"","obsid","leadid","ccode","idacr","leader","startdate","enddate","bornin","died","eindate","eoutdate","entry","exit","exitcode","prevtimesinoffice","posttenurefate","gender","borndate","yrborn","deathdate","yrdied"
"1","USA-1869","A2.9-1",2,"USA","Grant","04/03/1869","04/03/1877","1822","23/07/1885",1869-03-04,1877-03-04,0,1,0,0,0,"M",NA,1822,1885-07-23,1885
"2","USA-1877","A2.9-4",2,"USA","Hayes","04/03/1877","04/03/1881","1822","17/01/1893",1877-03-04,1881-03-04,0,1,0,0,0,"M",NA,1822,1893-01-17,1893
"3","USA-1881-1","A2.9-7",2,"USA","Garfield","04/03/1881","19/09/1881","1831","19/09/1881",1881-03-04,1881-09-19,0,3,11,0,3,"M",NA,1831,1881-09-19,1881
"4","USA-1881-2","A2.9-10",2,"USA","Arthur","19/09/1881","04/03/1885","1829","18/11/1886",1881-09-19,1885-03-04,0,1,0,0,0,"M",NA,1829,1886-11-18,1886
"5","USA-1885","A2.9-13",2,"USA","Cleveland","04/03/1885","04/03/1889","1837","24/06/1908",1885-03-04,1889-03-04,0,1,0,0,0,"M",NA,1837,1908-06-24,1908
"6","USA-1889","A2.9-16",2,"USA","Harrison","04/03/1889","04/03/1893","1833","13/03/1901",1889-03-04,1893-03-04,0,1,0,0,0,"M",NA,1833,1901-03-13,1901
"7","USA-1893","A2.9-19",2,"USA","Cleveland","04/03/1893","04/03/1897","1837","24/06/1908",1893-03-04,1897-03-04,0,1,0,1,0,"M",NA,1837,1908-06-24,1908
"8","USA-1897","A2.9-22",2,"USA","McKinley","04/03/1897","14/09/1901","1843","14/09/1901",1897-03-04,1901-09-14,0,3,11,0,3,"M",NA,1843,1901-09-14,1901
"9","USA-1901","A2.9-25",2,"USA","Roosevelt, T.","14/09/1901","04/03/1909","1858","1919",1901-09-14,1909-03-04,0,1,0,0,0,"M",NA,1858,NA,1919
"10","USA-1909","A2.9-28",2,"USA","Taft","04/03/1909","04/03/1913","1857","1930",1909-03-04,1913-03-04,0,1,0,0,0,"M",NA,1857,NA,1930
"11","USA-1913","A2.9-31",2,"USA","Wilson","04/03/1913","04/03/1921","1856","1924",1913-03-04,1921-03-04,0,1,0,0,0,"M",NA,1856,NA,1924
"12","USA-1921","A2.9-34",2,"USA","Harding","04/03/1921","03/08/1923","1865","1923",1921-03-04,1923-08-03,0,2,0,0,-777,"M",NA,1865,NA,1923
"13","USA-1923","A2.9-37",2,"USA","Coolidge","03/08/1923","04/03/1929","1872","1933",1923-08-03,1929-03-04,0,1,0,0,0,"M",NA,1872,NA,1933
"14","USA-1929","A2.9-40",2,"USA","Hoover","04/03/1929","04/03/1933","1874","1964",1929-03-04,1933-03-04,0,1,0,0,0,"M",NA,1874,NA,1964
"15","USA-1933","A2.9-43",2,"USA","Roosevelt, F.","04/03/1933","12/04/1945","1882","1945",1933-03-04,1945-04-12,0,2,0,0,-777,"M",NA,1882,NA,1945
"16","USA-1945","A2.9-46",2,"USA","Truman","12/04/1945","20/01/1953","1884","1972",1945-04-12,1953-01-20,0,1,0,0,0,"M",NA,1884,NA,1972
"17","USA-1953","A2.9-49",2,"USA","Eisenhower","20/01/1953","20/01/1961","1890","1969",1953-01-20,1961-01-20,0,1,0,0,0,"M",NA,1890,NA,1969
"18","USA-1961","A2.9-52",2,"USA","Kennedy","20/01/1961","22/11/1963","1917","1963",1961-01-20,1963-11-22,0,3,11,0,3,"M",NA,1917,NA,1963
"19","USA-1963","A2.9-55",2,"USA","Johnson","22/11/1963","20/01/1969","1908","1973",1963-11-22,1969-01-20,0,1,0,0,0,"M",NA,1908,NA,1973
"20","USA-1969","A2.9-58",2,"USA","Nixon","20/01/1969","09/08/1974","1913","1994",1969-01-20,1974-08-09,0,1,0,0,0,"M",NA,1913,NA,1994
"21","USA-1974","A2.9-61",2,"USA","Ford","09/08/1974","20/01/1977","1913","2006",1974-08-09,1977-01-20,0,1,0,0,0,"M",NA,1913,NA,2006
"22","USA-1977","A2.9-64",2,"USA","Carter","20/01/1977","20/01/1981","1924","-777",1977-01-20,1981-01-20,0,1,0,0,0,"M",NA,1924,NA,-777
"23","USA-1981","A2.9-67",2,"USA","Reagan","20/01/1981","20/01/1989","1911","2004",1981-01-20,1989-01-20,0,1,0,0,0,"M",NA,1911,NA,2004
"24","USA-1989","A2.9-70",2,"USA","Bush","20/01/1989","20/01/1993","1924","-777",1989-01-20,1993-01-20,0,1,0,0,0,"M",NA,1924,NA,-777
"25","USA-1993","A2.9-73",2,"USA","Clinton","20/01/1993","20/01/2001","1946","-777",1993-01-20,2001-01-20,0,1,0,0,0,"M",NA,1946,NA,-777
"26","USA-2001","A2.9-76",2,"USA","G.W. Bush","21/01/2001","31/12/2004","1946","-777",2001-01-21,2004-12-31,0,-888,0,0,-888,"M",NA,1946,NA,-777
"27","CAN-1873","A2.9-79",20,"CAN","Mackenzie","07/11/1873","17/10/1878","1822","17/04/1892",1873-11-07,1878-10-17,0,1,0,0,0,"M",NA,1822,1892-04-17,1892
"28","CAN-1878","A2.9-82",20,"CAN","Macdonald","17/10/1878","06/06/1891","1815","06/06/1891",1878-10-17,1891-06-06,0,2,0,1,-777,"M",NA,1815,1891-06-06,1891
"29","CAN-1891","A2.9-85",20,"CAN","Abbott","16/06/1891","05/12/1892","1821","30/10/1893",1891-06-16,1892-12-05,0,1,0,0,0,"M",NA,1821,1893-10-30,1893
"30","CAN-1892","A2.9-88",20,"CAN","Thompson","05/12/1892","12/12/1894","1845","1894",1892-12-05,1894-12-12,0,2,0,0,-777,"M",NA,1845,NA,1894
"31","CAN-1894","A2.9-91",20,"CAN","Bowell","21/12/1894","01/05/1896","1823","1917",1894-12-21,1896-05-01,0,1,0,0,0,"M",NA,1823,NA,1917
"32","CAN-1896-1","A2.9-94",20,"CAN","Tupper","01/05/1896","11/07/1896","1821","1915",1896-05-01,1896-07-11,0,1,0,0,0,"M",NA,1821,NA,1915
"33","CAN-1896-2","A2.9-97",20,"CAN","Laurier","11/07/1896","10/10/1911","1841","1919",1896-07-11,1911-10-10,0,1,0,0,0,"M",NA,1841,NA,1919
"34","CAN-1911","A2.9-100",20,"CAN","Borden","10/10/1911","10/06/1920","1854","1937",1911-10-10,1920-06-10,0,2.1,0,0,0,"M",NA,1854,NA,1937
"35","CAN-1920","A2.9-103",20,"CAN","Meighen","10/07/1920","29/12/1921","1874","1960",1920-07-10,1921-12-29,0,1,0,0,0,"M",NA,1874,NA,1960
"36","CAN-1921","A2.9-106",20,"CAN","King","29/12/1921","28/06/1926","1874","1951",1921-12-29,1926-06-28,0,1,0,0,0,"M",NA,1874,NA,1951
"37","CAN-1926-1","A2.9-109",20,"CAN","Meighen","29/06/1926","25/09/1926","1874","1960",1926-06-29,1926-09-25,0,1,0,1,0,"M",NA,1874,NA,1960
"38","CAN-1926-2","A2.9-112",20,"CAN","King","25/09/1926","07/08/1930","1874","1951",1926-09-25,1930-08-07,0,1,0,1,0,"M",NA,1874,NA,1951
"39","CAN-1930","A2.9-115",20,"CAN","Bennett","07/08/1930","23/10/1935","1870","1947",1930-08-07,1935-10-23,0,1,0,0,0,"M",NA,1870,NA,1947
"40","CAN-1935","A2.9-118",20,"CAN","King","23/10/1935","15/11/1948","1874","1951",1935-10-23,1948-11-15,0,2.1,0,2,0,"M",NA,1874,NA,1951
"41","CAN-1948","A2.9-121",20,"CAN","St. Laurent","15/11/1948","21/06/1957","1/2/1882","1973",1948-11-15,1957-06-21,0,1,0,0,0,"M",1882-02-01,1882,NA,1973
"42","CAN-1957","A2.9-124",20,"CAN","Diefenbaker","21/06/1957","22/04/1963","18/9/1895","1979",1957-06-21,1963-04-22,0,1,0,0,0,"M",1895-09-18,1895,NA,1979
"43","CAN-1963","A2.9-127",20,"CAN","Pearson","22/04/1963","20/04/1968","23/4/1897","1972",1963-04-22,1968-04-20,0,1,0,0,0,"M",1897-04-23,1897,NA,1972
"44","CAN-1968","A2.9-130",20,"CAN","Trudeau","20/04/1968","04/06/1979","18/10/1919","2000",1968-04-20,1979-06-04,0,1,0,0,0,"M",1919-10-18,1919,NA,2000
"45","CAN-1979","A2.9-133",20,"CAN","Clark","04/06/1979","03/03/1980","5/6/1939","-777",1979-06-04,1980-03-03,0,1,0,0,0,"M",1939-06-05,1939,NA,-777
"46","CAN-1980","A2.9-136",20,"CAN","Trudeau","03/03/1980","30/06/1984","18/10/1919","2000",1980-03-03,1984-06-30,0,1,0,1,0,"M",1919-10-18,1919,NA,2000
"47","CAN-1984-1","A2.9-139",20,"CAN","Turner","30/06/1984","17/09/1984","7/6/1929","-777",1984-06-30,1984-09-17,0,1,0,0,0,"M",1929-06-07,1929,NA,-777
"48","CAN-1984-2","A2.9-142",20,"CAN","Mulroney","17/09/1984","25/06/1993","20/3/1939","-777",1984-09-17,1993-06-25,0,1,0,0,0,"M",1939-03-20,1939,NA,-777
"49","CAN-1993-1","A2.9-145",20,"CAN","Kim Campbell","25/06/1993","04/11/1993","1947","-777",1993-06-25,1993-11-04,0,1,0,0,0,"F",NA,1947,NA,-777
"50","CAN-1993-2","A2.9-148",20,"CAN","Chretien","04/11/1993","12/12/2003","1939","-777",1993-11-04,2003-12-12,0,1,0,0,0,"M",NA,1939,NA,-777
"51","CAN-2003","A2.9-151",20,"CAN","Paul Martin","12/12/2003","31/12/2004","1938","-777",2003-12-12,2004-12-31,0,-888,0,0,-888,"M",NA,1938,NA,-777
"52","BHM-1967","A2.9-154",31,"BHM","Pindling","16/01/1967","21/08/1992","1930","2000",1967-01-16,1992-08-21,0,1,0,0,0,"M",NA,1930,NA,2000
"53","BHM-1992","A2.9-157",31,"BHM","Ingraham","21/08/1992","03/05/2002","1947","-777",1992-08-21,2002-05-03,0,1,0,0,0,"M",NA,1947,NA,-777
"54","BHM-2002","A2.9-160",31,"BHM","Christie","03/05/2002","31/12/2004","1943","-777",2002-05-03,2004-12-31,0,-888,0,0,-888,"M",NA,1943,NA,-777
"55","CUB-1902","A2.9-163",40,"CUB","Palma","20/05/1902","28/09/1906","9/7/1835","1908",1902-05-20,1906-09-28,0,3,-999,0,0,"M",1835-07-09,1835,NA,1908
"56","CUB-1909","A2.9-166",40,"CUB","Gomez","28/01/1909","20/05/1913","6/7/1858","1921",1909-01-28,1913-05-20,0,1,0,0,0,"M",1858-07-06,1858,NA,1921
"57","CUB-1913","A2.9-169",40,"CUB","Menocal","20/05/1913","20/05/1921","17/12/1868","1941",1913-05-20,1921-05-20,0,1,0,0,1,"M",1868-12-17,1868,NA,1941
"58","CUB-1921","A2.9-172",40,"CUB","Zyas y Alfonso","20/05/1921","20/05/1925","21/9/1861","1934",1921-05-20,1925-05-20,0,1,0,0,0,"M",1861-09-21,1861,NA,1934
"59","CUB-1925","A2.9-175",40,"CUB","Machado Morales","20/05/1925","12/08/1933","28/9/1871","1939",1925-05-20,1933-08-12,0,3,6,0,1,"M",1871-09-28,1871,NA,1939
"60","CUB-1933-1","A2.9-178",40,"CUB","de Cespedes","12/08/1933","05/09/1933","12/8/1871","1939",1933-08-12,1933-09-05,1,3,6,0,0,"M",1871-08-12,1871,NA,1939
"61","CUB-1933-2","A2.9-181",40,"CUB","Grau San Martin","10/09/1933","15/01/1934","13/9/1882","1969",1933-09-10,1934-01-15,1,3,16,0,1,"M",1882-09-13,1882,NA,1969
"62","CUB-1934-1","A2.9-184",40,"CUB","Hevia","15/01/1934","18/01/1934","1900","1964",1934-01-15,1934-01-18,1,3,16,0,0,"M",NA,1900,NA,1964
"63","CUB-1934-2","A2.9-187",40,"CUB","Mendieta","18/01/1934","12/12/1935","4/11/1873","1960",1934-01-18,1935-12-12,1,1,0,0,0,"M",1873-11-04,1873,NA,1960
"64","CUB-1935","A2.9-190",40,"CUB","Barnet","12/12/1935","20/05/1936","1864","1945",1935-12-12,1936-05-20,0,1,0,0,0,"M",NA,1864,NA,1945
"65","CUB-1936-1","A2.9-193",40,"CUB","Gomez y Arias","20/05/1936","28/12/1936","6/10/1889","1950",1936-05-20,1936-12-28,0,1,0,0,0,"M",1889-10-06,1889,NA,1950
"66","CUB-1936-2","A2.9-196",40,"CUB","Laredo Bru","28/12/1936","10/10/1940","23/4/1875","1946",1936-12-28,1940-10-10,0,1,0,0,0,"M",1875-04-23,1875,NA,1946
"67","CUB-1940","A2.9-199",40,"CUB","Batista","10/10/1940","10/10/1944","16/1/1901","1973",1940-10-10,1944-10-10,0,1,0,0,1,"M",1901-01-16,1901,NA,1973
"68","CUB-1944","A2.9-202",40,"CUB","Grau San Martin","10/10/1944","10/10/1948","13/9/1882","1969",1944-10-10,1948-10-10,0,1,0,1,1,"M",1882-09-13,1882,NA,1969
"69","CUB-1948","A2.9-205",40,"CUB","Prio Socarres","10/10/1948","10/03/1952","14/7/1903","1977",1948-10-10,1952-03-10,0,3,6,0,1,"M",1903-07-14,1903,NA,1977
"70","CUB-1952","A2.9-208",40,"CUB","Batista","10/03/1952","01/01/1959","16/1/1901","1973",1952-03-10,1959-01-01,1,3,4,1,1,"M",1901-01-16,1901,NA,1973
"71","CUB-1959","A2.9-211",40,"CUB","Castro","02/01/1959","31/12/2004","13/8/1927","-777",1959-01-02,2004-12-31,1,-888,0,0,-888,"M",1927-08-13,1927,NA,-777
"72","HAI-1874","A2.9-214",41,"HAI","Rameau","11/06/1874","15/04/1876","1828","15/04/1876",1874-06-11,1876-04-15,1,3,6,0,3,"M",NA,1828,1876-04-15,1876
"73","HAI-1876","A2.9-217",41,"HAI","Canal","23/04/1876","17/07/1879","1832","1905",1876-04-23,1879-07-17,1,3,-999,0,1,"M",NA,1832,NA,1905
"74","HAI-1879-1","A2.9-220",41,"HAI","Herrise","17/07/1879","26/07/1879","-999","-999",1879-07-17,1879-07-26,1,1,0,0,2,"M",NA,NA,NA,NA
"75","HAI-1879-2","A2.9-223",41,"HAI","Lamothe","26/07/1879","02/10/1879","-999","-999",1879-07-26,1879-10-02,1,3,-999,0,2,"M",NA,NA,NA,NA
"76","HAI-1879-3","A2.9-226",41,"HAI","Salomon","23/10/1879","10/08/1888","1815","1888",1879-10-23,1888-08-10,1,3,-999,0,1,"M",NA,1815,NA,1888
"77","HAI-1888-1","A2.9-229",41,"HAI","Canal","10/08/1888","16/10/1888","1832","1905",1888-08-10,1888-10-16,1,1,0,1,1,"M",NA,1832,NA,1905
"78","HAI-1888-2","A2.9-232",41,"HAI","Legitime","16/10/1888","22/08/1889","1841","1935",1888-10-16,1889-08-22,1,3,-999,0,1,"M",NA,1841,NA,1935
"79","HAI-1889","A2.9-235",41,"HAI","Hippolyte","25/08/1889","24/03/1896","1827","1896",1889-08-25,1896-03-24,1,2,0,0,-777,"M",NA,1827,NA,1896
"80","HAI-1896","A2.9-238",41,"HAI","P. A. T. Simon","31/03/1896","12/05/1902","1835","1916",1896-03-31,1902-05-12,0,1,0,0,1,"M",NA,1835,NA,1916
"81","HAI-1902-1","A2.9-241",41,"HAI","Canal","26/05/1902","17/12/1902","1832","1905",1902-05-26,1902-12-17,1,3,-999,2,0,"M",NA,1832,NA,1905
"82","HAI-1902-2","A2.9-244",41,"HAI","Nord","17/12/1902","20/12/1908","1820","01/05/1910",1902-12-17,1908-12-20,1,3,-999,0,1,"M",NA,1820,1910-05-01,1910
"83","HAI-1908","A2.9-247",41,"HAI","A. Simon","20/12/1908","03/08/1911","1844","1923",1908-12-20,1911-08-03,1,3,-999,0,1,"M",NA,1844,NA,1923
"84","HAI-1911","A2.9-250",41,"HAI","Leconte","07/08/1911","08/08/1912","1854","1912",1911-08-07,1912-08-08,1,3,-999,0,3,"M",NA,1854,NA,1912
"85","HAI-1912","A2.9-253",41,"HAI","Tancred Auguste","08/08/1912","12/05/1913","1856","1913",1912-08-08,1913-05-12,1,2,0,0,-777,"M",NA,1856,NA,1913
"86","HAI-1913","A2.9-256",41,"HAI","Michel Oreste","12/05/1913","27/01/1914","1859","28/10/1918",1913-05-12,1914-01-27,0,3,-999,0,1,"M",NA,1859,1918-10-28,1918
"87","HAI-1914-1","A2.9-259",41,"HAI","Oreste Zamor","08/02/1914","19/10/1914","1861","1915",1914-02-08,1914-10-19,1,3,-999,0,3,"M",NA,1861,NA,1915
"88","HAI-1914-2","A2.9-262",41,"HAI","Theodore","19/10/1914","22/02/1915","1847","13/01/1917",1914-10-19,1915-02-22,1,3,-999,0,1,"M",NA,1847,1917-01-13,1917
"89","HAI-1915","A2.9-265",41,"HAI","Velbrun-Guillaume","04/03/1915","26/07/1915","-999","1915",1915-03-04,1915-07-26,1,3,-999,0,3,"M",NA,NA,NA,1915
"90","HAI-1934","A2.9-268",41,"HAI","Vincent","15/08/1934","15/05/1941","1874","03/09/1959",1934-08-15,1941-05-15,0,1,0,0,1,"M",NA,1874,1959-09-03,1959
"91","HAI-1941","A2.9-271",41,"HAI","Lescot","15/05/1941","11/01/1946","9/12/1883","21/10/1974",1941-05-15,1946-01-11,0,3,6,0,1,"M",1883-12-09,1883,1974-10-21,1974
"92","HAI-1946-1","A2.9-274",41,"HAI","Lavaud","11/01/1946","16/08/1946","1903","-999",1946-01-11,1946-08-16,1,1,0,0,0,"M",NA,1903,NA,NA
"93","HAI-1946-2","A2.9-277",41,"HAI","Estime","16/08/1946","10/05/1950","21/4/1900","20/07/1953",1946-08-16,1950-05-10,0,3,6,0,2,"M",1900-04-21,1900,1953-07-20,1953
"94","HAI-1950","A2.9-280",41,"HAI","Magloire","10/05/1950","12/12/1956","19/7/1907","2001",1950-05-10,1956-12-12,0,3,6,0,1,"M",1907-07-19,1907,NA,2001
"95","HAI-1956","A2.9-283",41,"HAI","Pierre-Louis","12/12/1956","3/2/1957","1900","-999",1956-12-12,1957-02-03,0,3,6,0,0,"M",NA,1900,NA,NA
"96","HAI-1957-1","A2.9-286",41,"HAI","Sylvain","07/02/1957","02/04/1957","1909","1987",1957-02-07,1957-04-02,0,3,6,0,2,"M",NA,1909,NA,1987
"97","HAI-1957-2","A2.9-289",41,"HAI","Cantave","02/04/1957","06/04/1957","1910","1967",1957-04-02,1957-04-06,1,1,0,0,0,"M",NA,1910,NA,1967
"98","HAI-1957-3","A2.9-292",41,"HAI","Executive council","06/04/1957","20/05/1957","-999","-999",1957-04-06,1957-05-20,0,1,0,0,0,"M",NA,NA,NA,NA
"99","HAI-1957-4","A2.9-295",41,"HAI","Cantave","20/05/1957","26/05/1957","4/7/1910","1967",1957-05-20,1957-05-26,1,3,6,1,1,"M",1910-07-04,1910,NA,1967
"100","HAI-1957-5","A2.9-298",41,"HAI","Fignole","26/05/1957","14/06/1957","12/11/1914","1986",1957-05-26,1957-06-14,1,3,6,0,1,"M",1914-11-12,1914,NA,1986
"101","HAI-1957-6","A2.9-301",41,"HAI","Kebreau","14/06/1957","15/10/1957","11/11/1909","1962",1957-06-14,1957-10-15,1,1,0,0,1,"M",1909-11-11,1909,NA,1962
"102","HAI-1957-7","A2.9-304",41,"HAI","Duvalier, Francois","15/10/1957","22/04/1971","14/4/1907","1971",1957-10-15,1971-04-22,0,2,0,0,-777,"M",1907-04-14,1907,NA,1971
"103","HAI-1971","A2.9-307",41,"HAI","Duvalier, Jean-","22/04/1971","07/02/1986","3/7/1951","-777",1971-04-22,1986-02-07,0,3,6,0,1,"M",1951-07-03,1951,NA,-777
"104","HAI-1986","A2.9-310",41,"HAI","Namphy","07/02/1986","07/02/1988","2/11/1932","-777",1986-02-07,1988-02-07,1,1,0,0,2,"M",1932-11-02,1932,NA,-777
"105","HAI-1988-1","A2.9-313",41,"HAI","Manigat","07/02/1988","20/06/1988","16/8/1930","-777",1988-02-07,1988-06-20,0,3,6,0,1,"M",1930-08-16,1930,NA,-777
"106","HAI-1988-2","A2.9-316",41,"HAI","Namphy","20/06/1988","17/09/1988","2/11/1932","-777",1988-06-20,1988-09-17,1,3,6,1,1,"M",1932-11-02,1932,NA,-777
"107","HAI-1988-3","A2.9-319",41,"HAI","Avril","17/09/1988","10/03/1990","1938","-777",1988-09-17,1990-03-10,1,3,2,0,1,"M",NA,1938,NA,-777
"108","HAI-1990-1","A2.9-322",41,"HAI","Abraham","10/03/1990","13/03/1990","1940","-777",1990-03-10,1990-03-13,0,1,0,0,0,"M",NA,1940,NA,-777
"109","HAI-1990-2","A2.9-325",41,"HAI","Pascal-Troillet","13/03/1990","07/02/1991","13/8/1943","-777",1990-03-13,1991-02-07,0,1,0,0,2,"F",1943-08-13,1943,NA,-777
"110","HAI-1991-1","A2.9-328",41,"HAI","Aristide","07/02/1991","30/09/1991","15/7/1953","-777",1991-02-07,1991-09-30,0,3,6,0,2,"M",1953-07-15,1953,NA,-777
"111","HAI-1991-2","A2.9-331",41,"HAI","Cedras","30/09/1991","14/10/1994","1949","-777",1991-09-30,1994-10-14,1,4,9,0,1,"M",NA,1949,NA,-777
"112","HAI-1994","A2.9-334",41,"HAI","Aristide","15/10/1994","07/02/1996","15/7/1953","-777",1994-10-15,1996-02-07,2,1,0,1,0,"M",1953-07-15,1953,NA,-777
"113","HAI-1996","A2.9-337",41,"HAI","Preval","07/02/1996","07/02/2001","1943","-777",1996-02-07,2001-02-07,0,1,0,0,0,"M",NA,1943,NA,-777
"114","HAI-2001","A2.9-340",41,"HAI","Aristide","08/02/2001","29/02/2004","15/7/1953","-777",2001-02-08,2004-02-29,0,3,3,2,1,"M",1953-07-15,1953,NA,-777
"115","HAI-2004","A2.9-343",41,"HAI","Boniface Alexandre","29/02/2004","31/12/2004","1936","-777",2004-02-29,2004-12-31,0,-888,0,0,-888,"M",NA,1936,NA,-777
"116","DOM-1874","A2.9-346",42,"DOM","Gonzalez","02/01/1874","23/02/1876","1840","1915",1874-01-02,1876-02-23,1,3,-999,0,0,"M",NA,1840,NA,1915
"117","DOM-1876-1","A2.9-349",42,"DOM","Villanueva","24/02/1876","03/03/1876","-999","1920",1876-02-24,1876-03-03,1,3,6,0,1,"M",NA,NA,NA,1920
"118","DOM-1876-2","A2.9-352",42,"DOM","Espaillat","29/04/1876","05/10/1876","1823","1878",1876-04-29,1876-10-05,1,3,-999,0,1,"M",NA,1823,NA,1878
"119","DOM-1876-3","A2.9-355",42,"DOM","Gonzalez","05/10/1876","09/12/1876","1840","1915",1876-10-05,1876-12-09,1,3,-999,1,1,"M",NA,1840,NA,1915
"120","DOM-1876-4","A2.9-358",42,"DOM","Buenaventura Baez","26/12/1876","02/03/1878","14/7/1812","14/03/1884",1876-12-26,1878-03-02,1,3,-999,4,1,"M",1812-07-14,1812,1884-03-14,1884
"121","DOM-1878-1","A2.9-361",42,"DOM","Guillermo","05/03/1878","06/07/1878","1847","1885",1878-03-05,1878-07-06,1,1,0,0,1,"M",NA,1847,NA,1885
"122","DOM-1878-2","A2.9-364",42,"DOM","Gonzalez","06/07/1878","02/09/1878","1840","1915",1878-07-06,1878-09-02,0,3,-999,2,1,"M",NA,1840,NA,1915
"123","DOM-1878-3","A2.9-367",42,"DOM","del Rosario de Castro","07/09/1878","29/09/1878","1811","1896",1878-09-07,1878-09-29,0,3,-999,1,0,"M",NA,1811,NA,1896
"124","DOM-1878-4","A2.9-370",42,"DOM","Guillermo","30/09/1878","06/12/1879","1847","1885",1878-09-30,1879-12-06,1,3,-999,1,1,"M",NA,1847,NA,1885
"125","DOM-1879","A2.9-373",42,"DOM","Luperon","06/12/1879","01/09/1880","1839","1897",1879-12-06,1880-09-01,1,1,0,0,0,"M",NA,1839,NA,1897
"126","DOM-1880","A2.9-376",42,"DOM","de Merino","01/09/1880","01/09/1882","1833","1906",1880-09-01,1882-09-01,0,1,0,0,0,"M",NA,1833,NA,1906
"127","DOM-1882","A2.9-379",42,"DOM","Heureaux","01/09/1882","01/09/1884","21/10/1845","26/07/1899",1882-09-01,1884-09-01,0,1,0,0,0,"M",1845-10-21,1845,1899-07-26,1899
"128","DOM-1884","A2.9-382",42,"DOM","Billini","01/09/1884","16/05/1885","1844","1898",1884-09-01,1885-05-16,0,3,-999,0,0,"M",NA,1844,NA,1898
"129","DOM-1885","A2.9-385",42,"DOM","Woss y Gil","16/05/1885","06/01/1887","1856","1932",1885-05-16,1887-01-06,0,1,0,0,0,"M",NA,1856,NA,1932
"130","DOM-1887","A2.9-388",42,"DOM","Heureaux","06/01/1887","26/07/1899","21/10/1845","26/07/1899",1887-01-06,1899-07-26,0,3,-999,1,3,"M",1845-10-21,1845,1899-07-26,1899
"131","DOM-1899-1","A2.9-391",42,"DOM","Figuereo","27/07/1899","31/08/1899","1834","1910",1899-07-27,1899-08-31,0,3,-999,0,0,"M",NA,1834,NA,1910
"132","DOM-1899-2","A2.9-394",42,"DOM","Vasquez","01/09/1899","14/11/1899","22/10/1860","1936",1899-09-01,1899-11-14,1,1,0,0,0,"M",1860-10-22,1860,NA,1936
"133","DOM-1899-3","A2.9-397",42,"DOM","Jimenez","15/11/1899","02/05/1902","1846","1919",1899-11-15,1902-05-02,0,3,-999,0,1,"M",NA,1846,NA,1919
"134","DOM-1902","A2.9-400",42,"DOM","Vasquez","02/05/1902","18/04/1903","22/10/1860","1936",1902-05-02,1903-04-18,1,3,-999,1,0,"M",1860-10-22,1860,NA,1936
"135","DOM-1903-1","A2.9-403",42,"DOM","Woss y Gil","18/04/1903","04/11/1903","1856","1932",1903-04-18,1903-11-04,1,1,0,1,1,"M",NA,1856,NA,1932
"136","DOM-1903-2","A2.9-406",42,"DOM","Morales","04/11/1903","25/12/1905","1867","1906",1903-11-04,1905-12-25,1,3,-999,0,1,"M",NA,1867,NA,1906
"137","DOM-1905","A2.9-409",42,"DOM","Caceres","25/12/1905","19/11/1911","15/12/1866","1911",1905-12-25,1911-11-19,0,3,-999,0,3,"M",1866-12-15,1866,NA,1911
"138","DOM-1911","A2.9-412",42,"DOM","Victoria","02/12/1911","28/11/1912","1864","1939",1911-12-02,1912-11-28,1,3,-999,0,0,"M",NA,1864,NA,1939
"139","DOM-1912","A2.9-415",42,"DOM","Nouel y Bobadilla","01/12/1912","31/03/1913","1862","1937",1912-12-01,1913-03-31,0,1,0,0,1,"M",NA,1862,NA,1937
"140","DOM-1913","A2.9-418",42,"DOM","Bordas y Valdes","13/04/1913","27/08/1914","1874","1968",1913-04-13,1914-08-27,0,4,-999,0,1,"M",NA,1874,NA,1968
"141","DOM-1914-1","A2.9-421",42,"DOM","Ramon Baez","27/08/1914","05/12/1914","1858","1929",1914-08-27,1914-12-05,0,1,0,0,0,"M",NA,1858,NA,1929
"142","DOM-1914-2","A2.9-424",42,"DOM","Jimenez","05/12/1914","08/05/1916","1846","1919",1914-12-05,1916-05-08,0,4,-999,1,1,"M",NA,1846,NA,1919
"143","DOM-1925","A2.9-427",42,"DOM","Vasquez","01/01/1925","27/02/1930","22/10/1860","1936",1925-01-01,1930-02-27,1,3,6,2,0,"M",1860-10-22,1860,NA,1936
"144","DOM-1930-1","A2.9-430",42,"DOM","Estrella Urena","02/03/1930","16/08/1930","1889","1945",1930-03-02,1930-08-16,1,1,0,0,0,"M",NA,1889,NA,1945
"145","DOM-1930-2","A2.9-433",42,"DOM","Rafel Trujillo","16/08/1930","30/05/1961","24/10/1891","30/05/1961",1930-08-16,1961-05-30,0,3,6,0,3,"M",1891-10-24,1891,1961-05-30,1961
"146","DOM-1961","A2.9-436",42,"DOM","Balaguer","30/05/1961","17/01/1962","1/9/1907","2002",1961-05-30,1962-01-17,1,3,6,0,1,"M",1907-09-01,1907,NA,2002
"147","DOM-1962-1","A2.9-439",42,"DOM","Echavarria","17/01/1962","19/01/1962","1925","-999",1962-01-17,1962-01-19,1,3,6,0,2,"M",NA,1925,NA,NA
"148","DOM-1962-2","A2.9-442",42,"DOM","Filiberto Bonnelly","19/01/1962","27/02/1963","22/8/1904","1979",1962-01-19,1963-02-27,0,1,0,0,0,"M",1904-08-22,1904,NA,1979
"149","DOM-1963-1","A2.9-445",42,"DOM","Bosch","27/02/1963","25/09/1963","30/6/1909","01/11/2001",1963-02-27,1963-09-25,0,3,6,0,1,"M",1909-06-30,1909,2001-11-01,2001
"150","DOM-1963-2","A2.9-448",42,"DOM","de los Santos","26/09/1963","22/12/1963","1903","-999",1963-09-26,1963-12-22,1,1,0,0,0,"M",NA,1903,NA,NA
"151","DOM-1963-3","A2.9-451",42,"DOM","Cabral","22/12/1963","25/04/1965","9/6/1923","2006",1963-12-22,1965-04-25,1,3,6,0,0,"M",1923-06-09,1923,NA,2006
"152","DOM-1965-1","A2.9-454",42,"DOM","Molina Urena","25/04/1965","27/04/1965","1921","2000",1965-04-25,1965-04-27,1,3,6,0,1,"M",NA,1921,NA,2000
"153","DOM-1965-2","A2.9-457",42,"DOM","Bartolome Benoit","27/04/1965","07/05/1965","1921","-777",1965-04-27,1965-05-07,1,1,0,0,0,"M",NA,1921,NA,-777
"154","DOM-1965-3","A2.9-460",42,"DOM","Berreras","07/05/1965","30/08/1965","3/12/1920","-999",1965-05-07,1965-08-30,1,1,0,0,0,"M",1920-12-03,1920,NA,NA
"155","DOM-1965-4","A2.9-463",42,"DOM","Godoy","03/09/1965","01/07/1966","11/7/1921","1970",1965-09-03,1966-07-01,0,1,0,0,0,"M",1921-07-11,1921,NA,1970
"156","DOM-1966","A2.9-466",42,"DOM","Balaguer","01/07/1966","01/07/1978","1/9/1907","2002",1966-07-01,1978-07-01,0,1,0,1,0,"M",1907-09-01,1907,NA,2002
"157","DOM-1978","A2.9-469",42,"DOM","Guzman Fernandez","01/07/1978","04/07/1982","12/2/1911","1982",1978-07-01,1982-07-04,0,2.2,0,0,-777,"M",1911-02-12,1911,NA,1982
"158","DOM-1982-1","A2.9-472",42,"DOM","Majluta Azar","04/07/1982","16/08/1982","1934","1996",1982-07-04,1982-08-16,0,1,0,0,0,"M",NA,1934,NA,1996
"159","DOM-1982-2","A2.9-475",42,"DOM","Blanco","16/08/1982","16/08/1986","5/7/1926","-777",1982-08-16,1986-08-16,0,1,0,0,0,"M",1926-07-05,1926,NA,-777
"160","DOM-1986","A2.9-478",42,"DOM","Balaguer","16/08/1986","16/08/1996","1/9/1907","-777",1986-08-16,1996-08-16,0,1,0,2,0,"M",1907-09-01,1907,NA,-777
"161","DOM-1996","A2.9-481",42,"DOM","Fernandez Reyna","16/08/1996","16/08/2000","26/12/1953","-777",1996-08-16,2000-08-16,0,1,0,0,0,"M",1953-12-26,1953,NA,-777
"162","DOM-2000","A2.9-484",42,"DOM","Hipolito Mejia","17/08/2000","16/08/2004","22/02/1941","-777",2000-08-17,2004-08-16,0,1,0,0,-999,"M",1941-02-22,1941,NA,-777
"163","DOM-2004","A2.9-487",42,"DOM","Fernandez Reyna","16/08/2004","31/12/2004","26/12/1953","-777",2004-08-16,2004-12-31,0,-888,0,1,-888,"M",1953-12-26,1953,NA,-777
"164","JAM-1962","A2.9-490",51,"JAM","Bustamante","06/08/1962","22/02/1967","24/2/1884","06/08/1977",1962-08-06,1967-02-22,0,1,0,0,0,"M",1884-02-24,1884,1977-08-06,1977
"165","JAM-1967-1","A2.9-493",51,"JAM","Sangster","22/02/1967","11/04/1967","26/10/1911","1967",1967-02-22,1967-04-11,0,2,0,0,-777,"M",1911-10-26,1911,NA,1967
"166","JAM-1967-2","A2.9-496",51,"JAM","Shearer","11/04/1967","02/03/1972","18/5/1923","2004",1967-04-11,1972-03-02,0,1,0,0,0,"M",1923-05-18,1923,NA,2004
"167","JAM-1972","A2.9-499",51,"JAM","Manley","02/03/1972","01/11/1980","10/12/1924","06/03/1997",1972-03-02,1980-11-01,0,1,0,0,0,"M",1924-12-10,1924,1997-03-06,1997
"168","JAM-1980","A2.9-502",51,"JAM","Seaga","01/11/1980","10/02/1989","28/5/1930","-777",1980-11-01,1989-02-10,0,1,0,0,0,"M",1930-05-28,1930,NA,-777
"169","JAM-1989","A2.9-505",51,"JAM","Manley","10/02/1989","30/03/1992","28/5/1924","06/03/1997",1989-02-10,1992-03-30,0,2.1,0,1,0,"M",1924-05-28,1924,1997-03-06,1997
"170","JAM-1992","A2.9-508",51,"JAM","Patterson","30/03/1992","31/12/2004","1935","-777",1992-03-30,2004-12-31,0,-888,0,0,-888,"M",NA,1935,NA,-777
"171","TRI-1962","A2.9-511",52,"TRI","Williams","31/08/1962","29/03/1981","25/9/1911","1981",1962-08-31,1981-03-29,0,2,0,0,-777,"M",1911-09-25,1911,NA,1981
"172","TRI-1981","A2.9-514",52,"TRI","Chambers","30/03/1981","18/12/1986","4/10/1928","04/11/1997",1981-03-30,1986-12-18,0,1,0,0,0,"M",1928-10-04,1928,1997-11-04,1997
"173","TRI-1986","A2.9-517",52,"TRI","Robinson","18/12/1986","07/12/1991","16/12/1926","-777",1986-12-18,1991-12-07,0,1,0,0,0,"M",1926-12-16,1926,NA,-777
"174","TRI-1991","A2.9-520",52,"TRI","Manning","16/12/1991","09/11/1995","17/8/1946","-777",1991-12-16,1995-11-09,0,1,0,0,0,"M",1946-08-17,1946,NA,-777
"175","TRI-1995","A2.9-523",52,"TRI","Panday","09/11/1995","24/12/2001","1933","-777",1995-11-09,2001-12-24,0,1,0,0,0,"M",NA,1933,NA,-777
"176","TRI-2001","A2.9-526",52,"TRI","Manning","25/12/2001","31/12/2004","17/8/1947","-777",2001-12-25,2004-12-31,0,-888,0,1,-888,"M",1947-08-17,1947,NA,-777
"177","BAR-1966","A2.9-529",53,"BAR","Barrow","18/11/1966","08/09/1976","21/1/1920","01/06/1987",1966-11-18,1976-09-08,0,1,0,0,0,"M",1920-01-21,1920,1987-06-01,1987
"178","BAR-1976","A2.9-532",53,"BAR","Adams","08/10/1976","11/03/1985","24/9/1931","11/03/1985",1976-10-08,1985-03-11,0,2,0,0,-777,"M",1931-09-24,1931,1985-03-11,1985
"179","BAR-1985","A2.9-535",53,"BAR","St. John","11/03/1985","29/05/1986","16/8/1931","2004",1985-03-11,1986-05-29,0,1,0,0,0,"M",1931-08-16,1931,NA,2004
"180","BAR-1986","A2.9-538",53,"BAR","Barrow","29/05/1986","01/06/1987","21/1/1920","01/06/1987",1986-05-29,1987-06-01,0,2,0,1,-777,"M",1920-01-21,1920,1987-06-01,1987
"181","BAR-1987","A2.9-541",53,"BAR","Sandiford","01/06/1987","07/09/1994","24/3/1937","-777",1987-06-01,1994-09-07,0,1,0,0,0,"M",1937-03-24,1937,NA,-777
"182","BAR-1994","A2.9-544",53,"BAR","Arthur","07/09/1994","31/12/2004","1949","-777",1994-09-07,2004-12-31,0,-888,0,0,-888,"M",NA,1949,NA,-777
"183","MEX-1872","A2.9-547",70,"MEX","de Tejada","19/07/1872","21/11/1876","25/04/1825","21/04/1889",1872-07-19,1876-11-21,0,3,-999,0,1,"M",1825-04-25,1825,1889-04-21,1889
"184","MEX-1876","A2.9-550",70,"MEX","Diaz","23/11/1876","25/05/1911","15/9/1830","02/07/1915",1876-11-23,1911-05-25,1,3,-999,0,1,"M",1830-09-15,1830,1915-07-02,1915
"185","MEX-1911-1","A2.9-553",70,"MEX","de la Barra","26/05/1911","06/11/1911","16/6/1863","1939",1911-05-26,1911-11-06,0,1,0,0,1,"M",1863-06-16,1863,NA,1939
"186","MEX-1911-2","A2.9-556",70,"MEX","Madero","06/11/1911","19/02/1913","30/10/1873","22/02/1913",1911-11-06,1913-02-19,0,3,-999,0,3,"M",1873-10-30,1873,1913-02-22,1913
"187","MEX-1913","A2.9-559",70,"MEX","Huerta","19/02/1913","15/07/1914","23/3/1845","13/01/1916",1913-02-19,1914-07-15,1,3,-999,0,1,"M",1845-03-23,1845,1916-01-13,1916
"188","MEX-1915","A2.9-562",70,"MEX","Carranza","19/10/1915","06/05/1920","29/12/1859","21/05/1920",1915-10-19,1920-05-06,1,3,4,0,3,"M",1859-12-29,1859,1920-05-21,1920
"189","MEX-1920-1","A2.9-565",70,"MEX","de la Huerta, A","24/05/1920","01/12/1920","26/5/1881","09/07/1955",1920-05-24,1920-12-01,0,1,0,0,0,"M",1881-05-26,1881,1955-07-09,1955
"190","MEX-1920-2","A2.9-568",70,"MEX","Obregon","01/12/1920","01/12/1924","19/2/1890","17/07/1928",1920-12-01,1924-12-01,1,1,0,0,0,"M",1890-02-19,1890,1928-07-17,1928
"191","MEX-1924","A2.9-571",70,"MEX","Calles","01/12/1924","01/12/1928","25/9/1877","19/10/1945",1924-12-01,1928-12-01,0,1,0,0,1,"M",1877-09-25,1877,1945-10-19,1945
"192","MEX-1928","A2.9-574",70,"MEX","Portes Gil","01/12/1928","05/02/1930","3/10/1890","10/12/1978",1928-12-01,1930-02-05,0,1,0,0,0,"M",1890-10-03,1890,1978-12-10,1978
"193","MEX-1930","A2.9-577",70,"MEX","Ortiz Rubio","05/02/1930","04/09/1932","10/3/1877","1963",1930-02-05,1932-09-04,0,1,0,0,1,"M",1877-03-10,1877,NA,1963
"194","MEX-1932","A2.9-580",70,"MEX","Rodriguez","04/09/1932","01/12/1934","12/5/1889","1967",1932-09-04,1934-12-01,0,1,0,0,0,"M",1889-05-12,1889,NA,1967
"195","MEX-1934","A2.9-583",70,"MEX","Cardenas","01/12/1934","01/12/1940","21/5/1895","19/10/1970",1934-12-01,1940-12-01,0,1,0,0,0,"M",1895-05-21,1895,1970-10-19,1970
"196","MEX-1940","A2.9-586",70,"MEX","Avila Camacho","01/12/1940","01/12/1946","24/4/1897","13/10/1955",1940-12-01,1946-12-01,0,1,0,0,0,"M",1897-04-24,1897,1955-10-13,1955
"197","MEX-1946","A2.9-589",70,"MEX","Aleman Valdes","01/12/1946","01/12/1952","29/9/1903","14/05/1983",1946-12-01,1952-12-01,0,1,0,0,1,"M",1903-09-29,1903,1983-05-14,1983
"198","MEX-1952","A2.9-592",70,"MEX","Ruiz Cortines","01/12/1952","01/12/1958","30/12/1890","1973",1952-12-01,1958-12-01,0,1,0,0,0,"M",1890-12-30,1890,NA,1973
"199","MEX-1958","A2.9-595",70,"MEX","Lopez Mateos","01/12/1958","01/12/1964","26/5/1910","22/09/1969",1958-12-01,1964-12-01,0,1,0,0,0,"M",1910-05-26,1910,1969-09-22,1969
"200","MEX-1964","A2.9-598",70,"MEX","Diaz Ordaz","01/12/1964","01/12/1970","12/3/1911","15/07/1979",1964-12-01,1970-12-01,0,1,0,0,0,"M",1911-03-12,1911,1979-07-15,1979
"201","MEX-1970","A2.9-601",70,"MEX","Echeverria Alvarez","01/12/1970","01/12/1976","17/1/1922","-777",1970-12-01,1976-12-01,0,1,0,0,0,"M",1922-01-17,1922,NA,-777
"202","MEX-1976","A2.9-604",70,"MEX","Lopez Portillo","01/12/1976","01/12/1982","16/6/1920","17/02/2004",1976-12-01,1982-12-01,0,1,0,0,0,"M",1920-06-16,1920,2004-02-17,2004
"203","MEX-1982","A2.9-607",70,"MEX","de La Madrid","01/12/1982","01/12/1988","12/12/1934","-777",1982-12-01,1988-12-01,0,1,0,0,0,"M",1934-12-12,1934,NA,-777
"204","MEX-1988","A2.9-610",70,"MEX","Salinas","01/12/1988","30/11/1994","3/4/1948","-777",1988-12-01,1994-11-30,0,1,0,0,1,"M",1948-04-03,1948,NA,-777
"205","MEX-1994","A2.9-613",70,"MEX","Zedillo","01/12/1994","30/11/2000","27/12/1951","-777",1994-12-01,2000-11-30,0,1,0,0,0,"M",1951-12-27,1951,NA,-777
"206","MEX-2000","A2.9-616",70,"MEX","Vicente Fox Quesada","01/12/2000","31/12/2004","2/7/1942","-777",2000-12-01,2004-12-31,0,-888,0,0,-888,"M",1942-07-02,1942,NA,-777
"207","BLZ-1961","A2.9-619",80,"BLZ","Price","07/04/1961","17/12/1984","15/1/1919","-777",1961-04-07,1984-12-17,0,1,0,0,0,"M",1919-01-15,1919,NA,-777
"208","BLZ-1984","A2.9-622",80,"BLZ","Esquivel","17/12/1984","07/11/1989","2/5/1940","-777",1984-12-17,1989-11-07,0,1,0,0,0,"M",1940-05-02,1940,NA,-777
"209","BLZ-1989","A2.9-625",80,"BLZ","Price","07/11/1989","03/07/1993","15/1/1919","-777",1989-11-07,1993-07-03,0,1,0,1,0,"M",1919-01-15,1919,NA,-777
"210","BLZ-1993","A2.9-628",80,"BLZ","Esquivel","03/07/1993","28/08/1998","2/5/1940","-777",1993-07-03,1998-08-28,0,1,0,1,0,"M",1940-05-02,1940,NA,-777
"211","BLZ-1998","A2.9-631",80,"BLZ","Musa","28/08/1998","31/12/2004","19/03/1944","-777",1998-08-28,2004-12-31,0,-888,0,0,-888,"M",1944-03-19,1944,NA,-777
"212","GUA-1873","A2.9-634",90,"GUA","Justo Rufino Barrios","04/06/1873","06/04/1885","17/07/1835","1885",1873-06-04,1885-04-06,0,3,-999,0,3,"M",1835-07-17,1835,NA,1885
"213","GUA-1885","A2.9-637",90,"GUA","Barillas","06/04/1885","15/03/1892","1845","1907",1885-04-06,1892-03-15,0,1,0,0,0,"M",NA,1845,NA,1907
"214","GUA-1892","A2.9-640",90,"GUA","Reina Barrios","15/03/1892","08/02/1898","1835","1898",1892-03-15,1898-02-08,0,3,-999,0,3,"M",NA,1835,NA,1898
"215","GUA-1898","A2.9-643",90,"GUA","Estrada-Cabrera","08/02/1898","15/4/1920","21/11/1857","1924",1898-02-08,1920-04-15,0,3,4,0,2,"M",1857-11-21,1857,NA,1924
"216","GUA-1920","A2.9-646",90,"GUA","Herrera y Luna","15/04/1920","07/12/1921","1856","1930",1920-04-15,1921-12-07,1,3,6,0,2,"M",NA,1856,NA,1930
"217","GUA-1921","A2.9-649",90,"GUA","Orellana, J.","07/12/1921","26/09/1926","11/7/1872","1926",1921-12-07,1926-09-26,1,2,0,0,-777,"M",1872-07-11,1872,NA,1926
"218","GUA-1926","A2.9-652",90,"GUA","Chacon","27/09/1926","13/12/1930","27/6/1874","1931",1926-09-27,1930-12-13,0,2.1,0,0,-777,"M",1874-06-27,1874,NA,1931
"219","GUA-1930-1","A2.9-655",90,"GUA","Palma","13/12/1930","17/12/1930","1884","-999",1930-12-13,1930-12-17,0,3,6,0,0,"M",NA,1884,NA,NA
"220","GUA-1930-2","A2.9-658",90,"GUA","Orellana, M.","17/12/1930","31/12/1930","-999","-999",1930-12-17,1930-12-31,1,1,0,0,0,"M",NA,NA,NA,NA
"221","GUA-1931-1","A2.9-661",90,"GUA","Reyna Andrade","01/01/1931","14/02/1931","1860","1947",1931-01-01,1931-02-14,0,1,0,0,0,"M",NA,1860,NA,1947
"222","GUA-1931-2","A2.9-664",90,"GUA","Ubico Castaneda","15/02/1931","01/07/1944","10/11/1878","1946",1931-02-15,1944-07-01,0,3,2,0,1,"M",1878-11-10,1878,NA,1946
"223","GUA-1944-1","A2.9-667",90,"GUA","Ponce Valdez","01/07/1944","21/10/1944","1889","1956",1944-07-01,1944-10-21,1,3,6,0,1,"M",NA,1889,NA,1956
"224","GUA-1944-2","A2.9-670",90,"GUA","Arbenz Guzman","21/10/1944","15/03/1945","14/9/1913","27/01/1971",1944-10-21,1945-03-15,1,1,0,0,0,"M",1913-09-14,1913,1971-01-27,1971
"225","GUA-1945","A2.9-673",90,"GUA","Arevalo","15/03/1945","01/03/1951","10/9/1904","06/10/1990",1945-03-15,1951-03-01,0,1,0,0,1,"M",1904-09-10,1904,1990-10-06,1990
"226","GUA-1951","A2.9-676",90,"GUA","Arbenz Guzman","01/03/1951","27/06/1954","14/9/1913","27/01/1971",1951-03-01,1954-06-27,0,3,5,1,1,"M",1913-09-14,1913,1971-01-27,1971
"227","GUA-1954-1","A2.9-679",90,"GUA","Diaz","27/06/1954","29/06/1954","-999","-999",1954-06-27,1954-06-29,1,3,6,0,2,"M",NA,NA,NA,NA
"228","GUA-1954-2","A2.9-682",90,"GUA","Monzon","29/06/1954","08/07/1954","1912","1981",1954-06-29,1954-07-08,1,3,16,0,0,"M",NA,1912,NA,1981
"229","GUA-1954-3","A2.9-685",90,"GUA","Castillo Armas","08/07/1954","20/07/1957","4/11/1914","1957",1954-07-08,1957-07-20,1,3,11,0,3,"M",1914-11-04,1914,NA,1957
"230","GUA-1957-1","A2.9-688",90,"GUA","Gonzalez Lopez","20/07/1957","24/10/1957","12/12/1900","1965",1957-07-20,1957-10-24,1,3,6,0,0,"M",1900-12-12,1900,NA,1965
"231","GUA-1957-2","A2.9-691",90,"GUA","Mendoza Azurdia","24/10/1957","27/10/1957","1917","-999",1957-10-24,1957-10-27,1,3,5,0,0,"M",NA,1917,NA,NA
"232","GUA-1957-3","A2.9-694",90,"GUA","Flores Avendano","28/10/1957","02/03/1958","1898","1982",1957-10-28,1958-03-02,1,1,0,0,0,"M",NA,1898,NA,1982
"233","GUA-1958","A2.9-697",90,"GUA","Ydigoras Fuente","02/03/1958","31/03/1963","17/10/1895","1982",1958-03-02,1963-03-31,0,3,6,0,1,"M",1895-10-17,1895,NA,1982
"234","GUA-1963","A2.9-700",90,"GUA","Peralta Azurdia","31/03/1963","01/07/1966","17/6/1908","1997",1963-03-31,1966-07-01,1,1,0,0,0,"M",1908-06-17,1908,NA,1997
"235","GUA-1966","A2.9-703",90,"GUA","Mendez Montenegro","01/07/1966","01/07/1970","23/11/1915","1996",1966-07-01,1970-07-01,0,1,0,0,0,"M",1915-11-23,1915,NA,1996
"236","GUA-1970","A2.9-706",90,"GUA","Arana Osorio","01/07/1970","01/07/1974","17/7/1918","06/12/2003",1970-07-01,1974-07-01,0,1,0,0,0,"M",1918-07-17,1918,2003-12-06,2003
"237","GUA-1974","A2.9-709",90,"GUA","Laugerud Garcia","01/07/1974","01/07/1978","24/1/1930","-777",1974-07-01,1978-07-01,0,1,0,0,0,"M",1930-01-24,1930,NA,-777
"238","GUA-1978","A2.9-712",90,"GUA","Lucas Garcia","01/07/1978","23/03/1982","4/7/1924","27/05/2006",1978-07-01,1982-03-23,0,3,6,0,2,"M",1924-07-04,1924,2006-05-27,2006
"239","GUA-1982","A2.9-715",90,"GUA","Rios Montt","23/03/1982","08/08/1983","16/6/1926","-777",1982-03-23,1983-08-08,1,3,6,0,2,"M",1926-06-16,1926,NA,-777
"240","GUA-1983","A2.9-718",90,"GUA","Mejia Victores","08/08/1983","14/01/1986","1930","-777",1983-08-08,1986-01-14,1,1,0,0,0,"M",NA,1930,NA,-777
"241","GUA-1986","A2.9-721",90,"GUA","Cerezo","14/01/1986","14/01/1991","26/12/1942","-777",1986-01-14,1991-01-14,0,1,0,0,0,"M",1942-12-26,1942,NA,-777
"242","GUA-1991","A2.9-724",90,"GUA","Serrano Elias","14/01/1991","31/05/1993","26/4/1945","-777",1991-01-14,1993-05-31,0,3,6,0,1,"M",1945-04-26,1945,NA,-777
"243","GUA-1993-1","A2.9-727",90,"GUA","Espina Salguero","31/05/1993","01/06/1993","1946","-777",1993-05-31,1993-06-01,0,1,0,0,1,"M",NA,1946,NA,-777
"244","GUA-1993-2","A2.9-730",90,"GUA","Leon Carpio","01/06/1993","14/01/1996","1942","2002",1993-06-01,1996-01-14,1,1,0,0,0,"M",NA,1942,NA,2002
"245","GUA-1996","A2.9-733",90,"GUA","Arzu Yrigoyen","14/01/1996","14/01/2000","1946","-777",1996-01-14,2000-01-14,0,1,0,0,0,"M",NA,1946,NA,-777
"246","GUA-2000","A2.9-736",90,"GUA","Alfonso Portillo Cabrera","15/01/2000","14/01/2004","1951","-777",2000-01-15,2004-01-14,0,1,0,0,1,"M",NA,1951,NA,-777
"247","GUA-2004","A2.9-739",90,"GUA","Berger Perdomo","14/01/2004","31/12/2004","1946","-777",2004-01-14,2004-12-31,0,-888,0,0,-888,"M",NA,1946,NA,-777
"248","HON-1874","A2.9-742",91,"HON","Leiva","13/01/1874","08/06/1876","1821","1896",1874-01-13,1876-06-08,1,3,-999,0,0,"M",NA,1821,NA,1896
"249","HON-1876","A2.9-745",91,"HON","Soto","27/08/1876","19/10/1883","1846","1908",1876-08-27,1883-10-19,1,3,-999,0,1,"M",NA,1846,NA,1908
"250","HON-1883-1","A2.9-748",91,"HON","Council of Ministers","19/10/1883","30/11/1883","-999","-999",1883-10-19,1883-11-30,1,1,0,0,0,"M",NA,NA,NA,NA
"251","HON-1883-2","A2.9-751",91,"HON","Bogran","30/11/1883","30/11/1891","1849","1895",1883-11-30,1891-11-30,0,1,0,0,1,"M",NA,1849,NA,1895
"252","HON-1891","A2.9-754",91,"HON","Leiva","30/11/1891","07/08/1893","1821","1896",1891-11-30,1893-08-07,0,3,-999,1,1,"M",NA,1821,NA,1896
"253","HON-1893","A2.9-757",91,"HON","Vasquez","07/08/1893","22/02/1894","1846","1909",1893-08-07,1894-02-22,1,3,-999,0,1,"M",NA,1846,NA,1909
"254","HON-1894","A2.9-760",91,"HON","P. Bonilla","22/02/1894","01/02/1899","1858","1926",1894-02-22,1899-02-01,1,1,0,0,0,"M",NA,1858,NA,1926
"255","HON-1899","A2.9-763",91,"HON","Sierra","01/02/1899","30/01/1903","1839","1907",1899-02-01,1903-01-30,0,3,-999,0,1,"M",NA,1839,NA,1907
"256","HON-1903","A2.9-766",91,"HON","M. Bonilla","01/02/1903","11/04/1907","1849","1913",1903-02-01,1907-04-11,1,3,-999,0,1,"M",NA,1849,NA,1913
"257","HON-1907","A2.9-769",91,"HON","Davila","18/04/1907","28/03/1911","1856","1927",1907-04-18,1911-03-28,1,3,-999,0,1,"M",NA,1856,NA,1927
"258","HON-1911","A2.9-772",91,"HON","Bertrand","28/03/1911","02/02/1912","1866","1926",1911-03-28,1912-02-02,1,1,0,0,0,"M",NA,1866,NA,1926
"259","HON-1912","A2.9-775",91,"HON","M. Bonilla","02/02/1912","20/03/1913","1849","20/03/1913",1912-02-02,1913-03-20,0,2,0,1,-777,"M",NA,1849,1913-03-20,1913
"260","HON-1913","A2.9-778",91,"HON","Bertrand","20/03/1913","28/07/1915","1866","1926",1913-03-20,1915-07-28,0,1,0,1,0,"M",NA,1866,NA,1926
"261","HON-1915","A2.9-781",91,"HON","Alberto Membreno","28/07/1915","01/02/1916","1858","-999",1915-07-28,1916-02-01,0,1,0,0,0,"M",NA,1858,NA,NA
"262","HON-1916","A2.9-784",91,"HON","Bertrand","01/02/1916","09/09/1919","1866","1926",1916-02-01,1919-09-09,0,3,6,2,1,"M",NA,1866,NA,1926
"263","HON-1919","A2.9-787",91,"HON","Bogran","13/09/1919","01/02/1920","1849","1926",1919-09-13,1920-02-01,0,1,0,1,0,"M",NA,1849,NA,1926
"264","HON-1920","A2.9-790",91,"HON","Lopez-Gutierrez","01/02/1920","01/02/1924","1855","1924",1920-02-01,1924-02-01,0,3,6,0,-777,"M",NA,1855,NA,1924
"265","HON-1924","A2.9-793",91,"HON","Vicente Tosta","01/02/1924","01/02/1925","1876","1930",1924-02-01,1925-02-01,1,1,0,0,0,"M",NA,1876,NA,1930
"266","HON-1925","A2.9-796",91,"HON","Paz Baraona","01/02/1925","01/02/1929","1863","1937",1925-02-01,1929-02-01,1,1,0,0,0,"M",NA,1863,NA,1937
"267","HON-1929","A2.9-799",91,"HON","Mejia Colindres","01/02/1929","01/02/1933","1878","1966",1929-02-01,1933-02-01,0,1,0,0,1,"M",NA,1878,NA,1966
"268","HON-1933","A2.9-802",91,"HON","Carias Andino","01/02/1933","01/01/1949","15/3/1876","1969",1933-02-01,1949-01-01,0,1,0,0,0,"M",1876-03-15,1876,NA,1969
"269","HON-1949","A2.9-805",91,"HON","Galvez","01/01/1949","15/01/1954","1887","1972",1949-01-01,1954-01-15,0,2.1,0,0,0,"M",NA,1887,NA,1972
"270","HON-1954","A2.9-808",91,"HON","Lozano Diaz","15/01/1954","21/10/1956","1885","1957",1954-01-15,1956-10-21,0,3,6,0,1,"M",NA,1885,NA,1957
"271","HON-1956","A2.9-811",91,"HON","Hector Caraccioli","21/10/1956","21/12/1957","1922","1975",1956-10-21,1957-12-21,1,1,0,0,0,"M",NA,1922,NA,1975
"272","HON-1957","A2.9-814",91,"HON","Villeda Morales","21/12/1957","03/10/1963","26/11/1909","1971",1957-12-21,1963-10-03,0,3,6,0,1,"M",1909-11-26,1909,NA,1971
"273","HON-1963","A2.9-817",91,"HON","Lopez Arellano","03/10/1963","06/06/1971","30/6/1921","-777",1963-10-03,1971-06-06,1,1,0,0,0,"M",1921-06-30,1921,NA,-777
"274","HON-1971","A2.9-820",91,"HON","Cruz","06/06/1971","04/12/1972","4/1/1903","06/08/1985",1971-06-06,1972-12-04,0,3,6,0,2,"M",1903-01-04,1903,1985-08-06,1985
"275","HON-1972","A2.9-823",91,"HON","Lopez Arellano","04/12/1972","22/04/1975","30/6/1921","-777",1972-12-04,1975-04-22,1,3,16,1,0,"M",1921-06-30,1921,NA,-777
"276","HON-1975","A2.9-826",91,"HON","Castro","22/04/1975","07/08/1978","1938","1987",1975-04-22,1978-08-07,1,3,16,0,0,"M",NA,1938,NA,1987
"277","HON-1978","A2.9-829",91,"HON","Paz Garcia","07/08/1978","27/01/1982","1931","2000",1978-08-07,1982-01-27,1,1,0,0,0,"M",NA,1931,NA,2000
"278","HON-1982","A2.9-832",91,"HON","Suazo Cordova","27/01/1982","27/01/1986","1928","-777",1982-01-27,1986-01-27,0,1,0,0,0,"M",NA,1928,NA,-777
"279","HON-1986","A2.9-835",91,"HON","Azcona Hoyo","27/01/1986","27/01/1990","26/1/1927","24/10/2005",1986-01-27,1990-01-27,0,1,0,0,0,"M",1927-01-26,1927,2005-10-24,2005
"280","HON-1990","A2.9-838",91,"HON","Callejas","27/01/1990","27/01/1994","1943","-777",1990-01-27,1994-01-27,0,1,0,0,0,"M",NA,1943,NA,-777
"281","HON-1994","A2.9-841",91,"HON","Reina","27/01/1994","27/01/1998","13/03/1926","19/08/2003",1994-01-27,1998-01-27,0,1,0,0,0,"M",1926-03-13,1926,2003-08-19,2003
"282","HON-1998","A2.9-844",91,"HON","Flores Facusse","27/01/1998","27/01/2002","1950","-777",1998-01-27,2002-01-27,0,1,0,0,0,"M",NA,1950,NA,-777
"283","HON-2002","A2.9-847",91,"HON","Ricardo Maduro","27/01/2002","31/12/2004","1946","-777",2002-01-27,2004-12-31,0,-888,0,0,-888,"M",NA,1946,NA,-777
"284","SAL-1871","A2.9-850",92,"SAL","Gonzalez","15/04/1871","11/02/1876","1818","1887",1871-04-15,1876-02-11,1,1,0,0,-666,"M",NA,1818,NA,1887
"285","SAL-1876-1","A2.9-853",92,"SAL","Andres del Valle","12/02/1876","01/05/1876","1833","1888",1876-02-12,1876-05-01,0,3,-999,0,1,"M",NA,1833,NA,1888
"286","SAL-1876-2","A2.9-856",92,"SAL","Zaldivar","01/05/1876","14/05/1885","1834","1903",1876-05-01,1885-05-14,1,3,-999,0,1,"M",NA,1834,NA,1903
"287","SAL-1885","A2.9-859",92,"SAL","Menendez","22/05/1885","22/06/1890","1830","1890",1885-05-22,1890-06-22,1,3,-999,0,0,"M",NA,1830,NA,1890
"288","SAL-1890","A2.9-862",92,"SAL","Ezeta","22/06/1890","10/06/1894","1852","1903",1890-06-22,1894-06-10,1,3,-999,0,1,"M",NA,1852,NA,1903
"289","SAL-1894","A2.9-865",92,"SAL","Guttierez","10/06/1894","14/11/1898","1861","1921",1894-06-10,1898-11-14,1,3,-999,0,1,"M",NA,1861,NA,1921
"290","SAL-1898","A2.9-868",92,"SAL","Regalado","14/11/1898","01/03/1903","1864","1906",1898-11-14,1903-03-01,1,1,0,0,0,"M",NA,1864,NA,1906
"291","SAL-1903","A2.9-871",92,"SAL","Escalon","01/03/1903","28/02/1907","1847","1923",1903-03-01,1907-02-28,0,1,0,0,-666,"M",NA,1847,NA,1923
"292","SAL-1907","A2.9-874",92,"SAL","Figueroa","01/03/1907","28/02/1911","1849","1919",1907-03-01,1911-02-28,0,1,0,0,-666,"M",NA,1849,NA,1919
"293","SAL-1911","A2.9-877",92,"SAL","Araujo","01/03/1911","09/02/1913","1865","1913",1911-03-01,1913-02-09,0,3,-999,0,3,"M",NA,1865,NA,1913
"294","SAL-1913","A2.9-880",92,"SAL","C. Melendez","11/02/1913","15/08/1914","1/2/1861","09/10/1919",1913-02-11,1914-08-15,0,1,0,0,0,"M",1861-02-01,1861,1919-10-09,1919
"295","SAL-1914","A2.9-883",92,"SAL","Quinonez Molina","29/08/1914","28/02/1915","1873","1950",1914-08-29,1915-02-28,0,1,0,0,0,"M",NA,1873,NA,1950
"296","SAL-1915","A2.9-886",92,"SAL","C. Melendez","01/03/1915","21/12/1918","1/2/1861","09/10/1919",1915-03-01,1918-12-21,0,2.1,0,1,0,"M",1861-02-01,1861,1919-10-09,1919
"297","SAL-1918","A2.9-889",92,"SAL","Quinonez Molina","21/12/1918","28/02/1919","1873","1950",1918-12-21,1919-02-28,0,1,0,1,0,"M",NA,1873,NA,1950
"298","SAL-1919","A2.9-892",92,"SAL","J. Melendez","01/03/1919","28/02/1923","15/4/1871","1953",1919-03-01,1923-02-28,0,1,0,0,0,"M",1871-04-15,1871,NA,1953
"299","SAL-1923","A2.9-895",92,"SAL","Quinonez Molina","01/03/1923","28/02/1927","1873","1950",1923-03-01,1927-02-28,0,1,0,2,1,"M",NA,1873,NA,1950
"300","SAL-1927","A2.9-898",92,"SAL","Romeo Bosque","01/03/1927","28/02/1931","1860","1935",1927-03-01,1931-02-28,0,1,0,0,1,"M",NA,1860,NA,1935
"301","SAL-1931-1","A2.9-901",92,"SAL","Arajuo, A.","01/03/1931","02/12/1931","1878","1967",1931-03-01,1931-12-02,0,3,6,0,1,"M",NA,1878,NA,1967
"302","SAL-1931-2","A2.9-904",92,"SAL","Hernandez Martinez","04/12/1931","29/08/1934","29/10/1882","11/04/1966",1931-12-04,1934-08-29,0,1,0,0,0,"M",1882-10-29,1882,1966-04-11,1966
"303","SAL-1934","A2.9-907",92,"SAL","Menendez, A.I.","29/08/1934","28/02/1935","1879","1962",1934-08-29,1935-02-28,0,1,0,0,0,"M",NA,1879,NA,1962
"304","SAL-1935","A2.9-910",92,"SAL","Hernandez Martinez","28/02/1935","09/05/1944","29/10/1882","11/04/1966",1935-02-28,1944-05-09,0,3,2,1,1,"M",1882-10-29,1882,1966-04-11,1966
"305","SAL-1944-1","A2.9-913",92,"SAL","Menendez, A.I.","09/05/1944","21/10/1944","1879","1962",1944-05-09,1944-10-21,1,3,6,1,1,"M",NA,1879,NA,1962
"306","SAL-1944-2","A2.9-916",92,"SAL","Aguirre Salinas","21/10/1944","28/02/1945","1889","1977",1944-10-21,1945-02-28,1,1,0,0,1,"M",NA,1889,NA,1977
"307","SAL-1945","A2.9-919",92,"SAL","Castaneda Castro","28/02/1945","14/12/1948","6/8/1888","1965",1945-02-28,1948-12-14,0,3,6,0,2,"M",1888-08-06,1888,NA,1965
"308","SAL-1948","A2.9-922",92,"SAL","Cordova","15/12/1948","04/01/1949","1894","-999",1948-12-15,1949-01-04,1,1,0,0,1,"M",NA,1894,NA,NA
"309","SAL-1949-1","A2.9-925",92,"SAL","Osorio","04/01/1949","22/10/1949","1910","1969",1949-01-04,1949-10-22,0,1,0,0,0,"M",NA,1910,NA,1969
"310","SAL-1949-2","A2.9-928",92,"SAL","Oscar Bolanos","22/10/1949","14/09/1950","-999","-999",1949-10-22,1950-09-14,0,1,0,0,1,"M",NA,NA,NA,NA
"311","SAL-1950","A2.9-931",92,"SAL","Osorio","14/09/1950","14/09/1956","1910","1969",1950-09-14,1956-09-14,0,1,0,1,0,"M",NA,1910,NA,1969
"312","SAL-1956","A2.9-934",92,"SAL","Lemus","14/09/1956","26/10/1960","1911","1993",1956-09-14,1960-10-26,0,3,6,0,1,"M",NA,1911,NA,1993
"313","SAL-1960","A2.9-937",92,"SAL","Castillo","26/10/1960","25/01/1961","1915","-999",1960-10-26,1961-01-25,1,3,6,0,1,"M",NA,1915,NA,NA
"314","SAL-1961","A2.9-940",92,"SAL","Portillo","25/01/1961","25/01/1962","1914","-999",1961-01-25,1962-01-25,1,1,0,0,0,"M",NA,1914,NA,NA
"315","SAL-1962-1","A2.9-943",92,"SAL","Rodolfo Cordon","25/01/1962","01/07/1962","1899","1966",1962-01-25,1962-07-01,0,1,0,0,0,"M",NA,1899,NA,1966
"316","SAL-1962-2","A2.9-946",92,"SAL","Rivera","01/07/1962","01/07/1967","1922","1973",1962-07-01,1967-07-01,0,1,0,0,0,"M",NA,1922,NA,1973
"317","SAL-1967","A2.9-949",92,"SAL","Sanchez Hernandez","01/07/1967","01/07/1972","7/7/1917","2003",1967-07-01,1972-07-01,0,1,0,0,0,"M",1917-07-07,1917,NA,2003
"318","SAL-1972","A2.9-952",92,"SAL","Molina","01/07/1972","01/07/1977","18/6/1927","-777",1972-07-01,1977-07-01,0,1,0,0,0,"M",1927-06-18,1927,NA,-777
"319","SAL-1977","A2.9-955",92,"SAL","Romero Mena","01/07/1977","15/10/1979","1924","-777",1977-07-01,1979-10-15,0,3,6,0,1,"M",NA,1924,NA,-777
"320","SAL-1979","A2.9-958",92,"SAL","Majano Ramos","15/10/1979","07/12/1980","1938","-777",1979-10-15,1980-12-07,1,3,16,0,1,"M",NA,1938,NA,-777
"321","SAL-1980","A2.9-961",92,"SAL","Duarte","13/12/1980","02/05/1982","23/11/1925","23/2/1990",1980-12-13,1982-05-02,1,1,0,0,0,"M",1925-11-23,1925,1990-02-23,1990
"322","SAL-1982","A2.9-964",92,"SAL","Magana Borjo","02/05/1982","01/06/1984","8/10/1925","10/07/2001",1982-05-02,1984-06-01,0,1,0,0,0,"M",1925-10-08,1925,2001-07-10,2001
"323","SAL-1984","A2.9-967",92,"SAL","Duarte","01/06/1984","01/06/1989","23/11/1925","23/2/1990",1984-06-01,1989-06-01,0,1,0,1,-777,"M",1925-11-23,1925,1990-02-23,1990
"324","SAL-1989","A2.9-970",92,"SAL","Cristiani","01/06/1989","01/06/1994","22/11/1947","-777",1989-06-01,1994-06-01,0,1,0,0,0,"M",1947-11-22,1947,NA,-777
"325","SAL-1994","A2.9-973",92,"SAL","Calderon Sol","01/06/1994","01/06/1999","1948","-777",1994-06-01,1999-06-01,0,1,0,0,0,"M",NA,1948,NA,-777
"326","SAL-1999","A2.9-976",92,"SAL","Flores","01/06/1999","01/06/2004","17/10/1959","-777",1999-06-01,2004-06-01,0,1,0,0,0,"M",1959-10-17,1959,NA,-777
"327","SAL-2004","A2.9-979",92,"SAL","Saca González","01/06/2004","31/12/2004","1965","-777",2004-06-01,2004-12-31,0,-888,0,0,-888,"M",NA,1965,NA,-777
"328","NIC-1871","A2.9-982",93,"NIC","Quadra","01/03/1871","01/03/1875","1812","1894",1871-03-01,1875-03-01,0,1,0,0,0,"M",NA,1812,NA,1894
"329","NIC-1875","A2.9-985",93,"NIC","Chamorro","01/03/1875","01/03/1879","1818","1894",1875-03-01,1879-03-01,0,1,0,0,0,"M",NA,1818,NA,1894
"330","NIC-1879","A2.9-988",93,"NIC","Zavala","01/03/1879","01/03/1883","1835","1906",1879-03-01,1883-03-01,0,1,0,0,0,"M",NA,1835,NA,1906
"331","NIC-1883","A2.9-991",93,"NIC","Cardenas","01/03/1883","01/03/1887","1836","1916",1883-03-01,1887-03-01,0,1,0,0,0,"M",NA,1836,NA,1916
"332","NIC-1887","A2.9-994",93,"NIC","Carazo","01/03/1887","01/08/1889","24/10/1821","1889",1887-03-01,1889-08-01,0,2,0,0,-777,"M",1821-10-24,1821,NA,1889
"333","NIC-1889","A2.9-997",93,"NIC","Sacasa","01/08/1889","01/06/1893","1840","1896",1889-08-01,1893-06-01,0,3,-999,0,1,"M",NA,1840,NA,1896
"334","NIC-1893","A2.9-1000",93,"NIC","Zelaya","31/07/1893","16/12/1909","31/10/1853","1919",1893-07-31,1909-12-16,1,3,-999,0,1,"M",1853-10-31,1853,NA,1919
"335","NIC-1909","A2.9-1003",93,"NIC","Madriz","16/12/1909","20/08/1910","1867","1911",1909-12-16,1910-08-20,1,3,-999,0,1,"M",NA,1867,NA,1911
"336","NIC-1910-1","A2.9-1006",93,"NIC","J. D. Estrada","20/08/1910","29/08/1910","-999","1911",1910-08-20,1910-08-29,1,3,-999,0,0,"M",NA,NA,NA,1911
"337","NIC-1910-2","A2.9-1009",93,"NIC","J. J. Estrada","29/08/1910","09/05/1911","1871","1967",1910-08-29,1911-05-09,1,3,-999,0,1,"M",NA,1871,NA,1967
"338","NIC-1911","A2.9-1012",93,"NIC","Adolfo Diaz","09/05/1911","31/12/1916","1875","1964",1911-05-09,1916-12-31,1,1,0,0,0,"M",NA,1875,NA,1964
"339","NIC-1917","A2.9-1015",93,"NIC","Chamorro Vargas","01/01/1917","31/12/1920","11/5/1871","26/02/1966",1917-01-01,1920-12-31,0,1,0,0,0,"M",1871-05-11,1871,1966-02-26,1966
"340","NIC-1921","A2.9-1018",93,"NIC","Diego Chamorro","01/01/1921","12/10/1923","1861","1923",1921-01-01,1923-10-12,0,2,0,0,-777,"M",NA,1861,NA,1923
"341","NIC-1923","A2.9-1021",93,"NIC","Martinez Bartol","12/10/1923","07/12/1924","1860","1936",1923-10-12,1924-12-07,0,1,0,0,1,"M",NA,1860,NA,1936
"342","NIC-1925","A2.9-1024",93,"NIC","Solorzano","01/01/1925","14/01/1926","1860","1936",1925-01-01,1926-01-14,0,3,6,0,1,"M",NA,1860,NA,1936
"343","NIC-1926-1","A2.9-1027",93,"NIC","Chamorro Vargas","17/01/1926","30/10/1926","11/5/1871","26/02/1966",1926-01-17,1926-10-30,1,1,0,1,1,"M",1871-05-11,1871,1966-02-26,1966
"344","NIC-1926-2","A2.9-1030",93,"NIC","Adolfo Diaz","30/10/1926","01/01/1929","1875","1964",1926-10-30,1929-01-01,0,1,0,1,1,"M",NA,1875,NA,1964
"345","NIC-1929","A2.9-1033",93,"NIC","Moncada","01/01/1929","31/12/1932","1871","1945",1929-01-01,1932-12-31,0,1,0,0,0,"M",NA,1871,NA,1945
"346","NIC-1933","A2.9-1036",93,"NIC","Sacasa, Juan","01/01/1933","06/06/1936","21/12/1874","1946",1933-01-01,1936-06-06,0,1,0,0,1,"M",1874-12-21,1874,NA,1946
"347","NIC-1936","A2.9-1039",93,"NIC","Jarquin","06/06/1936","18/12/1936","1886","1942",1936-06-06,1936-12-18,0,1,0,0,1,"M",NA,1886,NA,1942
"348","NIC-1937","A2.9-1042",93,"NIC","Anastasio Somoza Garcia","01/01/1937","01/05/1947","1/2/1896","29/09/1956",1937-01-01,1947-05-01,0,1,0,0,0,"M",1896-02-01,1896,1956-09-29,1956
"349","NIC-1947-1","A2.9-1045",93,"NIC","Arguello","01/05/1947","26/05/1947","29/08/1875","15/12/1947",1947-05-01,1947-05-26,0,3,6,0,1,"M",1875-08-29,1875,1947-12-15,1947
"350","NIC-1947-2","A2.9-1048",93,"NIC","Anastasio Somoza Garcia","26/05/1947","29/09/1956","1/2/1896","29/09/1956",1947-05-26,1956-09-29,1,3,11,1,3,"M",1896-02-01,1896,1956-09-29,1956
"351","NIC-1956","A2.9-1051",93,"NIC","Luis Somoza Debayle","29/09/1956","01/05/1963","18/11/1922","1967",1956-09-29,1963-05-01,0,1,0,0,0,"M",1922-11-18,1922,NA,1967
"352","NIC-1963","A2.9-1054",93,"NIC","Shick Gutierrez","01/05/1963","03/08/1966","1909","1966",1963-05-01,1966-08-03,1,2,0,0,-777,"M",NA,1909,NA,1966
"353","NIC-1966","A2.9-1057",93,"NIC","Guerrero Gutierrez","04/08/1966","01/05/1967","13/11/1900","1981",1966-08-04,1967-05-01,0,1,0,0,0,"M",1900-11-13,1900,NA,1981
"354","NIC-1967","A2.9-1060",93,"NIC","Anastasio Somoza Debayle","01/05/1967","17/07/1979","5/12/1925","17/09/1980",1967-05-01,1979-07-17,0,3,3,0,3,"M",1925-12-05,1925,1980-09-17,1980
"355","NIC-1979","A2.9-1063",93,"NIC","Daniel Ortega","18/07/1979","25/04/1990","11/11/1945","-777",1979-07-18,1990-04-25,1,1,0,0,0,"M",1945-11-11,1945,NA,-777
"356","NIC-1990","A2.9-1066",93,"NIC","Violeta Chamorro","25/04/1990","10/01/1997","18/10/1929","-777",1990-04-25,1997-01-10,0,1,0,0,0,"F",1929-10-18,1929,NA,-777
"357","NIC-1997","A2.9-1069",93,"NIC","Aleman","10/01/1997","10/01/2002","1946","-777",1997-01-10,2002-01-10,0,1,0,0,0,"M",NA,1946,NA,-777
"358","NIC-2002","A2.9-1072",93,"NIC","Enrique Bolanos","11/01/2002","31/12/2004","1928","-777",2002-01-11,2004-12-31,0,-888,0,0,-888,"M",NA,1928,NA,-777
"359","COS-1870","A2.9-1075",94,"COS","Guardia","10/08/1870","06/07/1882","1831","1882",1870-08-10,1882-07-06,1,2,0,0,-777,"M",NA,1831,NA,1882
"360","COS-1882-1","A2.9-1078",94,"COS","Lizano","06/07/1882","20/07/1882","1826","1905",1882-07-06,1882-07-20,0,1,0,0,0,"M",NA,1826,NA,1905
"361","COS-1882-2","A2.9-1081",94,"COS","Prospero Fernandez Oreamuno","20/07/1882","12/03/1885","1834","1885",1882-07-20,1885-03-12,0,2,0,0,-777,"M",NA,1834,NA,1885
"362","COS-1885","A2.9-1084",94,"COS","Bernardo Soto Alfaro","12/03/1885","07/11/1889","1854","1931",1885-03-12,1889-11-07,0,3,-999,0,1,"M",NA,1854,NA,1931
"363","COS-1889","A2.9-1087",94,"COS","Carlos Duran Cartin","07/11/1889","08/05/1890","1852","-999",1889-11-07,1890-05-08,0,1,0,0,-666,"M",NA,1852,NA,NA
"364","COS-1890","A2.9-1090",94,"COS","Jose Joaquin Rodriguez","08/05/1890","08/05/1894","1838","1917",1890-05-08,1894-05-08,0,1,0,0,1,"M",NA,1838,NA,1917
"365","COS-1894","A2.9-1093",94,"COS","Rafael Yglesias Castro","08/05/1894","08/05/1902","18/4/1861","1924",1894-05-08,1902-05-08,0,1,0,0,0,"M",1861-04-18,1861,NA,1924
"366","COS-1902","A2.9-1096",94,"COS","Ascension Esquivel Ibarra","08/05/1902","08/05/1906","1848","1927",1902-05-08,1906-05-08,0,1,0,0,0,"M",NA,1848,NA,1927
"367","COS-1906","A2.9-1099",94,"COS","Gonzalez Viquez","08/05/1906","08/05/1910","13/10/1858","1937",1906-05-08,1910-05-08,0,1,0,0,0,"M",1858-10-13,1858,NA,1937
"368","COS-1910","A2.9-1102",94,"COS","Jimenez Oreamuno","08/05/1910","08/05/1914","6/2/1859","1945",1910-05-08,1914-05-08,0,1,0,0,0,"M",1859-02-06,1859,NA,1945
"369","COS-1914","A2.9-1105",94,"COS","Alfredo Gonzalez Flores","08/05/1914","27/01/1917","15/6/1877","1962",1914-05-08,1917-01-27,0,3,-999,0,1,"M",1877-06-15,1877,NA,1962
"370","COS-1917","A2.9-1108",94,"COS","Federico Tinoco Granados","27/01/1917","13/08/1919","1870","1931",1917-01-27,1919-08-13,1,3,4,0,1,"M",NA,1870,NA,1931
"371","COS-1919-1","A2.9-1111",94,"COS","Juan Bautista Quiros Segura","13/08/1919","06/09/1919","1853","1934",1919-08-13,1919-09-06,1,3,1,0,0,"M",NA,1853,NA,1934
"372","COS-1919-2","A2.9-1114",94,"COS","Barquero","06/09/1919","06/09/1919","1857","1924",1919-09-06,1919-09-06,1,1,0,0,-666,"M",NA,1857,NA,1924
"373","COS-1920","A2.9-1117",94,"COS","Acosta Garcia","08/05/1920","08/05/1924","23/5/1872","1954",1920-05-08,1924-05-08,0,1,0,0,0,"M",1872-05-23,1872,NA,1954
"374","COS-1924","A2.9-1120",94,"COS","Jimenez Oreamuno","08/05/1924","08/05/1928","6/2/1859","1945",1924-05-08,1928-05-08,0,1,0,1,0,"M",1859-02-06,1859,NA,1945
"375","COS-1928","A2.9-1123",94,"COS","Gonzalez Viquez","08/05/1928","08/05/1932","13/10/1858","1937",1928-05-08,1932-05-08,0,1,0,1,0,"M",1858-10-13,1858,NA,1937
"376","COS-1932","A2.9-1126",94,"COS","Jimenez Oreamuno","08/05/1932","08/05/1936","6/2/1859","1945",1932-05-08,1936-05-08,0,1,0,2,0,"M",1859-02-06,1859,NA,1945
"377","COS-1936","A2.9-1129",94,"COS","Cortes Castro","08/05/1936","08/05/1940","8/12/1882","1946",1936-05-08,1940-05-08,0,1,0,0,0,"M",1882-12-08,1882,NA,1946
"378","COS-1940","A2.9-1132",94,"COS","Calderon Guardi","08/05/1940","08/05/1944","10/3/1900","1970",1940-05-08,1944-05-08,0,1,0,0,0,"M",1900-03-10,1900,NA,1970
"379","COS-1944","A2.9-1135",94,"COS","Picado Michalski","08/05/1944","20/04/1948","10/1/1900","1960",1944-05-08,1948-04-20,0,3,4,0,1,"M",1900-01-10,1900,NA,1960
"380","COS-1948","A2.9-1138",94,"COS","Leon Herrera","20/04/1948","08/05/1949","1872","-999",1948-04-20,1949-05-08,1,1,0,0,0,"M",NA,1872,NA,NA
"381","COS-1949-1","A2.9-1141",94,"COS","Figueres Ferrer","08/05/1949","08/11/1949","25/9/1906","08/06/1990",1949-05-08,1949-11-08,1,1,0,0,0,"M",1906-09-25,1906,1990-06-08,1990
"382","COS-1949-2","A2.9-1144",94,"COS","Otilia Ulate","08/11/1949","08/11/1953","1892","1973",1949-11-08,1953-11-08,0,1,0,0,0,"M",NA,1892,NA,1973
"383","COS-1953","A2.9-1147",94,"COS","Figueres Ferrer","08/11/1953","08/05/1958","25/9/1906","08/06/1990",1953-11-08,1958-05-08,0,1,0,1,0,"M",1906-09-25,1906,1990-06-08,1990
"384","COS-1958","A2.9-1150",94,"COS","Echandi Jimenez","08/05/1958","08/05/1962","1915","-777",1958-05-08,1962-05-08,0,1,0,0,0,"M",NA,1915,NA,-777
"385","COS-1962","A2.9-1153",94,"COS","Orlich","08/05/1962","08/05/1966","10/3/1907","1969",1962-05-08,1966-05-08,0,1,0,0,0,"M",1907-03-10,1907,NA,1969
"386","COS-1966","A2.9-1156",94,"COS","Trejos","08/05/1966","08/05/1970","18/4/1916","-777",1966-05-08,1970-05-08,0,1,0,0,0,"M",1916-04-18,1916,NA,-777
"387","COS-1970","A2.9-1159",94,"COS","Figueres Ferrer","08/05/1970","08/05/1974","25/9/1906","08/06/1990",1970-05-08,1974-05-08,0,1,0,2,0,"M",1906-09-25,1906,1990-06-08,1990
"388","COS-1974","A2.9-1162",94,"COS","Quiros, Daniel","08/05/1974","08/05/1978","25/8/1921","13/10/1991",1974-05-08,1978-05-08,0,1,0,0,0,"M",1921-08-25,1921,1991-10-13,1991
"389","COS-1978","A2.9-1165",94,"COS","Carazo Odio","08/05/1978","08/05/1982","27/12/1926","-777",1978-05-08,1982-05-08,0,1,0,0,0,"M",1926-12-27,1926,NA,-777
"390","COS-1982","A2.9-1168",94,"COS","Monge Alverez","08/05/1982","08/05/1986","28/12/1925","-777",1982-05-08,1986-05-08,0,1,0,0,0,"M",1925-12-28,1925,NA,-777
"391","COS-1986","A2.9-1171",94,"COS","Arias","08/05/1986","08/05/1990","13/9/1941","-777",1986-05-08,1990-05-08,0,1,0,0,0,"M",1941-09-13,1941,NA,-777
"392","COS-1990","A2.9-1174",94,"COS","Calderon Fournier","08/05/1990","08/05/1994","1949","-777",1990-05-08,1994-05-08,0,1,0,0,0,"M",NA,1949,NA,-777
"393","COS-1994","A2.9-1177",94,"COS","Figueres Olsen","08/05/1994","08/05/1998","1954","-777",1994-05-08,1998-05-08,0,1,0,0,0,"M",NA,1954,NA,-777
"394","COS-1998","A2.9-1180",94,"COS","Rodriguez Echeverria","08/05/1998","08/05/2002","1940","-777",1998-05-08,2002-05-08,0,1,0,0,0,"M",NA,1940,NA,-777
"395","COS-2002","A2.9-1183",94,"COS","de la Espriella","09/05/2002","31/12/2004","1933","-777",2002-05-09,2004-12-31,0,-888,0,0,-888,"M",NA,1933,NA,-777
"396","PAN-1903","A2.9-1186",95,"PAN","Jose Agustin Arango","03/11/1903","20/02/1904","1841","1909",1903-11-03,1904-02-20,1,1,0,0,0,"M",NA,1841,NA,1909
"397","PAN-1904","A2.9-1189",95,"PAN","Manuel Amador Guerrero","20/02/1904","01/10/1908","30/6/1833","1909",1904-02-20,1908-10-01,0,1,0,0,0,"M",1833-06-30,1833,NA,1909
"398","PAN-1908","A2.9-1192",95,"PAN","Jose Domingo de Obaldia","01/10/1908","01/03/1910","1845","1910",1908-10-01,1910-03-01,0,2,0,0,-777,"M",NA,1845,NA,1910
"399","PAN-1910-1","A2.9-1195",95,"PAN","Carlos Antonio Mendoza","01/03/1910","01/10/1910","1856","1916",1910-03-01,1910-10-01,0,1,0,0,0,"M",NA,1856,NA,1916
"400","PAN-1910-2","A2.9-1198",95,"PAN","Pablo Arosemena Alba","01/10/1910","02/02/1912","24/9/1836","1920",1910-10-01,1912-02-02,0,1,0,0,0,"M",1836-09-24,1836,NA,1920
"401","PAN-1912-1","A2.9-1201",95,"PAN","Rudolfo Chiari","02/02/1912","08/03/1912","15/11/1870","1937",1912-02-02,1912-03-08,0,1,0,0,0,"F",1870-11-15,1870,NA,1937
"402","PAN-1912-2","A2.9-1204",95,"PAN","Pablo Arosemena Alba","08/03/1912","01/10/1912","24/9/1836","1920",1912-03-08,1912-10-01,0,1,0,1,0,"F",1836-09-24,1836,NA,1920
"403","PAN-1912-3","A2.9-1207",95,"PAN","Belisario Porras Barahona","01/10/1912","01/10/1916","28/11/1856","1942",1912-10-01,1916-10-01,0,1,0,0,0,"M",1856-11-28,1856,NA,1942
"404","PAN-1916","A2.9-1210",95,"PAN","Ramon Maximiliano Valdes","01/10/1916","03/06/1918","1867","1918",1916-10-01,1918-06-03,0,2,0,0,-777,"M",NA,1867,NA,1918
"405","PAN-1918-1","A2.9-1213",95,"PAN","Ciro Luis Urriola","03/06/1918","01/10/1918","1863","1922",1918-06-03,1918-10-01,0,1,0,0,0,"M",NA,1863,NA,1922
"406","PAN-1918-2","A2.9-1216",95,"PAN","Belisario Porras Barahona","01/10/1918","30/01/1920","28/11/1856","1942",1918-10-01,1920-01-30,0,1,0,1,0,"M",1856-11-28,1856,NA,1942
"407","PAN-1920-1","A2.9-1219",95,"PAN","Ernesto Lefevre","30/01/1920","01/10/1920","1876","1922",1920-01-30,1920-10-01,0,1,0,0,0,"M",NA,1876,NA,1922
"408","PAN-1920-2","A2.9-1222",95,"PAN","Belisario Porras Barahona","01/10/1920","01/10/1924","28/11/1856","1942",1920-10-01,1924-10-01,0,1,0,2,0,"M",1856-11-28,1856,NA,1942
"409","PAN-1924","A2.9-1225",95,"PAN","Rudolfo Chiari","01/10/1924","08/09/1928","15/11/1870","1937",1924-10-01,1928-09-08,0,1,0,1,0,"M",1870-11-15,1870,NA,1937
"410","PAN-1928-1","A2.9-1228",95,"PAN","Tomas Duque","08/09/1928","01/10/1928","1890","-999",1928-09-08,1928-10-01,0,1,0,0,0,"M",NA,1890,NA,NA
"411","PAN-1928-2","A2.9-1231",95,"PAN","Florencio Harmodio Arosemena","01/10/1928","03/01/1931","17/09/1872","30/08/1945",1928-10-01,1931-01-03,0,3,4,0,1,"M",1872-09-17,1872,1945-08-30,1945
"412","PAN-1931-1","A2.9-1234",95,"PAN","Arias, H.","03/01/1931","16/01/1931","3/7/1886","23/12/1962",1931-01-03,1931-01-16,1,1,0,0,0,"M",1886-07-03,1886,1962-12-23,1962
"413","PAN-1931-2","A2.9-1237",95,"PAN","Alfaro","16/01/1931","01/10/1932","20/8/1882","1971",1931-01-16,1932-10-01,0,1,0,0,0,"M",1882-08-20,1882,NA,1971
"414","PAN-1932","A2.9-1240",95,"PAN","Arias, H.","01/10/1932","01/10/1936","3/7/1886","23/12/1962",1932-10-01,1936-10-01,0,1,0,1,0,"M",1886-07-03,1886,1962-12-23,1962
"415","PAN-1936","A2.9-1243",95,"PAN","Arosomena, Juan","01/10/1936","16/12/1939","24/6/1879","16/12/1939",1936-10-01,1939-12-16,0,2,0,0,-777,"M",1879-06-24,1879,1939-12-16,1939
"416","PAN-1939","A2.9-1246",95,"PAN","Boyd","18/12/1939","01/10/1940","1879","1957",1939-12-18,1940-10-01,0,1,0,0,0,"M",NA,1879,NA,1957
"417","PAN-1940","A2.9-1249",95,"PAN","Arias, A.","01/10/1940","09/10/1941","15/8/1901","10/08/1988",1940-10-01,1941-10-09,0,3,8,0,1,"M",1901-08-15,1901,1988-08-10,1988
"418","PAN-1941-1","A2.9-1252",95,"PAN","Ernesto Jaen Guardia","09/10/1941","09/10/1941","1895","1961",1941-10-09,1941-10-09,0,1,0,0,0,"M",NA,1895,NA,1961
"419","PAN-1941-2","A2.9-1255",95,"PAN","Guardia, R.","09/10/1941","15/06/1945","14/6/1899","1969",1941-10-09,1945-06-15,1,1,0,0,0,"M",1899-06-14,1899,NA,1969
"420","PAN-1945","A2.9-1258",95,"PAN","Jimenez","15/06/1945","01/10/1948","1888","1970",1945-06-15,1948-10-01,0,3,8,0,1,"M",NA,1888,NA,1970
"421","PAN-1948","A2.9-1261",95,"PAN","Diaz Arosomena","01/10/1948","28/07/1949","17/9/1873","23/08/1949",1948-10-01,1949-07-28,1,2.1,0,0,-777,"M",1873-09-17,1873,1949-08-23,1949
"422","PAN-1949-1","A2.9-1264",95,"PAN","Chaniz Pinzon","28/07/1949","20/11/1949","1892","1961",1949-07-28,1949-11-20,0,3,6,0,1,"M",NA,1892,NA,1961
"423","PAN-1949-2","A2.9-1267",95,"PAN","Chiari, Roberto","20/11/1949","25/11/1949","2/3/1905","1981",1949-11-20,1949-11-25,0,1,0,0,0,"M",1905-03-02,1905,NA,1981
"424","PAN-1949-3","A2.9-1270",95,"PAN","Arias, A.","25/11/1949","10/05/1951","15/8/1901","10/08/1988",1949-11-25,1951-05-10,1,1,0,1,2,"M",1901-08-15,1901,1988-08-10,1988
"425","PAN-1951","A2.9-1273",95,"PAN","Arosomena, A.","10/05/1951","01/10/1952","20/11/1883","08/04/1958",1951-05-10,1952-10-01,0,1,0,0,0,"M",1883-11-20,1883,1958-04-08,1958
"426","PAN-1952","A2.9-1276",95,"PAN","Remon Cantero","01/10/1952","02/01/1955","1/7/1908","1955",1952-10-01,1955-01-02,0,3,11,0,3,"M",1908-07-01,1908,NA,1955
"427","PAN-1955-1","A2.9-1279",95,"PAN","Guizado","03/01/1955","15/01/1955","1899","1964",1955-01-03,1955-01-15,0,1,0,0,2,"M",NA,1899,NA,1964
"428","PAN-1955-2","A2.9-1282",95,"PAN","Arias Espinosa","15/01/1955","01/10/1956","1912","1993",1955-01-15,1956-10-01,0,1,0,0,0,"M",NA,1912,NA,1993
"429","PAN-1956","A2.9-1285",95,"PAN","Guardia Jr., E.","01/10/1956","01/10/1960","30/5/1904","02/05/1983",1956-10-01,1960-10-01,0,1,0,0,0,"M",1904-05-30,1904,1983-05-02,1983
"430","PAN-1960","A2.9-1288",95,"PAN","Chiari, Roberto","01/10/1960","01/10/1964","2/3/1905","1981",1960-10-01,1964-10-01,0,1,0,1,0,"M",1905-03-02,1905,NA,1981
"431","PAN-1964","A2.9-1291",95,"PAN","Robles","01/10/1964","01/10/1968","8/11/1905","1990",1964-10-01,1968-10-01,0,1,0,0,1,"M",1905-11-08,1905,NA,1990
"432","PAN-1968-1","A2.9-1294",95,"PAN","Arias, A.","01/10/1968","12/10/1968","15/8/1901","10/08/1988",1968-10-01,1968-10-12,0,3,6,2,1,"M",1901-08-15,1901,1988-08-10,1988
"433","PAN-1968-2","A2.9-1297",95,"PAN","Torrijos Herrera","12/10/1968","31/07/1981","13/2/1929","31/07/1981",1968-10-12,1981-07-31,1,2,0,0,-777,"M",1929-02-13,1929,1981-07-31,1981
"434","PAN-1981","A2.9-1300",95,"PAN","Florez Aguilar","31/07/1981","03/03/1982","1931","-777",1981-07-31,1982-03-03,1,3,16,0,2,"M",NA,1931,NA,-777
"435","PAN-1982","A2.9-1303",95,"PAN","Dario Paredes","03/03/1982","15/08/1983","1931","-777",1982-03-03,1983-08-15,1,1,0,0,0,"M",NA,1931,NA,-777
"436","PAN-1983","A2.9-1306",95,"PAN","Noriega","15/08/1983","03/01/1990","11/2/1940","-777",1983-08-15,1990-01-03,1,4,9,0,2,"M",1940-02-11,1940,NA,-777
"437","PAN-1990","A2.9-1309",95,"PAN","Endara","04/01/1990","01/09/1994","1936","-777",1990-01-04,1994-09-01,2,1,0,0,0,"M",NA,1936,NA,-777
"438","PAN-1994","A2.9-1312",95,"PAN","Balladares","01/09/1994","01/09/1999","1946","-777",1994-09-01,1999-09-01,0,1,0,0,0,"M",NA,1946,NA,-777
"439","PAN-1999","A2.9-1315",95,"PAN","Mireya Moscoso","01/09/1999","01/09/2004","01/07/1946","-999",1999-09-01,2004-09-01,0,1,0,0,-999,"F",1946-07-01,1946,NA,NA
"440","PAN-2004","A2.9-1318",95,"PAN","Martin Torrijos","01/09/2004","31/12/2004","1963","-777",2004-09-01,2004-12-31,0,-888,0,0,-888,"M",NA,1963,NA,-777
"441","COL-1874","A2.9-1321",100,"COL","Perez","01/04/1874","01/04/1876","1830","1900",1874-04-01,1876-04-01,0,1,0,0,0,"M",NA,1830,NA,1900
"442","COL-1876","A2.9-1324",100,"COL","Parra","01/04/1876","14/05/1877","1825","1900",1876-04-01,1877-05-14,0,2.1,0,0,0,"M",NA,1825,NA,1900
"443","COL-1877-1","A2.9-1327",100,"COL","Camargo","14/05/1877","15/08/1877","-999","-999",1877-05-14,1877-08-15,0,1,0,0,0,"M",NA,NA,NA,NA
"444","COL-1877-2","A2.9-1330",100,"COL","Parra","15/08/1877","01/04/1878","1825","1900",1877-08-15,1878-04-01,0,1,0,1,1,"M",NA,1825,NA,1900
"445","COL-1878","A2.9-1333",100,"COL","Trujillo","01/04/1878","08/04/1880","1828","1883",1878-04-01,1880-04-08,0,1,0,0,0,"M",NA,1828,NA,1883
"446","COL-1880","A2.9-1336",100,"COL","Nunez","08/04/1880","01/04/1882","28/09/1825","18/09/1894",1880-04-08,1882-04-01,0,1,0,0,0,"M",1825-09-28,1825,1894-09-18,1894
"447","COL-1882-1","A2.9-1339",100,"COL","Zaldua","01/04/1882","21/12/1882","1811","1882",1882-04-01,1882-12-21,0,2,0,0,-777,"M",NA,1811,NA,1882
"448","COL-1882-2","A2.9-1342",100,"COL","Otalora","22/12/1882","01/04/1884","1828","1884",1882-12-22,1884-04-01,0,2,0,0,-777,"M",NA,1828,NA,1884
"449","COL-1884","A2.9-1345",100,"COL","Nunez","01/04/1884","12/09/1894","1825","18/09/1894",1884-04-01,1894-09-12,0,1,0,1,0,"M",NA,1825,1894-09-18,1894
"450","COL-1894","A2.9-1348",100,"COL","Caro","18/09/1894","07/08/1898","1843","1909",1894-09-18,1898-08-07,0,1,0,0,0,"M",NA,1843,NA,1909
"451","COL-1898","A2.9-1351",100,"COL","Sanclemente","07/08/1898","31/07/1900","1814","1902",1898-08-07,1900-07-31,0,3,-999,0,2,"M",NA,1814,NA,1902
"452","COL-1900","A2.9-1354",100,"COL","Marroquin","31/07/1900","07/08/1904","6/8/1827","1908",1900-07-31,1904-08-07,1,1,0,0,0,"M",1827-08-06,1827,NA,1908
"453","COL-1904","A2.9-1357",100,"COL","Reyes Prieto","07/08/1904","08/07/1909","5/12/1849","19/02/1921",1904-08-07,1909-07-08,0,1,0,0,1,"M",1849-12-05,1849,1921-02-19,1921
"454","COL-1909-1","A2.9-1360",100,"COL","J. Holguin","08/07/1909","03/08/1909","30/10/1848","1928",1909-07-08,1909-08-03,0,1,0,0,0,"M",1848-10-30,1848,NA,1928
"455","COL-1909-2","A2.9-1363",100,"COL","Gonzales Valencia","03/08/1909","15/07/1910","1854","1928",1909-08-03,1910-07-15,0,1,0,0,0,"M",NA,1854,NA,1928
"456","COL-1910","A2.9-1366",100,"COL","Restropo","15/07/1910","07/08/1914","12/9/1867","1937",1910-07-15,1914-08-07,0,1,0,0,0,"M",1867-09-12,1867,NA,1937
"457","COL-1914","A2.9-1369",100,"COL","Concha","07/08/1914","07/08/1918","21/4/1867","1929",1914-08-07,1918-08-07,0,1,0,0,0,"M",1867-04-21,1867,NA,1929
"458","COL-1918","A2.9-1372",100,"COL","Suarez","07/08/1918","11/11/1921","23/4/1855","1927",1918-08-07,1921-11-11,0,1,0,0,0,"M",1855-04-23,1855,NA,1927
"459","COL-1921","A2.9-1375",100,"COL","J. Holguin","11/11/1921","07/08/1922","30/10/1848","1928",1921-11-11,1922-08-07,0,1,0,1,0,"M",1848-10-30,1848,NA,1928
"460","COL-1922","A2.9-1378",100,"COL","Nel Ospina","07/08/1922","07/08/1926","18/9/1858","1927",1922-08-07,1926-08-07,0,1,0,0,0,"M",1858-09-18,1858,NA,1927
"461","COL-1926","A2.9-1381",100,"COL","Abadia Mendez","07/08/1926","07/08/1930","5/6/1867","1947",1926-08-07,1930-08-07,0,1,0,0,0,"M",1867-06-05,1867,NA,1947
"462","COL-1930","A2.9-1384",100,"COL","Olaya Herrera","07/08/1930","07/08/1934","1881","1937",1930-08-07,1934-08-07,0,1,0,0,0,"M",NA,1881,NA,1937
"463","COL-1934","A2.9-1387",100,"COL","Lopez Pumarejo","07/08/1934","07/08/1938","31/1/1886","20/11/1959",1934-08-07,1938-08-07,0,1,0,0,0,"M",1886-01-31,1886,1959-11-20,1959
"464","COL-1938","A2.9-1390",100,"COL","Santos","07/08/1938","07/08/1942","1888","1974",1938-08-07,1942-08-07,0,1,0,0,0,"M",NA,1888,NA,1974
"465","COL-1942","A2.9-1393",100,"COL","Lopez Pumarejo","07/08/1942","07/08/1945","31/1/1886","20/11/1959",1942-08-07,1945-08-07,0,1,0,1,0,"M",1886-01-31,1886,1959-11-20,1959
"466","COL-1945","A2.9-1396",100,"COL","Lleras Camargo","07/08/1945","07/08/1946","3/7/1906","04/01/1990",1945-08-07,1946-08-07,0,1,0,0,0,"M",1906-07-03,1906,1990-01-04,1990
"467","COL-1946","A2.9-1399",100,"COL","Ospina Perez","07/08/1946","07/08/1950","24/11/1891","14/04/1976",1946-08-07,1950-08-07,0,1,0,0,0,"M",1891-11-24,1891,1976-04-14,1976
"468","COL-1950","A2.9-1402",100,"COL","Laureanco Gomez","07/08/1950","05/11/1951","20/2/1889","13/07/1965",1950-08-07,1951-11-05,0,1,0,0,0,"M",1889-02-20,1889,1965-07-13,1965
"469","COL-1951","A2.9-1405",100,"COL","Roberto Urdaneta Arbelaez","05/11/1951","13/06/1953","1890","1972",1951-11-05,1953-06-13,0,1,0,0,0,"M",NA,1890,NA,1972
"470","COL-1953-1","A2.9-1408",100,"COL","Laureanco Gomez","13/06/1953","13/06/1953","20/2/1889","13/07/1965",1953-06-13,1953-06-13,0,3,6,1,1,"M",1889-02-20,1889,1965-07-13,1965
"471","COL-1953-2","A2.9-1411",100,"COL","Rojas Pinillia","13/06/1953","10/05/1957","12/3/1900","1975",1953-06-13,1957-05-10,1,3,16,0,1,"M",1900-03-12,1900,NA,1975
"472","COL-1957","A2.9-1414",100,"COL","Paris","10/05/1957","07/08/1958","1910","-999",1957-05-10,1958-08-07,1,1,0,0,0,"M",NA,1910,NA,NA
"473","COL-1958","A2.9-1417",100,"COL","Lleras Camargo","07/08/1958","07/08/1962","3/7/1906","04/01/1990",1958-08-07,1962-08-07,0,1,0,1,0,"M",1906-07-03,1906,1990-01-04,1990
"474","COL-1962","A2.9-1420",100,"COL","Guillermo-Leon","07/08/1962","07/08/1966","1909","1971",1962-08-07,1966-08-07,0,1,0,0,0,"M",NA,1909,NA,1971
"475","COL-1966","A2.9-1423",100,"COL","Lleras Restropo","07/08/1966","07/08/1970","12/4/1908","27/09/1994",1966-08-07,1970-08-07,0,1,0,0,0,"M",1908-04-12,1908,1994-09-27,1994
"476","COL-1970","A2.9-1426",100,"COL","Pastrana Borrero","07/08/1970","07/08/1974","12/11/1923","21/08/1997",1970-08-07,1974-08-07,0,1,0,0,0,"M",1923-11-12,1923,1997-08-21,1997
"477","COL-1974","A2.9-1429",100,"COL","Lopez Michelsen","07/08/1974","07/08/1978","30/6/1913","-777",1974-08-07,1978-08-07,0,1,0,0,0,"M",1913-06-30,1913,NA,-777
"478","COL-1978","A2.9-1432",100,"COL","Turbay","07/08/1978","07/08/1982","18/6/1916","2005",1978-08-07,1982-08-07,0,1,0,0,0,"M",1916-06-18,1916,NA,2005
"479","COL-1982","A2.9-1435",100,"COL","Betancur","07/08/1982","07/08/1986","1923","-777",1982-08-07,1986-08-07,0,1,0,0,0,"M",NA,1923,NA,-777
"480","COL-1986","A2.9-1438",100,"COL","Vargas","07/08/1986","07/08/1990","17/9/1921","1997",1986-08-07,1990-08-07,0,1,0,0,0,"M",1921-09-17,1921,NA,1997
"481","COL-1990","A2.9-1441",100,"COL","Trujillo","07/08/1990","07/08/1994","31/3/1947","-777",1990-08-07,1994-08-07,0,1,0,0,0,"M",1947-03-31,1947,NA,-777
"482","COL-1994","A2.9-1444",100,"COL","Pizano","07/08/1994","07/08/1998","1950","-777",1994-08-07,1998-08-07,0,1,0,0,0,"M",NA,1950,NA,-777
"483","COL-1998","A2.9-1447",100,"COL","Arango","07/08/1998","07/08/2002","1954","-777",1998-08-07,2002-08-07,0,1,0,0,0,"M",NA,1954,NA,-777
"484","COL-2002","A2.9-1450",100,"COL","Alvaro Uribe Velez","08/08/2002","31/12/2004","1952","-777",2002-08-08,2004-12-31,0,-888,0,0,-888,"M",NA,1952,NA,-777
"485","VEN-1870","A2.9-1453",101,"VEN","Guzman Blanco","27/04/1870","20/02/1877","20/2/1829","1899",1870-04-27,1877-02-20,1,1,0,0,0,"M",1829-02-20,1829,NA,1899
"486","VEN-1877-1","A2.9-1456",101,"VEN","Jacinto Guitierrez Martinez de Aleman","21/02/1877","02/03/1877","1808","1884",1877-02-21,1877-03-02,0,1,0,0,-666,"M",NA,1808,NA,1884
"487","VEN-1877-2","A2.9-1459",101,"VEN","Linares Alcantara","02/03/1877","20/11/1878","1825","30/11/1878",1877-03-02,1878-11-20,0,2,0,0,-777,"M",NA,1825,1878-11-30,1878
"488","VEN-1878","A2.9-1462",101,"VEN","Jacinto Guitierrez Martinez de Aleman","20/11/1878","01/01/1879","1808","1884",1878-11-20,1879-01-01,0,3,-999,1,1,"M",NA,1808,NA,1884
"489","VEN-1879","A2.9-1465",101,"VEN","Guzman Blanco","26/02/1879","27/04/1884","20/2/1829","1899",1879-02-26,1884-04-27,0,1,0,1,0,"M",1829-02-20,1829,NA,1899
"490","VEN-1884","A2.9-1468",101,"VEN","Joaquin Crespo","27/04/1884","27/04/1886","22/8/1841","15/04/1898",1884-04-27,1886-04-27,0,1,0,0,0,"M",1841-08-22,1841,1898-04-15,1898
"491","VEN-1886-1","A2.9-1471",101,"VEN","Antonio Diez","27/04/1886","15/09/1886","1838","1916",1886-04-27,1886-09-15,0,1,0,0,-666,"M",NA,1838,NA,1916
"492","VEN-1886-2","A2.9-1474",101,"VEN","Guzman Blanco","15/09/1886","08/08/1887","20/2/1829","1899",1886-09-15,1887-08-08,0,1,0,2,0,"M",1829-02-20,1829,NA,1899
"493","VEN-1887","A2.9-1477",101,"VEN","Lopez","08/08/1887","05/07/1888","-999","-999",1887-08-08,1888-07-05,0,1,0,0,0,"M",NA,NA,NA,NA
"494","VEN-1888","A2.9-1480",101,"VEN","Rojas Paul","05/07/1888","19/03/1890","26/11/1826","1905",1888-07-05,1890-03-19,0,1,0,0,0,"M",1826-11-26,1826,NA,1905
"495","VEN-1890","A2.9-1483",101,"VEN","Palacio","19/03/1890","17/06/1892","6/2/1843","1900",1890-03-19,1892-06-17,0,3,-999,0,1,"M",1843-02-06,1843,NA,1900
"496","VEN-1892-1","A2.9-1486",101,"VEN","Tell Villegas","17/06/1892","02/09/1892","1823","1907",1892-06-17,1892-09-02,1,3,-999,0,1,"M",NA,1823,NA,1907
"497","VEN-1892-2","A2.9-1489",101,"VEN","Tell Villegas Pulido","02/09/1892","06/10/1892","1854","1949",1892-09-02,1892-10-06,0,3,-999,0,1,"M",NA,1854,NA,1949
"498","VEN-1892-3","A2.9-1492",101,"VEN","Joaquin Crespo","07/10/1892","28/02/1894","22/8/1841","15/04/1898",1892-10-07,1894-02-28,1,1,0,1,0,"M",1841-08-22,1841,1898-04-15,1898
"499","VEN-1894-1","A2.9-1495",101,"VEN","Guzman Alvarez","28/02/1894","14/03/1894","1830","1912",1894-02-28,1894-03-14,0,1,0,0,0,"M",NA,1830,NA,1912
"500","VEN-1894-2","A2.9-1498",101,"VEN","Joaquin Crespo","14/04/1894","20/02/1898","22/8/1841","15/04/1898",1894-04-14,1898-02-20,0,1,0,2,3,"M",1841-08-22,1841,1898-04-15,1898
"501","VEN-1898-1","A2.9-1501",101,"VEN","Guzman Alvarez","20/02/1898","28/02/1898","1830","1912",1898-02-20,1898-02-28,0,1,0,1,0,"M",NA,1830,NA,1912
"502","VEN-1898-2","A2.9-1504",101,"VEN","Andrade","28/02/1898","20/10/1899","1839","1925",1898-02-28,1899-10-20,1,3,-999,0,1,"M",NA,1839,NA,1925
"503","VEN-1899","A2.9-1507",101,"VEN","Cipriano Castro","21/10/1899","10/12/1908","12/10/1858","1924",1899-10-21,1908-12-10,1,3,-999,0,1,"M",1858-10-12,1858,NA,1924
"504","VEN-1908","A2.9-1510",101,"VEN","Gomez","19/12/1908","18/12/1935","24/7/1857","1935",1908-12-19,1935-12-18,1,2,0,0,-777,"M",1857-07-24,1857,NA,1935
"505","VEN-1935","A2.9-1513",101,"VEN","Lopez Contreras","18/12/1935","15/04/1941","5/5/1883","1973",1935-12-18,1941-04-15,0,1,0,0,0,"M",1883-05-05,1883,NA,1973
"506","VEN-1941","A2.9-1516",101,"VEN","Medina Angarita","05/05/1941","18/10/1945","6/7/1897","1953",1941-05-05,1945-10-18,0,3,6,0,1,"M",1897-07-06,1897,NA,1953
"507","VEN-1945","A2.9-1519",101,"VEN","Betancourt","18/10/1945","15/02/1948","22/2/1908","28/09/1981",1945-10-18,1948-02-15,1,1,0,0,1,"M",1908-02-22,1908,1981-09-28,1981
"508","VEN-1948-1","A2.9-1522",101,"VEN","Gallegos","15/02/1948","24/11/1948","2/8/1884","1969",1948-02-15,1948-11-24,0,3,6,0,1,"M",1884-08-02,1884,NA,1969
"509","VEN-1948-2","A2.9-1525",101,"VEN","Delgado Chalbaud","24/11/1948","13/11/1950","1909","1950",1948-11-24,1950-11-13,1,3,4,0,3,"M",NA,1909,NA,1950
"510","VEN-1950","A2.9-1528",101,"VEN","Perez Jimenez","13/11/1950","23/01/1958","25/4/1914","20/09/2001",1950-11-13,1958-01-23,0,3,2,0,1,"M",1914-04-25,1914,2001-09-20,2001
"511","VEN-1958-1","A2.9-1531",101,"VEN","Larrazabal","23/01/1958","14/11/1958","5/3/1911","2003",1958-01-23,1958-11-14,1,1,0,0,0,"M",1911-03-05,1911,NA,2003
"512","VEN-1958-2","A2.9-1534",101,"VEN","Sanabria","14/11/1958","13/02/1959","1911","1989",1958-11-14,1959-02-13,0,1,0,0,0,"M",NA,1911,NA,1989
"513","VEN-1959","A2.9-1537",101,"VEN","Betancourt","13/02/1959","01/12/1963","22/2/1908","28/09/1981",1959-02-13,1963-12-01,0,1,0,1,1,"M",1908-02-22,1908,1981-09-28,1981
"514","VEN-1963","A2.9-1540",101,"VEN","Leoni","01/12/1963","11/03/1969","26/4/1905","-777",1963-12-01,1969-03-11,0,1,0,0,0,"M",1905-04-26,1905,NA,-777
"515","VEN-1969","A2.9-1543",101,"VEN","Caldera Rodriguez","11/03/1969","12/03/1974","24/1/1916","-777",1969-03-11,1974-03-12,0,1,0,0,0,"M",1916-01-24,1916,NA,-777
"516","VEN-1974","A2.9-1546",101,"VEN","Andres Perez","12/03/1974","12/03/1979","27/10/1922","-777",1974-03-12,1979-03-12,0,1,0,0,0,"M",1922-10-27,1922,NA,-777
"517","VEN-1979","A2.9-1549",101,"VEN","Campins","12/03/1979","02/02/1984","4/5/1925","-777",1979-03-12,1984-02-02,0,1,0,0,0,"M",1925-05-04,1925,NA,-777
"518","VEN-1984","A2.9-1552",101,"VEN","Lusinchi","02/02/1984","02/02/1989","27/4/1924","-777",1984-02-02,1989-02-02,0,1,0,0,0,"M",1924-04-27,1924,NA,-777
"519","VEN-1989","A2.9-1555",101,"VEN","Andres Perez","02/02/1989","31/08/1993","27/10/1922","-777",1989-02-02,1993-08-31,0,1,0,1,2,"M",1922-10-27,1922,NA,-777
"520","VEN-1993","A2.9-1558",101,"VEN","Velasquez","31/08/1993","02/02/1994","1916","-777",1993-08-31,1994-02-02,0,1,0,0,0,"M",NA,1916,NA,-777
"521","VEN-1994","A2.9-1561",101,"VEN","Caldera Rodriguez","02/02/1994","02/02/1999","24/1/1916","-777",1994-02-02,1999-02-02,0,1,0,1,0,"M",1916-01-24,1916,NA,-777
"522","VEN-1999","A2.9-1564",101,"VEN","Hugo Chavez","02/02/1999","31/12/2004","28/7/1954","-777",1999-02-02,2004-12-31,0,-888,0,0,-888,"M",1954-07-28,1954,NA,-777
"523","GUY-1966","A2.9-1567",110,"GUY","Burnham","26/05/1966","06/08/1985","20/2/1923","06/08/1985",1966-05-26,1985-08-06,0,2,0,0,-777,"M",1923-02-20,1923,1985-08-06,1985
"524","GUY-1985","A2.9-1570",110,"GUY","Hoyte","06/08/1985","09/10/1992","9/3/1929","22/12/2002",1985-08-06,1992-10-09,0,1,0,0,0,"M",1929-03-09,1929,2002-12-22,2002
"525","GUY-1992","A2.9-1573",110,"GUY","Jagan Cheddi","09/10/1992","06/03/1997","22/3/1918","06/03/1997",1992-10-09,1997-03-06,0,2,0,0,-777,"M",1918-03-22,1918,1997-03-06,1997
"526","GUY-1997-1","A2.9-1576",110,"GUY","Samuel Hinds","06/03/1997","19/12/1997","27/12/1943","-777",1997-03-06,1997-12-19,0,1,0,0,0,"M",1943-12-27,1943,NA,-777
"527","GUY-1997-2","A2.9-1579",110,"GUY","Janet Jagan","19/12/1997","11/08/1999","20/10/1920","-777",1997-12-19,1999-08-11,0,2.1,0,0,0,"F",1920-10-20,1920,NA,-777
"528","GUY-1999","A2.9-1582",110,"GUY","Bharrat Jagdeo","11/08/1999","31/12/2004","23/1/1964","-777",1999-08-11,2004-12-31,0,-888,0,0,-888,"M",1964-01-23,1964,NA,-777
"529","SUR-1975","A2.9-1585",115,"SUR","Ferrier","25/11/1975","13/08/1980","12/5/1910","-777",1975-11-25,1980-08-13,0,3,6,0,1,"M",1910-05-12,1910,NA,-777
"530","SUR-1980","A2.9-1588",115,"SUR","Bouterse","13/08/1980","25/01/1988","1946","-777",1980-08-13,1988-01-25,1,1,0,0,0,"M",NA,1946,NA,-777
"531","SUR-1988","A2.9-1591",115,"SUR","Shankar","25/01/1988","24/12/1990","1937","-777",1988-01-25,1990-12-24,0,3,6,0,0,"M",NA,1937,NA,-777
"532","SUR-1990-1","A2.9-1594",115,"SUR","Graanoogst","24/12/1990","29/12/1990","-999","-999",1990-12-24,1990-12-29,1,1,0,0,0,"M",NA,NA,NA,NA
"533","SUR-1990-2","A2.9-1597",115,"SUR","Kraag","29/12/1990","16/09/1991","1913","1996",1990-12-29,1991-09-16,0,1,0,0,0,"M",NA,1913,NA,1996
"534","SUR-1991","A2.9-1600",115,"SUR","Venetiaan","16/09/1991","15/09/1996","1936","-777",1991-09-16,1996-09-15,0,1,0,0,0,"M",NA,1936,NA,-777
"535","SUR-1996","A2.9-1603",115,"SUR","Wijdenbosch","15/09/1996","12/08/2000","1941","-777",1996-09-15,2000-08-12,0,1,0,0,0,"M",NA,1941,NA,-777
"536","SUR-2000","A2.9-1606",115,"SUR","Venetiaan","12/08/2000","31/12/2004","1936","-777",2000-08-12,2004-12-31,0,-888,0,1,-888,"M",NA,1936,NA,-777
"537","ECU-1869","A2.9-1609",130,"ECU","Moreno","19/01/1869","06/08/1875","24/12/1821","06/08/1875",1869-01-19,1875-08-06,1,3,-999,0,3,"M",1821-12-24,1821,1875-08-06,1875
"538","ECU-1875","A2.9-1612",130,"ECU","Borrero y Cortazar","09/10/1875","08/09/1876","28/10/1827","1911",1875-10-09,1876-09-08,0,3,-999,0,1,"M",1827-10-28,1827,NA,1911
"539","ECU-1876","A2.9-1615",130,"ECU","Veintemilla","08/09/1876","09/07/1883","1823","1908",1876-09-08,1883-07-09,1,3,-999,0,1,"M",NA,1823,NA,1908
"540","ECU-1883-1","A2.9-1618",130,"ECU","Aloy Alfaro Delgado","09/07/1883","11/10/1883","25/6/1842","1912",1883-07-09,1883-10-11,1,1,0,0,1,"M",1842-06-25,1842,NA,1912
"541","ECU-1883-2","A2.9-1621",130,"ECU","Borrero y Cortazar","11/10/1883","15/10/1883","1827","1911",1883-10-11,1883-10-15,0,1,0,1,0,"M",NA,1827,NA,1911
"542","ECU-1883-3","A2.9-1624",130,"ECU","Perez Pareja","15/10/1883","23/11/1883","-999","1897",1883-10-15,1883-11-23,0,1,0,0,-666,"M",NA,NA,NA,1897
"543","ECU-1883-4","A2.9-1627",130,"ECU","Caamano","23/11/1883","30/06/1888","1837","1907",1883-11-23,1888-06-30,0,1,0,0,0,"M",NA,1837,NA,1907
"544","ECU-1888","A2.9-1630",130,"ECU","Flores","03/08/1888","01/07/1892","1833","1915",1888-08-03,1892-07-01,0,1,0,0,1,"M",NA,1833,NA,1915
"545","ECU-1892","A2.9-1633",130,"ECU","Cordero","01/07/1892","16/04/1895","6/4/1833","1912",1892-07-01,1895-04-16,0,3,-999,0,1,"M",1833-04-06,1833,NA,1912
"546","ECU-1895","A2.9-1636",130,"ECU","Aloy Alfaro Delgado","16/04/1895","31/08/1901","25/6/1842","1912",1895-04-16,1901-08-31,1,1,0,1,0,"M",1842-06-25,1842,NA,1912
"547","ECU-1901","A2.9-1639",130,"ECU","Plaza Gutierrez","01/09/1901","31/08/1905","18/4/1865","1932",1901-09-01,1905-08-31,0,1,0,0,1,"M",1865-04-18,1865,NA,1932
"548","ECU-1905","A2.9-1642",130,"ECU","Garcia","01/09/1905","15/01/1906","1842","1927",1905-09-01,1906-01-15,0,3,-999,0,1,"M",NA,1842,NA,1927
"549","ECU-1906","A2.9-1645",130,"ECU","Aloy Alfaro Delgado","17/01/1906","11/08/1911","25/6/1842","1932",1906-01-17,1911-08-11,1,3,-999,2,3,"M",1842-06-25,1842,NA,1932
"550","ECU-1911-1","A2.9-1648",130,"ECU","Freile","11/08/1911","31/08/1911","1851","1926",1911-08-11,1911-08-31,0,1,0,0,1,"M",NA,1851,NA,1926
"551","ECU-1911-2","A2.9-1651",130,"ECU","E. Estrada","01/09/1911","22/12/1911","28/5/1855","22/12/1911",1911-09-01,1911-12-22,0,2,0,0,-777,"M",1855-05-28,1855,1911-12-22,1911
"552","ECU-1911-3","A2.9-1654",130,"ECU","Freile","22/12/1911","06/03/1912","1851","1926",1911-12-22,1912-03-06,0,1,0,1,1,"M",NA,1851,NA,1926
"553","ECU-1912-1","A2.9-1657",130,"ECU","Andrade Marin","06/03/1912","10/08/1912","1841","1935",1912-03-06,1912-08-10,0,1,0,0,-666,"M",NA,1841,NA,1935
"554","ECU-1912-2","A2.9-1660",130,"ECU","Alfredo Baquerizo Moreno","10/08/1912","01/09/1912","28/9/1859","1951",1912-08-10,1912-09-01,0,1,0,0,0,"M",1859-09-28,1859,NA,1951
"555","ECU-1912-3","A2.9-1663",130,"ECU","Plaza Gutierrez","01/09/1912","01/09/1916","18/4/1865","1932",1912-09-01,1916-09-01,0,1,0,1,0,"M",1865-04-18,1865,NA,1932
"556","ECU-1916","A2.9-1666",130,"ECU","Alfredo Baquerizo Moreno","01/09/1916","01/09/1920","28/9/1859","1951",1916-09-01,1920-09-01,0,1,0,1,0,"M",1859-09-28,1859,NA,1951
"557","ECU-1920","A2.9-1669",130,"ECU","Tamayo","01/09/1920","01/09/1924","29/7/1858","1947",1920-09-01,1924-09-01,0,1,0,0,0,"M",1858-07-29,1858,NA,1947
"558","ECU-1924","A2.9-1672",130,"ECU","Cordova","01/09/1924","09/07/1925","15/7/1863","1928",1924-09-01,1925-07-09,0,3,6,0,1,"M",1863-07-15,1863,NA,1928
"559","ECU-1925","A2.9-1675",130,"ECU","Ayora","09/07/1925","24/08/1931","31/8/1879","1978",1925-07-09,1931-08-24,1,3,6,0,1,"M",1879-08-31,1879,NA,1978
"560","ECU-1931-1","A2.9-1678",130,"ECU","Larrea Alba","24/08/1931","15/10/1931","25/10/1895","1980",1931-08-24,1931-10-15,1,3,6,0,1,"M",1895-10-25,1895,NA,1980
"561","ECU-1931-2","A2.9-1681",130,"ECU","Alfredo Baquerizo Moreno","15/10/1931","27/08/1932","28/9/1859","1951",1931-10-15,1932-08-27,1,3,6,2,2,"M",1859-09-28,1859,NA,1951
"562","ECU-1932-1","A2.9-1684",130,"ECU","Freile Larrea","27/08/1932","02/09/1932","1892","1942",1932-08-27,1932-09-02,0,1,0,0,0,"M",NA,1892,NA,1942
"563","ECU-1932-2","A2.9-1687",130,"ECU","Guerrero Martin","02/09/1932","06/12/1932","1878","1941",1932-09-02,1932-12-06,0,1,0,0,-666,"M",NA,1878,NA,1941
"564","ECU-1932-3","A2.9-1690",130,"ECU","Martinez Mera","06/12/1932","18/10/1933","9/3/1875","1955",1932-12-06,1933-10-18,0,1,0,0,-666,"M",1875-03-09,1875,NA,1955
"565","ECU-1933","A2.9-1693",130,"ECU","Montalvo","20/10/1933","31/08/1934","1/6/1876","1950",1933-10-20,1934-08-31,1,1,0,0,0,"M",1876-06-01,1876,NA,1950
"566","ECU-1934","A2.9-1696",130,"ECU","Velasco Ibarra","01/09/1934","21/08/1935","19/3/1893","30/03/1979",1934-09-01,1935-08-21,0,3,6,0,2,"M",1893-03-19,1893,1979-03-30,1979
"567","ECU-1935-1","A2.9-1699",130,"ECU","Pons","21/08/1935","26/09/1935","10/11/1897","1980",1935-08-21,1935-09-26,1,3,16,0,-666,"M",1897-11-10,1897,NA,1980
"568","ECU-1935-2","A2.9-1702",130,"ECU","Paez","26/09/1935","23/10/1937","6/6/1876","1974",1935-09-26,1937-10-23,1,3,16,0,1,"M",1876-06-06,1876,NA,1974
"569","ECU-1937","A2.9-1705",130,"ECU","Enriquez Gallo","23/10/1937","10/08/1938","24/7/1895","1962",1937-10-23,1938-08-10,1,1,0,0,0,"M",1895-07-24,1895,NA,1962
"570","ECU-1938-1","A2.9-1708",130,"ECU","Manuel Maria Borrero","10/08/1938","02/12/1938","1883","1975",1938-08-10,1938-12-02,0,1,0,0,0,"M",NA,1883,NA,1975
"571","ECU-1938-2","A2.9-1711",130,"ECU","Mosquera Narvaez","03/12/1938","19/11/1939","2/8/1883","19/11/1939",1938-12-03,1939-11-19,0,2,0,0,-777,"M",1883-08-02,1883,1939-11-19,1939
"572","ECU-1939-1","A2.9-1714",130,"ECU","Arroyo del Rio","19/11/1939","10/12/1939","27/11/1893","1969",1939-11-19,1939-12-10,0,1,0,0,0,"M",1893-11-27,1893,NA,1969
"573","ECU-1939-2","A2.9-1717",130,"ECU","Cordova Nieto","11/12/1939","10/08/1940","8/5/1892","1983",1939-12-11,1940-08-10,0,1,0,0,0,"M",1892-05-08,1892,NA,1983
"574","ECU-1940-1","A2.9-1720",130,"ECU","Moreno","10/08/1940","31/08/1940","20/10/1880","1952",1940-08-10,1940-08-31,0,1,0,0,0,"M",1880-10-20,1880,NA,1952
"575","ECU-1940-2","A2.9-1723",130,"ECU","Arroyo del Rio","01/09/1940","29/05/1944","27/11/1893","1952",1940-09-01,1944-05-29,0,3,6,1,1,"M",1893-11-27,1893,NA,1952
"576","ECU-1944-1","A2.9-1726",130,"ECU","Navarro Allende","29/05/1944","30/05/1944","-999","-999",1944-05-29,1944-05-30,0,3,6,1,2,"M",NA,NA,NA,NA
"577","ECU-1944-2","A2.9-1729",130,"ECU","Larrea Alba","30/05/1944","31/05/1944","25/10/1895","1980",1944-05-30,1944-05-31,1,1,6,1,1,"M",1895-10-25,1895,NA,1980
"578","ECU-1944-3","A2.9-1732",130,"ECU","Velasco Ibarra","31/05/1944","23/08/1947","19/3/1893","30/03/1979",1944-05-31,1947-08-23,1,3,6,1,1,"M",1893-03-19,1893,1979-03-30,1979
"579","ECU-1947-1","A2.9-1735",130,"ECU","Mancheno","24/08/1947","03/09/1947","1902","1996",1947-08-24,1947-09-03,1,3,6,0,1,"M",NA,1902,NA,1996
"580","ECU-1947-2","A2.9-1738",130,"ECU","Suarez","03/09/1947","17/09/1947","1897","1980",1947-09-03,1947-09-17,1,1,0,0,0,"M",NA,1897,NA,1980
"581","ECU-1947-3","A2.9-1741",130,"ECU","Arosemana Tola","17/09/1947","21/08/1948","1894","1952",1947-09-17,1948-08-21,0,1,0,0,0,"M",NA,1894,NA,1952
"582","ECU-1948","A2.9-1744",130,"ECU","Plaza Lasso","01/09/1948","01/09/1952","17/2/1906","28/01/1987",1948-09-01,1952-09-01,0,1,0,0,0,"M",1906-02-17,1906,1987-01-28,1987
"583","ECU-1952","A2.9-1747",130,"ECU","Velasco Ibarra","01/09/1952","01/09/1956","19/3/1893","30/03/1979",1952-09-01,1956-09-01,0,1,0,2,1,"M",1893-03-19,1893,1979-03-30,1979
"584","ECU-1956","A2.9-1750",130,"ECU","Ponce Enriquez","01/09/1956","01/09/1960","31/1/1912","1976",1956-09-01,1960-09-01,0,1,0,0,1,"M",1912-01-31,1912,NA,1976
"585","ECU-1960","A2.9-1753",130,"ECU","Velasco Ibarra","01/09/1960","07/11/1961","19/3/1893","30/03/1979",1960-09-01,1961-11-07,0,3,6,3,1,"M",1893-03-19,1893,1979-03-30,1979
"586","ECU-1961","A2.9-1756",130,"ECU","Arosemena Monroy","07/11/1961","11/07/1963","1919","2004",1961-11-07,1963-07-11,1,3,6,0,1,"M",NA,1919,NA,2004
"587","ECU-1963","A2.9-1759",130,"ECU","Castro","11/07/1963","29/03/1966","1915","1984",1963-07-11,1966-03-29,1,3,2,0,1,"M",NA,1915,NA,1984
"588","ECU-1966-1","A2.9-1762",130,"ECU","Yerovi Indaburu","29/03/1966","16/11/1966","1904","1981",1966-03-29,1966-11-16,1,1,0,0,0,"M",NA,1904,NA,1981
"589","ECU-1966-2","A2.9-1765",130,"ECU","Arosemena Gomez","16/11/1966","01/09/1968","19/7/1925","20/04/1984",1966-11-16,1968-09-01,0,1,0,0,0,"M",1925-07-19,1925,1984-04-20,1984
"590","ECU-1968","A2.9-1768",130,"ECU","Velasco Ibarra","01/09/1968","15/02/1972","19/3/1893","30/03/1979",1968-09-01,1972-02-15,0,3,6,4,1,"M",1893-03-19,1893,1979-03-30,1979
"591","ECU-1972","A2.9-1771",130,"ECU","Rodriguez Lara","15/02/1972","11/01/1976","4/11/1923","-777",1972-02-15,1976-01-11,1,3,6,0,0,"M",1923-11-04,1923,NA,-777
"592","ECU-1976","A2.9-1774",130,"ECU","Poveda Burbano","11/01/1976","10/08/1979","1926","07/06/1990",1976-01-11,1979-08-10,1,1,0,0,0,"M",NA,1926,1990-06-07,1990
"593","ECU-1979","A2.9-1777",130,"ECU","Roldos Aquilers","10/08/1979","24/05/1981","5/11/1940","1981",1979-08-10,1981-05-24,0,2,0,0,-777,"M",1940-11-05,1940,NA,1981
"594","ECU-1981","A2.9-1780",130,"ECU","Hurtado Larrea","24/05/1981","10/08/1984","1940","-777",1981-05-24,1984-08-10,0,1,0,0,0,"M",NA,1940,NA,-777
"595","ECU-1984","A2.9-1783",130,"ECU","Febres Cordaro","10/08/1984","10/08/1988","9/3/1931","-777",1984-08-10,1988-08-10,0,1,0,0,0,"M",1931-03-09,1931,NA,-777
"596","ECU-1988","A2.9-1786",130,"ECU","Borja Cevallos","10/08/1988","10/08/1992","19/6/1935","-777",1988-08-10,1992-08-10,0,1,0,0,0,"M",1935-06-19,1935,NA,-777
"597","ECU-1992","A2.9-1789",130,"ECU","Duran Ballen","10/08/1992","10/08/1996","14/7/1921","-777",1992-08-10,1996-08-10,0,1,0,0,0,"M",1921-07-14,1921,NA,-777
"598","ECU-1996","A2.9-1792",130,"ECU","Bucaram Ortiz","10/08/1996","06/02/1997","20/2/1952","-777",1996-08-10,1997-02-06,0,1,0,0,1,"M",1952-02-20,1952,NA,-777
"599","ECU-1997-1","A2.9-1795",130,"ECU","Alarcon Fabian","06/02/1997","09/02/1997","14/4/1947","-777",1997-02-06,1997-02-09,0,1,0,0,0,"M",1947-04-14,1947,NA,-777
"600","ECU-1997-2","A2.9-1798",130,"ECU","Arteaga Serrano","09/02/1997","11/02/1997","1956","-777",1997-02-09,1997-02-11,0,1,0,0,0,"F",NA,1956,NA,-777
"601","ECU-1997-3","A2.9-1801",130,"ECU","Alarcon Fabian","11/02/1997","10/08/1998","14/4/1947","-777",1997-02-11,1998-08-10,0,1,0,1,0,"M",1947-04-14,1947,NA,-777
"602","ECU-1998","A2.9-1804",130,"ECU","Mahuad","10/08/1998","21/01/2000","29/7/1949","-777",1998-08-10,2000-01-21,0,3,2,0,1,"M",1949-07-29,1949,NA,-777
"603","ECU-2000","A2.9-1807",130,"ECU","Gustavo Noboa","22/01/2000","15/01/2003","1937","-777",2000-01-22,2003-01-15,1,1,0,0,1,"M",NA,1937,NA,-777
"604","ECU-2003","A2.9-1810",130,"ECU","Lucio Gutierrez","15/01/2003","31/12/2004","1957","-777",2003-01-15,2004-12-31,0,-888,0,0,-888,"M",NA,1957,NA,-777
"605","PER-1872","A2.9-1813",135,"PER","Pardo","02/08/1872","02/08/1876","1834","1878",1872-08-02,1876-08-02,0,1,0,0,1,"M",NA,1834,NA,1878
"606","PER-1876","A2.9-1816",135,"PER","Prado","02/08/1876","17/12/1879","1826","1901",1876-08-02,1879-12-17,0,1,0,0,1,"M",NA,1826,NA,1901
"607","PER-1879-1","A2.9-1819",135,"PER","Luis de la Puerta","17/12/1879","22/12/1879","1795","-999",1879-12-17,1879-12-22,0,3,-999,0,-666,"F",NA,1795,NA,NA
"608","PER-1879-2","A2.9-1822",135,"PER","Pierola","22/12/1879","16/01/1881","1839","1913",1879-12-22,1881-01-16,1,4,-999,0,1,"M",NA,1839,NA,1913
"609","PER-1881-1","A2.9-1825",135,"PER","Francisco Garcia Calderon","22/02/1881","28/09/1881","1834","1905",1881-02-22,1881-09-28,2,4,-999,0,2,"F",NA,1834,NA,1905
"610","PER-1881-2","A2.9-1828",135,"PER","Montero","28/09/1881","30/12/1882","1832","1905",1881-09-28,1882-12-30,1,4,-999,0,1,"F",NA,1832,NA,1905
"611","PER-1882","A2.9-1831",135,"PER","Iglesias","30/12/1882","30/11/1885","1830","1909",1882-12-30,1885-11-30,2,3,-999,0,0,"M",NA,1830,NA,1909
"612","PER-1885","A2.9-1834",135,"PER","Caceres","30/11/1885","10/08/1890","1833","1923",1885-11-30,1890-08-10,1,1,0,0,0,"M",NA,1833,NA,1923
"613","PER-1890","A2.9-1837",135,"PER","Bermudez","10/08/1890","01/04/1894","1836","1894",1890-08-10,1894-04-01,0,2,0,0,-777,"M",NA,1836,NA,1894
"614","PER-1894-1","A2.9-1840",135,"PER","Borgono","01/04/1894","10/08/1894","1836","1921",1894-04-01,1894-08-10,1,1,0,0,0,"M",NA,1836,NA,1921
"615","PER-1894-2","A2.9-1843",135,"PER","Caceres","10/08/1894","19/03/1895","1833","1923",1894-08-10,1895-03-19,0,3,-999,1,1,"M",NA,1833,NA,1923
"616","PER-1895-1","A2.9-1846",135,"PER","de Candamo","21/03/1895","08/09/1895","1841","1904",1895-03-21,1895-09-08,0,3,-999,0,0,"M",NA,1841,NA,1904
"617","PER-1895-2","A2.9-1849",135,"PER","Pierola","08/09/1895","08/09/1899","1839","1913",1895-09-08,1899-09-08,1,1,0,1,0,"M",NA,1839,NA,1913
"618","PER-1899","A2.9-1852",135,"PER","de Romana","08/09/1899","08/09/1903","19/3/1847","1912",1899-09-08,1903-09-08,0,1,0,0,0,"M",1847-03-19,1847,NA,1912
"619","PER-1903","A2.9-1855",135,"PER","de Candamo","30/09/1903","07/05/1904","1841","07/05/1904",1903-09-30,1904-05-07,0,2,0,1,-777,"M",NA,1841,1904-05-07,1904
"620","PER-1904-1","A2.9-1858",135,"PER","Serapio Calderon","07/05/1904","24/09/1904","1843","1922",1904-05-07,1904-09-24,0,1,0,0,0,"M",NA,1843,NA,1922
"621","PER-1904-2","A2.9-1861",135,"PER","Pardo y Barreda","24/09/1904","24/09/1908","24/2/1864","1947",1904-09-24,1908-09-24,0,1,0,0,1,"M",1864-02-24,1864,NA,1947
"622","PER-1908","A2.9-1864",135,"PER","Leguia","24/09/1908","24/09/1912","19/2/1863","06/02/1932",1908-09-24,1912-09-24,0,1,0,0,2,"M",1863-02-19,1863,1932-02-06,1932
"623","PER-1912","A2.9-1867",135,"PER","Billinghurst","24/09/1912","04/02/1914","1851","1915",1912-09-24,1914-02-04,0,3,-999,0,1,"M",NA,1851,NA,1915
"624","PER-1914","A2.9-1870",135,"PER","Benavides","04/02/1914","18/08/1915","18/5/1876","1945",1914-02-04,1915-08-18,1,1,0,0,0,"M",1876-05-18,1876,NA,1945
"625","PER-1915","A2.9-1873",135,"PER","Pardo y Barreda","18/08/1915","04/07/1919","24/2/1864","1947",1915-08-18,1919-07-04,0,3,6,1,2,"M",1864-02-24,1864,NA,1947
"626","PER-1919","A2.9-1876",135,"PER","Leguia","20/07/1919","25/08/1930","19/2/1863","06/02/1932",1919-07-20,1930-08-25,1,3,6,1,2,"M",1863-02-19,1863,1932-02-06,1932
"627","PER-1930-1","A2.9-1879",135,"PER","Ponce Brousset","25/08/1930","27/08/1930","1874","1966",1930-08-25,1930-08-27,1,3,6,0,-666,"M",NA,1874,NA,1966
"628","PER-1930-2","A2.9-1882",135,"PER","Sanchez Cerro","27/08/1930","01/03/1931","1889","1933",1930-08-27,1931-03-01,1,3,6,0,1,"M",NA,1889,NA,1933
"629","PER-1931-1","A2.9-1885",135,"PER","Ricardo Leonicio Elias","01/03/1931","05/03/1931","1874","1951",1931-03-01,1931-03-05,1,3,6,0,0,"M",NA,1874,NA,1951
"630","PER-1931-2","A2.9-1888",135,"PER","Gustavo Jimenez","05/03/1931","10/03/1931","1886","1933",1931-03-05,1931-03-10,1,3,6,0,0,"M",NA,1886,NA,1933
"631","PER-1931-3","A2.9-1891",135,"PER","Samanez Ocampo","10/03/1931","08/12/1931","1866","1947",1931-03-10,1931-12-08,1,1,0,0,0,"M",NA,1866,NA,1947
"632","PER-1931-4","A2.9-1894",135,"PER","Sanchez Cerro","08/12/1931","30/04/1933","1889","1933",1931-12-08,1933-04-30,0,3,11,1,3,"M",NA,1889,NA,1933
"633","PER-1933","A2.9-1897",135,"PER","Benavidez","30/04/1933","08/12/1939","18/5/1876","1945",1933-04-30,1939-12-08,0,1,0,1,0,"M",1876-05-18,1876,NA,1945
"634","PER-1939","A2.9-1900",135,"PER","Ugarteche","08/12/1939","28/07/1945","21/4/1889","1967",1939-12-08,1945-07-28,0,1,0,0,0,"M",1889-04-21,1889,NA,1967
"635","PER-1945","A2.9-1903",135,"PER","Bustamante","28/07/1945","28/10/1948","15/1/1894","11/01/1989",1945-07-28,1948-10-28,0,3,6,0,1,"M",1894-01-15,1894,1989-01-11,1989
"636","PER-1948","A2.9-1906",135,"PER","Odria","29/10/1948","01/06/1950","26/11/1897","18/02/1974",1948-10-29,1950-06-01,1,1,0,0,0,"M",1897-11-26,1897,1974-02-18,1974
"637","PER-1950-1","A2.9-1909",135,"PER","Noriega","01/06/1950","28/07/1950","1900","1957",1950-06-01,1950-07-28,0,1,0,0,0,"M",NA,1900,NA,1957
"638","PER-1950-2","A2.9-1912",135,"PER","Odria","28/07/1950","28/07/1956","26/11/1897","18/02/1974",1950-07-28,1956-07-28,0,1,0,1,1,"M",1897-11-26,1897,1974-02-18,1974
"639","PER-1956","A2.9-1915",135,"PER","Ugarteche","28/07/1956","19/07/1962","21/4/1889","1967",1956-07-28,1962-07-19,0,3,6,1,2,"M",1889-04-21,1889,NA,1967
"640","PER-1962","A2.9-1918",135,"PER","Perez Godoy","19/07/1962","03/03/1963","9/6/1905","1982",1962-07-19,1963-03-03,1,3,16,0,2,"M",1905-06-09,1905,NA,1982
"641","PER-1963-1","A2.9-1921",135,"PER","Lindley Lopez","03/03/1963","28/07/1963","1908","1995",1963-03-03,1963-07-28,1,1,0,0,0,"M",NA,1908,NA,1995
"642","PER-1963-2","A2.9-1924",135,"PER","Belaunde","28/07/1963","03/10/1968","7/10/1913","04/06/2002",1963-07-28,1968-10-03,0,3,6,0,1,"M",1913-10-07,1913,2002-06-04,2002
"643","PER-1968","A2.9-1927",135,"PER","Velasco Alvarado","03/10/1968","29/08/1975","16/6/1910","1977",1968-10-03,1975-08-29,1,3,6,0,0,"M",1910-06-16,1910,NA,1977
"644","PER-1975","A2.9-1930",135,"PER","Morales Bermudez","30/08/1975","28/07/1980","4/10/1921","-777",1975-08-30,1980-07-28,1,1,0,0,0,"M",1921-10-04,1921,NA,-777
"645","PER-1980","A2.9-1933",135,"PER","Belaunde","28/07/1980","28/07/1985","7/10/1913","04/06/2002",1980-07-28,1985-07-28,0,1,0,1,0,"M",1913-10-07,1913,2002-06-04,2002
"646","PER-1985","A2.9-1936",135,"PER","Garcia Perez","28/07/1985","28/07/1990","23/5/1949","-777",1985-07-28,1990-07-28,0,1,0,0,0,"M",1949-05-23,1949,NA,-777
"647","PER-1990","A2.9-1939",135,"PER","Fujimori","28/07/1990","22/11/2000","28/7/1938","-777",1990-07-28,2000-11-22,0,1,0,0,1,"M",1938-07-28,1938,NA,-777
"648","PER-2000","A2.9-1942",135,"PER","Valentin Paniagua","23/11/2000","28/07/2001","1936","2006",2000-11-23,2001-07-28,0,1,0,0,0,"M",NA,1936,NA,2006
"649","PER-2001","A2.9-1945",135,"PER","Alejandro Toledo","28/07/2001","31/12/2004","1946","-777",2001-07-28,2004-12-31,0,-888,0,0,-888,"M",NA,1946,NA,-777
"650","BRA-1840","A2.9-1948",140,"BRA","Pedro II","23/07/1840","15/11/1889","2/12/1825","05/12/1891",1840-07-23,1889-11-15,0,3,-999,0,1,"M",1825-12-02,1825,1891-12-05,1891
"651","BRA-1889","A2.9-1951",140,"BRA","M. D. da Fonseca","15/11/1889","23/11/1891","1823","1892",1889-11-15,1891-11-23,1,3,-999,0,0,"M",NA,1823,NA,1892
"652","BRA-1891","A2.9-1954",140,"BRA","Peixoto","23/11/1891","15/11/1894","30/4/1839","1895",1891-11-23,1894-11-15,0,1,0,0,0,"M",1839-04-30,1839,NA,1895
"653","BRA-1894","A2.9-1957",140,"BRA","de Moraes Barros","15/11/1894","15/11/1898","4/10/1841","1902",1894-11-15,1898-11-15,0,1,0,0,0,"M",1841-10-04,1841,NA,1902
"654","BRA-1898","A2.9-1960",140,"BRA","de Campos Salles","15/11/1898","15/11/1902","1841","1913",1898-11-15,1902-11-15,0,1,0,0,0,"M",NA,1841,NA,1913
"655","BRA-1902","A2.9-1963",140,"BRA","Rodriguez Alves","15/11/1902","15/11/1906","7/7/1848","1919",1902-11-15,1906-11-15,0,1,0,0,0,"M",1848-07-07,1848,NA,1919
"656","BRA-1906","A2.9-1966",140,"BRA","Moreira Penna","15/11/1906","14/06/1909","30/11/1847","1909",1906-11-15,1909-06-14,0,2,0,0,-777,"M",1847-11-30,1847,NA,1909
"657","BRA-1909","A2.9-1969",140,"BRA","Pecanha","14/06/1909","15/11/1910","2/10/1867","1924",1909-06-14,1910-11-15,0,1,0,0,0,"M",1867-10-02,1867,NA,1924
"658","BRA-1910","A2.9-1972",140,"BRA","H. R. da Fonseca","15/11/1910","15/11/1914","12/5/1885","1923",1910-11-15,1914-11-15,0,1,0,0,0,"M",1885-05-12,1885,NA,1923
"659","BRA-1914","A2.9-1975",140,"BRA","Braz Pereira Gomez","15/11/1914","15/11/1918","26/2/1868","1966",1914-11-15,1918-11-15,0,1,0,0,0,"M",1868-02-26,1868,NA,1966
"660","BRA-1918","A2.9-1978",140,"BRA","da Costa Ribeiro","15/11/1918","28/07/1919","7/11/1868","01/07/1920",1918-11-15,1919-07-28,0,1,0,0,0,"M",1868-11-07,1868,1920-07-01,1920
"661","BRA-1919","A2.9-1981",140,"BRA","de Silva Pessoa","28/07/1919","15/11/1922","23/5/1865","1942",1919-07-28,1922-11-15,0,1,0,0,0,"M",1865-05-23,1865,NA,1942
"662","BRA-1922","A2.9-1984",140,"BRA","de Silva Bernar","15/11/1922","15/11/1926","8/8/1875","1955",1922-11-15,1926-11-15,0,1,0,0,1,"M",1875-08-08,1875,NA,1955
"663","BRA-1926","A2.9-1987",140,"BRA","de Souza","15/11/1926","24/10/1930","26/10/1870","04/08/1957",1926-11-15,1930-10-24,0,3,6,0,2,"M",1870-10-26,1870,1957-08-04,1957
"664","BRA-1930","A2.9-1990",140,"BRA","Vargas","25/10/1930","30/10/1945","19/4/1883","24/08/1954",1930-10-25,1945-10-30,1,3,6,0,0,"M",1883-04-19,1883,1954-08-24,1954
"665","BRA-1945","A2.9-1993",140,"BRA","Linhares","30/10/1945","31/01/1946","28/1/1886","1957",1945-10-30,1946-01-31,0,1,0,0,0,"M",1886-01-28,1886,NA,1957
"666","BRA-1946","A2.9-1996",140,"BRA","Dutra","31/01/1946","31/01/1951","18/5/1885","11/06/1974",1946-01-31,1951-01-31,0,1,0,0,0,"M",1885-05-18,1885,1974-06-11,1974
"667","BRA-1951","A2.9-1999",140,"BRA","Vargas","10/02/1951","24/08/1954","19/4/1883","24/08/1954",1951-02-10,1954-08-24,0,3,6,1,3.1,"M",1883-04-19,1883,1954-08-24,1954
"668","BRA-1954","A2.9-2002",140,"BRA","Cafe Filho","24/08/1954","08/11/1955","3/2/1899","1970",1954-08-24,1955-11-08,0,2.1,0,0,2,"M",1899-02-03,1899,NA,1970
"669","BRA-1955-1","A2.9-2005",140,"BRA","Coimbra da Luz","08/11/1955","11/11/1955","1894","1961",1955-11-08,1955-11-11,0,3,6,0,2,"M",NA,1894,NA,1961
"670","BRA-1955-2","A2.9-2008",140,"BRA","Oliveria Ramos","11/11/1955","31/01/1956","1889","1958",1955-11-11,1956-01-31,0,1,0,0,0,"M",NA,1889,NA,1958
"671","BRA-1956","A2.9-2011",140,"BRA","Kubitschek","31/01/1956","31/01/1961","12/9/1902","22/08/1976",1956-01-31,1961-01-31,0,1,0,0,0,"M",1902-09-12,1902,1976-08-22,1976
"672","BRA-1961-1","A2.9-2014",140,"BRA","Quadros","31/01/1961","25/08/1961","25/1/1917","16/02/1992",1961-01-31,1961-08-25,0,1,0,0,1,"M",1917-01-25,1917,1992-02-16,1992
"673","BRA-1961-2","A2.9-2017",140,"BRA","Ranieri Mazzilli","25/08/1961","07/09/1961","1910","1975",1961-08-25,1961-09-07,0,1,0,0,0,"M",NA,1910,NA,1975
"674","BRA-1961-3","A2.9-2020",140,"BRA","Goulart","07/09/1961","02/04/1964","1/3/1918","06/12/1976",1961-09-07,1964-04-02,0,3,6,0,1,"M",1918-03-01,1918,1976-12-06,1976
"675","BRA-1964-1","A2.9-2023",140,"BRA","Ranieri Mazzilli","02/04/1964","15/04/1964","1910","1975",1964-04-02,1964-04-15,0,1,0,1,0,"M",NA,1910,NA,1975
"676","BRA-1964-2","A2.9-2026",140,"BRA","Castello Branco","15/04/1964","15/03/1967","20/9/1900","1967",1964-04-15,1967-03-15,1,1,0,0,-777,"M",1900-09-20,1900,NA,1967
"677","BRA-1967","A2.9-2029",140,"BRA","Costa de Silva","15/03/1967","01/09/1969","3/10/1902","1969",1967-03-15,1969-09-01,0,2.1,0,0,-777,"M",1902-10-03,1902,NA,1969
"678","BRA-1969-1","A2.9-2032",140,"BRA","Military Junta","01/09/1969","25/10/1969","-999","-999",1969-09-01,1969-10-25,1,1,0,0,0,"M",NA,NA,NA,NA
"679","BRA-1969-2","A2.9-2035",140,"BRA","Medici","25/10/1969","15/03/1974","4/12/1905","09/10/1985",1969-10-25,1974-03-15,1,1,0,0,0,"M",1905-12-04,1905,1985-10-09,1985
"680","BRA-1974","A2.9-2038",140,"BRA","Geisel","15/03/1974","15/03/1979","3/8/1907","12/09/1996",1974-03-15,1979-03-15,0,1,0,0,0,"M",1907-08-03,1907,1996-09-12,1996
"681","BRA-1979","A2.9-2041",140,"BRA","Figueiredo","15/03/1979","21/03/1985","15/1/1918","24/12/1999",1979-03-15,1985-03-21,0,1,0,0,0,"M",1918-01-15,1918,1999-12-24,1999
"682","BRA-1985","A2.9-2044",140,"BRA","Sarnay","21/03/1985","15/03/1990","30/4/1930","-777",1985-03-21,1990-03-15,0,1,0,0,0,"M",1930-04-30,1930,NA,-777
"683","BRA-1990","A2.9-2047",140,"BRA","Mello","15/03/1990","02/10/1992","12/8/1949","-777",1990-03-15,1992-10-02,0,1,0,0,0,"M",1949-08-12,1949,NA,-777
"684","BRA-1992","A2.9-2050",140,"BRA","Franco, Itamar","02/10/1992","31/12/1994","28/6/1930","-777",1992-10-02,1994-12-31,0,1,0,0,0,"M",1930-06-28,1930,NA,-777
"685","BRA-1995","A2.9-2053",140,"BRA","Cardoso","01/01/1995","01/01/2003","18/6/1931","-777",1995-01-01,2003-01-01,0,1,0,0,0,"M",1931-06-18,1931,NA,-777
"686","BRA-2003","A2.9-2056",140,"BRA","Lula da Silva","01/01/2003","31/12/2004","1945","-777",2003-01-01,2004-12-31,0,-888,0,0,-888,"M",NA,1945,NA,-777
"687","BOL-1874","A2.9-2059",145,"BOL","Frias","14/02/1874","04/05/1876","21/12/1804","1884",1874-02-14,1876-05-04,0,3,-999,1,2,"M",1804-12-21,1804,NA,1884
"688","BOL-1876","A2.9-2062",145,"BOL","Daza","04/05/1876","27/12/1879","14/1/1840","1893",1876-05-04,1879-12-27,1,3,-999,0,1,"M",1840-01-14,1840,NA,1893
"689","BOL-1880","A2.9-2065",145,"BOL","Campero","19/01/1880","15/08/1884","28/10/1813","1896",1880-01-19,1884-08-15,1,1,0,0,0,"M",1813-10-28,1813,NA,1896
"690","BOL-1884","A2.9-2068",145,"BOL","Pacheco","15/08/1884","15/08/1888","4/7/1823","1899",1884-08-15,1888-08-15,0,1,0,0,0,"M",1823-07-04,1823,NA,1899
"691","BOL-1888","A2.9-2071",145,"BOL","Arce","15/08/1888","01/08/1892","17/4/1824","1906",1888-08-15,1892-08-01,0,1,0,0,0,"M",1824-04-17,1824,NA,1906
"692","BOL-1892","A2.9-2074",145,"BOL","Baptista","06/08/1892","15/08/1896","16/7/1832","1907",1892-08-06,1896-08-15,0,1,0,0,0,"M",1832-07-16,1832,NA,1907
"693","BOL-1896","A2.9-2077",145,"BOL","Fernandez Alonso","15/08/1896","06/10/1899","15/8/1849","1925",1896-08-15,1899-10-06,0,3,-999,0,1,"M",1849-08-15,1849,NA,1925
"694","BOL-1899","A2.9-2080",145,"BOL","Jose Manuel Pando","06/10/1899","04/08/1904","25/12/1848","1917",1899-10-06,1904-08-04,1,1,0,0,0,"M",1848-12-25,1848,NA,1917
"695","BOL-1904","A2.9-2083",145,"BOL","Montes","14/08/1904","24/10/1909","5/10/1861","1933",1904-08-14,1909-10-24,0,1,0,0,0,"M",1861-10-05,1861,NA,1933
"696","BOL-1909","A2.9-2086",145,"BOL","Villazon","24/10/1909","15/08/1913","22/1/1848","1939",1909-10-24,1913-08-15,0,1,0,0,0,"M",1848-01-22,1848,NA,1939
"697","BOL-1913","A2.9-2089",145,"BOL","Montes","15/08/1913","15/08/1917","5/10/1861","1933",1913-08-15,1917-08-15,0,1,0,1,0,"M",1861-10-05,1861,NA,1933
"698","BOL-1917","A2.9-2092",145,"BOL","Gutierrez Guerra","15/08/1917","11/07/1920","5/9/1869","1929",1917-08-15,1920-07-11,0,3,8,0,1,"M",1869-09-05,1869,NA,1929
"699","BOL-1920","A2.9-2095",145,"BOL","Saavedra","11/07/1920","03/09/1925","30/8/1870","1939",1920-07-11,1925-09-03,1,1,0,0,0,"M",1870-08-30,1870,NA,1939
"700","BOL-1925","A2.9-2098",145,"BOL","Felipe Guzman","03/09/1925","10/01/1926","1879","1932",1925-09-03,1926-01-10,0,1,0,0,-666,"M",NA,1879,NA,1932
"701","BOL-1926","A2.9-2101",145,"BOL","Siles","10/01/1926","25/06/1930","1905","1942",1926-01-10,1930-06-25,0,3,6,0,1,"M",NA,1905,NA,1942
"702","BOL-1930","A2.9-2104",145,"BOL","Blanco Galindo","25/06/1930","05/03/1931","12/3/1882","1943",1930-06-25,1931-03-05,1,1,0,0,0,"M",1882-03-12,1882,NA,1943
"703","BOL-1931","A2.9-2107",145,"BOL","Salamanca","05/03/1931","28/11/1934","8/7/1868","17/7/1935",1931-03-05,1934-11-28,0,3,6,0,2,"M",1868-07-08,1868,1935-07-17,1935
"704","BOL-1934","A2.9-2110",145,"BOL","Tejada Sorzano","28/11/1934","18/05/1936","12/1/1882","4/10/1938",1934-11-28,1936-05-18,0,3,6,0,1,"M",1882-01-12,1882,1938-10-04,1938
"705","BOL-1936","A2.9-2113",145,"BOL","Toro","18/05/1936","13/07/1937","24/6/1898","1977",1936-05-18,1937-07-13,1,3,16,0,1,"M",1898-06-24,1898,NA,1977
"706","BOL-1937","A2.9-2116",145,"BOL","Busch, G.","13/07/1937","23/08/1939","23/3/1903","23/08/1939",1937-07-13,1939-08-23,1,2.2,0,0,-777,"M",1903-03-23,1903,1939-08-23,1939
"707","BOL-1939","A2.9-2119",145,"BOL","Quintanila","23/08/1939","15/04/1940","1888","1964",1939-08-23,1940-04-15,1,1,0,0,0,"M",NA,1888,NA,1964
"708","BOL-1940","A2.9-2122",145,"BOL","Penaranda","15/04/1940","20/12/1943","17/11/1891","1969",1940-04-15,1943-12-20,0,3,6,0,2,"M",1891-11-17,1891,NA,1969
"709","BOL-1943","A2.9-2125",145,"BOL","Villarroel","20/12/1943","21/07/1946","1908","1946",1943-12-20,1946-07-21,1,3,2,0,3,"M",NA,1908,NA,1946
"710","BOL-1946-1","A2.9-2128",145,"BOL","Guillen","21/07/1946","16/08/1946","1890","1966",1946-07-21,1946-08-16,1,1,0,0,0,"M",NA,1890,NA,1966
"711","BOL-1946-2","A2.9-2131",145,"BOL","Gutierrez","16/08/1946","10/03/1947","1884","1954",1946-08-16,1947-03-10,0,1,0,0,0,"M",NA,1884,NA,1954
"712","BOL-1947","A2.9-2134",145,"BOL","Herzog","11/03/1947","07/05/1949","1896","1980",1947-03-11,1949-05-07,0,2.1,0,0,0,"M",NA,1896,NA,1980
"713","BOL-1949","A2.9-2137",145,"BOL","Urriolagoitia","07/05/1949","16/05/1951","1894","04/06/1974",1949-05-07,1951-05-16,0,3,6,0,1,"M",NA,1894,1974-06-04,1974
"714","BOL-1951","A2.9-2140",145,"BOL","Ballivian Rojas","16/05/1951","11/04/1952","1902","1993",1951-05-16,1952-04-11,1,3,4,0,1,"M",NA,1902,NA,1993
"715","BOL-1952-1","A2.9-2143",145,"BOL","Siles Zuazo","11/04/1952","16/04/1952","1914","06/08/1996",1952-04-11,1952-04-16,1,1,0,0,0,"M",NA,1914,1996-08-06,1996
"716","BOL-1952-2","A2.9-2146",145,"BOL","Paz Estenssoro","17/04/1952","17/06/1956","2/10/1907","07/06/2001",1952-04-17,1956-06-17,0,1,0,0,0,"M",1907-10-02,1907,2001-06-07,2001
"717","BOL-1956","A2.9-2149",145,"BOL","Siles Zuazo","17/06/1956","06/08/1960","19/3/1914","06/08/1996",1956-06-17,1960-08-06,0,1,0,1,0,"M",1914-03-19,1914,1996-08-06,1996
"718","BOL-1960","A2.9-2152",145,"BOL","Paz Estenssoro","06/08/1960","04/11/1964","2/10/1907","07/06/2001",1960-08-06,1964-11-04,0,3,6,1,1,"M",1907-10-02,1907,2001-06-07,2001
"719","BOL-1964","A2.9-2155",145,"BOL","Barrientos Ortuna","06/11/1964","05/01/1966","30/5/1919","1969",1964-11-06,1966-01-05,1,1,0,0,0,"M",1919-05-30,1919,NA,1969
"720","BOL-1966-1","A2.9-2158",145,"BOL","Ovando Candia","05/01/1966","06/08/1966","6/4/1918","24/01/1982",1966-01-05,1966-08-06,0,1,0,0,0,"M",1918-04-06,1918,1982-01-24,1982
"721","BOL-1966-2","A2.9-2161",145,"BOL","Barrientos Ortuna","06/08/1966","27/04/1969","30/5/1919","1969",1966-08-06,1969-04-27,0,2,0,1,-777,"M",1919-05-30,1919,NA,1969
"722","BOL-1969-1","A2.9-2164",145,"BOL","Siles Salinas","27/04/1969","26/09/1969","1925","2005",1969-04-27,1969-09-26,0,3,6,0,1,"M",NA,1925,NA,2005
"723","BOL-1969-2","A2.9-2167",145,"BOL","Ovando Candia","26/09/1969","06/10/1970","6/4/1918","24/01/1982",1969-09-26,1970-10-06,1,3,6,1,1,"M",1918-04-06,1918,1982-01-24,1982
"724","BOL-1970","A2.9-2170",145,"BOL","Torres","07/10/1970","22/08/1971","5/3/1921","1976",1970-10-07,1971-08-22,1,3,6,0,1,"M",1921-03-05,1921,NA,1976
"725","BOL-1971","A2.9-2173",145,"BOL","Banzer Suarez","22/08/1971","21/07/1978","10/7/1926","05/05/2002",1971-08-22,1978-07-21,1,3,6,0,1,"M",1926-07-10,1926,2002-05-05,2002
"726","BOL-1978-1","A2.9-2176",145,"BOL","Pereda Asbun","21/07/1978","24/11/1978","1932","-777",1978-07-21,1978-11-24,1,3,6,0,1,"M",NA,1932,NA,-777
"727","BOL-1978-2","A2.9-2179",145,"BOL","Padilla Aranciba","24/11/1978","08/08/1979","1927","-777",1978-11-24,1979-08-08,1,1,0,0,0,"M",NA,1927,NA,-777
"728","BOL-1979-1","A2.9-2182",145,"BOL","Guevara Arze","08/08/1979","01/11/1979","11/3/1911","1996",1979-08-08,1979-11-01,0,3,6,0,0,"M",1911-03-11,1911,NA,1996
"729","BOL-1979-2","A2.9-2185",145,"BOL","Natusch Busch","01/11/1979","16/11/1979","1927","1994",1979-11-01,1979-11-16,1,1,0,0,1,"M",NA,1927,NA,1994
"730","BOL-1979-3","A2.9-2188",145,"BOL","Gueiler Tejada","16/11/1979","17/07/1980","1925","-777",1979-11-16,1980-07-17,0,3,7,0,1,"F",NA,1925,NA,-777
"731","BOL-1980","A2.9-2191",145,"BOL","Garcia Meza Tejada","18/07/1980","04/08/1981","8/8/1932","-777",1980-07-18,1981-08-04,1,3,6,0,1,"M",1932-08-08,1932,NA,-777
"732","BOL-1981","A2.9-2194",145,"BOL","Torrelio Villa","05/08/1981","19/07/1982","3/6/1933","1999",1981-08-05,1982-07-19,1,3,16,0,1,"M",1933-06-03,1933,NA,1999
"733","BOL-1982-1","A2.9-2197",145,"BOL","Vildoso Calderon","21/07/1982","10/10/1982","1937","-777",1982-07-21,1982-10-10,1,1,0,0,0,"M",NA,1937,NA,-777
"734","BOL-1982-2","A2.9-2200",145,"BOL","Siles Zuazo","10/10/1982","06/08/1985","19/3/1914","06/08/1996",1982-10-10,1985-08-06,1,1,0,2,0,"M",1914-03-19,1914,1996-08-06,1996
"735","BOL-1985","A2.9-2203",145,"BOL","Paz Estenssoro","06/08/1985","06/08/1989","2/10/1907","07/06/2001",1985-08-06,1989-08-06,0,1,0,2,0,"M",1907-10-02,1907,2001-06-07,2001
"736","BOL-1989","A2.9-2206",145,"BOL","Paz Zamora","06/08/1989","06/08/1993","15/4/1939","-777",1989-08-06,1993-08-06,0,1,0,0,0,"M",1939-04-15,1939,NA,-777
"737","BOL-1993","A2.9-2209",145,"BOL","Gonzalo Sanchez de Lozada","06/08/1993","06/08/1997","1930","-777",1993-08-06,1997-08-06,0,1,0,0,0,"M",NA,1930,NA,-777
"738","BOL-1997","A2.9-2212",145,"BOL","Banzer Suarez","06/08/1997","07/08/2001","10/7/1926","05/05/2002",1997-08-06,2001-08-07,0,2.1,0,1,-777,"M",1926-07-10,1926,2002-05-05,2002
"739","BOL-2001","A2.9-2215",145,"BOL","Jorge Quiroga Ramirez","07/08/2001","06/08/2002","1960","-777",2001-08-07,2002-08-06,0,1,0,0,0,"M",NA,1960,NA,-777
"740","BOL-2002","A2.9-2218",145,"BOL","Gonzalo Sanchez de Lozada","08/08/2002","17/10/2003","1930","-777",2002-08-08,2003-10-17,0,1,0,1,1,"M",NA,1930,NA,-777
"741","BOL-2003","A2.9-2221",145,"BOL","Carlos Mesa","17/10/2003","31/12/2004","12/08/1953","-777",2003-10-17,2004-12-31,0,-888,0,0,-888,"M",1953-08-12,1953,NA,-777
"742","PAR-1874","A2.9-2224",150,"PAR","Gill","25/11/1874","12/04/1877","1840","1877",1874-11-25,1877-04-12,1,3,-999,0,3,"M",NA,1840,NA,1877
"743","PAR-1877","A2.9-2227",150,"PAR","Uriarte","12/04/1877","25/11/1878","1843","1909",1877-04-12,1878-11-25,0,1,0,0,-666,"M",NA,1843,NA,1909
"744","PAR-1878","A2.9-2230",150,"PAR","Barreiro","27/11/1878","04/09/1880","1833","1880",1878-11-27,1880-09-04,0,2,0,0,-777,"M",NA,1833,NA,1880
"745","PAR-1880","A2.9-2233",150,"PAR","Caballero","04/09/1880","25/11/1886","1839","1912",1880-09-04,1886-11-25,1,1,0,0,0,"M",NA,1839,NA,1912
"746","PAR-1886","A2.9-2236",150,"PAR","Escobar","25/11/1886","25/11/1890","1843","1912",1886-11-25,1890-11-25,0,1,0,0,0,"M",NA,1843,NA,1912
"747","PAR-1890","A2.9-2239",150,"PAR","Gonzalez","25/11/1890","09/06/1894","1851","1912",1890-11-25,1894-06-09,0,3,-999,0,1,"M",NA,1851,NA,1912
"748","PAR-1894-1","A2.9-2242",150,"PAR","Morinigo","09/06/1894","25/11/1894","1848","1901",1894-06-09,1894-11-25,1,1,0,0,-666,"M",NA,1848,NA,1901
"749","PAR-1894-2","A2.9-2245",150,"PAR","Egusquiza","25/11/1894","25/11/1898","1845","1902",1894-11-25,1898-11-25,0,1,0,0,-666,"M",NA,1845,NA,1902
"750","PAR-1898","A2.9-2248",150,"PAR","Aceval","25/11/1898","09/01/1902","1854","1931",1898-11-25,1902-01-09,0,3,-999,0,2,"M",NA,1854,NA,1931
"751","PAR-1902-1","A2.9-2251",150,"PAR","Carvallo","09/01/1902","25/08/1902","1862","1934",1902-01-09,1902-08-25,0,1,0,0,-666,"M",NA,1862,NA,1934
"752","PAR-1902-2","A2.9-2254",150,"PAR","Escurra","25/08/1902","19/12/1904","1859","1929",1902-08-25,1904-12-19,0,3,-999,0,1,"M",NA,1859,NA,1929
"753","PAR-1904","A2.9-2257",150,"PAR","Gaona","19/12/1904","08/12/1905","1846","1932",1904-12-19,1905-12-08,1,3,-999,0,-666,"M",NA,1846,NA,1932
"754","PAR-1905","A2.9-2260",150,"PAR","Baez","08/12/1905","25/11/1906","1/2/1862","1941",1905-12-08,1906-11-25,1,1,0,0,0,"M",1862-02-01,1862,NA,1941
"755","PAR-1906","A2.9-2263",150,"PAR","Ferreira","25/11/1906","04/07/1908","18/2/1840","1920",1906-11-25,1908-07-04,1,3,-999,0,1,"M",1840-02-18,1840,NA,1920
"756","PAR-1908","A2.9-2266",150,"PAR","Gonzales Navero","05/07/1908","25/11/1910","1861","1934",1908-07-05,1910-11-25,1,1,0,0,0,"M",NA,1861,NA,1934
"757","PAR-1910","A2.9-2269",150,"PAR","Gondra","25/11/1910","17/01/1911","1/1/1871","1927",1910-11-25,1911-01-17,0,3,-999,0,0,"M",1871-01-01,1871,NA,1927
"758","PAR-1911-1","A2.9-2272",150,"PAR","Jara","19/01/1911","05/07/1911","1877","1912",1911-01-19,1911-07-05,1,3,-999,0,3,"M",NA,1877,NA,1912
"759","PAR-1911-2","A2.9-2275",150,"PAR","Rojas","05/07/1911","01/03/1912","1870","1922",1911-07-05,1912-03-01,0,3,-999,0,1,"M",NA,1870,NA,1922
"760","PAR-1912-1","A2.9-2278",150,"PAR","Pena","01/03/1912","25/03/1912","1864","1943",1912-03-01,1912-03-25,1,3,-999,0,1,"M",NA,1864,NA,1943
"761","PAR-1912-2","A2.9-2281",150,"PAR","Gonzalez Navero","25/03/1912","31/07/1912","1861","1934",1912-03-25,1912-07-31,1,1,0,1,0,"M",NA,1861,NA,1934
"762","PAR-1912-3","A2.9-2284",150,"PAR","Schaerer","15/08/1912","15/08/1916","2/12/1873","1941",1912-08-15,1916-08-15,0,1,0,0,0,"M",1873-12-02,1873,NA,1941
"763","PAR-1916","A2.9-2287",150,"PAR","Manuel Franco","15/08/1916","05/06/1919","1871","05/06/1919",1916-08-15,1919-06-05,0,2,0,0,-777,"M",NA,1871,1919-06-05,1919
"764","PAR-1919","A2.9-2290",150,"PAR","Montero","05/06/1919","15/08/1920","12/02/1879","1927",1919-06-05,1920-08-15,0,1,0,0,-666,"M",1879-02-12,1879,NA,1927
"765","PAR-1920","A2.9-2293",150,"PAR","Gondra","15/08/1920","30/10/1921","1/1/1871","1927",1920-08-15,1921-10-30,0,3,8,1,0,"M",1871-01-01,1871,NA,1927
"766","PAR-1921-1","A2.9-2296",150,"PAR","Paiva","31/10/1921","03/11/1921","1877","1965",1921-10-31,1921-11-03,0,1,0,0,0,"M",NA,1877,NA,1965
"767","PAR-1921-2","A2.9-2299",150,"PAR","Ayala Eusebio","03/11/1921","10/04/1923","15/8/1874","1942",1921-11-03,1923-04-10,1,1,0,0,0,"M",1874-08-15,1874,NA,1942
"768","PAR-1923","A2.9-2302",150,"PAR","Ayala Eligio","10/04/1923","12/04/1924","1880","1930",1923-04-10,1924-04-12,0,1,0,0,0,"M",NA,1880,NA,1930
"769","PAR-1924-1","A2.9-2305",150,"PAR","Riart","12/04/1924","15/08/1924","1891","1953",1924-04-12,1924-08-15,0,1,0,0,0,"M",NA,1891,NA,1953
"770","PAR-1924-2","A2.9-2308",150,"PAR","Ayala Eligio","15/08/1924","15/08/1928","1880","1930",1924-08-15,1928-08-15,0,1,0,1,0,"M",NA,1880,NA,1930
"771","PAR-1928","A2.9-2311",150,"PAR","Guggiari","15/08/1928","26/10/1931","17/3/1884","1957",1928-08-15,1931-10-26,0,1,0,0,0,"M",1884-03-17,1884,NA,1957
"772","PAR-1931","A2.9-2314",150,"PAR","Gonzalez Navero","26/10/1931","28/01/1932","1861","1934",1931-10-26,1932-01-28,0,1,0,2,0,"M",NA,1861,NA,1934
"773","PAR-1932-1","A2.9-2317",150,"PAR","Guggiari","28/01/1932","15/08/1932","17/3/1884","1957",1932-01-28,1932-08-15,0,1,0,1,0,"M",1884-03-17,1884,NA,1957
"774","PAR-1932-2","A2.9-2320",150,"PAR","Ayala Eusebio","15/08/1932","19/02/1936","15/8/1874","1942",1932-08-15,1936-02-19,0,3,6,1,2,"M",1874-08-15,1874,NA,1942
"775","PAR-1936","A2.9-2323",150,"PAR","Rafael Franco","19/02/1936","16/08/1937","1897","1973",1936-02-19,1937-08-16,1,3,6,0,1,"M",NA,1897,NA,1973
"776","PAR-1937","A2.9-2326",150,"PAR","Paiva","16/08/1937","15/08/1939","1877","1965",1937-08-16,1939-08-15,1,1,0,1,0,"M",NA,1877,NA,1965
"777","PAR-1939","A2.9-2329",150,"PAR","Estigarribia","15/08/1939","05/09/1940","21/2/1888","05/09/1940",1939-08-15,1940-09-05,0,2,0,0,-777,"M",1888-02-21,1888,1940-09-05,1940
"778","PAR-1940","A2.9-2332",150,"PAR","Morinigo","08/09/1940","03/06/1948","11/1/1897","1983",1940-09-08,1948-06-03,0,3,8,0,2,"M",1897-01-11,1897,NA,1983
"779","PAR-1948-1","A2.9-2335",150,"PAR","Frutos","03/06/1948","15/08/1948","1879","1960",1948-06-03,1948-08-15,1,1,0,0,0,"M",NA,1879,NA,1960
"780","PAR-1948-2","A2.9-2338",150,"PAR","Natalicio","15/08/1948","30/01/1949","8/9/1897","1966",1948-08-15,1949-01-30,0,3,6,0,1,"M",1897-09-08,1897,NA,1966
"781","PAR-1949-1","A2.9-2341",150,"PAR","Rolon","30/01/1949","26/02/1949","1903","1954",1949-01-30,1949-02-26,1,3,8,0,0,"M",NA,1903,NA,1954
"782","PAR-1949-2","A2.9-2344",150,"PAR","Molas Lopez","26/02/1949","10/09/1949","1901","02/03/1954",1949-02-26,1949-09-10,1,3,8,0,0,"M",NA,1901,1954-03-02,1954
"783","PAR-1949-3","A2.9-2347",150,"PAR","Chavez","10/09/1949","06/05/1954","15/02/1882","24/04/1978",1949-09-10,1954-05-06,1,3,6,0,0,"M",1882-02-15,1882,1978-04-24,1978
"784","PAR-1954-1","A2.9-2350",150,"PAR","Pareira","06/05/1954","11/07/1954","1886","1982",1954-05-06,1954-07-11,0,1,0,0,0,"M",NA,1886,NA,1982
"785","PAR-1954-2","A2.9-2353",150,"PAR","Stroessner","11/07/1954","03/02/1989","3/11/1912","2006",1954-07-11,1989-02-03,1,3,6,0,1,"M",1912-11-03,1912,NA,2006
"786","PAR-1989","A2.9-2356",150,"PAR","Rodriguez Pedotti","03/02/1989","15/08/1993","19/6/1924","1997",1989-02-03,1993-08-15,1,1,0,0,0,"M",1924-06-19,1924,NA,1997
"787","PAR-1993","A2.9-2359",150,"PAR","Wasmosy Monti","15/08/1993","15/08/1998","1938","-777",1993-08-15,1998-08-15,0,1,0,0,0,"M",NA,1938,NA,-777
"788","PAR-1998","A2.9-2362",150,"PAR","Cubas Grau","15/08/1998","28/03/1999","1943","-777",1998-08-15,1999-03-28,0,1,0,0,1,"M",NA,1943,NA,-777
"789","PAR-1999","A2.9-2365",150,"PAR","Gonzalez Macchi","28/03/1999","15/08/2003","1947","-777",1999-03-28,2003-08-15,0,1,0,0,-888,"M",NA,1947,NA,-777
"790","PAR-2003","A2.9-2368",150,"PAR","Nicanor Duarte Frutos","15/08/2003","31/12/2004","11/10/1956","-777",2003-08-15,2004-12-31,0,-888,0,0,-888,"M",1956-10-11,1956,NA,-777
"791","CHL-1871","A2.9-2371",155,"CHL","F.  Errazuriz Zanartu","18/09/1871","18/09/1876","25/4/1825","1877",1871-09-18,1876-09-18,0,1,0,0,0,"M",1825-04-25,1825,NA,1877
"792","CHL-1876","A2.9-2374",155,"CHL","Pinto","18/09/1876","18/09/1881","15/3/1825","1884",1876-09-18,1881-09-18,0,1,0,0,0,"M",1825-03-15,1825,NA,1884
"793","CHL-1881","A2.9-2377",155,"CHL","Santa Maria","18/09/1881","18/09/1886","4/8/1825","1889",1881-09-18,1886-09-18,0,1,0,0,0,"M",1825-08-04,1825,NA,1889
"794","CHL-1886","A2.9-2380",155,"CHL","Balmaceda","18/09/1886","28/08/1891","19/7/1840","1891",1886-09-18,1891-08-28,0,3,-999,0,1,"M",1840-07-19,1840,NA,1891
"795","CHL-1891","A2.9-2383",155,"CHL","J. Montt-Alvarez","31/08/1891","18/09/1896","1845","1922",1891-08-31,1896-09-18,1,1,0,0,0,"M",NA,1845,NA,1922
"796","CHL-1896","A2.9-2386",155,"CHL","F. Errazuriz Echaurren","18/09/1896","01/05/1901","16/9/1850","1901",1896-09-18,1901-05-01,0,2.1,0,0,-777,"M",1850-09-16,1850,NA,1901
"797","CHL-1901-1","A2.9-2389",155,"CHL","A. Zanartu Zanartu","01/05/1901","18/08/1901","1847","1902",1901-05-01,1901-08-18,0,1,0,0,-777,"M",NA,1847,NA,1902
"798","CHL-1901-2","A2.9-2392",155,"CHL","Riesco Errazuriz","18/08/1901","18/09/1906","18/5/1854","1916",1901-08-18,1906-09-18,0,1,0,0,0,"M",1854-05-18,1854,NA,1916
"799","CHL-1906","A2.9-2395",155,"CHL","P. Montt","18/09/1906","16/08/1910","29/6/1848","1910",1906-09-18,1910-08-16,0,2,0,0,-777,"M",1848-06-29,1848,NA,1910
"800","CHL-1910-1","A2.9-2398",155,"CHL","Albano","16/08/1910","06/09/1910","1845","1910",1910-08-16,1910-09-06,0,2,0,0,-777,"M",NA,1845,NA,1910
"801","CHL-1910-2","A2.9-2401",155,"CHL","Figueroa Larrain","06/09/1910","18/09/1911","1866","1931",1910-09-06,1911-09-18,0,1,0,0,0,"M",NA,1866,NA,1931
"802","CHL-1911","A2.9-2404",155,"CHL","Lucco","18/09/1911","23/12/1915","1835","1919",1911-09-18,1915-12-23,0,1,0,0,0,"M",NA,1835,NA,1919
"803","CHL-1915","A2.9-2407",155,"CHL","Sanfuentes","23/12/1915","23/12/1920","27/12/1858","1930",1915-12-23,1920-12-23,0,1,0,0,0,"M",1858-12-27,1858,NA,1930
"804","CHL-1920","A2.9-2410",155,"CHL","Alessandri y Palma","23/12/1920","08/09/1924","20/12/1868","24/08/1950",1920-12-23,1924-09-08,0,3,6,0,1,"M",1868-12-20,1868,1950-08-24,1950
"805","CHL-1924","A2.9-2413",155,"CHL","Altamirano","08/09/1924","23/01/1925","1867","1938",1924-09-08,1925-01-23,1,3,6,0,2,"M",NA,1867,NA,1938
"806","CHL-1925-1","A2.9-2416",155,"CHL","Ibanez del Campo","23/01/1925","21/03/1925","03/11/1877","28/04/1960",1925-01-23,1925-03-21,1,1,0,0,0,"M",1877-11-03,1877,1960-04-28,1960
"807","CHL-1925-2","A2.9-2419",155,"CHL","Alessandri y Palma","21/03/1925","01/10/1925","20/12/1868","24/08/1950",1925-03-21,1925-10-01,0,1,0,1,1,"M",1868-12-20,1868,1950-08-24,1950
"808","CHL-1925-3","A2.9-2422",155,"CHL","Barros Borgono","01/10/1925","23/12/1925","1858","1943",1925-10-01,1925-12-23,0,1,0,0,0,"M",NA,1858,NA,1943
"809","CHL-1925-4","A2.9-2425",155,"CHL","Figueroa Larrain","23/12/1925","09/04/1927","1866","1931",1925-12-23,1927-04-09,1,3,6,1,1,"M",NA,1866,NA,1931
"810","CHL-1927","A2.9-2428",155,"CHL","Ibanez del Campo","09/04/1927","26/07/1931","3/11/1877","28/04/1960",1927-04-09,1931-07-26,1,1,0,1,1,"M",1877-11-03,1877,1960-04-28,1960
"811","CHL-1931-1","A2.9-2431",155,"CHL","Opazo Letelier","26/07/1931","27/07/1931","1878","-999",1931-07-26,1931-07-27,0,1,0,0,0,"M",NA,1878,NA,NA
"812","CHL-1931-2","A2.9-2434",155,"CHL","Montero Rodriquez","28/07/1931","17/08/1931","1878","1948",1931-07-28,1931-08-17,0,1,0,0,0,"M",NA,1878,NA,1948
"813","CHL-1931-3","A2.9-2437",155,"CHL","Trucco Franzani","17/08/1931","15/11/1931","1874","-999",1931-08-17,1931-11-15,0,1,0,0,0,"M",NA,1874,NA,NA
"814","CHL-1931-4","A2.9-2440",155,"CHL","Montero Rodriquez","15/11/1931","04/06/1932","1878","1948",1931-11-15,1932-06-04,0,3,6,1,1,"M",NA,1878,NA,1948
"815","CHL-1932-1","A2.9-2443",155,"CHL","Davila","05/06/1932","12/06/1932","5/9/1887","1955",1932-06-05,1932-06-12,1,3,16,0,1,"M",1887-09-05,1887,NA,1955
"816","CHL-1932-2","A2.9-2446",155,"CHL","Grove Vallejo","12/06/1932","17/06/1932","6/7/1878","-999",1932-06-12,1932-06-17,1,3,6,0,2,"M",1878-07-06,1878,NA,NA
"817","CHL-1932-3","A2.9-2449",155,"CHL","Davila","17/06/1932","13/09/1932","5/9/1887","1955",1932-06-17,1932-09-13,1,3,6,1,1,"M",1887-09-05,1887,NA,1955
"818","CHL-1932-4","A2.9-2452",155,"CHL","Blanche","13/09/1932","02/10/1932","1879","1970",1932-09-13,1932-10-02,1,1,0,0,0,"M",NA,1879,NA,1970
"819","CHL-1932-5","A2.9-2455",155,"CHL","Ovandel Urrutia","02/10/1932","25/12/1932","1874","1954",1932-10-02,1932-12-25,0,1,0,0,0,"M",NA,1874,NA,1954
"820","CHL-1932-6","A2.9-2458",155,"CHL","Alessandri y Palma","25/12/1932","24/12/1938","20/12/1868","24/08/1950",1932-12-25,1938-12-24,0,1,0,2,1,"M",1868-12-20,1868,1950-08-24,1950
"821","CHL-1938","A2.9-2461",155,"CHL","Aguirre Cerda","24/12/1938","25/11/1941","6/2/1879","25/11/1941",1938-12-24,1941-11-25,0,2,0,0,-777,"M",1879-02-06,1879,1941-11-25,1941
"822","CHL-1941","A2.9-2464",155,"CHL","Mendez Arancibia","25/11/1941","01/04/1942","1884","1959",1941-11-25,1942-04-01,0,1,0,0,0,"M",NA,1884,NA,1959
"823","CHL-1942","A2.9-2467",155,"CHL","Rios Morales","01/04/1942","17/01/1946","10/11/1888","27/6/1946",1942-04-01,1946-01-17,0,2.1,0,0,-777,"M",1888-11-10,1888,1946-06-27,1946
"824","CHL-1946-1","A2.9-2470",155,"CHL","Duhalde Vasquez","17/01/1946","03/08/1946","1888","1985",1946-01-17,1946-08-03,0,1,0,0,0,"M",NA,1888,NA,1985
"825","CHL-1946-2","A2.9-2473",155,"CHL","Bielech","03/08/1946","06/09/1946","1895","1977",1946-08-03,1946-09-06,0,1,0,0,0,"M",NA,1895,NA,1977
"826","CHL-1946-3","A2.9-2476",155,"CHL","Duhalde Vasquez","06/09/1946","17/10/1946","1888","1985",1946-09-06,1946-10-17,0,1,0,1,0,"M",NA,1888,NA,1985
"827","CHL-1946-4","A2.9-2479",155,"CHL","Iribarren","17/10/1946","03/11/1946","1885","-999",1946-10-17,1946-11-03,0,1,0,0,0,"M",NA,1885,NA,NA
"828","CHL-1946-5","A2.9-2482",155,"CHL","Gonzalez Videla","03/11/1946","03/11/1952","22/11/1898","22/08/1980",1946-11-03,1952-11-03,0,1,0,0,0,"M",1898-11-22,1898,1980-08-22,1980
"829","CHL-1952","A2.9-2485",155,"CHL","Ibanez Campo","03/11/1952","03/11/1958","3/11/1877","28/04/1960",1952-11-03,1958-11-03,0,1,0,1,0,"M",1877-11-03,1877,1960-04-28,1960
"830","CHL-1958","A2.9-2488",155,"CHL","Alessandri Rodriguez","03/11/1958","03/11/1964","19/5/1896","31/08/1986",1958-11-03,1964-11-03,0,1,0,0,0,"M",1896-05-19,1896,1986-08-31,1986
"831","CHL-1964","A2.9-2491",155,"CHL","Frei Montalva","03/11/1964","03/11/1970","16/1/1911","22/01/1982",1964-11-03,1970-11-03,0,1,0,0,0,"M",1911-01-16,1911,1982-01-22,1982
"832","CHL-1970","A2.9-2494",155,"CHL","Allende","04/11/1970","11/09/1973","26/7/1908","11/09/1973",1970-11-04,1973-09-11,0,3,6,0,3.1,"M",1908-07-26,1908,1973-09-11,1973
"833","CHL-1973","A2.9-2497",155,"CHL","Pinochet","11/09/1973","11/03/1990","25/11/1915","10/12/2006",1973-09-11,1990-03-11,1,1,0,0,0,"M",1915-11-25,1915,2006-12-10,2006
"834","CHL-1990","A2.9-2500",155,"CHL","Aylwin","11/03/1990","11/03/1994","26/11/1918","-777",1990-03-11,1994-03-11,0,1,0,0,0,"M",1918-11-26,1918,NA,-777
"835","CHL-1994","A2.9-2503",155,"CHL","Frei Ruiz-Tagle","11/03/1994","11/03/2000","1942","-777",1994-03-11,2000-03-11,0,1,0,0,0,"M",NA,1942,NA,-777
"836","CHL-2000","A2.9-2506",155,"CHL","Ricardo Lagos Escobar","12/03/2000","31/12/2004","1928","-777",2000-03-12,2004-12-31,0,-888,0,0,-888,"M",NA,1928,NA,-777
"837","ARG-1874","A2.9-2509",160,"ARG","Avellanda","12/10/1874","21/09/1880","1/10/1836","1885",1874-10-12,1880-09-21,0,1,0,0,-666,"M",1836-10-01,1836,NA,1885
"838","ARG-1880","A2.9-2512",160,"ARG","Roca","21/09/1880","12/10/1886","17/07/1843","1914",1880-09-21,1886-10-12,0,1,0,0,0,"M",1843-07-17,1843,NA,1914
"839","ARG-1886","A2.9-2515",160,"ARG","Celman","12/10/1886","05/08/1890","1844","1909",1886-10-12,1890-08-05,0,1,0,0,0,"M",NA,1844,NA,1909
"840","ARG-1890","A2.9-2518",160,"ARG","Pellegrini","05/08/1890","12/10/1892","1846","1906",1890-08-05,1892-10-12,0,1,0,0,0,"M",NA,1846,NA,1906
"841","ARG-1892","A2.9-2521",160,"ARG","L.S. Pena","12/10/1892","23/01/1895","1822","1907",1892-10-12,1895-01-23,0,1,0,0,-666,"M",NA,1822,NA,1907
"842","ARG-1895","A2.9-2524",160,"ARG","J. Evaristo Uriburu","23/01/1895","12/10/1898","19/11/1831","1914",1895-01-23,1898-10-12,0,1,0,0,0,"M",1831-11-19,1831,NA,1914
"843","ARG-1898","A2.9-2527",160,"ARG","Roca","12/10/1898","12/10/1904","1843","1914",1898-10-12,1904-10-12,0,1,0,1,0,"M",NA,1843,NA,1914
"844","ARG-1904","A2.9-2530",160,"ARG","Quintana","12/10/1904","12/03/1906","19/10/1835","1906",1904-10-12,1906-03-12,0,2,0,0,-777,"M",1835-10-19,1835,NA,1906
"845","ARG-1906","A2.9-2533",160,"ARG","Alcorta","12/03/1906","12/10/1910","20/11/1860","1931",1906-03-12,1910-10-12,0,1,0,0,0,"M",1860-11-20,1860,NA,1931
"846","ARG-1910","A2.9-2536",160,"ARG","R.S. Pena","12/10/1910","06/10/1913","19/3/1851","1914",1910-10-12,1913-10-06,0,2.1,0,0,0,"M",1851-03-19,1851,NA,1914
"847","ARG-1913","A2.9-2539",160,"ARG","de la Plaza","06/10/1913","12/10/1916","2/11/1840","1919",1913-10-06,1916-10-12,0,1,0,0,0,"M",1840-11-02,1840,NA,1919
"848","ARG-1916","A2.9-2542",160,"ARG","Irigoyen","12/10/1916","12/10/1922","12/7/1852","1933",1916-10-12,1922-10-12,0,1,0,0,0,"M",1852-07-12,1852,NA,1933
"849","ARG-1922","A2.9-2545",160,"ARG","de Alvear","12/10/1922","12/10/1928","4/10/1868","1942",1922-10-12,1928-10-12,0,1,0,0,0,"M",1868-10-04,1868,NA,1942
"850","ARG-1928","A2.9-2548",160,"ARG","Irigoyen","12/10/1928","06/09/1930","12/7/1852","1933",1928-10-12,1930-09-06,0,3,6,1,2,"M",1852-07-12,1852,NA,1933
"851","ARG-1930","A2.9-2551",160,"ARG","J. Felix Uriburu","06/09/1930","20/02/1932","20/7/1868","1932",1930-09-06,1932-02-20,1,1,0,0,1,"M",1868-07-20,1868,NA,1932
"852","ARG-1932","A2.9-2554",160,"ARG","Justo","20/02/1932","20/02/1938","26/2/1876","10/01/1943",1932-02-20,1938-02-20,0,1,0,0,0,"M",1876-02-26,1876,1943-01-10,1943
"853","ARG-1938","A2.9-2557",160,"ARG","Ortiz","20/02/1938","22/06/1942","24/9/1886","1942",1938-02-20,1942-06-22,0,2.1,0,0,-777,"M",1886-09-24,1886,NA,1942
"854","ARG-1942","A2.9-2560",160,"ARG","Castillo","27/06/1942","05/06/1943","20/11/1873","12/10/1944",1942-06-27,1943-06-05,0,3,6,0,0,"M",1873-11-20,1873,1944-10-12,1944
"855","ARG-1943-1","A2.9-2563",160,"ARG","Rawson","05/06/1943","07/06/1943","4/6/1885","1952",1943-06-05,1943-06-07,1,3,16,0,1,"M",1885-06-04,1885,NA,1952
"856","ARG-1943-2","A2.9-2566",160,"ARG","Ramirez","07/06/1943","24/02/1944","30/1/1884","1962",1943-06-07,1944-02-24,1,1,0,0,0,"M",1884-01-30,1884,NA,1962
"857","ARG-1944","A2.9-2569",160,"ARG","Farrell","10/03/1944","04/06/1946","12/8/1887","1980",1944-03-10,1946-06-04,0,1,0,0,0,"M",1887-08-12,1887,NA,1980
"858","ARG-1946","A2.9-2572",160,"ARG","Peron","04/06/1946","20/09/1955","8/10/1895","01/07/1974",1946-06-04,1955-09-20,0,3,6,0,1,"M",1895-10-08,1895,1974-07-01,1974
"859","ARG-1955-1","A2.9-2575",160,"ARG","Lonardi","20/09/1955","13/11/1955","15/9/1896","22/3/1956",1955-09-20,1955-11-13,1,3,6,0,1,"M",1896-09-15,1896,1956-03-22,1956
"860","ARG-1955-2","A2.9-2578",160,"ARG","Aramburu","13/11/1955","01/05/1958","21/5/1903","31/05/1970",1955-11-13,1958-05-01,1,1,0,0,0,"M",1903-05-21,1903,1970-05-31,1970
"861","ARG-1958","A2.9-2581",160,"ARG","Frondizi","01/05/1958","29/03/1962","28/10/1908","18/04/1995",1958-05-01,1962-03-29,0,3,6,0,2,"M",1908-10-28,1908,1995-04-18,1995
"862","ARG-1962","A2.9-2584",160,"ARG","Guido","29/03/1962","12/10/1963","20/8/1910","1975",1962-03-29,1963-10-12,0,1,0,0,0,"M",1910-08-20,1910,NA,1975
"863","ARG-1963","A2.9-2587",160,"ARG","Arturo Illia","12/10/1963","28/06/1966","4/8/1900","18/01/1983",1963-10-12,1966-06-28,0,3,6,0,0,"M",1900-08-04,1900,1983-01-18,1983
"864","ARG-1966","A2.9-2590",160,"ARG","Ongania","28/06/1966","08/06/1970","17/3/1914","08/06/1995",1966-06-28,1970-06-08,1,3,6,0,0,"M",1914-03-17,1914,1995-06-08,1995
"865","ARG-1970-1","A2.9-2593",160,"ARG","Lanusse","08/06/1970","18/06/1970","28/8/1918","26/08/1996",1970-06-08,1970-06-18,1,1,0,0,0,"M",1918-08-28,1918,1996-08-26,1996
"866","ARG-1970-2","A2.9-2596",160,"ARG","Levingston","18/06/1970","22/03/1971","10/1/1920","-777",1970-06-18,1971-03-22,0,3,16,0,2,"M",1920-01-10,1920,NA,-777
"867","ARG-1971","A2.9-2599",160,"ARG","Lanusse","25/03/1971","25/05/1973","28/8/1918","26/08/1996",1971-03-25,1973-05-25,1,1,0,1,0,"M",1918-08-28,1918,1996-08-26,1996
"868","ARG-1973-1","A2.9-2602",160,"ARG","Campora","25/05/1973","13/07/1973","26/3/1909","1980",1973-05-25,1973-07-13,0,1,0,0,0,"M",1909-03-26,1909,NA,1980
"869","ARG-1973-2","A2.9-2605",160,"ARG","Lastiri","13/07/1973","12/10/1973","1915","1978",1973-07-13,1973-10-12,0,1,0,0,0,"M",NA,1915,NA,1978
"870","ARG-1973-3","A2.9-2608",160,"ARG","Peron","12/10/1973","01/07/1974","8/10/1895","01/07/1974",1973-10-12,1974-07-01,0,2,0,1,-777,"M",1895-10-08,1895,1974-07-01,1974
"871","ARG-1974","A2.9-2611",160,"ARG","Peron, Isabel","01/07/1974","29/03/1976","4/2/1931","-777",1974-07-01,1976-03-29,0,3,6,0,2,"F",1931-02-04,1931,NA,-777
"872","ARG-1976","A2.9-2614",160,"ARG","Videla","29/03/1976","29/03/1981","2/8/1925","-777",1976-03-29,1981-03-29,1,1,0,0,0,"M",1925-08-02,1925,NA,-777
"873","ARG-1981-1","A2.9-2617",160,"ARG","Viola","29/03/1981","20/11/1981","13/10/1924","1994",1981-03-29,1981-11-20,0,2.1,0,0,0,"M",1924-10-13,1924,NA,1994
"874","ARG-1981-2","A2.9-2620",160,"ARG","Liendo","20/11/1981","11/12/1981","17/12/1924","-999",1981-11-20,1981-12-11,0,3,16,0,0,"M",1924-12-17,1924,NA,NA
"875","ARG-1981-3","A2.9-2623",160,"ARG","Galtieri","12/12/1981","17/06/1982","15/7/1926","12/01/2003",1981-12-12,1982-06-17,1,3,16,0,2,"M",1926-07-15,1926,2003-01-12,2003
"876","ARG-1982-1","A2.9-2626",160,"ARG","Saint-Jean","18/06/1982","01/07/1982","1926","-777",1982-06-18,1982-07-01,1,1,0,0,0,"M",NA,1926,NA,-777
"877","ARG-1982-2","A2.9-2629",160,"ARG","Bignone","01/07/1982","10/12/1983","21/1/1928","-777",1982-07-01,1983-12-10,0,1,0,0,2,"M",1928-01-21,1928,NA,-777
"878","ARG-1983","A2.9-2632",160,"ARG","Alfonsin","10/12/1983","08/07/1988","13/3/1926","-777",1983-12-10,1988-07-08,0,1,0,0,0,"M",1926-03-13,1926,NA,-777
"879","ARG-1988","A2.9-2635",160,"ARG","Menem","08/07/1988","10/12/1999","2/7/1930","-777",1988-07-08,1999-12-10,0,1,0,0,0,"M",1930-07-02,1930,NA,-777
"880","ARG-1999","A2.9-2638",160,"ARG","de la Rua","10/12/1999","21/12/2001","15/9/1937","-777",1999-12-10,2001-12-21,0,1,0,0,0,"M",1937-09-15,1937,NA,-777
"881","ARG-2001-1","A2.9-2641",160,"ARG","Ramon Puerta","21/12/2001","23/12/2001","1951","-777",2001-12-21,2001-12-23,0,1,0,0,0,"M",NA,1951,NA,-777
"882","ARG-2001-2","A2.9-2644",160,"ARG","Adolfo Rodriguez Saa","23/12/2001","01/01/2002","1947","-777",2001-12-23,2002-01-01,0,1,0,0,0,"M",NA,1947,NA,-777
"883","ARG-2002","A2.9-2647",160,"ARG","Eduardo Duhalde","02/01/2002","25/05/2003","5/10/1941","-777",2002-01-02,2003-05-25,0,1,0,0,0,"M",1941-10-05,1941,NA,-777
"884","ARG-2003","A2.9-2650",160,"ARG","Nestor Kirchner","25/05/2003","31/12/2004","1950","-777",2003-05-25,2004-12-31,0,-888,0,0,-888,"M",NA,1950,NA,-777
"885","URU-1873","A2.9-2653",165,"URU","Jose Eugenio Ellauri","15/02/1873","15/01/1875","1834","1894",1873-02-15,1875-01-15,0,3,-999,0,1,"M",NA,1834,NA,1894
"886","URU-1875","A2.9-2656",165,"URU","Pedro Varela Olivera","15/01/1875","10/03/1876","1837","1903",1875-01-15,1876-03-10,1,3,-999,1,1,"M",NA,1837,NA,1903
"887","URU-1876","A2.9-2659",165,"URU","Lorenzo Latorre","10/03/1876","14/02/1879","1844","1916",1876-03-10,1879-02-14,1,1,0,0,0,"M",NA,1844,NA,1916
"888","URU-1879-1","A2.9-2662",165,"URU","Francisco Antonino Vidal","14/02/1879","01/03/1879","1827","1891",1879-02-14,1879-03-01,0,1,0,0,0,"M",NA,1827,NA,1891
"889","URU-1879-2","A2.9-2665",165,"URU","Lorenzo Latorre","01/03/1879","15/03/1880","1844","1916",1879-03-01,1880-03-15,0,1,0,1,1,"M",NA,1844,NA,1916
"890","URU-1880","A2.9-2668",165,"URU","Francisco Antonino Vidal","15/03/1880","28/02/1882","1827","1891",1880-03-15,1882-02-28,0,3,-999,1,0,"M",NA,1827,NA,1891
"891","URU-1882","A2.9-2671",165,"URU","Maximo Santos","01/03/1882","01/03/1886","1847","1889",1882-03-01,1886-03-01,1,1,0,0,0,"M",NA,1847,NA,1889
"892","URU-1886-1","A2.9-2674",165,"URU","Francisco Antonino Vidal","01/03/1886","24/05/1886","1827","1891",1886-03-01,1886-05-24,0,3,-999,2,-666,"M",NA,1827,NA,1891
"893","URU-1886-2","A2.9-2677",165,"URU","Maximo Santos","24/05/1886","18/11/1886","1847","1889",1886-05-24,1886-11-18,0,1,0,1,1,"M",NA,1847,NA,1889
"894","URU-1886-3","A2.9-2680",165,"URU","Maximo Tajes","18/11/1886","01/03/1890","1852","1912",1886-11-18,1890-03-01,0,1,0,0,0,"M",NA,1852,NA,1912
"895","URU-1890","A2.9-2683",165,"URU","Julio Herrera y Obes","01/03/1890","01/03/1894","1841","1912",1890-03-01,1894-03-01,0,1,0,0,0,"M",NA,1841,NA,1912
"896","URU-1894","A2.9-2686",165,"URU","Juan Idiarte Borda","21/03/1894","25/08/1897","1844","1897",1894-03-21,1897-08-25,0,3,-999,0,3,"M",NA,1844,NA,1897
"897","URU-1897","A2.9-2689",165,"URU","Juan Lindolfo Cuestas","25/08/1897","01/03/1903","6/1/1837","1905",1897-08-25,1903-03-01,1,1,0,0,1,"M",1837-01-06,1837,NA,1905
"898","URU-1903","A2.9-2692",165,"URU","Jose Batlle y Ordonez","01/03/1903","01/03/1907","21/5/1856","20/10/1929",1903-03-01,1907-03-01,0,1,0,0,1,"M",1856-05-21,1856,1929-10-20,1929
"899","URU-1907","A2.9-2695",165,"URU","Claudio Williman","01/03/1907","01/03/1911","2/9/1863","1934",1907-03-01,1911-03-01,0,1,0,0,0,"M",1863-09-02,1863,NA,1934
"900","URU-1911","A2.9-2698",165,"URU","Jose Batlle y Ordonez","01/03/1911","01/03/1915","21/5/1856","20/10/1929",1911-03-01,1915-03-01,0,1,0,1,0,"M",1856-05-21,1856,1929-10-20,1929
"901","URU-1915","A2.9-2701",165,"URU","Feliciano Viera","01/03/1915","01/03/1919","8/11/1872","1927",1915-03-01,1919-03-01,0,1,0,0,0,"M",1872-11-08,1872,NA,1927
"902","URU-1919","A2.9-2704",165,"URU","Baltasar Brum","05/03/1919","01/03/1923","18/6/1883","31/03/1933",1919-03-05,1923-03-01,0,1,0,0,0,"M",1883-06-18,1883,1933-03-31,1933
"903","URU-1923","A2.9-2707",165,"URU","Serrato","01/03/1923","01/03/1927","30/9/1868","1960",1923-03-01,1927-03-01,0,1,0,0,0,"M",1868-09-30,1868,NA,1960
"904","URU-1927","A2.9-2710",165,"URU","Campisteguy","01/03/1927","01/03/1931","7/9/1859","1937",1927-03-01,1931-03-01,0,1,0,0,0,"M",1859-09-07,1859,NA,1937
"905","URU-1931","A2.9-2713",165,"URU","Terra","01/03/1931","18/06/1938","1873","1942",1931-03-01,1938-06-18,0,1,0,0,0,"M",NA,1873,NA,1942
"906","URU-1938","A2.9-2716",165,"URU","Baldomir","19/06/1938","01/03/1943","27/8/1884","25/02/1948",1938-06-19,1943-03-01,0,1,0,0,0,"M",1884-08-27,1884,1948-02-25,1948
"907","URU-1943","A2.9-2719",165,"URU","Amezaga","01/03/1943","01/03/1947","28/1/1881","1974",1943-03-01,1947-03-01,0,1,0,0,0,"M",1881-01-28,1881,NA,1974
"908","URU-1947-1","A2.9-2722",165,"URU","Berreta","01/03/1947","01/08/1947","22/11/1875","1947",1947-03-01,1947-08-01,0,2.1,0,0,-777,"M",1875-11-22,1875,NA,1947
"909","URU-1947-2","A2.9-2725",165,"URU","Batlle Berres","01/08/1947","01/03/1951","26/11/1897","15/07/1964",1947-08-01,1951-03-01,0,1,0,0,0,"M",1897-11-26,1897,1964-07-15,1964
"910","URU-1951","A2.9-2728",165,"URU","Martinez Trueba","01/03/1951","01/03/1954","1884","1959",1951-03-01,1954-03-01,0,1,0,0,0,"M",NA,1884,NA,1959
"911","URU-1954","A2.9-2731",165,"URU","Batlle Berres","01/03/1954","01/03/1956","26/11/1897","15/07/1964",1954-03-01,1956-03-01,0,1,0,1,0,"M",1897-11-26,1897,1964-07-15,1964
"912","URU-1956","A2.9-2734",165,"URU","Zubiria","01/03/1956","01/03/1957","9/10/1901","1971",1956-03-01,1957-03-01,0,1,0,0,0,"M",1901-10-09,1901,NA,1971
"913","URU-1957","A2.9-2737",165,"URU","Lezama","01/03/1957","01/03/1958","1899","1964",1957-03-01,1958-03-01,0,1,0,0,0,"M",NA,1899,NA,1964
"914","URU-1958","A2.9-2740",165,"URU","Fisher","01/03/1958","01/03/1959","1903","1969",1958-03-01,1959-03-01,0,1,0,0,0,"M",NA,1903,NA,1969
"915","URU-1959","A2.9-2743",165,"URU","Echegoyen","02/03/1959","01/03/1960","1892","1974",1959-03-02,1960-03-01,0,1,0,0,0,"M",NA,1892,NA,1974
"916","URU-1960","A2.9-2746",165,"URU","Nardone","01/03/1960","01/03/1961","1907","1964",1960-03-01,1961-03-01,0,1,0,0,0,"M",NA,1907,NA,1964
"917","URU-1961","A2.9-2749",165,"URU","Haedo","01/03/1961","01/03/1962","1898","1970",1961-03-01,1962-03-01,0,1,0,0,0,"M",NA,1898,NA,1970
"918","URU-1962","A2.9-2752",165,"URU","Harrison","01/03/1962","01/03/1963","1900","1963",1962-03-01,1963-03-01,0,1,0,0,-777,"M",NA,1900,NA,1963
"919","URU-1963","A2.9-2755",165,"URU","Crespo","01/03/1963","02/03/1964","1901","1964",1963-03-01,1964-03-02,0,1,0,0,0,"M",NA,1901,NA,1964
"920","URU-1964","A2.9-2758",165,"URU","Giannattasio","02/03/1964","07/02/1965","1895","1965",1964-03-02,1965-02-07,0,2,0,0,-777,"M",NA,1895,NA,1965
"921","URU-1965","A2.9-2761",165,"URU","Beltran","07/02/1965","01/03/1966","6/4/1914","2003",1965-02-07,1966-03-01,0,1,0,0,0,"M",1914-04-06,1914,NA,2003
"922","URU-1966","A2.9-2764",165,"URU","Heber Usher","01/03/1966","01/03/1967","1916","1981",1966-03-01,1967-03-01,0,1,0,0,0,"M",NA,1916,NA,1981
"923","URU-1967-1","A2.9-2767",165,"URU","Gestido","01/03/1967","06/12/1967","28/11/1901","1967",1967-03-01,1967-12-06,0,2,0,0,-777,"M",1901-11-28,1901,NA,1967
"924","URU-1967-2","A2.9-2770",165,"URU","Pacheco Areco","06/12/1967","01/03/1972","9/4/1920","1998",1967-12-06,1972-03-01,0,1,0,0,0,"M",1920-04-09,1920,NA,1998
"925","URU-1972","A2.9-2773",165,"URU","Bordaberry","01/03/1972","12/06/1976","17/6/1928","-777",1972-03-01,1976-06-12,0,3,6,0,0,"M",1928-06-17,1928,NA,-777
"926","URU-1976-1","A2.9-2776",165,"URU","Demichelli","12/06/1976","01/09/1976","1894","1980",1976-06-12,1976-09-01,1,3,6,0,0,"M",NA,1894,NA,1980
"927","URU-1976-2","A2.9-2779",165,"URU","Mendez Manfredini","01/09/1976","01/09/1981","24/04/1904","26/06/1988",1976-09-01,1981-09-01,1,1,0,0,0,"M",1904-04-24,1904,1988-06-26,1988
"928","URU-1981","A2.9-2782",165,"URU","Alvarez Armalino","01/09/1981","01/03/1985","26/11/1925","-777",1981-09-01,1985-03-01,1,1,0,0,0,"M",1925-11-26,1925,NA,-777
"929","URU-1985","A2.9-2785",165,"URU","Sanguinetti","01/03/1985","01/03/1990","6/1/1936","-777",1985-03-01,1990-03-01,0,1,0,0,0,"M",1936-01-06,1936,NA,-777
"930","URU-1990","A2.9-2788",165,"URU","Lacalle de Herrera","01/03/1990","01/03/1995","1941","-777",1990-03-01,1995-03-01,0,1,0,0,0,"M",NA,1941,NA,-777
"931","URU-1995","A2.9-2791",165,"URU","Sanguinetti","01/03/1995","01/03/2000","6/1/1936","-777",1995-03-01,2000-03-01,0,1,0,1,0,"M",1936-01-06,1936,NA,-777
"932","URU-2000","A2.9-2794",165,"URU","Jorge Batlle","02/03/2000","31/12/2004","1927","-777",2000-03-02,2004-12-31,0,-888,0,0,-888,"M",NA,1927,NA,-777
"933","UKG-1874","A2.9-2797",200,"UKG","Disraeli","20/02/1874","18/04/1880","21/11/1804","19/04/1881",1874-02-20,1880-04-18,0,1,0,1,0,"M",1804-11-21,1804,1881-04-19,1881
"934","UKG-1880","A2.9-2800",200,"UKG","Gladstone","28/04/1880","09/06/1885","29/12/1809","19/05/1898",1880-04-28,1885-06-09,0,1,0,1,0,"M",1809-12-29,1809,1898-05-19,1898
"935","UKG-1885","A2.9-2803",200,"UKG","Salisbury","24/06/1885","26/01/1886","03/02/1830","1903",1885-06-24,1886-01-26,0,2.1,0,0,0,"M",1830-02-03,1830,NA,1903
"936","UKG-1886-1","A2.9-2806",200,"UKG","Gladstone","03/02/1886","20/07/1886","29/12/1809","19/05/1898",1886-02-03,1886-07-20,0,1,0,2,0,"M",1809-12-29,1809,1898-05-19,1898
"937","UKG-1886-2","A2.9-2809",200,"UKG","Salisbury","03/08/1886","11/08/1892","03/02/1830","1903",1886-08-03,1892-08-11,0,1,0,1,0,"M",1830-02-03,1830,NA,1903
"938","UKG-1892","A2.9-2812",200,"UKG","Gladstone","16/08/1892","03/03/1894","29/12/1809","19/05/1898",1892-08-16,1894-03-03,0,1,0,3,0,"M",1809-12-29,1809,1898-05-19,1898
"939","UKG-1894","A2.9-2815",200,"UKG","Rosebery","06/03/1894","24/06/1895","07/05/1847","1929",1894-03-06,1895-06-24,0,1,0,0,0,"M",1847-05-07,1847,NA,1929
"940","UKG-1895","A2.9-2818",200,"UKG","Salisbury","28/06/1895","11/07/1902","03/02/1830","1903",1895-06-28,1902-07-11,0,1,0,2,0,"M",1830-02-03,1830,NA,1903
"941","UKG-1902","A2.9-2821",200,"UKG","Balfour","12/07/1902","04/12/1905","25/07/1848","19/03/1930",1902-07-12,1905-12-04,0,1,0,0,0,"M",1848-07-25,1848,1930-03-19,1930
"942","UKG-1905","A2.9-2824",200,"UKG","Campbell-Bannerman","10/12/1905","06/04/1908","07/09/1836","22/04/1908",1905-12-10,1908-04-06,0,2.1,0,0,-777,"M",1836-09-07,1836,1908-04-22,1908
"943","UKG-1908","A2.9-2827",200,"UKG","Asquith","06/04/1908","05/12/1916","12/09/1852","15/02/1928",1908-04-06,1916-12-05,0,1,0,0,0,"M",1852-09-12,1852,1928-02-15,1928
"944","UKG-1916","A2.9-2830",200,"UKG","Lloyd-George","10/12/1916","19/10/1922","17/11/1863","26/03/1945",1916-12-10,1922-10-19,0,1,0,0,0,"M",1863-11-17,1863,1945-03-26,1945
"945","UKG-1922","A2.9-2833",200,"UKG","Bonar Law","24/10/1922","20/05/1923","16/09/1858","30/10/1923",1922-10-24,1923-05-20,0,2.1,0,0,0,"M",1858-09-16,1858,1923-10-30,1923
"946","UKG-1923","A2.9-2836",200,"UKG","Baldwin","27/05/1923","22/01/1924","03/08/1867","14/14/1947",1923-05-27,1924-01-22,0,1,0,0,0,"M",1867-08-03,1867,NA,NA
"947","UKG-1924-1","A2.9-2839",200,"UKG","MacDonald","23/01/1924","04/11/1924","12/10/1866","09/11/1937",1924-01-23,1924-11-04,0,1,0,0,0,"M",1866-10-12,1866,1937-11-09,1937
"948","UKG-1924-2","A2.9-2842",200,"UKG","Baldwin","06/11/1924","04/06/1929","03/08/1867","14/14/1947",1924-11-06,1929-06-04,0,1,0,1,0,"M",1867-08-03,1867,NA,NA
"949","UKG-1929","A2.9-2845",200,"UKG","MacDonald","08/06/1929","07/06/1935","12/10/1867","09/11/1937",1929-06-08,1935-06-07,0,1,0,1,0,"M",1867-10-12,1867,1937-11-09,1937
"950","UKG-1935","A2.9-2848",200,"UKG","Baldwin","07/06/1935","28/05/1937","03/08/1867","14/14/1947",1935-06-07,1937-05-28,0,1,0,2,0,"M",1867-08-03,1867,NA,NA
"951","UKG-1937","A2.9-2851",200,"UKG","Chamberlin","28/05/1937","10/05/1940","18/04/1869","09/11/1940",1937-05-28,1940-05-10,0,1,0,0,0,"M",1869-04-18,1869,1940-11-09,1940
"952","UKG-1940","A2.9-2854",200,"UKG","Churchill","10/05/1940","27/07/1945","30/11/1874","24/01/1965",1940-05-10,1945-07-27,0,1,0,0,0,"M",1874-11-30,1874,1965-01-24,1965
"953","UKG-1945","A2.9-2857",200,"UKG","Atlee","27/07/1945","26/10/1951","03/01/1883","08/10/1967",1945-07-27,1951-10-26,0,1,0,0,0,"M",1883-01-03,1883,1967-10-08,1967
"954","UKG-1951","A2.9-2860",200,"UKG","Churchill","26/10/1951","05/04/1955","30/11/1874","24/01/1965",1951-10-26,1955-04-05,0,1,0,1,0,"M",1874-11-30,1874,1965-01-24,1965
"955","UKG-1955","A2.9-2863",200,"UKG","Eden","06/04/1955","09/01/1957","12/06/1897","14/01/1977",1955-04-06,1957-01-09,0,2.1,0,0,0,"M",1897-06-12,1897,1977-01-14,1977
"956","UKG-1957","A2.9-2866",200,"UKG","MacMillan","10/01/1957","18/10/1963","10/02/1894","29/12/1986",1957-01-10,1963-10-18,0,1,0,0,0,"M",1894-02-10,1894,1986-12-29,1986
"957","UKG-1963","A2.9-2869",200,"UKG","Douglas-Home","18/10/1963","16/10/1964","8/3/1903","09/10/1995",1963-10-18,1964-10-16,0,1,0,0,0,"M",1903-03-08,1903,1995-10-09,1995
"958","UKG-1964","A2.9-2872",200,"UKG","Wilson","16/10/1964","19/06/1970","11/3/1916","1995",1964-10-16,1970-06-19,0,1,0,0,0,"M",1916-03-11,1916,NA,1995
"959","UKG-1970","A2.9-2875",200,"UKG","Heath","19/06/1970","04/03/1974","9/7/1916","17/05/2005",1970-06-19,1974-03-04,0,1,0,0,0,"M",1916-07-09,1916,2005-05-17,2005
"960","UKG-1974","A2.9-2878",200,"UKG","Wilson","04/03/1974","05/04/1976","11/3/1916","1995",1974-03-04,1976-04-05,0,1,0,1,0,"M",1916-03-11,1916,NA,1995
"961","UKG-1976","A2.9-2881",200,"UKG","Callaghan","05/04/1976","04/05/1979","27/03/1912","26/03/2005",1976-04-05,1979-05-04,0,1,0,0,0,"M",1912-03-27,1912,2005-03-26,2005
"962","UKG-1979","A2.9-2884",200,"UKG","Thatcher","04/05/1979","28/11/1990","13/10/1925","-777",1979-05-04,1990-11-28,0,1,0,0,0,"F",1925-10-13,1925,NA,-777
"963","UKG-1990","A2.9-2887",200,"UKG","Major","28/11/1990","02/05/1997","29/03/1943","-777",1990-11-28,1997-05-02,0,1,0,0,0,"M",1943-03-29,1943,NA,-777
"964","UKG-1997","A2.9-2890",200,"UKG","Blair","02/05/1997","31/12/2004","6/5/1953","-777",1997-05-02,2004-12-31,0,-888,0,0,-888,"M",1953-05-06,1953,NA,-777
"965","IRE-1919","A2.9-2893",205,"IRE","de Valera","01/04/1919","05/12/1921","14/10/1882","29/08/1975",1919-04-01,1921-12-05,1,1,0,0,0,"M",1882-10-14,1882,1975-08-29,1975
"966","IRE-1922-1","A2.9-2896",205,"IRE","Griffith","10/01/1922","12/08/1922","31/03/1872","12/08/1922",1922-01-10,1922-08-12,0,2,0,0,-777,"M",1872-03-31,1872,1922-08-12,1922
"967","IRE-1922-2","A2.9-2899",205,"IRE","Collins","12/08/1922","22/08/1922","16/10/1890","22/08/1922",1922-08-12,1922-08-22,0,3,4,0,3,"M",1890-10-16,1890,1922-08-22,1922
"968","IRE-1922-3","A2.9-2902",205,"IRE","Cosgrave, W.","09/09/1922","09/03/1932","06/06/1880","16/11/1965",1922-09-09,1932-03-09,0,1,0,0,0,"M",1880-06-06,1880,1965-11-16,1965
"969","IRE-1932","A2.9-2905",205,"IRE","de Valera","09/03/1932","18/02/1948","14/10/1882","29/08/1975",1932-03-09,1948-02-18,0,1,0,1,0,"M",1882-10-14,1882,1975-08-29,1975
"970","IRE-1948","A2.9-2908",205,"IRE","Costello","18/02/1948","13/06/1951","20/06/1891","05/01/1976",1948-02-18,1951-06-13,0,1,0,0,0,"M",1891-06-20,1891,1976-01-05,1976
"971","IRE-1951","A2.9-2911",205,"IRE","de Valera","13/06/1951","02/06/1954","14/10/1882","29/08/1975",1951-06-13,1954-06-02,0,1,0,2,0,"M",1882-10-14,1882,1975-08-29,1975
"972","IRE-1954","A2.9-2914",205,"IRE","Costello","02/06/1954","20/03/1957","20/06/1891","05/01/1976",1954-06-02,1957-03-20,0,1,0,1,0,"M",1891-06-20,1891,1976-01-05,1976
"973","IRE-1957","A2.9-2917",205,"IRE","de Valera","20/03/1957","23/06/1959","14/10/1882","29/08/1975",1957-03-20,1959-06-23,0,1,0,3,0,"M",1882-10-14,1882,1975-08-29,1975
"974","IRE-1959","A2.9-2920",205,"IRE","LeMass","23/06/1959","10/11/1966","15/07/1899","11/05/1971",1959-06-23,1966-11-10,0,1,0,0,0,"M",1899-07-15,1899,1971-05-11,1971
"975","IRE-1966","A2.9-2923",205,"IRE","Lynch","10/11/1966","14/03/1973","15/08/1917","20/10/1999",1966-11-10,1973-03-14,0,1,0,0,0,"M",1917-08-15,1917,1999-10-20,1999
"976","IRE-1973","A2.9-2926",205,"IRE","Cosgrave, L.","14/03/1973","05/07/1977","30/04/1920","-777",1973-03-14,1977-07-05,0,1,0,0,0,"M",1920-04-30,1920,NA,-777
"977","IRE-1977","A2.9-2929",205,"IRE","Lynch","05/07/1977","11/12/1979","15/08/1917","20/10/1999",1977-07-05,1979-12-11,0,1,0,1,0,"M",1917-08-15,1917,1999-10-20,1999
"978","IRE-1979","A2.9-2932",205,"IRE","Haughey","11/12/1979","30/06/1981","16/09/1925","13/06/2006",1979-12-11,1981-06-30,0,1,0,0,0,"M",1925-09-16,1925,2006-06-13,2006
"979","IRE-1981","A2.9-2935",205,"IRE","Fitzgerald","30/06/1981","09/03/1982","9/2/1926","-777",1981-06-30,1982-03-09,0,1,0,0,0,"M",1926-02-09,1926,NA,-777
"980","IRE-1982-1","A2.9-2938",205,"IRE","Haughey","09/03/1982","14/12/1982","16/09/1925","13/06/2006",1982-03-09,1982-12-14,0,1,0,1,0,"M",1925-09-16,1925,2006-06-13,2006
"981","IRE-1982-2","A2.9-2941",205,"IRE","Fitzgerald","14/12/1982","10/03/1987","9/2/1926","-777",1982-12-14,1987-03-10,0,1,0,1,0,"M",1926-02-09,1926,NA,-777
"982","IRE-1987","A2.9-2944",205,"IRE","Haughey","10/03/1987","11/02/1992","16/09/1925","13/06/2006",1987-03-10,1992-02-11,0,1,0,2,0,"M",1925-09-16,1925,2006-06-13,2006
"983","IRE-1992","A2.9-2947",205,"IRE","Reynolds","11/02/1992","15/12/1994","3/11/1935","-777",1992-02-11,1994-12-15,0,1,0,0,0,"M",1935-11-03,1935,NA,-777
"984","IRE-1994","A2.9-2950",205,"IRE","Bruton","15/12/1994","26/06/1997","1947","-777",1994-12-15,1997-06-26,0,1,0,0,0,"M",NA,1947,NA,-777
"985","IRE-1997","A2.9-2953",205,"IRE","Ahern","26/06/1997","31/12/2004","1951","-777",1997-06-26,2004-12-31,0,-888,0,0,-888,"M",NA,1951,NA,-777
"986","NTH-1874","A2.9-2956",210,"NTH","Heemskerk, JA","27/08/1874","03/11/1877","30/07/1818","1897",1874-08-27,1877-11-03,0,1,0,1,0,"M",1818-07-30,1818,NA,1897
"987","NTH-1877","A2.9-2959",210,"NTH","Kappeye van de Coppello","03/11/1877","11/08/1879","08/11/1822","1895",1877-11-03,1879-08-11,0,1,0,0,0,"M",1822-11-08,1822,NA,1895
"988","NTH-1879","A2.9-2962",210,"NTH","van Lynden","20/08/1879","23/04/1883","04/02/1826","1885",1879-08-20,1883-04-23,0,1,0,0,0,"M",1826-02-04,1826,NA,1885
"989","NTH-1883","A2.9-2965",210,"NTH","Heemskerk, JA","23/04/1883","21/04/1888","30/07/1818","1897",1883-04-23,1888-04-21,0,1,0,2,0,"M",1818-07-30,1818,NA,1897
"990","NTH-1888","A2.9-2968",210,"NTH","Mackay","21/04/1888","21/08/1891","1838","1909",1888-04-21,1891-08-21,0,1,0,0,0,"M",NA,1838,NA,1909
"991","NTH-1891","A2.9-2971",210,"NTH","van Tienhoven","21/08/1891","07/05/1894","12/02/1841","1914",1891-08-21,1894-05-07,0,1,0,0,0,"M",1841-02-12,1841,NA,1914
"992","NTH-1894","A2.9-2974",210,"NTH","Roell","09/05/1894","27/07/1897","21/07/1844","1914",1894-05-09,1897-07-27,0,1,0,0,0,"M",1844-07-21,1844,NA,1914
"993","NTH-1897","A2.9-2977",210,"NTH","Pierson","27/07/1897","01/08/1901","1839","1909",1897-07-27,1901-08-01,0,1,0,0,0,"M",NA,1839,NA,1909
"994","NTH-1901","A2.9-2980",210,"NTH","Kuyper","01/08/1901","16/08/1905","29/10/1837","1920",1901-08-01,1905-08-16,0,1,0,0,0,"M",1837-10-29,1837,NA,1920
"995","NTH-1905","A2.9-2983",210,"NTH","de Meester","16/08/1905","11/02/1908","16/12/1851","1919",1905-08-16,1908-02-11,0,1,0,0,0,"M",1851-12-16,1851,NA,1919
"996","NTH-1908","A2.9-2986",210,"NTH","Heemskerk, T","12/02/1908","25/08/1913","02/07/1852","1932",1908-02-12,1913-08-25,0,1,0,0,0,"M",1852-07-02,1852,NA,1932
"997","NTH-1913","A2.9-2989",210,"NTH","van der Linden","29/08/1913","03/07/1918","14/05/1846","1935",1913-08-29,1918-07-03,0,1,0,0,0,"M",1846-05-14,1846,NA,1935
"998","NTH-1918","A2.9-2992",210,"NTH","de Beerenbrouck","09/09/1918","30/06/1925","01/12/1873","1936",1918-09-09,1925-06-30,0,1,0,0,0,"M",1873-12-01,1873,NA,1936
"999","NTH-1925","A2.9-2995",210,"NTH","Colijn","04/08/1925","08/03/1926","22/06/1869","18/09/1944",1925-08-04,1926-03-08,0,1,0,0,0,"M",1869-06-22,1869,1944-09-18,1944
"1000","NTH-1926","A2.9-2998",210,"NTH","de Geer","08/03/1926","02/07/1929","14/12/1870","1960",1926-03-08,1929-07-02,0,1,0,0,0,"M",1870-12-14,1870,NA,1960
"1001","NTH-1929","A2.9-3001",210,"NTH","de Beerenbrouck","10/08/1929","25/04/1933","01/12/1873","1936",1929-08-10,1933-04-25,0,1,0,1,0,"M",1873-12-01,1873,NA,1936
"1002","NTH-1933","A2.9-3004",210,"NTH","Colijn","26/05/1933","27/07/1939","22/06/1869","18/09/1944",1933-05-26,1939-07-27,0,1,0,1,2,"M",1869-06-22,1869,1944-09-18,1944
"1003","NTH-1939","A2.9-3007",210,"NTH","de Geer","10/08/1939","14/05/1940","14/12/1870","1960",1939-08-10,1940-05-14,0,4,9,1,1,"M",1870-12-14,1870,NA,1960
"1004","NTH-1945","A2.9-3010",210,"NTH","Schermerhorn","24/06/1945","17/05/1946","17/12/1894","1977",1945-06-24,1946-05-17,0,1,0,0,0,"M",1894-12-17,1894,NA,1977
"1005","NTH-1946","A2.9-3013",210,"NTH","Beel","03/07/1946","07/07/1948","12/4/1902","1977",1946-07-03,1948-07-07,0,1,0,0,0,"M",1902-04-12,1902,NA,1977
"1006","NTH-1948","A2.9-3016",210,"NTH","Drees","07/08/1948","22/12/1958","05/07/1886","14/05/1988",1948-08-07,1958-12-22,0,1,0,0,0,"M",1886-07-05,1886,1988-05-14,1988
"1007","NTH-1958","A2.9-3019",210,"NTH","Beel","22/12/1958","19/05/1959","12/4/1902","1977",1958-12-22,1959-05-19,0,1,0,1,0,"M",1902-04-12,1902,NA,1977
"1008","NTH-1959","A2.9-3022",210,"NTH","de Quay","19/05/1959","15/05/1963","26/08/1901","04/07/1985",1959-05-19,1963-05-15,0,1,0,0,0,"M",1901-08-26,1901,1985-07-04,1985
"1009","NTH-1963","A2.9-3025",210,"NTH","Marijnen","24/07/1963","26/02/1965","21/02/1917","1975",1963-07-24,1965-02-26,0,1,0,0,0,"M",1917-02-21,1917,NA,1975
"1010","NTH-1965","A2.9-3028",210,"NTH","Cals","27/04/1965","14/10/1966","18/07/1914","1971",1965-04-27,1966-10-14,0,1,0,0,0,"M",1914-07-18,1914,NA,1971
"1011","NTH-1966","A2.9-3031",210,"NTH","Zijlstra","22/11/1966","15/02/1967","27/08/1918","2001",1966-11-22,1967-02-15,0,1,0,0,0,"M",1918-08-27,1918,NA,2001
"1012","NTH-1967","A2.9-3034",210,"NTH","De Jong","03/04/1967","29/04/1971","3/4/1915","-777",1967-04-03,1971-04-29,0,1,0,0,0,"M",1915-04-03,1915,NA,-777
"1013","NTH-1971","A2.9-3037",210,"NTH","Biesheuvel","06/07/1971","11/05/1973","5/4/1920","2001",1971-07-06,1973-05-11,0,1,0,0,0,"M",1920-04-05,1920,NA,2001
"1014","NTH-1973","A2.9-3040",210,"NTH","den Uyl","11/05/1973","19/12/1977","9/8/1919","24/12/1987",1973-05-11,1977-12-19,0,1,0,0,0,"M",1919-08-09,1919,1987-12-24,1987
"1015","NTH-1977","A2.9-3043",210,"NTH","van Agt","19/12/1977","04/11/1982","2/2/1931","-777",1977-12-19,1982-11-04,0,1,0,0,0,"M",1931-02-02,1931,NA,-777
"1016","NTH-1982","A2.9-3046",210,"NTH","Lubbers","04/11/1982","22/08/1994","7/5/1939","-777",1982-11-04,1994-08-22,0,1,0,0,0,"M",1939-05-07,1939,NA,-777
"1017","NTH-1994","A2.9-3049",210,"NTH","Kok","22/08/1994","22/07/2002","29/09/1938","-777",1994-08-22,2002-07-22,0,1,0,0,0,"M",1938-09-29,1938,NA,-777
"1018","NTH-2002","A2.9-3052",210,"NTH","Jan Peter Balkenende","22/07/2002","31/12/2004","07/05/1956","-777",2002-07-22,2004-12-31,0,-888,0,0,-888,"M",1956-05-07,1956,NA,-777
"1019","BEL-1871","A2.9-3055",211,"BEL","Jules Malou","07/12/1871","19/06/1878","1810","1886",1871-12-07,1878-06-19,0,1,0,0,0,"M",NA,1810,NA,1886
"1020","BEL-1878","A2.9-3058",211,"BEL","Walthere Frere-Orban","19/06/1878","16/06/1884","22/04/1812","02/02/1896",1878-06-19,1884-06-16,0,1,0,1,0,"M",1812-04-22,1812,1896-02-02,1896
"1021","BEL-1884-1","A2.9-3061",211,"BEL","Jules Malou","16/06/1884","26/10/1884","1810","1886",1884-06-16,1884-10-26,0,1,0,1,0,"M",NA,1810,NA,1886
"1022","BEL-1884-2","A2.9-3064",211,"BEL","Auguste Marie Franaois Beernaert","26/10/1884","26/03/1894","26/07/1829","06/10/1912",1884-10-26,1894-03-26,0,1,0,0,0,"M",1829-07-26,1829,1912-10-06,1912
"1023","BEL-1894","A2.9-3067",211,"BEL","Jules Philippe Marie de Burlet","26/03/1894","25/02/1896","10/04/1844","01/03/1897",1894-03-26,1896-02-25,0,1,0,0,-777,"M",1844-04-10,1844,1897-03-01,1897
"1024","BEL-1896","A2.9-3070",211,"BEL","Paul de Smet de Nayer","25/02/1896","24/01/1899","1843","1913",1896-02-25,1899-01-24,0,1,0,0,0,"M",NA,1843,NA,1913
"1025","BEL-1899-1","A2.9-3073",211,"BEL","Julius Vandenpeereboom","24/01/1899","05/08/1899","1843","1917",1899-01-24,1899-08-05,0,1,0,0,0,"M",NA,1843,NA,1917
"1026","BEL-1899-2","A2.9-3076",211,"BEL","Paul de Smet de Nayer","05/08/1899","02/05/1907","1843","1913",1899-08-05,1907-05-02,0,1,0,1,0,"M",NA,1843,NA,1913
"1027","BEL-1907","A2.9-3079",211,"BEL","Jules de Trooz","02/05/1907","31/12/1907","12/01/1857","1907",1907-05-02,1907-12-31,0,2,0,0,-777,"M",1857-01-12,1857,NA,1907
"1028","BEL-1908","A2.9-3082",211,"BEL","Frans Schollaert","09/01/1908","17/06/1911","19/08/1851","1917",1908-01-09,1911-06-17,0,1,0,0,0,"M",1851-08-19,1851,NA,1917
"1029","BEL-1911","A2.9-3085",211,"BEL","Charles, baron de Broqueville","17/06/1911","01/08/1914","04/12/1860","05/09/1940",1911-06-17,1914-08-01,0,4,-999,0,1,"M",1860-12-04,1860,1940-09-05,1940
"1030","BEL-1914-1","A2.9-3088",211,"BEL","Von der Golt","26/08/1914","27/11/1914","-999","-999",1914-08-26,1914-11-27,2,1,0,0,0,"M",NA,NA,NA,NA
"1031","BEL-1914-2","A2.9-3091",211,"BEL","Von Bissing","27/11/1914","18/04/1917","1844","18/04/1917",1914-11-27,1917-04-18,0,2,0,0,-777,"M",NA,1844,1917-04-18,1917
"1032","BEL-1917","A2.9-3094",211,"BEL","Von Falkenhausen","18/04/1917","11/11/1918","-999","-999",1917-04-18,1918-11-11,0,4,-999,0,0,"M",NA,NA,NA,NA
"1033","BEL-1918-1","A2.9-3097",211,"BEL","Geraard Cooreman","11/11/1918","13/11/1918","25/03/1852","1926",1918-11-11,1918-11-13,0,1,0,0,0,"M",1852-03-25,1852,NA,1926
"1034","BEL-1918-2","A2.9-3100",211,"BEL","Delacroix","22/11/1918","03/11/1920","27/12/1876","15/10/1929",1918-11-22,1920-11-03,0,1,0,0,0,"M",1876-12-27,1876,1929-10-15,1929
"1035","BEL-1920","A2.9-3103",211,"BEL","de Wiart","18/11/1920","19/11/1921","31/01/1869","06/05/1951",1920-11-18,1921-11-19,0,1,0,0,0,"M",1869-01-31,1869,1951-05-06,1951
"1036","BEL-1921","A2.9-3106",211,"BEL","Theunis","15/12/1921","05/04/1925","1873","1944",1921-12-15,1925-04-05,0,1,0,0,0,"M",NA,1873,NA,1944
"1037","BEL-1925-1","A2.9-3109",211,"BEL","van der Vyvere","13/05/1925","22/05/1925","1871","1961",1925-05-13,1925-05-22,0,1,0,0,0,"M",NA,1871,NA,1961
"1038","BEL-1925-2","A2.9-3112",211,"BEL","Poullet","17/06/1925","06/05/1926","1868","1937",1925-06-17,1926-05-06,0,2.1,0,0,0,"M",NA,1868,NA,1937
"1039","BEL-1926","A2.9-3115",211,"BEL","Jasper","20/05/1926","21/05/1931","28/07/1870","15/02/1939",1926-05-20,1931-05-21,0,1,0,0,0,"M",1870-07-28,1870,1939-02-15,1939
"1040","BEL-1931","A2.9-3118",211,"BEL","Renkin","05/06/1931","18/10/1932","1862","1934",1931-06-05,1932-10-18,0,1,0,0,0,"M",NA,1862,NA,1934
"1041","BEL-1932","A2.9-3121",211,"BEL","Charles, baron de Broqueville","22/10/1932","13/11/1934","04/12/1860","05/09/1940",1932-10-22,1934-11-13,0,1,0,1,0,"M",1860-12-04,1860,1940-09-05,1940
"1042","BEL-1934","A2.9-3124",211,"BEL","Theunis","19/11/1934","19/03/1935","1873","1944",1934-11-19,1935-03-19,0,1,0,1,0,"M",NA,1873,NA,1944
"1043","BEL-1935","A2.9-3127",211,"BEL","van ZeeLand","26/03/1935","25/10/1937","1893","1973",1935-03-26,1937-10-25,0,1,0,0,0,"M",NA,1893,NA,1973
"1044","BEL-1937","A2.9-3130",211,"BEL","Janson","24/11/1937","13/05/1938","30/05/1872","03/03/1944",1937-11-24,1938-05-13,0,1,0,0,0,"M",1872-05-30,1872,1944-03-03,1944
"1045","BEL-1938","A2.9-3133",211,"BEL","Spaak","15/05/1938","09/02/1939","1899","31/07/1972",1938-05-15,1939-02-09,0,1,0,0,0,"M",NA,1899,1972-07-31,1972
"1046","BEL-1939","A2.9-3136",211,"BEL","Pierlot","09/02/1939","28/05/1940","1883","1963",1939-02-09,1940-05-28,0,4,9,0,1,"M",NA,1883,NA,1963
"1047","BEL-1944","A2.9-3139",211,"BEL","Pierlot","03/09/1944","07/02/1945","1883","1963",1944-09-03,1945-02-07,0,1,0,1,0,"M",NA,1883,NA,1963
"1048","BEL-1945","A2.9-3142",211,"BEL","van Acker","11/02/1945","18/02/1946","1898","1975",1945-02-11,1946-02-18,0,1,0,0,0,"M",NA,1898,NA,1975
"1049","BEL-1946-1","A2.9-3145",211,"BEL","Spaak","12/03/1946","21/03/1946","1899","31/07/1972",1946-03-12,1946-03-21,0,1,0,1,0,"M",NA,1899,1972-07-31,1972
"1050","BEL-1946-2","A2.9-3148",211,"BEL","van Acker","31/03/1946","09/07/1946","1898","1975",1946-03-31,1946-07-09,0,1,0,1,0,"M",NA,1898,NA,1975
"1051","BEL-1946-3","A2.9-3151",211,"BEL","Huysman","02/08/1946","12/03/1947","26/05/1871","25/02/1968",1946-08-02,1947-03-12,0,1,0,0,0,"M",1871-05-26,1871,1968-02-25,1968
"1052","BEL-1947","A2.9-3154",211,"BEL","Spaak","19/03/1947","28/06/1949","1899","31/07/1972",1947-03-19,1949-06-28,0,1,0,2,0,"M",NA,1899,1972-07-31,1972
"1053","BEL-1949","A2.9-3157",211,"BEL","Eyskens, G.","10/08/1949","18/03/1950","1/4/1905","03/01/1988",1949-08-10,1950-03-18,0,1,0,0,0,"M",1905-04-01,1905,1988-01-03,1988
"1054","BEL-1950-1","A2.9-3160",211,"BEL","Duvieusart","08/06/1950","11/08/1950","10/04/1900","10/10/1977",1950-06-08,1950-08-11,0,1,0,0,0,"M",1900-04-10,1900,1977-10-10,1977
"1055","BEL-1950-2","A2.9-3163",211,"BEL","Pholien","15/08/1950","09/01/1952","28/12/1884","04/01/1968",1950-08-15,1952-01-09,0,1,0,0,0,"M",1884-12-28,1884,1968-01-04,1968
"1056","BEL-1952","A2.9-3166",211,"BEL","van Houtte","15/01/1952","12/04/1954","1907","1991",1952-01-15,1954-04-12,0,1,0,0,0,"M",NA,1907,NA,1991
"1057","BEL-1954","A2.9-3169",211,"BEL","van Acker","22/04/1954","02/06/1958","1898","1975",1954-04-22,1958-06-02,0,1,0,2,0,"M",NA,1898,NA,1975
"1058","BEL-1958","A2.9-3172",211,"BEL","Eyskens, G.","25/06/1958","27/03/1961","1/4/1905","03/01/1988",1958-06-25,1961-03-27,0,1,0,1,0,"M",1905-04-01,1905,1988-01-03,1988
"1059","BEL-1961","A2.9-3175",211,"BEL","Lefevre","25/04/1961","27/07/1965","1914","1973",1961-04-25,1965-07-27,0,1,0,0,0,"M",NA,1914,NA,1973
"1060","BEL-1965","A2.9-3178",211,"BEL","Harmel","27/07/1965","11/02/1966","1911","-777",1965-07-27,1966-02-11,0,1,0,0,0,"M",NA,1911,NA,-777
"1061","BEL-1966","A2.9-3181",211,"BEL","Vanden Boeynants","19/03/1966","16/06/1968","22/05/1919","2001",1966-03-19,1968-06-16,0,1,0,0,0,"M",1919-05-22,1919,NA,2001
"1062","BEL-1968","A2.9-3184",211,"BEL","Eyskens, G.","17/06/1968","26/01/1973","1/4/1905","03/01/1988",1968-06-17,1973-01-26,0,1,0,2,0,"M",1905-04-01,1905,1988-01-03,1988
"1063","BEL-1973","A2.9-3187",211,"BEL","Leburton","26/01/1973","24/04/1974","1915","1997",1973-01-26,1974-04-24,0,1,0,0,0,"M",NA,1915,NA,1997
"1064","BEL-1974","A2.9-3190",211,"BEL","Tindemans","25/04/1974","20/10/1978","1922","-777",1974-04-25,1978-10-20,0,1,0,0,0,"M",NA,1922,NA,-777
"1065","BEL-1978","A2.9-3193",211,"BEL","Vanden Boeynants","20/10/1978","03/04/1979","22/05/1919","2001",1978-10-20,1979-04-03,0,1,0,1,0,"M",1919-05-22,1919,NA,2001
"1066","BEL-1979","A2.9-3196",211,"BEL","Martens","03/04/1979","06/04/1981","19/04/1936","-777",1979-04-03,1981-04-06,0,1,0,0,0,"M",1936-04-19,1936,NA,-777
"1067","BEL-1981-1","A2.9-3199",211,"BEL","Eyskens, M.","06/04/1981","17/12/1981","1933","-777",1981-04-06,1981-12-17,0,1,0,0,0,"M",NA,1933,NA,-777
"1068","BEL-1981-2","A2.9-3202",211,"BEL","Martens","17/12/1981","07/03/1992","19/04/1936","-777",1981-12-17,1992-03-07,0,1,0,1,0,"M",1936-04-19,1936,NA,-777
"1069","BEL-1992","A2.9-3205",211,"BEL","Dehaene","07/03/1992","12/07/1999","07/08/1940","-777",1992-03-07,1999-07-12,0,1,0,0,0,"M",1940-08-07,1940,NA,-777
"1070","BEL-1999","A2.9-3208",211,"BEL","Verhofstadt","12/07/1999","31/12/2004","1953","-777",1999-07-12,2004-12-31,0,-888,0,0,-888,"M",NA,1953,NA,-777
"1071","LUX-1874","A2.9-3211",212,"LUX","Felix de Blochausen","26/12/1874","20/02/1885","1834","1915",1874-12-26,1885-02-20,0,1,0,0,0,"M",NA,1834,NA,1915
"1072","LUX-1885","A2.9-3214",212,"LUX","Edouard Thilges","20/02/1885","22/09/1888","1817","1904",1885-02-20,1888-09-22,0,1,0,0,0,"M",NA,1817,NA,1904
"1073","LUX-1888","A2.9-3217",212,"LUX","Paul Eyschen","22/09/1888","12/10/1915","09/09/1841","1915",1888-09-22,1915-10-12,0,2,0,0,-777,"M",1841-09-09,1841,NA,1915
"1074","LUX-1915-1","A2.9-3220",212,"LUX","Mathias Mongenast","12/10/1915","06/11/1915","1843","1926",1915-10-12,1915-11-06,0,1,0,0,0,"M",NA,1843,NA,1926
"1075","LUX-1915-2","A2.9-3223",212,"LUX","Hubert Loutsch","06/11/1915","24/02/1916","1878","1946",1915-11-06,1916-02-24,0,1,0,0,0,"M",NA,1878,NA,1946
"1076","LUX-1916","A2.9-3226",212,"LUX","Victor Thorn","24/02/1916","19/06/1917","31/01/1844","1930",1916-02-24,1917-06-19,0,1,0,0,0,"M",1844-01-31,1844,NA,1930
"1077","LUX-1917","A2.9-3229",212,"LUX","Leon Kauffman","19/06/1917","28/09/1918","1869","1952",1917-06-19,1918-09-28,0,1,0,0,0,"M",NA,1869,NA,1952
"1078","LUX-1918","A2.9-3232",212,"LUX","Reuter","28/09/1918","01/03/1925","1874","1973",1918-09-28,1925-03-01,0,1,0,0,0,"M",NA,1874,NA,1973
"1079","LUX-1925","A2.9-3235",212,"LUX","Prum","01/03/1925","01/07/1926","1886","1950",1925-03-01,1926-07-01,0,1,0,0,0,"M",NA,1886,NA,1950
"1080","LUX-1926","A2.9-3238",212,"LUX","Bech","16/07/1926","19/10/1937","17/02/1887","1975",1926-07-16,1937-10-19,0,1,0,0,0,"M",1887-02-17,1887,NA,1975
"1081","LUX-1937","A2.9-3241",212,"LUX","Dupong","05/11/1937","10/05/1940","01/11/1885","1953",1937-11-05,1940-05-10,0,4,9,0,1,"M",1885-11-01,1885,NA,1953
"1082","LUX-1945","A2.9-3244",212,"LUX","Dupong","09/05/1945","22/12/1953","01/11/1885","1953",1945-05-09,1953-12-22,0,2,0,1,-777,"M",1885-11-01,1885,NA,1953
"1083","LUX-1953","A2.9-3247",212,"LUX","Bech","28/12/1953","26/03/1958","17/02/1887","1975",1953-12-28,1958-03-26,0,1,0,1,0,"M",1887-02-17,1887,NA,1975
"1084","LUX-1958","A2.9-3250",212,"LUX","Frieden","31/03/1958","23/02/1959","28/10/1892","1959",1958-03-31,1959-02-23,0,2,0,0,-777,"M",1892-10-28,1892,NA,1959
"1085","LUX-1959","A2.9-3253",212,"LUX","Werner","07/03/1959","27/05/1974","29/12/1913","2002",1959-03-07,1974-05-27,0,1,0,0,0,"M",1913-12-29,1913,NA,2002
"1086","LUX-1974","A2.9-3256",212,"LUX","Thorn G.","15/06/1974","19/07/1979","3/9/1928","-777",1974-06-15,1979-07-19,0,1,0,0,0,"M",1928-09-03,1928,NA,-777
"1087","LUX-1979","A2.9-3259",212,"LUX","Werner","19/07/1979","20/07/1984","29/12/1913","2002",1979-07-19,1984-07-20,0,1,0,1,0,"M",1913-12-29,1913,NA,2002
"1088","LUX-1984","A2.9-3262",212,"LUX","Santer","20/07/1984","20/01/1995","18/05/1937","-777",1984-07-20,1995-01-20,0,1,0,0,0,"M",1937-05-18,1937,NA,-777
"1089","LUX-1995","A2.9-3265",212,"LUX","Juncker","20/01/1995","31/12/2004","1954","-777",1995-01-20,2004-12-31,0,-888,0,0,-888,"M",NA,1954,NA,-777
"1090","FRN-1874","A2.9-3268",220,"FRN","Cissey","22/05/1874","25/02/1875","1810","1882",1874-05-22,1875-02-25,0,1,0,0,0,"M",NA,1810,NA,1882
"1091","FRN-1875","A2.9-3271",220,"FRN","Buffet","10/03/1875","21/02/1876","1818","1898",1875-03-10,1876-02-21,0,1,0,0,0,"M",NA,1818,NA,1898
"1092","FRN-1876-1","A2.9-3274",220,"FRN","DuFaure","22/02/1876","12/12/1876","1798","1881",1876-02-22,1876-12-12,0,1,0,1,0,"M",NA,1798,NA,1881
"1093","FRN-1876-2","A2.9-3277",220,"FRN","Simon","12/12/1876","16/05/1877","1814","1896",1876-12-12,1877-05-16,0,1,0,0,0,"M",NA,1814,NA,1896
"1094","FRN-1877-1","A2.9-3280",220,"FRN","Broglie","18/05/1877","23/11/1877","1821","1901",1877-05-18,1877-11-23,0,1,0,1,0,"M",NA,1821,NA,1901
"1095","FRN-1877-2","A2.9-3283",220,"FRN","Rochebouet","23/11/1877","12/12/1877","1813","1899",1877-11-23,1877-12-12,0,1,0,0,0,"M",NA,1813,NA,1899
"1096","FRN-1877-3","A2.9-3286",220,"FRN","DuFaure","14/12/1877","30/01/1879","1798","1881",1877-12-14,1879-01-30,0,1,0,2,0,"M",NA,1798,NA,1881
"1097","FRN-1879-1","A2.9-3289",220,"FRN","Waddington","04/02/1879","21/12/1879","1826","1894",1879-02-04,1879-12-21,0,1,0,0,0,"M",NA,1826,NA,1894
"1098","FRN-1879-2","A2.9-3292",220,"FRN","Freycinet","29/12/1879","19/09/1880","1828","1923",1879-12-29,1880-09-19,0,1,0,0,0,"M",NA,1828,NA,1923
"1099","FRN-1880","A2.9-3295",220,"FRN","Ferry","22/09/1880","10/11/1881","1832","1893",1880-09-22,1881-11-10,0,1,0,0,0,"M",NA,1832,NA,1893
"1100","FRN-1881","A2.9-3298",220,"FRN","Gambetta","14/11/1881","26/01/1882","02/04/1838","31/12/1882",1881-11-14,1882-01-26,0,1,0,0,0,"M",1838-04-02,1838,1882-12-31,1882
"1101","FRN-1882-1","A2.9-3301",220,"FRN","Freycinet","31/01/1882","29/07/1882","1828","1923",1882-01-31,1882-07-29,0,1,0,1,0,"M",NA,1828,NA,1923
"1102","FRN-1882-2","A2.9-3304",220,"FRN","Duclerc","08/08/1882","28/01/1883","1812","1888",1882-08-08,1883-01-28,0,1,0,0,0,"M",NA,1812,NA,1888
"1103","FRN-1883-1","A2.9-3307",220,"FRN","Fallieres","29/01/1883","18/02/1883","06/11/1841","22/06/1931",1883-01-29,1883-02-18,0,1,0,0,0,"M",1841-11-06,1841,1931-06-22,1931
"1104","FRN-1883-2","A2.9-3310",220,"FRN","Ferry","19/02/1883","30/03/1885","1832","1893",1883-02-19,1885-03-30,0,1,0,1,0,"M",NA,1832,NA,1893
"1105","FRN-1885","A2.9-3313",220,"FRN","Brisson","06/04/1885","29/12/1885","1835","1912",1885-04-06,1885-12-29,0,1,0,0,0,"M",NA,1835,NA,1912
"1106","FRN-1886-1","A2.9-3316",220,"FRN","Freycinet","07/01/1886","03/12/1886","1828","1923",1886-01-07,1886-12-03,0,1,0,2,0,"M",NA,1828,NA,1923
"1107","FRN-1886-2","A2.9-3319",220,"FRN","Goblet","16/12/1886","17/05/1887","1828","1905",1886-12-16,1887-05-17,0,1,0,0,0,"M",NA,1828,NA,1905
"1108","FRN-1887-1","A2.9-3322",220,"FRN","Rouvier","29/05/1887","19/11/1887","1842","1911",1887-05-29,1887-11-19,0,1,0,0,0,"M",NA,1842,NA,1911
"1109","FRN-1887-2","A2.9-3325",220,"FRN","Tirard","11/12/1887","03/04/1888","1837","1893",1887-12-11,1888-04-03,0,1,0,0,0,"M",NA,1837,NA,1893
"1110","FRN-1888","A2.9-3328",220,"FRN","Floquet","03/04/1888","21/02/1889","1828","1896",1888-04-03,1889-02-21,0,1,0,0,0,"M",NA,1828,NA,1896
"1111","FRN-1889","A2.9-3331",220,"FRN","Tirard","21/02/1889","13/03/1890","1837","1893",1889-02-21,1890-03-13,0,1,0,1,0,"M",NA,1837,NA,1893
"1112","FRN-1890","A2.9-3334",220,"FRN","Freycinet","17/03/1890","20/02/1892","1828","1923",1890-03-17,1892-02-20,0,1,0,3,0,"M",NA,1828,NA,1923
"1113","FRN-1892-1","A2.9-3337",220,"FRN","Loubet","27/02/1892","29/11/1892","30/12/1838","20/12/1929",1892-02-27,1892-11-29,0,1,0,0,0,"M",1838-12-30,1838,1929-12-20,1929
"1114","FRN-1892-2","A2.9-3340",220,"FRN","Ribot","06/12/1892","04/04/1893","1842","1923",1892-12-06,1893-04-04,0,1,0,0,0,"M",NA,1842,NA,1923
"1115","FRN-1893-1","A2.9-3343",220,"FRN","Dupuy","04/04/1893","25/11/1893","05/11/1851","23/07/1923",1893-04-04,1893-11-25,0,1,0,0,0,"M",1851-11-05,1851,1923-07-23,1923
"1116","FRN-1893-2","A2.9-3346",220,"FRN","Casimir-Perier","03/12/1893","22/05/1894","08/11/1847","11/03/1907",1893-12-03,1894-05-22,0,1,0,0,0,"M",1847-11-08,1847,1907-03-11,1907
"1117","FRN-1894","A2.9-3349",220,"FRN","Dupuy","30/05/1894","14/01/1895","05/11/1851","23/07/1923",1894-05-30,1895-01-14,0,1,0,1,0,"M",1851-11-05,1851,1923-07-23,1923
"1118","FRN-1895-1","A2.9-3352",220,"FRN","Ribot","27/01/1895","28/10/1895","1842","1923",1895-01-27,1895-10-28,0,1,0,1,0,"M",NA,1842,NA,1923
"1119","FRN-1895-2","A2.9-3355",220,"FRN","Bourgeois","01/11/1895","22/04/1896","1851","1925",1895-11-01,1896-04-22,0,1,0,0,0,"M",NA,1851,NA,1925
"1120","FRN-1896","A2.9-3358",220,"FRN","Meline","29/04/1896","14/06/1898","1838","1925",1896-04-29,1898-06-14,0,1,0,0,0,"M",NA,1838,NA,1925
"1121","FRN-1898-1","A2.9-3361",220,"FRN","Brisson","27/06/1898","25/10/1898","1835","1912",1898-06-27,1898-10-25,0,1,0,1,0,"M",NA,1835,NA,1912
"1122","FRN-1898-2","A2.9-3364",220,"FRN","Dupuy","31/10/1898","12/06/1899","05/11/1851","23/07/1923",1898-10-31,1899-06-12,0,1,0,2,0,"M",1851-11-05,1851,1923-07-23,1923
"1123","FRN-1899","A2.9-3367",220,"FRN","Waldeck-Rousseau","22/06/1899","28/05/1902","1846","10/08/1904",1899-06-22,1902-05-28,0,2.1,0,0,0,"M",NA,1846,1904-08-10,1904
"1124","FRN-1902","A2.9-3370",220,"FRN","Combes","07/06/1902","19/01/1905","1835","1921",1902-06-07,1905-01-19,0,1,0,0,0,"M",NA,1835,NA,1921
"1125","FRN-1905","A2.9-3373",220,"FRN","Rouvier","24/01/1905","07/03/1906","1842","1911",1905-01-24,1906-03-07,0,1,0,1,0,"M",NA,1842,NA,1911
"1126","FRN-1906-1","A2.9-3376",220,"FRN","Sarrien","12/03/1906","18/10/1906","1840","1915",1906-03-12,1906-10-18,0,1,0,0,0,"M",NA,1840,NA,1915
"1127","FRN-1906-2","A2.9-3379",220,"FRN","Clemenceau","28/10/1906","20/07/1909","28/09/1841","24/11/1929",1906-10-28,1909-07-20,0,1,0,0,0,"M",1841-09-28,1841,1929-11-24,1929
"1128","FRN-1909","A2.9-3382",220,"FRN","Briand","24/07/1909","24/02/1911","28/03/1862","07/03/1932",1909-07-24,1911-02-24,0,1,0,0,0,"M",1862-03-28,1862,1932-03-07,1932
"1129","FRN-1911-1","A2.9-3385",220,"FRN","Monis","04/03/1911","22/06/1911","1846","1929",1911-03-04,1911-06-22,0,1,0,0,0,"M",NA,1846,NA,1929
"1130","FRN-1911-2","A2.9-3388",220,"FRN","Caillaux","27/06/1911","10/01/1912","1863","1934",1911-06-27,1912-01-10,0,1,0,0,0,"M",NA,1863,NA,1934
"1131","FRN-1912","A2.9-3391",220,"FRN","Poincare","14/01/1912","18/01/1913","20/08/1860","15/10/1934",1912-01-14,1913-01-18,0,1,0,0,0,"M",1860-08-20,1860,1934-10-15,1934
"1132","FRN-1913-1","A2.9-3394",220,"FRN","Briand","18/01/1913","18/03/1913","28/03/1862","07/03/1932",1913-01-18,1913-03-18,0,1,0,1,0,"M",1862-03-28,1862,1932-03-07,1932
"1133","FRN-1913-2","A2.9-3397",220,"FRN","Barthou","24/03/1913","02/12/1913","25/08/1862","09/10/1934",1913-03-24,1913-12-02,0,1,0,0,0,"M",1862-08-25,1862,1934-10-09,1934
"1134","FRN-1913-3","A2.9-3400",220,"FRN","Doumergue","08/12/1913","04/06/1914","01/08/1863","18/06/1937",1913-12-08,1914-06-04,0,1,0,0,0,"M",1863-08-01,1863,1937-06-18,1937
"1135","FRN-1914","A2.9-3403",220,"FRN","Viviani","09/06/1914","29/10/1915","1863","1925",1914-06-09,1915-10-29,0,1,0,0,0,"M",NA,1863,NA,1925
"1136","FRN-1915","A2.9-3406",220,"FRN","Briand","29/10/1915","17/03/1917","28/03/1862","07/03/1932",1915-10-29,1917-03-17,0,1,0,2,0,"M",1862-03-28,1862,1932-03-07,1932
"1137","FRN-1917-1","A2.9-3409",220,"FRN","Ribot","20/03/1917","07/09/1917","1842","1923",1917-03-20,1917-09-07,0,1,0,2,0,"M",NA,1842,NA,1923
"1138","FRN-1917-2","A2.9-3412",220,"FRN","Painleve","12/09/1917","13/11/1917","1863","1933",1917-09-12,1917-11-13,0,1,0,0,0,"M",NA,1863,NA,1933
"1139","FRN-1917-3","A2.9-3415",220,"FRN","Clemenceau","16/11/1917","19/01/1920","28/09/1841","24/11/1929",1917-11-16,1920-01-19,0,1,0,1,0,"M",1841-09-28,1841,1929-11-24,1929
"1140","FRN-1920-1","A2.9-3418",220,"FRN","Millerand","19/01/1920","03/09/1920","10/02/1859","07/04/1943",1920-01-19,1920-09-03,0,1,0,0,0,"M",1859-02-10,1859,1943-04-07,1943
"1141","FRN-1920-2","A2.9-3421",220,"FRN","Leygues","03/09/1920","16/01/1921","1857","1933",1920-09-03,1921-01-16,0,1,0,0,0,"M",NA,1857,NA,1933
"1142","FRN-1921","A2.9-3424",220,"FRN","Briand","16/01/1921","16/01/1922","28/03/1862","07/03/1932",1921-01-16,1922-01-16,0,1,0,3,0,"M",1862-03-28,1862,1932-03-07,1932
"1143","FRN-1922","A2.9-3427",220,"FRN","Poincare","16/01/1922","08/06/1924","20/08/1860","15/10/1934",1922-01-16,1924-06-08,0,1,0,1,0,"M",1860-08-20,1860,1934-10-15,1934
"1144","FRN-1924-1","A2.9-3430",220,"FRN","Francois-Marsat","08/06/1924","14/06/1924","1874","1958",1924-06-08,1924-06-14,0,1,0,0,0,"M",NA,1874,NA,1958
"1145","FRN-1924-2","A2.9-3433",220,"FRN","Herriot","14/06/1924","17/04/1925","1872","1957",1924-06-14,1925-04-17,0,1,0,0,0,"M",NA,1872,NA,1957
"1146","FRN-1925-1","A2.9-3436",220,"FRN","Painleve","17/04/1925","02/11/1925","1863","1933",1925-04-17,1925-11-02,0,1,0,1,0,"M",NA,1863,NA,1933
"1147","FRN-1925-2","A2.9-3439",220,"FRN","Briand","29/11/1925","20/07/1926","28/03/1862","07/03/1932",1925-11-29,1926-07-20,0,1,0,4,0,"M",1862-03-28,1862,1932-03-07,1932
"1148","FRN-1926-1","A2.9-3442",220,"FRN","Herriot","20/07/1926","24/07/1926","1872","1957",1926-07-20,1926-07-24,0,1,0,1,0,"M",NA,1872,NA,1957
"1149","FRN-1926-2","A2.9-3445",220,"FRN","Poincare","24/07/1926","28/07/1929","20/08/1860","15/10/1934",1926-07-24,1929-07-28,0,1,0,2,0,"M",1860-08-20,1860,1934-10-15,1934
"1150","FRN-1929-1","A2.9-3448",220,"FRN","Briand","28/07/1929","11/10/1929","28/03/1862","07/03/1932",1929-07-28,1929-10-11,0,1,0,5,0,"M",1862-03-28,1862,1932-03-07,1932
"1151","FRN-1929-2","A2.9-3451",220,"FRN","Poincare","11/10/1929","02/11/1929","20/08/1860","15/10/1934",1929-10-11,1929-11-02,0,1,0,3,0,"M",1860-08-20,1860,1934-10-15,1934
"1152","FRN-1929-3","A2.9-3454",220,"FRN","Tardieu","02/11/1929","21/02/1930","1876","1945",1929-11-02,1930-02-21,0,1,0,0,0,"M",NA,1876,NA,1945
"1153","FRN-1930-1","A2.9-3457",220,"FRN","Chautemps","21/02/1930","02/03/1930","1885","1963",1930-02-21,1930-03-02,0,1,0,0,0,"M",NA,1885,NA,1963
"1154","FRN-1930-2","A2.9-3460",220,"FRN","Tardieu","02/03/1930","13/12/1930","1876","1945",1930-03-02,1930-12-13,0,1,0,1,0,"M",NA,1876,NA,1945
"1155","FRN-1930-3","A2.9-3463",220,"FRN","Steeg","13/12/1930","27/01/1931","1868","1950",1930-12-13,1931-01-27,0,1,0,0,0,"M",NA,1868,NA,1950
"1156","FRN-1931","A2.9-3466",220,"FRN","Laval","27/01/1931","23/02/1932","28/06/1883","15/10/1945",1931-01-27,1932-02-23,0,1,0,0,0,"M",1883-06-28,1883,1945-10-15,1945
"1157","FRN-1932-1","A2.9-3469",220,"FRN","Tardieu","23/02/1932","04/06/1932","1876","1945",1932-02-23,1932-06-04,0,1,0,2,0,"M",NA,1876,NA,1945
"1158","FRN-1932-2","A2.9-3472",220,"FRN","Herriot","04/06/1932","20/12/1932","1872","1957",1932-06-04,1932-12-20,0,1,0,2,0,"M",NA,1872,NA,1957
"1159","FRN-1932-3","A2.9-3475",220,"FRN","Paul-Boncour","20/12/1932","31/01/1933","04/08/1873","1972",1932-12-20,1933-01-31,0,1,0,0,0,"M",1873-08-04,1873,NA,1972
"1160","FRN-1933-1","A2.9-3478",220,"FRN","Daladier","31/01/1933","24/10/1933","18/06/1884","10/10/1970",1933-01-31,1933-10-24,0,1,0,0,0,"M",1884-06-18,1884,1970-10-10,1970
"1161","FRN-1933-2","A2.9-3481",220,"FRN","Sarraut","24/10/1933","22/11/1933","1872","1962",1933-10-24,1933-11-22,0,1,0,0,0,"M",NA,1872,NA,1962
"1162","FRN-1933-3","A2.9-3484",220,"FRN","Chautemps","22/11/1933","30/01/1934","1885","1963",1933-11-22,1934-01-30,0,1,0,1,0,"M",NA,1885,NA,1963
"1163","FRN-1934-1","A2.9-3487",220,"FRN","Daladier","30/01/1934","09/02/1934","18/06/1884","10/10/1970",1934-01-30,1934-02-09,0,1,0,1,0,"M",1884-06-18,1884,1970-10-10,1970
"1164","FRN-1934-2","A2.9-3490",220,"FRN","Doumergue","09/02/1934","10/11/1934","01/08/1863","18/06/1937",1934-02-09,1934-11-10,0,1,0,1,0,"M",1863-08-01,1863,1937-06-18,1937
"1165","FRN-1934-3","A2.9-3493",220,"FRN","Flandin","10/11/1934","30/05/1935","12/04/1889","13/06/1958",1934-11-10,1935-05-30,0,1,0,0,0,"M",1889-04-12,1889,1958-06-13,1958
"1166","FRN-1935-1","A2.9-3496",220,"FRN","Bouissin","01/06/1935","04/06/1935","1874","1959",1935-06-01,1935-06-04,0,1,0,0,0,"M",NA,1874,NA,1959
"1167","FRN-1935-2","A2.9-3499",220,"FRN","Laval","07/06/1935","25/01/1936","28/06/1883","15/10/1945",1935-06-07,1936-01-25,0,1,0,1,0,"M",1883-06-28,1883,1945-10-15,1945
"1168","FRN-1936-1","A2.9-3502",220,"FRN","Sarraut","25/01/1936","03/06/1936","1872","1962",1936-01-25,1936-06-03,0,1,0,1,0,"M",NA,1872,NA,1962
"1169","FRN-1936-2","A2.9-3505",220,"FRN","Blum","03/06/1936","23/06/1937","09/04/1872","30/03/1950",1936-06-03,1937-06-23,0,1,0,0,0,"M",1872-04-09,1872,1950-03-30,1950
"1170","FRN-1937","A2.9-3508",220,"FRN","Chautemps","23/06/1937","12/03/1938","1885","1963",1937-06-23,1938-03-12,0,1,0,2,0,"M",NA,1885,NA,1963
"1171","FRN-1938-1","A2.9-3511",220,"FRN","Blum","12/03/1938","10/04/1938","09/04/1872","30/03/1950",1938-03-12,1938-04-10,0,1,0,1,0,"M",1872-04-09,1872,1950-03-30,1950
"1172","FRN-1938-2","A2.9-3514",220,"FRN","Daladier","10/04/1938","21/03/1940","18/06/1884","10/10/1970",1938-04-10,1940-03-21,0,1,0,2,0,"M",1884-06-18,1884,1970-10-10,1970
"1173","FRN-1940-1","A2.9-3517",220,"FRN","Reynaud","21/03/1940","11/06/1940","1878","1966",1940-03-21,1940-06-11,0,1,0,0,2,"M",NA,1878,NA,1966
"1174","FRN-1940-2","A2.9-3520",220,"FRN","Petain","17/06/1940","18/04/1942","24/04/1856","23/07/1951",1940-06-17,1942-04-18,0,1,0,0,0,"M",1856-04-24,1856,1951-07-23,1951
"1175","FRN-1942","A2.9-3523",220,"FRN","Laval","18/04/1942","17/08/1944","28/06/1883","15/10/1945",1942-04-18,1944-08-17,0,4,9,3,2,"M",1883-06-28,1883,1945-10-15,1945
"1176","FRN-1944","A2.9-3526",220,"FRN","De Gaulle","10/09/1944","20/01/1946","22/11/1890","09/11/1970",1944-09-10,1946-01-20,0,1,0,0,0,"M",1890-11-22,1890,1970-11-09,1970
"1177","FRN-1946-1","A2.9-3529",220,"FRN","Gouin","26/01/1946","12/06/1946","04/10/1884","25/11/1977",1946-01-26,1946-06-12,0,1,0,0,0,"M",1884-10-04,1884,1977-11-25,1977
"1178","FRN-1946-2","A2.9-3532",220,"FRN","Bidault","24/06/1946","28/11/1946","05/10/1899","27/01/1983",1946-06-24,1946-11-28,0,1,0,0,0,"M",1899-10-05,1899,1983-01-27,1983
"1179","FRN-1946-3","A2.9-3535",220,"FRN","Blum","16/12/1946","16/01/1947","09/04/1872","30/03/1950",1946-12-16,1947-01-16,0,1,0,2,0,"M",1872-04-09,1872,1950-03-30,1950
"1180","FRN-1947-1","A2.9-3538",220,"FRN","Ramadier","22/01/1947","19/11/1947","17/03/1888","14/10/1961",1947-01-22,1947-11-19,0,1,0,0,0,"M",1888-03-17,1888,1961-10-14,1961
"1181","FRN-1947-2","A2.9-3541",220,"FRN","Schuman","24/11/1947","19/07/1948","1886","1963",1947-11-24,1948-07-19,0,1,0,0,0,"M",NA,1886,NA,1963
"1182","FRN-1948-1","A2.9-3544",220,"FRN","Marie","27/07/1948","27/08/1948","1897","1974",1948-07-27,1948-08-27,0,1,0,0,0,"M",NA,1897,NA,1974
"1183","FRN-1948-2","A2.9-3547",220,"FRN","Schuman","31/08/1948","08/09/1948","1886","1963",1948-08-31,1948-09-08,0,1,0,1,0,"M",NA,1886,NA,1963
"1184","FRN-1948-3","A2.9-3550",220,"FRN","Queuille","13/09/1948","06/10/1949","1884","1970",1948-09-13,1949-10-06,0,1,0,0,0,"M",NA,1884,NA,1970
"1185","FRN-1949","A2.9-3553",220,"FRN","Bidault","28/10/1949","24/06/1950","05/10/1899","27/01/1983",1949-10-28,1950-06-24,0,1,0,0,0,"M",1899-10-05,1899,1983-01-27,1983
"1186","FRN-1950-1","A2.9-3556",220,"FRN","Queuille","30/06/1950","04/07/1950","1884","1970",1950-06-30,1950-07-04,0,1,0,1,0,"M",NA,1884,NA,1970
"1187","FRN-1950-2","A2.9-3559",220,"FRN","Pleven","11/07/1950","28/02/1951","15/04/1901","13/01/1993",1950-07-11,1951-02-28,0,1,0,0,0,"M",1901-04-15,1901,1993-01-13,1993
"1188","FRN-1951-1","A2.9-3562",220,"FRN","Queuille","09/03/1951","10/07/1951","1884","1970",1951-03-09,1951-07-10,0,1,0,2,0,"M",NA,1884,NA,1970
"1189","FRN-1951-2","A2.9-3565",220,"FRN","Pleven","08/08/1951","08/01/1952","15/04/1901","13/01/1993",1951-08-08,1952-01-08,0,1,0,1,0,"M",1901-04-15,1901,1993-01-13,1993
"1190","FRN-1952-1","A2.9-3568",220,"FRN","Faure","18/01/1952","29/02/1952","18/08/1908","30/03/1988",1952-01-18,1952-02-29,0,1,0,0,0,"M",1908-08-18,1908,1988-03-30,1988
"1191","FRN-1952-2","A2.9-3571",220,"FRN","Pinay","07/03/1952","23/12/1952","30/12/1891","13/12/1994",1952-03-07,1952-12-23,0,1,0,0,0,"M",1891-12-30,1891,1994-12-13,1994
"1192","FRN-1953-1","A2.9-3574",220,"FRN","Mayer","07/01/1953","21/05/1953","1895","1972",1953-01-07,1953-05-21,0,1,0,0,0,"M",NA,1895,NA,1972
"1193","FRN-1953-2","A2.9-3577",220,"FRN","Laniel","26/06/1953","12/06/1954","1889","1975",1953-06-26,1954-06-12,0,1,0,0,0,"M",NA,1889,NA,1975
"1194","FRN-1954","A2.9-3580",220,"FRN","Mendes-France","18/06/1954","05/02/1955","11/01/1907","18/10/1982",1954-06-18,1955-02-05,0,1,0,0,0,"M",1907-01-11,1907,1982-10-18,1982
"1195","FRN-1955","A2.9-3583",220,"FRN","Faure","23/02/1955","19/01/1956","18/08/1908","30/03/1988",1955-02-23,1956-01-19,0,1,0,1,0,"M",1908-08-18,1908,1988-03-30,1988
"1196","FRN-1956","A2.9-3586",220,"FRN","Mollet","31/01/1956","13/06/1957","31/12/1905","03/10/1975",1956-01-31,1957-06-13,0,1,0,0,0,"M",1905-12-31,1905,1975-10-03,1975
"1197","FRN-1957-1","A2.9-3589",220,"FRN","Bourges-Maunory","13/06/1957","05/11/1957","1914","1993",1957-06-13,1957-11-05,0,1,0,0,0,"M",NA,1914,NA,1993
"1198","FRN-1957-2","A2.9-3592",220,"FRN","Gaillard","06/11/1957","13/05/1958","1919","1970",1957-11-06,1958-05-13,0,1,0,0,0,"M",NA,1919,NA,1970
"1199","FRN-1958-1","A2.9-3595",220,"FRN","Pflimin","14/05/1958","31/05/1958","05/02/1907","27/06/2000",1958-05-14,1958-05-31,0,1,0,0,0,"M",1907-02-05,1907,2000-06-27,2000
"1200","FRN-1958-2","A2.9-3598",220,"FRN","De Gaulle","01/06/1958","27/04/1969","22/11/1890","09/11/1970",1958-06-01,1969-04-27,0,1,0,1,0,"M",1890-11-22,1890,1970-11-09,1970
"1201","FRN-1969-1","A2.9-3601",220,"FRN","Poher","27/04/1969","20/06/1969","17/04/1909","09/12/1996",1969-04-27,1969-06-20,0,1,0,0,0,"M",1909-04-17,1909,1996-12-09,1996
"1202","FRN-1969-2","A2.9-3604",220,"FRN","Pompidou","20/06/1969","02/04/1974","05/07/1911","02/04/1974",1969-06-20,1974-04-02,0,2,0,0,-777,"M",1911-07-05,1911,1974-04-02,1974
"1203","FRN-1974-1","A2.9-3607",220,"FRN","Poher","02/04/1974","27/05/1974","17/04/1909","09/12/1996",1974-04-02,1974-05-27,0,1,0,1,0,"M",1909-04-17,1909,1996-12-09,1996
"1204","FRN-1974-2","A2.9-3610",220,"FRN","Giscard D'Estaing","27/05/1974","21/05/1981","02/02/1926","-777",1974-05-27,1981-05-21,0,1,0,0,0,"M",1926-02-02,1926,NA,-777
"1205","FRN-1981","A2.9-3613",220,"FRN","Mitterand","21/05/1981","17/05/1995","26/10/1916","08/01/1996",1981-05-21,1995-05-17,0,1,0,0,0,"M",1916-10-26,1916,1996-01-08,1996
"1206","FRN-1995","A2.9-3616",220,"FRN","Chirac","17/05/1995","31/12/2004","29/11/1932","-777",1995-05-17,2004-12-31,0,-888,0,0,-888,"M",1932-11-29,1932,NA,-777
"1207","SWZ-1875","A2.9-3619",225,"SWZ","Scherer","01/01/1875","31/12/1875","1825","1878",1875-01-01,1875-12-31,0,1,0,0,0,"M",NA,1825,NA,1878
"1208","SWZ-1876","A2.9-3622",225,"SWZ","Welti","01/01/1876","31/12/1876","23/04/1825","1899",1876-01-01,1876-12-31,0,1,0,2,0,"M",1825-04-23,1825,NA,1899
"1209","SWZ-1877","A2.9-3625",225,"SWZ","Heer","01/01/1877","31/12/1877","25/09/1825","1879",1877-01-01,1877-12-31,0,1,0,0,0,"M",1825-09-25,1825,NA,1879
"1210","SWZ-1878","A2.9-3628",225,"SWZ","Schenck","01/01/1878","31/12/1878","01/12/1823","1895",1878-01-01,1878-12-31,0,1,0,3,0,"M",1823-12-01,1823,NA,1895
"1211","SWZ-1879","A2.9-3631",225,"SWZ","Hammer","01/01/1879","31/12/1879","03/03/1822","1907",1879-01-01,1879-12-31,0,1,0,0,0,"M",1822-03-03,1822,NA,1907
"1212","SWZ-1880","A2.9-3634",225,"SWZ","Welti","01/01/1880","31/12/1880","23/04/1825","1899",1880-01-01,1880-12-31,0,1,0,3,0,"M",1825-04-23,1825,NA,1899
"1213","SWZ-1881","A2.9-3637",225,"SWZ","Droz","01/01/1881","31/12/1881","27/01/1844","1899",1881-01-01,1881-12-31,0,1,0,0,0,"M",1844-01-27,1844,NA,1899
"1214","SWZ-1882","A2.9-3640",225,"SWZ","Bavier","01/01/1882","31/12/1882","16/09/1825","1896",1882-01-01,1882-12-31,0,1,0,0,0,"M",1825-09-16,1825,NA,1896
"1215","SWZ-1883","A2.9-3643",225,"SWZ","Ruchonnet","01/01/1883","31/12/1883","28/04/1834","1893",1883-01-01,1883-12-31,0,1,0,0,0,"M",1834-04-28,1834,NA,1893
"1216","SWZ-1884","A2.9-3646",225,"SWZ","Welti","01/01/1884","31/12/1884","23/04/1825","1899",1884-01-01,1884-12-31,0,1,0,4,0,"M",1825-04-23,1825,NA,1899
"1217","SWZ-1885","A2.9-3649",225,"SWZ","Schenck","01/01/1885","31/12/1885","01/12/1823","1895",1885-01-01,1885-12-31,0,1,0,4,0,"M",1823-12-01,1823,NA,1895
"1218","SWZ-1886","A2.9-3652",225,"SWZ","Deucher","01/01/1886","31/12/1886","15/02/1831","1912",1886-01-01,1886-12-31,0,1,0,0,0,"M",1831-02-15,1831,NA,1912
"1219","SWZ-1887","A2.9-3655",225,"SWZ","Droz","01/01/1887","31/12/1887","27/01/1844","1899",1887-01-01,1887-12-31,0,1,0,1,0,"M",1844-01-27,1844,NA,1899
"1220","SWZ-1888-1","A2.9-3658",225,"SWZ","Hertenstein","01/01/1888","27/11/1888","05/03/1825","27/11/1888",1888-01-01,1888-11-27,0,2,0,0,-777,"M",1825-03-05,1825,1888-11-27,1888
"1221","SWZ-1888-2","A2.9-3661",225,"SWZ","Hammer","27/11/1888","31/12/1889","03/03/1822","1907",1888-11-27,1889-12-31,0,1,0,1,0,"M",1822-03-03,1822,NA,1907
"1222","SWZ-1890","A2.9-3664",225,"SWZ","Ruchonnet","01/01/1890","31/12/1890","28/04/1834","1893",1890-01-01,1890-12-31,0,1,0,1,0,"M",1834-04-28,1834,NA,1893
"1223","SWZ-1891","A2.9-3667",225,"SWZ","Welti","01/01/1891","31/12/1891","23/04/1825","1899",1891-01-01,1891-12-31,0,1,0,5,0,"M",1825-04-23,1825,NA,1899
"1224","SWZ-1892","A2.9-3670",225,"SWZ","Hauser","01/01/1892","31/12/1892","01/05/1837","1902",1892-01-01,1892-12-31,0,1,0,0,0,"M",1837-05-01,1837,NA,1902
"1225","SWZ-1893","A2.9-3673",225,"SWZ","Schenck","01/01/1893","31/12/1893","01/12/1823","1895",1893-01-01,1893-12-31,0,1,0,5,0,"M",1823-12-01,1823,NA,1895
"1226","SWZ-1894","A2.9-3676",225,"SWZ","Frey","01/01/1894","31/12/1894","24/10/1838","1922",1894-01-01,1894-12-31,0,1,0,0,0,"M",1838-10-24,1838,NA,1922
"1227","SWZ-1895","A2.9-3679",225,"SWZ","Zemp","01/01/1895","31/12/1895","02/09/1834","1908",1895-01-01,1895-12-31,0,1,0,0,0,"M",1834-09-02,1834,NA,1908
"1228","SWZ-1896","A2.9-3682",225,"SWZ","Lachenal","01/01/1896","31/12/1896","19/05/1849","1918",1896-01-01,1896-12-31,0,1,0,0,0,"M",1849-05-19,1849,NA,1918
"1229","SWZ-1897","A2.9-3685",225,"SWZ","Deucher","01/01/1897","31/12/1897","15/02/1831","1912",1897-01-01,1897-12-31,0,1,0,1,0,"M",1831-02-15,1831,NA,1912
"1230","SWZ-1898","A2.9-3688",225,"SWZ","Ruffy","01/01/1898","31/12/1898","02/08/1854","1919",1898-01-01,1898-12-31,0,1,0,0,0,"M",1854-08-02,1854,NA,1919
"1231","SWZ-1899","A2.9-3691",225,"SWZ","Muller","01/01/1899","31/12/1899","12/11/1848","1919",1899-01-01,1899-12-31,0,1,0,0,0,"M",1848-11-12,1848,NA,1919
"1232","SWZ-1900","A2.9-3694",225,"SWZ","Hauser","01/01/1900","31/12/1900","01/05/1837","1902",1900-01-01,1900-12-31,0,1,0,1,0,"M",1837-05-01,1837,NA,1902
"1233","SWZ-1901","A2.9-3697",225,"SWZ","Brenner","01/01/1901","31/12/1901","1856","1911",1901-01-01,1901-12-31,0,1,0,0,0,"M",NA,1856,NA,1911
"1234","SWZ-1902","A2.9-3700",225,"SWZ","Zemp","01/01/1902","31/12/1902","02/09/1834","1908",1902-01-01,1902-12-31,0,1,0,1,0,"M",1834-09-02,1834,NA,1908
"1235","SWZ-1903","A2.9-3703",225,"SWZ","Deucher","01/01/1903","31/12/1903","15/02/1831","1912",1903-01-01,1903-12-31,0,1,0,2,0,"M",1831-02-15,1831,NA,1912
"1236","SWZ-1904","A2.9-3706",225,"SWZ","Comtesse","01/01/1904","31/12/1904","14/08/1847","1922",1904-01-01,1904-12-31,0,1,0,0,0,"M",1847-08-14,1847,NA,1922
"1237","SWZ-1905","A2.9-3709",225,"SWZ","Ruchet","01/01/1905","31/12/1905","14/09/1853","1912",1905-01-01,1905-12-31,0,1,0,0,0,"M",1853-09-14,1853,NA,1912
"1238","SWZ-1906","A2.9-3712",225,"SWZ","Forrer","01/01/1906","31/12/1906","09/02/1845","1921",1906-01-01,1906-12-31,0,1,0,0,0,"M",1845-02-09,1845,NA,1921
"1239","SWZ-1907","A2.9-3715",225,"SWZ","Muller","01/01/1907","31/12/1907","12/11/1848","1919",1907-01-01,1907-12-31,0,1,0,1,0,"M",1848-11-12,1848,NA,1919
"1240","SWZ-1908","A2.9-3718",225,"SWZ","Brenner","01/01/1908","31/12/1908","1856","1911",1908-01-01,1908-12-31,0,1,0,1,0,"M",NA,1856,NA,1911
"1241","SWZ-1909","A2.9-3721",225,"SWZ","Deucher","01/01/1909","31/12/1909","15/02/1831","1912",1909-01-01,1909-12-31,0,1,0,3,0,"M",1831-02-15,1831,NA,1912
"1242","SWZ-1910","A2.9-3724",225,"SWZ","Comtesse","01/01/1910","31/12/1910","14/08/1847","1922",1910-01-01,1910-12-31,0,1,0,1,0,"M",1847-08-14,1847,NA,1922
"1243","SWZ-1911","A2.9-3727",225,"SWZ","Ruchet","01/01/1911","31/12/1911","14/09/1853","1912",1911-01-01,1911-12-31,0,1,0,1,0,"M",1853-09-14,1853,NA,1912
"1244","SWZ-1912","A2.9-3730",225,"SWZ","Forrer","01/01/1912","31/12/1912","09/02/1845","1921",1912-01-01,1912-12-31,0,1,0,1,0,"M",1845-02-09,1845,NA,1921
"1245","SWZ-1913","A2.9-3733",225,"SWZ","Muller","01/01/1913","31/12/1913","12/11/1848","1919",1913-01-01,1913-12-31,0,1,0,2,0,"M",1848-11-12,1848,NA,1919
"1246","SWZ-1914","A2.9-3736",225,"SWZ","Hoffman","01/01/1914","31/12/1914","08/06/1857","1927",1914-01-01,1914-12-31,0,1,0,0,0,"M",1857-06-08,1857,NA,1927
"1247","SWZ-1915","A2.9-3739",225,"SWZ","Motta","01/01/1915","31/12/1915","17/12/1871","1940",1915-01-01,1915-12-31,0,1,0,0,0,"M",1871-12-17,1871,NA,1940
"1248","SWZ-1916","A2.9-3742",225,"SWZ","Decoppet","01/01/1916","31/12/1916","04/06/1862","1925",1916-01-01,1916-12-31,0,1,0,0,0,"M",1862-06-04,1862,NA,1925
"1249","SWZ-1917","A2.9-3745",225,"SWZ","Schulthess","01/01/1917","31/12/1917","02/03/1868","1944",1917-01-01,1917-12-31,0,1,0,0,0,"M",1868-03-02,1868,NA,1944
"1250","SWZ-1918","A2.9-3748",225,"SWZ","Calonder","01/01/1918","31/12/1918","07/10/1863","1952",1918-01-01,1918-12-31,0,1,0,0,0,"M",1863-10-07,1863,NA,1952
"1251","SWZ-1919","A2.9-3751",225,"SWZ","Ador","01/01/1919","31/12/1919","23/12/1845","31/03/1928",1919-01-01,1919-12-31,0,1,0,0,0,"M",1845-12-23,1845,1928-03-31,1928
"1252","SWZ-1920","A2.9-3754",225,"SWZ","Motta","01/01/1920","31/12/1920","17/12/1871","1940",1920-01-01,1920-12-31,0,1,0,1,0,"M",1871-12-17,1871,NA,1940
"1253","SWZ-1921","A2.9-3757",225,"SWZ","Schulthess","01/01/1921","31/12/1921","02/03/1868","1944",1921-01-01,1921-12-31,0,1,0,1,0,"M",1868-03-02,1868,NA,1944
"1254","SWZ-1922","A2.9-3760",225,"SWZ","Haab","01/01/1922","31/12/1922","1865","1939",1922-01-01,1922-12-31,0,1,0,0,0,"M",NA,1865,NA,1939
"1255","SWZ-1923","A2.9-3763",225,"SWZ","Scheurer","01/01/1923","31/12/1923","1872","1929",1923-01-01,1923-12-31,0,1,0,0,0,"M",NA,1872,NA,1929
"1256","SWZ-1924","A2.9-3766",225,"SWZ","Chuard","01/01/1924","31/12/1924","1857","1942",1924-01-01,1924-12-31,0,1,0,0,0,"M",NA,1857,NA,1942
"1257","SWZ-1925","A2.9-3769",225,"SWZ","Musy","01/01/1925","31/12/1925","10/04/1876","1952",1925-01-01,1925-12-31,0,1,0,0,0,"M",1876-04-10,1876,NA,1952
"1258","SWZ-1926","A2.9-3772",225,"SWZ","Haberlin","01/01/1926","31/12/1926","06/09/1868","1947",1926-01-01,1926-12-31,0,1,0,0,0,"M",1868-09-06,1868,NA,1947
"1259","SWZ-1927","A2.9-3775",225,"SWZ","Motta","01/01/1927","31/12/1927","17/12/1871","1940",1927-01-01,1927-12-31,0,1,0,2,0,"M",1871-12-17,1871,NA,1940
"1260","SWZ-1928","A2.9-3778",225,"SWZ","Schulthess","01/01/1928","31/12/1928","02/03/1868","1944",1928-01-01,1928-12-31,0,1,0,2,0,"M",1868-03-02,1868,NA,1944
"1261","SWZ-1929","A2.9-3781",225,"SWZ","Haab","01/01/1929","31/12/1929","1865","1939",1929-01-01,1929-12-31,0,1,0,1,0,"M",NA,1865,NA,1939
"1262","SWZ-1930","A2.9-3784",225,"SWZ","Musy","01/01/1930","31/12/1930","10/04/1876","1952",1930-01-01,1930-12-31,0,1,0,1,0,"M",1876-04-10,1876,NA,1952
"1263","SWZ-1931","A2.9-3787",225,"SWZ","Haberlin","01/01/1931","31/12/1931","06/09/1868","1947",1931-01-01,1931-12-31,0,1,0,1,0,"M",1868-09-06,1868,NA,1947
"1264","SWZ-1932","A2.9-3790",225,"SWZ","Motta","01/01/1932","31/12/1932","17/12/1871","1940",1932-01-01,1932-12-31,0,1,0,3,0,"M",1871-12-17,1871,NA,1940
"1265","SWZ-1933","A2.9-3793",225,"SWZ","Schulthess","01/01/1933","31/12/1933","02/03/1868","1944",1933-01-01,1933-12-31,0,1,0,3,0,"M",1868-03-02,1868,NA,1944
"1266","SWZ-1934","A2.9-3796",225,"SWZ","Golaz","01/01/1934","31/12/1934","31/12/1889","1958",1934-01-01,1934-12-31,0,1,0,0,0,"M",1889-12-31,1889,NA,1958
"1267","SWZ-1935","A2.9-3799",225,"SWZ","Minger","01/01/1935","31/12/1935","12/11/1881","1955",1935-01-01,1935-12-31,0,1,0,0,0,"M",1881-11-12,1881,NA,1955
"1268","SWZ-1936","A2.9-3802",225,"SWZ","Meyer","01/01/1936","31/12/1936","12/03/1870","1953",1936-01-01,1936-12-31,0,1,0,0,0,"M",1870-03-12,1870,NA,1953
"1269","SWZ-1937","A2.9-3805",225,"SWZ","Motta","01/01/1937","31/12/1937","17/12/1871","1940",1937-01-01,1937-12-31,0,1,0,4,0,"M",1871-12-17,1871,NA,1940
"1270","SWZ-1938","A2.9-3808",225,"SWZ","Baumann","01/01/1938","31/12/1938","27/11/1874","1953",1938-01-01,1938-12-31,0,1,0,0,0,"M",1874-11-27,1874,NA,1953
"1271","SWZ-1939","A2.9-3811",225,"SWZ","Etter","01/01/1939","31/12/1939","21/12/1891","1977",1939-01-01,1939-12-31,0,1,0,0,0,"M",1891-12-21,1891,NA,1977
"1272","SWZ-1940","A2.9-3814",225,"SWZ","Golaz","01/01/1940","31/12/1940","31/12/1889","1958",1940-01-01,1940-12-31,0,1,0,1,0,"M",1889-12-31,1889,NA,1958
"1273","SWZ-1941","A2.9-3817",225,"SWZ","Wetter","01/01/1941","31/12/1941","27/08/1877","1965",1941-01-01,1941-12-31,0,1,0,0,0,"M",1877-08-27,1877,NA,1965
"1274","SWZ-1942","A2.9-3820",225,"SWZ","Etter","01/01/1942","31/12/1942","21/12/1891","1977",1942-01-01,1942-12-31,0,1,0,1,0,"M",1891-12-21,1891,NA,1977
"1275","SWZ-1943","A2.9-3823",225,"SWZ","Celio","01/01/1943","31/12/1943","19/06/1889","1980",1943-01-01,1943-12-31,0,1,0,0,0,"M",1889-06-19,1889,NA,1980
"1276","SWZ-1944","A2.9-3826",225,"SWZ","Stampfli","01/01/1944","31/12/1944","03/12/1884","1965",1944-01-01,1944-12-31,0,1,0,0,0,"M",1884-12-03,1884,NA,1965
"1277","SWZ-1945","A2.9-3829",225,"SWZ","von Steiger","01/01/1945","31/12/1945","02/07/1881","1962",1945-01-01,1945-12-31,0,1,0,0,0,"M",1881-07-02,1881,NA,1962
"1278","SWZ-1946","A2.9-3832",225,"SWZ","Kobelt","01/01/1946","31/12/1946","01/08/1891","1968",1946-01-01,1946-12-31,0,1,0,0,0,"M",1891-08-01,1891,NA,1968
"1279","SWZ-1947","A2.9-3835",225,"SWZ","Etter","01/01/1947","31/12/1947","21/12/1891","1977",1947-01-01,1947-12-31,0,1,0,2,0,"M",1891-12-21,1891,NA,1977
"1280","SWZ-1948","A2.9-3838",225,"SWZ","Celio","01/01/1948","31/12/1948","19/06/1889","1980",1948-01-01,1948-12-31,0,1,0,1,0,"M",1889-06-19,1889,NA,1980
"1281","SWZ-1949","A2.9-3841",225,"SWZ","Nobs","01/01/1949","31/12/1949","14/07/1886","1957",1949-01-01,1949-12-31,0,1,0,0,0,"M",1886-07-14,1886,NA,1957
"1282","SWZ-1950","A2.9-3844",225,"SWZ","Petipierre","01/01/1950","31/12/1950","26/02/1899","1994",1950-01-01,1950-12-31,0,1,0,0,0,"M",1899-02-26,1899,NA,1994
"1283","SWZ-1951","A2.9-3847",225,"SWZ","von Steiger","01/01/1951","31/12/1951","02/07/1881","1962",1951-01-01,1951-12-31,0,1,0,1,0,"M",1881-07-02,1881,NA,1962
"1284","SWZ-1952","A2.9-3850",225,"SWZ","Kobelt","01/01/1952","31/12/1952","01/08/1891","1968",1952-01-01,1952-12-31,0,1,0,1,0,"M",1891-08-01,1891,NA,1968
"1285","SWZ-1953","A2.9-3853",225,"SWZ","Etter","01/01/1953","31/12/1953","21/12/1891","1977",1953-01-01,1953-12-31,0,1,0,3,0,"M",1891-12-21,1891,NA,1977
"1286","SWZ-1954","A2.9-3856",225,"SWZ","Rubattel","01/01/1954","31/12/1954","04/09/1896","1961",1954-01-01,1954-12-31,0,1,0,0,0,"M",1896-09-04,1896,NA,1961
"1287","SWZ-1955","A2.9-3859",225,"SWZ","Petipierre","01/01/1955","31/12/1955","26/02/1899","1994",1955-01-01,1955-12-31,0,1,0,1,0,"M",1899-02-26,1899,NA,1994
"1288","SWZ-1956","A2.9-3862",225,"SWZ","Feldmann","01/01/1956","31/12/1956","21/05/1897","1958",1956-01-01,1956-12-31,0,1,0,0,0,"M",1897-05-21,1897,NA,1958
"1289","SWZ-1957","A2.9-3865",225,"SWZ","Streuli","01/01/1957","31/12/1957","13/07/1892","1970",1957-01-01,1957-12-31,0,1,0,0,0,"M",1892-07-13,1892,NA,1970
"1290","SWZ-1958","A2.9-3868",225,"SWZ","Holenstein","01/01/1958","31/12/1958","07/12/1896","1962",1958-01-01,1958-12-31,0,1,0,0,0,"M",1896-12-07,1896,NA,1962
"1291","SWZ-1959","A2.9-3871",225,"SWZ","Chaudet","01/01/1959","31/12/1959","17/11/1901","1977",1959-01-01,1959-12-31,0,1,0,0,0,"M",1901-11-17,1901,NA,1977
"1292","SWZ-1960","A2.9-3874",225,"SWZ","Petipierre","01/01/1960","31/12/1960","26/02/1899","1994",1960-01-01,1960-12-31,0,1,0,2,0,"M",1899-02-26,1899,NA,1994
"1293","SWZ-1961","A2.9-3877",225,"SWZ","Friedrich","01/01/1961","31/12/1961","10/04/1899","1985",1961-01-01,1961-12-31,0,1,0,0,0,"M",1899-04-10,1899,NA,1985
"1294","SWZ-1962","A2.9-3880",225,"SWZ","Chaudet","01/01/1962","31/12/1962","17/11/1901","1977",1962-01-01,1962-12-31,0,1,0,1,0,"M",1901-11-17,1901,NA,1977
"1295","SWZ-1963","A2.9-3883",225,"SWZ","Spuhler","01/01/1963","31/12/1963","31/01/1902","1990",1963-01-01,1963-12-31,0,1,0,0,0,"M",1902-01-31,1902,NA,1990
"1296","SWZ-1964","A2.9-3886",225,"SWZ","von Moos","01/01/1964","31/12/1964","31/01/1910","1990",1964-01-01,1964-12-31,0,1,0,0,0,"M",1910-01-31,1910,NA,1990
"1297","SWZ-1965","A2.9-3889",225,"SWZ","Tschudi","01/01/1965","31/12/1965","22/10/1923","2002",1965-01-01,1965-12-31,0,1,0,0,0,"M",1923-10-22,1923,NA,2002
"1298","SWZ-1966","A2.9-3892",225,"SWZ","Schaffner","01/01/1966","31/12/1966","16/12/1908","2004",1966-01-01,1966-12-31,0,1,0,0,0,"M",1908-12-16,1908,NA,2004
"1299","SWZ-1967","A2.9-3895",225,"SWZ","Bonvin","01/01/1967","31/12/1967","12/9/1907","1982",1967-01-01,1967-12-31,0,1,0,0,0,"M",1907-09-12,1907,NA,1982
"1300","SWZ-1968","A2.9-3898",225,"SWZ","Spuhler","01/01/1968","31/12/1968","31/01/1902","1990",1968-01-01,1968-12-31,0,1,0,1,0,"M",1902-01-31,1902,NA,1990
"1301","SWZ-1969","A2.9-3901",225,"SWZ","von Moos","01/01/1969","31/12/1969","31/01/1910","1990",1969-01-01,1969-12-31,0,1,0,1,0,"M",1910-01-31,1910,NA,1990
"1302","SWZ-1970","A2.9-3904",225,"SWZ","Tschudi","01/01/1970","31/12/1970","22/10/1923","2002",1970-01-01,1970-12-31,0,1,0,1,0,"M",1923-10-22,1923,NA,2002
"1303","SWZ-1971","A2.9-3907",225,"SWZ","Gnagi","01/01/1971","31/12/1971","3/8/1917","1985",1971-01-01,1971-12-31,0,1,0,0,0,"M",1917-08-03,1917,NA,1985
"1304","SWZ-1972","A2.9-3910",225,"SWZ","Celio","01/01/1972","31/12/1972","12/2/1914","1980",1972-01-01,1972-12-31,0,1,0,0,0,"M",1914-02-12,1914,NA,1980
"1305","SWZ-1973","A2.9-3913",225,"SWZ","Bonvin","01/01/1973","31/12/1973","12/9/1907","1982",1973-01-01,1973-12-31,0,1,0,1,0,"M",1907-09-12,1907,NA,1982
"1306","SWZ-1974","A2.9-3916",225,"SWZ","Brugger","01/01/1974","31/12/1974","10/3/1914","21/06/1998",1974-01-01,1974-12-31,0,1,0,0,0,"M",1914-03-10,1914,1998-06-21,1998
"1307","SWZ-1975","A2.9-3919",225,"SWZ","Graber","01/01/1975","31/12/1975","6/12/1908","2003",1975-01-01,1975-12-31,0,1,0,0,0,"M",1908-12-06,1908,NA,2003
"1308","SWZ-1976","A2.9-3922",225,"SWZ","Gnagi","01/01/1976","31/12/1976","3/8/1917","1985",1976-01-01,1976-12-31,0,1,0,1,0,"M",1917-08-03,1917,NA,1985
"1309","SWZ-1977","A2.9-3925",225,"SWZ","Furgler","01/01/1977","31/12/1977","1924","-777",1977-01-01,1977-12-31,0,1,0,0,0,"M",NA,1924,NA,-777
"1310","SWZ-1978","A2.9-3928",225,"SWZ","Ritschard","01/01/1978","31/12/1978","1918","1983",1978-01-01,1978-12-31,0,1,0,0,0,"M",NA,1918,NA,1983
"1311","SWZ-1979","A2.9-3931",225,"SWZ","Hurlimann","01/01/1979","31/12/1979","1918","1994",1979-01-01,1979-12-31,0,1,0,0,0,"M",NA,1918,NA,1994
"1312","SWZ-1980","A2.9-3934",225,"SWZ","Chevallaz","01/01/1980","31/12/1980","7/2/1915","08/09/2002",1980-01-01,1980-12-31,0,1,0,0,0,"M",1915-02-07,1915,2002-09-08,2002
"1313","SWZ-1981","A2.9-3937",225,"SWZ","Furgler","01/01/1981","31/12/1981","1924","-777",1981-01-01,1981-12-31,0,1,0,1,0,"M",NA,1924,NA,-777
"1314","SWZ-1982","A2.9-3940",225,"SWZ","Honegger","01/01/1982","31/12/1982","1917","1999",1982-01-01,1982-12-31,0,1,0,0,0,"M",NA,1917,NA,1999
"1315","SWZ-1983","A2.9-3943",225,"SWZ","Aubert","01/01/1983","31/12/1983","1927","-777",1983-01-01,1983-12-31,0,1,0,0,0,"M",NA,1927,NA,-777
"1316","SWZ-1984","A2.9-3946",225,"SWZ","Schlumpf","01/01/1984","31/12/1984","1925","-777",1984-01-01,1984-12-31,0,1,0,0,0,"M",NA,1925,NA,-777
"1317","SWZ-1985","A2.9-3949",225,"SWZ","Furgler","01/01/1985","31/12/1985","1924","-777",1985-01-01,1985-12-31,0,1,0,2,0,"M",NA,1924,NA,-777
"1318","SWZ-1986","A2.9-3952",225,"SWZ","Egli","01/01/1986","31/12/1986","1924","-777",1986-01-01,1986-12-31,0,1,0,0,0,"M",NA,1924,NA,-777
"1319","SWZ-1987","A2.9-3955",225,"SWZ","Aubert","01/01/1987","31/12/1987","1927","-777",1987-01-01,1987-12-31,0,1,0,1,0,"M",NA,1927,NA,-777
"1320","SWZ-1988","A2.9-3958",225,"SWZ","Stich","01/01/1988","31/12/1988","1927","-777",1988-01-01,1988-12-31,0,1,0,0,0,"M",NA,1927,NA,-777
"1321","SWZ-1989","A2.9-3961",225,"SWZ","Delamuraz","01/01/1989","31/12/1989","1/4/1936","04/10/1998",1989-01-01,1989-12-31,0,1,0,0,0,"M",1936-04-01,1936,1998-10-04,1998
"1322","SWZ-1990","A2.9-3964",225,"SWZ","Koller","01/01/1990","31/12/1990","1933","-777",1990-01-01,1990-12-31,0,1,0,0,0,"M",NA,1933,NA,-777
"1323","SWZ-1991","A2.9-3967",225,"SWZ","Cotti","01/01/1991","31/12/1991","1939","-777",1991-01-01,1991-12-31,0,1,0,0,0,"M",NA,1939,NA,-777
"1324","SWZ-1992","A2.9-3970",225,"SWZ","Felber","01/01/1992","31/12/1992","1933","-777",1992-01-01,1992-12-31,0,1,0,0,0,"M",NA,1933,NA,-777
"1325","SWZ-1993","A2.9-3973",225,"SWZ","Ogi","01/01/1993","31/12/1993","18/07/1942","-777",1993-01-01,1993-12-31,0,1,0,0,0,"M",1942-07-18,1942,NA,-777
"1326","SWZ-1994","A2.9-3976",225,"SWZ","Stich","01/01/1994","31/12/1994","1927","-777",1994-01-01,1994-12-31,0,1,0,1,0,"M",NA,1927,NA,-777
"1327","SWZ-1995","A2.9-3979",225,"SWZ","Villiger","01/01/1995","31/12/1995","1941","-777",1995-01-01,1995-12-31,0,1,0,0,0,"M",NA,1941,NA,-777
"1328","SWZ-1996","A2.9-3982",225,"SWZ","Delamuraz","01/01/1996","31/12/1996","1/4/1936","04/10/1998",1996-01-01,1996-12-31,0,1,0,1,0,"M",1936-04-01,1936,1998-10-04,1998
"1329","SWZ-1997","A2.9-3985",225,"SWZ","Koller","01/01/1997","31/12/1997","1933","-777",1997-01-01,1997-12-31,0,1,0,1,0,"M",NA,1933,NA,-777
"1330","SWZ-1998","A2.9-3988",225,"SWZ","Cotti","01/01/1998","31/12/1998","1939","-777",1998-01-01,1998-12-31,0,1,0,1,0,"M",NA,1939,NA,-777
"1331","SWZ-1999","A2.9-3991",225,"SWZ","Dreifuss","01/01/1999","31/12/1999","9/1/1940","-777",1999-01-01,1999-12-31,0,1,0,0,0,"F",1940-01-09,1940,NA,-777
"1332","SWZ-2000","A2.9-3994",225,"SWZ","Ogi","01/01/2000","31/12/2000","1942","-777",2000-01-01,2000-12-31,0,1,0,1,0,"M",NA,1942,NA,-777
"1333","SWZ-2001","A2.9-3997",225,"SWZ","Leuenberger","1/1/2001","31/12/2001","21/09/1946","-777",2001-01-01,2001-12-31,0,1,0,0,0,"M",1946-09-21,1946,NA,-777
"1334","SWZ-2002","A2.9-4000",225,"SWZ","Villiger","1/1/2002","31/12/2002","1941","-777",2002-01-01,2002-12-31,0,1,0,1,0,"M",NA,1941,NA,-777
"1335","SWZ-2003","A2.9-4003",225,"SWZ","Pascal Couchepin","01/01/2003","31/12/2003","1942","-777",2003-01-01,2003-12-31,0,1,0,0,0,"M",NA,1942,NA,-777
"1336","SWZ-2004","A2.9-4006",225,"SWZ","Joseph Deiss","01/01/2004","31/12/2004","1946","-777",2004-01-01,2004-12-31,0,1,0,0,-888,"M",NA,1946,NA,-777
"1337","SPN-1874","A2.9-4009",230,"SPN","del Castillo","30/12/1874","10/09/1875","08/02/1828","1897",1874-12-30,1875-09-10,0,1,0,0,0,"M",1828-02-08,1828,NA,1897
"1338","SPN-1875-1","A2.9-4012",230,"SPN","Jovellar","11/09/1875","02/12/1875","1819","1892",1875-09-11,1875-12-02,0,1,0,0,0,"M",NA,1819,NA,1892
"1339","SPN-1875-2","A2.9-4015",230,"SPN","del Castillo","02/12/1875","07/03/1879","08/02/1828","1897",1875-12-02,1879-03-07,0,1,0,1,0,"M",1828-02-08,1828,NA,1897
"1340","SPN-1879-1","A2.9-4018",230,"SPN","Martinez-Campos","07/03/1879","09/12/1879","12/12/1831","1900",1879-03-07,1879-12-09,0,1,0,1,0,"M",1831-12-12,1831,NA,1900
"1341","SPN-1879-2","A2.9-4021",230,"SPN","del Castillo","09/12/1879","08/02/1881","08/02/1828","1897",1879-12-09,1881-02-08,0,1,0,2,0,"M",1828-02-08,1828,NA,1897
"1342","SPN-1881","A2.9-4024",230,"SPN","Sagasta","08/02/1881","13/10/1883","21/07/1827","1903",1881-02-08,1883-10-13,0,1,0,2,0,"M",1827-07-21,1827,NA,1903
"1343","SPN-1883","A2.9-4027",230,"SPN","Herrera","13/10/1883","18/01/1884","1815","1885",1883-10-13,1884-01-18,0,1,0,0,0,"M",NA,1815,NA,1885
"1344","SPN-1884","A2.9-4030",230,"SPN","del Castillo","18/01/1884","27/11/1885","08/02/1828","1897",1884-01-18,1885-11-27,0,1,0,3,0,"M",1828-02-08,1828,NA,1897
"1345","SPN-1885","A2.9-4033",230,"SPN","Sagasta","27/11/1885","05/07/1890","21/07/1827","1903",1885-11-27,1890-07-05,0,1,0,3,0,"M",1827-07-21,1827,NA,1903
"1346","SPN-1890","A2.9-4036",230,"SPN","del Castillo","05/07/1890","11/12/1892","08/02/1828","1897",1890-07-05,1892-12-11,0,1,0,4,0,"M",1828-02-08,1828,NA,1897
"1347","SPN-1892","A2.9-4039",230,"SPN","Sagasta","11/12/1892","23/03/1895","21/07/1827","1903",1892-12-11,1895-03-23,0,1,0,4,0,"M",1827-07-21,1827,NA,1903
"1348","SPN-1895","A2.9-4042",230,"SPN","del Castillo","23/03/1895","08/08/1897","08/02/1828","1897",1895-03-23,1897-08-08,0,3,-999,5,3,"M",1828-02-08,1828,NA,1897
"1349","SPN-1897-1","A2.9-4045",230,"SPN","Azcarraga y Palmero","08/08/1897","04/10/1897","04/09/1832","1915",1897-08-08,1897-10-04,0,1,0,0,0,"M",1832-09-04,1832,NA,1915
"1350","SPN-1897-2","A2.9-4048",230,"SPN","Sagasta","04/10/1897","05/03/1899","21/07/1827","1903",1897-10-04,1899-03-05,0,1,0,5,0,"M",1827-07-21,1827,NA,1903
"1351","SPN-1899","A2.9-4051",230,"SPN","Le-Vielleuze","05/03/1899","22/10/1900","15/12/1843","1905",1899-03-05,1900-10-22,0,1,0,0,0,"M",1843-12-15,1843,NA,1905
"1352","SPN-1900","A2.9-4054",230,"SPN","Azcarraga y Palmero","22/10/1900","26/02/1901","04/09/1832","1915",1900-10-22,1901-02-26,0,1,0,1,0,"M",1832-09-04,1832,NA,1915
"1353","SPN-1901","A2.9-4057",230,"SPN","Sagasta","26/02/1901","06/12/1902","21/07/1827","1903",1901-02-26,1902-12-06,0,1,0,6,0,"M",1827-07-21,1827,NA,1903
"1354","SPN-1902","A2.9-4060",230,"SPN","Le-Vielleuze","06/12/1902","20/07/1903","15/12/1843","1905",1902-12-06,1903-07-20,0,1,0,1,0,"M",1843-12-15,1843,NA,1905
"1355","SPN-1903-1","A2.9-4063",230,"SPN","Villaverde","20/07/1903","06/12/1903","20/01/1848","1905",1903-07-20,1903-12-06,0,1,0,0,0,"M",1848-01-20,1848,NA,1905
"1356","SPN-1903-2","A2.9-4066",230,"SPN","Maura y Montaner","06/12/1903","16/12/1904","02/05/1853","1925",1903-12-06,1904-12-16,0,1,0,0,0,"M",1853-05-02,1853,NA,1925
"1357","SPN-1904","A2.9-4069",230,"SPN","Azcarraga y Palmero","16/12/1904","27/01/1905","04/09/1832","1915",1904-12-16,1905-01-27,0,1,0,2,0,"M",1832-09-04,1832,NA,1915
"1358","SPN-1905-1","A2.9-4072",230,"SPN","Villaverde","27/01/1905","23/06/1905","20/01/1848","1905",1905-01-27,1905-06-23,0,1,0,1,0,"M",1848-01-20,1848,NA,1905
"1359","SPN-1905-2","A2.9-4075",230,"SPN","Rios","23/06/1905","01/12/1905","12/11/1832","1914",1905-06-23,1905-12-01,0,1,0,0,0,"M",1832-11-12,1832,NA,1914
"1360","SPN-1905-3","A2.9-4078",230,"SPN","Moret y Prendergast","01/12/1905","05/07/1906","02/07/1838","1913",1905-12-01,1906-07-05,0,1,0,0,0,"M",1838-07-02,1838,NA,1913
"1361","SPN-1906-1","A2.9-4081",230,"SPN","Dominguez","05/07/1906","30/11/1906","29/11/1829","1911",1906-07-05,1906-11-30,0,1,0,0,0,"M",1829-11-29,1829,NA,1911
"1362","SPN-1906-2","A2.9-4084",230,"SPN","Moret y Prendergast","30/11/1906","04/12/1906","02/07/1838","1913",1906-11-30,1906-12-04,0,1,0,1,0,"M",1838-07-02,1838,NA,1913
"1363","SPN-1906-3","A2.9-4087",230,"SPN","Aguilar y Correa","04/12/1906","24/01/1907","30/06/1824","1908",1906-12-04,1907-01-24,0,1,0,0,0,"M",1824-06-30,1824,NA,1908
"1364","SPN-1907","A2.9-4090",230,"SPN","Maura y Montaner","24/01/1907","21/10/1909","02/05/1853","1925",1907-01-24,1909-10-21,0,1,0,1,0,"M",1853-05-02,1853,NA,1925
"1365","SPN-1909","A2.9-4093",230,"SPN","Moret y Prendergast","21/10/1909","09/02/1910","02/07/1838","1913",1909-10-21,1910-02-09,0,1,0,2,0,"M",1838-07-02,1838,NA,1913
"1366","SPN-1910","A2.9-4096",230,"SPN","Canalejas y Mendez","09/02/1910","12/11/1912","03/07/1854","1912",1910-02-09,1912-11-12,0,3,-999,0,3,"M",1854-07-03,1854,NA,1912
"1367","SPN-1912-1","A2.9-4099",230,"SPN","Figueroa y Torres","12/11/1912","15/11/1912","01/08/1863","1950",1912-11-12,1912-11-15,0,1,0,0,0,"M",1863-08-01,1863,NA,1950
"1368","SPN-1912-2","A2.9-4102",230,"SPN","Garcia Prieto","15/11/1912","27/10/1913","05/11/1859","1938",1912-11-15,1913-10-27,0,1,0,0,0,"M",1859-11-05,1859,NA,1938
"1369","SPN-1913","A2.9-4105",230,"SPN","Dato y Iradier","27/10/1913","09/12/1915","12/08/1856","1921",1913-10-27,1915-12-09,0,1,0,0,0,"M",1856-08-12,1856,NA,1921
"1370","SPN-1915","A2.9-4108",230,"SPN","Figueroa y Torres","09/12/1915","19/04/1917","01/08/1863","1950",1915-12-09,1917-04-19,0,1,0,1,0,"M",1863-08-01,1863,NA,1950
"1371","SPN-1917-1","A2.9-4111",230,"SPN","Garcia Prieto","19/04/1917","11/06/1917","05/11/1859","1938",1917-04-19,1917-06-11,0,1,0,1,0,"M",1859-11-05,1859,NA,1938
"1372","SPN-1917-2","A2.9-4114",230,"SPN","Dato y Iradier","11/06/1917","03/11/1917","12/08/1856","1921",1917-06-11,1917-11-03,0,1,0,1,0,"M",1856-08-12,1856,NA,1921
"1373","SPN-1917-3","A2.9-4117",230,"SPN","Garcia Prieto","03/11/1917","22/03/1918","05/11/1859","1938",1917-11-03,1918-03-22,0,1,0,2,0,"M",1859-11-05,1859,NA,1938
"1374","SPN-1918-1","A2.9-4120",230,"SPN","Maura y Montaner","22/03/1918","09/11/1918","02/05/1853","1925",1918-03-22,1918-11-09,0,1,0,2,0,"M",1853-05-02,1853,NA,1925
"1375","SPN-1918-2","A2.9-4123",230,"SPN","Garcia Prieto","09/11/1918","05/12/1918","05/11/1859","1938",1918-11-09,1918-12-05,0,1,0,3,0,"M",1859-11-05,1859,NA,1938
"1376","SPN-1918-3","A2.9-4126",230,"SPN","Figueroa y Torres","05/12/1918","14/04/1919","01/08/1863","1950",1918-12-05,1919-04-14,0,3,2,2,0,"M",1863-08-01,1863,NA,1950
"1377","SPN-1919-1","A2.9-4129",230,"SPN","Maura y Montaner","14/04/1919","20/07/1919","02/05/1853","1925",1919-04-14,1919-07-20,0,1,0,3,0,"M",1853-05-02,1853,NA,1925
"1378","SPN-1919-2","A2.9-4132",230,"SPN","de Toca","20/07/1919","12/12/1919","1852","1942",1919-07-20,1919-12-12,0,1,0,0,0,"M",NA,1852,NA,1942
"1379","SPN-1919-3","A2.9-4135",230,"SPN","Allende Salazar","12/12/1919","05/05/1920","1856","1923",1919-12-12,1920-05-05,0,1,0,0,0,"M",NA,1856,NA,1923
"1380","SPN-1920","A2.9-4138",230,"SPN","Dato y Iradier","05/05/1920","08/03/1921","12/08/1856","1921",1920-05-05,1921-03-08,0,3,11,2,3,"M",1856-08-12,1856,NA,1921
"1381","SPN-1921-1","A2.9-4141",230,"SPN","Araugo","08/03/1921","12/03/1921","1861","1932",1921-03-08,1921-03-12,0,1,0,0,0,"M",NA,1861,NA,1932
"1382","SPN-1921-2","A2.9-4144",230,"SPN","Allende Salazar","13/03/1921","14/08/1921","1856","1923",1921-03-13,1921-08-14,0,1,0,1,0,"M",NA,1856,NA,1923
"1383","SPN-1921-3","A2.9-4147",230,"SPN","Maura y Montaner","14/08/1921","08/03/1922","02/05/1853","1925",1921-08-14,1922-03-08,0,1,0,3,0,"M",1853-05-02,1853,NA,1925
"1384","SPN-1922-1","A2.9-4150",230,"SPN","Sanchez Guerra","08/03/1922","05/12/1922","1859","1925",1922-03-08,1922-12-05,0,3,8,0,1,"M",NA,1859,NA,1925
"1385","SPN-1922-2","A2.9-4153",230,"SPN","Garcia Prieto","05/12/1922","14/9/1923","05/11/1859","1938",1922-12-05,1923-09-14,0,3,6,4,0,"M",1859-11-05,1859,NA,1938
"1386","SPN-1923","A2.9-4156",230,"SPN","de Rivera","14/9/1923","28/01/1930","09/01/1870","06/03/1930",1923-09-14,1930-01-28,1,1,0,0,1,"M",1870-01-09,1870,1930-03-06,1930
"1387","SPN-1930","A2.9-4159",230,"SPN","Berenguer","30/01/1930","14/02/1931","04/08/1873","19/05/1953",1930-01-30,1931-02-14,1,1,0,0,2,"M",1873-08-04,1873,1953-05-19,1953
"1388","SPN-1931-1","A2.9-4162",230,"SPN","Azmar-Cabanas","18/02/1931","14/04/1931","1860","1933",1931-02-18,1931-04-14,0,3,2,0,0,"M",NA,1860,NA,1933
"1389","SPN-1931-2","A2.9-4165",230,"SPN","Alcala Zamora","14/04/1931","14/10/1931","06/07/1877","1949",1931-04-14,1931-10-14,1,1,0,0,0,"M",1877-07-06,1877,NA,1949
"1390","SPN-1931-3","A2.9-4168",230,"SPN","Azana y Diez","14/10/1931","08/09/1933","10/11/1880","1940",1931-10-14,1933-09-08,0,1,0,0,0,"M",1880-11-10,1880,NA,1940
"1391","SPN-1933-1","A2.9-4171",230,"SPN","Lerroux y Garcia","12/09/1933","03/10/1933","26/02/1866","1949",1933-09-12,1933-10-03,0,1,0,0,0,"M",1866-02-26,1866,NA,1949
"1392","SPN-1933-2","A2.9-4174",230,"SPN","Martinez Barro","09/10/1933","16/12/1933","25/11/1883","1962",1933-10-09,1933-12-16,0,1,0,0,0,"M",1883-11-25,1883,NA,1962
"1393","SPN-1933-3","A2.9-4177",230,"SPN","Lerroux y Garcia","16/12/1933","15/04/1934","26/02/1866","1949",1933-12-16,1934-04-15,0,1,0,1,0,"M",1866-02-26,1866,NA,1949
"1394","SPN-1934-1","A2.9-4180",230,"SPN","Ibanez","28/04/1934","01/10/1934","25/08/1881","1938",1934-04-28,1934-10-01,0,1,0,0,0,"M",1881-08-25,1881,NA,1938
"1395","SPN-1934-2","A2.9-4183",230,"SPN","Lerroux y Garcia","10/10/1934","20/10/1935","26/02/1866","1949",1934-10-10,1935-10-20,0,1,0,2,0,"M",1866-02-26,1866,NA,1949
"1396","SPN-1935-1","A2.9-4186",230,"SPN","Chapaprieta","25/10/1935","09/12/1935","26/10/1871","1951",1935-10-25,1935-12-09,0,1,0,0,0,"M",1871-10-26,1871,NA,1951
"1397","SPN-1935-2","A2.9-4189",230,"SPN","Portela","31/12/1935","19/02/1936","1868","1952",1935-12-31,1936-02-19,0,1,0,0,0,"M",NA,1868,NA,1952
"1398","SPN-1936-1","A2.9-4192",230,"SPN","Azana y Diez","19/02/1936","11/05/1936","10/11/1880","1940",1936-02-19,1936-05-11,0,1,0,1,1,"M",1880-11-10,1880,NA,1940
"1399","SPN-1936-2","A2.9-4195",230,"SPN","Casares Quiroga","13/05/1936","19/07/1936","1884","1950",1936-05-13,1936-07-19,0,1,0,0,0,"M",NA,1884,NA,1950
"1400","SPN-1936-3","A2.9-4198",230,"SPN","Martinez Barro","19/07/1936","19/07/1936","25/11/1883","1962",1936-07-19,1936-07-19,0,1,0,1,0,"M",1883-11-25,1883,NA,1962
"1401","SPN-1936-4","A2.9-4201",230,"SPN","Giral y Pereyra","19/07/1936","04/09/1936","22/10/1879","1962",1936-07-19,1936-09-04,0,1,0,0,0,"M",1879-10-22,1879,NA,1962
"1402","SPN-1936-5","A2.9-4204",230,"SPN","Largo Caballero","04/09/1936","15/05/1937","15/10/1869","1946",1936-09-04,1937-05-15,0,1,0,0,0,"M",1869-10-15,1869,NA,1946
"1403","SPN-1937","A2.9-4207",230,"SPN","Negrin","18/05/1937","05/03/1939","1889","1956",1937-05-18,1939-03-05,0,3,6,0,1,"M",NA,1889,NA,1956
"1404","SPN-1939-1","A2.9-4210",230,"SPN","Miaja","05/03/1939","31/03/1939","1878","14/01/1958",1939-03-05,1939-03-31,1,3,3,0,1,"M",NA,1878,1958-01-14,1958
"1405","SPN-1939-2","A2.9-4213",230,"SPN","Franco","01/04/1939","30/10/1975","04/12/1892","20/11/1975",1939-04-01,1975-10-30,1,2,0,0,-777,"M",1892-12-04,1892,1975-11-20,1975
"1406","SPN-1975-1","A2.9-4216",230,"SPN","Juan Carlos","01/11/1975","08/11/1975","5/1/1928","-777",1975-11-01,1975-11-08,0,1,0,0,0,"M",1928-01-05,1928,NA,-777
"1407","SPN-1975-2","A2.9-4219",230,"SPN","Arias Navarro","09/11/1975","01/07/1976","11/12/1908","27/11/1989",1975-11-09,1976-07-01,0,1,0,0,0,"M",1908-12-11,1908,1989-11-27,1989
"1408","SPN-1976","A2.9-4222",230,"SPN","Suarez Gonzalez","01/07/1976","25/02/1981","25/09/1932","-777",1976-07-01,1981-02-25,0,1,0,0,0,"M",1932-09-25,1932,NA,-777
"1409","SPN-1981","A2.9-4225",230,"SPN","Calvo-Sotelo","25/02/1981","02/12/1982","14/04/1926","-777",1981-02-25,1982-12-02,0,1,0,0,0,"M",1926-04-14,1926,NA,-777
"1410","SPN-1982","A2.9-4228",230,"SPN","Gonzalez Marquez","02/12/1982","05/05/1996","5/3/1942","-777",1982-12-02,1996-05-05,0,1,0,0,0,"M",1942-03-05,1942,NA,-777
"1411","SPN-1996","A2.9-4231",230,"SPN","Aznar","05/05/1996","17/04/2004","25/02/1953","-777",1996-05-05,2004-04-17,0,1,0,0,0,"M",1953-02-25,1953,NA,-777
"1412","SPN-2004","A2.9-4234",230,"SPN","Rodriguez Zapatero","17/04/2004","31/12/2004","1960","-777",2004-04-17,2004-12-31,0,-888,0,0,-888,"M",NA,1960,NA,-777
"1413","POR-1861","A2.9-4237",235,"POR","Luis I","11/11/1861","19/10/1889","1838","1889",1861-11-11,1889-10-19,0,2,0,0,-777,"M",NA,1838,NA,1889
"1414","POR-1889","A2.9-4240",235,"POR","Carlos I","19/10/1889","01/02/1908","28/09/1863","01/02/1908",1889-10-19,1908-02-01,0,3,-999,0,3,"M",1863-09-28,1863,1908-02-01,1908
"1415","POR-1908","A2.9-4243",235,"POR","Manuel II","01/02/1908","05/10/1910","15/11/1889","02/07/1932",1908-02-01,1910-10-05,0,3,-999,0,1,"M",1889-11-15,1889,1932-07-02,1932
"1416","POR-1910","A2.9-4246",235,"POR","Braga","05/10/1910","24/08/1911","1843","1924",1910-10-05,1911-08-24,1,1,0,0,0,"M",NA,1843,NA,1924
"1417","POR-1911","A2.9-4249",235,"POR","Arriaga","24/08/1911","29/05/1915","1840","1917",1911-08-24,1915-05-29,0,1,0,0,0,"M",NA,1840,NA,1917
"1418","POR-1915-1","A2.9-4252",235,"POR","Braga","29/05/1915","05/10/1915","1843","1924",1915-05-29,1915-10-05,0,1,0,1,0,"M",NA,1843,NA,1924
"1419","POR-1915-2","A2.9-4255",235,"POR","Machado Guimaraes","05/10/1915","08/12/1917","28/03/1851","29/04/1944",1915-10-05,1917-12-08,0,3,-999,0,2,"M",1851-03-28,1851,1944-04-29,1944
"1420","POR-1917","A2.9-4258",235,"POR","Paes","08/12/1917","14/12/1918","1872","1918",1917-12-08,1918-12-14,1,3,-999,0,3,"M",NA,1872,NA,1918
"1421","POR-1918","A2.9-4261",235,"POR","Joao Canto e Castro","16/12/1918","05/10/1919","1862","1934",1918-12-16,1919-10-05,0,1,0,0,0,"M",NA,1862,NA,1934
"1422","POR-1919","A2.9-4264",235,"POR","Almeida","05/10/1919","06/08/1923","1866","1929",1919-10-05,1923-08-06,0,1,0,0,0,"M",NA,1866,NA,1929
"1423","POR-1923","A2.9-4267",235,"POR","Gomes","06/08/1923","11/12/1925","1860","1941",1923-08-06,1925-12-11,0,2.1,0,0,0,"M",NA,1860,NA,1941
"1424","POR-1925","A2.9-4270",235,"POR","Machado Guimaraes","16/12/1925","28/05/1926","28/03/1851","29/04/1944",1925-12-16,1926-05-28,0,3,6,1,1,"M",1851-03-28,1851,1944-04-29,1944
"1425","POR-1926","A2.9-4273",235,"POR","Carmona","28/05/1926","05/07/1932","29/11/1869","1951",1926-05-28,1932-07-05,1,1,0,0,0,"M",1869-11-29,1869,NA,1951
"1426","POR-1932","A2.9-4276",235,"POR","Salazar","05/07/1932","16/09/1968","1889","1970",1932-07-05,1968-09-16,0,2,0,0,-777,"M",NA,1889,NA,1970
"1427","POR-1968","A2.9-4279",235,"POR","Caetano","27/09/1968","25/04/1974","17/08/1906","26/10/1980",1968-09-27,1974-04-25,0,3,6,0,1,"M",1906-08-17,1906,1980-10-26,1980
"1428","POR-1974-1","A2.9-4282",235,"POR","Spinola","25/04/1974","30/09/1974","11/04/1910","13/08/1996",1974-04-25,1974-09-30,1,1,0,0,2,"M",1910-04-11,1910,1996-08-13,1996
"1429","POR-1974-2","A2.9-4285",235,"POR","Costa Gomes","30/09/1974","23/07/1976","30/06/1914","2001",1974-09-30,1976-07-23,0,1,0,0,0,"M",1914-06-30,1914,NA,2001
"1430","POR-1976","A2.9-4288",235,"POR","Eanes","23/07/1976","09/03/1986","25/01/1914","-777",1976-07-23,1986-03-09,0,1,0,0,0,"M",1914-01-25,1914,NA,-777
"1431","POR-1986","A2.9-4291",235,"POR","Soares","09/03/1986","09/03/1996","7/12/1924","-777",1986-03-09,1996-03-09,0,1,0,0,0,"M",1924-12-07,1924,NA,-777
"1432","POR-1996","A2.9-4294",235,"POR","Sampaio","09/03/1996","31/12/2004","1939","-777",1996-03-09,2004-12-31,0,-888,0,0,-888,"M",NA,1939,NA,-777
"1433","BAV-1864","A2.9-4297",245,"BAV","Ludwig II","10/03/1864","06/04/1871","1831","1886",1864-03-10,1871-04-06,0,4,9,0,0,"M",NA,1831,NA,1886
"1434","GMY-1858","A2.9-4300",255,"GMY","Wilhelm I","07/10/1858","09/03/1888","22/03/1797","09/03/1888",1858-10-07,1888-03-09,0,2,0,0,-777,"M",1797-03-22,1797,1888-03-09,1888
"1435","GMY-1888-1","A2.9-4303",255,"GMY","Friedrich III","09/03/1888","15/06/1888","1831","15/06/1888",1888-03-09,1888-06-15,0,1,0,0,0,"M",NA,1831,1888-06-15,1888
"1436","GMY-1888-2","A2.9-4306",255,"GMY","Wilhelm II","15/06/1888","09/11/1918","27/01/1859","04/06/1941",1888-06-15,1918-11-09,0,3,1,0,1,"M",1859-01-27,1859,1941-06-04,1941
"1437","GMY-1918","A2.9-4309",255,"GMY","Ebert","09/11/1918","11/02/1919","04/02/1871","28/02/1925",1918-11-09,1919-02-11,1,1,0,0,0,"M",1871-02-04,1871,1925-02-28,1925
"1438","GMY-1919-1","A2.9-4312",255,"GMY","Scheidemann","12/02/1919","20/06/1919","26/07/1865","29/11/1939",1919-02-12,1919-06-20,0,1,0,0,0,"M",1865-07-26,1865,1939-11-29,1939
"1439","GMY-1919-2","A2.9-4315",255,"GMY","Bauer","21/06/1919","26/03/1920","06/01/1870","16/09/1944",1919-06-21,1920-03-26,0,1,0,0,0,"M",1870-01-06,1870,1944-09-16,1944
"1440","GMY-1920-1","A2.9-4318",255,"GMY","Muller","27/03/1920","08/06/1920","18/05/1876","20/03/1931",1920-03-27,1920-06-08,0,1,0,0,0,"M",1876-05-18,1876,1931-03-20,1931
"1441","GMY-1920-2","A2.9-4321",255,"GMY","Fehrenback","25/06/1920","04/05/1921","11/01/1852","26/03/1926",1920-06-25,1921-05-04,0,1,0,0,0,"M",1852-01-11,1852,1926-03-26,1926
"1442","GMY-1921","A2.9-4324",255,"GMY","Wirth","10/05/1921","14/11/1922","06/09/1879","03/01/1956",1921-05-10,1922-11-14,0,1,0,0,0,"M",1879-09-06,1879,1956-01-03,1956
"1443","GMY-1922","A2.9-4327",255,"GMY","Cuno","22/11/1922","12/08/1923","02/07/1876","03/01/1933",1922-11-22,1923-08-12,0,1,0,0,0,"M",1876-07-02,1876,1933-01-03,1933
"1444","GMY-1923-1","A2.9-4330",255,"GMY","Stresemann","13/08/1923","23/11/1923","10/05/1878","03/10/1929",1923-08-13,1923-11-23,0,1,0,0,0,"M",1878-05-10,1878,1929-10-03,1929
"1445","GMY-1923-2","A2.9-4333",255,"GMY","Marx","30/11/1923","15/12/1924","15/01/1863","05/08/1946",1923-11-30,1924-12-15,0,1,0,0,0,"M",1863-01-15,1863,1946-08-05,1946
"1446","GMY-1925","A2.9-4336",255,"GMY","Luther","15/01/1925","12/05/1926","10/03/1879","11/05/1962",1925-01-15,1926-05-12,0,1,0,0,0,"M",1879-03-10,1879,1962-05-11,1962
"1447","GMY-1926","A2.9-4339",255,"GMY","Marx","16/05/1926","12/06/1928","15/01/1863","05/08/1946",1926-05-16,1928-06-12,0,1,0,1,0,"M",1863-01-15,1863,1946-08-05,1946
"1448","GMY-1928","A2.9-4342",255,"GMY","Muller","28/06/1928","27/03/1930","18/05/1876","20/03/1931",1928-06-28,1930-03-27,0,1,0,1,0,"M",1876-05-18,1876,1931-03-20,1931
"1449","GMY-1930","A2.9-4345",255,"GMY","Bruning","30/03/1930","30/05/1932","26/11/1885","30/03/1970",1930-03-30,1932-05-30,0,1,0,0,0,"M",1885-11-26,1885,1970-03-30,1970
"1450","GMY-1932-1","A2.9-4348",255,"GMY","Papen","01/06/1932","17/11/1932","29/10/1879","02/05/1969",1932-06-01,1932-11-17,0,1,0,0,0,"M",1879-10-29,1879,1969-05-02,1969
"1451","GMY-1932-2","A2.9-4351",255,"GMY","Schleicher","03/12/1932","28/01/1933","07/04/1882","30/06/1934",1932-12-03,1933-01-28,0,1,0,0,0,"M",1882-04-07,1882,1934-06-30,1934
"1452","GMY-1933","A2.9-4354",255,"GMY","Hitler","30/01/1933","30/04/1945","20/05/1889","30/04/1945",1933-01-30,1945-04-30,0,2.2,0,0,-777,"M",1889-05-20,1889,1945-04-30,1945
"1453","GMY-1945","A2.9-4357",255,"GMY","Doenitz","30/04/1945","23/05/1945","16/09/1891","24/12/1980",1945-04-30,1945-05-23,0,4,9,0,2,"M",1891-09-16,1891,1980-12-24,1980
"1454","GFR-1949","A2.9-4360",260,"GFR","Adenauer","16/09/1949","15/10/1963","05/01/1876","19/04/1967",1949-09-16,1963-10-15,0,1,0,0,0,"M",1876-01-05,1876,1967-04-19,1967
"1455","GFR-1963","A2.9-4363",260,"GFR","Erhard","16/10/1963","01/12/1966","04/02/1897","05/05/1977",1963-10-16,1966-12-01,0,1,0,0,0,"M",1897-02-04,1897,1977-05-05,1977
"1456","GFR-1966","A2.9-4366",260,"GFR","Kiesinger","01/12/1966","21/10/1969","06/04/1904","09/03/1988",1966-12-01,1969-10-21,0,1,0,0,0,"M",1904-04-06,1904,1988-03-09,1988
"1457","GFR-1969","A2.9-4369",260,"GFR","Brandt","22/10/1969","06/05/1974","18/12/1913","08/10/1992",1969-10-22,1974-05-06,0,1,0,0,0,"M",1913-12-18,1913,1992-10-08,1992
"1458","GFR-1974","A2.9-4372",260,"GFR","Schmidt","16/05/1974","01/10/1982","23/12/1918","-777",1974-05-16,1982-10-01,0,1,0,0,0,"M",1918-12-23,1918,NA,-777
"1459","GFR-1982","A2.9-4375",260,"GFR","Kohl","01/10/1982","27/10/1998","03/04/1930","-777",1982-10-01,1998-10-27,0,1,0,0,0,"M",1930-04-03,1930,NA,-777
"1460","GFR-1998","A2.9-4378",260,"GFR","Schroder","27/10/1998","31/12/2004","07/04/1944","-777",1998-10-27,2004-12-31,0,-888,0,0,-888,"M",1944-04-07,1944,NA,-777
"1461","GDR-1946","A2.9-4381",265,"GDR","Wilhelm Pieck","22/04/1946","25/07/1950","1876","1960",1946-04-22,1950-07-25,1,1,0,0,0,"M",NA,1876,NA,1960
"1462","GDR-1950","A2.9-4384",265,"GDR","Ulbricht","25/07/1950","03/05/1971","30/06/1893","01/08/1973",1950-07-25,1971-05-03,0,1,0,0,0,"M",1893-06-30,1893,1973-08-01,1973
"1463","GDR-1971","A2.9-4387",265,"GDR","Honecker","03/05/1971","18/10/1989","25/08/1912","29/05/1994",1971-05-03,1989-10-18,0,1,0,0,2,"M",1912-08-25,1912,1994-05-29,1994
"1464","GDR-1989-1","A2.9-4390",265,"GDR","Krenz","18/10/1989","03/12/1989","19/03/1937","-777",1989-10-18,1989-12-03,0,1,0,0,0,"M",1937-03-19,1937,NA,-777
"1465","GDR-1989-2","A2.9-4393",265,"GDR","Gysi","09/12/1989","03/10/1990","16/01/1948","-777",1989-12-09,1990-10-03,0,4,111,0,0,"M",1948-01-16,1948,NA,-777
"1466","POL-1918-1","A2.9-4396",290,"POL","Daszynski","11/11/1918","13/11/1918","26/10/1866","31/10/1936",1918-11-11,1918-11-13,1,1,0,0,0,"M",1866-10-26,1866,1936-10-31,1936
"1467","POL-1918-2","A2.9-4399",290,"POL","Pildsudski","14/11/1918","09/12/1922","05/12/1867","12/05/1935",1918-11-14,1922-12-09,1,1,0,0,0,"M",1867-12-05,1867,1935-05-12,1935
"1468","POL-1922-1","A2.9-4402",290,"POL","Narutowicz","09/12/1922","18/12/1922","17/03/1865","16/12/1922",1922-12-09,1922-12-18,0,3,11,0,3,"M",1865-03-17,1865,1922-12-16,1922
"1469","POL-1922-2","A2.9-4405",290,"POL","Wojciechowski","20/12/1922","12/05/1926","15/03/1869","09/04/1953",1922-12-20,1926-05-12,0,3,6,0,0,"M",1869-03-15,1869,1953-04-09,1953
"1470","POL-1926","A2.9-4408",290,"POL","Pildsudski","12/05/1926","12/05/1935","05/12/1867","12/05/1935",1926-05-12,1935-05-12,0,2,0,1,-777,"M",1867-12-05,1867,1935-05-12,1935
"1471","POL-1935","A2.9-4411",290,"POL","Smigly-Rydz","12/05/1935","18/09/1939","11/03/1866","02/12/1941",1935-05-12,1939-09-18,0,4,9,0,1,"M",1866-03-11,1866,1941-12-02,1941
"1472","POL-1944","A2.9-4414",290,"POL","Bierut","31/12/1944","12/03/1956","18/04/1892","12/03/1956",1944-12-31,1956-03-12,1,2,0,0,-777,"M",1892-04-18,1892,1956-03-12,1956
"1473","POL-1956-1","A2.9-4417",290,"POL","Ochab","20/03/1956","21/10/1956","1906","1989",1956-03-20,1956-10-21,0,1,0,0,0,"M",NA,1906,NA,1989
"1474","POL-1956-2","A2.9-4420",290,"POL","Gomulka","21/10/1956","20/12/1970","06/02/1905","01/09/1982",1956-10-21,1970-12-20,0,3,2,0,0,"M",1905-02-06,1905,1982-09-01,1982
"1475","POL-1970","A2.9-4423",290,"POL","Gierek","20/12/1970","06/09/1980","06/01/1913","29/07/2001",1970-12-20,1980-09-06,0,2,0,0,-777,"M",1913-01-06,1913,2001-07-29,2001
"1476","POL-1980","A2.9-4426",290,"POL","Kania","06/09/1980","18/10/1981","08/03/1927","-777",1980-09-06,1981-10-18,0,1,0,0,0,"M",1927-03-08,1927,NA,-777
"1477","POL-1981","A2.9-4429",290,"POL","Jaruzelski","18/10/1981","22/12/1990","06/07/1923","-777",1981-10-18,1990-12-22,0,1,0,0,0,"M",1923-07-06,1923,NA,-777
"1478","POL-1990","A2.9-4432",290,"POL","Walesa","22/12/1990","23/12/1995","29/09/1943","-777",1990-12-22,1995-12-23,0,1,0,0,0,"M",1943-09-29,1943,NA,-777
"1479","POL-1995","A2.9-4435",290,"POL","Kwasniewski","23/12/1995","31/12/2004","15/11/1954","-777",1995-12-23,2004-12-31,0,-888,0,0,-888,"M",1954-11-15,1954,NA,-777
"1480","AUH-1848","A2.9-4438",300,"AUH","Francis Joseph I","02/12/1848","21/11/1916","18/08/1830","21/11/1916",1848-12-02,1916-11-21,0,2,0,0,-777,"M",1830-08-18,1830,1916-11-21,1916
"1481","AUH-1916","A2.9-4441",300,"AUH","Karl","21/11/1916","11/11/1918","17/08/1887","01/04/1922",1916-11-21,1918-11-11,0,3,1,0,1,"M",1887-08-17,1887,1922-04-01,1922
"1482","AUS-1918","A2.9-4444",305,"AUS","Renner","12/11/1918","11/06/1920","14/12/1870","31/12/1950",1918-11-12,1920-06-11,1,1,0,0,0,"M",1870-12-14,1870,1950-12-31,1950
"1483","AUS-1920","A2.9-4447",305,"AUS","Mayr","07/07/1920","01/06/1921","1864","1922",1920-07-07,1921-06-01,0,1,0,0,0,"M",NA,1864,NA,1922
"1484","AUS-1921","A2.9-4450",305,"AUS","Schober","21/06/1921","24/05/1922","14/11/1870","1932",1921-06-21,1922-05-24,0,1,0,0,0,"M",1870-11-14,1870,NA,1932
"1485","AUS-1922","A2.9-4453",305,"AUS","Seipel","31/05/1922","01/06/1924","19/07/1876","1932",1922-05-31,1924-06-01,0,1,0,0,0,"M",1876-07-19,1876,NA,1932
"1486","AUS-1924","A2.9-4456",305,"AUS","Ramek","01/06/1924","15/10/1926","12/04/1881","1941",1924-06-01,1926-10-15,0,1,0,0,0,"M",1881-04-12,1881,NA,1941
"1487","AUS-1926","A2.9-4459",305,"AUS","Seipel","20/10/1926","03/04/1929","19/07/1876","1932",1926-10-20,1929-04-03,0,1,0,1,0,"M",1876-07-19,1876,NA,1932
"1488","AUS-1929-1","A2.9-4462",305,"AUS","Streeruwitz","04/05/1929","25/09/1929","1874","1952",1929-05-04,1929-09-25,0,1,0,0,0,"M",NA,1874,NA,1952
"1489","AUS-1929-2","A2.9-4465",305,"AUS","Schober","26/09/1929","25/09/1930","14/11/1870","1932",1929-09-26,1930-09-25,0,1,0,1,0,"M",1870-11-14,1870,NA,1932
"1490","AUS-1930-1","A2.9-4468",305,"AUS","Vaugoin","30/09/1930","29/11/1930","1873","1949",1930-09-30,1930-11-29,0,1,0,0,0,"M",NA,1873,NA,1949
"1491","AUS-1930-2","A2.9-4471",305,"AUS","Ender","04/12/1930","16/06/1931","24/12/1875","25/06/1960",1930-12-04,1931-06-16,0,1,0,0,0,"M",1875-12-24,1875,1960-06-25,1960
"1492","AUS-1931","A2.9-4474",305,"AUS","Buresch","20/06/1931","06/05/1932","1878","1936",1931-06-20,1932-05-06,0,1,0,0,0,"M",NA,1878,NA,1936
"1493","AUS-1932","A2.9-4477",305,"AUS","Dollfuss","20/05/1932","25/07/1934","04/10/1882","25/07/1934",1932-05-20,1934-07-25,0,3,4,0,3,"M",1882-10-04,1882,1934-07-25,1934
"1494","AUS-1934","A2.9-4480",305,"AUS","Schuschnigg","30/07/1934","11/03/1938","14/12/1897","18/11/1977",1934-07-30,1938-03-11,0,4,9,0,2,"M",1897-12-14,1897,1977-11-18,1977
"1495","AUS-1938","A2.9-4483",305,"AUS","Seyss-Inquart","12/03/1938","30/04/1939","22/07/1892","16/10/1946",1938-03-12,1939-04-30,0,4,111,0,0,"M",1892-07-22,1892,1946-10-16,1946
"1496","AUS-1945-1","A2.9-4486",305,"AUS","Renner","29/04/1945","28/11/1945","14/12/1870","31/12/1950",1945-04-29,1945-11-28,1,1,0,1,0,"M",1870-12-14,1870,1950-12-31,1950
"1497","AUS-1945-2","A2.9-4489",305,"AUS","Figl","28/11/1945","02/04/1953","02/10/1902","1965",1945-11-28,1953-04-02,0,1,0,0,0,"M",1902-10-02,1902,NA,1965
"1498","AUS-1953","A2.9-4492",305,"AUS","Raab","02/04/1953","11/04/1961","29/11/1891","1964",1953-04-02,1961-04-11,0,1,0,0,0,"M",1891-11-29,1891,NA,1964
"1499","AUS-1961","A2.9-4495",305,"AUS","Gorbach","11/04/1961","25/02/1964","02/10/1898","1972",1961-04-11,1964-02-25,0,1,0,0,0,"M",1898-10-02,1898,NA,1972
"1500","AUS-1964","A2.9-4498",305,"AUS","Klaus","02/04/1964","03/03/1970","15/08/1910","25/07/2001",1964-04-02,1970-03-03,0,1,0,0,0,"M",1910-08-15,1910,2001-07-25,2001
"1501","AUS-1970","A2.9-4501",305,"AUS","Kreisky","20/04/1970","24/05/1983","22/01/1911","29/07/1990",1970-04-20,1983-05-24,0,1,0,0,0,"M",1911-01-22,1911,1990-07-29,1990
"1502","AUS-1983","A2.9-4504",305,"AUS","Sinowatz","24/05/1983","16/06/1986","05/02/1929","-777",1983-05-24,1986-06-16,0,1,0,0,0,"M",1929-02-05,1929,NA,-777
"1503","AUS-1986","A2.9-4507",305,"AUS","Vranitzky","16/06/1986","28/01/1997","04/10/1937","-777",1986-06-16,1997-01-28,0,1,0,0,0,"M",1937-10-04,1937,NA,-777
"1504","AUS-1997","A2.9-4510",305,"AUS","Klima","28/01/1997","04/02/2000","04/06/1947","-777",1997-01-28,2000-02-04,0,1,0,0,0,"M",1947-06-04,1947,NA,-777
"1505","AUS-2000","A2.9-4513",305,"AUS","Schussel","05/02/2000","31/12/2004","07/06/1945","-777",2000-02-05,2004-12-31,0,-888,0,0,-888,"M",1945-06-07,1945,NA,-777
"1506","HUN-1918","A2.9-4516",310,"HUN","Karolyi","16/11/1918","21/03/1919","04/03/1875","1955",1918-11-16,1919-03-21,0,3,3,0,1,"M",1875-03-04,1875,NA,1955
"1507","HUN-1919-1","A2.9-4519",310,"HUN","Kun","21/03/1919","01/08/1919","20/02/1886","30/11/1939",1919-03-21,1919-08-01,1,4,9,0,1,"M",1886-02-20,1886,1939-11-30,1939
"1508","HUN-1919-2","A2.9-4522",310,"HUN","Peidl","01/08/1919","07/08/1919","03/04/1873","1943",1919-08-01,1919-08-07,1,3,6,0,1,"M",1873-04-03,1873,NA,1943
"1509","HUN-1919-3","A2.9-4525",310,"HUN","Friedrich","07/08/1919","16/11/1919","01/07/1883","1951",1919-08-07,1919-11-16,1,1,0,0,0,"M",1883-07-01,1883,NA,1951
"1510","HUN-1919-4","A2.9-4528",310,"HUN","Huszar","23/11/1919","01/03/1920","10/09/1882","1941",1919-11-23,1920-03-01,0,1,0,0,0,"M",1882-09-10,1882,NA,1941
"1511","HUN-1920","A2.9-4531",310,"HUN","Horthy","01/03/1920","15/10/1944","18/06/1868","09/02/1957",1920-03-01,1944-10-15,0,4,9,0,2,"M",1868-06-18,1868,1957-02-09,1957
"1512","HUN-1945","A2.9-4534",310,"HUN","Rakoski","15/01/1945","15/07/1956","14/03/1892","05/02/1971",1945-01-15,1956-07-15,1,3,8,0,1,"M",1892-03-14,1892,1971-02-05,1971
"1513","HUN-1956-1","A2.9-4537",310,"HUN","Gero","18/07/1956","25/10/1956","08/07/1898","12/03/1980",1956-07-18,1956-10-25,1,3,2,0,1,"M",1898-07-08,1898,1980-03-12,1980
"1514","HUN-1956-2","A2.9-4540",310,"HUN","Nagy","25/10/1956","04/11/1956","07/06/1896","16/06/1958",1956-10-25,1956-11-04,1,4,9,0,2,"M",1896-06-07,1896,1958-06-16,1958
"1515","HUN-1956-3","A2.9-4543",310,"HUN","Kadar","04/11/1956","22/05/1988","26/05/1912","06/07/1989",1956-11-04,1988-05-22,2,1,0,0,0,"M",1912-05-26,1912,1989-07-06,1989
"1516","HUN-1988","A2.9-4546",310,"HUN","Grosz","22/05/1988","07/10/1989","1/8/1930","07/01/1996",1988-05-22,1989-10-07,0,1,0,0,0,"M",1930-08-01,1930,1996-01-07,1996
"1517","HUN-1989","A2.9-4549",310,"HUN","Szuros","18/10/1989","02/05/1990","11/9/1933","-999",1989-10-18,1990-05-02,0,1,0,0,0,"M",1933-09-11,1933,NA,NA
"1518","HUN-1990","A2.9-4552",310,"HUN","Antall","03/05/1990","12/12/1993","8/4/1932","12/12/1993",1990-05-03,1993-12-12,0,2,0,0,-777,"M",1932-04-08,1932,1993-12-12,1993
"1519","HUN-1993","A2.9-4555",310,"HUN","Boross","12/12/1993","15/07/1994","1928","-777",1993-12-12,1994-07-15,0,1,0,0,0,"M",NA,1928,NA,-777
"1520","HUN-1994","A2.9-4558",310,"HUN","Horn","15/07/1994","06/07/1998","1932","-777",1994-07-15,1998-07-06,0,1,0,0,0,"M",NA,1932,NA,-777
"1521","HUN-1998","A2.9-4561",310,"HUN","Orban","06/07/1998","27/05/2002","1963","-777",1998-07-06,2002-05-27,0,1,0,0,0,"M",NA,1963,NA,-777
"1522","HUN-2002","A2.9-4564",310,"HUN","Peter Medgyessy","27/05/2002","29/09/2004","19/10/1942","-777",2002-05-27,2004-09-29,0,1,0,0,-999,"M",1942-10-19,1942,NA,-777
"1523","HUN-2004","A2.9-4567",310,"HUN","Ferenc Gyurcsany","29/09/2004","31/12/2004","04/06/1961","-777",2004-09-29,2004-12-31,0,-888,0,0,-888,"M",1961-06-04,1961,NA,-777
"1524","CZE-1918","A2.9-4570",315,"CZE","Masaryk","28/10/1918","14/12/1935","07/03/1850","14/09/1937",1918-10-28,1935-12-14,0,2.1,0,0,0,"M",1850-03-07,1850,1937-09-14,1937
"1525","CZE-1935","A2.9-4573",315,"CZE","Benes","18/12/1935","05/10/1938","28/05/1884","03/09/1948",1935-12-18,1938-10-05,0,1,0,0,1,"M",1884-05-28,1884,1948-09-03,1948
"1526","CZE-1938-1","A2.9-4576",315,"CZE","Syrovy","05/10/1938","01/12/1938","1888","1971",1938-10-05,1938-12-01,0,1,0,0,0,"M",NA,1888,NA,1971
"1527","CZE-1938-2","A2.9-4579",315,"CZE","Hacha","01/12/1938","13/05/1945","12/07/1872","1945",1938-12-01,1945-05-13,2,4,9,0,2,"M",1872-07-12,1872,NA,1945
"1528","CZE-1945","A2.9-4582",315,"CZE","Benes","13/05/1945","07/06/1948","28/05/1884","03/09/1948",1945-05-13,1948-06-07,2,1,0,1,-777,"M",1884-05-28,1884,1948-09-03,1948
"1529","CZE-1948","A2.9-4585",315,"CZE","Gottwald","07/06/1948","14/03/1953","23/11/1896","14/03/1953",1948-06-07,1953-03-14,0,2,0,0,-777,"M",1896-11-23,1896,1953-03-14,1953
"1530","CZE-1953","A2.9-4588",315,"CZE","Zapotocky","21/03/1953","13/11/1957","19/12/1884","1957",1953-03-21,1957-11-13,0,2,0,0,-777,"M",1884-12-19,1884,NA,1957
"1531","CZE-1957","A2.9-4591",315,"CZE","Novotny","19/11/1957","05/01/1968","10/12/1904","28/01/1975",1957-11-19,1968-01-05,0,1,0,0,0,"M",1904-12-10,1904,1975-01-28,1975
"1532","CZE-1968-1","A2.9-4594",315,"CZE","Dubcek","05/01/1968","20/08/1968","27/11/1921","07/11/1992",1968-01-05,1968-08-20,0,4,9,0,2,"M",1921-11-27,1921,1992-11-07,1992
"1533","CZE-1968-2","A2.9-4597",315,"CZE","Svoboda","20/08/1968","28/08/1968","25/11/1895","20/09/1979",1968-08-20,1968-08-28,0,4,9,0,0,"M",1895-11-25,1895,1979-09-20,1979
"1534","CZE-1968-3","A2.9-4600",315,"CZE","Husak","28/08/1968","17/12/1989","10/1/1913","18/11/1991",1968-08-28,1989-12-17,2,1,0,0,0,"M",1913-01-10,1913,1991-11-18,1991
"1535","CZE-1989","A2.9-4603",315,"CZE","Calfa","17/12/1989","01/07/1992","1946","-777",1989-12-17,1992-07-01,0,1,0,0,0,"M",NA,1946,NA,-777
"1536","CZE-1992","A2.9-4606",315,"CZE","Strasky","01/07/1992","31/12/1992","1940","-777",1992-07-01,1992-12-31,0,1,0,0,0,"M",NA,1940,NA,-777
"1537","CZR-1993","A2.9-4609",316,"CZR","Klaus","01/01/1993","17/12/1997","15/08/1910","-777",1993-01-01,1997-12-17,0,1,0,0,0,"M",1910-08-15,1910,NA,-777
"1538","CZR-1997","A2.9-4612",316,"CZR","Tosovsky","17/12/1997","17/07/1998","1950","-777",1997-12-17,1998-07-17,0,1,0,0,0,"M",NA,1950,NA,-777
"1539","CZR-1998","A2.9-4615",316,"CZR","Zeman","17/07/1998","12/07/2002","1944","-777",1998-07-17,2002-07-12,0,1,0,0,0,"M",NA,1944,NA,-777
"1540","CZR-2002","A2.9-4618",316,"CZR","Spidla","12/07/2002","26/07/2004","22/04/1951","-777",2002-07-12,2004-07-26,0,1,0,0,-999,"M",1951-04-22,1951,NA,-777
"1541","CZR-2004","A2.9-4621",316,"CZR","Stanislav Gross","26/07/2004","31/12/2004","30/10/1969","-777",2004-07-26,2004-12-31,0,-888,0,0,-888,"M",1969-10-30,1969,NA,-777
"1542","SLO-1993","A2.9-4624",317,"SLO","Meciar","01/01/1993","16/03/1994","26/07/1942","-777",1993-01-01,1994-03-16,0,1,0,0,0,"M",1942-07-26,1942,NA,-777
"1543","SLO-1994-1","A2.9-4627",317,"SLO","Moravcik","16/03/1994","13/12/1994","1945","-777",1994-03-16,1994-12-13,0,1,0,0,0,"M",NA,1945,NA,-777
"1544","SLO-1994-2","A2.9-4630",317,"SLO","Meciar","13/12/1994","30/10/1998","26/07/1942","-777",1994-12-13,1998-10-30,0,1,0,1,0,"M",1942-07-26,1942,NA,-777
"1545","SLO-1998","A2.9-4633",317,"SLO","Dzurinda","30/10/1998","31/12/2004","4/2/1955","-777",1998-10-30,2004-12-31,0,-888,0,0,-888,"M",1955-02-04,1955,NA,-777
"1546","ITA-1873","A2.9-4636",325,"ITA","Minghetti","10/08/1873","18/03/1876","1818","1886",1873-08-10,1876-03-18,0,1,0,1,0,"M",NA,1818,NA,1886
"1547","ITA-1876","A2.9-4639",325,"ITA","Depretis","25/03/1876","11/03/1878","1813","1887",1876-03-25,1878-03-11,0,1,0,0,0,"M",NA,1813,NA,1887
"1548","ITA-1878-1","A2.9-4642",325,"ITA","Cairoli","23/03/1878","09/12/1878","1825","1889",1878-03-23,1878-12-09,0,1,0,0,0,"M",NA,1825,NA,1889
"1549","ITA-1878-2","A2.9-4645",325,"ITA","Depretis","18/12/1878","03/07/1879","1813","1887",1878-12-18,1879-07-03,0,1,0,1,0,"M",NA,1813,NA,1887
"1550","ITA-1879","A2.9-4648",325,"ITA","Cairoli","12/07/1879","14/05/1881","1825","1889",1879-07-12,1881-05-14,0,1,0,1,0,"M",NA,1825,NA,1889
"1551","ITA-1881","A2.9-4651",325,"ITA","Depretis","28/05/1881","29/07/1887","1813","1887",1881-05-28,1887-07-29,0,2,0,2,-777,"M",NA,1813,NA,1887
"1552","ITA-1887","A2.9-4654",325,"ITA","Crispi","08/08/1887","31/01/1891","04/10/1819","12/08/1901",1887-08-08,1891-01-31,0,1,0,0,0,"M",1819-10-04,1819,1901-08-12,1901
"1553","ITA-1891","A2.9-4657",325,"ITA","Rudini","09/02/1891","05/05/1892","1839","1908",1891-02-09,1892-05-05,0,1,0,0,0,"M",NA,1839,NA,1908
"1554","ITA-1892","A2.9-4660",325,"ITA","Giolitti","15/05/1892","24/11/1893","27/10/1842","17/07/1928",1892-05-15,1893-11-24,0,1,0,0,0,"M",1842-10-27,1842,1928-07-17,1928
"1555","ITA-1893","A2.9-4663",325,"ITA","Crispi","10/12/1893","05/03/1896","04/10/1819","12/08/1901",1893-12-10,1896-03-05,0,1,0,1,0,"M",1819-10-04,1819,1901-08-12,1901
"1556","ITA-1896","A2.9-4666",325,"ITA","Rudini","10/03/1896","18/06/1898","1839","1908",1896-03-10,1898-06-18,0,1,0,1,0,"M",NA,1839,NA,1908
"1557","ITA-1898","A2.9-4669",325,"ITA","Pelloux","29/06/1898","18/06/1900","01/03/1839","26/10/1924",1898-06-29,1900-06-18,0,1,0,0,0,"M",1839-03-01,1839,1924-10-26,1924
"1558","ITA-1900","A2.9-4672",325,"ITA","Saracco","20/06/1900","06/02/1901","09/10/1821","1907",1900-06-20,1901-02-06,0,1,0,0,0,"M",1821-10-09,1821,NA,1907
"1559","ITA-1901","A2.9-4675",325,"ITA","Zanardelli","15/02/1901","21/10/1903","29/10/1826","1903",1901-02-15,1903-10-21,0,2.1,0,0,-777,"M",1826-10-29,1826,NA,1903
"1560","ITA-1903","A2.9-4678",325,"ITA","Giolitti","03/11/1903","04/03/1905","27/10/1842","17/07/1928",1903-11-03,1905-03-04,0,1,0,1,0,"M",1842-10-27,1842,1928-07-17,1928
"1561","ITA-1905","A2.9-4681",325,"ITA","Fortis","27/03/1905","01/02/1906","16/09/1842","04/12/1909",1905-03-27,1906-02-01,0,1,0,0,0,"M",1842-09-16,1842,1909-12-04,1909
"1562","ITA-1906-1","A2.9-4684",325,"ITA","Sonnino","08/02/1906","17/05/1906","11/03/1847","24/11/1922",1906-02-08,1906-05-17,0,1,0,0,0,"M",1847-03-11,1847,1922-11-24,1922
"1563","ITA-1906-2","A2.9-4687",325,"ITA","Giolitti","29/05/1906","02/12/1909","27/10/1842","17/07/1928",1906-05-29,1909-12-02,0,1,0,2,0,"M",1842-10-27,1842,1928-07-17,1928
"1564","ITA-1909","A2.9-4690",325,"ITA","Sonnino","10/12/1909","21/03/1910","11/03/1847","24/11/1922",1909-12-10,1910-03-21,0,1,0,1,0,"M",1847-03-11,1847,1922-11-24,1922
"1565","ITA-1910","A2.9-4693",325,"ITA","Luzzati","30/03/1910","20/03/1911","01/03/1841","1927",1910-03-30,1911-03-20,0,1,0,0,0,"M",1841-03-01,1841,NA,1927
"1566","ITA-1911","A2.9-4696",325,"ITA","Giolitti","27/03/1911","10/03/1914","27/10/1842","17/07/1928",1911-03-27,1914-03-10,0,1,0,3,0,"M",1842-10-27,1842,1928-07-17,1928
"1567","ITA-1914","A2.9-4699",325,"ITA","Salandra","21/03/1914","12/06/1916","13/08/1853","1931",1914-03-21,1916-06-12,0,1,0,0,0,"M",1853-08-13,1853,NA,1931
"1568","ITA-1916","A2.9-4702",325,"ITA","Boselli","17/06/1916","30/10/1917","08/06/1838","10/03/1932",1916-06-17,1917-10-30,0,1,0,0,0,"M",1838-06-08,1838,1932-03-10,1932
"1569","ITA-1917","A2.9-4705",325,"ITA","Orlando","30/10/1917","19/06/1919","19/05/1860","1952",1917-10-30,1919-06-19,0,1,0,0,0,"M",1860-05-19,1860,NA,1952
"1570","ITA-1919","A2.9-4708",325,"ITA","Nitti","23/06/1919","09/06/1920","19/07/1868","1953",1919-06-23,1920-06-09,0,1,0,0,0,"M",1868-07-19,1868,NA,1953
"1571","ITA-1920","A2.9-4711",325,"ITA","Giolitti","16/06/1920","26/06/1921","27/10/1842","17/07/1928",1920-06-16,1921-06-26,0,1,0,4,0,"M",1842-10-27,1842,1928-07-17,1928
"1572","ITA-1921","A2.9-4714",325,"ITA","Bonomi","26/06/1921","25/02/1922","18/10/1873","20/04/1951",1921-06-26,1922-02-25,0,1,0,0,0,"M",1873-10-18,1873,1951-04-20,1951
"1573","ITA-1922-1","A2.9-4717",325,"ITA","Facta","25/02/1922","27/10/1922","16/11/1861","05/11/1930",1922-02-25,1922-10-27,0,1,0,0,0,"M",1861-11-16,1861,1930-11-05,1930
"1574","ITA-1922-2","A2.9-4720",325,"ITA","Mussolini","30/10/1922","25/07/1943","29/07/1883","28/04/1945",1922-10-30,1943-07-25,0,3,8,0,3,"M",1883-07-29,1883,1945-04-28,1945
"1575","ITA-1943","A2.9-4723",325,"ITA","Badoglio","28/07/1943","04/06/1944","28/09/1871","31/10/1956",1943-07-28,1944-06-04,1,1,0,0,0,"M",1871-09-28,1871,1956-10-31,1956
"1576","ITA-1944","A2.9-4726",325,"ITA","Bonomi","09/06/1944","20/06/1945","18/10/1873","20/04/1951",1944-06-09,1945-06-20,0,1,0,1,0,"M",1873-10-18,1873,1951-04-20,1951
"1577","ITA-1945-1","A2.9-4729",325,"ITA","Parri","20/06/1945","26/11/1945","19/06/1890","1981",1945-06-20,1945-11-26,0,1,0,0,0,"M",1890-06-19,1890,NA,1981
"1578","ITA-1945-2","A2.9-4732",325,"ITA","de Gasperi","10/12/1945","28/07/1953","03/04/1881","19/08/1954",1945-12-10,1953-07-28,0,1,0,0,0,"M",1881-04-03,1881,1954-08-19,1954
"1579","ITA-1953","A2.9-4735",325,"ITA","Pella","15/08/1953","06/01/1954","18/04/1902","31/05/1981",1953-08-15,1954-01-06,0,1,0,0,0,"M",1902-04-18,1902,1981-05-31,1981
"1580","ITA-1954-1","A2.9-4738",325,"ITA","Fanfani","18/01/1954","31/01/1954","6/2/1908","20/11/1999",1954-01-18,1954-01-31,0,1,0,0,0,"M",1908-02-06,1908,1999-11-20,1999
"1581","ITA-1954-2","A2.9-4741",325,"ITA","Scelba","09/02/1954","22/06/1955","5/9/1901","1991",1954-02-09,1955-06-22,0,1,0,0,0,"M",1901-09-05,1901,NA,1991
"1582","ITA-1955","A2.9-4744",325,"ITA","Segni","06/07/1955","06/05/1957","02/02/1891","1972",1955-07-06,1957-05-06,0,1,0,0,0,"M",1891-02-02,1891,NA,1972
"1583","ITA-1957","A2.9-4747",325,"ITA","Zoli","19/05/1957","19/06/1958","16/12/1887","1960",1957-05-19,1958-06-19,0,1,0,0,0,"M",1887-12-16,1887,NA,1960
"1584","ITA-1958","A2.9-4750",325,"ITA","Fanfani","02/07/1958","26/01/1959","6/2/1908","20/11/1999",1958-07-02,1959-01-26,0,1,0,1,0,"M",1908-02-06,1908,1999-11-20,1999
"1585","ITA-1959","A2.9-4753",325,"ITA","Segni","15/02/1959","24/02/1960","02/02/1891","1972",1959-02-15,1960-02-24,0,1,0,1,0,"M",1891-02-02,1891,NA,1972
"1586","ITA-1960-1","A2.9-4756",325,"ITA","Tambroni","25/03/1960","19/07/1960","1901","1963",1960-03-25,1960-07-19,0,1,0,0,0,"M",NA,1901,NA,1963
"1587","ITA-1960-2","A2.9-4759",325,"ITA","Fanfani","26/07/1960","16/05/1963","6/2/1908","20/11/1999",1960-07-26,1963-05-16,0,1,0,2,0,"M",1908-02-06,1908,1999-11-20,1999
"1588","ITA-1963-1","A2.9-4762",325,"ITA","Leone","21/06/1963","05/11/1963","3/11/1908","09/11/2001",1963-06-21,1963-11-05,0,1,0,0,0,"M",1908-11-03,1908,2001-11-09,2001
"1589","ITA-1963-2","A2.9-4765",325,"ITA","Moro","05/12/1963","05/06/1968","23/09/1916","09/05/1978",1963-12-05,1968-06-05,0,1,0,0,0,"M",1916-09-23,1916,1978-05-09,1978
"1590","ITA-1968-1","A2.9-4768",325,"ITA","Leone","25/06/1968","19/11/1968","3/11/1908","09/11/2001",1968-06-25,1968-11-19,0,1,0,1,0,"M",1908-11-03,1908,2001-11-09,2001
"1591","ITA-1968-2","A2.9-4771",325,"ITA","Rumor","13/12/1968","06/07/1970","16/06/1915","1990",1968-12-13,1970-07-06,0,1,0,0,0,"M",1915-06-16,1915,NA,1990
"1592","ITA-1970","A2.9-4774",325,"ITA","Colombo","06/08/1970","15/01/1972","11/4/1920","-777",1970-08-06,1972-01-15,0,1,0,0,0,"M",1920-04-11,1920,NA,-777
"1593","ITA-1972","A2.9-4777",325,"ITA","Andreotti","18/02/1972","12/06/1973","15/01/1919","-777",1972-02-18,1973-06-12,0,1,0,0,0,"M",1919-01-15,1919,NA,-777
"1594","ITA-1973","A2.9-4780",325,"ITA","Rumor","08/07/1973","23/11/1974","16/06/1915","1990",1973-07-08,1974-11-23,0,1,0,1,0,"M",1915-06-16,1915,NA,1990
"1595","ITA-1974","A2.9-4783",325,"ITA","Moro","23/11/1974","30/07/1976","23/09/1916","09/05/1978",1974-11-23,1976-07-30,0,1,0,1,0,"M",1916-09-23,1916,1978-05-09,1978
"1596","ITA-1976","A2.9-4786",325,"ITA","Andreotti","30/07/1976","05/08/1979","15/01/1919","-777",1976-07-30,1979-08-05,0,1,0,1,0,"M",1919-01-15,1919,NA,-777
"1597","ITA-1979","A2.9-4789",325,"ITA","Cossiga","05/08/1979","18/10/1980","26/07/1928","-777",1979-08-05,1980-10-18,0,1,0,0,0,"M",1928-07-26,1928,NA,-777
"1598","ITA-1980","A2.9-4792",325,"ITA","Forlani","18/10/1980","26/05/1981","8/12/1925","-777",1980-10-18,1981-05-26,0,1,0,0,0,"M",1925-12-08,1925,NA,-777
"1599","ITA-1981","A2.9-4795",325,"ITA","Spadolini","28/06/1981","30/11/1982","21/06/1925","1994",1981-06-28,1982-11-30,0,1,0,0,0,"M",1925-06-21,1925,NA,1994
"1600","ITA-1982","A2.9-4798",325,"ITA","Fanfani","30/11/1982","04/08/1983","6/2/1908","20/11/1999",1982-11-30,1983-08-04,0,1,0,3,0,"M",1908-02-06,1908,1999-11-20,1999
"1601","ITA-1983","A2.9-4801",325,"ITA","Craxi","04/08/1983","18/04/1987","24/02/1934","19/01/2000",1983-08-04,1987-04-18,0,1,0,0,0,"M",1934-02-24,1934,2000-01-19,2000
"1602","ITA-1987-1","A2.9-4804",325,"ITA","Fanfani","18/04/1987","29/07/1987","6/2/1908","20/11/1999",1987-04-18,1987-07-29,0,1,0,4,0,"M",1908-02-06,1908,1999-11-20,1999
"1603","ITA-1987-2","A2.9-4807",325,"ITA","Goria","29/07/1987","13/04/1988","30/07/1943","21/05/1994",1987-07-29,1988-04-13,0,1,0,0,0,"M",1943-07-30,1943,1994-05-21,1994
"1604","ITA-1988","A2.9-4810",325,"ITA","Mita","13/04/1988","12/07/1989","02/02/1928","-777",1988-04-13,1989-07-12,0,1,0,0,0,"M",1928-02-02,1928,NA,-777
"1605","ITA-1989","A2.9-4813",325,"ITA","Andreotti","23/07/1989","28/06/1992","15/01/1919","-777",1989-07-23,1992-06-28,0,1,0,2,0,"M",1919-01-15,1919,NA,-777
"1606","ITA-1992","A2.9-4816",325,"ITA","Amato","28/06/1992","29/04/1993","13/05/1938","-777",1992-06-28,1993-04-29,0,1,0,0,0,"M",1938-05-13,1938,NA,-777
"1607","ITA-1993","A2.9-4819",325,"ITA","Ciampi","29/04/1993","11/05/1994","09/12/1920","-777",1993-04-29,1994-05-11,0,1,0,0,0,"M",1920-12-09,1920,NA,-777
"1608","ITA-1994","A2.9-4822",325,"ITA","Berlusconi","11/05/1994","17/01/1995","29/09/1936","-777",1994-05-11,1995-01-17,0,1,0,0,0,"M",1936-09-29,1936,NA,-777
"1609","ITA-1995","A2.9-4825",325,"ITA","Dini","17/01/1995","18/05/1996","01/03/1931","-777",1995-01-17,1996-05-18,0,1,0,0,0,"M",1931-03-01,1931,NA,-777
"1610","ITA-1996","A2.9-4828",325,"ITA","Prodi","18/05/1996","21/10/1998","09/08/1939","-777",1996-05-18,1998-10-21,0,1,0,0,0,"M",1939-08-09,1939,NA,-777
"1611","ITA-1998","A2.9-4831",325,"ITA","D'Alema","21/10/1998","26/04/2000","20/04/1949","-777",1998-10-21,2000-04-26,0,1,0,0,0,"M",1949-04-20,1949,NA,-777
"1612","ITA-2000","A2.9-4834",325,"ITA","Amato","26/04/2000","11/06/2001","13/05/1938","-777",2000-04-26,2001-06-11,0,1,0,1,0,"M",1938-05-13,1938,NA,-777
"1613","ITA-2001","A2.9-4837",325,"ITA","Berlusconi","11/06/2001","31/12/2004","29/09/1936","-777",2001-06-11,2004-12-31,0,-888,0,1,-888,"M",1936-09-29,1936,NA,-777
"1614","MLT-1962","A2.9-4840",338,"MLT","Olivier","05/03/1962","21/06/1971","05/07/1911","29/10/1980",1962-03-05,1971-06-21,0,1,0,0,0,"M",1911-07-05,1911,1980-10-29,1980
"1615","MLT-1971","A2.9-4843",338,"MLT","Mintoff","21/06/1971","22/12/1984","06/08/1916","-777",1971-06-21,1984-12-22,0,1,0,0,0,"M",1916-08-06,1916,NA,-777
"1616","MLT-1984","A2.9-4846",338,"MLT","Bonnici","22/12/1984","12/05/1987","17/07/1933","-777",1984-12-22,1987-05-12,0,1,0,0,0,"M",1933-07-17,1933,NA,-777
"1617","MLT-1987","A2.9-4849",338,"MLT","Adami","12/05/1987","28/10/1996","07/02/1934","-777",1987-05-12,1996-10-28,0,1,0,0,0,"M",1934-02-07,1934,NA,-777
"1618","MLT-1996","A2.9-4852",338,"MLT","Sant","28/10/1996","06/09/1998","1948","-777",1996-10-28,1998-09-06,0,1,0,0,0,"M",NA,1948,NA,-777
"1619","MLT-1998","A2.9-4855",338,"MLT","Adami","06/09/1998","31/12/2004","07/02/1934","-777",1998-09-06,2004-12-31,0,-888,0,1,-888,"M",1934-02-07,1934,NA,-777
"1620","ALB-1912","A2.9-4858",339,"ALB","Ismail Qemali Bej","29/11/1912","22/01/1914","1844","1919",1912-11-29,1914-01-22,1,3,-999,0,1,"M",NA,1844,NA,1919
"1621","ALB-1914-1","A2.9-4861",339,"ALB","Fevzi Bej","22/01/1914","21/02/1914","1876","1945",1914-01-22,1914-02-21,-666,-666,0,0,-666,"M",NA,1876,NA,1945
"1622","ALB-1914-2","A2.9-4864",339,"ALB","Wilhelm zu Wied","21/02/1914","03/09/1914","1871","1945",1914-02-21,1914-09-03,1,1,0,0,1,"M",NA,1871,NA,1945
"1623","ALB-1914-3","A2.9-4867",339,"ALB","Esat Pashe Toptani","05/10/1914","24/02/1916","1863","1920",1914-10-05,1916-02-24,1,4,-999,0,1,"M",NA,1863,NA,1920
"1624","ALB-1918","A2.9-4870",339,"ALB","Turkhan Pasha","28/12/1918","27/03/1920","1839","1927",1918-12-28,1920-03-27,2,1,0,0,1,"M",NA,1839,NA,1927
"1625","ALB-1920-1","A2.9-4873",339,"ALB","Delvina","27/03/1920","20/11/1920","1882","1932",1920-03-27,1920-11-20,0,1,0,0,0,"M",NA,1882,NA,1932
"1626","ALB-1920-2","A2.9-4876",339,"ALB","Vrioni","11/12/1920","17/10/1921","1883","1932",1920-12-11,1921-10-17,0,1,0,0,0,"M",NA,1883,NA,1932
"1627","ALB-1921-1","A2.9-4879",339,"ALB","Evangeli","17/10/1921","07/12/1921","1859","1939",1921-10-17,1921-12-07,0,1,0,0,0,"M",NA,1859,NA,1939
"1628","ALB-1921-2","A2.9-4882",339,"ALB","Prishtina","07/12/1921","11/12/1921","1873","1933",1921-12-07,1921-12-11,0,1,0,0,0,"M",NA,1873,NA,1933
"1629","ALB-1921-3","A2.9-4885",339,"ALB","Idomeni Kosturis","11/12/1921","24/12/1921","1873","1943",1921-12-11,1921-12-24,0,1,0,0,-666,"M",NA,1873,NA,1943
"1630","ALB-1921-4","A2.9-4888",339,"ALB","Djafer Ypi","24/12/1921","02/12/1922","1880","1940",1921-12-24,1922-12-02,0,1,0,0,0,"M",NA,1880,NA,1940
"1631","ALB-1922","A2.9-4891",339,"ALB","Zogu","03/12/1922","03/03/1924","1895","1961",1922-12-03,1924-03-03,0,1,0,0,1,"M",NA,1895,NA,1961
"1632","ALB-1924-1","A2.9-4894",339,"ALB","Verlaci","05/03/1924","01/06/1924","1877","1946",1924-03-05,1924-06-01,0,1,0,0,1,"M",NA,1877,NA,1946
"1633","ALB-1924-2","A2.9-4897",339,"ALB","Vrioni","01/06/1924","10/06/1924","1883","1932",1924-06-01,1924-06-10,0,3,4,1,0,"M",NA,1883,NA,1932
"1634","ALB-1924-3","A2.9-4900",339,"ALB","Fan S. Noli","12/06/1924","24/12/1924","1882","1965",1924-06-12,1924-12-24,1,3,4,0,1,"M",NA,1882,NA,1965
"1635","ALB-1924-4","A2.9-4903",339,"ALB","Vrioni","24/12/1924","10/01/1925","1883","1932",1924-12-24,1925-01-10,1,3,8,2,0,"M",NA,1883,NA,1932
"1636","ALB-1925","A2.9-4906",339,"ALB","Zogu","10/01/1925","12/04/1939","1895","1961",1925-01-10,1939-04-12,1,4,9,1,1,"M",NA,1895,NA,1961
"1637","ALB-1944","A2.9-4909",339,"ALB","Hoxha","29/11/1944","11/04/1985","16/10/1908","11/04/1985",1944-11-29,1985-04-11,1,2,0,0,-777,"M",1908-10-16,1908,1985-04-11,1985
"1638","ALB-1985","A2.9-4912",339,"ALB","Alia","13/04/1985","03/04/1992","18/10/1925","-777",1985-04-13,1992-04-03,0,1,0,0,2,"M",1925-10-18,1925,NA,-777
"1639","ALB-1992","A2.9-4915",339,"ALB","Berisha","09/04/1992","24/07/1997","15/10/1944","-777",1992-04-09,1997-07-24,0,1,0,0,0,"M",1944-10-15,1944,NA,-777
"1640","ALB-1997","A2.9-4918",339,"ALB","Fatos Nano","24/07/1997","02/10/1998","16/09/1952","-777",1997-07-24,1998-10-02,0,1,0,0,0,"M",1952-09-16,1952,NA,-777
"1641","ALB-1998","A2.9-4921",339,"ALB","Majko","02/10/1998","29/10/1999","15/11/1967","-777",1998-10-02,1999-10-29,0,1,0,0,0,"M",1967-11-15,1967,NA,-777
"1642","ALB-1999","A2.9-4924",339,"ALB","Meta","29/10/1999","22/02/2002","1969","-777",1999-10-29,2002-02-22,0,1,0,0,0,"M",NA,1969,NA,-777
"1643","ALB-2002-1","A2.9-4927",339,"ALB","Majko","22/02/2002","31/07/2002","15/11/1967","-777",2002-02-22,2002-07-31,0,1,0,1,0,"M",1967-11-15,1967,NA,-777
"1644","ALB-2002-2","A2.9-4930",339,"ALB","Fatos Nano","31/07/2002","31/12/2004","16/09/1952","-777",2002-07-31,2004-12-31,0,-888,0,2,-888,"M",1952-09-16,1952,NA,-777
"1645","SER-1882","A2.9-4933",340,"SER","Milan I","06/03/1882","06/03/1889","1854","1901",1882-03-06,1889-03-06,1,1,0,0,1,"M",NA,1854,NA,1901
"1646","SER-1889","A2.9-4936",340,"SER","Ristic (Regency)","06/03/1889","13/04/1893","1831","1899",1889-03-06,1893-04-13,0,3,-999,0,2,"M",NA,1831,NA,1899
"1647","SER-1893","A2.9-4939",340,"SER","Alexander I","13/04/1893","11/06/1903","1876","1903",1893-04-13,1903-06-11,1,3,-999,0,3,"M",NA,1876,NA,1903
"1648","SER-1903","A2.9-4942",340,"SER","Peter I","15/06/1903","24/06/1914","1844","1921",1903-06-15,1914-06-24,1,2.1,0,0,0,"M",NA,1844,NA,1921
"1649","SER-1914","A2.9-4945",340,"SER","Alexander","24/06/1914","01/10/1915","16/12/1888","09/10/1934",1914-06-24,1915-10-01,0,4,-999,0,1,"M",1888-12-16,1888,1934-10-09,1934
"1650","MNG-1860","A2.9-4948",341,"MNG","Nikola I Petrovic-Njegos","13/08/1860","17/01/1917","1841","1921",1860-08-13,1917-01-17,0,4,-999,0,1,"M",NA,1841,NA,1921
"1651","MAC-1991","A2.9-4951",343,"MAC","Nikola Kljusev","27/01/1991","17/08/1992","1927","-777",1991-01-27,1992-08-17,1,1,0,0,0,"M",NA,1927,NA,-777
"1652","MAC-1992","A2.9-4954",343,"MAC","Crvenkovski","17/08/1992","30/11/1998","1962","-777",1992-08-17,1998-11-30,0,1,0,0,0,"M",NA,1962,NA,-777
"1653","MAC-1998","A2.9-4957",343,"MAC","Georgievski","30/11/1998","01/11/2002","1966","-777",1998-11-30,2002-11-01,0,1,0,0,0,"M",NA,1966,NA,-777
"1654","MAC-2002","A2.9-4960",343,"MAC","Crvenkovski","01/11/2002","12/05/2004","1962","-777",2002-11-01,2004-05-12,0,1,0,1,0,"M",NA,1962,NA,-777
"1655","MAC-2004-1","A2.9-4963",343,"MAC","Radmila Sekerinska","12/05/2004","02/06/2004","10/07/1972","-777",2004-05-12,2004-06-02,0,1,0,0,0,"M",1972-07-10,1972,NA,-777
"1656","MAC-2004-2","A2.9-4966",343,"MAC","Hari Kostov","02/06/2004","18/11/2004","1959","-777",2004-06-02,2004-11-18,0,1,0,0,-999,"M",NA,1959,NA,-777
"1657","MAC-2004-3","A2.9-4969",343,"MAC","Radmila Sekerinska","18/11/2004","17/12/2004","10/07/1972","-777",2004-11-18,2004-12-17,0,1,0,1,-999,"M",1972-07-10,1972,NA,-777
"1658","MAC-2004-4","A2.9-4972",343,"MAC","Vlado Buckovski","17/12/2004","31/12/2004","02/12/1962","-777",2004-12-17,2004-12-31,0,-888,0,0,-888,"M",1962-12-02,1962,NA,-777
"1659","CRO-1990","A2.9-4975",344,"CRO","Tudjman","30/05/1990","26/11/1999","1922","1999",1990-05-30,1999-11-26,0,2,0,0,-777,"M",NA,1922,NA,1999
"1660","CRO-1999","A2.9-4978",344,"CRO","Pavletic","26/11/1999","02/02/2000","1930","-777",1999-11-26,2000-02-02,0,1,0,0,0,"M",NA,1930,NA,-777
"1661","CRO-2000-1","A2.9-4981",344,"CRO","Tomcic","02/02/2000","18/02/2000","1945","-777",2000-02-02,2000-02-18,0,1,0,0,0,"M",NA,1945,NA,-777
"1662","CRO-2000-2","A2.9-4984",344,"CRO","Mesic","18/02/2000","31/12/2004","24/12/1934","-777",2000-02-18,2004-12-31,0,-888,0,0,-888,"M",1934-12-24,1934,NA,-777
"1663","YUG-1918","A2.9-4987",345,"YUG","Alexander","01/12/1918","09/10/1934","1888","1934",1918-12-01,1934-10-09,0,3,11,1,3,"M",NA,1888,NA,1934
"1664","YUG-1934","A2.9-4990",345,"YUG","Prince Paul","09/10/1934","27/03/1941","1893","1976",1934-10-09,1941-03-27,0,3,6,0,1,"M",NA,1893,NA,1976
"1665","YUG-1941","A2.9-4993",345,"YUG","Peter II","27/03/1941","20/04/1941","06/09/1923","03/11/1970",1941-03-27,1941-04-20,1,4,9,0,1,"M",1923-09-06,1923,1970-11-03,1970
"1666","YUG-1945","A2.9-4996",345,"YUG","Tito","06/03/1945","04/05/1980","07/05/1892","04/05/1980",1945-03-06,1980-05-04,1,2,0,0,-777,"M",1892-05-07,1892,1980-05-04,1980
"1667","YUG-1980-1","A2.9-4999",345,"YUG","Kolisevski","04/05/1980","15/05/1980","1914","2000",1980-05-04,1980-05-15,0,1,0,0,0,"M",NA,1914,NA,2000
"1668","YUG-1980-2","A2.9-5002",345,"YUG","Mijatovic","15/05/1980","15/05/1981","1912","1993",1980-05-15,1981-05-15,0,1,0,0,0,"M",NA,1912,NA,1993
"1669","YUG-1981","A2.9-5005",345,"YUG","Kraigher","15/05/1981","16/05/1982","1914","2001",1981-05-15,1982-05-16,0,1,0,0,0,"M",NA,1914,NA,2001
"1670","YUG-1982","A2.9-5008",345,"YUG","Stambolic","16/05/1982","13/05/1983","1912","-777",1982-05-16,1983-05-13,0,1,0,0,0,"M",NA,1912,NA,-777
"1671","YUG-1983","A2.9-5011",345,"YUG","Spiljac","13/05/1983","15/05/1984","1916","2007",1983-05-13,1984-05-15,0,1,0,0,0,"M",NA,1916,NA,2007
"1672","YUG-1984","A2.9-5014",345,"YUG","Djuranovic","15/05/1984","15/05/1985","1926","1997",1984-05-15,1985-05-15,0,1,0,0,0,"M",NA,1926,NA,1997
"1673","YUG-1985","A2.9-5017",345,"YUG","Vlajkovic","15/05/1985","15/05/1986","1922","2001",1985-05-15,1986-05-15,0,1,0,0,0,"M",NA,1922,NA,2001
"1674","YUG-1986","A2.9-5020",345,"YUG","Hasani","15/05/1986","15/05/1987","1922","-777",1986-05-15,1987-05-15,0,1,0,0,0,"M",NA,1922,NA,-777
"1675","YUG-1987","A2.9-5023",345,"YUG","Mojsov","15/05/1987","15/05/1988","1920","-777",1987-05-15,1988-05-15,0,1,0,0,0,"M",NA,1920,NA,-777
"1676","YUG-1988","A2.9-5026",345,"YUG","Dizarevic","15/05/1988","15/05/1989","1926","-777",1988-05-15,1989-05-15,0,1,0,0,0,"M",NA,1926,NA,-777
"1677","YUG-1989","A2.9-5029",345,"YUG","Milosevic","15/05/1989","07/10/2000","20/08/1941","11/03/2006",1989-05-15,2000-10-07,0,1,0,0,2,"M",1941-08-20,1941,2006-03-11,2006
"1678","YUG-2000","A2.9-5032",345,"YUG","Kostunica","08/10/2000","31/12/2004","24/03/1944","-777",2000-10-08,2004-12-31,0,-888,0,0,-888,"M",1944-03-24,1944,NA,-777
"1679","BOS-1990","A2.9-5035",346,"BOS","Izetbegovic","20/12/1990","13/10/1998","08/08/1925","19/10/2003",1990-12-20,1998-10-13,0,2.1,0,0,0,"M",1925-08-08,1925,2003-10-19,2003
"1680","BOS-1998","A2.9-5038",346,"BOS","Radisic","13/10/1998","15/06/1999","15/08/1937","-777",1998-10-13,1999-06-15,0,1,0,0,0,"M",1937-08-15,1937,NA,-777
"1681","BOS-1999","A2.9-5041",346,"BOS","Jelavic","15/06/1999","14/02/2000","21/08/1963","-777",1999-06-15,2000-02-14,0,1,0,0,0,"M",1963-08-21,1963,NA,-777
"1682","BOS-2000-1","A2.9-5044",346,"BOS","Izetbegovic","14/02/2000","14/10/2000","08/08/1925","19/10/2003",2000-02-14,2000-10-14,0,2.1,0,1,0,"M",1925-08-08,1925,2003-10-19,2003
"1683","BOS-2000-2","A2.9-5047",346,"BOS","Radisic","14/10/2000","14/06/2001","15/08/1937","-777",2000-10-14,2001-06-14,0,1,0,1,0,"M",1937-08-15,1937,NA,-777
"1684","BOS-2001","A2.9-5050",346,"BOS","Krizanovic","14/06/2001","14/02/2002","1944","-777",2001-06-14,2002-02-14,0,1,0,0,0,"M",NA,1944,NA,-777
"1685","BOS-2002-1","A2.9-5053",346,"BOS","Belkic","14/02/2002","28/10/2002","1946","-777",2002-02-14,2002-10-28,0,1,0,0,0,"M",NA,1946,NA,-777
"1686","BOS-2002-2","A2.9-5056",346,"BOS","Sarovic","28/10/2002","02/04/2003","16/09/1956","-777",2002-10-28,2003-04-02,0,1,0,0,0,"M",1956-09-16,1956,NA,-777
"1687","BOS-2003-1","A2.9-5059",346,"BOS","Borislav Paravac","10/04/2003","27/06/2003","1943","-777",2003-04-10,2003-06-27,0,1,0,0,0,"M",NA,1943,NA,-777
"1688","BOS-2003-2","A2.9-5062",346,"BOS","Dragan Covic","27/06/2003","28/02/2004","1956","-777",2003-06-27,2004-02-28,0,1,0,0,0,"M",NA,1956,NA,-777
"1689","BOS-2004-1","A2.9-5065",346,"BOS","Sulejman Tihic","28/02/2004","28/10/2004","1951","-777",2004-02-28,2004-10-28,0,1,0,0,-999,"M",NA,1951,NA,-777
"1690","BOS-2004-2","A2.9-5068",346,"BOS","Borislav Paravac","28/10/2004","31/12/2004","1943","-777",2004-10-28,2004-12-31,0,-888,0,1,-888,"M",NA,1943,NA,-777
"1691","SLV-1990","A2.9-5071",349,"SLV","Kucan","22/04/1990","23/12/1991","1941","-777",1990-04-22,1991-12-23,0,1,0,0,0,"M",NA,1941,NA,-777
"1692","SLV-1991","A2.9-5074",349,"SLV","Peterle","23/12/1991","14/05/1992","1948","-777",1991-12-23,1992-05-14,0,1,0,0,0,"M",NA,1948,NA,-777
"1693","SLV-1992","A2.9-5077",349,"SLV","Drnovsek","14/05/1992","03/05/2000","17/05/1950","23/02/2008",1992-05-14,2000-05-03,0,1,0,0,0,"M",1950-05-17,1950,2008-02-23,2008
"1694","SLV-2000-1","A2.9-5080",349,"SLV","Bajuk","03/05/2000","17/11/2000","18/10/1943","-777",2000-05-03,2000-11-17,0,1,0,0,0,"M",1943-10-18,1943,NA,-777
"1695","SLV-2000-2","A2.9-5083",349,"SLV","Drnovsek","17/11/2000","11/12/2002","17/05/1950","23/02/2008",2000-11-17,2002-12-11,0,1,0,1,0,"M",1950-05-17,1950,2008-02-23,2008
"1696","SLV-2002","A2.9-5086",349,"SLV","Anton Rop","11/12/2002","09/11/2004","27/12/1960","-777",2002-12-11,2004-11-09,0,1,0,0,-999,"M",1960-12-27,1960,NA,-777
"1697","SLV-2004","A2.9-5089",349,"SLV","Janez Jansa","09/11/2004","31/12/2004","17/09/1958","-777",2004-11-09,2004-12-31,0,-888,0,0,-888,"M",1958-09-17,1958,NA,-777
"1698","GRC-1863","A2.9-5092",350,"GRC","George I","30/03/1863","18/03/1913","24/12/1845","18/03/1913",1863-03-30,1913-03-18,0,3,-999,0,3,"M",1845-12-24,1845,1913-03-18,1913
"1699","GRC-1913","A2.9-5095",350,"GRC","Konstantinos I","18/03/1913","12/06/1917","1868","1923",1913-03-18,1917-06-12,1,4,-999,0,1,"M",NA,1868,NA,1923
"1700","GRC-1917","A2.9-5098",350,"GRC","Venizelos","27/06/1917","18/11/1920","23/08/1864","1936",1917-06-27,1920-11-18,2,1,0,0,1,"M",1864-08-23,1864,NA,1936
"1701","GRC-1920-1","A2.9-5101",350,"GRC","Rallis","18/11/1920","11/12/1920","1844","1921",1920-11-18,1920-12-11,0,2.1,0,0,0,"M",NA,1844,NA,1921
"1702","GRC-1920-2","A2.9-5104",350,"GRC","Konstantinos I","11/12/1920","27/09/1922","1868","1923",1920-12-11,1922-09-27,0,3,6,1,1,"M",NA,1868,NA,1923
"1703","GRC-1922-1","A2.9-5107",350,"GRC","Plastiras","27/09/1922","27/11/1922","1883","1953",1922-09-27,1922-11-27,1,1,0,0,0,"M",NA,1883,NA,1953
"1704","GRC-1922-2","A2.9-5110",350,"GRC","Gonatas","27/11/1922","24/01/1924","1876","1966",1922-11-27,1924-01-24,1,1,0,0,0,"M",NA,1876,NA,1966
"1705","GRC-1924-1","A2.9-5113",350,"GRC","Venizelos","24/01/1924","19/02/1924","23/08/1864","1936",1924-01-24,1924-02-19,0,2.1,0,1,0,"M",1864-08-23,1864,NA,1936
"1706","GRC-1924-2","A2.9-5116",350,"GRC","Kaphantaris","19/02/1924","12/03/1924","1873","1946",1924-02-19,1924-03-12,0,1,0,0,0,"M",NA,1873,NA,1946
"1707","GRC-1924-3","A2.9-5119",350,"GRC","Papanastasiou","12/03/1924","24/07/1924","1876","1936",1924-03-12,1924-07-24,0,1,0,0,0,"M",NA,1876,NA,1936
"1708","GRC-1924-4","A2.9-5122",350,"GRC","Sophoulis","24/07/1924","07/10/1924","1861","1949",1924-07-24,1924-10-07,0,1,0,0,0,"M",NA,1861,NA,1949
"1709","GRC-1924-5","A2.9-5125",350,"GRC","Michalakopoulos","07/10/1924","26/06/1925","1876","1938",1924-10-07,1925-06-26,0,3,6,0,0,"M",NA,1876,NA,1938
"1710","GRC-1925","A2.9-5128",350,"GRC","Pangalos","26/06/1925","22/08/1926","11/01/1878","26/02/1952",1925-06-26,1926-08-22,1,3,6,0,2,"M",1878-01-11,1878,1952-02-26,1952
"1711","GRC-1926-1","A2.9-5131",350,"GRC","Kondilis","23/08/1926","04/12/1926","1879","31/01/1936",1926-08-23,1926-12-04,1,1,0,0,0,"M",NA,1879,1936-01-31,1936
"1712","GRC-1926-2","A2.9-5134",350,"GRC","Zaimis","04/12/1926","04/07/1928","1855","1936",1926-12-04,1928-07-04,0,1,0,0,0,"M",NA,1855,NA,1936
"1713","GRC-1928","A2.9-5137",350,"GRC","Venizelos","04/07/1928","26/05/1932","23/08/1864","1936",1928-07-04,1932-05-26,0,1,0,2,0,"M",1864-08-23,1864,NA,1936
"1714","GRC-1932-1","A2.9-5140",350,"GRC","Papanastasiou","26/05/1932","05/06/1932","1876","1936",1932-05-26,1932-06-05,0,1,0,1,0,"M",NA,1876,NA,1936
"1715","GRC-1932-2","A2.9-5143",350,"GRC","Venizelos","05/06/1932","03/11/1932","23/08/1864","1936",1932-06-05,1932-11-03,0,1,0,3,0,"M",1864-08-23,1864,NA,1936
"1716","GRC-1932-3","A2.9-5146",350,"GRC","Tsaldaris","04/11/1932","11/01/1933","1868","1936",1932-11-04,1933-01-11,0,1,0,0,0,"M",NA,1868,NA,1936
"1717","GRC-1933-1","A2.9-5149",350,"GRC","Venizelos","16/01/1933","06/03/1933","23/08/1864","1936",1933-01-16,1933-03-06,0,1,0,4,0,"M",1864-08-23,1864,NA,1936
"1718","GRC-1933-2","A2.9-5152",350,"GRC","Plastiras","06/03/1933","10/03/1933","1883","1953",1933-03-06,1933-03-10,1,3,6,1,1,"M",NA,1883,NA,1953
"1719","GRC-1933-3","A2.9-5155",350,"GRC","Tsaldaris","10/03/1933","10/10/1935","1868","1936",1933-03-10,1935-10-10,0,3,6,1,0,"M",NA,1868,NA,1936
"1720","GRC-1935-1","A2.9-5158",350,"GRC","Kondilis","10/10/1935","30/11/1935","1879","31/01/1936",1935-10-10,1935-11-30,1,1,0,1,1,"M",NA,1879,1936-01-31,1936
"1721","GRC-1935-2","A2.9-5161",350,"GRC","Demertzis","30/11/1935","12/04/1936","1876","12/04/1936",1935-11-30,1936-04-12,0,2,0,0,-777,"M",NA,1876,1936-04-12,1936
"1722","GRC-1936","A2.9-5164",350,"GRC","Metaxas","22/04/1936","29/01/1941","12/04/1871","29/01/1941",1936-04-22,1941-01-29,1,2,0,0,-777,"M",1871-04-12,1871,1941-01-29,1941
"1723","GRC-1941-1","A2.9-5167",350,"GRC","Korizis","29/01/1941","18/04/1941","1885","1941",1941-01-29,1941-04-18,0,2,0,0,-777,"M",NA,1885,NA,1941
"1724","GRC-1941-2","A2.9-5170",350,"GRC","Tsouderos","21/04/1941","29/04/1941","1882","1956",1941-04-21,1941-04-29,0,4,9,0,1,"M",NA,1882,NA,1956
"1725","GRC-1944","A2.9-5173",350,"GRC","G. Papandreou","18/10/1944","03/01/1945","13/02/1888","01/11/1968",1944-10-18,1945-01-03,1,1,0,0,0,"M",1888-02-13,1888,1968-11-01,1968
"1726","GRC-1945-1","A2.9-5176",350,"GRC","Plastiras","03/01/1945","09/04/1945","1883","1953",1945-01-03,1945-04-09,0,1,0,2,0,"M",NA,1883,NA,1953
"1727","GRC-1945-2","A2.9-5179",350,"GRC","Voulgaris","09/04/1945","09/10/1945","1884","1957",1945-04-09,1945-10-09,0,1,0,0,0,"M",NA,1884,NA,1957
"1728","GRC-1945-3","A2.9-5182",350,"GRC","Damaskinos","17/10/1945","01/11/1945","03/03/1891","20/05/1949",1945-10-17,1945-11-01,1,1,0,0,0,"M",1891-03-03,1891,1949-05-20,1949
"1729","GRC-1945-4","A2.9-5185",350,"GRC","Kanellopoulos","01/11/1945","22/11/1945","13/12/1902","11/09/1986",1945-11-01,1945-11-22,0,1,0,0,0,"M",1902-12-13,1902,1986-09-11,1986
"1730","GRC-1945-5","A2.9-5188",350,"GRC","Sophoulis","22/11/1945","04/04/1946","1861","1949",1945-11-22,1946-04-04,0,1,0,1,0,"M",NA,1861,NA,1949
"1731","GRC-1946-1","A2.9-5191",350,"GRC","Poulitsas","04/04/1946","18/04/1946","1881","1968",1946-04-04,1946-04-18,0,1,0,0,0,"M",NA,1881,NA,1968
"1732","GRC-1946-2","A2.9-5194",350,"GRC","K. Tsaldaris","18/04/1946","22/01/1947","1884","1970",1946-04-18,1947-01-22,0,1,0,0,0,"M",NA,1884,NA,1970
"1733","GRC-1947-1","A2.9-5197",350,"GRC","Maximos","25/01/1947","25/08/1947","1873","1955",1947-01-25,1947-08-25,0,1,0,0,0,"M",NA,1873,NA,1955
"1734","GRC-1947-2","A2.9-5200",350,"GRC","K. Tsaldaris","29/08/1947","05/09/1947","1884","1970",1947-08-29,1947-09-05,0,1,0,1,0,"M",NA,1884,NA,1970
"1735","GRC-1947-3","A2.9-5203",350,"GRC","Sophoulis","08/09/1947","24/06/1949","1861","1949",1947-09-08,1949-06-24,0,2,0,2,-777,"M",NA,1861,NA,1949
"1736","GRC-1949","A2.9-5206",350,"GRC","Diomidis","30/06/1949","06/01/1950","1875","1950",1949-06-30,1950-01-06,0,1,0,0,0,"M",NA,1875,NA,1950
"1737","GRC-1950-1","A2.9-5209",350,"GRC","Theotokis","06/01/1950","05/03/1950","1880","1961",1950-01-06,1950-03-05,0,1,0,0,0,"M",NA,1880,NA,1961
"1738","GRC-1950-2","A2.9-5212",350,"GRC","S. Venizelos","23/03/1950","15/04/1950","1894","1964",1950-03-23,1950-04-15,0,1,0,0,0,"M",NA,1894,NA,1964
"1739","GRC-1950-3","A2.9-5215",350,"GRC","Plastiras","15/04/1950","21/08/1950","1883","1953",1950-04-15,1950-08-21,0,1,0,3,0,"M",NA,1883,NA,1953
"1740","GRC-1950-4","A2.9-5218",350,"GRC","S. Venizelos","21/08/1950","01/11/1951","1894","1964",1950-08-21,1951-11-01,0,1,0,1,0,"M",NA,1894,NA,1964
"1741","GRC-1951","A2.9-5221",350,"GRC","Plastiras","01/11/1951","11/10/1952","1883","1953",1951-11-01,1952-10-11,0,2.1,0,4,0,"M",NA,1883,NA,1953
"1742","GRC-1952-1","A2.9-5224",350,"GRC","Kiousopoulos","11/10/1952","19/11/1952","1892","1977",1952-10-11,1952-11-19,0,1,0,0,-666,"M",NA,1892,NA,1977
"1743","GRC-1952-2","A2.9-5227",350,"GRC","Papagos","19/11/1952","04/10/1955","1883","1955",1952-11-19,1955-10-04,0,2,0,0,-777,"M",NA,1883,NA,1955
"1744","GRC-1955-1","A2.9-5230",350,"GRC","Stephanopoulos","04/10/1955","06/10/1955","1898","1982",1955-10-04,1955-10-06,0,1,0,0,0,"M",NA,1898,NA,1982
"1745","GRC-1955-2","A2.9-5233",350,"GRC","Karamanlis","06/10/1955","05/03/1958","08/03/1907","22/04/1998",1955-10-06,1958-03-05,0,1,0,0,0,"M",1907-03-08,1907,1998-04-22,1998
"1746","GRC-1958-1","A2.9-5236",350,"GRC","Georgakopoulos","05/03/1958","17/05/1958","1890","1978",1958-03-05,1958-05-17,0,1,0,0,0,"M",NA,1890,NA,1978
"1747","GRC-1958-2","A2.9-5239",350,"GRC","Karamanlis","17/05/1958","20/09/1961","08/03/1907","22/04/1998",1958-05-17,1961-09-20,0,1,0,1,0,"M",1907-03-08,1907,1998-04-22,1998
"1748","GRC-1961-1","A2.9-5242",350,"GRC","Dovas","20/09/1961","04/11/1961","1898","1973",1961-09-20,1961-11-04,0,1,0,0,0,"M",NA,1898,NA,1973
"1749","GRC-1961-2","A2.9-5245",350,"GRC","Karamanlis","04/11/1961","11/06/1963","08/03/1907","22/04/1998",1961-11-04,1963-06-11,0,1,0,2,1,"M",1907-03-08,1907,1998-04-22,1998
"1750","GRC-1963-1","A2.9-5248",350,"GRC","Pipinelis","17/06/1963","29/09/1963","1899","1970",1963-06-17,1963-09-29,0,1,0,0,0,"M",NA,1899,NA,1970
"1751","GRC-1963-2","A2.9-5251",350,"GRC","Mavromichalis","29/09/1963","08/11/1963","1900","1981",1963-09-29,1963-11-08,0,1,0,0,0,"M",NA,1900,NA,1981
"1752","GRC-1963-3","A2.9-5254",350,"GRC","G. Papandreou","08/11/1963","24/12/1963","13/02/1888","01/11/1968",1963-11-08,1963-12-24,0,1,0,1,0,"M",1888-02-13,1888,1968-11-01,1968
"1753","GRC-1963-4","A2.9-5257",350,"GRC","Paraskevopoulos","31/12/1963","18/02/1964","1900","1984",1963-12-31,1964-02-18,0,1,0,0,0,"M",NA,1900,NA,1984
"1754","GRC-1964","A2.9-5260",350,"GRC","G. Papandreou","18/02/1964","15/07/1965","13/02/1888","01/11/1968",1964-02-18,1965-07-15,0,3,8,2,0,"M",1888-02-13,1888,1968-11-01,1968
"1755","GRC-1965-1","A2.9-5263",350,"GRC","Athaniadis-Novas","15/07/1965","05/08/1965","1893","1987",1965-07-15,1965-08-05,1,1,0,0,0,"M",NA,1893,NA,1987
"1756","GRC-1965-2","A2.9-5266",350,"GRC","Tsirimokos","20/08/1965","29/08/1965","1907","1968",1965-08-20,1965-08-29,0,1,0,0,0,"M",NA,1907,NA,1968
"1757","GRC-1965-3","A2.9-5269",350,"GRC","Stephanopoulos","17/09/1965","22/12/1966","1898","1982",1965-09-17,1966-12-22,0,1,0,1,2,"M",NA,1898,NA,1982
"1758","GRC-1966","A2.9-5272",350,"GRC","Paraskevopoulos","22/12/1966","30/03/1967","1900","1984",1966-12-22,1967-03-30,0,1,0,1,0,"M",NA,1900,NA,1984
"1759","GRC-1967-1","A2.9-5275",350,"GRC","Kanellopoulos","03/04/1967","21/04/1967","13/12/1902","11/09/1986",1967-04-03,1967-04-21,0,3,6,1,2,"M",1902-12-13,1902,1986-09-11,1986
"1760","GRC-1967-2","A2.9-5278",350,"GRC","Kollias","21/04/1967","13/12/1967","1901","1998",1967-04-21,1967-12-13,1,3,6,0,1,"M",NA,1901,NA,1998
"1761","GRC-1967-3","A2.9-5281",350,"GRC","Papadopoulos","13/12/1967","25/11/1973","05/05/1919","27/06/1999",1967-12-13,1973-11-25,1,3,6,0,2,"M",1919-05-05,1919,1999-06-27,1999
"1762","GRC-1973","A2.9-5284",350,"GRC","Ionannides","25/11/1973","24/07/1974","13/03/1923","27/07/1999",1973-11-25,1974-07-24,1,1,0,0,2,"M",1923-03-13,1923,1999-07-27,1999
"1763","GRC-1974","A2.9-5287",350,"GRC","Karamanlis","24/07/1974","09/05/1980","08/03/1907","22/04/1998",1974-07-24,1980-05-09,0,1,0,3,0,"M",1907-03-08,1907,1998-04-22,1998
"1764","GRC-1980","A2.9-5290",350,"GRC","Rallis","09/05/1980","21/10/1981","26/12/1918","15/03/2006",1980-05-09,1981-10-21,0,1,0,0,0,"M",1918-12-26,1918,2006-03-15,2006
"1765","GRC-1981","A2.9-5293",350,"GRC","A. Papandreou","21/10/1981","02/07/1989","05/02/1919","23/06/1996",1981-10-21,1989-07-02,0,1,0,0,0,"M",1919-02-05,1919,1996-06-23,1996
"1766","GRC-1989-1","A2.9-5296",350,"GRC","Tzannetakis","02/07/1989","11/10/1989","1927","-777",1989-07-02,1989-10-11,0,1,0,0,0,"M",NA,1927,NA,-777
"1767","GRC-1989-2","A2.9-5299",350,"GRC","Grivas","11/10/1989","23/11/1989","1923","-777",1989-10-11,1989-11-23,0,1,0,0,0,"M",NA,1923,NA,-777
"1768","GRC-1989-3","A2.9-5302",350,"GRC","Zolotas","28/11/1989","10/04/1990","1904","2004",1989-11-28,1990-04-10,0,1,0,0,0,"M",NA,1904,NA,2004
"1769","GRC-1990","A2.9-5305",350,"GRC","Mitsotakis","11/04/1990","13/10/1993","1918","-777",1990-04-11,1993-10-13,0,1,0,0,0,"M",NA,1918,NA,-777
"1770","GRC-1993","A2.9-5308",350,"GRC","A. Papandreou","13/10/1993","20/11/1995","05/02/1919","23/06/1996",1993-10-13,1995-11-20,0,2.1,0,1,-777,"M",1919-02-05,1919,1996-06-23,1996
"1771","GRC-1995","A2.9-5311",350,"GRC","Tsokhatzopulos","20/11/1995","22/01/1996","1939","-777",1995-11-20,1996-01-22,0,1,0,0,0,"M",NA,1939,NA,-777
"1772","GRC-1996","A2.9-5314",350,"GRC","Simitis","22/01/1996","10/03/2004","1936","-777",1996-01-22,2004-03-10,0,1,0,0,0,"M",NA,1936,NA,-777
"1773","GRC-2004","A2.9-5317",350,"GRC","Konstantinos Karamanlis","10/03/2004","31/12/2004","1956","-777",2004-03-10,2004-12-31,0,-888,0,0,-888,"M",NA,1956,NA,-777
"1774","CYP-1960","A2.9-5320",352,"CYP","Makarios","16/08/1960","15/07/1974","13/08/1913","03/08/1977",1960-08-16,1974-07-15,0,3,5,0,1,"M",1913-08-13,1913,1977-08-03,1977
"1775","CYP-1974-1","A2.9-5323",352,"CYP","Sampson","16/07/1974","23/07/1974","1935","2001",1974-07-16,1974-07-23,1,3,111,0,2,"M",NA,1935,NA,2001
"1776","CYP-1974-2","A2.9-5326",352,"CYP","Clerides","23/07/1974","07/12/1974","24/04/1919","-777",1974-07-23,1974-12-07,0,1,0,0,0,"M",1919-04-24,1919,NA,-777
"1777","CYP-1974-3","A2.9-5329",352,"CYP","Makarios","07/12/1974","03/08/1977","13/08/1913","03/08/1977",1974-12-07,1977-08-03,0,2,0,1,-777,"M",1913-08-13,1913,1977-08-03,1977
"1778","CYP-1977","A2.9-5332",352,"CYP","Kyprianou","03/08/1977","28/02/1988","28/10/1932","12/03/2002",1977-08-03,1988-02-28,0,1,0,0,0,"M",1932-10-28,1932,2002-03-12,2002
"1779","CYP-1988","A2.9-5335",352,"CYP","Vassiliou","28/02/1988","28/02/1993","1931","-777",1988-02-28,1993-02-28,0,1,0,0,0,"M",NA,1931,NA,-777
"1780","CYP-1993","A2.9-5338",352,"CYP","Clerides","28/02/1993","28/02/2003","24/04/1919","-777",1993-02-28,2003-02-28,0,1,0,1,0,"M",1919-04-24,1919,NA,-777
"1781","CYP-2003","A2.9-5341",352,"CYP","Tassos Nikolaou Papadopoulos","28/02/2003","31/12/2004","1934","-777",2003-02-28,2004-12-31,0,-888,0,0,-888,"M",NA,1934,NA,-777
"1782","BUL-1887","A2.9-5344",355,"BUL","Ferdinand I","07/08/1887","03/10/1918","26/02/1861","10/09/1948",1887-08-07,1918-10-03,0,1,0,0,1,"M",1861-02-26,1861,1948-09-10,1948
"1783","BUL-1918","A2.9-5347",355,"BUL","Boris III","03/10/1918","29/08/1943","30/01/1894","29/08/1943",1918-10-03,1943-08-29,0,2,0,0,-777,"M",1894-01-30,1894,1943-08-29,1943
"1784","BUL-1943","A2.9-5350",355,"BUL","Cyril","29/08/1943","09/09/1944","1895","1945",1943-08-29,1944-09-09,0,3,3,0,3,"M",NA,1895,NA,1945
"1785","BUL-1944","A2.9-5353",355,"BUL","Georgiev","09/09/1944","23/11/1946","1882","1968",1944-09-09,1946-11-23,1,1,0,0,0,"M",NA,1882,NA,1968
"1786","BUL-1946","A2.9-5356",355,"BUL","Dimitrov","23/11/1946","02/07/1949","30/06/1882","02/07/1949",1946-11-23,1949-07-02,0,2,0,0,-777,"M",1882-06-30,1882,1949-07-02,1949
"1787","BUL-1949","A2.9-5359",355,"BUL","Kolarov","20/07/1949","23/01/1950","28/07/1877","23/01/1950",1949-07-20,1950-01-23,0,2,0,0,-777,"M",1877-07-28,1877,1950-01-23,1950
"1788","BUL-1950","A2.9-5362",355,"BUL","Chervenkov","01/02/1950","16/04/1956","06/09/1900","21/10/1980",1950-02-01,1956-04-16,0,1,0,0,0,"M",1900-09-06,1900,1980-10-21,1980
"1789","BUL-1956","A2.9-5365",355,"BUL","Zhivkov","16/04/1956","10/11/1989","1911","1998",1956-04-16,1989-11-10,0,1,0,0,2,"M",NA,1911,NA,1998
"1790","BUL-1989","A2.9-5368",355,"BUL","Mladenov","10/11/1989","06/07/1990","22/08/1936","31/05/2000",1989-11-10,1990-07-06,0,1,0,0,0,"M",1936-08-22,1936,2000-05-31,2000
"1791","BUL-1990-1","A2.9-5371",355,"BUL","Lukanov","06/07/1990","07/12/1990","26/09/1938","02/10/1996",1990-07-06,1990-12-07,0,1,0,0,0,"M",1938-09-26,1938,1996-10-02,1996
"1792","BUL-1990-2","A2.9-5374",355,"BUL","Popov","07/12/1990","08/11/1991","1927","-777",1990-12-07,1991-11-08,0,1,0,0,-666,"M",NA,1927,NA,-777
"1793","BUL-1991","A2.9-5377",355,"BUL","Dimitrov","08/11/1991","30/12/1992","31/03/1955","-777",1991-11-08,1992-12-30,0,1,0,0,0,"M",1955-03-31,1955,NA,-777
"1794","BUL-1992","A2.9-5380",355,"BUL","Berov","30/12/1992","17/10/1994","1925","2006",1992-12-30,1994-10-17,0,1,0,0,0,"M",NA,1925,NA,2006
"1795","BUL-1994","A2.9-5383",355,"BUL","Indzhova","17/10/1994","25/01/1995","1953","-777",1994-10-17,1995-01-25,0,1,0,0,0,"F",NA,1953,NA,-777
"1796","BUL-1995","A2.9-5386",355,"BUL","Videnov","25/01/1995","13/02/1997","1959","-777",1995-01-25,1997-02-13,0,1,0,0,0,"M",NA,1959,NA,-777
"1797","BUL-1997-1","A2.9-5389",355,"BUL","Sofiyanski","13/02/1997","21/05/1997","1951","-777",1997-02-13,1997-05-21,0,1,0,0,0,"M",NA,1951,NA,-777
"1798","BUL-1997-2","A2.9-5392",355,"BUL","Kostov","21/05/1997","21/07/2001","1949","-777",1997-05-21,2001-07-21,0,1,0,0,0,"M",NA,1949,NA,-777
"1799","BUL-2001","A2.9-5395",355,"BUL","Saksgoburggotski","24/07/2001","31/12/2004","1937","-777",2001-07-24,2004-12-31,0,-888,0,0,-888,"M",NA,1937,NA,-777
"1800","MLD-1990","A2.9-5398",359,"MLD","Snegur","03/09/1990","15/01/1997","1940","-777",1990-09-03,1997-01-15,0,1,0,0,0,"M",NA,1940,NA,-777
"1801","MLD-1997","A2.9-5401",359,"MLD","Lucinschi","15/01/1997","07/04/2001","27/01/1940","-777",1997-01-15,2001-04-07,0,1,0,0,0,"M",1940-01-27,1940,NA,-777
"1802","MLD-2001","A2.9-5404",359,"MLD","Tarlev","07/04/2001","31/12/2004","1963","-777",2001-04-07,2004-12-31,0,-888,0,0,-888,"M",NA,1963,NA,-777
"1803","RUM-1866","A2.9-5407",360,"RUM","Carol I","22/05/1866","10/10/1914","1839","1914",1866-05-22,1914-10-10,0,2,0,0,-777,"M",NA,1839,NA,1914
"1804","RUM-1914","A2.9-5410",360,"RUM","Ferdinand I","11/10/1914","21/07/1927","1865","1927",1914-10-11,1927-07-21,0,2,0,0,-777,"M",NA,1865,NA,1927
"1805","RUM-1927","A2.9-5413",360,"RUM","Nicholas","21/07/1927","08/06/1930","1903","1978",1927-07-21,1930-06-08,0,1,0,0,1,"M",NA,1903,NA,1978
"1806","RUM-1930","A2.9-5416",360,"RUM","Carol II","08/06/1930","06/09/1940","1893","1953",1930-06-08,1940-09-06,1,3,6,0,1,"M",NA,1893,NA,1953
"1807","RUM-1940","A2.9-5419",360,"RUM","Antonescu","06/09/1940","23/08/1944","15/06/1882","01/06/1946",1940-09-06,1944-08-23,1,3,8,0,2,"M",1882-06-15,1882,1946-06-01,1946
"1808","RUM-1944","A2.9-5422",360,"RUM","Michael","23/08/1944","30/12/1947","1921","-777",1944-08-23,1947-12-30,1,3,7,0,1,"M",NA,1921,NA,-777
"1809","RUM-1947","A2.9-5425",360,"RUM","Georghiu-Dej","30/12/1947","19/03/1965","08/11/1901","19/03/1965",1947-12-30,1965-03-19,1,2,0,0,-777,"M",1901-11-08,1901,1965-03-19,1965
"1810","RUM-1965","A2.9-5428",360,"RUM","Ceausescu","22/03/1965","25/12/1989","26/01/1918","25/12/1989",1965-03-22,1989-12-25,0,3,2,0,3,"M",1918-01-26,1918,1989-12-25,1989
"1811","RUM-1989","A2.9-5431",360,"RUM","Roman","26/12/1989","01/10/1991","1946","-777",1989-12-26,1991-10-01,0,1,0,0,0,"M",NA,1946,NA,-777
"1812","RUM-1991","A2.9-5434",360,"RUM","Stolojan","01/10/1991","04/11/1992","1943","-777",1991-10-01,1992-11-04,0,1,0,0,0,"M",NA,1943,NA,-777
"1813","RUM-1992","A2.9-5437",360,"RUM","Vacariou","04/11/1992","12/12/1996","1943","-777",1992-11-04,1996-12-12,0,1,0,0,0,"M",NA,1943,NA,-777
"1814","RUM-1996","A2.9-5440",360,"RUM","Ciorbea","12/12/1996","30/03/1998","1954","-777",1996-12-12,1998-03-30,0,1,0,0,0,"M",NA,1954,NA,-777
"1815","RUM-1998-1","A2.9-5443",360,"RUM","Dejeu","30/03/1998","15/04/1998","1932","-777",1998-03-30,1998-04-15,0,1,0,0,0,"M",NA,1932,NA,-777
"1816","RUM-1998-2","A2.9-5446",360,"RUM","Vasile","15/04/1998","14/12/1999","1942","-777",1998-04-15,1999-12-14,0,1,0,0,0,"M",NA,1942,NA,-777
"1817","RUM-1999-1","A2.9-5449",360,"RUM","Athanasiu","14/12/1999","22/12/1999","1955","-777",1999-12-14,1999-12-22,0,1,0,0,0,"M",NA,1955,NA,-777
"1818","RUM-1999-2","A2.9-5452",360,"RUM","Isarescu","22/12/1999","28/12/2000","1949","-777",1999-12-22,2000-12-28,0,1,0,0,0,"M",NA,1949,NA,-777
"1819","RUM-2000","A2.9-5455",360,"RUM","A. Nastase","28/12/2000","21/12/2004","1950","-777",2000-12-28,2004-12-21,0,1,0,0,-999,"M",NA,1950,NA,-777
"1820","RUM-2004-1","A2.9-5458",360,"RUM","Eugen Bejinariu","21/12/2004","29/12/2004","1959","-777",2004-12-21,2004-12-29,0,1,0,0,-999,"M",NA,1959,NA,-777
"1821","RUM-2004-2","A2.9-5461",360,"RUM","Traian Basescu","29/12/2004","31/12/2004","04/11/1951","-777",2004-12-29,2004-12-31,0,-888,0,0,-888,"M",1951-11-04,1951,NA,-777
"1822","RUS-1855","A2.9-5464",364,"RUS","Alexander II","02/03/1855","13/03/1881","20/04/1818","13/03/1881",1855-03-02,1881-03-13,0,3,-999,0,3,"M",1818-04-20,1818,1881-03-13,1881
"1823","RUS-1881","A2.9-5467",364,"RUS","Alexander III","13/03/1881","01/11/1894","1845","01/11/1894",1881-03-13,1894-11-01,0,2,0,0,-777,"M",NA,1845,1894-11-01,1894
"1824","RUS-1894","A2.9-5470",364,"RUS","Nicholas II","01/11/1894","06/11/1917","18/05/1868","16/07/1918",1894-11-01,1917-11-06,0,3,-999,0,2,"M",1868-05-18,1868,1918-07-16,1918
"1825","RUS-1917","A2.9-5473",364,"RUS","Lenin","07/11/1917","10/03/1923","22/04/1870","21/01/1924",1917-11-07,1923-03-10,1,2,0,0,-777,"M",1870-04-22,1870,1924-01-21,1924
"1826","RUS-1923","A2.9-5476",364,"RUS","Stalin","10/03/1923","05/03/1953","21/12/1879","05/03/1953",1923-03-10,1953-03-05,0,2,0,0,-777,"M",1879-12-21,1879,1953-03-05,1953
"1827","RUS-1953-1","A2.9-5479",364,"RUS","Malenkov","06/03/1953","20/03/1953","21/01/1902","14/01/1988",1953-03-06,1953-03-20,0,1,0,0,0,"M",1902-01-21,1902,1988-01-14,1988
"1828","RUS-1953-2","A2.9-5482",364,"RUS","Khrushchev","20/03/1953","15/10/1964","15/04/1894","11/09/1971",1953-03-20,1964-10-15,0,1,0,0,0,"M",1894-04-15,1894,1971-09-11,1971
"1829","RUS-1964","A2.9-5485",364,"RUS","Brezhnev","15/10/1964","10/11/1982","19/12/1906","10/11/1982",1964-10-15,1982-11-10,0,2,0,0,-777,"M",1906-12-19,1906,1982-11-10,1982
"1830","RUS-1982","A2.9-5488",364,"RUS","Andropov","10/11/1982","09/02/1984","15/06/1914","09/02/1984",1982-11-10,1984-02-09,0,2,0,0,-777,"M",1914-06-15,1914,1984-02-09,1984
"1831","RUS-1984","A2.9-5491",364,"RUS","Chernenko","13/02/1984","10/03/1985","24/09/1911","10/03/1985",1984-02-13,1985-03-10,0,2,0,0,-777,"M",1911-09-24,1911,1985-03-10,1985
"1832","RUS-1985","A2.9-5494",364,"RUS","Gorbachev","11/03/1985","21/08/1991","02/03/1931","-777",1985-03-11,1991-08-21,0,3,6,0,0,"M",1931-03-02,1931,NA,-777
"1833","RUS-1991","A2.9-5497",364,"RUS","Yeltsin","21/08/1991","31/12/1999","01/02/1931","23/04/2007",1991-08-21,1999-12-31,0,1,0,0,0,"M",1931-02-01,1931,2007-04-23,2007
"1834","RUS-2000","A2.9-5500",365,"RUS","Putin","01/01/2000","31/12/2004","07/10/1952","-777",2000-01-01,2004-12-31,0,-888,0,0,-888,"M",1952-10-07,1952,NA,-777
"1835","EST-1918","A2.9-5503",366,"EST","Pats","24/02/1918","08/05/1919","23/02/1874","18/01/1956",1918-02-24,1919-05-08,0,1,0,0,0,"M",1874-02-23,1874,1956-01-18,1956
"1836","EST-1919-1","A2.9-5506",366,"EST","Strandman","19/05/1919","13/11/1919","30/11/1875","1941",1919-05-19,1919-11-13,0,1,0,0,0,"M",1875-11-30,1875,NA,1941
"1837","EST-1919-2","A2.9-5509",366,"EST","Tonisson","13/11/1919","27/10/1920","22/12/1868","1941",1919-11-13,1920-10-27,0,1,0,0,0,"M",1868-12-22,1868,NA,1941
"1838","EST-1920","A2.9-5512",366,"EST","Piip","27/10/1920","04/01/1921","1884","1942",1920-10-27,1921-01-04,0,1,0,0,0,"M",NA,1884,NA,1942
"1839","EST-1921","A2.9-5515",366,"EST","Pats","25/01/1921","23/10/1922","23/02/1874","18/01/1956",1921-01-25,1922-10-23,0,1,0,1,0,"M",1874-02-23,1874,1956-01-18,1956
"1840","EST-1922","A2.9-5518",366,"EST","Kukk","23/10/1922","02/08/1923","1885","1945",1922-10-23,1923-08-02,0,1,0,0,0,"M",NA,1885,NA,1945
"1841","EST-1923","A2.9-5521",366,"EST","Pats","02/08/1923","28/03/1924","23/02/1874","18/01/1956",1923-08-02,1924-03-28,0,1,0,2,0,"M",1874-02-23,1874,1956-01-18,1956
"1842","EST-1924-1","A2.9-5524",366,"EST","Akel","28/03/1924","10/12/1924","1871","1941",1924-03-28,1924-12-10,0,1,0,0,0,"M",NA,1871,NA,1941
"1843","EST-1924-2","A2.9-5527",366,"EST","Jaakson","17/12/1924","16/12/1925","1870","1942",1924-12-17,1925-12-16,0,1,0,0,0,"M",NA,1870,NA,1942
"1844","EST-1925","A2.9-5530",366,"EST","Teemant","16/12/1925","22/02/1927","24/09/1872","1941",1925-12-16,1927-02-22,0,1,0,0,0,"M",1872-09-24,1872,NA,1941
"1845","EST-1927-1","A2.9-5533",366,"EST","Uluots","22/02/1927","22/11/1927","1890","1945",1927-02-22,1927-11-22,0,1,0,0,0,"M",NA,1890,NA,1945
"1846","EST-1927-2","A2.9-5536",366,"EST","Tonisson","10/12/1927","19/11/1928","22/12/1868","1941",1927-12-10,1928-11-19,0,1,0,1,0,"M",1868-12-22,1868,NA,1941
"1847","EST-1928","A2.9-5539",366,"EST","Rei","19/11/1928","03/07/1929","22/03/1886","1963",1928-11-19,1929-07-03,0,1,0,0,0,"M",1886-03-22,1886,NA,1963
"1848","EST-1929","A2.9-5542",366,"EST","Strandman","10/07/1929","03/02/1931","30/11/1875","1941",1929-07-10,1931-02-03,0,1,0,1,0,"M",1875-11-30,1875,NA,1941
"1849","EST-1931","A2.9-5545",366,"EST","Pats","12/02/1931","29/01/1932","23/02/1874","18/01/1956",1931-02-12,1932-01-29,0,1,0,3,0,"M",1874-02-23,1874,1956-01-18,1956
"1850","EST-1932-1","A2.9-5548",366,"EST","Teemant","18/02/1932","20/06/1932","24/09/1872","1941",1932-02-18,1932-06-20,0,1,0,1,0,"M",1872-09-24,1872,NA,1941
"1851","EST-1932-2","A2.9-5551",366,"EST","Einbund","19/07/1932","30/10/1932","1888","1942",1932-07-19,1932-10-30,0,1,0,0,0,"M",NA,1888,NA,1942
"1852","EST-1932-3","A2.9-5554",366,"EST","Pats","01/11/1932","26/04/1933","23/02/1874","18/01/1956",1932-11-01,1933-04-26,0,1,0,4,0,"M",1874-02-23,1874,1956-01-18,1956
"1853","EST-1933-1","A2.9-5557",366,"EST","Tonisson","17/05/1933","17/10/1933","22/12/1868","1941",1933-05-17,1933-10-17,0,1,0,2,0,"M",1868-12-22,1868,NA,1941
"1854","EST-1933-2","A2.9-5560",366,"EST","Pats","21/10/1933","23/07/1940","23/02/1874","18/01/1956",1933-10-21,1940-07-23,0,4,9,5,2,"M",1874-02-23,1874,1956-01-18,1956
"1855","EST-1940","A2.9-5563",366,"EST","Vares","23/07/1940","25/08/1940","12/01/1890","1946",1940-07-23,1940-08-25,2,4,9,0,0,"M",1890-01-12,1890,NA,1946
"1856","EST-1991","A2.9-5566",366,"EST","Savisaar","06/09/1991","23/01/1992","1950","-777",1991-09-06,1992-01-23,0,1,0,0,0,"M",NA,1950,NA,-777
"1857","EST-1992-1","A2.9-5569",366,"EST","Vahi","30/01/1992","08/10/1992","10/1/1947","-777",1992-01-30,1992-10-08,0,1,0,0,0,"M",1947-01-10,1947,NA,-777
"1858","EST-1992-2","A2.9-5572",366,"EST","Laar","28/10/1992","08/11/1994","22/04/1960","-777",1992-10-28,1994-11-08,0,1,0,0,0,"M",1960-04-22,1960,NA,-777
"1859","EST-1994","A2.9-5575",366,"EST","Tarand","08/11/1994","17/04/1995","1940","-777",1994-11-08,1995-04-17,0,1,0,0,0,"M",NA,1940,NA,-777
"1860","EST-1995","A2.9-5578",366,"EST","Vahi","17/04/1995","17/03/1997","10/1/1947","-777",1995-04-17,1997-03-17,0,1,0,1,0,"M",1947-01-10,1947,NA,-777
"1861","EST-1997","A2.9-5581",366,"EST","Siimann","17/03/1997","25/03/1999","1946","-777",1997-03-17,1999-03-25,0,1,0,0,0,"M",NA,1946,NA,-777
"1862","EST-1999","A2.9-5584",366,"EST","Laar","25/03/1999","28/01/2002","22/04/1960","-777",1999-03-25,2002-01-28,0,1,0,1,0,"M",1960-04-22,1960,NA,-777
"1863","EST-2002","A2.9-5587",366,"EST","Kallas","28/01/2002","10/04/2003","1948","-777",2002-01-28,2003-04-10,0,1,0,0,0,"M",NA,1948,NA,-777
"1864","EST-2003","A2.9-5590",366,"EST","Parts","10/04/2003","31/12/2004","1966","-777",2003-04-10,2004-12-31,0,-888,0,0,-888,"M",NA,1966,NA,-777
"1865","LAT-1918","A2.9-5593",367,"LAT","Ulmanis","17/11/1918","21/04/1919","04/09/1877","1942",1918-11-17,1919-04-21,1,1,0,0,0,"M",1877-09-04,1877,NA,1942
"1866","LAT-1919-1","A2.9-5596",367,"LAT","Oskars Borkovskis","21/04/1919","26/04/1919","1872","1945",1919-04-21,1919-04-26,2,-666,0,0,-666,"M",NA,1872,NA,1945
"1867","LAT-1919-2","A2.9-5599",367,"LAT","Andrievs Niedra","26/04/1919","28/06/1919","08/02/1871","25/09/1942",1919-04-26,1919-06-28,2,3,4,0,1,"M",1871-02-08,1871,1942-09-25,1942
"1868","LAT-1919-3","A2.9-5602",367,"LAT","Ulmanis","14/07/1919","17/06/1921","04/09/1877","1942",1919-07-14,1921-06-17,0,1,0,1,0,"M",1877-09-04,1877,NA,1942
"1869","LAT-1921","A2.9-5605",367,"LAT","Meierovics","17/06/1921","31/01/1923","1887","1925",1921-06-17,1923-01-31,0,1,0,0,0,"M",NA,1887,NA,1925
"1870","LAT-1923-1","A2.9-5608",367,"LAT","Pauluks","31/01/1923","27/06/1923","1865","1937",1923-01-31,1923-06-27,0,1,0,0,-666,"M",NA,1865,NA,1937
"1871","LAT-1923-2","A2.9-5611",367,"LAT","Meierovics","28/06/1923","26/01/1924","1887","1925",1923-06-28,1924-01-26,0,1,0,1,0,"M",NA,1887,NA,1925
"1872","LAT-1924-1","A2.9-5614",367,"LAT","Zamuelis","27/01/1924","18/12/1924","22/05/1872","1948",1924-01-27,1924-12-18,0,1,0,0,-666,"M",1872-05-22,1872,NA,1948
"1873","LAT-1924-2","A2.9-5617",367,"LAT","Celmins","19/12/1924","25/12/1925","1877","1941",1924-12-19,1925-12-25,0,1,0,0,0,"M",NA,1877,NA,1941
"1874","LAT-1925","A2.9-5620",367,"LAT","Ulmanis","25/12/1925","06/05/1926","04/09/1877","1942",1925-12-25,1926-05-06,0,1,0,2,0,"M",1877-09-04,1877,NA,1942
"1875","LAT-1926-1","A2.9-5623",367,"LAT","Alberings","07/05/1926","17/12/1926","26/12/1876","1934",1926-05-07,1926-12-17,0,1,0,0,0,"M",1876-12-26,1876,NA,1934
"1876","LAT-1926-2","A2.9-5626",367,"LAT","Skujenieks","17/12/1926","21/01/1928","23/06/1886","1941",1926-12-17,1928-01-21,0,1,0,0,0,"M",1886-06-23,1886,NA,1941
"1877","LAT-1928-1","A2.9-5629",367,"LAT","Juresevskis","21/01/1928","13/11/1928","1872","1945",1928-01-21,1928-11-13,0,1,0,0,-666,"M",NA,1872,NA,1945
"1878","LAT-1928-2","A2.9-5632",367,"LAT","Celmins","01/12/1928","03/03/1931","1877","1941",1928-12-01,1931-03-03,0,1,0,1,0,"M",NA,1877,NA,1941
"1879","LAT-1931-1","A2.9-5635",367,"LAT","Ulmanis","24/03/1931","04/11/1931","04/09/1877","1942",1931-03-24,1931-11-04,0,1,0,3,0,"M",1877-09-04,1877,NA,1942
"1880","LAT-1931-2","A2.9-5638",367,"LAT","Skujenieks","04/12/1931","03/02/1933","23/06/1886","1941",1931-12-04,1933-02-03,0,1,0,1,0,"M",1886-06-23,1886,NA,1941
"1881","LAT-1933","A2.9-5641",367,"LAT","Blodnieks","25/03/1933","02/03/1934","1889","1962",1933-03-25,1934-03-02,0,1,0,0,-666,"M",NA,1889,NA,1962
"1882","LAT-1934","A2.9-5644",367,"LAT","Ulmanis","16/03/1934","22/06/1940","04/09/1877","1942",1934-03-16,1940-06-22,0,4,9,4,2,"M",1877-09-04,1877,NA,1942
"1883","LAT-1990","A2.9-5647",367,"LAT","Godmanis","03/05/1990","03/08/1993","27/11/1951","-777",1990-05-03,1993-08-03,0,1,0,0,0,"M",1951-11-27,1951,NA,-777
"1884","LAT-1993","A2.9-5650",367,"LAT","Birkavs","03/08/1993","19/09/1994","28/07/1942","-777",1993-08-03,1994-09-19,0,1,0,0,0,"M",1942-07-28,1942,NA,-777
"1885","LAT-1994","A2.9-5653",367,"LAT","Gailis","19/09/1994","21/12/1995","1951","-777",1994-09-19,1995-12-21,0,1,0,0,0,"M",NA,1951,NA,-777
"1886","LAT-1995","A2.9-5656",367,"LAT","Skele","21/12/1995","07/08/1997","1958","-777",1995-12-21,1997-08-07,0,1,0,0,0,"M",NA,1958,NA,-777
"1887","LAT-1997","A2.9-5659",367,"LAT","Krasts","07/08/1997","26/11/1998","1957","-777",1997-08-07,1998-11-26,0,1,0,0,0,"M",NA,1957,NA,-777
"1888","LAT-1998","A2.9-5662",367,"LAT","Kristopans","26/11/1998","16/07/1999","1954","-777",1998-11-26,1999-07-16,0,1,0,0,0,"M",NA,1954,NA,-777
"1889","LAT-1999","A2.9-5665",367,"LAT","Skele","16/07/1999","05/05/2000","1958","-777",1999-07-16,2000-05-05,0,1,0,1,0,"M",NA,1958,NA,-777
"1890","LAT-2000","A2.9-5668",367,"LAT","Berzins","05/05/2000","07/11/2002","4/8/1951","-777",2000-05-05,2002-11-07,0,1,0,0,0,"M",1951-08-04,1951,NA,-777
"1891","LAT-2002","A2.9-5671",367,"LAT","Repse","07/11/2002","09/03/2004","1961","-777",2002-11-07,2004-03-09,0,1,0,0,0,"M",NA,1961,NA,-777
"1892","LAT-2004-1","A2.9-5674",367,"LAT","Indulis Emsis","09/03/2004","02/12/2004","1952","-777",2004-03-09,2004-12-02,0,1,0,0,-999,"M",NA,1952,NA,-777
"1893","LAT-2004-2","A2.9-5677",367,"LAT","Aigars Kalvitis","02/12/2004","31/12/2004","1966","-777",2004-12-02,2004-12-31,0,-888,0,0,-888,"M",NA,1966,NA,-777
"1894","LIT-1917","A2.9-5680",368,"LIT","Smetona","18/09/1917","09/07/1918","10/08/1874","09/01/1944",1917-09-18,1918-07-09,-666,-666,0,0,-666,"M",1874-08-10,1874,1944-01-09,1944
"1895","LIT-1918-1","A2.9-5683",368,"LIT","Mindaugas II","09/07/1918","02/11/1918","30/05/1864","24/03/1928",1918-07-09,1918-11-02,0,3,-999,0,-666,"M",1864-05-30,1864,1928-03-24,1928
"1896","LIT-1918-2","A2.9-5686",368,"LIT","Smetona","02/11/1918","15/05/1920","10/08/1874","09/01/1944",1918-11-02,1920-05-15,0,1,0,1,0,"M",1874-08-10,1874,1944-01-09,1944
"1897","LIT-1920","A2.9-5689",368,"LIT","Stulginskis","15/05/1920","06/06/1926","26/02/1885","1969",1920-05-15,1926-06-06,0,1,0,0,0,"M",1885-02-26,1885,NA,1969
"1898","LIT-1926-1","A2.9-5692",368,"LIT","Grinius","06/06/1926","19/12/1926","17/12/1866","04/06/1950",1926-06-06,1926-12-19,0,3,6,0,0,"M",1866-12-17,1866,1950-06-04,1950
"1899","LIT-1926-2","A2.9-5695",368,"LIT","Smetona","19/12/1926","16/06/1940","10/08/1874","09/01/1944",1926-12-19,1940-06-16,1,4,9,2,1,"M",1874-08-10,1874,1944-01-09,1944
"1900","LIT-1990","A2.9-5698",368,"LIT","Landsbergis","11/03/1990","25/11/1992","12/10/1931","-777",1990-03-11,1992-11-25,0,1,0,0,0,"M",1931-10-12,1931,NA,-777
"1901","LIT-1992","A2.9-5701",368,"LIT","Brazauskas","25/11/1992","25/02/1998","1932","-777",1992-11-25,1998-02-25,0,1,0,0,0,"M",NA,1932,NA,-777
"1902","LIT-1998","A2.9-5704",368,"LIT","Adamkus","26/02/1998","25/02/2003","3/11/1926","-777",1998-02-26,2003-02-25,0,1,0,0,0,"M",1926-11-03,1926,NA,-777
"1903","LIT-2003","A2.9-5707",368,"LIT","Paksas","26/02/2003","06/04/2004","10/06/1956","-777",2003-02-26,2004-04-06,0,1,0,0,0,"M",1956-06-10,1956,NA,-777
"1904","LIT-2004-1","A2.9-5710",368,"LIT","Paulauskas","06/04/2004","12/07/2004","1953","-777",2004-04-06,2004-07-12,0,1,0,0,-999,"M",NA,1953,NA,-777
"1905","LIT-2004-2","A2.9-5713",368,"LIT","Adamkus","12/07/2004","31/12/2004","1953","-777",2004-07-12,2004-12-31,0,-888,0,1,-888,"M",NA,1953,NA,-777
"1906","UKR-1990","A2.9-5716",369,"UKR","Kravchuk","18/07/1990","19/07/1994","10/1/1934","-777",1990-07-18,1994-07-19,0,1,0,0,0,"M",1934-01-10,1934,NA,-777
"1907","UKR-1994","A2.9-5719",369,"UKR","Kuchma","19/07/1994","31/12/2004","9/8/1938","-777",1994-07-19,2004-12-31,0,-888,0,0,-888,"M",1938-08-09,1938,NA,-777
"1908","BLR-1991","A2.9-5722",370,"BLR","Shushkevich","18/09/1991","26/01/1994","15/12/1934","-777",1991-09-18,1994-01-26,0,1,0,0,0,"M",1934-12-15,1934,NA,-777
"1909","BLR-1994-1","A2.9-5725",370,"BLR","Kuznyatsu","26/01/1994","28/01/1994","1947","-777",1994-01-26,1994-01-28,0,1,0,0,0,"M",NA,1947,NA,-777
"1910","BLR-1994-2","A2.9-5728",370,"BLR","Hryb","28/01/1994","20/07/1994","1938","-777",1994-01-28,1994-07-20,0,1,0,0,0,"M",NA,1938,NA,-777
"1911","BLR-1994-3","A2.9-5731",370,"BLR","Lukashenko","20/07/1994","31/12/2004","30/08/1954","-777",1994-07-20,2004-12-31,0,-888,0,0,-888,"M",1954-08-30,1954,NA,-777
"1912","ARM-1991","A2.9-5734",371,"ARM","Ter-Petrosyan","16/10/1991","03/02/1998","1945","-777",1991-10-16,1998-02-03,0,1,0,0,0,"M",NA,1945,NA,-777
"1913","ARM-1998","A2.9-5737",371,"ARM","Kocharian","04/02/1998","31/12/2004","31/08/1954","-777",1998-02-04,2004-12-31,0,-888,0,0,-888,"M",1954-08-31,1954,NA,-777
"1914","GRG-1991","A2.9-5740",372,"GRG","Gamsakhurdia","12/04/1991","06/01/1992","31/03/1939","31/12/1993",1991-04-12,1992-01-06,0,3,4,0,1,"M",1939-03-31,1939,1993-12-31,1993
"1915","GRG-1992-1","A2.9-5743",372,"GRG","Ioseliani","06/01/1992","10/03/1992","10/7/1926","04/03/2003",1992-01-06,1992-03-10,1,1,0,0,0,"M",1926-07-10,1926,2003-03-04,2003
"1916","GRG-1992-2","A2.9-5746",372,"GRG","Shevardnadze","10/03/1992","23/11/2003","25/01/1928","-777",1992-03-10,2003-11-23,0,3,2,0,0,"M",1928-01-25,1928,NA,-777
"1917","GRG-2003","A2.9-5749",372,"GRG","Burdjanadze","23/11/2003","25/01/2004","16/07/1964","-777",2003-11-23,2004-01-25,0,1,0,0,0,"F",1964-07-16,1964,NA,-777
"1918","GRG-2004","A2.9-5752",372,"GRG","Saakashvili","25/01/2004","31/12/2004","21/12/1967","-777",2004-01-25,2004-12-31,0,-888,0,0,-888,"M",1967-12-21,1967,NA,-777
"1919","AZE-1991","A2.9-5755",373,"AZE","Mutalibov","08/09/1991","06/03/1992","12/5/1938","-777",1991-09-08,1992-03-06,0,1,0,0,0,"M",1938-05-12,1938,NA,-777
"1920","AZE-1992-1","A2.9-5758",373,"AZE","Mamedov","06/03/1992","14/05/1992","1941","-777",1992-03-06,1992-05-14,0,1,0,0,-666,"M",NA,1941,NA,-777
"1921","AZE-1992-2","A2.9-5761",373,"AZE","Mutalibov","14/05/1992","18/05/1992","12/5/1938","-777",1992-05-14,1992-05-18,0,3,2,1,1,"M",1938-05-12,1938,NA,-777
"1922","AZE-1992-3","A2.9-5764",373,"AZE","Gambarov","19/05/1992","16/06/1992","1957","-777",1992-05-19,1992-06-16,1,1,0,0,0,"M",NA,1957,NA,-777
"1923","AZE-1992-4","A2.9-5767",373,"AZE","Abulfaz Elchibey","16/06/1992","18/06/1993","7/6/1938","22/08/2000",1992-06-16,1993-06-18,1,3,4,0,0,"M",1938-06-07,1938,2000-08-22,2000
"1924","AZE-1993","A2.9-5770",373,"AZE","H. Aliyev","24/06/1993","04/08/2003","10/5/1923","12/12/2003",1993-06-24,2003-08-04,0,2.1,0,0,0,"M",1923-05-10,1923,2003-12-12,2003
"1925","AZE-2003","A2.9-5773",373,"AZE","Ilhma Aliyev","04/08/2003","31/12/2004","24/12/1961","-777",2003-08-04,2004-12-31,0,-888,0,0,-888,"M",1961-12-24,1961,NA,-777
"1926","FIN-1917","A2.9-5776",375,"FIN","Svinhufud","27/11/1917","12/12/1918","15/12/1861","1944",1917-11-27,1918-12-12,0,2.1,0,0,0,"M",1861-12-15,1861,NA,1944
"1927","FIN-1918","A2.9-5779",375,"FIN","Mannerheim","12/12/1918","30/06/1919","04/06/1867","27/01/1951",1918-12-12,1919-06-30,0,1,0,0,0,"M",1867-06-04,1867,1951-01-27,1951
"1928","FIN-1919","A2.9-5782",375,"FIN","Stahlberg","25/07/1919","28/02/1925","28/01/1865","1952",1919-07-25,1925-02-28,0,1,0,0,0,"M",1865-01-28,1865,NA,1952
"1929","FIN-1925","A2.9-5785",375,"FIN","Relander","01/03/1925","28/02/1931","31/05/1883","1942",1925-03-01,1931-02-28,0,1,0,0,0,"M",1883-05-31,1883,NA,1942
"1930","FIN-1931","A2.9-5788",375,"FIN","Svinhufud","01/03/1931","28/02/1937","15/12/1861","1944",1931-03-01,1937-02-28,0,1,0,1,0,"M",1861-12-15,1861,NA,1944
"1931","FIN-1937","A2.9-5791",375,"FIN","Kallio","01/03/1937","28/11/1940","10/04/1873","1940",1937-03-01,1940-11-28,0,2.1,0,0,-777,"M",1873-04-10,1873,NA,1940
"1932","FIN-1940","A2.9-5794",375,"FIN","Ryti","19/12/1940","01/08/1944","03/02/1889","1956",1940-12-19,1944-08-01,0,1,0,0,2,"M",1889-02-03,1889,NA,1956
"1933","FIN-1944","A2.9-5797",375,"FIN","Mannerheim","04/08/1944","04/03/1946","04/06/1867","27/01/1951",1944-08-04,1946-03-04,0,2.1,0,1,1,"M",1867-06-04,1867,1951-01-27,1951
"1934","FIN-1946","A2.9-5800",375,"FIN","Paasikivi","09/03/1946","29/02/1956","27/11/1879","14/12/1956",1946-03-09,1956-02-29,0,1,0,0,0,"M",1879-11-27,1879,1956-12-14,1956
"1935","FIN-1956","A2.9-5803",375,"FIN","Kekkonen","01/03/1956","11/09/1981","3/9/1900","31/08/1986",1956-03-01,1981-09-11,0,2.1,0,0,0,"M",1900-09-03,1900,1986-08-31,1986
"1936","FIN-1981","A2.9-5806",375,"FIN","Koivisto","11/09/1981","01/03/1994","25/11/1923","-777",1981-09-11,1994-03-01,0,1,0,0,0,"M",1923-11-25,1923,NA,-777
"1937","FIN-1994","A2.9-5809",375,"FIN","Marthi Ahtisaari","01/03/1994","01/03/2000","23/06/1937","-777",1994-03-01,2000-03-01,0,1,0,0,0,"M",1937-06-23,1937,NA,-777
"1938","FIN-2000","A2.9-5812",375,"FIN","Halonen","01/03/2000","31/12/2004","24/12/1943","-777",2000-03-01,2004-12-31,0,-888,0,0,-888,"F",1943-12-24,1943,NA,-777
"1939","SWD-1872","A2.9-5815",380,"SWD","Oscar II","18/09/1872","20/03/1876","21/01/1829","08/12/1907",1872-09-18,1876-03-20,0,1,0,0,0,"M",1829-01-21,1829,1907-12-08,1907
"1940","SWD-1876","A2.9-5818",380,"SWD","de Geer af Finspång","20/03/1876","19/04/1880","1818","1896",1876-03-20,1880-04-19,0,1,0,0,0,"M",NA,1818,NA,1896
"1941","SWD-1880","A2.9-5821",380,"SWD","Posse","19/04/1880","13/06/1883","1820","1901",1880-04-19,1883-06-13,0,1,0,0,0,"M",NA,1820,NA,1901
"1942","SWD-1883","A2.9-5824",380,"SWD","Thyselius","13/06/1883","16/05/1884","08/06/1811","11/01/1891",1883-06-13,1884-05-16,0,1,0,0,0,"M",1811-06-08,1811,1891-01-11,1891
"1943","SWD-1884","A2.9-5827",380,"SWD","Themptander","16/05/1884","06/02/1888","14/02/1844","30/01/1897",1884-05-16,1888-02-06,0,1,0,0,0,"M",1844-02-14,1844,1897-01-30,1897
"1944","SWD-1888","A2.9-5830",380,"SWD","Bildt","06/02/1888","12/10/1889","1820","1894",1888-02-06,1889-10-12,0,1,0,0,0,"M",NA,1820,NA,1894
"1945","SWD-1889","A2.9-5833",380,"SWD","Akerhjelm","12/10/1889","15/07/1891","1833","1900",1889-10-12,1891-07-15,0,1,0,0,0,"M",NA,1833,NA,1900
"1946","SWD-1891","A2.9-5836",380,"SWD","Bostrom","15/07/1891","12/09/1900","11/02/1842","1907",1891-07-15,1900-09-12,0,1,0,0,0,"M",1842-02-11,1842,NA,1907
"1947","SWD-1900","A2.9-5839",380,"SWD","Otter","12/09/1900","05/07/1902","11/04/1833","1910",1900-09-12,1902-07-05,0,1,0,0,0,"M",1833-04-11,1833,NA,1910
"1948","SWD-1902","A2.9-5842",380,"SWD","Bostrom","05/07/1902","13/04/1905","11/02/1842","1907",1902-07-05,1905-04-13,0,1,0,1,0,"M",1842-02-11,1842,NA,1907
"1949","SWD-1905-1","A2.9-5845",380,"SWD","Ramstedt","13/04/1905","02/08/1905","1852","1935",1905-04-13,1905-08-02,0,1,0,0,0,"M",NA,1852,NA,1935
"1950","SWD-1905-2","A2.9-5848",380,"SWD","Lundeberg","02/08/1905","07/11/1905","14/07/1842","1911",1905-08-02,1905-11-07,0,1,0,0,0,"M",1842-07-14,1842,NA,1911
"1951","SWD-1905-3","A2.9-5851",380,"SWD","Staaf","07/11/1905","29/05/1906","21/01/1860","1915",1905-11-07,1906-05-29,0,1,0,0,0,"M",1860-01-21,1860,NA,1915
"1952","SWD-1906","A2.9-5854",380,"SWD","Lindman","29/05/1906","30/09/1911","19/09/1862","1936",1906-05-29,1911-09-30,0,1,0,0,0,"M",1862-09-19,1862,NA,1936
"1953","SWD-1911","A2.9-5857",380,"SWD","Staaf","07/10/1911","17/02/1914","21/01/1860","1915",1911-10-07,1914-02-17,0,1,0,1,0,"M",1860-01-21,1860,NA,1915
"1954","SWD-1914","A2.9-5860",380,"SWD","Hammarskjold","17/02/1914","29/03/1917","04/02/1862","12/10/1953",1914-02-17,1917-03-29,0,1,0,0,0,"M",1862-02-04,1862,1953-10-12,1953
"1955","SWD-1917-1","A2.9-5863",380,"SWD","Swartz","29/03/1917","19/10/1917","09/06/1858","1926",1917-03-29,1917-10-19,0,1,0,0,0,"M",1858-06-09,1858,NA,1926
"1956","SWD-1917-2","A2.9-5866",380,"SWD","Eden","19/10/1917","06/03/1920","25/08/1871","16/06/1945",1917-10-19,1920-03-06,0,1,0,0,0,"M",1871-08-25,1871,1945-06-16,1945
"1957","SWD-1920-1","A2.9-5869",380,"SWD","Branting","06/03/1920","22/10/1920","23/11/1860","24/02/1925",1920-03-06,1920-10-22,0,1,0,0,0,"M",1860-11-23,1860,1925-02-24,1925
"1958","SWD-1920-2","A2.9-5872",380,"SWD","de Geer","27/10/1920","23/02/1921","27/11/1854","1935",1920-10-27,1921-02-23,0,1,0,0,0,"M",1854-11-27,1854,NA,1935
"1959","SWD-1921-1","A2.9-5875",380,"SWD","von Sydow","23/02/1921","13/10/1921","12/07/1873","1936",1921-02-23,1921-10-13,0,1,0,0,0,"M",1873-07-12,1873,NA,1936
"1960","SWD-1921-2","A2.9-5878",380,"SWD","Branting","13/10/1921","06/04/1923","23/11/1860","24/02/1925",1921-10-13,1923-04-06,0,1,0,1,0,"M",1860-11-23,1860,1925-02-24,1925
"1961","SWD-1923","A2.9-5881",380,"SWD","Trygger","06/04/1923","18/10/1924","20/10/1857","24/09/1943",1923-04-06,1924-10-18,0,1,0,0,0,"M",1857-10-20,1857,1943-09-24,1943
"1962","SWD-1924","A2.9-5884",380,"SWD","Branting","18/10/1924","24/01/1925","23/11/1860","24/02/1925",1924-10-18,1925-01-24,0,2.1,0,2,-777,"M",1860-11-23,1860,1925-02-24,1925
"1963","SWD-1925","A2.9-5887",380,"SWD","Sandler","24/01/1925","02/06/1926","29/01/1884","1964",1925-01-24,1926-06-02,0,1,0,0,0,"M",1884-01-29,1884,NA,1964
"1964","SWD-1926","A2.9-5890",380,"SWD","Ekman","06/06/1926","26/09/1928","05/10/1872","1945",1926-06-06,1928-09-26,0,1,0,0,0,"M",1872-10-05,1872,NA,1945
"1965","SWD-1928","A2.9-5893",380,"SWD","Lindman","01/10/1928","02/06/1930","19/09/1862","1936",1928-10-01,1930-06-02,0,1,0,1,0,"M",1862-09-19,1862,NA,1936
"1966","SWD-1930","A2.9-5896",380,"SWD","Ekman","06/06/1930","06/08/1932","05/10/1872","1945",1930-06-06,1932-08-06,0,1,0,1,0,"M",1872-10-05,1872,NA,1945
"1967","SWD-1932-1","A2.9-5899",380,"SWD","Hamrin","06/08/1932","19/09/1932","14/01/1875","27/11/1937",1932-08-06,1932-09-19,0,1,0,0,0,"M",1875-01-14,1875,1937-11-27,1937
"1968","SWD-1932-2","A2.9-5902",380,"SWD","Hansson","24/09/1932","15/06/1936","28/10/1885","06/10/1946",1932-09-24,1936-06-15,0,1,0,0,0,"M",1885-10-28,1885,1946-10-06,1946
"1969","SWD-1936-1","A2.9-5905",380,"SWD","Pehrsson-Bramst","19/06/1936","23/09/1936","19/08/1883","19/02/1954",1936-06-19,1936-09-23,0,1,0,0,0,"M",1883-08-19,1883,1954-02-19,1954
"1970","SWD-1936-2","A2.9-5908",380,"SWD","Hansson","28/09/1936","06/10/1946","28/10/1885","06/10/1946",1936-09-28,1946-10-06,0,2,0,1,-777,"M",1885-10-28,1885,1946-10-06,1946
"1971","SWD-1946","A2.9-5911",380,"SWD","Erlander","10/10/1946","09/10/1969","16/06/1901","21/06/1985",1946-10-10,1969-10-09,0,1,0,0,0,"M",1901-06-16,1901,1985-06-21,1985
"1972","SWD-1969","A2.9-5914",380,"SWD","Palme","14/10/1969","20/09/1976","30/01/1927","28/02/1986",1969-10-14,1976-09-20,0,1,0,0,0,"M",1927-01-30,1927,1986-02-28,1986
"1973","SWD-1976","A2.9-5917",380,"SWD","Falldin","04/10/1976","18/10/1978","24/04/1926","-777",1976-10-04,1978-10-18,0,1,0,0,0,"M",1926-04-24,1926,NA,-777
"1974","SWD-1978","A2.9-5920",380,"SWD","Ullsten","18/10/1978","09/10/1979","23/06/1931","-777",1978-10-18,1979-10-09,0,1,0,0,0,"M",1931-06-23,1931,NA,-777
"1975","SWD-1979","A2.9-5923",380,"SWD","Falldin","09/10/1979","07/10/1982","24/04/1926","-777",1979-10-09,1982-10-07,0,1,0,1,0,"M",1926-04-24,1926,NA,-777
"1976","SWD-1982","A2.9-5926",380,"SWD","Palme","07/10/1982","28/02/1986","30/01/1927","28/02/1986",1982-10-07,1986-02-28,0,3,11,1,3,"M",1927-01-30,1927,1986-02-28,1986
"1977","SWD-1986","A2.9-5929",380,"SWD","Carlsson","12/03/1986","30/10/1991","9/11/1934","-777",1986-03-12,1991-10-30,0,1,0,0,0,"M",1934-11-09,1934,NA,-777
"1978","SWD-1991","A2.9-5932",380,"SWD","Bildt","30/10/1991","07/10/1994","15/07/1949","-777",1991-10-30,1994-10-07,0,1,0,0,0,"M",1949-07-15,1949,NA,-777
"1979","SWD-1994","A2.9-5935",380,"SWD","Carlsson","07/10/1994","21/03/1996","9/11/1934","-777",1994-10-07,1996-03-21,0,1,0,1,0,"M",1934-11-09,1934,NA,-777
"1980","SWD-1996","A2.9-5938",380,"SWD","Persson","21/03/1996","31/12/2004","20/01/1949","-777",1996-03-21,2004-12-31,0,-888,0,0,-888,"M",1949-01-20,1949,NA,-777
"1981","NOR-1905","A2.9-5941",385,"NOR","Michelsen","02/03/1905","28/10/1907","15/03/1857","28/06/1925",1905-03-02,1907-10-28,0,1,0,0,0,"M",1857-03-15,1857,1925-06-28,1925
"1982","NOR-1907","A2.9-5944",385,"NOR","Lovland","28/10/1907","13/03/1908","03/02/1857","1922",1907-10-28,1908-03-13,0,1,0,0,0,"M",1857-02-03,1857,NA,1922
"1983","NOR-1908","A2.9-5947",385,"NOR","Knudsen","19/03/1908","01/02/1910","19/09/1848","1928",1908-03-19,1910-02-01,0,1,0,0,0,"M",1848-09-19,1848,NA,1928
"1984","NOR-1910","A2.9-5950",385,"NOR","Konow","01/02/1910","19/02/1912","1845","1932",1910-02-01,1912-02-19,0,1,0,0,0,"M",NA,1845,NA,1932
"1985","NOR-1912","A2.9-5953",385,"NOR","Bratlie","19/02/1912","29/01/1913","17/01/1856","1939",1912-02-19,1913-01-29,0,1,0,0,0,"M",1856-01-17,1856,NA,1939
"1986","NOR-1913","A2.9-5956",385,"NOR","Knudsen","29/01/1913","20/06/1920","19/09/1848","1928",1913-01-29,1920-06-20,0,1,0,1,0,"M",1848-09-19,1848,NA,1928
"1987","NOR-1920","A2.9-5959",385,"NOR","Halvorsen","20/06/1920","22/06/1921","28/05/1872","1923",1920-06-20,1921-06-22,0,1,0,0,0,"M",1872-05-28,1872,NA,1923
"1988","NOR-1921","A2.9-5962",385,"NOR","Blehr","22/06/1921","05/03/1923","17/02/1847","1927",1921-06-22,1923-03-05,0,1,0,1,0,"M",1847-02-17,1847,NA,1927
"1989","NOR-1923-1","A2.9-5965",385,"NOR","Halvorsen","05/03/1923","23/05/1923","28/05/1872","1923",1923-03-05,1923-05-23,0,2,0,1,-777,"M",1872-05-28,1872,NA,1923
"1990","NOR-1923-2","A2.9-5968",385,"NOR","Berge","23/05/1923","25/06/1924","20/08/1851","1936",1923-05-23,1924-06-25,0,1,0,0,0,"M",1851-08-20,1851,NA,1936
"1991","NOR-1924","A2.9-5971",385,"NOR","Mowinckel","25/06/1924","03/03/1926","22/10/1870","30/09/1943",1924-06-25,1926-03-03,0,1,0,0,0,"M",1870-10-22,1870,1943-09-30,1943
"1992","NOR-1926","A2.9-5974",385,"NOR","Lykke","03/03/1926","20/01/1928","09/01/1872","1949",1926-03-03,1928-01-20,0,1,0,0,0,"M",1872-01-09,1872,NA,1949
"1993","NOR-1928-1","A2.9-5977",385,"NOR","Hornsrud","20/01/1928","15/02/1928","15/11/1859","1960",1928-01-20,1928-02-15,0,1,0,0,0,"M",1859-11-15,1859,NA,1960
"1994","NOR-1928-2","A2.9-5980",385,"NOR","Mowinckel","15/02/1928","09/05/1931","22/10/1870","30/09/1943",1928-02-15,1931-05-09,0,1,0,1,0,"M",1870-10-22,1870,1943-09-30,1943
"1995","NOR-1931","A2.9-5983",385,"NOR","Kolstad","11/05/1931","01/02/1932","1878","1932",1931-05-11,1932-02-01,0,2.1,0,0,-777,"M",NA,1878,NA,1932
"1996","NOR-1932-1","A2.9-5986",385,"NOR","Braadland","01/02/1932","14/03/1932","1879","1966",1932-02-01,1932-03-14,0,1,0,0,0,"M",NA,1879,NA,1966
"1997","NOR-1932-2","A2.9-5989",385,"NOR","Hundseid","14/03/1932","25/02/1933","1883","1965",1932-03-14,1933-02-25,0,1,0,0,0,"M",NA,1883,NA,1965
"1998","NOR-1933","A2.9-5992",385,"NOR","Mowinckel","02/03/1933","16/03/1935","22/10/1870","30/09/1943",1933-03-02,1935-03-16,0,1,0,2,0,"M",1870-10-22,1870,1943-09-30,1943
"1999","NOR-1935","A2.9-5995",385,"NOR","Nygaardsvold","19/03/1935","09/04/1940","06/09/1879","13/03/1952",1935-03-19,1940-04-09,0,4,9,0,1,"M",1879-09-06,1879,1952-03-13,1952
"2000","NOR-1940","A2.9-5998",385,"NOR","Quisling","09/04/1940","07/05/1945","18/07/1887","24/10/1945",1940-04-09,1945-05-07,2,4,9,0,0,"M",1887-07-18,1887,1945-10-24,1945
"2001","NOR-1945-1","A2.9-6001",385,"NOR","Nygaardsvold","07/05/1945","25/06/1945","06/09/1879","13/03/1952",1945-05-07,1945-06-25,0,1,0,1,0,"M",1879-09-06,1879,1952-03-13,1952
"2002","NOR-1945-2","A2.9-6004",385,"NOR","Gerhardsen","26/06/1945","13/11/1951","10/05/1897","19/09/1987",1945-06-26,1951-11-13,0,1,0,0,0,"M",1897-05-10,1897,1987-09-19,1987
"2003","NOR-1951","A2.9-6007",385,"NOR","Torp","13/11/1951","14/01/1955","08/06/1893","1958",1951-11-13,1955-01-14,0,1,0,0,0,"M",1893-06-08,1893,NA,1958
"2004","NOR-1955","A2.9-6010",385,"NOR","Gerhardsen","22/01/1955","23/08/1963","10/05/1897","19/09/1987",1955-01-22,1963-08-23,0,1,0,1,0,"M",1897-05-10,1897,1987-09-19,1987
"2005","NOR-1963-1","A2.9-6013",385,"NOR","Lyng","27/08/1963","25/09/1963","22/08/1905","1978",1963-08-27,1963-09-25,0,1,0,0,0,"M",1905-08-22,1905,NA,1978
"2006","NOR-1963-2","A2.9-6016",385,"NOR","Gerhardsen","25/09/1963","12/10/1965","10/05/1897","19/09/1987",1963-09-25,1965-10-12,0,1,0,2,0,"M",1897-05-10,1897,1987-09-19,1987
"2007","NOR-1965","A2.9-6019",385,"NOR","Borten","12/10/1965","16/03/1971","3/4/1913","20/01/2005",1965-10-12,1971-03-16,0,1,0,0,0,"M",1913-04-03,1913,2005-01-20,2005
"2008","NOR-1971","A2.9-6022",385,"NOR","Bratteli","16/03/1971","17/10/1972","11/1/1910","20/11/1984",1971-03-16,1972-10-17,0,1,0,0,0,"M",1910-01-11,1910,1984-11-20,1984
"2009","NOR-1972","A2.9-6025",385,"NOR","Korvald","17/10/1972","15/10/1973","29/04/1916","2006",1972-10-17,1973-10-15,0,1,0,0,0,"M",1916-04-29,1916,NA,2006
"2010","NOR-1973","A2.9-6028",385,"NOR","Bratteli","15/10/1973","09/01/1976","11/1/1910","20/11/1984",1973-10-15,1976-01-09,0,1,0,1,0,"M",1910-01-11,1910,1984-11-20,1984
"2011","NOR-1976","A2.9-6031",385,"NOR","Nordli","09/01/1976","04/02/1981","3/11/1927","-777",1976-01-09,1981-02-04,0,2.1,0,0,0,"M",1927-11-03,1927,NA,-777
"2012","NOR-1981-1","A2.9-6034",385,"NOR","Brundtland","04/02/1981","14/10/1981","20/04/1939","-777",1981-02-04,1981-10-14,0,1,0,0,0,"F",1939-04-20,1939,NA,-777
"2013","NOR-1981-2","A2.9-6037",385,"NOR","Willoch","14/10/1981","09/05/1986","3/10/1928","-777",1981-10-14,1986-05-09,0,1,0,0,0,"M",1928-10-03,1928,NA,-777
"2014","NOR-1986","A2.9-6040",385,"NOR","Brundtland","09/05/1986","16/10/1989","20/04/1939","-777",1986-05-09,1989-10-16,0,1,0,1,0,"F",1939-04-20,1939,NA,-777
"2015","NOR-1989","A2.9-6043",385,"NOR","Syse","16/10/1989","03/11/1990","25/11/1930","1997",1989-10-16,1990-11-03,0,1,0,0,0,"M",1930-11-25,1930,NA,1997
"2016","NOR-1990","A2.9-6046",385,"NOR","Brundtland","03/11/1990","25/10/1996","20/04/1939","-777",1990-11-03,1996-10-25,0,1,0,2,0,"F",1939-04-20,1939,NA,-777
"2017","NOR-1996","A2.9-6049",385,"NOR","Jagland","25/10/1996","17/10/1997","5/11/1950","-777",1996-10-25,1997-10-17,0,1,0,0,0,"M",1950-11-05,1950,NA,-777
"2018","NOR-1997","A2.9-6052",385,"NOR","Bondevik","17/10/1997","30/08/1998","3/9/1947","-777",1997-10-17,1998-08-30,0,1,0,0,0,"M",1947-09-03,1947,NA,-777
"2019","NOR-1998-1","A2.9-6055",385,"NOR","Lahnstein","30/08/1998","23/09/1998","1949","-777",1998-08-30,1998-09-23,0,1,0,0,0,"M",NA,1949,NA,-777
"2020","NOR-1998-2","A2.9-6058",385,"NOR","Bondevik","24/09/1998","17/03/2000","3/9/1947","-777",1998-09-24,2000-03-17,0,1,0,1,0,"M",1947-09-03,1947,NA,-777
"2021","NOR-2000","A2.9-6061",385,"NOR","Stoltenberg","17/03/2000","19/10/2001","1959","-777",2000-03-17,2001-10-19,0,1,0,0,0,"M",NA,1959,NA,-777
"2022","NOR-2001","A2.9-6064",385,"NOR","Bondevik","19/10/2001","31/12/2004","3/9/1947","-777",2001-10-19,2004-12-31,0,-888,0,2,-888,"M",1947-09-03,1947,NA,-777
"2023","DEN-1874","A2.9-6067",390,"DEN","Fonnesbech","14/07/1874","11/06/1875","07/07/1817","1880",1874-07-14,1875-06-11,0,1,0,0,0,"M",1817-07-07,1817,NA,1880
"2024","DEN-1875","A2.9-6070",390,"DEN","Estrup","11/06/1875","07/08/1894","06/04/1825","24/12/1913",1875-06-11,1894-08-07,0,1,0,0,0,"M",1825-04-06,1825,1913-12-24,1913
"2025","DEN-1894","A2.9-6073",390,"DEN","Reedtz-Thott","07/08/1894","23/05/1897","1839","1923",1894-08-07,1897-05-23,0,1,0,0,0,"M",NA,1839,NA,1923
"2026","DEN-1897","A2.9-6076",390,"DEN","Horring","23/05/1897","24/04/1900","17/08/1842","1909",1897-05-23,1900-04-24,0,1,0,0,0,"M",1842-08-17,1842,NA,1909
"2027","DEN-1900","A2.9-6079",390,"DEN","Sehested","24/04/1900","24/07/1901","16/11/1842","1924",1900-04-24,1901-07-24,0,1,0,0,0,"M",1842-11-16,1842,NA,1924
"2028","DEN-1901","A2.9-6082",390,"DEN","Deuntzer","24/07/1901","14/01/1905","21/05/1845","1918",1901-07-24,1905-01-14,0,1,0,0,0,"M",1845-05-21,1845,NA,1918
"2029","DEN-1905","A2.9-6085",390,"DEN","Christensen","14/01/1905","12/10/1908","21/11/1856","1930",1905-01-14,1908-10-12,0,1,0,0,0,"M",1856-11-21,1856,NA,1930
"2030","DEN-1908","A2.9-6088",390,"DEN","Neergaard","12/10/1908","16/08/1909","27/04/1854","1936",1908-10-12,1909-08-16,0,1,0,0,0,"M",1854-04-27,1854,NA,1936
"2031","DEN-1909-1","A2.9-6091",390,"DEN","J. Holstein","16/08/1909","28/10/1909","10/06/1839","1912",1909-08-16,1909-10-28,0,1,0,0,0,"M",1839-06-10,1839,NA,1912
"2032","DEN-1909-2","A2.9-6094",390,"DEN","Zahle","28/10/1909","05/07/1910","19/01/1866","1946",1909-10-28,1910-07-05,0,1,0,0,0,"M",1866-01-19,1866,NA,1946
"2033","DEN-1910","A2.9-6097",390,"DEN","Bernsten","05/07/1910","21/06/1913","12/06/1844","1927",1910-07-05,1913-06-21,0,1,0,0,0,"M",1844-06-12,1844,NA,1927
"2034","DEN-1913","A2.9-6100",390,"DEN","Zahle","21/06/1913","30/03/1920","19/01/1866","1946",1913-06-21,1920-03-30,0,1,0,1,0,"M",1866-01-19,1866,NA,1946
"2035","DEN-1920-1","A2.9-6103",390,"DEN","Liebe","30/03/1920","05/04/1920","24/05/1860","1929",1920-03-30,1920-04-05,0,1,0,0,0,"M",1860-05-24,1860,NA,1929
"2036","DEN-1920-2","A2.9-6106",390,"DEN","Friis","05/04/1920","05/05/1920","16/08/1870","1944",1920-04-05,1920-05-05,0,1,0,0,0,"M",1870-08-16,1870,NA,1944
"2037","DEN-1920-3","A2.9-6109",390,"DEN","Neergaard","05/05/1920","23/04/1924","27/04/1854","1936",1920-05-05,1924-04-23,0,1,0,1,0,"M",1854-04-27,1854,NA,1936
"2038","DEN-1924","A2.9-6112",390,"DEN","Stauning","23/04/1924","14/12/1926","26/10/1873","1942",1924-04-23,1926-12-14,0,1,0,0,0,"M",1873-10-26,1873,NA,1942
"2039","DEN-1926","A2.9-6115",390,"DEN","Madsen-Mygdat","14/12/1926","25/04/1929","24/12/1876","1943",1926-12-14,1929-04-25,0,1,0,0,0,"M",1876-12-24,1876,NA,1943
"2040","DEN-1929","A2.9-6118",390,"DEN","Stauning","30/04/1929","03/05/1942","26/10/1873","1942",1929-04-30,1942-05-03,0,2,0,1,-777,"M",1873-10-26,1873,NA,1942
"2041","DEN-1942-1","A2.9-6121",390,"DEN","Buhl","03/05/1942","9/11/1942","16/10/1881","18/12/1954",1942-05-03,1942-11-09,0,1,0,0,0,"M",1881-10-16,1881,1954-12-18,1954
"2042","DEN-1942-2","A2.9-6124",390,"DEN","Scavenius","9/11/1942","30/08/1943","13/06/1877","1962",1942-11-09,1943-08-30,0,4,9,0,0,"M",1877-06-13,1877,NA,1962
"2043","DEN-1945-1","A2.9-6127",390,"DEN","Buhl","05/05/1945","07/11/1945","16/10/1881","18/12/1954",1945-05-05,1945-11-07,0,1,0,0,0,"M",1881-10-16,1881,1954-12-18,1954
"2044","DEN-1945-2","A2.9-6130",390,"DEN","Kristensen","08/11/1945","04/10/1947","26/10/1880","29/09/1962",1945-11-08,1947-10-04,0,1,0,1,0,"M",1880-10-26,1880,1962-09-29,1962
"2045","DEN-1947","A2.9-6133",390,"DEN","Hedtoft","12/11/1947","25/10/1950","21/04/1903","29/01/1955",1947-11-12,1950-10-25,0,1,0,0,0,"M",1903-04-21,1903,1955-01-29,1955
"2046","DEN-1950","A2.9-6136",390,"DEN","Eriksen","28/10/1950","30/09/1953","20/11/1902","07/10/1972",1950-10-28,1953-09-30,0,1,0,0,0,"M",1902-11-20,1902,1972-10-07,1972
"2047","DEN-1953","A2.9-6139",390,"DEN","Hedtoft","30/09/1953","29/01/1955","21/04/1903","29/01/1955",1953-09-30,1955-01-29,0,2,0,1,-777,"M",1903-04-21,1903,1955-01-29,1955
"2048","DEN-1955","A2.9-6142",390,"DEN","Hansen","01/02/1955","19/02/1960","8/11/1906","19/02/1960",1955-02-01,1960-02-19,0,2,0,0,-777,"M",1906-11-08,1906,1960-02-19,1960
"2049","DEN-1960","A2.9-6145",390,"DEN","Kampmann","19/02/1960","03/09/1962","21/07/1910","03/06/1976",1960-02-19,1962-09-03,0,2.1,0,0,0,"M",1910-07-21,1910,1976-06-03,1976
"2050","DEN-1962","A2.9-6148",390,"DEN","Krag","03/09/1962","18/02/1968","15/09/1914","22/06/1978",1962-09-03,1968-02-18,0,1,0,0,0,"M",1914-09-15,1914,1978-06-22,1978
"2051","DEN-1968","A2.9-6151",390,"DEN","Baunsgaard","18/02/1968","06/10/1971","26/02/1920","30/06/1989",1968-02-18,1971-10-06,0,1,0,0,0,"M",1920-02-26,1920,1989-06-30,1989
"2052","DEN-1971","A2.9-6154",390,"DEN","Krag","11/10/1971","03/10/1972","15/09/1914","22/06/1978",1971-10-11,1972-10-03,0,1,0,1,0,"M",1914-09-15,1914,1978-06-22,1978
"2053","DEN-1972","A2.9-6157",390,"DEN","Jorgensen","05/10/1972","19/12/1973","12/7/1923","-777",1972-10-05,1973-12-19,0,1,0,0,0,"M",1923-07-12,1923,NA,-777
"2054","DEN-1973","A2.9-6160",390,"DEN","Hartling","19/12/1973","29/01/1975","14/08/1914","30/04/2000",1973-12-19,1975-01-29,0,1,0,0,0,"M",1914-08-14,1914,2000-04-30,2000
"2055","DEN-1975","A2.9-6163",390,"DEN","Jorgensen","13/02/1975","10/09/1982","12/7/1923","-777",1975-02-13,1982-09-10,0,1,0,1,0,"M",1923-07-12,1923,NA,-777
"2056","DEN-1982","A2.9-6166",390,"DEN","Schluter","10/09/1982","25/01/1993","3/4/1929","-777",1982-09-10,1993-01-25,0,1,0,0,0,"M",1929-04-03,1929,NA,-777
"2057","DEN-1993","A2.9-6169",390,"DEN","Nyrup Rasmussen","25/01/1993","27/11/2001","15/06/1943","-777",1993-01-25,2001-11-27,0,1,0,0,0,"M",1943-06-15,1943,NA,-777
"2058","DEN-2001","A2.9-6172",390,"DEN","Fogh Rasmussen","27/11/2001","31/12/2004","26/01/1953","-777",2001-11-27,2004-12-31,0,-888,0,0,-888,"M",1953-01-26,1953,NA,-777
"2059","ICE-1944-1","A2.9-6175",395,"ICE","Thordarson","17/05/1944","21/10/1944","1879","1963",1944-05-17,1944-10-21,0,1,0,0,0,"M",NA,1879,NA,1963
"2060","ICE-1944-2","A2.9-6178",395,"ICE","Thors","21/10/1944","03/02/1947","19/01/1892","1964",1944-10-21,1947-02-03,0,1,0,0,0,"M",1892-01-19,1892,NA,1964
"2061","ICE-1947","A2.9-6181",395,"ICE","Stefansson","03/02/1947","06/12/1949","20/07/1894","1980",1947-02-03,1949-12-06,0,1,0,0,0,"M",1894-07-20,1894,NA,1980
"2062","ICE-1949","A2.9-6184",395,"ICE","Thors","06/12/1949","14/03/1950","19/01/1892","1964",1949-12-06,1950-03-14,0,1,0,1,0,"M",1892-01-19,1892,NA,1964
"2063","ICE-1950","A2.9-6187",395,"ICE","Steinthorsson","14/03/1950","13/09/1953","12/02/1893","1966",1950-03-14,1953-09-13,0,1,0,0,0,"M",1893-02-12,1893,NA,1966
"2064","ICE-1953","A2.9-6190",395,"ICE","Thors","13/09/1953","21/07/1956","19/01/1892","1964",1953-09-13,1956-07-21,0,1,0,2,0,"M",1892-01-19,1892,NA,1964
"2065","ICE-1956","A2.9-6193",395,"ICE","Jonasson","21/07/1956","04/12/1958","25/12/1896","1976",1956-07-21,1958-12-04,0,1,0,0,0,"M",1896-12-25,1896,NA,1976
"2066","ICE-1958","A2.9-6196",395,"ICE","Jonsson","23/12/1958","20/11/1959","27/10/1902","1986",1958-12-23,1959-11-20,0,1,0,0,0,"M",1902-10-27,1902,NA,1986
"2067","ICE-1959","A2.9-6199",395,"ICE","Thors","20/11/1959","12/11/1963","19/01/1892","1964",1959-11-20,1963-11-12,0,2.1,0,3,0,"M",1892-01-19,1892,NA,1964
"2068","ICE-1963","A2.9-6202",395,"ICE","Benediktsson","14/11/1963","10/07/1970","30/04/1908","1970",1963-11-14,1970-07-10,0,2,0,0,-777,"M",1908-04-30,1908,NA,1970
"2069","ICE-1970","A2.9-6205",395,"ICE","Hafstein","10/07/1970","14/07/1971","19/09/1915","1980",1970-07-10,1971-07-14,0,1,0,0,0,"M",1915-09-19,1915,NA,1980
"2070","ICE-1971","A2.9-6208",395,"ICE","Johannesson","14/07/1971","28/08/1974","1/3/1913","1984",1971-07-14,1974-08-28,0,1,0,0,0,"M",1913-03-01,1913,NA,1984
"2071","ICE-1974","A2.9-6211",395,"ICE","Hallgrimsson","29/08/1974","31/08/1978","16/12/1925","1990",1974-08-29,1978-08-31,0,1,0,0,0,"M",1925-12-16,1925,NA,1990
"2072","ICE-1978","A2.9-6214",395,"ICE","Johannesson","31/08/1978","15/10/1979","1/3/1913","1984",1978-08-31,1979-10-15,0,1,0,1,0,"M",1913-03-01,1913,NA,1984
"2073","ICE-1979","A2.9-6217",395,"ICE","Groendal","15/10/1979","08/02/1980","7/7/1924","-777",1979-10-15,1980-02-08,0,1,0,0,0,"M",1924-07-07,1924,NA,-777
"2074","ICE-1980","A2.9-6220",395,"ICE","Thoroddsen","08/02/1980","26/05/1983","29/12/1910","1983",1980-02-08,1983-05-26,0,1,0,0,-777,"M",1910-12-29,1910,NA,1983
"2075","ICE-1983","A2.9-6223",395,"ICE","Hermannsson","26/05/1983","08/07/1987","22/06/1928","-777",1983-05-26,1987-07-08,0,1,0,0,0,"M",1928-06-22,1928,NA,-777
"2076","ICE-1987","A2.9-6226",395,"ICE","Palsson","08/07/1987","28/09/1988","29/10/1947","-777",1987-07-08,1988-09-28,0,1,0,0,0,"M",1947-10-29,1947,NA,-777
"2077","ICE-1988","A2.9-6229",395,"ICE","Hermannsson","28/09/1988","30/04/1991","22/06/1928","-777",1988-09-28,1991-04-30,0,1,0,1,0,"M",1928-06-22,1928,NA,-777
"2078","ICE-1991","A2.9-6232",395,"ICE","Oddsson","30/04/1991","15/09/2004","17/01/1948","-777",1991-04-30,2004-09-15,0,1,0,0,-999,"M",1948-01-17,1948,NA,-777
"2079","ICE-2004","A2.9-6235",395,"ICE","Halldor Asgrimsson","15/09/2004","31/12/2004","1947","-777",2004-09-15,2004-12-31,0,-888,0,0,-888,"M",NA,1947,NA,-777
"2080","CAP-1975","A2.9-6238",402,"CAP","Pires","08/07/1975","04/04/1991","1934","-777",1975-07-08,1991-04-04,0,1,0,0,0,"M",NA,1934,NA,-777
"2081","CAP-1991","A2.9-6241",402,"CAP","Veiga","04/04/1991","29/07/2000","1949","-777",1991-04-04,2000-07-29,0,1,0,0,0,"M",NA,1949,NA,-777
"2082","CAP-2000","A2.9-6244",402,"CAP","do Rosario","29/07/2000","01/02/2001","1950","-777",2000-07-29,2001-02-01,0,1,0,0,0,"M",NA,1950,NA,-777
"2083","CAP-2001","A2.9-6247",402,"CAP","Neves","01/02/2001","31/12/2004","1960","-777",2001-02-01,2004-12-31,0,-888,0,0,-888,"M",NA,1960,NA,-777
"2084","GNB-1974","A2.9-6250",404,"GNB","Cabral","10/09/1974","14/11/1980","1931","-777",1974-09-10,1980-11-14,1,3,6,0,2,"M",NA,1931,NA,-777
"2085","GNB-1980","A2.9-6253",404,"GNB","Vieira","14/11/1980","07/05/1999","1939","-777",1980-11-14,1999-05-07,1,3,6,0,1,"M",NA,1939,NA,-777
"2086","GNB-1999-1","A2.9-6256",404,"GNB","Mane","07/05/1999","14/05/1999","1940","2000",1999-05-07,1999-05-14,1,1,0,0,0,"M",NA,1940,NA,2000
"2087","GNB-1999-2","A2.9-6259",404,"GNB","Sanha","14/05/1999","17/02/2000","05/05/1947","-777",1999-05-14,2000-02-17,1,1,0,0,0,"M",1947-05-05,1947,NA,-777
"2088","GNB-2000","A2.9-6262",404,"GNB","Kumba Iala","18/02/2000","14/09/2003","1953","-777",2000-02-18,2003-09-14,0,3,6,0,0,"M",NA,1953,NA,-777
"2089","GNB-2003-1","A2.9-6265",404,"GNB","Correia Seabra","14/09/2003","28/09/2003","1947","2004",2003-09-14,2003-09-28,1,1,0,0,0,"M",NA,1947,NA,2004
"2090","GNB-2003-2","A2.9-6268",404,"GNB","Henrique Pereira Rosa","28/09/2003","31/12/2004","1946","-777",2003-09-28,2004-12-31,0,-888,0,0,-888,"M",NA,1946,NA,-777
"2091","EQG-1963","A2.9-6271",411,"EQG","Bonifacio Ondo Edu","15/12/1963","12/10/1968","-999","1969",1963-12-15,1968-10-12,0,1,0,0,3,"M",NA,NA,NA,1969
"2092","EQG-1968","A2.9-6274",411,"EQG","Macias Nguema","12/10/1968","03/08/1979","1/1/1924","29/09/1979",1968-10-12,1979-08-03,0,3,6,0,3,"M",1924-01-01,1924,1979-09-29,1979
"2093","EQG-1979","A2.9-6277",411,"EQG","Nguema Mbasogo","03/08/1979","31/12/2004","4/6/1942","-777",1979-08-03,2004-12-31,1,-888,0,0,-888,"M",1942-06-04,1942,NA,-777
"2094","GAM-1965","A2.9-6280",420,"GAM","Jawara","18/02/1965","22/07/1994","11/5/1924","-777",1965-02-18,1994-07-22,0,3,6,0,1,"M",1924-05-11,1924,NA,-777
"2095","GAM-1994","A2.9-6283",420,"GAM","Jammeh","22/07/1994","31/12/2004","25/5/1965","-777",1994-07-22,2004-12-31,1,-888,0,0,-888,"M",1965-05-25,1965,NA,-777
"2096","MLI-1960","A2.9-6286",432,"MLI","Keita","22/09/1960","19/11/1968","4/6/1915","16/05/1977",1960-09-22,1968-11-19,0,3,6,0,2,"M",1915-06-04,1915,1977-05-16,1977
"2097","MLI-1968","A2.9-6289",432,"MLI","Traore","19/11/1968","26/03/1991","15/9/1936","-777",1968-11-19,1991-03-26,1,3,6,0,2,"M",1936-09-15,1936,NA,-777
"2098","MLI-1991","A2.9-6292",432,"MLI","Amadou Toure","26/03/1991","06/06/1992","1948","-777",1991-03-26,1992-06-06,1,1,0,0,0,"M",NA,1948,NA,-777
"2099","MLI-1992","A2.9-6295",432,"MLI","Konare","06/06/1992","08/06/2002","1946","-777",1992-06-06,2002-06-08,0,1,0,0,0,"M",NA,1946,NA,-777
"2100","MLI-2002","A2.9-6298",432,"MLI","Amadou Toure","09/06/2002","31/12/2004","1948","-777",2002-06-09,2004-12-31,0,-888,0,1,-888,"M",NA,1948,NA,-777
"2101","SEN-1960","A2.9-6301",433,"SEN","Senghor","20/08/1960","31/12/1980","9/10/1906","2001",1960-08-20,1980-12-31,0,1,0,0,0,"M",1906-10-09,1906,NA,2001
"2102","SEN-1981","A2.9-6304",433,"SEN","Diouf","01/01/1981","01/04/2000","7/9/1935","-777",1981-01-01,2000-04-01,0,1,0,0,0,"M",1935-09-07,1935,NA,-777
"2103","SEN-2000","A2.9-6307",433,"SEN","Abdoulaye Wade","02/04/2000","31/12/2004","1926","-777",2000-04-02,2004-12-31,0,-888,0,0,-888,"M",NA,1926,NA,-777
"2104","BEN-1960","A2.9-6310",434,"BEN","Maga","01/01/1960","27/10/1963","10/08/1916","08/05/2000",1960-01-01,1963-10-27,0,3,6,0,2,"M",1916-08-10,1916,2000-05-08,2000
"2105","BEN-1963","A2.9-6313",434,"BEN","Soglo","28/10/1963","19/01/1964","28/6/1912","1983",1963-10-28,1964-01-19,1,1,0,0,0,"M",1912-06-28,1912,NA,1983
"2106","BEN-1964","A2.9-6316",434,"BEN","Apithy","19/01/1964","29/11/1965","8/4/1913","1989",1964-01-19,1965-11-29,1,3,6,0,2,"M",1913-04-08,1913,NA,1989
"2107","BEN-1965-1","A2.9-6319",434,"BEN","Congacou","29/11/1965","22/12/1965","1913","1994",1965-11-29,1965-12-22,1,3,6,0,2,"M",NA,1913,NA,1994
"2108","BEN-1965-2","A2.9-6322",434,"BEN","Soglo","22/12/1965","17/12/1967","28/6/1912","1983",1965-12-22,1967-12-17,1,3,6,1,2,"M",1912-06-28,1912,NA,1983
"2109","BEN-1967","A2.9-6325",434,"BEN","Alley","17/12/1967","01/08/1968","9/4/1930","1987",1967-12-17,1968-08-01,1,1,0,0,2,"M",1930-04-09,1930,NA,1987
"2110","BEN-1968","A2.9-6328",434,"BEN","Zinsou","01/08/1968","10/12/1969","23/3/1918","-777",1968-08-01,1969-12-10,1,3,6,0,2,"M",1918-03-23,1918,NA,-777
"2111","BEN-1969-1","A2.9-6331",434,"BEN","Kouandete","10/12/1969","13/12/1969","1939","2003",1969-12-10,1969-12-13,1,1,0,0,0,"M",NA,1939,NA,2003
"2112","BEN-1969-2","A2.9-6334",434,"BEN","Paul-Emile de Souza","13/12/1969","07/05/1970","1930","1999",1969-12-13,1970-05-07,1,1,0,0,0,"M",NA,1930,NA,1999
"2113","BEN-1970","A2.9-6337",434,"BEN","Maga","07/05/1970","07/04/1972","1916","2000",1970-05-07,1972-04-07,0,1,0,1,2,"M",NA,1916,NA,2000
"2114","BEN-1972-1","A2.9-6340",434,"BEN","Ahomadegbe","07/04/1972","26/10/1972","1917","2002",1972-04-07,1972-10-26,1,3,6,0,2,"M",NA,1917,NA,2002
"2115","BEN-1972-2","A2.9-6343",434,"BEN","Kerekou","27/10/1972","04/04/1991","2/9/1933","-777",1972-10-27,1991-04-04,1,1,0,0,0,"M",1933-09-02,1933,NA,-777
"2116","BEN-1991","A2.9-6346",434,"BEN","Soglo, C","04/04/1991","04/04/1996","29/11/1934","-777",1991-04-04,1996-04-04,0,1,0,0,0,"M",1934-11-29,1934,NA,-777
"2117","BEN-1996","A2.9-6349",434,"BEN","Kerekou","04/04/1996","31/12/2004","2/9/1933","-777",1996-04-04,2004-12-31,0,-888,0,1,-888,"M",1933-09-02,1933,NA,-777
"2118","MAA-1960","A2.9-6352",435,"MAA","Ould Daddah","28/11/1960","10/07/1978","25/12/1924","15/10/2003",1960-11-28,1978-07-10,0,3,6,0,2,"M",1924-12-25,1924,2003-10-15,2003
"2119","MAA-1978","A2.9-6355",435,"MAA","Ould Mohamed Salek","10/07/1978","06/04/1979","1936","-777",1978-07-10,1979-04-06,1,3,16,0,0,"M",NA,1936,NA,-777
"2120","MAA-1979-1","A2.9-6358",435,"MAA","Ould Bouceif","06/04/1979","27/05/1979","1933","1979",1979-04-06,1979-05-27,1,2,0,0,-777,"M",NA,1933,NA,1979
"2121","MAA-1979-2","A2.9-6361",435,"MAA","Ould Sidi","27/05/1979","31/05/1979","1934","1981",1979-05-27,1979-05-31,0,1,0,0,1,"M",NA,1934,NA,1981
"2122","MAA-1979-3","A2.9-6364",435,"MAA","Ould Ahmed Louly","03/06/1979","04/01/1980","1943","-777",1979-06-03,1980-01-04,0,3,16,0,0,"M",NA,1943,NA,-777
"2123","MAA-1980","A2.9-6367",435,"MAA","Ould Haidalla","04/01/1980","12/12/1984","1940","-777",1980-01-04,1984-12-12,1,3,6,0,1,"M",NA,1940,NA,-777
"2124","MAA-1984","A2.9-6370",435,"MAA","Sidi Ahmed Taya","12/12/1984","31/12/2004","1941","-777",1984-12-12,2004-12-31,1,-888,0,0,-888,"M",NA,1941,NA,-777
"2125","NIR-1960","A2.9-6373",436,"NIR","Diori","03/10/1960","15/04/1974","6/6/1916","23/04/1989",1960-10-03,1974-04-15,0,3,6,0,2,"M",1916-06-06,1916,1989-04-23,1989
"2126","NIR-1974","A2.9-6376",436,"NIR","Kountche","17/04/1974","10/11/1987","1/7/1931","10/11/1987",1974-04-17,1987-11-10,1,2,0,0,-777,"M",1931-07-01,1931,1987-11-10,1987
"2127","NIR-1987","A2.9-6379",436,"NIR","Seibou","10/11/1987","16/04/1993","1940","-777",1987-11-10,1993-04-16,0,1,0,0,0,"M",NA,1940,NA,-777
"2128","NIR-1993","A2.9-6382",436,"NIR","Ousmane","16/04/1993","27/01/1996","1950","-777",1993-04-16,1996-01-27,0,3,6,0,2,"M",NA,1950,NA,-777
"2129","NIR-1996","A2.9-6385",436,"NIR","Mainassara","27/01/1996","11/04/1999","09/05/1949","09/04/1999",1996-01-27,1999-04-11,1,3,6,0,3,"M",1949-05-09,1949,1999-04-09,1999
"2130","NIR-1999-1","A2.9-6388",436,"NIR","Wanke","11/04/1999","22/12/1999","1954","2004",1999-04-11,1999-12-22,1,1,0,0,0,"M",NA,1954,NA,2004
"2131","NIR-1999-2","A2.9-6391",436,"NIR","Mamadou","22/12/1999","31/12/2004","1938","-777",1999-12-22,2004-12-31,0,-888,0,0,-888,"M",NA,1938,NA,-777
"2132","CDI-1960","A2.9-6394",437,"CDI","Houphouet-Boigny","07/08/1960","07/12/1993","18/10/1905","07/12/1993",1960-08-07,1993-12-07,0,2,0,0,-777,"M",1905-10-18,1905,1993-12-07,1993
"2133","CDI-1993","A2.9-6397",437,"CDI","Konan Bedie","07/12/1993","25/12/1999","1934","-777",1993-12-07,1999-12-25,0,3,6,0,1,"M",NA,1934,NA,-777
"2134","CDI-1999","A2.9-6400",437,"CDI","Guei","25/12/1999","25/10/2000","16/3/1941","19/09/2002",1999-12-25,2000-10-25,1,3,2,0,1,"M",1941-03-16,1941,2002-09-19,2002
"2135","CDI-2000","A2.9-6403",437,"CDI","Laurent Gbagbo","26/10/2000","31/12/2004","31/5/1945","-777",2000-10-26,2004-12-31,1,-888,0,0,-888,"M",1945-05-31,1945,NA,-777
"2136","GUI-1958","A2.9-6406",438,"GUI","Toure","02/10/1958","26/03/1984","9/1/1922","1984",1958-10-02,1984-03-26,0,2,0,0,-777,"M",1922-01-09,1922,NA,1984
"2137","GUI-1984-1","A2.9-6409",438,"GUI","Beavogui","27/03/1984","03/04/1984","1923","1984",1984-03-27,1984-04-03,1,3,6,0,2,"M",NA,1923,NA,1984
"2138","GUI-1984-2","A2.9-6412",438,"GUI","Conte","03/04/1984","31/12/2004","1934","-777",1984-04-03,2004-12-31,1,-888,0,0,-888,"M",NA,1934,NA,-777
"2139","BFO-1960","A2.9-6415",439,"BFO","Yameogo","05/08/1960","03/01/1966","31/12/1921","1993",1960-08-05,1966-01-03,0,3,6,0,2,"M",1921-12-31,1921,NA,1993
"2140","BFO-1966","A2.9-6418",439,"BFO","Lamizana","03/01/1966","13/01/1971","1916","2005",1966-01-03,1971-01-13,1,1,0,0,0,"M",NA,1916,NA,2005
"2141","BFO-1971","A2.9-6421",439,"BFO","Gerard Kango Ouedraogo","13/01/1971","08/02/1974","1925","-777",1971-01-13,1974-02-08,0,3,6,0,-666,"M",NA,1925,NA,-777
"2142","BFO-1974","A2.9-6424",439,"BFO","Lamizana","08/02/1974","25/11/1980","1916","2005",1974-02-08,1980-11-25,1,3,6,1,2,"M",NA,1916,NA,2005
"2143","BFO-1980","A2.9-6427",439,"BFO","Zerbo","25/11/1980","07/11/1982","1932","-777",1980-11-25,1982-11-07,1,3,6,0,2,"M",NA,1932,NA,-777
"2144","BFO-1982","A2.9-6430",439,"BFO","J. P. Ouedraogo","07/11/1982","04/08/1983","1942","-777",1982-11-07,1983-08-04,1,3,6,0,2,"M",NA,1942,NA,-777
"2145","BFO-1983","A2.9-6433",439,"BFO","Sankara","04/08/1983","15/10/1987","21/12/1949","1987",1983-08-04,1987-10-15,1,3,6,0,3,"M",1949-12-21,1949,NA,1987
"2146","BFO-1987","A2.9-6436",439,"BFO","Campaore","15/10/1987","31/12/2004","3/2/1951","-777",1987-10-15,2004-12-31,1,-888,0,0,-888,"M",1951-02-03,1951,NA,-777
"2147","LBR-1872","A2.9-6439",450,"LBR","Joseph Jenkins Roberts","01/01/1872","27/06/1875","1809","1876",1872-01-01,1875-06-27,1,2.1,0,1,0,"M",NA,1809,NA,1876
"2148","LBR-1875","A2.9-6442",450,"LBR","Anthony William Gardiner","27/06/1875","03/01/1876","1820","1885",1875-06-27,1876-01-03,0,1,0,0,0,"M",NA,1820,NA,1885
"2149","LBR-1876","A2.9-6445",450,"LBR","James Spriggs Payne","03/01/1876","07/01/1878","1819","1882",1876-01-03,1878-01-07,0,1,0,1,0,"M",NA,1819,NA,1882
"2150","LBR-1878","A2.9-6448",450,"LBR","Anthony William Gardiner","07/01/1878","20/01/1883","1820","1882",1878-01-07,1883-01-20,0,1,0,1,0,"M",NA,1820,NA,1882
"2151","LBR-1883","A2.9-6451",450,"LBR","Alfred Francis Russell","20/01/1883","07/01/1884","1817","1884",1883-01-20,1884-01-07,0,1,0,0,-777,"M",NA,1817,NA,1884
"2152","LBR-1884","A2.9-6454",450,"LBR","Hilary Richard Wright Johnson","07/01/1884","04/01/1892","1837","1901",1884-01-07,1892-01-04,0,1,0,0,0,"M",NA,1837,NA,1901
"2153","LBR-1892","A2.9-6457",450,"LBR","Joseph James Cheeseman","04/01/1892","12/11/1896","1843","1896",1892-01-04,1896-11-12,0,2,0,0,-777,"M",NA,1843,NA,1896
"2154","LBR-1896","A2.9-6460",450,"LBR","William David Coleman","12/11/1896","11/12/1900","18/7/1842","1908",1896-11-12,1900-12-11,0,1,0,0,0,"M",1842-07-18,1842,NA,1908
"2155","LBR-1900","A2.9-6463",450,"LBR","Garretson Wilmot Gibson","11/12/1900","04/01/1904","20/5/1832","1910",1900-12-11,1904-01-04,0,1,0,0,0,"M",1832-05-20,1832,NA,1910
"2156","LBR-1904","A2.9-6466",450,"LBR","Arthur Barclay","04/01/1904","01/01/1912","31/7/1854","1938",1904-01-04,1912-01-01,0,1,0,0,0,"M",1854-07-31,1854,NA,1938
"2157","LBR-1912","A2.9-6469",450,"LBR","Daniel E. Howard","01/01/1912","05/01/1920","4/8/1861","1935",1912-01-01,1920-01-05,0,1,0,0,0,"M",1861-08-04,1861,NA,1935
"2158","LBR-1920","A2.9-6472",450,"LBR","Burgess King","05/01/1920","03/12/1930","1875","1961",1920-01-05,1930-12-03,0,1,0,0,0,"M",NA,1875,NA,1961
"2159","LBR-1930","A2.9-6475",450,"LBR","Edwin Barclay","03/12/1930","31/12/1943","5/1/1882","1955",1930-12-03,1943-12-31,0,1,0,0,0,"M",1882-01-05,1882,NA,1955
"2160","LBR-1944","A2.9-6478",450,"LBR","Tubman","01/01/1944","23/07/1971","29/11/1895","1971",1944-01-01,1971-07-23,0,2,0,0,-777,"M",1895-11-29,1895,NA,1971
"2161","LBR-1971","A2.9-6481",450,"LBR","Tolbert","23/07/1971","12/04/1980","13/5/1913","1980",1971-07-23,1980-04-12,0,3,6,0,3,"M",1913-05-13,1913,NA,1980
"2162","LBR-1980","A2.9-6484",450,"LBR","Doe","12/04/1980","09/09/1990","6/5/1951","09/09/1990",1980-04-12,1990-09-09,1,3,4,0,3,"M",1951-05-06,1951,1990-09-09,1990
"2163","LBR-1990","A2.9-6487",450,"LBR","Sawyer","22/11/1990","07/03/1994","15/6/1945","-777",1990-11-22,1994-03-07,2,1,0,0,0,"M",1945-06-15,1945,NA,-777
"2164","LBR-1994","A2.9-6490",450,"LBR","Kpormapkor","07/03/1994","01/09/1995","1944","-777",1994-03-07,1995-09-01,0,1,0,0,0,"M",NA,1944,NA,-777
"2165","LBR-1995","A2.9-6493",450,"LBR","Sankawulo","01/09/1995","03/09/1996","1943","-777",1995-09-01,1996-09-03,0,1,0,0,0,"M",NA,1943,NA,-777
"2166","LBR-1996","A2.9-6496",450,"LBR","Perry","03/09/1996","02/08/1997","1939","-777",1996-09-03,1997-08-02,0,1,0,0,0,"F",NA,1939,NA,-777
"2167","LBR-1997","A2.9-6499",450,"LBR","Taylor","02/08/1997","11/08/2003","1948","-777",1997-08-02,2003-08-11,0,1,0,0,1,"M",NA,1948,NA,-777
"2168","LBR-2003-1","A2.9-6502",450,"LBR","Moses Zeh Blah","11/08/2003","14/10/2003","1947","-777",2003-08-11,2003-10-14,0,1,0,0,0,"M",NA,1947,NA,-777
"2169","LBR-2003-2","A2.9-6505",450,"LBR","Bryant","14/10/2003","31/12/2004","1949","-777",2003-10-14,2004-12-31,0,-888,0,0,-888,"M",NA,1949,NA,-777
"2170","SIE-1961","A2.9-6508",451,"SIE","Margai,M","27/04/1961","28/04/1964","7/12/1895","28/04/1964",1961-04-27,1964-04-28,0,2,0,0,-777,"M",1895-12-07,1895,1964-04-28,1964
"2171","SIE-1964","A2.9-6511",451,"SIE","Margai, A","29/04/1964","17/03/1967","10/10/1910","18/12/1980",1964-04-29,1967-03-17,0,1,0,0,2,"M",1910-10-10,1910,1980-12-18,1980
"2172","SIE-1967-1","A2.9-6514",451,"SIE","Lansana","21/03/1967","23/03/1967","27/3/1922","1975",1967-03-21,1967-03-23,1,3,16,0,2,"M",1922-03-27,1922,NA,1975
"2173","SIE-1967-2","A2.9-6517",451,"SIE","Juxon-Smith","27/03/1967","19/04/1968","1933","1996",1967-03-27,1968-04-19,1,3,6,0,2,"M",NA,1933,NA,1996
"2174","SIE-1968","A2.9-6520",451,"SIE","Stevens","19/04/1968","28/11/1985","24/8/1905","1988",1968-04-19,1985-11-28,1,1,0,0,0,"M",1905-08-24,1905,NA,1988
"2175","SIE-1985","A2.9-6523",451,"SIE","Momoh","28/11/1985","29/04/1992","26/1/1937","02/08/2003",1985-11-28,1992-04-29,0,3,6,0,1,"M",1937-01-26,1937,2003-08-02,2003
"2176","SIE-1992","A2.9-6526",451,"SIE","Strasser","01/05/1992","17/01/1996","1965","-777",1992-05-01,1996-01-17,1,3,6,0,1,"M",NA,1965,NA,-777
"2177","SIE-1996-1","A2.9-6529",451,"SIE","Bio","17/01/1996","29/03/1996","1964","-777",1996-01-17,1996-03-29,1,1,0,0,0,"M",NA,1964,NA,-777
"2178","SIE-1996-2","A2.9-6532",451,"SIE","Kabbah","29/03/1996","25/05/1997","16/2/1932","-777",1996-03-29,1997-05-25,0,3,6,0,1,"M",1932-02-16,1932,NA,-777
"2179","SIE-1997","A2.9-6535",451,"SIE","Koroma","25/05/1997","12/02/1998","09/05/1960","01/06/2003",1997-05-25,1998-02-12,1,4,9,0,0,"M",1960-05-09,1960,2003-06-01,2003
"2180","SIE-1998","A2.9-6538",451,"SIE","Kabbah","10/03/1998","31/12/2004","16/2/1932","-777",1998-03-10,2004-12-31,2,-888,0,1,-888,"M",1932-02-16,1932,NA,-777
"2181","GHA-1952","A2.9-6541",452,"GHA","Nkrumah","21/03/1952","24/02/1966","21/9/1909","27/04/1972",1952-03-21,1966-02-24,0,3,6,0,1,"M",1909-09-21,1909,1972-04-27,1972
"2182","GHA-1966","A2.9-6544",452,"GHA","Ankrah","24/02/1966","03/04/1969","18/8/1915","1992",1966-02-24,1969-04-03,1,1,0,0,0,"M",1915-08-18,1915,NA,1992
"2183","GHA-1969-1","A2.9-6547",452,"GHA","Afrifa","03/04/1969","03/09/1969","24/4/1936","26/06/1979",1969-04-03,1969-09-03,0,1,0,0,0,"M",1936-04-24,1936,1979-06-26,1979
"2184","GHA-1969-2","A2.9-6550",452,"GHA","Busia","03/09/1969","13/01/1972","11/07/1913","28/08/1978",1969-09-03,1972-01-13,0,3,6,0,1,"M",1913-07-11,1913,1978-08-28,1978
"2185","GHA-1972","A2.9-6553",452,"GHA","Acheampong","13/01/1972","05/07/1978","23/9/1931","16/06/1979",1972-01-13,1978-07-05,1,3,16,0,2,"M",1931-09-23,1931,1979-06-16,1979
"2186","GHA-1978","A2.9-6556",452,"GHA","Akuffo","05/07/1978","04/06/1979","21/3/1937","26/06/1979",1978-07-05,1979-06-04,0,3,6,0,3,"M",1937-03-21,1937,1979-06-26,1979
"2187","GHA-1979-1","A2.9-6559",452,"GHA","Rawlings","05/06/1979","24/09/1979","22/6/1947","-777",1979-06-05,1979-09-24,1,1,0,0,0,"M",1947-06-22,1947,NA,-777
"2188","GHA-1979-2","A2.9-6562",452,"GHA","Limann","24/09/1979","31/12/1981","12/12/1934","23/01/1998",1979-09-24,1981-12-31,0,3,6,0,2,"M",1934-12-12,1934,1998-01-23,1998
"2189","GHA-1981","A2.9-6565",452,"GHA","Rawlings","31/12/1981","07/01/2001","22/6/1947","-777",1981-12-31,2001-01-07,1,1,0,1,0,"M",1947-06-22,1947,NA,-777
"2190","GHA-2001","A2.9-6568",452,"GHA","John Agyekum Kufuor","08/01/2001","31/12/2004","8/12/1938","-777",2001-01-08,2004-12-31,0,-888,0,0,-888,"M",1938-12-08,1938,NA,-777
"2191","TOG-1960","A2.9-6571",461,"TOG","Olympio","27/04/1960","13/01/1963","6/9/1902","13/1/1963",1960-04-27,1963-01-13,0,3,6,0,3,"M",1902-09-06,1902,1963-01-13,1963
"2192","TOG-1963","A2.9-6574",461,"TOG","Grunitzky","16/01/1963","13/01/1967","5/4/1913","1969",1963-01-16,1967-01-13,1,3,6,0,1,"M",1913-04-05,1913,NA,1969
"2193","TOG-1967-1","A2.9-6577",461,"TOG","Dadjo","13/01/1967","14/04/1967","12/8/1914","1979",1967-01-13,1967-04-14,1,3,16,0,0,"M",1914-08-12,1914,NA,1979
"2194","TOG-1967-2","A2.9-6580",461,"TOG","Eyadema","14/04/1967","31/12/2004","26/12/1937","05/02/2005",1967-04-14,2004-12-31,1,-888,0,0,-888,"M",1937-12-26,1937,2005-02-05,2005
"2195","CAO-1960","A2.9-6583",471,"CAO","Ahidjo","01/01/1960","06/11/1982","24/8/1924","30/11/1989",1960-01-01,1982-11-06,0,2.1,0,0,1,"M",1924-08-24,1924,1989-11-30,1989
"2196","CAO-1982","A2.9-6586",471,"CAO","Biya","06/11/1982","31/12/2004","13/2/1933","-777",1982-11-06,2004-12-31,0,-888,0,0,-888,"M",1933-02-13,1933,NA,-777
"2197","NIG-1960","A2.9-6589",475,"NIG","Balewa","01/10/1960","15/01/1966","1912","15/01/1966",1960-10-01,1966-01-15,0,3,6,0,3,"M",NA,1912,1966-01-15,1966
"2198","NIG-1966-1","A2.9-6592",475,"NIG","Ironsi","15/01/1966","29/07/1966","3/3/1924","1966",1966-01-15,1966-07-29,1,3,6,0,3,"M",1924-03-03,1924,NA,1966
"2199","NIG-1966-2","A2.9-6595",475,"NIG","Gowon","29/07/1966","29/07/1975","19/10/1934","-777",1966-07-29,1975-07-29,1,3,6,0,1,"M",1934-10-19,1934,NA,-777
"2200","NIG-1975","A2.9-6598",475,"NIG","Ramat Mohammed","29/07/1975","13/02/1976","8/11/1938","1976",1975-07-29,1976-02-13,1,3,6,0,3,"M",1938-11-08,1938,NA,1976
"2201","NIG-1976","A2.9-6601",475,"NIG","Obasanjo","13/02/1976","01/10/1979","5/3/1937","-777",1976-02-13,1979-10-01,1,1,0,0,0,"M",1937-03-05,1937,NA,-777
"2202","NIG-1979","A2.9-6604",475,"NIG","Shagari","01/10/1979","31/12/1983","1925","-777",1979-10-01,1983-12-31,0,3,6,0,2,"M",NA,1925,NA,-777
"2203","NIG-1983","A2.9-6607",475,"NIG","Buhari","31/12/1983","27/08/1985","17/12/1942","-777",1983-12-31,1985-08-27,1,3,6,0,2,"M",1942-12-17,1942,NA,-777
"2204","NIG-1985","A2.9-6610",475,"NIG","Babangida","27/08/1985","26/08/1993","17/8/1941","-777",1985-08-27,1993-08-26,1,1,0,0,0,"M",1941-08-17,1941,NA,-777
"2205","NIG-1993-1","A2.9-6613",475,"NIG","Shonekan","26/08/1993","17/11/1993","1936","-777",1993-08-26,1993-11-17,1,3,6,0,0,"M",NA,1936,NA,-777
"2206","NIG-1993-2","A2.9-6616",475,"NIG","Abacha","17/11/1993","08/06/1998","20/9/1943","08/06/1998",1993-11-17,1998-06-08,1,2,0,0,-777,"M",1943-09-20,1943,1998-06-08,1998
"2207","NIG-1998","A2.9-6619",475,"NIG","Abubakar","09/06/1998","29/05/1999","13/6/1942","-777",1998-06-09,1999-05-29,0,1,0,0,0,"M",1942-06-13,1942,NA,-777
"2208","NIG-1999","A2.9-6622",475,"NIG","Obasanjo","29/05/1999","31/12/2004","5/3/1937","-777",1999-05-29,2004-12-31,0,-888,0,1,-888,"M",1937-03-05,1937,NA,-777
"2209","GAB-1960","A2.9-6625",481,"GAB","Mba","17/08/1960","17/02/1964","1902","28/11/1967",1960-08-17,1964-02-17,0,3,6,0,2,"M",NA,1902,1967-11-28,1967
"2210","GAB-1964-1","A2.9-6628",481,"GAB","Aubaume","17/02/1964","19/02/1964","10/11/1912","1989",1964-02-17,1964-02-19,1,4,9,0,2,"M",1912-11-10,1912,NA,1989
"2211","GAB-1964-2","A2.9-6631",481,"GAB","Mba","20/02/1964","28/11/1967","1902","28/11/1967",1964-02-20,1967-11-28,2,2,0,1,-777,"M",NA,1902,1967-11-28,1967
"2212","GAB-1967","A2.9-6634",481,"GAB","Bongo","28/11/1967","31/12/2004","30/12/1935","-777",1967-11-28,2004-12-31,0,-888,0,0,-888,"M",1935-12-30,1935,NA,-777
"2213","CEN-1960","A2.9-6637",482,"CEN","Dacko","13/08/1960","01/01/1966","24/3/1930","20/11/2003",1960-08-13,1966-01-01,0,3,6,0,2,"M",1930-03-24,1930,2003-11-20,2003
"2214","CEN-1966","A2.9-6640",482,"CEN","Bokassa","01/01/1966","21/09/1979","22/2/1921","03/11/1996",1966-01-01,1979-09-21,1,4,9,0,1,"M",1921-02-22,1921,1996-11-03,1996
"2215","CEN-1979","A2.9-6643",482,"CEN","Dacko","21/09/1979","01/09/1981","24/3/1930","20/11/2003",1979-09-21,1981-09-01,2,3,6,1,0,"M",1930-03-24,1930,2003-11-20,2003
"2216","CEN-1981","A2.9-6646",482,"CEN","Kolingba","01/09/1981","22/10/1993","12/8/1935","-777",1981-09-01,1993-10-22,1,1,0,0,0,"M",1935-08-12,1935,NA,-777
"2217","CEN-1993","A2.9-6649",482,"CEN","Patasse","22/10/1993","15/03/2003","25/01/1937","-777",1993-10-22,2003-03-15,0,3,4,0,1,"M",1937-01-25,1937,NA,-777
"2218","CEN-2003","A2.9-6652",482,"CEN","Francois Bozize","15/03/2003","31/12/2004","1953","-777",2003-03-15,2004-12-31,0,-888,0,0,-888,"M",NA,1953,NA,-777
"2219","CHA-1960","A2.9-6655",483,"CHA","Tombalbaye","11/08/1960","13/04/1975","15/6/1918","1975",1960-08-11,1975-04-13,0,3,6,0,3,"M",1918-06-15,1918,NA,1975
"2220","CHA-1975","A2.9-6658",483,"CHA","Malloum","15/04/1975","23/03/1979","10/9/1932","-777",1975-04-15,1979-03-23,1,3,3,0,1,"M",1932-09-10,1932,NA,-777
"2221","CHA-1979","A2.9-6661",483,"CHA","Oueddei","23/03/1979","07/06/1982","1944","-777",1979-03-23,1982-06-07,0,3,4,0,1,"M",NA,1944,NA,-777
"2222","CHA-1982","A2.9-6664",483,"CHA","Habre","19/06/1982","02/12/1990","1942","-777",1982-06-19,1990-12-02,1,3,4,0,1,"M",NA,1942,NA,-777
"2223","CHA-1990","A2.9-6667",483,"CHA","Deby","04/12/1990","31/12/2004","1952","-777",1990-12-04,2004-12-31,1,-888,0,0,-888,"M",NA,1952,NA,-777
"2224","CON-1960","A2.9-6670",484,"CON","Youlou","15/08/1960","15/08/1963","9/6/1917","1972",1960-08-15,1963-08-15,0,3,2,0,2,"M",1917-06-09,1917,NA,1972
"2225","CON-1963","A2.9-6673",484,"CON","Debat","16/08/1963","04/09/1968","1921","1977",1963-08-16,1968-09-04,1,3,6,0,0,"M",NA,1921,NA,1977
"2226","CON-1968","A2.9-6676",484,"CON","Raoul","04/09/1968","01/01/1969","13/12/1938","1999",1968-09-04,1969-01-01,1,1,0,0,0,"M",1938-12-13,1938,NA,1999
"2227","CON-1969","A2.9-6679",484,"CON","Ngouabi","01/01/1969","18/03/1977","1938","1977",1969-01-01,1977-03-18,0,3,6,0,3,"M",NA,1938,NA,1977
"2228","CON-1977","A2.9-6682",484,"CON","Opango","18/03/1977","05/02/1979","1939","-777",1977-03-18,1979-02-05,0,3,16,0,2,"M",NA,1939,NA,-777
"2229","CON-1979","A2.9-6685",484,"CON","Nguesso","08/02/1979","20/08/1992","1943","-777",1979-02-08,1992-08-20,1,1,0,0,0,"M",NA,1943,NA,-777
"2230","CON-1992","A2.9-6688",484,"CON","Lissouba","31/08/1992","15/10/1997","29/11/1931","-777",1992-08-31,1997-10-15,0,3,3,0,1,"M",1931-11-29,1931,NA,-777
"2231","CON-1997","A2.9-6691",484,"CON","Nguesso","15/10/1997","31/12/2004","1943","-777",1997-10-15,2004-12-31,1,-888,0,1,-888,"M",NA,1943,NA,-777
"2232","DRC-1960-1","A2.9-6694",490,"DRC","Lumumba","30/06/1960","14/09/1960","2/7/1925","17/01/1961",1960-06-30,1960-09-14,0,3,6,0,3,"M",1925-07-02,1925,1961-01-17,1961
"2233","DRC-1960-2","A2.9-6697",490,"DRC","Mobutu","14/09/1960","20/09/1960","14/10/1930","-777",1960-09-14,1960-09-20,1,1,0,0,0,"M",1930-10-14,1930,NA,-777
"2234","DRC-1960-3","A2.9-6700",490,"DRC","Kasavubu","20/09/1960","25/11/1965","1913","1969",1960-09-20,1965-11-25,0,3,6,0,0,"M",NA,1913,NA,1969
"2235","DRC-1965","A2.9-6703",490,"DRC","Mobutu","25/11/1965","16/05/1997","14/10/1930","-777",1965-11-25,1997-05-16,1,3,4,1,1,"M",1930-10-14,1930,NA,-777
"2236","DRC-1997","A2.9-6706",490,"DRC","Laurent Kabila","16/05/1997","16/01/2001","27/11/1939","16/01/2001",1997-05-16,2001-01-16,1,3,6,0,3,"M",1939-11-27,1939,2001-01-16,2001
"2237","DRC-2001","A2.9-6709",490,"DRC","Joseph Kabila","17/01/2001","31/12/2004","1971","-777",2001-01-17,2004-12-31,0,-888,0,0,-888,"M",NA,1971,NA,-777
"2238","UGA-1962","A2.9-6712",500,"UGA","Obote","09/10/1962","25/01/1971","28/12/1924","10/10/2005",1962-10-09,1971-01-25,0,3,6,0,1,"M",1924-12-28,1924,2005-10-10,2005
"2239","UGA-1971","A2.9-6715",500,"UGA","Amin","25/01/1971","11/04/1979","1925","16/08/2003",1971-01-25,1979-04-11,1,4,9,0,1,"M",NA,1925,2003-08-16,2003
"2240","UGA-1979-1","A2.9-6718",500,"UGA","Yusuf Lule","13/04/1979","20/06/1979","10/04/1912","21/01/1985",1979-04-13,1979-06-20,0,1,0,0,1,"M",1912-04-10,1912,1985-01-21,1985
"2241","UGA-1979-2","A2.9-6721",500,"UGA","Banaisa","20/06/1979","12/05/1980","30/5/1919","-777",1979-06-20,1980-05-12,0,3,6,0,1,"M",1919-05-30,1919,NA,-777
"2242","UGA-1980-1","A2.9-6724",500,"UGA","Paulo Muwanga","18/05/1980","17/12/1980","1924","01/04/1991",1980-05-18,1980-12-17,1,1,0,0,0,"M",NA,1924,1991-04-01,1991
"2243","UGA-1980-2","A2.9-6727",500,"UGA","Obote","17/12/1980","27/07/1985","28/12/1924","10/10/2005",1980-12-17,1985-07-27,0,3,6,1,1,"M",1924-12-28,1924,2005-10-10,2005
"2244","UGA-1985","A2.9-6730",500,"UGA","Okello","29/07/1985","29/01/1986","1914","1990",1985-07-29,1986-01-29,1,3,4,0,2,"M",NA,1914,NA,1990
"2245","UGA-1986","A2.9-6733",500,"UGA","Museveni","29/01/1986","31/12/2004","1944","-777",1986-01-29,2004-12-31,1,-888,0,0,-888,"M",NA,1944,NA,-777
"2246","KEN-1963","A2.9-6736",501,"KEN","Kenyatta","12/12/1963","22/08/1978","20/10/1891","22/08/1978",1963-12-12,1978-08-22,0,2,0,0,-777,"M",1891-10-20,1891,1978-08-22,1978
"2247","KEN-1978","A2.9-6739",501,"KEN","Moi","22/08/1978","30/12/2002","02/09/1924","-777",1978-08-22,2002-12-30,0,1,0,0,0,"M",1924-09-02,1924,NA,-777
"2248","KEN-2002","A2.9-6742",501,"KEN","Mwai Kibaki","31/12/2002","31/12/2004","1931","-777",2002-12-31,2004-12-31,0,-888,0,0,-888,"M",NA,1931,NA,-777
"2249","TAZ-1961","A2.9-6745",510,"TAZ","Nyerere","09/11/1961","05/11/1985","13/04/1922","14/10/1999",1961-11-09,1985-11-05,0,1,0,0,0,"M",1922-04-13,1922,1999-10-14,1999
"2250","TAZ-1985","A2.9-6748",510,"TAZ","Mwinyi","05/11/1985","05/11/1995","8/5/1925","-777",1985-11-05,1995-11-05,0,1,0,0,0,"M",1925-05-08,1925,NA,-777
"2251","TAZ-1995","A2.9-6751",510,"TAZ","Mkapa","05/11/1995","31/12/2004","1938","-777",1995-11-05,2004-12-31,0,-888,0,0,-888,"M",NA,1938,NA,-777
"2252","ZAN-1961","A2.9-6754",511,"ZAN","Shamte Hamadi","05/06/1961","12/01/1964","-999","-999",1961-06-05,1964-01-12,0,3,4,0,2,"M",NA,NA,NA,NA
"2253","ZAN-1964","A2.9-6757",511,"ZAN","Kassim Hanga","12/01/1964","27/04/1964","1932","1969",1964-01-12,1964-04-27,1,1,0,0,0,"M",NA,1932,NA,1969
"2254","BUI-1962","A2.9-6760",516,"BUI","Mwambutsa","01/07/1962","08/07/1966","1912","1977",1962-07-01,1966-07-08,0,3,8,0,1,"M",NA,1912,NA,1977
"2255","BUI-1966-1","A2.9-6763",516,"BUI","Ntare","08/07/1966","28/11/1966","2/12/1947","1972",1966-07-08,1966-11-28,1,3,6,0,1,"M",1947-12-02,1947,NA,1972
"2256","BUI-1966-2","A2.9-6766",516,"BUI","Micombero","28/11/1966","01/11/1976","1940","1983",1966-11-28,1976-11-01,1,3,6,0,1,"M",NA,1940,NA,1983
"2257","BUI-1976","A2.9-6769",516,"BUI","Bagaza","09/11/1976","03/09/1987","29/8/1946","-777",1976-11-09,1987-09-03,1,3,6,0,1,"M",1946-08-29,1946,NA,-777
"2258","BUI-1987","A2.9-6772",516,"BUI","Buyoya","03/09/1987","10/07/1993","24/11/1949","-777",1987-09-03,1993-07-10,1,1,0,0,0,"M",1949-11-24,1949,NA,-777
"2259","BUI-1993-1","A2.9-6775",516,"BUI","Ndadaye","10/07/1993","21/10/1993","1953","1993",1993-07-10,1993-10-21,0,3,6,0,3,"M",NA,1953,NA,1993
"2260","BUI-1993-2","A2.9-6778",516,"BUI","Ngueze","21/10/1993","27/10/1993","-999","-999",1993-10-21,1993-10-27,1,1,0,0,2,"M",NA,NA,NA,NA
"2261","BUI-1993-3","A2.9-6781",516,"BUI","Kinigi","27/10/1993","05/02/1994","1953","-777",1993-10-27,1994-02-05,0,1,0,0,0,"F",NA,1953,NA,-777
"2262","BUI-1994-1","A2.9-6784",516,"BUI","Ntarymira","05/02/1994","06/04/1994","1955","06/04/1994",1994-02-05,1994-04-06,0,3,111,0,3,"M",NA,1955,1994-04-06,1994
"2263","BUI-1994-2","A2.9-6787",516,"BUI","Ntibantunganya","06/04/1994","25/07/1996","08/05/1956","-777",1994-04-06,1996-07-25,0,3,8,0,0,"M",1956-05-08,1956,NA,-777
"2264","BUI-1996","A2.9-6790",516,"BUI","Buyoya","25/07/1996","30/04/2003","24/11/1949","-777",1996-07-25,2003-04-30,1,1,0,1,0,"M",1949-11-24,1949,NA,-777
"2265","BUI-2003","A2.9-6793",516,"BUI","Ndayizeye","30/04/2003","31/12/2004","1953","-777",2003-04-30,2004-12-31,0,-888,0,0,-888,"M",NA,1953,NA,-777
"2266","RWA-1961","A2.9-6796",517,"RWA","Kayibanda","26/10/1961","05/07/1973","1/5/1924","1976",1961-10-26,1973-07-05,0,3,6,0,2,"M",1924-05-01,1924,NA,1976
"2267","RWA-1973","A2.9-6799",517,"RWA","Habyarimana","05/07/1973","06/04/1994","3/8/1937","06/04/1994",1973-07-05,1994-04-06,1,3,111,0,3,"M",1937-08-03,1937,1994-04-06,1994
"2268","RWA-1994-1","A2.9-6802",517,"RWA","Sindikubwabo","06/04/1994","19/07/1994","1928","1998",1994-04-06,1994-07-19,1,1,0,0,1,"M",NA,1928,NA,1998
"2269","RWA-1994-2","A2.9-6805",517,"RWA","Paul Kagame","19/07/1994","31/12/2004","23/10/1957","-777",1994-07-19,2004-12-31,0,-888,0,0,-888,"M",1957-10-23,1957,NA,-777
"2270","SOM-1960","A2.9-6808",520,"SOM","Osman Daar","01/07/1960","10/07/1967","1908","08/06/2007",1960-07-01,1967-07-10,0,1,0,0,0,"M",NA,1908,2007-06-08,2007
"2271","SOM-1967","A2.9-6811",520,"SOM","Shermarke","10/07/1967","15/10/1969","16/10/1919","1969",1967-07-10,1969-10-15,0,3,11,0,3,"M",1919-10-16,1919,NA,1969
"2272","SOM-1969","A2.9-6814",520,"SOM","Siad Barre","21/10/1969","26/01/1991","1912","02/01/1995",1969-10-21,1991-01-26,1,3,4,0,1,"M",NA,1912,1995-01-02,1995
"2273","DJI-1977","A2.9-6817",522,"DJI","Gouled Aptidon","27/06/1977","08/05/1999","1916","2006",1977-06-27,1999-05-08,0,1,0,0,0,"M",NA,1916,NA,2006
"2274","DJI-1999","A2.9-6820",522,"DJI","Guelleh","08/05/1999","31/12/2004","1947","-777",1999-05-08,2004-12-31,0,-888,0,0,-888,"M",NA,1947,NA,-777
"2275","ETH-1871","A2.9-6823",530,"ETH","Yohannes IV","11/07/1871","09/03/1889","1837","1889",1871-07-11,1889-03-09,1,3,-999,0,3,"M",NA,1837,NA,1889
"2276","ETH-1889","A2.9-6826",530,"ETH","Menelek II","09/03/1889","15/05/1911","17/08/1844","12/12/1913",1889-03-09,1911-05-15,1,2,0,0,-777,"M",1844-08-17,1844,1913-12-12,1913
"2277","ETH-1911","A2.9-6829",530,"ETH","Joshua (Lij Yasu)","15/05/1911","27/09/1916","1894","1935",1911-05-15,1916-09-27,0,3,-999,0,2,"M",NA,1894,NA,1935
"2278","ETH-1916","A2.9-6832",530,"ETH","Judith (Zanditu)","27/09/1916","03/04/1930","1876","1930",1916-09-27,1930-04-03,1,2,0,0,-777,"M",NA,1876,NA,1930
"2279","ETH-1930","A2.9-6835",530,"ETH","Selassie","03/04/1930","15/05/1936","23/7/1892","27/08/1975",1930-04-03,1936-05-15,0,4,9,0,1,"M",1892-07-23,1892,1975-08-27,1975
"2280","ETH-1936","A2.9-6838",530,"ETH","King of Italy/Emperor of Ethiopia","15/05/1936","07/04/1941","-999","-999",1936-05-15,1941-04-07,2,4,9,0,0,"M",NA,NA,NA,NA
"2281","ETH-1941","A2.9-6841",530,"ETH","Selassie","05/05/1941","12/09/1974","23/7/1892","27/08/1975",1941-05-05,1974-09-12,2,3,6,1,2,"M",1892-07-23,1892,1975-08-27,1975
"2282","ETH-1974-1","A2.9-6844",530,"ETH","Andom","12/09/1974","23/11/1974","1924","1974",1974-09-12,1974-11-23,1,3,16,0,3,"M",NA,1924,NA,1974
"2283","ETH-1974-2","A2.9-6847",530,"ETH","Banti","28/11/1974","03/02/1977","1921","1977",1974-11-28,1977-02-03,0,3,6,0,3,"M",NA,1921,NA,1977
"2284","ETH-1977","A2.9-6850",530,"ETH","Mengistu Marriam","11/02/1977","21/05/1991","1937","-777",1977-02-11,1991-05-21,0,3,4,0,1,"M",NA,1937,NA,-777
"2285","ETH-1991-1","A2.9-6853",530,"ETH","Gebre Kidan","21/05/1991","27/05/1991","1935","2004",1991-05-21,1991-05-27,0,3,4,0,1,"M",NA,1935,NA,2004
"2286","ETH-1991-2","A2.9-6856",530,"ETH","Meles Zenawi","27/05/1991","31/12/2004","23/8/1955","-777",1991-05-27,2004-12-31,1,-888,0,0,-888,"M",1955-08-23,1955,NA,-777
"2287","ERI-1993","A2.9-6859",531,"ERI","Afeworki","24/05/1993","31/12/2004","1946","-777",1993-05-24,2004-12-31,0,-888,0,0,-888,"M",NA,1946,NA,-777
"2288","ANG-1975","A2.9-6862",540,"ANG","Neto","11/11/1975","10/09/1979","17/9/1922","10/09/1979",1975-11-11,1979-09-10,1,2,0,0,-777,"M",1922-09-17,1922,1979-09-10,1979
"2289","ANG-1979","A2.9-6865",540,"ANG","Dos Santos","10/09/1979","31/12/2004","28/8/1942","-777",1979-09-10,2004-12-31,0,-888,0,0,-888,"M",1942-08-28,1942,NA,-777
"2290","MZM-1975","A2.9-6868",541,"MZM","Machel","25/06/1975","19/10/1986","29/9/1933","19/10/1986",1975-06-25,1986-10-19,1,2,0,0,-777,"M",1933-09-29,1933,1986-10-19,1986
"2291","MZM-1986","A2.9-6871",541,"MZM","Chissano","06/11/1986","31/12/2004","2/10/1939","-777",1986-11-06,2004-12-31,0,-888,0,0,-888,"M",1939-10-02,1939,NA,-777
"2292","ZAM-1964","A2.9-6874",551,"ZAM","Kaunda","24/10/1964","02/11/1991","28/4/1924","-777",1964-10-24,1991-11-02,0,1,0,0,0,"M",1924-04-28,1924,NA,-777
"2293","ZAM-1991","A2.9-6877",551,"ZAM","Chiluba","02/11/1991","02/01/2002","30/4/1943","-777",1991-11-02,2002-01-02,0,1,0,0,0,"M",1943-04-30,1943,NA,-777
"2294","ZAM-2002","A2.9-6880",551,"ZAM","Levy Mwanawasa","03/01/2002","31/12/2004","03/09/1948","-777",2002-01-03,2004-12-31,0,-888,0,0,-888,"M",1948-09-03,1948,NA,-777
"2295","ZIM-1965","A2.9-6883",552,"ZIM","Smith","11/11/1965","23/05/1979","8/4/1919","-777",1965-11-11,1979-05-23,0,1,0,0,0,"M",1919-04-08,1919,NA,-777
"2296","ZIM-1979","A2.9-6886",552,"ZIM","Muzorewa","29/05/1979","11/12/1979","14/4/1925","-777",1979-05-29,1979-12-11,0,1,0,0,0,"M",1925-04-14,1925,NA,-777
"2297","ZIM-1980","A2.9-6889",552,"ZIM","Mugabe","04/03/1980","31/12/2004","21/2/1924","-777",1980-03-04,2004-12-31,0,-888,0,0,-888,"M",1924-02-21,1924,NA,-777
"2298","MAW-1964","A2.9-6892",553,"MAW","Banda","06/07/1964","21/05/1994","18/5/1906","25/11/1997",1964-07-06,1994-05-21,0,1,0,0,2,"M",1906-05-18,1906,1997-11-25,1997
"2299","MAW-1994","A2.9-6895",553,"MAW","Muluzi","21/05/1994","24/05/2004","1943","-777",1994-05-21,2004-05-24,0,1,0,0,0,"M",NA,1943,NA,-777
"2300","MAW-2004","A2.9-6898",553,"MAW","Bingu wa Mutharika","24/05/2004","31/12/2004","1934","-777",2004-05-24,2004-12-31,0,-888,0,0,-888,"M",NA,1934,NA,-777
"2301","SAF-1910","A2.9-6901",560,"SAF","Louis Botha","31/05/1910","27/08/1919","27/9/1862","27/08/1919",1910-05-31,1919-08-27,0,2,0,1,-777,"M",1862-09-27,1862,1919-08-27,1919
"2302","SAF-1919","A2.9-6904",560,"SAF","Smuts","03/09/1919","29/06/1924","24/5/1870","1950",1919-09-03,1924-06-29,0,1,0,0,0,"M",1870-05-24,1870,NA,1950
"2303","SAF-1924","A2.9-6907",560,"SAF","Hertzog","30/06/1924","05/09/1939","3/4/1866","1942",1924-06-30,1939-09-05,0,1,0,0,0,"M",1866-04-03,1866,NA,1942
"2304","SAF-1939","A2.9-6910",560,"SAF","Smuts","06/09/1939","03/06/1948","24/5/1870","1950",1939-09-06,1948-06-03,0,1,0,1,0,"M",1870-05-24,1870,NA,1950
"2305","SAF-1948","A2.9-6913",560,"SAF","Malan","03/06/1948","30/11/1954","22/5/1874","07/02/1959",1948-06-03,1954-11-30,0,1,0,0,0,"M",1874-05-22,1874,1959-02-07,1959
"2306","SAF-1954","A2.9-6916",560,"SAF","Strijdom","02/12/1954","23/08/1958","14/7/1873","1958",1954-12-02,1958-08-23,0,2,0,0,-777,"M",1873-07-14,1873,NA,1958
"2307","SAF-1958-1","A2.9-6919",560,"SAF","Swart","23/08/1958","03/09/1958","5/12/1894","1982",1958-08-23,1958-09-03,0,1,0,0,0,"M",1894-12-05,1894,NA,1982
"2308","SAF-1958-2","A2.9-6922",560,"SAF","Verwoerd","03/09/1958","06/09/1966","8/9/1901","06/09/1966",1958-09-03,1966-09-06,0,3,11,0,3,"M",1901-09-08,1901,1966-09-06,1966
"2309","SAF-1966-1","A2.9-6925",560,"SAF","Donges","06/09/1966","13/09/1966","8/3/1898","1968",1966-09-06,1966-09-13,0,1,0,0,0,"M",1898-03-08,1898,NA,1968
"2310","SAF-1966-2","A2.9-6928",560,"SAF","Vorster","13/09/1966","28/09/1978","13/12/1915","1983",1966-09-13,1978-09-28,0,1,0,0,0,"M",1915-12-13,1915,NA,1983
"2311","SAF-1978","A2.9-6931",560,"SAF","Botha","28/09/1978","18/01/1989","12/1/1916","2006",1978-09-28,1989-01-18,0,1,0,0,0,"M",1916-01-12,1916,NA,2006
"2312","SAF-1989-1","A2.9-6934",560,"SAF","Heunis","19/01/1989","15/03/1989","29/4/1927","2006",1989-01-19,1989-03-15,0,1,0,0,0,"M",1927-04-29,1927,NA,2006
"2313","SAF-1989-2","A2.9-6937",560,"SAF","Botha","15/03/1989","14/08/1989","12/1/1916","2006",1989-03-15,1989-08-14,0,1,0,1,0,"M",1916-01-12,1916,NA,2006
"2314","SAF-1989-3","A2.9-6940",560,"SAF","deKlerk","15/08/1989","10/05/1994","18/3/1936","-777",1989-08-15,1994-05-10,0,1,0,0,0,"M",1936-03-18,1936,NA,-777
"2315","SAF-1994","A2.9-6943",560,"SAF","Mandela","10/05/1994","16/06/1999","18/7/1918","-777",1994-05-10,1999-06-16,0,1,0,0,0,"M",1918-07-18,1918,NA,-777
"2316","SAF-1999","A2.9-6946",560,"SAF","Mbeki","16/06/1999","31/12/2004","18/6/1942","-777",1999-06-16,2004-12-31,0,-888,0,0,-888,"M",1942-06-18,1942,NA,-777
"2317","TRA-1872","A2.9-6949",563,"TRA","Burgers","01/07/1872","12/04/1877","1834","1881",1872-07-01,1877-04-12,0,4,-999,0,1,"M",NA,1834,NA,1881
"2318","TRA-1877","A2.9-6952",563,"TRA","Shepstone","12/04/1877","04/03/1879","1817","1893",1877-04-12,1879-03-04,2,1,0,0,0,"M",NA,1817,NA,1893
"2319","TRA-1879","A2.9-6955",563,"TRA","Lanyon","04/03/1879","08/08/1881","1842","1887",1879-03-04,1881-08-08,0,3,-999,0,0,"M",NA,1842,NA,1887
"2320","TRA-1881","A2.9-6958",563,"TRA","Triumvirate","08/08/1881","09/05/1883","-999","-999",1881-08-08,1883-05-09,1,1,0,0,0,"M",NA,NA,NA,NA
"2321","TRA-1883","A2.9-6961",563,"TRA","Kruger","09/05/1883","10/09/1900","1825","1904",1883-05-09,1900-09-10,0,1,0,0,1,"M",NA,1825,NA,1904
"2322","TRA-1900","A2.9-6964",563,"TRA","Schalk Burger","10/09/1900","31/05/1902","1852","1918",1900-09-10,1902-05-31,0,4,-999,0,0,"M",NA,1852,NA,1918
"2323","TRA-1902","A2.9-6967",563,"TRA","Milner","21/06/1902","01/04/1905","1854","1925",1902-06-21,1905-04-01,2,1,0,0,0,"M",NA,1854,NA,1925
"2324","TRA-1905","A2.9-6970",563,"TRA","Palmer","02/04/1905","04/02/1907","1859","1942",1905-04-02,1907-02-04,0,1,0,0,0,"M",NA,1859,NA,1942
"2325","TRA-1907","A2.9-6973",563,"TRA","Louis Botha","04/02/1907","31/05/1910","27/9/1862","27/08/1919",1907-02-04,1910-05-31,0,1,0,0,0,"M",1862-09-27,1862,1919-08-27,1919
"2326","OFS-1873","A2.9-6976",564,"OFS","Johannes Henricus Brand","16/06/1873","14/07/1888","1823","14/07/1888",1873-06-16,1888-07-14,0,2,0,0,-777,"M",NA,1823,1888-07-14,1888
"2327","OFS-1888","A2.9-6979",564,"OFS","Blignaut","14/07/1888","10/01/1889","1841","1909",1888-07-14,1889-01-10,0,1,0,0,0,"M",NA,1841,NA,1909
"2328","OFS-1889","A2.9-6982",564,"OFS","Reitz","10/01/1889","11/12/1895","1844","1934",1889-01-10,1895-12-11,0,2.1,0,0,0,"M",NA,1844,NA,1934
"2329","OFS-1895","A2.9-6985",564,"OFS","Blignaut","11/12/1895","04/03/1896","1841","1909",1895-12-11,1896-03-04,0,1,0,1,0,"M",NA,1841,NA,1909
"2330","OFS-1896","A2.9-6988",564,"OFS","Steyn","04/03/1896","31/05/1902","1857","1916",1896-03-04,1902-05-31,0,4,-999,0,1,"M",NA,1857,NA,1916
"2331","OFS-1902","A2.9-6991",564,"OFS","Milner","23/06/1902","01/04/1905","1854","1925",1902-06-23,1905-04-01,2,1,0,0,0,"M",NA,1854,NA,1925
"2332","OFS-1905","A2.9-6994",564,"OFS","Palmer","02/04/1905","07/06/1907","1859","1942",1905-04-02,1907-06-07,0,1,0,0,0,"M",NA,1859,NA,1942
"2333","OFS-1907-1","A2.9-6997",564,"OFS","Hamilton John Goold-Adams","07/06/1907","27/11/1907","1858","1920",1907-06-07,1907-11-27,0,1,0,0,0,"M",NA,1858,NA,1920
"2334","OFS-1907-2","A2.9-7000",564,"OFS","Fischer","27/11/1907","31/05/1910","1850","1913",1907-11-27,1910-05-31,0,1,0,0,0,"M",NA,1850,NA,1913
"2335","NAM-1990","A2.9-7003",565,"NAM","Nujoma","21/03/1990","31/12/2004","12/05/1929","-777",1990-03-21,2004-12-31,0,-888,0,0,-888,"M",1929-05-12,1929,NA,-777
"2336","LES-1966","A2.9-7006",570,"LES","Jonathan","04/10/1966","20/01/1986","30/10/1914","05/04/1987",1966-10-04,1986-01-20,0,3,6,0,1,"M",1914-10-30,1914,1987-04-05,1987
"2337","LES-1986","A2.9-7009",570,"LES","Lekhanya","24/01/1986","02/05/1991","07/04/1938","-777",1986-01-24,1991-05-02,1,3,6,0,2,"M",1938-04-07,1938,NA,-777
"2338","LES-1991","A2.9-7012",570,"LES","Ramaema","02/05/1991","02/04/1993","10/11/1933","-777",1991-05-02,1993-04-02,1,1,0,0,0,"M",1933-11-10,1933,NA,-777
"2339","LES-1993","A2.9-7015",570,"LES","Mokhehle","02/04/1993","17/08/1994","26/12/1918","06/01/1999",1993-04-02,1994-08-17,0,3,8,0,0,"M",1918-12-26,1918,1999-01-06,1999
"2340","LES-1994-1","A2.9-7018",570,"LES","Letsie III","17/08/1994","14/09/1994","1963","-777",1994-08-17,1994-09-14,1,1,0,0,0,"M",NA,1963,NA,-777
"2341","LES-1994-2","A2.9-7021",570,"LES","Mokhehle","14/09/1994","29/05/1998","26/12/1918","06/01/1999",1994-09-14,1998-05-29,1,1,0,1,0,"M",1918-12-26,1918,1999-01-06,1999
"2342","LES-1998","A2.9-7024",570,"LES","Mosisili","29/05/1998","31/12/2004","14/03/1945","-777",1998-05-29,2004-12-31,0,-888,0,0,-888,"M",1945-03-14,1945,NA,-777
"2343","BOT-1966","A2.9-7027",571,"BOT","Khama","30/09/1966","13/07/1980","1/7/1921","13/07/1980",1966-09-30,1980-07-13,0,2,0,0,-777,"M",1921-07-01,1921,1980-07-13,1980
"2344","BOT-1980","A2.9-7030",571,"BOT","Masire","13/07/1980","31/03/1998","23/7/1925","-777",1980-07-13,1998-03-31,0,1,0,0,0,"M",1925-07-23,1925,NA,-777
"2345","BOT-1998","A2.9-7033",571,"BOT","Mogae","31/03/1998","31/12/2004","1939","-777",1998-03-31,2004-12-31,0,-888,0,0,-888,"M",NA,1939,NA,-777
"2346","SWA-1968","A2.9-7036",572,"SWA","Subhuza II","06/09/1968","21/08/1982","22/7/1899","1982",1968-09-06,1982-08-21,0,2,0,0,-777,"M",1899-07-22,1899,NA,1982
"2347","SWA-1982","A2.9-7039",572,"SWA","Dzeliwe Shongwe","21/08/1982","10/08/1983","1927","-777",1982-08-21,1983-08-10,0,3,8,0,0,"M",NA,1927,NA,-777
"2348","SWA-1983","A2.9-7042",572,"SWA","Ntombe Thwala","10/08/1983","25/04/1986","1950","-777",1983-08-10,1986-04-25,0,1,0,0,0,"M",NA,1950,NA,-777
"2349","SWA-1986","A2.9-7045",572,"SWA","Mswati","25/04/1986","31/12/2004","1968","-777",1986-04-25,2004-12-31,0,-888,0,0,-888,"M",NA,1968,NA,-777
"2350","MAG-1864","A2.9-7048",580,"MAG","Rainilaiarivony","15/07/1864","30/09/1895","1828","1896",1864-07-15,1895-09-30,0,4,-999,0,1,"M",NA,1828,NA,1896
"2351","MAG-1960","A2.9-7051",580,"MAG","Tsiranana","26/06/1960","08/10/1972","8/10/1910","1978",1960-06-26,1972-10-08,0,3,2,0,0,"M",1910-10-08,1910,NA,1978
"2352","MAG-1972","A2.9-7054",580,"MAG","Ramanantsoa","12/10/1972","05/02/1975","13/4/1906","1979",1972-10-12,1975-02-05,1,3,16,0,0,"M",1906-04-13,1906,NA,1979
"2353","MAG-1975-1","A2.9-7057",580,"MAG","Ratsimandrava","05/02/1975","11/02/1975","21/3/1931","1975",1975-02-05,1975-02-11,1,3,6,0,3,"M",1931-03-21,1931,NA,1975
"2354","MAG-1975-2","A2.9-7060",580,"MAG","Gilles Andriamahazo","11/02/1975","15/06/1975","5/5/1919","1989",1975-02-11,1975-06-15,1,1,0,0,0,"M",1919-05-05,1919,NA,1989
"2355","MAG-1975-3","A2.9-7063",580,"MAG","Ratsiraka","15/06/1975","27/03/1993","4/11/1936","-777",1975-06-15,1993-03-27,0,1,0,0,0,"M",1936-11-04,1936,NA,-777
"2356","MAG-1993","A2.9-7066",580,"MAG","Zafy","27/03/1993","05/09/1996","1927","-777",1993-03-27,1996-09-05,0,1,0,0,0,"M",NA,1927,NA,-777
"2357","MAG-1996","A2.9-7069",580,"MAG","Ratsirahonana","05/09/1996","09/02/1997","1938","-777",1996-09-05,1997-02-09,0,1,0,0,0,"M",NA,1938,NA,-777
"2358","MAG-1997","A2.9-7072",580,"MAG","Ratsiraka","09/02/1997","06/07/2002","4/11/1936","-777",1997-02-09,2002-07-06,0,3,8,1,1,"M",1936-11-04,1936,NA,-777
"2359","MAG-2002","A2.9-7075",580,"MAG","Marc Ravalomanana","06/07/2002","31/12/2004","12/12/1949","-777",2002-07-06,2004-12-31,1,-888,0,0,-888,"M",1949-12-12,1949,NA,-777
"2360","COM-1975-1","A2.9-7078",581,"COM","Abdallah","06/07/1975","03/08/1975","1919","26/11/1989",1975-07-06,1975-08-03,1,3,4,0,1,"M",NA,1919,1989-11-26,1989
"2361","COM-1975-2","A2.9-7081",581,"COM","Soilih","03/08/1975","13/05/1978","1937","1978",1975-08-03,1978-05-13,1,3,6,0,3,"M",NA,1937,NA,1978
"2362","COM-1978","A2.9-7084",581,"COM","Bob Denard","13/05/1978","18/12/1989","07/04/1929","13/10/2007",1978-05-13,1989-12-18,1,3,7,0,1,"M",1929-04-07,1929,2007-10-13,2007
"2363","COM-1989","A2.9-7087",581,"COM","Djohar","18/12/1989","29/09/1995","1918","2006",1989-12-18,1995-09-29,0,3,5,0,2,"M",NA,1918,NA,2006
"2364","COM-1995-1","A2.9-7090",581,"COM","Bob Denard","29/09/1995","05/10/1995","07/04/1929","13/10/2007",1995-09-29,1995-10-05,1,4,9,1,1,"M",1929-04-07,1929,2007-10-13,2007
"2365","COM-1995-2","A2.9-7093",581,"COM","el-Yachroutu","05/10/1995","26/01/1996","1948","-777",1995-10-05,1996-01-26,0,1,0,0,0,"M",NA,1948,NA,-777
"2366","COM-1996-1","A2.9-7096",581,"COM","Djohar","26/01/1996","25/03/1996","1918","2006",1996-01-26,1996-03-25,0,1,0,1,2,"M",NA,1918,NA,2006
"2367","COM-1996-2","A2.9-7099",581,"COM","Abdoulkarim","25/03/1996","06/11/1998","1936","1998",1996-03-25,1998-11-06,0,2,0,1,-777,"M",NA,1936,NA,1998
"2368","COM-1998","A2.9-7102",581,"COM","Massounde","06/11/1998","30/04/1999","1933","2004",1998-11-06,1999-04-30,0,3,6,0,2,"M",NA,1933,NA,2004
"2369","COM-1999","A2.9-7105",581,"COM","Azali Assoumani","30/04/1999","21/01/2002","1959","-777",1999-04-30,2002-01-21,1,1,0,0,0,"M",NA,1959,NA,-777
"2370","COM-2002-1","A2.9-7108",581,"COM","Hamada Madi","22/01/2002","26/05/2002","1965","-777",2002-01-22,2002-05-26,0,1,0,0,0,"M",NA,1965,NA,-777
"2371","COM-2002-2","A2.9-7111",581,"COM","Azali Assoumani","27/05/2002","31/12/2004","1959","-777",2002-05-27,2004-12-31,0,-888,0,1,-888,"M",NA,1959,NA,-777
"2372","MAS-1968","A2.9-7114",590,"MAS","Ramgoolam","12/03/1968","16/06/1982","18/9/1900","15/12/1985",1968-03-12,1982-06-16,0,1,0,0,0,"M",1900-09-18,1900,1985-12-15,1985
"2373","MAS-1982","A2.9-7117",590,"MAS","Anerood Jugnauth","16/06/1982","22/12/1995","29/3/1930","-777",1982-06-16,1995-12-22,0,1,0,0,0,"M",1930-03-29,1930,NA,-777
"2374","MAS-1995","A2.9-7120",590,"MAS","Ramgoolam N.","22/12/1995","17/09/2000","1947","-777",1995-12-22,2000-09-17,0,1,0,0,0,"M",NA,1947,NA,-777
"2375","MAS-2000","A2.9-7123",590,"MAS","Anerood Jugnauth","18/09/2000","30/09/2003","29/3/1930","-777",2000-09-18,2003-09-30,0,1,0,1,0,"M",1930-03-29,1930,NA,-777
"2376","MAS-2003","A2.9-7126",590,"MAS","Paul Berenger","30/09/2003","31/12/2004","26/03/1945","-777",2003-09-30,2004-12-31,0,-888,0,0,-888,"M",1945-03-26,1945,NA,-777
"2377","MOR-1873","A2.9-7129",600,"MOR","Abu Ali al-Hasan","25/09/1873","07/06/1894","1827","1894",1873-09-25,1894-06-07,0,2,0,0,-777,"M",NA,1827,NA,1894
"2378","MOR-1894","A2.9-7132",600,"MOR","Abd al-Aziz","07/06/1894","05/01/1908","18/2/1881","1943",1894-06-07,1908-01-05,0,3,-999,0,0,"M",1881-02-18,1881,NA,1943
"2379","MOR-1956","A2.9-7135",600,"MOR","Mohammed V","02/03/1956","26/02/1961","10/8/1909","26/02/1961",1956-03-02,1961-02-26,1,2,0,0,-777,"M",1909-08-10,1909,1961-02-26,1961
"2380","MOR-1961","A2.9-7138",600,"MOR","Hassan II","26/02/1961","23/07/1999","9/7/1929","23/07/1999",1961-02-26,1999-07-23,0,2,0,0,-777,"M",1929-07-09,1929,1999-07-23,1999
"2381","MOR-1999","A2.9-7141",600,"MOR","Muhammad VI","23/07/1999","31/12/2004","1963","-777",1999-07-23,2004-12-31,0,-888,0,0,-888,"M",NA,1963,NA,-777
"2382","ALG-1962-1","A2.9-7144",615,"ALG","Ben Khedda","03/07/1962","25/09/1962","1920","2003",1962-07-03,1962-09-25,0,1,0,0,0,"M",NA,1920,NA,2003
"2383","ALG-1962-2","A2.9-7147",615,"ALG","Bella","26/09/1962","19/06/1965","25/12/1916","-777",1962-09-26,1965-06-19,0,3,6,0,2,"M",1916-12-25,1916,NA,-777
"2384","ALG-1965","A2.9-7150",615,"ALG","Boumedienne","19/06/1965","27/12/1978","22/8/1927","27/12/1978",1965-06-19,1978-12-27,1,2,0,0,-777,"M",1927-08-22,1927,1978-12-27,1978
"2385","ALG-1978","A2.9-7153",615,"ALG","Bitat","27/12/1978","07/02/1979","19/12/1925","2000",1978-12-27,1979-02-07,0,1,0,0,0,"M",1925-12-19,1925,NA,2000
"2386","ALG-1979","A2.9-7156",615,"ALG","Benjedid","07/02/1979","11/01/1992","14/04/1929","-777",1979-02-07,1992-01-11,0,3,6,0,0,"M",1929-04-14,1929,NA,-777
"2387","ALG-1992-1","A2.9-7159",615,"ALG","Boudiaf","14/01/1992","29/06/1992","23/6/1919","29/06/1992",1992-01-14,1992-06-29,1,3,4,0,3,"M",1919-06-23,1919,1992-06-29,1992
"2388","ALG-1992-2","A2.9-7162",615,"ALG","Kafi","02/07/1992","31/01/1994","1928","-777",1992-07-02,1994-01-31,0,1,0,0,0,"M",NA,1928,NA,-777
"2389","ALG-1994","A2.9-7165",615,"ALG","Zeroual","31/01/1994","27/04/1999","1941","-777",1994-01-31,1999-04-27,0,1,0,0,0,"M",NA,1941,NA,-777
"2390","ALG-1999","A2.9-7168",615,"ALG","Bouteflika","27/04/1999","31/12/2004","2/3/1937","-777",1999-04-27,2004-12-31,0,-888,0,0,-888,"M",1937-03-02,1937,NA,-777
"2391","TUN-1859","A2.9-7171",616,"TUN","Muhammad III","23/09/1859","28/10/1882","1813","28/10/1882",1859-09-23,1882-10-28,0,2,0,0,-777,"M",NA,1813,1882-10-28,1882
"2392","TUN-1943","A2.9-7174",616,"TUN","Muhammad al-Amin","15/05/1943","25/07/1957","4/9/1881","1962",1943-05-15,1957-07-25,0,3,8,0,2,"M",1881-09-04,1881,NA,1962
"2393","TUN-1957","A2.9-7177",616,"TUN","Ben Ali Bourguiba","25/07/1957","07/11/1987","3/8/1903","06/04/2000",1957-07-25,1987-11-07,1,3,8,0,2,"M",1903-08-03,1903,2000-04-06,2000
"2394","TUN-1987","A2.9-7180",616,"TUN","Zine Al-Abidine Ben Ali","07/11/1987","31/12/2004","3/9/1936","-777",1987-11-07,2004-12-31,1,-888,0,0,-888,"M",1936-09-03,1936,NA,-777
"2395","LIB-1951","A2.9-7183",620,"LIB","Idris","24/12/1951","01/09/1969","12/3/1890","25/05/1983",1951-12-24,1969-09-01,0,3,6,0,1,"M",1890-03-12,1890,1983-05-25,1983
"2396","LIB-1969","A2.9-7186",620,"LIB","Qaddafi","01/09/1969","31/12/2004","1942","-777",1969-09-01,2004-12-31,1,-888,0,0,-888,"M",NA,1942,NA,-777
"2397","SUD-1956-1","A2.9-7189",625,"SUD","Al-Azhari","01/01/1956","04/07/1956","1900","1969",1956-01-01,1956-07-04,0,1,0,0,0,"M",NA,1900,NA,1969
"2398","SUD-1956-2","A2.9-7192",625,"SUD","Khalil","05/07/1956","17/11/1958","1892","1970",1956-07-05,1958-11-17,0,3,6,0,0,"M",NA,1892,NA,1970
"2399","SUD-1958","A2.9-7195",625,"SUD","Abboud","18/11/1958","01/11/1964","26/10/1900","1983",1958-11-18,1964-11-01,1,3,2,0,0,"M",1900-10-26,1900,NA,1983
"2400","SUD-1964","A2.9-7198",625,"SUD","al-Khalifa","01/11/1964","14/06/1965","1917","2006",1964-11-01,1965-06-14,1,1,0,0,0,"M",NA,1917,NA,2006
"2401","SUD-1965","A2.9-7201",625,"SUD","Maghoub","14/06/1965","25/07/1966","1908","1976",1965-06-14,1966-07-25,0,1,0,0,0,"M",NA,1908,NA,1976
"2402","SUD-1966","A2.9-7204",625,"SUD","Mahdi","26/07/1966","15/05/1967","25/12/1935","-777",1966-07-26,1967-05-15,0,1,0,0,0,"M",1935-12-25,1935,NA,-777
"2403","SUD-1967","A2.9-7207",625,"SUD","Maghoub","18/05/1967","23/05/1969","1908","1976",1967-05-18,1969-05-23,0,3,6,1,1,"M",NA,1908,NA,1976
"2404","SUD-1969","A2.9-7210",625,"SUD","Nimeiri","25/05/1969","19/07/1971","1/1/1930","-777",1969-05-25,1971-07-19,1,3,6,0,2,"M",1930-01-01,1930,NA,-777
"2405","SUD-1971-1","A2.9-7213",625,"SUD","Osman","19/07/1971","22/07/1971","-999","23/071971",1971-07-19,1971-07-22,1,3,6,0,3,"M",NA,NA,NA,NA
"2406","SUD-1971-2","A2.9-7216",625,"SUD","Nimeiri","22/07/1971","06/04/1985","01/01/1930","-777",1971-07-22,1985-04-06,1,3,6,1,1,"M",1930-01-01,1930,NA,-777
"2407","SUD-1985","A2.9-7219",625,"SUD","Abdul Rahman Swaredahab","06/04/1985","06/05/1986","1934","-777",1985-04-06,1986-05-06,1,1,0,0,0,"M",NA,1934,NA,-777
"2408","SUD-1986","A2.9-7222",625,"SUD","Al-Mirghani","06/05/1986","30/06/1989","1941","-777",1986-05-06,1989-06-30,0,3,6,0,2,"M",NA,1941,NA,-777
"2409","SUD-1989","A2.9-7225",625,"SUD","Al-Bashir","30/06/1989","31/12/2004","1/1/1944","-777",1989-06-30,2004-12-31,1,-888,0,0,-888,"M",1944-01-01,1944,NA,-777
"2410","IRN-1848","A2.9-7228",630,"IRN","Nasir Ad-Din","13/09/1848","01/05/1896","17/07/1831","01/05/1896",1848-09-13,1896-05-01,0,3,-999,0,3,"M",1831-07-17,1831,1896-05-01,1896
"2411","IRN-1896","A2.9-7231",630,"IRN","Muzaffar ad-Din","02/05/1896","08/01/1907","25/3/1853","08/01/1907",1896-05-02,1907-01-08,0,2,0,0,-777,"M",1853-03-25,1853,1907-01-08,1907
"2412","IRN-1907","A2.9-7234",630,"IRN","Mohammed Ali Shah","08/01/1907","16/07/1909","21/6/1872","1924",1907-01-08,1909-07-16,0,1,0,0,1,"M",1872-06-21,1872,NA,1924
"2413","IRN-1909","A2.9-7237",630,"IRN","Sultan Ahmad","16/07/1909","21/02/1922","21/1/1898","1930",1909-07-16,1922-02-21,0,3,6,0,0,"M",1898-01-21,1898,NA,1930
"2414","IRN-1922","A2.9-7240",630,"IRN","Reza Khan","21/02/1922","16/09/1941","16/3/1878","26/07/1944",1922-02-21,1941-09-16,1,1,0,0,1,"M",1878-03-16,1878,1944-07-26,1944
"2415","IRN-1941","A2.9-7243",630,"IRN","Mohammad Reza","16/09/1941","30/04/1951","26/10/1919","27/07/1980",1941-09-16,1951-04-30,0,3,8,0,1,"M",1919-10-26,1919,1980-07-27,1980
"2416","IRN-1951","A2.9-7246",630,"IRN","Mohammad Mossadeg","30/04/1951","19/08/1953","19/05/1882","05/03/1967",1951-04-30,1953-08-19,1,3,8,0,2,"M",1882-05-19,1882,1967-03-05,1967
"2417","IRN-1953","A2.9-7249",630,"IRN","Mohammad Reza","19/08/1953","16/01/1979","26/10/1919","27/07/1980",1953-08-19,1979-01-16,1,3,2,1,1,"M",1919-10-26,1919,1980-07-27,1980
"2418","IRN-1979","A2.9-7252",630,"IRN","Ayatollah Khomeini","01/02/1979","03/06/1989","24/09/1902","03/06/1989",1979-02-01,1989-06-03,1,2,0,0,-777,"M",1902-09-24,1902,1989-06-03,1989
"2419","IRN-1989-1","A2.9-7255",630,"IRN","Khamenei","04/06/1989","03/08/1989","15/07/1939","-777",1989-06-04,1989-08-03,0,1,0,0,0,"M",1939-07-15,1939,NA,-777
"2420","IRN-1989-2","A2.9-7258",630,"IRN","Rafsanjani","17/08/1989","03/08/1997","29/9/1943","-777",1989-08-17,1997-08-03,0,1,0,0,0,"M",1943-09-29,1943,NA,-777
"2421","IRN-1997","A2.9-7261",630,"IRN","Khatami","03/08/1997","31/12/2004","2/2/1946","-777",1997-08-03,2004-12-31,0,-888,0,0,-888,"M",1946-02-02,1946,NA,-777
"2422","TUR-1861","A2.9-7264",640,"TUR","Abdul Aziz","25/06/1861","30/05/1876","1830","04/06/1876",1861-06-25,1876-05-30,0,3,-999,0,3,"M",NA,1830,1876-06-04,1876
"2423","TUR-1876-1","A2.9-7267",640,"TUR","Murad V","30/05/1876","30/08/1876","1840","1904",1876-05-30,1876-08-30,1,1,0,0,2,"M",NA,1840,NA,1904
"2424","TUR-1876-2","A2.9-7270",640,"TUR","Hamid II","30/08/1876","27/04/1909","21/9/1842","1918",1876-08-30,1909-04-27,0,3,-999,0,2,"M",1842-09-21,1842,NA,1918
"2425","TUR-1909","A2.9-7273",640,"TUR","Mahmud Sefket Pasha","27/04/1909","23/01/1913","3/11/1844","11/06/1913",1909-04-27,1913-01-23,1,3,-999,0,3,"M",1844-11-03,1844,1913-06-11,1913
"2426","TUR-1913","A2.9-7276",640,"TUR","Enver Pasha","23/01/1913","08/10/1918","22/11/1881","04/08/1922",1913-01-23,1918-10-08,1,3,-999,0,1,"M",1881-11-22,1881,1922-08-04,1922
"2427","TUR-1918","A2.9-7279",640,"TUR","Mehmet VI Vahidettin","08/10/1918","01/11/1922","14/1/1861","1926",1918-10-08,1922-11-01,1,3,8,0,1,"M",1861-01-14,1861,NA,1926
"2428","TUR-1922","A2.9-7282",640,"TUR","Ataturk","01/11/1922","10/11/1938","1881","10/11/1938",1922-11-01,1938-11-10,1,2,0,0,-777,"M",NA,1881,1938-11-10,1938
"2429","TUR-1938","A2.9-7285",640,"TUR","Inonu","11/11/1938","22/05/1950","25/9/1884","25/12/1973",1938-11-11,1950-05-22,0,1,0,0,0,"M",1884-09-25,1884,1973-12-25,1973
"2430","TUR-1950","A2.9-7288",640,"TUR","Menderes","22/05/1950","27/05/1960","1899","17/09/1961",1950-05-22,1960-05-27,0,3,6,0,3,"M",NA,1899,1961-09-17,1961
"2431","TUR-1960","A2.9-7291",640,"TUR","Gursel","27/05/1960","10/11/1961","1895","1966",1960-05-27,1961-11-10,1,1,0,0,0,"M",NA,1895,NA,1966
"2432","TUR-1961","A2.9-7294",640,"TUR","Inonu","10/11/1961","13/02/1965","25/9/1884","25/12/1973",1961-11-10,1965-02-13,0,1,0,1,0,"M",1884-09-25,1884,1973-12-25,1973
"2433","TUR-1965-1","A2.9-7297",640,"TUR","Urguplu","13/02/1965","27/10/1965","1902","1981",1965-02-13,1965-10-27,0,1,0,0,0,"M",NA,1902,NA,1981
"2434","TUR-1965-2","A2.9-7300",640,"TUR","Demirel","27/10/1965","12/03/1971","6/10/1924","-777",1965-10-27,1971-03-12,0,3,6,0,0,"M",1924-10-06,1924,NA,-777
"2435","TUR-1971","A2.9-7303",640,"TUR","Erim","19/03/1971","17/04/1972","1912","19/07/1980",1971-03-19,1972-04-17,1,1,0,0,0,"M",NA,1912,1980-07-19,1980
"2436","TUR-1972","A2.9-7306",640,"TUR","Melen","22/05/1972","15/04/1973","1906","03/09/1988",1972-05-22,1973-04-15,0,1,0,0,0,"M",NA,1906,1988-09-03,1988
"2437","TUR-1973","A2.9-7309",640,"TUR","Talu","15/04/1973","25/01/1974","22/7/1919","1998",1973-04-15,1974-01-25,0,1,0,0,0,"M",1919-07-22,1919,NA,1998
"2438","TUR-1974-1","A2.9-7312",640,"TUR","Ecevit","25/01/1974","07/11/1974","28/5/1925","05/11/2006",1974-01-25,1974-11-07,0,1,0,0,2,"M",1925-05-28,1925,2006-11-05,2006
"2439","TUR-1974-2","A2.9-7315",640,"TUR","Irmak","17/11/1974","31/03/1975","15/5/1901","1990",1974-11-17,1975-03-31,0,1,0,0,0,"M",1901-05-15,1901,NA,1990
"2440","TUR-1975","A2.9-7318",640,"TUR","Demirel","31/03/1975","21/06/1977","6/10/1924","-777",1975-03-31,1977-06-21,0,1,0,1,0,"M",1924-10-06,1924,NA,-777
"2441","TUR-1977-1","A2.9-7321",640,"TUR","Ecevit","21/06/1977","21/07/1977","28/5/1925","05/11/2006",1977-06-21,1977-07-21,0,1,0,1,2,"M",1925-05-28,1925,2006-11-05,2006
"2442","TUR-1977-2","A2.9-7324",640,"TUR","Demirel","21/07/1977","21/12/1977","6/10/1924","-777",1977-07-21,1977-12-21,0,1,0,2,0,"M",1924-10-06,1924,NA,-777
"2443","TUR-1978","A2.9-7327",640,"TUR","Ecevit","01/01/1978","12/11/1979","28/5/1925","05/11/2006",1978-01-01,1979-11-12,0,1,0,2,2,"M",1925-05-28,1925,2006-11-05,2006
"2444","TUR-1979","A2.9-7330",640,"TUR","Demirel","12/11/1979","20/09/1980","6/10/1924","-777",1979-11-12,1980-09-20,0,3,6,3,2,"M",1924-10-06,1924,NA,-777
"2445","TUR-1980","A2.9-7333",640,"TUR","Evren","20/09/1980","23/11/1983","1917","-777",1980-09-20,1983-11-23,1,1,0,0,0,"M",NA,1917,NA,-777
"2446","TUR-1983","A2.9-7336",640,"TUR","Ozal","13/12/1983","09/11/1989","13/10/1927","17/04/1993",1983-12-13,1989-11-09,0,1,0,0,0,"M",1927-10-13,1927,1993-04-17,1993
"2447","TUR-1989","A2.9-7339",640,"TUR","Akbulut","09/11/1989","24/06/1991","1935","-777",1989-11-09,1991-06-24,0,1,0,0,0,"M",NA,1935,NA,-777
"2448","TUR-1991-1","A2.9-7342",640,"TUR","Yilmaz","24/06/1991","20/11/1991","6/11/1947","-777",1991-06-24,1991-11-20,0,1,0,0,0,"M",1947-11-06,1947,NA,-777
"2449","TUR-1991-2","A2.9-7345",640,"TUR","Demirel","20/11/1991","16/05/1993","6/10/1924","-777",1991-11-20,1993-05-16,0,1,0,4,0,"M",1924-10-06,1924,NA,-777
"2450","TUR-1993-1","A2.9-7348",640,"TUR","Erdal Inonu","16/05/1993","25/06/1993","1926","-777",1993-05-16,1993-06-25,0,1,0,0,0,"M",NA,1926,NA,-777
"2451","TUR-1993-2","A2.9-7351",640,"TUR","Ciller","25/06/1993","06/03/1996","24/5/1946","-777",1993-06-25,1996-03-06,0,1,0,0,0,"F",1946-05-24,1946,NA,-777
"2452","TUR-1996-1","A2.9-7354",640,"TUR","Yilmaz","06/03/1996","28/06/1996","6/11/1947","-777",1996-03-06,1996-06-28,0,1,0,1,0,"M",1947-11-06,1947,NA,-777
"2453","TUR-1996-2","A2.9-7357",640,"TUR","Erbakan","28/06/1996","30/06/1997","29/10/1926","-777",1996-06-28,1997-06-30,0,3,6,0,0,"M",1926-10-29,1926,NA,-777
"2454","TUR-1997","A2.9-7360",640,"TUR","Yilmaz","30/06/1997","11/01/1999","6/11/1947","-777",1997-06-30,1999-01-11,1,1,0,2,0,"M",1947-11-06,1947,NA,-777
"2455","TUR-1999","A2.9-7363",640,"TUR","Ecevit","11/01/1999","18/11/2002","28/5/1925","05/11/2006",1999-01-11,2002-11-18,0,1,0,3,2,"M",1925-05-28,1925,2006-11-05,2006
"2456","TUR-2002","A2.9-7366",640,"TUR","Abdullah Gul","19/11/2002","14/03/2003","1950","-777",2002-11-19,2003-03-14,0,1,0,0,0,"M",NA,1950,NA,-777
"2457","TUR-2003","A2.9-7369",640,"TUR","Erdogan","14/03/2003","31/12/2004","26/02/1954","-777",2003-03-14,2004-12-31,0,-888,0,0,-888,"M",1954-02-26,1954,NA,-777
"2458","IRQ-1932","A2.9-7372",645,"IRQ","Faisal I","03/10/1932","08/09/1933","20/5/1885","08/09/1933",1932-10-03,1933-09-08,0,2,0,0,-777,"M",1885-05-20,1885,1933-09-08,1933
"2459","IRQ-1933","A2.9-7375",645,"IRQ","Ghazi","08/09/1933","04/04/1939","21/03/1912","04/04/1939",1933-09-08,1939-04-04,0,2,0,0,-777,"M",1912-03-21,1912,1939-04-04,1939
"2460","IRQ-1939","A2.9-7378",645,"IRQ","Abdul-Ilah","04/04/1939","02/05/1953","14/11/1913","14/07/1958",1939-04-04,1953-05-02,0,1,0,0,0,"M",1913-11-14,1913,1958-07-14,1958
"2461","IRQ-1953","A2.9-7381",645,"IRQ","Faisal II","02/05/1953","14/07/1958","2/5/1935","14/07/1958",1953-05-02,1958-07-14,0,3,6,0,3,"M",1935-05-02,1935,1958-07-14,1958
"2462","IRQ-1958","A2.9-7384",645,"IRQ","Karrim Kassem","14/07/1958","08/02/1963","04/05/1914","09/02/1963",1958-07-14,1963-02-08,1,3,6,0,3,"M",1914-05-04,1914,1963-02-09,1963
"2463","IRQ-1963","A2.9-7387",645,"IRQ","Salem Aref","08/02/1963","13/04/1966","21/3/1921","13/04/1966",1963-02-08,1966-04-13,1,2,0,0,-777,"M",1921-03-21,1921,1966-04-13,1966
"2464","IRQ-1966","A2.9-7390",645,"IRQ","Rahmen Aref","17/04/1966","17/07/1968","1916","-777",1966-04-17,1968-07-17,0,3,6,0,1,"M",NA,1916,NA,-777
"2465","IRQ-1968","A2.9-7393",645,"IRQ","Hassan Al-Bakr","17/07/1968","16/07/1979","01/07/1914","04/10/1982",1968-07-17,1979-07-16,1,1,0,0,-666,"M",1914-07-01,1914,1982-10-04,1982
"2466","IRQ-1979","A2.9-7396",645,"IRQ","Saddam Hussein","16/07/1979","09/04/2003","28/4/1937","30/12/2006",1979-07-16,2003-04-09,0,4,9,0,2,"M",1937-04-28,1937,2006-12-30,2006
"2467","IRQ-2003-1","A2.9-7399",645,"IRQ","Tommy Ray Franks","09/04/2003","21/04/2003","1945","-777",2003-04-09,2003-04-21,2,1,0,0,0,"M",NA,1945,NA,-777
"2468","IRQ-2003-2","A2.9-7402",645,"IRQ","Jay Garner","21/04/2003","12/05/2003","1938","-777",2003-04-21,2003-05-12,2,1,0,0,0,"M",NA,1938,NA,-777
"2469","IRQ-2003-3","A2.9-7405",645,"IRQ","Paul Bremer","12/05/2003","28/06/2004","1941","-777",2003-05-12,2004-06-28,2,1,0,0,0,"M",NA,1941,NA,-777
"2470","IRQ-2004","A2.9-7408",645,"IRQ","Iyad Allawi","28/06/2004","31/12/2004","1945","-777",2004-06-28,2004-12-31,0,-888,0,0,-888,"M",NA,1945,NA,-777
"2471","EGY-1922","A2.9-7411",651,"EGY","Fuad I","28/02/1922","28/04/1936","26/3/1868","28/04/1936",1922-02-28,1936-04-28,0,2,0,0,-777,"M",1868-03-26,1868,1936-04-28,1936
"2472","EGY-1936","A2.9-7414",651,"EGY","Farouk","28/04/1936","22/07/1952","11/2/1920","18/03/1965",1936-04-28,1952-07-22,0,3,6,0,1,"M",1920-02-11,1920,1965-03-18,1965
"2473","EGY-1952","A2.9-7417",651,"EGY","Naguib","23/07/1952","14/11/1954","20/2/1901","28/08/1984",1952-07-23,1954-11-14,1,1,0,0,1,"M",1901-02-20,1901,1984-08-28,1984
"2474","EGY-1954","A2.9-7420",651,"EGY","Nasser","17/11/1954","28/09/1970","15/1/1918","28/09/1970",1954-11-17,1970-09-28,1,2,0,0,-777,"M",1918-01-15,1918,1970-09-28,1970
"2475","EGY-1970","A2.9-7423",651,"EGY","Sadat","28/09/1970","06/10/1981","25/12/1918","06/10/1981",1970-09-28,1981-10-06,0,3,111,0,3,"M",1918-12-25,1918,1981-10-06,1981
"2476","EGY-1981","A2.9-7426",651,"EGY","Mubarak","14/10/1981","31/12/2004","4/5/1929","-777",1981-10-14,2004-12-31,0,-888,0,0,-888,"M",1929-05-04,1929,NA,-777
"2477","SYR-1943","A2.9-7429",652,"SYR","Kuwatli","17/08/1943","30/03/1949","1891","30/06/1967",1943-08-17,1949-03-30,0,3,6,0,1,"M",NA,1891,1967-06-30,1967
"2478","SYR-1949-1","A2.9-7432",652,"SYR","Al-Zaim","30/03/1949","13/08/1949","1897","1949",1949-03-30,1949-08-13,1,3,6,0,3,"M",NA,1897,NA,1949
"2479","SYR-1949-2","A2.9-7435",652,"SYR","Hinnawi","13/08/1949","19/12/1949","1898","1950",1949-08-13,1949-12-19,1,3,6,0,3,"M",NA,1898,NA,1950
"2480","SYR-1949-3","A2.9-7438",652,"SYR","Shishakli","19/12/1949","28/02/1954","1909","1964",1949-12-19,1954-02-28,1,3,6,0,1,"M",NA,1909,NA,1964
"2481","SYR-1954","A2.9-7441",652,"SYR","Atassi, H.","28/02/1954","06/09/1955","1875","05/12/1960",1954-02-28,1955-09-06,1,1,0,2,0,"M",NA,1875,1960-12-05,1960
"2482","SYR-1955","A2.9-7444",652,"SYR","Kuwatli","06/09/1955","01/02/1958","1891","30/06/1967",1955-09-06,1958-02-01,0,1,0,1,0,"M",NA,1891,1967-06-30,1967
"2483","SYR-1958","A2.9-7447",652,"SYR","Nasser (president of UAR)","01/02/1958","28/09/1961","15/1/1918","28/09/1970",1958-02-01,1961-09-28,0,3,6,0,0,"M",1918-01-15,1918,1970-09-28,1970
"2484","SYR-1961-1","A2.9-7450",652,"SYR","Al-kuzbari","28/09/1961","01/12/1961","1914","02/03/1998",1961-09-28,1961-12-01,1,1,0,0,0,"M",NA,1914,1998-03-02,1998
"2485","SYR-1961-2","A2.9-7453",652,"SYR","El-Kudsi","01/12/1961","28/03/1962","14/02/1906","06/02/1998",1961-12-01,1962-03-28,0,3,6,0,2,"M",1906-02-14,1906,1998-02-06,1998
"2486","SYR-1962-1","A2.9-7456",652,"SYR","Zahreddin","28/03/1962","13/04/1962","-999","-999",1962-03-28,1962-04-13,1,1,0,0,2,"M",NA,NA,NA,NA
"2487","SYR-1962-2","A2.9-7459",652,"SYR","El-Kudsi","13/04/1962","08/03/1963","14/02/1906","06/02/1998",1962-04-13,1963-03-08,0,3,6,1,2,"M",1906-02-14,1906,1998-02-06,1998
"2488","SYR-1963-1","A2.9-7462",652,"SYR","Atassi, L.","09/03/1963","27/07/1963","1926","2003",1963-03-09,1963-07-27,1,3,16,0,-666,"M",NA,1926,NA,2003
"2489","SYR-1963-2","A2.9-7465",652,"SYR","Al-Hafiz","27/07/1963","25/02/1966","1911","-777",1963-07-27,1966-02-25,1,3,6,0,2,"M",NA,1911,NA,-777
"2490","SYR-1966","A2.9-7468",652,"SYR","El-Atassi, N.","25/02/1966","13/11/1970","1929","03/12/1992",1966-02-25,1970-11-13,1,3,6,0,2,"M",NA,1929,1992-12-03,1992
"2491","SYR-1970","A2.9-7471",652,"SYR","Al-Khatib","18/11/1970","22/02/1971","1933","-777",1970-11-18,1971-02-22,1,1,0,0,0,"M",NA,1933,NA,-777
"2492","SYR-1971","A2.9-7474",652,"SYR","Al-Assad H.","22/02/1971","10/06/2000","6/10/1930","10/06/2000",1971-02-22,2000-06-10,0,2,0,0,-777,"M",1930-10-06,1930,2000-06-10,2000
"2493","SYR-2000","A2.9-7477",652,"SYR","Bashar al-Assad","11/06/2000","31/12/2004","1965","-777",2000-06-11,2004-12-31,0,-888,0,0,-888,"M",NA,1965,NA,-777
"2494","LEB-1943","A2.9-7480",660,"LEB","EL Khoury","22/11/1943","18/09/1952","10/8/1890","11/01/1964",1943-11-22,1952-09-18,0,1,0,1,0,"M",1890-08-10,1890,1964-01-11,1964
"2495","LEB-1952-1","A2.9-7483",660,"LEB","Chebab","19/09/1952","23/09/1952","09/03/1902","25/04/1973",1952-09-19,1952-09-23,0,1,0,0,0,"M",1902-03-09,1902,1973-04-25,1973
"2496","LEB-1952-2","A2.9-7486",660,"LEB","Chamoun","23/09/1952","23/09/1958","03/04/1900","07/08/1987",1952-09-23,1958-09-23,0,1,0,0,0,"M",1900-04-03,1900,1987-08-07,1987
"2497","LEB-1958","A2.9-7489",660,"LEB","Chehab","23/09/1958","23/09/1964","09/03/1902","25/04/1973",1958-09-23,1964-09-23,0,1,0,1,0,"M",1902-03-09,1902,1973-04-25,1973
"2498","LEB-1964","A2.9-7492",660,"LEB","Helou","23/09/1964","23/09/1970","25/12/1912","07/01/2001",1964-09-23,1970-09-23,0,1,0,0,0,"M",1912-12-25,1912,2001-01-07,2001
"2499","LEB-1970","A2.9-7495",660,"LEB","Franjieh","23/09/1970","23/09/1976","14/6/1910","23/07/1992",1970-09-23,1976-09-23,0,1,0,0,0,"M",1910-06-14,1910,1992-07-23,1992
"2500","LEB-1976","A2.9-7498",660,"LEB","Sarkis","23/09/1976","23/09/1982","20/7/1924","1985",1976-09-23,1982-09-23,0,1,0,0,0,"M",1924-07-20,1924,NA,1985
"2501","LEB-1982","A2.9-7501",660,"LEB","Gemayel, Amin","23/09/1982","23/09/1988","1942","-777",1982-09-23,1988-09-23,0,1,0,0,0,"M",NA,1942,NA,-777
"2502","LEB-1988","A2.9-7504",660,"LEB","Aoun","23/09/1988","05/11/1989","15/2/1935","-777",1988-09-23,1989-11-05,0,1,0,0,1,"M",1935-02-15,1935,NA,-777
"2503","LEB-1989-1","A2.9-7507",660,"LEB","Moawad","05/11/1989","22/11/1989","17/04/1925","22/11/1989",1989-11-05,1989-11-22,0,3,4,0,3,"M",1925-04-17,1925,1989-11-22,1989
"2504","LEB-1989-2","A2.9-7510",660,"LEB","Elias Hrawi","23/11/1989","24/11/1998","1930","2006",1989-11-23,1998-11-24,0,1,0,0,0,"M",NA,1930,NA,2006
"2505","LEB-1998","A2.9-7513",660,"LEB","Emile Lahoud","24/11/1998","31/12/2004","1936","-777",1998-11-24,2004-12-31,0,-888,0,0,-888,"M",NA,1936,NA,-777
"2506","JOR-1921","A2.9-7516",663,"JOR","Abdullah Al-Hussein","11/04/1921","20/07/1951","1882","20/07/1951",1921-04-11,1951-07-20,2,3,11,0,3,"M",NA,1882,1951-07-20,1951
"2507","JOR-1951-1","A2.9-7519",663,"JOR","Abdullah El-Hashim","20/07/1951","06/09/1951","1914","1983",1951-07-20,1951-09-06,0,1,0,0,1,"M",NA,1914,NA,1983
"2508","JOR-1951-2","A2.9-7522",663,"JOR","Ibn Abdullah-Hashim","06/09/1951","11/08/1952","1909","1972",1951-09-06,1952-08-11,0,1,0,0,1,"M",NA,1909,NA,1972
"2509","JOR-1952","A2.9-7525",663,"JOR","Hussein Ibn Talal El-Hashim","11/08/1952","07/02/1999","14/11/1935","07/02/1999",1952-08-11,1999-02-07,0,2,0,0,-777,"M",1935-11-14,1935,1999-02-07,1999
"2510","JOR-1999","A2.9-7528",663,"JOR","Abdullah Ibn Hussein El-Hashimi","07/02/1999","31/12/2004","30/1/1962","-777",1999-02-07,2004-12-31,0,-888,0,0,-888,"M",1962-01-30,1962,NA,-777
"2511","ISR-1948","A2.9-7531",666,"ISR","Ben Gurion","14/05/1948","08/12/1953","16/10/1886","1973",1948-05-14,1953-12-08,0,1,0,0,0,"M",1886-10-16,1886,NA,1973
"2512","ISR-1953","A2.9-7534",666,"ISR","Sharett","08/12/1953","03/11/1955","15/10/1894","1965",1953-12-08,1955-11-03,0,1,0,0,0,"M",1894-10-15,1894,NA,1965
"2513","ISR-1955","A2.9-7537",666,"ISR","Ben Gurion","03/11/1955","16/06/1963","16/10/1886","1973",1955-11-03,1963-06-16,0,1,0,1,0,"M",1886-10-16,1886,NA,1973
"2514","ISR-1963","A2.9-7540",666,"ISR","Eshkol","19/06/1963","26/02/1969","25/10/1895","26/02/1969",1963-06-19,1969-02-26,0,2,0,0,-777,"M",1895-10-25,1895,1969-02-26,1969
"2515","ISR-1969-1","A2.9-7543",666,"ISR","Allon","26/02/1969","17/03/1969","10/10/1918","1980",1969-02-26,1969-03-17,0,1,0,0,0,"M",1918-10-10,1918,NA,1980
"2516","ISR-1969-2","A2.9-7546",666,"ISR","Meir","17/03/1969","03/06/1974","3/5/1898","1978",1969-03-17,1974-06-03,0,1,0,0,0,"F",1898-05-03,1898,NA,1978
"2517","ISR-1974","A2.9-7549",666,"ISR","Rabin","03/06/1974","08/04/1977","1/3/1922","1995",1974-06-03,1977-04-08,0,1,0,0,0,"M",1922-03-01,1922,NA,1995
"2518","ISR-1977-1","A2.9-7552",666,"ISR","Peres","08/04/1977","21/06/1977","1/8/1923","-777",1977-04-08,1977-06-21,0,1,0,0,0,"M",1923-08-01,1923,NA,-777
"2519","ISR-1977-2","A2.9-7555",666,"ISR","Begin","21/06/1977","10/10/1983","16/8/1913","1992",1977-06-21,1983-10-10,0,1,0,0,0,"M",1913-08-16,1913,NA,1992
"2520","ISR-1983","A2.9-7558",666,"ISR","Shamir","10/10/1983","14/09/1984","3/11/1914","-777",1983-10-10,1984-09-14,0,1,0,0,0,"M",1914-11-03,1914,NA,-777
"2521","ISR-1984","A2.9-7561",666,"ISR","Peres","14/09/1984","20/10/1986","1/8/1923","-777",1984-09-14,1986-10-20,0,1,0,1,0,"M",1923-08-01,1923,NA,-777
"2522","ISR-1986","A2.9-7564",666,"ISR","Shamir","20/10/1986","12/07/1992","3/11/1914","-777",1986-10-20,1992-07-12,0,1,0,1,0,"M",1914-11-03,1914,NA,-777
"2523","ISR-1992","A2.9-7567",666,"ISR","Rabin","12/07/1992","04/11/1995","1/3/1922","04/11/1995",1992-07-12,1995-11-04,0,3,11,1,3,"M",1922-03-01,1922,1995-11-04,1995
"2524","ISR-1995","A2.9-7570",666,"ISR","Peres","04/11/1995","18/06/1996","1/8/1923","-777",1995-11-04,1996-06-18,0,1,0,2,0,"M",1923-08-01,1923,NA,-777
"2525","ISR-1996","A2.9-7573",666,"ISR","Netanyahu","18/06/1996","06/07/1999","1949","-777",1996-06-18,1999-07-06,0,1,0,0,0,"M",NA,1949,NA,-777
"2526","ISR-1999","A2.9-7576",666,"ISR","Barak","06/07/1999","07/03/2001","12/2/1942","-777",1999-07-06,2001-03-07,0,1,0,0,0,"M",1942-02-12,1942,NA,-777
"2527","ISR-2001","A2.9-7579",666,"ISR","Ariel Sharon","08/03/2001","31/12/2004","1928","-777",2001-03-08,2004-12-31,0,-888,0,0,-888,"M",NA,1928,NA,-777
"2528","SAU-1927","A2.9-7582",670,"SAU","Aziz","20/05/1927","09/11/1953","21/10/1882","09/11/1953",1927-05-20,1953-11-09,0,2,0,0,-777,"M",1882-10-21,1882,1953-11-09,1953
"2529","SAU-1953","A2.9-7585",670,"SAU","Saud","09/11/1953","02/11/1964","15/1/1902","1969",1953-11-09,1964-11-02,0,1,0,0,1,"M",1902-01-15,1902,NA,1969
"2530","SAU-1964","A2.9-7588",670,"SAU","Faisal","02/11/1964","25/03/1975","1905","25/03/1975",1964-11-02,1975-03-25,0,3,11,0,3,"M",NA,1905,1975-03-25,1975
"2531","SAU-1975","A2.9-7591",670,"SAU","Khalid","25/03/1975","13/06/1982","1913","13/06/1982",1975-03-25,1982-06-13,0,2,0,0,-777,"M",NA,1913,1982-06-13,1982
"2532","SAU-1982","A2.9-7594",670,"SAU","Fahd","13/06/1982","01/01/1996","1922","01/08/2005",1982-06-13,1996-01-01,0,2.1,0,0,0,"M",NA,1922,2005-08-01,2005
"2533","SAU-1996","A2.9-7597",670,"SAU","Abdullah","01/01/1996","31/12/2004","1924","-777",1996-01-01,2004-12-31,0,-888,0,0,-888,"M",NA,1924,NA,-777
"2534","YEM-1904","A2.9-7600",678,"YEM","Yahya","04/06/1904","17/02/1948","1876","1948",1904-06-04,1948-02-17,0,3,4,0,3,"M",NA,1876,NA,1948
"2535","YEM-1948-1","A2.9-7603",678,"YEM","Ibn Ahmed Alwazir","17/02/1948","13/03/1948","1888","1948",1948-02-17,1948-03-13,1,3,4,0,3,"M",NA,1888,NA,1948
"2536","YEM-1948-2","A2.9-7606",678,"YEM","Ibn Yahya Hamid","13/03/1948","18/09/1962","1891","18/09/1962",1948-03-13,1962-09-18,1,2,0,0,-777,"M",NA,1891,1962-09-18,1962
"2537","YEM-1962-1","A2.9-7609",678,"YEM","Al-Badr","18/09/1962","27/09/1962","1928","1996",1962-09-18,1962-09-27,1,3,6,0,0,"M",NA,1928,NA,1996
"2538","YEM-1962-2","A2.9-7612",678,"YEM","AL-Sallal","27/09/1962","05/11/1967","1917","1994",1962-09-27,1967-11-05,1,3,6,0,1,"M",NA,1917,NA,1994
"2539","YEM-1967","A2.9-7615",678,"YEM","Al-Iryani","05/11/1967","13/06/1974","18/7/1917","1998",1967-11-05,1974-06-13,1,3,6,0,1,"M",1917-07-18,1917,NA,1998
"2540","YEM-1974","A2.9-7618",678,"YEM","Al-Hamadi","13/06/1974","11/10/1977","1943","1977",1974-06-13,1977-10-11,1,3,111,0,3,"M",NA,1943,NA,1977
"2541","YEM-1977","A2.9-7621",678,"YEM","Al-Ghashmi","11/10/1977","24/06/1978","1939","1978",1977-10-11,1978-06-24,0,3,11,0,3,"M",NA,1939,NA,1978
"2542","YEM-1978","A2.9-7624",678,"YEM","Saleh al-Hashidi","17/07/1978","31/12/2004","1942","-777",1978-07-17,2004-12-31,0,-888,0,0,-888,"M",NA,1942,NA,-777
"2543","YPR-1967","A2.9-7627",680,"YPR","Al-Shaabi","30/11/1967","22/06/1969","1925","1976",1967-11-30,1969-06-22,1,3,8,0,2,"M",NA,1925,NA,1976
"2544","YPR-1969","A2.9-7630",680,"YPR","Ali Rubayyi","24/06/1969","26/06/1978","1934","1978",1969-06-24,1978-06-26,0,3,3,0,3,"M",NA,1934,NA,1978
"2545","YPR-1978-1","A2.9-7633",680,"YPR","Ali Nassir Hassani","27/06/1978","27/12/1978","1939","-777",1978-06-27,1978-12-27,1,1,0,0,0,"M",NA,1939,NA,-777
"2546","YPR-1978-2","A2.9-7636",680,"YPR","Ismail","27/12/1978","02/04/1980","1939","1986",1978-12-27,1980-04-02,0,1,0,0,0,"M",NA,1939,NA,1986
"2547","YPR-1980","A2.9-7639",680,"YPR","Ali Nassir Hassani","02/04/1980","24/01/1986","1939","-777",1980-04-02,1986-01-24,0,3,8,1,1,"M",NA,1939,NA,-777
"2548","YPR-1986","A2.9-7642",680,"YPR","Attas","24/01/1986","22/05/1990","1939","-777",1986-01-24,1990-05-22,1,1,0,0,0,"M",NA,1939,NA,-777
"2549","KUW-1950","A2.9-7645",690,"KUW","Abdullah As-Sabah","29/01/1950","24/11/1965","1895","24/11/1965",1950-01-29,1965-11-24,0,2,0,0,-777,"M",NA,1895,1965-11-24,1965
"2550","KUW-1965","A2.9-7648",690,"KUW","Sabah As-Sabah","24/11/1965","31/12/1977","1913","31/12/1977",1965-11-24,1977-12-31,0,2,0,0,-777,"M",NA,1913,1977-12-31,1977
"2551","KUW-1978","A2.9-7651",690,"KUW","Jabir As-Sabah","01/01/1978","02/08/1990","29/6/1926","-777",1978-01-01,1990-08-02,0,4,9,0,1,"M",1926-06-29,1926,NA,-777
"2552","KUW-1990","A2.9-7654",690,"KUW","Saddam Hussein","02/08/1990","20/04/1991","28/4/1937","30/12/2006",1990-08-02,1991-04-20,2,4,9,0,0,"M",1937-04-28,1937,2006-12-30,2006
"2553","KUW-1991","A2.9-7657",690,"KUW","Jabir As-Sabah","20/04/1991","31/12/2004","29/6/1926","-777",1991-04-20,2004-12-31,2,-888,0,1,-888,"M",1926-06-29,1926,NA,-777
"2554","BAH-1971","A2.9-7660",692,"BAH","Isa Ibn Al-Khalifah","15/08/1971","06/03/1999","3/7/1933","06/03/1999",1971-08-15,1999-03-06,0,2,0,0,-777,"M",1933-07-03,1933,1999-03-06,1999
"2555","BAH-1999","A2.9-7663",692,"BAH","Hamad Isa Ibn Al-Khalifah","06/03/1999","31/12/2004","28/1/1950","-777",1999-03-06,2004-12-31,0,-888,0,0,-888,"M",1950-01-28,1950,NA,-777
"2556","QAT-1971","A2.9-7666",694,"QAT","Ahmed Ath-Thani","03/09/1971","22/02/1972","1917","1977",1971-09-03,1972-02-22,0,3,8,0,1,"M",NA,1917,NA,1977
"2557","QAT-1972","A2.9-7669",694,"QAT","Khalifah Ath-Thani","22/02/1972","27/06/1995","1932","-777",1972-02-22,1995-06-27,1,3,8,0,1,"M",NA,1932,NA,-777
"2558","QAT-1995","A2.9-7672",694,"QAT","Amad Al Thani","27/06/1995","31/12/2004","1952","-777",1995-06-27,2004-12-31,1,-888,0,0,-888,"M",NA,1952,NA,-777
"2559","UAE-1971","A2.9-7675",696,"UAE","An-Nahayan","02/12/1971","31/12/2004","1918","-777",1971-12-02,2004-12-31,0,-888,0,0,-888,"M",NA,1918,NA,-777
"2560","OMA-1871","A2.9-7678",698,"OMA","Turki ibn Sa`id","30/01/1871","04/06/1888","1832","04/06/1888",1871-01-30,1888-06-04,1,2,0,0,-777,"M",NA,1832,1888-06-04,1888
"2561","OMA-1888","A2.9-7681",698,"OMA","Faysal ibn Turki","04/06/1888","05/10/1913","1864","05/10/1913",1888-06-04,1913-10-05,0,2,0,0,-777,"M",NA,1864,1913-10-05,1913
"2562","OMA-1913","A2.9-7684",698,"OMA","Taimur ibn Faysal","09/10/1913","10/02/1932","4/6/1888","1965",1913-10-09,1932-02-10,0,1,0,0,-666,"M",1888-06-04,1888,NA,1965
"2563","OMA-1932","A2.9-7687",698,"OMA","Sa`id ibn Taimur","10/02/1932","23/07/1970","13/4/1910","1972",1932-02-10,1970-07-23,0,3,8,0,1,"M",1910-04-13,1910,NA,1972
"2564","OMA-1970","A2.9-7690",698,"OMA","Qabus Bin Said","23/07/1970","31/12/2004","18/11/1940","-777",1970-07-23,2004-12-31,1,-888,0,0,-888,"M",1940-11-18,1940,NA,-777
"2565","AFG-1868","A2.9-7693",700,"AFG","Shir `Ali Khan","08/09/1868","21/02/1879","1825","21/02/1879",1868-09-08,1879-02-21,1,1,0,1,1,"M",NA,1825,1879-02-21,1879
"2566","AFG-1879-1","A2.9-7696",700,"AFG","Mohammad Ya`qub Khan","21/02/1879","12/10/1879","1849","1923",1879-02-21,1879-10-12,0,4,-999,0,1,"M",NA,1849,NA,1923
"2567","AFG-1879-2","A2.9-7699",700,"AFG","Mohammad Jan","12/10/1879","31/03/1880","-999","31/03/1880",1879-10-12,1880-03-31,2,2,0,0,-777,"M",NA,NA,1880-03-31,1880
"2568","AFG-1880","A2.9-7702",700,"AFG","Abdor Rahman Khan","22/07/1880","03/10/1901","1844","03/10/1901",1880-07-22,1901-10-03,2,2,0,0,-777,"M",NA,1844,1901-10-03,1901
"2569","AFG-1901","A2.9-7705",700,"AFG","Habibullah Khan","03/10/1901","20/02/1919","3/7/1872","20/02/1919",1901-10-03,1919-02-20,0,3,11,0,3,"M",1872-07-03,1872,1919-02-20,1919
"2570","AFG-1920","A2.9-7708",700,"AFG","Amanullah Khan","01/01/1920","14/01/1929","1/6/1892","25/04/1960",1920-01-01,1929-01-14,1,1,0,0,1,"M",1892-06-01,1892,1960-04-25,1960
"2571","AFG-1929-1","A2.9-7711",700,"AFG","Inayatullah Khan","14/01/1929","17/01/1929","20/10/1888","1946",1929-01-14,1929-01-17,0,3,4,0,1,"M",1888-10-20,1888,NA,1946
"2572","AFG-1929-2","A2.9-7714",700,"AFG","Habibullah Ghazi","17/01/1929","17/10/1929","1890","1929",1929-01-17,1929-10-17,1,3,4,0,3,"M",NA,1890,NA,1929
"2573","AFG-1929-3","A2.9-7717",700,"AFG","Nadir Shah","17/10/1929","08/11/1933","10/4/1880","1933",1929-10-17,1933-11-08,1,3,11,0,3,"M",1880-04-10,1880,NA,1933
"2574","AFG-1933","A2.9-7720",700,"AFG","Hashim Khan","08/11/1933","14/05/1946","1884","1953",1933-11-08,1946-05-14,0,2.1,0,0,0,"M",NA,1884,NA,1953
"2575","AFG-1946","A2.9-7723",700,"AFG","Mahmud Khan Ghazi","14/05/1946","07/09/1953","1888","1959",1946-05-14,1953-09-07,0,3,8,0,0,"M",NA,1888,NA,1959
"2576","AFG-1953","A2.9-7726",700,"AFG","Sardar Mohammad Daud Khan","07/09/1953","10/03/1963","18/07/1909","27/04/1978",1953-09-07,1963-03-10,1,1,0,0,0,"M",1909-07-18,1909,1978-04-27,1978
"2577","AFG-1963","A2.9-7729",700,"AFG","Mohammad Yusuf","10/03/1963","2/11/1965","1917","1998",1963-03-10,1965-11-02,0,1,0,0,0,"M",NA,1917,NA,1998
"2578","AFG-1965","A2.9-7732",700,"AFG","Mohammad Hashim Maiwandwal","2/11/1965","11/10/1967","1919","1973",1965-11-02,1967-10-11,0,2.1,0,0,0,"M",NA,1919,NA,1973
"2579","AFG-1967-1","A2.9-7735",700,"AFG","Abdallah Yakta","11/10/1967","1/11/1967","-999","-999",1967-10-11,1967-11-01,0,1,0,0,0,"M",NA,NA,NA,NA
"2580","AFG-1967-2","A2.9-7738",700,"AFG","Nur Ahmad Etemadi","01/11/1967","09/06/1971","1921","1979",1967-11-01,1971-06-09,0,1,0,0,0,"M",NA,1921,NA,1979
"2581","AFG-1971","A2.9-7741",700,"AFG","Abdul Zahir","09/06/1971","06/12/1972","1910","1982",1971-06-09,1972-12-06,0,1,0,0,0,"M",NA,1910,NA,1982
"2582","AFG-1972","A2.9-7744",700,"AFG","Mohammad Musa Shafiq","12/12/1972","17/07/1973","1932","1979",1972-12-12,1973-07-17,0,3,6,0,2,"M",NA,1932,NA,1979
"2583","AFG-1973","A2.9-7747",700,"AFG","Sardar Mohammad Daud Khan","17/07/1973","27/04/1978","18/07/1909","27/04/1978",1973-07-17,1978-04-27,1,3,6,1,3,"M",1909-07-18,1909,1978-04-27,1978
"2584","AFG-1978","A2.9-7750",700,"AFG","Taraki","30/04/1978","27/03/1979","1917","1979",1978-04-30,1979-03-27,1,3,8,0,3,"M",NA,1917,NA,1979
"2585","AFG-1979-1","A2.9-7753",700,"AFG","Amin","27/03/1979","27/12/1979","1/8/1929","1979",1979-03-27,1979-12-27,1,3,7,0,3,"M",1929-08-01,1929,NA,1979
"2586","AFG-1979-2","A2.9-7756",700,"AFG","Karmal","27/12/1979","04/05/1986","06/01/1929","01/12/1996",1979-12-27,1986-05-04,1,4,9,0,1,"M",1929-01-06,1929,1996-12-01,1996
"2587","AFG-1986","A2.9-7759",700,"AFG","Najibullah","04/05/1986","16/04/1992","06/08/1947","27/09/1996",1986-05-04,1992-04-16,1,3,4,0,1,"M",1947-08-06,1947,1996-09-27,1996
"2588","AFG-1992-1","A2.9-7762",700,"AFG","Mojadidi","28/04/1992","28/06/1992","1926","-777",1992-04-28,1992-06-28,1,1,0,0,-666,"M",NA,1926,NA,-777
"2589","AFG-1992-2","A2.9-7765",700,"AFG","Burhanuddin Rabbani","28/06/1992","27/09/1996","1939","-777",1992-06-28,1996-09-27,0,3,4,0,0,"M",NA,1939,NA,-777
"2590","AFG-1996","A2.9-7768",700,"AFG","Mullah Omar","27/09/1996","13/11/2001","1959","-777",1996-09-27,2001-11-13,1,3,3,0,0,"M",NA,1959,NA,-777
"2591","AFG-2001","A2.9-7771",700,"AFG","Hamid Karzai","22/12/2001","31/12/2004","24/12/1957","-777",2001-12-22,2004-12-31,2,-888,0,0,-888,"M",1957-12-24,1957,NA,-777
"2592","TKM-1990","A2.9-7774",701,"TKM","Niyazov","27/10/1990","31/12/2004","19/02/1940","21/12/2006",1990-10-27,2004-12-31,0,-888,0,0,-888,"M",1940-02-19,1940,2006-12-21,2006
"2593","TAJ-1991-1","A2.9-7777",702,"TAJ","Kadreddin Aslonov","31/08/1991","23/09/1991","1947","-777",1991-08-31,1991-09-23,0,1,0,0,0,"M",NA,1947,NA,-777
"2594","TAJ-1991-2","A2.9-7780",702,"TAJ","Nabiyev","23/09/1991","07/09/1992","05/10/1930","1993",1991-09-23,1992-09-07,1,3,4,0,0,"M",1930-10-05,1930,NA,1993
"2595","TAJ-1992-1","A2.9-7783",702,"TAJ","Iskandrov","07/09/1992","20/11/1992","1951","-777",1992-09-07,1992-11-20,0,1,0,0,0,"M",NA,1951,NA,-777
"2596","TAJ-1992-2","A2.9-7786",702,"TAJ","Rakhmonov","20/11/1992","31/12/2004","1952","-777",1992-11-20,2004-12-31,1,-888,0,0,-888,"M",NA,1952,NA,-777
"2597","KYR-1990","A2.9-7789",703,"KYR","Akayev","27/10/1990","31/12/2004","10/11/1944","-777",1990-10-27,2004-12-31,0,-888,0,0,-888,"M",1944-11-10,1944,NA,-777
"2598","UZB-1990","A2.9-7792",704,"UZB","Karimov","24/03/1990","31/12/2004","30/01/1938","-777",1990-03-24,2004-12-31,0,-888,0,0,-888,"M",1938-01-30,1938,NA,-777
"2599","KZK-1990","A2.9-7795",705,"KZK","Nazarbaev","24/04/1990","31/12/2004","6/7/1940","-777",1990-04-24,2004-12-31,0,-888,0,0,-888,"M",1940-07-06,1940,NA,-777
"2600","CHN-1861","A2.9-7798",710,"CHN","Tz'u Hsi","22/08/1861","15/11/1908","1835","15/11/1908",1861-08-22,1908-11-15,0,2,0,0,-777,"M",NA,1835,1908-11-15,1908
"2601","CHN-1908","A2.9-7801",710,"CHN","Zaifeng","02/12/1908","06/12/1911","1882","1951",1908-12-02,1911-12-06,0,3,-999,0,0,"M",NA,1882,NA,1951
"2602","CHN-1911","A2.9-7804",710,"CHN","Empress Dowager Jonyu","06/12/1911","12/01/1912","1868","1913",1911-12-06,1912-01-12,0,3,-999,0,0,"F",NA,1868,NA,1913
"2603","CHN-1912-1","A2.9-7807",710,"CHN","Sun Yat-sen","12/01/1912","15/02/1912","12/11/1866","1925",1912-01-12,1912-02-15,1,1,0,0,0,"M",1866-11-12,1866,NA,1925
"2604","CHN-1912-2","A2.9-7810",710,"CHN","Yuan Shih-kai","15/02/1912","06/06/1916","16/9/1859","1916",1912-02-15,1916-06-06,0,2,0,0,-777,"M",1859-09-16,1859,NA,1916
"2605","CHN-1916","A2.9-7813",710,"CHN","Li Yuan-Hung","06/06/1916","14/08/1917","1864","03/06/1928",1916-06-06,1917-08-14,0,3,-999,0,0,"M",NA,1864,1928-06-03,1928
"2606","CHN-1917","A2.9-7816",710,"CHN","Feng Kuo-chang","14/08/1917","04/09/1918","7/1/1859","1919",1917-08-14,1918-09-04,1,1,0,0,0,"M",1859-01-07,1859,NA,1919
"2607","CHN-1918","A2.9-7819",710,"CHN","Hsu Shih-ch'ang","04/09/1918","02/06/1922","23/10/1855","1939",1918-09-04,1922-06-02,0,1,0,0,0,"M",1855-10-23,1855,NA,1939
"2608","CHN-1922","A2.9-7822",710,"CHN","Li Yuan-Hung","11/06/1922","14/06/1923","1864","03/06/1928",1922-06-11,1923-06-14,0,3,6,1,1,"M",NA,1864,1928-06-03,1928
"2609","CHN-1923","A2.9-7825",710,"CHN","Tsao Kun","05/10/1923","02/11/1924","12/12/1862","1938",1923-10-05,1924-11-02,1,3,6,0,2,"M",1862-12-12,1862,NA,1938
"2610","CHN-1924","A2.9-7828",710,"CHN","Tuan Chi-jui","24/11/1924","20/04/1926","6/3/1865","1936",1924-11-24,1926-04-20,1,3,6,0,0,"M",1865-03-06,1865,NA,1936
"2611","CHN-1926","A2.9-7831",710,"CHN","Chang Tso-lin","21/04/1926","10/10/1928","1873","1928",1926-04-21,1928-10-10,1,4,9,0,3,"M",NA,1873,NA,1928
"2612","CHN-1928","A2.9-7834",710,"CHN","Chiang Kai-shek","10/10/1928","14/12/1937","31/10/1886","05/04/1975",1928-10-10,1937-12-14,1,4,9,0,0,"M",1886-10-31,1886,1975-04-05,1975
"2613","CHN-1937","A2.9-7837",710,"CHN","Wang Kemin","14/12/1937","30/03/1940","1873","1945",1937-12-14,1940-03-30,2,1,0,0,0,"M",NA,1873,NA,1945
"2614","CHN-1940","A2.9-7840",710,"CHN","Wang Jingwei","30/03/1940","10/11/1944","1883","10/11/1944",1940-03-30,1944-11-10,0,2,0,0,-777,"M",NA,1883,1944-11-10,1944
"2615","CHN-1944","A2.9-7843",710,"CHN","Chen Gongbo","20/11/1944","01/08/1945","1892","1946",1944-11-20,1945-08-01,0,3,3,0,1,"M",NA,1892,NA,1946
"2616","CHN-1946","A2.9-7846",710,"CHN","Chiang Kai-shek","26/12/1946","21/01/1949","31/10/1886","05/04/1975",1946-12-26,1949-01-21,1,3,4,1,1,"M",1886-10-31,1886,1975-04-05,1975
"2617","CHN-1949","A2.9-7849",710,"CHN","Mao Tse-Tung","01/10/1949","09/09/1976","26/12/1893","09/09/1976",1949-10-01,1976-09-09,1,2,0,0,-777,"M",1893-12-26,1893,1976-09-09,1976
"2618","CHN-1976","A2.9-7852",710,"CHN","Hua Guofeng","07/10/1976","10/09/1980","16/2/1921","-777",1976-10-07,1980-09-10,0,1,0,0,0,"M",1921-02-16,1921,NA,-777
"2619","CHN-1980","A2.9-7855",710,"CHN","Deng Xiaoping","10/09/1980","19/02/1997","22/8/1904","19/02/1997",1980-09-10,1997-02-19,0,2,0,0,-777,"M",1904-08-22,1904,1997-02-19,1997
"2620","CHN-1997","A2.9-7858",710,"CHN","Jiang Zemin","19/02/1997","15/03/2003","17/8/1926","-777",1997-02-19,2003-03-15,0,1,0,0,0,"M",1926-08-17,1926,NA,-777
"2621","CHN-2003","A2.9-7861",710,"CHN","Hu Jintao","15/03/2003","31/12/2004","1942","-777",2003-03-15,2004-12-31,0,-888,0,0,-888,"M",NA,1942,NA,-777
"2622","TBT-1875","A2.9-7864",711,"TBT","Tatsak Rinpoche","25/04/1875","15/06/1886","-999","15/06/1886",1875-04-25,1886-06-15,0,2,0,0,-777,"M",NA,NA,1886-06-15,1886
"2623","TBT-1886","A2.9-7867",711,"TBT","Demo Tulku Trinley Rabgyey","15/06/1886","08/01/1895","-999","08/01/1895",1886-06-15,1895-01-08,0,2,0,0,-777,"M",NA,NA,1895-01-08,1895
"2624","TBT-1895","A2.9-7870",711,"TBT","13th Dalai Lama","08/01/1895","17/12/1933","26/6/1876","17/12/1933",1895-01-08,1933-12-17,0,2,0,0,-777,"M",1876-06-26,1876,1933-12-17,1933
"2625","TBT-1933","A2.9-7873",711,"TBT","Radreng Hutukto","17/12/1933","30/06/1941","1911","1947",1933-12-17,1941-06-30,0,1,0,0,-666,"M",NA,1911,NA,1947
"2626","TBT-1941","A2.9-7876",711,"TBT","Taktra Rimpoche","30/06/1941","17/11/1950","-999","-999",1941-06-30,1950-11-17,0,1,0,0,-666,"M",NA,NA,NA,NA
"2627","TBT-1950","A2.9-7879",711,"TBT","14th Dalai Lama","17/11/1950","23/05/1951","7/6/1935","-777",1950-11-17,1951-05-23,0,4,9,0,1,"M",1935-06-07,1935,NA,-777
"2628","MON-1921-1","A2.9-7882",712,"MON","Chagdarjav","13/03/1921","16/04/1921","1880","31/08/1922",1921-03-13,1921-04-16,2,1,0,0,0,"M",NA,1880,1922-08-31,1922
"2629","MON-1921-2","A2.9-7885",712,"MON","Dogsomyn Bodo","16/04/1921","07/01/1922","1895","31/08/1922",1921-04-16,1922-01-07,0,1,0,0,3,"M",NA,1895,1922-08-31,1922
"2630","MON-1922","A2.9-7888",712,"MON","Sukhebaatur","07/01/1922","23/02/1923","02/02/1893","23/02/1923",1922-01-07,1923-02-23,0,2,0,0,-777,"M",1893-02-02,1893,1923-02-23,1923
"2631","MON-1923","A2.9-7891",712,"MON","Danzin","23/02/1923","26/08/1924","1885","30/08/1924",1923-02-23,1924-08-26,0,3,8,0,3,"M",NA,1885,1924-08-30,1924
"2632","MON-1924","A2.9-7894",712,"MON","Elbek-Dorzhi Rinchino","26/08/1924","15/07/1925","16/05/1898","23/06/1938",1924-08-26,1925-07-15,0,4,111,0,1,"M",1898-05-16,1898,1938-06-23,1938
"2633","MON-1925","A2.9-7897",712,"MON","Dambadorji","15/07/1925","15/10/1928","1899","25/06/1934",1925-07-15,1928-10-15,0,1,0,0,1,"M",NA,1899,1934-06-25,1934
"2634","MON-1928","A2.9-7900",712,"MON","Gendun","15/10/1928","20/03/1936","1895","1937",1928-10-15,1936-03-20,0,1,0,0,1,"M",NA,1895,NA,1937
"2635","MON-1936","A2.9-7903",712,"MON","Choibalsan","22/03/1936","26/01/1952","8/2/1895","26/01/1952",1936-03-22,1952-01-26,0,2,0,0,-777,"M",1895-02-08,1895,1952-01-26,1952
"2636","MON-1952","A2.9-7906",712,"MON","Tsedenbal","26/01/1952","23/08/1984","17/9/1916","1991",1952-01-26,1984-08-23,0,4,111,0,1,"M",1916-09-17,1916,NA,1991
"2637","MON-1984","A2.9-7909",712,"MON","Batmonh","23/08/1984","12/03/1990","10/3/1926","1997",1984-08-23,1990-03-12,0,1,0,0,0,"M",1926-03-10,1926,NA,1997
"2638","MON-1990","A2.9-7912",712,"MON","Ochirbat","12/03/1990","20/06/1997","1942","-777",1990-03-12,1997-06-20,0,1,0,0,0,"M",NA,1942,NA,-777
"2639","MON-1997","A2.9-7915",712,"MON","Bagabandi","20/06/1997","31/12/2004","22/4/1950","-777",1997-06-20,2004-12-31,0,-888,0,0,-888,"M",1950-04-22,1950,NA,-777
"2640","TAW-1949","A2.9-7918",713,"TAW","Li Tsung-jen","21/01/1949","28/02/1950","1890","13/01/1969",1949-01-21,1950-02-28,0,3,8,0,1,"M",NA,1890,1969-01-13,1969
"2641","TAW-1950","A2.9-7921",713,"TAW","Chiang Kai-shek","01/03/1950","05/04/1975","31/10/1886","05/04/1975",1950-03-01,1975-04-05,0,2,0,0,-777,"M",1886-10-31,1886,1975-04-05,1975
"2642","TAW-1975","A2.9-7924",713,"TAW","Yen Chia-Kan","05/04/1975","20/05/1978","23/11/1905","1993",1975-04-05,1978-05-20,0,2,0,0,-777,"M",1905-11-23,1905,NA,1993
"2643","TAW-1978","A2.9-7927",713,"TAW","Chiang Ching-Kuo","20/05/1978","13/01/1988","18/3/1910","1988",1978-05-20,1988-01-13,0,2,0,0,-777,"M",1910-03-18,1910,NA,1988
"2644","TAW-1988","A2.9-7930",713,"TAW","Lee Teng-Hui","13/01/1988","20/05/2000","15/1/1923","-777",1988-01-13,2000-05-20,0,1,0,0,0,"M",1923-01-15,1923,NA,-777
"2645","TAW-2000","A2.9-7933",713,"TAW","Chen Shui-bian","21/05/2000","31/12/2004","1950","-777",2000-05-21,2004-12-31,0,-888,0,0,-888,"M",NA,1950,NA,-777
"2646","KOR-1873","A2.9-7936",730,"KOR","Yi Hyong","22/12/1873","20/07/1907","1852","1919",1873-12-22,1907-07-20,0,4,-999,0,1,"M",NA,1852,NA,1919
"2647","KOR-1907","A2.9-7939",730,"KOR","Yi Ch'ok","20/07/1907","29/08/1910","1874","1926",1907-07-20,1910-08-29,2,4,-999,0,0,"M",NA,1874,NA,1926
"2648","PRK-1948","A2.9-7942",731,"PRK","Kim Il-Sung","09/09/1948","08/07/1994","15/4/1912","1994",1948-09-09,1994-07-08,0,2,0,0,-777,"M",1912-04-15,1912,NA,1994
"2649","PRK-1994","A2.9-7945",731,"PRK","Kim Jong-Il","08/07/1994","31/12/2004","16/2/1942","-777",1994-07-08,2004-12-31,0,-888,0,0,-888,"M",1942-02-16,1942,NA,-777
"2650","ROK-1948","A2.9-7948",732,"ROK","Rhee","15/08/1948","27/04/1960","26/4/1875","1965",1948-08-15,1960-04-27,0,3,2,0,1,"M",1875-04-26,1875,NA,1965
"2651","ROK-1960-1","A2.9-7951",732,"ROK","Ho Chong","27/04/1960","12/08/1960","1896","1988",1960-04-27,1960-08-12,0,1,0,0,0,"M",NA,1896,NA,1988
"2652","ROK-1960-2","A2.9-7954",732,"ROK","Myun Chang","12/08/1960","16/05/1961","28/08/1899","1966",1960-08-12,1961-05-16,0,3,6,0,2,"M",1899-08-28,1899,NA,1966
"2653","ROK-1961-1","A2.9-7957",732,"ROK","Chang Do Yong","18/05/1961","03/07/1961","1923","-777",1961-05-18,1961-07-03,1,3,16,0,2,"M",NA,1923,NA,-777
"2654","ROK-1961-2","A2.9-7960",732,"ROK","Hee Park","03/07/1961","26/10/1979","30/9/1917","26/10/1979",1961-07-03,1979-10-26,1,3,8,0,3,"M",1917-09-30,1917,1979-10-26,1979
"2655","ROK-1979","A2.9-7963",732,"ROK","Choi Kuy Hay","26/10/1979","16/08/1980","16/7/1919","2006",1979-10-26,1980-08-16,0,1,0,0,0,"M",1919-07-16,1919,NA,2006
"2656","ROK-1980-1","A2.9-7966",732,"ROK","Park Choong Hoon","16/08/1980","27/08/1980","19/01/1919","2001",1980-08-16,1980-08-27,0,1,0,0,0,"M",1919-01-19,1919,NA,2001
"2657","ROK-1980-2","A2.9-7969",732,"ROK","Chun Doo Hwan","27/08/1980","25/02/1988","18/1/1931","-777",1980-08-27,1988-02-25,0,1,0,0,0,"M",1931-01-18,1931,NA,-777
"2658","ROK-1988","A2.9-7972",732,"ROK","Roh Tae Woo","25/02/1988","25/02/1993","4/12/1932","-777",1988-02-25,1993-02-25,0,1,0,0,0,"M",1932-12-04,1932,NA,-777
"2659","ROK-1993","A2.9-7975",732,"ROK","Kim Young Sam","25/02/1993","25/02/1998","20/12/1927","-777",1993-02-25,1998-02-25,0,1,0,0,0,"M",1927-12-20,1927,NA,-777
"2660","ROK-1998","A2.9-7978",732,"ROK","Kim Dae Jung","25/02/1998","25/02/2003","3/12/1925","-777",1998-02-25,2003-02-25,0,1,0,0,0,"M",1925-12-03,1925,NA,-777
"2661","ROK-2003","A2.9-7981",732,"ROK","Roh Moo Hyun","25/02/2003","31/12/2004","1946","-777",2003-02-25,2004-12-31,0,-888,0,0,-888,"M",NA,1946,NA,-777
"2662","JPN-1868","A2.9-7984",740,"JPN","Mutsuhito (Emperor)","03/01/1868","22/12/1885","3/11/1852","30/07/1912",1868-01-03,1885-12-22,0,1,0,0,0,"M",1852-11-03,1852,1912-07-30,1912
"2663","JPN-1885","A2.9-7987",740,"JPN","Ito","22/12/1885","30/04/1888","2/9/1842","1909",1885-12-22,1888-04-30,0,1,0,0,0,"M",1842-09-02,1842,NA,1909
"2664","JPN-1888","A2.9-7990",740,"JPN","Kuroda","30/04/1888","24/12/1889","1840","1900",1888-04-30,1889-12-24,0,1,0,0,0,"M",NA,1840,NA,1900
"2665","JPN-1889","A2.9-7993",740,"JPN","Yamagata","24/12/1889","06/05/1891","22/04/1838","1922",1889-12-24,1891-05-06,0,1,0,0,0,"M",1838-04-22,1838,NA,1922
"2666","JPN-1891","A2.9-7996",740,"JPN","Matsukata","06/05/1891","08/08/1892","1835","1924",1891-05-06,1892-08-08,0,1,0,0,0,"M",NA,1835,NA,1924
"2667","JPN-1892","A2.9-7999",740,"JPN","Ito","08/08/1892","18/09/1896","2/9/1842","1909",1892-08-08,1896-09-18,0,1,0,1,0,"M",1842-09-02,1842,NA,1909
"2668","JPN-1896","A2.9-8002",740,"JPN","Matsukata","18/09/1896","14/04/1897","1835","1924",1896-09-18,1897-04-14,0,1,0,1,0,"M",NA,1835,NA,1924
"2669","JPN-1897-1","A2.9-8005",740,"JPN","Kuroda","14/04/1897","08/06/1897","1840","1900",1897-04-14,1897-06-08,0,1,0,1,0,"M",NA,1840,NA,1900
"2670","JPN-1897-2","A2.9-8008",740,"JPN","Matsukata","08/06/1897","12/01/1898","1835","1924",1897-06-08,1898-01-12,0,1,0,2,0,"M",NA,1835,NA,1924
"2671","JPN-1898-1","A2.9-8011",740,"JPN","Ito","12/01/1898","30/06/1898","2/9/1842","1909",1898-01-12,1898-06-30,0,1,0,2,0,"M",1842-09-02,1842,NA,1909
"2672","JPN-1898-2","A2.9-8014",740,"JPN","Okuma","30/06/1898","31/10/1898","1838","1922",1898-06-30,1898-10-31,0,1,0,0,0,"M",NA,1838,NA,1922
"2673","JPN-1898-3","A2.9-8017",740,"JPN","Yamagata","07/11/1898","19/10/1900","22/04/1838","1922",1898-11-07,1900-10-19,0,1,0,1,0,"M",1838-04-22,1838,NA,1922
"2674","JPN-1900","A2.9-8020",740,"JPN","Ito","19/10/1900","10/05/1901","2/9/1842","1909",1900-10-19,1901-05-10,0,1,0,3,0,"M",1842-09-02,1842,NA,1909
"2675","JPN-1901-1","A2.9-8023",740,"JPN","Saionji","10/05/1901","02/06/1901","1849","1940",1901-05-10,1901-06-02,0,1,0,0,0,"M",NA,1849,NA,1940
"2676","JPN-1901-2","A2.9-8026",740,"JPN","Katsura","02/06/1901","07/01/1906","28/11/1847","1913",1901-06-02,1906-01-07,0,1,0,0,0,"M",1847-11-28,1847,NA,1913
"2677","JPN-1906","A2.9-8029",740,"JPN","Saionji","07/01/1906","14/07/1908","1849","1940",1906-01-07,1908-07-14,0,1,0,1,0,"M",NA,1849,NA,1940
"2678","JPN-1908","A2.9-8032",740,"JPN","Katsura","14/07/1908","30/08/1911","28/11/1847","1913",1908-07-14,1911-08-30,0,1,0,1,0,"M",1847-11-28,1847,NA,1913
"2679","JPN-1911","A2.9-8035",740,"JPN","Saionji","30/08/1911","21/12/1912","1849","1940",1911-08-30,1912-12-21,0,1,0,2,0,"M",NA,1849,NA,1940
"2680","JPN-1912","A2.9-8038",740,"JPN","Katsura","21/12/1912","20/02/1913","28/11/1847","10/10/1913",1912-12-21,1913-02-20,0,1,0,2,0,"M",1847-11-28,1847,1913-10-10,1913
"2681","JPN-1913","A2.9-8041",740,"JPN","Yamamoto, G.","20/02/1913","16/04/1914","1852","1933",1913-02-20,1914-04-16,0,1,0,0,0,"M",NA,1852,NA,1933
"2682","JPN-1914","A2.9-8044",740,"JPN","Okuma","16/04/1914","09/10/1916","1838","1922",1914-04-16,1916-10-09,0,1,0,1,0,"M",NA,1838,NA,1922
"2683","JPN-1916","A2.9-8047",740,"JPN","Terauchi","09/10/1916","29/09/1918","1852","1919",1916-10-09,1918-09-29,0,1,0,0,0,"M",NA,1852,NA,1919
"2684","JPN-1918","A2.9-8050",740,"JPN","Hara, T.","29/09/1918","04/11/1921","9/2/1856","1921",1918-09-29,1921-11-04,0,3,11,0,3,"M",1856-02-09,1856,NA,1921
"2685","JPN-1921-1","A2.9-8053",740,"JPN","Uchida","04/11/1921","13/11/1921","1865","1936",1921-11-04,1921-11-13,0,1,0,0,0,"M",NA,1865,NA,1936
"2686","JPN-1921-2","A2.9-8056",740,"JPN","Takahashi, K.","13/11/1921","11/06/1922","1854","1936",1921-11-13,1922-06-11,0,1,0,0,0,"M",NA,1854,NA,1936
"2687","JPN-1922","A2.9-8059",740,"JPN","Kato, Tomosaburo","11/06/1922","24/08/1923","1859","1923",1922-06-11,1923-08-24,0,2,0,0,-777,"M",NA,1859,NA,1923
"2688","JPN-1923-1","A2.9-8062",740,"JPN","Uchida","24/08/1923","12/09/1923","1865","1936",1923-08-24,1923-09-12,0,1,0,1,0,"M",NA,1865,NA,1936
"2689","JPN-1923-2","A2.9-8065",740,"JPN","Yamamoto, G.","12/09/1923","29/12/1923","1852","1933",1923-09-12,1923-12-29,0,1,0,1,0,"M",NA,1852,NA,1933
"2690","JPN-1923-3","A2.9-8068",740,"JPN","Kiyoura","29/12/1923","11/06/1924","1850","1942",1923-12-29,1924-06-11,0,1,0,0,0,"M",NA,1850,NA,1942
"2691","JPN-1924","A2.9-8071",740,"JPN","Kato, Takaaki","11/06/1924","28/01/1926","3/1/1860","1926",1924-06-11,1926-01-28,0,2,0,0,-777,"M",1860-01-03,1860,NA,1926
"2692","JPN-1926","A2.9-8074",740,"JPN","Wakatsuki","29/01/1926","17/04/1927","5/2/1866","1949",1926-01-29,1927-04-17,0,1,0,0,0,"M",1866-02-05,1866,NA,1949
"2693","JPN-1927","A2.9-8077",740,"JPN","Tanaka, G.","17/04/1927","02/07/1929","1864","1929",1927-04-17,1929-07-02,0,1,0,0,0,"M",NA,1864,NA,1929
"2694","JPN-1929","A2.9-8080",740,"JPN","Hamaguchi","02/07/1929","14/11/1930","1870","25/08/1931",1929-07-02,1930-11-14,0,3,11,0,3,"M",NA,1870,1931-08-25,1931
"2695","JPN-1930","A2.9-8083",740,"JPN","Shidehara","14/11/1930","13/04/1931","11/8/1872","10/03/1951",1930-11-14,1931-04-13,0,1,0,0,0,"M",1872-08-11,1872,1951-03-10,1951
"2696","JPN-1931-1","A2.9-8086",740,"JPN","Wakatsuki","13/04/1931","11/12/1931","5/2/1866","1949",1931-04-13,1931-12-11,0,1,0,1,0,"M",1866-02-05,1866,NA,1949
"2697","JPN-1931-2","A2.9-8089",740,"JPN","Inukai","13/12/1931","15/05/1932","1855","1932",1931-12-13,1932-05-15,0,3,4,0,3,"M",NA,1855,NA,1932
"2698","JPN-1932-1","A2.9-8092",740,"JPN","Takahashi, K.","16/05/1932","26/05/1932","1854","1936",1932-05-16,1932-05-26,0,1,0,1,0,"M",NA,1854,NA,1936
"2699","JPN-1932-2","A2.9-8095",740,"JPN","Saito, M.","26/05/1932","07/07/1934","1858","1936",1932-05-26,1934-07-07,0,1,0,0,0,"M",NA,1858,NA,1936
"2700","JPN-1934","A2.9-8098",740,"JPN","Okada","07/07/1934","06/03/1936","1868","1952",1934-07-07,1936-03-06,0,1,0,0,0,"M",NA,1868,NA,1952
"2701","JPN-1936","A2.9-8101",740,"JPN","Hirota","09/03/1936","23/01/1937","1878","1948",1936-03-09,1937-01-23,0,1,0,0,0,"M",NA,1878,NA,1948
"2702","JPN-1937-1","A2.9-8104",740,"JPN","Hayashi","02/02/1937","31/05/1937","1876","1943",1937-02-02,1937-05-31,0,1,0,0,0,"M",NA,1876,NA,1943
"2703","JPN-1937-2","A2.9-8107",740,"JPN","Konoe, F.","31/05/1937","05/01/1939","1891","1945",1937-05-31,1939-01-05,0,1,0,0,0,"M",NA,1891,NA,1945
"2704","JPN-1939-1","A2.9-8110",740,"JPN","Hiranuma","05/01/1939","29/08/1939","1867","1952",1939-01-05,1939-08-29,0,1,0,0,0,"M",NA,1867,NA,1952
"2705","JPN-1939-2","A2.9-8113",740,"JPN","Abe, M.","30/08/1939","14/01/1940","1875","1953",1939-08-30,1940-01-14,0,1,0,0,0,"M",NA,1875,NA,1953
"2706","JPN-1940-1","A2.9-8116",740,"JPN","Yonai","14/01/1940","16/07/1940","30/12/1873","1948",1940-01-14,1940-07-16,0,1,0,0,0,"M",1873-12-30,1873,NA,1948
"2707","JPN-1940-2","A2.9-8119",740,"JPN","Konoe, F.","16/07/1940","17/10/1941","1891","1945",1940-07-16,1941-10-17,0,1,0,1,0,"M",NA,1891,NA,1945
"2708","JPN-1941","A2.9-8122",740,"JPN","Tojo","17/10/1941","18/07/1944","20/12/1883","1948",1941-10-17,1944-07-18,0,1,0,0,0,"M",1883-12-20,1883,NA,1948
"2709","JPN-1944","A2.9-8125",740,"JPN","Koiso","18/07/1944","05/04/1945","1880","1950",1944-07-18,1945-04-05,0,1,0,0,2,"M",NA,1880,NA,1950
"2710","JPN-1945-1","A2.9-8128",740,"JPN","Suzuki, Kantaro","07/04/1945","17/08/1945","24/12/1867","1948",1945-04-07,1945-08-17,0,4,9,0,2,"M",1867-12-24,1867,NA,1948
"2711","JPN-1945-2","A2.9-8131",740,"JPN","Douglas MacArthur","02/09/1945","11/04/1951","1880","-999",1945-09-02,1951-04-11,2,1,0,0,0,"M",NA,1880,NA,NA
"2712","JPN-1951","A2.9-8134",740,"JPN","Matthew Bunker Ridgway","11/04/1951","28/04/1952","1895","-999",1951-04-11,1952-04-28,0,1,0,0,0,"M",NA,1895,NA,NA
"2713","JPN-1952","A2.9-8137",740,"JPN","Yoshida, Shigeru","29/04/1952","07/12/1954","22/9/1878","1967",1952-04-29,1954-12-07,0,1,0,0,0,"M",1878-09-22,1878,NA,1967
"2714","JPN-1954","A2.9-8140",740,"JPN","Hatoyama","09/12/1954","20/12/1956","1/1/1883","1959",1954-12-09,1956-12-20,0,1,0,0,0,"M",1883-01-01,1883,NA,1959
"2715","JPN-1956","A2.9-8143",740,"JPN","Ishibashi","23/12/1956","23/02/1957","25/9/1884","1973",1956-12-23,1957-02-23,0,2.1,0,0,0,"M",1884-09-25,1884,NA,1973
"2716","JPN-1957","A2.9-8146",740,"JPN","Kishi","25/02/1957","18/07/1960","13/11/1896","1987",1957-02-25,1960-07-18,0,1,0,0,0,"M",1896-11-13,1896,NA,1987
"2717","JPN-1960","A2.9-8149",740,"JPN","Ikeda","18/07/1960","25/10/1964","3/12/1899","1965",1960-07-18,1964-10-25,0,2.1,0,0,-777,"M",1899-12-03,1899,NA,1965
"2718","JPN-1964","A2.9-8152",740,"JPN","Sato","09/11/1964","05/07/1972","27/3/1901","1975",1964-11-09,1972-07-05,0,1,0,0,0,"M",1901-03-27,1901,NA,1975
"2719","JPN-1972","A2.9-8155",740,"JPN","Tanaka","06/07/1972","09/12/1974","4/5/1918","1993",1972-07-06,1974-12-09,0,1,0,0,2,"M",1918-05-04,1918,NA,1993
"2720","JPN-1974","A2.9-8158",740,"JPN","Miki","09/12/1974","24/12/1976","17/3/1907","1988",1974-12-09,1976-12-24,0,1,0,0,0,"M",1907-03-17,1907,NA,1988
"2721","JPN-1976","A2.9-8161",740,"JPN","Fukuda","24/12/1976","07/12/1978","14/1/1905","1995",1976-12-24,1978-12-07,0,1,0,0,0,"M",1905-01-14,1905,NA,1995
"2722","JPN-1978","A2.9-8164",740,"JPN","Ohira","07/12/1978","12/06/1980","12/3/1910","1980",1978-12-07,1980-06-12,0,2,0,0,-777,"M",1910-03-12,1910,NA,1980
"2723","JPN-1980-1","A2.9-8167",740,"JPN","Ito","12/06/1980","17/07/1980","15/12/1913","1994",1980-06-12,1980-07-17,0,1,0,0,0,"M",1913-12-15,1913,NA,1994
"2724","JPN-1980-2","A2.9-8170",740,"JPN","Suzuki","17/07/1980","26/11/1982","11/1/1911","2004",1980-07-17,1982-11-26,0,1,0,0,0,"M",1911-01-11,1911,NA,2004
"2725","JPN-1982","A2.9-8173",740,"JPN","Nakasone","26/11/1982","06/11/1987","27/5/1918","-777",1982-11-26,1987-11-06,0,1,0,0,0,"M",1918-05-27,1918,NA,-777
"2726","JPN-1987","A2.9-8176",740,"JPN","Takeshita","06/11/1987","02/06/1989","26/2/1924","2000",1987-11-06,1989-06-02,0,1,0,0,0,"M",1924-02-26,1924,NA,2000
"2727","JPN-1989-1","A2.9-8179",740,"JPN","Uno","02/06/1989","09/08/1989","27/8/1922","1998",1989-06-02,1989-08-09,0,1,0,0,0,"M",1922-08-27,1922,NA,1998
"2728","JPN-1989-2","A2.9-8182",740,"JPN","Kaifu","09/08/1989","06/11/1991","2/1/1931","-777",1989-08-09,1991-11-06,0,1,0,0,0,"M",1931-01-02,1931,NA,-777
"2729","JPN-1991","A2.9-8185",740,"JPN","Miyazawa","06/11/1991","09/08/1993","8/10/1919","2007",1991-11-06,1993-08-09,0,1,0,0,0,"M",1919-10-08,1919,NA,2007
"2730","JPN-1993","A2.9-8188",740,"JPN","Hosokawa","09/08/1993","25/04/1994","14/1/1938","-777",1993-08-09,1994-04-25,0,1,0,0,0,"M",1938-01-14,1938,NA,-777
"2731","JPN-1994-1","A2.9-8191",740,"JPN","Hata","25/04/1994","29/06/1994","24/8/1935","-777",1994-04-25,1994-06-29,0,1,0,0,0,"M",1935-08-24,1935,NA,-777
"2732","JPN-1994-2","A2.9-8194",740,"JPN","Murayama","29/06/1994","11/01/1996","1924","-777",1994-06-29,1996-01-11,0,1,0,0,0,"M",NA,1924,NA,-777
"2733","JPN-1996","A2.9-8197",740,"JPN","Hashimoto","11/01/1996","30/07/1998","29/7/1937","2006",1996-01-11,1998-07-30,0,1,0,0,0,"M",1937-07-29,1937,NA,2006
"2734","JPN-1998","A2.9-8200",740,"JPN","Obuchi","30/07/1998","02/04/2000","23/06/1937","2000",1998-07-30,2000-04-02,0,2.1,0,0,-777,"M",1937-06-23,1937,NA,2000
"2735","JPN-2000-1","A2.9-8203",740,"JPN","Mikio Aoki","02/04/2000","05/04/2000","1934","-777",2000-04-02,2000-04-05,0,1,0,0,0,"M",NA,1934,NA,-777
"2736","JPN-2000-2","A2.9-8206",740,"JPN","Yoshiro Mori","05/04/2000","26/04/2001","1937","-777",2000-04-05,2001-04-26,0,1,0,0,0,"M",NA,1937,NA,-777
"2737","JPN-2001","A2.9-8209",740,"JPN","Junichiro Koizumi","26/04/2001","31/12/2004","8/1/1942","-777",2001-04-26,2004-12-31,0,-888,0,0,-888,"M",1942-01-08,1942,NA,-777
"2738","IND-1947","A2.9-8212",750,"IND","Nehru","15/08/1947","27/05/1964","14/11/1889","27/05/1964",1947-08-15,1964-05-27,0,2,0,0,-777,"M",1889-11-14,1889,1964-05-27,1964
"2739","IND-1964-1","A2.9-8215",750,"IND","Nanda","27/05/1964","09/06/1964","4/7/1898","1998",1964-05-27,1964-06-09,0,1,0,0,0,"M",1898-07-04,1898,NA,1998
"2740","IND-1964-2","A2.9-8218",750,"IND","Shastri","09/06/1964","11/01/1966","2/10/1904","1966",1964-06-09,1966-01-11,0,2,0,0,-777,"M",1904-10-02,1904,NA,1966
"2741","IND-1966-1","A2.9-8221",750,"IND","Nanda","11/01/1966","24/01/1966","4/7/1898","1998",1966-01-11,1966-01-24,0,1,0,1,0,"M",1898-07-04,1898,NA,1998
"2742","IND-1966-2","A2.9-8224",750,"IND","Gandhi, I.","24/01/1966","22/03/1977","19/11/1917","31/10/1984",1966-01-24,1977-03-22,0,1,0,0,2,"F",1917-11-19,1917,1984-10-31,1984
"2743","IND-1977","A2.9-8227",750,"IND","Desai","24/03/1977","15/06/1979","29/2/1896","10/03/1995",1977-03-24,1979-06-15,0,1,0,0,0,"M",1896-02-29,1896,1995-03-10,1995
"2744","IND-1979","A2.9-8230",750,"IND","Charan Singh","28/07/1979","14/01/1980","23/12/1902","1987",1979-07-28,1980-01-14,0,1,0,0,0,"M",1902-12-23,1902,NA,1987
"2745","IND-1980","A2.9-8233",750,"IND","Gandhi, I.","14/01/1980","31/10/1984","19/11/1917","31/10/1984",1980-01-14,1984-10-31,0,3,111,1,3,"F",1917-11-19,1917,1984-10-31,1984
"2746","IND-1984","A2.9-8236",750,"IND","Gandhi, R.","31/10/1984","02/12/1989","20/8/1944","21/05/1991",1984-10-31,1989-12-02,0,1,0,0,0,"M",1944-08-20,1944,1991-05-21,1991
"2747","IND-1989","A2.9-8239",750,"IND","Pratap Singh","02/12/1989","10/11/1990","25/6/1931","-777",1989-12-02,1990-11-10,0,1,0,0,0,"M",1931-06-25,1931,NA,-777
"2748","IND-1990","A2.9-8242",750,"IND","Shekhar","10/11/1990","21/06/1991","17/4/1927","2007",1990-11-10,1991-06-21,0,1,0,0,0,"M",1927-04-17,1927,NA,2007
"2749","IND-1991","A2.9-8245",750,"IND","Rao","21/06/1991","16/05/1996","28/6/1921","23/12/2004",1991-06-21,1996-05-16,0,1,0,0,0,"M",1921-06-28,1921,2004-12-23,2004
"2750","IND-1996-1","A2.9-8248",750,"IND","Vajpayee","16/05/1996","01/06/1996","1924","-777",1996-05-16,1996-06-01,0,1,0,0,0,"M",NA,1924,NA,-777
"2751","IND-1996-2","A2.9-8251",750,"IND","Gowda","01/06/1996","21/04/1997","18/5/1933","-777",1996-06-01,1997-04-21,0,1,0,0,0,"M",1933-05-18,1933,NA,-777
"2752","IND-1997","A2.9-8254",750,"IND","Gujral","21/04/1997","19/03/1998","4/12/1919","-777",1997-04-21,1998-03-19,0,1,0,0,0,"M",1919-12-04,1919,NA,-777
"2753","IND-1998","A2.9-8257",750,"IND","Vajpayee","19/03/1998","22/05/2004","1924","-777",1998-03-19,2004-05-22,0,1,0,1,0,"M",NA,1924,NA,-777
"2754","IND-2004","A2.9-8260",750,"IND","Manmohan Singh","22/05/2004","31/12/2004","1932","-777",2004-05-22,2004-12-31,0,-888,0,0,-888,"M",NA,1932,NA,-777
"2755","BHU-1926","A2.9-8263",760,"BHU","Wangchuk, Jigme","21/08/1926","24/03/1952","1902","24/03/1952",1926-08-21,1952-03-24,0,2,0,0,-777,"M",NA,1902,1952-03-24,1952
"2756","BHU-1952","A2.9-8266",760,"BHU","Wangchuk, Jigme Dorji","24/03/1952","21/07/1972","1929","21/07/1972",1952-03-24,1972-07-21,0,2,0,0,-777,"M",NA,1929,1972-07-21,1972
"2757","BHU-1972","A2.9-8269",760,"BHU","Wangchuck, Jigme Singye","21/07/1972","20/07/1998","11/11/1955","-777",1972-07-21,1998-07-20,0,1,0,0,0,"M",1955-11-11,1955,NA,-777
"2758","BHU-1998","A2.9-8272",760,"BHU","Lyonpo Jigme Thinley","20/07/1998","09/07/1999","1952","-777",1998-07-20,1999-07-09,0,1,0,0,0,"M",NA,1952,NA,-777
"2759","BHU-1999","A2.9-8275",760,"BHU","Lyonpo Sangay Ngedup","09/07/1999","20/07/2000","1953","-777",1999-07-09,2000-07-20,0,1,0,0,0,"M",NA,1953,NA,-777
"2760","BHU-2000","A2.9-8278",760,"BHU","Lyonpo Yeshey Zimba","20/07/2000","08/08/2001","1952","-777",2000-07-20,2001-08-08,0,1,0,0,0,"M",NA,1952,NA,-777
"2761","BHU-2001","A2.9-8281",760,"BHU","Lyonpo Khandu Wangchuk","08/08/2001","14/08/2002","1950","-777",2001-08-08,2002-08-14,0,1,0,0,0,"M",NA,1950,NA,-777
"2762","BHU-2002","A2.9-8284",760,"BHU","Lyonpo Kinzang Dorji","14/08/2002","30/08/2003","1951","-777",2002-08-14,2003-08-30,0,1,0,0,0,"M",NA,1951,NA,-777
"2763","BHU-2003","A2.9-8287",760,"BHU","Lyonpo Jigme Thinley","30/08/2003","18/08/2004","1952","-777",2003-08-30,2004-08-18,0,1,0,1,-999,"M",NA,1952,NA,-777
"2764","BHU-2004","A2.9-8290",760,"BHU","Lyonpo Yeshey Zimba","18/08/2004","31/12/2004","1952","-777",2004-08-18,2004-12-31,0,-888,0,1,-888,"M",NA,1952,NA,-777
"2765","PAK-1947","A2.9-8293",770,"PAK","Jinnah","15/08/1947","11/09/1948","25/12/1876","11/09/1948",1947-08-15,1948-09-11,0,2,0,0,-777,"M",1876-12-25,1876,1948-09-11,1948
"2766","PAK-1948","A2.9-8296",770,"PAK","L. Khan","11/09/1948","16/10/1951","1/10/1895","16/10/1951",1948-09-11,1951-10-16,0,3,11,0,3,"M",1895-10-01,1895,1951-10-16,1951
"2767","PAK-1951","A2.9-8299",770,"PAK","Nazimuddin","17/10/1951","17/04/1953","19/7/1894","1964",1951-10-17,1953-04-17,0,1,0,0,0,"M",1894-07-19,1894,NA,1964
"2768","PAK-1953","A2.9-8302",770,"PAK","Mohammed Ali","17/04/1953","08/08/1955","19/10/1909","1963",1953-04-17,1955-08-08,0,1,0,0,0,"M",1909-10-19,1909,NA,1963
"2769","PAK-1955","A2.9-8305",770,"PAK","Chaudhri M. Ali","11/08/1955","12/09/1956","15/7/1905","1/12/1980",1955-08-11,1956-09-12,0,1,0,0,0,"M",1905-07-15,1905,1980-12-01,1980
"2770","PAK-1956","A2.9-8308",770,"PAK","Shahid Suhrawardy","12/09/1956","17/10/1957","8/9/1893","1963",1956-09-12,1957-10-17,0,1,0,0,0,"M",1893-09-08,1893,NA,1963
"2771","PAK-1957-1","A2.9-8311",770,"PAK","Chundrigar","17/10/1957","16/12/1957","1897","1960",1957-10-17,1957-12-16,0,1,0,0,0,"M",NA,1897,NA,1960
"2772","PAK-1957-2","A2.9-8314",770,"PAK","Khan Noon","16/12/1957","07/10/1958","7/5/1893","1970",1957-12-16,1958-10-07,0,3,8,0,0,"M",1893-05-07,1893,NA,1970
"2773","PAK-1958","A2.9-8317",770,"PAK","Ayub Khan","07/10/1958","25/03/1969","14/5/1907","19/04/1974",1958-10-07,1969-03-25,1,3,2,0,0,"M",1907-05-14,1907,1974-04-19,1974
"2774","PAK-1969","A2.9-8320",770,"PAK","Yahya Khan","31/03/1969","20/12/1971","4/2/1917","1980",1969-03-31,1971-12-20,1,3,6,0,2,"M",1917-02-04,1917,NA,1980
"2775","PAK-1971","A2.9-8323",770,"PAK","Bhutto","20/12/1971","05/07/1977","5/1/1928","04/04/1979",1971-12-20,1977-07-05,0,3,6,0,3,"M",1928-01-05,1928,1979-04-04,1979
"2776","PAK-1977","A2.9-8326",770,"PAK","Zia","05/07/1977","17/08/1988","12/8/1924","17/08/1988",1977-07-05,1988-08-17,1,3,111,0,3,"M",1924-08-12,1924,1988-08-17,1988
"2777","PAK-1988-1","A2.9-8329",770,"PAK","Ishaq Khan","17/08/1988","02/12/1988","1915","28/10/2006",1988-08-17,1988-12-02,0,1,0,0,0,"M",NA,1915,2006-10-28,2006
"2778","PAK-1988-2","A2.9-8332",770,"PAK","Bhutto Benazir","02/12/1988","06/08/1990","21/6/1953","-777",1988-12-02,1990-08-06,0,1,0,0,0,"F",1953-06-21,1953,NA,-777
"2779","PAK-1990-1","A2.9-8335",770,"PAK","Jatoi","06/08/1990","06/11/1990","1931","-777",1990-08-06,1990-11-06,0,1,0,0,0,"M",NA,1931,NA,-777
"2780","PAK-1990-2","A2.9-8338",770,"PAK","Sharif","06/11/1990","18/04/1993","25/12/1949","-777",1990-11-06,1993-04-18,0,3,8,0,0,"M",1949-12-25,1949,NA,-777
"2781","PAK-1993-1","A2.9-8341",770,"PAK","Mazari","18/04/1993","26/05/1993","1922","-777",1993-04-18,1993-05-26,1,1,0,0,0,"M",NA,1922,NA,-777
"2782","PAK-1993-2","A2.9-8344",770,"PAK","Sharif","26/05/1993","18/07/1993","25/12/1949","-777",1993-05-26,1993-07-18,0,1,0,1,0,"M",1949-12-25,1949,NA,-777
"2783","PAK-1993-3","A2.9-8347",770,"PAK","Qureshi","19/07/1993","19/10/1993","1930","-777",1993-07-19,1993-10-19,0,1,0,0,0,"M",NA,1930,NA,-777
"2784","PAK-1993-4","A2.9-8350",770,"PAK","Bhutto Benazir","19/10/1993","05/11/1996","21/6/1953","-777",1993-10-19,1996-11-05,0,3,8,1,0,"F",1953-06-21,1953,NA,-777
"2785","PAK-1996","A2.9-8353",770,"PAK","Khalid","05/11/1996","17/02/1997","1916","2003",1996-11-05,1997-02-17,1,1,0,0,0,"M",NA,1916,NA,2003
"2786","PAK-1997","A2.9-8356",770,"PAK","Sharif","17/02/1997","12/10/1999","25/12/1949","-777",1997-02-17,1999-10-12,0,3,6,2,2,"M",1949-12-25,1949,NA,-777
"2787","PAK-1999","A2.9-8359",770,"PAK","Musharraf","14/10/1999","31/12/2004","1943","-777",1999-10-14,2004-12-31,1,-888,0,0,-888,"M",NA,1943,NA,-777
"2788","BNG-1971","A2.9-8362",771,"BNG","Syed Nazrul Islam","11/04/1971","10/01/1972","1925","1975",1971-04-11,1972-01-10,0,1,0,0,0,"M",NA,1925,NA,1975
"2789","BNG-1972","A2.9-8365",771,"BNG","Sheikh Mujib Rahman","13/01/1972","15/08/1975","17/3/1920","15/08/1975",1972-01-13,1975-08-15,0,3,6,0,3,"M",1920-03-17,1920,1975-08-15,1975
"2790","BNG-1975-1","A2.9-8368",771,"BNG","Moshtaque Ahmed","15/08/1975","06/11/1975","1918","1996",1975-08-15,1975-11-06,1,3,6,0,2,"M",NA,1918,NA,1996
"2791","BNG-1975-2","A2.9-8371",771,"BNG","Ziaur Rahman","06/11/1975","30/05/1981","19/1/1936","30/05/1981",1975-11-06,1981-05-30,1,3,6,0,3,"M",1936-01-19,1936,1981-05-30,1981
"2792","BNG-1981","A2.9-8374",771,"BNG","Sattar","30/05/1981","20/03/1982","1906","1985",1981-05-30,1982-03-20,0,3,6,0,0,"M",NA,1906,NA,1985
"2793","BNG-1982","A2.9-8377",771,"BNG","Ershad","27/03/1982","06/12/1990","1/2/1930","-777",1982-03-27,1990-12-06,1,3,2,0,2,"M",1930-02-01,1930,NA,-777
"2794","BNG-1990","A2.9-8380",771,"BNG","Ahmed","06/12/1990","20/03/1991","1/2/1930","-777",1990-12-06,1991-03-20,1,1,0,0,0,"M",1930-02-01,1930,NA,-777
"2795","BNG-1991","A2.9-8383",771,"BNG","Khaleda Zia","20/03/1991","30/03/1996","1945","-777",1991-03-20,1996-03-30,0,1,0,0,0,"F",NA,1945,NA,-777
"2796","BNG-1996-1","A2.9-8386",771,"BNG","Mohammad Habibur Rahman","30/03/1996","23/06/1996","1930","-777",1996-03-30,1996-06-23,0,1,0,0,0,"M",NA,1930,NA,-777
"2797","BNG-1996-2","A2.9-8389",771,"BNG","Hasina Wazed","23/06/1996","15/07/2001","1947","-777",1996-06-23,2001-07-15,0,1,0,0,0,"F",NA,1947,NA,-777
"2798","BNG-2001-1","A2.9-8392",771,"BNG","Latifur Rahman","15/07/2001","10/10/2001","1936","-777",2001-07-15,2001-10-10,0,1,0,0,0,"M",NA,1936,NA,-777
"2799","BNG-2001-2","A2.9-8395",771,"BNG","Khaleda Zia","10/10/2001","31/12/2004","1945","-777",2001-10-10,2004-12-31,0,-888,0,0,-888,"F",NA,1945,NA,-777
"2800","MYA-1853","A2.9-8398",775,"MYA","Mindon Min","18/02/1853","01/10/1878","08/07/1808","01/10/1878",1853-02-18,1878-10-01,1,2,0,0,-777,"M",1808-07-08,1808,1878-10-01,1878
"2801","MYA-1878","A2.9-8401",775,"MYA","Thibaw Min","01/10/1878","29/11/1885","1859","1916",1878-10-01,1885-11-29,0,4,-999,0,1,"M",NA,1859,NA,1916
"2802","MYA-1885","A2.9-8404",775,"MYA","Taingda Mingyi","29/11/1885","01/01/1886","-999","-999",1885-11-29,1886-01-01,0,4,-999,0,1,"M",NA,NA,NA,NA
"2803","MYA-1948","A2.9-8407",775,"MYA","U Nu","04/01/1948","12/06/1956","25/5/1907","14/02/1995",1948-01-04,1956-06-12,0,1,0,0,0,"M",1907-05-25,1907,1995-02-14,1995
"2804","MYA-1956","A2.9-8410",775,"MYA","U Ba Swe","12/06/1956","01/03/1957","19/4/1915","1987",1956-06-12,1957-03-01,0,1,0,0,0,"M",1915-04-19,1915,NA,1987
"2805","MYA-1957","A2.9-8413",775,"MYA","U Nu","01/03/1957","29/10/1958","25/5/1907","14/02/1995",1957-03-01,1958-10-29,0,1,0,1,0,"M",1907-05-25,1907,1995-02-14,1995
"2806","MYA-1958","A2.9-8416",775,"MYA","Ne Win","29/10/1958","15/03/1960","24/5/1911","05/12/2002",1958-10-29,1960-03-15,0,1,0,0,0,"M",1911-05-24,1911,2002-12-05,2002
"2807","MYA-1960","A2.9-8419",775,"MYA","U Nu","04/04/1960","02/03/1962","25/5/1907","14/02/1995",1960-04-04,1962-03-02,0,3,6,2,2,"M",1907-05-25,1907,1995-02-14,1995
"2808","MYA-1962","A2.9-8422",775,"MYA","Ne Win","02/03/1962","25/07/1988","24/5/1911","05/12/2002",1962-03-02,1988-07-25,1,1,0,1,0,"M",1911-05-24,1911,2002-12-05,2002
"2809","MYA-1988-1","A2.9-8425",775,"MYA","Sein Lwin","25/07/1988","12/08/1988","1924","-777",1988-07-25,1988-08-12,1,1,0,0,0,"M",NA,1924,NA,-777
"2810","MYA-1988-2","A2.9-8428",775,"MYA","Maung Maung","19/08/1988","18/09/1988","11/01/1925","02/07/1994",1988-08-19,1988-09-18,0,3,6,0,0,"M",1925-01-11,1925,1994-07-02,1994
"2811","MYA-1988-3","A2.9-8431",775,"MYA","Saw Maung","18/09/1988","23/04/1992","5/12/1928","1997",1988-09-18,1992-04-23,1,2.1,0,0,0,"M",1928-12-05,1928,NA,1997
"2812","MYA-1992","A2.9-8434",775,"MYA","Than Shwe","23/04/1992","31/12/2004","1933","-777",1992-04-23,2004-12-31,0,-888,0,0,-888,"M",NA,1933,NA,-777
"2813","SRI-1948","A2.9-8437",780,"SRI","Senanayake, Don","04/02/1948","22/03/1952","20/10/1884","1952",1948-02-04,1952-03-22,0,2,0,0,-777,"M",1884-10-20,1884,NA,1952
"2814","SRI-1952","A2.9-8440",780,"SRI","Senanayake, Dudley","26/03/1952","12/10/1953","19/6/1911","1973",1952-03-26,1953-10-12,0,2.1,0,0,0,"M",1911-06-19,1911,NA,1973
"2815","SRI-1953","A2.9-8443",780,"SRI","Kotelawala","12/10/1953","11/04/1956","1897","1980",1953-10-12,1956-04-11,0,1,0,0,1,"M",NA,1897,NA,1980
"2816","SRI-1956","A2.9-8446",780,"SRI","Bandaranaike, S.W.R.D.","12/04/1956","26/09/1959","8/1/1899","26/09/1959",1956-04-12,1959-09-26,0,3,11,0,3,"M",1899-01-08,1899,1959-09-26,1959
"2817","SRI-1959","A2.9-8449",780,"SRI","Dahanayake","26/09/1959","21/03/1960","22/10/1902","1997",1959-09-26,1960-03-21,0,1,0,0,0,"M",1902-10-22,1902,NA,1997
"2818","SRI-1960-1","A2.9-8452",780,"SRI","Senanayake, Dudley","21/03/1960","22/07/1960","19/6/1911","1973",1960-03-21,1960-07-22,0,1,0,1,0,"M",1911-06-19,1911,NA,1973
"2819","SRI-1960-2","A2.9-8455",780,"SRI","Bandaranaike, S","22/07/1960","25/03/1965","17/4/1916","10/10/2000",1960-07-22,1965-03-25,0,1,0,0,0,"F",1916-04-17,1916,2000-10-10,2000
"2820","SRI-1965","A2.9-8458",780,"SRI","Senanayake, Dudley","25/03/1965","28/05/1970","19/6/1911","1973",1965-03-25,1970-05-28,0,1,0,2,0,"M",1911-06-19,1911,NA,1973
"2821","SRI-1970","A2.9-8461",780,"SRI","Bandaranaike, S","31/05/1970","23/01/1977","17/4/1916","10/10/2000",1970-05-31,1977-01-23,0,1,0,1,0,"F",1916-04-17,1916,2000-10-10,2000
"2822","SRI-1977","A2.9-8464",780,"SRI","Jayewardene","23/01/1977","02/01/1989","17/9/1906","01/11/1996",1977-01-23,1989-01-02,0,1,0,0,0,"M",1906-09-17,1906,1996-11-01,1996
"2823","SRI-1989","A2.9-8467",780,"SRI","Premadasa","02/01/1989","01/05/1993","23/6/1924","01/05/1993",1989-01-02,1993-05-01,0,3,111,0,3,"M",1924-06-23,1924,1993-05-01,1993
"2824","SRI-1993","A2.9-8470",780,"SRI","Wijetunge","01/05/1993","12/11/1994","15/2/1922","-777",1993-05-01,1994-11-12,0,1,0,0,0,"M",1922-02-15,1922,NA,-777
"2825","SRI-1994","A2.9-8473",780,"SRI","Kumaratunga","12/11/1994","31/12/2004","29/6/1945","-777",1994-11-12,2004-12-31,0,-888,0,0,-888,"F",1945-06-29,1945,NA,-777
"2826","MAD-1953","A2.9-8476",781,"MAD","Ali Didi","02/09/1953","12/12/1957","1889","1975",1953-09-02,1957-12-12,0,3,2,0,0,"M",NA,1889,NA,1975
"2827","MAD-1957","A2.9-8479",781,"MAD","Nasir","12/12/1957","11/11/1978","2/9/1926","-777",1957-12-12,1978-11-11,0,2.1,0,0,1,"M",1926-09-02,1926,NA,-777
"2828","MAD-1978","A2.9-8482",781,"MAD","Gayoom","11/11/1978","31/12/2004","29/12/1937","-777",1978-11-11,2004-12-31,0,-888,0,0,-888,"M",1937-12-29,1937,NA,-777
"2829","NEP-1846","A2.9-8485",790,"NEP","Jang Bahadur Kunwar","17/09/1846","25/02/1877","18/6/1817","25/02/1877",1846-09-17,1877-02-25,0,2,0,0,-777,"M",1817-06-18,1817,1877-02-25,1877
"2830","NEP-1877","A2.9-8488",790,"NEP","Rana Udip Singh","27/02/1877","21/11/1885","1825","1885",1877-02-27,1885-11-21,0,3,-999,0,3,"M",NA,1825,NA,1885
"2831","NEP-1885","A2.9-8491",790,"NEP","Bira Shamsher Jang Bahadur Rana","23/11/1885","05/03/1901","1852","05/03/1901",1885-11-23,1901-03-05,0,2,0,0,-777,"M",NA,1852,1901-03-05,1901
"2832","NEP-1901-1","A2.9-8494",790,"NEP","Dev Shumshere Jung Bahadur Rana","15/03/1901","26/06/1901","1862","1914",1901-03-15,1901-06-26,0,3,-999,0,1,"M",NA,1862,NA,1914
"2833","NEP-1901-2","A2.9-8497",790,"NEP","Chandra Rana","26/06/1901","22/06/1929","1863","22/06/1929",1901-06-26,1929-06-22,1,2,0,0,-777,"M",NA,1863,1929-06-22,1929
"2834","NEP-1929","A2.9-8500",790,"NEP","Bhim Rana","22/06/1929","01/09/1932","1869","01/09/1932",1929-06-22,1932-09-01,0,2,0,0,-777,"M",NA,1869,1932-09-01,1932
"2835","NEP-1932","A2.9-8503",790,"NEP","Juddha Rana","01/09/1932","28/11/1945","1875","1952",1932-09-01,1945-11-28,0,1,0,0,0,"M",NA,1875,NA,1952
"2836","NEP-1945","A2.9-8506",790,"NEP","Padma Rana","28/11/1945","09/02/1948","1882","09/02/1948",1945-11-28,1948-02-09,0,2,0,0,-777,"M",NA,1882,1948-02-09,1948
"2837","NEP-1948","A2.9-8509",790,"NEP","Mohan Rana","09/02/1948","18/02/1951","23/12/1885","1967",1948-02-09,1951-02-18,0,3,8,0,1,"M",1885-12-23,1885,NA,1967
"2838","NEP-1951","A2.9-8512",790,"NEP","Tribhuvan","18/02/1951","13/03/1955","1906","13/03/1955",1951-02-18,1955-03-13,1,2,0,0,-777,"M",NA,1906,1955-03-13,1955
"2839","NEP-1955","A2.9-8515",790,"NEP","Mahendra","14/03/1955","31/01/1972","11/6/1920","31/01/1972",1955-03-14,1972-01-31,0,2,0,0,-777,"M",1920-06-11,1920,1972-01-31,1972
"2840","NEP-1972","A2.9-8518",790,"NEP","Birendra","31/01/1972","09/11/1990","28/12/1946","01/06/2001",1972-01-31,1990-11-09,0,1,0,0,0,"M",1946-12-28,1946,2001-06-01,2001
"2841","NEP-1990","A2.9-8521",790,"NEP","Krishna Prasad Bhatterai","09/11/1990","26/05/1991","1924","-777",1990-11-09,1991-05-26,0,1,0,0,0,"M",NA,1924,NA,-777
"2842","NEP-1991","A2.9-8524",790,"NEP","Girija Prasad Koirala","26/05/1991","30/11/1994","1925","-777",1991-05-26,1994-11-30,0,1,0,0,0,"M",NA,1925,NA,-777
"2843","NEP-1994","A2.9-8527",790,"NEP","Man Mohan Adhilari","30/11/1994","12/09/1995","1920","1999",1994-11-30,1995-09-12,0,1,0,0,0,"M",NA,1920,NA,1999
"2844","NEP-1995","A2.9-8530",790,"NEP","Sher Bahadur Deuba","12/09/1995","12/03/1997","1946","-777",1995-09-12,1997-03-12,0,1,0,0,0,"M",NA,1946,NA,-777
"2845","NEP-1997-1","A2.9-8533",790,"NEP","Lokendra Bahadur Chand","12/03/1997","07/10/1997","1940","-777",1997-03-12,1997-10-07,0,1,0,0,0,"M",NA,1940,NA,-777
"2846","NEP-1997-2","A2.9-8536",790,"NEP","Surya  Bahadur Thapa","07/10/1997","15/04/1998","1928","-777",1997-10-07,1998-04-15,0,1,0,0,0,"M",NA,1928,NA,-777
"2847","NEP-1998","A2.9-8539",790,"NEP","Girija Prasad Koirala","15/04/1998","31/05/1999","1925","-777",1998-04-15,1999-05-31,0,1,0,1,0,"M",NA,1925,NA,-777
"2848","NEP-1999","A2.9-8542",790,"NEP","Krishna Prasad Bhatterai","31/05/1999","22/03/2000","1924","-777",1999-05-31,2000-03-22,0,1,0,1,0,"M",NA,1924,NA,-777
"2849","NEP-2000","A2.9-8545",790,"NEP","Girija Prasad Koirala","22/03/2000","26/07/2001","1925","-777",2000-03-22,2001-07-26,0,1,0,2,0,"M",NA,1925,NA,-777
"2850","NEP-2001","A2.9-8548",790,"NEP","Sher Bahdur Deuba","26/07/2001","04/10/2002","1946","-777",2001-07-26,2002-10-04,0,1,0,1,0,"M",NA,1946,NA,-777
"2851","NEP-2002","A2.9-8551",790,"NEP","Lokendra Bahadur Chand","11/10/2002","05/06/2003","1940","-777",2002-10-11,2003-06-05,0,1,0,1,0,"M",NA,1940,NA,-777
"2852","NEP-2003","A2.9-8554",790,"NEP","Surya Bahadur Thapa","05/06/2003","03/06/2004","1928","-777",2003-06-05,2004-06-03,0,1,0,1,0,"M",NA,1928,NA,-777
"2853","NEP-2004","A2.9-8557",790,"NEP","Sher Bahdur Deuba","03/06/2004","31/12/2004","13/06/1946","-777",2004-06-03,2004-12-31,0,-888,0,2,-888,"M",1946-06-13,1946,NA,-777
"2854","THI-1868","A2.9-8560",800,"THI","Rama V","01/10/1868","23/10/1910","22/9/1853","23/10/1910",1868-10-01,1910-10-23,0,2,0,0,-777,"M",1853-09-22,1853,1910-10-23,1910
"2855","THI-1910","A2.9-8563",800,"THI","Rama VI","23/10/1910","26/11/1925","1/1/1881","26/11/1925",1910-10-23,1925-11-26,0,2,0,0,-777,"M",1881-01-01,1881,1925-11-26,1925
"2856","THI-1925","A2.9-8566",800,"THI","Rama VII","26/11/1925","10/12/1932","8/11/1893","30/05/1941",1925-11-26,1932-12-10,0,3,6,0,0,"M",1893-11-08,1893,1941-05-30,1941
"2857","THI-1932","A2.9-8569",800,"THI","Phraya Mano","10/12/1932","20/06/1933","1884","1948",1932-12-10,1933-06-20,1,3,6,0,1,"M",NA,1884,NA,1948
"2858","THI-1933","A2.9-8572",800,"THI","Phahon","20/06/1933","21/12/1938","1889","1958",1933-06-20,1938-12-21,1,1,0,0,-666,"M",NA,1889,NA,1958
"2859","THI-1938","A2.9-8575",800,"THI","Plaek Pibulsongkram","26/12/1938","02/08/1944","14/7/1897","11/06/1964",1938-12-26,1944-08-02,0,1,0,0,0,"M",1897-07-14,1897,1964-06-11,1964
"2860","THI-1944","A2.9-8578",800,"THI","Pridi Banomyong","02/08/1944","21/08/1946","11/05/1900","1983",1944-08-02,1946-08-21,0,1,0,0,1,"M",1900-05-11,1900,NA,1983
"2861","THI-1946","A2.9-8581",800,"THI","Plaek Pibulsongkram","21/08/1946","16/09/1957","14/7/1897","11/06/1964",1946-08-21,1957-09-16,0,3,6,1,1,"M",1897-07-14,1897,1964-06-11,1964
"2862","THI-1957-1","A2.9-8584",800,"THI","Pote Sarasin","21/09/1957","27/12/1957","26/03/1906","28/09/2000",1957-09-21,1957-12-27,1,1,0,0,1,"M",1906-03-26,1906,2000-09-28,2000
"2863","THI-1957-2","A2.9-8587",800,"THI","Thanon Kittakachorn","27/12/1957","20/10/1958","11/08/1911","2004",1957-12-27,1958-10-20,0,1,0,0,0,"M",1911-08-11,1911,NA,2004
"2864","THI-1958","A2.9-8590",800,"THI","Sarit","20/10/1958","08/12/1963","16/6/1908","1963",1958-10-20,1963-12-08,1,2,0,0,-777,"M",1908-06-16,1908,NA,1963
"2865","THI-1963","A2.9-8593",800,"THI","Thanon Kittakachorn","08/12/1963","13/10/1973","11/8/1911","2004",1963-12-08,1973-10-13,0,3,2,0,1,"M",1911-08-11,1911,NA,2004
"2866","THI-1973","A2.9-8596",800,"THI","Sanya","14/10/1973","21/02/1975","5/4/1907","2002",1973-10-14,1975-02-21,1,1,0,0,0,"M",1907-04-05,1907,NA,2002
"2867","THI-1975-1","A2.9-8599",800,"THI","Seni Pramoj","21/02/1975","06/03/1975","26/5/1905","28/07/1997",1975-02-21,1975-03-06,0,1,0,0,0,"M",1905-05-26,1905,1997-07-28,1997
"2868","THI-1975-2","A2.9-8602",800,"THI","Kukrot Pramoj","17/03/1975","16/04/1976","20/4/1911","09/10/1995",1975-03-17,1976-04-16,0,1,0,0,0,"M",1911-04-20,1911,1995-10-09,1995
"2869","THI-1976-1","A2.9-8605",800,"THI","Seni Pramoj","20/04/1976","06/10/1976","26/5/1905","28/07/1997",1976-04-20,1976-10-06,0,3,6,1,0,"M",1905-05-26,1905,1997-07-28,1997
"2870","THI-1976-2","A2.9-8608",800,"THI","Sangad","06/10/1976","22/10/1976","3/3/1915","1980",1976-10-06,1976-10-22,1,1,0,0,0,"M",1915-03-03,1915,NA,1980
"2871","THI-1976-3","A2.9-8611",800,"THI","Thanin Kraivichien","22/10/1976","20/10/1977","1927","-777",1976-10-22,1977-10-20,1,3,6,0,0,"M",NA,1927,NA,-777
"2872","THI-1977-1","A2.9-8614",800,"THI","Sangad","20/10/1977","12/11/1977","03/03/1915","1980",1977-10-20,1977-11-12,1,1,0,0,0,"M",1915-03-03,1915,NA,1980
"2873","THI-1977-2","A2.9-8617",800,"THI","Kriangsak","12/11/1977","29/02/1980","17/12/1917","23/12/2003",1977-11-12,1980-02-29,1,1,0,0,0,"M",1917-12-17,1917,2003-12-23,2003
"2874","THI-1980","A2.9-8620",800,"THI","Prem","03/03/1980","04/08/1988","26/8/1920","-777",1980-03-03,1988-08-04,0,1,0,0,0,"M",1920-08-26,1920,NA,-777
"2875","THI-1988","A2.9-8623",800,"THI","Choonhavan","04/08/1988","23/02/1991","25/4/1922","06/05/1998",1988-08-04,1991-02-23,0,3,6,0,1,"M",1922-04-25,1922,1998-05-06,1998
"2876","THI-1991","A2.9-8626",800,"THI","Panyarachun","07/03/1991","04/04/1992","9/8/1932","-777",1991-03-07,1992-04-04,0,1,0,0,0,"M",1932-08-09,1932,NA,-777
"2877","THI-1992-1","A2.9-8629",800,"THI","Kraprayoon","05/04/1992","24/05/1992","1932","-777",1992-04-05,1992-05-24,0,1,0,0,0,"M",NA,1932,NA,-777
"2878","THI-1992-2","A2.9-8632",800,"THI","Panyarachun","10/06/1992","23/09/1992","9/8/1932","-777",1992-06-10,1992-09-23,0,1,0,1,0,"M",1932-08-09,1932,NA,-777
"2879","THI-1992-3","A2.9-8635",800,"THI","Leekpai","23/09/1992","13/07/1995","1938","-777",1992-09-23,1995-07-13,0,1,0,0,0,"M",NA,1938,NA,-777
"2880","THI-1995","A2.9-8638",800,"THI","Silpa-Archa","13/07/1995","01/12/1996","1932","-777",1995-07-13,1996-12-01,0,1,0,0,0,"M",NA,1932,NA,-777
"2881","THI-1996","A2.9-8641",800,"THI","Chavalit Yongchaiyudh","01/12/1996","09/11/1997","15/5/1932","-777",1996-12-01,1997-11-09,0,1,0,0,0,"M",1932-05-15,1932,NA,-777
"2882","THI-1997","A2.9-8644",800,"THI","Leekpai","09/11/1997","09/02/2001","1938","-777",1997-11-09,2001-02-09,0,1,0,1,0,"M",NA,1938,NA,-777
"2883","THI-2001","A2.9-8647",800,"THI","Thaksin Shinawatra","10/02/2001","31/12/2004","1949","-777",2001-02-10,2004-12-31,0,-888,0,0,-888,"M",NA,1949,NA,-777
"2884","CAM-1953","A2.9-8650",811,"CAM","Sihanouk","09/11/1953","18/03/1970","31/10/1922","-777",1953-11-09,1970-03-18,0,3,6,0,1,"M",1922-10-31,1922,NA,-777
"2885","CAM-1970","A2.9-8653",811,"CAM","Lon Nol","18/03/1970","10/04/1975","13/11/1913","17/11/1985",1970-03-18,1975-04-10,1,3,4,0,1,"M",1913-11-13,1913,1985-11-17,1985
"2886","CAM-1975","A2.9-8656",811,"CAM","Pol Pot","11/04/1975","07/01/1979","19/5/1925","15/04/1998",1975-04-11,1979-01-07,1,4,9,0,0,"M",1925-05-19,1925,1998-04-15,1998
"2887","CAM-1979","A2.9-8659",811,"CAM","Heng Samrin","07/01/1979","14/01/1985","25/05/1934","-777",1979-01-07,1985-01-14,0,1,0,0,0,"M",1934-05-25,1934,NA,-777
"2888","CAM-1985","A2.9-8662",811,"CAM","Hun Sen","14/01/1985","21/09/1993","05/08/1952","-777",1985-01-14,1993-09-21,0,1,0,0,0,"M",1952-08-05,1952,NA,-777
"2889","CAM-1993","A2.9-8665",811,"CAM","Ranariddh","21/09/1993","06/07/1997","1944","-777",1993-09-21,1997-07-06,0,3,8,1,1,"M",NA,1944,NA,-777
"2890","CAM-1997","A2.9-8668",811,"CAM","Hun Sen","06/07/1997","31/12/2004","05/08/1952","-777",1997-07-06,2004-12-31,1,-888,0,2,-888,"M",1952-08-05,1952,NA,-777
"2891","LAO-1951","A2.9-8671",812,"LAO","Souvanna Phouma","21/11/1951","25/11/1954","7/10/1901","1984",1951-11-21,1954-11-25,0,1,0,0,0,"M",1901-10-07,1901,NA,1984
"2892","LAO-1954","A2.9-8674",812,"LAO","Katay Don Sasorith","25/11/1954","21/03/1956","1904","1959",1954-11-25,1956-03-21,0,1,0,0,0,"M",NA,1904,NA,1959
"2893","LAO-1956","A2.9-8677",812,"LAO","Souvanna Phouma","21/03/1956","22/07/1958","7/10/1901","1984",1956-03-21,1958-07-22,0,1,0,1,0,"M",1901-10-07,1901,NA,1984
"2894","LAO-1958","A2.9-8680",812,"LAO","Sananikone","15/08/1958","31/12/1959","6/9/1903","1983",1958-08-15,1959-12-31,0,3,6,0,0,"M",1903-09-06,1903,NA,1983
"2895","LAO-1959","A2.9-8683",812,"LAO","Nosavan","31/12/1959","07/01/1960","7/1/1920","-999",1959-12-31,1960-01-07,1,1,0,0,0,"M",1920-01-07,1920,NA,NA
"2896","LAO-1960-1","A2.9-8686",812,"LAO","Kou Abhay Og Long","07/01/1960","31/05/1960","1892","1964",1960-01-07,1960-05-31,1,1,0,0,-666,"M",NA,1892,NA,1964
"2897","LAO-1960-2","A2.9-8689",812,"LAO","Somsanith","31/05/1960","09/08/1960","1913","1975",1960-05-31,1960-08-09,1,3,6,0,0,"M",NA,1913,NA,1975
"2898","LAO-1960-3","A2.9-8692",812,"LAO","Kong Le","09/08/1960","15/08/1960","1934","-999",1960-08-09,1960-08-15,1,1,0,0,1,"M",NA,1934,NA,NA
"2899","LAO-1960-4","A2.9-8695",812,"LAO","Souvanna Phouma","15/08/1960","10/12/1960","7/10/1901","1984",1960-08-15,1960-12-10,1,3,6,2,1,"M",1901-10-07,1901,NA,1984
"2900","LAO-1960-5","A2.9-8698",812,"LAO","Boun Oum","13/12/1960","22/06/1962","12/12/1912","17/03/1980",1960-12-13,1962-06-22,1,1,0,0,0,"M",1912-12-12,1912,1980-03-17,1980
"2901","LAO-1962","A2.9-8701",812,"LAO","Souvanna Phouma","24/06/1962","19/04/1964","7/10/1901","1984",1962-06-24,1964-04-19,0,3,6,3,2,"M",1901-10-07,1901,NA,1984
"2902","LAO-1964-1","A2.9-8704",812,"LAO","Kouprasith","19/04/1964","20/04/1964","1926","-999",1964-04-19,1964-04-20,1,1,0,0,0,"M",NA,1926,NA,NA
"2903","LAO-1964-2","A2.9-8707",812,"LAO","Souvanna Phouma","20/04/1964","02/12/1975","7/10/1901","1984",1964-04-20,1975-12-02,0,3,3,4,0,"M",1901-10-07,1901,NA,1984
"2904","LAO-1975","A2.9-8710",812,"LAO","Phomivan","02/12/1975","25/11/1992","13/12/1920","25/11/1992",1975-12-02,1992-11-25,1,2,0,0,-777,"M",1920-12-13,1920,1992-11-25,1992
"2905","LAO-1992","A2.9-8713",812,"LAO","Phounsavanh","25/11/1992","24/02/1998","1914","-777",1992-11-25,1998-02-24,0,1,0,0,0,"M",NA,1914,NA,-777
"2906","LAO-1998","A2.9-8716",812,"LAO","Siphandon","24/02/1998","31/12/2004","1924","-777",1998-02-24,2004-12-31,0,-888,0,0,-888,"M",NA,1924,NA,-777
"2907","VNM-1847","A2.9-8719",815,"VNM","Tu Duc","10/11/1847","17/07/1883","1829","17/07/1883",1847-11-10,1883-07-17,1,2,0,0,-777,"M",NA,1829,1883-07-17,1883
"2908","VNM-1883-1","A2.9-8722",815,"VNM","Duc Duc","20/07/1883","23/07/1883","1852","23/07/1883",1883-07-20,1883-07-23,0,3,-999,0,3,"M",NA,1852,1883-07-23,1883
"2909","VNM-1883-2","A2.9-8725",815,"VNM","Hiep Hoa","30/07/1883","29/11/1883","1847","29/11/1883",1883-07-30,1883-11-29,1,3,-999,0,3,"M",NA,1847,1883-11-29,1883
"2910","VIE-1883","A2.9-8728",815,"VIE","Regency","02/12/1883","14/10/1885","-999","-999",1883-12-02,1885-10-14,1,4,-999,0,1,"M",NA,NA,NA,NA
"2911","VNM-1885","A2.9-8731",815,"VNM","Dong Khanh","14/10/1885","28/01/1889","1864","1889",1885-10-14,1889-01-28,2,2,0,0,-777,"M",NA,1864,NA,1889
"2912","VNM-1889","A2.9-8734",815,"VNM","Thanh Thai","01/02/1889","03/09/1907","1878","1954",1889-02-01,1907-09-03,0,4,-999,0,1,"M",NA,1878,NA,1954
"2913","DRV-1945","A2.9-8737",816,"DRV","Ho Chi Minh","02/09/1945","03/09/1969","19/5/1890","02/09/1969",1945-09-02,1969-09-03,1,2,0,0,-777,"M",1890-05-19,1890,1969-09-02,1969
"2914","DRV-1969","A2.9-8740",816,"DRV","Le Duan","03/09/1969","10/07/1986","7/4/1908","10/07/1986",1969-09-03,1986-07-10,0,2,0,0,-777,"M",1908-04-07,1908,1986-07-10,1986
"2915","DRV-1986-1","A2.9-8743",816,"DRV","Truong Chinh","10/07/1986","18/12/1986","1907","1988",1986-07-10,1986-12-18,0,1,0,0,0,"M",NA,1907,NA,1988
"2916","DRV-1986-2","A2.9-8746",816,"DRV","Nguyen Van Linh","18/12/1986","27/06/1991","01/07/1915","27/04/1998",1986-12-18,1991-06-27,0,1,0,0,0,"M",1915-07-01,1915,1998-04-27,1998
"2917","DRV-1991","A2.9-8749",816,"DRV","Do Muoi","27/06/1991","29/12/1997","2/2/1917","-777",1991-06-27,1997-12-29,0,1,0,0,0,"M",1917-02-02,1917,NA,-777
"2918","DRV-1997","A2.9-8752",816,"DRV","Phieu","29/12/1997","22/04/2001","27/12/1931","-777",1997-12-29,2001-04-22,0,1,0,0,0,"M",1931-12-27,1931,NA,-777
"2919","DRV-2001","A2.9-8755",816,"DRV","Nong Duc Manh","23/04/2001","31/12/2004","11/09/1940","-777",2001-04-23,2004-12-31,0,-888,0,0,-888,"M",1940-09-11,1940,NA,-777
"2920","RVN-1954-1","A2.9-8758",817,"RVN","Pham Buu Loc","12/01/1954","16/06/1954","1915","1990",1954-01-12,1954-06-16,0,1,0,0,-666,"M",NA,1915,NA,1990
"2921","RVN-1954-2","A2.9-8761",817,"RVN","Quat","16/06/1954","26/06/1954","1909","1979",1954-06-16,1954-06-26,0,1,0,0,0,"M",NA,1909,NA,1979
"2922","RVN-1954-3","A2.9-8764",817,"RVN","Ngo Dinh Diem","26/06/1954","01/11/1963","3/1/1901","01/11/1963",1954-06-26,1963-11-01,1,3,6,0,3,"M",1901-01-03,1901,1963-11-01,1963
"2923","RVN-1963","A2.9-8767",817,"RVN","Minh","01/11/1963","30/01/1964","19/2/1916","06/08/2001",1963-11-01,1964-01-30,1,3,6,0,1,"M",1916-02-19,1916,2001-08-06,2001
"2924","RVN-1964-1","A2.9-8770",817,"RVN","Khanh","30/01/1964","04/11/1964","08/11/1927","-777",1964-01-30,1964-11-04,1,3,2,0,1,"M",1927-11-08,1927,NA,-777
"2925","RVN-1964-2","A2.9-8773",817,"RVN","Van Huong","04/11/1964","26/01/1965","1/12/1903","1982",1964-11-04,1965-01-26,1,3,6,0,0,"M",1903-12-01,1903,NA,1982
"2926","RVN-1965-1","A2.9-8776",817,"RVN","Khahn","26/01/1965","20/02/1965","08/11/1927","-777",1965-01-26,1965-02-20,1,3,16,1,1,"M",1927-11-08,1927,NA,-777
"2927","RVN-1965-2","A2.9-8779",817,"RVN","Quat","20/02/1965","12/06/1965","1909","1979",1965-02-20,1965-06-12,1,3,6,1,0,"M",NA,1909,NA,1979
"2928","RVN-1965-3","A2.9-8782",817,"RVN","Van Thieu","14/06/1965","21/04/1975","5/5/1923","29/09/2001",1965-06-14,1975-04-21,1,4,9,0,1,"M",1923-05-05,1923,2001-09-29,2001
"2929","RVN-1975","A2.9-8785",817,"RVN","Minh","28/04/1975","30/04/1975","19/2/1916","06/08/2001",1975-04-28,1975-04-30,0,4,9,1,2,"M",1916-02-19,1916,2001-08-06,2001
"2930","MAL-1957","A2.9-8788",820,"MAL","Rahman","31/08/1957","15/04/1959","24/8/1895","06/12/1990",1957-08-31,1959-04-15,0,1,0,0,0,"M",1895-08-24,1895,1990-12-06,1990
"2931","MAL-1959-1","A2.9-8791",820,"MAL","Razak","15/04/1959","21/08/1959","11/3/1922","14/01/1976",1959-04-15,1959-08-21,0,1,0,0,0,"M",1922-03-11,1922,1976-01-14,1976
"2932","MAL-1959-2","A2.9-8794",820,"MAL","Rahman","21/08/1959","22/09/1970","24/8/1895","06/12/1990",1959-08-21,1970-09-22,0,1,0,1,0,"M",1895-08-24,1895,1990-12-06,1990
"2933","MAL-1970","A2.9-8797",820,"MAL","Razak","22/09/1970","14/01/1976","11/3/1922","14/01/1976",1970-09-22,1976-01-14,0,2,0,1,-777,"M",1922-03-11,1922,1976-01-14,1976
"2934","MAL-1976","A2.9-8800",820,"MAL","Hussein Bin Onn","14/01/1976","16/07/1981","22/2/1922","28/05/1990",1976-01-14,1981-07-16,0,2.1,0,0,0,"M",1922-02-22,1922,1990-05-28,1990
"2935","MAL-1981","A2.9-8803",820,"MAL","Mahatir Bin Mohammad","16/07/1981","31/10/2003","20/12/1925","-777",1981-07-16,2003-10-31,0,1,0,0,0,"M",1925-12-20,1925,NA,-777
"2936","MAL-2003","A2.9-8806",820,"MAL","Ahmad Badawi","31/10/2003","31/12/2004","26/11/1939","-777",2003-10-31,2004-12-31,0,-888,0,0,-888,"M",1939-11-26,1939,NA,-777
"2937","SIN-1959","A2.9-8809",830,"SIN","Lee Kuan Yew","05/06/1959","28/11/1990","16/9/1923","-777",1959-06-05,1990-11-28,0,1,0,0,0,"M",1923-09-16,1923,NA,-777
"2938","SIN-1990","A2.9-8812",830,"SIN","Goh Chok Tong","28/11/1990","12/08/2004","20/5/1941","-777",1990-11-28,2004-08-12,0,1,0,0,-999,"M",1941-05-20,1941,NA,-777
"2939","SIN-2004","A2.9-8815",830,"SIN","Lee Hsien Loong","12/08/2004","31/12/2004","1939","-777",2004-08-12,2004-12-31,0,-888,0,0,-888,"M",NA,1939,NA,-777
"2940","BRU-1967","A2.9-8818",835,"BRU","Hassanal Bolkiah","04/10/1967","31/12/2004","15/7/1946","-777",1967-10-04,2004-12-31,0,-888,0,0,-888,"M",1946-07-15,1946,NA,-777
"2941","PHI-1946","A2.9-8821",840,"PHI","Roxas","04/07/1946","16/04/1948","1/1/1892","15/04/1948",1946-07-04,1948-04-16,0,2,0,0,-777,"M",1892-01-01,1892,1948-04-15,1948
"2942","PHI-1948","A2.9-8824",840,"PHI","Quirrino","16/04/1948","30/12/1953","16/11/1890","28/02/1956",1948-04-16,1953-12-30,0,1,0,0,0,"M",1890-11-16,1890,1956-02-28,1956
"2943","PHI-1953","A2.9-8827",840,"PHI","Magsaysay","30/12/1953","17/03/1957","31/8/1907","17/03/1957",1953-12-30,1957-03-17,0,2,0,0,-777,"M",1907-08-31,1907,1957-03-17,1957
"2944","PHI-1957","A2.9-8830",840,"PHI","Garcia","17/03/1957","14/11/1961","4/11/1896","14/06/1971",1957-03-17,1961-11-14,0,1,0,0,0,"M",1896-11-04,1896,1971-06-14,1971
"2945","PHI-1961","A2.9-8833",840,"PHI","Macapagal","14/11/1961","30/12/1965","28/9/1910","21/04/1997",1961-11-14,1965-12-30,0,1,0,0,0,"M",1910-09-28,1910,1997-04-21,1997
"2946","PHI-1965","A2.9-8836",840,"PHI","Marcos","30/12/1965","25/02/1986","11/9/1917","28/09/1989",1965-12-30,1986-02-25,0,3,2,0,1,"M",1917-09-11,1917,1989-09-28,1989
"2947","PHI-1986","A2.9-8839",840,"PHI","Aquino","25/02/1986","30/06/1992","25/1/1933","-777",1986-02-25,1992-06-30,1,1,0,0,0,"F",1933-01-25,1933,NA,-777
"2948","PHI-1992","A2.9-8842",840,"PHI","Ramos","30/06/1992","30/06/1998","18/3/1928","-777",1992-06-30,1998-06-30,0,1,0,0,0,"M",1928-03-18,1928,NA,-777
"2949","PHI-1998","A2.9-8845",840,"PHI","Estrada","30/06/1998","20/01/2001","19/04/1937","-777",1998-06-30,2001-01-20,0,1,0,0,2,"M",1937-04-19,1937,NA,-777
"2950","PHI-2001","A2.9-8848",840,"PHI","Gloria Macapagal-Arroyo","21/01/2001","31/12/2004","05/04/1947","-777",2001-01-21,2004-12-31,0,-888,0,0,-888,"F",1947-04-05,1947,NA,-777
"2951","INS-1945","A2.9-8851",850,"INS","Sukarno","17/08/1945","18/12/1948","6/6/1901","1970",1945-08-17,1948-12-18,0,4,9,0,2,"M",1901-06-06,1901,NA,1970
"2952","INS-1948","A2.9-8854",850,"INS","Louis Beel","18/12/1948","19/05/1949","12/4/1902","1977",1948-12-18,1949-05-19,2,4,111,0,1,"M",1902-04-12,1902,NA,1977
"2953","INS-1949-1","A2.9-8857",850,"INS","A. H. J. Lovink","19/05/1949","27/12/1949","12/07/1902","1995",1949-05-19,1949-12-27,2,1,0,0,1,"M",1902-07-12,1902,NA,1995
"2954","INS-1949-2","A2.9-8860",850,"INS","Sukarno","27/12/1949","12/03/1966","6/6/1901","1970",1949-12-27,1966-03-12,0,3,6,1,2,"M",1901-06-06,1901,NA,1970
"2955","INS-1966","A2.9-8863",850,"INS","Suharto","12/03/1966","21/05/1998","20/2/1921","-777",1966-03-12,1998-05-21,1,1,0,0,2,"M",1921-02-20,1921,NA,-777
"2956","INS-1998","A2.9-8866",850,"INS","Habibie","21/05/1998","20/10/1999","25/6/1936","-777",1998-05-21,1999-10-20,0,1,0,0,0,"M",1936-06-25,1936,NA,-777
"2957","INS-1999","A2.9-8869",850,"INS","Wahid","20/10/1999","23/07/2001","1940","-777",1999-10-20,2001-07-23,0,1,0,0,0,"M",NA,1940,NA,-777
"2958","INS-2001","A2.9-8872",850,"INS","Megawati Sukarnoputri","24/07/2001","20/10/2004","1947","-777",2001-07-24,2004-10-20,0,1,0,0,-999,"F",NA,1947,NA,-777
"2959","INS-2004","A2.9-8875",850,"INS","Bambang Yudhoyono","20/10/2004","31/12/2004","1949","-777",2004-10-20,2004-12-31,0,-888,0,0,-888,"M",NA,1949,NA,-777
"2960","ETM-2002","A2.9-8878",860,"ETM","Gusmao","20/05/2002","31/12/2004","20/6/1946","-777",2002-05-20,2004-12-31,0,-888,0,0,-888,"M",1946-06-20,1946,NA,-777
"2961","AUL-1901","A2.9-8881",900,"AUL","Edmund Barton","01/01/1901","24/09/1903","18/1/1849","07/01/1920",1901-01-01,1903-09-24,0,1,0,0,0,"M",1849-01-18,1849,1920-01-07,1920
"2962","AUL-1903","A2.9-8884",900,"AUL","Alfred Deakin","24/09/1903","26/04/1904","3/8/1856","07/10/1919",1903-09-24,1904-04-26,0,1,0,0,0,"M",1856-08-03,1856,1919-10-07,1919
"2963","AUL-1904-1","A2.9-8887",900,"AUL","John Christian Watson","26/04/1904","18/08/1904","9/4/1867","1941",1904-04-26,1904-08-18,0,1,0,0,0,"M",1867-04-09,1867,NA,1941
"2964","AUL-1904-2","A2.9-8890",900,"AUL","George Reid","18/08/1904","05/07/1905","22/2/1848","12/09/1918",1904-08-18,1905-07-05,0,1,0,0,0,"M",1848-02-22,1848,1918-09-12,1918
"2965","AUL-1905","A2.9-8893",900,"AUL","Alfred Deakin","05/07/1905","13/11/1908","3/8/1856","07/10/1919",1905-07-05,1908-11-13,0,1,0,1,0,"M",1856-08-03,1856,1919-10-07,1919
"2966","AUL-1908","A2.9-8896",900,"AUL","Andrew Fisher","13/11/1908","02/06/1909","29/8/1862","22/10/1928",1908-11-13,1909-06-02,0,1,0,0,0,"M",1862-08-29,1862,1928-10-22,1928
"2967","AUL-1909","A2.9-8899",900,"AUL","Alfred Deakin","02/06/1909","29/04/1910","3/8/1856","07/10/1919",1909-06-02,1910-04-29,0,1,0,2,0,"M",1856-08-03,1856,1919-10-07,1919
"2968","AUL-1910","A2.9-8902",900,"AUL","Andrew Fisher","29/04/1910","24/04/1913","29/8/1862","22/10/1928",1910-04-29,1913-04-24,0,1,0,1,0,"M",1862-08-29,1862,1928-10-22,1928
"2969","AUL-1913","A2.9-8905",900,"AUL","Joseph Cook","24/04/1913","17/09/1914","7/12/1860","30/07/1947",1913-04-24,1914-09-17,0,1,0,0,0,"M",1860-12-07,1860,1947-07-30,1947
"2970","AUL-1914","A2.9-8908",900,"AUL","Andrew Fisher","17/09/1914","27/10/1915","29/8/1862","22/10/1928",1914-09-17,1915-10-27,0,1,0,2,0,"M",1862-08-29,1862,1928-10-22,1928
"2971","AUL-1915","A2.9-8911",900,"AUL","Hughes","27/10/1915","03/02/1923","25/9/1864","28/10/1952",1915-10-27,1923-02-03,0,1,0,0,0,"M",1864-09-25,1864,1952-10-28,1952
"2972","AUL-1923","A2.9-8914",900,"AUL","Bruce","03/02/1923","22/10/1929","15/4/1883","25/08/1967",1923-02-03,1929-10-22,0,1,0,0,0,"M",1883-04-15,1883,1967-08-25,1967
"2973","AUL-1929","A2.9-8917",900,"AUL","Scullin","22/10/1929","06/01/1932","18/9/1876","1953",1929-10-22,1932-01-06,0,1,0,0,0,"M",1876-09-18,1876,NA,1953
"2974","AUL-1932","A2.9-8920",900,"AUL","Lyons","06/01/1932","07/04/1939","15/9/1879","07/04/1939",1932-01-06,1939-04-07,0,2,0,0,-777,"M",1879-09-15,1879,1939-04-07,1939
"2975","AUL-1939-1","A2.9-8923",900,"AUL","Page","07/04/1939","26/04/1939","8/8/1888","20/12/1961",1939-04-07,1939-04-26,0,1,0,0,0,"M",1888-08-08,1888,1961-12-20,1961
"2976","AUL-1939-2","A2.9-8926",900,"AUL","Menzies","26/04/1939","29/08/1941","20/12/1894","16/05/1978",1939-04-26,1941-08-29,0,1,0,0,0,"M",1894-12-20,1894,1978-05-16,1978
"2977","AUL-1941-1","A2.9-8929",900,"AUL","Fadden","29/08/1941","07/10/1941","13/04/1895","21/04/1973",1941-08-29,1941-10-07,0,1,0,0,0,"M",1895-04-13,1895,1973-04-21,1973
"2978","AUL-1941-2","A2.9-8932",900,"AUL","Curtin","07/10/1941","30/04/1945","8/1/1885","05/07/1945",1941-10-07,1945-04-30,0,2.1,0,0,-777,"M",1885-01-08,1885,1945-07-05,1945
"2979","AUL-1945-1","A2.9-8935",900,"AUL","Forde","30/04/1945","13/07/1945","18/7/1890","28/01/1983",1945-04-30,1945-07-13,0,1,0,0,0,"M",1890-07-18,1890,1983-01-28,1983
"2980","AUL-1945-2","A2.9-8938",900,"AUL","Chifley","13/07/1945","19/12/1949","22/9/1885","13/06/1951",1945-07-13,1949-12-19,0,1,0,0,0,"M",1885-09-22,1885,1951-06-13,1951
"2981","AUL-1949","A2.9-8941",900,"AUL","Menzies","19/12/1949","26/01/1966","20/12/1894","16/05/1978",1949-12-19,1966-01-26,0,1,0,1,0,"M",1894-12-20,1894,1978-05-16,1978
"2982","AUL-1966","A2.9-8944",900,"AUL","Holt","27/01/1966","19/12/1967","5/8/1908","19/12/1967",1966-01-27,1967-12-19,0,2,0,0,-777,"M",1908-08-05,1908,1967-12-19,1967
"2983","AUL-1967","A2.9-8947",900,"AUL","McEwen","19/12/1967","10/01/1968","29/3/1900","21/11/1980",1967-12-19,1968-01-10,0,1,0,0,0,"M",1900-03-29,1900,1980-11-21,1980
"2984","AUL-1968","A2.9-8950",900,"AUL","Gorton","10/01/1968","10/03/1971","9/9/1911","19/05/2002",1968-01-10,1971-03-10,0,1,0,0,0,"M",1911-09-09,1911,2002-05-19,2002
"2985","AUL-1971","A2.9-8953",900,"AUL","McMahon","10/03/1971","05/12/1972","23/2/1908","31/03/1988",1971-03-10,1972-12-05,0,1,0,0,0,"M",1908-02-23,1908,1988-03-31,1988
"2986","AUL-1972","A2.9-8956",900,"AUL","Whitlam","05/12/1972","11/11/1975","11/7/1916","-777",1972-12-05,1975-11-11,0,1,0,0,0,"M",1916-07-11,1916,NA,-777
"2987","AUL-1975","A2.9-8959",900,"AUL","Fraser","11/11/1975","11/03/1983","21/5/1930","-777",1975-11-11,1983-03-11,0,1,0,0,0,"M",1930-05-21,1930,NA,-777
"2988","AUL-1983","A2.9-8962",900,"AUL","Hawke","11/03/1983","19/12/1991","9/12/1929","-777",1983-03-11,1991-12-19,0,1,0,0,0,"M",1929-12-09,1929,NA,-777
"2989","AUL-1991","A2.9-8965",900,"AUL","Keating","19/12/1991","11/03/1996","18/1/1945","-777",1991-12-19,1996-03-11,0,1,0,0,0,"M",1945-01-18,1945,NA,-777
"2990","AUL-1996","A2.9-8968",900,"AUL","Howard","11/03/1996","31/12/2004","26/7/1939","-777",1996-03-11,2004-12-31,0,-888,0,0,-888,"M",1939-07-26,1939,NA,-777
"2991","PNG-1975","A2.9-8971",910,"PNG","Somare","16/09/1975","11/03/1980","9/4/1936","-777",1975-09-16,1980-03-11,0,1,0,0,0,"M",1936-04-09,1936,NA,-777
"2992","PNG-1980","A2.9-8974",910,"PNG","Chan","11/03/1980","02/08/1982","29/8/1939","-777",1980-03-11,1982-08-02,0,1,0,0,0,"M",1939-08-29,1939,NA,-777
"2993","PNG-1982","A2.9-8977",910,"PNG","Somare","02/08/1982","21/11/1985","9/4/1936","-777",1982-08-02,1985-11-21,0,1,0,1,0,"M",1936-04-09,1936,NA,-777
"2994","PNG-1985","A2.9-8980",910,"PNG","Wingti","21/11/1985","04/07/1988","1951","-777",1985-11-21,1988-07-04,0,1,0,0,0,"M",NA,1951,NA,-777
"2995","PNG-1988","A2.9-8983",910,"PNG","Namaliu","04/07/1988","17/07/1992","3/4/1947","-777",1988-07-04,1992-07-17,0,1,0,0,0,"M",1947-04-03,1947,NA,-777
"2996","PNG-1992","A2.9-8986",910,"PNG","Wingti","17/07/1992","30/08/1994","1951","-777",1992-07-17,1994-08-30,0,1,0,1,0,"M",NA,1951,NA,-777
"2997","PNG-1994","A2.9-8989",910,"PNG","Chan","30/08/1994","22/07/1997","29/8/1939","-777",1994-08-30,1997-07-22,0,1,0,1,0,"M",1939-08-29,1939,NA,-777
"2998","PNG-1997","A2.9-8992",910,"PNG","Skate","22/07/1997","14/07/1999","1953","-777",1997-07-22,1999-07-14,0,1,0,0,0,"M",NA,1953,NA,-777
"2999","PNG-1999","A2.9-8995",910,"PNG","Morauta","14/07/1999","05/08/2002","1946","-777",1999-07-14,2002-08-05,0,1,0,0,0,"M",NA,1946,NA,-777
"3000","PNG-2002","A2.9-8998",910,"PNG","Somare","06/08/2002","31/12/2004","9/4/1936","-777",2002-08-06,2004-12-31,0,-888,0,2,-888,"M",1936-04-09,1936,NA,-777
"3001","NEW-1906","A2.9-9001",920,"NEW","Ward","06/08/1906","28/03/1912","1856","1930",1906-08-06,1912-03-28,0,1,0,0,0,"M",NA,1856,NA,1930
"3002","NEW-1912-1","A2.9-9004",920,"NEW","Thomas Mackenzie","28/03/1912","10/07/1912","1854","1930",1912-03-28,1912-07-10,0,1,0,0,0,"M",NA,1854,NA,1930
"3003","NEW-1912-2","A2.9-9007",920,"NEW","Massey","10/07/1912","10/05/1925","26/3/1856","1925",1912-07-10,1925-05-10,0,2,0,0,-777,"M",1856-03-26,1856,NA,1925
"3004","NEW-1925-1","A2.9-9010",920,"NEW","Bell","14/05/1925","30/05/1925","31/03/1851","1936",1925-05-14,1925-05-30,0,1,0,0,0,"M",1851-03-31,1851,NA,1936
"3005","NEW-1925-2","A2.9-9013",920,"NEW","Coates","30/05/1925","07/12/1928","3/2/1878","1943",1925-05-30,1928-12-07,0,1,0,0,0,"M",1878-02-03,1878,NA,1943
"3006","NEW-1928","A2.9-9016",920,"NEW","Ward","10/12/1928","15/05/1930","1856","1930",1928-12-10,1930-05-15,0,2.1,0,1,-777,"M",NA,1856,NA,1930
"3007","NEW-1930","A2.9-9019",920,"NEW","Forbes","28/05/1930","27/11/1935","12/3/1869","17/05/1947",1930-05-28,1935-11-27,0,1,0,0,0,"M",1869-03-12,1869,1947-05-17,1947
"3008","NEW-1935","A2.9-9022",920,"NEW","Savage","27/11/1935","26/03/1940","7/3/1872","1940",1935-11-27,1940-03-26,0,2,0,0,-777,"M",1872-03-07,1872,NA,1940
"3009","NEW-1940","A2.9-9025",920,"NEW","Fraser","01/04/1940","12/12/1949","28/8/1884","12/12/1950",1940-04-01,1949-12-12,0,1,0,0,0,"M",1884-08-28,1884,1950-12-12,1950
"3010","NEW-1949","A2.9-9028",920,"NEW","Holland","13/12/1949","20/09/1957","18/10/1893","05/08/1961",1949-12-13,1957-09-20,0,2.1,0,0,0,"M",1893-10-18,1893,1961-08-05,1961
"3011","NEW-1957-1","A2.9-9031",920,"NEW","Holyoake","20/09/1957","12/12/1957","11/2/1904","08/12/1983",1957-09-20,1957-12-12,0,1,0,0,0,"M",1904-02-11,1904,1983-12-08,1983
"3012","NEW-1957-2","A2.9-9034",920,"NEW","Nash","12/12/1957","12/12/1960","12/2/1882","04/06/1968",1957-12-12,1960-12-12,0,1,0,0,0,"M",1882-02-12,1882,1968-06-04,1968
"3013","NEW-1960","A2.9-9037",920,"NEW","Holyoake","12/12/1960","07/02/1972","11/2/1904","08/12/1983",1960-12-12,1972-02-07,0,1,0,1,0,"M",1904-02-11,1904,1983-12-08,1983
"3014","NEW-1972-1","A2.9-9040",920,"NEW","Marshall","07/02/1972","08/12/1972","5/3/1912","30/08/1988",1972-02-07,1972-12-08,0,1,0,0,0,"M",1912-03-05,1912,1988-08-30,1988
"3015","NEW-1972-2","A2.9-9043",920,"NEW","Kirk","08/12/1972","31/08/1974","2/1/1923","31/08/1974",1972-12-08,1974-08-31,0,2,0,0,-777,"M",1923-01-02,1923,1974-08-31,1974
"3016","NEW-1974","A2.9-9046",920,"NEW","Rowling","06/09/1974","12/12/1975","15/11/1927","31/10/1995",1974-09-06,1975-12-12,0,1,0,0,0,"M",1927-11-15,1927,1995-10-31,1995
"3017","NEW-1975","A2.9-9049",920,"NEW","Muldoon","12/12/1975","26/07/1984","25/9/1921","05/08/1992",1975-12-12,1984-07-26,0,1,0,0,0,"M",1921-09-25,1921,1992-08-05,1992
"3018","NEW-1984","A2.9-9052",920,"NEW","Lange","26/07/1984","08/08/1989","1942","13/08/2005",1984-07-26,1989-08-08,0,1,0,0,0,"M",NA,1942,2005-08-13,2005
"3019","NEW-1989","A2.9-9055",920,"NEW","Palmer","08/08/1989","04/09/1990","21/4/1942","-777",1989-08-08,1990-09-04,0,1,0,0,0,"M",1942-04-21,1942,NA,-777
"3020","NEW-1990-1","A2.9-9058",920,"NEW","Moore","04/09/1990","27/10/1990","1949","-777",1990-09-04,1990-10-27,0,1,0,0,0,"M",NA,1949,NA,-777
"3021","NEW-1990-2","A2.9-9061",920,"NEW","Bolger","27/10/1990","08/12/1997","31/5/1935","-777",1990-10-27,1997-12-08,0,1,0,0,0,"M",1935-05-31,1935,NA,-777
"3022","NEW-1997","A2.9-9064",920,"NEW","Shipley","08/12/1997","10/12/1999","1952","-777",1997-12-08,1999-12-10,0,1,0,0,0,"F",NA,1952,NA,-777
"3023","NEW-1999","A2.9-9067",920,"NEW","Clark","10/12/1999","31/12/2004","26/2/1950","-777",1999-12-10,2004-12-31,0,-888,0,0,-888,"F",1950-02-26,1950,NA,-777
"3024","SOL-1978","A2.9-9070",940,"SOL","Kenilorea","07/07/1978","31/08/1981","23/5/1943","-777",1978-07-07,1981-08-31,0,1,0,0,0,"M",1943-05-23,1943,NA,-777
"3025","SOL-1981","A2.9-9073",940,"SOL","Mamaloni","31/08/1981","19/11/1984","1943","2000",1981-08-31,1984-11-19,0,1,0,0,0,"M",NA,1943,NA,2000
"3026","SOL-1984","A2.9-9076",940,"SOL","Kenilorea","19/11/1984","01/12/1986","23/5/1943","-777",1984-11-19,1986-12-01,0,1,0,1,0,"M",1943-05-23,1943,NA,-777
"3027","SOL-1986","A2.9-9079",940,"SOL","Alebua","01/12/1986","28/03/1989","1947","-777",1986-12-01,1989-03-28,0,1,0,0,0,"M",NA,1947,NA,-777
"3028","SOL-1989","A2.9-9082",940,"SOL","Mamaloni","28/03/1989","18/06/1993","1943","2000",1989-03-28,1993-06-18,0,1,0,1,0,"M",NA,1943,NA,2000
"3029","SOL-1993","A2.9-9085",940,"SOL","Hilly","18/06/1993","31/10/1994","1947","-777",1993-06-18,1994-10-31,0,3,8,0,0,"M",NA,1947,NA,-777
"3030","SOL-1994","A2.9-9088",940,"SOL","Mamaloni","31/10/1994","27/08/1997","1943","2000",1994-10-31,1997-08-27,1,1,0,2,0,"M",NA,1943,NA,2000
"3031","SOL-1997","A2.9-9091",940,"SOL","Ulufa'alu","27/08/1997","05/06/2000","1950","2007",1997-08-27,2000-06-05,0,3,4,0,2,"M",NA,1950,NA,2007
"3032","SOL-2000","A2.9-9094",940,"SOL","Sogavare","30/06/2000","17/12/2001","1954","-777",2000-06-30,2001-12-17,0,1,0,0,0,"M",NA,1954,NA,-777
"3033","SOL-2001","A2.9-9097",940,"SOL","Kemakeza","17/12/2001","31/12/2004","1951","-777",2001-12-17,2004-12-31,0,-888,0,0,-888,"M",NA,1951,NA,-777
"3034","FJI-1970","A2.9-9100",950,"FJI","Mara","10/10/1970","13/04/1987","13/5/1920","18/04/2004",1970-10-10,1987-04-13,0,1,0,0,0,"M",1920-05-13,1920,2004-04-18,2004
"3035","FJI-1987-1","A2.9-9103",950,"FJI","Bavadra","13/04/1987","14/05/1987","1934","03/11/1989",1987-04-13,1987-05-14,0,3,6,0,2,"M",NA,1934,1989-11-03,1989
"3036","FJI-1987-2","A2.9-9106",950,"FJI","Rabuka","14/05/1987","05/12/1987","13/9/1948","-777",1987-05-14,1987-12-05,1,1,0,0,0,"M",1948-09-13,1948,NA,-777
"3037","FJI-1987-3","A2.9-9109",950,"FJI","Mara","05/12/1987","02/06/1992","13/5/1920","18/04/2004",1987-12-05,1992-06-02,0,1,0,1,0,"M",1920-05-13,1920,2004-04-18,2004
"3038","FJI-1992","A2.9-9112",950,"FJI","Rabuka","02/06/1992","19/05/1999","13/9/1948","-777",1992-06-02,1999-05-19,0,1,0,1,0,"M",1948-09-13,1948,NA,-777
"3039","FJI-1999","A2.9-9115",950,"FJI","Chaudhry","19/05/1999","19/05/2000","2/9/1942","-777",1999-05-19,2000-05-19,0,3,4,0,2,"M",1942-09-02,1942,NA,-777
"3040","FJI-2000-1","A2.9-9118",950,"FJI","Ratu Josefa Iloilo","27/05/2000","29/05/2000","1920","-777",2000-05-27,2000-05-29,1,1,0,0,0,"M",NA,1920,NA,-777
"3041","FJI-2000-2","A2.9-9121",950,"FJI","Bainimarama","29/05/2000","14/07/2000","27/04/1954","-777",2000-05-29,2000-07-14,1,3,8,0,0,"M",1954-04-27,1954,NA,-777
"3042","FJI-2000-3","A2.9-9124",950,"FJI","Laisenia Qarase","14/07/2000","31/12/2004","1941","-777",2000-07-14,2004-12-31,0,-888,0,0,-888,"M",NA,1941,NA,-777
