"","DSU_Case_mod","CASE_ID","s.ccodeIMP","IMP_DATE","t.ccodeIMP","i.date","t.ccodeINV","s.ccodeINV","V_NUMBER.x","AD_CTY_NAME","CASE_REPCODE","INV_CTY_NAME","INV_CTY_CODE","PRODUCT","INIT_DATE","P_DUMP_DATE","P_INJ_DATE","P_DUMP_DEC","P_INJ_DEC","P_AD_DATE","P_AD_MEASURE","F_DUMP_DATE","F_INJ_DATE","F_DUMP_DEC","F_INJ_DEC","F_AD_DATE","F_AD_MEASURE","REVOKE_DATE","REVOKE_YEAR","WTO_F_AD_MEASURE","WTO_F_MARGIN_MIN","WTO_F_MARGIN_MAX","WTO_CITATION","s.polity2INV","s.democINV","s.democ.iINV","t.polity2INV","t.democ.iINV","wtopd","s.TX.VAL.AGRI.ZS.UNINV","t.TX.VAL.AGRI.ZS.UNINV","s.NE.TRD.GNFS.ZSINV","t.NE.TRD.GNFS.ZSINV","prevint","s.NY.GDP.PCAP.CDINV","t.NY.GDP.PCAP.CDINV","s.NY.GDP.MKTP.CDINV","t.NY.GDP.MKTP.CDINV","s.NE.EXP.GNFS.ZSINV","t.NE.EXP.GNFS.ZSINV","s.NV.AGR.TOTL.ZSINV","t.NV.AGR.TOTL.ZSINV","sdateINV","cdate","einitdate","t.tenureINV","s.tenureINV","eP_AD_DATE","s.NY.GDP.MKTP.CD_IMP","t.NY.GDP.MKTP.CD_IMP","s.NE.EXP.GNFS.ZS_IMP","t.NE.EXP.GNFS.ZS_IMP","s.NE.TRD.GNFS.ZS_IMP","t.NE.TRD.GNFS.ZS_IMP","s.NY.GDP.PCAP.CD_IMP","t.NY.GDP.PCAP.CD_IMP","s.NV.AGR.TOTL.ZS_IMP","t.NV.AGR.TOTL.ZS_IMP","WTOname.x","s.WTOdate","WTOname.y","t.WTOdate","t.WTOmem","s.WTOmem","t.GATTname","t.GATTdate","s.GATTname","s.GATTdate","s.GATTmem","t.GATTmem","t.polity2_IMP","t.democ_IMP","s.polity2_IMP","s.democ_IMP","s.democ.i_IMP","t.democ.i_IMP","V_NUMBER.y","AD.imposing.country","DSU_Case","DSU.case.descriptor","Exporting.Country","DSU_INIT_YR","AD_INIT_YR","AD_OTH_YR","unique","F_DATE","chal","pan_date","panel_date","panel.i"
"2",2,"USA-AD-747",2,"1996",70,1996,70,2,"Q4_2012","USA","USA-AD-747","Mexico","MEX","Fresh Tomatoes","4/5/96","11/1/96","6/6/96","OTH","A","11/1/96",".",".",".",".",".",".",".","IF","IF","MI","MI","MI","G/ADP/N/22/USA",10,10,1,4,0,1,3.072677564,1.164146926,22.61178736,50.72412577,1,30068.22721,4088.455459,8.1e+12,3.97e+11,10.71084665,26.72858685,1.805715555,4.719838656,"4/5/96",1996-04-05,1996-04-05,491,1171,1996-11-01,8.1e+12,3.97e+11,10.71084665,26.72858685,22.61178736,50.72412577,30068.22721,4088.455459,1.805715555,4.719838656,"United States of America",1995-01-01,"Mexico ",1995-01-01,1,1,"Mexico",1986-08-24,"United States of America",1948-01-01,1,1,4,4,10,10,1,0,"Q4_2013","USA","DS-049","Anti-Dumping Investigation Regarding Imports of Fresh or Chilled Tomatoes from Mexico","Mexico",1996,"1996",1996,1,NA,1,"03/25/1995",1995-03-25,1
"6",7,"MEX-AD-183",70,"1997",2,1997,2,70,"Q4_2012","Mexico","MEX-AD-183","USA","USA","High Fructose Corn Syrup","2/27/97","6/25/97","6/25/97","A","A","6/26/97","SD","1/28/98","1/28/98","A","A","1/24/98","SD","5/20/02","2002","SD","MI","MI","G/ADP/N/41/MEX",6,6,1,10,1,1,1.002618009,2.672195833,49.32015831,23.34436894,0,4855.629476,31572.63522,4.81e+11,8.61e+12,25.23093323,11.07974676,4.37469987,1.685758917,"2/27/97",1997-02-27,1997-02-27,1499,819,1997-06-26,4.81e+11,8.61e+12,25.23093323,11.07974676,49.32015831,23.34436894,4855.629476,31572.63522,4.37469987,1.685758917,"Mexico ",1995-01-01,"United States of America",1995-01-01,1,1,"United States of America",1948-01-01,"Mexico",1986-08-24,1,1,10,10,6,6,1,1,"Q4_2013","Mexico ","DS-101","Anti-Dumping Investigation of High-Fructose Corn Syrup (HFCS) from the United States","USA",1997,"1997",1997,1,1998,1,"07/07/1995",1995-07-07,1
"7",8,"AUS-AD-344",900,"1997",225,1997,225,900,"Q4_2012","Australia","AUS-AD-331","Switzerland","CHE","Coated Woodfree Paper in Sheets","7/9/97","11/21/97","11/21/97","A","A","11/21/97","MI","5/8/98","5/8/98","N","N",".",".",".",".",".",".",".",".",10,10,1,10,1,1,8.064125384,0.594116125,37.92803761,73.74722511,0,23536.68349,38407.95376,4.36e+11,2.72e+11,19.11934236,39.17839331,3.55281644,1.478351821,"7/9/97",1997-07-09,1997-07-09,189,485,1997-11-21,4.36e+11,2.72e+11,19.11934236,39.17839331,37.92803761,73.74722511,23536.68349,38407.95376,3.55281644,1.478351821,"Australia ",1995-01-01,"Switzerland ",1995-07-01,1,1,"Switzerland",1966-08-01,"Australia",1948-01-01,1,1,10,10,10,10,1,1,"Q4_2013","Australia ","DS-119","Anti-Dumping Measures on Imports of Coated Woodfree Paper Sheets","Switzerland",1998,"1997",1997,1,NA,1,"09/14/1995",1995-09-14,1
"8",9,"THA-AD-1",800,"1996",290,1996,290,800,"Q2_2012","Thailand","THA-AD-1","Poland","POL","Iron or Non-Alloy Steel: H Section","8/30/96","MI","MI","A","A","12/27/96","MI","MI","MI","A","A","5/26/97","MI","MI","MI","AVD","27.78","27.78","G/ADP/N/41/THA",9,9,1,9,1,1,5.361374003,2.237046386,84.77790103,46.04792205,0,3054.753307,4056.612425,1.82e+11,1.57e+11,39.25165463,22.30846803,9.501520234,7.54644869,"8/30/96",1996-08-30,1996-08-30,251,414,1996-12-27,1.82e+11,1.57e+11,39.25165463,22.30846803,84.77790103,46.04792205,3054.753307,4056.612425,9.501520234,7.54644869,"Thailand ",1995-01-01,"Poland ",1995-07-01,1,1,"Poland",1967-10-18,"Thailand",1982-11-20,1,1,9,9,9,9,1,1,"Q4_2013","Thailand ","DS-122","H-Beams","Poland",1998,"1996",1996,1,1997,1,"09/14/1995",1995-09-14,1
"9",10,"MEX-AD-183",70,"1997",2,1997,2,70,"Q4_2012","Mexico","MEX-AD-183","USA","USA","High Fructose Corn Syrup","2/27/97","6/25/97","6/25/97","A","A","6/26/97","SD","1/28/98","1/28/98","A","A","1/24/98","SD","5/20/02","2002","SD","MI","MI","G/ADP/N/41/MEX",6,6,1,10,1,1,1.002618009,2.672195833,49.32015831,23.34436894,0,4855.629476,31572.63522,4.81e+11,8.61e+12,25.23093323,11.07974676,4.37469987,1.685758917,"2/27/97",1997-02-27,1997-02-27,1499,819,1997-06-26,4.81e+11,8.61e+12,25.23093323,11.07974676,49.32015831,23.34436894,4855.629476,31572.63522,4.37469987,1.685758917,"Mexico ",1995-01-01,"United States of America",1995-01-01,1,1,"United States of America",1948-01-01,"Mexico",1986-08-24,1,1,10,10,6,6,1,1,"Q4_2013","Mexico ","DS-132","Corn Syrup","USA",1998,"1997",1997,0,1998,1,"09/14/1995",1995-09-14,1
"10",11,"EUN-AD-381",994,"1998",750,1997,750,994,"Q4_2012","European Union","EUN-AD-379","India","IND","Cotton Fabrics","7/11/97","4/7/98","4/7/98","A","A","4/7/98","AVD",".",".",".",".",".",".",".",".",".",".",".",".",NA,NA,1,9,1,1,1.751742861,2.004066084,62.87320261,22.22954875,1,18306.25003,427.2361968,8.89e+12,4.23e+11,32.33718379,10.50646612,2.747584066,25.88700833,"7/11/97",1997-07-11,1997-07-11,81,NA,1998-04-07,9.2e+12,4.29e+11,32.54378883,10.82856928,63.84209982,23.29101706,18919.92294,425.4452943,2.566497586,25.79098082,"European Union",1995-01-01,"India ",1995-01-01,1,1,"India",1948-07-08,NA,NA,NA,1,9,9,6,NA,1,1,"Q4_2013","EUN ","DS-140","Anti-Dumping Investigations Regarding Unbleached Cotton Fabrics from India","India",1998,"1997",1997,1,NA,1,"09/14/1995",1995-09-14,1
"11",12,"EUN-AD-356",994,"1997",750,1996,750,994,"Q4_2012","European Union","EUN-AD-355","India","IND","Bed Linen (Cotton Type)","9/13/96","6/12/97","6/12/97","A","A","6/12/97","AVD","11/28/97","11/28/97","A","A","11/28/97","AVD","12/20/03","2003","AVD","2.6","24.7","G/ADP/N/35/EEC",NA,NA,1,9,1,1,1.812418903,2.53330323,59.52104043,21.55153995,1,19449.99077,410.8183568,9.43e+12,4e+11,30.53347661,10.2061841,2.856364089,27.12742197,"9/13/96",1996-09-13,1996-09-13,104,NA,1997-06-12,8.89e+12,4.23e+11,32.33718379,10.50646612,62.87320261,22.22954875,18306.25003,427.2361968,2.747584066,25.88700833,"European Union",1995-01-01,"India ",1995-01-01,1,1,"India",1948-07-08,NA,NA,NA,1,9,9,6,NA,1,1,"Q4_2013","EUN ","DS-141","Bed Linen","India",1998,"1996",1996,1,1997,1,"09/18/1995",1995-09-18,1
"17",16,"USA-AD-791",2,"1998",732,1998,732,2,"Q4_2012","USA","USA-AD-788","South Korea","KOR","Stainless Steel Plate in Coils","4/9/98","11/4/98","5/28/98","A","A","11/4/98","AVD","3/31/99","5/12/99","A","A","5/21/99","AVD","12/1/11","2011","AVD","16.26","16.26","G/ADP/N/53/USA",10,10,1,8,1,1,2.349922309,1.10598414,22.75912907,72.9054547,1,32948.95126,8133.731245,9.09e+12,3.76e+11,10.48398631,42.35677439,1.300089704,4.636583786,"4/9/98",1998-04-09,1998-04-09,43,1905,1998-11-04,9.09e+12,3.76e+11,10.48398631,42.35677439,22.75912907,72.9054547,32948.95126,8133.731245,1.300089704,4.636583786,"United States of America",1995-01-01,"South Korea",1995-01-01,1,1,"South Korea",1967-04-14,"United States of America",1948-01-01,1,1,8,8,10,10,1,1,"Q4_2013","USA","DS-179","Stainless Steel","Korea",1999,"1998",1998,1,1999,1,"",NA,0
"18",16,"USA-AD-801",2,"1999",732,1998,732,2,"Q4_2012","USA","USA-AD-797","South Korea","KOR","Stainless Steel Sheet and Strip","6/17/98","1/4/99","8/5/98","A","A","1/4/99","AVD","6/8/99","7/28/99","A","A","7/27/99","AVD","IF","IF","AVD","MI","MI","MI",10,10,1,8,1,1,2.349922309,1.10598414,22.75912907,72.9054547,1,32948.95126,8133.731245,9.09e+12,3.76e+11,10.48398631,42.35677439,1.300089704,4.636583786,"6/17/98",1998-06-17,1998-06-17,112,1974,1999-01-04,9.67e+12,4.86e+11,10.23412686,35.77703363,23.17266209,65.43023242,34639.11984,10432.2108,1.219934045,4.75889537,"United States of America",1995-01-01,"South Korea",1995-01-01,1,1,"South Korea",1967-04-14,"United States of America",1948-01-01,1,1,8,8,10,10,1,1,"Q4_2013","USA","DS-179","Stainless Steel","Korea",1999,"1998",1998,1,1999,1,"",NA,0
"19",17,"ECU-AD-1",130,"1999",70,1998,70,130,"Q4_2012","Ecuador","ECU-AD-1","Mexico","MEX","Grey Portland Cement","1/26/98","6/1/99","6/1/99","A","A","7/14/99","AVD","1/6/00","1/6/00","A","A","1/14/00","AVD","5/4/00","2000","MI","MI","MI","MI",9,9,1,6,1,1,4.899153486,0.783309588,43.39510795,51.77609803,1,2323.556239,4986.252659,27981319125,5.02e+11,17.89195087,25.74892715,18.32287554,4.206365878,"1/26/98",1998-01-26,1998-01-26,1152,349,1999-07-14,19644866963,5.79e+11,26.37754164,25.48169145,49.2012508,51.2689011,1598.83413,5663.388512,18.32826619,3.953796773,"Ecuador ",1996-01-21,"Mexico ",1995-01-01,1,1,"Mexico",1986-08-24,NA,NA,NA,1,6,6,9,9,1,1,"Q4_2013","Ecuador ","DS-182","Provisional Anti-Dumping Measure on Cement from Mexico","Mexico",1999,"1998",1998,1,2000,1,"",NA,0
"20",18,"USA-AD-807",2,"1999",740,1998,740,2,"Q4_2012","USA","USA-AD-806","Japan","JPN","Hot Rolled Carbon Steel Flat Products","10/7/98","2/19/99","11/25/98","A","A","2/19/99","AVD","5/6/99","6/23/99","A","A","6/29/99","AVD","6/21/11","2011","AVD","17.86","67.14","G/ADP/N/53/USA",10,10,1,10,1,1,2.349922309,0.52714681,22.75912907,19.6888759,1,32948.95126,30967.28809,9.09e+12,3.91e+12,10.48398631,10.7774668,1.300089704,1.704186546,"10/7/98",1998-10-07,1998-10-07,69,2086,1999-02-19,9.67e+12,4.43e+12,10.23412686,10.17337581,23.17266209,18.75638736,34639.11984,34998.80997,1.219934045,1.679247869,"United States of America",1995-01-01,"Japan ",1995-01-01,1,1,"Japan",1955-09-10,"United States of America",1948-01-01,1,1,10,10,10,10,1,1,"Q4_2013","USA","DS-184","Hot-Rolled Steel","Japan",1999,"1998",1998,1,1999,1,"03/07/1997",1997-03-07,1
"21",19,"TTO-AD-3",52,"1999",94,1998,94,52,"Q4_2012","Trinidad and Tobago","TTO-AD-3","Costa Rica","CRI","Macaroni and Spaghetti","12/31/98","12/3/99","12/3/99","A","A","12/30/99","AVD","5/19/00","5/19/00","W","W",".",".",".",".",".",".",".",".",10,10,1,10,1,1,0.153295079,4.472075063,102.2832356,97.53284273,0,4786.930366,3759.881077,6043710211,14101753567,48.46513115,47.4442833,2.181492078,12.83326036,"12/31/98",1998-12-31,1998-12-31,237,1148,1999-12-30,6808976089,15796567138,50.00280776,51.74490096,94.18470337,97.67202282,5383.521802,4111.832609,2.027936414,10.54177591,"Trinidad and Tobago",1995-03-01,"Costa Rica",1995-01-01,1,1,"Costa Rica",1990-11-24,"Trinidad and Tobago",1962-10-23,1,1,10,10,10,10,1,1,"Q4_2013","Trinidad and Tobago ","DS-185","Anti-Dumping Measures on Pasta from Costa Rica","Costa Rica ",1999,"1998",1998,1,NA,1,"",NA,0
"22",20,"TTO-AD-3",52,"1999",94,1998,94,52,"Q4_2012","Trinidad and Tobago","TTO-AD-3","Costa Rica","CRI","Macaroni and Spaghetti","12/31/98","12/3/99","12/3/99","A","A","12/30/99","AVD","5/19/00","5/19/00","W","W",".",".",".",".",".",".",".",".",10,10,1,10,1,1,0.153295079,4.472075063,102.2832356,97.53284273,0,4786.930366,3759.881077,6043710211,14101753567,48.46513115,47.4442833,2.181492078,12.83326036,"12/31/98",1998-12-31,1998-12-31,237,1148,1999-12-30,6808976089,15796567138,50.00280776,51.74490096,94.18470337,97.67202282,5383.521802,4111.832609,2.027936414,10.54177591,"Trinidad and Tobago",1995-03-01,"Costa Rica",1995-01-01,1,1,"Costa Rica",1990-11-24,"Trinidad and Tobago",1962-10-23,1,1,10,10,10,10,1,1,"Q4_2013","Trinidad and Tobago ","DS-187","Provisional Anti-Dumping Measure on Macaroni and Spaghetti from Costa Rica","Costa Rica ",1999,"1998",1998,0,NA,1,"",NA,0
"23",21,"ARG-AD-134",160,"1998",255,1997,255,160,"Q4_2012","Argentina","ARG-AD-134","Germany","DEU","Coated Cardboard","8/27/97","12/23/97","12/23/97","A","A","6/9/98","DPU","7/24/98","7/24/98","A","A","2/26/99","DPU","MI","2001","DPU","MI","MI","G/ADP/N/53/ARG",7,7,1,10,1,1,2.842551758,0.944504553,19.26442562,53.50674475,1,9939.753275,26296.53061,3.55e+11,2.16e+12,8.718137771,27.39830597,4.81158208,1.133319477,"8/27/97",1997-08-27,1997-08-27,5444,3337,1998-06-09,3.62e+11,2.18e+12,8.598203206,28.58294637,19.27581739,55.79170281,10028.81193,26547.77535,4.805017302,1.073012219,"Argentina ",1995-01-01,"Germany ",1995-01-01,1,1,"Germany",1951-10-01,"Argentina",1967-10-11,1,1,10,10,7,7,1,1,"Q4_2013","Argentina ","DS-189","Definitive Anti-Dumping Measures on Carton-Board Imports from Germany and Definitive Anti-Dumping Measures on Imports of Ceramic Tiles from Italy","EUN (for DEU)",2000,"1997",1997,1,1999,1,"05/11/1999",1999-05-11,1
"25",22,"ECU-AD-1",130,"1999",70,1998,70,130,"Q4_2012","Ecuador","ECU-AD-1","Mexico","MEX","Grey Portland Cement","1/26/98","6/1/99","6/1/99","A","A","7/14/99","AVD","1/6/00","1/6/00","A","A","1/14/00","AVD","5/4/00","2000","MI","MI","MI","MI",9,9,1,6,1,1,4.899153486,0.783309588,43.39510795,51.77609803,1,2323.556239,4986.252659,27981319125,5.02e+11,17.89195087,25.74892715,18.32287554,4.206365878,"1/26/98",1998-01-26,1998-01-26,1152,349,1999-07-14,19644866963,5.79e+11,26.37754164,25.48169145,49.2012508,51.2689011,1598.83413,5663.388512,18.32826619,3.953796773,"Ecuador ",1996-01-21,"Mexico ",1995-01-01,1,1,"Mexico",1986-08-24,NA,NA,NA,1,6,6,9,9,1,1,"Q4_2013","Ecuador ","DS-191","Definitive Anti-Dumping Measure on Cement from Mexico","Mexico",1999,"1998",1998,0,2000,1,"01/17/1996",1996-01-17,1
"27",24,"USA-AD-817",2,"1999",750,1999,750,2,"Q4_2012","USA","USA-AD-815","India","IND","Cut-To-Length Carbon Steel Plate","2/24/99","7/29/99","4/8/99","A","A","7/29/99","AVD","12/29/99","2/10/00","A","A","2/10/00","AVD","IF","IF","AVD","72.49","72.49","G/ADP/N/59/USA",10,10,1,9,1,1,2.077063761,1.418164643,23.17266209,24.38790891,1,34639.11984,455.4735407,9.67e+12,4.67e+11,10.23412686,11.25469183,1.219934045,24.50227807,"2/24/99",1999-02-24,1999-02-24,342,2226,1999-07-29,9.67e+12,4.67e+11,10.23412686,11.25469183,23.17266209,24.38790891,34639.11984,455.4735407,1.219934045,24.50227807,"United States of America",1995-01-01,"India ",1995-01-01,1,1,"India",1948-07-08,"United States of America",1948-01-01,1,1,9,9,10,10,1,1,"Q4_2013","USA","DS-206","Steel Plate","India",2000,"1999",1999,1,2000,1,"02/22/1996",1996-02-22,1
"29",27,"PHL-AD-15",840,"1999",732,1999,732,840,"Q4_2012","Philippines","PHL-AD-15","South Korea","KOR","Polypropylene Resins","8/16/99","11/10/99","11/10/99","A","A","11/12/99","MI","8/30/00","8/30/00","A","A","10/2/00","MI","11/8/01","2001","MI","2.09","39.42","G/ADP/N/72/PHL",8,8,1,8,1,1,0.524261931,1.002573,94.90945626,65.43023242,1,1091.782723,10432.2108,82995145601,4.86e+11,45.48930623,35.77703363,15.21112017,4.75889537,"8/16/99",1999-08-16,1999-08-16,537,412,1999-11-12,82995145601,4.86e+11,45.48930623,35.77703363,94.90945626,65.43023242,1091.782723,10432.2108,15.21112017,4.75889537,"Philippines ",1995-01-01,"South Korea",1995-01-01,1,1,"South Korea",1967-04-14,"Philippines",1979-12-27,1,1,8,8,8,8,1,1,"Q4_2013","Philippines ","DS-215","Anti-Dumping Measures Regarding Polypropylene Resins from Korea","Korea",2000,"1999",1999,1,2000,1,"04/11/1996",1996-04-11,1
"30",28,"MEX-AD-214",70,"2000",140,1999,140,70,"Q4_2012","Mexico","MEX-AD-214","Brazil","BRA","Power Transformers","11/11/99","7/13/00","7/13/00","A","A","7/18/00","AVD","3/15/01","3/15/01","N","N",".",".",".",".",".",".",".",".",6,6,1,8,1,1,0.624501262,4.506917669,51.2689011,20.22715514,1,5663.388512,3411.865896,5.79e+11,5.87e+11,25.48169145,9.411088649,3.953796773,5.473261496,"11/11/99",1999-11-11,1999-11-11,1775,1806,2000-07-18,6.84e+11,6.45e+11,26.27670441,9.978193817,53.13105126,21.71995842,6581.536932,3694.462668,3.535313249,5.602902758,"Mexico ",1995-01-01,"Brazil ",1995-01-01,1,1,"Brazil",1948-07-30,"Mexico",1986-08-24,1,1,8,8,8,8,1,1,"Q4_2013","Mexico ","DS-216","Provisional Anti-Dumping Measure on Electric Transformers","Brazil",2000,"1999",1999,1,NA,1,"",NA,0
"31",29,"EUN-AD-446",994,"2000",140,1999,140,994,"Q4_2012","European Union","EUN-AD-445","Brazil","BRA","Malleable Cast Iron Pipe Fittings","5/29/99","2/28/00","2/28/00","A","A","2/28/00","AVD","8/11/00","8/11/00","A","A","8/11/00","AVD","8/6/05","2005","AVD","34.8","34.8","G/ADP/N/72/EEC",NA,NA,1,8,1,1,1.591942935,4.506917669,64.65834607,20.22715514,1,18863.99964,3411.865896,9.19e+12,5.87e+11,32.69786017,9.411088649,2.398573448,5.473261496,"5/29/99",1999-05-29,1999-05-29,1609,NA,2000-02-28,8.52e+12,6.45e+11,36.11678545,9.978193817,72.08801675,21.71995842,17468.29776,3694.462668,2.288564687,5.602902758,"European Union",1995-01-01,"Brazil ",1995-01-01,1,1,"Brazil",1948-07-30,NA,NA,NA,1,8,8,6,NA,1,1,"Q4_2013","EUN ","DS-219","Tube or Pipe Fittings","Brazil",2000,"1999",1999,1,2000,1,"",NA,0
"37",35,"USA-AD-928",2,"2001",20,2001,20,2,"Q4_2012","USA","USA-AD-928","Canada","CAN","Softwood Lumber","4/9/01","11/6/01","5/23/01","A","A","11/6/01","AVD","4/2/02","5/22/02","A","A","5/22/02","AVD","12/12/06","2006","AVD","2.18","12.44","G/ADP/N/92/USA",10,10,1,10,1,1,2.306059661,5.577059012,22.8379434,78.79827146,0,37285.81592,23573.75007,1.06e+13,7.33e+11,9.68255014,42.24634131,1.181402837,2.237988252,"4/9/01",2001-04-09,2001-04-09,2713,78,2001-11-06,1.06e+13,7.33e+11,9.68255014,42.24634131,22.8379434,78.79827146,37285.81592,23573.75007,1.181402837,2.237988252,"United States of America",1995-01-01,"Canada ",1995-01-01,1,1,"Canada",1948-01-01,"United States of America",1948-01-01,1,1,10,10,10,10,1,1,"Q4_2013","USA","DS-247","Provisional Anti-Dumping Measure on Imports of Certain Softwood Lumber from Canada","Canada",2002,"2001",2001,1,2002,1,"01/09/1997",1997-01-09,1
"40",37,"USA-AD-928",2,"2001",20,2001,20,2,"Q4_2012","USA","USA-AD-928","Canada","CAN","Softwood Lumber","4/9/01","11/6/01","5/23/01","A","A","11/6/01","AVD","4/2/02","5/22/02","A","A","5/22/02","AVD","12/12/06","2006","AVD","2.18","12.44","G/ADP/N/92/USA",10,10,1,10,1,1,2.306059661,5.577059012,22.8379434,78.79827146,0,37285.81592,23573.75007,1.06e+13,7.33e+11,9.68255014,42.24634131,1.181402837,2.237988252,"4/9/01",2001-04-09,2001-04-09,2713,78,2001-11-06,1.06e+13,7.33e+11,9.68255014,42.24634131,22.8379434,78.79827146,37285.81592,23573.75007,1.181402837,2.237988252,"United States of America",1995-01-01,"Canada ",1995-01-01,1,1,"Canada",1948-01-01,"United States of America",1948-01-01,1,1,10,10,10,10,1,1,"Q4_2013","USA","DS-264","Softwood Lumber V","Canada",2002,"2001",2001,0,2002,1,"",NA,0
"41",38,"USA-AD-711",2,"1995",160,1994,160,2,"Q4_2012","USA","USA-AD-711","Argentina","ARG","Oil Country Tubular Goods","7/7/94","2/2/95","8/24/94","A","A","2/2/95","AVD","6/28/95","8/10/95","A","A","8/11/95","AVD","7/25/06","2006","AVD","1.36","1.36","G/ADP/N/4/USA",10,10,1,7,1,0,3.489054379,3.360702032,20.99278942,14.97014353,0,27776.4265,9065.649524,7.31e+12,3.12e+11,9.863587232,6.21608196,1.834777514,4.662412404,"7/7/94",1994-07-07,1994-07-07,2190,533,1995-02-02,7.66e+12,3.13e+11,10.60542797,7.991430122,22.38256785,16.32174519,28781.94969,8973.321347,1.607811468,4.909063075,"United States of America",1995-01-01,"Argentina ",1995-01-01,1,1,"Argentina",1967-10-11,"United States of America",1948-01-01,1,1,7,7,10,10,1,1,"Q4_2013","USA","DS-268","Oil Country Tubular Goods Sunset Reviews","Argentina",2002,"1994",2001,1,1995,1,"10/03/1996",1996-10-03,1
"42",39,"PER-AD-81",135,"2002",160,2001,160,135,"Q4_2012","Peru","PER-AD-81","Argentina","ARG","Vegetable Oil","11/29/01","4/17/02","4/17/02","A","A","4/18/02","AVD","7/15/02","7/15/02","A","A","7/27/02","AVD","MI","MI","MI","MI","MI","G/ADP/N/98/PER",9,9,1,8,1,1,2.488004899,1.618177593,34.99158095,18.03958519,1,1945.032871,8732.466063,51295103189,3.25e+11,16.3624138,9.558790367,8.714726252,4.288049878,"11/29/01",2001-11-29,2001-11-29,720,124,2002-04-18,53992755100,1.24e+11,16.99539171,23.4304137,35.10046083,34.46767997,2019.937857,3285.026171,8.334276514,9.304636934,"Peru ",1995-01-01,"Argentina ",1995-01-01,1,1,"Argentina",1967-10-11,"Peru",1951-10-07,1,1,8,8,9,9,1,1,"Q4_2013","Peru ","DS-272","Provisional Anti-Dumping Duties on Vegetable Oils from Argentina","Argentina",2002,"2001",2001,1,2002,1,"06/19/1996",1996-06-19,1
"43",39,"PER-AD-83",135,"2002",160,2002,160,135,"Q4_2012","Peru","PER-AD-83","Argentina","ARG","Vegetable Oil","2/21/02","8/2/02","8/2/02","A","A","8/3/02","AVD","11/26/02","11/26/02","A","A","11/30/02","AVD","2/15/12","2012","AVD","17","20","G/ADP/N/98/PER",9,9,1,8,1,1,2.860930476,1.557061672,35.10046083,34.46767997,1,2019.937857,3285.026171,53992755100,1.24e+11,16.99539171,23.4304137,8.334276514,9.304636934,"2/21/02",2002-02-21,2002-02-21,50,208,2002-08-03,53992755100,1.24e+11,16.99539171,23.4304137,35.10046083,34.46767997,2019.937857,3285.026171,8.334276514,9.304636934,"Peru ",1995-01-01,"Argentina ",1995-01-01,1,1,"Argentina",1967-10-11,"Peru",1951-10-07,1,1,8,8,9,9,1,1,"Q4_2013","Peru ","DS-272","Provisional Anti-Dumping Duties on Vegetable Oils from Argentina","Argentina",2002,"2002",2002,1,2002,1,"06/19/1996",1996-06-19,1
"44",40,"USA-AD-928",2,"2001",20,2001,20,2,"Q4_2012","USA","USA-AD-928","Canada","CAN","Softwood Lumber","4/9/01","11/6/01","5/23/01","A","A","11/6/01","AVD","4/2/02","5/22/02","A","A","5/22/02","AVD","12/12/06","2006","AVD","2.18","12.44","G/ADP/N/92/USA",10,10,1,10,1,1,2.306059661,5.577059012,22.8379434,78.79827146,0,37285.81592,23573.75007,1.06e+13,7.33e+11,9.68255014,42.24634131,1.181402837,2.237988252,"4/9/01",2001-04-09,2001-04-09,2713,78,2001-11-06,1.06e+13,7.33e+11,9.68255014,42.24634131,22.8379434,78.79827146,37285.81592,23573.75007,1.181402837,2.237988252,"United States of America",1995-01-01,"Canada ",1995-01-01,1,1,"Canada",1948-01-01,"United States of America",1948-01-01,1,1,10,10,10,10,1,1,"Q4_2013","USA","DS-277","Softwood Lumber VI","Canada",2002,"2001",2001,0,2002,1,"",NA,0
"51",44,"USA-AD-799",2,"1999",325,1998,325,2,"Q4_2012","USA","USA-AD-797","Italy","ITA","Stainless Steel Sheet and Strip","6/17/98","1/4/99","8/5/98","A","A","1/4/99","AVD","6/8/99","7/28/99","A","A","7/27/99","AVD","8/10/11","2011","AVD","MI","MI","MI",10,10,1,10,1,1,2.349922309,0.634332938,22.75912907,47.08565282,1,32948.95126,21519.06412,9.09e+12,1.22e+12,10.48398631,25.15430622,1.300089704,3.098162293,"6/17/98",1998-06-17,1998-06-17,760,1974,1999-01-04,9.67e+12,1.21e+12,10.23412686,24.27992645,23.17266209,46.64130468,34639.11984,21227.31087,1.219934045,3.027755412,"United States of America",1995-01-01,"Italy ",1995-01-01,1,1,"Italy",1950-05-30,"United States of America",1948-01-01,1,1,10,10,10,10,1,1,"Q4_2013","USA","DS-294","Zeroing (EC)","EUN",2003,"1998",2002,1,1999,1,"09/20/1996",1996-09-20,1
"52",44,"USA-AD-918",2,"2001",200,2001,200,2,"Q4_2012","USA","USA-AD-913","United Kingdom","GBR","Stainless Steel Bar","1/4/01","8/2/01","2/23/01","A","A","8/2/01","AVD","1/23/02","3/8/02","A","A","3/7/02","AVD","3/7/07","2007","AVD","4.48","125.77","G/ADP/N/92/USA",10,10,1,10,1,1,2.306059661,0.453504611,22.8379434,56.10090605,1,37285.81592,25121.03789,1.06e+13,1.49e+12,9.68255014,26.9190061,1.181402837,0.821107531,"1/4/01",2001-01-04,2001-01-04,1343,2906,2001-08-02,1.06e+13,1.49e+12,9.68255014,26.9190061,22.8379434,56.10090605,37285.81592,25121.03789,1.181402837,0.821107531,"United States of America",1995-01-01,"United Kingdom",1995-01-01,1,1,"United Kingdom",1948-01-01,"United States of America",1948-01-01,1,1,10,10,10,10,1,1,"Q4_2013","USA","DS-294","Zeroing (EC)","EUN",2003,"2001",2001,1,2002,1,"09/20/1996",1996-09-20,1
"53",44,"USA-AD-903",2,"2001",210,2000,210,2,"Q4_2012","USA","USA-AD-898","Netherlands","NLD","Hot-Rolled Carbon Steel Products","11/22/00","5/3/01","1/4/01","A","A","5/3/01","AVD","10/3/01","11/15/01","A","A","11/29/01","AVD","11/29/06","2006","AVD","2.59","2.59","G/ADP/N/85/USA",10,10,1,10,1,1,2.295750911,2.732042732,24.96379875,134.6176668,0,36467.29543,24179.73141,1.03e+13,3.85e+11,10.63490675,70.08230453,1.190978876,2.506326741,"11/22/00",2000-11-22,2000-11-22,2284,2863,2001-05-03,1.06e+13,4.01e+11,9.68255014,67.27610999,22.8379434,128.7650397,37285.81592,24968.81742,1.181402837,2.418275664,"United States of America",1995-01-01,"Netherlands ",1995-01-01,1,1,"Netherlands",1948-01-01,"United States of America",1948-01-01,1,1,10,10,10,10,1,1,"Q4_2013","USA","DS-294","Zeroing (EC)","EUN",2003,"2000",2000,1,2001,1,"09/20/1996",1996-09-20,1
"54",44,"USA-AD-734",2,"1996",325,1995,325,2,"Q4_2012","USA","USA-AD-734","Italy","ITA","Pasta","5/19/95","1/19/96","7/10/95","A","A","1/19/96","AVD","6/14/96","7/24/96","A","A","7/24/96","AVD","IF","IF","AVD","0","46.67","G/ADP/N/22/USA",10,10,1,10,1,1,3.862870077,0.667190616,22.38256785,47.58799564,1,28781.94969,19910.00067,7.66e+12,1.13e+12,10.60542797,25.71427747,1.607811468,3.317877129,"5/19/95",1995-05-19,1995-05-19,122,849,1996-01-19,8.1e+12,1.27e+12,10.71084665,24.68113975,22.61178736,44.64167892,30068.22721,22271.33092,1.805715555,3.29828126,"United States of America",1995-01-01,"Italy ",1995-01-01,1,1,"Italy",1950-05-30,"United States of America",1948-01-01,1,1,10,10,10,10,1,1,"Q4_2013","USA","DS-294","Zeroing (EC)","EUN",2003,"1995",2003,0,1996,1,"09/20/1996",1996-09-20,1
"56",44,"USA-AD-798",2,"1999",255,1998,255,2,"Q4_2012","USA","USA-AD-797","Germany","DEU","Stainless Steel Sheet and Strip","6/17/98","1/4/99","8/5/98","A","A","1/4/99","AVD","6/8/99","7/28/99","A","A","7/27/99","AVD","8/10/11","2011","AVD","25.37","25.37","G/ADP/N/59/USA",10,10,1,10,1,1,2.349922309,0.915361126,22.75912907,55.79170281,1,32948.95126,26547.77535,9.09e+12,2.18e+12,10.48398631,28.58294637,1.300089704,1.073012219,"6/17/98",1998-06-17,1998-06-17,5738,1974,1999-01-04,9.67e+12,2.13e+12,10.23412686,29.40355964,23.17266209,57.92820718,34639.11984,25956.63741,1.219934045,1.059086461,"United States of America",1995-01-01,"Germany ",1995-01-01,1,1,"Germany",1951-10-01,"United States of America",1948-01-01,1,1,10,10,10,10,1,1,"Q4_2013","USA","DS-294","Zeroing (EC)","EUN",2003,"1998",2002,1,1999,1,"09/20/1996",1996-09-20,1
"57",44,"USA-AD-788",2,"1998",211,1998,211,2,"Q4_2012","USA","USA-AD-788","Belgium","BEL","Stainless Steel Plate in Coils","4/9/98","11/4/98","5/28/98","A","A","11/4/98","AVD","3/31/99","5/12/99","A","A","5/21/99","AVD","IF","IF","AVD","9.86","9.86","G/ADP/N/53/USA",10,10,1,10,1,1,2.349922309,1.233065856,22.75912907,135.6035967,0,32948.95126,25051.33996,9.09e+12,2.56e+11,10.48398631,69.7023323,1.300089704,1.407012203,"4/9/98",1998-04-09,1998-04-09,2224,1905,1998-11-04,9.09e+12,2.56e+11,10.48398631,69.7023323,22.75912907,135.6035967,32948.95126,25051.33996,1.300089704,1.407012203,"United States of America",1995-01-01,"Belgium ",1995-01-01,1,1,"Belgium",1948-01-01,"United States of America",1948-01-01,1,1,10,10,10,10,1,1,"Q4_2013","USA","DS-294","Zeroing (EC)","EUN",2003,"1998",2002,1,1999,1,"09/20/1996",1996-09-20,1
"58",44,"USA-AD-914",2,"2001",255,2001,255,2,"Q4_2012","USA","USA-AD-913","Germany","DEU","Stainless Steel Bar","1/4/01","8/2/01","2/23/01","A","A","8/2/01","AVD","1/23/02","3/8/02","A","A","3/7/02","AVD","3/7/07","2007","AVD","4.17","32.32","G/ADP/N/92/USA",10,10,1,10,1,1,2.306059661,0.856664997,22.8379434,67.59503307,1,37285.81592,22840.27405,1.06e+13,1.88e+12,9.68255014,34.78900043,1.181402837,1.20527108,"1/4/01",2001-01-04,2001-01-04,800,2906,2001-08-02,1.06e+13,1.88e+12,9.68255014,34.78900043,22.8379434,67.59503307,37285.81592,22840.27405,1.181402837,1.20527108,"United States of America",1995-01-01,"Germany ",1995-01-01,1,1,"Germany",1951-10-01,"United States of America",1948-01-01,1,1,10,10,10,10,1,1,"Q4_2013","USA","DS-294","Zeroing (EC)","EUN",2003,"2001",2001,1,2002,1,"09/20/1996",1996-09-20,1
"59",44,"USA-AD-798",2,"1999",255,1998,255,2,"Q4_2012","USA","USA-AD-797","Germany","DEU","Stainless Steel Sheet and Strip","6/17/98","1/4/99","8/5/98","A","A","1/4/99","AVD","6/8/99","7/28/99","A","A","7/27/99","AVD","8/10/11","2011","AVD","25.37","25.37","G/ADP/N/59/USA",10,10,1,10,1,1,2.349922309,0.915361126,22.75912907,55.79170281,1,32948.95126,26547.77535,9.09e+12,2.18e+12,10.48398631,28.58294637,1.300089704,1.073012219,"6/17/98",1998-06-17,1998-06-17,5738,1974,1999-01-04,9.67e+12,2.13e+12,10.23412686,29.40355964,23.17266209,57.92820718,34639.11984,25956.63741,1.219934045,1.059086461,"United States of America",1995-01-01,"Germany ",1995-01-01,1,1,"Germany",1951-10-01,"United States of America",1948-01-01,1,1,10,10,10,10,1,1,"Q4_2013","USA","DS-294","Zeroing (EC)","EUN",2003,"1998",2003,0,1999,1,"09/20/1996",1996-09-20,1
"61",44,"USA-AD-913",2,"2001",220,2001,220,2,"Q4_2012","USA","USA-AD-913","France","FRA","Stainless Steel Bar","1/4/01","8/2/01","2/23/01","A","A","8/2/01","AVD","1/23/02","3/8/02","A","A","3/7/02","AVD","3/7/07","2007","AVD","3.9","71.83","G/ADP/N/92/USA",10,10,1,9,1,1,2.306059661,1.0180398,22.8379434,55.5839122,1,37285.81592,21812.19434,1.06e+13,1.34e+12,9.68255014,28.36027408,1.181402837,2.479958407,"1/4/01",2001-01-04,2001-01-04,2059,2906,2001-08-02,1.06e+13,1.34e+12,9.68255014,28.36027408,22.8379434,55.5839122,37285.81592,21812.19434,1.181402837,2.479958407,"United States of America",1995-01-01,"France ",1995-01-01,1,1,"France",1948-01-01,"United States of America",1948-01-01,1,1,9,9,10,10,1,1,"Q4_2013","USA","DS-294","Zeroing (EC)","EUN",2003,"2001",2001,1,2002,1,"09/20/1996",1996-09-20,1
"62",44,"USA-AD-797",2,"1999",220,1998,220,2,"Q4_2012","USA","USA-AD-797","France","FRA","Stainless Steel Sheet and Strip","6/17/98","1/4/99","8/5/98","A","A","1/4/99","AVD","6/8/99","7/28/99","A","A","7/27/99","AVD","7/27/04","2004","AVD","MI","MI","MI",10,10,1,9,1,1,2.349922309,1.128093344,22.75912907,50.4014939,1,32948.95126,24405.87657,9.09e+12,1.47e+12,10.48398631,26.4677143,1.300089704,2.797470926,"6/17/98",1998-06-17,1998-06-17,1127,1974,1999-01-04,9.67e+12,1.46e+12,10.23412686,26.35445218,23.17266209,50.57611726,34639.11984,24075.01701,1.219934045,2.64938617,"United States of America",1995-01-01,"France ",1995-01-01,1,1,"France",1948-01-01,"United States of America",1948-01-01,1,1,9,9,10,10,1,1,"Q4_2013","USA","DS-294","Zeroing (EC)","EUN",2003,"1998",2002,0,1999,1,"09/20/1996",1996-09-20,1
"63",44,"USA-AD-799",2,"1999",325,1998,325,2,"Q4_2012","USA","USA-AD-797","Italy","ITA","Stainless Steel Sheet and Strip","6/17/98","1/4/99","8/5/98","A","A","1/4/99","AVD","6/8/99","7/28/99","A","A","7/27/99","AVD","8/10/11","2011","AVD","MI","MI","MI",10,10,1,10,1,1,2.349922309,0.634332938,22.75912907,47.08565282,1,32948.95126,21519.06412,9.09e+12,1.22e+12,10.48398631,25.15430622,1.300089704,3.098162293,"6/17/98",1998-06-17,1998-06-17,760,1974,1999-01-04,9.67e+12,1.21e+12,10.23412686,24.27992645,23.17266209,46.64130468,34639.11984,21227.31087,1.219934045,3.027755412,"United States of America",1995-01-01,"Italy ",1995-01-01,1,1,"Italy",1950-05-30,"United States of America",1948-01-01,1,1,10,10,10,10,1,1,"Q4_2013","USA","DS-294","Zeroing (EC)","EUN",2003,"1998",2003,0,1999,1,"09/20/1996",1996-09-20,1
"65",44,"USA-AD-797",2,"1999",220,1998,220,2,"Q4_2012","USA","USA-AD-797","France","FRA","Stainless Steel Sheet and Strip","6/17/98","1/4/99","8/5/98","A","A","1/4/99","AVD","6/8/99","7/28/99","A","A","7/27/99","AVD","7/27/04","2004","AVD","MI","MI","MI",10,10,1,9,1,1,2.349922309,1.128093344,22.75912907,50.4014939,1,32948.95126,24405.87657,9.09e+12,1.47e+12,10.48398631,26.4677143,1.300089704,2.797470926,"6/17/98",1998-06-17,1998-06-17,1127,1974,1999-01-04,9.67e+12,1.46e+12,10.23412686,26.35445218,23.17266209,50.57611726,34639.11984,24075.01701,1.219934045,2.64938617,"United States of America",1995-01-01,"France ",1995-01-01,1,1,"France",1948-01-01,"United States of America",1948-01-01,1,1,9,9,10,10,1,1,"Q4_2013","USA","DS-294","Zeroing (EC)","EUN",2003,"1998",2002,1,1999,1,"09/20/1996",1996-09-20,1
"67",44,"USA-AD-915",2,"2001",325,2001,325,2,"Q4_2012","USA","USA-AD-913","Italy","ITA","Stainless Steel Bar","1/4/01","8/2/01","2/23/01","A","A","8/2/01","AVD","1/23/02","3/8/02","A","A","3/7/02","AVD","3/7/07","2007","AVD","1.7","33","G/ADP/N/92/USA",10,10,1,10,1,1,2.306059661,0.652361831,22.8379434,52.33283751,1,37285.81592,19723.04417,1.06e+13,1.12e+12,9.68255014,26.85797238,1.181402837,2.683528549,"1/4/01",2001-01-04,2001-01-04,253,2906,2001-08-02,1.06e+13,1.12e+12,9.68255014,26.85797238,22.8379434,52.33283751,37285.81592,19723.04417,1.181402837,2.683528549,"United States of America",1995-01-01,"Italy ",1995-01-01,1,1,"Italy",1950-05-30,"United States of America",1948-01-01,1,1,10,10,10,10,1,1,"Q4_2013","USA","DS-294","Zeroing (EC)","EUN",2003,"2001",2001,1,2002,1,"09/20/1996",1996-09-20,1
"68",44,"USA-AD-734",2,"1996",325,1995,325,2,"Q4_2012","USA","USA-AD-734","Italy","ITA","Pasta","5/19/95","1/19/96","7/10/95","A","A","1/19/96","AVD","6/14/96","7/24/96","A","A","7/24/96","AVD","IF","IF","AVD","0","46.67","G/ADP/N/22/USA",10,10,1,10,1,1,3.862870077,0.667190616,22.38256785,47.58799564,1,28781.94969,19910.00067,7.66e+12,1.13e+12,10.60542797,25.71427747,1.607811468,3.317877129,"5/19/95",1995-05-19,1995-05-19,122,849,1996-01-19,8.1e+12,1.27e+12,10.71084665,24.68113975,22.61178736,44.64167892,30068.22721,22271.33092,1.805715555,3.29828126,"United States of America",1995-01-01,"Italy ",1995-01-01,1,1,"Italy",1950-05-30,"United States of America",1948-01-01,1,1,10,10,10,10,1,1,"Q4_2013","USA","DS-294","Zeroing (EC)","EUN",2003,"1995",2002,1,1996,1,"09/20/1996",1996-09-20,1
"70",45,"MEX-AD-195",70,"1999",2,1998,2,70,"Q4_2012","Mexico","MEX-AD-195","USA","USA","Beef","9/21/98","8/2/99","8/2/99","A","A","8/3/99","AVD","4/27/00","4/27/00","A","A","4/29/00","SD","IF","IF","SD","MI","MI","G/ADP/N/65/MEX",6,6,1,10,1,1,0.783309588,2.349922309,51.77609803,22.75912907,1,4986.252659,32948.95126,5.02e+11,9.09e+12,25.74892715,10.48398631,4.206365878,1.300089704,"9/21/98",1998-09-21,1998-09-21,2070,1390,1999-08-03,5.79e+11,9.67e+12,25.48169145,10.23412686,51.2689011,23.17266209,5663.388512,34639.11984,3.953796773,1.219934045,"Mexico ",1995-01-01,"United States of America",1995-01-01,1,1,"United States of America",1948-01-01,"Mexico",1986-08-24,1,1,10,10,6,6,1,1,"Q4_2013","Mexico ","DS-295","Anti-Dumping Measures on Beef and Rice","USA",2003,"1998",1998,1,2000,1,"",NA,0
"72",46,"IND-AD-242",750,"2002",994,2001,994,750,"Q4_2012","India","IND-AD-239","European Union","EUN","Flexible Slabstock Polyol of Molecular Weight 3000 to 4000","9/21/01","12/14/01","12/14/01","A","A","2/11/02","SD","9/19/02","9/19/02","A","A","10/31/02","SD","2/5/08","2008","MI","7.98","7.98","G/ADP/N/98/IND",9,9,1,NA,1,1,1.139473046,1.481261834,25.54526907,71.5586288,1,466.2141765,17634.03089,4.94e+11,8.63e+12,12.34193985,36.12211562,22.92230619,2.271640117,"9/21/01",2001-09-21,2001-09-21,NA,1282,2002-02-11,5.24e+11,9.41e+12,14.01854169,35.25688032,29.00009028,69.17092307,486.640454,19180.25766,20.69574147,2.09656721,"India ",1995-01-01,"European Union",1995-01-01,1,1,NA,NA,"India",1948-07-08,1,NA,6,NA,9,9,1,1,"Q4_2013","India ","DS-304","Anti-Dumping Measures on Imports of Certain Products from the European Communities","EUN",2003,"2001",2001,1,2002,1,"09/16/1996",1996-09-16,1
"73",46,"IND-AD-292",750,"2003",994,2002,994,750,"Q4_2012","India","IND-AD-292","European Union","EUN","Methylene Chloride","8/19/02","12/24/02","12/24/02","A","A","3/27/03","SD","8/14/03","8/14/03","A","A","10/20/03","SD","10/31/05","2005","MI","55.75","85.32","G/ADP/N/112/IND",9,9,1,NA,1,1,1.062797391,1.513611807,29.00009028,69.17092307,1,486.640454,19180.25766,5.24e+11,9.41e+12,14.01854169,35.25688032,20.69574147,2.09656721,"8/19/02",2002-08-19,2002-08-19,NA,1614,2003-03-27,6.18e+11,1.15e+13,14.6902912,34.45612425,30.06518498,67.81831502,565.335483,23298.27289,20.7427547,2.016595406,"India ",1995-01-01,"European Union",1995-01-01,1,1,NA,NA,"India",1948-07-08,1,NA,6,NA,9,9,1,1,"Q4_2013","India ","DS-304","Anti-Dumping Measures on Imports of Certain Products from the European Communities","EUN",2003,"2002",2002,1,2003,1,"09/16/1996",1996-09-16,1
"74",46,"IND-AD-247",750,"2002",994,2001,994,750,"Q4_2012","India","IND-AD-247","European Union","EUN","Sodium Nitrite","11/2/01","2/1/02","2/1/02","A","A","3/28/02","SD","10/28/02","10/28/02","A","A","11/29/02","SD","IF","IF","MI","71.37","71.37","G/ADP/N/98/IND",9,9,1,NA,1,1,1.139473046,1.481261834,25.54526907,71.5586288,1,466.2141765,17634.03089,4.94e+11,8.63e+12,12.34193985,36.12211562,22.92230619,2.271640117,"11/2/01",2001-11-02,2001-11-02,NA,1324,2002-03-28,5.24e+11,9.41e+12,14.01854169,35.25688032,29.00009028,69.17092307,486.640454,19180.25766,20.69574147,2.09656721,"India ",1995-01-01,"European Union",1995-01-01,1,1,NA,NA,"India",1948-07-08,1,NA,6,NA,9,9,1,1,"Q4_2013","India ","DS-304","Anti-Dumping Measures on Imports of Certain Products from the European Communities","EUN",2003,"2001",2001,1,2002,1,"09/16/1996",1996-09-16,1
"75",46,"IND-AD-132",750,"2000",220,1999,220,750,"Q4_2012","India","IND-AD-131","France","FRA","Black & White Photographic Paper","8/27/99","4/28/00","4/28/00","A","A","6/23/00","SD","10/24/00","10/24/00","A","A","12/21/00","SD","7/12/05","2005","MI","10.2","303.1","G/ADP/N/72/IND",9,9,1,9,1,1,1.418164643,1.078988803,24.38790891,50.57611726,1,455.4735407,24075.01701,4.67e+11,1.46e+12,11.25469183,26.35445218,24.50227807,2.64938617,"8/27/99",1999-08-27,1999-08-27,1563,526,2000-06-23,4.77e+11,1.33e+12,12.77323297,28.81383859,26.43729384,56.63227108,457.2835418,21774.93717,23.02185278,2.468438389,"India ",1995-01-01,"France ",1995-01-01,1,1,"France",1948-01-01,"India",1948-07-08,1,1,9,9,9,9,1,1,"Q4_2013","India ","DS-304","Anti-Dumping Measures on Imports of Certain Products from the European Communities","EUN (for FRA)",2003,"1999",1999,1,2000,1,"09/16/1996",1996-09-16,1
"76",46,"IND-AD-155",750,"2000",994,2000,994,750,"Q4_2012","India","IND-AD-155","European Union","EUN","Aniline","5/29/00","11/21/00","11/21/00","A","A","12/26/00","MI","5/28/01","5/28/01","A","A","6/26/01","SD","12/26/05","2005","MI","166.17","166.17","G/ADP/N/78/IND",9,9,1,NA,1,1,1.258907331,1.594918941,26.43729384,72.08801675,1,457.2835418,17468.29776,4.77e+11,8.52e+12,12.77323297,36.11678545,23.02185278,2.288564687,"5/29/00",2000-05-29,2000-05-29,NA,802,2000-12-26,4.77e+11,8.52e+12,12.77323297,36.11678545,26.43729384,72.08801675,457.2835418,17468.29776,23.02185278,2.288564687,"India ",1995-01-01,"European Union",1995-01-01,1,1,NA,NA,"India",1948-07-08,1,NA,6,NA,9,9,1,1,"Q4_2013","India ","DS-304","Anti-Dumping Measures on Imports of Certain Products from the European Communities","EUN",2003,"2000",2000,1,2001,1,"09/16/1996",1996-09-16,1
"77",46,"IND-AD-54",750,"1998",235,1998,235,750,"Q4_2012","India","IND-AD-53","Portugal","PRT","Acrylic Fibre","1/7/98","10/20/98","10/20/98","A","A","11/17/98","SD","12/24/98","12/24/98","A","A","1/22/99","SD","11/10/04","2004","SD","MI","MI","MI",9,9,1,10,1,1,1.656051057,3.094932071,23.29101706,65.11068932,0,425.4452943,12092.18518,4.29e+11,1.23e+11,10.82856928,27.92714029,25.79098082,4.134954876,"1/7/98",1998-01-07,1998-01-07,669,261,1998-11-17,4.29e+11,1.23e+11,10.82856928,27.92714029,23.29101706,65.11068932,425.4452943,12092.18518,25.79098082,4.134954876,"India ",1995-01-01,"Portugal ",1995-01-01,1,1,"Portugal",1962-05-06,"India",1948-07-08,1,1,10,10,9,9,1,1,"Q4_2013","India ","DS-304","Anti-Dumping Measures on Imports of Certain Products from the European Communities","EUN (for PRT)",2003,"1998",1998,1,1999,1,"09/16/1996",1996-09-16,1
"79",46,"IND-AD-56",750,"1998",325,1998,325,750,"Q4_2012","India","IND-AD-53","Italy","ITA","Acrylic Fibre","1/7/98","10/20/98","10/20/98","A","A","11/17/98","SD","12/24/98","12/24/98","A","A","1/22/99","SD","11/10/04","2004","SD","MI","MI","MI",9,9,1,10,1,1,1.656051057,0.634332938,23.29101706,47.08565282,1,425.4452943,21519.06412,4.29e+11,1.22e+12,10.82856928,25.15430622,25.79098082,3.098162293,"1/7/98",1998-01-07,1998-01-07,599,261,1998-11-17,4.29e+11,1.22e+12,10.82856928,25.15430622,23.29101706,47.08565282,425.4452943,21519.06412,25.79098082,3.098162293,"India ",1995-01-01,"Italy ",1995-01-01,1,1,"Italy",1950-05-30,"India",1948-07-08,1,1,10,10,9,9,1,1,"Q4_2013","India ","DS-304","Anti-Dumping Measures on Imports of Certain Products from the European Communities","EUN (for ITA)",2003,"1998",1998,1,1999,1,"09/16/1996",1996-09-16,1
"80",46,"IND-AD-197",750,"2001",994,2001,994,750,"Q4_2012","India","IND-AD-197","European Union","EUN","Vitamin AD3 500/100","3/19/01","6/6/01","6/6/01","A","A","7/11/01","SD","3/18/02","3/18/02","A","A","5/21/02","SD","6/2/05","2005","MI","0","105","G/ADP/N/92/IND",9,9,1,NA,1,1,1.139473046,1.481261834,25.54526907,71.5586288,1,466.2141765,17634.03089,4.94e+11,8.63e+12,12.34193985,36.12211562,22.92230619,2.271640117,"3/19/01",2001-03-19,2001-03-19,NA,1096,2001-07-11,4.94e+11,8.63e+12,12.34193985,36.12211562,25.54526907,71.5586288,466.2141765,17634.03089,22.92230619,2.271640117,"India ",1995-01-01,"European Union",1995-01-01,1,1,NA,NA,"India",1948-07-08,1,NA,6,NA,9,9,1,1,"Q4_2013","India ","DS-304","Anti-Dumping Measures on Imports of Certain Products from the European Communities","EUN",2003,"2001",2001,1,2002,1,"09/16/1996",1996-09-16,1
"81",46,"IND-AD-131",750,"2000",200,1999,200,750,"Q4_2012","India","IND-AD-131","UK","GBR","Black & White Photographic Paper","8/27/99","4/28/00","4/28/00","A","A","6/23/00","SD","10/24/00","10/24/00","A","A","12/21/00","SD","7/12/05","2005","MI","10.2","303.1","G/ADP/N/72/IND",9,9,1,10,1,1,1.418164643,0.473256333,24.38790891,53.11242851,1,455.4735407,25870.98904,4.67e+11,1.52e+12,11.25469183,25.82740736,24.50227807,0.995674794,"8/27/99",1999-08-27,1999-08-27,847,526,2000-06-23,4.77e+11,1.49e+12,12.77323297,27.30800829,26.43729384,56.46621195,457.2835418,25361.93964,23.02185278,0.897981114,"India ",1995-01-01,"United Kingdom",1995-01-01,1,1,"United Kingdom",1948-01-01,"India",1948-07-08,1,1,10,10,9,9,1,1,"Q4_2013","India ","DS-304","Anti-Dumping Measures on Imports of Certain Products from the European Communities","EUN (for GBR)",2003,"1999",1999,1,2000,1,"09/16/1996",1996-09-16,1
"83",46,"IND-AD-163",750,"2001",994,2000,994,750,"Q4_2012","India","IND-AD-163","European Union","EUN","Theophylline & Caffeine","7/11/00","1/2/01","1/2/01","A","A","1/31/01","SD","6/26/01","6/26/01","A","A","7/30/01","SD","MI","MI","MI","177","177","G/ADP/N/78/IND",9,9,1,NA,1,1,1.258907331,1.594918941,26.43729384,72.08801675,1,457.2835418,17468.29776,4.77e+11,8.52e+12,12.77323297,36.11678545,23.02185278,2.288564687,"7/11/00",2000-07-11,2000-07-11,NA,845,2001-01-31,4.94e+11,8.63e+12,12.34193985,36.12211562,25.54526907,71.5586288,466.2141765,17634.03089,22.92230619,2.271640117,"India ",1995-01-01,"European Union",1995-01-01,1,1,NA,NA,"India",1948-07-08,1,NA,6,NA,9,9,1,1,"Q4_2013","India ","DS-304","Anti-Dumping Measures on Imports of Certain Products from the European Communities","EUN",2003,"2000",2000,1,2001,1,"09/16/1996",1996-09-16,1
"84",46,"IND-AD-277",750,"2002",994,2002,994,750,"Q4_2012","India","IND-AD-277","European Union","EUN","D (-) Para Hydroxy Phenyl Glycine Base ","3/8/02","6/5/02","6/5/02","A","A","7/5/02","SD","3/7/03","3/7/03","A","A","5/1/03","SD","5/25/05","2005","MI","1.21","78.48","G/ADP/N/105/IND",9,9,1,NA,1,1,1.062797391,1.513611807,29.00009028,69.17092307,1,486.640454,19180.25766,5.24e+11,9.41e+12,14.01854169,35.25688032,20.69574147,2.09656721,"3/8/02",2002-03-08,2002-03-08,NA,1450,2002-07-05,5.24e+11,9.41e+12,14.01854169,35.25688032,29.00009028,69.17092307,486.640454,19180.25766,20.69574147,2.09656721,"India ",1995-01-01,"European Union",1995-01-01,1,1,NA,NA,"India",1948-07-08,1,NA,6,NA,9,9,1,1,"Q4_2013","India ","DS-304","Anti-Dumping Measures on Imports of Certain Products from the European Communities","EUN",2003,"2002",2002,1,2003,1,"09/16/1996",1996-09-16,1
"85",46,"IND-AD-262",750,"2002",994,2002,994,750,"Q4_2012","India","IND-AD-262","European Union","EUN","Vitamin A Palmitate","1/24/02","4/30/02","4/30/02","A","A","8/13/02","SD","1/23/03","1/23/03","A","A","3/7/03","SD","1/24/05","2005","MI","52.94","58.83","G/ADP/N/105/IND",9,9,1,NA,1,1,1.062797391,1.513611807,29.00009028,69.17092307,1,486.640454,19180.25766,5.24e+11,9.41e+12,14.01854169,35.25688032,20.69574147,2.09656721,"1/24/02",2002-01-24,2002-01-24,NA,1407,2002-08-13,5.24e+11,9.41e+12,14.01854169,35.25688032,29.00009028,69.17092307,486.640454,19180.25766,20.69574147,2.09656721,"India ",1995-01-01,"European Union",1995-01-01,1,1,NA,NA,"India",1948-07-08,1,NA,6,NA,9,9,1,1,"Q4_2013","India ","DS-304","Anti-Dumping Measures on Imports of Certain Products from the European Communities","EUN",2003,"2002",2002,1,2003,1,"09/16/1996",1996-09-16,1
"86",46,"IND-AD-162",750,"2001",994,2000,994,750,"Q4_2012","India","IND-AD-162","European Union","EUN","Sodium Ferrocyanide","6/13/00","1/2/01","1/2/01","A","A","1/31/01","SD","4/16/01","4/16/01","A","A","5/10/01","SD","MI","MI","MI","60","60","G/ADP/N/78/IND",9,9,1,NA,1,1,1.258907331,1.594918941,26.43729384,72.08801675,1,457.2835418,17468.29776,4.77e+11,8.52e+12,12.77323297,36.11678545,23.02185278,2.288564687,"6/13/00",2000-06-13,2000-06-13,NA,817,2001-01-31,4.94e+11,8.63e+12,12.34193985,36.12211562,25.54526907,71.5586288,466.2141765,17634.03089,22.92230619,2.271640117,"India ",1995-01-01,"European Union",1995-01-01,1,1,NA,NA,"India",1948-07-08,1,NA,6,NA,9,9,1,1,"Q4_2013","India ","DS-304","Anti-Dumping Measures on Imports of Certain Products from the European Communities","EUN",2003,"2000",2000,1,2001,1,"09/16/1996",1996-09-16,1
"87",46,"IND-AD-154",750,"2000",220,2000,220,750,"Q4_2012","India","IND-AD-150","France","FRA","Caustic Soda","5/26/00","11/16/00","11/16/00","A","A","12/26/00","MI","5/14/01","5/14/01","A","A","6/26/01","SD","11/26/12","2012","DPU","305.6","305.6","G/ADP/N/78/IND",9,9,1,9,1,1,1.258907331,1.091021624,26.43729384,56.63227108,1,457.2835418,21774.93717,4.77e+11,1.33e+12,12.77323297,28.81383859,23.02185278,2.468438389,"5/26/00",2000-05-26,2000-05-26,1836,799,2000-12-26,4.77e+11,1.33e+12,12.77323297,28.81383859,26.43729384,56.63227108,457.2835418,21774.93717,23.02185278,2.468438389,"India ",1995-01-01,"France ",1995-01-01,1,1,"France",1948-01-01,"India",1948-07-08,1,1,9,9,9,9,1,1,"Q4_2013","India ","DS-304","Anti-Dumping Measures on Imports of Certain Products from the European Communities","EUN (for FRA)",2003,"2000",2000,1,2001,1,"09/16/1996",1996-09-16,1
"88",46,"IND-AD-229",750,"2001",255,2001,255,750,"Q4_2012","India","IND-AD-227","Germany","DEU","Acrylic Fibre","8/28/01","12/7/01","12/7/01","A","A","12/31/01","SD","8/27/02","8/27/02","A","A","10/9/02","SD","4/7/05","2005","MI","10.29","10.29","G/ADP/N/98/IND",9,9,1,10,1,1,1.139473046,0.856664997,25.54526907,67.59503307,1,466.2141765,22840.27405,4.94e+11,1.88e+12,12.34193985,34.78900043,22.92230619,1.20527108,"8/28/01",2001-08-28,2001-08-28,1036,1258,2001-12-31,4.94e+11,1.88e+12,12.34193985,34.78900043,25.54526907,67.59503307,466.2141765,22840.27405,22.92230619,1.20527108,"India ",1995-01-01,"Germany ",1995-01-01,1,1,"Germany",1951-10-01,"India",1948-07-08,1,1,10,10,9,9,1,1,"Q4_2013","India ","DS-304","Anti-Dumping Measures on Imports of Certain Products from the European Communities","EUN (for DEU)",2003,"2001",2001,1,2002,1,"09/16/1996",1996-09-16,1
"89",46,"IND-AD-181",750,"2001",994,2000,994,750,"Q4_2012","India","IND-AD-180","European Union","EUN","High Styrene Butadiene Copolymer/High Styrene Resin/Rubber (HSR) ","12/20/00","3/13/01","3/13/01","A","A","4/9/01","SD","12/18/01","12/18/01","A","A","1/15/02","SD","MI","MI","MI","26.7","107.48","G/ADP/N/85/IND",9,9,1,NA,1,1,1.258907331,1.594918941,26.43729384,72.08801675,1,457.2835418,17468.29776,4.77e+11,8.52e+12,12.77323297,36.11678545,23.02185278,2.288564687,"12/20/00",2000-12-20,2000-12-20,NA,1007,2001-04-09,4.94e+11,8.63e+12,12.34193985,36.12211562,25.54526907,71.5586288,466.2141765,17634.03089,22.92230619,2.271640117,"India ",1995-01-01,"European Union",1995-01-01,1,1,NA,NA,"India",1948-07-08,1,NA,6,NA,9,9,1,1,"Q4_2013","India ","DS-304","Anti-Dumping Measures on Imports of Certain Products from the European Communities","EUN",2003,"2000",2000,1,2002,1,"09/16/1996",1996-09-16,1
"90",46,"IND-AD-55",750,"1998",230,1998,230,750,"Q4_2012","India","IND-AD-53","Spain","ESP","Acrylic Fibre","1/7/98","10/20/98","10/20/98","A","A","11/17/98","SD","12/24/98","12/24/98","A","A","1/22/99","SD","11/10/04","2004","SD","MI","MI","MI",9,9,1,10,1,1,1.656051057,1.260181682,23.29101706,53.56955454,0,425.4452943,15121.72118,4.29e+11,6.01e+11,10.82856928,26.67408334,25.79098082,4.65607215,"1/7/98",1998-01-07,1998-01-07,612,261,1998-11-17,4.29e+11,6.01e+11,10.82856928,26.67408334,23.29101706,53.56955454,425.4452943,15121.72118,25.79098082,4.65607215,"India ",1995-01-01,"Spain ",1995-01-01,1,1,"Spain",1963-08-29,"India",1948-07-08,1,1,10,10,9,9,1,1,"Q4_2013","India ","DS-304","Anti-Dumping Measures on Imports of Certain Products from the European Communities","EUN (for ESP)",2003,"1998",1998,1,1999,1,"09/16/1996",1996-09-16,1
"91",46,"IND-AD-94",750,"1999",994,1999,994,750,"Q4_2012","India","IND-AD-90","European Union","EUN","Sodium Cyanide","3/8/99","10/15/99","10/15/99","A","A","12/27/99","SD","3/6/00","3/6/00","A","A","6/6/00","SD","12/19/05","2005","MI","30.92","54","G/ADP/N/65/IND",9,9,1,NA,1,1,1.418164643,1.591942935,24.38790891,64.65834607,0,455.4735407,18863.99964,4.67e+11,9.19e+12,11.25469183,32.69786017,24.50227807,2.398573448,"3/8/99",1999-03-08,1999-03-08,NA,354,1999-12-27,4.67e+11,9.19e+12,11.25469183,32.69786017,24.38790891,64.65834607,455.4735407,18863.99964,24.50227807,2.398573448,"India ",1995-01-01,"European Union",1995-01-01,1,1,NA,NA,"India",1948-07-08,1,NA,6,NA,9,9,1,1,"Q4_2013","India ","DS-304","Anti-Dumping Measures on Imports of Certain Products from the European Communities","EUN",2003,"1999",1999,1,2000,1,"09/16/1996",1996-09-16,1
"92",46,"IND-AD-223",750,"2001",994,2001,994,750,"Q4_2012","India","IND-AD-223","European Union","EUN","Cold Rolled Flat Products of Stainless Steel ","8/21/01","11/29/01","11/29/01","A","A","12/28/01","SD","10/19/02","10/19/02","A","A","12/5/02","SD","9/13/05","2005","MI","46.77","265","G/ADP/N/98/IND",9,9,1,NA,1,1,1.139473046,1.481261834,25.54526907,71.5586288,1,466.2141765,17634.03089,4.94e+11,8.63e+12,12.34193985,36.12211562,22.92230619,2.271640117,"8/21/01",2001-08-21,2001-08-21,NA,1251,2001-12-28,4.94e+11,8.63e+12,12.34193985,36.12211562,25.54526907,71.5586288,466.2141765,17634.03089,22.92230619,2.271640117,"India ",1995-01-01,"European Union",1995-01-01,1,1,NA,NA,"India",1948-07-08,1,NA,6,NA,9,9,1,1,"Q4_2013","India ","DS-304","Anti-Dumping Measures on Imports of Certain Products from the European Communities","EUN",2003,"2001",2001,1,2002,1,"09/16/1996",1996-09-16,1
"93",46,"IND-AD-20",750,"1997",255,1996,255,750,"Q4_2012","India","IND-AD-20","Germany","DEU","Acrylonitrile Butadiene Rubber (Nbr)","3/15/96","12/30/96","12/30/96","A","A","1/31/97","SD","7/17/97","7/17/97","A","A","7/30/97","SD","1/2/09","2009","SD","MI","MI","MI",9,9,1,10,1,1,2.53330323,0.970729758,21.55153995,48.64693333,1,410.8183568,29749.97126,4e+11,2.44e+12,10.2061841,24.80373333,27.12742197,1.142644996,"3/15/96",1996-03-15,1996-03-15,4914,1729,1997-01-31,4.23e+11,2.16e+12,10.50646612,27.39830597,22.22954875,53.50674475,427.2361968,26296.53061,25.88700833,1.133319477,"India ",1995-01-01,"Germany ",1995-01-01,1,1,"Germany",1951-10-01,"India",1948-07-08,1,1,10,10,9,9,1,1,"Q4_2013","India ","DS-304","Anti-Dumping Measures on Imports of Certain Products from the European Communities","EUN (for DEU)",2003,"1996",1996,1,1997,1,"09/16/1996",1996-09-16,1
"94",46,"IND-AD-130",750,"2000",994,1999,994,750,"Q4_2012","India","IND-AD-129","European Union","EUN","Vitamin C","8/10/99","1/17/00","1/17/00","A","A","3/16/00","SD","8/8/00","8/8/00","A","A","9/15/00","SD","3/16/05","2005","MI","49.2","134.73","G/ADP/N/72/IND",9,9,1,NA,1,1,1.418164643,1.591942935,24.38790891,64.65834607,0,455.4735407,18863.99964,4.67e+11,9.19e+12,11.25469183,32.69786017,24.50227807,2.398573448,"8/10/99",1999-08-10,1999-08-10,NA,509,2000-03-16,4.77e+11,8.52e+12,12.77323297,36.11678545,26.43729384,72.08801675,457.2835418,17468.29776,23.02185278,2.288564687,"India ",1995-01-01,"European Union",1995-01-01,1,1,NA,NA,"India",1948-07-08,1,NA,6,NA,9,9,1,1,"Q4_2013","India ","DS-304","Anti-Dumping Measures on Imports of Certain Products from the European Communities","EUN",2003,"1999",1999,1,2000,1,"09/16/1996",1996-09-16,1
"95",46,"IND-AD-176",750,"2001",994,2000,994,750,"Q4_2012","India","IND-AD-175","European Union","EUN","Choline Chloride","12/6/00","2/22/01","2/22/01","A","A","3/30/01","SD","11/26/01","11/26/01","A","A","1/14/02","SD","3/30/06","2006","MI","19.09","81.86","G/ADP/N/85/IND",9,9,1,NA,1,1,1.258907331,1.594918941,26.43729384,72.08801675,1,457.2835418,17468.29776,4.77e+11,8.52e+12,12.77323297,36.11678545,23.02185278,2.288564687,"12/6/00",2000-12-06,2000-12-06,NA,993,2001-03-30,4.94e+11,8.63e+12,12.34193985,36.12211562,25.54526907,71.5586288,466.2141765,17634.03089,22.92230619,2.271640117,"India ",1995-01-01,"European Union",1995-01-01,1,1,NA,NA,"India",1948-07-08,1,NA,6,NA,9,9,1,1,"Q4_2013","India ","DS-304","Anti-Dumping Measures on Imports of Certain Products from the European Communities","EUN",2003,"2000",2000,1,2002,1,"09/16/1996",1996-09-16,1
"96",46,"IND-AD-228",750,"2001",200,2001,200,750,"Q4_2012","India","IND-AD-227","UK","GBR","Acrylic Fibre","8/28/01","12/7/01","12/7/01","A","A","12/31/01","SD","8/27/02","8/27/02","A","A","10/9/02","SD","4/7/05","2005","MI","26.16","26.16","G/ADP/N/98/IND",9,9,1,10,1,1,1.139473046,0.453504611,25.54526907,56.10090605,1,466.2141765,25121.03789,4.94e+11,1.49e+12,12.34193985,26.9190061,22.92230619,0.821107531,"8/28/01",2001-08-28,2001-08-28,1579,1258,2001-12-31,4.94e+11,1.49e+12,12.34193985,26.9190061,25.54526907,56.10090605,466.2141765,25121.03789,22.92230619,0.821107531,"India ",1995-01-01,"United Kingdom",1995-01-01,1,1,"United Kingdom",1948-01-01,"India",1948-07-08,1,1,10,10,9,9,1,1,"Q4_2013","India ","DS-304","Anti-Dumping Measures on Imports of Certain Products from the European Communities","EUN (for GBR)",2003,"2001",2001,1,2002,1,"09/16/1996",1996-09-16,1
"97",46,"IND-AD-274",750,"2002",994,2002,994,750,"Q4_2012","India","IND-AD-274","European Union","EUN","Phenol ","2/15/02","6/24/02","6/24/02","A","A","8/13/02","SD","2/13/03","2/13/03","A","A","3/24/03","SD","IF","IF","MI","77.88","77.88","G/ADP/N/105/IND",9,9,1,NA,1,1,1.062797391,1.513611807,29.00009028,69.17092307,1,486.640454,19180.25766,5.24e+11,9.41e+12,14.01854169,35.25688032,20.69574147,2.09656721,"2/15/02",2002-02-15,2002-02-15,NA,1429,2002-08-13,5.24e+11,9.41e+12,14.01854169,35.25688032,29.00009028,69.17092307,486.640454,19180.25766,20.69574147,2.09656721,"India ",1995-01-01,"European Union",1995-01-01,1,1,NA,NA,"India",1948-07-08,1,NA,6,NA,9,9,1,1,"Q4_2013","India ","DS-304","Anti-Dumping Measures on Imports of Certain Products from the European Communities","EUN",2003,"2002",2002,1,2003,1,"09/16/1996",1996-09-16,1
"98",46,"IND-AD-146",750,"2000",994,2000,994,750,"Q4_2012","India","IND-AD-144","European Union","EUN","Hydroxyl Amine Sulphate (HAS)","3/3/00","8/4/00","8/4/00","A","A","9/29/00","SD","3/1/01","3/1/01","A","A","3/28/01","SD","3/4/05","2005","MI","98.74","98.74","G/ADP/N/78/IND",9,9,1,NA,1,1,1.258907331,1.594918941,26.43729384,72.08801675,1,457.2835418,17468.29776,4.77e+11,8.52e+12,12.77323297,36.11678545,23.02185278,2.288564687,"3/3/00",2000-03-03,2000-03-03,NA,715,2000-09-29,4.77e+11,8.52e+12,12.77323297,36.11678545,26.43729384,72.08801675,457.2835418,17468.29776,23.02185278,2.288564687,"India ",1995-01-01,"European Union",1995-01-01,1,1,NA,NA,"India",1948-07-08,1,NA,6,NA,9,9,1,1,"Q4_2013","India ","DS-304","Anti-Dumping Measures on Imports of Certain Products from the European Communities","EUN",2003,"2000",2000,1,2001,1,"09/16/1996",1996-09-16,1
"99",46,"IND-AD-227",750,"2002",325,2001,325,750,"Q4_2012","India","IND-AD-227","Italy","ITA","Acrylic Fibre","8/28/01","12/6/01","12/6/01","A","A","1/10/02","SD","8/12/02","8/12/02","A","A","9/12/02","SD","4/19/05","2005","MI","25.07","25.07","G/ADP/N/98/IND",9,9,1,10,1,1,1.139473046,0.652361831,25.54526907,52.33283751,1,466.2141765,19723.04417,4.94e+11,1.12e+12,12.34193985,26.85797238,22.92230619,2.683528549,"8/28/01",2001-08-28,2001-08-28,78,1258,2002-01-10,5.24e+11,1.23e+12,14.01854169,25.48205474,29.00009028,50.02728234,486.640454,21472.10448,20.69574147,2.579163741,"India ",1995-01-01,"Italy ",1995-01-01,1,1,"Italy",1950-05-30,"India",1948-07-08,1,1,10,10,9,9,1,1,"Q4_2013","India ","DS-304","Anti-Dumping Measures on Imports of Certain Products from the European Communities","EUN (for ITA)",2003,"2001",2001,1,2002,1,"09/16/1996",1996-09-16,1
"100",46,"IND-AD-210",750,"2001",994,2001,994,750,"Q4_2012","India","IND-AD-210","European Union","EUN","Vitamin AB2D3K","7/2/01","9/25/01","9/25/01","A","A","12/21/01","SD","7/1/02","7/1/02","A","A","9/9/02","SD","4/13/05","2005","SD","MI","MI","MI",9,9,1,NA,1,1,1.139473046,1.481261834,25.54526907,71.5586288,1,466.2141765,17634.03089,4.94e+11,8.63e+12,12.34193985,36.12211562,22.92230619,2.271640117,"7/2/01",2001-07-02,2001-07-02,NA,1201,2001-12-21,4.94e+11,8.63e+12,12.34193985,36.12211562,25.54526907,71.5586288,466.2141765,17634.03089,22.92230619,2.271640117,"India ",1995-01-01,"European Union",1995-01-01,1,1,NA,NA,"India",1948-07-08,1,NA,6,NA,9,9,1,1,"Q4_2013","India ","DS-304","Anti-Dumping Measures on Imports of Certain Products from the European Communities","EUN",2003,"2001",2001,1,2002,1,"09/16/1996",1996-09-16,1
"102",48,"USA-AD-1019",2,"2003",20,2002,20,2,"Q4_2012","USA","USA-AD-1019","Canada","CAN","Durum and Hard Red Spring Wheat","9/25/02","5/8/03","12/2/02","A","A","5/8/03","AVD","9/5/03","10/23/03","A","P","10/23/03","AVD","2/16/06","2006","AVD","8.86","8.86","G/ADP/N/112/USA",10,10,1,10,1,1,2.401034651,5.507277165,22.17081656,76.27804103,1,38175.37638,23995.01633,1.1e+13,7.53e+11,9.150106555,40.32268991,1.009241245,2.179335795,"9/25/02",2002-09-25,2002-09-25,3247,612,2003-05-08,1.15e+13,8.88e+11,9.063428363,37.01987974,22.47789302,70.20764108,39682.47225,28026.00601,1.197297611,2.09984984,"United States of America",1995-01-01,"Canada ",1995-01-01,1,1,"Canada",1948-01-01,"United States of America",1948-01-01,1,1,10,10,10,10,1,1,"Q4_2013","USA","DS-310","Determination of the International Trade Commission in Hard Red Spring Wheat from Canada","Canada",2004,"2002",2002,1,2003,1,"09/16/1996",1996-09-16,1
"122",52,"USA-AD-820",2,"1999",740,1999,740,2,"Q4_2012","USA","USA-AD-815","Japan","JPN","Cut-To-Length Carbon Steel Plate","2/24/99","7/29/99","4/8/99","A","A","7/29/99","AVD","12/29/99","2/10/00","A","A","2/10/00","AVD","1/4/12","2012","AVD","10.78","59.12","G/ADP/N/59/USA",10,10,1,10,1,1,2.077063761,0.490620156,23.17266209,18.75638736,1,34639.11984,34998.80997,9.67e+12,4.43e+12,10.23412686,10.17337581,1.219934045,1.679247869,"2/24/99",1999-02-24,1999-02-24,209,2226,1999-07-29,9.67e+12,4.43e+12,10.23412686,10.17337581,23.17266209,18.75638736,34639.11984,34998.80997,1.219934045,1.679247869,"United States of America",1995-01-01,"Japan ",1995-01-01,1,1,"Japan",1955-09-10,"United States of America",1948-01-01,1,1,10,10,10,10,1,1,"Q4_2013","USA","DS-322","Zeroing (Japan)","Japan",2004,"1999",1999,1,2000,1,"",NA,0
"127",53,"USA-AD-802",2,"1999",70,1998,70,2,"Q4_2012","USA","USA-AD-797","Mexico","MEX","Stainless Steel Sheet and Strip","6/17/98","1/4/99","8/5/98","A","A","1/4/99","AVD","6/8/99","7/28/99","A","A","7/27/99","AVD","8/10/11","2011","AVD","30.85","30.85","G/ADP/N/59/USA",10,10,1,6,1,1,2.349922309,0.783309588,22.75912907,51.77609803,1,32948.95126,4986.252659,9.09e+12,5.02e+11,10.48398631,25.74892715,1.300089704,4.206365878,"6/17/98",1998-06-17,1998-06-17,1294,1974,1999-01-04,9.67e+12,5.79e+11,10.23412686,25.48169145,23.17266209,51.2689011,34639.11984,5663.388512,1.219934045,3.953796773,"United States of America",1995-01-01,"Mexico ",1995-01-01,1,1,"Mexico",1986-08-24,"United States of America",1948-01-01,1,1,6,6,10,10,1,1,"Q4_2013","USA","DS-325","Anti-Dumping Determinations regarding Stainless Steel from Mexico","Mexico",2005,"1998",2003,0,1999,1,"",NA,0
"128",53,"USA-AD-802",2,"1999",70,1998,70,2,"Q4_2012","USA","USA-AD-797","Mexico","MEX","Stainless Steel Sheet and Strip","6/17/98","1/4/99","8/5/98","A","A","1/4/99","AVD","6/8/99","7/28/99","A","A","7/27/99","AVD","8/10/11","2011","AVD","30.85","30.85","G/ADP/N/59/USA",10,10,1,6,1,1,2.349922309,0.783309588,22.75912907,51.77609803,1,32948.95126,4986.252659,9.09e+12,5.02e+11,10.48398631,25.74892715,1.300089704,4.206365878,"6/17/98",1998-06-17,1998-06-17,1294,1974,1999-01-04,9.67e+12,5.79e+11,10.23412686,25.48169145,23.17266209,51.2689011,34639.11984,5663.388512,1.219934045,3.953796773,"United States of America",1995-01-01,"Mexico ",1995-01-01,1,1,"Mexico",1986-08-24,"United States of America",1948-01-01,1,1,6,6,10,10,1,1,"Q4_2013","USA","DS-325","Anti-Dumping Determinations regarding Stainless Steel from Mexico","Mexico",2005,"1998",2002,0,1999,1,"",NA,0
"129",53,"USA-AD-802",2,"1999",70,1998,70,2,"Q4_2012","USA","USA-AD-797","Mexico","MEX","Stainless Steel Sheet and Strip","6/17/98","1/4/99","8/5/98","A","A","1/4/99","AVD","6/8/99","7/28/99","A","A","7/27/99","AVD","8/10/11","2011","AVD","30.85","30.85","G/ADP/N/59/USA",10,10,1,6,1,1,2.349922309,0.783309588,22.75912907,51.77609803,1,32948.95126,4986.252659,9.09e+12,5.02e+11,10.48398631,25.74892715,1.300089704,4.206365878,"6/17/98",1998-06-17,1998-06-17,1294,1974,1999-01-04,9.67e+12,5.79e+11,10.23412686,25.48169145,23.17266209,51.2689011,34639.11984,5663.388512,1.219934045,3.953796773,"United States of America",1995-01-01,"Mexico ",1995-01-01,1,1,"Mexico",1986-08-24,"United States of America",1948-01-01,1,1,6,6,10,10,1,1,"Q4_2013","USA","DS-325","Anti-Dumping Determinations regarding Stainless Steel from Mexico","Mexico",2005,"1998",1998,1,1999,1,"",NA,0
"130",53,"USA-AD-802",2,"1999",70,1998,70,2,"Q4_2012","USA","USA-AD-797","Mexico","MEX","Stainless Steel Sheet and Strip","6/17/98","1/4/99","8/5/98","A","A","1/4/99","AVD","6/8/99","7/28/99","A","A","7/27/99","AVD","8/10/11","2011","AVD","30.85","30.85","G/ADP/N/59/USA",10,10,1,6,1,1,2.349922309,0.783309588,22.75912907,51.77609803,1,32948.95126,4986.252659,9.09e+12,5.02e+11,10.48398631,25.74892715,1.300089704,4.206365878,"6/17/98",1998-06-17,1998-06-17,1294,1974,1999-01-04,9.67e+12,5.79e+11,10.23412686,25.48169145,23.17266209,51.2689011,34639.11984,5663.388512,1.219934045,3.953796773,"United States of America",1995-01-01,"Mexico ",1995-01-01,1,1,"Mexico",1986-08-24,"United States of America",1948-01-01,1,1,6,6,10,10,1,1,"Q4_2013","USA","DS-325","Anti-Dumping Determinations regarding Stainless Steel from Mexico","Mexico",2005,"1998",2004,0,1999,1,"",NA,0
"131",54,"MEX-AD-225",70,"2002",90,2001,90,70,"Q4_2012","Mexico","MEX-AD-225","Guatemala","GTM","Pipe","8/14/01","3/4/02","3/4/02","A","A","3/14/02","AVD","1/13/03","1/13/03","A","A","1/14/03","AVD","1/25/08","2008","AVD","25.87","25.87","G/ADP/N/105/MEX",8,8,1,8,1,1,0.542536007,4.109378812,48.52804694,69.54458428,0,6879.669807,1629.309766,7.25e+11,18702820735,23.64412569,28.20745718,3.665469947,15.08682551,"8/14/01",2001-08-14,2001-08-14,577,256,2002-03-14,7.42e+11,20776536920,23.46254693,26.29896103,48.37108358,66.03188297,6948.407618,1765.85072,3.57639671,15.17491383,"Mexico ",1995-01-01,"Guatemala ",1995-07-21,1,1,"Guatemala",1991-10-10,"Mexico",1986-08-24,1,1,8,8,8,8,1,1,"Q4_2013","Mexico ","DS-331","Steel Pipes and Tubes","Guatemala",2005,"2001",2001,1,2003,1,"05/12/1997",1997-05-12,1
"132",55,"USA-AD-1065",2,"2004",130,2004,130,2,"Q4_2012","USA","USA-AD-1063","Ecuador","ECU","Certain Frozen and Canned Warmwater Shrimp and Prawns","1/8/04","8/4/04","3/2/04","A","A","8/4/04","AVD","12/23/05","1/27/05","A","P","2/1/05","AVD","8/15/07","2007","AVD","1.97","4.42","G/ADP/N/132/USA",10,10,1,6,1,1,2.645168965,5.254598876,24.28117618,50.66524037,0,41928.88614,2704.665155,1.23e+13,36591661000,9.636719068,24.5543486,1.34507504,10.3702494,"1/8/04",2004-01-08,2004-01-08,358,1082,2004-08-04,1.23e+13,36591661000,9.636719068,24.5543486,24.28117618,50.66524037,41928.88614,2704.665155,1.34507504,10.3702494,"United States of America",1995-01-01,"Ecuador ",1996-01-21,1,1,NA,NA,"United States of America",1948-01-01,1,NA,6,6,10,10,1,1,"Q4_2013","USA","DS-335","Anti-Dumping Measure on Shrimp from Ecuador","Ecuador",2005,"2004",2004,1,2005,1,"04/17/1997",1997-04-17,1
"133",56,"EUN-AD-604",994,"2005",385,2004,385,994,"Q4_2012","European Union","EUN-AD-604","Norway","NOR","Farmed Salmon","10/23/04","4/23/05","4/23/05","A","A","4/23/05","AVD","1/20/06","1/20/06","A","A","1/20/06","DPU","7/17/08","2008","DPU ","0.8","20.9","G/ADP/N/145/EEC",NA,NA,1,10,1,1,1.428685194,0.611828371,70.27789133,70.19805889,0,26795.93303,56627.65738,1.32e+13,2.6e+11,35.70172137,41.79906345,2.028298134,1.583923817,"10/23/04",2004-10-23,2004-10-23,1100,NA,2005-04-23,1.39e+13,3.04e+11,37.04369782,44.09116921,73.30833573,71.93710574,27909.03457,65767.01961,1.769160588,1.563576661,"European Union",1995-01-01,"Norway ",1995-01-01,1,1,"Norway",1948-07-10,NA,NA,NA,1,10,10,6,NA,1,1,"Q4_2013","EUN ","DS-337","Anti-Dumping Measure on Farmed Salmon from Norway","Norway",2006,"2004",2004,1,2006,1,"01/09/1997",1997-01-09,1
"134",57,"CAN-AD-347",20,"2005",2,2005,2,20,"Q4_2012","Canada","CAN-AD-347","USA","USA","Grain Corn","9/16/05","12/15/05","11/15/05","A","A","12/15/05","AVD","3/15/06","4/18/06","A","N",".",".",".",".",".",".",".",".",10,10,1,10,1,1,5.041383051,2.530182767,70.02204564,25.47841227,1,36029.32267,44313.58524,1.16e+12,1.31e+13,36.95989963,10.00656719,1.840625422,1.212483968,"9/16/05",2005-09-16,2005-09-16,NA,NA,2005-12-15,1.16e+12,1.31e+13,36.95989963,10.00656719,70.02204564,25.47841227,36029.32267,44313.58524,1.840625422,1.212483968,"Canada ",1995-01-01,"United States of America",1995-01-01,1,1,"United States of America",1948-01-01,"Canada",1948-01-01,1,1,10,10,10,10,1,1,"Q4_2013","Canada ","DS-338","Provisional Anti-Dumping and Countervailing Duties on Grain Corn from the United States","USA",2006,"2005",2005,1,NA,1,"",NA,0
"135",58,"USA-AD-1067",2,"2004",800,2004,800,2,"Q4_2012","USA","USA-AD-1063","Thailand","THA","Certain Frozen and Canned Warmwater Shrimp and Prawns","1/8/04","8/4/04","3/2/04","A","A","8/4/04","AVD","12/23/04","1/27/05","A","P","2/1/05","AVD","IF","IF","AVD","5.29","6.82","G/ADP/N/132/USA",10,10,1,9,1,1,2.645168965,4.765890441,24.28117618,136.5376958,1,41928.88614,2478.817568,1.23e+13,1.61e+11,9.636719068,70.69704858,1.34507504,10.30604012,"1/8/04",2004-01-08,2004-01-08,1062,1082,2004-08-04,1.23e+13,1.61e+11,9.636719068,70.69704858,24.28117618,136.5376958,41928.88614,2478.817568,1.34507504,10.30604012,"United States of America",1995-01-01,"Thailand ",1995-01-01,1,1,"Thailand",1982-11-20,"United States of America",1948-01-01,1,1,9,9,10,10,1,1,"Q4_2013","USA","DS-343","Anti-Dumping Measures on Shrimp from Thailand","Thailand",2006,"2004",2004,1,2005,1,"01/09/1997",1997-01-09,1
"136",59,"USA-AD-802",2,"1999",70,1998,70,2,"Q4_2012","USA","USA-AD-797","Mexico","MEX","Stainless Steel Sheet and Strip","6/17/98","1/4/99","8/5/98","A","A","1/4/99","AVD","6/8/99","7/28/99","A","A","7/27/99","AVD","8/10/11","2011","AVD","30.85","30.85","G/ADP/N/59/USA",10,10,1,6,1,1,2.349922309,0.783309588,22.75912907,51.77609803,1,32948.95126,4986.252659,9.09e+12,5.02e+11,10.48398631,25.74892715,1.300089704,4.206365878,"6/17/98",1998-06-17,1998-06-17,1294,1974,1999-01-04,9.67e+12,5.79e+11,10.23412686,25.48169145,23.17266209,51.2689011,34639.11984,5663.388512,1.219934045,3.953796773,"United States of America",1995-01-01,"Mexico ",1995-01-01,1,1,"Mexico",1986-08-24,"United States of America",1948-01-01,1,1,6,6,10,10,1,1,"Q4_2013","USA","DS-344","Final Anti-dumping Measures on Stainless Steel from Mexico","Mexico",2006,"1998",2003,0,1999,1,"06/12/1997",1997-06-12,1
"137",59,"USA-AD-802",2,"1999",70,1998,70,2,"Q4_2012","USA","USA-AD-797","Mexico","MEX","Stainless Steel Sheet and Strip","6/17/98","1/4/99","8/5/98","A","A","1/4/99","AVD","6/8/99","7/28/99","A","A","7/27/99","AVD","8/10/11","2011","AVD","30.85","30.85","G/ADP/N/59/USA",10,10,1,6,1,1,2.349922309,0.783309588,22.75912907,51.77609803,1,32948.95126,4986.252659,9.09e+12,5.02e+11,10.48398631,25.74892715,1.300089704,4.206365878,"6/17/98",1998-06-17,1998-06-17,1294,1974,1999-01-04,9.67e+12,5.79e+11,10.23412686,25.48169145,23.17266209,51.2689011,34639.11984,5663.388512,1.219934045,3.953796773,"United States of America",1995-01-01,"Mexico ",1995-01-01,1,1,"Mexico",1986-08-24,"United States of America",1948-01-01,1,1,6,6,10,10,1,1,"Q4_2013","USA","DS-344","Final Anti-dumping Measures on Stainless Steel from Mexico","Mexico",2006,"1998",2004,0,1999,1,"06/12/1997",1997-06-12,1
"138",59,"USA-AD-802",2,"1999",70,1998,70,2,"Q4_2012","USA","USA-AD-797","Mexico","MEX","Stainless Steel Sheet and Strip","6/17/98","1/4/99","8/5/98","A","A","1/4/99","AVD","6/8/99","7/28/99","A","A","7/27/99","AVD","8/10/11","2011","AVD","30.85","30.85","G/ADP/N/59/USA",10,10,1,6,1,1,2.349922309,0.783309588,22.75912907,51.77609803,1,32948.95126,4986.252659,9.09e+12,5.02e+11,10.48398631,25.74892715,1.300089704,4.206365878,"6/17/98",1998-06-17,1998-06-17,1294,1974,1999-01-04,9.67e+12,5.79e+11,10.23412686,25.48169145,23.17266209,51.2689011,34639.11984,5663.388512,1.219934045,3.953796773,"United States of America",1995-01-01,"Mexico ",1995-01-01,1,1,"Mexico",1986-08-24,"United States of America",1948-01-01,1,1,6,6,10,10,1,1,"Q4_2013","USA","DS-344","Final Anti-dumping Measures on Stainless Steel from Mexico","Mexico",2006,"1998",2005,0,1999,1,"06/12/1997",1997-06-12,1
"139",59,"USA-AD-802",2,"1999",70,1998,70,2,"Q4_2012","USA","USA-AD-797","Mexico","MEX","Stainless Steel Sheet and Strip","6/17/98","1/4/99","8/5/98","A","A","1/4/99","AVD","6/8/99","7/28/99","A","A","7/27/99","AVD","8/10/11","2011","AVD","30.85","30.85","G/ADP/N/59/USA",10,10,1,6,1,1,2.349922309,0.783309588,22.75912907,51.77609803,1,32948.95126,4986.252659,9.09e+12,5.02e+11,10.48398631,25.74892715,1.300089704,4.206365878,"6/17/98",1998-06-17,1998-06-17,1294,1974,1999-01-04,9.67e+12,5.79e+11,10.23412686,25.48169145,23.17266209,51.2689011,34639.11984,5663.388512,1.219934045,3.953796773,"United States of America",1995-01-01,"Mexico ",1995-01-01,1,1,"Mexico",1986-08-24,"United States of America",1948-01-01,1,1,6,6,10,10,1,1,"Q4_2013","USA","DS-344","Final Anti-dumping Measures on Stainless Steel from Mexico","Mexico",2006,"1998",2002,0,1999,1,"06/12/1997",1997-06-12,1
"141",59,"USA-AD-802",2,"1999",70,1998,70,2,"Q4_2012","USA","USA-AD-797","Mexico","MEX","Stainless Steel Sheet and Strip","6/17/98","1/4/99","8/5/98","A","A","1/4/99","AVD","6/8/99","7/28/99","A","A","7/27/99","AVD","8/10/11","2011","AVD","30.85","30.85","G/ADP/N/59/USA",10,10,1,6,1,1,2.349922309,0.783309588,22.75912907,51.77609803,1,32948.95126,4986.252659,9.09e+12,5.02e+11,10.48398631,25.74892715,1.300089704,4.206365878,"6/17/98",1998-06-17,1998-06-17,1294,1974,1999-01-04,9.67e+12,5.79e+11,10.23412686,25.48169145,23.17266209,51.2689011,34639.11984,5663.388512,1.219934045,3.953796773,"United States of America",1995-01-01,"Mexico ",1995-01-01,1,1,"Mexico",1986-08-24,"United States of America",1948-01-01,1,1,6,6,10,10,1,1,"Q4_2013","USA","DS-344","Final Anti-dumping Measures on Stainless Steel from Mexico","Mexico",2006,"1998",1998,0,1999,1,"06/12/1997",1997-06-12,1
"142",60,"USA-AD-1066",2,"2004",750,2004,750,2,"Q4_2012","USA","USA-AD-1063","India","IND","Certain Frozen and Canned Warmwater Shrimp and Prawns","1/8/04","8/4/04","3/2/04","A","A","8/4/04","AVD","12/23/04","1/27/05","A","P","2/1/05","AVD","IF","IF","AVD","4.94","15.36","G/ADP/N/132/USA",10,10,1,9,1,1,2.645168965,1.203886488,24.28117618,36.85744745,1,41928.88614,649.7106479,1.23e+13,7.22e+11,9.636719068,17.55132848,1.34507504,19.02855235,"1/8/04",2004-01-08,2004-01-08,2121,1082,2004-08-04,1.23e+13,7.22e+11,9.636719068,17.55132848,24.28117618,36.85744745,41928.88614,649.7106479,1.34507504,19.02855235,"United States of America",1995-01-01,"India ",1995-01-01,1,1,"India",1948-07-08,"United States of America",1948-01-01,1,1,9,9,10,10,1,1,"Q4_2013","USA","DS-345","Customs Bond Directive for Merchandise Subject to Anti-Dumping/Countervailing Duties","India",2006,"2004",2004,1,2005,1,"02/04/1997",1997-02-04,1
"143",61,"USA-AD-711",2,"1995",160,1994,160,2,"Q4_2012","USA","USA-AD-711","Argentina","ARG","Oil Country Tubular Goods","7/7/94","2/2/95","8/24/94","A","A","2/2/95","AVD","6/28/95","8/10/95","A","A","8/11/95","AVD","7/25/06","2006","AVD","1.36","1.36","G/ADP/N/4/USA",10,10,1,7,1,0,3.489054379,3.360702032,20.99278942,14.97014353,0,27776.4265,9065.649524,7.31e+12,3.12e+11,9.863587232,6.21608196,1.834777514,4.662412404,"7/7/94",1994-07-07,1994-07-07,2190,533,1995-02-02,7.66e+12,3.13e+11,10.60542797,7.991430122,22.38256785,16.32174519,28781.94969,8973.321347,1.607811468,4.909063075,"United States of America",1995-01-01,"Argentina ",1995-01-01,1,1,"Argentina",1967-10-11,"United States of America",1948-01-01,1,1,7,7,10,10,1,1,"Q4_2013","USA","DS-346","Anti-Dumping Administrative Review on Oil Country Tubular Goods from Argentina","Argentina",2006,"1994",2003,0,1995,1,"",NA,0
"145",62,"USA-AD-914",2,"2001",255,2001,255,2,"Q4_2012","USA","USA-AD-913","Germany","DEU","Stainless Steel Bar","1/4/01","8/2/01","2/23/01","A","A","8/2/01","AVD","1/23/02","3/8/02","A","A","3/7/02","AVD","3/7/07","2007","AVD","4.17","32.32","G/ADP/N/92/USA",10,10,1,10,1,1,2.306059661,0.856664997,22.8379434,67.59503307,1,37285.81592,22840.27405,1.06e+13,1.88e+12,9.68255014,34.78900043,1.181402837,1.20527108,"1/4/01",2001-01-04,2001-01-04,800,2906,2001-08-02,1.06e+13,1.88e+12,9.68255014,34.78900043,22.8379434,67.59503307,37285.81592,22840.27405,1.181402837,1.20527108,"United States of America",1995-01-01,"Germany ",1995-01-01,1,1,"Germany",1951-10-01,"United States of America",1948-01-01,1,1,10,10,10,10,1,1,"Q4_2013","USA","DS-350","Continued Zeroing","EUN",2006,"2001",2006,0,2002,1,"02/11/1997",1997-02-11,1
"146",62,"USA-AD-913",2,"2001",220,2001,220,2,"Q4_2012","USA","USA-AD-913","France","FRA","Stainless Steel Bar","1/4/01","8/2/01","2/23/01","A","A","8/2/01","AVD","1/23/02","3/8/02","A","A","3/7/02","AVD","3/7/07","2007","AVD","3.9","71.83","G/ADP/N/92/USA",10,10,1,9,1,1,2.306059661,1.0180398,22.8379434,55.5839122,1,37285.81592,21812.19434,1.06e+13,1.34e+12,9.68255014,28.36027408,1.181402837,2.479958407,"1/4/01",2001-01-04,2001-01-04,2059,2906,2001-08-02,1.06e+13,1.34e+12,9.68255014,28.36027408,22.8379434,55.5839122,37285.81592,21812.19434,1.181402837,2.479958407,"United States of America",1995-01-01,"France ",1995-01-01,1,1,"France",1948-01-01,"United States of America",1948-01-01,1,1,9,9,10,10,1,1,"Q4_2013","USA","DS-350","Continued Zeroing","EUN",2006,"2001",2006,0,2002,1,"02/11/1997",1997-02-11,1
"147",62,"USA-AD-903",2,"2001",210,2000,210,2,"Q4_2012","USA","USA-AD-898","Netherlands","NLD","Hot-Rolled Carbon Steel Products","11/22/00","5/3/01","1/4/01","A","A","5/3/01","AVD","10/3/01","11/15/01","A","A","11/29/01","AVD","11/29/06","2006","AVD","2.59","2.59","G/ADP/N/85/USA",10,10,1,10,1,1,2.295750911,2.732042732,24.96379875,134.6176668,0,36467.29543,24179.73141,1.03e+13,3.85e+11,10.63490675,70.08230453,1.190978876,2.506326741,"11/22/00",2000-11-22,2000-11-22,2284,2863,2001-05-03,1.06e+13,4.01e+11,9.68255014,67.27610999,22.8379434,128.7650397,37285.81592,24968.81742,1.181402837,2.418275664,"United States of America",1995-01-01,"Netherlands ",1995-01-01,1,1,"Netherlands",1948-01-01,"United States of America",1948-01-01,1,1,10,10,10,10,1,1,"Q4_2013","USA","DS-350","Continued Zeroing","EUN",2006,"2000",2004,0,2001,1,"02/11/1997",1997-02-11,1
"148",62,"USA-AD-798",2,"1999",255,1998,255,2,"Q4_2012","USA","USA-AD-797","Germany","DEU","Stainless Steel Sheet and Strip","6/17/98","1/4/99","8/5/98","A","A","1/4/99","AVD","6/8/99","7/28/99","A","A","7/27/99","AVD","8/10/11","2011","AVD","25.37","25.37","G/ADP/N/59/USA",10,10,1,10,1,1,2.349922309,0.915361126,22.75912907,55.79170281,1,32948.95126,26547.77535,9.09e+12,2.18e+12,10.48398631,28.58294637,1.300089704,1.073012219,"6/17/98",1998-06-17,1998-06-17,5738,1974,1999-01-04,9.67e+12,2.13e+12,10.23412686,29.40355964,23.17266209,57.92820718,34639.11984,25956.63741,1.219934045,1.059086461,"United States of America",1995-01-01,"Germany ",1995-01-01,1,1,"Germany",1951-10-01,"United States of America",1948-01-01,1,1,10,10,10,10,1,1,"Q4_2013","USA","DS-350","Continued Zeroing","EUN",2006,"1998",2005,0,1999,1,"02/11/1997",1997-02-11,1
"149",62,"USA-AD-798",2,"1999",255,1998,255,2,"Q4_2012","USA","USA-AD-797","Germany","DEU","Stainless Steel Sheet and Strip","6/17/98","1/4/99","8/5/98","A","A","1/4/99","AVD","6/8/99","7/28/99","A","A","7/27/99","AVD","8/10/11","2011","AVD","25.37","25.37","G/ADP/N/59/USA",10,10,1,10,1,1,2.349922309,0.915361126,22.75912907,55.79170281,1,32948.95126,26547.77535,9.09e+12,2.18e+12,10.48398631,28.58294637,1.300089704,1.073012219,"6/17/98",1998-06-17,1998-06-17,5738,1974,1999-01-04,9.67e+12,2.13e+12,10.23412686,29.40355964,23.17266209,57.92820718,34639.11984,25956.63741,1.219934045,1.059086461,"United States of America",1995-01-01,"Germany ",1995-01-01,1,1,"Germany",1951-10-01,"United States of America",1948-01-01,1,1,10,10,10,10,1,1,"Q4_2013","USA","DS-350","Continued Zeroing","EUN",2006,"1998",2004,0,1999,1,"02/11/1997",1997-02-11,1
"150",62,"USA-AD-1083",2,"2004",230,2004,230,2,"Q4_2012","USA","USA-AD-1082","Spain","ESP","Chlorinated Isocyanurates","5/21/04","12/20/04","7/2/04","A","A","12/20/04","AVD","5/10/05","6/22/05","A","A","6/24/05","AVD","IF","IF","DPU ","24.83","24.83","G/ADP/N/132/USA",10,10,1,10,1,1,2.645168965,1.126444657,24.28117618,55.86643908,1,41928.88614,24337.5105,1.23e+13,1.04e+12,9.636719068,25.93635519,1.34507504,3.458647611,"5/21/04",2004-05-21,2004-05-21,34,1216,2004-12-20,1.23e+13,1.04e+12,9.636719068,25.93635519,24.28117618,55.86643908,41928.88614,24337.5105,1.34507504,3.458647611,"United States of America",1995-01-01,"Spain ",1995-01-01,1,1,"Spain",1963-08-29,"United States of America",1948-01-01,1,1,10,10,10,10,1,1,"Q4_2013","USA","DS-350","Continued Zeroing","EUN",2006,"2004",2004,1,2005,1,"02/11/1997",1997-02-11,1
"151",62,"USA-AD-903",2,"2001",210,2000,210,2,"Q4_2012","USA","USA-AD-898","Netherlands","NLD","Hot-Rolled Carbon Steel Products","11/22/00","5/3/01","1/4/01","A","A","5/3/01","AVD","10/3/01","11/15/01","A","A","11/29/01","AVD","11/29/06","2006","AVD","2.59","2.59","G/ADP/N/85/USA",10,10,1,10,1,1,2.295750911,2.732042732,24.96379875,134.6176668,0,36467.29543,24179.73141,1.03e+13,3.85e+11,10.63490675,70.08230453,1.190978876,2.506326741,"11/22/00",2000-11-22,2000-11-22,2284,2863,2001-05-03,1.06e+13,4.01e+11,9.68255014,67.27610999,22.8379434,128.7650397,37285.81592,24968.81742,1.181402837,2.418275664,"United States of America",1995-01-01,"Netherlands ",1995-01-01,1,1,"Netherlands",1948-01-01,"United States of America",1948-01-01,1,1,10,10,10,10,1,1,"Q4_2013","USA","DS-350","Continued Zeroing","EUN",2006,"2000",2005,0,2001,1,"02/11/1997",1997-02-11,1
"152",62,"USA-AD-913",2,"2001",220,2001,220,2,"Q4_2012","USA","USA-AD-913","France","FRA","Stainless Steel Bar","1/4/01","8/2/01","2/23/01","A","A","8/2/01","AVD","1/23/02","3/8/02","A","A","3/7/02","AVD","3/7/07","2007","AVD","3.9","71.83","G/ADP/N/92/USA",10,10,1,9,1,1,2.306059661,1.0180398,22.8379434,55.5839122,1,37285.81592,21812.19434,1.06e+13,1.34e+12,9.68255014,28.36027408,1.181402837,2.479958407,"1/4/01",2001-01-04,2001-01-04,2059,2906,2001-08-02,1.06e+13,1.34e+12,9.68255014,28.36027408,22.8379434,55.5839122,37285.81592,21812.19434,1.181402837,2.479958407,"United States of America",1995-01-01,"France ",1995-01-01,1,1,"France",1948-01-01,"United States of America",1948-01-01,1,1,9,9,10,10,1,1,"Q4_2013","USA","DS-350","Continued Zeroing","EUN",2006,"2001",2005,0,2002,1,"02/11/1997",1997-02-11,1
"153",62,"USA-AD-734",2,"1996",325,1995,325,2,"Q4_2012","USA","USA-AD-734","Italy","ITA","Pasta","5/19/95","1/19/96","7/10/95","A","A","1/19/96","AVD","6/14/96","7/24/96","A","A","7/24/96","AVD","IF","IF","AVD","0","46.67","G/ADP/N/22/USA",10,10,1,10,1,1,3.862870077,0.667190616,22.38256785,47.58799564,1,28781.94969,19910.00067,7.66e+12,1.13e+12,10.60542797,25.71427747,1.607811468,3.317877129,"5/19/95",1995-05-19,1995-05-19,122,849,1996-01-19,8.1e+12,1.27e+12,10.71084665,24.68113975,22.61178736,44.64167892,30068.22721,22271.33092,1.805715555,3.29828126,"United States of America",1995-01-01,"Italy ",1995-01-01,1,1,"Italy",1950-05-30,"United States of America",1948-01-01,1,1,10,10,10,10,1,1,"Q4_2013","USA","DS-350","Continued Zeroing","EUN",2006,"1995",2005,0,1996,1,"02/11/1997",1997-02-11,1
"154",62,"USA-AD-1084",2,"2004",375,2004,375,2,"Q4_2012","USA","USA-AD-1084","Finland","FIN","Purified Carboxymethylcellulose","6/17/04","12/27/04","6/30/04","A","A","12/27/04","AVD","5/17/05","7/7/05","A","A","7/11/05","AVD","IF","IF","DPU ","MI","MI","G/ADP/N/139/USA",10,10,1,10,1,1,2.645168965,6.011289335,24.28117618,73.20084589,0,41928.88614,36162.65601,1.23e+13,1.89e+11,9.636719068,39.86182076,1.34507504,2.869615701,"6/17/04",2004-06-17,2004-06-17,1569,1243,2004-12-27,1.23e+13,1.89e+11,9.636719068,39.86182076,24.28117618,73.20084589,41928.88614,36162.65601,1.34507504,2.869615701,"United States of America",1995-01-01,"Finland ",1995-01-01,1,1,"Finland",1950-05-25,"United States of America",1948-01-01,1,1,10,10,10,10,1,1,"Q4_2013","USA","DS-350","Continued Zeroing","EUN",2006,"2004",2004,1,2005,1,"02/11/1997",1997-02-11,1
"156",62,"USA-AD-914",2,"2001",255,2001,255,2,"Q4_2012","USA","USA-AD-913","Germany","DEU","Stainless Steel Bar","1/4/01","8/2/01","2/23/01","A","A","8/2/01","AVD","1/23/02","3/8/02","A","A","3/7/02","AVD","3/7/07","2007","AVD","4.17","32.32","G/ADP/N/92/USA",10,10,1,10,1,1,2.306059661,0.856664997,22.8379434,67.59503307,1,37285.81592,22840.27405,1.06e+13,1.88e+12,9.68255014,34.78900043,1.181402837,1.20527108,"1/4/01",2001-01-04,2001-01-04,800,2906,2001-08-02,1.06e+13,1.88e+12,9.68255014,34.78900043,22.8379434,67.59503307,37285.81592,22840.27405,1.181402837,1.20527108,"United States of America",1995-01-01,"Germany ",1995-01-01,1,1,"Germany",1951-10-01,"United States of America",1948-01-01,1,1,10,10,10,10,1,1,"Q4_2013","USA","DS-350","Continued Zeroing","EUN",2006,"2001",2004,0,2002,1,"02/11/1997",1997-02-11,1
"157",62,"USA-AD-788",2,"1998",211,1998,211,2,"Q4_2012","USA","USA-AD-788","Belgium","BEL","Stainless Steel Plate in Coils","4/9/98","11/4/98","5/28/98","A","A","11/4/98","AVD","3/31/99","5/12/99","A","A","5/21/99","AVD","IF","IF","AVD","9.86","9.86","G/ADP/N/53/USA",10,10,1,10,1,1,2.349922309,1.233065856,22.75912907,135.6035967,0,32948.95126,25051.33996,9.09e+12,2.56e+11,10.48398631,69.7023323,1.300089704,1.407012203,"4/9/98",1998-04-09,1998-04-09,2224,1905,1998-11-04,9.09e+12,2.56e+11,10.48398631,69.7023323,22.75912907,135.6035967,32948.95126,25051.33996,1.300089704,1.407012203,"United States of America",1995-01-01,"Belgium ",1995-01-01,1,1,"Belgium",1948-01-01,"United States of America",1948-01-01,1,1,10,10,10,10,1,1,"Q4_2013","USA","DS-350","Continued Zeroing","EUN",2006,"1998",2004,0,1999,1,"02/11/1997",1997-02-11,1
"164",62,"USA-AD-878",2,"2001",367,2000,367,2,"Q4_2012","USA","USA-AD-872","Latvia","LVA","Steel Concrete Rebar","7/7/00","1/30/01","8/23/00","A","A","1/30/01","AVD","6/22/01","7/30/01","A","A","9/7/01","AVD","IF","IF","AVD","17.21","17.21","G/ADP/N/78/USA",10,10,1,8,1,1,2.295750911,29.47080305,24.96379875,90.31615179,0,36467.29543,3308.512355,1.03e+13,7833068425,10.63490675,41.64179343,1.190978876,4.604133844,"7/7/00",2000-07-07,2000-07-07,63,2725,2001-01-30,1.06e+13,8313047744,9.68255014,41.57739299,22.8379434,92.68561261,37285.81592,3556.88621,1.181402837,4.504274595,"United States of America",1995-01-01,"Latvia ",1999-02-10,1,1,NA,NA,"United States of America",1948-01-01,1,NA,8,8,10,10,1,1,"Q4_2013","USA","DS-350","Continued Zeroing","EUN",2006,"2000",2006,0,2001,1,"02/11/1997",1997-02-11,1
"166",62,"USA-AD-1087",2,"2004",380,2004,380,2,"Q4_2012","USA","USA-AD-1084","Sweden","SWE","Purified Carboxymethylcellulose","6/17/04","12/27/04","6/30/04","A","A","12/27/04","AVD","5/17/05","7/7/05","A","A","7/11/05","AVD","5/20/11","2011","DPU ","MI","MI","G/ADP/N/139/USA",10,10,1,10,1,1,2.645168965,4.180186541,24.28117618,83.73276983,0,41928.88614,40261.12201,1.23e+13,3.62e+11,9.636719068,45.95733791,1.34507504,1.894012394,"6/17/04",2004-06-17,2004-06-17,3010,1243,2004-12-27,1.23e+13,3.62e+11,9.636719068,45.95733791,24.28117618,83.73276983,41928.88614,40261.12201,1.34507504,1.894012394,"United States of America",1995-01-01,"Sweden ",1995-01-01,1,1,"Sweden",1950-04-30,"United States of America",1948-01-01,1,1,10,10,10,10,1,1,"Q4_2013","USA","DS-350","Continued Zeroing","EUN",2006,"2004",2004,1,2005,1,"02/11/1997",1997-02-11,1
"167",62,"USA-AD-878",2,"2001",367,2000,367,2,"Q4_2012","USA","USA-AD-872","Latvia","LVA","Steel Concrete Rebar","7/7/00","1/30/01","8/23/00","A","A","1/30/01","AVD","6/22/01","7/30/01","A","A","9/7/01","AVD","IF","IF","AVD","17.21","17.21","G/ADP/N/78/USA",10,10,1,8,1,1,2.295750911,29.47080305,24.96379875,90.31615179,0,36467.29543,3308.512355,1.03e+13,7833068425,10.63490675,41.64179343,1.190978876,4.604133844,"7/7/00",2000-07-07,2000-07-07,63,2725,2001-01-30,1.06e+13,8313047744,9.68255014,41.57739299,22.8379434,92.68561261,37285.81592,3556.88621,1.181402837,4.504274595,"United States of America",1995-01-01,"Latvia ",1999-02-10,1,1,NA,NA,"United States of America",1948-01-01,1,NA,8,8,10,10,1,1,"Q4_2013","USA","DS-350","Continued Zeroing","EUN",2006,"2000",2004,1,2001,1,"02/11/1997",1997-02-11,1
"168",62,"USA-AD-915",2,"2001",325,2001,325,2,"Q4_2012","USA","USA-AD-913","Italy","ITA","Stainless Steel Bar","1/4/01","8/2/01","2/23/01","A","A","8/2/01","AVD","1/23/02","3/8/02","A","A","3/7/02","AVD","3/7/07","2007","AVD","1.7","33","G/ADP/N/92/USA",10,10,1,10,1,1,2.306059661,0.652361831,22.8379434,52.33283751,1,37285.81592,19723.04417,1.06e+13,1.12e+12,9.68255014,26.85797238,1.181402837,2.683528549,"1/4/01",2001-01-04,2001-01-04,253,2906,2001-08-02,1.06e+13,1.12e+12,9.68255014,26.85797238,22.8379434,52.33283751,37285.81592,19723.04417,1.181402837,2.683528549,"United States of America",1995-01-01,"Italy ",1995-01-01,1,1,"Italy",1950-05-30,"United States of America",1948-01-01,1,1,10,10,10,10,1,1,"Q4_2013","USA","DS-350","Continued Zeroing","EUN",2006,"2001",2004,0,2002,1,"02/11/1997",1997-02-11,1
"173",62,"USA-AD-734",2,"1996",325,1995,325,2,"Q4_2012","USA","USA-AD-734","Italy","ITA","Pasta","5/19/95","1/19/96","7/10/95","A","A","1/19/96","AVD","6/14/96","7/24/96","A","A","7/24/96","AVD","IF","IF","AVD","0","46.67","G/ADP/N/22/USA",10,10,1,10,1,1,3.862870077,0.667190616,22.38256785,47.58799564,1,28781.94969,19910.00067,7.66e+12,1.13e+12,10.60542797,25.71427747,1.607811468,3.317877129,"5/19/95",1995-05-19,1995-05-19,122,849,1996-01-19,8.1e+12,1.27e+12,10.71084665,24.68113975,22.61178736,44.64167892,30068.22721,22271.33092,1.805715555,3.29828126,"United States of America",1995-01-01,"Italy ",1995-01-01,1,1,"Italy",1950-05-30,"United States of America",1948-01-01,1,1,10,10,10,10,1,1,"Q4_2013","USA","DS-350","Continued Zeroing","EUN",2006,"1995",2004,0,1996,1,"02/11/1997",1997-02-11,1
"176",62,"USA-AD-1086",2,"2004",210,2004,210,2,"Q4_2012","USA","USA-AD-1084","Netherlands","NLD","Purified Carboxymethylcellulose","6/17/04","12/27/04","6/30/04","A","A","12/27/04","AVD","5/17/05","7/7/05","A","A","7/11/05","AVD","IF","IF","DPU ","MI","MI","G/ADP/N/139/USA",10,10,1,10,1,1,2.645168965,3.009490491,24.28117618,125.4122691,1,41928.88614,37458.43287,1.23e+13,6.1e+11,9.636719068,66.39283853,1.34507504,1.984782798,"6/17/04",2004-06-17,2004-06-17,696,1243,2004-12-27,1.23e+13,6.1e+11,9.636719068,66.39283853,24.28117618,125.4122691,41928.88614,37458.43287,1.34507504,1.984782798,"United States of America",1995-01-01,"Netherlands ",1995-01-01,1,1,"Netherlands",1948-01-01,"United States of America",1948-01-01,1,1,10,10,10,10,1,1,"Q4_2013","USA","DS-350","Continued Zeroing","EUN",2006,"2004",2004,1,2005,1,"02/11/1997",1997-02-11,1
"177",62,"USA-AD-788",2,"1998",211,1998,211,2,"Q4_2012","USA","USA-AD-788","Belgium","BEL","Stainless Steel Plate in Coils","4/9/98","11/4/98","5/28/98","A","A","11/4/98","AVD","3/31/99","5/12/99","A","A","5/21/99","AVD","IF","IF","AVD","9.86","9.86","G/ADP/N/53/USA",10,10,1,10,1,1,2.349922309,1.233065856,22.75912907,135.6035967,0,32948.95126,25051.33996,9.09e+12,2.56e+11,10.48398631,69.7023323,1.300089704,1.407012203,"4/9/98",1998-04-09,1998-04-09,2224,1905,1998-11-04,9.09e+12,2.56e+11,10.48398631,69.7023323,22.75912907,135.6035967,32948.95126,25051.33996,1.300089704,1.407012203,"United States of America",1995-01-01,"Belgium ",1995-01-01,1,1,"Belgium",1948-01-01,"United States of America",1948-01-01,1,1,10,10,10,10,1,1,"Q4_2013","USA","DS-350","Continued Zeroing","EUN",2006,"1998",2005,0,1999,1,"02/11/1997",1997-02-11,1
"181",62,"USA-AD-799",2,"1999",325,1998,325,2,"Q4_2012","USA","USA-AD-797","Italy","ITA","Stainless Steel Sheet and Strip","6/17/98","1/4/99","8/5/98","A","A","1/4/99","AVD","6/8/99","7/28/99","A","A","7/27/99","AVD","8/10/11","2011","AVD","MI","MI","MI",10,10,1,10,1,1,2.349922309,0.634332938,22.75912907,47.08565282,1,32948.95126,21519.06412,9.09e+12,1.22e+12,10.48398631,25.15430622,1.300089704,3.098162293,"6/17/98",1998-06-17,1998-06-17,760,1974,1999-01-04,9.67e+12,1.21e+12,10.23412686,24.27992645,23.17266209,46.64130468,34639.11984,21227.31087,1.219934045,3.027755412,"United States of America",1995-01-01,"Italy ",1995-01-01,1,1,"Italy",1950-05-30,"United States of America",1948-01-01,1,1,10,10,10,10,1,1,"Q4_2013","USA","DS-350","Continued Zeroing","EUN",2006,"1998",2003,0,1999,1,"02/11/1997",1997-02-11,1
"183",64,"USA-AD-1107",2,"2007",710,2006,710,2,"Q4_2012","USA","USA-AD-1107","China","CHN","Coated Free Sheet Paper","11/6/06","6/4/07","12/29/06","A","A","6/4/07","AVD","10/25/07","12/13/07","A","N",".",".",".",".",".",".",".",".",10,10,1,-7,0,1,2.464403823,0.47626229,26.83956444,70.55319578,1,46443.8102,2069.34363,1.39e+13,2.71e+12,10.66900468,39.12622529,1.042895226,11.11345205,"11/6/06",2006-11-06,2006-11-06,NA,NA,2007-06-04,1.45e+13,3.49e+12,11.50321471,38.39804741,27.90826157,67.98414918,48070.38469,2651.260119,1.130169679,10.76971034,"United States of America",1995-01-01,"China ",2001-12-11,1,1,NA,NA,"United States of America",1948-01-01,1,NA,-7,0,10,10,1,0,"Q4_2013","USA","DS-368","Preliminary Anti-Dumping and Countervailing Duty Determinations on Coated Free Sheet Paper from China","China",2007,"2006",2006,1,NA,1,"04/17/1997",1997-04-17,1
"185",66,"USA-AD-1116",2,"2008",710,2007,710,2,"Q4_2012","USA","USA-AD-1116","China","CHN","Circular Welded Carbon Quality Steel Pipe","6/14/07","1/15/08","8/3/07","A","A","1/15/08","AVD","6/5/08","7/21/08","A","A","7/22/08","AVD","IF","IF","AVD","69.2","85.55","G/ADP/N/180/USA",10,10,1,-7,0,1,2.411169113,0.458951894,27.90826157,67.98414918,1,48070.38469,2651.260119,1.45e+13,3.49e+12,11.50321471,38.39804741,1.130169679,10.76971034,"6/14/07",2007-06-14,2007-06-14,NA,NA,2008-01-15,1.47e+13,4.52e+12,12.5208046,34.9816182,29.88729849,62.24882112,48407.07691,3413.588648,1.220378431,10.7315685,"United States of America",1995-01-01,"China ",2001-12-11,1,1,NA,NA,"United States of America",1948-01-01,1,NA,-7,0,10,10,1,0,"Q4_2013","USA","DS-379","Definitive Anti-Dumping and Countervailing Duties on Certain Products from China","China",2008,"2007",2007,1,2008,1,"",NA,0
"186",66,"USA-AD-1122",2,"2008",710,2007,710,2,"Q4_2012","USA","USA-AD-1122","China","CHN","Laminated Woven Sacks","7/5/07","1/31/08","8/17/07","A","A","1/31/08","AVD","6/24/08","8/5/08","A","A","8/7/08","AVD","IF","IF","AVD","64.28","91.73","G/ADP/N/180/USA",10,10,1,-7,0,1,2.411169113,0.458951894,27.90826157,67.98414918,1,48070.38469,2651.260119,1.45e+13,3.49e+12,11.50321471,38.39804741,1.130169679,10.76971034,"7/5/07",2007-07-05,2007-07-05,NA,NA,2008-01-31,1.47e+13,4.52e+12,12.5208046,34.9816182,29.88729849,62.24882112,48407.07691,3413.588648,1.220378431,10.7315685,"United States of America",1995-01-01,"China ",2001-12-11,1,1,NA,NA,"United States of America",1948-01-01,1,NA,-7,0,10,10,1,0,"Q4_2013","USA","DS-379","Definitive Anti-Dumping and Countervailing Duties on Certain Products from China","China",2008,"2007",2007,1,2008,1,"",NA,0
"187",66,"USA-AD-1118",2,"2008",710,2007,710,2,"Q4_2012","USA","USA-AD-1118","China","CHN","Light-Walled Rectangular Pipe and Tube","7/3/07","1/30/08","8/28/07","A","A","1/30/08","AVD","6/24/08","8/4/08","A","A","8/5/08","AVD","IF","IF","AVD","249.12","264.64","G/ADP/N/180/USA",10,10,1,-7,0,1,2.411169113,0.458951894,27.90826157,67.98414918,1,48070.38469,2651.260119,1.45e+13,3.49e+12,11.50321471,38.39804741,1.130169679,10.76971034,"7/3/07",2007-07-03,2007-07-03,NA,NA,2008-01-30,1.47e+13,4.52e+12,12.5208046,34.9816182,29.88729849,62.24882112,48407.07691,3413.588648,1.220378431,10.7315685,"United States of America",1995-01-01,"China ",2001-12-11,1,1,NA,NA,"United States of America",1948-01-01,1,NA,-7,0,10,10,1,0,"Q4_2013","USA","DS-379","Definitive Anti-Dumping and Countervailing Duties on Certain Products from China","China",2008,"2007",2007,1,2008,1,"",NA,0
"188",66,"USA-AD-1117",2,"2008",710,2007,710,2,"Q4_2012","USA","USA-AD-1117","China","CHN","Certain New Pneumatic Off-The-Road Tires","6/22/07","2/20/08","9/4/07","A","A","2/20/08","AVD","7/15/08","8/29/08","A","A","9/4/08","AVD","IF","IF","AVD","0","210.48","G/ADP/N/180/USA",10,10,1,-7,0,1,2.411169113,0.458951894,27.90826157,67.98414918,1,48070.38469,2651.260119,1.45e+13,3.49e+12,11.50321471,38.39804741,1.130169679,10.76971034,"6/22/07",2007-06-22,2007-06-22,NA,NA,2008-02-20,1.47e+13,4.52e+12,12.5208046,34.9816182,29.88729849,62.24882112,48407.07691,3413.588648,1.220378431,10.7315685,"United States of America",1995-01-01,"China ",2001-12-11,1,1,NA,NA,"United States of America",1948-01-01,1,NA,-7,0,10,10,1,0,"Q4_2013","USA","DS-379","Definitive Anti-Dumping and Countervailing Duties on Certain Products from China","China",2008,"2007",2007,1,2008,1,"",NA,0
"189",67,"USA-AD-1089",2,"2005",140,2005,140,2,"Q4_2012","USA","USA-AD-1089","Brazil","BRA","Orange Juice","1/4/05","8/24/05","4/20/05","A","A","8/24/05","AVD","1/13/06","3/3/06","A","A","3/9/06","AVD","4/20/12","2012","DPU ","12.46","60.29","G/ADP/N/145/USA",10,10,1,8,1,1,2.530182767,3.827514837,25.47841227,26.64834858,1,44313.58524,4739.305437,1.31e+13,8.82e+11,10.00656719,15.12835081,1.212483968,5.708390758,"1/4/05",2005-01-04,2005-01-04,NA,NA,2005-08-24,1.31e+13,8.82e+11,10.00656719,15.12835081,25.47841227,26.64834858,44313.58524,4739.305437,1.212483968,5.708390758,"United States of America",1995-01-01,"Brazil ",1995-01-01,1,1,"Brazil",1948-07-30,"United States of America",1948-01-01,1,1,8,8,10,10,1,1,"Q4_2013","USA","DS-382","Anti-Dumping Administrative Reviews and Other Measures Related to Imports of Certain Orange Juice from Brazil","Brazil",2008,"2005",2008,1,2006,1,"03/07/1997",1997-03-07,1
"190",68,"USA-AD-1045",2,"2004",800,2003,800,2,"Q4_2012","USA","USA-AD-1043","Thailand","THA","Polyethylene Retail Carrier Bags","6/27/03","1/26/04","8/11/03","A","A","1/26/04","AVD","6/18/04","8/6/04","A","A","8/9/04","AVD","IF","IF","AVD","2.26","122.88","G/ADP/N/126/USA",10,10,1,9,1,1,2.620249571,4.657728892,22.47789302,124.5796569,0,39682.47225,2211.874014,1.15e+13,1.43e+11,9.063428363,65.68064287,1.197297611,10.40756458,"6/27/03",2003-06-27,2003-06-27,867,887,2004-01-26,1.23e+13,1.61e+11,9.636719068,70.69704858,24.28117618,136.5376958,41928.88614,2478.817568,1.34507504,10.30604012,"United States of America",1995-01-01,"Thailand ",1995-01-01,1,1,"Thailand",1982-11-20,"United States of America",1948-01-01,1,1,9,9,10,10,1,1,"Q4_2013","USA","DS-383","Anti-Dumping Measures on Polyethylene Retail Carrier Bags from Thailand","Thailand",2008,"2003",2003,1,2004,1,"03/07/1997",1997-03-07,1
"191",69,"EUN-AD-486",994,"2000",750,1999,750,994,"Q4_2012","European Union","EUN-AD-486","India","IND","Certain Polyethylene Terephthalate (PET) ","11/6/99","8/4/00","8/4/00","A","A","8/4/00","AVD","11/30/00","11/30/00","A","A","11/30/00","PU","6/28/12","2012","SD/PU","30","51.5","G/ADP/N/72/EEC",NA,NA,1,9,1,1,1.591942935,1.418164643,64.65834607,24.38790891,1,18863.99964,455.4735407,9.19e+12,4.67e+11,32.69786017,11.25469183,2.398573448,24.50227807,"11/6/99",1999-11-06,1999-11-06,597,NA,2000-08-04,8.52e+12,4.77e+11,36.11678545,12.77323297,72.08801675,26.43729384,17468.29776,457.2835418,2.288564687,23.02185278,"European Union",1995-01-01,"India ",1995-01-01,1,1,"India",1948-07-08,NA,NA,NA,1,9,9,6,NA,1,1,"Q4_2013","EUN ","DS-385","Expiry Reviews of Anti-dumping and Countervailing Duties Imposed on Imports of PET from India","India",2008,"1999",2007,1,2000,1,"06/12/1997",1997-06-12,1
"192",70,"CHL-AD-18",155,"2008",160,2008,160,155,"Q4_2012","Chile ","CHL-AD-18","Argentina","ARG","Wheat Flour","4/25/08","MI","MI","A","A","7/7/08","AVD","MI","MI","A","A","2/7/09","AVD","1/7/10","2010","AVD","30.3","30.3","G/ADP/N/188/CHL",10,10,1,8,1,1,6.008271805,0.984658242,81.04138041,36.72246659,1,10685.9866,10232.95908,1.8e+11,4.06e+11,41.50668453,19.90643993,3.633655485,7.227886221,"4/25/08",2008-04-25,2008-04-25,NA,NA,2008-07-07,1.8e+11,4.06e+11,41.50668453,19.90643993,81.04138041,36.72246659,10685.9866,10232.95908,3.633655485,7.227886221,"Chile ",1995-01-01,"Argentina ",1995-01-01,1,1,"Argentina",1967-10-11,"Chile",1949-03-16,1,1,8,8,10,10,1,1,"Q4_2013","Chile","DS-393","Anti-Dumping Measures on Imports of Wheat Flour from Argentina","Argentina",2009,"2008",2008,1,2009,1,"07/10/1998",1998-07-10,1
"194",72,"USA-AD-791",2,"1998",732,1998,732,2,"Q4_2012","USA","USA-AD-788","South Korea","KOR","Stainless Steel Plate in Coils","4/9/98","11/4/98","5/28/98","A","A","11/4/98","AVD","3/31/99","5/12/99","A","A","5/21/99","AVD","12/1/11","2011","AVD","16.26","16.26","G/ADP/N/53/USA",10,10,1,8,1,1,2.349922309,1.10598414,22.75912907,72.9054547,1,32948.95126,8133.731245,9.09e+12,3.76e+11,10.48398631,42.35677439,1.300089704,4.636583786,"4/9/98",1998-04-09,1998-04-09,43,1905,1998-11-04,9.09e+12,3.76e+11,10.48398631,42.35677439,22.75912907,72.9054547,32948.95126,8133.731245,1.300089704,4.636583786,"United States of America",1995-01-01,"South Korea",1995-01-01,1,1,"South Korea",1967-04-14,"United States of America",1948-01-01,1,1,8,8,10,10,1,1,"Q4_2013","USA","DS-402","Use of Zeroing in Anti-Dumping Measures Involving Products from Korea","Korea",2009,"1998",1998,0,1999,1,"11/06/1997",1997-11-06,1
"195",72,"USA-AD-801",2,"1999",732,1998,732,2,"Q4_2012","USA","USA-AD-797","South Korea","KOR","Stainless Steel Sheet and Strip","6/17/98","1/4/99","8/5/98","A","A","1/4/99","AVD","6/8/99","7/28/99","A","A","7/27/99","AVD","IF","IF","AVD","MI","MI","MI",10,10,1,8,1,1,2.349922309,1.10598414,22.75912907,72.9054547,1,32948.95126,8133.731245,9.09e+12,3.76e+11,10.48398631,42.35677439,1.300089704,4.636583786,"6/17/98",1998-06-17,1998-06-17,112,1974,1999-01-04,9.67e+12,4.86e+11,10.23412686,35.77703363,23.17266209,65.43023242,34639.11984,10432.2108,1.219934045,4.75889537,"United States of America",1995-01-01,"South Korea",1995-01-01,1,1,"South Korea",1967-04-14,"United States of America",1948-01-01,1,1,8,8,10,10,1,1,"Q4_2013","USA","DS-402","Use of Zeroing in Anti-Dumping Measures Involving Products from Korea","Korea",2009,"1998",1998,0,1999,1,"11/06/1997",1997-11-06,1
"196",72,"USA-AD-1093",2,"2005",732,2005,732,2,"Q4_2012","USA","USA-AD-1092","South Korea","KOR","Diamond Sawblades and Parts Thereof","5/10/05","12/29/05","7/29/05","A","A","12/29/05","AVD","5/22/06","7/11/06","A","N","11/4/09","AVD","10/28/11","2011","AVD","6.43","26.55","G/ADP/N/195/USA",10,10,1,8,1,1,2.530182767,0.800996405,25.47841227,71.18429245,1,44313.58524,18657.46113,1.31e+13,8.98e+11,10.00656719,36.80965361,1.212483968,3.147437074,"5/10/05",2005-05-10,2005-05-10,NA,NA,2005-12-29,1.31e+13,8.98e+11,10.00656719,36.80965361,25.47841227,71.18429245,44313.58524,18657.46113,1.212483968,3.147437074,"United States of America",1995-01-01,"South Korea",1995-01-01,1,1,"South Korea",1967-04-14,"United States of America",1948-01-01,1,1,8,8,10,10,1,1,"Q4_2013","USA","DS-402","Use of Zeroing in Anti-Dumping Measures Involving Products from Korea","Korea",2009,"2005",2005,1,2009,1,"11/06/1997",1997-11-06,1
"201",74,"EUN-AD-622",994,"2006",710,2005,710,994,"Q4_2012","European Union","EUN-AD-622","China","CHN","Certain Footwear with Uppers of Leather ","7/7/05","6/4/06","6/4/06","A","A","6/4/06","AVD","10/6/06","10/6/06","A","A","10/6/06","AVD","3/16/11","2011","AVD","9.7","28.9","G/ADP/N/153/EEC",NA,NA,1,-7,0,1,1.361857737,0.522731473,73.30833573,68.61870494,1,27909.03457,1731.125235,1.39e+13,2.26e+12,37.04369782,37.06949052,1.769160588,12.12302312,"7/7/05",2005-07-07,2005-07-07,NA,NA,2006-06-04,1.48e+13,2.71e+12,39.39015032,39.12622529,78.25337348,70.55319578,29651.0928,2069.34363,1.661706871,11.11345205,"European Union",1995-01-01,"China ",2001-12-11,1,1,NA,NA,NA,NA,NA,NA,-7,0,6,NA,1,0,"Q4_2013","EUN ","DS-405","Anti-Dumping Measures on Certain Footwear from China","China",2010,"2005",2005,1,2006,1,"",NA,0
"202",75,"CHN-AD-164",710,"2009",994,2008,994,710,"Q4_2012","China","CHN-AD-164","European Union","EUN","Certain Iron or Steel Fasteners","12/29/08","12/23/09","12/23/09","A","A","12/28/09","AVD","6/28/10","6/28/10","A","A","6/29/10","AVD","IF","IF","AVD","6.1","26","G/ADP/N/202/CHN",-7,0,0,NA,1,1,0.434411564,1.244473311,62.24882112,81.02271452,1,3413.588648,36612.36658,4.52e+12,1.84e+13,34.9816182,40.70362268,10.7315685,1.634080761,"12/29/08",2008-12-29,2008-12-29,NA,NA,2009-12-28,4.99e+12,1.64e+13,26.71609478,36.38564241,49.0212234,71.79250782,3748.504063,32598.4594,10.3331503,1.471584494,"China ",2001-12-11,"European Union",1995-01-01,1,1,NA,NA,NA,NA,NA,NA,6,NA,-7,0,0,1,"Q4_2013","China","DS-407","Provisional Anti-Dumping Duties on Certain Iron and Steel Fasteners from the European Union","EUN",2010,"2008",2008,1,2010,1,"09/10/1997",1997-09-10,1
"203",76,"ARG-AD-279",160,"2009",135,2008,135,160,"Q4_2012","Argentina","ARG-AD-278","Peru","PER","Zippers","5/5/08","10/24/08","10/24/08","A","A","1/15/09","AVD","8/21/09","8/21/09","A","A","10/1/09","AVD","IF","IF","AVD","23.61","77.24","G/ADP/N/195/ARG",8,8,1,9,1,1,0.984658242,1.387119344,36.72246659,56.5534582,0,10232.95908,4240.352266,4.06e+11,1.21e+11,19.90643993,28.43736274,7.227886221,7.734000105,"5/5/08",2008-05-05,2008-05-05,NA,NA,2009-01-15,3.78e+11,1.21e+11,17.39562781,25.18537795,30.56244596,46.4174873,9456.816314,4188.921339,6.234805307,7.887719041,"Argentina ",1995-01-01,"Peru ",1995-01-01,1,1,"Peru",1951-10-07,"Argentina",1967-10-11,1,1,9,9,8,8,1,1,"Q4_2013","Argentina ","DS-410","Anti-Dumping Duties on Fasteners and Chains from Peru","Peru",2010,"2008",2008,1,2009,1,"10/03/1997",1997-10-03,1
"204",77,"CHN-AD-173",710,"2009",2,2009,2,710,"Q4_2012","China","CHN-AD-173","USA","USA","Grain Oriented Flat-rolled Electrical Steel","6/1/09","12/10/09","12/10/09","A","A","12/11/09","AVD","4/10/10","4/10/10","A","A","4/11/10","AVD","IF","IF","AVD","7.8","64.8","G/ADP/N/202/CHN",-7,0,0,10,1,1,0.448398182,2.312438916,49.0212234,24.69014212,1,3748.504063,46998.82042,4.99e+12,1.44e+13,26.71609478,10.9849562,10.3331503,1.11946068,"6/1/09",2009-06-01,2009-06-01,NA,NA,2009-12-11,4.99e+12,1.44e+13,26.71609478,10.9849562,49.0212234,24.69014212,3748.504063,46998.82042,10.3331503,1.11946068,"China ",2001-12-11,"United States of America",1995-01-01,1,1,"United States of America",1948-01-01,NA,NA,NA,1,10,10,-7,0,0,1,"Q4_2013","China","DS-414","Countervailing and Anti-Dumping Duties on Grain Oriented Flat-rolled Electrical Steel from the United States","USA",2010,"2009",2009,1,2010,1,"09/10/1997",1997-09-10,1
"206",79,"USA-AD-1064",2,"2004",710,2004,710,2,"Q4_2012","USA","USA-AD-1063","China","CHN","Certain Frozen and Canned Warmwater Shrimp and Prawns","1/8/04","7/16/04","3/2/04","A","A","7/16/04","AVD","12/8/04","1/27/05","A","P","2/1/05","AVD","IF","IF","AVD","0.07","112.81","G/ADP/N/132/USA",10,10,1,-7,0,1,2.645168965,0.539893236,24.28117618,65.51084195,0,41928.88614,1490.380055,1.23e+13,1.93e+12,9.636719068,34.08005361,1.34507504,13.39314276,"1/8/04",2004-01-08,2004-01-08,299,1082,2004-07-16,1.23e+13,1.93e+12,9.636719068,34.08005361,24.28117618,65.51084195,41928.88614,1490.380055,1.34507504,13.39314276,"United States of America",1995-01-01,"China ",2001-12-11,1,1,NA,NA,"United States of America",1948-01-01,1,NA,-7,0,10,10,1,0,"Q4_2013","USA","DS-422","Anti-Dumping Measures on Certain Frozen Warmwater Shrimp from China","China",2011,"2004",2004,1,2005,1,"09/09/1997",1997-09-09,1
"207",80,"USA-AD-799",2,"1999",325,1998,325,2,"Q4_2012","USA","USA-AD-797","Italy","ITA","Stainless Steel Sheet and Strip","6/17/98","1/4/99","8/5/98","A","A","1/4/99","AVD","6/8/99","7/28/99","A","A","7/27/99","AVD","8/10/11","2011","AVD","MI","MI","MI",10,10,1,10,1,1,2.349922309,0.634332938,22.75912907,47.08565282,1,32948.95126,21519.06412,9.09e+12,1.22e+12,10.48398631,25.15430622,1.300089704,3.098162293,"6/17/98",1998-06-17,1998-06-17,760,1974,1999-01-04,9.67e+12,1.21e+12,10.23412686,24.27992645,23.17266209,46.64130468,34639.11984,21227.31087,1.219934045,3.027755412,"United States of America",1995-01-01,"Italy ",1995-01-01,1,1,"Italy",1950-05-30,"United States of America",1948-01-01,1,1,10,10,10,10,1,1,"Q4_2013","USA","DS-424","Anti-Dumping Measures on Imports of Stainless Steel Sheet and Strip in Coils from Italy","EUN",2011,"1998",1999,0,1999,1,"",NA,0
"208",81,"CHN-AD-180",710,"2010",994,2009,994,710,"Q4_2012","China","CHN-AD-180","European Union","EUN","X-Ray Security Inspection Equipment","10/23/09","6/9/10","6/9/10","A","A","6/10/10","AVD","1/23/11","1/23/11","A","A","1/23/11","AVD","IF","IF","AVD","33.5","71.8","G/ADP/N/216/CHN",-7,0,0,NA,1,1,0.448398182,1.305923646,49.0212234,71.79250782,1,3748.504063,32598.4594,4.99e+12,1.64e+13,26.71609478,36.38564241,10.3331503,1.471584494,"10/23/09",2009-10-23,2009-10-23,NA,NA,2010-06-10,5.93e+12,1.63e+13,29.396777,40.19162968,55.03337471,79.50970156,4433.340886,32380.82708,10.09522,1.587467526,"China ",2001-12-11,"European Union",1995-01-01,1,1,NA,NA,NA,NA,NA,NA,6,NA,-7,0,0,1,"Q4_2013","China","DS-425","Definitive Anti-Dumping Duties on X-Ray Security Inspection Equipment from the European Union","EUN",2011,"2009",2009,1,2011,1,"",NA,0
"209",82,"CHN-AD-179",710,"2010",2,2009,2,710,"Q4_2012","China","CHN-AD-179","USA","USA","Broiler Products or Chicken Products","9/27/09","2/5/10","2/5/10","A","A","2/13/10","AVD","9/26/10","9/26/10","A","A","9/27/10","AVD","IF","IF","AVD","50.3","105.4","G/ADP/N/209/CHN",-7,0,0,10,1,1,0.448398182,2.312438916,49.0212234,24.69014212,1,3748.504063,46998.82042,4.99e+12,1.44e+13,26.71609478,10.9849562,10.3331503,1.11946068,"9/27/09",2009-09-27,2009-09-27,NA,NA,2010-02-13,5.93e+12,1.5e+13,29.396777,12.32426145,55.03337471,28.11482588,4433.340886,48357.67357,10.09522,1.192126008,"China ",2001-12-11,"United States of America",1995-01-01,1,1,"United States of America",1948-01-01,NA,NA,NA,1,10,10,-7,0,0,1,"Q4_2013","China","DS-427","Anti-Dumping and Countervailing Duty Measures on Broiler Products from the United States","USA",2011,"2009",2009,1,2010,1,"01/09/1998",1998-01-09,1
"213",84,"ZAF-AD-290",560,"2012",140,2011,140,560,"Q4_2012","South Africa","ZAF-AD-290","Brazil","BRA","Frozen Meat of Fowls of the Species Gallus Domesticus (whole bird and boneless cuts)","6/24/11","1/30/12","1/30/12","A","A","2/10/12","AVD","MI","MI","MI","MI","MI","MI","MI","MI","MI","MI","MI","MI",9,9,1,8,1,1,2.079551962,3.53217088,60.77947851,24.5117143,1,7830.505168,12576.19559,4.04e+11,2.48e+12,30.60592008,11.88916767,2.474505053,5.456271013,"6/24/11",2011-06-24,2011-06-24,NA,NA,2012-02-10,3.82e+11,2.25e+12,29.92032444,12.58720783,61.7601259,26.62092387,7313.974916,11319.97371,2.518135733,5.319042412,"South Africa",1995-01-01,"Brazil ",1995-01-01,1,1,"Brazil",1948-07-30,"South Africa",1948-06-13,1,1,8,8,9,9,1,1,"Q4_2013","South Africa ","DS-439","Anti-Dumping Duties on Frozen Meat of Fowls from Brazil","Brazil",2012,"2011",2011,1,NA,1,"09/10/1997",1997-09-10,1
"215",86,"EUN-AD-717",994,"2011",850,2010,850,994,"Q4_2012","European Union","EUN-AD-716","Indonesia","IDN","Certain Fatty Alcohols and their Blends","8/13/10","5/11/11","5/11/11","A","A","5/11/11","AVD","11/11/11","11/11/11","A","A","11/11/11","SD","IF","IF","SD","MI","MI","G/ADP/N/223/EEC",NA,NA,1,8,1,1,1.411250369,6.539272207,79.50970156,47.48510044,1,32380.82708,2946.656061,1.63e+13,7.09e+11,40.19162968,24.58058328,1.587467526,15.28607319,"8/13/10",2010-08-13,2010-08-13,NA,NA,2011-05-11,1.77e+13,8.46e+11,42.90363901,26.36166164,84.8037816,51.31143545,34920.11178,3469.753726,1.543159494,14.71114133,"European Union",1995-01-01,"Indonesia ",1995-01-01,1,1,"Indonesia",1950-02-24,NA,NA,NA,1,8,8,6,NA,1,1,"Q4_2013","EUN ","DS-442","Anti-Dumping Measures on Imports of Certain Fatty Alcohols from Indonesia","Indonesia",2012,"2010",2010,1,2011,1,"",NA,0
"216",87,"USA-AD-1168",2,"2010",710,2009,710,2,"Q4_2012","USA","USA-AD-1168","China","CHN","Certain Seamless Carbon and Alloy Steel Standard and Line and Pressure Pipe","9/22/09","4/28/10","11/6/09","A","A","4/28/10","AVD","9/21/10","11/10/10","A","A","11/10/10","AVD","IF","IF","AVD","50.01","98.74","G/ADP/N/209/USA",10,10,1,-7,0,1,2.312438916,0.448398182,24.69014212,49.0212234,1,46998.82042,3748.504063,1.44e+13,4.99e+12,10.9849562,26.71609478,1.11946068,10.3331503,"9/22/09",2009-09-22,2009-09-22,NA,NA,2010-04-28,1.5e+13,5.93e+12,12.32426145,29.396777,28.11482588,55.03337471,48357.67357,4433.340886,1.192126008,10.09522,"United States of America",1995-01-01,"China ",2001-12-11,1,1,NA,NA,"United States of America",1948-01-01,1,NA,-7,0,10,10,1,0,"Q4_2013","USA","DS-449","Countervailing and Anti-dumping Measures on Certain Products from China","China",2012,"2009",2009,1,2010,1,"10/03/1997",1997-10-03,1
"217",87,"USA-AD-1117",2,"2008",710,2007,710,2,"Q4_2012","USA","USA-AD-1117","China","CHN","Certain New Pneumatic Off-The-Road Tires","6/22/07","2/20/08","9/4/07","A","A","2/20/08","AVD","7/15/08","8/29/08","A","A","9/4/08","AVD","IF","IF","AVD","0","210.48","G/ADP/N/180/USA",10,10,1,-7,0,1,2.411169113,0.458951894,27.90826157,67.98414918,1,48070.38469,2651.260119,1.45e+13,3.49e+12,11.50321471,38.39804741,1.130169679,10.76971034,"6/22/07",2007-06-22,2007-06-22,NA,NA,2008-02-20,1.47e+13,4.52e+12,12.5208046,34.9816182,29.88729849,62.24882112,48407.07691,3413.588648,1.220378431,10.7315685,"United States of America",1995-01-01,"China ",2001-12-11,1,1,NA,NA,"United States of America",1948-01-01,1,NA,-7,0,10,10,1,0,"Q4_2013","USA","DS-449","Countervailing and Anti-dumping Measures on Certain Products from China","China",2012,"2007",2007,0,2008,1,"10/03/1997",1997-10-03,1
"218",87,"USA-AD-1107",2,"2007",710,2006,710,2,"Q4_2012","USA","USA-AD-1107","China","CHN","Coated Free Sheet Paper","11/6/06","6/4/07","12/29/06","A","A","6/4/07","AVD","10/25/07","12/13/07","A","N",".",".",".",".",".",".",".",".",10,10,1,-7,0,1,2.464403823,0.47626229,26.83956444,70.55319578,1,46443.8102,2069.34363,1.39e+13,2.71e+12,10.66900468,39.12622529,1.042895226,11.11345205,"11/6/06",2006-11-06,2006-11-06,NA,NA,2007-06-04,1.45e+13,3.49e+12,11.50321471,38.39804741,27.90826157,67.98414918,48070.38469,2651.260119,1.130169679,10.76971034,"United States of America",1995-01-01,"China ",2001-12-11,1,1,NA,NA,"United States of America",1948-01-01,1,NA,-7,0,10,10,1,0,"Q4_2013","USA","DS-449","Countervailing and Anti-dumping Measures on Certain Products from China","China",2012,"2006",2006,0,NA,1,"10/03/1997",1997-10-03,1
"219",87,"USA-AD-1188",2,"2011",710,2011,710,2,"Q4_2012","USA","USA-AD-1188","China","CHN","High Pressure Steel Cylinders","5/13/11","12/15/11","7/1/11","A","A","12/15/11","AVD","5/7/12","6/22/12","A","A","6/21/12","AVD","IF","IF","AVD","6.62","31.21","G/ADP/N/230/USA",10,10,1,-7,0,1,2.801760143,0.533552859,30.71366955,54.57721811,1,49854.52267,5447.309378,1.55e+13,7.32e+12,13.52598849,28.53028081,1.24542282,10.03716006,"5/13/11",2011-05-13,2011-05-13,NA,NA,2011-12-15,1.55e+13,7.32e+12,13.52598849,28.53028081,30.71366955,54.57721811,49854.52267,5447.309378,1.24542282,10.03716006,"United States of America",1995-01-01,"China ",2001-12-11,1,1,NA,NA,"United States of America",1948-01-01,1,NA,-7,0,10,10,1,0,"Q4_2013","USA","DS-449","Countervailing and Anti-dumping Measures on Certain Products from China","China",2012,"2011",2011,1,2012,1,"10/03/1997",1997-10-03,1
"220",87,"USA-AD-1195",2,"2012",710,2012,710,2,"Q4_2012","USA","USA-AD-1195","China","CHN","Utility Scale Wind Towers","1/6/12","8/2/12","2/17/12","A","A","8/2/12","AVD","12/26/12","MI","A","MI","MI","MI","MI","MI","MI","MI","MI","MI",10,10,1,-7,0,1,2.451607541,0.461590928,30.40394962,51.82489065,1,51755.21484,6092.781886,1.62e+13,8.23e+12,13.51772281,27.32111234,NA,10.08212511,"1/6/12",2012-01-06,2012-01-06,NA,NA,2012-08-02,1.62e+13,8.23e+12,13.51772281,27.32111234,30.40394962,51.82489065,51755.21484,6092.781886,NA,10.08212511,"United States of America",1995-01-01,"China ",2001-12-11,1,1,NA,NA,"United States of America",1948-01-01,1,NA,-7,0,10,10,1,0,"Q4_2013","USA","DS-449","Countervailing and Anti-dumping Measures on Certain Products from China","China",2012,"2012",2012,1,NA,1,"10/03/1997",1997-10-03,1
"221",87,"USA-AD-1169",2,"2010",710,2009,710,2,"Q4_2012","USA","USA-AD-1169","China","CHN","Certain Coated Paper Suitable for High-Quality Print Graphics Using Sheet-Fed Presses","9/30/09","5/6/10","11/23/09","A","A","5/6/10","AVD","9/27/10","11/17/10","A","A","11/17/10","AVD","IF","IF","AVD","7.62","135.84","G/ADP/N/209/USA",10,10,1,-7,0,1,2.312438916,0.448398182,24.69014212,49.0212234,1,46998.82042,3748.504063,1.44e+13,4.99e+12,10.9849562,26.71609478,1.11946068,10.3331503,"9/30/09",2009-09-30,2009-09-30,NA,NA,2010-05-06,1.5e+13,5.93e+12,12.32426145,29.396777,28.11482588,55.03337471,48357.67357,4433.340886,1.192126008,10.09522,"United States of America",1995-01-01,"China ",2001-12-11,1,1,NA,NA,"United States of America",1948-01-01,1,NA,-7,0,10,10,1,0,"Q4_2013","USA","DS-449","Countervailing and Anti-dumping Measures on Certain Products from China","China",2012,"2009",2009,1,2010,1,"10/03/1997",1997-10-03,1
"222",87,"USA-AD-1166",2,"2010",710,2009,710,2,"Q4_2012","USA","USA-AD-1166","China","CHN","Certain Magnesia Carbon Bricks","8/10/09","3/12/10","9/29/09","A","A","3/12/10","AVD","8/2/10","9/16/10","A","A","9/20/10","AVD","IF","IF","AVD","128.1","236","G/ADP/N/209/USA",10,10,1,-7,0,1,2.312438916,0.448398182,24.69014212,49.0212234,1,46998.82042,3748.504063,1.44e+13,4.99e+12,10.9849562,26.71609478,1.11946068,10.3331503,"8/10/09",2009-08-10,2009-08-10,NA,NA,2010-03-12,1.5e+13,5.93e+12,12.32426145,29.396777,28.11482588,55.03337471,48357.67357,4433.340886,1.192126008,10.09522,"United States of America",1995-01-01,"China ",2001-12-11,1,1,NA,NA,"United States of America",1948-01-01,1,NA,-7,0,10,10,1,0,"Q4_2013","USA","DS-449","Countervailing and Anti-dumping Measures on Certain Products from China","China",2012,"2009",2009,1,2010,1,"10/03/1997",1997-10-03,1
"223",87,"USA-AD-1177",2,"2010",710,2010,710,2,"Q4_2012","USA","USA-AD-1177","China","CHN","Certain Aluminum Extrusions","4/6/10","11/12/10","6/17/10","A","A","11/12/10","AVD","4/4/11","5/19/11","A","A","5/26/11","AVD","IF","IF","AVD","32.79","33.28","G/ADP/N/216/USA",10,10,1,-7,0,1,2.632230719,0.456645176,28.11482588,55.03337471,1,48357.67357,4433.340886,1.5e+13,5.93e+12,12.32426145,29.396777,1.192126008,10.09522,"4/6/10",2010-04-06,2010-04-06,NA,NA,2010-11-12,1.5e+13,5.93e+12,12.32426145,29.396777,28.11482588,55.03337471,48357.67357,4433.340886,1.192126008,10.09522,"United States of America",1995-01-01,"China ",2001-12-11,1,1,NA,NA,"United States of America",1948-01-01,1,NA,-7,0,10,10,1,0,"Q4_2013","USA","DS-449","Countervailing and Anti-dumping Measures on Certain Products from China","China",2012,"2010",2010,1,2011,1,"10/03/1997",1997-10-03,1
"224",87,"USA-AD-1179",2,"2011",710,2010,710,2,"Q4_2012","USA","USA-AD-1179","China","CHN","Multilayered Wood Flooring","10/27/10","5/26/11","12/17/10","A","A","5/26/11","AVD","10/18/11","12/7/11","A","A","12/8/11","AVD","IF","IF","AVD","0","58.84","G/ADP/N/223/USA",10,10,1,-7,0,1,2.632230719,0.456645176,28.11482588,55.03337471,1,48357.67357,4433.340886,1.5e+13,5.93e+12,12.32426145,29.396777,1.192126008,10.09522,"10/27/10",2010-10-27,2010-10-27,NA,NA,2011-05-26,1.55e+13,7.32e+12,13.52598849,28.53028081,30.71366955,54.57721811,49854.52267,5447.309378,1.24542282,10.03716006,"United States of America",1995-01-01,"China ",2001-12-11,1,1,NA,NA,"United States of America",1948-01-01,1,NA,-7,0,10,10,1,0,"Q4_2013","USA","DS-449","Countervailing and Anti-dumping Measures on Certain Products from China","China",2012,"2010",2010,1,2011,1,"10/03/1997",1997-10-03,1
"225",87,"USA-AD-1176",2,"2010",710,2010,710,2,"Q4_2012","USA","USA-AD-1176","China","CHN","Drill Pipe","1/6/10","8/18/10","3/8/10","A","A","8/18/10","AVD","1/11/11","3/3/11","A","A","3/3/11","AVD","IF","IF","AVD","69.32","429.95","G/ADP/N/216/USA",10,10,1,-7,0,1,2.632230719,0.456645176,28.11482588,55.03337471,1,48357.67357,4433.340886,1.5e+13,5.93e+12,12.32426145,29.396777,1.192126008,10.09522,"1/6/10",2010-01-06,2010-01-06,NA,NA,2010-08-18,1.5e+13,5.93e+12,12.32426145,29.396777,28.11482588,55.03337471,48357.67357,4433.340886,1.192126008,10.09522,"United States of America",1995-01-01,"China ",2001-12-11,1,1,NA,NA,"United States of America",1948-01-01,1,NA,-7,0,10,10,1,0,"Q4_2013","USA","DS-449","Countervailing and Anti-dumping Measures on Certain Products from China","China",2012,"2010",2010,1,2011,1,"10/03/1997",1997-10-03,1
"226",87,"USA-AD-1118",2,"2008",710,2007,710,2,"Q4_2012","USA","USA-AD-1118","China","CHN","Light-Walled Rectangular Pipe and Tube","7/3/07","1/30/08","8/28/07","A","A","1/30/08","AVD","6/24/08","8/4/08","A","A","8/5/08","AVD","IF","IF","AVD","249.12","264.64","G/ADP/N/180/USA",10,10,1,-7,0,1,2.411169113,0.458951894,27.90826157,67.98414918,1,48070.38469,2651.260119,1.45e+13,3.49e+12,11.50321471,38.39804741,1.130169679,10.76971034,"7/3/07",2007-07-03,2007-07-03,NA,NA,2008-01-30,1.47e+13,4.52e+12,12.5208046,34.9816182,29.88729849,62.24882112,48407.07691,3413.588648,1.220378431,10.7315685,"United States of America",1995-01-01,"China ",2001-12-11,1,1,NA,NA,"United States of America",1948-01-01,1,NA,-7,0,10,10,1,0,"Q4_2013","USA","DS-449","Countervailing and Anti-dumping Measures on Certain Products from China","China",2012,"2007",2007,0,2008,1,"10/03/1997",1997-10-03,1
"227",87,"USA-AD-1159",2,"2009",710,2009,710,2,"Q4_2012","USA","USA-AD-1159","China","CHN","Oil Country Tubular Goods","4/15/09","11/17/09","6/10/09","A","A","11/17/09","AVD","4/19/10","5/19/10","A","A","5/21/10","AVD","IF","IF","AVD","32.07","99.14","G/ADP/N/202/USA",10,10,1,-7,0,1,2.312438916,0.448398182,24.69014212,49.0212234,1,46998.82042,3748.504063,1.44e+13,4.99e+12,10.9849562,26.71609478,1.11946068,10.3331503,"4/15/09",2009-04-15,2009-04-15,NA,NA,2009-11-17,1.44e+13,4.99e+12,10.9849562,26.71609478,24.69014212,49.0212234,46998.82042,3748.504063,1.11946068,10.3331503,"United States of America",1995-01-01,"China ",2001-12-11,1,1,NA,NA,"United States of America",1948-01-01,1,NA,-7,0,10,10,1,0,"Q4_2013","USA","DS-449","Countervailing and Anti-dumping Measures on Certain Products from China","China",2012,"2009",2009,1,2010,1,"10/03/1997",1997-10-03,1
"228",87,"USA-AD-1153",2,"2009",710,2008,710,2,"Q4_2012","USA","USA-AD-1153","China","CHN","Certain Tow Behind Lawn Groomers and Certain Parts Thereof","7/1/08","1/28/09","8/21/08","A","A","1/28/09","AVD","6/19/09","7/31/09","A","A","8/3/09","AVD","IF","IF","AVD","154.72","386.28","G/ADP/N/195/USA",10,10,1,-7,0,1,2.287331158,0.434411564,29.88729849,62.24882112,1,48407.07691,3413.588648,1.47e+13,4.52e+12,12.5208046,34.9816182,1.220378431,10.7315685,"7/1/08",2008-07-01,2008-07-01,NA,NA,2009-01-28,1.44e+13,4.99e+12,10.9849562,26.71609478,24.69014212,49.0212234,46998.82042,3748.504063,1.11946068,10.3331503,"United States of America",1995-01-01,"China ",2001-12-11,1,1,NA,NA,"United States of America",1948-01-01,1,NA,-7,0,10,10,1,0,"Q4_2013","USA","DS-449","Countervailing and Anti-dumping Measures on Certain Products from China","China",2012,"2008",2008,1,2009,1,"10/03/1997",1997-10-03,1
"229",87,"USA-AD-1122",2,"2008",710,2007,710,2,"Q4_2012","USA","USA-AD-1122","China","CHN","Laminated Woven Sacks","7/5/07","1/31/08","8/17/07","A","A","1/31/08","AVD","6/24/08","8/5/08","A","A","8/7/08","AVD","IF","IF","AVD","64.28","91.73","G/ADP/N/180/USA",10,10,1,-7,0,1,2.411169113,0.458951894,27.90826157,67.98414918,1,48070.38469,2651.260119,1.45e+13,3.49e+12,11.50321471,38.39804741,1.130169679,10.76971034,"7/5/07",2007-07-05,2007-07-05,NA,NA,2008-01-31,1.47e+13,4.52e+12,12.5208046,34.9816182,29.88729849,62.24882112,48407.07691,3413.588648,1.220378431,10.7315685,"United States of America",1995-01-01,"China ",2001-12-11,1,1,NA,NA,"United States of America",1948-01-01,1,NA,-7,0,10,10,1,0,"Q4_2013","USA","DS-449","Countervailing and Anti-dumping Measures on Certain Products from China","China",2012,"2007",2007,0,2008,1,"10/03/1997",1997-10-03,1
"230",87,"USA-AD-1164",2,"2010",710,2009,710,2,"Q4_2012","USA","USA-AD-1164","China","CHN","Narrow Woven Ribbons with Woven Selvedge","7/15/09","2/18/10","9/8/09","A","A","2/18/10","AVD","7/19/10","9/1/10","A","A","9/1/10","AVD","IF","IF","AVD","123.83","247.65","G/ADP/N/209/USA",10,10,1,-7,0,1,2.312438916,0.448398182,24.69014212,49.0212234,1,46998.82042,3748.504063,1.44e+13,4.99e+12,10.9849562,26.71609478,1.11946068,10.3331503,"7/15/09",2009-07-15,2009-07-15,NA,NA,2010-02-18,1.5e+13,5.93e+12,12.32426145,29.396777,28.11482588,55.03337471,48357.67357,4433.340886,1.192126008,10.09522,"United States of America",1995-01-01,"China ",2001-12-11,1,1,NA,NA,"United States of America",1948-01-01,1,NA,-7,0,10,10,1,0,"Q4_2013","USA","DS-449","Countervailing and Anti-dumping Measures on Certain Products from China","China",2012,"2009",2009,1,2010,1,"10/03/1997",1997-10-03,1
"231",87,"USA-AD-1173",2,"2010",710,2009,710,2,"Q4_2012","USA","USA-AD-1173","China","CHN","Certain Sodium and Potassium Phosphate Salts","10/1/09","3/16/10","11/23/09","P","P","3/16/10","AVD","6/1/10","7/22/10","P","P","7/22/10","AVD","IF","IF","AVD","62.23","95.4","G/ADP/N/209/USA",10,10,1,-7,0,1,2.312438916,0.448398182,24.69014212,49.0212234,1,46998.82042,3748.504063,1.44e+13,4.99e+12,10.9849562,26.71609478,1.11946068,10.3331503,"10/1/09",2009-10-01,2009-10-01,NA,NA,2010-03-16,1.5e+13,5.93e+12,12.32426145,29.396777,28.11482588,55.03337471,48357.67357,4433.340886,1.192126008,10.09522,"United States of America",1995-01-01,"China ",2001-12-11,1,1,NA,NA,"United States of America",1948-01-01,1,NA,-7,0,10,10,1,0,"Q4_2013","USA","DS-449","Countervailing and Anti-dumping Measures on Certain Products from China","China",2012,"2009",2009,1,2010,1,"10/03/1997",1997-10-03,1
"232",87,"USA-AD-1183",2,"2011",710,2011,710,2,"Q4_2012","USA","USA-AD-1183","China","CHN","Galvanized Steel Wire","4/7/11","11/4/11","5/20/11","A","A","11/4/11","AVD","3/26/12","5/14/12","A","N",".",".",".",".",".",".",".",".",10,10,1,-7,0,1,2.801760143,0.533552859,30.71366955,54.57721811,1,49854.52267,5447.309378,1.55e+13,7.32e+12,13.52598849,28.53028081,1.24542282,10.03716006,"4/7/11",2011-04-07,2011-04-07,NA,NA,2011-11-04,1.55e+13,7.32e+12,13.52598849,28.53028081,30.71366955,54.57721811,49854.52267,5447.309378,1.24542282,10.03716006,"United States of America",1995-01-01,"China ",2001-12-11,1,1,NA,NA,"United States of America",1948-01-01,1,NA,-7,0,10,10,1,0,"Q4_2013","USA","DS-449","Countervailing and Anti-dumping Measures on Certain Products from China","China",2012,"2011",2011,1,NA,1,"10/03/1997",1997-10-03,1
"233",87,"USA-AD-1116",2,"2008",710,2007,710,2,"Q4_2012","USA","USA-AD-1116","China","CHN","Circular Welded Carbon Quality Steel Pipe","6/14/07","1/15/08","8/3/07","A","A","1/15/08","AVD","6/5/08","7/21/08","A","A","7/22/08","AVD","IF","IF","AVD","69.2","85.55","G/ADP/N/180/USA",10,10,1,-7,0,1,2.411169113,0.458951894,27.90826157,67.98414918,1,48070.38469,2651.260119,1.45e+13,3.49e+12,11.50321471,38.39804741,1.130169679,10.76971034,"6/14/07",2007-06-14,2007-06-14,NA,NA,2008-01-15,1.47e+13,4.52e+12,12.5208046,34.9816182,29.88729849,62.24882112,48407.07691,3413.588648,1.220378431,10.7315685,"United States of America",1995-01-01,"China ",2001-12-11,1,1,NA,NA,"United States of America",1948-01-01,1,NA,-7,0,10,10,1,0,"Q4_2013","USA","DS-449","Countervailing and Anti-dumping Measures on Certain Products from China","China",2012,"2007",2007,0,2008,1,"10/03/1997",1997-10-03,1
"234",87,"USA-AD-1136",2,"2008",710,2007,710,2,"Q4_2012","USA","USA-AD-1136","China","CHN","Sodium Nitrite","11/15/07","4/23/08","1/14/08","A","A","4/23/08","AVD","7/8/08","8/26/08","A","A","8/27/08","AVD","IF","IF","AVD","190.74","190.74","G/ADP/N/180/USA",10,10,1,-7,0,1,2.411169113,0.458951894,27.90826157,67.98414918,1,48070.38469,2651.260119,1.45e+13,3.49e+12,11.50321471,38.39804741,1.130169679,10.76971034,"11/15/07",2007-11-15,2007-11-15,NA,NA,2008-04-23,1.47e+13,4.52e+12,12.5208046,34.9816182,29.88729849,62.24882112,48407.07691,3413.588648,1.220378431,10.7315685,"United States of America",1995-01-01,"China ",2001-12-11,1,1,NA,NA,"United States of America",1948-01-01,1,NA,-7,0,10,10,1,0,"Q4_2013","USA","DS-449","Countervailing and Anti-dumping Measures on Certain Products from China","China",2012,"2007",2007,1,2008,1,"10/03/1997",1997-10-03,1
"235",87,"USA-AD-1144",2,"2008",710,2008,710,2,"Q4_2012","USA","USA-AD-1144","China","CHN","Circular Welded Austenitic Stainless Pressure Pipe","2/5/08","9/5/08","3/31/08","A","A","9/5/08","AVD","1/28/09","3/17/09","A","A","3/17/09","AVD","IF","IF","AVD","10.53","55.21","G/ADP/N/188/USA",10,10,1,-7,0,1,2.287331158,0.434411564,29.88729849,62.24882112,1,48407.07691,3413.588648,1.47e+13,4.52e+12,12.5208046,34.9816182,1.220378431,10.7315685,"2/5/08",2008-02-05,2008-02-05,NA,NA,2008-09-05,1.47e+13,4.52e+12,12.5208046,34.9816182,29.88729849,62.24882112,48407.07691,3413.588648,1.220378431,10.7315685,"United States of America",1995-01-01,"China ",2001-12-11,1,1,NA,NA,"United States of America",1948-01-01,1,NA,-7,0,10,10,1,0,"Q4_2013","USA","DS-449","Countervailing and Anti-dumping Measures on Certain Products from China","China",2012,"2008",2008,1,2009,1,"10/03/1997",1997-10-03,1
"236",87,"USA-AD-1182",2,"2011",710,2011,710,2,"Q4_2012","USA","USA-AD-1182","China","CHN","Certain Steel Wheels","4/5/11","11/2/11","5/20/11","A","A","11/2/11","AVD","3/23/12","5/9/12","A","N",".",".",".",".",".",".",".",".",10,10,1,-7,0,1,2.801760143,0.533552859,30.71366955,54.57721811,1,49854.52267,5447.309378,1.55e+13,7.32e+12,13.52598849,28.53028081,1.24542282,10.03716006,"4/5/11",2011-04-05,2011-04-05,NA,NA,2011-11-02,1.55e+13,7.32e+12,13.52598849,28.53028081,30.71366955,54.57721811,49854.52267,5447.309378,1.24542282,10.03716006,"United States of America",1995-01-01,"China ",2001-12-11,1,1,NA,NA,"United States of America",1948-01-01,1,NA,-7,0,10,10,1,0,"Q4_2013","USA","DS-449","Countervailing and Anti-dumping Measures on Certain Products from China","China",2012,"2011",2011,1,NA,1,"10/03/1997",1997-10-03,1
"237",87,"USA-AD-1149",2,"2008",710,2008,710,2,"Q4_2012","USA","USA-AD-1149","China","CHN","Certain Circular Welded Carbon Quality Steel Line Pipe","4/14/08","11/6/08","6/3/08","A","A","11/6/08","AVD","3/31/09","5/12/09","A","A","5/13/09","AVD","IF","IF","AVD","73.87","101.1","G/ADP/N/188/USA",10,10,1,-7,0,1,2.287331158,0.434411564,29.88729849,62.24882112,1,48407.07691,3413.588648,1.47e+13,4.52e+12,12.5208046,34.9816182,1.220378431,10.7315685,"4/14/08",2008-04-14,2008-04-14,NA,NA,2008-11-06,1.47e+13,4.52e+12,12.5208046,34.9816182,29.88729849,62.24882112,48407.07691,3413.588648,1.220378431,10.7315685,"United States of America",1995-01-01,"China ",2001-12-11,1,1,NA,NA,"United States of America",1948-01-01,1,NA,-7,0,10,10,1,0,"Q4_2013","USA","DS-449","Countervailing and Anti-dumping Measures on Certain Products from China","China",2012,"2008",2008,1,2009,1,"10/03/1997",1997-10-03,1
"238",87,"USA-AD-1129",2,"2008",710,2007,710,2,"Q4_2012","USA","USA-AD-1129","China","CHN","Raw Flexible Magnets","9/28/07","4/25/08","11/9/07","A","A","4/25/08","AVD","7/10/08","9/2/08","A","A","9/17/08","AVD","IF","IF","AVD","105","185.28","G/ADP/N/180/USA",10,10,1,-7,0,1,2.411169113,0.458951894,27.90826157,67.98414918,1,48070.38469,2651.260119,1.45e+13,3.49e+12,11.50321471,38.39804741,1.130169679,10.76971034,"9/28/07",2007-09-28,2007-09-28,NA,NA,2008-04-25,1.47e+13,4.52e+12,12.5208046,34.9816182,29.88729849,62.24882112,48407.07691,3413.588648,1.220378431,10.7315685,"United States of America",1995-01-01,"China ",2001-12-11,1,1,NA,NA,"United States of America",1948-01-01,1,NA,-7,0,10,10,1,0,"Q4_2013","USA","DS-449","Countervailing and Anti-dumping Measures on Certain Products from China","China",2012,"2007",2007,1,2008,1,"10/03/1997",1997-10-03,1
"239",87,"USA-AD-1190",2,"2012",710,2011,710,2,"Q4_2012","USA","USA-AD-1190","China","CHN","Crystalline Silicon Photovoltaic Cells and Modules","10/27/11","5/25/12","12/16/11","A","A","5/25/12","AVD","10/17/12","12/6/12","A","A","12/7/12","AVD","IF","IF","AVD","18.32","249.96","G/ADP/N/237/USA",10,10,1,-7,0,1,2.801760143,0.533552859,30.71366955,54.57721811,1,49854.52267,5447.309378,1.55e+13,7.32e+12,13.52598849,28.53028081,1.24542282,10.03716006,"10/27/11",2011-10-27,2011-10-27,NA,NA,2012-05-25,1.62e+13,8.23e+12,13.51772281,27.32111234,30.40394962,51.82489065,51755.21484,6092.781886,NA,10.08212511,"United States of America",1995-01-01,"China ",2001-12-11,1,1,NA,NA,"United States of America",1948-01-01,1,NA,-7,0,10,10,1,0,"Q4_2013","USA","DS-449","Countervailing and Anti-dumping Measures on Certain Products from China","China",2012,"2011",2011,1,2012,1,"10/03/1997",1997-10-03,1
"240",87,"USA-AD-1154",2,"2009",710,2008,710,2,"Q4_2012","USA","USA-AD-1154","China","CHN","Certain Kitchen Appliance Shelving and Racks","8/7/08","3/5/09","9/24/08","A","A","3/5/09","AVD","7/24/09","9/9/09","A","A","9/14/09","AVD","IF","IF","AVD","43.09","95.99","G/ADP/N/195/USA",10,10,1,-7,0,1,2.287331158,0.434411564,29.88729849,62.24882112,1,48407.07691,3413.588648,1.47e+13,4.52e+12,12.5208046,34.9816182,1.220378431,10.7315685,"8/7/08",2008-08-07,2008-08-07,NA,NA,2009-03-05,1.44e+13,4.99e+12,10.9849562,26.71609478,24.69014212,49.0212234,46998.82042,3748.504063,1.11946068,10.3331503,"United States of America",1995-01-01,"China ",2001-12-11,1,1,NA,NA,"United States of America",1948-01-01,1,NA,-7,0,10,10,1,0,"Q4_2013","USA","DS-449","Countervailing and Anti-dumping Measures on Certain Products from China","China",2012,"2008",2008,1,2009,1,"10/03/1997",1997-10-03,1
"241",87,"USA-AD-1152",2,"2008",710,2008,710,2,"Q4_2012","USA","USA-AD-1151","China","CHN","Citric Acid and Certain Citrate Salts","4/22/08","11/20/08","6/11/08","A","A","11/20/08","AVD","4/13/09","5/29/09","A","A","5/29/09","AVD","IF","IF","AVD","94.61","156.87","G/ADP/N/188/USA",10,10,1,-7,0,1,2.287331158,0.434411564,29.88729849,62.24882112,1,48407.07691,3413.588648,1.47e+13,4.52e+12,12.5208046,34.9816182,1.220378431,10.7315685,"4/22/08",2008-04-22,2008-04-22,NA,NA,2008-11-20,1.47e+13,4.52e+12,12.5208046,34.9816182,29.88729849,62.24882112,48407.07691,3413.588648,1.220378431,10.7315685,"United States of America",1995-01-01,"China ",2001-12-11,1,1,NA,NA,"United States of America",1948-01-01,1,NA,-7,0,10,10,1,0,"Q4_2013","USA","DS-449","Countervailing and Anti-dumping Measures on Certain Products from China","China",2012,"2008",2008,1,2009,1,"10/03/1997",1997-10-03,1
"242",87,"USA-AD-1162",2,"2010",710,2009,710,2,"Q4_2012","USA","USA-AD-1162","China","CHN","Wire Decking","6/11/09","1/12/10","7/31/09","A","A","1/12/10","AVD","6/10/10","7/30/10","A","N",".",".",".",".",".",".",".",".",10,10,1,-7,0,1,2.312438916,0.448398182,24.69014212,49.0212234,1,46998.82042,3748.504063,1.44e+13,4.99e+12,10.9849562,26.71609478,1.11946068,10.3331503,"6/11/09",2009-06-11,2009-06-11,NA,NA,2010-01-12,1.5e+13,5.93e+12,12.32426145,29.396777,28.11482588,55.03337471,48357.67357,4433.340886,1.192126008,10.09522,"United States of America",1995-01-01,"China ",2001-12-11,1,1,NA,NA,"United States of America",1948-01-01,1,NA,-7,0,10,10,1,0,"Q4_2013","USA","DS-449","Countervailing and Anti-dumping Measures on Certain Products from China","China",2012,"2009",2009,1,NA,1,"10/03/1997",1997-10-03,1
"243",87,"USA-AD-1201",2,"2012",710,2012,710,2,"Q4_2012","USA","USA-AD-1201","China","CHN","Drawn Stainless Steel Sinks","3/7/12","10/4/12","4/20/12","A","A","10/4/12","AVD","MI","MI","MI","MI","MI","MI","MI","MI","MI","MI","MI","MI",10,10,1,-7,0,1,2.451607541,0.461590928,30.40394962,51.82489065,1,51755.21484,6092.781886,1.62e+13,8.23e+12,13.51772281,27.32111234,NA,10.08212511,"3/7/12",2012-03-07,2012-03-07,NA,NA,2012-10-04,1.62e+13,8.23e+12,13.51772281,27.32111234,30.40394962,51.82489065,51755.21484,6092.781886,NA,10.08212511,"United States of America",1995-01-01,"China ",2001-12-11,1,1,NA,NA,"United States of America",1948-01-01,1,NA,-7,0,10,10,1,0,"Q4_2013","USA","DS-449","Countervailing and Anti-dumping Measures on Certain Products from China","China",2012,"2012",2012,1,NA,1,"10/03/1997",1997-10-03,1
"244",87,"USA-AD-1160",2,"2009",710,2009,710,2,"Q4_2012","USA","USA-AD-1160","China","CHN","Prestressed Concrete Steel Wire Strand","6/3/09","12/23/09","7/17/09","A","A","12/23/09","AVD","5/21/10","6/28/10","A","A","6/29/10","AVD","IF","IF","AVD","42.97","193.55","G/ADP/N/202/USA",10,10,1,-7,0,1,2.312438916,0.448398182,24.69014212,49.0212234,1,46998.82042,3748.504063,1.44e+13,4.99e+12,10.9849562,26.71609478,1.11946068,10.3331503,"6/3/09",2009-06-03,2009-06-03,NA,NA,2009-12-23,1.44e+13,4.99e+12,10.9849562,26.71609478,24.69014212,49.0212234,46998.82042,3748.504063,1.11946068,10.3331503,"United States of America",1995-01-01,"China ",2001-12-11,1,1,NA,NA,"United States of America",1948-01-01,1,NA,-7,0,10,10,1,0,"Q4_2013","USA","DS-449","Countervailing and Anti-dumping Measures on Certain Products from China","China",2012,"2009",2009,1,2010,1,"10/03/1997",1997-10-03,1
"245",87,"USA-AD-1161",2,"2010",710,2009,710,2,"Q4_2012","USA","USA-AD-1161","China","CHN","Certain Steel Grating","6/5/09","1/6/10","7/20/09","A","A","1/6/10","AVD","6/8/10","7/19/10","A","A","7/23/10","AVD","IF","IF","AVD","136.76","145.18","G/ADP/N/209/USA",10,10,1,-7,0,1,2.312438916,0.448398182,24.69014212,49.0212234,1,46998.82042,3748.504063,1.44e+13,4.99e+12,10.9849562,26.71609478,1.11946068,10.3331503,"6/5/09",2009-06-05,2009-06-05,NA,NA,2010-01-06,1.5e+13,5.93e+12,12.32426145,29.396777,28.11482588,55.03337471,48357.67357,4433.340886,1.192126008,10.09522,"United States of America",1995-01-01,"China ",2001-12-11,1,1,NA,NA,"United States of America",1948-01-01,1,NA,-7,0,10,10,1,0,"Q4_2013","USA","DS-449","Countervailing and Anti-dumping Measures on Certain Products from China","China",2012,"2009",2009,1,2010,1,"10/03/1997",1997-10-03,1
"246",87,"USA-AD-1126",2,"2008",710,2007,710,2,"Q4_2012","USA","USA-AD-1126","China","CHN","Lightweight Thermal Paper","9/27/07","5/13/08","12/11/07","A","A","5/13/08","AVD","10/2/08","11/20/08","A","A","11/24/08","AVD","IF","IF","AVD","19.77","115.29","G/ADP/N/180/USA",10,10,1,-7,0,1,2.411169113,0.458951894,27.90826157,67.98414918,1,48070.38469,2651.260119,1.45e+13,3.49e+12,11.50321471,38.39804741,1.130169679,10.76971034,"9/27/07",2007-09-27,2007-09-27,NA,NA,2008-05-13,1.47e+13,4.52e+12,12.5208046,34.9816182,29.88729849,62.24882112,48407.07691,3413.588648,1.220378431,10.7315685,"United States of America",1995-01-01,"China ",2001-12-11,1,1,NA,NA,"United States of America",1948-01-01,1,NA,-7,0,10,10,1,0,"Q4_2013","USA","DS-449","Countervailing and Anti-dumping Measures on Certain Products from China","China",2012,"2007",2007,1,2008,1,"10/03/1997",1997-10-03,1
"247",88,"CHN-AD-190",710,"2012",740,2011,740,710,"Q4_2012","China","CHN-AD-190","Japan","JPN","Certain High-performance Stainless Steel Seamless Tubes","9/8/11","5/8/12","5/8/12","A","A","5/9/12","AVD","11/8/12","11/8/12","A","A","11/9/12","AVD","IF","IF","AVD","9.2","14.4","G/ADP/N/237/CHN",-7,0,0,10,1,1,0.533552859,0.775321395,54.57721811,31.1619424,1,5447.309378,46203.69804,7.32e+12,5.91e+12,28.53028081,15.1275549,10.03716006,1.158421513,"9/8/11",2011-09-08,2011-09-08,NA,NA,2012-05-09,8.23e+12,5.94e+12,27.32111234,14.72734752,51.82489065,31.43488784,6092.781886,46548.26964,10.08212511,1.217299715,"China ",2001-12-11,"Japan ",1995-01-01,1,1,"Japan",1955-09-10,NA,NA,NA,1,10,10,-7,0,0,1,"Q4_2013","China","DS-454","Measures Imposing Anti-Dumping Duties on High-Performance Stainless Steel Seamless Tubes (HP-SSST) from Japan","Japan",2012,"2011",2011,1,2012,1,"09/08/1998",1998-09-08,1
"248",89,"CHN-AD-191",710,"2012",994,2011,994,710,"Q4_2012","China","CHN-AD-190","European Union","EUN","Certain High-performance Stainless Steel Seamless Tubes","9/8/11","5/8/12","5/8/12","A","A","5/9/12","AVD","11/8/12","11/8/12","A","A","11/9/12","AVD","IF","IF","AVD","9.7","11.1","G/ADP/N/237/CHN",-7,0,0,NA,1,1,0.533552859,1.494439488,54.57721811,84.8037816,1,5447.309378,34920.11178,7.32e+12,1.77e+13,28.53028081,42.90363901,10.03716006,1.543159494,"9/8/11",2011-09-08,2011-09-08,NA,NA,2012-05-09,8.23e+12,1.66e+13,27.32111234,43.18278344,51.82489065,84.5969663,6092.781886,32917.01851,10.08212511,1.549223779,"China ",2001-12-11,"European Union",1995-01-01,1,1,NA,NA,NA,NA,NA,NA,6,NA,-7,0,0,1,"Q4_2013","China","DS-460","Measures Imposing Anti-Dumping Duties on High-Performance Stainless Steel Seamless Tubes (HP-SSST) from the European Union","EUN",2013,"2011",2011,1,2012,1,"11/06/1997",1997-11-06,1
"249",90,"USA-AD-1199",2,"2012",732,2012,732,2,"Q4_2012","USA","USA-AD-1199","South Korea","KOR","Large Residential Washers","1/9/12","8/3/12","2/17/12","A","A","8/3/12","AVD","12/26/12","MI","A","MI","MI","MI","MI","MI","MI","MI","MI","MI",10,10,1,8,1,1,2.451607541,1.136907577,30.40394962,109.8862207,1,51755.21484,24453.97135,1.62e+13,1.22e+12,13.51772281,56.34025057,NA,2.459145358,"1/9/12",2012-01-09,2012-01-09,NA,NA,2012-08-03,1.62e+13,1.22e+12,13.51772281,56.34025057,30.40394962,109.8862207,51755.21484,24453.97135,NA,2.459145358,"United States of America",1995-01-01,"South Korea",1995-01-01,1,1,"South Korea",1967-04-14,"United States of America",1948-01-01,1,1,8,8,10,10,1,1,"Q4_2013","USA","DS-464","Anti-dumping and Countervailing Measures on large residential washers from Korea","Korea",2013,"2012",2012,1,NA,1,"10/03/1997",1997-10-03,1
"251",92,"USA-AD-1064",2,"2004",710,2004,710,2,"Q4_2012","USA","USA-AD-1063","China","CHN","Certain Frozen and Canned Warmwater Shrimp and Prawns","1/8/04","7/16/04","3/2/04","A","A","7/16/04","AVD","12/8/04","1/27/05","A","P","2/1/05","AVD","IF","IF","AVD","0.07","112.81","G/ADP/N/132/USA",10,10,1,-7,0,1,2.645168965,0.539893236,24.28117618,65.51084195,0,41928.88614,1490.380055,1.23e+13,1.93e+12,9.636719068,34.08005361,1.34507504,13.39314276,"1/8/04",2004-01-08,2004-01-08,299,1082,2004-07-16,1.23e+13,1.93e+12,9.636719068,34.08005361,24.28117618,65.51084195,41928.88614,1490.380055,1.34507504,13.39314276,"United States of America",1995-01-01,"China ",2001-12-11,1,1,NA,NA,"United States of America",1948-01-01,1,NA,-7,0,10,10,1,0,"Q4_2013","USA","DS-471","Certain Methodologies and their Application to Anti-Dumping Proceedings Involving China","China",2013,"2004",2004,0,2005,1,"",NA,0
"252",92,"USA-AD-1092",2,"2005",710,2005,710,2,"Q4_2012","USA","USA-AD-1092","China","CHN","Diamond Sawblades and Parts Thereof","5/10/05","12/29/05","7/29/05","A","A","12/29/05","AVD","5/22/06","7/11/06","A","N","11/4/09","AVD","IF","IF","AVD","2.82","164.09","G/ADP/N/195/USA",10,10,1,-7,0,1,2.530182767,0.522731473,25.47841227,68.61870494,1,44313.58524,1731.125235,1.31e+13,2.26e+12,10.00656719,37.06949052,1.212483968,12.12302312,"5/10/05",2005-05-10,2005-05-10,NA,NA,2005-12-29,1.31e+13,2.26e+12,10.00656719,37.06949052,25.47841227,68.61870494,44313.58524,1731.125235,1.212483968,12.12302312,"United States of America",1995-01-01,"China ",2001-12-11,1,1,NA,NA,"United States of America",1948-01-01,1,NA,-7,0,10,10,1,0,"Q4_2013","USA","DS-471","Certain Methodologies and their Application to Anti-Dumping Proceedings Involving China","China",2013,"2005",2013,0,2009,1,"",NA,0
"253",92,"USA-AD-1188",2,"2011",710,2011,710,2,"Q4_2012","USA","USA-AD-1188","China","CHN","High Pressure Steel Cylinders","5/13/11","12/15/11","7/1/11","A","A","12/15/11","AVD","5/7/12","6/22/12","A","A","6/21/12","AVD","IF","IF","AVD","6.62","31.21","G/ADP/N/230/USA",10,10,1,-7,0,1,2.801760143,0.533552859,30.71366955,54.57721811,1,49854.52267,5447.309378,1.55e+13,7.32e+12,13.52598849,28.53028081,1.24542282,10.03716006,"5/13/11",2011-05-13,2011-05-13,NA,NA,2011-12-15,1.55e+13,7.32e+12,13.52598849,28.53028081,30.71366955,54.57721811,49854.52267,5447.309378,1.24542282,10.03716006,"United States of America",1995-01-01,"China ",2001-12-11,1,1,NA,NA,"United States of America",1948-01-01,1,NA,-7,0,10,10,1,0,"Q4_2013","USA","DS-471","Certain Methodologies and their Application to Anti-Dumping Proceedings Involving China","China",2013,"2011",2012,0,2012,1,"",NA,0
"254",92,"USA-AD-1092",2,"2005",710,2005,710,2,"Q4_2012","USA","USA-AD-1092","China","CHN","Diamond Sawblades and Parts Thereof","5/10/05","12/29/05","7/29/05","A","A","12/29/05","AVD","5/22/06","7/11/06","A","N","11/4/09","AVD","IF","IF","AVD","2.82","164.09","G/ADP/N/195/USA",10,10,1,-7,0,1,2.530182767,0.522731473,25.47841227,68.61870494,1,44313.58524,1731.125235,1.31e+13,2.26e+12,10.00656719,37.06949052,1.212483968,12.12302312,"5/10/05",2005-05-10,2005-05-10,NA,NA,2005-12-29,1.31e+13,2.26e+12,10.00656719,37.06949052,25.47841227,68.61870494,44313.58524,1731.125235,1.212483968,12.12302312,"United States of America",1995-01-01,"China ",2001-12-11,1,1,NA,NA,"United States of America",1948-01-01,1,NA,-7,0,10,10,1,0,"Q4_2013","USA","DS-471","Certain Methodologies and their Application to Anti-Dumping Proceedings Involving China","China",2013,"2005",2006,1,2009,1,"",NA,0
"255",92,"USA-AD-1179",2,"2011",710,2010,710,2,"Q4_2012","USA","USA-AD-1179","China","CHN","Multilayered Wood Flooring","10/27/10","5/26/11","12/17/10","A","A","5/26/11","AVD","10/18/11","12/7/11","A","A","12/8/11","AVD","IF","IF","AVD","0","58.84","G/ADP/N/223/USA",10,10,1,-7,0,1,2.632230719,0.456645176,28.11482588,55.03337471,1,48357.67357,4433.340886,1.5e+13,5.93e+12,12.32426145,29.396777,1.192126008,10.09522,"10/27/10",2010-10-27,2010-10-27,NA,NA,2011-05-26,1.55e+13,7.32e+12,13.52598849,28.53028081,30.71366955,54.57721811,49854.52267,5447.309378,1.24542282,10.03716006,"United States of America",1995-01-01,"China ",2001-12-11,1,1,NA,NA,"United States of America",1948-01-01,1,NA,-7,0,10,10,1,0,"Q4_2013","USA","DS-471","Certain Methodologies and their Application to Anti-Dumping Proceedings Involving China","China",2013,"2010",2013,0,2011,1,"",NA,0
"256",92,"USA-AD-1132",2,"2008",710,2007,710,2,"Q4_2012","USA","USA-AD-1131","China","CHN","Polyethylene Terephthalate Film/Sheet/Strip (PET Film)","10/5/07","5/5/08","11/30/07","A","A","5/5/08","AVD","9/24/08","11/6/08","A","A","11/10/08","AVD","IF","IF","AVD","3.49","76.72","G/ADP/N/180/USA",10,10,1,-7,0,1,2.411169113,0.458951894,27.90826157,67.98414918,1,48070.38469,2651.260119,1.45e+13,3.49e+12,11.50321471,38.39804741,1.130169679,10.76971034,"10/5/07",2007-10-05,2007-10-05,NA,NA,2008-05-05,1.47e+13,4.52e+12,12.5208046,34.9816182,29.88729849,62.24882112,48407.07691,3413.588648,1.220378431,10.7315685,"United States of America",1995-01-01,"China ",2001-12-11,1,1,NA,NA,"United States of America",1948-01-01,1,NA,-7,0,10,10,1,0,"Q4_2013","USA","DS-471","Certain Methodologies and their Application to Anti-Dumping Proceedings Involving China","China",2013,"2007",2008,1,2008,1,"",NA,0
"257",92,"USA-AD-1064",2,"2004",710,2004,710,2,"Q4_2012","USA","USA-AD-1063","China","CHN","Certain Frozen and Canned Warmwater Shrimp and Prawns","1/8/04","7/16/04","3/2/04","A","A","7/16/04","AVD","12/8/04","1/27/05","A","P","2/1/05","AVD","IF","IF","AVD","0.07","112.81","G/ADP/N/132/USA",10,10,1,-7,0,1,2.645168965,0.539893236,24.28117618,65.51084195,0,41928.88614,1490.380055,1.23e+13,1.93e+12,9.636719068,34.08005361,1.34507504,13.39314276,"1/8/04",2004-01-08,2004-01-08,299,1082,2004-07-16,1.23e+13,1.93e+12,9.636719068,34.08005361,24.28117618,65.51084195,41928.88614,1490.380055,1.34507504,13.39314276,"United States of America",1995-01-01,"China ",2001-12-11,1,1,NA,NA,"United States of America",1948-01-01,1,NA,-7,0,10,10,1,0,"Q4_2013","USA","DS-471","Certain Methodologies and their Application to Anti-Dumping Proceedings Involving China","China",2013,"2004",2013,0,2005,1,"",NA,0
"258",92,"USA-AD-1117",2,"2008",710,2007,710,2,"Q4_2012","USA","USA-AD-1117","China","CHN","Certain New Pneumatic Off-The-Road Tires","6/22/07","2/20/08","9/4/07","A","A","2/20/08","AVD","7/15/08","8/29/08","A","A","9/4/08","AVD","IF","IF","AVD","0","210.48","G/ADP/N/180/USA",10,10,1,-7,0,1,2.411169113,0.458951894,27.90826157,67.98414918,1,48070.38469,2651.260119,1.45e+13,3.49e+12,11.50321471,38.39804741,1.130169679,10.76971034,"6/22/07",2007-06-22,2007-06-22,NA,NA,2008-02-20,1.47e+13,4.52e+12,12.5208046,34.9816182,29.88729849,62.24882112,48407.07691,3413.588648,1.220378431,10.7315685,"United States of America",1995-01-01,"China ",2001-12-11,1,1,NA,NA,"United States of America",1948-01-01,1,NA,-7,0,10,10,1,0,"Q4_2013","USA","DS-471","Certain Methodologies and their Application to Anti-Dumping Proceedings Involving China","China",2013,"2007",2008,0,2008,1,"",NA,0
"259",92,"USA-AD-1159",2,"2009",710,2009,710,2,"Q4_2012","USA","USA-AD-1159","China","CHN","Oil Country Tubular Goods","4/15/09","11/17/09","6/10/09","A","A","11/17/09","AVD","4/19/10","5/19/10","A","A","5/21/10","AVD","IF","IF","AVD","32.07","99.14","G/ADP/N/202/USA",10,10,1,-7,0,1,2.312438916,0.448398182,24.69014212,49.0212234,1,46998.82042,3748.504063,1.44e+13,4.99e+12,10.9849562,26.71609478,1.11946068,10.3331503,"4/15/09",2009-04-15,2009-04-15,NA,NA,2009-11-17,1.44e+13,4.99e+12,10.9849562,26.71609478,24.69014212,49.0212234,46998.82042,3748.504063,1.11946068,10.3331503,"United States of America",1995-01-01,"China ",2001-12-11,1,1,NA,NA,"United States of America",1948-01-01,1,NA,-7,0,10,10,1,0,"Q4_2013","USA","DS-471","Certain Methodologies and their Application to Anti-Dumping Proceedings Involving China","China",2013,"2009",2010,0,2010,1,"",NA,0
"260",92,"USA-AD-1177",2,"2010",710,2010,710,2,"Q4_2012","USA","USA-AD-1177","China","CHN","Certain Aluminum Extrusions","4/6/10","11/12/10","6/17/10","A","A","11/12/10","AVD","4/4/11","5/19/11","A","A","5/26/11","AVD","IF","IF","AVD","32.79","33.28","G/ADP/N/216/USA",10,10,1,-7,0,1,2.632230719,0.456645176,28.11482588,55.03337471,1,48357.67357,4433.340886,1.5e+13,5.93e+12,12.32426145,29.396777,1.192126008,10.09522,"4/6/10",2010-04-06,2010-04-06,NA,NA,2010-11-12,1.5e+13,5.93e+12,12.32426145,29.396777,28.11482588,55.03337471,48357.67357,4433.340886,1.192126008,10.09522,"United States of America",1995-01-01,"China ",2001-12-11,1,1,NA,NA,"United States of America",1948-01-01,1,NA,-7,0,10,10,1,0,"Q4_2013","USA","DS-471","Certain Methodologies and their Application to Anti-Dumping Proceedings Involving China","China",2013,"2010",2013,0,2011,1,"",NA,0
"261",92,"USA-AD-1117",2,"2008",710,2007,710,2,"Q4_2012","USA","USA-AD-1117","China","CHN","Certain New Pneumatic Off-The-Road Tires","6/22/07","2/20/08","9/4/07","A","A","2/20/08","AVD","7/15/08","8/29/08","A","A","9/4/08","AVD","IF","IF","AVD","0","210.48","G/ADP/N/180/USA",10,10,1,-7,0,1,2.411169113,0.458951894,27.90826157,67.98414918,1,48070.38469,2651.260119,1.45e+13,3.49e+12,11.50321471,38.39804741,1.130169679,10.76971034,"6/22/07",2007-06-22,2007-06-22,NA,NA,2008-02-20,1.47e+13,4.52e+12,12.5208046,34.9816182,29.88729849,62.24882112,48407.07691,3413.588648,1.220378431,10.7315685,"United States of America",1995-01-01,"China ",2001-12-11,1,1,NA,NA,"United States of America",1948-01-01,1,NA,-7,0,10,10,1,0,"Q4_2013","USA","DS-471","Certain Methodologies and their Application to Anti-Dumping Proceedings Involving China","China",2013,"2007",2013,0,2008,1,"",NA,0
"262",92,"USA-AD-1058",2,"2004",710,2003,710,2,"Q4_2012","USA","USA-AD-1058","China","CHN","Wooden Bedroom Furniture","11/10/03","6/24/04","1/28/04","A","A","6/24/04","AVD","11/17/04","12/28/04","A","A","1/4/05","AVD","IF","IF","AVD","0.83","198.08","G/ADP/N/132/USA",10,10,1,-7,0,1,2.620249571,0.643643193,22.47789302,56.93216421,0,39682.47225,1273.640744,1.15e+13,1.64e+12,9.063428363,29.5575468,1.197297611,12.7973531,"11/10/03",2003-11-10,2003-11-10,240,1023,2004-06-24,1.23e+13,1.93e+12,9.636719068,34.08005361,24.28117618,65.51084195,41928.88614,1490.380055,1.34507504,13.39314276,"United States of America",1995-01-01,"China ",2001-12-11,1,1,NA,NA,"United States of America",1948-01-01,1,NA,-7,0,10,10,1,0,"Q4_2013","USA","DS-471","Certain Methodologies and their Application to Anti-Dumping Proceedings Involving China","China",2013,"2003",2013,0,2005,1,"",NA,0
"263",92,"USA-AD-1179",2,"2011",710,2010,710,2,"Q4_2012","USA","USA-AD-1179","China","CHN","Multilayered Wood Flooring","10/27/10","5/26/11","12/17/10","A","A","5/26/11","AVD","10/18/11","12/7/11","A","A","12/8/11","AVD","IF","IF","AVD","0","58.84","G/ADP/N/223/USA",10,10,1,-7,0,1,2.632230719,0.456645176,28.11482588,55.03337471,1,48357.67357,4433.340886,1.5e+13,5.93e+12,12.32426145,29.396777,1.192126008,10.09522,"10/27/10",2010-10-27,2010-10-27,NA,NA,2011-05-26,1.55e+13,7.32e+12,13.52598849,28.53028081,30.71366955,54.57721811,49854.52267,5447.309378,1.24542282,10.03716006,"United States of America",1995-01-01,"China ",2001-12-11,1,1,NA,NA,"United States of America",1948-01-01,1,NA,-7,0,10,10,1,0,"Q4_2013","USA","DS-471","Certain Methodologies and their Application to Anti-Dumping Proceedings Involving China","China",2013,"2010",2011,0,2011,1,"",NA,0
"264",92,"USA-AD-1190",2,"2012",710,2011,710,2,"Q4_2012","USA","USA-AD-1190","China","CHN","Crystalline Silicon Photovoltaic Cells and Modules","10/27/11","5/25/12","12/16/11","A","A","5/25/12","AVD","10/17/12","12/6/12","A","A","12/7/12","AVD","IF","IF","AVD","18.32","249.96","G/ADP/N/237/USA",10,10,1,-7,0,1,2.801760143,0.533552859,30.71366955,54.57721811,1,49854.52267,5447.309378,1.55e+13,7.32e+12,13.52598849,28.53028081,1.24542282,10.03716006,"10/27/11",2011-10-27,2011-10-27,NA,NA,2012-05-25,1.62e+13,8.23e+12,13.51772281,27.32111234,30.40394962,51.82489065,51755.21484,6092.781886,NA,10.08212511,"United States of America",1995-01-01,"China ",2001-12-11,1,1,NA,NA,"United States of America",1948-01-01,1,NA,-7,0,10,10,1,0,"Q4_2013","USA","DS-471","Certain Methodologies and their Application to Anti-Dumping Proceedings Involving China","China",2013,"2011",2012,0,2012,1,"",NA,0
"265",92,"USA-AD-1169",2,"2010",710,2009,710,2,"Q4_2012","USA","USA-AD-1169","China","CHN","Certain Coated Paper Suitable for High-Quality Print Graphics Using Sheet-Fed Presses","9/30/09","5/6/10","11/23/09","A","A","5/6/10","AVD","9/27/10","11/17/10","A","A","11/17/10","AVD","IF","IF","AVD","7.62","135.84","G/ADP/N/209/USA",10,10,1,-7,0,1,2.312438916,0.448398182,24.69014212,49.0212234,1,46998.82042,3748.504063,1.44e+13,4.99e+12,10.9849562,26.71609478,1.11946068,10.3331503,"9/30/09",2009-09-30,2009-09-30,NA,NA,2010-05-06,1.5e+13,5.93e+12,12.32426145,29.396777,28.11482588,55.03337471,48357.67357,4433.340886,1.192126008,10.09522,"United States of America",1995-01-01,"China ",2001-12-11,1,1,NA,NA,"United States of America",1948-01-01,1,NA,-7,0,10,10,1,0,"Q4_2013","USA","DS-471","Certain Methodologies and their Application to Anti-Dumping Proceedings Involving China","China",2013,"2009",2010,0,2010,1,"",NA,0
"266",92,"USA-AD-1177",2,"2010",710,2010,710,2,"Q4_2012","USA","USA-AD-1177","China","CHN","Certain Aluminum Extrusions","4/6/10","11/12/10","6/17/10","A","A","11/12/10","AVD","4/4/11","5/19/11","A","A","5/26/11","AVD","IF","IF","AVD","32.79","33.28","G/ADP/N/216/USA",10,10,1,-7,0,1,2.632230719,0.456645176,28.11482588,55.03337471,1,48357.67357,4433.340886,1.5e+13,5.93e+12,12.32426145,29.396777,1.192126008,10.09522,"4/6/10",2010-04-06,2010-04-06,NA,NA,2010-11-12,1.5e+13,5.93e+12,12.32426145,29.396777,28.11482588,55.03337471,48357.67357,4433.340886,1.192126008,10.09522,"United States of America",1995-01-01,"China ",2001-12-11,1,1,NA,NA,"United States of America",1948-01-01,1,NA,-7,0,10,10,1,0,"Q4_2013","USA","DS-471","Certain Methodologies and their Application to Anti-Dumping Proceedings Involving China","China",2013,"2010",2011,0,2011,1,"",NA,0
"267",92,"USA-AD-1164",2,"2010",710,2009,710,2,"Q4_2012","USA","USA-AD-1164","China","CHN","Narrow Woven Ribbons with Woven Selvedge","7/15/09","2/18/10","9/8/09","A","A","2/18/10","AVD","7/19/10","9/1/10","A","A","9/1/10","AVD","IF","IF","AVD","123.83","247.65","G/ADP/N/209/USA",10,10,1,-7,0,1,2.312438916,0.448398182,24.69014212,49.0212234,1,46998.82042,3748.504063,1.44e+13,4.99e+12,10.9849562,26.71609478,1.11946068,10.3331503,"7/15/09",2009-07-15,2009-07-15,NA,NA,2010-02-18,1.5e+13,5.93e+12,12.32426145,29.396777,28.11482588,55.03337471,48357.67357,4433.340886,1.192126008,10.09522,"United States of America",1995-01-01,"China ",2001-12-11,1,1,NA,NA,"United States of America",1948-01-01,1,NA,-7,0,10,10,1,0,"Q4_2013","USA","DS-471","Certain Methodologies and their Application to Anti-Dumping Proceedings Involving China","China",2013,"2009",2010,0,2010,1,"",NA,0
"268",92,"USA-AD-1132",2,"2008",710,2007,710,2,"Q4_2012","USA","USA-AD-1131","China","CHN","Polyethylene Terephthalate Film/Sheet/Strip (PET Film)","10/5/07","5/5/08","11/30/07","A","A","5/5/08","AVD","9/24/08","11/6/08","A","A","11/10/08","AVD","IF","IF","AVD","3.49","76.72","G/ADP/N/180/USA",10,10,1,-7,0,1,2.411169113,0.458951894,27.90826157,67.98414918,1,48070.38469,2651.260119,1.45e+13,3.49e+12,11.50321471,38.39804741,1.130169679,10.76971034,"10/5/07",2007-10-05,2007-10-05,NA,NA,2008-05-05,1.47e+13,4.52e+12,12.5208046,34.9816182,29.88729849,62.24882112,48407.07691,3413.588648,1.220378431,10.7315685,"United States of America",1995-01-01,"China ",2001-12-11,1,1,NA,NA,"United States of America",1948-01-01,1,NA,-7,0,10,10,1,0,"Q4_2013","USA","DS-471","Certain Methodologies and their Application to Anti-Dumping Proceedings Involving China","China",2013,"2007",2013,0,2008,1,"",NA,0
"269",92,"USA-AD-1159",2,"2009",710,2009,710,2,"Q4_2012","USA","USA-AD-1159","China","CHN","Oil Country Tubular Goods","4/15/09","11/17/09","6/10/09","A","A","11/17/09","AVD","4/19/10","5/19/10","A","A","5/21/10","AVD","IF","IF","AVD","32.07","99.14","G/ADP/N/202/USA",10,10,1,-7,0,1,2.312438916,0.448398182,24.69014212,49.0212234,1,46998.82042,3748.504063,1.44e+13,4.99e+12,10.9849562,26.71609478,1.11946068,10.3331503,"4/15/09",2009-04-15,2009-04-15,NA,NA,2009-11-17,1.44e+13,4.99e+12,10.9849562,26.71609478,24.69014212,49.0212234,46998.82042,3748.504063,1.11946068,10.3331503,"United States of America",1995-01-01,"China ",2001-12-11,1,1,NA,NA,"United States of America",1948-01-01,1,NA,-7,0,10,10,1,0,"Q4_2013","USA","DS-471","Certain Methodologies and their Application to Anti-Dumping Proceedings Involving China","China",2013,"2009",2012,0,2010,1,"",NA,0
"270",92,"USA-AD-1043",2,"2004",710,2003,710,2,"Q4_2012","USA","USA-AD-1043","China","CHN","Polyethylene Retail Carrier Bags","6/27/03","1/26/04","8/11/03","A","A","1/26/04","AVD","6/18/04","8/6/04","A","A","8/9/04","AVD","IF","IF","AVD","19.79","77.57","G/ADP/N/126/USA",10,10,1,-7,0,1,2.620249571,0.643643193,22.47789302,56.93216421,0,39682.47225,1273.640744,1.15e+13,1.64e+12,9.063428363,29.5575468,1.197297611,12.7973531,"6/27/03",2003-06-27,2003-06-27,104,887,2004-01-26,1.23e+13,1.93e+12,9.636719068,34.08005361,24.28117618,65.51084195,41928.88614,1490.380055,1.34507504,13.39314276,"United States of America",1995-01-01,"China ",2001-12-11,1,1,NA,NA,"United States of America",1948-01-01,1,NA,-7,0,10,10,1,0,"Q4_2013","USA","DS-471","Certain Methodologies and their Application to Anti-Dumping Proceedings Involving China","China",2013,"2003",2004,1,2004,1,"",NA,0
"271",92,"USA-AD-1043",2,"2004",710,2003,710,2,"Q4_2012","USA","USA-AD-1043","China","CHN","Polyethylene Retail Carrier Bags","6/27/03","1/26/04","8/11/03","A","A","1/26/04","AVD","6/18/04","8/6/04","A","A","8/9/04","AVD","IF","IF","AVD","19.79","77.57","G/ADP/N/126/USA",10,10,1,-7,0,1,2.620249571,0.643643193,22.47789302,56.93216421,0,39682.47225,1273.640744,1.15e+13,1.64e+12,9.063428363,29.5575468,1.197297611,12.7973531,"6/27/03",2003-06-27,2003-06-27,104,887,2004-01-26,1.23e+13,1.93e+12,9.636719068,34.08005361,24.28117618,65.51084195,41928.88614,1490.380055,1.34507504,13.39314276,"United States of America",1995-01-01,"China ",2001-12-11,1,1,NA,NA,"United States of America",1948-01-01,1,NA,-7,0,10,10,1,0,"Q4_2013","USA","DS-471","Certain Methodologies and their Application to Anti-Dumping Proceedings Involving China","China",2013,"2003",2009,0,2004,1,"",NA,0
"272",92,"USA-AD-1164",2,"2010",710,2009,710,2,"Q4_2012","USA","USA-AD-1164","China","CHN","Narrow Woven Ribbons with Woven Selvedge","7/15/09","2/18/10","9/8/09","A","A","2/18/10","AVD","7/19/10","9/1/10","A","A","9/1/10","AVD","IF","IF","AVD","123.83","247.65","G/ADP/N/209/USA",10,10,1,-7,0,1,2.312438916,0.448398182,24.69014212,49.0212234,1,46998.82042,3748.504063,1.44e+13,4.99e+12,10.9849562,26.71609478,1.11946068,10.3331503,"7/15/09",2009-07-15,2009-07-15,NA,NA,2010-02-18,1.5e+13,5.93e+12,12.32426145,29.396777,28.11482588,55.03337471,48357.67357,4433.340886,1.192126008,10.09522,"United States of America",1995-01-01,"China ",2001-12-11,1,1,NA,NA,"United States of America",1948-01-01,1,NA,-7,0,10,10,1,0,"Q4_2013","USA","DS-471","Certain Methodologies and their Application to Anti-Dumping Proceedings Involving China","China",2013,"2009",2013,0,2010,1,"",NA,0
"273",92,"USA-AD-1058",2,"2004",710,2003,710,2,"Q4_2012","USA","USA-AD-1058","China","CHN","Wooden Bedroom Furniture","11/10/03","6/24/04","1/28/04","A","A","6/24/04","AVD","11/17/04","12/28/04","A","A","1/4/05","AVD","IF","IF","AVD","0.83","198.08","G/ADP/N/132/USA",10,10,1,-7,0,1,2.620249571,0.643643193,22.47789302,56.93216421,0,39682.47225,1273.640744,1.15e+13,1.64e+12,9.063428363,29.5575468,1.197297611,12.7973531,"11/10/03",2003-11-10,2003-11-10,240,1023,2004-06-24,1.23e+13,1.93e+12,9.636719068,34.08005361,24.28117618,65.51084195,41928.88614,1490.380055,1.34507504,13.39314276,"United States of America",1995-01-01,"China ",2001-12-11,1,1,NA,NA,"United States of America",1948-01-01,1,NA,-7,0,10,10,1,0,"Q4_2013","USA","DS-471","Certain Methodologies and their Application to Anti-Dumping Proceedings Involving China","China",2013,"2003",2004,1,2005,1,"",NA,0
"287",NA,"ARG-AD-107",160,"1997",140,1996,140,160,"Q4_2012","Argentina","ARG-AD-107","Brazil","BRA","Gas Carafe","4/19/96","8/7/96","8/7/96","A","A","4/14/97",".","5/26/97","5/26/97","A","A","1/26/98","DPU","MI","2002","DPU","MI","MI","G/ADP/N/41/ARG",7,7,1,8,1,1,3.812542737,3.703488109,17.75390254,14.93284674,1,9348.6424,5107.79392,3.3e+11,8.4e+11,8.608956961,6.566741512,5.082520723,5.513690332,"4/19/96",1996-04-19,1996-04-19,474,2842,1997-04-14,3.55e+11,8.71e+11,8.718137771,6.820657469,19.26442562,15.84107706,9939.753275,5219.098144,4.81158208,5.396392373,"Argentina ",1995-01-01,"Brazil ",1995-01-01,1,1,"Brazil",1948-07-30,"Argentina",1967-10-11,1,1,8,8,7,7,1,1,NA,NA,NA,NA,NA,NA,NA,NA,NA,1998,0,NA,NA,0
"294",NA,"ARG-AD-113",160,"1997",140,1996,140,160,"Q4_2012","Argentina","ARG-AD-113","Brazil","BRA","Cement Bags","5/23/96","10/22/96","10/22/96","A","A","5/20/97","DPU","8/19/97","8/19/97","A","N",".",".",".",".",".",".",".",".",7,7,1,8,1,1,3.812542737,3.703488109,17.75390254,14.93284674,1,9348.6424,5107.79392,3.3e+11,8.4e+11,8.608956961,6.566741512,5.082520723,5.513690332,"5/23/96",1996-05-23,1996-05-23,508,2876,1997-05-20,3.55e+11,8.71e+11,8.718137771,6.820657469,19.26442562,15.84107706,9939.753275,5219.098144,4.81158208,5.396392373,"Argentina ",1995-01-01,"Brazil ",1995-01-01,1,1,"Brazil",1948-07-30,"Argentina",1967-10-11,1,1,8,8,7,7,1,1,NA,NA,NA,NA,NA,NA,NA,NA,NA,NA,0,NA,NA,0
"295",NA,"ARG-AD-114",160,"1997",560,1996,560,160,"Q4_2012","Argentina","ARG-AD-113","South Africa","ZAF","Cement Bags","5/23/96","10/22/96","10/22/96","A","A","5/20/97","DPU","8/19/97","8/19/97","A","N",".",".",".",".",".",".",".",".",7,7,1,9,1,1,3.812542737,3.648610553,17.75390254,47.92524681,0,9348.6424,3593.277596,3.3e+11,1.44e+11,8.608956961,24.72934694,5.082520723,4.194740453,"5/23/96",1996-05-23,1996-05-23,744,2876,1997-05-20,3.55e+11,1.49e+11,8.718137771,24.59554052,19.26442562,48.03304544,9939.753275,3636.171062,4.81158208,4.008502012,"Argentina ",1995-01-01,"South Africa",1995-01-01,1,1,"South Africa",1948-06-13,"Argentina",1967-10-11,1,1,9,9,7,7,1,1,NA,NA,NA,NA,NA,NA,NA,NA,NA,NA,0,NA,NA,0
"298",NA,"ARG-AD-117",160,"1997",325,1996,325,160,"Q4_2012","Argentina","ARG-AD-117","Italy","ITA","Gas Meters","8/27/96","2/11/97","2/11/97","A","A","10/8/97","DPU","9/3/97","9/3/97","A","N",".",".",".",".",".",".",".",".",7,7,1,10,1,1,3.812542737,0.635388117,17.75390254,44.64167892,1,9348.6424,22271.33092,3.3e+11,1.27e+12,8.608956961,24.68113975,5.082520723,3.29828126,"8/27/96",1996-08-27,1996-08-27,101,2972,1997-10-08,3.55e+11,1.2e+12,8.718137771,25.20755186,19.26442562,46.49292109,9939.753275,21069.54779,4.81158208,3.198451766,"Argentina ",1995-01-01,"Italy ",1995-01-01,1,1,"Italy",1950-05-30,"Argentina",1967-10-11,1,1,10,10,7,7,1,1,NA,NA,NA,NA,NA,NA,NA,NA,NA,NA,0,NA,NA,0
"310",NA,"ARG-AD-128",160,"1998",150,1997,150,160,"Q4_2012","Argentina","ARG-AD-128","Paraguay","PRY","Wood","3/6/97","7/28/97","7/28/97","A","A","1/8/98","DPU","4/2/98","4/2/98","A","A","1/22/99","DPU","MI","2002","DPU","MI","MI","G/ADP/N/53/ARG",7,7,1,7,1,1,2.842551758,12.80377395,19.26442562,95.93427891,0,9939.753275,1984.602205,3.55e+11,9965225497,8.718137771,48.4697551,4.81158208,17.81747075,"3/6/97",1997-03-06,1997-03-06,1299,3163,1998-01-08,3.62e+11,9024567484,8.598203206,56.28363262,19.27581739,104.6933329,10028.81193,1758.927053,4.805017302,16.71029937,"Argentina ",1995-01-01,"Paraguay ",1995-01-01,1,1,"Paraguay",1994-01-06,"Argentina",1967-10-11,1,1,6,6,7,7,1,1,NA,NA,NA,NA,NA,NA,NA,NA,NA,1999,0,NA,NA,0
"315",NA,"ARG-AD-132",160,"1998",380,1997,380,160,"Q4_2012","Argentina","ARG-AD-132","Sweden","SWE","Chain Saw Blades","8/11/97","12/9/97","12/9/97","A","A","9/11/98","DPU","7/21/98","7/21/98","A","A","5/17/99","PU","MI","2004","PU","MI","MI","G/ADP/N/53/ARG",7,7,1,10,1,1,2.842551758,5.344771338,19.26442562,76.65060518,0,9939.753275,28620.40835,3.55e+11,2.53e+11,8.718137771,42.07061813,4.81158208,2.536617332,"8/11/97",1997-08-11,1997-08-11,508,3321,1998-09-11,3.62e+11,2.55e+11,8.598203206,43.04956386,19.27581739,79.41214524,10028.81193,28779.11562,4.805017302,2.380585329,"Argentina ",1995-01-01,"Sweden ",1995-01-01,1,1,"Sweden",1950-04-30,"Argentina",1967-10-11,1,1,10,10,7,7,1,1,NA,NA,NA,NA,NA,NA,NA,NA,NA,1999,0,NA,NA,0
"316",NA,"ARG-AD-133",160,"1998",200,1997,200,160,"Q4_2012","Argentina","ARG-AD-132","United Kingdom","GBR","Chain Saw Blades","8/11/97","12/9/97","12/9/97","A","A","9/11/98","DPU","7/21/98","7/21/98","A","A","5/17/99","DPU",".",".","DPU","MI","MI","MI",7,7,1,10,1,1,2.842551758,0.689121997,19.26442562,55.99926664,1,9939.753275,23734.42186,3.55e+11,1.38e+12,8.718137771,28.33810414,4.81158208,1.208845861,"8/11/97",1997-08-11,1997-08-11,101,3321,1998-09-11,3.62e+11,1.48e+12,8.598203206,26.25155362,19.27581739,53.13777989,10028.81193,25266.39474,4.805017302,1.067465104,"Argentina ",1995-01-01,"United Kingdom",1995-01-01,1,1,"United Kingdom",1948-01-01,"Argentina",1967-10-11,1,1,10,10,7,7,1,1,NA,NA,NA,NA,NA,NA,NA,NA,NA,1999,0,NA,NA,0
"324",NA,"ARG-AD-140",160,"1999",140,1998,140,160,"Q4_2012","Argentina","ARG-AD-140","Brazil","BRA","Hot Rolled Steel","10/5/98","2/1/99","2/1/99","A","A","4/20/99","DPU","9/4/99","9/4/99","A","A","12/9/99","PU","6/6/11","2011","DPU/PU","MI","MI","G/ADP/N/59/ARG",7,7,1,8,1,1,2.114979182,3.716876352,19.27581739,15.86498597,1,10028.81193,4979.144846,3.62e+11,8.44e+11,8.598203206,6.932774825,4.805017302,5.524736835,"10/5/98",1998-10-05,1998-10-05,1373,3741,1999-04-20,3.43e+11,5.87e+11,8.112502471,9.411088649,17.65178455,20.22715514,9405.790356,3411.865896,4.104074469,5.473261496,"Argentina ",1995-01-01,"Brazil ",1995-01-01,1,1,"Brazil",1948-07-30,"Argentina",1967-10-11,1,1,8,8,8,8,1,1,NA,NA,NA,NA,NA,NA,NA,NA,NA,1999,0,NA,NA,0
"329",NA,"ARG-AD-145",160,"1999",140,1999,140,160,"Q4_2012","Argentina","ARG-AD-145","Brazil","BRA","Javelins","2/18/99","6/1/99","6/1/99","A","A","10/7/99","DPU ","1/20/00","1/20/00","A","A","6/20/00","AVD","MI","2003","AVD","38.56","38.56","G/ADP/N/65/ARG",8,8,1,8,1,1,2.100327586,4.506917669,17.65178455,20.22715514,1,9405.790356,3411.865896,3.43e+11,5.87e+11,8.112502471,9.411088649,4.104074469,5.473261496,"2/18/99",1999-02-18,1999-02-18,1509,3877,1999-10-07,3.43e+11,5.87e+11,8.112502471,9.411088649,17.65178455,20.22715514,9405.790356,3411.865896,4.104074469,5.473261496,"Argentina ",1995-01-01,"Brazil ",1995-01-01,1,1,"Brazil",1948-07-30,"Argentina",1967-10-11,1,1,8,8,8,8,1,1,NA,NA,NA,NA,NA,NA,NA,NA,NA,2000,0,NA,NA,0
"331",NA,"ARG-AD-147",160,"1999",70,1999,70,160,"Q4_2012","Argentina","ARG-AD-147","Mexico","MEX","PVC","4/21/99","8/9/99","8/9/99","A","A","10/21/99","DPU","2/16/00","2/16/00","A","A","4/24/00","DPU","MI","2004","DPU","MI","MI","G/ADP/N/65/ARG",8,8,1,6,1,1,2.100327586,0.624501262,17.65178455,51.2689011,1,9405.790356,5663.388512,3.43e+11,5.79e+11,8.112502471,25.48169145,4.104074469,3.953796773,"4/21/99",1999-04-21,1999-04-21,1602,3939,1999-10-21,3.43e+11,5.79e+11,8.112502471,25.48169145,17.65178455,51.2689011,9405.790356,5663.388512,4.104074469,3.953796773,"Argentina ",1995-01-01,"Mexico ",1995-01-01,1,1,"Mexico",1986-08-24,"Argentina",1967-10-11,1,1,6,6,8,8,1,1,NA,NA,NA,NA,NA,NA,NA,NA,NA,2000,0,NA,NA,0
"332",NA,"ARG-AD-148",160,"1999",2,1999,2,160,"Q4_2012","Argentina","ARG-AD-147","USA","USA","PVC","4/21/99","8/9/99","8/9/99","A","A","10/21/99","DPU","2/16/00","2/16/00","A","A","4/24/00","DPU","MI","2004","DPU","MI","MI","G/ADP/N/65/ARG",8,8,1,10,1,1,2.100327586,2.077063761,17.65178455,23.17266209,1,9405.790356,34639.11984,3.43e+11,9.67e+12,8.112502471,10.23412686,4.104074469,1.219934045,"4/21/99",1999-04-21,1999-04-21,2282,3939,1999-10-21,3.43e+11,9.67e+12,8.112502471,10.23412686,17.65178455,23.17266209,9405.790356,34639.11984,4.104074469,1.219934045,"Argentina ",1995-01-01,"United States of America",1995-01-01,1,1,"United States of America",1948-01-01,"Argentina",1967-10-11,1,1,10,10,8,8,1,1,NA,NA,NA,NA,NA,NA,NA,NA,NA,2000,0,NA,NA,0
"336",NA,"ARG-AD-151",160,"2000",732,1999,732,160,"Q4_2012","Argentina","ARG-AD-151","South Korea","KOR","Nylon and Polyester Fabric","6/22/99","10/7/99","10/7/99","A","A","1/20/00","DPU","5/23/00","5/23/00","A","A","6/22/00","DPU","MI","2003","DPU","MI","MI","G/ADP/N/65/ARG",8,8,1,8,1,1,2.100327586,1.002573,17.65178455,65.43023242,1,9405.790356,10432.2108,3.43e+11,4.86e+11,8.112502471,35.77703363,4.104074469,4.75889537,"6/22/99",1999-06-22,1999-06-22,482,4001,2000-01-20,3.44e+11,5.62e+11,9.069476306,35.0088675,18.67530036,67.94720274,9329.113756,11947.57725,4.310081555,4.392899263,"Argentina ",1995-01-01,"South Korea",1995-01-01,1,1,"South Korea",1967-04-14,"Argentina",1967-10-11,1,1,8,8,8,8,1,1,NA,NA,NA,NA,NA,NA,NA,NA,NA,2000,0,NA,NA,0
"338",NA,"ARG-AD-153",160,"2000",305,1999,305,160,"Q4_2012","Argentina","ARG-AD-153","Austria","AUT","Cardboard","7/29/99","11/15/99","11/15/99","A","A","2/22/00",".","5/22/00","5/22/00","A","A","11/23/00","DPU","MI","2002","DPU","MI","MI","G/ADP/N/72/ARG",8,8,1,10,1,1,2.100327586,3.13454378,17.65178455,82.92865089,0,9405.790356,26563.20954,3.43e+11,2.12e+11,8.112502471,42.05123935,4.104074469,2.007034215,"7/29/99",1999-07-29,1999-07-29,912,4038,2000-02-22,3.44e+11,1.92e+11,9.069476306,46.2095343,18.67530036,90.67175472,9329.113756,23974.18307,4.310081555,1.908853875,"Argentina ",1995-01-01,"Austria ",1995-01-01,1,1,"Austria",1951-10-19,"Argentina",1967-10-11,1,1,10,10,8,8,1,1,NA,NA,NA,NA,NA,NA,NA,NA,NA,2000,0,NA,NA,0
"340",NA,"ARG-AD-155",160,"2000",290,1999,290,160,"Q4_2012","Argentina","ARG-AD-153","Poland","POL","Cardboard","7/29/99","11/15/99","11/15/99","A","A","2/22/00",".","5/22/00","5/22/00","A","A","11/23/00","DPU","MI","2002","DPU","MI","MI","G/ADP/N/72/ARG",8,8,1,9,1,1,2.100327586,1.940295459,17.65178455,54.29510521,1,9405.790356,4340.418356,3.43e+11,1.68e+11,8.112502471,24.19151314,4.104074469,5.227642762,"7/29/99",1999-07-29,1999-07-29,1314,4038,2000-02-22,3.44e+11,1.71e+11,9.069476306,27.1243911,18.67530036,60.67078823,9329.113756,4476.797076,4.310081555,4.957839039,"Argentina ",1995-01-01,"Poland ",1995-07-01,1,1,"Poland",1967-10-18,"Argentina",1967-10-11,1,1,9,9,8,8,1,1,NA,NA,NA,NA,NA,NA,NA,NA,NA,2000,0,NA,NA,0
"342",NA,"ARG-AD-157",160,"2000",230,1999,230,160,"Q4_2012","Argentina","ARG-AD-153","Spain","ESP","Cardboard","7/29/99","11/15/99","11/15/99","A","A","2/22/00",".","5/22/00","5/22/00","A","A","11/23/00","DPU","MI","2002","DPU","MI","MI","G/ADP/N/72/ARG",8,8,1,10,1,1,2.100327586,1.224735415,17.65178455,55.21993852,1,9405.790356,15468.04987,3.43e+11,6.18e+11,8.112502471,26.68399861,4.104074469,4.291581853,"7/29/99",1999-07-29,1999-07-29,1180,4038,2000-02-22,3.44e+11,5.8e+11,9.069476306,29.05063763,18.67530036,61.23094362,9329.113756,14413.78887,4.310081555,4.226665122,"Argentina ",1995-01-01,"Spain ",1995-01-01,1,1,"Spain",1963-08-29,"Argentina",1967-10-11,1,1,10,10,8,8,1,1,NA,NA,NA,NA,NA,NA,NA,NA,NA,2000,0,NA,NA,0
"343",NA,"ARG-AD-158",160,"2000",380,1999,380,160,"Q4_2012","Argentina","ARG-AD-153","Sweden","SWE","Cardboard","7/29/99","11/15/99","11/15/99","A","A","2/22/00",".","5/22/00","5/22/00","A","A","11/23/00","DPU","MI","2002","DPU","MI","MI","G/ADP/N/72/ARG",8,8,1,10,1,1,2.100327586,1.220435618,17.65178455,79.69623381,0,9405.790356,29218.47171,3.43e+11,2.59e+11,8.112502471,43.09857601,4.104074469,2.216781691,"7/29/99",1999-07-29,1999-07-29,1225,4038,2000-02-22,3.44e+11,2.47e+11,9.069476306,46.52278336,18.67530036,86.69136819,9329.113756,27869.3776,4.310081555,2.00849582,"Argentina ",1995-01-01,"Sweden ",1995-01-01,1,1,"Sweden",1950-04-30,"Argentina",1967-10-11,1,1,10,10,8,8,1,1,NA,NA,NA,NA,NA,NA,NA,NA,NA,2000,0,NA,NA,0
"344",NA,"ARG-AD-159",160,"2000",140,1999,140,160,"Q4_2012","Argentina","ARG-AD-159","Brazil","BRA","Cold Rolled Steel","9/2/99","1/19/00","1/19/00","A","A","9/25/00","DPU","2/5/01","2/5/01","A","A","3/2/01","DPU","MI","2006","DPU/PU","MI","MI","G/ADP/N/78/ARG",8,8,1,8,1,1,2.100327586,4.506917669,17.65178455,20.22715514,1,9405.790356,3411.865896,3.43e+11,5.87e+11,8.112502471,9.411088649,4.104074469,5.473261496,"9/2/99",1999-09-02,1999-09-02,1705,4073,2000-09-25,3.44e+11,6.45e+11,9.069476306,9.978193817,18.67530036,21.71995842,9329.113756,3694.462668,4.310081555,5.602902758,"Argentina ",1995-01-01,"Brazil ",1995-01-01,1,1,"Brazil",1948-07-30,"Argentina",1967-10-11,1,1,8,8,8,8,1,1,NA,NA,NA,NA,NA,NA,NA,NA,NA,2001,0,NA,NA,0
"347",NA,"ARG-AD-161",160,"2000",70,1999,70,160,"Q4_2012","Argentina","ARG-AD-161","Mexico","MEX","Steel Sheets Blades","9/16/99","12/28/99","12/28/99","A","A","5/2/00","DPU","6/28/00","6/28/00","A","A","2/27/01","PU","MI","2004","PU","MI","MI","G/ADP/N/78/ARG",8,8,1,6,1,1,2.100327586,0.624501262,17.65178455,51.2689011,1,9405.790356,5663.388512,3.43e+11,5.79e+11,8.112502471,25.48169145,4.104074469,3.953796773,"9/16/99",1999-09-16,1999-09-16,1750,4087,2000-05-02,3.44e+11,6.84e+11,9.069476306,26.27670441,18.67530036,53.13105126,9329.113756,6581.536932,4.310081555,3.535313249,"Argentina ",1995-01-01,"Mexico ",1995-01-01,1,1,"Mexico",1986-08-24,"Argentina",1967-10-11,1,1,8,8,8,8,1,1,NA,NA,NA,NA,NA,NA,NA,NA,NA,2001,0,NA,NA,0
"348",NA,"ARG-AD-162",160,"2000",732,1999,732,160,"Q4_2012","Argentina","ARG-AD-162","South Korea","KOR","Acetate Textiles","12/2/99","3/20/00","3/20/00","A","A","11/23/00","DPU","9/21/00","9/21/00","A","A","6/1/01","DPU","MI","MI","DPU","MI","MI","G/ADP/N/78/ARG",8,8,1,8,1,1,2.100327586,1.002573,17.65178455,65.43023242,1,9405.790356,10432.2108,3.43e+11,4.86e+11,8.112502471,35.77703363,4.104074469,4.75889537,"12/2/99",1999-12-02,1999-12-02,645,4164,2000-11-23,3.44e+11,5.62e+11,9.069476306,35.0088675,18.67530036,67.94720274,9329.113756,11947.57725,4.310081555,4.392899263,"Argentina ",1995-01-01,"South Korea",1995-01-01,1,1,"South Korea",1967-04-14,"Argentina",1967-10-11,1,1,8,8,8,8,1,1,NA,NA,NA,NA,NA,NA,NA,NA,NA,2001,0,NA,NA,0
"354",NA,"ARG-AD-168",160,"2000",155,2000,155,160,"Q4_2012","Argentina","ARG-AD-168","Chile","CHL","Polystyrene Trays","2/15/00","6/16/00","6/16/00","A","A","12/11/00","DPU","7/23/01","7/23/01","A","A","8/15/01","DPU","MI","2004","DPU/PU","MI","MI","G/ADP/N/85/ARG",8,8,1,9,1,1,1.732870451,10.27490199,18.67530036,57.86519771,0,9329.113756,5133.077311,3.44e+11,79328640264,9.069476306,29.28715138,4.310081555,5.89506754,"2/15/00",2000-02-15,2000-02-15,2167,67,2000-12-11,3.44e+11,79328640264,9.069476306,29.28715138,18.67530036,57.86519771,9329.113756,5133.077311,4.310081555,5.89506754,"Argentina ",1995-01-01,"Chile ",1995-01-01,1,1,"Chile",1949-03-16,"Argentina",1967-10-11,1,1,9,9,8,8,1,1,NA,NA,NA,NA,NA,NA,NA,NA,NA,2001,0,NA,NA,0
"355",NA,"ARG-AD-169",160,"2000",230,2000,230,160,"Q4_2012","Argentina","ARG-AD-169","Spain","ESP","Steel Disks","5/2/00","9/5/00","9/5/00","A","A","12/14/00","DPU","2/15/01","2/15/01","A","A","7/30/01","DPU","MI","MI","DPU","MI","MI","G/ADP/N/85/ARG",8,8,1,10,1,1,1.732870451,1.340853167,18.67530036,61.23094362,1,9329.113756,14413.78887,3.44e+11,5.8e+11,9.069476306,29.05063763,4.310081555,4.226665122,"5/2/00",2000-05-02,2000-05-02,1458,144,2000-12-14,3.44e+11,5.8e+11,9.069476306,29.05063763,18.67530036,61.23094362,9329.113756,14413.78887,4.310081555,4.226665122,"Argentina ",1995-01-01,"Spain ",1995-01-01,1,1,"Spain",1963-08-29,"Argentina",1967-10-11,1,1,10,10,8,8,1,1,NA,NA,NA,NA,NA,NA,NA,NA,NA,2001,0,NA,NA,0
"359",NA,"ARG-AD-172",160,"2001",560,2000,560,160,"Q4_2012","Argentina","ARG-AD-171","South Africa","ZAF","Hot Rolled Bars","6/8/00","10/9/00","10/9/00","A","A","2/7/01","DPU","5/18/01","5/18/01","A","A","10/23/01","DPU","MI","2004","DPU","MI","MI","G/ADP/N/85/ARG",8,8,1,9,1,1,1.732870451,3.376975394,18.67530036,52.78632006,0,9329.113756,3019.946367,3.44e+11,1.33e+11,9.069476306,27.8709062,4.310081555,3.274923749,"6/8/00",2000-06-08,2000-06-08,358,181,2001-02-07,3.25e+11,1.18e+11,9.558790367,30.12753668,18.03958519,56.20588719,8732.466063,2638.15805,4.288049878,3.510824368,"Argentina ",1995-01-01,"South Africa",1995-01-01,1,1,"South Africa",1948-06-13,"Argentina",1967-10-11,1,1,9,9,8,8,1,1,NA,NA,NA,NA,NA,NA,NA,NA,NA,2001,0,NA,NA,0
"360",NA,"ARG-AD-173",160,"2001",640,2000,640,160,"Q4_2012","Argentina","ARG-AD-171","Turkey","TUR","Hot Rolled Bars","6/8/00","10/9/00","10/9/00","A","A","2/7/01","DPU","5/18/01","5/18/01","A","A","10/23/01","DPU","MI","2004","DPU","MI","MI","G/ADP/N/85/ARG",8,8,1,7,1,1,1.732870451,1.120137474,18.67530036,43.19214543,1,9329.113756,4219.544349,3.44e+11,2.67e+11,9.069476306,20.0978721,4.310081555,11.31150937,"6/8/00",2000-06-08,2000-06-08,514,181,2001-02-07,3.25e+11,1.96e+11,9.558790367,27.44088235,18.03958519,50.7562312,8732.466063,3057.790664,4.288049878,9.947713877,"Argentina ",1995-01-01,"Turkey ",1995-03-26,1,1,"Turkey",1951-10-17,"Argentina",1967-10-11,1,1,7,8,8,8,1,1,NA,NA,NA,NA,NA,NA,NA,NA,NA,2001,0,NA,NA,0
"361",NA,"ARG-AD-174",160,"2001",140,2000,140,160,"Q4_2012","Argentina","ARG-AD-174","Brazil","BRA","Hot Rolled Steel Cross-Sections","7/11/00","11/10/00","11/10/00","A","A","7/17/01","DPU","1/25/01","1/25/01","A","A","1/11/02","DPU","MI","2005","DPU/PU","MI","MI","G/ADP/N/92/ARG",8,8,1,8,1,1,1.732870451,4.757257524,18.67530036,21.71995842,1,9329.113756,3694.462668,3.44e+11,6.45e+11,9.069476306,9.978193817,4.310081555,5.602902758,"7/11/00",2000-07-11,2000-07-11,2018,214,2001-07-17,3.25e+11,5.54e+11,9.558790367,12.18144648,18.03958519,25.67834696,8732.466063,3128.144846,4.288049878,5.973379533,"Argentina ",1995-01-01,"Brazil ",1995-01-01,1,1,"Brazil",1948-07-30,"Argentina",1967-10-11,1,1,8,8,8,8,1,1,NA,NA,NA,NA,NA,NA,NA,NA,NA,2002,0,NA,NA,0
"363",NA,"ARG-AD-176",160,"2001",560,2000,560,160,"Q4_2012","Argentina","ARG-AD-174","South Africa","ZAF","Hot Rolled Steel Cross-Sections","7/11/00","11/10/00","11/10/00","A","A","7/17/01","DPU","1/25/01","1/25/01","A","A","1/11/02","DPU","MI","2005","DPU","MI","MI","G/ADP/N/92/ARG",8,8,1,9,1,1,1.732870451,3.376975394,18.67530036,52.78632006,0,9329.113756,3019.946367,3.44e+11,1.33e+11,9.069476306,27.8709062,4.310081555,3.274923749,"7/11/00",2000-07-11,2000-07-11,391,214,2001-07-17,3.25e+11,1.18e+11,9.558790367,30.12753668,18.03958519,56.20588719,8732.466063,2638.15805,4.288049878,3.510824368,"Argentina ",1995-01-01,"South Africa",1995-01-01,1,1,"South Africa",1948-06-13,"Argentina",1967-10-11,1,1,9,9,8,8,1,1,NA,NA,NA,NA,NA,NA,NA,NA,NA,2002,0,NA,NA,0
"364",NA,"ARG-AD-177",160,"2001",640,2000,640,160,"Q4_2012","Argentina","ARG-AD-174","Turkey","TUR","Hot Rolled Steel Cross-Sections","7/11/00","11/10/00","11/10/00","A","A","7/17/01","DPU","1/25/01","1/25/01","A","A","1/11/02","DPU","MI","2005","DPU","MI","MI","G/ADP/N/92/ARG",8,8,1,7,1,1,1.732870451,1.120137474,18.67530036,43.19214543,1,9329.113756,4219.544349,3.44e+11,2.67e+11,9.069476306,20.0978721,4.310081555,11.31150937,"7/11/00",2000-07-11,2000-07-11,547,214,2001-07-17,3.25e+11,1.96e+11,9.558790367,27.44088235,18.03958519,50.7562312,8732.466063,3057.790664,4.288049878,9.947713877,"Argentina ",1995-01-01,"Turkey ",1995-03-26,1,1,"Turkey",1951-10-17,"Argentina",1967-10-11,1,1,7,8,8,8,1,1,NA,NA,NA,NA,NA,NA,NA,NA,NA,2002,0,NA,NA,0
"365",NA,"ARG-AD-178",160,"2001",155,2000,155,160,"Q4_2012","Argentina","ARG-AD-178","Chile","CHL","Electrolytic Copper Wire","8/17/00","12/27/00","12/27/00","A","A","7/24/01",".","6/19/01","6/19/01","A","A","12/19/01","DPU","MI","MI","DPU","MI","MI","G/ADP/N/85/ARG",8,8,1,9,1,1,1.732870451,10.27490199,18.67530036,57.86519771,0,9329.113756,5133.077311,3.44e+11,79328640264,9.069476306,29.28715138,4.310081555,5.89506754,"8/17/00",2000-08-17,2000-08-17,158,251,2001-07-24,3.25e+11,72336972322,9.558790367,30.87198151,18.03958519,61.41428034,8732.466063,4625.336377,4.288049878,5.159719613,"Argentina ",1995-01-01,"Chile ",1995-01-01,1,1,"Chile",1949-03-16,"Argentina",1967-10-11,1,1,9,9,8,8,1,1,NA,NA,NA,NA,NA,NA,NA,NA,NA,2001,0,NA,NA,0
"370",NA,"ARG-AD-182",160,"2001",140,2000,140,160,"Q4_2012","Argentina","ARG-AD-182","Brazil","BRA","Granulated Steel","9/27/00","2/2/01","2/2/01","A","A","11/12/01","DPU","8/9/01","8/9/01","N","N",".",".",".",".",".",".",".",".",8,8,1,8,1,1,1.732870451,4.757257524,18.67530036,21.71995842,1,9329.113756,3694.462668,3.44e+11,6.45e+11,9.069476306,9.978193817,4.310081555,5.602902758,"9/27/00",2000-09-27,2000-09-27,2096,292,2001-11-12,3.25e+11,5.54e+11,9.558790367,12.18144648,18.03958519,25.67834696,8732.466063,3128.144846,4.288049878,5.973379533,"Argentina ",1995-01-01,"Brazil ",1995-01-01,1,1,"Brazil",1948-07-30,"Argentina",1967-10-11,1,1,8,8,8,8,1,1,NA,NA,NA,NA,NA,NA,NA,NA,NA,NA,0,NA,NA,0
"371",NA,"ARG-AD-183",160,"2001",230,2000,230,160,"Q4_2012","Argentina","ARG-AD-182","Spain","ESP","Granulated Steel","9/27/00","2/2/01","2/2/01","A","A","11/12/01","DPU","8/9/01","8/9/01","N","N",".",".",".",".",".",".",".",".",8,8,1,10,1,1,1.732870451,1.340853167,18.67530036,61.23094362,1,9329.113756,14413.78887,3.44e+11,5.8e+11,9.069476306,29.05063763,4.310081555,4.226665122,"9/27/00",2000-09-27,2000-09-27,1606,292,2001-11-12,3.25e+11,6.09e+11,9.558790367,28.53363551,18.03958519,59.59388416,8732.466063,14939.06077,4.288049878,4.099585896,"Argentina ",1995-01-01,"Spain ",1995-01-01,1,1,"Spain",1963-08-29,"Argentina",1967-10-11,1,1,10,10,8,8,1,1,NA,NA,NA,NA,NA,NA,NA,NA,NA,NA,0,NA,NA,0
"372",NA,"ARG-AD-184",160,"2001",155,2000,155,160,"Q4_2012","Argentina","ARG-AD-184","Chile","CHL","Fiber Glass Products","10/18/00","2/16/01","2/16/01","A","A","10/5/01","DPU","8/23/01","8/23/01","N","N",".",".",".",".",".",".",".",".",8,8,1,9,1,1,1.732870451,10.27490199,18.67530036,57.86519771,0,9329.113756,5133.077311,3.44e+11,79328640264,9.069476306,29.28715138,4.310081555,5.89506754,"10/18/00",2000-10-18,2000-10-18,220,313,2001-10-05,3.25e+11,72336972322,9.558790367,30.87198151,18.03958519,61.41428034,8732.466063,4625.336377,4.288049878,5.159719613,"Argentina ",1995-01-01,"Chile ",1995-01-01,1,1,"Chile",1949-03-16,"Argentina",1967-10-11,1,1,9,9,8,8,1,1,NA,NA,NA,NA,NA,NA,NA,NA,NA,NA,0,NA,NA,0
"373",NA,"ARG-AD-185",160,"2001",560,2000,560,160,"Q4_2012","Argentina","ARG-AD-184","South Africa","ZAF","Fiber Glass Products","10/18/00","2/16/01","2/16/01","A","A","10/5/01","DPU","8/23/01","8/23/01","A","A","4/18/02","DPU","4/4/11","2011","DPU","MI","MI","G/ADP/N/92/ARG",8,8,1,9,1,1,1.732870451,3.376975394,18.67530036,52.78632006,0,9329.113756,3019.946367,3.44e+11,1.33e+11,9.069476306,27.8709062,4.310081555,3.274923749,"10/18/00",2000-10-18,2000-10-18,490,313,2001-10-05,3.25e+11,1.18e+11,9.558790367,30.12753668,18.03958519,56.20588719,8732.466063,2638.15805,4.288049878,3.510824368,"Argentina ",1995-01-01,"South Africa",1995-01-01,1,1,"South Africa",1948-06-13,"Argentina",1967-10-11,1,1,9,9,8,8,1,1,NA,NA,NA,NA,NA,NA,NA,NA,NA,2002,0,NA,NA,0
"376",NA,"ARG-AD-188",160,"2001",360,2000,360,160,"Q4_2012","Argentina","ARG-AD-187","Romania","ROU","Hot Rolled Steel and Iron Products","10/30/00","4/5/01","4/5/01","A","A","7/30/01","DPU","12/3/01","12/3/01","A","A","4/30/02","AVD","IF","IF","AVD","40.48","40.48","G/ADP/N/92/ARG",8,8,1,8,1,1,1.732870451,4.853903577,18.67530036,70.96633187,0,9329.113756,1662.217535,3.44e+11,37305099928,9.069476306,32.83290897,4.310081555,12.0621862,"10/30/00",2000-10-30,2000-10-30,313,325,2001-07-30,3.25e+11,40585886769,9.558790367,33.06383101,18.03958519,73.73463065,8732.466063,1833.81266,4.288049878,14.54052017,"Argentina ",1995-01-01,"Romania ",1995-01-01,1,1,"Romania",1971-11-14,"Argentina",1967-10-11,1,1,8,8,8,8,1,1,NA,NA,NA,NA,NA,NA,NA,NA,NA,2002,0,NA,NA,0
"377",NA,"ARG-AD-189",160,"2001",317,2000,317,160,"Q4_2012","Argentina","ARG-AD-187","Slovakia","SVK","Hot Rolled Steel and Iron Products","10/30/00","4/5/01","4/5/01","A","A","7/30/01","DPU","12/3/01","12/3/01","A","A","4/30/02","AVD","IF","IF","AVD","62.09","62.09","G/ADP/N/92/ARG",8,8,1,9,1,1,1.732870451,2.180668461,18.67530036,143.4736581,0,9329.113756,5330.401622,3.44e+11,28724041828,9.069476306,70.44851064,4.310081555,4.474773304,"10/30/00",2000-10-30,2000-10-30,731,325,2001-07-30,3.25e+11,30318731991,9.558790367,72.71262045,18.03958519,153.5098819,8732.466063,5636.63909,4.288049878,4.678874854,"Argentina ",1995-01-01,"Slovakia",1995-01-01,1,1,"Slovakia",1993-04-15,"Argentina",1967-10-11,1,1,9,9,8,8,1,1,NA,NA,NA,NA,NA,NA,NA,NA,NA,2002,0,NA,NA,0
"379",NA,"ARG-AD-190",160,"2001",560,2000,560,160,"Q4_2012","Argentina","ARG-AD-187","South Africa","ZAF","Hot Rolled Steel and Iron Products","10/30/00","4/5/01","4/5/01","A","A","7/30/01","DPU","12/3/01","12/3/01","A","A","4/30/02","AVD","IF","IF","AVD","55.26","55.26","G/ADP/N/92/ARG",8,8,1,9,1,1,1.732870451,3.376975394,18.67530036,52.78632006,0,9329.113756,3019.946367,3.44e+11,1.33e+11,9.069476306,27.8709062,4.310081555,3.274923749,"10/30/00",2000-10-30,2000-10-30,502,325,2001-07-30,3.25e+11,1.18e+11,9.558790367,30.12753668,18.03958519,56.20588719,8732.466063,2638.15805,4.288049878,3.510824368,"Argentina ",1995-01-01,"South Africa",1995-01-01,1,1,"South Africa",1948-06-13,"Argentina",1967-10-11,1,1,9,9,8,8,1,1,NA,NA,NA,NA,NA,NA,NA,NA,NA,2002,0,NA,NA,0
"380",NA,"ARG-AD-191",160,"2001",140,2000,140,160,"Q4_2012","Argentina","ARG-AD-191","Brazil","BRA","Phenol Panels","11/8/00","4/3/01","4/3/01","A","A","8/13/01","DPU","9/13/01","9/13/01","N","N",".",".","MI","2001",".",".",".",".",8,8,1,8,1,1,1.732870451,4.757257524,18.67530036,21.71995842,1,9329.113756,3694.462668,3.44e+11,6.45e+11,9.069476306,9.978193817,4.310081555,5.602902758,"11/8/00",2000-11-08,2000-11-08,2138,334,2001-08-13,3.25e+11,5.54e+11,9.558790367,12.18144648,18.03958519,25.67834696,8732.466063,3128.144846,4.288049878,5.973379533,"Argentina ",1995-01-01,"Brazil ",1995-01-01,1,1,"Brazil",1948-07-30,"Argentina",1967-10-11,1,1,8,8,8,8,1,1,NA,NA,NA,NA,NA,NA,NA,NA,NA,NA,0,NA,NA,0
"381",NA,"ARG-AD-192",160,"2001",155,2000,155,160,"Q4_2012","Argentina","ARG-AD-192","Chile","CHL","Polypropylene Fabric","11/21/00","4/26/01","4/26/01","A","A","10/30/01","DPU","12/7/01","12/7/01","A","A","5/22/02","DPU","MI","2005","DPU","MI","MI","G/ADP/N/92/ARG",8,8,1,9,1,1,1.732870451,10.27490199,18.67530036,57.86519771,0,9329.113756,5133.077311,3.44e+11,79328640264,9.069476306,29.28715138,4.310081555,5.89506754,"11/21/00",2000-11-21,2000-11-21,254,347,2001-10-30,3.25e+11,72336972322,9.558790367,30.87198151,18.03958519,61.41428034,8732.466063,4625.336377,4.288049878,5.159719613,"Argentina ",1995-01-01,"Chile ",1995-01-01,1,1,"Chile",1949-03-16,"Argentina",1967-10-11,1,1,9,9,8,8,1,1,NA,NA,NA,NA,NA,NA,NA,NA,NA,2002,0,NA,NA,0
"383",NA,"ARG-AD-194",160,"2002",140,2000,140,160,"Q4_2012","Argentina","ARG-AD-194","Brazil","BRA","Drill Bits","11/30/00","5/23/01","5/23/01","A","A","4/3/02",".","9/27/01","9/27/01","A","A","7/20/04","PU","MI","MI","PU","MI","MI","G/ADP/N/92/ARG",8,8,1,8,1,1,1.732870451,4.757257524,18.67530036,21.71995842,1,9329.113756,3694.462668,3.44e+11,6.45e+11,9.069476306,9.978193817,4.310081555,5.602902758,"11/30/00",2000-11-30,2000-11-30,2160,356,2002-04-03,1.24e+11,5.04e+11,23.4304137,14.09662327,34.46767997,26.67960011,3285.026171,2810.695347,9.304636934,6.61763262,"Argentina ",1995-01-01,"Brazil ",1995-01-01,1,1,"Brazil",1948-07-30,"Argentina",1967-10-11,1,1,8,8,8,8,1,1,NA,NA,NA,NA,NA,NA,NA,NA,NA,2004,0,NA,NA,0
"384",NA,"ARG-AD-195",160,"2001",740,2000,740,160,"Q4_2012","Argentina","ARG-AD-195","Japan","JPN","Steel Tubes","12/15/00","7/6/01","7/6/01","A","A","9/17/01","DPU","10/11/01","10/11/01","A","A","12/14/01","DPU","IF","IF","DPU","MI","MI","G/ADP/N/85/ARG",8,8,1,10,1,1,1.732870451,0.464845251,18.67530036,20.3060448,1,9329.113756,37291.70616,3.44e+11,4.73e+12,9.069476306,10.8773781,4.310081555,1.586389312,"12/15/00",2000-12-15,2000-12-15,254,371,2001-09-17,3.25e+11,4.16e+12,9.558790367,10.4488202,18.03958519,20.2578929,8732.466063,32716.41867,4.288049878,1.44258103,"Argentina ",1995-01-01,"Japan ",1995-01-01,1,1,"Japan",1955-09-10,"Argentina",1967-10-11,1,1,10,10,8,8,1,1,NA,NA,NA,NA,NA,NA,NA,NA,NA,2001,0,NA,NA,0
"385",NA,"ARG-AD-196",160,"2001",740,2000,740,160,"Q4_2012","Argentina","ARG-AD-196","Japan","JPN","Quizalofop-P-Ethyl","12/22/00","5/9/01","5/9/01","A","A","7/16/01",".","10/24/01","10/24/01","A","A","6/24/02","DPU","6/17/11","2011","DPU","MI","MI","G/ADP/N/92/ARG",8,8,1,10,1,1,1.732870451,0.464845251,18.67530036,20.3060448,1,9329.113756,37291.70616,3.44e+11,4.73e+12,9.069476306,10.8773781,4.310081555,1.586389312,"12/22/00",2000-12-22,2000-12-22,261,378,2001-07-16,3.25e+11,4.16e+12,9.558790367,10.4488202,18.03958519,20.2578929,8732.466063,32716.41867,4.288049878,1.44258103,"Argentina ",1995-01-01,"Japan ",1995-01-01,1,1,"Japan",1955-09-10,"Argentina",1967-10-11,1,1,10,10,8,8,1,1,NA,NA,NA,NA,NA,NA,NA,NA,NA,2002,0,NA,NA,0
"386",NA,"ARG-AD-197",160,"2002",200,2001,200,160,"Q4_2012","Argentina","ARG-AD-197","United Kingdom","GBR","Chain Saw Blades","2/26/01","7/6/01","7/6/01","A","A","4/15/02","DPU","12/27/01","12/27/01","N","N",".",".","MI","2002",".",".",".",".",8,8,1,10,1,1,1.618177593,0.453504611,18.03958519,56.10090605,1,8732.466063,25121.03789,3.25e+11,1.49e+12,9.558790367,26.9190061,4.288049878,0.821107531,"2/26/01",2001-02-26,2001-02-26,1396,444,2002-04-15,1.24e+11,1.62e+12,23.4304137,25.89034319,34.46767997,54.4881249,3285.026171,27301.46037,9.304636934,0.830368719,"Argentina ",1995-01-01,"United Kingdom",1995-01-01,1,1,"United Kingdom",1948-01-01,"Argentina",1967-10-11,1,1,10,10,8,8,1,1,NA,NA,NA,NA,NA,NA,NA,NA,NA,NA,0,NA,NA,0
"387",NA,"ARG-AD-198",160,"2002",710,2001,710,160,"Q4_2012","Argentina","ARG-AD-198","China","CHN","Playing Cards","5/14/01","9/21/01","9/21/01","A","A","4/24/02","DPU","1/2/02","1/2/02","A","A","11/14/02","DPU","4/28/12","2012","DPU","MI","MI","G/ADP/N/98/ARG",8,8,1,-7,0,1,1.618177593,0.863739086,18.03958519,43.08019713,0,8732.466063,1041.6377,3.25e+11,1.32e+12,9.558790367,22.60010168,4.288049878,14.39172359,"5/14/01",2001-05-14,2001-05-14,1545,521,2002-04-24,1.24e+11,1.45e+12,23.4304137,25.13437343,34.46767997,47.69731271,3285.026171,1135.447952,9.304636934,13.74274917,"Argentina ",1995-01-01,"China ",2001-12-11,1,1,NA,NA,"Argentina",1967-10-11,1,NA,-7,0,8,8,1,0,NA,NA,NA,NA,NA,NA,NA,NA,NA,2002,0,NA,NA,0
"388",NA,"ARG-AD-199",160,"2002",2,2001,2,160,"Q4_2012","Argentina","ARG-AD-199","USA","USA","Poliol","5/14/01","9/26/01","9/26/01","A","A","4/24/02","DPU","3/15/02","3/15/02","A","A","11/14/02","DPU","MI","2004","DPU","MI","MI","G/ADP/N/98/ARG",8,8,1,10,1,1,1.618177593,2.306059661,18.03958519,22.8379434,1,8732.466063,37285.81592,3.25e+11,1.06e+13,9.558790367,9.68255014,4.288049878,1.181402837,"5/14/01",2001-05-14,2001-05-14,113,521,2002-04-24,1.24e+11,1.1e+13,23.4304137,9.150106555,34.46767997,22.17081656,3285.026171,38175.37638,9.304636934,1.009241245,"Argentina ",1995-01-01,"United States of America",1995-01-01,1,1,"United States of America",1948-01-01,"Argentina",1967-10-11,1,1,10,10,8,8,1,1,NA,NA,NA,NA,NA,NA,NA,NA,NA,2002,0,NA,NA,0
"391",NA,"ARG-AD-200",160,"2001",732,2001,732,160,"Q4_2012","Argentina","ARG-AD-200","South Korea","KOR","Polyester Fiber","5/21/01","10/10/01","10/10/01","A","A","11/8/01",".","4/2/02","4/2/02","A","A","11/14/02","DPU","MI","2005","DPU","MI","MI","G/ADP/N/98/ARG",8,8,1,8,1,1,1.618177593,0.95340758,18.03958519,63.91107188,1,8732.466063,11255.94789,3.25e+11,5.33e+11,9.558790367,32.73245013,4.288049878,4.126427146,"5/21/01",2001-05-21,2001-05-21,1181,528,2001-11-08,3.25e+11,5.33e+11,9.558790367,32.73245013,18.03958519,63.91107188,8732.466063,11255.94789,4.288049878,4.126427146,"Argentina ",1995-01-01,"South Korea",1995-01-01,1,1,"South Korea",1967-04-14,"Argentina",1967-10-11,1,1,8,8,8,8,1,1,NA,NA,NA,NA,NA,NA,NA,NA,NA,2002,0,NA,NA,0
"392",NA,"ARG-AD-201",160,"2002",710,2001,710,160,"Q4_2012","Argentina","ARG-AD-201","China","CHN","Ball Bearings","6/4/01","10/29/01","10/29/01","A","A","4/30/02","DPU","5/2/02","5/2/02","A","A","12/4/02","DPU","IF","IF","DPU","MI","MI","G/ADP/N/98/ARG",8,8,1,-7,0,1,1.618177593,0.863739086,18.03958519,43.08019713,0,8732.466063,1041.6377,3.25e+11,1.32e+12,9.558790367,22.60010168,4.288049878,14.39172359,"6/4/01",2001-06-04,2001-06-04,1566,542,2002-04-30,1.24e+11,1.45e+12,23.4304137,25.13437343,34.46767997,47.69731271,3285.026171,1135.447952,9.304636934,13.74274917,"Argentina ",1995-01-01,"China ",2001-12-11,1,1,NA,NA,"Argentina",1967-10-11,1,NA,-7,0,8,8,1,0,NA,NA,NA,NA,NA,NA,NA,NA,NA,2002,0,NA,NA,0
"393",NA,"ARG-AD-202",160,"2002",710,2001,710,160,"Q4_2012","Argentina","ARG-AD-202","China","CHN","Syringes","6/4/01","10/26/01","10/26/01","A","A","4/15/02","DPU","4/2/02","4/2/02","A","N",".",".","MI","2002",".",".",".",".",8,8,1,-7,0,1,1.618177593,0.863739086,18.03958519,43.08019713,0,8732.466063,1041.6377,3.25e+11,1.32e+12,9.558790367,22.60010168,4.288049878,14.39172359,"6/4/01",2001-06-04,2001-06-04,1566,542,2002-04-15,1.24e+11,1.45e+12,23.4304137,25.13437343,34.46767997,47.69731271,3285.026171,1135.447952,9.304636934,13.74274917,"Argentina ",1995-01-01,"China ",2001-12-11,1,1,NA,NA,"Argentina",1967-10-11,1,NA,-7,0,8,8,1,0,NA,NA,NA,NA,NA,NA,NA,NA,NA,NA,0,NA,NA,0
"394",NA,"ARG-AD-203",160,"2002",732,2001,732,160,"Q4_2012","Argentina","ARG-AD-202","South Korea","KOR","Syringes","6/4/01","10/26/01","10/26/01","A","A","4/15/02","DPU","4/2/02","4/2/02","A","N",".",".","MI","2002",".",".",".",".",8,8,1,8,1,1,1.618177593,0.95340758,18.03958519,63.91107188,1,8732.466063,11255.94789,3.25e+11,5.33e+11,9.558790367,32.73245013,4.288049878,4.126427146,"6/4/01",2001-06-04,2001-06-04,1195,542,2002-04-15,1.24e+11,6.09e+11,23.4304137,30.82686814,34.46767997,60.15373411,3285.026171,12788.58018,9.304636934,3.763589197,"Argentina ",1995-01-01,"South Korea",1995-01-01,1,1,"South Korea",1967-04-14,"Argentina",1967-10-11,1,1,8,8,8,8,1,1,NA,NA,NA,NA,NA,NA,NA,NA,NA,NA,0,NA,NA,0
"395",NA,"ARG-AD-204",160,"2001",710,2001,710,160,"Q4_2012","Argentina","ARG-AD-204","China","CHN","Microwave Ovens","6/14/01","10/17/01","10/17/01","A","A","12/19/01","DPU","4/4/02","4/4/02","A","A","12/16/02","DPU","IF","IF","DPU","MI","MI","G/ADP/N/98/ARG",8,8,1,-7,0,1,1.618177593,0.863739086,18.03958519,43.08019713,0,8732.466063,1041.6377,3.25e+11,1.32e+12,9.558790367,22.60010168,4.288049878,14.39172359,"6/14/01",2001-06-14,2001-06-14,1576,552,2001-12-19,3.25e+11,1.32e+12,9.558790367,22.60010168,18.03958519,43.08019713,8732.466063,1041.6377,4.288049878,14.39172359,"Argentina ",1995-01-01,"China ",2001-12-11,1,1,NA,NA,"Argentina",1967-10-11,1,NA,-7,0,8,8,1,0,NA,NA,NA,NA,NA,NA,NA,NA,NA,2002,0,NA,NA,0
"396",NA,"ARG-AD-205",160,"2002",2,2001,2,160,"Q4_2012","Argentina","ARG-AD-205","USA","USA","Toluene","6/21/01","10/19/01","10/19/01","A","A","4/24/02","DPU","4/5/02","4/5/02","A","A","12/19/02","DPU","MI","2004","DPU","MI","MI","G/ADP/N/98/ARG",8,8,1,10,1,1,1.618177593,2.306059661,18.03958519,22.8379434,1,8732.466063,37285.81592,3.25e+11,1.06e+13,9.558790367,9.68255014,4.288049878,1.181402837,"6/21/01",2001-06-21,2001-06-21,151,559,2002-04-24,1.24e+11,1.1e+13,23.4304137,9.150106555,34.46767997,22.17081656,3285.026171,38175.37638,9.304636934,1.009241245,"Argentina ",1995-01-01,"United States of America",1995-01-01,1,1,"United States of America",1948-01-01,"Argentina",1967-10-11,1,1,10,10,8,8,1,1,NA,NA,NA,NA,NA,NA,NA,NA,NA,2002,0,NA,NA,0
"398",NA,"ARG-AD-207",160,"2002",732,2001,732,160,"Q4_2012","Argentina","ARG-AD-206","South Korea","KOR","Cold Rolled Steel","7/19/01","11/1/01","11/1/01","A","A","4/30/02","DPU","7/2/02","7/2/02","A","A","1/10/03","AVD","IF","IF","AVD","60.46","60.46","G/ADP/N/105/ARG",8,8,1,8,1,1,1.618177593,0.95340758,18.03958519,63.91107188,1,8732.466063,11255.94789,3.25e+11,5.33e+11,9.558790367,32.73245013,4.288049878,4.126427146,"7/19/01",2001-07-19,2001-07-19,1240,587,2002-04-30,1.24e+11,6.09e+11,23.4304137,30.82686814,34.46767997,60.15373411,3285.026171,12788.58018,9.304636934,3.763589197,"Argentina ",1995-01-01,"South Korea",1995-01-01,1,1,"South Korea",1967-04-14,"Argentina",1967-10-11,1,1,8,8,8,8,1,1,NA,NA,NA,NA,NA,NA,NA,NA,NA,2003,0,NA,NA,0
"399",NA,"ARG-AD-208",160,"2002",560,2001,560,160,"Q4_2012","Argentina","ARG-AD-206","South Africa","ZAF","Cold Rolled Steel","7/19/01","11/1/01","11/1/01","A","A","4/30/02","DPU","7/2/02","7/2/02","A","A","1/10/03","AVD","IF","IF","AVD","83.07","83.07","G/ADP/N/105/ARG",8,8,1,9,1,1,1.618177593,2.627801883,18.03958519,56.20588719,0,8732.466063,2638.15805,3.25e+11,1.18e+11,9.558790367,30.12753668,4.288049878,3.510824368,"7/19/01",2001-07-19,2001-07-19,764,587,2002-04-30,1.24e+11,1.11e+11,23.4304137,32.92328541,34.46767997,62.01047457,3285.026171,2425.320317,9.304636934,4.150523085,"Argentina ",1995-01-01,"South Africa",1995-01-01,1,1,"South Africa",1948-06-13,"Argentina",1967-10-11,1,1,9,9,8,8,1,1,NA,NA,NA,NA,NA,NA,NA,NA,NA,2003,0,NA,NA,0
"402",NA,"ARG-AD-210",160,"2002",710,2001,710,160,"Q4_2012","Argentina","ARG-AD-210","China","CHN","Plaguicide","8/22/01","1/14/02","1/14/02","A","A","5/31/02",".","8/29/02","8/29/02","A","A","12/26/02","DPU","IF","IF","DPU","MI","MI","G/ADP/N/98/ARG",8,8,1,-7,0,1,1.618177593,0.863739086,18.03958519,43.08019713,0,8732.466063,1041.6377,3.25e+11,1.32e+12,9.558790367,22.60010168,4.288049878,14.39172359,"8/22/01",2001-08-22,2001-08-22,1645,621,2002-05-31,1.24e+11,1.45e+12,23.4304137,25.13437343,34.46767997,47.69731271,3285.026171,1135.447952,9.304636934,13.74274917,"Argentina ",1995-01-01,"China ",2001-12-11,1,1,NA,NA,"Argentina",1967-10-11,1,NA,-7,0,8,8,1,0,NA,NA,NA,NA,NA,NA,NA,NA,NA,2002,0,NA,NA,0
"403",NA,"ARG-AD-211",160,"2002",140,2001,140,160,"Q4_2012","Argentina","ARG-AD-211","Brazil","BRA","Air Conditioners","8/22/01","12/17/01","12/17/01","A","A","8/7/02","DPU","11/29/02","11/29/02","N","N",".",".",".",".",".",".",".",".",8,8,1,8,1,1,1.618177593,4.103701107,18.03958519,25.67834696,1,8732.466063,3128.144846,3.25e+11,5.54e+11,9.558790367,12.18144648,4.288049878,5.973379533,"8/22/01",2001-08-22,2001-08-22,2425,621,2002-08-07,1.24e+11,5.04e+11,23.4304137,14.09662327,34.46767997,26.67960011,3285.026171,2810.695347,9.304636934,6.61763262,"Argentina ",1995-01-01,"Brazil ",1995-01-01,1,1,"Brazil",1948-07-30,"Argentina",1967-10-11,1,1,8,8,8,8,1,1,NA,NA,NA,NA,NA,NA,NA,NA,NA,NA,0,NA,NA,0
"404",NA,"ARG-AD-212",160,"2002",710,2001,710,160,"Q4_2012","Argentina","ARG-AD-211","China","CHN","Air Conditioners","8/22/01","12/17/01","12/17/01","A","A","8/7/02","DPU","11/29/02","11/29/02","A","A","2/24/03","DPU","IF","IF","DPU","MI","MI","G/ADP/N/105/ARG",8,8,1,-7,0,1,1.618177593,0.863739086,18.03958519,43.08019713,0,8732.466063,1041.6377,3.25e+11,1.32e+12,9.558790367,22.60010168,4.288049878,14.39172359,"8/22/01",2001-08-22,2001-08-22,1645,621,2002-08-07,1.24e+11,1.45e+12,23.4304137,25.13437343,34.46767997,47.69731271,3285.026171,1135.447952,9.304636934,13.74274917,"Argentina ",1995-01-01,"China ",2001-12-11,1,1,NA,NA,"Argentina",1967-10-11,1,NA,-7,0,8,8,1,0,NA,NA,NA,NA,NA,NA,NA,NA,NA,2003,0,NA,NA,0
"405",NA,"ARG-AD-213",160,"2002",710,2001,710,160,"Q4_2012","Argentina","ARG-AD-213","China","CHN","Bicycle Tires","9/19/01","2/4/02","2/4/02","A","A","4/30/02","DPU","11/14/02","11/14/02","A","A","3/21/03","DPU","IF","IF","DPU","MI","MI","G/ADP/N/105/ARG",8,8,1,-7,0,1,1.618177593,0.863739086,18.03958519,43.08019713,0,8732.466063,1041.6377,3.25e+11,1.32e+12,9.558790367,22.60010168,4.288049878,14.39172359,"9/19/01",2001-09-19,2001-09-19,1673,649,2002-04-30,1.24e+11,1.45e+12,23.4304137,25.13437343,34.46767997,47.69731271,3285.026171,1135.447952,9.304636934,13.74274917,"Argentina ",1995-01-01,"China ",2001-12-11,1,1,NA,NA,"Argentina",1967-10-11,1,NA,-7,0,8,8,1,0,NA,NA,NA,NA,NA,NA,NA,NA,NA,2003,0,NA,NA,0
"406",NA,"ARG-AD-214",160,"2002",850,2001,850,160,"Q4_2012","Argentina","ARG-AD-213","Indonesia","IDN","Bicycle Tires","9/19/01","2/4/02","2/4/02","A","A","4/30/02",".","11/14/02","11/14/02","A","A","3/21/03","DPU","IF","IF","DPU","MI","MI","G/ADP/N/105/ARG",8,8,1,6,1,1,1.618177593,3.603402754,18.03958519,69.7932057,1,8732.466063,756.931013,3.25e+11,1.6e+11,9.558790367,39.03213345,4.288049878,15.29026521,"9/19/01",2001-09-19,2001-09-19,57,649,2002-04-30,1.24e+11,1.96e+11,23.4304137,32.68762116,34.46767997,59.07946358,3285.026171,909.8873302,9.304636934,15.45645173,"Argentina ",1995-01-01,"Indonesia ",1995-01-01,1,1,"Indonesia",1950-02-24,"Argentina",1967-10-11,1,1,6,7,8,8,1,1,NA,NA,NA,NA,NA,NA,NA,NA,NA,2003,0,NA,NA,0
"407",NA,"ARG-AD-215",160,"2002",800,2001,800,160,"Q4_2012","Argentina","ARG-AD-213","Thailand","THA","Bicycle Tires","9/19/01","2/4/02","2/4/02","A","A","4/30/02",".","11/14/02","11/14/02","A","A","3/21/03","DPU","IF","IF","DPU","MI","MI","G/ADP/N/105/ARG",8,8,1,9,1,1,1.618177593,3.08006155,18.03958519,125.2229764,0,8732.466063,1831.902788,3.25e+11,1.16e+11,9.558790367,65.85660237,4.288049878,9.134212863,"9/19/01",2001-09-19,2001-09-19,221,649,2002-04-30,1.24e+11,1.27e+11,23.4304137,64.1943345,34.46767997,121.6969998,3285.026171,1988.733736,9.304636934,9.434795124,"Argentina ",1995-01-01,"Thailand ",1995-01-01,1,1,"Thailand",1982-11-20,"Argentina",1967-10-11,1,1,9,9,8,8,1,1,NA,NA,NA,NA,NA,NA,NA,NA,NA,2003,0,NA,NA,0
"408",NA,"ARG-AD-216",160,"2002",920,2001,920,160,"Q4_2012","Argentina","ARG-AD-216","New Zealand","NZL","Fiber Glass ","10/2/01","2/8/02","2/8/02","A","A","8/2/02","DPU","12/6/02","12/6/02","A","A","3/25/03","PU","IF","IF","PU","MI","MI","G/ADP/N/105/ARG",8,8,1,10,1,1,1.618177593,12.60528649,18.03958519,67.96328431,0,8732.466063,13736.70673,3.25e+11,53305290474,9.558790367,35.80878947,4.288049878,8.669790579,"10/2/01",2001-10-02,2001-10-02,662,662,2002-08-02,1.24e+11,66020503721,23.4304137,33.14843709,34.46767997,63.2397405,3285.026171,16720.40109,9.304636934,6.372463075,"Argentina ",1995-01-01,"New Zealand",1995-01-01,1,1,"New Zealand",1948-07-30,"Argentina",1967-10-11,1,1,10,10,8,8,1,1,NA,NA,NA,NA,NA,NA,NA,NA,NA,2003,0,NA,NA,0
"409",NA,"ARG-AD-217",160,"2002",710,2001,710,160,"Q4_2012","Argentina","ARG-AD-217","China","CHN","Bathroom and Kitchen Faucets","10/10/01","2/15/02","2/15/02","A","A","8/2/02","DPU","10/7/02","10/7/02","A","A","4/11/03","DPU","MI","2005","DPU","MI","MI","G/ADP/N/105/ARG",8,8,1,-7,0,1,1.618177593,0.863739086,18.03958519,43.08019713,0,8732.466063,1041.6377,3.25e+11,1.32e+12,9.558790367,22.60010168,4.288049878,14.39172359,"10/10/01",2001-10-10,2001-10-10,1694,670,2002-08-02,1.24e+11,1.45e+12,23.4304137,25.13437343,34.46767997,47.69731271,3285.026171,1135.447952,9.304636934,13.74274917,"Argentina ",1995-01-01,"China ",2001-12-11,1,1,NA,NA,"Argentina",1967-10-11,1,NA,-7,0,8,8,1,0,NA,NA,NA,NA,NA,NA,NA,NA,NA,2003,0,NA,NA,0
"410",NA,"ARG-AD-218",160,"2002",140,2001,140,160,"Q4_2012","Argentina","ARG-AD-218","Brazil","BRA","Pipe Accessories","10/10/01","2/14/02","2/14/02","A","A","8/6/02","DPU","11/29/02","11/29/02","A","A","4/11/03","AVD","MI","2004","AVD","105.92","105.92","G/ADP/N/105/ARG",8,8,1,8,1,1,1.618177593,4.103701107,18.03958519,25.67834696,1,8732.466063,3128.144846,3.25e+11,5.54e+11,9.558790367,12.18144648,4.288049878,5.973379533,"10/10/01",2001-10-10,2001-10-10,2474,670,2002-08-06,1.24e+11,5.04e+11,23.4304137,14.09662327,34.46767997,26.67960011,3285.026171,2810.695347,9.304636934,6.61763262,"Argentina ",1995-01-01,"Brazil ",1995-01-01,1,1,"Brazil",1948-07-30,"Argentina",1967-10-11,1,1,8,8,8,8,1,1,NA,NA,NA,NA,NA,NA,NA,NA,NA,2003,0,NA,NA,0
"411",NA,"ARG-AD-219",160,"2002",710,2001,710,160,"Q4_2012","Argentina","ARG-AD-219","China","CHN","Pipe Accessories","10/10/01","2/14/02","2/14/02","A","A","8/6/02","DPU","11/29/02","11/29/02","A","A","4/11/03","AVD","MI","2004","AVD","204.5","204.5","G/ADP/N/105/ARG",8,8,1,-7,0,1,1.618177593,0.863739086,18.03958519,43.08019713,0,8732.466063,1041.6377,3.25e+11,1.32e+12,9.558790367,22.60010168,4.288049878,14.39172359,"10/10/01",2001-10-10,2001-10-10,1694,670,2002-08-06,1.24e+11,1.45e+12,23.4304137,25.13437343,34.46767997,47.69731271,3285.026171,1135.447952,9.304636934,13.74274917,"Argentina ",1995-01-01,"China ",2001-12-11,1,1,NA,NA,"Argentina",1967-10-11,1,NA,-7,0,8,8,1,0,NA,NA,NA,NA,NA,NA,NA,NA,NA,2003,0,NA,NA,0
"413",NA,"ARG-AD-220",160,"2002",140,2001,140,160,"Q4_2012","Argentina","ARG-AD-220","Brazil","BRA","Pork Meat Cuts","11/6/01","3/5/02","3/5/02","A","MI","6/10/02",".","6/28/02","6/28/02","A","N",".",".",".",".",".",".",".",".",8,8,1,8,1,1,1.618177593,4.103701107,18.03958519,25.67834696,1,8732.466063,3128.144846,3.25e+11,5.54e+11,9.558790367,12.18144648,4.288049878,5.973379533,"11/6/01",2001-11-06,2001-11-06,2501,697,2002-06-10,1.24e+11,5.04e+11,23.4304137,14.09662327,34.46767997,26.67960011,3285.026171,2810.695347,9.304636934,6.61763262,"Argentina ",1995-01-01,"Brazil ",1995-01-01,1,1,"Brazil",1948-07-30,"Argentina",1967-10-11,1,1,8,8,8,8,1,1,NA,NA,NA,NA,NA,NA,NA,NA,NA,NA,0,NA,NA,0
"414",NA,"ARG-AD-221",160,"2002",140,2001,140,160,"Q4_2012","Argentina","ARG-AD-221","Brazil","BRA","Stainless Steel Tubes","11/21/01","3/26/02","3/26/02","A","A","7/3/02","DPU","12/18/02","12/18/02","A","A","5/20/03","DPU","5/20/11","2011","DPU","MI","MI","G/ADP/N/105/ARG",8,8,1,8,1,1,1.618177593,4.103701107,18.03958519,25.67834696,1,8732.466063,3128.144846,3.25e+11,5.54e+11,9.558790367,12.18144648,4.288049878,5.973379533,"11/21/01",2001-11-21,2001-11-21,2516,712,2002-07-03,1.24e+11,5.04e+11,23.4304137,14.09662327,34.46767997,26.67960011,3285.026171,2810.695347,9.304636934,6.61763262,"Argentina ",1995-01-01,"Brazil ",1995-01-01,1,1,"Brazil",1948-07-30,"Argentina",1967-10-11,1,1,8,8,8,8,1,1,NA,NA,NA,NA,NA,NA,NA,NA,NA,2003,0,NA,NA,0
"416",NA,"ARG-AD-223",160,"2003",710,2002,710,160,"Q4_2012","Argentina","ARG-AD-223","China","CHN","Glyphosate (Herbicide)","4/18/02","9/20/02","9/20/02","A","A","1/10/03",".","9/23/03","9/23/03","A","A",".",".",".",".",".",".",".",".",8,8,1,-7,0,1,1.557061672,0.780540991,34.46767997,47.69731271,0,3285.026171,1135.447952,1.24e+11,1.45e+12,23.4304137,25.13437343,9.304636934,13.74274917,"4/18/02",2002-04-18,2002-04-18,1884,106,2003-01-10,1.57e+11,1.64e+12,21.40645223,29.5575468,33.55295461,56.93216421,4134.50204,1273.640744,9.751272651,12.7973531,"Argentina ",1995-01-01,"China ",2001-12-11,1,1,NA,NA,"Argentina",1967-10-11,1,NA,-7,0,8,8,1,0,NA,NA,NA,NA,NA,NA,NA,NA,NA,NA,0,NA,NA,0
"417",NA,"ARG-AD-224",160,"2002",900,2002,900,160,"Q4_2012","Argentina","ARG-AD-224","Australia","AUS","Flat Steel or Iron Products","5/30/02","10/22/02","10/22/02","A","A","12/26/02","DPU","3/19/03","3/19/03","A","A","5/27/03","AVD","11/21/12","2012","AVD","70.37","70.37","G/ADP/N/105/ARG",8,8,1,10,1,1,1.557061672,5.357265304,34.46767997,41.30101425,0,3285.026171,20071.96613,1.24e+11,3.94e+11,23.4304137,20.66211409,9.304636934,4.307360092,"5/30/02",2002-05-30,2002-05-30,2271,148,2002-12-26,1.24e+11,3.94e+11,23.4304137,20.66211409,34.46767997,41.30101425,3285.026171,20071.96613,9.304636934,4.307360092,"Argentina ",1995-01-01,"Australia ",1995-01-01,1,1,"Australia",1948-01-01,"Argentina",1967-10-11,1,1,10,10,8,8,1,1,NA,NA,NA,NA,NA,NA,NA,NA,NA,2003,0,NA,NA,0
"419",NA,"ARG-AD-226",160,"2002",732,2002,732,160,"Q4_2012","Argentina","ARG-AD-224","South Korea","KOR","Flat Steel or Iron Products","5/30/02","10/22/02","10/22/02","A","A","12/26/02","DPU","3/19/03","3/19/03","A","A","5/27/03","AVD","11/21/12","2012","AVD","49.67","49.67","G/ADP/N/105/ARG",8,8,1,8,1,1,1.557061672,0.868333788,34.46767997,60.15373411,1,3285.026171,12788.58018,1.24e+11,6.09e+11,23.4304137,30.82686814,9.304636934,3.763589197,"5/30/02",2002-05-30,2002-05-30,1555,148,2002-12-26,1.24e+11,6.09e+11,23.4304137,30.82686814,34.46767997,60.15373411,3285.026171,12788.58018,9.304636934,3.763589197,"Argentina ",1995-01-01,"South Korea",1995-01-01,1,1,"South Korea",1967-04-14,"Argentina",1967-10-11,1,1,8,8,8,8,1,1,NA,NA,NA,NA,NA,NA,NA,NA,NA,2003,0,NA,NA,0
"421",NA,"ARG-AD-228",160,"2002",560,2002,560,160,"Q4_2012","Argentina","ARG-AD-224","South Africa","ZAF","Flat Steel or Iron Products","5/30/02","10/22/02","10/22/02","A","A","12/26/02","DPU","3/19/03","3/19/03","A","A","5/27/03","AVD","11/21/12","2012","AVD","27.9","27.9","G/ADP/N/105/ARG",8,8,1,9,1,1,1.557061672,3.011960982,34.46767997,62.01047457,0,3285.026171,2425.320317,1.24e+11,1.11e+11,23.4304137,32.92328541,9.304636934,4.150523085,"5/30/02",2002-05-30,2002-05-30,1079,148,2002-12-26,1.24e+11,1.11e+11,23.4304137,32.92328541,34.46767997,62.01047457,3285.026171,2425.320317,9.304636934,4.150523085,"Argentina ",1995-01-01,"South Africa",1995-01-01,1,1,"South Africa",1948-06-13,"Argentina",1967-10-11,1,1,9,9,8,8,1,1,NA,NA,NA,NA,NA,NA,NA,NA,NA,2003,0,NA,NA,0
"424",NA,"ARG-AD-230",160,"2002",750,2002,750,160,"Q4_2012","Argentina","ARG-AD-230","India","IND","Bicycle Tires","5/30/02","10/18/02","10/18/02","A","A","12/26/02","DPU","5/5/03","5/5/03","A","A","5/27/03","DPU","MI","MI","DPU","MI","MI","G/ADP/N/105/ARG",8,8,1,9,1,1,1.557061672,1.062797391,34.46767997,29.00009028,1,3285.026171,486.640454,1.24e+11,5.24e+11,23.4304137,14.01854169,9.304636934,20.69574147,"5/30/02",2002-05-30,2002-05-30,1533,148,2002-12-26,1.24e+11,5.24e+11,23.4304137,14.01854169,34.46767997,29.00009028,3285.026171,486.640454,9.304636934,20.69574147,"Argentina ",1995-01-01,"India ",1995-01-01,1,1,"India",1948-07-08,"Argentina",1967-10-11,1,1,9,9,8,8,1,1,NA,NA,NA,NA,NA,NA,NA,NA,NA,2003,0,NA,NA,0
"425",NA,"ARG-AD-231",160,"2003",710,2002,710,160,"Q4_2012","Argentina","ARG-AD-231","China","CHN","Thermos and Similar","7/29/02","1/2/03","1/2/03","A","A","10/3/03",".","8/26/03","8/26/03","A","A","1/8/04","DPU","IF","IF","DPU","MI","MI","G/ADP/N/119/ARG",8,8,1,-7,0,1,1.557061672,0.780540991,34.46767997,47.69731271,0,3285.026171,1135.447952,1.24e+11,1.45e+12,23.4304137,25.13437343,9.304636934,13.74274917,"7/29/02",2002-07-29,2002-07-29,1986,208,2003-10-03,1.57e+11,1.64e+12,21.40645223,29.5575468,33.55295461,56.93216421,4134.50204,1273.640744,9.751272651,12.7973531,"Argentina ",1995-01-01,"China ",2001-12-11,1,1,NA,NA,"Argentina",1967-10-11,1,NA,-7,0,8,8,1,0,NA,NA,NA,NA,NA,NA,NA,NA,NA,2004,0,NA,NA,0
"426",NA,"ARG-AD-232",160,"2003",994,2002,994,160,"Q4_2012","Argentina","ARG-AD-232","European Union","EUN","Starch ","12/6/02","5/5/03","5/5/03","A","A","7/29/03",".","11/13/03","11/13/03","N","N",".",".",".",".",".",".",".",".",8,8,1,NA,1,1,1.557061672,1.513611807,34.46767997,69.17092307,1,3285.026171,19180.25766,1.24e+11,9.41e+12,23.4304137,35.25688032,9.304636934,2.09656721,"12/6/02",2002-12-06,2002-12-06,NA,338,2003-07-29,1.57e+11,1.15e+13,21.40645223,34.45612425,33.55295461,67.81831502,4134.50204,23298.27289,9.751272651,2.016595406,"Argentina ",1995-01-01,"European Union",1995-01-01,1,1,NA,NA,"Argentina",1967-10-11,1,NA,6,NA,8,8,1,1,NA,NA,NA,NA,NA,NA,NA,NA,NA,NA,0,NA,NA,0
"428",NA,"ARG-AD-234",160,"2004",710,2004,710,160,"Q4_2012","Argentina","ARG-AD-234","China","CHN","Sun Glasses and Frames","1/7/04","6/17/04","6/17/04","A","A","10/1/04","DPU","3/21/05","3/21/05","P","A","7/8/05","DPU","MI","MI","SD","MI","MI","G/ADP/N/139/ARG",8,8,1,-7,0,1,1.635902738,0.539893236,36.9714091,65.51084195,0,4784.691893,1490.380055,1.83e+11,1.93e+12,21.50024438,34.08005361,9.009673437,13.39314276,"1/7/04",2004-01-07,2004-01-07,298,227,2004-10-01,1.83e+11,1.93e+12,21.50024438,34.08005361,36.9714091,65.51084195,4784.691893,1490.380055,9.009673437,13.39314276,"Argentina ",1995-01-01,"China ",2001-12-11,1,1,NA,NA,"Argentina",1967-10-11,1,NA,-7,0,8,8,1,0,NA,NA,NA,NA,NA,NA,NA,NA,NA,2005,0,NA,NA,0
"444",NA,"ARG-AD-249",160,"2006",710,2005,710,160,"Q4_2012","Argentina","ARG-AD-249","China","CHN","Tape Measures","11/25/05","3/31/06","3/31/06","A","A","10/25/06","MI","4/23/07","4/23/07","A","A","5/18/07","DPU","IF","IF","DPU","MI","MI","G/ADP/N/158/ARG",8,8,1,-7,0,1,1.367110316,0.522731473,36.79644456,68.61870494,1,5767.657012,1731.125235,2.23e+11,2.26e+12,20.90371409,37.06949052,8.442570988,12.12302312,"11/25/05",2005-11-25,2005-11-25,NA,NA,2006-10-25,2.64e+11,2.71e+12,20.43197594,39.12622529,36.18660748,70.55319578,6783.713975,2069.34363,7.697516707,11.11345205,"Argentina ",1995-01-01,"China ",2001-12-11,1,1,NA,NA,"Argentina",1967-10-11,1,NA,-7,0,8,8,1,0,NA,NA,NA,NA,NA,NA,NA,NA,NA,2007,0,NA,NA,0
"446",NA,"ARG-AD-250",160,"2006",710,2005,710,160,"Q4_2012","Argentina","ARG-AD-250","China","CHN","Stainless Steel Tubes","11/25/05","4/11/06","4/11/06","A","A","8/28/06","DPU","4/16/07","4/16/07","A","A","6/1/07","AVD","5/18/12","2012","AVD","63.02","63.02","G/ADP/N/158/ARG",8,8,1,-7,0,1,1.367110316,0.522731473,36.79644456,68.61870494,1,5767.657012,1731.125235,2.23e+11,2.26e+12,20.90371409,37.06949052,8.442570988,12.12302312,"11/25/05",2005-11-25,2005-11-25,NA,NA,2006-08-28,2.64e+11,2.71e+12,20.43197594,39.12622529,36.18660748,70.55319578,6783.713975,2069.34363,7.697516707,11.11345205,"Argentina ",1995-01-01,"China ",2001-12-11,1,1,NA,NA,"Argentina",1967-10-11,1,NA,-7,0,8,8,1,0,NA,NA,NA,NA,NA,NA,NA,NA,NA,2007,0,NA,NA,0
"457",NA,"ARG-AD-260",160,"2007",380,2006,380,160,"Q4_2012","Argentina","ARG-AD-259","Sweden","SWE","Steel and Bimetal Handsaw Blades","8/17/06","2/16/07","2/16/07","A","A","5/22/07","DPU","1/17/08","1/17/08","A","A","2/14/08","DPU","IF","IF","DPU/PU","MI","MI","G/ADP/N/173/ARG",8,8,1,10,1,1,1.288344519,3.943866908,36.18660748,94.11770499,1,6783.713975,43948.62473,2.64e+11,3.99e+11,20.43197594,51.10702059,7.697516707,1.422346078,"8/17/06",2006-08-17,2006-08-17,NA,NA,2007-05-22,3.3e+11,4.63e+11,19.84009654,51.87020676,36.17108627,96.27945201,8384.187712,50558.39553,8.781106816,1.672098956,"Argentina ",1995-01-01,"Sweden ",1995-01-01,1,1,"Sweden",1950-04-30,"Argentina",1967-10-11,1,1,10,10,8,8,1,1,NA,NA,NA,NA,NA,NA,NA,NA,NA,2008,0,NA,NA,0
"461",NA,"ARG-AD-264",160,"2007",140,2007,140,160,"Q4_2012","Argentina","ARG-AD-264","Brazil","BRA","Flumetralin","2/14/07","8/22/07","8/22/07","A","A","11/27/07","AVD","7/18/08","7/18/08","A","A",".",".",".",".",".",".",".",".",8,8,1,8,1,1,1.250664487,3.781906964,36.17108627,25.20866345,1,8384.187712,7193.924995,3.3e+11,1.37e+12,19.84009654,13.36438031,8.781106816,5.562716551,"2/14/07",2007-02-14,2007-02-14,NA,NA,2007-11-27,3.3e+11,1.37e+12,19.84009654,13.36438031,36.17108627,25.20866345,8384.187712,7193.924995,8.781106816,5.562716551,"Argentina ",1995-01-01,"Brazil ",1995-01-01,1,1,"Brazil",1948-07-30,"Argentina",1967-10-11,1,1,8,8,8,8,1,1,NA,NA,NA,NA,NA,NA,NA,NA,NA,NA,0,NA,NA,0
"463",NA,"ARG-AD-266",160,"2008",710,2007,710,160,"Q4_2012","Argentina","ARG-AD-266","China","CHN","Electric Irons","4/20/07","9/21/07","9/21/07","A","A","2/28/08","DPU","9/5/08","9/5/08","A","A","10/23/08","SD","IF","IF","SD","MI","MI","G/ADP/N/180/ARG",8,8,1,-7,0,1,1.250664487,0.458951894,36.17108627,67.98414918,1,8384.187712,2651.260119,3.3e+11,3.49e+12,19.84009654,38.39804741,8.781106816,10.76971034,"4/20/07",2007-04-20,2007-04-20,NA,NA,2008-02-28,4.06e+11,4.52e+12,19.90643993,34.9816182,36.72246659,62.24882112,10232.95908,3413.588648,7.227886221,10.7315685,"Argentina ",1995-01-01,"China ",2001-12-11,1,1,NA,NA,"Argentina",1967-10-11,1,NA,-7,0,8,8,1,0,NA,NA,NA,NA,NA,NA,NA,NA,NA,2008,0,NA,NA,0
"464",NA,"ARG-AD-267",160,"2008",710,2007,710,160,"Q4_2012","Argentina","ARG-AD-267","China","CHN","Universal Joints and Tripods (Auto Parts)","7/11/07","1/30/08","1/30/08","A","A","4/11/08","DPU","10/24/08","10/24/08","A","A","1/6/09","SD","IF","IF","SD","MI","MI","G/ADP/N/188/ARG",8,8,1,-7,0,1,1.250664487,0.458951894,36.17108627,67.98414918,1,8384.187712,2651.260119,3.3e+11,3.49e+12,19.84009654,38.39804741,8.781106816,10.76971034,"7/11/07",2007-07-11,2007-07-11,NA,NA,2008-04-11,4.06e+11,4.52e+12,19.90643993,34.9816182,36.72246659,62.24882112,10232.95908,3413.588648,7.227886221,10.7315685,"Argentina ",1995-01-01,"China ",2001-12-11,1,1,NA,NA,"Argentina",1967-10-11,1,NA,-7,0,8,8,1,0,NA,NA,NA,NA,NA,NA,NA,NA,NA,2009,0,NA,NA,0
"465",NA,"ARG-AD-268",160,"2008",710,2007,710,160,"Q4_2012","Argentina","ARG-AD-268","China","CHN","Steel Chain","7/30/07","2/29/08","2/29/08","A","A","4/23/08","DPU","1/7/09","1/7/09","A","A","2/13/09","DPU","IF","IF","MI","MI","MI","MI",8,8,1,-7,0,1,1.250664487,0.458951894,36.17108627,67.98414918,1,8384.187712,2651.260119,3.3e+11,3.49e+12,19.84009654,38.39804741,8.781106816,10.76971034,"7/30/07",2007-07-30,2007-07-30,NA,NA,2008-04-23,4.06e+11,4.52e+12,19.90643993,34.9816182,36.72246659,62.24882112,10232.95908,3413.588648,7.227886221,10.7315685,"Argentina ",1995-01-01,"China ",2001-12-11,1,1,NA,NA,"Argentina",1967-10-11,1,NA,-7,0,8,8,1,0,NA,NA,NA,NA,NA,NA,NA,NA,NA,2009,0,NA,NA,0
"466",NA,"ARG-AD-269",160,"2009",710,2007,710,160,"Q4_2012","Argentina","ARG-AD-269","China","CHN","Electric Connection Terminals","10/2/07","5/27/08","5/27/08","A","A","2/23/09","AVD","3/6/09","3/6/09","A","A","4/1/09","AVD","IF","IF","AVD","873.81","873.81","G/ADP/N/188/ARG",8,8,1,-7,0,1,1.250664487,0.458951894,36.17108627,67.98414918,1,8384.187712,2651.260119,3.3e+11,3.49e+12,19.84009654,38.39804741,8.781106816,10.76971034,"10/2/07",2007-10-02,2007-10-02,NA,NA,2009-02-23,3.78e+11,4.99e+12,17.39562781,26.71609478,30.56244596,49.0212234,9456.816314,3748.504063,6.234805307,10.3331503,"Argentina ",1995-01-01,"China ",2001-12-11,1,1,NA,NA,"Argentina",1967-10-11,1,NA,-7,0,8,8,1,0,NA,NA,NA,NA,NA,NA,NA,NA,NA,2009,0,NA,NA,0
"468",NA,"ARG-AD-270",160,"2009",255,2007,255,160,"Q4_2012","Argentina","ARG-AD-269","Germany","DEU","Electric Connection Terminals","10/2/07","5/27/08","5/27/08","A","A","2/23/09","AVD","3/6/09","3/6/09","A","A","4/1/09","AVD","IF","IF","AVD/PU","74.58","199.63","G/ADP/N/188/ARG",8,8,1,10,1,1,1.250664487,0.813034244,36.17108627,87.33127445,1,8384.187712,40403.01773,3.3e+11,3.32e+12,19.84009654,47.16532839,8.781106816,0.87092729,"10/2/07",2007-10-02,2007-10-02,NA,NA,2009-02-23,3.78e+11,3.3e+12,17.39562781,42.46019712,30.56244596,80.00421195,9456.816314,40270.14217,6.234805307,0.750572731,"Argentina ",1995-01-01,"Germany ",1995-01-01,1,1,"Germany",1951-10-01,"Argentina",1967-10-11,1,1,10,10,8,8,1,1,NA,NA,NA,NA,NA,NA,NA,NA,NA,2009,0,NA,NA,0
"469",NA,"ARG-AD-272",160,"2009",800,2008,800,160,"Q4_2012","Argentina","ARG-AD-271","Thailand","THA","Air Conditioners","1/10/08","12/12/08","12/12/08","A","P","2/25/09","DPU","6/11/09","6/11/09","A","A","7/9/09","DPU","IF","IF","DPU","MI","MI","G/ADP/N/195/ARG",8,8,1,4,0,1,0.984658242,4.798852666,36.72246659,150.3260626,1,10232.95908,4118.401435,4.06e+11,2.73e+11,19.90643993,76.44460097,7.227886221,11.56045295,"1/10/08",2008-01-10,2008-01-10,NA,NA,2009-02-25,3.78e+11,2.64e+11,17.39562781,68.35167993,30.56244596,126.1573153,9456.816314,3978.905381,6.234805307,11.46469229,"Argentina ",1995-01-01,"Thailand ",1995-01-01,1,1,"Thailand",1982-11-20,"Argentina",1967-10-11,1,1,4,5,8,8,1,0,NA,NA,NA,NA,NA,NA,NA,NA,NA,2009,0,NA,NA,0
"471",NA,"ARG-AD-274",160,"2009",850,2008,850,160,"Q4_2012","Argentina","ARG-AD-273","Indonesia","IDN","Acrylic Yarns","3/25/08","10/7/08","10/7/08","A","A","4/13/09","AVD","9/3/09","9/3/09","A","A","9/25/09","AVD","IF","IF","AVD","20.71","20.71","G/ADP/N/195/ARG",8,8,1,8,1,1,0.984658242,6.433799857,36.72246659,58.56139963,1,10232.95908,2178.265663,4.06e+11,5.1e+11,19.90643993,29.80828417,7.227886221,14.48174026,"3/25/08",2008-03-25,2008-03-25,NA,NA,2009-04-13,3.78e+11,5.4e+11,17.39562781,24.15911967,30.56244596,45.51212137,9456.816314,2272.040982,6.234805307,15.29014815,"Argentina ",1995-01-01,"Indonesia ",1995-01-01,1,1,"Indonesia",1950-02-24,"Argentina",1967-10-11,1,1,8,8,8,8,1,1,NA,NA,NA,NA,NA,NA,NA,NA,NA,2009,0,NA,NA,0
"472",NA,"ARG-AD-275",160,"2009",140,2008,140,160,"Q4_2012","Argentina","ARG-AD-275","Brazil","BRA","Stainless Steel Cuttlery","4/25/08","12/29/08","12/29/08","A","A","2/23/09","AVD","9/29/09","9/29/09","A","A","10/27/09","DPU","IF","IF","DPU/PU","0","16.38","G/ADP/N/195/ARG",8,8,1,8,1,1,0.984658242,3.531257034,36.72246659,27.13633384,1,10232.95908,8622.551938,4.06e+11,1.65e+12,19.90643993,13.6631968,7.227886221,5.914162259,"4/25/08",2008-04-25,2008-04-25,NA,NA,2009-02-23,3.78e+11,1.62e+12,17.39562781,10.9789949,30.56244596,22.11829707,9456.816314,8373.45773,6.234805307,5.626726234,"Argentina ",1995-01-01,"Brazil ",1995-01-01,1,1,"Brazil",1948-07-30,"Argentina",1967-10-11,1,1,8,8,8,8,1,1,NA,NA,NA,NA,NA,NA,NA,NA,NA,2009,0,NA,NA,0
"473",NA,"ARG-AD-276",160,"2009",710,2008,710,160,"Q4_2012","Argentina","ARG-AD-275","China","CHN","Stainless Steel Cuttlery","4/25/08","12/29/08","12/29/08","A","A","2/23/09","AVD","9/29/09","9/29/09","A","A","10/27/09","AVD","IF","IF","AVD","1450.21","1450.21","G/ADP/N/195/ARG",8,8,1,-7,0,1,0.984658242,0.434411564,36.72246659,62.24882112,1,10232.95908,3413.588648,4.06e+11,4.52e+12,19.90643993,34.9816182,7.227886221,10.7315685,"4/25/08",2008-04-25,2008-04-25,NA,NA,2009-02-23,3.78e+11,4.99e+12,17.39562781,26.71609478,30.56244596,49.0212234,9456.816314,3748.504063,6.234805307,10.3331503,"Argentina ",1995-01-01,"China ",2001-12-11,1,1,NA,NA,"Argentina",1967-10-11,1,NA,-7,0,8,8,1,0,NA,NA,NA,NA,NA,NA,NA,NA,NA,2009,0,NA,NA,0
"474",NA,"ARG-AD-277",160,"2009",710,2008,710,160,"Q4_2012","Argentina","ARG-AD-277","China","CHN","Large Chains","4/28/08","12/12/08","12/12/08","A","A","4/1/09","DPU","9/29/09","9/29/09","A","A","10/24/09","DPU","IF","IF","MI","MI","MI","G/ADP/N/195/ARG",8,8,1,-7,0,1,0.984658242,0.434411564,36.72246659,62.24882112,1,10232.95908,3413.588648,4.06e+11,4.52e+12,19.90643993,34.9816182,7.227886221,10.7315685,"4/28/08",2008-04-28,2008-04-28,NA,NA,2009-04-01,3.78e+11,4.99e+12,17.39562781,26.71609478,30.56244596,49.0212234,9456.816314,3748.504063,6.234805307,10.3331503,"Argentina ",1995-01-01,"China ",2001-12-11,1,1,NA,NA,"Argentina",1967-10-11,1,NA,-7,0,8,8,1,0,NA,NA,NA,NA,NA,NA,NA,NA,NA,2009,0,NA,NA,0
"475",NA,"ARG-AD-278",160,"2009",710,2008,710,160,"Q4_2012","Argentina","ARG-AD-278","China","CHN","Zippers","5/5/08","10/24/08","10/24/08","A","A","1/15/09","AVD","8/21/09","8/21/09","A","A","10/1/09","DPU","IF","IF","DPU","MI","MI","G/ADP/N/195/ARG",8,8,1,-7,0,1,0.984658242,0.434411564,36.72246659,62.24882112,1,10232.95908,3413.588648,4.06e+11,4.52e+12,19.90643993,34.9816182,7.227886221,10.7315685,"5/5/08",2008-05-05,2008-05-05,NA,NA,2009-01-15,3.78e+11,4.99e+12,17.39562781,26.71609478,30.56244596,49.0212234,9456.816314,3748.504063,6.234805307,10.3331503,"Argentina ",1995-01-01,"China ",2001-12-11,1,1,NA,NA,"Argentina",1967-10-11,1,NA,-7,0,8,8,1,0,NA,NA,NA,NA,NA,NA,NA,NA,NA,2009,0,NA,NA,0
"478",NA,"ARG-AD-281",160,"2009",710,2008,710,160,"Q4_2012","Argentina","ARG-AD-281","China","CHN","Oil Rigs","5/22/08","12/23/08","12/23/08","A","A","4/17/09","AVD","11/3/09","11/3/09","A","A","11/21/09","AVD","IF","IF","AVD","28","64","G/ADP/N/195/ARG",8,8,1,-7,0,1,0.984658242,0.434411564,36.72246659,62.24882112,1,10232.95908,3413.588648,4.06e+11,4.52e+12,19.90643993,34.9816182,7.227886221,10.7315685,"5/22/08",2008-05-22,2008-05-22,NA,NA,2009-04-17,3.78e+11,4.99e+12,17.39562781,26.71609478,30.56244596,49.0212234,9456.816314,3748.504063,6.234805307,10.3331503,"Argentina ",1995-01-01,"China ",2001-12-11,1,1,NA,NA,"Argentina",1967-10-11,1,NA,-7,0,8,8,1,0,NA,NA,NA,NA,NA,NA,NA,NA,NA,2009,0,NA,NA,0
"480",NA,"ARG-AD-283",160,"2009",710,2008,710,160,"Q4_2012","Argentina","ARG-AD-283","China","CHN","Cooling Liquid or Water for Engines","7/28/08","2/27/09","2/27/09","A","A","4/27/09","DPU","7/3/09","12/23/09","A","A","1/27/10","AVD","IF","IF","AVD","287","287","G/ADP/N/202/ARG",8,8,1,-7,0,1,0.984658242,0.434411564,36.72246659,62.24882112,1,10232.95908,3413.588648,4.06e+11,4.52e+12,19.90643993,34.9816182,7.227886221,10.7315685,"7/28/08",2008-07-28,2008-07-28,NA,NA,2009-04-27,3.78e+11,4.99e+12,17.39562781,26.71609478,30.56244596,49.0212234,9456.816314,3748.504063,6.234805307,10.3331503,"Argentina ",1995-01-01,"China ",2001-12-11,1,1,NA,NA,"Argentina",1967-10-11,1,NA,-7,0,8,8,1,0,NA,NA,NA,NA,NA,NA,NA,NA,NA,2010,0,NA,NA,0
"481",NA,"ARG-AD-284",160,"2009",710,2008,710,160,"Q4_2012","Argentina","ARG-AD-284","China","CHN","Dyes","7/29/08","7/13/09","7/13/09","A","A","9/10/09","DPU","12/28/09","1/13/10","A","A","1/26/10","AVD","IF","IF","AVD","30.1","60.5","G/ADP/N/202/ARG",8,8,1,-7,0,1,0.984658242,0.434411564,36.72246659,62.24882112,1,10232.95908,3413.588648,4.06e+11,4.52e+12,19.90643993,34.9816182,7.227886221,10.7315685,"7/29/08",2008-07-29,2008-07-29,NA,NA,2009-09-10,3.78e+11,4.99e+12,17.39562781,26.71609478,30.56244596,49.0212234,9456.816314,3748.504063,6.234805307,10.3331503,"Argentina ",1995-01-01,"China ",2001-12-11,1,1,NA,NA,"Argentina",1967-10-11,1,NA,-7,0,8,8,1,0,NA,NA,NA,NA,NA,NA,NA,NA,NA,2010,0,NA,NA,0
"482",NA,"ARG-AD-285",160,"2009",750,2008,750,160,"Q4_2012","Argentina","ARG-AD-284","India","IND","Dyes","7/29/08","7/13/09","7/13/09","A","A","9/10/09","DPU","12/28/09","1/13/10","A","A","1/26/10","AVD","IF","IF","AVD","42.93","63","G/ADP/N/202/ARG",8,8,1,9,1,1,0.984658242,1.735424467,36.72246659,52.26948525,1,10232.95908,1042.084209,4.06e+11,1.22e+12,19.90643993,23.60124526,7.227886221,17.78433572,"7/29/08",2008-07-29,2008-07-29,NA,NA,2009-09-10,3.78e+11,1.37e+12,17.39562781,20.04962324,30.56244596,45.47695995,9456.816314,1147.238685,6.234805307,17.73663649,"Argentina ",1995-01-01,"India ",1995-01-01,1,1,"India",1948-07-08,"Argentina",1967-10-11,1,1,9,9,8,8,1,1,NA,NA,NA,NA,NA,NA,NA,NA,NA,2010,0,NA,NA,0
"483",NA,"ARG-AD-286",160,"2009",710,2008,710,160,"Q4_2012","Argentina","ARG-AD-286","China","CHN","Dishware","7/31/08","12/29/08","12/29/08","A","A","4/7/09","DPU","7/13/09","7/13/09","A","A","9/19/09","DPU","IF","IF","DPU","MI","MI","G/ADP/N/195/ARG",8,8,1,-7,0,1,0.984658242,0.434411564,36.72246659,62.24882112,1,10232.95908,3413.588648,4.06e+11,4.52e+12,19.90643993,34.9816182,7.227886221,10.7315685,"7/31/08",2008-07-31,2008-07-31,NA,NA,2009-04-07,3.78e+11,4.99e+12,17.39562781,26.71609478,30.56244596,49.0212234,9456.816314,3748.504063,6.234805307,10.3331503,"Argentina ",1995-01-01,"China ",2001-12-11,1,1,NA,NA,"Argentina",1967-10-11,1,NA,-7,0,8,8,1,0,NA,NA,NA,NA,NA,NA,NA,NA,NA,2009,0,NA,NA,0
"484",NA,"ARG-AD-287",160,"2009",710,2008,710,160,"Q4_2012","Argentina","ARG-AD-287","China","CHN","Steel Pipe Accessories","10/23/08","3/6/09","3/6/09","A","A","4/29/09","DPU","9/4/09","9/4/09","A","A","10/23/09","DPU","IF","IF","DPU","MI","MI","G/ADP/N/195/ARG",8,8,1,-7,0,1,0.984658242,0.434411564,36.72246659,62.24882112,1,10232.95908,3413.588648,4.06e+11,4.52e+12,19.90643993,34.9816182,7.227886221,10.7315685,"10/23/08",2008-10-23,2008-10-23,NA,NA,2009-04-29,3.78e+11,4.99e+12,17.39562781,26.71609478,30.56244596,49.0212234,9456.816314,3748.504063,6.234805307,10.3331503,"Argentina ",1995-01-01,"China ",2001-12-11,1,1,NA,NA,"Argentina",1967-10-11,1,NA,-7,0,8,8,1,0,NA,NA,NA,NA,NA,NA,NA,NA,NA,2009,0,NA,NA,0
"485",NA,"ARG-AD-288",160,"2009",710,2008,710,160,"Q4_2012","Argentina","ARG-AD-288","China","CHN","Polyester Fiber and Yarn","11/17/08","7/3/09","7/3/09","P","A","9/19/09","DPU","12/17/09","4/20/10","A","P","5/15/10","AVD","IF","IF","AVD","14.2","14.2","G/ADP/N/202/ARG",8,8,1,-7,0,1,0.984658242,0.434411564,36.72246659,62.24882112,1,10232.95908,3413.588648,4.06e+11,4.52e+12,19.90643993,34.9816182,7.227886221,10.7315685,"11/17/08",2008-11-17,2008-11-17,NA,NA,2009-09-19,3.78e+11,4.99e+12,17.39562781,26.71609478,30.56244596,49.0212234,9456.816314,3748.504063,6.234805307,10.3331503,"Argentina ",1995-01-01,"China ",2001-12-11,1,1,NA,NA,"Argentina",1967-10-11,1,NA,-7,0,8,8,1,0,NA,NA,NA,NA,NA,NA,NA,NA,NA,2010,0,NA,NA,0
"486",NA,"ARG-AD-289",160,"2009",750,2008,750,160,"Q4_2012","Argentina","ARG-AD-288","India","IND","Polyester Fiber and Yarn","11/17/08","7/3/09","7/3/09","P","A","9/19/09","DPU","12/17/09","4/20/10","A","N",".",".",".",".",".",".",".",".",8,8,1,9,1,1,0.984658242,1.735424467,36.72246659,52.26948525,1,10232.95908,1042.084209,4.06e+11,1.22e+12,19.90643993,23.60124526,7.227886221,17.78433572,"11/17/08",2008-11-17,2008-11-17,NA,NA,2009-09-19,3.78e+11,1.37e+12,17.39562781,20.04962324,30.56244596,45.47695995,9456.816314,1147.238685,6.234805307,17.73663649,"Argentina ",1995-01-01,"India ",1995-01-01,1,1,"India",1948-07-08,"Argentina",1967-10-11,1,1,9,9,8,8,1,1,NA,NA,NA,NA,NA,NA,NA,NA,NA,NA,0,NA,NA,0
"488",NA,"ARG-AD-290",160,"2009",850,2008,850,160,"Q4_2012","Argentina","ARG-AD-288","Indonesia","IDN","Polyester Fiber and Yarn","11/17/08","7/3/09","7/3/09","P","A","9/19/09","DPU","12/17/09","4/20/10","A","A","5/15/10","AVD","IF","IF","AVD","0","7.52","G/ADP/N/202/ARG",8,8,1,8,1,1,0.984658242,6.433799857,36.72246659,58.56139963,1,10232.95908,2178.265663,4.06e+11,5.1e+11,19.90643993,29.80828417,7.227886221,14.48174026,"11/17/08",2008-11-17,2008-11-17,NA,NA,2009-09-19,3.78e+11,5.4e+11,17.39562781,24.15911967,30.56244596,45.51212137,9456.816314,2272.040982,6.234805307,15.29014815,"Argentina ",1995-01-01,"Indonesia ",1995-01-01,1,1,"Indonesia",1950-02-24,"Argentina",1967-10-11,1,1,8,8,8,8,1,1,NA,NA,NA,NA,NA,NA,NA,NA,NA,2010,0,NA,NA,0
"490",NA,"ARG-AD-292",160,"2009",140,2009,140,160,"Q4_2012","Argentina","ARG-AD-292","Brazil","BRA","Certain Taffeta Ligament Weft and Warp Fabrics","1/6/09","7/24/09","7/24/09","A","A","9/5/09","DPU","6/14/10","6/28/10","A","N","7/8/10",".",".",".",".",".",".",".",8,8,1,8,1,1,1.081750961,3.770853971,30.56244596,22.11829707,1,9456.816314,8373.45773,3.78e+11,1.62e+12,17.39562781,10.9789949,6.234805307,5.626726234,"1/6/09",2009-01-06,2009-01-06,NA,NA,2009-09-05,3.78e+11,1.62e+12,17.39562781,10.9789949,30.56244596,22.11829707,9456.816314,8373.45773,6.234805307,5.626726234,"Argentina ",1995-01-01,"Brazil ",1995-01-01,1,1,"Brazil",1948-07-30,"Argentina",1967-10-11,1,1,8,8,8,8,1,1,NA,NA,NA,NA,NA,NA,NA,NA,NA,2010,0,NA,NA,0
"491",NA,"ARG-AD-293",160,"2009",710,2009,710,160,"Q4_2012","Argentina","ARG-AD-292","China","CHN","Certain Taffeta Ligament Weft and Warp Fabrics","1/6/09","7/24/09","7/24/09","A","A","9/5/09","DPU","6/14/10","6/28/10","A","A","7/8/10","MI","IF","IF","DPU","MI","MI","G/ADP/N/209/ARG",8,8,1,-7,0,1,1.081750961,0.448398182,30.56244596,49.0212234,1,9456.816314,3748.504063,3.78e+11,4.99e+12,17.39562781,26.71609478,6.234805307,10.3331503,"1/6/09",2009-01-06,2009-01-06,NA,NA,2009-09-05,3.78e+11,4.99e+12,17.39562781,26.71609478,30.56244596,49.0212234,9456.816314,3748.504063,6.234805307,10.3331503,"Argentina ",1995-01-01,"China ",2001-12-11,1,1,NA,NA,"Argentina",1967-10-11,1,NA,-7,0,8,8,1,0,NA,NA,NA,NA,NA,NA,NA,NA,NA,2010,0,NA,NA,0
"497",NA,"ARG-AD-299",160,"2009",710,2009,710,160,"Q4_2012","Argentina","ARG-AD-299","China","CHN","Footwear","3/2/09","6/22/09","6/22/09","A","P","7/21/09","DPU","12/29/09","2/12/10","A","A","3/17/10","DPU","IF","IF","DPU","MI","MI","G/ADP/N/202/ARG",8,8,1,-7,0,1,1.081750961,0.448398182,30.56244596,49.0212234,1,9456.816314,3748.504063,3.78e+11,4.99e+12,17.39562781,26.71609478,6.234805307,10.3331503,"3/2/09",2009-03-02,2009-03-02,NA,NA,2009-07-21,3.78e+11,4.99e+12,17.39562781,26.71609478,30.56244596,49.0212234,9456.816314,3748.504063,6.234805307,10.3331503,"Argentina ",1995-01-01,"China ",2001-12-11,1,1,NA,NA,"Argentina",1967-10-11,1,NA,-7,0,8,8,1,0,NA,NA,NA,NA,NA,NA,NA,NA,NA,2010,0,NA,NA,0
"500",NA,"ARG-AD-300",160,"2009",710,2009,710,160,"Q4_2012","Argentina","ARG-AD-300","China","CHN","Steel Wheels","3/9/09","7/16/09","8/7/09","A","A","11/20/09","DPU","2/7/11","4/18/11","A","A","MI","MI","MI","MI","MI","MI","MI","MI",8,8,1,-7,0,1,1.081750961,0.448398182,30.56244596,49.0212234,1,9456.816314,3748.504063,3.78e+11,4.99e+12,17.39562781,26.71609478,6.234805307,10.3331503,"3/9/09",2009-03-09,2009-03-09,NA,NA,2009-11-20,3.78e+11,4.99e+12,17.39562781,26.71609478,30.56244596,49.0212234,9456.816314,3748.504063,6.234805307,10.3331503,"Argentina ",1995-01-01,"China ",2001-12-11,1,1,NA,NA,"Argentina",1967-10-11,1,NA,-7,0,8,8,1,0,NA,NA,NA,NA,NA,NA,NA,NA,NA,NA,0,NA,NA,0
"503",NA,"ARG-AD-303",160,"2009",150,2009,150,160,"Q4_2012","Argentina","ARG-AD-303","Paraguay","PRY","Recordable Compact Discs","3/25/09","7/20/09","7/20/09","A","A","9/19/09","DPU","4/8/10","5/21/10","A","A","10/1/10","DPU","9/30/12","2012","DPU/PU","MI","MI","G/ADP/N/209/ARG",8,8,1,8,1,1,1.081750961,3.901193148,30.56244596,96.28696148,0,9456.816314,2509.680462,3.78e+11,15929903100,17.39562781,51.54015367,6.234805307,18.91695742,"3/25/09",2009-03-25,2009-03-25,NA,NA,2009-09-19,3.78e+11,15929903100,17.39562781,51.54015367,30.56244596,96.28696148,9456.816314,2509.680462,6.234805307,18.91695742,"Argentina ",1995-01-01,"Paraguay ",1995-01-01,1,1,"Paraguay",1994-01-06,"Argentina",1967-10-11,1,1,8,9,8,8,1,1,NA,NA,NA,NA,NA,NA,NA,NA,NA,2010,0,NA,NA,0
"504",NA,"ARG-AD-304",160,"2009",710,2009,710,160,"Q4_2012","Argentina","ARG-AD-304","China","CHN","Denim","3/25/09","9/28/09","9/28/09","A","A","11/9/09","DPU","1/18/10","3/12/10","A","A","9/9/10","DPU","IF","IF","DPU","MI","MI","G/ADP/N/209/ARG",8,8,1,-7,0,1,1.081750961,0.448398182,30.56244596,49.0212234,1,9456.816314,3748.504063,3.78e+11,4.99e+12,17.39562781,26.71609478,6.234805307,10.3331503,"3/25/09",2009-03-25,2009-03-25,NA,NA,2009-11-09,3.78e+11,4.99e+12,17.39562781,26.71609478,30.56244596,49.0212234,9456.816314,3748.504063,6.234805307,10.3331503,"Argentina ",1995-01-01,"China ",2001-12-11,1,1,NA,NA,"Argentina",1967-10-11,1,NA,-7,0,8,8,1,0,NA,NA,NA,NA,NA,NA,NA,NA,NA,2010,0,NA,NA,0
"507",NA,"ARG-AD-307",160,"2010",710,2009,710,160,"Q4_2012","Argentina","ARG-AD-307","China","CHN","Elevator and Forklift Engines","5/29/09","9/16/09","10/6/09","A","A","3/3/10","DPU","5/17/10","6/14/10","A","A","12/4/10","AVD","IF","IF","AVD","149","295.61","G/ADP/N/209/ARG",8,8,1,-7,0,1,1.081750961,0.448398182,30.56244596,49.0212234,1,9456.816314,3748.504063,3.78e+11,4.99e+12,17.39562781,26.71609478,6.234805307,10.3331503,"5/29/09",2009-05-29,2009-05-29,NA,NA,2010-03-03,4.63e+11,5.93e+12,17.49945351,29.396777,32.53587923,55.03337471,11460.37615,4433.340886,8.177986442,10.09522,"Argentina ",1995-01-01,"China ",2001-12-11,1,1,NA,NA,"Argentina",1967-10-11,1,NA,-7,0,8,8,1,0,NA,NA,NA,NA,NA,NA,NA,NA,NA,2010,0,NA,NA,0
"508",NA,"ARG-AD-308",160,"2010",710,2009,710,160,"Q4_2012","Argentina","ARG-AD-308","China","CHN","Lighters used in Kitchens","7/7/09","11/11/09","1/27/10","A","A","3/20/10","DPU","9/15/10","12/16/10","A","A",".",".",".",".",".",".",".",".",8,8,1,-7,0,1,1.081750961,0.448398182,30.56244596,49.0212234,1,9456.816314,3748.504063,3.78e+11,4.99e+12,17.39562781,26.71609478,6.234805307,10.3331503,"7/7/09",2009-07-07,2009-07-07,NA,NA,2010-03-20,4.63e+11,5.93e+12,17.49945351,29.396777,32.53587923,55.03337471,11460.37615,4433.340886,8.177986442,10.09522,"Argentina ",1995-01-01,"China ",2001-12-11,1,1,NA,NA,"Argentina",1967-10-11,1,NA,-7,0,8,8,1,0,NA,NA,NA,NA,NA,NA,NA,NA,NA,NA,0,NA,NA,0
"511",NA,"ARG-AD-310",160,"2010",750,2009,750,160,"Q4_2012","Argentina","ARG-AD-310","India","IND","Connectors for metal conductors","7/16/09","12/4/09","1/29/10","A","A","5/27/10","DPU","8/9/10","12/7/10","A","A","1/21/11","DPU","IF","IF","DPU","MI","MI","G/ADP/N/216/ARG",8,8,1,9,1,1,1.081750961,1.164823488,30.56244596,45.47695995,1,9456.816314,1147.238685,3.78e+11,1.37e+12,17.39562781,20.04962324,6.234805307,17.73663649,"7/16/09",2009-07-16,2009-07-16,NA,NA,2010-05-27,4.63e+11,1.71e+12,17.49945351,21.97029603,32.53587923,48.30832072,11460.37615,1417.073614,8.177986442,18.20542941,"Argentina ",1995-01-01,"India ",1995-01-01,1,1,"India",1948-07-08,"Argentina",1967-10-11,1,1,9,9,8,8,1,1,NA,NA,NA,NA,NA,NA,NA,NA,NA,2011,0,NA,NA,0
"514",NA,"ARG-AD-313",160,"2010",140,2009,140,160,"Q4_2012","Argentina","ARG-AD-313","Brazil","BRA","Gas Compressors (except air)","9/9/09","12/21/09","3/10/10","A","A","7/14/10","AVD","2/21/11","3/1/11","A","A","4/12/11","AVD","IF","IF","AVD","33","33","G/ADP/N/216/ARG",8,8,1,8,1,1,1.081750961,3.770853971,30.56244596,22.11829707,1,9456.816314,8373.45773,3.78e+11,1.62e+12,17.39562781,10.9789949,6.234805307,5.626726234,"9/9/09",2009-09-09,2009-09-09,NA,NA,2010-07-14,4.63e+11,2.14e+12,17.49945351,10.87158512,32.53587923,22.77449978,11460.37615,10978.26024,8.177986442,5.304226816,"Argentina ",1995-01-01,"Brazil ",1995-01-01,1,1,"Brazil",1948-07-30,"Argentina",1967-10-11,1,1,8,8,8,8,1,1,NA,NA,NA,NA,NA,NA,NA,NA,NA,2011,0,NA,NA,0
"537",NA,"ARG-AD-334",160,"2012",710,2011,710,160,"Q4_2012","Argentina","ARG-AD-334","China","CHN","Single-Phase Motors","3/3/11","7/15/11","9/2/11","A","A","6/14/12","SD","8/2/12","8/7/12","A","A","9/5/12","SD","IF","IF","SD","MI","MI","G/ADP/N/237/ARG",8,8,1,-7,0,1,1.267100676,0.533552859,33.92136319,54.57721811,1,13693.70379,5447.309378,5.58e+11,7.32e+12,17.78503379,28.53028081,7.789211397,10.03716006,"3/3/11",2011-03-03,2011-03-03,NA,NA,2012-06-14,6.03e+11,8.23e+12,15.79885439,27.32111234,29.86297529,51.82489065,14679.92524,6092.781886,6.909453618,10.08212511,"Argentina ",1995-01-01,"China ",2001-12-11,1,1,NA,NA,"Argentina",1967-10-11,1,NA,-7,0,8,8,1,0,NA,NA,NA,NA,NA,NA,NA,NA,NA,2012,0,NA,NA,0
"538",NA,"ARG-AD-335",160,"2012",2,2011,2,160,"Q4_2012","Argentina","ARG-AD-335","USA","USA","Film for X-Ray","3/28/11","7/12/11","10/25/11","A","A","6/8/12","AVD","10/1/12","10/1/12","T","T",".",".",".",".",".",".",".",".",8,8,1,10,1,1,1.267100676,2.801760143,33.92136319,30.71366955,1,13693.70379,49854.52267,5.58e+11,1.55e+13,17.78503379,13.52598849,7.789211397,1.24542282,"3/28/11",2011-03-28,2011-03-28,NA,NA,2012-06-08,6.03e+11,1.62e+13,15.79885439,13.51772281,29.86297529,30.40394962,14679.92524,51755.21484,6.909453618,NA,"Argentina ",1995-01-01,"United States of America",1995-01-01,1,1,"United States of America",1948-01-01,"Argentina",1967-10-11,1,1,10,10,8,8,1,1,NA,NA,NA,NA,NA,NA,NA,NA,NA,NA,0,NA,NA,0
"544",NA,"ARG-AD-340",160,"2012",710,2011,710,160,"Q4_2012","Argentina","ARG-AD-340","China","CHN","Porcelain Floor Tiles","7/26/11","11/4/11","4/13/12","A","A","8/28/12","SD","MI","MI","MI","MI","MI","MI","MI","MI","MI","MI","MI","MI",8,8,1,-7,0,1,1.267100676,0.533552859,33.92136319,54.57721811,1,13693.70379,5447.309378,5.58e+11,7.32e+12,17.78503379,28.53028081,7.789211397,10.03716006,"7/26/11",2011-07-26,2011-07-26,NA,NA,2012-08-28,6.03e+11,8.23e+12,15.79885439,27.32111234,29.86297529,51.82489065,14679.92524,6092.781886,6.909453618,10.08212511,"Argentina ",1995-01-01,"China ",2001-12-11,1,1,NA,NA,"Argentina",1967-10-11,1,NA,-7,0,8,8,1,0,NA,NA,NA,NA,NA,NA,NA,NA,NA,NA,0,NA,NA,0
"593",NA,"ARG-AD-68",160,"1995",255,1994,255,160,"Q4_2012","Argentina","ARG-AD-68","Germany","DEU","Portland Cement","9/23/94","4/25/95","4/25/95","A","A","5/11/95","DPU","2/21/96","2/21/96","A","N",".",".",".",".",".",".",".",".",7,7,1,10,1,0,3.360702032,1.051335235,14.97014353,45.33497924,1,9065.649524,26375.84573,3.12e+11,2.15e+12,6.21608196,22.83469869,4.662412404,1.06979177,"9/23/94",1994-09-23,1994-09-23,4375,2268,1995-05-11,3.13e+11,2.52e+12,7.991430122,23.74087098,16.32174519,46.88720584,8973.321347,30887.86549,4.909063075,1.094530339,"Argentina ",1995-01-01,"Germany ",1995-01-01,1,1,"Germany",1951-10-01,"Argentina",1967-10-11,1,1,10,10,7,7,1,1,NA,NA,NA,NA,NA,NA,NA,NA,NA,NA,0,NA,NA,0
"600",NA,"ARG-AD-74",160,"1995",732,1994,732,160,"Q4_2012","Argentina","ARG-AD-74","South Korea","KOR","Microwave Ovens","10/5/94","4/4/95","4/4/95","A","A","4/13/95","DPU","8/28/96","8/28/96","A","A","9/4/96","DPU","MI","2001","DPU","17.35","80.95","G/ADP/N/22/ARG",7,7,1,6,1,0,3.360702032,1.323078828,14.97014353,49.86423672,1,9065.649524,10275.27753,3.12e+11,4.59e+11,6.21608196,24.58952874,4.662412404,6.1667875,"10/5/94",1994-10-05,1994-10-05,587,2280,1995-04-13,3.13e+11,5.59e+11,7.991430122,26.65268255,16.32174519,54.3156478,8973.321347,12403.91322,4.909063075,5.821741134,"Argentina ",1995-01-01,"South Korea",1995-01-01,1,1,"South Korea",1967-04-14,"Argentina",1967-10-11,1,1,6,7,7,7,1,1,NA,NA,NA,NA,NA,NA,NA,NA,NA,1996,0,NA,NA,0
"609",NA,"ARG-AD-82",160,"1996",140,1995,140,160,"Q4_2012","Argentina","ARG-AD-82","Brazil","BRA","Chain Saws","10/31/95","3/6/96","3/6/96","A","A","7/12/96","SD","10/28/96","10/28/96","A","A","5/6/97","SD","MI","2000","MI","63.33","96","G/ADP/N/29/ARG",7,7,1,8,1,1,4.31885235,5.225324721,16.32174519,16.03180654,1,8973.321347,4749.814207,3.13e+11,7.69e+11,7.991430122,7.256806223,4.909063075,5.771250392,"10/31/95",1995-10-31,1995-10-31,303,2671,1996-07-12,3.3e+11,8.4e+11,8.608956961,6.566741512,17.75390254,14.93284674,9348.6424,5107.79392,5.082520723,5.513690332,"Argentina ",1995-01-01,"Brazil ",1995-01-01,1,1,"Brazil",1948-07-30,"Argentina",1967-10-11,1,1,8,8,7,7,1,1,NA,NA,NA,NA,NA,NA,NA,NA,NA,1997,0,NA,NA,0
"614",NA,"ARG-AD-87",160,"1996",732,1995,732,160,"Q4_2012","Argentina","ARG-AD-87","South Korea","KOR","Washing Machine Motors","12/5/95","4/23/96","4/23/96","A","A","9/2/96","DPU","11/26/96","11/26/96","A","A","1/26/98","DPU","MI","2001","DPU","MI","MI","G/ADP/N/41/ARG",7,7,1,6,1,1,4.31885235,1.323774781,16.32174519,54.3156478,1,8973.321347,12403.91322,3.13e+11,5.59e+11,7.991430122,26.65268255,4.909063075,5.821741134,"12/5/95",1995-12-05,1995-12-05,1013,2706,1996-09-02,3.3e+11,6.03e+11,8.608956961,25.74861093,17.75390254,54.70820165,9348.6424,13254.6374,5.082520723,5.457582593,"Argentina ",1995-01-01,"South Korea",1995-01-01,1,1,"South Korea",1967-04-14,"Argentina",1967-10-11,1,1,6,7,7,7,1,1,NA,NA,NA,NA,NA,NA,NA,NA,NA,1998,0,NA,NA,0
"840",NA,"AUS-AD-291",900,"1995",2,1995,2,900,"Q4_2012","Australia","AUS-AD-291","USA","USA","Wound Closure Strips","9/20/95","12/22/95","12/22/95","A","A","12/22/95","AVD","4/29/96","4/29/96","N ","N ",".",".",".",".",".",".",".",".",10,10,1,10,1,1,8.341132311,3.862870077,37.70290489,22.38256785,0,20375.30175,28781.94969,3.68e+11,7.66e+12,17.86793084,10.60542797,3.308578251,1.607811468,"9/20/95",1995-09-20,1995-09-20,973,1371,1995-12-22,3.68e+11,7.66e+12,17.86793084,10.60542797,37.70290489,22.38256785,20375.30175,28781.94969,3.308578251,1.607811468,"Australia ",1995-01-01,"United States of America",1995-01-01,1,1,"United States of America",1948-01-01,"Australia",1948-01-01,1,1,10,10,10,10,1,1,NA,NA,NA,NA,NA,NA,NA,NA,NA,NA,0,NA,NA,0
"843",NA,"AUS-AD-294",900,"1996",800,1996,800,900,"Q4_2012","Australia","AUS-AD-294","Thailand","THA","Certain Refrigerators","1/23/96","5/2/96","5/2/96","A","A","5/2/96","MI","9/5/96","9/5/96","A","A","9/5/96","MI","9/17/01","2001","PU","MI","MI","G/ADP/N/22/AUS",10,10,1,9,1,1,7.485201636,5.361374003,38.19513983,84.77790103,0,21931.06145,3054.753307,4.02e+11,1.82e+11,18.87897189,39.25165463,3.713981273,9.501520234,"1/23/96",1996-01-23,1996-01-23,194,1496,1996-05-02,4.02e+11,1.82e+11,18.87897189,39.25165463,38.19513983,84.77790103,21931.06145,3054.753307,3.713981273,9.501520234,"Australia ",1995-01-01,"Thailand ",1995-01-01,1,1,"Thailand",1982-11-20,"Australia",1948-01-01,1,1,9,9,10,10,1,1,NA,NA,NA,NA,NA,NA,NA,NA,NA,1996,0,NA,NA,0
"844",NA,"AUS-AD-295",900,"1996",732,1996,732,900,"Q4_2012","Australia","AUS-AD-295","South Korea","KOR","Polyvinyl Chloride","3/19/96","7/5/96","7/5/96","A","A","7/5/96","AVD","11/8/96","11/8/96","N","N",".",".",".",".",".",".",".",".",10,10,1,6,1,1,7.485201636,1.161825166,38.19513983,54.70820165,1,21931.06145,13254.6374,4.02e+11,6.03e+11,18.87897189,25.74861093,3.713981273,5.457582593,"3/19/96",1996-03-19,1996-03-19,1118,8,1996-07-05,4.02e+11,6.03e+11,18.87897189,25.74861093,38.19513983,54.70820165,21931.06145,13254.6374,3.713981273,5.457582593,"Australia ",1995-01-01,"South Korea",1995-01-01,1,1,"South Korea",1967-04-14,"Australia",1948-01-01,1,1,6,7,10,10,1,1,NA,NA,NA,NA,NA,NA,NA,NA,NA,NA,0,NA,NA,0
"845",NA,"AUS-AD-296",900,"1996",211,1996,211,900,"Q4_2012","Australia","AUS-AD-295","Belgium","BEL","Polyvinyl Chloride","3/27/96","7/5/96","7/5/96","A","A","7/5/96","AVD","11/8/96","11/8/96","N","N",".",".",".",".",".",".",".",".",10,10,1,10,1,1,7.485201636,1.094412634,38.19513983,128.1050105,0,21931.06145,27154.33688,4.02e+11,2.76e+11,18.87897189,65.62308078,3.713981273,1.494401265,"3/27/96",1996-03-27,1996-03-27,1481,16,1996-07-05,4.02e+11,2.76e+11,18.87897189,65.62308078,38.19513983,128.1050105,21931.06145,27154.33688,3.713981273,1.494401265,"Australia ",1995-01-01,"Belgium ",1995-01-01,1,1,"Belgium",1948-01-01,"Australia",1948-01-01,1,1,10,10,10,10,1,1,NA,NA,NA,NA,NA,NA,NA,NA,NA,NA,0,NA,NA,0
"847",NA,"AUS-AD-298",900,"1996",820,1996,820,900,"Q4_2012","Australia","AUS-AD-298","Malaysia","MYS","Sodium Stearoyle Lactylate","4/19/96","7/28/96","7/28/96","A","A","7/28/96","AVD","11/27/96","11/27/96","A","A","11/27/96","AVD","1/29/02","2002","AVD","4","46","G/ADP/N/29/AUS",10,10,1,3,0,1,7.485201636,5.206961761,38.19513983,181.7669825,0,21931.06145,4743.753106,4.02e+11,1.01e+11,18.87897189,91.57615121,3.713981273,11.68043447,"4/19/96",1996-04-19,1996-04-19,5391,39,1996-07-28,4.02e+11,1.01e+11,18.87897189,91.57615121,38.19513983,181.7669825,21931.06145,4743.753106,3.713981273,11.68043447,"Australia ",1995-01-01,"Malaysia ",1995-01-01,1,1,"Malaysia",1957-10-24,"Australia",1948-01-01,1,1,3,4,10,10,1,0,NA,NA,NA,NA,NA,NA,NA,NA,NA,1996,0,NA,NA,0
"857",NA,"AUS-AD-306",900,"1997",255,1996,255,900,"Q4_2012","Australia","AUS-AD-306","Germany","DEU","Broad Tipped Highlighter Pens","10/11/96","1/9/97","1/9/97","A","A","1/9/97","MI","6/5/97","6/5/97","N","N",".",".",".",".",".",".",".",".",10,10,1,10,1,1,7.485201636,0.970729758,38.19513983,48.64693333,1,21931.06145,29749.97126,4.02e+11,2.44e+12,18.87897189,24.80373333,3.713981273,1.142644996,"10/11/96",1996-10-11,1996-10-11,5124,214,1997-01-09,4.36e+11,2.16e+12,19.11934236,27.39830597,37.92803761,53.50674475,23536.68349,26296.53061,3.55281644,1.133319477,"Australia ",1995-01-01,"Germany ",1995-01-01,1,1,"Germany",1951-10-01,"Australia",1948-01-01,1,1,10,10,10,10,1,1,NA,NA,NA,NA,NA,NA,NA,NA,NA,NA,0,NA,NA,0
"876",NA,"AUS-AD-323",900,"1997",255,1997,255,900,"Q4_2012","Australia","AUS-AD-323","Germany","DEU","Polyvinyl Chloride Homopolymer Resin","7/10/97","10/17/97","10/17/97","A","A","10/17/97","MI","5/13/98","5/13/98","A","N",".",".",".",".",".",".",".",".",10,10,1,10,1,1,8.064125384,0.944504553,37.92803761,53.50674475,1,23536.68349,26296.53061,4.36e+11,2.16e+12,19.11934236,27.39830597,3.55281644,1.133319477,"7/10/97",1997-07-10,1997-07-10,5396,486,1997-10-17,4.36e+11,2.16e+12,19.11934236,27.39830597,37.92803761,53.50674475,23536.68349,26296.53061,3.55281644,1.133319477,"Australia ",1995-01-01,"Germany ",1995-01-01,1,1,"Germany",1951-10-01,"Australia",1948-01-01,1,1,10,10,10,10,1,1,NA,NA,NA,NA,NA,NA,NA,NA,NA,NA,0,NA,NA,0
"877",NA,"AUS-AD-324",900,"1997",310,1997,310,900,"Q4_2012","Australia","AUS-AD-323","Hungary","HUN","Polyvinyl Chloride Homopolymer Resin","7/10/97","10/17/97","10/17/97","A","A","10/17/97","MI","5/13/98","5/13/98","A","N",".",".",".",".",".",".",".",".",10,10,1,10,1,1,8.064125384,1.540174008,37.92803761,109.4905613,0,23536.68349,4521.963999,4.36e+11,46533207226,19.11934236,55.35554428,3.55281644,7.077386786,"7/10/97",1997-07-10,1997-07-10,1091,486,1997-10-17,4.36e+11,46533207226,19.11934236,55.35554428,37.92803761,109.4905613,23536.68349,4521.963999,3.55281644,7.077386786,"Australia ",1995-01-01,"Hungary ",1995-01-01,1,1,"Hungary",1973-09-09,"Australia",1948-01-01,1,1,10,10,10,10,1,1,NA,NA,NA,NA,NA,NA,NA,NA,NA,NA,0,NA,NA,0
"878",NA,"AUS-AD-325",900,"1997",750,1997,750,900,"Q4_2012","Australia","AUS-AD-323","India","IND","Polyvinyl Chloride Homopolymer Resin","7/10/97","10/17/97","10/17/97","A","A","10/17/97","MI","5/13/98","5/13/98","A","N",".",".",".",".",".",".",".",".",10,10,1,9,1,1,8.064125384,2.004066084,37.92803761,22.22954875,1,23536.68349,427.2361968,4.36e+11,4.23e+11,19.11934236,10.50646612,3.55281644,25.88700833,"7/10/97",1997-07-10,1997-07-10,80,486,1997-10-17,4.36e+11,4.23e+11,19.11934236,10.50646612,37.92803761,22.22954875,23536.68349,427.2361968,3.55281644,25.88700833,"Australia ",1995-01-01,"India ",1995-01-01,1,1,"India",1948-07-08,"Australia",1948-01-01,1,1,9,9,10,10,1,1,NA,NA,NA,NA,NA,NA,NA,NA,NA,NA,0,NA,NA,0
"880",NA,"AUS-AD-327",900,"1997",666,1997,666,900,"Q4_2012","Australia","AUS-AD-323","Israel","ISR","Polyvinyl Chloride Homopolymer Resin","7/10/97","10/17/97","10/17/97","A","A","10/17/97","MI","5/13/98","5/13/98","A","N",".",".",".",".",".",".",".",".",10,10,1,9,1,1,8.064125384,1.828860651,37.92803761,63.57933954,0,23536.68349,18586.73744,4.36e+11,1.08e+11,19.11934236,29.30479683,3.55281644,NA,"7/10/97",1997-07-10,1997-07-10,387,486,1997-10-17,4.36e+11,1.08e+11,19.11934236,29.30479683,37.92803761,63.57933954,23536.68349,18586.73744,3.55281644,NA,"Australia ",1995-01-01,"Israel ",1995-04-21,1,1,"Israel",1962-07-05,"Australia",1948-01-01,1,1,9,9,10,10,1,1,NA,NA,NA,NA,NA,NA,NA,NA,NA,NA,0,NA,NA,0
"881",NA,"AUS-AD-328",900,"1997",210,1997,210,900,"Q4_2012","Australia","AUS-AD-323","Netherlands","NLD","Polyvinyl Chloride Homopolymer Resin","7/10/97","10/17/97","10/17/97","A","A","10/17/97","MI","5/13/98","5/13/98","A","N",".",".",".",".",".",".",".",".",10,10,1,10,1,1,8.064125384,3.167968652,37.92803761,120.9614974,0,23536.68349,24760.9017,4.36e+11,3.87e+11,19.11934236,63.3160646,3.55281644,3.343783336,"7/10/97",1997-07-10,1997-07-10,1053,486,1997-10-17,4.36e+11,3.87e+11,19.11934236,63.3160646,37.92803761,120.9614974,23536.68349,24760.9017,3.55281644,3.343783336,"Australia ",1995-01-01,"Netherlands ",1995-01-01,1,1,"Netherlands",1948-01-01,"Australia",1948-01-01,1,1,10,10,10,10,1,1,NA,NA,NA,NA,NA,NA,NA,NA,NA,NA,0,NA,NA,0
"885",NA,"AUS-AD-331",900,"1997",305,1997,305,900,"Q4_2012","Australia","AUS-AD-331","Austria","AUT","Coated Woodfree Paper in Sheets","7/9/97","11/21/97","11/21/97","A","A","11/21/97","MI","5/8/98","5/8/98","A","A","5/8/98","MI","10/27/99","1999","MI","MI","MI","G/ADP/N/41/AUS",10,10,1,10,1,1,8.064125384,2.869762523,37.92803761,79.00824055,0,23536.68349,26082.45851,4.36e+11,2.08e+11,19.11934236,39.24808728,3.55281644,2.217656345,"7/9/97",1997-07-09,1997-07-09,162,485,1997-11-21,4.36e+11,2.08e+11,19.11934236,39.24808728,37.92803761,79.00824055,23536.68349,26082.45851,3.55281644,2.217656345,"Australia ",1995-01-01,"Austria ",1995-01-01,1,1,"Austria",1951-10-19,"Australia",1948-01-01,1,1,10,10,10,10,1,1,NA,NA,NA,NA,NA,NA,NA,NA,NA,1998,0,NA,NA,0
"886",NA,"AUS-AD-332",900,"1997",211,1997,211,900,"Q4_2012","Australia","AUS-AD-331","Belgium","BEL","Coated Woodfree Paper in Sheets","7/9/97","11/21/97","11/21/97","A","A","11/21/97","MI","5/8/98","5/8/98","N","N",".",".",".",".",".",".",".",".",10,10,1,10,1,1,8.064125384,1.214571297,37.92803761,135.8151273,0,23536.68349,24532.02692,4.36e+11,2.5e+11,19.11934236,69.79046742,3.55281644,1.505221062,"7/9/97",1997-07-09,1997-07-09,1950,485,1997-11-21,4.36e+11,2.5e+11,19.11934236,69.79046742,37.92803761,135.8151273,23536.68349,24532.02692,3.55281644,1.505221062,"Australia ",1995-01-01,"Belgium ",1995-01-01,1,1,"Belgium",1948-01-01,"Australia",1948-01-01,1,1,10,10,10,10,1,1,NA,NA,NA,NA,NA,NA,NA,NA,NA,NA,0,NA,NA,0
"888",NA,"AUS-AD-334",900,"1997",375,1997,375,900,"Q4_2012","Australia","AUS-AD-331","Finland","FIN","Coated Woodfree Paper in Sheets","7/9/97","11/21/97","11/21/97","A","A","11/21/97","MI","5/8/98","5/8/98","A","A","5/8/98","MI","5/1/03","2003","PU","MI","MI","G/ADP/N/47/AUS",10,10,1,10,1,1,8.064125384,7.322737098,37.92803761,70.11827156,0,23536.68349,23928.21124,4.36e+11,1.23e+11,19.11934236,38.76047681,3.55281644,4.114671527,"7/9/97",1997-07-09,1997-07-09,1226,485,1997-11-21,4.36e+11,1.23e+11,19.11934236,38.76047681,37.92803761,70.11827156,23536.68349,23928.21124,3.55281644,4.114671527,"Australia ",1995-01-01,"Finland ",1995-01-01,1,1,"Finland",1950-05-25,"Australia",1948-01-01,1,1,10,10,10,10,1,1,NA,NA,NA,NA,NA,NA,NA,NA,NA,1998,0,NA,NA,0
"889",NA,"AUS-AD-335",900,"1997",220,1997,220,900,"Q4_2012","Australia","AUS-AD-331","France","FRA","Coated Woodfree Paper in Sheets","7/9/97","11/21/97","11/21/97","A","A","11/21/97","MI","5/8/98","5/8/98","N","N",".",".",".",".",".",".",".",".",10,10,1,9,1,1,8.064125384,1.226964608,37.92803761,48.97738313,1,23536.68349,23705.83186,4.36e+11,1.42e+12,19.11934236,25.92567205,3.55281644,2.778938793,"7/9/97",1997-07-09,1997-07-09,784,485,1997-11-21,4.36e+11,1.42e+12,19.11934236,25.92567205,37.92803761,48.97738313,23536.68349,23705.83186,3.55281644,2.778938793,"Australia ",1995-01-01,"France ",1995-01-01,1,1,"France",1948-01-01,"Australia",1948-01-01,1,1,9,9,10,10,1,1,NA,NA,NA,NA,NA,NA,NA,NA,NA,NA,0,NA,NA,0
"890",NA,"AUS-AD-336",900,"1997",255,1997,255,900,"Q4_2012","Australia","AUS-AD-331","Germany","DEU","Coated Woodfree Paper in Sheets","7/9/97","11/21/97","11/21/97","A","A","11/21/97","MI","5/8/98","5/8/98","A","A","5/8/98","MI","5/1/03","2003","MI","MI","MI","G/ADP/N/47/AUS",10,10,1,10,1,1,8.064125384,0.944504553,37.92803761,53.50674475,1,23536.68349,26296.53061,4.36e+11,2.16e+12,19.11934236,27.39830597,3.55281644,1.133319477,"7/9/97",1997-07-09,1997-07-09,5395,485,1997-11-21,4.36e+11,2.16e+12,19.11934236,27.39830597,37.92803761,53.50674475,23536.68349,26296.53061,3.55281644,1.133319477,"Australia ",1995-01-01,"Germany ",1995-01-01,1,1,"Germany",1951-10-01,"Australia",1948-01-01,1,1,10,10,10,10,1,1,NA,NA,NA,NA,NA,NA,NA,NA,NA,1998,0,NA,NA,0
"892",NA,"AUS-AD-338",900,"1997",325,1997,325,900,"Q4_2012","Australia","AUS-AD-331","Italy","ITA","Coated Woodfree Paper in Sheets","7/9/97","11/21/97","11/21/97","A","A","11/21/97","MI","5/8/98","5/8/98","N","N",".",".",".",".",".",".",".",".",10,10,1,10,1,1,8.064125384,0.636162923,37.92803761,46.49292109,1,23536.68349,21069.54779,4.36e+11,1.2e+12,19.11934236,25.20755186,3.55281644,3.198451766,"7/9/97",1997-07-09,1997-07-09,417,485,1997-11-21,4.36e+11,1.2e+12,19.11934236,25.20755186,37.92803761,46.49292109,23536.68349,21069.54779,3.55281644,3.198451766,"Australia ",1995-01-01,"Italy ",1995-01-01,1,1,"Italy",1950-05-30,"Australia",1948-01-01,1,1,10,10,10,10,1,1,NA,NA,NA,NA,NA,NA,NA,NA,NA,NA,0,NA,NA,0
"893",NA,"AUS-AD-339",900,"1997",740,1997,740,900,"Q4_2012","Australia","AUS-AD-331","Japan","JPN","Coated Woodfree Paper in Sheets","7/9/97","11/21/97","11/21/97","A","A","11/21/97","MI","5/8/98","5/8/98","A","A","5/8/98","MI","5/8/03","2003","DPU ","MI","MI","G/ADP/N/47/AUS",10,10,1,10,1,1,8.064125384,0.531375085,37.92803761,20.38760447,1,23536.68349,34294.89898,4.36e+11,4.32e+12,19.11934236,10.73145689,3.55281644,1.613068025,"7/9/97",1997-07-09,1997-07-09,545,485,1997-11-21,4.36e+11,4.32e+12,19.11934236,10.73145689,37.92803761,20.38760447,23536.68349,34294.89898,3.55281644,1.613068025,"Australia ",1995-01-01,"Japan ",1995-01-01,1,1,"Japan",1955-09-10,"Australia",1948-01-01,1,1,10,10,10,10,1,1,NA,NA,NA,NA,NA,NA,NA,NA,NA,1998,0,NA,NA,0
"895",NA,"AUS-AD-340",900,"1997",732,1997,732,900,"Q4_2012","Australia","AUS-AD-331","South Korea","KOR","Coated Woodfree Paper in Sheets","7/9/97","11/21/97","11/21/97","A","A","11/21/97","MI","5/8/98","5/8/98","N","N",".",".",".",".",".",".",".",".",10,10,1,6,1,1,8.064125384,1.220949385,37.92803761,60.23187117,1,23536.68349,12196.76978,4.36e+11,5.6e+11,19.11934236,29.83791712,3.55281644,4.971705782,"7/9/97",1997-07-09,1997-07-09,1595,485,1997-11-21,4.36e+11,5.6e+11,19.11934236,29.83791712,37.92803761,60.23187117,23536.68349,12196.76978,3.55281644,4.971705782,"Australia ",1995-01-01,"South Korea",1995-01-01,1,1,"South Korea",1967-04-14,"Australia",1948-01-01,1,1,6,7,10,10,1,1,NA,NA,NA,NA,NA,NA,NA,NA,NA,NA,0,NA,NA,0
"896",NA,"AUS-AD-341",900,"1997",210,1997,210,900,"Q4_2012","Australia","AUS-AD-331","Netherlands","NLD","Coated Woodfree Paper in Sheets","7/9/97","11/21/97","11/21/97","A","A","11/21/97","MI","5/8/98","5/8/98","N","N",".",".",".",".",".",".",".",".",10,10,1,10,1,1,8.064125384,3.167968652,37.92803761,120.9614974,0,23536.68349,24760.9017,4.36e+11,3.87e+11,19.11934236,63.3160646,3.55281644,3.343783336,"7/9/97",1997-07-09,1997-07-09,1052,485,1997-11-21,4.36e+11,3.87e+11,19.11934236,63.3160646,37.92803761,120.9614974,23536.68349,24760.9017,3.55281644,3.343783336,"Australia ",1995-01-01,"Netherlands ",1995-01-01,1,1,"Netherlands",1948-01-01,"Australia",1948-01-01,1,1,10,10,10,10,1,1,NA,NA,NA,NA,NA,NA,NA,NA,NA,NA,0,NA,NA,0
"899",NA,"CHN-AD-193",710,"2012",994,2011,994,710,"Q4_2012","China","CHN-AD-192","European Union","EUN","Ethylene Glycol Monobutyl Ether and Diethylene Glycol Monobutyl Ether","11/18/11","7/27/12","7/27/12","A","A","7/28/12","AVD","MI","MI","MI","MI","MI","MI","MI","MI","MI","MI","MI","MI",-7,0,0,NA,1,1,0.533552859,1.494439488,54.57721811,84.8037816,1,5447.309378,34920.11178,7.32e+12,1.77e+13,28.53028081,42.90363901,10.03716006,1.543159494,"11/18/11",2011-11-18,2011-11-18,NA,NA,2012-07-28,8.23e+12,1.66e+13,27.32111234,43.18278344,51.82489065,84.5969663,6092.781886,32917.01851,10.08212511,1.549223779,"China ",2001-12-11,"European Union",1995-01-01,1,1,NA,NA,NA,NA,NA,NA,6,NA,-7,0,0,1,NA,NA,NA,NA,NA,NA,NA,NA,NA,NA,0,NA,NA,0
"904",NA,"AUS-AD-349",900,"1998",991,1997,991,900,"Q4_2012","Australia","AUS-AD-349","Hong Kong","HKG","Polystyrene Resin","12/11/97","3/23/98","3/23/98","A","A","3/23/98","MI","12/23/98","12/23/98","N","N",".",".",".",".",".",".",".",".",10,10,1,NA,0,1,8.064125384,0.203854654,37.92803761,262.0212325,0,23536.68349,27330.03335,4.36e+11,1.77e+11,19.11934236,129.3319486,3.55281644,NA,"12/11/97",1997-12-11,1997-12-11,NA,640,1998-03-23,4e+11,1.69e+11,19.58279642,124.265829,39.94927141,247.9955262,21352.31487,25808.97095,3.315436985,NA,"Australia ",1995-01-01,"Hong Kong",1995-01-01,1,1,"Hong Kong",1986-04-23,"Australia",1948-01-01,1,1,0,NA,10,10,1,0,NA,NA,NA,NA,NA,NA,NA,NA,NA,NA,0,NA,NA,0
"906",NA,"AUS-AD-350",900,"1998",732,1997,732,900,"Q4_2012","Australia","AUS-AD-349","South Korea","KOR","Polystyrene Resin","12/11/97","3/23/98","3/23/98","A","A","3/23/98","MI","12/23/98","12/23/98","A","A","12/23/98","MI","12/17/03","2003","DPU ","MI","MI","G/ADP/N/47/AUS",10,10,1,6,1,1,8.064125384,1.220949385,37.92803761,60.23187117,1,23536.68349,12196.76978,4.36e+11,5.6e+11,19.11934236,29.83791712,3.55281644,4.971705782,"12/11/97",1997-12-11,1997-12-11,1750,640,1998-03-23,4e+11,3.76e+11,19.58279642,42.35677439,39.94927141,72.9054547,21352.31487,8133.731245,3.315436985,4.636583786,"Australia ",1995-01-01,"South Korea",1995-01-01,1,1,"South Korea",1967-04-14,"Australia",1948-01-01,1,1,8,8,10,10,1,1,NA,NA,NA,NA,NA,NA,NA,NA,NA,1998,0,NA,NA,0
"907",NA,"AUS-AD-351",900,"1998",830,1997,830,900,"Q4_2012","Australia","AUS-AD-349","Singapore","SGP","Polystyrene Resin","12/11/97","3/23/98","3/23/98","A","A","3/23/98","MI","12/23/98","12/23/98","A","A","12/23/98","MI","12/22/03","2003","DPU ","MI","MI","G/ADP/N/47/AUS",10,10,1,-2,0,1,8.064125384,0.685997884,37.92803761,325.3933642,0,23536.68349,26386.61792,4.36e+11,1e+11,19.11934236,169.9065044,3.55281644,0.141592007,"12/11/97",1997-12-11,1997-12-11,2570,640,1998-03-23,4e+11,85707550881,19.58279642,167.5949507,39.94927141,313.8848706,21352.31487,21824.08609,3.315436985,0.117367185,"Australia ",1995-01-01,"Singapore ",1995-01-01,1,1,"Singapore",1973-08-20,"Australia",1948-01-01,1,1,-2,2,10,10,1,0,NA,NA,NA,NA,NA,NA,NA,NA,NA,1998,0,NA,NA,0
"915",NA,"AUS-AD-359",900,"1998",220,1998,220,900,"Q4_2012","Australia","AUS-AD-359","France","FRA","Wound/Skin Closure Strips","4/3/98","7/13/98","7/13/98","A","A","7/13/98","MI","MI","MI","A","A","12/9/98","MI","12/17/03","2003","DPU ","MI","MI","G/ADP/N/47/AUS",10,10,1,9,1,1,6.996185838,1.128093344,39.94927141,50.4014939,1,21352.31487,24405.87657,4e+11,1.47e+12,19.58279642,26.4677143,3.315436985,2.797470926,"4/3/98",1998-04-03,1998-04-03,1052,753,1998-07-13,4e+11,1.47e+12,19.58279642,26.4677143,39.94927141,50.4014939,21352.31487,24405.87657,3.315436985,2.797470926,"Australia ",1995-01-01,"France ",1995-01-01,1,1,"France",1948-01-01,"Australia",1948-01-01,1,1,9,9,10,10,1,1,NA,NA,NA,NA,NA,NA,NA,NA,NA,1998,0,NA,NA,0
"917",NA,"AUS-AD-360",900,"1998",255,1998,255,900,"Q4_2012","Australia","AUS-AD-359","Germany","DEU","Wound/Skin Closure Strips","4/3/98","7/13/98","7/13/98","A","A","7/13/98","MI","MI","MI","N","N",".",".",".",".",".",".",".",".",10,10,1,10,1,1,6.996185838,0.915361126,39.94927141,55.79170281,1,21352.31487,26547.77535,4e+11,2.18e+12,19.58279642,28.58294637,3.315436985,1.073012219,"4/3/98",1998-04-03,1998-04-03,5663,753,1998-07-13,4e+11,2.18e+12,19.58279642,28.58294637,39.94927141,55.79170281,21352.31487,26547.77535,3.315436985,1.073012219,"Australia ",1995-01-01,"Germany ",1995-01-01,1,1,"Germany",1951-10-01,"Australia",1948-01-01,1,1,10,10,10,10,1,1,NA,NA,NA,NA,NA,NA,NA,NA,NA,NA,0,NA,NA,0
"918",NA,"AUS-AD-361",900,"1998",2,1998,2,900,"Q4_2012","Australia","AUS-AD-359","USA","USA","Wound/Skin Closure Strips","4/3/98","7/13/98","7/13/98","A","A","7/13/98","MI","MI","MI","A","A","12/16/98","MI","12/10/03","2003","PU","MI","MI","G/ADP/N/47/AUS",10,10,1,10,1,1,6.996185838,2.349922309,39.94927141,22.75912907,1,21352.31487,32948.95126,4e+11,9.09e+12,19.58279642,10.48398631,3.315436985,1.300089704,"4/3/98",1998-04-03,1998-04-03,1899,753,1998-07-13,4e+11,9.09e+12,19.58279642,10.48398631,39.94927141,22.75912907,21352.31487,32948.95126,3.315436985,1.300089704,"Australia ",1995-01-01,"United States of America",1995-01-01,1,1,"United States of America",1948-01-01,"Australia",1948-01-01,1,1,10,10,10,10,1,1,NA,NA,NA,NA,NA,NA,NA,NA,NA,1998,0,NA,NA,0
"919",NA,"AUS-AD-362",900,"1998",200,1998,200,900,"Q4_2012","Australia","AUS-AD-362","United Kingdom","GBR","Polymeric Plasticisers of The Saturated Polyester Adipate Type","4/6/98","6/30/98","6/30/98","A","A","6/30/98","MI","12/16/98","12/16/98","N","N",".",".",".",".",".",".",".",".",10,10,1,10,1,1,6.996185838,0.531443353,39.94927141,53.13777989,1,21352.31487,25266.39474,4e+11,1.48e+12,19.58279642,26.25155362,3.315436985,1.067465104,"4/6/98",1998-04-06,1998-04-06,339,756,1998-06-30,4e+11,1.48e+12,19.58279642,26.25155362,39.94927141,53.13777989,21352.31487,25266.39474,3.315436985,1.067465104,"Australia ",1995-01-01,"United Kingdom",1995-01-01,1,1,"United Kingdom",1948-01-01,"Australia",1948-01-01,1,1,10,10,10,10,1,1,NA,NA,NA,NA,NA,NA,NA,NA,NA,NA,0,NA,NA,0
"930",NA,"AUS-AD-372",900,"1999",732,1999,732,900,"Q4_2012","Australia","AUS-AD-370","South Korea","KOR","Polyvinyl Chloride Homopolymer Resin","4/1/99","10/5/99","10/5/99","A","A","10/5/99","MI","3/17/00","3/17/00","A","A","3/17/00","MI","MI","2004","DPU ","9","34","G/ADP/N/65/AUS",10,10,1,8,1,1,6.33633408,1.002573,38.98671351,65.43023242,1,20546.74271,10432.2108,3.89e+11,4.86e+11,18.35002538,35.77703363,3.326680323,4.75889537,"4/1/99",1999-04-01,1999-04-01,400,1116,1999-10-05,3.89e+11,4.86e+11,18.35002538,35.77703363,38.98671351,65.43023242,20546.74271,10432.2108,3.326680323,4.75889537,"Australia ",1995-01-01,"South Korea",1995-01-01,1,1,"South Korea",1967-04-14,"Australia",1948-01-01,1,1,8,8,10,10,1,1,NA,NA,NA,NA,NA,NA,NA,NA,NA,2000,0,NA,NA,0
"932",NA,"AUS-AD-374",900,"1999",800,1999,800,900,"Q4_2012","Australia","AUS-AD-374","Thailand","THA","Certain Galvanised Steel Pipe","4/27/99","9/14/99","9/14/99","A","A","9/14/99","MI","2/17/00","2/17/00","A","A","2/17/00","MI","2/18/10","2010","DPU ","3","33","G/ADP/N/65/AUS",10,10,1,9,1,1,6.33633408,3.023915411,38.98671351,104.0235932,0,20546.74271,1989.994923,3.89e+11,1.23e+11,18.35002538,58.29765213,3.326680323,9.391839512,"4/27/99",1999-04-27,1999-04-27,534,1142,1999-09-14,3.89e+11,1.23e+11,18.35002538,58.29765213,38.98671351,104.0235932,20546.74271,1989.994923,3.326680323,9.391839512,"Australia ",1995-01-01,"Thailand ",1995-01-01,1,1,"Thailand",1982-11-20,"Australia",1948-01-01,1,1,9,9,10,10,1,1,NA,NA,NA,NA,NA,NA,NA,NA,NA,2000,0,NA,NA,0
"940",NA,"AUS-AD-381",900,"2000",830,1999,830,900,"Q4_2012","Australia","AUS-AD-381","Singapore","SGP","Polyvinyl Chloride Bottle Compound","10/11/99","1/27/00","1/27/00","A","A","1/27/00","MI","4/14/00","4/14/00","A","A","4/14/00","MI","4/19/05","2005","DPU ","16","16","G/ADP/N/65/AUS",10,10,1,-2,0,1,6.33633408,0.563958108,38.98671351,337.5439573,0,20546.74271,21796.38082,3.89e+11,86285332762,18.35002538,177.1862408,3.326680323,0.118316086,"10/11/99",1999-10-11,1999-10-11,3239,1309,2000-01-27,4.15e+11,95835970989,19.42414269,189.1812439,40.87933496,366.0708871,21678.49368,23793.03632,3.384846872,0.098844134,"Australia ",1995-01-01,"Singapore ",1995-01-01,1,1,"Singapore",1973-08-20,"Australia",1948-01-01,1,1,-2,2,10,10,1,0,NA,NA,NA,NA,NA,NA,NA,NA,NA,2000,0,NA,NA,0
"962",NA,"AUS-AD-400",900,"2001",325,2000,325,900,"Q4_2012","Australia","AUS-AD-400","Italy","ITA","Split System Caravan Airconditioners","10/3/00","1/21/01","1/21/01","A","A","1/21/01","MI","4/20/01","4/20/01","A","A","4/20/01","MI","4/20/06","2006","DPU ","MI","MI","G/ADP/N/78/AUS",10,10,1,10,1,1,5.654583336,0.698530087,40.87933496,52.58415044,1,21678.49368,19388.27875,4.15e+11,1.1e+12,19.42414269,26.76879547,3.384846872,2.804762303,"10/3/00",2000-10-03,2000-10-03,160,1667,2001-01-21,3.79e+11,1.12e+12,22.13639623,26.85797238,44.09662085,52.33283751,19504.57255,19723.04417,3.835656398,2.683528549,"Australia ",1995-01-01,"Italy ",1995-01-01,1,1,"Italy",1950-05-30,"Australia",1948-01-01,1,1,10,10,10,10,1,1,NA,NA,NA,NA,NA,NA,NA,NA,NA,2001,0,NA,NA,0
"964",NA,"AUS-AD-402",900,"2001",732,2000,732,900,"Q4_2012","Australia","AUS-AD-402","South Korea","KOR","Certain Copper Tube","10/19/00","2/23/01","2/23/01","A","A","2/28/01","MI","MI","MI","MI","MI","MI","MI","3/22/06","2006","PU","MI","MI","G/ADP/N/78/AUS",10,10,1,8,1,1,5.654583336,0.956559987,40.87933496,67.94720274,1,21678.49368,11947.57725,4.15e+11,5.62e+11,19.42414269,35.0088675,3.384846872,4.392899263,"10/19/00",2000-10-19,2000-10-19,967,1683,2001-02-28,3.79e+11,5.33e+11,22.13639623,32.73245013,44.09662085,63.91107188,19504.57255,11255.94789,3.835656398,4.126427146,"Australia ",1995-01-01,"South Korea",1995-01-01,1,1,"South Korea",1967-04-14,"Australia",1948-01-01,1,1,8,8,10,10,1,1,NA,NA,NA,NA,NA,NA,NA,NA,NA,NA,0,NA,NA,0
"969",NA,"AUS-AD-407",900,"2001",800,2001,800,900,"Q4_2012","Australia","AUS-AD-406","Thailand","THA","Pineapple Juice and Canned Pineapple","1/29/01","10/11/01","10/11/01","A","A","10/11/01","MI","10/11/01","10/11/01","A","A","10/11/01","SD/DPU","IF","IF","DPU ","3.22","74","G/ADP/N/85/AUS",10,10,1,9,1,1,5.894059235,3.08006155,44.09662085,125.2229764,0,19504.57255,1831.902788,3.79e+11,1.16e+11,22.13639623,65.85660237,3.835656398,9.134212863,"1/29/01",2001-01-29,2001-01-29,1177,1785,2001-10-11,3.79e+11,1.16e+11,22.13639623,65.85660237,44.09662085,125.2229764,19504.57255,1831.902788,3.835656398,9.134212863,"Australia ",1995-01-01,"Thailand ",1995-01-01,1,1,"Thailand",1982-11-20,"Australia",1948-01-01,1,1,9,9,10,10,1,1,NA,NA,NA,NA,NA,NA,NA,NA,NA,2001,0,NA,NA,0
"971",NA,"AUS-AD-409",900,"2001",2,2001,2,900,"Q4_2012","Australia","AUS-AD-409","USA","USA","Carpet Gripper","7/23/01","11/15/01","11/15/01","A","A","11/15/01","MI","2/19/02","2/19/02","A","A","2/19/02","MI","2/20/07","2007","DPU ","37","37","G/ADP/N/92/AUS",10,10,1,10,1,1,5.894059235,2.306059661,44.09662085,22.8379434,1,19504.57255,37285.81592,3.79e+11,1.06e+13,22.13639623,9.68255014,3.835656398,1.181402837,"7/23/01",2001-07-23,2001-07-23,183,1960,2001-11-15,3.79e+11,1.06e+13,22.13639623,9.68255014,44.09662085,22.8379434,19504.57255,37285.81592,3.835656398,1.181402837,"Australia ",1995-01-01,"United States of America",1995-01-01,1,1,"United States of America",1948-01-01,"Australia",1948-01-01,1,1,10,10,10,10,1,1,NA,NA,NA,NA,NA,NA,NA,NA,NA,2002,0,NA,NA,0
"974",NA,"AUS-AD-411",900,"2001",732,2001,732,900,"Q4_2012","Australia","AUS-AD-411","South Korea","KOR","Flexible Slabstock Polyols","4/26/01","8/17/01","8/17/01","A","A","8/17/01","MI","4/24/02","4/24/02","A","A","4/24/02","MI","4/27/07","2007","DPU ","8","55","G/ADP/N/92/AUS",10,10,1,8,1,1,5.894059235,0.95340758,44.09662085,63.91107188,1,19504.57255,11255.94789,3.79e+11,5.33e+11,22.13639623,32.73245013,3.835656398,4.126427146,"4/26/01",2001-04-26,2001-04-26,1156,1872,2001-08-17,3.79e+11,5.33e+11,22.13639623,32.73245013,44.09662085,63.91107188,19504.57255,11255.94789,3.835656398,4.126427146,"Australia ",1995-01-01,"South Korea",1995-01-01,1,1,"South Korea",1967-04-14,"Australia",1948-01-01,1,1,8,8,10,10,1,1,NA,NA,NA,NA,NA,NA,NA,NA,NA,2002,0,NA,NA,0
"975",NA,"AUS-AD-412",900,"2001",830,2001,830,900,"Q4_2012","Australia","AUS-AD-411","Singapore","SGP","Flexible Slabstock Polyols","4/26/01","8/17/01","8/17/01","A","A","8/17/01","MI","4/24/02","4/24/02","A","A","4/24/02","MI","4/27/07","2007","DPU ","8","55","G/ADP/N/92/AUS",10,10,1,-2,0,1,5.894059235,0.433972079,44.09662085,352.7492263,0,19504.57255,21576.86984,3.79e+11,89285087395,22.13639623,184.4794251,3.835656398,0.0878928,"4/26/01",2001-04-26,2001-04-26,3802,1872,2001-08-17,3.79e+11,89285087395,22.13639623,184.4794251,44.09662085,352.7492263,19504.57255,21576.86984,3.835656398,0.0878928,"Australia ",1995-01-01,"Singapore ",1995-01-01,1,1,"Singapore",1973-08-20,"Australia",1948-01-01,1,1,-2,2,10,10,1,0,NA,NA,NA,NA,NA,NA,NA,NA,NA,2002,0,NA,NA,0
"976",NA,"AUS-AD-413",900,"2001",2,2001,2,900,"Q4_2012","Australia","AUS-AD-411","USA","USA","Flexible Slabstock Polyols","4/26/01","8/17/01","8/17/01","A","A","8/17/01","MI","4/24/02","4/24/02","A","A","4/24/02","MI","4/27/07","2007","DPU ","8","55","G/ADP/N/92/AUS",10,10,1,10,1,1,5.894059235,2.306059661,44.09662085,22.8379434,1,19504.57255,37285.81592,3.79e+11,1.06e+13,22.13639623,9.68255014,3.835656398,1.181402837,"4/26/01",2001-04-26,2001-04-26,95,1872,2001-08-17,3.79e+11,1.06e+13,22.13639623,9.68255014,44.09662085,22.8379434,19504.57255,37285.81592,3.835656398,1.181402837,"Australia ",1995-01-01,"United States of America",1995-01-01,1,1,"United States of America",1948-01-01,"Australia",1948-01-01,1,1,10,10,10,10,1,1,NA,NA,NA,NA,NA,NA,NA,NA,NA,2002,0,NA,NA,0
"977",NA,"AUS-AD-414",900,"2002",710,2001,710,900,"Q4_2012","Australia","AUS-AD-414","China","CHN","Sodium Metabisulfite","9/12/01","2/4/02","2/4/02","A","A","2/4/02","MI","6/4/02","6/4/02","A","A","6/4/02","MI","6/4/07","2007","DPU ","83","83","G/ADP/N/92/AUS",10,10,1,-7,0,1,5.894059235,0.863739086,44.09662085,43.08019713,0,19504.57255,1041.6377,3.79e+11,1.32e+12,22.13639623,22.60010168,3.835656398,14.39172359,"9/12/01",2001-09-12,2001-09-12,1666,2011,2002-02-04,3.94e+11,1.45e+12,20.66211409,25.13437343,41.30101425,47.69731271,20071.96613,1135.447952,4.307360092,13.74274917,"Australia ",1995-01-01,"China ",2001-12-11,1,1,NA,NA,"Australia",1948-01-01,1,NA,-7,0,10,10,1,0,NA,NA,NA,NA,NA,NA,NA,NA,NA,2002,0,NA,NA,0
"980",NA,"AUS-AD-417",900,"2001",740,2001,740,900,"Q4_2012","Australia","AUS-AD-417","Japan","JPN","Flexible Slabstock Polyols","4/26/01","8/17/01","8/17/01","A","A","8/17/01","MI","4/24/02","4/24/02","N","N",".",".",".",".",".",".",".",".",10,10,1,10,1,1,5.894059235,0.520560234,44.09662085,20.2578929,1,19504.57255,32716.41867,3.79e+11,4.16e+12,22.13639623,10.4488202,3.835656398,1.44258103,"4/26/01",2001-04-26,2001-04-26,0,1872,2001-08-17,3.79e+11,4.16e+12,22.13639623,10.4488202,44.09662085,20.2578929,19504.57255,32716.41867,3.835656398,1.44258103,"Australia ",1995-01-01,"Japan ",1995-01-01,1,1,"Japan",1955-09-10,"Australia",1948-01-01,1,1,10,10,10,10,1,1,NA,NA,NA,NA,NA,NA,NA,NA,NA,NA,0,NA,NA,0
"987",NA,"AUS-AD-423",900,"2002",732,2001,732,900,"Q4_2012","Australia","AUS-AD-423","South Korea","KOR","Certain Hot Rolled Structural Steel Sections","11/30/01","4/15/02","4/15/02","A","A","4/15/02","MI","7/5/02","7/5/02","A","A","7/5/02","MI","7/5/07","2007","DPU ","18.25","18.25","G/ADP/N/98/AUS",10,10,1,8,1,1,5.894059235,0.95340758,44.09662085,63.91107188,1,19504.57255,11255.94789,3.79e+11,5.33e+11,22.13639623,32.73245013,3.835656398,4.126427146,"11/30/01",2001-11-30,2001-11-30,1374,2090,2002-04-15,3.94e+11,6.09e+11,20.66211409,30.82686814,41.30101425,60.15373411,20071.96613,12788.58018,4.307360092,3.763589197,"Australia ",1995-01-01,"South Korea",1995-01-01,1,1,"South Korea",1967-04-14,"Australia",1948-01-01,1,1,8,8,10,10,1,1,NA,NA,NA,NA,NA,NA,NA,NA,NA,2002,0,NA,NA,0
"988",NA,"AUS-AD-424",900,"2002",560,2001,560,900,"Q4_2012","Australia","AUS-AD-423","South Africa","ZAF","Certain Hot Rolled Structural Steel Sections","11/30/01","4/15/02","4/15/02","A","A","4/15/02","MI","7/5/02","7/5/02","A","A","7/5/02","MI","7/5/07","2007","DPU ","30","43","G/ADP/N/98/AUS",10,10,1,9,1,1,5.894059235,2.627801883,44.09662085,56.20588719,0,19504.57255,2638.15805,3.79e+11,1.18e+11,22.13639623,30.12753668,3.835656398,3.510824368,"11/30/01",2001-11-30,2001-11-30,898,2090,2002-04-15,3.94e+11,1.11e+11,20.66211409,32.92328541,41.30101425,62.01047457,20071.96613,2425.320317,4.307360092,4.150523085,"Australia ",1995-01-01,"South Africa",1995-01-01,1,1,"South Africa",1948-06-13,"Australia",1948-01-01,1,1,9,9,10,10,1,1,NA,NA,NA,NA,NA,NA,NA,NA,NA,2002,0,NA,NA,0
"989",NA,"AUS-AD-425",900,"2002",800,2001,800,900,"Q4_2012","Australia","AUS-AD-423","Thailand","THA","Certain Hot Rolled Structural Steel Sections","11/30/01","4/15/02","4/15/02","A","A","4/15/02","MI","7/5/02","7/5/02","A","A","7/5/02","MI","7/5/07","2007","DPU ","4","4","G/ADP/N/98/AUS",10,10,1,9,1,1,5.894059235,3.08006155,44.09662085,125.2229764,0,19504.57255,1831.902788,3.79e+11,1.16e+11,22.13639623,65.85660237,3.835656398,9.134212863,"11/30/01",2001-11-30,2001-11-30,293,2090,2002-04-15,3.94e+11,1.27e+11,20.66211409,64.1943345,41.30101425,121.6969998,20071.96613,1988.733736,4.307360092,9.434795124,"Australia ",1995-01-01,"Thailand ",1995-01-01,1,1,"Thailand",1982-11-20,"Australia",1948-01-01,1,1,9,9,10,10,1,1,NA,NA,NA,NA,NA,NA,NA,NA,NA,2002,0,NA,NA,0
"991",NA,"AUS-AD-427",900,"2002",710,2002,710,900,"Q4_2012","Australia","AUS-AD-426","China","CHN","Dichlorophenoxy-Acetic Acid","4/2/02","10/28/02","10/28/02","A","A","10/28/02","MI","3/24/03","3/24/03","A","A","3/24/03","SD/DPU","IF","IF","DPU ","5","10","G/ADP/N/105/AUS",10,10,1,-7,0,1,5.357265304,0.780540991,41.30101425,47.69731271,0,20071.96613,1135.447952,3.94e+11,1.45e+12,20.66211409,25.13437343,4.307360092,13.74274917,"4/2/02",2002-04-02,2002-04-02,1868,2213,2002-10-28,3.94e+11,1.45e+12,20.66211409,25.13437343,41.30101425,47.69731271,20071.96613,1135.447952,4.307360092,13.74274917,"Australia ",1995-01-01,"China ",2001-12-11,1,1,NA,NA,"Australia",1948-01-01,1,NA,-7,0,10,10,1,0,NA,NA,NA,NA,NA,NA,NA,NA,NA,2003,0,NA,NA,0
"992",NA,"AUS-AD-428",900,"2002",200,2002,200,900,"Q4_2012","Australia","AUS-AD-426","United Kingdom","GBR","Dichlorophenoxy-Acetic Acid","4/2/02","10/28/02","10/28/02","A","A","10/28/02","MI","3/24/03","3/24/03","A","A","3/24/03","MI","3/25/08","2008","DPU ","30","30","G/ADP/N/105/AUS",10,10,1,10,1,1,5.357265304,0.499588259,41.30101425,54.4881249,1,20071.96613,27301.46037,3.94e+11,1.62e+12,20.66211409,25.89034319,4.307360092,0.830368719,"4/2/02",2002-04-02,2002-04-02,1796,2213,2002-10-28,3.94e+11,1.62e+12,20.66211409,25.89034319,41.30101425,54.4881249,20071.96613,27301.46037,4.307360092,0.830368719,"Australia ",1995-01-01,"United Kingdom",1995-01-01,1,1,"United Kingdom",1948-01-01,"Australia",1948-01-01,1,1,10,10,10,10,1,1,NA,NA,NA,NA,NA,NA,NA,NA,NA,2003,0,NA,NA,0
"996",NA,"AUS-AD-431",900,"2003",732,2002,732,900,"Q4_2012","Australia","AUS-AD-431","South Korea","KOR","Linear Low Density Polyethylene","10/11/02","6/11/03","6/11/03","A","A","6/11/03","MI","12/3/03","12/3/03","A","A","12/3/03","MI","12/3/08","2008","DPU ","MI","MI","G/ADP/N/112/AUS",10,10,1,8,1,1,5.357265304,0.868333788,41.30101425,60.15373411,1,20071.96613,12788.58018,3.94e+11,6.09e+11,20.66211409,30.82686814,4.307360092,3.763589197,"10/11/02",2002-10-11,2002-10-11,1689,2405,2003-06-11,4.67e+11,6.81e+11,18.90944399,32.7021783,39.94091813,63.39301239,23455.84237,14219.19359,3.17920143,3.514052875,"Australia ",1995-01-01,"South Korea",1995-01-01,1,1,"South Korea",1967-04-14,"Australia",1948-01-01,1,1,8,8,10,10,1,1,NA,NA,NA,NA,NA,NA,NA,NA,NA,2003,0,NA,NA,0
"997",NA,"AUS-AD-432",900,"2003",800,2002,800,900,"Q4_2012","Australia","AUS-AD-431","Thailand","THA","Linear Low Density Polyethylene","10/11/02","6/11/03","6/11/03","A","A","6/11/03","MI","12/3/03","12/3/03","A","A","12/3/03","SD/DPU","IF","IF","DPU ","MI","MI","G/ADP/N/112/AUS",10,10,1,9,1,1,5.357265304,3.641876593,41.30101425,121.6969998,0,20071.96613,1988.733736,3.94e+11,1.27e+11,20.66211409,64.1943345,4.307360092,9.434795124,"10/11/02",2002-10-11,2002-10-11,608,2405,2003-06-11,4.67e+11,1.43e+11,18.90944399,65.68064287,39.94091813,124.5796569,23455.84237,2211.874014,3.17920143,10.40756458,"Australia ",1995-01-01,"Thailand ",1995-01-01,1,1,"Thailand",1982-11-20,"Australia",1948-01-01,1,1,9,9,10,10,1,1,NA,NA,NA,NA,NA,NA,NA,NA,NA,2003,0,NA,NA,0
"998",NA,"AUS-AD-433",900,"2003",732,2002,732,900,"Q4_2012","Australia","AUS-AD-433","South Korea","KOR","High Density Polyethylene ","10/11/02","6/11/03","6/11/03","A","A","6/11/03","MI","12/10/03","12/10/03","A","A","12/10/03","MI","12/17/08","2008","DPU ","MI","MI","G/ADP/N/112/AUS",10,10,1,8,1,1,5.357265304,0.868333788,41.30101425,60.15373411,1,20071.96613,12788.58018,3.94e+11,6.09e+11,20.66211409,30.82686814,4.307360092,3.763589197,"10/11/02",2002-10-11,2002-10-11,1689,2405,2003-06-11,4.67e+11,6.81e+11,18.90944399,32.7021783,39.94091813,63.39301239,23455.84237,14219.19359,3.17920143,3.514052875,"Australia ",1995-01-01,"South Korea",1995-01-01,1,1,"South Korea",1967-04-14,"Australia",1948-01-01,1,1,8,8,10,10,1,1,NA,NA,NA,NA,NA,NA,NA,NA,NA,2003,0,NA,NA,0
"999",NA,"AUS-AD-434",900,"2003",820,2002,820,900,"Q4_2012","Australia","AUS-AD-433","Malaysia","MYS","High Density Polyethylene ","10/11/02","6/11/03","6/11/03","A","A","6/11/03","MI","12/10/03","12/10/03","A","A","12/10/03","MI","12/17/08","2008","DPU ","MI","MI","G/ADP/N/112/AUS",10,10,1,3,0,1,5.357265304,2.223176331,41.30101425,199.3562327,0,20071.96613,4130.678017,3.94e+11,1.01e+11,20.66211409,108.3053028,4.307360092,8.985081404,"10/11/02",2002-10-11,2002-10-11,7757,2405,2003-06-11,4.67e+11,1.1e+11,18.90944399,106.9434461,39.94091813,194.1951291,23455.84237,4427.459737,3.17920143,9.306085216,"Australia ",1995-01-01,"Malaysia ",1995-01-01,1,1,"Malaysia",1957-10-24,"Australia",1948-01-01,1,1,3,4,10,10,1,0,NA,NA,NA,NA,NA,NA,NA,NA,NA,2003,0,NA,NA,0
"1000",NA,"AUS-AD-435",900,"2003",830,2002,830,900,"Q4_2012","Australia","AUS-AD-433","Singapore","SGP","High Density Polyethylene ","10/11/02","6/11/03","6/11/03","A","A","6/11/03","MI","12/10/03","12/10/03","A","A","12/10/03","MI","12/17/08","2008","DPU ","MI","MI","G/ADP/N/112/AUS",10,10,1,-2,0,1,5.357265304,0.404116124,41.30101425,354.2779896,0,20071.96613,22016.71263,3.94e+11,91941791944,20.66211409,185.964275,4.307360092,0.075254915,"10/11/02",2002-10-11,2002-10-11,4335,2405,2003-06-11,4.67e+11,97002305536,18.90944399,205.1615484,39.94091813,382.7914067,23455.84237,23574.00251,3.17920143,0.064928404,"Australia ",1995-01-01,"Singapore ",1995-01-01,1,1,"Singapore",1973-08-20,"Australia",1948-01-01,1,1,-2,2,10,10,1,0,NA,NA,NA,NA,NA,NA,NA,NA,NA,2003,0,NA,NA,0
"1001",NA,"AUS-AD-436",900,"2003",380,2002,380,900,"Q4_2012","Australia","AUS-AD-433","Sweden","SWE","High Density Polyethylene ","10/11/02","6/11/03","6/11/03","A","A","6/11/03","MI","12/10/03","12/10/03","A","A","12/10/03","MI","12/17/08","2008","DPU ","MI","MI","G/ADP/N/112/AUS",10,10,1,10,1,1,5.357265304,4.759008457,41.30101425,81.99293674,0,20071.96613,28118.9848,3.94e+11,2.51e+11,20.66211409,44.37124278,4.307360092,1.943157025,"10/11/02",2002-10-11,2002-10-11,2395,2405,2003-06-11,4.67e+11,3.15e+11,18.90944399,43.52207797,39.94091813,80.21609774,23455.84237,35131.20776,3.17920143,1.919589655,"Australia ",1995-01-01,"Sweden ",1995-01-01,1,1,"Sweden",1950-04-30,"Australia",1948-01-01,1,1,10,10,10,10,1,1,NA,NA,NA,NA,NA,NA,NA,NA,NA,2003,0,NA,NA,0
"1007",NA,"AUS-AD-441",900,"2003",20,2002,20,900,"Q4_2012","Australia","AUS-AD-441","Canada","CAN","Iron and Steel Grinding Mill Liners","12/2/02","2/20/03","2/20/03","A","A","2/20/03","MI","9/17/03","9/17/03","A","A","9/17/03","SD/DPU","IF","IF","DPU ","80","90","G/ADP/N/112/AUS",10,10,1,10,1,1,5.357265304,5.507277165,41.30101425,76.27804103,1,20071.96613,23995.01633,3.94e+11,7.53e+11,20.66211409,40.32268991,4.307360092,2.179335795,"12/2/02",2002-12-02,2002-12-02,3315,2457,2003-02-20,4.67e+11,8.88e+11,18.90944399,37.01987974,39.94091813,70.20764108,23455.84237,28026.00601,3.17920143,2.09984984,"Australia ",1995-01-01,"Canada ",1995-01-01,1,1,"Canada",1948-01-01,"Australia",1948-01-01,1,1,10,10,10,10,1,1,NA,NA,NA,NA,NA,NA,NA,NA,NA,2003,0,NA,NA,0
"1010",NA,"AUS-AD-444",900,"2004",710,2003,710,900,"Q4_2012","Australia","AUS-AD-444","China","CHN","Certain Hot Rolled Plate Steel","8/20/03","2/6/04","2/6/04","A","A","2/6/04","MI","4/1/04","4/1/04","A","A","4/2/04","SD/DPU","4/1/09","2009","DPU ","MI","MI","G/ADP/N/119/AUS",10,10,1,-7,0,1,3.657050763,0.643643193,39.94091813,56.93216421,0,23455.84237,1273.640744,4.67e+11,1.64e+12,18.90944399,29.5575468,3.17920143,12.7973531,"8/20/03",2003-08-20,2003-08-20,158,2718,2004-02-06,6.13e+11,1.93e+12,17.000355,34.08005361,36.69983828,65.51084195,30464.00376,1490.380055,3.37680067,13.39314276,"Australia ",1995-01-01,"China ",2001-12-11,1,1,NA,NA,"Australia",1948-01-01,1,NA,-7,0,10,10,1,0,NA,NA,NA,NA,NA,NA,NA,NA,NA,2004,0,NA,NA,0
"1011",NA,"AUS-AD-445",900,"2004",850,2003,850,900,"Q4_2012","Australia","AUS-AD-444","Indonesia","IDN","Certain Hot Rolled Plate Steel","8/20/03","2/6/04","2/6/04","A","A","2/6/04","MI","4/1/04","4/1/04","A","A","4/2/04","SD/DPU","4/1/09","2009","DPU ","MI","MI","G/ADP/N/119/AUS",10,10,1,6,1,1,3.657050763,4.956632392,39.94091813,53.61649402,1,23455.84237,1076.219005,4.67e+11,2.35e+11,18.90944399,30.47765573,3.17920143,15.18534852,"8/20/03",2003-08-20,2003-08-20,757,2718,2004-02-06,6.13e+11,2.57e+11,17.000355,32.2166932,36.69983828,59.76129216,30464.00376,1160.614924,3.37680067,14.33577983,"Australia ",1995-01-01,"Indonesia ",1995-01-01,1,1,"Indonesia",1950-02-24,"Australia",1948-01-01,1,1,8,8,10,10,1,1,NA,NA,NA,NA,NA,NA,NA,NA,NA,2004,0,NA,NA,0
"1012",NA,"AUS-AD-446",900,"2004",740,2003,740,900,"Q4_2012","Australia","AUS-AD-444","Japan","JPN","Certain Hot Rolled Plate Steel","8/20/03","2/6/04","2/6/04","A","A","2/6/04","MI","4/1/04","4/1/04","A","A","4/2/04","SD/DPU","4/1/09","2009","DPU ","MI","MI","G/ADP/N/119/AUS",10,10,1,10,1,1,3.657050763,0.518402302,39.94091813,22.09029561,1,23455.84237,33690.93773,4.67e+11,4.3e+12,18.90944399,11.87275335,3.17920143,1.384225524,"8/20/03",2003-08-20,2003-08-20,846,2718,2004-02-06,6.13e+11,4.66e+12,17.000355,13.21033508,36.69983828,24.46337319,30464.00376,36441.50449,3.37680067,1.316515033,"Australia ",1995-01-01,"Japan ",1995-01-01,1,1,"Japan",1955-09-10,"Australia",1948-01-01,1,1,10,10,10,10,1,1,NA,NA,NA,NA,NA,NA,NA,NA,NA,2004,0,NA,NA,0
"1013",NA,"AUS-AD-447",900,"2004",732,2003,732,900,"Q4_2012","Australia","AUS-AD-444","South Korea","KOR","Certain Hot Rolled Plate Steel","8/20/03","2/6/04","2/6/04","A","A","2/6/04","MI","4/1/04","4/1/04","A","A","4/2/04","SD/DPU","4/1/09","2009","DPU ","MI","MI","G/ADP/N/119/AUS",10,10,1,8,1,1,3.657050763,0.85879417,39.94091813,63.39301239,1,23455.84237,14219.19359,4.67e+11,6.81e+11,18.90944399,32.7021783,3.17920143,3.514052875,"8/20/03",2003-08-20,2003-08-20,176,2718,2004-02-06,6.13e+11,7.65e+11,17.000355,38.29500278,36.69983828,72.76108631,30464.00376,15921.9392,3.37680067,3.530029285,"Australia ",1995-01-01,"South Korea",1995-01-01,1,1,"South Korea",1967-04-14,"Australia",1948-01-01,1,1,8,8,10,10,1,1,NA,NA,NA,NA,NA,NA,NA,NA,NA,2004,0,NA,NA,0
"1019",NA,"AUS-AD-452",900,"2004",710,2004,710,900,"Q4_2012","Australia","AUS-AD-452","China","CHN","Certain Silicon","5/19/04","10/6/04","10/6/04","A","A","10/6/04","MI","2/16/05","2/16/05","A","A","2/17/05","SD/DPU","2/17/10","2010","DPU ","3.7","8.1","G/ADP/N/132/AUS",10,10,1,-7,0,1,4.31603312,0.539893236,36.69983828,65.51084195,0,30464.00376,1490.380055,6.13e+11,1.93e+12,17.000355,34.08005361,3.37680067,13.39314276,"5/19/04",2004-05-19,2004-05-19,431,2991,2004-10-06,6.13e+11,1.93e+12,17.000355,34.08005361,36.69983828,65.51084195,30464.00376,1490.380055,3.37680067,13.39314276,"Australia ",1995-01-01,"China ",2001-12-11,1,1,NA,NA,"Australia",1948-01-01,1,NA,-7,0,10,10,1,0,NA,NA,NA,NA,NA,NA,NA,NA,NA,2005,0,NA,NA,0
"1021",NA,"AUS-AD-454",900,"2005",732,2004,732,900,"Q4_2012","Australia","AUS-AD-454","South Korea","KOR","Greyback Cartonboard","12/15/04","4/8/05","4/8/05","A","A","4/9/05","DPU","7/27/05","7/27/05","A","A","7/28/05","SD/DPU","IF","IF","MI","16","32","G/ADP/N/139/AUS",10,10,1,8,1,1,4.31603312,0.790694575,36.69983828,72.76108631,1,30464.00376,15921.9392,6.13e+11,7.65e+11,17.000355,38.29500278,3.37680067,3.530029285,"12/15/04",2004-12-15,2004-12-15,659,3201,2005-04-09,6.94e+11,8.98e+11,18.05908682,36.80965361,38.83213577,71.18429245,34011.73864,18657.46113,3.159780873,3.147437074,"Australia ",1995-01-01,"South Korea",1995-01-01,1,1,"South Korea",1967-04-14,"Australia",1948-01-01,1,1,8,8,10,10,1,1,NA,NA,NA,NA,NA,NA,NA,NA,NA,2005,0,NA,NA,0
"1028",NA,"AUS-AD-460",900,"2005",710,2005,710,900,"Q4_2012","Australia","AUS-AD-460","China","CHN","Sodium Hydrogen Carbonate (Sodium Bicarbonate)","3/16/05","8/22/05","8/22/05","A","A","8/22/05","DPU","11/2/05","11/2/05","A","A","11/3/05","SD/DPU","IF","IF","MI","3","43","G/ADP/N/139/AUS",10,10,1,-7,0,1,3.458027755,0.522731473,38.83213577,68.61870494,1,34011.73864,1731.125235,6.94e+11,2.26e+12,18.05908682,37.06949052,3.159780873,12.12302312,"3/16/05",2005-03-16,2005-03-16,NA,NA,2005-08-22,6.94e+11,2.26e+12,18.05908682,37.06949052,38.83213577,68.61870494,34011.73864,1731.125235,3.159780873,12.12302312,"Australia ",1995-01-01,"China ",2001-12-11,1,1,NA,NA,"Australia",1948-01-01,1,NA,-7,0,10,10,1,0,NA,NA,NA,NA,NA,NA,NA,NA,NA,2005,0,NA,NA,0
"1029",NA,"AUS-AD-461",900,"2005",710,2005,710,900,"Q4_2012","Australia","AUS-AD-461","China","CHN","Preserved Mushrooms","4/5/05","9/26/05","9/26/05","A","A","9/30/05","DPU","1/12/06","1/12/06","A","A","1/13/06","SD/DPU","IF","IF","MI","4","24","G/ADP/N/145/AUS",10,10,1,-7,0,1,3.458027755,0.522731473,38.83213577,68.61870494,1,34011.73864,1731.125235,6.94e+11,2.26e+12,18.05908682,37.06949052,3.159780873,12.12302312,"4/5/05",2005-04-05,2005-04-05,NA,NA,2005-09-30,6.94e+11,2.26e+12,18.05908682,37.06949052,38.83213577,68.61870494,34011.73864,1731.125235,3.159780873,12.12302312,"Australia ",1995-01-01,"China ",2001-12-11,1,1,NA,NA,"Australia",1948-01-01,1,NA,-7,0,10,10,1,0,NA,NA,NA,NA,NA,NA,NA,NA,NA,2006,0,NA,NA,0
"1030",NA,"AUS-AD-462",900,"2006",820,2005,820,900,"Q4_2012","Australia","AUS-AD-462","Malaysia","MYS","Certain Mobile Garbage Bins","10/31/05","2/27/06","2/27/06","A","A","2/27/06","DPU","6/5/06","6/5/06","A","A","6/6/06","SD/DPU","6/5/11","2011","MI","MI","MI","G/ADP/N/145/AUS",10,10,1,3,0,1,3.458027755,2.467275997,38.83213577,203.8546446,0,34011.73864,5553.943582,6.94e+11,1.44e+11,18.05908682,112.8989768,3.159780873,8.262291704,"10/31/05",2005-10-31,2005-10-31,NA,NA,2006-02-27,7.47e+11,1.63e+11,19.58936685,112.1856484,40.98528316,202.577482,36113.0024,6179.658221,2.975597122,8.609982841,"Australia ",1995-01-01,"Malaysia ",1995-01-01,1,1,"Malaysia",1957-10-24,"Australia",1948-01-01,1,1,3,4,10,10,1,0,NA,NA,NA,NA,NA,NA,NA,NA,NA,2006,0,NA,NA,0
"1031",NA,"AUS-AD-463",900,"2006",710,2006,710,900,"Q4_2012","Australia","AUS-AD-463","China","CHN","Pineapple Prepared or Preserved in Containers","4/10/06","8/11/06","8/11/06","A","A","8/11/06","MI","10/10/06","10/10/06","A","A","10/11/06","SD/DPU","10/11/11","2011","MI","MI","MI","G/ADP/N/153/AUS",10,10,1,-7,0,1,3.060375978,0.47626229,40.98528316,70.55319578,1,36113.0024,2069.34363,7.47e+11,2.71e+12,19.58936685,39.12622529,2.975597122,11.11345205,"4/10/06",2006-04-10,2006-04-10,NA,NA,2006-08-11,7.47e+11,2.71e+12,19.58936685,39.12622529,40.98528316,70.55319578,36113.0024,2069.34363,2.975597122,11.11345205,"Australia ",1995-01-01,"China ",2001-12-11,1,1,NA,NA,"Australia",1948-01-01,1,NA,-7,0,10,10,1,0,NA,NA,NA,NA,NA,NA,NA,NA,NA,2006,0,NA,NA,0
"1032",NA,"AUS-AD-464",900,"2006",840,2006,840,900,"Q4_2012","Australia","AUS-AD-463","Philippines","PHL","Pineapple Prepared or Preserved in Containers","4/10/06","8/11/06","8/11/06","A","A","8/11/06","MI","10/10/06","10/10/06","A","A","10/11/06","SD/DPU","IF","IF","MI","MI","MI","G/ADP/N/153/AUS",10,10,1,8,1,1,3.060375978,0.51175495,40.98528316,94.94082587,0,36113.0024,1398.826978,7.47e+11,1.22e+11,19.58936685,46.57805687,2.975597122,12.36913455,"4/10/06",2006-04-10,2006-04-10,NA,NA,2006-08-11,7.47e+11,1.22e+11,19.58936685,46.57805687,40.98528316,94.94082587,36113.0024,1398.826978,2.975597122,12.36913455,"Australia ",1995-01-01,"Philippines ",1995-01-01,1,1,"Philippines",1979-12-27,"Australia",1948-01-01,1,1,8,8,10,10,1,1,NA,NA,NA,NA,NA,NA,NA,NA,NA,2006,0,NA,NA,0
"1035",NA,"AUS-AD-467",900,"2006",710,2006,710,900,"Q4_2012","Australia","AUS-AD-467","China","CHN","Certain Hollow Structural Sections","6/8/06","11/24/06","11/24/06","A","A","11/24/06","DPU","5/24/07","5/24/07","A","A","5/25/07","SD/DPU","3/3/11","2011","MI","2.5","14.5","G/ADP/N/158/AUS",10,10,1,-7,0,1,3.060375978,0.47626229,40.98528316,70.55319578,1,36113.0024,2069.34363,7.47e+11,2.71e+12,19.58936685,39.12622529,2.975597122,11.11345205,"6/8/06",2006-06-08,2006-06-08,NA,NA,2006-11-24,7.47e+11,2.71e+12,19.58936685,39.12622529,40.98528316,70.55319578,36113.0024,2069.34363,2.975597122,11.11345205,"Australia ",1995-01-01,"China ",2001-12-11,1,1,NA,NA,"Australia",1948-01-01,1,NA,-7,0,10,10,1,0,NA,NA,NA,NA,NA,NA,NA,NA,NA,2007,0,NA,NA,0
"1046",NA,"AUS-AD-477",900,"2008",350,2008,350,900,"Q4_2012","Australia","AUS-AD-477","Greece","GRC","Processed Dried Currants","4/28/08","11/17/08","11/17/08","A","A","11/17/08","DPU","1/14/09","1/14/09","A","A","1/15/09","SD/DPU","IF","IF","MI","30","80","G/ADP/N/188/AUS/Rev.1",10,10,1,10,1,1,2.059829482,1.914814787,42.08212039,62.74644697,0,49672.74801,30536.44871,1.06e+12,3.42e+11,19.74185548,24.13023637,2.519293188,3.118307362,"4/28/08",2008-04-28,2008-04-28,NA,NA,2008-11-17,1.06e+12,3.42e+11,19.74185548,24.13023637,42.08212039,62.74644697,49672.74801,30536.44871,2.519293188,3.118307362,"Australia ",1995-01-01,"Greece ",1995-01-01,1,1,"Greece",1950-03-01,"Australia",1948-01-01,1,1,10,10,10,10,1,1,NA,NA,NA,NA,NA,NA,NA,NA,NA,2009,0,NA,NA,0
"1047",NA,"AUS-AD-478",900,"2008",710,2008,710,900,"Q4_2012","Australia","AUS-AD-478","China","CHN","Certain Tubeless Steel Demountable Rims","6/6/08","11/5/08","11/5/08","A","A","11/5/08","DPU","12/31/08","12/31/08","A","A","1/1/09","SD/DPU","IF","IF","MI","2.1","239.1","G/ADP/N/180/AUS",10,10,1,-7,0,1,2.059829482,0.434411564,42.08212039,62.24882112,1,49672.74801,3413.588648,1.06e+12,4.52e+12,19.74185548,34.9816182,2.519293188,10.7315685,"6/6/08",2008-06-06,2008-06-06,NA,NA,2008-11-05,1.06e+12,4.52e+12,19.74185548,34.9816182,42.08212039,62.24882112,49672.74801,3413.588648,2.519293188,10.7315685,"Australia ",1995-01-01,"China ",2001-12-11,1,1,NA,NA,"Australia",1948-01-01,1,NA,-7,0,10,10,1,0,NA,NA,NA,NA,NA,NA,NA,NA,NA,2009,0,NA,NA,0
"1051",NA,"AUS-AD-481",900,"2009",255,2009,255,900,"Q4_2012","Australia","AUS-AD-481","Germany","DEU","Geosynthetic Clay Liners","1/6/09","5/8/09","5/8/09","A","A","5/8/09","DPU","10/15/09","10/15/09","A","A","10/16/09","SD/DPU","IF","IF","MI","26.7","26.7","G/ADP/N/195/AUS",10,10,1,10,1,1,1.997299408,0.768844521,44.93999145,80.00421195,1,42721.88494,40270.14217,9.27e+11,3.3e+12,22.52096287,42.46019712,2.461211752,0.750572731,"1/6/09",2009-01-06,2009-01-06,NA,NA,2009-05-08,9.27e+11,3.3e+12,22.52096287,42.46019712,44.93999145,80.00421195,42721.88494,40270.14217,2.461211752,0.750572731,"Australia ",1995-01-01,"Germany ",1995-01-01,1,1,"Germany",1951-10-01,"Australia",1948-01-01,1,1,10,10,10,10,1,1,NA,NA,NA,NA,NA,NA,NA,NA,NA,2009,0,NA,NA,0
"1054",NA,"AUS-AD-484",900,"2009",710,2009,710,900,"Q4_2012","Australia","AUS-AD-484","China","CHN","Certain Aluminium Extrusions","6/24/09","11/3/09","11/3/09","A","A","11/6/09","AVD","4/15/10","4/15/10","A","A","10/28/10","AVD","IF","IF","AVD","2","26","G/ADP/N/209/AUS",10,10,1,-7,0,1,1.997299408,0.448398182,44.93999145,49.0212234,1,42721.88494,3748.504063,9.27e+11,4.99e+12,22.52096287,26.71609478,2.461211752,10.3331503,"6/24/09",2009-06-24,2009-06-24,NA,NA,2009-11-06,9.27e+11,4.99e+12,22.52096287,26.71609478,44.93999145,49.0212234,42721.88494,3748.504063,2.461211752,10.3331503,"Australia ",1995-01-01,"China ",2001-12-11,1,1,NA,NA,"Australia",1948-01-01,1,NA,-7,0,10,10,1,0,NA,NA,NA,NA,NA,NA,NA,NA,NA,2010,0,NA,NA,0
"1055",NA,"AUS-AD-485",900,"2009",2,2009,2,900,"Q4_2012","Australia","AUS-AD-485","USA","USA","Silicone Emulsion Concrete Admixtures","8/14/09","11/26/09","11/26/09","A","A","11/26/09","DPU","3/17/10","3/17/10","A","A","4/14/10","SD/DPU","IF","IF","MI","110","110","G/ADP/N/202/AUS",10,10,1,10,1,1,1.997299408,2.312438916,44.93999145,24.69014212,1,42721.88494,46998.82042,9.27e+11,1.44e+13,22.52096287,10.9849562,2.461211752,1.11946068,"8/14/09",2009-08-14,2009-08-14,NA,NA,2009-11-26,9.27e+11,1.44e+13,22.52096287,10.9849562,44.93999145,24.69014212,42721.88494,46998.82042,2.461211752,1.11946068,"Australia ",1995-01-01,"United States of America",1995-01-01,1,1,"United States of America",1948-01-01,"Australia",1948-01-01,1,1,10,10,10,10,1,1,NA,NA,NA,NA,NA,NA,NA,NA,NA,2010,0,NA,NA,0
"1064",NA,"AUS-AD-493",900,"2010",2,2010,2,900,"Q4_2012","Australia","AUS-AD-493","USA","USA","Biodiesel","6/22/10","10/18/10","10/18/10","A","A","10/18/10","SD","12/22/10","12/22/10","A","A","4/18/11","SD/DPU","IF","IF","MI","40","40","G/ADP/N/216/AUS",10,10,1,10,1,1,2.240827502,2.632230719,39.87490782,28.11482588,1,51824.79842,48357.67357,1.14e+12,1.5e+13,19.45146429,12.32426145,2.369922114,1.192126008,"6/22/10",2010-06-22,2010-06-22,NA,NA,2010-10-18,1.14e+12,1.5e+13,19.45146429,12.32426145,39.87490782,28.11482588,51824.79842,48357.67357,2.369922114,1.192126008,"Australia ",1995-01-01,"United States of America",1995-01-01,1,1,"United States of America",1948-01-01,"Australia",1948-01-01,1,1,10,10,10,10,1,1,NA,NA,NA,NA,NA,NA,NA,NA,NA,2011,0,NA,NA,0
"1081",NA,"AUS-AD-508",900,"2011",710,2011,710,900,"Q4_2012","Australia","AUS-AD-508","China","CHN","Certain Hollow Structural Sections","9/19/11","12/23/11","12/23/11","A","A","12/23/11","AVD","6/7/12","6/7/12","A","A","7/3/12","AVD","IF","IF","AVD","10.1","57.1","G/ADP/N/237/AUS",10,10,1,-7,0,1,2.877868199,0.533552859,41.27965957,54.57721811,1,62080.98242,5447.309378,1.39e+12,7.32e+12,21.13649887,28.53028081,2.463814908,10.03716006,"9/19/11",2011-09-19,2011-09-19,NA,NA,2011-12-23,1.39e+12,7.32e+12,21.13649887,28.53028081,41.27965957,54.57721811,62080.98242,5447.309378,2.463814908,10.03716006,"Australia ",1995-01-01,"China ",2001-12-11,1,1,NA,NA,"Australia",1948-01-01,1,NA,-7,0,10,10,1,0,NA,NA,NA,NA,NA,NA,NA,NA,NA,2012,0,NA,NA,0
"1082",NA,"AUS-AD-509",900,"2011",732,2011,732,900,"Q4_2012","Australia","AUS-AD-508","South Korea","KOR","Certain Hollow Structural Sections","9/19/11","12/23/11","12/23/11","A","A","12/23/11","AVD","6/7/12","6/7/12","A","A","7/3/12","AVD","IF","IF","AVD","3.2","8.9","G/ADP/N/237/AUS",10,10,1,8,1,1,2.877868199,1.177632588,41.27965957,110.0000525,1,62080.98242,24155.8293,1.39e+12,1.2e+12,21.13649887,55.74747445,2.463814908,2.516950614,"9/19/11",2011-09-19,2011-09-19,NA,NA,2011-12-23,1.39e+12,1.2e+12,21.13649887,55.74747445,41.27965957,110.0000525,62080.98242,24155.8293,2.463814908,2.516950614,"Australia ",1995-01-01,"South Korea",1995-01-01,1,1,"South Korea",1967-04-14,"Australia",1948-01-01,1,1,8,8,10,10,1,1,NA,NA,NA,NA,NA,NA,NA,NA,NA,2012,0,NA,NA,0
"1084",NA,"AUS-AD-510",900,"2011",820,2011,820,900,"Q4_2012","Australia","AUS-AD-508","Malaysia","MYS","Certain Hollow Structural Sections","9/19/11","12/23/11","12/23/11","A","A","12/23/11","AVD","6/7/12","6/7/12","A","A","7/3/12","AVD","IF","IF","AVD","3","20","G/ADP/N/237/AUS",10,10,1,6,1,1,2.877868199,3.160270392,41.27965957,166.786213,1,62080.98242,10058.04302,1.39e+12,2.89e+11,21.13649887,91.60680871,2.463814908,11.79268589,"9/19/11",2011-09-19,2011-09-19,NA,NA,2011-12-23,1.39e+12,2.89e+11,21.13649887,91.60680871,41.27965957,166.786213,62080.98242,10058.04302,2.463814908,11.79268589,"Australia ",1995-01-01,"Malaysia ",1995-01-01,1,1,"Malaysia",1957-10-24,"Australia",1948-01-01,1,1,6,6,10,10,1,1,NA,NA,NA,NA,NA,NA,NA,NA,NA,2012,0,NA,NA,0
"1088",NA,"AUS-AD-514",900,"2012",710,2011,710,900,"Q4_2012","Australia","AUS-AD-514","China","CHN","Aluminium Road Wheels","11/7/11","5/30/12","5/30/12","A","A","5/31/12","AVD","6/12/12","6/12/12","A","A","7/5/12","AVD","IF","IF","AVD","5.6","29.3","G/ADP/N/237/AUS",10,10,1,-7,0,1,2.877868199,0.533552859,41.27965957,54.57721811,1,62080.98242,5447.309378,1.39e+12,7.32e+12,21.13649887,28.53028081,2.463814908,10.03716006,"11/7/11",2011-11-07,2011-11-07,NA,NA,2012-05-31,1.53e+12,8.23e+12,21.2397658,27.32111234,42.6862512,51.82489065,67435.95443,6092.781886,2.421652626,10.08212511,"Australia ",1995-01-01,"China ",2001-12-11,1,1,NA,NA,"Australia",1948-01-01,1,NA,-7,0,10,10,1,0,NA,NA,NA,NA,NA,NA,NA,NA,NA,2012,0,NA,NA,0
"1090",NA,"AUS-AD-516",900,"2012",732,2012,732,900,"Q4_2012","Australia","AUS-AD-516","South Korea","KOR","Polyvinyl Chloride Homopolymer Resin (PVC)","4/19/12","6/28/12","6/28/12","A","A","6/28/12","AVD","9/25/12","9/25/12","A","A","10/19/12","AVD","IF","IF","AVD","3.26","3.26","G/ADP/N/237/AUS",10,10,1,8,1,1,2.918337502,1.136907577,42.6862512,109.8862207,1,67435.95443,24453.97135,1.53e+12,1.22e+12,21.2397658,56.34025057,2.421652626,2.459145358,"4/19/12",2012-04-19,2012-04-19,NA,NA,2012-06-28,1.53e+12,1.22e+12,21.2397658,56.34025057,42.6862512,109.8862207,67435.95443,24453.97135,2.421652626,2.459145358,"Australia ",1995-01-01,"South Korea",1995-01-01,1,1,"South Korea",1967-04-14,"Australia",1948-01-01,1,1,8,8,10,10,1,1,NA,NA,NA,NA,NA,NA,NA,NA,NA,2012,0,NA,NA,0
"1091",NA,"AUS-AD-517",900,"2012",740,2012,740,900,"Q4_2012","Australia","AUS-AD-517","Japan","JPN","Hot Rolled Coil Steel","6/14/12","10/3/12","10/3/12","A","A","10/5/12","AVD","11/19/12","11/19/12","A","A","12/20/12","AVD/SD","IF","IF","AVD","0","7.5","G/ADP/N/237/AUS",10,10,1,10,1,1,2.918337502,0.795654974,42.6862512,31.43488784,1,67435.95443,46548.26964,1.53e+12,5.94e+12,21.2397658,14.72734752,2.421652626,1.217299715,"6/14/12",2012-06-14,2012-06-14,NA,NA,2012-10-05,1.53e+12,5.94e+12,21.2397658,14.72734752,42.6862512,31.43488784,67435.95443,46548.26964,2.421652626,1.217299715,"Australia ",1995-01-01,"Japan ",1995-01-01,1,1,"Japan",1955-09-10,"Australia",1948-01-01,1,1,10,10,10,10,1,1,NA,NA,NA,NA,NA,NA,NA,NA,NA,2012,0,NA,NA,0
"1092",NA,"AUS-AD-518",900,"2012",732,2012,732,900,"Q4_2012","Australia","AUS-AD-517","South Korea","KOR","Hot Rolled Coil Steel","6/14/12","10/3/12","10/3/12","A","A","10/5/12","AVD","11/19/12","11/19/12","A","A","12/20/12","AVD/SD","IF","IF","AVD","2.6","11.8","G/ADP/N/237/AUS",10,10,1,8,1,1,2.918337502,1.136907577,42.6862512,109.8862207,1,67435.95443,24453.97135,1.53e+12,1.22e+12,21.2397658,56.34025057,2.421652626,2.459145358,"6/14/12",2012-06-14,2012-06-14,NA,NA,2012-10-05,1.53e+12,1.22e+12,21.2397658,56.34025057,42.6862512,109.8862207,67435.95443,24453.97135,2.421652626,2.459145358,"Australia ",1995-01-01,"South Korea",1995-01-01,1,1,"South Korea",1967-04-14,"Australia",1948-01-01,1,1,8,8,10,10,1,1,NA,NA,NA,NA,NA,NA,NA,NA,NA,2012,0,NA,NA,0
"1093",NA,"AUS-AD-519",900,"2012",820,2012,820,900,"Q4_2012","Australia","AUS-AD-517","Malaysia","MYS","Hot Rolled Coil Steel","6/14/12","10/3/12","10/3/12","A","A","10/5/12","AVD","11/19/12","11/19/12","A","A","12/20/12","AVD/SD","IF","IF","AVD","15.4","15.4","G/ADP/N/237/AUS",10,10,1,6,1,1,2.918337502,2.396439804,42.6862512,162.4146735,1,67435.95443,10432.06247,1.53e+12,3.05e+11,21.2397658,87.1362898,2.421652626,10.0540034,"6/14/12",2012-06-14,2012-06-14,NA,NA,2012-10-05,1.53e+12,3.05e+11,21.2397658,87.1362898,42.6862512,162.4146735,67435.95443,10432.06247,2.421652626,10.0540034,"Australia ",1995-01-01,"Malaysia ",1995-01-01,1,1,"Malaysia",1957-10-24,"Australia",1948-01-01,1,1,6,6,10,10,1,1,NA,NA,NA,NA,NA,NA,NA,NA,NA,2012,0,NA,NA,0
"1157",NA,"BRA-AD-105",140,"1999",220,1998,220,140,"Q4_2012","Brazil","BRA-AD-105","France","FRA","Cold Rolled Stainless Steel ","11/30/98","12/23/99","12/23/99","A","A","12/23/99","AVD","5/26/00","5/26/00","A","A","5/26/00","AVD","5/23/08","2008","AVD","30.9","30.9","G/ADP/N/65/BRA",8,8,1,9,1,1,3.716876352,1.128093344,15.86498597,50.4014939,1,4979.144846,24405.87657,8.44e+11,1.47e+12,6.932774825,26.4677143,5.524736835,2.797470926,"11/30/98",1998-11-30,1998-11-30,1293,1429,1999-12-23,5.87e+11,1.46e+12,9.411088649,26.35445218,20.22715514,50.57611726,3411.865896,24075.01701,5.473261496,2.64938617,"Brazil ",1995-01-01,"France ",1995-01-01,1,1,"France",1948-01-01,"Brazil",1948-07-30,1,1,9,9,8,8,1,1,NA,NA,NA,NA,NA,NA,NA,NA,NA,2000,0,NA,NA,0
"1158",NA,"BRA-AD-106",140,"1999",255,1998,255,140,"Q4_2012","Brazil","BRA-AD-105","Germany","DEU","Cold Rolled Stainless Steel ","11/30/98","12/23/99","12/23/99","A","A","12/23/99","AVD","5/26/00","5/26/00","N","N",".",".",".",".",".",".",".",".",8,8,1,10,1,1,3.716876352,0.915361126,15.86498597,55.79170281,1,4979.144846,26547.77535,8.44e+11,2.18e+12,6.932774825,28.58294637,5.524736835,1.073012219,"11/30/98",1998-11-30,1998-11-30,34,1429,1999-12-23,5.87e+11,2.13e+12,9.411088649,29.40355964,20.22715514,57.92820718,3411.865896,25956.63741,5.473261496,1.059086461,"Brazil ",1995-01-01,"Germany ",1995-01-01,1,1,"Germany",1951-10-01,"Brazil",1948-07-30,1,1,10,10,8,8,1,1,NA,NA,NA,NA,NA,NA,NA,NA,NA,NA,0,NA,NA,0
"1160",NA,"BRA-AD-108",140,"1999",740,1998,740,140,"Q4_2012","Brazil","BRA-AD-105","Japan","JPN","Cold Rolled Stainless Steel ","11/30/98","12/23/99","12/23/99","A","A","12/23/99","AVD","5/26/00","5/26/00","A","A","5/26/00","AVD","5/23/08","2008","AVD","48.7","48.7","G/ADP/N/65/BRA",8,8,1,10,1,1,3.716876352,0.52714681,15.86498597,19.6888759,1,4979.144846,30967.28809,8.44e+11,3.91e+12,6.932774825,10.7774668,5.524736835,1.704186546,"11/30/98",1998-11-30,1998-11-30,123,1429,1999-12-23,5.87e+11,4.43e+12,9.411088649,10.17337581,20.22715514,18.75638736,3411.865896,34998.80997,5.473261496,1.679247869,"Brazil ",1995-01-01,"Japan ",1995-01-01,1,1,"Japan",1955-09-10,"Brazil",1948-07-30,1,1,10,10,8,8,1,1,NA,NA,NA,NA,NA,NA,NA,NA,NA,2000,0,NA,NA,0
"1161",NA,"BRA-AD-109",140,"1999",70,1998,70,140,"Q4_2012","Brazil","BRA-AD-105","Mexico","MEX","Cold Rolled Stainless Steel ","11/30/98","12/23/99","12/23/99","A","A","12/23/99","AVD","5/26/00","5/26/00","A","A","5/26/00","AVD","5/23/08","2008","AVD","44.4","44.4","G/ADP/N/65/BRA",8,8,1,6,1,1,3.716876352,0.783309588,15.86498597,51.77609803,1,4979.144846,4986.252659,8.44e+11,5.02e+11,6.932774825,25.74892715,5.524736835,4.206365878,"11/30/98",1998-11-30,1998-11-30,1460,1429,1999-12-23,5.87e+11,5.79e+11,9.411088649,25.48169145,20.22715514,51.2689011,3411.865896,5663.388512,5.473261496,3.953796773,"Brazil ",1995-01-01,"Mexico ",1995-01-01,1,1,"Mexico",1986-08-24,"Brazil",1948-07-30,1,1,6,6,8,8,1,1,NA,NA,NA,NA,NA,NA,NA,NA,NA,2000,0,NA,NA,0
"1163",NA,"BRA-AD-110",140,"1999",560,1998,560,140,"Q4_2012","Brazil","BRA-AD-105","South Africa","ZAF","Cold Rolled Stainless Steel ","11/30/98","12/23/99","12/23/99","A","A","12/23/99","AVD","5/26/00","5/26/00","A","A","5/26/00","AVD","5/23/08","2008","AVD","6","16.4","G/ADP/N/65/BRA",8,8,1,9,1,1,3.716876352,3.775064242,15.86498597,50.16338451,0,4979.144846,3205.168742,8.44e+11,1.34e+11,6.932774825,25.65286277,5.524736835,3.768703469,"11/30/98",1998-11-30,1998-11-30,1665,1429,1999-12-23,5.87e+11,1.33e+11,9.411088649,25.33468196,20.22715514,48.07535622,3411.865896,3102.813799,5.473261496,3.543098869,"Brazil ",1995-01-01,"South Africa",1995-01-01,1,1,"South Africa",1948-06-13,"Brazil",1948-07-30,1,1,9,9,8,8,1,1,NA,NA,NA,NA,NA,NA,NA,NA,NA,2000,0,NA,NA,0
"1164",NA,"BRA-AD-111",140,"1999",230,1998,230,140,"Q4_2012","Brazil","BRA-AD-105","Spain","ESP","Cold Rolled Stainless Steel ","11/30/98","12/23/99","12/23/99","A","A","12/23/99","AVD","5/26/00","5/26/00","A","A","5/26/00","AVD","MI","MI","AVD","28.2","28.2","G/ADP/N/65/BRA",8,8,1,10,1,1,3.716876352,1.260181682,15.86498597,53.56955454,0,4979.144846,15121.72118,8.44e+11,6.01e+11,6.932774825,26.67408334,5.524736835,4.65607215,"11/30/98",1998-11-30,1998-11-30,939,1429,1999-12-23,5.87e+11,6.18e+11,9.411088649,26.68399861,20.22715514,55.21993852,3411.865896,15468.04987,5.473261496,4.291581853,"Brazil ",1995-01-01,"Spain ",1995-01-01,1,1,"Spain",1963-08-29,"Brazil",1948-07-30,1,1,10,10,8,8,1,1,NA,NA,NA,NA,NA,NA,NA,NA,NA,2000,0,NA,NA,0
"1174",NA,"BRA-AD-120",140,"2000",160,1999,160,140,"Q4_2012","Brazil","BRA-AD-120","Argentina","ARG","Milk","8/25/99","12/12/00","12/12/00","A","A","12/12/00",".","2/23/01","2/23/01","T","T",".","PU","2/18/08","2008","PU","MI","MI","G/ADP/N/78/BRA",8,8,1,8,1,1,4.506917669,2.100327586,20.22715514,17.65178455,1,3411.865896,9405.790356,5.87e+11,3.43e+11,9.411088649,8.112502471,5.473261496,4.104074469,"8/25/99",1999-08-25,1999-08-25,4065,1697,2000-12-12,6.45e+11,3.44e+11,9.978193817,9.069476306,21.71995842,18.67530036,3694.462668,9329.113756,5.602902758,4.310081555,"Brazil ",1995-01-01,"Argentina ",1995-01-01,1,1,"Argentina",1967-10-11,"Brazil",1948-07-30,1,1,8,8,8,8,1,1,NA,NA,NA,NA,NA,NA,NA,NA,NA,NA,0,NA,NA,0
"1176",NA,"BRA-AD-122",140,"2000",994,1999,994,140,"Q4_2012","Brazil","BRA-AD-120","European Union","EUN","Milk","8/25/99","12/12/00","12/12/00","A","A","12/12/00","MI","2/23/01","2/23/01","A","A","2/23/01","AVD","IF","IF","AVD/PU","14.8","14.8","G/ADP/N/78/BRA",8,8,1,NA,1,1,4.506917669,1.591942935,20.22715514,64.65834607,0,3411.865896,18863.99964,5.87e+11,9.19e+12,9.411088649,32.69786017,5.473261496,2.398573448,"8/25/99",1999-08-25,1999-08-25,NA,1697,2000-12-12,6.45e+11,8.52e+12,9.978193817,36.11678545,21.71995842,72.08801675,3694.462668,17468.29776,5.602902758,2.288564687,"Brazil ",1995-01-01,"European Union",1995-01-01,1,1,NA,NA,"Brazil",1948-07-30,1,NA,6,NA,8,8,1,1,NA,NA,NA,NA,NA,NA,NA,NA,NA,2001,0,NA,NA,0
"1177",NA,"BRA-AD-123",140,"2000",920,1999,920,140,"Q4_2012","Brazil","BRA-AD-120","New Zealand","NZL","Milk","8/25/99","12/12/00","12/12/00","A","A","12/12/00","MI","2/23/01","2/23/01","A","A","2/23/01","AVD","IF","IF","AVD","3.9","3.9","G/ADP/N/78/BRA",8,8,1,10,1,1,4.506917669,13.13822464,20.22715514,62.02306931,0,3411.865896,15169.04084,5.87e+11,58174788520,9.411088649,31.26131832,5.473261496,6.818067382,"8/25/99",1999-08-25,1999-08-25,625,1697,2000-12-12,6.45e+11,52012031792,9.978193817,36.16723091,21.71995842,69.3820865,3694.462668,13482.65334,5.602902758,8.428292273,"Brazil ",1995-01-01,"New Zealand",1995-01-01,1,1,"New Zealand",1948-07-30,"Brazil",1948-07-30,1,1,10,10,8,8,1,1,NA,NA,NA,NA,NA,NA,NA,NA,NA,2001,0,NA,NA,0
"1178",NA,"BRA-AD-124",140,"2000",165,1999,165,140,"Q4_2012","Brazil","BRA-AD-120","Uruguay","URY","Milk","8/25/99","12/12/00","12/12/00","A","A","12/12/00","MI","2/23/01","2/23/01","A","A","2/23/01","AVD","4/5/08","2008","AVD/PU","16.9","16.9","G/ADP/N/78/BRA",8,8,1,10,1,1,4.506917669,9.340400994,20.22715514,33.38644895,0,3411.865896,7248.348746,5.87e+11,23983945191,9.411088649,15.09765307,5.473261496,6.778210245,"8/25/99",1999-08-25,1999-08-25,1638,1697,2000-12-12,6.45e+11,22823255806,9.978193817,16.69809893,21.71995842,36.71373813,3694.462668,6872.733686,5.602902758,6.962935961,"Brazil ",1995-01-01,"Uruguay ",1995-01-01,1,1,"Uruguay",1953-12-06,"Brazil",1948-07-30,1,1,10,10,8,8,1,1,NA,NA,NA,NA,NA,NA,NA,NA,NA,2001,0,NA,NA,0
"1186",NA,"BRA-AD-131",140,"2001",155,2000,155,140,"Q4_2012","Brazil","BRA-AD-131","Chile","CHL","Paper and Paperboard","5/15/00","6/4/01","6/4/01","A","A","6/4/01","PU","10/31/01","10/31/01","T","T",".","PU","IF","IF","PU","MI","MI","G/ADP/N/85/BRA",8,8,1,9,1,1,4.757257524,10.27490199,21.71995842,57.86519771,0,3694.462668,5133.077311,6.45e+11,79328640264,9.978193817,29.28715138,5.602902758,5.89506754,"5/15/00",2000-05-15,2000-05-15,64,1961,2001-06-04,5.54e+11,72336972322,12.18144648,30.87198151,25.67834696,61.41428034,3128.144846,4625.336377,5.973379533,5.159719613,"Brazil ",1995-01-01,"Chile ",1995-01-01,1,1,"Chile",1949-03-16,"Brazil",1948-07-30,1,1,9,9,8,8,1,1,NA,NA,NA,NA,NA,NA,NA,NA,NA,NA,0,NA,NA,0
"1242",NA,"BRA-AD-182",140,"2006",710,2006,710,140,"Q4_2012","Brazil","BRA-AD-182","China","CHN","Photographic Plates","4/18/06","6/29/06","6/29/06","A","A","6/29/06","SD","10/8/07","10/8/07","A","A","10/8/07","SD","IF","IF","SD","MI","MI","G/ADP/N/166/BRA",8,8,1,-7,0,1,3.704287718,0.47626229,25.83424317,70.55319578,1,5787.975574,2069.34363,1.09e+12,2.71e+12,14.36845084,39.12622529,5.483921707,11.11345205,"4/18/06",2006-04-18,2006-04-18,NA,NA,2006-06-29,1.09e+12,2.71e+12,14.36845084,39.12622529,25.83424317,70.55319578,5787.975574,2069.34363,5.483921707,11.11345205,"Brazil ",1995-01-01,"China ",2001-12-11,1,1,NA,NA,"Brazil",1948-07-30,1,NA,-7,0,8,8,1,0,NA,NA,NA,NA,NA,NA,NA,NA,NA,2007,0,NA,NA,0
"1243",NA,"BRA-AD-183",140,"2006",2,2006,2,140,"Q4_2012","Brazil","BRA-AD-182","USA","USA","Photographic Plates","4/18/06","6/29/06","6/29/06","A","A","6/29/06","SD","10/8/07","10/8/07","A","A","10/8/07","SD","IF","IF","SD","MI","MI","G/ADP/N/166/BRA",8,8,1,10,1,1,3.704287718,2.464403823,25.83424317,26.83956444,1,5787.975574,46443.8102,1.09e+12,1.39e+13,14.36845084,10.66900468,5.483921707,1.042895226,"4/18/06",2006-04-18,2006-04-18,NA,NA,2006-06-29,1.09e+12,1.39e+13,14.36845084,10.66900468,25.83424317,26.83956444,5787.975574,46443.8102,5.483921707,1.042895226,"Brazil ",1995-01-01,"United States of America",1995-01-01,1,1,"United States of America",1948-01-01,"Brazil",1948-07-30,1,1,10,10,8,8,1,1,NA,NA,NA,NA,NA,NA,NA,NA,NA,2007,0,NA,NA,0
"1244",NA,"BRA-AD-184",140,"2006",710,2006,710,140,"Q4_2012","Brazil","BRA-AD-184","China","CHN","Christmas Ornaments","6/26/06","6/29/06","6/29/06","A","A","6/29/06","SD","9/26/07","9/26/07",".","N",".",".",".",".",".",".",".",".",8,8,1,-7,0,1,3.704287718,0.47626229,25.83424317,70.55319578,1,5787.975574,2069.34363,1.09e+12,2.71e+12,14.36845084,39.12622529,5.483921707,11.11345205,"6/26/06",2006-06-26,2006-06-26,NA,NA,2006-06-29,1.09e+12,2.71e+12,14.36845084,39.12622529,25.83424317,70.55319578,5787.975574,2069.34363,5.483921707,11.11345205,"Brazil ",1995-01-01,"China ",2001-12-11,1,1,NA,NA,"Brazil",1948-07-30,1,NA,-7,0,8,8,1,0,NA,NA,NA,NA,NA,NA,NA,NA,NA,NA,0,NA,NA,0
"1247",NA,"BRA-AD-187",140,"2007",710,2006,710,140,"Q4_2012","Brazil","BRA-AD-187","China","CHN","Hair Brushes","9/15/06","6/29/07","6/29/07","A","A","6/29/07","SD","12/13/07","12/13/07","A","A","12/13/07","SD","IF","IF","SD","MI","MI","G/ADP/N/166/BRA",8,8,1,-7,0,1,3.704287718,0.47626229,25.83424317,70.55319578,1,5787.975574,2069.34363,1.09e+12,2.71e+12,14.36845084,39.12622529,5.483921707,11.11345205,"9/15/06",2006-09-15,2006-09-15,NA,NA,2007-06-29,1.37e+12,3.49e+12,13.36438031,38.39804741,25.20866345,67.98414918,7193.924995,2651.260119,5.562716551,10.76971034,"Brazil ",1995-01-01,"China ",2001-12-11,1,1,NA,NA,"Brazil",1948-07-30,1,NA,-7,0,8,8,1,0,NA,NA,NA,NA,NA,NA,NA,NA,NA,2007,0,NA,NA,0
"1248",NA,"BRA-AD-188",140,"2006",710,2006,710,140,"Q4_2012","Brazil","BRA-AD-188","China","CHN","Loudspeakers","9/15/06","6/27/06","6/27/06","A","A","6/27/06","SD","12/13/07","12/13/07","A","A","12/13/07","SD","IF","IF","SD","MI","MI","G/ADP/N/166/BRA",8,8,1,-7,0,1,3.704287718,0.47626229,25.83424317,70.55319578,1,5787.975574,2069.34363,1.09e+12,2.71e+12,14.36845084,39.12622529,5.483921707,11.11345205,"9/15/06",2006-09-15,2006-09-15,NA,NA,2006-06-27,1.09e+12,2.71e+12,14.36845084,39.12622529,25.83424317,70.55319578,5787.975574,2069.34363,5.483921707,11.11345205,"Brazil ",1995-01-01,"China ",2001-12-11,1,1,NA,NA,"Brazil",1948-07-30,1,NA,-7,0,8,8,1,0,NA,NA,NA,NA,NA,NA,NA,NA,NA,2007,0,NA,NA,0
"1252",NA,"BRA-AD-191",140,"2007",710,2006,710,140,"Q4_2012","Brazil","BRA-AD-191","China","CHN","Steel Drills","11/24/06","8/24/07","8/24/07","A","A","8/24/07","SD","11/21/07","11/21/07","A","A","11/21/07","SD","IF","IF","SD","MI","MI","G/ADP/N/166/BRA",8,8,1,-7,0,1,3.704287718,0.47626229,25.83424317,70.55319578,1,5787.975574,2069.34363,1.09e+12,2.71e+12,14.36845084,39.12622529,5.483921707,11.11345205,"11/24/06",2006-11-24,2006-11-24,NA,NA,2007-08-24,1.37e+12,3.49e+12,13.36438031,38.39804741,25.20866345,67.98414918,7193.924995,2651.260119,5.562716551,10.76971034,"Brazil ",1995-01-01,"China ",2001-12-11,1,1,NA,NA,"Brazil",1948-07-30,1,NA,-7,0,8,8,1,0,NA,NA,NA,NA,NA,NA,NA,NA,NA,2007,0,NA,NA,0
"1253",NA,"BRA-AD-192",140,"2007",710,2006,710,140,"Q4_2012","Brazil","BRA-AD-192","China","CHN","Bicycle Crank Arms","12/8/06","5/7/07","5/7/07","A","A","5/7/07","SD","10/11/07","10/11/07","A","A","10/11/07","SD","IF","IF","SD","MI","MI","G/ADP/N/166/BRA",8,8,1,-7,0,1,3.704287718,0.47626229,25.83424317,70.55319578,1,5787.975574,2069.34363,1.09e+12,2.71e+12,14.36845084,39.12622529,5.483921707,11.11345205,"12/8/06",2006-12-08,2006-12-08,NA,NA,2007-05-07,1.37e+12,3.49e+12,13.36438031,38.39804741,25.20866345,67.98414918,7193.924995,2651.260119,5.562716551,10.76971034,"Brazil ",1995-01-01,"China ",2001-12-11,1,1,NA,NA,"Brazil",1948-07-30,1,NA,-7,0,8,8,1,0,NA,NA,NA,NA,NA,NA,NA,NA,NA,2007,0,NA,NA,0
"1254",NA,"BRA-AD-193",140,"2007",255,2007,255,140,"Q4_2012","Brazil","BRA-AD-193","Germany","DEU","Synthetic Indigo Dye","3/2/07","10/11/07","10/11/07","A","A","10/11/07","SD","3/24/08","3/24/08","A","A","3/24/08","SD","IF","IF","SD","MI","MI","G/ADP/N/173/BRA",8,8,1,10,1,1,3.781906964,0.813034244,25.20866345,87.33127445,1,7193.924995,40403.01773,1.37e+12,3.32e+12,13.36438031,47.16532839,5.562716551,0.87092729,"3/2/07",2007-03-02,2007-03-02,NA,NA,2007-10-11,1.37e+12,3.32e+12,13.36438031,47.16532839,25.20866345,87.33127445,7193.924995,40403.01773,5.562716551,0.87092729,"Brazil ",1995-01-01,"Germany ",1995-01-01,1,1,"Germany",1951-10-01,"Brazil",1948-07-30,1,1,10,10,8,8,1,1,NA,NA,NA,NA,NA,NA,NA,NA,NA,2008,0,NA,NA,0
"1255",NA,"BRA-AD-194",140,"2008",750,2007,750,140,"Q4_2012","Brazil","BRA-AD-194","India","IND","Pet Film","3/8/07","1/24/08","1/24/08","A","A","1/24/08","SD","7/4/08","7/4/08","A","A","7/4/08","SD","IF","IF","SD","MI","MI","G/ADP/N/180/BRA",8,8,1,9,1,1,3.781906964,1.983005667,25.20866345,44.87619241,1,7193.924995,1068.678519,1.37e+12,1.24e+12,13.36438031,20.43089434,5.562716551,18.2562719,"3/8/07",2007-03-08,2007-03-08,NA,NA,2008-01-24,1.65e+12,1.22e+12,13.6631968,23.60124526,27.13633384,52.26948525,8622.551938,1042.084209,5.914162259,17.78433572,"Brazil ",1995-01-01,"India ",1995-01-01,1,1,"India",1948-07-08,"Brazil",1948-07-30,1,1,9,9,8,8,1,1,NA,NA,NA,NA,NA,NA,NA,NA,NA,2008,0,NA,NA,0
"1256",NA,"BRA-AD-195",140,"2008",800,2007,800,140,"Q4_2012","Brazil","BRA-AD-194","Thailand","THA","Pet Film","3/8/07","1/24/08","1/24/08","A","A","1/24/08","SD","7/4/08","7/4/08","A","A","7/4/08","SD","IF","IF","SD","MI","MI","G/ADP/N/180/BRA",8,8,1,-1,0,1,3.781906964,4.760869034,25.20866345,138.4609529,1,7193.924995,3737.717255,1.37e+12,2.47e+11,13.36438031,73.42447336,5.562716551,10.67570638,"3/8/07",2007-03-08,2007-03-08,NA,NA,2008-01-24,1.65e+12,2.73e+11,13.6631968,76.44460097,27.13633384,150.3260626,8622.551938,4118.401435,5.914162259,11.56045295,"Brazil ",1995-01-01,"Thailand ",1995-01-01,1,1,"Thailand",1982-11-20,"Brazil",1948-07-30,1,1,4,5,8,8,1,0,NA,NA,NA,NA,NA,NA,NA,NA,NA,2008,0,NA,NA,0
"1260",NA,"BRA-AD-199",140,"2007",994,2007,994,140,"Q4_2012","Brazil","BRA-AD-199","European Union","EUN","Polycarbonates","10/8/07","10/8/07","10/8/07","A","A","10/8/07","SD","4/8/08","4/8/08","A","A","4/8/08","SD","IF","IF","SD/PU","MI","MI","G/ADP/N/173/BRA",8,8,1,NA,1,1,3.781906964,1.338927423,25.20866345,78.95004189,1,7193.924995,34161.46972,1.37e+12,1.71e+13,13.36438031,39.83741049,5.562716551,1.67825265,"10/8/07",2007-10-08,2007-10-08,NA,NA,2007-10-08,1.37e+12,1.71e+13,13.36438031,39.83741049,25.20866345,78.95004189,7193.924995,34161.46972,5.562716551,1.67825265,"Brazil ",1995-01-01,"European Union",1995-01-01,1,1,NA,NA,"Brazil",1948-07-30,1,NA,6,NA,8,8,1,1,NA,NA,NA,NA,NA,NA,NA,NA,NA,2008,0,NA,NA,0
"1268",NA,"BRA-AD-205",140,"2008",2,2007,2,140,"Q4_2012","Brazil","BRA-AD-205","USA","USA","Butyl Acrylate","12/24/07","7/3/08","7/3/08","A","A","7/3/08","SD","3/25/09","3/25/09","A","A","3/25/09","SD","IF","IF","SD","5.9","36.2","G/ADP/N/188/BRA",8,8,1,10,1,1,3.781906964,2.411169113,25.20866345,27.90826157,1,7193.924995,48070.38469,1.37e+12,1.45e+13,13.36438031,11.50321471,5.562716551,1.130169679,"12/24/07",2007-12-24,2007-12-24,NA,NA,2008-07-03,1.65e+12,1.47e+13,13.6631968,12.5208046,27.13633384,29.88729849,8622.551938,48407.07691,5.914162259,1.220378431,"Brazil ",1995-01-01,"United States of America",1995-01-01,1,1,"United States of America",1948-01-01,"Brazil",1948-07-30,1,1,10,10,8,8,1,1,NA,NA,NA,NA,NA,NA,NA,NA,NA,2009,0,NA,NA,0
"1269",NA,"BRA-AD-206",140,"2008",305,2008,305,140,"Q4_2012","Brazil","BRA-AD-206","Austria","AUT","Fibre of Viscose Rayon","3/20/08","10/9/08","10/9/08","A","A","10/9/08","SD","4/9/09","4/9/09","A","A","4/9/09","SD","IF","IF","SD","5.1","5.1","G/ADP/N/188/BRA",8,8,1,10,1,1,3.531257034,1.690814205,27.13633384,112.7781739,1,8622.551938,49679.13172,1.65e+12,4.14e+11,13.6631968,59.26723174,5.914162259,1.58087957,"3/20/08",2008-03-20,2008-03-20,NA,NA,2008-10-09,1.65e+12,4.14e+11,13.6631968,59.26723174,27.13633384,112.7781739,8622.551938,49679.13172,5.914162259,1.58087957,"Brazil ",1995-01-01,"Austria ",1995-01-01,1,1,"Austria",1951-10-19,"Brazil",1948-07-30,1,1,10,10,8,8,1,1,NA,NA,NA,NA,NA,NA,NA,NA,NA,2009,0,NA,NA,0
"1270",NA,"BRA-AD-207",140,"2008",710,2008,710,140,"Q4_2012","Brazil","BRA-AD-206","China","CHN","Fibre of Viscose Rayon","3/20/08","10/9/08","10/9/08","A","A","10/9/08","SD","4/9/09","4/9/09","A","A","4/9/09","SD","IF","IF","SD","15.1","15.1","G/ADP/N/188/BRA",8,8,1,-7,0,1,3.531257034,0.434411564,27.13633384,62.24882112,1,8622.551938,3413.588648,1.65e+12,4.52e+12,13.6631968,34.9816182,5.914162259,10.7315685,"3/20/08",2008-03-20,2008-03-20,NA,NA,2008-10-09,1.65e+12,4.52e+12,13.6631968,34.9816182,27.13633384,62.24882112,8622.551938,3413.588648,5.914162259,10.7315685,"Brazil ",1995-01-01,"China ",2001-12-11,1,1,NA,NA,"Brazil",1948-07-30,1,NA,-7,0,8,8,1,0,NA,NA,NA,NA,NA,NA,NA,NA,NA,2009,0,NA,NA,0
"1275",NA,"BRA-AD-211",140,"2008",710,2008,710,140,"Q4_2012","Brazil","BRA-AD-211","China","CHN","Truck Tires","5/16/08","12/19/08","12/19/08","A","A","12/19/08","SD","6/18/09","6/18/09","A","A","6/18/09","SD","IF","IF","SD","99.2","99.2","G/ADP/N/188/BRA",8,8,1,-7,0,1,3.531257034,0.434411564,27.13633384,62.24882112,1,8622.551938,3413.588648,1.65e+12,4.52e+12,13.6631968,34.9816182,5.914162259,10.7315685,"5/16/08",2008-05-16,2008-05-16,NA,NA,2008-12-19,1.65e+12,4.52e+12,13.6631968,34.9816182,27.13633384,62.24882112,8622.551938,3413.588648,5.914162259,10.7315685,"Brazil ",1995-01-01,"China ",2001-12-11,1,1,NA,NA,"Brazil",1948-07-30,1,NA,-7,0,8,8,1,0,NA,NA,NA,NA,NA,NA,NA,NA,NA,2009,0,NA,NA,0
"1279",NA,"BRA-AD-215",140,"2009",305,2008,305,140,"Q4_2012","Brazil","BRA-AD-215","Austria","AUT","Yarn of Viscose Rayon","8/13/08","3/14/09","3/14/09","A","A","3/14/09","SD","12/16/09","12/16/09","A","A","12/16/09","SD","IF","IF","SD","15.1","15.1","G/ADP/N/195/BRA",8,8,1,10,1,1,3.531257034,1.690814205,27.13633384,112.7781739,1,8622.551938,49679.13172,1.65e+12,4.14e+11,13.6631968,59.26723174,5.914162259,1.58087957,"8/13/08",2008-08-13,2008-08-13,NA,NA,2009-03-14,1.62e+12,3.84e+11,10.9789949,50.05081544,22.11829707,95.62698211,8373.45773,45872.19805,5.626726234,1.363810994,"Brazil ",1995-01-01,"Austria ",1995-01-01,1,1,"Austria",1951-10-19,"Brazil",1948-07-30,1,1,10,10,8,8,1,1,NA,NA,NA,NA,NA,NA,NA,NA,NA,2009,0,NA,NA,0
"1280",NA,"BRA-AD-216",140,"2009",710,2008,710,140,"Q4_2012","Brazil","BRA-AD-215","China","CHN","Yarn of Viscose Rayon","8/13/08","3/14/09","3/14/09","A","A","3/14/09","SD","12/16/09","12/16/09","A","A","12/16/09","SD","IF","IF","SD","14.8","14.8","G/ADP/N/195/BRA",8,8,1,-7,0,1,3.531257034,0.434411564,27.13633384,62.24882112,1,8622.551938,3413.588648,1.65e+12,4.52e+12,13.6631968,34.9816182,5.914162259,10.7315685,"8/13/08",2008-08-13,2008-08-13,NA,NA,2009-03-14,1.62e+12,4.99e+12,10.9789949,26.71609478,22.11829707,49.0212234,8373.45773,3748.504063,5.626726234,10.3331503,"Brazil ",1995-01-01,"China ",2001-12-11,1,1,NA,NA,"Brazil",1948-07-30,1,NA,-7,0,8,8,1,0,NA,NA,NA,NA,NA,NA,NA,NA,NA,2009,0,NA,NA,0
"1281",NA,"BRA-AD-217",140,"2009",750,2008,750,140,"Q4_2012","Brazil","BRA-AD-215","India","IND","Yarn of Viscose Rayon","8/13/08","3/14/09","3/14/09","A","A","3/14/09","SD","12/16/09","12/16/09","A","A","12/16/09","SD","IF","IF","SD","11.6","34.4","G/ADP/N/195/BRA",8,8,1,9,1,1,3.531257034,1.735424467,27.13633384,52.26948525,1,8622.551938,1042.084209,1.65e+12,1.22e+12,13.6631968,23.60124526,5.914162259,17.78433572,"8/13/08",2008-08-13,2008-08-13,NA,NA,2009-03-14,1.62e+12,1.37e+12,10.9789949,20.04962324,22.11829707,45.47695995,8373.45773,1147.238685,5.626726234,17.73663649,"Brazil ",1995-01-01,"India ",1995-01-01,1,1,"India",1948-07-08,"Brazil",1948-07-30,1,1,9,9,8,8,1,1,NA,NA,NA,NA,NA,NA,NA,NA,NA,2009,0,NA,NA,0
"1282",NA,"BRA-AD-218",140,"2009",850,2008,850,140,"Q4_2012","Brazil","BRA-AD-215","Indonesia","IDN","Yarn of Viscose Rayon","8/13/08","3/14/09","3/14/09","A","A","3/14/09","SD","12/16/09","12/16/09","A","A","12/16/09","SD","IF","IF","SD","2.4","2.4","G/ADP/N/195/BRA",8,8,1,8,1,1,3.531257034,6.433799857,27.13633384,58.56139963,1,8622.551938,2178.265663,1.65e+12,5.1e+11,13.6631968,29.80828417,5.914162259,14.48174026,"8/13/08",2008-08-13,2008-08-13,NA,NA,2009-03-14,1.62e+12,5.4e+11,10.9789949,24.15911967,22.11829707,45.51212137,8373.45773,2272.040982,5.626726234,15.29014815,"Brazil ",1995-01-01,"Indonesia ",1995-01-01,1,1,"Indonesia",1950-02-24,"Brazil",1948-07-30,1,1,8,8,8,8,1,1,NA,NA,NA,NA,NA,NA,NA,NA,NA,2009,0,NA,NA,0
"1285",NA,"BRA-AD-220",140,"2009",800,2008,800,140,"Q4_2012","Brazil","BRA-AD-215","Thailand","THA","Yarn of Viscose Rayon","8/13/08","3/14/09","3/14/09","A","A","3/14/09","SD","12/16/09","12/16/09","A","A","12/16/09","SD","IF","IF","SD","4.2","4.7","G/ADP/N/195/BRA",8,8,1,4,0,1,3.531257034,4.798852666,27.13633384,150.3260626,1,8622.551938,4118.401435,1.65e+12,2.73e+11,13.6631968,76.44460097,5.914162259,11.56045295,"8/13/08",2008-08-13,2008-08-13,NA,NA,2009-03-14,1.62e+12,2.64e+11,10.9789949,68.35167993,22.11829707,126.1573153,8373.45773,3978.905381,5.626726234,11.46469229,"Brazil ",1995-01-01,"Thailand ",1995-01-01,1,1,"Thailand",1982-11-20,"Brazil",1948-07-30,1,1,4,5,8,8,1,0,NA,NA,NA,NA,NA,NA,NA,NA,NA,2009,0,NA,NA,0
"1293",NA,"BRA-AD-228",140,"2009",710,2008,710,140,"Q4_2012","Brazil","BRA-AD-228","China","CHN","Footwear","12/31/08","9/8/09","9/8/09","A","A","9/9/09","SD","3/4/10","3/4/10","A","A","3/4/10","SD","9/10/12","2012","SD","246","246","G/ADP/N/202/BRA",8,8,1,-7,0,1,3.531257034,0.434411564,27.13633384,62.24882112,1,8622.551938,3413.588648,1.65e+12,4.52e+12,13.6631968,34.9816182,5.914162259,10.7315685,"12/31/08",2008-12-31,2008-12-31,NA,NA,2009-09-09,1.62e+12,4.99e+12,10.9789949,26.71609478,22.11829707,49.0212234,8373.45773,3748.504063,5.626726234,10.3331503,"Brazil ",1995-01-01,"China ",2001-12-11,1,1,NA,NA,"Brazil",1948-07-30,1,NA,-7,0,8,8,1,0,NA,NA,NA,NA,NA,NA,NA,NA,NA,2010,0,NA,NA,0
"1306",NA,"BRA-AD-240",140,"2011",220,2010,220,140,"Q4_2012","Brazil","BRA-AD-240","France","FRA","Glassine Papers","4/19/10","6/2/11","6/2/11","A","A","6/2/11","SD","10/6/11","10/6/11","A","A","10/6/11","SD","IF","IF","SD","28.3","28.3","G/ADP/N/223/BRA",8,8,1,9,1,1,3.935644997,0.933187394,22.77449978,53.33088934,1,10978.26024,39448.09885,2.14e+12,2.57e+12,10.87158512,25.53404726,5.304226816,1.827013512,"4/19/10",2010-04-19,2010-04-19,NA,NA,2011-06-02,2.48e+12,2.78e+12,11.88916767,26.89530019,24.5117143,56.75397897,12576.19559,42578.17709,5.456271013,1.904456507,"Brazil ",1995-01-01,"France ",1995-01-01,1,1,"France",1948-01-01,"Brazil",1948-07-30,1,1,9,9,8,8,1,1,NA,NA,NA,NA,NA,NA,NA,NA,NA,2011,0,NA,NA,0
"1307",NA,"BRA-AD-241",140,"2011",310,2010,310,140,"Q4_2012","Brazil","BRA-AD-240","Hungary","HUN","Glassine Papers","4/19/10","6/2/11","6/2/11","A","A","6/2/11","SD","10/6/11","10/6/11","A","A","10/6/11","SD","IF","IF","SD","20.1","20.1","G/ADP/N/223/BRA",8,8,1,10,1,1,3.935644997,0.669775272,22.77449978,168.0630567,0,10978.26024,12750.29865,2.14e+12,1.28e+11,10.87158512,87.3109458,5.304226816,3.526911278,"4/19/10",2010-04-19,2010-04-19,NA,NA,2011-06-02,2.48e+12,1.37e+11,11.88916767,93.99815852,24.5117143,180.5012297,12576.19559,13783.84074,5.456271013,NA,"Brazil ",1995-01-01,"Hungary ",1995-01-01,1,1,"Hungary",1973-09-09,"Brazil",1948-07-30,1,1,10,10,8,8,1,1,NA,NA,NA,NA,NA,NA,NA,NA,NA,2011,0,NA,NA,0
"1308",NA,"BRA-AD-242",140,"2011",325,2010,325,140,"Q4_2012","Brazil","BRA-AD-240","Italy","ITA","Glassine Papers","4/19/10","6/2/11","6/2/11","A","A","6/2/11","SD","10/6/11","10/6/11","A","A","10/6/11","SD","IF","IF","SD","26.3","26.3","G/ADP/N/223/BRA",8,8,1,10,1,1,3.935644997,0.71114,22.77449978,55.11108522,1,10978.26024,34673.49552,2.14e+12,2.06e+12,10.87158512,26.58114089,5.304226816,1.893622418,"4/19/10",2010-04-19,2010-04-19,NA,NA,2011-06-02,2.48e+12,2.2e+12,11.88916767,28.83447156,24.5117143,59.06676267,12576.19559,36988.16405,5.456271013,1.991997022,"Brazil ",1995-01-01,"Italy ",1995-01-01,1,1,"Italy",1950-05-30,"Brazil",1948-07-30,1,1,10,10,8,8,1,1,NA,NA,NA,NA,NA,NA,NA,NA,NA,2011,0,NA,NA,0
"1312",NA,"BRA-AD-246",140,"2011",2,2010,2,140,"Q4_2012","Brazil","BRA-AD-246","USA","USA","N-Butyl Alcohol","7/14/10","4/8/11","4/8/11","A","A","4/8/11","SD","10/6/11","10/6/11","A","A","10/6/11","SD","IF","IF","SD","11.1","61.4","G/ADP/N/223/BRA",8,8,1,10,1,1,3.935644997,2.632230719,22.77449978,28.11482588,1,10978.26024,48357.67357,2.14e+12,1.5e+13,10.87158512,12.32426145,5.304226816,1.192126008,"7/14/10",2010-07-14,2010-07-14,NA,NA,2011-04-08,2.48e+12,1.55e+13,11.88916767,13.52598849,24.5117143,30.71366955,12576.19559,49854.52267,5.456271013,1.24542282,"Brazil ",1995-01-01,"United States of America",1995-01-01,1,1,"United States of America",1948-01-01,"Brazil",1948-07-30,1,1,10,10,8,8,1,1,NA,NA,NA,NA,NA,NA,NA,NA,NA,2011,0,NA,NA,0
"1314",NA,"BRA-AD-248",140,"2011",160,2010,160,140,"Q4_2012","Brazil","BRA-AD-248","Argentina","ARG","Toluane Diisocyanate","7/26/10","7/12/11","7/12/11","A","A","7/12/11","SD","11/18/11","11/18/11","A","A","11/18/11","SD","5/18/12","2012","SD/PU","39.6","39.6","G/ADP/N/223/BRA",8,8,1,8,1,1,3.935644997,1.224987658,22.77449978,32.53587923,1,10978.26024,11460.37615,2.14e+12,4.63e+11,10.87158512,17.49945351,5.304226816,8.177986442,"7/26/10",2010-07-26,2010-07-26,NA,NA,2011-07-12,2.48e+12,5.58e+11,11.88916767,17.78503379,24.5117143,33.92136319,12576.19559,13693.70379,5.456271013,7.789211397,"Brazil ",1995-01-01,"Argentina ",1995-01-01,1,1,"Argentina",1967-10-11,"Brazil",1948-07-30,1,1,8,8,8,8,1,1,NA,NA,NA,NA,NA,NA,NA,NA,NA,2011,0,NA,NA,0
"1315",NA,"BRA-AD-249",140,"2011",2,2010,2,140,"Q4_2012","Brazil","BRA-AD-248","USA","USA","Toluane Diisocyanate","7/26/10","7/12/11","7/12/11","A","A","7/12/11","SD","11/18/11","11/18/11","A","A","11/18/11","SD","5/18/12","2012","SD","44.1","48","G/ADP/N/223/BRA",8,8,1,10,1,1,3.935644997,2.632230719,22.77449978,28.11482588,1,10978.26024,48357.67357,2.14e+12,1.5e+13,10.87158512,12.32426145,5.304226816,1.192126008,"7/26/10",2010-07-26,2010-07-26,NA,NA,2011-07-12,2.48e+12,1.55e+13,11.88916767,13.52598849,24.5117143,30.71366955,12576.19559,49854.52267,5.456271013,1.24542282,"Brazil ",1995-01-01,"United States of America",1995-01-01,1,1,"United States of America",1948-01-01,"Brazil",1948-07-30,1,1,10,10,8,8,1,1,NA,NA,NA,NA,NA,NA,NA,NA,NA,2011,0,NA,NA,0
"1335",NA,"BRA-AD-267",140,"2011",211,2010,211,140,"Q4_2012","Brazil","BRA-AD-267","Belgium","BEL","LWC Paper (Light Weighted Coated)","12/10/10","11/10/11","11/10/11","A","A","11/10/11","SD","4/19/12","4/19/12","A","A","4/23/12","SD","IF","IF","SD","12.4","12.4","G/ADP/N/230/BRA",8,8,1,8,1,1,3.935644997,1.423112954,22.77449978,157.5155077,1,10978.26024,43150.78431,2.14e+12,4.71e+11,10.87158512,79.81230554,5.304226816,0.774102523,"12/10/10",2010-12-10,2010-12-10,NA,NA,2011-11-10,2.48e+12,5.13e+11,11.88916767,84.98421158,24.5117143,169.1389218,12576.19559,46463.60378,5.456271013,0.624541669,"Brazil ",1995-01-01,"Belgium ",1995-01-01,1,1,"Belgium",1948-01-01,"Brazil",1948-07-30,1,1,8,8,8,8,1,1,NA,NA,NA,NA,NA,NA,NA,NA,NA,2012,0,NA,NA,0
"1336",NA,"BRA-AD-268",140,"2011",20,2010,20,140,"Q4_2012","Brazil","BRA-AD-267","Canada","CAN","LWC Paper (Light Weighted Coated)","12/10/10","11/10/11","11/10/11","A","A","11/10/11","SD","4/19/12","4/19/12","A","A","4/23/12","SD","IF","IF","SD","20.7","20.7","G/ADP/N/230/BRA",8,8,1,10,1,1,3.935644997,4.259310622,22.77449978,60.02278144,1,10978.26024,47465.34593,2.14e+12,1.61e+12,10.87158512,29.06089104,5.304226816,NA,"12/10/10",2010-12-10,2010-12-10,NA,NA,2011-11-10,2.48e+12,1.78e+12,11.88916767,30.71895573,24.5117143,62.6804037,12576.19559,51790.56695,5.456271013,NA,"Brazil ",1995-01-01,"Canada ",1995-01-01,1,1,"Canada",1948-01-01,"Brazil",1948-07-30,1,1,10,10,8,8,1,1,NA,NA,NA,NA,NA,NA,NA,NA,NA,2012,0,NA,NA,0
"1337",NA,"BRA-AD-269",140,"2011",375,2010,375,140,"Q4_2012","Brazil","BRA-AD-267","Finland","FIN","LWC Paper (Light Weighted Coated)","12/10/10","11/10/11","11/10/11","A","A","11/10/11","SD","4/19/12","4/19/12","A","A","4/23/12","SD","IF","IF","SD","36.8","95","G/ADP/N/230/BRA",8,8,1,10,1,1,3.935644997,5.89267979,22.77449978,79.36986639,1,10978.26024,44134.04836,2.14e+12,2.37e+11,10.87158512,40.35104407,5.304226816,2.883774749,"12/10/10",2010-12-10,2010-12-10,NA,NA,2011-11-10,2.48e+12,2.62e+11,11.88916767,40.9618319,24.5117143,82.64315687,12576.19559,48694.53514,5.456271013,2.896136231,"Brazil ",1995-01-01,"Finland ",1995-01-01,1,1,"Finland",1950-05-25,"Brazil",1948-07-30,1,1,10,10,8,8,1,1,NA,NA,NA,NA,NA,NA,NA,NA,NA,2012,0,NA,NA,0
"1339",NA,"BRA-AD-270",140,"2011",255,2010,255,140,"Q4_2012","Brazil","BRA-AD-267","Germany","DEU","LWC Paper (Light Weighted Coated)","12/10/10","11/10/11","11/10/11","A","A","11/10/11","SD","4/19/12","4/19/12","A","A","4/23/12","SD","IF","IF","SD","5.7","11.1","G/ADP/N/230/BRA",8,8,1,10,1,1,3.935644997,0.807024819,22.77449978,89.65851703,1,10978.26024,40407.96125,2.14e+12,3.3e+12,10.87158512,47.63887776,5.304226816,0.796810967,"12/10/10",2010-12-10,2010-12-10,NA,NA,2011-11-10,2.48e+12,3.63e+12,11.88916767,50.63144182,24.5117143,96.06536649,12576.19559,44354.68494,5.456271013,0.790615404,"Brazil ",1995-01-01,"Germany ",1995-01-01,1,1,"Germany",1951-10-01,"Brazil",1948-07-30,1,1,10,10,8,8,1,1,NA,NA,NA,NA,NA,NA,NA,NA,NA,2012,0,NA,NA,0
"1340",NA,"BRA-AD-271",140,"2011",380,2010,380,140,"Q4_2012","Brazil","BRA-AD-267","Sweden","SWE","LWC Paper (Light Weighted Coated)","12/10/10","11/10/11","11/10/11","A","A","11/10/11","SD","4/19/12","4/19/12","A","A","4/23/12","SD","IF","IF","SD","16.3","16.3","G/ADP/N/230/BRA",8,8,1,10,1,1,3.935644997,4.08693313,22.77449978,92.77909329,1,10978.26024,49376.82237,2.14e+12,4.63e+11,10.87158512,49.48112841,5.304226816,1.716834373,"12/10/10",2010-12-10,2010-12-10,NA,NA,2011-11-10,2.48e+12,5.36e+11,11.88916767,49.85546795,24.5117143,94.13623104,12576.19559,56724.36224,5.456271013,1.718662236,"Brazil ",1995-01-01,"Sweden ",1995-01-01,1,1,"Sweden",1950-04-30,"Brazil",1948-07-30,1,1,10,10,8,8,1,1,NA,NA,NA,NA,NA,NA,NA,NA,NA,2012,0,NA,NA,0
"1342",NA,"BRA-AD-273",140,"2011",2,2010,2,140,"Q4_2012","Brazil","BRA-AD-267","USA","USA","LWC Paper (Light Weighted Coated)","12/10/10","11/10/11","11/10/11","A","A","11/10/11","SD","4/19/12","4/19/12","A","A","4/23/12","SD","IF","IF","SD","79.3","79.3","G/ADP/N/230/BRA",8,8,1,10,1,1,3.935644997,2.632230719,22.77449978,28.11482588,1,10978.26024,48357.67357,2.14e+12,1.5e+13,10.87158512,12.32426145,5.304226816,1.192126008,"12/10/10",2010-12-10,2010-12-10,NA,NA,2011-11-10,2.48e+12,1.55e+13,11.88916767,13.52598849,24.5117143,30.71366955,12576.19559,49854.52267,5.456271013,1.24542282,"Brazil ",1995-01-01,"United States of America",1995-01-01,1,1,"United States of America",1948-01-01,"Brazil",1948-07-30,1,1,10,10,8,8,1,1,NA,NA,NA,NA,NA,NA,NA,NA,NA,2012,0,NA,NA,0
"1346",NA,"BRA-AD-277",140,"2012",710,2011,710,140,"Q4_2012","Brazil","BRA-AD-277","China","CHN","Citric Acid","4/7/11","1/25/12","1/25/12","A","A","1/26/12","SD","MI","MI","A","A","7/25/12","SD","IF","IF","SD","92.7","92.7","G/ADP/N/237/BRA",8,8,1,-7,0,1,3.53217088,0.533552859,24.5117143,54.57721811,1,12576.19559,5447.309378,2.48e+12,7.32e+12,11.88916767,28.53028081,5.456271013,10.03716006,"4/7/11",2011-04-07,2011-04-07,NA,NA,2012-01-26,2.25e+12,8.23e+12,12.58720783,27.32111234,26.62092387,51.82489065,11319.97371,6092.781886,5.319042412,10.08212511,"Brazil ",1995-01-01,"China ",2001-12-11,1,1,NA,NA,"Brazil",1948-07-30,1,NA,-7,0,8,8,1,0,NA,NA,NA,NA,NA,NA,NA,NA,NA,2012,0,NA,NA,0
"1355",NA,"BRA-AD-285",140,"2012",710,2011,710,140,"Q4_2012","Brazil","BRA-AD-284","China","CHN","Methylene Diphenyl Diisocyanate (MDI)","6/8/11","4/25/12","4/25/12","A","A","5/9/12","SD","MI","MI","A","A","10/31/12","SD","IF","IF","SD","41.8","73.5","G/ADP/N/237/BRA",8,8,1,-7,0,1,3.53217088,0.533552859,24.5117143,54.57721811,1,12576.19559,5447.309378,2.48e+12,7.32e+12,11.88916767,28.53028081,5.456271013,10.03716006,"6/8/11",2011-06-08,2011-06-08,NA,NA,2012-05-09,2.25e+12,8.23e+12,12.58720783,27.32111234,26.62092387,51.82489065,11319.97371,6092.781886,5.319042412,10.08212511,"Brazil ",1995-01-01,"China ",2001-12-11,1,1,NA,NA,"Brazil",1948-07-30,1,NA,-7,0,8,8,1,0,NA,NA,NA,NA,NA,NA,NA,NA,NA,2012,0,NA,NA,0
"1356",NA,"BRA-AD-286",140,"2012",2,2011,2,140,"Q4_2012","Brazil","BRA-AD-284","USA","USA","Methylene Diphenyl Diisocyanate (MDI)","6/8/11","4/25/12","4/25/12","A","A","5/9/12","SD","MI","MI","A","A","10/31/12","SD","IF","IF","SD","28.9","61.5","G/ADP/N/237/BRA",8,8,1,10,1,1,3.53217088,2.801760143,24.5117143,30.71366955,1,12576.19559,49854.52267,2.48e+12,1.55e+13,11.88916767,13.52598849,5.456271013,1.24542282,"6/8/11",2011-06-08,2011-06-08,NA,NA,2012-05-09,2.25e+12,1.62e+13,12.58720783,13.51772281,26.62092387,30.40394962,11319.97371,51755.21484,5.319042412,NA,"Brazil ",1995-01-01,"United States of America",1995-01-01,1,1,"United States of America",1948-01-01,"Brazil",1948-07-30,1,1,10,10,8,8,1,1,NA,NA,NA,NA,NA,NA,NA,NA,NA,2012,0,NA,NA,0
"1402",NA,"EUN-AD-379",994,"1998",651,1997,651,994,"Q4_2012","European Union","EUN-AD-379","Egypt","EGY","Cotton Fabrics","7/11/97","4/7/98","4/7/98","A","A","4/7/98","AVD",".",".",".",".",".",".",".",".",".",".",".",".",NA,NA,1,-6,0,1,1.751742861,3.836652759,62.87320261,43.73824746,0,18306.25003,1243.168764,8.89e+12,78436575744,32.33718379,18.8416698,2.747584066,16.95435335,"7/11/97",1997-07-11,1997-07-11,5749,NA,1998-04-07,9.2e+12,84828807270,32.54378883,16.21433542,63.84209982,41.927627,18919.92294,1323.70359,2.566497586,17.11367707,"European Union",1995-01-01,"Egypt ",1995-06-30,1,1,"Egypt",1970-05-09,NA,NA,NA,1,-6,0,6,NA,1,0,NA,NA,NA,NA,NA,NA,NA,NA,NA,NA,0,NA,NA,0
"1420",NA,"EUN-AD-395",994,"1998",355,1997,355,994,"Q4_2012","European Union","EUN-AD-395","Bulgaria","BGR","Hardboard","11/7/97","8/5/98","8/5/98","A","A","8/5/98","PU","1/25/99","1/25/99","A","A","1/25/99","PU","1/28/04","2004","AVD/PU","7.1","7.2","G/ADP/N/53/EEC",NA,NA,1,8,1,1,1.751742861,3.098207269,62.87320261,112.0938612,0,18306.25003,1209.502744,8.89e+12,10053469055,32.33718379,58.68229522,2.747584066,24.94717759,"11/7/97",1997-11-07,1997-11-07,170,NA,1998-08-05,9.2e+12,13060786998,32.54378883,59.0944153,63.84209982,117.1780783,18919.92294,1581.824574,2.566497586,17.18027964,"European Union",1995-01-01,"Bulgaria ",1996-12-01,1,1,NA,NA,NA,NA,NA,NA,8,8,6,NA,1,1,NA,NA,NA,NA,NA,NA,NA,NA,NA,1999,0,NA,NA,0
"1453",NA,"BRA-AD-68",140,"1998",349,1995,349,140,"Q4_2012","Brazil","BRA-AD-65","Slovenia","SVN","Ferrochromium Containing by Weight Less Than 4% Carbon","1/20/95","2/19/98","2/19/98","A","A","2/19/98","AVD","4/30/96","4/30/96","A","A","4/30/96","AVD","4/30/01","2001","AVD","45.5","45.5","G/ADP/N/16/BRA",8,8,1,10,1,1,5.225324721,1.797408424,16.03180654,101.1237517,0,4749.814207,10523.72455,7.69e+11,20940864809,7.256806223,49.59290431,5.771250392,4.392580999,"1/20/95",1995-01-20,1995-01-20,981,19,1998-02-19,8.44e+11,21747365515,6.932774825,51.07139956,15.86498597,103.6353427,4979.144846,10974.48893,5.524736835,3.971283611,"Brazil ",1995-01-01,"Slovenia ",1995-07-30,1,1,"Slovenia",1994-10-30,"Brazil",1948-07-30,1,1,10,10,8,8,1,1,NA,NA,NA,NA,NA,NA,NA,NA,NA,1996,0,NA,NA,0
"1614",NA,"CAN-AD-212",20,"1995",2,1995,2,20,"Q4_2012","Canada","CAN-AD-212","USA","USA","Refined Sugar","3/17/95","7/7/95","MI","A","MI","7/7/95","AVD","10/5/95","11/6/95","A","A","11/6/95","AVD","IF","IF","AVD","43.86","43.86","G/ADP/N/9/CAN",10,10,1,10,1,1,9.308978005,3.862870077,69.32816437,22.38256785,0,20509.00309,28781.94969,6.02e+11,7.66e+12,36.22560257,10.60542797,2.90607832,1.607811468,"3/17/95",1995-03-17,1995-03-17,786,498,1995-07-07,6.02e+11,7.66e+12,36.22560257,10.60542797,69.32816437,22.38256785,20509.00309,28781.94969,2.90607832,1.607811468,"Canada ",1995-01-01,"United States of America",1995-01-01,1,1,"United States of America",1948-01-01,"Canada",1948-01-01,1,1,10,10,10,10,1,1,NA,NA,NA,NA,NA,NA,NA,NA,NA,1995,0,NA,NA,0
"1615",NA,"CAN-AD-213",20,"1995",732,1995,732,20,"Q4_2012","Canada","CAN-AD-212","Korea","KOR","Refined Sugar","3/17/95","7/7/95","MI","A","MI","7/7/95","AVD","10/5/95","11/6/95","A","N",".",".",".",".",".",".",".",".",10,10,1,6,1,1,9.308978005,1.323774781,69.32816437,54.3156478,1,20509.00309,12403.91322,6.02e+11,5.59e+11,36.22560257,26.65268255,2.90607832,5.821741134,"3/17/95",1995-03-17,1995-03-17,750,498,1995-07-07,6.02e+11,5.59e+11,36.22560257,26.65268255,69.32816437,54.3156478,20509.00309,12403.91322,2.90607832,5.821741134,"Canada ",1995-01-01,"South Korea",1995-01-01,1,1,"South Korea",1967-04-14,"Canada",1948-01-01,1,1,6,7,10,10,1,1,NA,NA,NA,NA,NA,NA,NA,NA,NA,NA,0,NA,NA,0
"1616",NA,"CAN-AD-214",20,"1995",390,1995,390,20,"Q4_2012","Canada","CAN-AD-212","Denmark","DNK","Refined Sugar","3/17/95","7/7/95","MI","A","MI","7/7/95","AVD","10/5/95","11/6/95","A","A","11/6/95","AVD","11/1/10","2010","AVD","64.29","64.29","G/ADP/N/9/CAN",10,10,1,10,1,1,9.308978005,2.866391705,69.32816437,71.1860683,0,20509.00309,34773.67544,6.02e+11,1.82e+11,36.22560257,37.63727937,2.90607832,3.381405673,"3/17/95",1995-03-17,1995-03-17,781,498,1995-07-07,6.02e+11,1.82e+11,36.22560257,37.63727937,69.32816437,71.1860683,20509.00309,34773.67544,2.90607832,3.381405673,"Canada ",1995-01-01,"Denmark ",1995-01-01,1,1,"Denmark",1950-05-28,"Canada",1948-01-01,1,1,10,10,10,10,1,1,NA,NA,NA,NA,NA,NA,NA,NA,NA,1995,0,NA,NA,0
"1617",NA,"CAN-AD-215",20,"1995",255,1995,255,20,"Q4_2012","Canada","CAN-AD-212","Germany","DEU","Refined Sugar","3/17/95","7/7/95","MI","A","MI","7/7/95","AVD","10/5/95","11/6/95","A","A","11/6/95","AVD","11/1/10","2010","AVD","49.74","49.74","G/ADP/N/9/CAN",10,10,1,10,1,1,9.308978005,1.111538494,69.32816437,46.88720584,1,20509.00309,30887.86549,6.02e+11,2.52e+12,36.22560257,23.74087098,2.90607832,1.094530339,"3/17/95",1995-03-17,1995-03-17,4550,498,1995-07-07,6.02e+11,2.52e+12,36.22560257,23.74087098,69.32816437,46.88720584,20509.00309,30887.86549,2.90607832,1.094530339,"Canada ",1995-01-01,"Germany ",1995-01-01,1,1,"Germany",1951-10-01,"Canada",1948-01-01,1,1,10,10,10,10,1,1,NA,NA,NA,NA,NA,NA,NA,NA,NA,1995,0,NA,NA,0
"1618",NA,"CAN-AD-216",20,"1995",210,1995,210,20,"Q4_2012","Canada","CAN-AD-212","Netherlands","NLD","Refined Sugar","3/17/95","7/7/95","MI","A","MI","7/7/95","AVD","10/5/95","11/6/95","A","A","11/6/95","AVD","11/1/10","2010","AVD","64.19","64.19","G/ADP/N/9/CAN",10,10,1,10,1,1,9.308978005,3.914121733,69.32816437,113.0491612,0,20509.00309,27101.95313,6.02e+11,4.19e+11,36.22560257,59.36526448,2.90607832,3.359256545,"3/17/95",1995-03-17,1995-03-17,207,498,1995-07-07,6.02e+11,4.19e+11,36.22560257,59.36526448,69.32816437,113.0491612,20509.00309,27101.95313,2.90607832,3.359256545,"Canada ",1995-01-01,"Netherlands ",1995-01-01,1,1,"Netherlands",1948-01-01,"Canada",1948-01-01,1,1,10,10,10,10,1,1,NA,NA,NA,NA,NA,NA,NA,NA,NA,1995,0,NA,NA,0
"1619",NA,"CAN-AD-217",20,"1995",200,1995,200,20,"Q4_2012","Canada","CAN-AD-212","United Kingdom","GBR","Refined Sugar","3/17/95","7/7/95","MI","A","MI","7/7/95","AVD","10/5/95","11/6/95","A","A","11/6/95","AVD","11/1/10","2010","AVD","63.77","63.77","G/ADP/N/9/CAN",10,10,1,10,1,1,9.308978005,0.738148648,69.32816437,56.27960438,1,20509.00309,20349.95874,6.02e+11,1.18e+12,36.22560257,28.41860465,2.90607832,1.569365601,"3/17/95",1995-03-17,1995-03-17,1570,498,1995-07-07,6.02e+11,1.18e+12,36.22560257,28.41860465,69.32816437,56.27960438,20509.00309,20349.95874,2.90607832,1.569365601,"Canada ",1995-01-01,"United Kingdom",1995-01-01,1,1,"United Kingdom",1948-01-01,"Canada",1948-01-01,1,1,10,10,10,10,1,1,NA,NA,NA,NA,NA,NA,NA,NA,NA,1995,0,NA,NA,0
"1620",NA,"CAN-AD-218",20,"1995",2,1995,2,20,"Q4_2012","Canada","CAN-AD-218","USA","USA","Jars and Jar Caps","3/24/95","6/22/95","MI","A","MI","6/22/95","AVD","9/20/95","10/20/95","A","A","10/20/95","AVD","2/4/00","2000","AVD","31.85","31.85","G/ADP/N/9/CAN",10,10,1,10,1,1,9.308978005,3.862870077,69.32816437,22.38256785,0,20509.00309,28781.94969,6.02e+11,7.66e+12,36.22560257,10.60542797,2.90607832,1.607811468,"3/24/95",1995-03-24,1995-03-24,793,505,1995-06-22,6.02e+11,7.66e+12,36.22560257,10.60542797,69.32816437,22.38256785,20509.00309,28781.94969,2.90607832,1.607811468,"Canada ",1995-01-01,"United States of America",1995-01-01,1,1,"United States of America",1948-01-01,"Canada",1948-01-01,1,1,10,10,10,10,1,1,NA,NA,NA,NA,NA,NA,NA,NA,NA,1995,0,NA,NA,0
"1621",NA,"CAN-AD-219",20,"1996",325,1995,325,20,"Q4_2012","Canada","CAN-AD-219","Italy","ITA","Pasta","8/30/95","1/12/96","MI","A","MI","1/12/96","AVD","4/11/96","5/13/96","A","N",".",".",".",".",".",".",".",".",10,10,1,10,1,1,9.308978005,0.667190616,69.32816437,47.58799564,1,20509.00309,19910.00067,6.02e+11,1.13e+12,36.22560257,25.71427747,2.90607832,3.317877129,"8/30/95",1995-08-30,1995-08-30,225,664,1996-01-12,6.27e+11,1.27e+12,37.20361655,24.68113975,70.47845989,44.64167892,21129.43543,22271.33092,3.002817962,3.29828126,"Canada ",1995-01-01,"Italy ",1995-01-01,1,1,"Italy",1950-05-30,"Canada",1948-01-01,1,1,10,10,10,10,1,1,NA,NA,NA,NA,NA,NA,NA,NA,NA,NA,0,NA,NA,0
"1624",NA,"CAN-AD-221",20,"1996",2,1995,2,20,"Q4_2012","Canada","CAN-AD-221","USA","USA","Culture Media","9/29/95","1/31/96","MI","A","MI","1/31/96","AVD","4/26/96","5/31/96","A","N",".",".",".",".",".",".",".",".",10,10,1,10,1,1,9.308978005,3.862870077,69.32816437,22.38256785,0,20509.00309,28781.94969,6.02e+11,7.66e+12,36.22560257,10.60542797,2.90607832,1.607811468,"9/29/95",1995-09-29,1995-09-29,982,694,1996-01-31,6.27e+11,8.1e+12,37.20361655,10.71084665,70.47845989,22.61178736,21129.43543,30068.22721,3.002817962,1.805715555,"Canada ",1995-01-01,"United States of America",1995-01-01,1,1,"United States of America",1948-01-01,"Canada",1948-01-01,1,1,10,10,10,10,1,1,NA,NA,NA,NA,NA,NA,NA,NA,NA,NA,0,NA,NA,0
"1625",NA,"CAN-AD-222",20,"1996",200,1995,200,20,"Q4_2012","Canada","CAN-AD-221","United Kingdom","GBR","Culture Media","9/29/95","1/31/96","MI","A","MI","1/31/96","MI","4/26/96","5/31/96","A","N",".",".",".",".",".",".",".",".",10,10,1,10,1,1,9.308978005,0.738148648,69.32816437,56.27960438,1,20509.00309,20349.95874,6.02e+11,1.18e+12,36.22560257,28.41860465,2.90607832,1.569365601,"9/29/95",1995-09-29,1995-09-29,1766,694,1996-01-31,6.27e+11,1.24e+12,37.20361655,29.16154741,70.47845989,57.88001216,21129.43543,21349.43492,3.002817962,1.363270277,"Canada ",1995-01-01,"United Kingdom",1995-01-01,1,1,"United Kingdom",1948-01-01,"Canada",1948-01-01,1,1,10,10,10,10,1,1,NA,NA,NA,NA,NA,NA,NA,NA,NA,NA,0,NA,NA,0
"1626",NA,"CAN-AD-223",20,"1996",850,1996,850,20,"Q4_2012","Canada","CAN-AD-223","Indonesia","IDN","Refill Paper","3/1/96","5/30/96","MI","A","MI","5/30/96","AVD","8/26/96","9/27/96","A","N",".",".",".",".",".",".",".",".",10,10,1,-7,0,1,8.026692688,5.83042185,70.47845989,52.26474368,0,21129.43543,1153.587564,6.27e+11,2.27e+11,37.20361655,25.82455238,3.002817962,16.67238699,"3/1/96",1996-03-01,1996-03-01,10947,848,1996-05-30,6.27e+11,2.27e+11,37.20361655,25.82455238,70.47845989,52.26474368,21129.43543,1153.587564,3.002817962,16.67238699,"Canada ",1995-01-01,"Indonesia ",1995-01-01,1,1,"Indonesia",1950-02-24,"Canada",1948-01-01,1,1,-7,0,10,10,1,0,NA,NA,NA,NA,NA,NA,NA,NA,NA,NA,0,NA,NA,0
"1627",NA,"CAN-AD-224",20,"1996",850,1996,850,20,"Q4_2012","Canada","CAN-AD-224","Indonesia","IDN","Spiral Books","3/1/96","5/30/96","MI","A","MI","5/30/96","AVD","8/26/96","9/27/96","A","N",".",".",".",".",".",".",".",".",10,10,1,-7,0,1,8.026692688,5.83042185,70.47845989,52.26474368,0,21129.43543,1153.587564,6.27e+11,2.27e+11,37.20361655,25.82455238,3.002817962,16.67238699,"3/1/96",1996-03-01,1996-03-01,10947,848,1996-05-30,6.27e+11,2.27e+11,37.20361655,25.82455238,70.47845989,52.26474368,21129.43543,1153.587564,3.002817962,16.67238699,"Canada ",1995-01-01,"Indonesia ",1995-01-01,1,1,"Indonesia",1950-02-24,"Canada",1948-01-01,1,1,-7,0,10,10,1,0,NA,NA,NA,NA,NA,NA,NA,NA,NA,NA,0,NA,NA,0
"1628",NA,"CAN-AD-225",20,"1996",140,1996,140,20,"Q4_2012","Canada","CAN-AD-224","Brazil","BRA","Spiral Books","3/1/96","5/30/96","MI","A","MI","5/30/96","AVD","8/26/96","9/27/96","A","N",".",".",".",".",".",".",".",".",10,10,1,8,1,1,8.026692688,3.703488109,70.47845989,14.93284674,1,21129.43543,5107.79392,6.27e+11,8.4e+11,37.20361655,6.566741512,3.002817962,5.513690332,"3/1/96",1996-03-01,1996-03-01,425,848,1996-05-30,6.27e+11,8.4e+11,37.20361655,6.566741512,70.47845989,14.93284674,21129.43543,5107.79392,3.002817962,5.513690332,"Canada ",1995-01-01,"Brazil ",1995-01-01,1,1,"Brazil",1948-07-30,"Canada",1948-01-01,1,1,8,8,10,10,1,1,NA,NA,NA,NA,NA,NA,NA,NA,NA,NA,0,NA,NA,0
"1630",NA,"CAN-AD-227",20,"1996",2,1996,2,20,"Q4_2012","Canada","CAN-AD-227","USA","USA","Polyiso Insulation Board","9/13/96","12/12/96","MI","A","MI","12/12/96","AVD","3/7/97","4/11/97","A","A","4/11/97","AVD","4/10/02","2002","AVD","36","36","G/ADP/N/29/CAN",10,10,1,10,1,1,8.026692688,3.072677564,70.47845989,22.61178736,0,21129.43543,30068.22721,6.27e+11,8.1e+12,37.20361655,10.71084665,3.002817962,1.805715555,"9/13/96",1996-09-13,1996-09-13,1332,1044,1996-12-12,6.27e+11,8.1e+12,37.20361655,10.71084665,70.47845989,22.61178736,21129.43543,30068.22721,3.002817962,1.805715555,"Canada ",1995-01-01,"United States of America",1995-01-01,1,1,"United States of America",1948-01-01,"Canada",1948-01-01,1,1,10,10,10,10,1,1,NA,NA,NA,NA,NA,NA,NA,NA,NA,1997,0,NA,NA,0
"1631",NA,"CAN-AD-228",20,"1997",2,1996,2,20,"Q4_2012","Canada","CAN-AD-228","USA","USA","Concrete Panels","11/29/96","2/2/97","MI","A","MI","2/2/97","AVD","5/27/97","6/27/97","A","A","6/27/97","AVD","6/26/02","2002","AVD","35.7","35.7","G/ADP/N/29/CAN",10,10,1,10,1,1,8.026692688,3.072677564,70.47845989,22.61178736,0,21129.43543,30068.22721,6.27e+11,8.1e+12,37.20361655,10.71084665,3.002817962,1.805715555,"11/29/96",1996-11-29,1996-11-29,1409,1121,1997-02-02,6.51e+11,8.61e+12,38.25007544,11.07974676,74.59351037,23.34436894,21709.29634,31572.63522,2.501016275,1.685758917,"Canada ",1995-01-01,"United States of America",1995-01-01,1,1,"United States of America",1948-01-01,"Canada",1948-01-01,1,1,10,10,10,10,1,1,NA,NA,NA,NA,NA,NA,NA,NA,NA,1997,0,NA,NA,0
"1634",NA,"CAN-AD-230",20,"1997",70,1997,70,20,"Q4_2012","Canada","CAN-AD-229","Mexico","MEX","Hot-Rolled Carbon Steel Plate","2/13/97","6/27/97","4/7/97","A","A","6/27/97","AVD","9/25/97","10/27/97","A","A","10/27/97","AVD","1/10/03","2003","AVD","26.2","26.2","G/ADP/N/35/CAN",10,10,1,6,1,1,7.667701871,1.002618009,74.59351037,49.32015831,1,21709.29634,4855.629476,6.51e+11,4.81e+11,38.25007544,25.23093323,2.501016275,4.37469987,"2/13/97",1997-02-13,1997-02-13,805,1197,1997-06-27,6.51e+11,4.81e+11,38.25007544,25.23093323,74.59351037,49.32015831,21709.29634,4855.629476,2.501016275,4.37469987,"Canada ",1995-01-01,"Mexico ",1995-01-01,1,1,"Mexico",1986-08-24,"Canada",1948-01-01,1,1,6,6,10,10,1,1,NA,NA,NA,NA,NA,NA,NA,NA,NA,1997,0,NA,NA,0
"1636",NA,"CAN-AD-232",20,"1997",560,1997,560,20,"Q4_2012","Canada","CAN-AD-229","South Africa","ZAF","Hot-Rolled Carbon Steel Plate","2/13/97","6/27/97","4/7/97","A","A","6/27/97","AVD","9/25/97","10/27/97","A","A","10/27/97","AVD","1/9/08","2008","AVD","18.1","18.1","G/ADP/N/35/CAN",10,10,1,9,1,1,7.667701871,3.927045762,74.59351037,48.03304544,0,21709.29634,3636.171062,6.51e+11,1.49e+11,38.25007544,24.59554052,2.501016275,4.008502012,"2/13/97",1997-02-13,1997-02-13,1010,1197,1997-06-27,6.51e+11,1.49e+11,38.25007544,24.59554052,74.59351037,48.03304544,21709.29634,3636.171062,2.501016275,4.008502012,"Canada ",1995-01-01,"South Africa",1995-01-01,1,1,"South Africa",1948-06-13,"Canada",1948-01-01,1,1,9,9,10,10,1,1,NA,NA,NA,NA,NA,NA,NA,NA,NA,1997,0,NA,NA,0
"1638",NA,"CAN-AD-234",20,"1997",2,1997,2,20,"Q4_2012","Canada","CAN-AD-234","USA","USA","Baby Food","10/3/97","12/30/97","MI","A","MI","12/30/97","AVD","3/30/98","4/29/98","A","A","4/29/98","AVD","4/28/03","2003","AVD","59.7","59.7","G/ADP/N/41/CAN",10,10,1,10,1,1,7.667701871,2.672195833,74.59351037,23.34436894,0,21709.29634,31572.63522,6.51e+11,8.61e+12,38.25007544,11.07974676,2.501016275,1.685758917,"10/3/97",1997-10-03,1997-10-03,1717,1429,1997-12-30,6.51e+11,8.61e+12,38.25007544,11.07974676,74.59351037,23.34436894,21709.29634,31572.63522,2.501016275,1.685758917,"Canada ",1995-01-01,"United States of America",1995-01-01,1,1,"United States of America",1948-01-01,"Canada",1948-01-01,1,1,10,10,10,10,1,1,NA,NA,NA,NA,NA,NA,NA,NA,NA,1998,0,NA,NA,0
"1639",NA,"CAN-AD-235",20,"1998",255,1997,255,20,"Q4_2012","Canada","CAN-AD-235","Germany","DEU","Stainless Steel Round Bar","12/23/97","5/7/98","2/13/98","A","A","5/7/98","AVD","8/5/98","9/4/98","A","A","9/4/98","AVD","1/18/05","2005","AVD","52.4","52.4","G/ADP/N/47/CAN",10,10,1,10,1,1,7.667701871,0.944504553,74.59351037,53.50674475,1,21709.29634,26296.53061,6.51e+11,2.16e+12,38.25007544,27.39830597,2.501016275,1.133319477,"12/23/97",1997-12-23,1997-12-23,5562,1510,1998-05-07,6.31e+11,2.18e+12,40.06896331,28.58294637,78.20599319,55.79170281,20875.24831,26547.77535,2.576269825,1.073012219,"Canada ",1995-01-01,"Germany ",1995-01-01,1,1,"Germany",1951-10-01,"Canada",1948-01-01,1,1,10,10,10,10,1,1,NA,NA,NA,NA,NA,NA,NA,NA,NA,1998,0,NA,NA,0
"1640",NA,"CAN-AD-236",20,"1998",220,1997,220,20,"Q4_2012","Canada","CAN-AD-235","France","FRA","Stainless Steel Round Bar","12/23/97","5/7/98","2/13/98","A","A","5/7/98","AVD","8/5/98","9/4/98","A","A","9/4/98","AVD","1/18/05","2005","AVD","52.4","52.4","G/ADP/N/47/CAN",10,10,1,9,1,1,7.667701871,1.226964608,74.59351037,48.97738313,1,21709.29634,23705.83186,6.51e+11,1.42e+12,38.25007544,25.92567205,2.501016275,2.778938793,"12/23/97",1997-12-23,1997-12-23,951,1510,1998-05-07,6.31e+11,1.47e+12,40.06896331,26.4677143,78.20599319,50.4014939,20875.24831,24405.87657,2.576269825,2.797470926,"Canada ",1995-01-01,"France ",1995-01-01,1,1,"France",1948-01-01,"Canada",1948-01-01,1,1,9,9,10,10,1,1,NA,NA,NA,NA,NA,NA,NA,NA,NA,1998,0,NA,NA,0
"1641",NA,"CAN-AD-237",20,"1998",325,1997,325,20,"Q4_2012","Canada","CAN-AD-235","Italy","ITA","Stainless Steel Round Bar","12/23/97","5/7/98","2/13/98","A","A","5/7/98","AVD","8/5/98","9/4/98","A","A","9/4/98","AVD","1/18/05","2005","AVD","48.6","48.6","G/ADP/N/47/CAN",10,10,1,10,1,1,7.667701871,0.636162923,74.59351037,46.49292109,1,21709.29634,21069.54779,6.51e+11,1.2e+12,38.25007544,25.20755186,2.501016275,3.198451766,"12/23/97",1997-12-23,1997-12-23,584,1510,1998-05-07,6.31e+11,1.22e+12,40.06896331,25.15430622,78.20599319,47.08565282,20875.24831,21519.06412,2.576269825,3.098162293,"Canada ",1995-01-01,"Italy ",1995-01-01,1,1,"Italy",1950-05-30,"Canada",1948-01-01,1,1,10,10,10,10,1,1,NA,NA,NA,NA,NA,NA,NA,NA,NA,1998,0,NA,NA,0
"1642",NA,"CAN-AD-238",20,"1998",740,1997,740,20,"Q4_2012","Canada","CAN-AD-235","Japan","JPN","Stainless Steel Round Bar","12/23/97","5/7/98","2/13/98","A","A","5/7/98","AVD","8/5/98","9/4/98","A","A","9/4/98","AVD","1/18/05","2005","AVD","52.4","52.4","G/ADP/N/47/CAN",10,10,1,10,1,1,7.667701871,0.531375085,74.59351037,20.38760447,1,21709.29634,34294.89898,6.51e+11,4.32e+12,38.25007544,10.73145689,2.501016275,1.613068025,"12/23/97",1997-12-23,1997-12-23,712,1510,1998-05-07,6.31e+11,3.91e+12,40.06896331,10.7774668,78.20599319,19.6888759,20875.24831,30967.28809,2.576269825,1.704186546,"Canada ",1995-01-01,"Japan ",1995-01-01,1,1,"Japan",1955-09-10,"Canada",1948-01-01,1,1,10,10,10,10,1,1,NA,NA,NA,NA,NA,NA,NA,NA,NA,1998,0,NA,NA,0
"1643",NA,"CAN-AD-239",20,"1998",230,1997,230,20,"Q4_2012","Canada","CAN-AD-235","Spain","ESP","Stainless Steel Round Bar","12/23/97","5/7/98","2/13/98","A","A","5/7/98","AVD","8/5/98","9/4/98","A","A","9/4/98","AVD","1/18/05","2005","AVD","52.4","52.4","G/ADP/N/47/CAN",10,10,1,10,1,1,7.667701871,1.352447831,74.59351037,51.75778652,0,21709.29634,14463.12096,6.51e+11,5.72e+11,38.25007544,26.31191357,2.501016275,4.800635225,"12/23/97",1997-12-23,1997-12-23,597,1510,1998-05-07,6.31e+11,6.01e+11,40.06896331,26.67408334,78.20599319,53.56955454,20875.24831,15121.72118,2.576269825,4.65607215,"Canada ",1995-01-01,"Spain ",1995-01-01,1,1,"Spain",1963-08-29,"Canada",1948-01-01,1,1,10,10,10,10,1,1,NA,NA,NA,NA,NA,NA,NA,NA,NA,1998,0,NA,NA,0
"1645",NA,"CAN-AD-240",20,"1998",380,1997,380,20,"Q4_2012","Canada","CAN-AD-235","Sweden","SWE","Stainless Steel Round Bar","12/23/97","5/7/98","2/13/98","A","A","5/7/98","AVD","8/5/98","9/4/98","A","A","9/4/98","AVD","1/18/05","2005","AVD","44.2","44.2","G/ADP/N/47/CAN",10,10,1,10,1,1,7.667701871,5.344771338,74.59351037,76.65060518,0,21709.29634,28620.40835,6.51e+11,2.53e+11,38.25007544,42.07061813,2.501016275,2.536617332,"12/23/97",1997-12-23,1997-12-23,642,1510,1998-05-07,6.31e+11,2.55e+11,40.06896331,43.04956386,78.20599319,79.41214524,20875.24831,28779.11562,2.576269825,2.380585329,"Canada ",1995-01-01,"Sweden ",1995-01-01,1,1,"Sweden",1950-04-30,"Canada",1948-01-01,1,1,10,10,10,10,1,1,NA,NA,NA,NA,NA,NA,NA,NA,NA,1998,0,NA,NA,0
"1647",NA,"CAN-AD-242",20,"1998",200,1997,200,20,"Q4_2012","Canada","CAN-AD-235","United Kingdom","GBR","Stainless Steel Round Bar","12/23/97","5/7/98","2/13/98","A","A","5/7/98","AVD","8/5/98","9/4/98","A","A","9/4/98","AVD","1/18/05","2005","AVD","52.4","52.4","G/ADP/N/47/CAN",10,10,1,10,1,1,7.667701871,0.689121997,74.59351037,55.99926664,1,21709.29634,23734.42186,6.51e+11,1.38e+12,38.25007544,28.33810414,2.501016275,1.208845861,"12/23/97",1997-12-23,1997-12-23,235,1510,1998-05-07,6.31e+11,1.48e+12,40.06896331,26.25155362,78.20599319,53.13777989,20875.24831,25266.39474,2.576269825,1.067465104,"Canada ",1995-01-01,"United Kingdom",1995-01-01,1,1,"United Kingdom",1948-01-01,"Canada",1948-01-01,1,1,10,10,10,10,1,1,NA,NA,NA,NA,NA,NA,NA,NA,NA,1998,0,NA,NA,0
"1648",NA,"CAN-AD-243",20,"1998",750,1998,750,20,"Q4_2012","Canada","CAN-AD-235","India","IND","Stainless Steel Round Bar","3/6/98","5/7/98","2/13/98","A","A","5/7/98","AVD","8/5/98","9/4/98","A","A","9/4/98","AVD","1/18/05","2005","AVD","24.5","24.5","G/ADP/N/47/CAN",10,10,1,9,1,1,6.745102129,1.656051057,78.20599319,23.29101706,1,20875.24831,425.4452943,6.31e+11,4.29e+11,40.06896331,10.82856928,2.576269825,25.79098082,"3/6/98",1998-03-06,1998-03-06,319,1583,1998-05-07,6.31e+11,4.29e+11,40.06896331,10.82856928,78.20599319,23.29101706,20875.24831,425.4452943,2.576269825,25.79098082,"Canada ",1995-01-01,"India ",1995-01-01,1,1,"India",1948-07-08,"Canada",1948-01-01,1,1,9,9,10,10,1,1,NA,NA,NA,NA,NA,NA,NA,NA,NA,1998,0,NA,NA,0
"1649",NA,"CAN-AD-244",20,"1999",220,1998,220,20,"Q4_2012","Canada","CAN-AD-244","France","FRA","Filter Tip Cigarette Tubes","10/19/98","1/18/99","MI","A","MI","1/18/99","AVD",".",".","OTH",".","4/12/99","PU","4/6/09","2009","PU","MI","MI","G/ADP/N/53/CAN",10,10,1,9,1,1,6.745102129,1.128093344,78.20599319,50.4014939,1,20875.24831,24405.87657,6.31e+11,1.47e+12,40.06896331,26.4677143,2.576269825,2.797470926,"10/19/98",1998-10-19,1998-10-19,1251,1810,1999-01-18,6.74e+11,1.46e+12,41.98633521,26.35445218,80.40295655,50.57611726,22109.60399,24075.01701,2.483472464,2.64938617,"Canada ",1995-01-01,"France ",1995-01-01,1,1,"France",1948-01-01,"Canada",1948-01-01,1,1,9,9,10,10,1,1,NA,NA,NA,NA,NA,NA,NA,NA,NA,1999,0,NA,NA,0
"1651",NA,"CAN-AD-246",20,"1999",220,1998,220,20,"Q4_2012","Canada","CAN-AD-246","France","FRA","Hot-Rolled Carbon and Alloy Steel Sheet","12/3/98","3/3/99","1/18/99","A","A","3/3/99","AVD","6/1/99","7/2/99","A","A","7/2/99","AVD","6/30/04","2004","AVD","MI","MI","G/ADP/N/59/CAN",10,10,1,9,1,1,6.745102129,1.128093344,78.20599319,50.4014939,1,20875.24831,24405.87657,6.31e+11,1.47e+12,40.06896331,26.4677143,2.576269825,2.797470926,"12/3/98",1998-12-03,1998-12-03,1296,1855,1999-03-03,6.74e+11,1.46e+12,41.98633521,26.35445218,80.40295655,50.57611726,22109.60399,24075.01701,2.483472464,2.64938617,"Canada ",1995-01-01,"France ",1995-01-01,1,1,"France",1948-01-01,"Canada",1948-01-01,1,1,9,9,10,10,1,1,NA,NA,NA,NA,NA,NA,NA,NA,NA,1999,0,NA,NA,0
"1652",NA,"CAN-AD-247",20,"1999",360,1998,360,20,"Q4_2012","Canada","CAN-AD-246","Romania","ROU","Hot-Rolled Carbon and Alloy Steel Sheet","12/3/98","3/3/99","1/18/99","A","A","3/3/99","AVD","6/1/99","7/2/99","A","A","7/2/99","AVD","6/30/04","2004","AVD","MI","MI","G/ADP/N/59/CAN",10,10,1,8,1,1,6.745102129,3.909681398,78.20599319,53.27005779,0,20875.24831,1871.18898,6.31e+11,42115494069,40.06896331,22.62164566,2.576269825,16.21875496,"12/3/98",1998-12-03,1998-12-03,232,1855,1999-03-03,6.74e+11,35592337083,41.98633521,28.01800219,80.40295655,60.86839403,22109.60399,1583.849846,2.483472464,15.15275142,"Canada ",1995-01-01,"Romania ",1995-01-01,1,1,"Romania",1971-11-14,"Canada",1948-01-01,1,1,8,8,10,10,1,1,NA,NA,NA,NA,NA,NA,NA,NA,NA,1999,0,NA,NA,0
"1654",NA,"CAN-AD-249",20,"1999",317,1998,317,20,"Q4_2012","Canada","CAN-AD-246","Slovakia","SVK","Hot-Rolled Carbon and Alloy Steel Sheet","12/3/98","3/3/99","1/18/99","A","A","3/3/99","AVD","6/1/99","7/2/99","A","A","7/2/99","AVD","6/30/04","2004","AVD","MI","MI","G/ADP/N/59/CAN",10,10,1,9,1,1,6.745102129,2.319987046,78.20599319,129.1833372,0,20875.24831,5431.44324,6.31e+11,29278281687,40.06896331,59.16482194,2.576269825,5.373365074,"12/3/98",1998-12-03,1998-12-03,34,1855,1999-03-03,6.74e+11,29947934157,41.98633521,61.16324976,80.40295655,126.8180934,22109.60399,5550.004292,2.483472464,4.743961212,"Canada ",1995-01-01,"Slovakia",1995-01-01,1,1,"Slovakia",1993-04-15,"Canada",1948-01-01,1,1,9,9,10,10,1,1,NA,NA,NA,NA,NA,NA,NA,NA,NA,1999,0,NA,NA,0
"1656",NA,"CAN-AD-250",20,"1999",732,1998,732,20,"Q4_2012","Canada","CAN-AD-250","Korea","KOR","Stainless Steel Round Bar","12/3/98","2/18/99","MI","A","MI","2/18/99","AVD","5/19/99","6/18/99","A","A","6/18/99","AVD","1/18/05","2005","AVD","MI","MI","G/ADP/N/53/CAN",10,10,1,8,1,1,6.745102129,1.10598414,78.20599319,72.9054547,1,20875.24831,8133.731245,6.31e+11,3.76e+11,40.06896331,42.35677439,2.576269825,4.636583786,"12/3/98",1998-12-03,1998-12-03,281,1855,1999-02-18,6.74e+11,4.86e+11,41.98633521,35.77703363,80.40295655,65.43023242,22109.60399,10432.2108,2.483472464,4.75889537,"Canada ",1995-01-01,"South Korea",1995-01-01,1,1,"South Korea",1967-04-14,"Canada",1948-01-01,1,1,8,8,10,10,1,1,NA,NA,NA,NA,NA,NA,NA,NA,NA,1999,0,NA,NA,0
"1657",NA,"CAN-AD-251",20,"1999",160,1999,160,20,"Q4_2012","Canada","CAN-AD-251","Argentina","ARG","Cold-Rolled Steel Sheet","1/29/99","4/29/99","MI","A","MI","4/29/99","AVD","7/28/99","8/27/99","A","N",".",".",".",".",".",".",".",".",10,10,1,8,1,1,6.746408904,2.100327586,80.40295655,17.65178455,1,22109.60399,9405.790356,6.74e+11,3.43e+11,41.98633521,8.112502471,2.483472464,4.104074469,"1/29/99",1999-01-29,1999-01-29,3857,1912,1999-04-29,6.74e+11,3.43e+11,41.98633521,8.112502471,80.40295655,17.65178455,22109.60399,9405.790356,2.483472464,4.104074469,"Canada ",1995-01-01,"Argentina ",1995-01-01,1,1,"Argentina",1967-10-11,"Canada",1948-01-01,1,1,8,8,10,10,1,1,NA,NA,NA,NA,NA,NA,NA,NA,NA,NA,0,NA,NA,0
"1658",NA,"CAN-AD-252",20,"1999",211,1999,211,20,"Q4_2012","Canada","CAN-AD-251","Belgium","BEL","Cold-Rolled Steel Sheet","1/29/99","4/29/99","MI","A","MI","4/29/99","AVD","7/28/99","8/27/99","A","A","8/27/99","AVD","9/10/04","2004","AVD","MI","MI","G/ADP/N/59/CAN",10,10,1,10,1,1,6.746408904,1.374115569,80.40295655,135.7531282,1,22109.60399,24886.86566,6.74e+11,2.55e+11,41.98633521,69.95776069,2.483472464,1.215844041,"1/29/99",1999-01-29,1999-01-29,2519,1912,1999-04-29,6.74e+11,2.55e+11,41.98633521,69.95776069,80.40295655,135.7531282,22109.60399,24886.86566,2.483472464,1.215844041,"Canada ",1995-01-01,"Belgium ",1995-01-01,1,1,"Belgium",1948-01-01,"Canada",1948-01-01,1,1,10,10,10,10,1,1,NA,NA,NA,NA,NA,NA,NA,NA,NA,1999,0,NA,NA,0
"1659",NA,"CAN-AD-253",20,"1999",920,1999,920,20,"Q4_2012","Canada","CAN-AD-251","New Zealand","NZL","Cold-Rolled Steel Sheet","1/29/99","4/29/99","MI","A","MI","4/29/99","AVD","7/28/99","8/27/99","A","N",".",".",".",".",".",".",".",".",10,10,1,10,1,1,6.746408904,13.13822464,80.40295655,62.02306931,0,22109.60399,15169.04084,6.74e+11,58174788520,41.98633521,31.26131832,2.483472464,6.818067382,"1/29/99",1999-01-29,1999-01-29,417,1912,1999-04-29,6.74e+11,58174788520,41.98633521,31.26131832,80.40295655,62.02306931,22109.60399,15169.04084,2.483472464,6.818067382,"Canada ",1995-01-01,"New Zealand",1995-01-01,1,1,"New Zealand",1948-07-30,"Canada",1948-01-01,1,1,10,10,10,10,1,1,NA,NA,NA,NA,NA,NA,NA,NA,NA,NA,0,NA,NA,0
"1661",NA,"CAN-AD-255",20,"1999",317,1999,317,20,"Q4_2012","Canada","CAN-AD-251","Slovakia","SVK","Cold-Rolled Steel Sheet","1/29/99","4/29/99","MI","A","MI","4/29/99","AVD","7/28/99","8/27/99","A","A","8/27/99","AVD","9/10/04","2004","AVD","MI","MI","G/ADP/N/59/CAN",10,10,1,9,1,1,6.746408904,2.482733452,80.40295655,126.8180934,0,22109.60399,5550.004292,6.74e+11,29947934157,41.98633521,61.16324976,2.483472464,4.743961212,"1/29/99",1999-01-29,1999-01-29,91,1912,1999-04-29,6.74e+11,29947934157,41.98633521,61.16324976,80.40295655,126.8180934,22109.60399,5550.004292,2.483472464,4.743961212,"Canada ",1995-01-01,"Slovakia",1995-01-01,1,1,"Slovakia",1993-04-15,"Canada",1948-01-01,1,1,9,9,10,10,1,1,NA,NA,NA,NA,NA,NA,NA,NA,NA,1999,0,NA,NA,0
"1662",NA,"CAN-AD-256",20,"1999",230,1999,230,20,"Q4_2012","Canada","CAN-AD-251","Spain","ESP","Cold-Rolled Steel Sheet","1/29/99","4/29/99","MI","A","MI","4/29/99","AVD","7/28/99","8/27/99","A","N",".",".",".",".",".",".",".",".",10,10,1,10,1,1,6.746408904,1.224735415,80.40295655,55.21993852,1,22109.60399,15468.04987,6.74e+11,6.18e+11,41.98633521,26.68399861,2.483472464,4.291581853,"1/29/99",1999-01-29,1999-01-29,999,1912,1999-04-29,6.74e+11,6.18e+11,41.98633521,26.68399861,80.40295655,55.21993852,22109.60399,15468.04987,2.483472464,4.291581853,"Canada ",1995-01-01,"Spain ",1995-01-01,1,1,"Spain",1963-08-29,"Canada",1948-01-01,1,1,10,10,10,10,1,1,NA,NA,NA,NA,NA,NA,NA,NA,NA,NA,0,NA,NA,0
"1663",NA,"CAN-AD-257",20,"1999",640,1999,640,20,"Q4_2012","Canada","CAN-AD-251","Turkey","TUR","Cold-Rolled Steel Sheet","1/29/99","4/29/99","MI","A","MI","4/29/99","AVD","7/28/99","8/27/99","A","A","8/27/99","AVD","9/10/04","2004","AVD","MI","MI","G/ADP/N/59/CAN",10,10,1,7,1,1,6.746408904,1.34201247,80.40295655,38.72587738,1,22109.60399,4012.472793,6.74e+11,2.5e+11,41.98633521,19.43988625,2.483472464,11.53718485,"1/29/99",1999-01-29,1999-01-29,18,1912,1999-04-29,6.74e+11,2.5e+11,41.98633521,19.43988625,80.40295655,38.72587738,22109.60399,4012.472793,2.483472464,11.53718485,"Canada ",1995-01-01,"Turkey ",1995-03-26,1,1,"Turkey",1951-10-17,"Canada",1948-01-01,1,1,7,8,10,10,1,1,NA,NA,NA,NA,NA,NA,NA,NA,NA,1999,0,NA,NA,0
"1664",NA,"CAN-AD-258",20,"1999",40,1999,40,20,"Q4_2012","Canada","CAN-AD-258","Cuba","CUB","Concrete Reinforcing Steel Bars","6/16/99","9/14/99","MI","A","MI","9/14/99","AVD","12/13/99","1/12/00","A","A","1/12/00","AVD","1/11/05","2005","AVD","MI","MI","G/ADP/N/65/CAN",10,10,1,-7,0,1,6.746408904,0.324467614,80.40295655,31.86816286,0,22109.60399,2555.068738,6.74e+11,28365300000,41.98633521,14.53712811,2.483472464,8.001776085,"6/16/99",1999-06-16,1999-06-16,14775,2050,1999-09-14,6.74e+11,28365300000,41.98633521,14.53712811,80.40295655,31.86816286,22109.60399,2555.068738,2.483472464,8.001776085,"Canada ",1995-01-01,"Cuba ",1995-04-20,1,1,"Cuba",1948-01-01,"Canada",1948-01-01,1,1,-7,0,10,10,1,0,NA,NA,NA,NA,NA,NA,NA,NA,NA,2000,0,NA,NA,0
"1665",NA,"CAN-AD-259",20,"1999",732,1999,732,20,"Q4_2012","Canada","CAN-AD-258","Korea","KOR","Concrete Reinforcing Steel Bars","6/16/99","9/14/99","MI","A","MI","9/14/99","AVD","12/13/99","1/12/00","A","A","1/12/00","AVD","1/11/05","2005","AVD","MI","MI","G/ADP/N/65/CAN",10,10,1,8,1,1,6.746408904,1.002573,80.40295655,65.43023242,1,22109.60399,10432.2108,6.74e+11,4.86e+11,41.98633521,35.77703363,2.483472464,4.75889537,"6/16/99",1999-06-16,1999-06-16,476,2050,1999-09-14,6.74e+11,4.86e+11,41.98633521,35.77703363,80.40295655,65.43023242,22109.60399,10432.2108,2.483472464,4.75889537,"Canada ",1995-01-01,"South Korea",1995-01-01,1,1,"South Korea",1967-04-14,"Canada",1948-01-01,1,1,8,8,10,10,1,1,NA,NA,NA,NA,NA,NA,NA,NA,NA,2000,0,NA,NA,0
"1667",NA,"CAN-AD-260",20,"1999",640,1999,640,20,"Q4_2012","Canada","CAN-AD-258","Turkey","TUR","Concrete Reinforcing Steel Bars","6/16/99","9/14/99","MI","A","MI","9/14/99","AVD","12/13/99","1/12/00","A","A","1/12/00","AVD","1/11/05","2005","AVD","MI","MI","G/ADP/N/65/CAN",10,10,1,7,1,1,6.746408904,1.34201247,80.40295655,38.72587738,1,22109.60399,4012.472793,6.74e+11,2.5e+11,41.98633521,19.43988625,2.483472464,11.53718485,"6/16/99",1999-06-16,1999-06-16,156,2050,1999-09-14,6.74e+11,2.5e+11,41.98633521,19.43988625,80.40295655,38.72587738,22109.60399,4012.472793,2.483472464,11.53718485,"Canada ",1995-01-01,"Turkey ",1995-03-26,1,1,"Turkey",1951-10-17,"Canada",1948-01-01,1,1,7,8,10,10,1,1,NA,NA,NA,NA,NA,NA,NA,NA,NA,2000,0,NA,NA,0
"1668",NA,"CAN-AD-261",20,"1999",2,1999,2,20,"Q4_2012","Canada","CAN-AD-261","USA","USA","Iodinated Radiographic Contrast Media","8/20/99","12/31/99","10/18/99","A","A","12/31/99","AVD","3/30/00","5/1/00","A","A","5/1/00","AVD","7/21/04","2004","AVD","MI","MI","G/ADP/N/65/CAN",10,10,1,10,1,1,6.746408904,2.077063761,80.40295655,23.17266209,1,22109.60399,34639.11984,6.74e+11,9.67e+12,41.98633521,10.23412686,2.483472464,1.219934045,"8/20/99",1999-08-20,1999-08-20,2403,2115,1999-12-31,6.74e+11,9.67e+12,41.98633521,10.23412686,80.40295655,23.17266209,22109.60399,34639.11984,2.483472464,1.219934045,"Canada ",1995-01-01,"United States of America",1995-01-01,1,1,"United States of America",1948-01-01,"Canada",1948-01-01,1,1,10,10,10,10,1,1,NA,NA,NA,NA,NA,NA,NA,NA,NA,2000,0,NA,NA,0
"1669",NA,"CAN-AD-262",20,"2000",140,1999,140,20,"Q4_2012","Canada","CAN-AD-262","Brazil","BRA","Hot-Rolled Carbon Steel Plate","10/15/99","2/28/00","12/14/99","A","A","2/28/00","AVD","5/29/00","6/27/00","A","A","6/27/00","AVD","6/27/05","2005","AVD","MI","MI","G/ADP/N/65/CAN",10,10,1,8,1,1,6.746408904,4.506917669,80.40295655,20.22715514,1,22109.60399,3411.865896,6.74e+11,5.87e+11,41.98633521,9.411088649,2.483472464,5.473261496,"10/15/99",1999-10-15,1999-10-15,1748,2171,2000-02-28,7.39e+11,6.45e+11,44.40722077,9.978193817,83.17567654,21.71995842,24031.9512,3694.462668,2.276259338,5.602902758,"Canada ",1995-01-01,"Brazil ",1995-01-01,1,1,"Brazil",1948-07-30,"Canada",1948-01-01,1,1,8,8,10,10,1,1,NA,NA,NA,NA,NA,NA,NA,NA,NA,2000,0,NA,NA,0
"1670",NA,"CAN-AD-263",20,"2000",375,1999,375,20,"Q4_2012","Canada","CAN-AD-262","Finland","FIN","Hot-Rolled Carbon Steel Plate","10/15/99","2/28/00","12/14/99","A","A","2/28/00","AVD","5/29/00","6/27/00","A","A","6/27/00","AVD","6/27/05","2005","AVD","MI","MI","G/ADP/N/65/CAN",10,10,1,10,1,1,6.746408904,6.532611733,80.40295655,68.52461965,0,22109.60399,25229.59582,6.74e+11,1.3e+11,41.98633521,38.83143532,2.483472464,3.47192699,"10/15/99",1999-10-15,1999-10-15,2054,2171,2000-02-28,7.39e+11,1.22e+11,44.40722077,43.57653466,83.17567654,78.0135406,24031.9512,23529.53846,2.276259338,3.497147224,"Canada ",1995-01-01,"Finland ",1995-01-01,1,1,"Finland",1950-05-25,"Canada",1948-01-01,1,1,10,10,10,10,1,1,NA,NA,NA,NA,NA,NA,NA,NA,NA,2000,0,NA,NA,0
"1671",NA,"CAN-AD-264",20,"2000",750,1999,750,20,"Q4_2012","Canada","CAN-AD-262","India","IND","Hot-Rolled Carbon Steel Plate","10/15/99","2/28/00","12/14/99","A","A","2/28/00","AVD","5/29/00","6/27/00","A","A","6/27/00","AVD","6/27/05","2005","AVD","MI","MI","G/ADP/N/65/CAN",10,10,1,9,1,1,6.746408904,1.418164643,80.40295655,24.38790891,1,22109.60399,455.4735407,6.74e+11,4.67e+11,41.98633521,11.25469183,2.483472464,24.50227807,"10/15/99",1999-10-15,1999-10-15,575,2171,2000-02-28,7.39e+11,4.77e+11,44.40722077,12.77323297,83.17567654,26.43729384,24031.9512,457.2835418,2.276259338,23.02185278,"Canada ",1995-01-01,"India ",1995-01-01,1,1,"India",1948-07-08,"Canada",1948-01-01,1,1,9,9,10,10,1,1,NA,NA,NA,NA,NA,NA,NA,NA,NA,2000,0,NA,NA,0
"1672",NA,"CAN-AD-265",20,"2000",850,1999,850,20,"Q4_2012","Canada","CAN-AD-262","Indonesia","IDN","Hot-Rolled Carbon Steel Plate","10/15/99","2/28/00","12/14/99","A","A","2/28/00","AVD","5/29/00","6/27/00","A","A","6/27/00","AVD","6/27/05","2005","AVD","MI","MI","G/ADP/N/65/CAN",10,10,1,6,1,1,6.746408904,3.765437622,80.40295655,62.94391295,1,22109.60399,679.7936722,6.74e+11,1.4e+11,41.98633521,35.5141287,2.483472464,19.61266996,"10/15/99",1999-10-15,1999-10-15,512,2171,2000-02-28,7.39e+11,1.65e+11,44.40722077,40.97730855,83.17567654,71.43687599,24031.9512,789.8058801,2.276259338,15.60197123,"Canada ",1995-01-01,"Indonesia ",1995-01-01,1,1,"Indonesia",1950-02-24,"Canada",1948-01-01,1,1,6,7,10,10,1,1,NA,NA,NA,NA,NA,NA,NA,NA,NA,2000,0,NA,NA,0
"1673",NA,"CAN-AD-266",20,"2000",800,1999,800,20,"Q4_2012","Canada","CAN-AD-262","Thailand","THA","Hot-Rolled Carbon Steel Plate","10/15/99","2/28/00","12/14/99","A","A","2/28/00","AVD","5/29/00","6/27/00","A","A","6/27/00","AVD","6/27/05","2005","AVD","MI","MI","G/ADP/N/65/CAN",10,10,1,9,1,1,6.746408904,3.023915411,80.40295655,104.0235932,0,22109.60399,1989.994923,6.74e+11,1.23e+11,41.98633521,58.29765213,2.483472464,9.391839512,"10/15/99",1999-10-15,1999-10-15,705,2171,2000-02-28,7.39e+11,1.23e+11,44.40722077,66.77764842,83.17567654,124.9223043,24031.9512,1968.536991,2.276259338,9.023141829,"Canada ",1995-01-01,"Thailand ",1995-01-01,1,1,"Thailand",1982-11-20,"Canada",1948-01-01,1,1,9,9,10,10,1,1,NA,NA,NA,NA,NA,NA,NA,NA,NA,2000,0,NA,NA,0
"1675",NA,"CAN-AD-268",20,"2000",2,1999,2,20,"Q4_2012","Canada","CAN-AD-268","USA","USA","Refrigerators Dishwashers Dryers","11/30/99","4/3/00","1/24/00","A","A","4/3/00","AVD","6/30/00","8/1/00","A","A","8/1/00","AVD","7/29/05","2005","AVD","9.4","15.1","G/ADP/N/72/CAN",10,10,1,10,1,1,6.746408904,2.077063761,80.40295655,23.17266209,1,22109.60399,34639.11984,6.74e+11,9.67e+12,41.98633521,10.23412686,2.483472464,1.219934045,"11/30/99",1999-11-30,1999-11-30,2505,2217,2000-04-03,7.39e+11,1.03e+13,44.40722077,10.63490675,83.17567654,24.96379875,24031.9512,36467.29543,2.276259338,1.190978876,"Canada ",1995-01-01,"United States of America",1995-01-01,1,1,"United States of America",1948-01-01,"Canada",1948-01-01,1,1,10,10,10,10,1,1,NA,NA,NA,NA,NA,NA,NA,NA,NA,2000,0,NA,NA,0
"1676",NA,"CAN-AD-269",20,"2000",2,2000,2,20,"Q4_2012","Canada","CAN-AD-269","USA","USA","Bingo Paper","3/20/00","7/5/00","MI","A","MI","7/5/00","AVD",".",".","OTH",".","9/27/00","PU","6/20/03","2003","PU","MI","MI","G/ADP/N/72/CAN",10,10,1,10,1,1,6.209745027,2.295750911,83.17567654,24.96379875,1,24031.9512,36467.29543,7.39e+11,1.03e+13,44.40722077,10.63490675,2.276259338,1.190978876,"3/20/00",2000-03-20,2000-03-20,2616,2328,2000-07-05,7.39e+11,1.03e+13,44.40722077,10.63490675,83.17567654,24.96379875,24031.9512,36467.29543,2.276259338,1.190978876,"Canada ",1995-01-01,"United States of America",1995-01-01,1,1,"United States of America",1948-01-01,"Canada",1948-01-01,1,1,10,10,10,10,1,1,NA,NA,NA,NA,NA,NA,NA,NA,NA,2000,0,NA,NA,0
"1678",NA,"CAN-AD-270",20,"2000",140,2000,140,20,"Q4_2012","Canada","CAN-AD-270","Brazil","BRA","Stainless Steel Round Bar","3/31/00","6/29/00","MI","A","MI","6/29/00","AVD","9/27/00","10/27/00","A","A","10/27/00","AVD","1/18/05","2005","AVD","37.3","37.3","G/ADP/N/72/CAN",10,10,1,8,1,1,6.209745027,4.757257524,83.17567654,21.71995842,1,24031.9512,3694.462668,7.39e+11,6.45e+11,44.40722077,9.978193817,2.276259338,5.602902758,"3/31/00",2000-03-31,2000-03-31,1916,2339,2000-06-29,7.39e+11,6.45e+11,44.40722077,9.978193817,83.17567654,21.71995842,24031.9512,3694.462668,2.276259338,5.602902758,"Canada ",1995-01-01,"Brazil ",1995-01-01,1,1,"Brazil",1948-07-30,"Canada",1948-01-01,1,1,8,8,10,10,1,1,NA,NA,NA,NA,NA,NA,NA,NA,NA,2000,0,NA,NA,0
"1680",NA,"CAN-AD-272",20,"2000",2,2000,2,20,"Q4_2012","Canada","CAN-AD-272","USA","USA","Grain Corn","8/9/00","11/7/00","10/10/00","A","A","11/7/00","SD","2/5/01","3/7/01","A","N",".",".",".",".",".",".",".",".",10,10,1,10,1,1,6.209745027,2.295750911,83.17567654,24.96379875,1,24031.9512,36467.29543,7.39e+11,1.03e+13,44.40722077,10.63490675,2.276259338,1.190978876,"8/9/00",2000-08-09,2000-08-09,2758,2470,2000-11-07,7.39e+11,1.03e+13,44.40722077,10.63490675,83.17567654,24.96379875,24031.9512,36467.29543,2.276259338,1.190978876,"Canada ",1995-01-01,"United States of America",1995-01-01,1,1,"United States of America",1948-01-01,"Canada",1948-01-01,1,1,10,10,10,10,1,1,NA,NA,NA,NA,NA,NA,NA,NA,NA,NA,0,NA,NA,0
"1683",NA,"CAN-AD-275",20,"2001",850,2000,850,20,"Q4_2012","Canada","CAN-AD-275","Indonesia","IDN","Concrete Reinforcing Steel Bars","11/3/00","2/1/01","1/2/01","A","A","2/1/01","AVD","5/1/01","6/1/01","A","A","6/1/01","AVD","5/31/06","2006","AVD","MI","MI","G/ADP/N/78/CAN",10,10,1,6,1,1,6.209745027,3.613756891,83.17567654,71.43687599,1,24031.9512,789.8058801,7.39e+11,1.65e+11,44.40722077,40.97730855,2.276259338,15.60197123,"11/3/00",2000-11-03,2000-11-03,380,2556,2001-02-01,7.33e+11,1.6e+11,42.24634131,39.03213345,78.79827146,69.7932057,23573.75007,756.931013,2.237988252,15.29026521,"Canada ",1995-01-01,"Indonesia ",1995-01-01,1,1,"Indonesia",1950-02-24,"Canada",1948-01-01,1,1,6,7,10,10,1,1,NA,NA,NA,NA,NA,NA,NA,NA,NA,2001,0,NA,NA,0
"1684",NA,"CAN-AD-276",20,"2001",740,2000,740,20,"Q4_2012","Canada","CAN-AD-275","Japan","JPN","Concrete Reinforcing Steel Bars","11/3/00","2/1/01","1/2/01","A","A","2/1/01","AVD","5/1/01","6/1/01","A","A","6/1/01","AVD","5/31/06","2006","AVD","MI","MI","G/ADP/N/78/CAN",10,10,1,10,1,1,6.209745027,0.464845251,83.17567654,20.3060448,1,24031.9512,37291.70616,7.39e+11,4.73e+12,44.40722077,10.8773781,2.276259338,1.586389312,"11/3/00",2000-11-03,2000-11-03,212,2556,2001-02-01,7.33e+11,4.16e+12,42.24634131,10.4488202,78.79827146,20.2578929,23573.75007,32716.41867,2.237988252,1.44258103,"Canada ",1995-01-01,"Japan ",1995-01-01,1,1,"Japan",1955-09-10,"Canada",1948-01-01,1,1,10,10,10,10,1,1,NA,NA,NA,NA,NA,NA,NA,NA,NA,2001,0,NA,NA,0
"1685",NA,"CAN-AD-277",20,"2001",367,2000,367,20,"Q4_2012","Canada","CAN-AD-275","Latvia","LVA","Concrete Reinforcing Steel Bars","11/3/00","2/1/01","1/2/01","A","A","2/1/01","AVD","5/1/01","6/1/01","A","A","6/1/01","AVD","5/31/06","2006","AVD","MI","MI","G/ADP/N/78/CAN",10,10,1,8,1,1,6.209745027,29.47080305,83.17567654,90.31615179,0,24031.9512,3308.512355,7.39e+11,7833068425,44.40722077,41.64179343,2.276259338,4.604133844,"11/3/00",2000-11-03,2000-11-03,182,2556,2001-02-01,7.33e+11,8313047744,42.24634131,41.57739299,78.79827146,92.68561261,23573.75007,3556.88621,2.237988252,4.504274595,"Canada ",1995-01-01,"Latvia ",1999-02-10,1,1,NA,NA,"Canada",1948-01-01,1,NA,8,8,10,10,1,1,NA,NA,NA,NA,NA,NA,NA,NA,NA,2001,0,NA,NA,0
"1687",NA,"CAN-AD-279",20,"2001",290,2000,290,20,"Q4_2012","Canada","CAN-AD-275","Poland","POL","Concrete Reinforcing Steel Bars","11/3/00","2/1/01","1/2/01","A","A","2/1/01","AVD","5/1/01","6/1/01","A","A","6/1/01","AVD","5/31/06","2006","AVD","MI","MI","G/ADP/N/78/CAN",10,10,1,9,1,1,6.209745027,1.785732113,83.17567654,60.67078823,1,24031.9512,4476.797076,7.39e+11,1.71e+11,44.40722077,27.1243911,2.276259338,4.957839039,"11/3/00",2000-11-03,2000-11-03,1777,2556,2001-02-01,7.33e+11,1.9e+11,42.24634131,27.05602106,78.79827146,57.77678292,23573.75007,4978.573826,2.237988252,5.100143113,"Canada ",1995-01-01,"Poland ",1995-07-01,1,1,"Poland",1967-10-18,"Canada",1948-01-01,1,1,9,9,10,10,1,1,NA,NA,NA,NA,NA,NA,NA,NA,NA,2001,0,NA,NA,0
"1693",NA,"CAN-AD-284",20,"2001",750,2000,750,20,"Q4_2012","Canada","CAN-AD-283","India","IND","Corrosion Resistant Steel Sheet","12/4/00","3/5/01","2/2/01","A","A","3/5/01","AVD","6/4/01","7/3/01","A","N",".",".",".",".",".",".",".",".",10,10,1,9,1,1,6.209745027,1.258907331,83.17567654,26.43729384,1,24031.9512,457.2835418,7.39e+11,4.77e+11,44.40722077,12.77323297,2.276259338,23.02185278,"12/4/00",2000-12-04,2000-12-04,991,2587,2001-03-05,7.33e+11,4.94e+11,42.24634131,12.34193985,78.79827146,25.54526907,23573.75007,466.2141765,2.237988252,22.92230619,"Canada ",1995-01-01,"India ",1995-01-01,1,1,"India",1948-07-08,"Canada",1948-01-01,1,1,9,9,10,10,1,1,NA,NA,NA,NA,NA,NA,NA,NA,NA,NA,0,NA,NA,0
"1694",NA,"CAN-AD-285",20,"2001",820,2000,820,20,"Q4_2012","Canada","CAN-AD-283","Malaysia","MYS","Corrosion Resistant Steel Sheet","12/4/00","3/5/01","2/2/01","A","A","3/5/01","AVD","6/4/01","7/3/01","A","N",".",".",".",".",".",".",".",".",10,10,1,3,0,1,6.209745027,2.61031243,83.17567654,220.4074074,0,24031.9512,4004.545955,7.39e+11,93789473684,44.40722077,119.8100449,2.276259338,8.599046016,"12/4/00",2000-12-04,2000-12-04,7081,2587,2001-03-05,7.33e+11,92783947368,42.24634131,110.4024914,78.79827146,203.364636,23573.75007,3877.996652,2.237988252,8.010970591,"Canada ",1995-01-01,"Malaysia ",1995-01-01,1,1,"Malaysia",1957-10-24,"Canada",1948-01-01,1,1,3,4,10,10,1,0,NA,NA,NA,NA,NA,NA,NA,NA,NA,NA,0,NA,NA,0
"1698",NA,"CAN-AD-289",20,"2001",560,2000,560,20,"Q4_2012","Canada","CAN-AD-283","South Africa","ZAF","Corrosion Resistant Steel Sheet","12/4/00","3/5/01","2/2/01","A","A","3/5/01","AVD","6/4/01","7/3/01","A","N",".",".",".",".",".",".",".",".",10,10,1,9,1,1,6.209745027,3.376975394,83.17567654,52.78632006,0,24031.9512,3019.946367,7.39e+11,1.33e+11,44.40722077,27.8709062,2.276259338,3.274923749,"12/4/00",2000-12-04,2000-12-04,537,2587,2001-03-05,7.33e+11,1.18e+11,42.24634131,30.12753668,78.79827146,56.20588719,23573.75007,2638.15805,2.237988252,3.510824368,"Canada ",1995-01-01,"South Africa",1995-01-01,1,1,"South Africa",1948-06-13,"Canada",1948-01-01,1,1,9,9,10,10,1,1,NA,NA,NA,NA,NA,NA,NA,NA,NA,NA,0,NA,NA,0
"1700",NA,"CAN-AD-290",20,"2001",140,2001,140,20,"Q4_2012","Canada","CAN-AD-290","Brazil","BRA","Hot-Rolled Carbon Steel Sheet","1/19/01","4/19/01","3/20/01","A","A","4/19/01","AVD","7/18/01","8/17/01","A","A","8/17/01","AVD","IF","IF","AVD","MI","MI","G/ADP/N/85/CAN",10,10,1,8,1,1,5.577059012,4.103701107,78.79827146,25.67834696,1,23573.75007,3128.144846,7.33e+11,5.54e+11,42.24634131,12.18144648,2.237988252,5.973379533,"1/19/01",2001-01-19,2001-01-19,2210,2633,2001-04-19,7.33e+11,5.54e+11,42.24634131,12.18144648,78.79827146,25.67834696,23573.75007,3128.144846,2.237988252,5.973379533,"Canada ",1995-01-01,"Brazil ",1995-01-01,1,1,"Brazil",1948-07-30,"Canada",1948-01-01,1,1,8,8,10,10,1,1,NA,NA,NA,NA,NA,NA,NA,NA,NA,2001,0,NA,NA,0
"1701",NA,"CAN-AD-291",20,"2001",355,2001,355,20,"Q4_2012","Canada","CAN-AD-290","Bulgaria","BGR","Hot-Rolled Carbon Steel Sheet","1/19/01","4/19/01","3/20/01","A","A","4/19/01","AVD","7/18/01","8/17/01","A","A","8/17/01","AVD","IF","IF","AVD","MI","MI","G/ADP/N/85/CAN",10,10,1,9,1,1,5.577059012,2.405408019,78.79827146,106.8660521,1,23573.75007,1729.191157,7.33e+11,13868600710,42.24634131,48.72180677,2.237988252,12.16000325,"1/19/01",2001-01-19,2001-01-19,1339,2633,2001-04-19,7.33e+11,13868600710,42.24634131,48.72180677,78.79827146,106.8660521,23573.75007,1729.191157,2.237988252,12.16000325,"Canada ",1995-01-01,"Bulgaria ",1996-12-01,1,1,NA,NA,"Canada",1948-01-01,1,NA,9,9,10,10,1,1,NA,NA,NA,NA,NA,NA,NA,NA,NA,2001,0,NA,NA,0
"1705",NA,"CAN-AD-295",20,"2001",750,2001,750,20,"Q4_2012","Canada","CAN-AD-290","India","IND","Hot-Rolled Carbon Steel Sheet","1/19/01","4/19/01","3/20/01","A","A","4/19/01","AVD","7/18/01","8/17/01","A","A","8/17/01","AVD","IF","IF","AVD","MI","MI","G/ADP/N/85/CAN",10,10,1,9,1,1,5.577059012,1.139473046,78.79827146,25.54526907,1,23573.75007,466.2141765,7.33e+11,4.94e+11,42.24634131,12.34193985,2.237988252,22.92230619,"1/19/01",2001-01-19,2001-01-19,1037,2633,2001-04-19,7.33e+11,4.94e+11,42.24634131,12.34193985,78.79827146,25.54526907,23573.75007,466.2141765,2.237988252,22.92230619,"Canada ",1995-01-01,"India ",1995-01-01,1,1,"India",1948-07-08,"Canada",1948-01-01,1,1,9,9,10,10,1,1,NA,NA,NA,NA,NA,NA,NA,NA,NA,2001,0,NA,NA,0
"1706",NA,"CAN-AD-296",20,"2001",732,2001,732,20,"Q4_2012","Canada","CAN-AD-290","Korea","KOR","Hot-Rolled Carbon Steel Sheet","1/19/01","4/19/01","3/20/01","A","A","4/19/01","AVD","7/18/01","8/17/01","A","N",".",".",".",".",".",".",".",".",10,10,1,8,1,1,5.577059012,0.95340758,78.79827146,63.91107188,1,23573.75007,11255.94789,7.33e+11,5.33e+11,42.24634131,32.73245013,2.237988252,4.126427146,"1/19/01",2001-01-19,2001-01-19,1059,2633,2001-04-19,7.33e+11,5.33e+11,42.24634131,32.73245013,78.79827146,63.91107188,23573.75007,11255.94789,2.237988252,4.126427146,"Canada ",1995-01-01,"South Korea",1995-01-01,1,1,"South Korea",1967-04-14,"Canada",1948-01-01,1,1,8,8,10,10,1,1,NA,NA,NA,NA,NA,NA,NA,NA,NA,NA,0,NA,NA,0
"1708",NA,"CAN-AD-298",20,"2001",920,2001,920,20,"Q4_2012","Canada","CAN-AD-290","New Zealand","NZL","Hot-Rolled Carbon Steel Sheet","1/19/01","4/19/01","3/20/01","A","A","4/19/01","AVD","7/18/01","8/17/01","A","N",".",".",".",".",".",".",".",".",10,10,1,10,1,1,5.577059012,12.60528649,78.79827146,67.96328431,0,23573.75007,13736.70673,7.33e+11,53305290474,42.24634131,35.80878947,2.237988252,8.669790579,"1/19/01",2001-01-19,2001-01-19,406,2633,2001-04-19,7.33e+11,53305290474,42.24634131,35.80878947,78.79827146,67.96328431,23573.75007,13736.70673,2.237988252,8.669790579,"Canada ",1995-01-01,"New Zealand",1995-01-01,1,1,"New Zealand",1948-07-30,"Canada",1948-01-01,1,1,10,10,10,10,1,1,NA,NA,NA,NA,NA,NA,NA,NA,NA,NA,0,NA,NA,0
"1712",NA,"CAN-AD-300",20,"2001",560,2001,560,20,"Q4_2012","Canada","CAN-AD-290","South Africa","ZAF","Hot-Rolled Carbon Steel Sheet","1/19/01","4/19/01","3/20/01","A","A","4/19/01","AVD","7/18/01","8/17/01","A","A","8/17/01","AVD","8/15/11","2011","AVD","MI","MI","G/ADP/N/85/CAN",10,10,1,9,1,1,5.577059012,2.627801883,78.79827146,56.20588719,0,23573.75007,2638.15805,7.33e+11,1.18e+11,42.24634131,30.12753668,2.237988252,3.510824368,"1/19/01",2001-01-19,2001-01-19,583,2633,2001-04-19,7.33e+11,1.18e+11,42.24634131,30.12753668,78.79827146,56.20588719,23573.75007,2638.15805,2.237988252,3.510824368,"Canada ",1995-01-01,"South Africa",1995-01-01,1,1,"South Africa",1948-06-13,"Canada",1948-01-01,1,1,9,9,10,10,1,1,NA,NA,NA,NA,NA,NA,NA,NA,NA,2001,0,NA,NA,0
"1714",NA,"CAN-AD-302",20,"2001",140,2001,140,20,"Q4_2012","Canada","CAN-AD-302","Brazil","BRA","Cold-Rolled Steel Sheet","3/12/01","6/11/01","5/11/01","A","A","6/11/01","AVD","9/10/01","10/9/01","A","N",".",".",".",".",".",".",".",".",10,10,1,8,1,1,5.577059012,4.103701107,78.79827146,25.67834696,1,23573.75007,3128.144846,7.33e+11,5.54e+11,42.24634131,12.18144648,2.237988252,5.973379533,"3/12/01",2001-03-12,2001-03-12,2262,2685,2001-06-11,7.33e+11,5.54e+11,42.24634131,12.18144648,78.79827146,25.67834696,23573.75007,3128.144846,2.237988252,5.973379533,"Canada ",1995-01-01,"Brazil ",1995-01-01,1,1,"Brazil",1948-07-30,"Canada",1948-01-01,1,1,8,8,10,10,1,1,NA,NA,NA,NA,NA,NA,NA,NA,NA,NA,0,NA,NA,0
"1717",NA,"CAN-AD-305",20,"2001",325,2001,325,20,"Q4_2012","Canada","CAN-AD-302","Italy","ITA","Cold-Rolled Steel Sheet","3/12/01","6/11/01","5/11/01","A","A","6/11/01","AVD","9/10/01",".","A","T",".",".",".",".",".",".",".",".",10,10,1,10,1,1,5.577059012,0.652361831,78.79827146,52.33283751,1,23573.75007,19723.04417,7.33e+11,1.12e+12,42.24634131,26.85797238,2.237988252,2.683528549,"3/12/01",2001-03-12,2001-03-12,320,2685,2001-06-11,7.33e+11,1.12e+12,42.24634131,26.85797238,78.79827146,52.33283751,23573.75007,19723.04417,2.237988252,2.683528549,"Canada ",1995-01-01,"Italy ",1995-01-01,1,1,"Italy",1950-05-30,"Canada",1948-01-01,1,1,10,10,10,10,1,1,NA,NA,NA,NA,NA,NA,NA,NA,NA,NA,0,NA,NA,0
"1718",NA,"CAN-AD-306",20,"2001",732,2001,732,20,"Q4_2012","Canada","CAN-AD-302","Korea","KOR","Cold-Rolled Steel Sheet","3/12/01","6/11/01","5/11/01","A","A","6/11/01","AVD","9/10/01","10/9/01","A","N",".",".",".",".",".",".",".",".",10,10,1,8,1,1,5.577059012,0.95340758,78.79827146,63.91107188,1,23573.75007,11255.94789,7.33e+11,5.33e+11,42.24634131,32.73245013,2.237988252,4.126427146,"3/12/01",2001-03-12,2001-03-12,1111,2685,2001-06-11,7.33e+11,5.33e+11,42.24634131,32.73245013,78.79827146,63.91107188,23573.75007,11255.94789,2.237988252,4.126427146,"Canada ",1995-01-01,"South Korea",1995-01-01,1,1,"South Korea",1967-04-14,"Canada",1948-01-01,1,1,8,8,10,10,1,1,NA,NA,NA,NA,NA,NA,NA,NA,NA,NA,0,NA,NA,0
"1719",NA,"CAN-AD-307",20,"2001",212,2001,212,20,"Q4_2012","Canada","CAN-AD-302","Luxembourg","LUX","Cold-Rolled Steel Sheet","3/12/01","6/11/01","5/11/01","A","A","6/11/01","AVD","9/10/01",".","A","T",".",".",".",".",".",".",".",".",10,10,1,10,1,1,5.577059012,0.474867565,78.79827146,275.6473195,0,23573.75007,45743.43018,7.33e+11,20196868009,42.24634131,146.6371289,2.237988252,0.673385724,"3/12/01",2001-03-12,2001-03-12,2243,2685,2001-06-11,7.33e+11,20196868009,42.24634131,146.6371289,78.79827146,275.6473195,23573.75007,45743.43018,2.237988252,0.673385724,"Canada ",1995-01-01,"Luxembourg ",1995-01-01,1,1,"Luxembourg",1948-01-01,"Canada",1948-01-01,1,1,10,10,10,10,1,1,NA,NA,NA,NA,NA,NA,NA,NA,NA,NA,0,NA,NA,0
"1721",NA,"CAN-AD-309",20,"2001",820,2001,820,20,"Q4_2012","Canada","CAN-AD-302","Malaysia","MYS","Cold-Rolled Steel Sheet","3/12/01","6/11/01","5/11/01","A","A","6/11/01","AVD","9/10/01",".","A","T",".",".",".",".",".",".",".",".",10,10,1,3,0,1,5.577059012,2.106201381,78.79827146,203.364636,0,23573.75007,3877.996652,7.33e+11,92783947368,42.24634131,110.4024914,2.237988252,8.010970591,"3/12/01",2001-03-12,2001-03-12,7179,2685,2001-06-11,7.33e+11,92783947368,42.24634131,110.4024914,78.79827146,203.364636,23573.75007,3877.996652,2.237988252,8.010970591,"Canada ",1995-01-01,"Malaysia ",1995-01-01,1,1,"Malaysia",1957-10-24,"Canada",1948-01-01,1,1,3,4,10,10,1,0,NA,NA,NA,NA,NA,NA,NA,NA,NA,NA,0,NA,NA,0
"1723",NA,"CAN-AD-310",20,"2001",560,2001,560,20,"Q4_2012","Canada","CAN-AD-302","South Africa","ZAF","Cold-Rolled Steel Sheet","3/12/01","6/11/01","5/11/01","A","A","6/11/01","AVD","9/10/01","10/9/01","A","N",".",".",".",".",".",".",".",".",10,10,1,9,1,1,5.577059012,2.627801883,78.79827146,56.20588719,0,23573.75007,2638.15805,7.33e+11,1.18e+11,42.24634131,30.12753668,2.237988252,3.510824368,"3/12/01",2001-03-12,2001-03-12,635,2685,2001-06-11,7.33e+11,1.18e+11,42.24634131,30.12753668,78.79827146,56.20588719,23573.75007,2638.15805,2.237988252,3.510824368,"Canada ",1995-01-01,"South Africa",1995-01-01,1,1,"South Africa",1948-06-13,"Canada",1948-01-01,1,1,9,9,10,10,1,1,NA,NA,NA,NA,NA,NA,NA,NA,NA,NA,0,NA,NA,0
"1725",NA,"CAN-AD-312",20,"2002",2,2001,2,20,"Q4_2012","Canada","CAN-AD-312","USA","USA","Fresh Tomatoes","11/9/01","3/25/02","1/8/02","A","A","3/25/02","AVD","6/24/02","6/26/02","A","N",".",".",".",".",".",".",".",".",10,10,1,10,1,1,5.577059012,2.306059661,78.79827146,22.8379434,1,23573.75007,37285.81592,7.33e+11,1.06e+13,42.24634131,9.68255014,2.237988252,1.181402837,"11/9/01",2001-11-09,2001-11-09,292,2927,2002-03-25,7.53e+11,1.1e+13,40.32268991,9.150106555,76.27804103,22.17081656,23995.01633,38175.37638,2.179335795,1.009241245,"Canada ",1995-01-01,"United States of America",1995-01-01,1,1,"United States of America",1948-01-01,"Canada",1948-01-01,1,1,10,10,10,10,1,1,NA,NA,NA,NA,NA,NA,NA,NA,NA,NA,0,NA,NA,0
"1726",NA,"CAN-AD-313",20,"2002",710,2001,710,20,"Q4_2012","Canada","CAN-AD-313","China","CHN","Automotive Laminated Windshields","12/18/01","5/2/02","2/15/02","A","A","5/2/02","AVD","7/31/02","8/30/02","A","N",".",".",".",".",".",".",".",".",10,10,1,-7,0,1,5.577059012,0.863739086,78.79827146,43.08019713,0,23573.75007,1041.6377,7.33e+11,1.32e+12,42.24634131,22.60010168,2.237988252,14.39172359,"12/18/01",2001-12-18,2001-12-18,1763,2966,2002-05-02,7.53e+11,1.45e+12,40.32268991,25.13437343,76.27804103,47.69731271,23995.01633,1135.447952,2.179335795,13.74274917,"Canada ",1995-01-01,"China ",2001-12-11,1,1,NA,NA,"Canada",1948-01-01,1,NA,-7,0,10,10,1,0,NA,NA,NA,NA,NA,NA,NA,NA,NA,NA,0,NA,NA,0
"1727",NA,"CAN-AD-314",20,"2002",991,2002,991,20,"Q4_2012","Canada","CAN-AD-314","Hong Kong","HKG","Waterproof Footwear and Footwear Bottoms","4/16/02","9/9/02","6/25/02","A","A","9/9/02","AVD","12/9/02",".","A","T",".",".",".",".",".",".",".",".",10,10,1,NA,0,1,5.507277165,0.379967403,76.27804103,286.5683733,0,23995.01633,24665.89,7.53e+11,1.66e+11,40.32268991,147.3627211,2.179335795,0.089792487,"4/16/02",2002-04-16,2002-04-16,NA,3085,2002-09-09,7.53e+11,1.66e+11,40.32268991,147.3627211,76.27804103,286.5683733,23995.01633,24665.89,2.179335795,0.089792487,"Canada ",1995-01-01,"Hong Kong",1995-01-01,1,1,"Hong Kong",1986-04-23,"Canada",1948-01-01,1,1,0,NA,10,10,1,0,NA,NA,NA,NA,NA,NA,NA,NA,NA,NA,0,NA,NA,0
"1729",NA,"CAN-AD-317",20,"2002",710,2002,710,20,"Q4_2012","Canada","CAN-AD-317","China","CHN","Xanthates","6/21/02","11/4/02","8/20/02","A","A","11/4/02","AVD","2/3/03","3/4/03","A","A","3/4/03","AVD","3/3/08","2008","AVD/PU","44.7","44.7","G/ADP/N/105/CAN",10,10,1,-7,0,1,5.507277165,0.780540991,76.27804103,47.69731271,0,23995.01633,1135.447952,7.53e+11,1.45e+12,40.32268991,25.13437343,2.179335795,13.74274917,"6/21/02",2002-06-21,2002-06-21,1948,3151,2002-11-04,7.53e+11,1.45e+12,40.32268991,25.13437343,76.27804103,47.69731271,23995.01633,1135.447952,2.179335795,13.74274917,"Canada ",1995-01-01,"China ",2001-12-11,1,1,NA,NA,"Canada",1948-01-01,1,NA,-7,0,10,10,1,0,NA,NA,NA,NA,NA,NA,NA,NA,NA,2003,0,NA,NA,0
"1730",NA,"CAN-AD-318",20,"2003",710,2002,710,20,"Q4_2012","Canada","CAN-AD-318","China","CHN","Carbon Steel Pipe Nipples","12/18/02","4/2/03","2/17/03","A","A","4/2/03","AVD","6/16/03","7/16/03","A","A","7/16/03","AVD","IF","IF","AVD/PU","4","158","G/ADP/N/112/CAN",10,10,1,-7,0,1,5.507277165,0.780540991,76.27804103,47.69731271,0,23995.01633,1135.447952,7.53e+11,1.45e+12,40.32268991,25.13437343,2.179335795,13.74274917,"12/18/02",2002-12-18,2002-12-18,2128,3331,2003-04-02,8.88e+11,1.64e+12,37.01987974,29.5575468,70.20764108,56.93216421,28026.00601,1273.640744,2.09984984,12.7973531,"Canada ",1995-01-01,"China ",2001-12-11,1,1,NA,NA,"Canada",1948-01-01,1,NA,-7,0,10,10,1,0,NA,NA,NA,NA,NA,NA,NA,NA,NA,2003,0,NA,NA,0
"1731",NA,"CAN-AD-319",20,"2003",710,2002,710,20,"Q4_2012","Canada","CAN-AD-318","China","CHN","Carbon Steel Threaded Couplings","12/18/02","4/2/03","2/17/03","A","A","4/2/03","AVD","6/16/03","7/16/03","A","A","7/16/03","AVD","IF","IF","AVD/PU","4","158","G/ADP/N/112/CAN",10,10,1,-7,0,1,5.507277165,0.780540991,76.27804103,47.69731271,0,23995.01633,1135.447952,7.53e+11,1.45e+12,40.32268991,25.13437343,2.179335795,13.74274917,"12/18/02",2002-12-18,2002-12-18,2128,3331,2003-04-02,8.88e+11,1.64e+12,37.01987974,29.5575468,70.20764108,56.93216421,28026.00601,1273.640744,2.09984984,12.7973531,"Canada ",1995-01-01,"China ",2001-12-11,1,1,NA,NA,"Canada",1948-01-01,1,NA,-7,0,10,10,1,0,NA,NA,NA,NA,NA,NA,NA,NA,NA,2003,0,NA,NA,0
"1733",NA,"CAN-AD-320",20,"2003",710,2002,710,20,"Q4_2012","Canada","CAN-AD-318","China","CHN","Carbon Steel Adaptor Fittings","12/18/02","4/2/03","2/17/03","A","A","4/2/03","AVD","6/16/03","7/16/03","A","A","7/16/03","AVD","IF","IF","AVD/PU","4","158","G/ADP/N/112/CAN",10,10,1,-7,0,1,5.507277165,0.780540991,76.27804103,47.69731271,0,23995.01633,1135.447952,7.53e+11,1.45e+12,40.32268991,25.13437343,2.179335795,13.74274917,"12/18/02",2002-12-18,2002-12-18,2128,3331,2003-04-02,8.88e+11,1.64e+12,37.01987974,29.5575468,70.20764108,56.93216421,28026.00601,1273.640744,2.09984984,12.7973531,"Canada ",1995-01-01,"China ",2001-12-11,1,1,NA,NA,"Canada",1948-01-01,1,NA,-7,0,10,10,1,0,NA,NA,NA,NA,NA,NA,NA,NA,NA,2003,0,NA,NA,0
"1734",NA,"CAN-AD-321",20,"2003",732,2003,732,20,"Q4_2012","Canada","CAN-AD-321","Korea","KOR","Steel Structural Tubing","5/21/03","8/19/03","7/21/03","A","A","8/19/03","AVD","11/17/03","12/23/03","A","A","12/23/03","AVD","IF","IF","AVD","89","89","G/ADP/N/112/CAN",10,10,1,8,1,1,5.099264634,0.85879417,70.20764108,63.39301239,1,28026.00601,14219.19359,8.88e+11,6.81e+11,37.01987974,32.7021783,2.09984984,3.514052875,"5/21/03",2003-05-21,2003-05-21,85,3485,2003-08-19,8.88e+11,6.81e+11,37.01987974,32.7021783,70.20764108,63.39301239,28026.00601,14219.19359,2.09984984,3.514052875,"Canada ",1995-01-01,"South Korea",1995-01-01,1,1,"South Korea",1967-04-14,"Canada",1948-01-01,1,1,8,8,10,10,1,1,NA,NA,NA,NA,NA,NA,NA,NA,NA,2003,0,NA,NA,0
"1735",NA,"CAN-AD-322",20,"2003",560,2003,560,20,"Q4_2012","Canada","CAN-AD-321","South Africa","ZAF","Steel Structural Tubing","5/21/03","8/19/03","7/21/03","A","A","8/19/03","AVD","11/17/03","12/23/03","A","A","12/23/03","AVD","IF","IF","AVD/PU","9.5","88.7","G/ADP/N/112/CAN",10,10,1,9,1,1,5.099264634,2.765288661,70.20764108,53.42241522,0,28026.00601,3624.694443,8.88e+11,1.68e+11,37.01987974,27.88013237,2.09984984,3.431935247,"5/21/03",2003-05-21,2003-05-21,1435,3485,2003-08-19,8.88e+11,1.68e+11,37.01987974,27.88013237,70.20764108,53.42241522,28026.00601,3624.694443,2.09984984,3.431935247,"Canada ",1995-01-01,"South Africa",1995-01-01,1,1,"South Africa",1948-06-13,"Canada",1948-01-01,1,1,9,9,10,10,1,1,NA,NA,NA,NA,NA,NA,NA,NA,NA,2003,0,NA,NA,0
"1736",NA,"CAN-AD-323",20,"2003",640,2003,640,20,"Q4_2012","Canada","CAN-AD-321","Turkey","TUR","Steel Structural Tubing","5/21/03","8/19/03","7/21/03","A","A","8/19/03","AVD","11/17/03","12/23/03","A","A","12/23/03","AVD","IF","IF","AVD/PU","0.9","43.3","G/ADP/N/112/CAN",10,10,1,7,1,1,5.099264634,0.801607839,70.20764108,47.03271799,1,28026.00601,4595.287775,8.88e+11,3.03e+11,37.01987974,22.99463309,2.09984984,11.39074262,"5/21/03",2003-05-21,2003-05-21,68,3485,2003-08-19,8.88e+11,3.03e+11,37.01987974,22.99463309,70.20764108,47.03271799,28026.00601,4595.287775,2.09984984,11.39074262,"Canada ",1995-01-01,"Turkey ",1995-03-26,1,1,"Turkey",1951-10-17,"Canada",1948-01-01,1,1,7,8,10,10,1,1,NA,NA,NA,NA,NA,NA,NA,NA,NA,2003,0,NA,NA,0
"1737",NA,"CAN-AD-324",20,"2003",355,2003,355,20,"Q4_2012","Canada","CAN-AD-324","Bulgaria","BGR","Hot-Rolled Carbon Steel Plate","6/13/03","9/11/03","8/12/03","A","A","9/11/03","AVD","12/9/03","1/9/04","A","A","1/9/04","AVD","8/16/06","2006","AVD","74.6","74.6","G/ADP/N/119/CAN",10,10,1,9,1,1,5.099264634,2.303968313,70.20764108,107.3846266,1,28026.00601,2641.787723,8.88e+11,20668176834,37.01987974,48.52706723,2.09984984,10.43817899,"6/13/03",2003-06-13,2003-06-13,689,3508,2003-09-11,8.88e+11,20668176834,37.01987974,48.52706723,70.20764108,107.3846266,28026.00601,2641.787723,2.09984984,10.43817899,"Canada ",1995-01-01,"Bulgaria ",1996-12-01,1,1,NA,NA,"Canada",1948-01-01,1,NA,9,9,10,10,1,1,NA,NA,NA,NA,NA,NA,NA,NA,NA,2004,0,NA,NA,0
"1739",NA,"CAN-AD-326",20,"2003",360,2003,360,20,"Q4_2012","Canada","CAN-AD-324","Romania","ROU","Hot-Rolled Carbon Steel Plate","6/13/03","9/11/03","8/12/03","A","A","9/11/03","AVD","12/9/03","1/9/04","A","A","1/9/04","AVD","IF","IF","AVD","39.3","74.6","G/ADP/N/119/CAN",10,10,1,8,1,1,5.099264634,3.142616384,70.20764108,77.02930087,0,28026.00601,2756.332583,8.88e+11,59466017706,37.01987974,34.77624202,2.09984984,13.00038886,"6/13/03",2003-06-13,2003-06-13,897,3508,2003-09-11,8.88e+11,59466017706,37.01987974,34.77624202,70.20764108,77.02930087,28026.00601,2756.332583,2.09984984,13.00038886,"Canada ",1995-01-01,"Romania ",1995-01-01,1,1,"Romania",1971-11-14,"Canada",1948-01-01,1,1,8,8,10,10,1,1,NA,NA,NA,NA,NA,NA,NA,NA,NA,2004,0,NA,NA,0
"1740",NA,"CAN-AD-327",20,"2004",710,2003,710,20,"Q4_2012","Canada","CAN-AD-327","China","CHN","Wood Venetian Blinds and Slats","11/21/03","2/19/04","1/20/04","A","A","2/19/04","AVD","5/17/04","6/18/04","A","P (JUST SLATS)","6/18/04","AVD","7/15/09","2009","AVD/PU","28","120","G/ADP/N/119/CAN",10,10,1,-7,0,1,5.099264634,0.643643193,70.20764108,56.93216421,0,28026.00601,1273.640744,8.88e+11,1.64e+12,37.01987974,29.5575468,2.09984984,12.7973531,"11/21/03",2003-11-21,2003-11-21,251,3669,2004-02-19,1.02e+12,1.93e+12,37.46350778,34.08005361,70.51096653,65.51084195,31829.52256,1490.380055,2.167396569,13.39314276,"Canada ",1995-01-01,"China ",2001-12-11,1,1,NA,NA,"Canada",1948-01-01,1,NA,-7,0,10,10,1,0,NA,NA,NA,NA,NA,NA,NA,NA,NA,2004,0,NA,NA,0
"1741",NA,"CAN-AD-328",20,"2004",70,2003,70,20,"Q4_2012","Canada","CAN-AD-327","Mexico","MEX","Wood Venetian Blinds and Slats","11/21/03","2/19/04","1/20/04","A","A","2/19/04","AVD","5/17/04","6/18/04","A","P (JUST SLATS)","6/18/04","AVD","7/15/09","2009","AVD","1","120","G/ADP/N/119/CAN",10,10,1,8,1,1,5.099264634,0.513348781,70.20764108,51.23527043,1,28026.00601,6601.042065,8.88e+11,7.13e+11,37.01987974,24.89614657,2.09984984,3.586141596,"11/21/03",2003-11-21,2003-11-21,1085,3669,2004-02-19,1.02e+12,7.7e+11,37.46350778,26.23368567,70.51096653,54.22641286,31829.52256,7042.024783,2.167396569,3.575193304,"Canada ",1995-01-01,"Mexico ",1995-01-01,1,1,"Mexico",1986-08-24,"Canada",1948-01-01,1,1,8,8,10,10,1,1,NA,NA,NA,NA,NA,NA,NA,NA,NA,2004,0,NA,NA,0
"1744",NA,"CAN-AD-330",20,"2004",732,2003,732,20,"Q4_2012","Canada","CAN-AD-329","Korea","KOR","Stainless Steel Wire","11/21/03","4/2/04","1/20/04","A","A","4/2/04","AVD","6/30/04","7/30/04","A","A","7/30/04","AVD","7/29/09","2009","AVD","MI","MI","G/ADP/N/126/CAN",10,10,1,8,1,1,5.099264634,0.85879417,70.20764108,63.39301239,1,28026.00601,14219.19359,8.88e+11,6.81e+11,37.01987974,32.7021783,2.09984984,3.514052875,"11/21/03",2003-11-21,2003-11-21,269,3669,2004-04-02,1.02e+12,7.65e+11,37.46350778,38.29500278,70.51096653,72.76108631,31829.52256,15921.9392,2.167396569,3.530029285,"Canada ",1995-01-01,"South Korea",1995-01-01,1,1,"South Korea",1967-04-14,"Canada",1948-01-01,1,1,8,8,10,10,1,1,NA,NA,NA,NA,NA,NA,NA,NA,NA,2004,0,NA,NA,0
"1746",NA,"CAN-AD-332",20,"2004",225,2003,225,20,"Q4_2012","Canada","CAN-AD-329","Switzerland","CHE","Stainless Steel Wire","11/21/03","4/2/04","1/20/04","A","A","4/2/04","AVD","6/30/04","7/30/04","A","A","7/30/04","AVD","7/29/09","2009","AVD","MI","MI","G/ADP/N/126/CAN",10,10,1,10,1,1,5.099264634,0.396693823,70.20764108,79.37872467,1,28026.00601,45588.61982,8.88e+11,3.35e+11,37.01987974,42.91135412,2.09984984,1.038425047,"11/21/03",2003-11-21,2003-11-21,324,3669,2004-04-02,1.02e+12,3.74e+11,37.46350778,45.04554223,70.51096653,83.31456034,31829.52256,50641.8372,2.167396569,1.10640364,"Canada ",1995-01-01,"Switzerland ",1995-07-01,1,1,"Switzerland",1966-08-01,"Canada",1948-01-01,1,1,10,10,10,10,1,1,NA,NA,NA,NA,NA,NA,NA,NA,NA,2004,0,NA,NA,0
"1747",NA,"CAN-AD-333",20,"2004",2,2003,2,20,"Q4_2012","Canada","CAN-AD-329","USA","USA","Stainless Steel Wire","11/21/03","4/2/04","1/20/04","A","A","4/2/04","AVD","6/30/04","7/30/04","A","A","7/30/04","AVD","7/29/09","2009","AVD","MI","MI","G/ADP/N/126/CAN",10,10,1,10,1,1,5.099264634,2.620249571,70.20764108,22.47789302,1,28026.00601,39682.47225,8.88e+11,1.15e+13,37.01987974,9.063428363,2.09984984,1.197297611,"11/21/03",2003-11-21,2003-11-21,1034,3669,2004-04-02,1.02e+12,1.23e+13,37.46350778,9.636719068,70.51096653,24.28117618,31829.52256,41928.88614,2.167396569,1.34507504,"Canada ",1995-01-01,"United States of America",1995-01-01,1,1,"United States of America",1948-01-01,"Canada",1948-01-01,1,1,10,10,10,10,1,1,NA,NA,NA,NA,NA,NA,NA,NA,NA,2004,0,NA,NA,0
"1748",NA,"CAN-AD-334",20,"2004",710,2003,710,20,"Q4_2012","Canada","CAN-AD-334","China","CHN","Certain Steel Fuel Tanks","12/19/03","5/3/04","2/17/04","A","A","5/3/04","AVD","8/3/04","8/31/04","A","N",".",".",".",".",".",".",".",".",10,10,1,-7,0,1,5.099264634,0.643643193,70.20764108,56.93216421,0,28026.00601,1273.640744,8.88e+11,1.64e+12,37.01987974,29.5575468,2.09984984,12.7973531,"12/19/03",2003-12-19,2003-12-19,279,7,2004-05-03,1.02e+12,1.93e+12,37.46350778,34.08005361,70.51096653,65.51084195,31829.52256,1490.380055,2.167396569,13.39314276,"Canada ",1995-01-01,"China ",2001-12-11,1,1,NA,NA,"Canada",1948-01-01,1,NA,-7,0,10,10,1,0,NA,NA,NA,NA,NA,NA,NA,NA,NA,NA,0,NA,NA,0
"1750",NA,"CAN-AD-336",20,"2004",2,2004,2,20,"Q4_2012","Canada","CAN-AD-336","USA","USA","Frozen Self-Rising Pizza","1/2/04","5/17/04","3/2/04","A","A","5/17/04","AVD","8/16/04","8/18/04","A","N",".",".",".",".",".",".",".",".",10,10,1,10,1,1,5.820139115,2.645168965,70.51096653,24.28117618,1,31829.52256,41928.88614,1.02e+12,1.23e+13,37.46350778,9.636719068,2.167396569,1.34507504,"1/2/04",2004-01-02,2004-01-02,1076,21,2004-05-17,1.02e+12,1.23e+13,37.46350778,9.636719068,70.51096653,24.28117618,31829.52256,41928.88614,2.167396569,1.34507504,"Canada ",1995-01-01,"United States of America",1995-01-01,1,1,"United States of America",1948-01-01,"Canada",1948-01-01,1,1,10,10,10,10,1,1,NA,NA,NA,NA,NA,NA,NA,NA,NA,NA,0,NA,NA,0
"1751",NA,"CAN-AD-337",20,"2004",710,2004,710,20,"Q4_2012","Canada","CAN-AD-337","China","CHN","Outdoor Barbeques","4/13/04","8/27/04","6/11/04","A","A","8/27/04","AVD",".",".","T",".",".",".",".",".",".",".",".",".",10,10,1,-7,0,1,5.820139115,0.539893236,70.51096653,65.51084195,0,31829.52256,1490.380055,1.02e+12,1.93e+12,37.46350778,34.08005361,2.167396569,13.39314276,"4/13/04",2004-04-13,2004-04-13,395,123,2004-08-27,1.02e+12,1.93e+12,37.46350778,34.08005361,70.51096653,65.51084195,31829.52256,1490.380055,2.167396569,13.39314276,"Canada ",1995-01-01,"China ",2001-12-11,1,1,NA,NA,"Canada",1948-01-01,1,NA,-7,0,10,10,1,0,NA,NA,NA,NA,NA,NA,NA,NA,NA,NA,0,NA,NA,0
"1752",NA,"CAN-AD-338",20,"2004",710,2004,710,20,"Q4_2012","Canada","CAN-AD-338","China","CHN","Carbon Steel and Stainless Steel Fasteners","4/28/04","9/10/04","6/28/04","A","A","9/10/04","AVD","12/9/04","1/7/05","A","P (ONLY CARBON STEEL SCREWS)","1/7/05","AVD","IF","IF","AVD/PU","0.04","187","G/ADP/N/132/CAN",10,10,1,-7,0,1,5.820139115,0.539893236,70.51096653,65.51084195,0,31829.52256,1490.380055,1.02e+12,1.93e+12,37.46350778,34.08005361,2.167396569,13.39314276,"4/28/04",2004-04-28,2004-04-28,410,138,2004-09-10,1.02e+12,1.93e+12,37.46350778,34.08005361,70.51096653,65.51084195,31829.52256,1490.380055,2.167396569,13.39314276,"Canada ",1995-01-01,"China ",2001-12-11,1,1,NA,NA,"Canada",1948-01-01,1,NA,-7,0,10,10,1,0,NA,NA,NA,NA,NA,NA,NA,NA,NA,2005,0,NA,NA,0
"1755",NA,"CAN-AD-340",20,"2005",305,2004,305,20,"Q4_2012","Canada","CAN-AD-340","Austria","AUT","Certain Laminate Flooring","10/4/04","2/16/05","12/3/04","A","A","2/16/05","AVD",".",".","T",".",".",".",".",".",".",".",".",".",10,10,1,10,1,1,5.820139115,1.975846923,70.51096653,99.1900969,1,31829.52256,35662.21182,1.02e+12,2.91e+11,37.46350778,51.48408087,2.167396569,1.729113167,"10/4/04",2004-10-04,2004-10-04,1703,297,2005-02-16,1.16e+12,3.05e+11,36.95989963,53.83894917,70.02204564,103.693687,36029.32267,37067.32383,1.840625422,1.494022765,"Canada ",1995-01-01,"Austria ",1995-01-01,1,1,"Austria",1951-10-19,"Canada",1948-01-01,1,1,10,10,10,10,1,1,NA,NA,NA,NA,NA,NA,NA,NA,NA,NA,0,NA,NA,0
"1756",NA,"CAN-AD-341",20,"2005",211,2004,211,20,"Q4_2012","Canada","CAN-AD-340","Belgium","BEL","Certain Laminate Flooring","10/4/04","2/16/05","12/3/04","A","A","2/16/05","AVD",".",".","T",".",".",".",".",".",".",".",".",".",10,10,1,10,1,1,5.820139115,1.217743669,70.51096653,146.9598712,1,31829.52256,34706.6939,1.02e+12,3.62e+11,37.46350778,75.93679086,2.167396569,1.051143586,"10/4/04",2004-10-04,2004-10-04,1911,297,2005-02-16,1.16e+12,3.77e+11,36.95989963,78.67813535,70.02204564,153.4229736,36029.32267,36011.4694,1.840625422,0.778762633,"Canada ",1995-01-01,"Belgium ",1995-01-01,1,1,"Belgium",1948-01-01,"Canada",1948-01-01,1,1,10,10,10,10,1,1,NA,NA,NA,NA,NA,NA,NA,NA,NA,NA,0,NA,NA,0
"1757",NA,"CAN-AD-342",20,"2005",710,2004,710,20,"Q4_2012","Canada","CAN-AD-340","China","CHN","Certain Laminate Flooring","10/4/04","2/16/05","12/3/04","A","A","2/16/05","AVD","5/17/05","6/16/05","A","A","6/16/05","AVD","6/15/10","2010","AVD/PU","0","17","G/ADP/N/132/CAN",10,10,1,-7,0,1,5.820139115,0.539893236,70.51096653,65.51084195,0,31829.52256,1490.380055,1.02e+12,1.93e+12,37.46350778,34.08005361,2.167396569,13.39314276,"10/4/04",2004-10-04,2004-10-04,569,297,2005-02-16,1.16e+12,2.26e+12,36.95989963,37.06949052,70.02204564,68.61870494,36029.32267,1731.125235,1.840625422,12.12302312,"Canada ",1995-01-01,"China ",2001-12-11,1,1,NA,NA,"Canada",1948-01-01,1,NA,-7,0,10,10,1,0,NA,NA,NA,NA,NA,NA,NA,NA,NA,2005,0,NA,NA,0
"1758",NA,"CAN-AD-343",20,"2005",220,2004,220,20,"Q4_2012","Canada","CAN-AD-340","France","FRA","Certain Laminate Flooring","10/4/04","2/16/05","12/3/04","A","A","2/16/05","AVD","5/17/05","6/16/05","A","A","6/16/05","AVD","6/15/10","2010","AVD","7","7","G/ADP/N/132/CAN",10,10,1,9,1,1,5.820139115,0.971592092,70.51096653,51.88286632,1,31829.52256,32784.83363,1.02e+12,2.06e+12,37.46350778,26.14359898,2.167396569,2.128398081,"10/4/04",2004-10-04,2004-10-04,3428,297,2005-02-16,1.16e+12,2.14e+12,36.95989963,26.35963669,70.02204564,53.35249229,36029.32267,33818.97269,1.840625422,1.96862676,"Canada ",1995-01-01,"France ",1995-01-01,1,1,"France",1948-01-01,"Canada",1948-01-01,1,1,9,9,10,10,1,1,NA,NA,NA,NA,NA,NA,NA,NA,NA,2005,0,NA,NA,0
"1759",NA,"CAN-AD-344",20,"2005",255,2004,255,20,"Q4_2012","Canada","CAN-AD-340","Germany","DEU","Certain Laminate Flooring","10/4/04","2/16/05","12/3/04","A","A","2/16/05","AVD",".",".","T",".",".",".",".",".",".",".",".",".",10,10,1,10,1,1,5.820139115,0.773067909,70.51096653,72.05492554,1,31829.52256,33040.05141,1.02e+12,2.73e+12,37.46350778,38.54989297,2.167396569,1.069300342,"10/4/04",2004-10-04,2004-10-04,2169,297,2005-02-16,1.16e+12,2.77e+12,36.95989963,41.31765869,70.02204564,77.42087754,36029.32267,33542.78138,1.840625422,0.8019498,"Canada ",1995-01-01,"Germany ",1995-01-01,1,1,"Germany",1951-10-01,"Canada",1948-01-01,1,1,10,10,10,10,1,1,NA,NA,NA,NA,NA,NA,NA,NA,NA,NA,0,NA,NA,0
"1761",NA,"CAN-AD-346",20,"2005",290,2004,290,20,"Q4_2012","Canada","CAN-AD-340","Poland","POL","Certain Laminate Flooring","10/4/04","2/16/05","12/3/04","A","A","2/16/05","AVD",".",".","T",".",".",".",".",".",".",".",".",".",10,10,1,10,1,1,5.820139115,1.321908587,70.51096653,77.33549081,1,31829.52256,6620.070424,1.02e+12,2.53e+11,37.46350778,37.49234753,2.167396569,5.104269988,"10/4/04",2004-10-04,2004-10-04,3208,297,2005-02-16,1.16e+12,3.04e+11,36.95989963,37.0850461,70.02204564,74.91126836,36029.32267,7963.021208,1.840625422,4.528879906,"Canada ",1995-01-01,"Poland ",1995-07-01,1,1,"Poland",1967-10-18,"Canada",1948-01-01,1,1,10,10,10,10,1,1,NA,NA,NA,NA,NA,NA,NA,NA,NA,NA,0,NA,NA,0
"1763",NA,"CAN-AD-348",20,"2006",2,2006,2,20,"Q4_2012","Canada","CAN-AD-348","USA","USA","Certain Cross-Linked Polyethylene Tubing","3/3/06","6/1/06","5/2/06","A","A","6/1/06","AVD","8/30/06","9/29/06","A","N",".",".",".",".",".",".",".",".",10,10,1,10,1,1,4.748718847,2.464403823,68.22299548,26.83956444,1,40244.8531,46443.8102,1.31e+12,1.39e+13,35.455015,10.66900468,1.660719177,1.042895226,"3/3/06",2006-03-03,2006-03-03,NA,NA,2006-06-01,1.31e+12,1.39e+13,35.455015,10.66900468,68.22299548,26.83956444,40244.8531,46443.8102,1.660719177,1.042895226,"Canada ",1995-01-01,"United States of America",1995-01-01,1,1,"United States of America",1948-01-01,"Canada",1948-01-01,1,1,10,10,10,10,1,1,NA,NA,NA,NA,NA,NA,NA,NA,NA,NA,0,NA,NA,0
"1764",NA,"CAN-AD-349",20,"2006",710,2006,710,20,"Q4_2012","Canada","CAN-AD-349","China","CHN","Certain Copper Pipe Fittings","6/8/06","10/20/06","8/8/06","A","A","10/20/06","AVD","1/18/07","2/19/07","A","A","2/19/07","AVD","IF","IF","MI","0","242","G/ADP/N/158/CAN",10,10,1,-7,0,1,4.748718847,0.47626229,68.22299548,70.55319578,1,40244.8531,2069.34363,1.31e+12,2.71e+12,35.455015,39.12622529,1.660719177,11.11345205,"6/8/06",2006-06-08,2006-06-08,NA,NA,2006-10-20,1.31e+12,2.71e+12,35.455015,39.12622529,68.22299548,70.55319578,40244.8531,2069.34363,1.660719177,11.11345205,"Canada ",1995-01-01,"China ",2001-12-11,1,1,NA,NA,"Canada",1948-01-01,1,NA,-7,0,10,10,1,0,NA,NA,NA,NA,NA,NA,NA,NA,NA,2007,0,NA,NA,0
"1766",NA,"CAN-AD-350",20,"2006",732,2006,732,20,"Q4_2012","Canada","CAN-AD-349","Korea","KOR","Certain Copper Pipe Fittings","6/8/06","10/20/06","8/8/06","A","A","10/20/06","AVD","1/18/07","2/19/07","A","A","2/19/07","AVD","IF","IF","MI","1.9","242","G/ADP/N/158/CAN",10,10,1,8,1,1,4.748718847,0.727337087,68.22299548,73.55135,1,40244.8531,20917.04119,1.31e+12,1.01e+12,35.455015,37.16626369,1.660719177,2.988785897,"6/8/06",2006-06-08,2006-06-08,NA,NA,2006-10-20,1.31e+12,1.01e+12,35.455015,37.16626369,68.22299548,73.55135,40244.8531,20917.04119,1.660719177,2.988785897,"Canada ",1995-01-01,"South Korea",1995-01-01,1,1,"South Korea",1967-04-14,"Canada",1948-01-01,1,1,8,8,10,10,1,1,NA,NA,NA,NA,NA,NA,NA,NA,NA,2007,0,NA,NA,0
"1767",NA,"CAN-AD-351",20,"2006",2,2006,2,20,"Q4_2012","Canada","CAN-AD-349","USA","USA","Certain Copper Pipe Fittings","6/8/06","10/20/06","8/8/06","A","A","10/20/06","AVD","1/18/07","2/19/07","A","A","2/19/07","AVD","IF","IF","MI","0","242","G/ADP/N/158/CAN",10,10,1,10,1,1,4.748718847,2.464403823,68.22299548,26.83956444,1,40244.8531,46443.8102,1.31e+12,1.39e+13,35.455015,10.66900468,1.660719177,1.042895226,"6/8/06",2006-06-08,2006-06-08,NA,NA,2006-10-20,1.31e+12,1.39e+13,35.455015,10.66900468,68.22299548,26.83956444,40244.8531,46443.8102,1.660719177,1.042895226,"Canada ",1995-01-01,"United States of America",1995-01-01,1,1,"United States of America",1948-01-01,"Canada",1948-01-01,1,1,10,10,10,10,1,1,NA,NA,NA,NA,NA,NA,NA,NA,NA,2007,0,NA,NA,0
"1768",NA,"CAN-AD-352",20,"2006",140,2006,140,20,"Q4_2012","Canada","CAN-AD-352","Brazil","BRA","Certain Copper Rod","8/30/06","11/28/06","10/30/06","A","A","11/28/06","AVD","2/26/07","3/28/07","A","N",".",".",".",".",".",".",".",".",10,10,1,8,1,1,4.748718847,3.704287718,68.22299548,25.83424317,1,40244.8531,5787.975574,1.31e+12,1.09e+12,35.455015,14.36845084,1.660719177,5.483921707,"8/30/06",2006-08-30,2006-08-30,NA,NA,2006-11-28,1.31e+12,1.09e+12,35.455015,14.36845084,68.22299548,25.83424317,40244.8531,5787.975574,1.660719177,5.483921707,"Canada ",1995-01-01,"Brazil ",1995-01-01,1,1,"Brazil",1948-07-30,"Canada",1948-01-01,1,1,8,8,10,10,1,1,NA,NA,NA,NA,NA,NA,NA,NA,NA,NA,0,NA,NA,0
"1770",NA,"CAN-AD-354",20,"2007",220,2006,220,20,"Q4_2012","Canada","CAN-AD-354","France","FRA","Certain Adult Incontinence Briefs ","11/22/06","2/20/07","1/22/07","A","A","2/20/07","AVD","5/22/07","6/20/07","A","N",".",".",".",".",".",".",".",".",10,10,1,9,1,1,4.748718847,0.915495223,68.22299548,55.09251121,1,40244.8531,35457.05773,1.31e+12,2.26e+12,35.455015,27.02351389,1.660719177,1.785378846,"11/22/06",2006-11-22,2006-11-22,NA,NA,2007-02-20,1.46e+12,2.58e+12,34.31975222,26.85637731,66.51471997,55.26104392,44328.50977,40341.94274,1.686431041,1.895225317,"Canada ",1995-01-01,"France ",1995-01-01,1,1,"France",1948-01-01,"Canada",1948-01-01,1,1,9,9,10,10,1,1,NA,NA,NA,NA,NA,NA,NA,NA,NA,NA,0,NA,NA,0
"1771",NA,"CAN-AD-355",20,"2007",710,2007,710,20,"Q4_2012","Canada","CAN-AD-355","China","CHN","Certain Seamless Carbon or Alloy Steel Oil and Gas Well Casing","8/13/07","11/9/07","10/12/07","A","A","11/9/07","AVD","2/7/08","3/10/08","A","A","3/10/08","AVD","IF","IF","MI","37","91","G/ADP/N/173/CAN",10,10,1,-7,0,1,4.321982894,0.458951894,66.51471997,67.98414918,1,44328.50977,2651.260119,1.46e+12,3.49e+12,34.31975222,38.39804741,1.686431041,10.76971034,"8/13/07",2007-08-13,2007-08-13,NA,NA,2007-11-09,1.46e+12,3.49e+12,34.31975222,38.39804741,66.51471997,67.98414918,44328.50977,2651.260119,1.686431041,10.76971034,"Canada ",1995-01-01,"China ",2001-12-11,1,1,NA,NA,"Canada",1948-01-01,1,NA,-7,0,10,10,1,0,NA,NA,NA,NA,NA,NA,NA,NA,NA,2008,0,NA,NA,0
"1772",NA,"CAN-AD-356",20,"2008",710,2008,710,20,"Q4_2012","Canada","CAN-AD-356","China","CHN","Certain Carbon Steel Welded Pipe","1/23/08","4/22/08","3/25/08","A","A","4/22/08","AVD","7/21/08","8/20/08","A","A","8/20/08","AVD","IF","IF","MI","97","179","G/ADP/N/180/CAN",10,10,1,-7,0,1,3.480671573,0.434411564,67.2067724,62.24882112,1,46398.70244,3413.588648,1.54e+12,4.52e+12,34.46828443,34.9816182,1.906603906,10.7315685,"1/23/08",2008-01-23,2008-01-23,NA,NA,2008-04-22,1.54e+12,4.52e+12,34.46828443,34.9816182,67.2067724,62.24882112,46398.70244,3413.588648,1.906603906,10.7315685,"Canada ",1995-01-01,"China ",2001-12-11,1,1,NA,NA,"Canada",1948-01-01,1,NA,-7,0,10,10,1,0,NA,NA,NA,NA,NA,NA,NA,NA,NA,2008,0,NA,NA,0
"1773",NA,"CAN-AD-357",20,"2008",710,2008,710,20,"Q4_2012","Canada","CAN-AD-357","China","CHN","Certain Thermoelectric Coolers and Warmers ","5/15/08","8/13/08","7/14/08","A","A","8/13/08","AVD","11/10/08","12/11/08","A","A","12/11/08","AVD","IF","IF","MI","16.7","37","G/ADP/N/180/CAN",10,10,1,-7,0,1,3.480671573,0.434411564,67.2067724,62.24882112,1,46398.70244,3413.588648,1.54e+12,4.52e+12,34.46828443,34.9816182,1.906603906,10.7315685,"5/15/08",2008-05-15,2008-05-15,NA,NA,2008-08-13,1.54e+12,4.52e+12,34.46828443,34.9816182,67.2067724,62.24882112,46398.70244,3413.588648,1.906603906,10.7315685,"Canada ",1995-01-01,"China ",2001-12-11,1,1,NA,NA,"Canada",1948-01-01,1,NA,-7,0,10,10,1,0,NA,NA,NA,NA,NA,NA,NA,NA,NA,2008,0,NA,NA,0
"1774",NA,"CAN-AD-358",20,"2008",710,2008,710,20,"Q4_2012","Canada","CAN-AD-358","China","CHN","Certain Aluminum Extrusions","8/18/08","11/17/08","10/17/08","A","A","11/17/08","AVD","2/16/09","3/17/09","A","A","3/17/09","AVD","IF","IF","MI","MI","MI","G/ADP/N/188/CAN",10,10,1,-7,0,1,3.480671573,0.434411564,67.2067724,62.24882112,1,46398.70244,3413.588648,1.54e+12,4.52e+12,34.46828443,34.9816182,1.906603906,10.7315685,"8/18/08",2008-08-18,2008-08-18,NA,NA,2008-11-17,1.54e+12,4.52e+12,34.46828443,34.9816182,67.2067724,62.24882112,46398.70244,3413.588648,1.906603906,10.7315685,"Canada ",1995-01-01,"China ",2001-12-11,1,1,NA,NA,"Canada",1948-01-01,1,NA,-7,0,10,10,1,0,NA,NA,NA,NA,NA,NA,NA,NA,NA,2009,0,NA,NA,0
"1775",NA,"CAN-AD-359",20,"2009",710,2009,710,20,"Q4_2012","Canada","CAN-AD-359","China","CHN","Certain Waterproof Footwear","2/27/09","5/28/09","4/28/09","A","A","5/28/09","AVD","8/26/09","9/25/09","A","N",".",".",".",".",".",".",".",".",10,10,1,-7,0,1,3.604667449,0.448398182,58.35270678,49.0212234,1,40764.1215,3748.504063,1.37e+12,4.99e+12,28.44205546,26.71609478,NA,10.3331503,"2/27/09",2009-02-27,2009-02-27,NA,NA,2009-05-28,1.37e+12,4.99e+12,28.44205546,26.71609478,58.35270678,49.0212234,40764.1215,3748.504063,NA,10.3331503,"Canada ",1995-01-01,"China ",2001-12-11,1,1,NA,NA,"Canada",1948-01-01,1,NA,-7,0,10,10,1,0,NA,NA,NA,NA,NA,NA,NA,NA,NA,NA,0,NA,NA,0
"1777",NA,"CAN-AD-360",20,"2009",816,2009,816,20,"Q4_2012","Canada","CAN-AD-359","Vietnam","VNM","Certain Waterproof Footwear","2/27/09","5/28/09","4/28/09","A","A","5/28/09","AVD","8/26/09","9/25/09","A","N",".",".",".",".",".",".",".",".",10,10,1,-7,0,1,3.604667449,2.397567678,58.35270678,136.3107385,1,40764.1215,1232.369671,1.37e+12,1.06e+11,28.44205546,62.97179667,NA,19.16847046,"2/27/09",2009-02-27,2009-02-27,NA,NA,2009-05-28,1.37e+12,1.06e+11,28.44205546,62.97179667,58.35270678,136.3107385,40764.1215,1232.369671,NA,19.16847046,"Canada ",1995-01-01,"Vietnam",2007-01-11,1,1,NA,NA,"Canada",1948-01-01,1,NA,NA,NA,10,10,1,0,NA,NA,NA,NA,NA,NA,NA,NA,NA,NA,0,NA,NA,0
"1778",NA,"CAN-AD-361",20,"2009",710,2009,710,20,"Q4_2012","Canada","CAN-AD-361","China","CHN","Certain Mattress Innerspring Units","4/27/09","7/27/09","6/26/09","A","A","7/27/09","AVD","10/26/09","11/24/09","A","A","11/24/09","AVD","IF","IF","MI","0","147.4","G/ADP/N/195/CAN",10,10,1,-7,0,1,3.604667449,0.448398182,58.35270678,49.0212234,1,40764.1215,3748.504063,1.37e+12,4.99e+12,28.44205546,26.71609478,NA,10.3331503,"4/27/09",2009-04-27,2009-04-27,NA,NA,2009-07-27,1.37e+12,4.99e+12,28.44205546,26.71609478,58.35270678,49.0212234,40764.1215,3748.504063,NA,10.3331503,"Canada ",1995-01-01,"China ",2001-12-11,1,1,NA,NA,"Canada",1948-01-01,1,NA,-7,0,10,10,1,0,NA,NA,NA,NA,NA,NA,NA,NA,NA,2009,0,NA,NA,0
"1779",NA,"CAN-AD-362",20,"2009",369,2009,369,20,"Q4_2012","Canada","CAN-AD-362","Ukraine","UKR","Certain Carbon Steel Plate and High Strength Low Alloy Plate","7/6/09","10/5/09","9/4/09","A","A","10/5/09","AVD","1/4/10","2/2/10","A","A","2/2/10","AVD","IF","IF","AVD","15","21.3","G/ADP/N/202/CAN",10,10,1,7,1,1,3.604667449,1.152464519,58.35270678,94.42477925,0,40764.1215,2545.480341,1.37e+12,1.17e+11,28.44205546,46.37502806,NA,8.256066372,"7/6/09",2009-07-06,2009-07-06,NA,NA,2009-10-05,1.37e+12,1.17e+11,28.44205546,46.37502806,58.35270678,94.42477925,40764.1215,2545.480341,NA,8.256066372,"Canada ",1995-01-01,"Ukraine ",2008-05-16,1,1,NA,NA,"Canada",1948-01-01,1,NA,7,7,10,10,1,1,NA,NA,NA,NA,NA,NA,NA,NA,NA,2010,0,NA,NA,0
"1780",NA,"CAN-AD-363",20,"2009",710,2009,710,20,"Q4_2012","Canada","CAN-AD-363","China","CHN","Certain Oil Country Tubular Goods","8/24/09","11/23/09","10/23/09","A","A","11/23/09","AVD","2/22/10","3/23/10","A","P","3/23/10","AVD","IF","IF","AVD","13.85","166.9","G/ADP/N/202/CAN",10,10,1,-7,0,1,3.604667449,0.448398182,58.35270678,49.0212234,1,40764.1215,3748.504063,1.37e+12,4.99e+12,28.44205546,26.71609478,NA,10.3331503,"8/24/09",2009-08-24,2009-08-24,NA,NA,2009-11-23,1.37e+12,4.99e+12,28.44205546,26.71609478,58.35270678,49.0212234,40764.1215,3748.504063,NA,10.3331503,"Canada ",1995-01-01,"China ",2001-12-11,1,1,NA,NA,"Canada",1948-01-01,1,NA,-7,0,10,10,1,0,NA,NA,NA,NA,NA,NA,NA,NA,NA,2010,0,NA,NA,0
"1781",NA,"CAN-AD-364",20,"2010",2,2009,2,20,"Q4_2012","Canada","CAN-AD-364","USA","USA","Polyisocyanurate Thermal Insulation Board","10/8/09","1/6/10","12/7/09","A","A","1/6/10","AVD","4/6/10","5/6/10","A","N",".",".",".",".",".",".",".",".",10,10,1,10,1,1,3.604667449,2.312438916,58.35270678,24.69014212,1,40764.1215,46998.82042,1.37e+12,1.44e+13,28.44205546,10.9849562,NA,1.11946068,"10/8/09",2009-10-08,2009-10-08,NA,NA,2010-01-06,1.61e+12,1.5e+13,29.06089104,12.32426145,60.02278144,28.11482588,47465.34593,48357.67357,NA,1.192126008,"Canada ",1995-01-01,"United States of America",1995-01-01,1,1,"United States of America",1948-01-01,"Canada",1948-01-01,1,1,10,10,10,10,1,1,NA,NA,NA,NA,NA,NA,NA,NA,NA,NA,0,NA,NA,0
"1782",NA,"CAN-AD-365",20,"2010",210,2010,210,20,"Q4_2012","Canada","CAN-AD-365","Netherlands","NLD","Greenhouse Bell Peppers","3/22/10","6/21/10","5/21/10","A","A","6/21/10","AVD","9/20/10","10/19/10","A","A","10/19/10","AVD","IF","IF","AVD","193","193","G/ADP/N/209/CAN",10,10,1,10,1,1,4.259310622,2.660202749,60.02278144,149.3127853,1,47465.34593,46773.35381,1.61e+12,7.77e+11,29.06089104,78.68535368,NA,1.787186141,"3/22/10",2010-03-22,2010-03-22,NA,NA,2010-06-21,1.61e+12,7.77e+11,29.06089104,78.68535368,60.02278144,149.3127853,47465.34593,46773.35381,NA,1.787186141,"Canada ",1995-01-01,"Netherlands ",1995-01-01,1,1,"Netherlands",1948-01-01,"Canada",1948-01-01,1,1,10,10,10,10,1,1,NA,NA,NA,NA,NA,NA,NA,NA,NA,2010,0,NA,NA,0
"1783",NA,"CAN-AD-366",20,"2010",710,2010,710,20,"Q4_2012","Canada","CAN-AD-366","China","CHN","Certain Steel Grating","9/20/10","12/20/10","11/19/10","A","A","12/20/10","AVD","3/21/11","4/19/11","A","P","4/19/11","AVD","IF","IF","AVD","0","85","G/ADP/N/216/CAN",10,10,1,-7,0,1,4.259310622,0.456645176,60.02278144,55.03337471,1,47465.34593,4433.340886,1.61e+12,5.93e+12,29.06089104,29.396777,NA,10.09522,"9/20/10",2010-09-20,2010-09-20,NA,NA,2010-12-20,1.61e+12,5.93e+12,29.06089104,29.396777,60.02278144,55.03337471,47465.34593,4433.340886,NA,10.09522,"Canada ",1995-01-01,"China ",2001-12-11,1,1,NA,NA,"Canada",1948-01-01,1,NA,-7,0,10,10,1,0,NA,NA,NA,NA,NA,NA,NA,NA,NA,2011,0,NA,NA,0
"1784",NA,"CAN-AD-367",20,"2011",710,2011,710,20,"Q4_2012","Canada","CAN-AD-367","China","CHN","Certain Pup Joints","9/12/11","12/12/11","11/14/11","A","A","12/12/11","AVD","3/12/12","4/10/12","A","P","4/10/12","AVD","IF","IF","AVD","80.2","173.4","G/ADP/N/230/CAN",10,10,1,-7,0,1,4.052202872,0.533552859,62.6804037,54.57721811,1,51790.56695,5447.309378,1.78e+12,7.32e+12,30.71895573,28.53028081,NA,10.03716006,"9/12/11",2011-09-12,2011-09-12,NA,NA,2011-12-12,1.78e+12,7.32e+12,30.71895573,28.53028081,62.6804037,54.57721811,51790.56695,5447.309378,NA,10.03716006,"Canada ",1995-01-01,"China ",2001-12-11,1,1,NA,NA,"Canada",1948-01-01,1,NA,-7,0,10,10,1,0,NA,NA,NA,NA,NA,NA,NA,NA,NA,2012,0,NA,NA,0
"1785",NA,"CAN-AD-368",20,"2012",710,2011,710,20,"Q4_2012","Canada","CAN-AD-368","China","CHN","Certain Stainless Steel Sinks","10/27/11","1/25/12","12/28/11","A","A","1/25/12","AVD","4/24/12","5/24/12","A","P","5/24/12","AVD","IF","IF","AVD","4.4","103.1","G/ADP/N/230/CAN",10,10,1,-7,0,1,4.052202872,0.533552859,62.6804037,54.57721811,1,51790.56695,5447.309378,1.78e+12,7.32e+12,30.71895573,28.53028081,NA,10.03716006,"10/27/11",2011-10-27,2011-10-27,NA,NA,2012-01-25,1.82e+12,8.23e+12,30.03444568,27.32111234,62.05859777,51.82489065,52409.19313,6092.781886,NA,10.08212511,"Canada ",1995-01-01,"China ",2001-12-11,1,1,NA,NA,"Canada",1948-01-01,1,NA,-7,0,10,10,1,0,NA,NA,NA,NA,NA,NA,NA,NA,NA,2012,0,NA,NA,0
"1788",NA,"CAN-AD-370",20,"2012",732,2012,732,20,"Q4_2012","Canada","CAN-AD-370","Korea","KOR","Certain Liquid Dielectric Transformers","4/23/12","7/23/12","6/22/12","A","A","7/23/12","AVD","10/22/12","11/20/12","A","A","11/20/12","AVD","IF","IF","AVD","15.5","118.1","G/ADP/N/237/CAN",10,10,1,8,1,1,3.976025316,1.136907577,62.05859777,109.8862207,1,52409.19313,24453.97135,1.82e+12,1.22e+12,30.03444568,56.34025057,NA,2.459145358,"4/23/12",2012-04-23,2012-04-23,NA,NA,2012-07-23,1.82e+12,1.22e+12,30.03444568,56.34025057,62.05859777,109.8862207,52409.19313,24453.97135,NA,2.459145358,"Canada ",1995-01-01,"South Korea",1995-01-01,1,1,"South Korea",1967-04-14,"Canada",1948-01-01,1,1,8,8,10,10,1,1,NA,NA,NA,NA,NA,NA,NA,NA,NA,2012,0,NA,NA,0
"1789",NA,"CAN-AD-371",20,"2012",710,2012,710,20,"Q4_2012","Canada","CAN-AD-371","China","CHN","Certain Steel Piling Pipe","5/4/12","8/2/12","7/3/12","A","A","8/2/12","AVD","10/31/12","11/30/12","A","A","11/30/12","AVD","IF","IF","AVD","72.9","96.4","G/ADP/N/237/CAN",10,10,1,-7,0,1,3.976025316,0.461590928,62.05859777,51.82489065,1,52409.19313,6092.781886,1.82e+12,8.23e+12,30.03444568,27.32111234,NA,10.08212511,"5/4/12",2012-05-04,2012-05-04,NA,NA,2012-08-02,1.82e+12,8.23e+12,30.03444568,27.32111234,62.05859777,51.82489065,52409.19313,6092.781886,NA,10.08212511,"Canada ",1995-01-01,"China ",2001-12-11,1,1,NA,NA,"Canada",1948-01-01,1,NA,-7,0,10,10,1,0,NA,NA,NA,NA,NA,NA,NA,NA,NA,2012,0,NA,NA,0
"1791",NA,"CAN-AD-373",20,"2012",750,2012,750,20,"Q4_2012","Canada","CAN-AD-372","India","IND","Certain Carbon Steel Welded Pipe","5/14/12","8/13/12","7/13/12","A","A","8/13/12","AVD","11/9/12","12/11/12","A","P","12/11/12","AVD","IF","IF","AVD","11.6","54.2","G/ADP/N/237/CAN",10,10,1,9,1,1,3.976025316,1.954673746,62.05859777,54.73235415,1,52409.19313,1503.003703,1.82e+12,1.86e+12,30.03444568,23.99623723,NA,17.51994517,"5/14/12",2012-05-14,2012-05-14,NA,NA,2012-08-13,1.82e+12,1.86e+12,30.03444568,23.99623723,62.05859777,54.73235415,52409.19313,1503.003703,NA,17.51994517,"Canada ",1995-01-01,"India ",1995-01-01,1,1,"India",1948-07-08,"Canada",1948-01-01,1,1,9,9,10,10,1,1,NA,NA,NA,NA,NA,NA,NA,NA,NA,2012,0,NA,NA,0
"1793",NA,"CAN-AD-375",20,"2012",732,2012,732,20,"Q4_2012","Canada","CAN-AD-372","Korea","KOR","Certain Carbon Steel Welded Pipe","5/14/12","8/13/12","7/13/12","A","A","8/13/12","AVD","11/9/12","12/11/12","A","P","12/11/12","AVD","IF","IF","AVD","54.2","54.2","G/ADP/N/237/CAN",10,10,1,8,1,1,3.976025316,1.136907577,62.05859777,109.8862207,1,52409.19313,24453.97135,1.82e+12,1.22e+12,30.03444568,56.34025057,NA,2.459145358,"5/14/12",2012-05-14,2012-05-14,NA,NA,2012-08-13,1.82e+12,1.22e+12,30.03444568,56.34025057,62.05859777,109.8862207,52409.19313,24453.97135,NA,2.459145358,"Canada ",1995-01-01,"South Korea",1995-01-01,1,1,"South Korea",1967-04-14,"Canada",1948-01-01,1,1,8,8,10,10,1,1,NA,NA,NA,NA,NA,NA,NA,NA,NA,2012,0,NA,NA,0
"1794",NA,"CAN-AD-376",20,"2012",800,2012,800,20,"Q4_2012","Canada","CAN-AD-372","Thailand","THA","Certain Carbon Steel Welded Pipe","5/14/12","8/13/12","7/13/12","A","A","8/13/12","AVD","11/9/12","12/11/12","A","P","12/11/12","AVD","IF","IF","AVD","3.8","54.2","G/ADP/N/237/CAN",10,10,1,7,1,1,3.976025316,4.923380505,62.05859777,148.8256316,1,52409.19313,5479.76058,1.82e+12,3.66e+11,30.03444568,74.97978304,NA,12.26989168,"5/14/12",2012-05-14,2012-05-14,NA,NA,2012-08-13,1.82e+12,3.66e+11,30.03444568,74.97978304,62.05859777,148.8256316,52409.19313,5479.76058,NA,12.26989168,"Canada ",1995-01-01,"Thailand ",1995-01-01,1,1,"Thailand",1982-11-20,"Canada",1948-01-01,1,1,7,7,10,10,1,1,NA,NA,NA,NA,NA,NA,NA,NA,NA,2012,0,NA,NA,0
"1795",NA,"CAN-AD-377",20,"2012",640,2012,640,20,"Q4_2012","Canada","CAN-AD-372","Turkey","TUR","Certain Carbon Steel Welded Pipe","5/14/12","8/13/12","7/13/12","A","A","8/13/12","AVD","11/9/12",".","N",".",".",".",".",".",".",".",".",".",10,10,1,9,1,1,3.976025316,0.454197146,62.05859777,57.75483553,1,52409.19313,10660.72864,1.82e+12,7.89e+11,30.03444568,26.29611125,NA,8.999048849,"5/14/12",2012-05-14,2012-05-14,NA,NA,2012-08-13,1.82e+12,7.89e+11,30.03444568,26.29611125,62.05859777,57.75483553,52409.19313,10660.72864,NA,8.999048849,"Canada ",1995-01-01,"Turkey ",1995-03-26,1,1,"Turkey",1951-10-17,"Canada",1948-01-01,1,1,9,9,10,10,1,1,NA,NA,NA,NA,NA,NA,NA,NA,NA,NA,0,NA,NA,0
"1796",NA,"CAN-AD-378",20,"2012",696,2012,696,20,"Q4_2012","Canada","CAN-AD-372","United Arab Emirates","ARE","Certain Carbon Steel Welded Pipe","5/14/12","8/13/12","7/13/12","A","A","8/13/12","AVD","11/9/12","12/11/12","A","P","12/11/12","AVD","IF","IF","AVD","0","54.2","G/ADP/N/237/CAN",10,10,1,-8,0,1,3.976025316,NA,62.05859777,169.6209833,0,52409.19313,41691.69503,1.82e+12,3.84e+11,30.03444568,95.15187096,NA,0.735223953,"5/14/12",2012-05-14,2012-05-14,NA,NA,2012-08-13,1.82e+12,3.84e+11,30.03444568,95.15187096,62.05859777,169.6209833,52409.19313,41691.69503,NA,0.735223953,"Canada ",1995-01-01,"United Arab Emirates",1996-04-10,1,1,"United Arab Emirates",1994-03-08,"Canada",1948-01-01,1,1,-8,0,10,10,1,0,NA,NA,NA,NA,NA,NA,NA,NA,NA,2012,0,NA,NA,0
"1873",NA,"CHL-AD-16",155,"2006",160,2006,160,155,"Q4_2012","Chile ","CHL-AD-16","Argentina","ARG","Wheat Flour","10/11/06","MI","MI","A","A","12/1/06","AVD","MI","MI","A","A","5/28/07","AVD","4/19/08","2008","AVD","31.1","31.1","G/ADP/N/158/CHL",10,10,1,8,1,1,4.712992596,1.288344519,71.94475384,36.18660748,1,9371.427857,6783.713975,1.55e+11,2.64e+11,42.43382995,20.43197594,3.867738464,7.697516707,"10/11/06",2006-10-11,2006-10-11,NA,NA,2006-12-01,1.55e+11,2.64e+11,42.43382995,20.43197594,71.94475384,36.18660748,9371.427857,6783.713975,3.867738464,7.697516707,"Chile ",1995-01-01,"Argentina ",1995-01-01,1,1,"Argentina",1967-10-11,"Chile",1949-03-16,1,1,8,8,10,10,1,1,NA,NA,NA,NA,NA,NA,NA,NA,NA,2007,0,NA,NA,0
"1876",NA,"CHL-AD-19",155,"2010",160,2009,160,155,"Q4_2012","Chile","CHL-AD-19","Argentina","ARG","Wheat Flour","12/4/09","MI","MI","A","A","2/24/10","AVD","MI","MI","A","A","7/8/10","AVD","7/7/11","2011","AVD","17","17","G/ADP/N/202/CHL",10,10,1,8,1,1,5.358032964,1.081750961,66.76845041,30.56244596,1,10141.60351,9456.816314,1.72e+11,3.78e+11,37.17091154,17.39562781,3.561871972,6.234805307,"12/4/09",2009-12-04,2009-12-04,NA,NA,2010-02-24,2.18e+11,4.63e+11,38.05674102,17.49945351,69.81495546,32.53587923,12681.7652,11460.37615,3.463978636,8.177986442,"Chile ",1995-01-01,"Argentina ",1995-01-01,1,1,"Argentina",1967-10-11,"Chile",1949-03-16,1,1,8,8,10,10,1,1,NA,NA,NA,NA,NA,NA,NA,NA,NA,2010,0,NA,NA,0
"1879",NA,"CHL-AD-21",155,"2011",160,2011,160,155,"Q4_2012","Chile","CHL-AD-21","Argentina","ARG","Wheat Flour","6/13/11","MI","MI","A","A","10/1/11","AVD","4/2/12","4/2/12","A","A","6/30/12","AVD","IF","IF","AVD","9.7","9.7","G/ADP/N/230/CHL",10,10,1,8,1,1,5.192541179,1.267100676,72.8893252,33.92136319,1,14510.9661,13693.70379,2.51e+11,5.58e+11,38.02449504,17.78503379,3.582180363,7.789211397,"6/13/11",2011-06-13,2011-06-13,NA,NA,2011-10-01,2.51e+11,5.58e+11,38.02449504,17.78503379,72.8893252,33.92136319,14510.9661,13693.70379,3.582180363,7.789211397,"Chile ",1995-01-01,"Argentina ",1995-01-01,1,1,"Argentina",1967-10-11,"Chile",1949-03-16,1,1,8,8,10,10,1,1,NA,NA,NA,NA,NA,NA,NA,NA,NA,2012,0,NA,NA,0
"1890",NA,"CHN-AD-100",710,"2005",255,2004,255,710,"Q4_2012","China","CHN-AD-97","Germany","DEU","Dimethyl Cyclosiloxane or Cyclic Dimethyl Siloxane ","7/16/04","9/29/05","9/29/05","A","A","9/29/05","AVD","1/16/06","1/16/06","A","A","1/16/06","AVD","1/16/11","2011","AVD","13","22","G/ADP/N/145/CHN",-7,0,0,10,1,1,0.539893236,0.773067909,65.51084195,72.05492554,1,1490.380055,33040.05141,1.93e+12,2.73e+12,34.08005361,38.54989297,13.39314276,1.069300342,"7/16/04",2004-07-16,2004-07-16,2089,489,2005-09-29,2.26e+12,2.77e+12,37.06949052,41.31765869,68.61870494,77.42087754,1731.125235,33542.78138,12.12302312,0.8019498,"China ",2001-12-11,"Germany ",1995-01-01,1,1,"Germany",1951-10-01,NA,NA,NA,1,10,10,-7,0,0,1,NA,NA,NA,NA,NA,NA,NA,NA,NA,2006,0,NA,NA,0
"1891",NA,"CHN-AD-101",710,"2005",210,2004,210,710,"Q4_2012","China","CHN-AD-101","Netherlands","NLD","Ethylenepropylenenonconjugated Diene Rubber (EPDM) ","8/10/04","11/16/05","11/16/05","A","A","11/16/05","AVD","2/9/06","2/9/06","W","W",".",".",".",".",".",".",".",".",-7,0,0,10,1,1,0.539893236,3.009490491,65.51084195,125.4122691,1,1490.380055,37458.43287,1.93e+12,6.1e+11,34.08005361,66.39283853,13.39314276,1.984782798,"8/10/04",2004-08-10,2004-08-10,750,514,2005-11-16,2.26e+12,6.38e+11,37.06949052,69.62370984,68.61870494,130.7229936,1731.125235,39122.29108,12.12302312,1.934754111,"China ",2001-12-11,"Netherlands ",1995-01-01,1,1,"Netherlands",1948-01-01,NA,NA,NA,1,10,10,-7,0,0,1,NA,NA,NA,NA,NA,NA,NA,NA,NA,NA,0,NA,NA,0
"1892",NA,"CHN-AD-102",710,"2005",2,2004,2,710,"Q4_2012","China","CHN-AD-101","USA","USA","Ethylenepropylenenonconjugated Diene Rubber (EPDM) ","8/10/04","11/16/05","11/16/05","A","A","11/16/05","AVD","2/9/06","2/9/06","W","W",".",".",".",".",".",".",".",".",-7,0,0,10,1,1,0.539893236,2.645168965,65.51084195,24.28117618,1,1490.380055,41928.88614,1.93e+12,1.23e+13,34.08005361,9.636719068,13.39314276,1.34507504,"8/10/04",2004-08-10,2004-08-10,1297,514,2005-11-16,2.26e+12,1.31e+13,37.06949052,10.00656719,68.61870494,25.47841227,1731.125235,44313.58524,12.12302312,1.212483968,"China ",2001-12-11,"United States of America",1995-01-01,1,1,"United States of America",1948-01-01,NA,NA,NA,1,10,10,-7,0,0,1,NA,NA,NA,NA,NA,NA,NA,NA,NA,NA,0,NA,NA,0
"1893",NA,"CHN-AD-103",710,"2005",732,2004,732,710,"Q4_2012","China","CHN-AD-101","South Korea","KOR","Ethylenepropylenenonconjugated Diene Rubber (EPDM) ","8/10/04","11/16/05","11/16/05","A","A","11/16/05","AVD","2/9/06","2/9/06","W","W",".",".",".",".",".",".",".",".",-7,0,0,8,1,1,0.539893236,0.790694575,65.51084195,72.76108631,1,1490.380055,15921.9392,1.93e+12,7.65e+11,34.08005361,38.29500278,13.39314276,3.530029285,"8/10/04",2004-08-10,2004-08-10,532,514,2005-11-16,2.26e+12,8.98e+11,37.06949052,36.80965361,68.61870494,71.18429245,1731.125235,18657.46113,12.12302312,3.147437074,"China ",2001-12-11,"South Korea",1995-01-01,1,1,"South Korea",1967-04-14,NA,NA,NA,1,8,8,-7,0,0,1,NA,NA,NA,NA,NA,NA,NA,NA,NA,NA,0,NA,NA,0
"1894",NA,"CHN-AD-104",710,"2005",994,2004,994,710,"Q4_2012","China","CHN-AD-104","European Union","EUN","Benzofuranol 7-Hydroxy or Furan Phenol ","8/12/04","6/16/05","6/16/05","A","A","6/16/05","AVD","2/12/06","2/12/06","A","A","2/12/06","DPU","2/12/11","2011","DPU ","113.2","113.2","G/ADP/N/145/CHN",-7,0,0,NA,1,1,0.539893236,1.428685194,65.51084195,70.27789133,1,1490.380055,26795.93303,1.93e+12,1.32e+13,34.08005361,35.70172137,13.39314276,2.028298134,"8/12/04",2004-08-12,2004-08-12,NA,516,2005-06-16,2.26e+12,1.39e+13,37.06949052,37.04369782,68.61870494,73.30833573,1731.125235,27909.03457,12.12302312,1.769160588,"China ",2001-12-11,"European Union",1995-01-01,1,1,NA,NA,NA,NA,NA,NA,6,NA,-7,0,0,1,NA,NA,NA,NA,NA,NA,NA,NA,NA,2006,0,NA,NA,0
"1895",NA,"CHN-AD-105",710,"2005",740,2004,740,710,"Q4_2012","China","CHN-AD-104","Japan","JPN","Benzofuranol 7-Hydroxy or Furan Phenol ","8/12/04","6/16/05","6/16/05","A","A","6/16/05","AVD","2/12/06","2/12/06","A","A","2/12/06","DPU","2/12/11","2011","DPU ","113.2","113.2","G/ADP/N/145/CHN",-7,0,0,10,1,1,0.539893236,0.492808285,65.51084195,24.46337319,1,1490.380055,36441.50449,1.93e+12,4.66e+12,34.08005361,13.21033508,13.39314276,1.316515033,"8/12/04",2004-08-12,2004-08-12,1204,516,2005-06-16,2.26e+12,4.57e+12,37.06949052,14.31265541,68.61870494,27.21757957,1731.125235,35781.16627,12.12302312,1.216689303,"China ",2001-12-11,"Japan ",1995-01-01,1,1,"Japan",1955-09-10,NA,NA,NA,1,10,10,-7,0,0,1,NA,NA,NA,NA,NA,NA,NA,NA,NA,2006,0,NA,NA,0
"1896",NA,"CHN-AD-106",710,"2005",2,2004,2,710,"Q4_2012","China","CHN-AD-104","USA","USA","Benzofuranol 7-Hydroxy or Furan Phenol ","8/12/04","6/16/05","6/16/05","A","A","6/16/05","AVD","2/12/06","2/12/06","A","A","2/12/06","DPU","2/12/11","2011","DPU ","44","44","G/ADP/N/145/CHN",-7,0,0,10,1,1,0.539893236,2.645168965,65.51084195,24.28117618,1,1490.380055,41928.88614,1.93e+12,1.23e+13,34.08005361,9.636719068,13.39314276,1.34507504,"8/12/04",2004-08-12,2004-08-12,1299,516,2005-06-16,2.26e+12,1.31e+13,37.06949052,10.00656719,68.61870494,25.47841227,1731.125235,44313.58524,12.12302312,1.212483968,"China ",2001-12-11,"United States of America",1995-01-01,1,1,"United States of America",1948-01-01,NA,NA,NA,1,10,10,-7,0,0,1,NA,NA,NA,NA,NA,NA,NA,NA,NA,2006,0,NA,NA,0
"1897",NA,"CHN-AD-107",710,"2005",732,2004,732,710,"Q4_2012","China","CHN-AD-107","South Korea","KOR","Disodium 5'-Inosinate Disodium 5'-Guanylate Disodium 5-Ribonucleotide","11/12/04","8/4/05","8/4/05","A","A","8/4/05","AVD","5/12/06","5/12/06","A","A","5/12/06","AVD","5/12/11","2011","DPU ","25","119","G/ADP/N/145/CHN",-7,0,0,8,1,1,0.539893236,0.790694575,65.51084195,72.76108631,1,1490.380055,15921.9392,1.93e+12,7.65e+11,34.08005361,38.29500278,13.39314276,3.530029285,"11/12/04",2004-11-12,2004-11-12,626,608,2005-08-04,2.26e+12,8.98e+11,37.06949052,36.80965361,68.61870494,71.18429245,1731.125235,18657.46113,12.12302312,3.147437074,"China ",2001-12-11,"South Korea",1995-01-01,1,1,"South Korea",1967-04-14,NA,NA,NA,1,8,8,-7,0,0,1,NA,NA,NA,NA,NA,NA,NA,NA,NA,2006,0,NA,NA,0
"1898",NA,"CHN-AD-108",710,"2005",740,2004,740,710,"Q4_2012","China","CHN-AD-107","Japan","JPN","Disodium 5'-Inosinate Disodium 5'-Guanylate Disodium 5-Ribonucleotide","11/12/04","8/4/05","8/4/05","A","A","8/4/05","AVD","5/12/06","5/12/06","A","A","5/12/06","AVD","5/12/11","2011","DPU ","25","119","G/ADP/N/145/CHN",-7,0,0,10,1,1,0.539893236,0.492808285,65.51084195,24.46337319,1,1490.380055,36441.50449,1.93e+12,4.66e+12,34.08005361,13.21033508,13.39314276,1.316515033,"11/12/04",2004-11-12,2004-11-12,1296,608,2005-08-04,2.26e+12,4.57e+12,37.06949052,14.31265541,68.61870494,27.21757957,1731.125235,35781.16627,12.12302312,1.216689303,"China ",2001-12-11,"Japan ",1995-01-01,1,1,"Japan",1955-09-10,NA,NA,NA,1,10,10,-7,0,0,1,NA,NA,NA,NA,NA,NA,NA,NA,NA,2006,0,NA,NA,0
"1899",NA,"CHN-AD-109",710,"2005",732,2004,732,710,"Q4_2012","China","CHN-AD-109","South Korea","KOR","Epichlorohydrin (ECH)","12/28/04","9/21/05","9/21/05","A","A","9/21/05","AVD","6/28/06","6/28/06","A","A","6/28/06","AVD","IF","IF","DPU ","3.8","71.5","G/ADP/N/145/CHN",-7,0,0,8,1,1,0.539893236,0.790694575,65.51084195,72.76108631,1,1490.380055,15921.9392,1.93e+12,7.65e+11,34.08005361,38.29500278,13.39314276,3.530029285,"12/28/04",2004-12-28,2004-12-28,672,654,2005-09-21,2.26e+12,8.98e+11,37.06949052,36.80965361,68.61870494,71.18429245,1731.125235,18657.46113,12.12302312,3.147437074,"China ",2001-12-11,"South Korea",1995-01-01,1,1,"South Korea",1967-04-14,NA,NA,NA,1,8,8,-7,0,0,1,NA,NA,NA,NA,NA,NA,NA,NA,NA,2006,0,NA,NA,0
"1901",NA,"CHN-AD-110",710,"2005",2,2004,2,710,"Q4_2012","China","CHN-AD-109","USA","USA","Epichlorohydrin (ECH)","12/28/04","9/21/05","9/21/05","A","A","9/21/05","AVD","6/28/06","6/28/06","A","A","6/29/06","AVD","IF","IF","DPU ","4.3","71.5","G/ADP/N/145/CHN",-7,0,0,10,1,1,0.539893236,2.645168965,65.51084195,24.28117618,1,1490.380055,41928.88614,1.93e+12,1.23e+13,34.08005361,9.636719068,13.39314276,1.34507504,"12/28/04",2004-12-28,2004-12-28,1437,654,2005-09-21,2.26e+12,1.31e+13,37.06949052,10.00656719,68.61870494,25.47841227,1731.125235,44313.58524,12.12302312,1.212483968,"China ",2001-12-11,"United States of America",1995-01-01,1,1,"United States of America",1948-01-01,NA,NA,NA,1,10,10,-7,0,0,1,NA,NA,NA,NA,NA,NA,NA,NA,NA,2006,0,NA,NA,0
"1902",NA,"CHN-AD-111",710,"2005",740,2004,740,710,"Q4_2012","China","CHN-AD-109","Japan","JPN","Epichlorohydrin (ECH)","12/28/04","9/21/05","9/21/05","A","A","9/21/05","AVD","6/28/06","6/28/06","A","A","6/30/06","AVD","IF","IF","DPU ","0","71.5","G/ADP/N/145/CHN",-7,0,0,10,1,1,0.539893236,0.492808285,65.51084195,24.46337319,1,1490.380055,36441.50449,1.93e+12,4.66e+12,34.08005361,13.21033508,13.39314276,1.316515033,"12/28/04",2004-12-28,2004-12-28,1342,654,2005-09-21,2.26e+12,4.57e+12,37.06949052,14.31265541,68.61870494,27.21757957,1731.125235,35781.16627,12.12302312,1.216689303,"China ",2001-12-11,"Japan ",1995-01-01,1,1,"Japan",1955-09-10,NA,NA,NA,1,10,10,-7,0,0,1,NA,NA,NA,NA,NA,NA,NA,NA,NA,2006,0,NA,NA,0
"1904",NA,"CHN-AD-113",710,"2006",2,2005,2,710,"Q4_2012","China","CHN-AD-113","USA","USA","Spendex","4/13/05","5/24/06","5/24/06","A","A","5/24/06","MI","10/19/06","10/19/06","A","A","10/13/06","AVD","IF","IF","MI","61","61","G/ADP/N/153/CHN",-7,0,0,10,1,1,0.522731473,2.530182767,68.61870494,25.47841227,1,1731.125235,44313.58524,2.26e+12,1.31e+13,37.06949052,10.00656719,12.12302312,1.212483968,"4/13/05",2005-04-13,2005-04-13,NA,NA,2006-05-24,2.71e+12,1.39e+13,39.12622529,10.66900468,70.55319578,26.83956444,2069.34363,46443.8102,11.11345205,1.042895226,"China ",2001-12-11,"United States of America",1995-01-01,1,1,"United States of America",1948-01-01,NA,NA,NA,1,10,10,-7,0,0,1,NA,NA,NA,NA,NA,NA,NA,NA,NA,2006,0,NA,NA,0
"1905",NA,"CHN-AD-114",710,"2006",740,2005,740,710,"Q4_2012","China","CHN-AD-113","Japan","JPN","Spendex","4/13/05","5/24/06","5/24/06","A","A","5/25/06","MI","10/19/06","10/19/06","A","A","10/13/06","AVD","IF","IF","MI","12.87","61","G/ADP/N/153/CHN",-7,0,0,10,1,1,0.522731473,0.515204769,68.61870494,27.21757957,1,1731.125235,35781.16627,2.26e+12,4.57e+12,37.06949052,14.31265541,12.12302312,1.216689303,"4/13/05",2005-04-13,2005-04-13,NA,NA,2006-05-25,2.71e+12,4.36e+12,39.12622529,16.17160101,70.55319578,31.08646956,2069.34363,34102.11478,11.11345205,1.181368596,"China ",2001-12-11,"Japan ",1995-01-01,1,1,"Japan",1955-09-10,NA,NA,NA,1,10,10,-7,0,0,1,NA,NA,NA,NA,NA,NA,NA,NA,NA,2006,0,NA,NA,0
"1907",NA,"CHN-AD-116",710,"2006",830,2005,830,710,"Q4_2012","China","CHN-AD-113","Singapore","SGP","Spendex","4/13/05","5/24/06","5/24/06","A","A","5/27/06","MI","10/19/06","10/19/06","A","A","10/13/06","AVD","IF","IF","MI","10.85","61","G/ADP/N/153/CHN",-7,0,0,-2,0,1,0.522731473,0.326407495,68.61870494,422.3304601,0,1731.125235,29869.63276,2.26e+12,1.27e+11,37.06949052,226.0794345,12.12302312,0.057656861,"4/13/05",2005-04-13,2005-04-13,NA,NA,2006-05-27,2.71e+12,1.48e+11,39.12622529,230.1035195,70.55319578,430.3576128,2069.34363,33578.888,11.11345205,0.051163833,"China ",2001-12-11,"Singapore ",1995-01-01,1,1,"Singapore",1973-08-20,NA,NA,NA,1,-2,2,-7,0,0,0,NA,NA,NA,NA,NA,NA,NA,NA,NA,2006,0,NA,NA,0
"1908",NA,"CHN-AD-117",710,"2006",732,2005,732,710,"Q4_2012","China","CHN-AD-113","South Korea","KOR","Spendex","4/13/05","5/24/06","5/24/06","A","A","5/28/06","MI","10/19/06","10/19/06","A","A","10/13/06","AVD","IF","IF","MI","0","61","G/ADP/N/153/CHN",-7,0,0,8,1,1,0.522731473,0.800996405,68.61870494,71.18429245,1,1731.125235,18657.46113,2.26e+12,8.98e+11,37.06949052,36.80965361,12.12302312,3.147437074,"4/13/05",2005-04-13,2005-04-13,NA,NA,2006-05-28,2.71e+12,1.01e+12,39.12622529,37.16626369,70.55319578,73.55135,2069.34363,20917.04119,11.11345205,2.988785897,"China ",2001-12-11,"South Korea",1995-01-01,1,1,"South Korea",1967-04-14,NA,NA,NA,1,8,8,-7,0,0,1,NA,NA,NA,NA,NA,NA,NA,NA,NA,2006,0,NA,NA,0
"1909",NA,"CHN-AD-118",710,"2005",740,2005,740,710,"Q4_2012","China","CHN-AD-118","Japan","JPN","O-Dihydroxybenzene(Catechol Pyrocatechol)","5/31/05","12/14/05","12/14/05","A","A","12/2/05","AVD","5/22/06","5/22/06","A","A","5/22/06","AVD","IF","IF","DPU ","42.86","42.86","G/ADP/N/145/CHN",-7,0,0,10,1,1,0.522731473,0.515204769,68.61870494,27.21757957,1,1731.125235,35781.16627,2.26e+12,4.57e+12,37.06949052,14.31265541,12.12302312,1.216689303,"5/31/05",2005-05-31,2005-05-31,NA,NA,2005-12-02,2.26e+12,4.57e+12,37.06949052,14.31265541,68.61870494,27.21757957,1731.125235,35781.16627,12.12302312,1.216689303,"China ",2001-12-11,"Japan ",1995-01-01,1,1,"Japan",1955-09-10,NA,NA,NA,1,10,10,-7,0,0,1,NA,NA,NA,NA,NA,NA,NA,NA,NA,2006,0,NA,NA,0
"1910",NA,"CHN-AD-119",710,"2005",2,2005,2,710,"Q4_2012","China","CHN-AD-118","USA","USA","O-Dihydroxybenzene(Catechol Pyrocatechol)","5/31/05","12/14/05","12/14/05","A","A","12/2/05","AVD","5/22/06","5/22/06","A","A","5/22/06","AVD","IF","IF","DPU ","4","46.81","G/ADP/N/145/CHN",-7,0,0,10,1,1,0.522731473,2.530182767,68.61870494,25.47841227,1,1731.125235,44313.58524,2.26e+12,1.31e+13,37.06949052,10.00656719,12.12302312,1.212483968,"5/31/05",2005-05-31,2005-05-31,NA,NA,2005-12-02,2.26e+12,1.31e+13,37.06949052,10.00656719,68.61870494,25.47841227,1731.125235,44313.58524,12.12302312,1.212483968,"China ",2001-12-11,"United States of America",1995-01-01,1,1,"United States of America",1948-01-01,NA,NA,NA,1,10,10,-7,0,0,1,NA,NA,NA,NA,NA,NA,NA,NA,NA,2006,0,NA,NA,0
"1913",NA,"CHN-AD-121",710,"2006",740,2005,740,710,"Q4_2012","China","CHN-AD-120","Japan","JPN","Polybutylene Terephthalate Resin (PBT)","6/6/05","3/22/06","3/22/06","A","A","3/22/06","AVD","7/24/06","7/24/06","A","A","7/22/06","AVD","7/22/11","2011","AVD","6.24","17.31","G/ADP/N/153/CHN",-7,0,0,10,1,1,0.522731473,0.515204769,68.61870494,27.21757957,1,1731.125235,35781.16627,2.26e+12,4.57e+12,37.06949052,14.31265541,12.12302312,1.216689303,"6/6/05",2005-06-06,2005-06-06,NA,NA,2006-03-22,2.71e+12,4.36e+12,39.12622529,16.17160101,70.55319578,31.08646956,2069.34363,34102.11478,11.11345205,1.181368596,"China ",2001-12-11,"Japan ",1995-01-01,1,1,"Japan",1955-09-10,NA,NA,NA,1,10,10,-7,0,0,1,NA,NA,NA,NA,NA,NA,NA,NA,NA,2006,0,NA,NA,0
"1914",NA,"CHN-AD-122",710,"2006",994,2005,994,710,"Q4_2012","China","CHN-AD-122","European Union","EUN","Glassine and Other Glazed Transparent or Translucent Papers ","6/13/05","6/16/06","6/16/06","A","A","6/16/06","AVD","12/12/06","12/12/06","A","A","12/13/06","AVD","12/13/11","2011","AVD","10","42.08","G/ADP/N/153/CHN",-7,0,0,NA,1,1,0.522731473,1.361857737,68.61870494,73.30833573,1,1731.125235,27909.03457,2.26e+12,1.39e+13,37.06949052,37.04369782,12.12302312,1.769160588,"6/13/05",2005-06-13,2005-06-13,NA,NA,2006-06-16,2.71e+12,1.48e+13,39.12622529,39.39015032,70.55319578,78.25337348,2069.34363,29651.0928,11.11345205,1.661706871,"China ",2001-12-11,"European Union",1995-01-01,1,1,NA,NA,NA,NA,NA,NA,6,NA,-7,0,0,1,NA,NA,NA,NA,NA,NA,NA,NA,NA,2006,0,NA,NA,0
"1915",NA,"CHN-AD-123",710,"2006",2,2005,2,710,"Q4_2012","China","CHN-AD-122","USA","USA","Glassine and Other Glazed Transparent or Translucent Papers ","6/13/05","6/16/06","6/16/06","A","A","6/16/06","AVD","12/12/06","12/12/06","A","A","12/13/06","AVD","12/13/11","2011","AVD","4.1","42.8","G/ADP/N/153/CHN",-7,0,0,10,1,1,0.522731473,2.530182767,68.61870494,25.47841227,1,1731.125235,44313.58524,2.26e+12,1.31e+13,37.06949052,10.00656719,12.12302312,1.212483968,"6/13/05",2005-06-13,2005-06-13,NA,NA,2006-06-16,2.71e+12,1.39e+13,39.12622529,10.66900468,70.55319578,26.83956444,2069.34363,46443.8102,11.11345205,1.042895226,"China ",2001-12-11,"United States of America",1995-01-01,1,1,"United States of America",1948-01-01,NA,NA,NA,1,10,10,-7,0,0,1,NA,NA,NA,NA,NA,NA,NA,NA,NA,2006,0,NA,NA,0
"1928",NA,"CHN-AD-135",710,"2006",750,2005,750,710,"Q4_2012","China","CHN-AD-135","India","IND","Octylphenol Nonylphenol and their Isomers and Salts Thereof ","12/29/05","7/10/06","7/10/06","A","A","7/10/06","AVD","3/28/07","3/28/07","A","A","3/29/07","AVD","IF","IF","MI","12.22","20.38","G/ADP/N/158/CHN",-7,0,0,9,1,1,0.522731473,1.267858549,68.61870494,41.30519008,1,1731.125235,740.1142606,2.26e+12,8.34e+11,37.06949052,19.28014883,12.12302312,18.81054342,"12/29/05",2005-12-29,2005-12-29,NA,NA,2006-07-10,2.71e+12,9.49e+11,39.12622529,21.0694752,70.55319578,45.29779299,2069.34363,830.1632213,11.11345205,18.28822509,"China ",2001-12-11,"India ",1995-01-01,1,1,"India",1948-07-08,NA,NA,NA,1,9,9,-7,0,0,1,NA,NA,NA,NA,NA,NA,NA,NA,NA,2007,0,NA,NA,0
"1930",NA,"CHN-AD-137",710,"2006",994,2006,994,710,"Q4_2012","China","CHN-AD-137","European Union","EUN","Potato Starch","2/6/06","8/18/06","8/18/06","A","A","8/18/06","AVD","2/6/07","2/6/07","A","A","2/6/07","AVD","IF","IF","MI","17","35","G/ADP/N/158/CHN",-7,0,0,NA,1,1,0.47626229,1.342145255,70.55319578,78.25337348,1,2069.34363,29651.0928,2.71e+12,1.48e+13,39.12622529,39.39015032,11.11345205,1.661706871,"2/6/06",2006-02-06,2006-02-06,NA,NA,2006-08-18,2.71e+12,1.48e+13,39.12622529,39.39015032,70.55319578,78.25337348,2069.34363,29651.0928,11.11345205,1.661706871,"China ",2001-12-11,"European Union",1995-01-01,1,1,NA,NA,NA,NA,NA,NA,6,NA,-7,0,0,1,NA,NA,NA,NA,NA,NA,NA,NA,NA,2007,0,NA,NA,0
"1931",NA,"CHN-AD-138",710,"2006",740,2006,740,710,"Q4_2012","China","CHN-AD-138","Japan","JPN","Paper for Electrolytic Capacitor","4/18/06","10/19/06","10/19/06","A","A","10/20/06","AVD","4/17/07","4/17/07","A","A","4/18/07","AVD","IF","IF","MI","15","40.83","G/ADP/N/158/CHN",-7,0,0,10,1,1,0.47626229,0.518005765,70.55319578,31.08646956,1,2069.34363,34102.11478,2.71e+12,4.36e+12,39.12622529,16.17160101,11.11345205,1.181368596,"4/18/06",2006-04-18,2006-04-18,NA,NA,2006-10-20,2.71e+12,4.36e+12,39.12622529,16.17160101,70.55319578,31.08646956,2069.34363,34102.11478,11.11345205,1.181368596,"China ",2001-12-11,"Japan ",1995-01-01,1,1,"Japan",1955-09-10,NA,NA,NA,1,10,10,-7,0,0,1,NA,NA,NA,NA,NA,NA,NA,NA,NA,2007,0,NA,NA,0
"1932",NA,"CHN-AD-139",710,"2007",750,2006,750,710,"Q4_2012","China","CHN-AD-139","India","IND","Sulfamethoxazole or Sulphamethoxazole or SMZ","6/16/06","2/1/07","2/1/07","A","A","2/1/07","AVD","6/15/07","6/15/07","A","A","6/16/07","AVD","IF","IF","MI","10.1","37.7","G/ADP/N/158/CHN",-7,0,0,9,1,1,0.47626229,1.717894269,70.55319578,45.29779299,1,2069.34363,830.1632213,2.71e+12,9.49e+11,39.12622529,21.0694752,11.11345205,18.28822509,"6/16/06",2006-06-16,2006-06-16,NA,NA,2007-02-01,3.49e+12,1.24e+12,38.39804741,20.43089434,67.98414918,44.87619241,2651.260119,1068.678519,10.76971034,18.2562719,"China ",2001-12-11,"India ",1995-01-01,1,1,"India",1948-07-08,NA,NA,NA,1,9,9,-7,0,0,1,NA,NA,NA,NA,NA,NA,NA,NA,NA,2007,0,NA,NA,0
"1934",NA,"CHN-AD-140",710,"2007",740,2006,740,710,"Q4_2012","China","CHN-AD-140","Japan","JPN","Bisphenol-A (BPA)","8/30/06","3/21/07","3/21/07","A","A","3/21/07","AVD","8/29/07","8/29/07","A","A","8/30/07","AVD","IF","IF","MI","6.1","37.1","G/ADP/N/166/CHN",-7,0,0,10,1,1,0.47626229,0.518005765,70.55319578,31.08646956,1,2069.34363,34102.11478,2.71e+12,4.36e+12,39.12622529,16.17160101,11.11345205,1.181368596,"8/30/06",2006-08-30,2006-08-30,NA,NA,2007-03-21,3.49e+12,4.36e+12,38.39804741,17.74676437,67.98414918,33.80276473,2651.260119,34095.02343,10.76971034,1.146307523,"China ",2001-12-11,"Japan ",1995-01-01,1,1,"Japan",1955-09-10,NA,NA,NA,1,10,10,-7,0,0,1,NA,NA,NA,NA,NA,NA,NA,NA,NA,2007,0,NA,NA,0
"1935",NA,"CHN-AD-141",710,"2007",830,2006,830,710,"Q4_2012","China","CHN-AD-140","Singapore","SGP","Bisphenol-A (BPA)","8/30/06","3/21/07","3/21/07","A","A","3/21/07","AVD","8/29/07","8/29/07","A","A","8/30/07","AVD","IF","IF","MI","5","37.1","G/ADP/N/166/CHN",-7,0,0,-2,0,1,0.47626229,0.31893595,70.55319578,430.3576128,0,2069.34363,33578.888,2.71e+12,1.48e+11,39.12622529,230.1035195,11.11345205,0.051163833,"8/30/06",2006-08-30,2006-08-30,NA,NA,2007-03-21,3.49e+12,1.8e+11,38.39804741,214.7422782,67.98414918,398.6578055,2651.260119,39223.52995,10.76971034,0.045594963,"China ",2001-12-11,"Singapore ",1995-01-01,1,1,"Singapore",1973-08-20,NA,NA,NA,1,-2,2,-7,0,0,0,NA,NA,NA,NA,NA,NA,NA,NA,NA,2007,0,NA,NA,0
"1936",NA,"CHN-AD-142",710,"2007",732,2006,732,710,"Q4_2012","China","CHN-AD-140","South Korea","KOR","Bisphenol-A (BPA)","8/30/06","3/21/07","3/21/07","A","A","3/21/07","AVD","8/29/07","8/29/07","A","A","8/30/07","AVD","IF","IF","MI","5.8","37.1","G/ADP/N/166/CHN",-7,0,0,8,1,1,0.47626229,0.727337087,70.55319578,73.55135,1,2069.34363,20917.04119,2.71e+12,1.01e+12,39.12622529,37.16626369,11.11345205,2.988785897,"8/30/06",2006-08-30,2006-08-30,NA,NA,2007-03-21,3.49e+12,1.12e+12,38.39804741,39.18467708,67.98414918,77.24301702,2651.260119,23101.4431,10.76971034,2.709264967,"China ",2001-12-11,"South Korea",1995-01-01,1,1,"South Korea",1967-04-14,NA,NA,NA,1,8,8,-7,0,0,1,NA,NA,NA,NA,NA,NA,NA,NA,NA,2007,0,NA,NA,0
"1938",NA,"CHN-AD-144",710,"2007",740,2006,740,710,"Q4_2012","China","CHN-AD-144","Japan","JPN","Methyl Ethyl Ketone (MEK) or Butanone or 2-Butanone","11/22/06","8/8/07","8/8/07","A","A","8/8/07","AVD","11/21/07","11/21/07","A","A","11/22/07","AVD","IF","IF","MI","9.6","66.4","G/ADP/N/166/CHN",-7,0,0,10,1,1,0.47626229,0.518005765,70.55319578,31.08646956,1,2069.34363,34102.11478,2.71e+12,4.36e+12,39.12622529,16.17160101,11.11345205,1.181368596,"11/22/06",2006-11-22,2006-11-22,NA,NA,2007-08-08,3.49e+12,4.36e+12,38.39804741,17.74676437,67.98414918,33.80276473,2651.260119,34095.02343,10.76971034,1.146307523,"China ",2001-12-11,"Japan ",1995-01-01,1,1,"Japan",1955-09-10,NA,NA,NA,1,10,10,-7,0,0,1,NA,NA,NA,NA,NA,NA,NA,NA,NA,2007,0,NA,NA,0
"1940",NA,"CHN-AD-146",710,"2007",830,2006,830,710,"Q4_2012","China","CHN-AD-144","Singapore","SGP","Methyl Ethyl Ketone (MEK) or Butanone or 2-Butanone","11/22/06","8/8/07","8/8/07","A","A","8/10/07","AVD","11/21/07","11/21/07","A","A","11/22/07","AVD","11/21/12","2012","MI","17","17","G/ADP/N/166/CHN",-7,0,0,-2,0,1,0.47626229,0.31893595,70.55319578,430.3576128,0,2069.34363,33578.888,2.71e+12,1.48e+11,39.12622529,230.1035195,11.11345205,0.051163833,"11/22/06",2006-11-22,2006-11-22,NA,NA,2007-08-10,3.49e+12,1.8e+11,38.39804741,214.7422782,67.98414918,398.6578055,2651.260119,39223.52995,10.76971034,0.045594963,"China ",2001-12-11,"Singapore ",1995-01-01,1,1,"Singapore",1973-08-20,NA,NA,NA,1,-2,2,-7,0,0,0,NA,NA,NA,NA,NA,NA,NA,NA,NA,2007,0,NA,NA,0
"1941",NA,"CHN-AD-147",710,"2007",740,2007,740,710,"Q4_2012","China","CHN-AD-147","Japan","JPN","Acetone/Dimethyl Ketone or 2-Propanone ","3/9/07","11/22/07","11/22/07","A","A","11/23/07","AVD","6/10/08","6/10/08","A","A","6/9/08","AVD","IF","IF","MI","7.2","51.6","G/ADP/N/173/CHN",-7,0,0,10,1,1,0.458951894,0.553468186,67.98414918,33.80276473,1,2651.260119,34095.02343,3.49e+12,4.36e+12,38.39804741,17.74676437,10.76971034,1.146307523,"3/9/07",2007-03-09,2007-03-09,NA,NA,2007-11-23,3.49e+12,4.36e+12,38.39804741,17.74676437,67.98414918,33.80276473,2651.260119,34095.02343,10.76971034,1.146307523,"China ",2001-12-11,"Japan ",1995-01-01,1,1,"Japan",1955-09-10,NA,NA,NA,1,10,10,-7,0,0,1,NA,NA,NA,NA,NA,NA,NA,NA,NA,2008,0,NA,NA,0
"1942",NA,"CHN-AD-148",710,"2007",830,2007,830,710,"Q4_2012","China","CHN-AD-147","Singapore","SGP","Acetone/Dimethyl Ketone or 2-Propanone ","3/9/07","11/22/07","11/22/07","A","A","11/23/07","AVD","6/10/08","6/10/08","A","A","6/9/08","AVD","IF","IF","MI","6.7","51.6","G/ADP/N/173/CHN",-7,0,0,-2,0,1,0.458951894,0.287280671,67.98414918,398.6578055,0,2651.260119,39223.52995,3.49e+12,1.8e+11,38.39804741,214.7422782,10.76971034,0.045594963,"3/9/07",2007-03-09,2007-03-09,NA,NA,2007-11-23,3.49e+12,1.8e+11,38.39804741,214.7422782,67.98414918,398.6578055,2651.260119,39223.52995,10.76971034,0.045594963,"China ",2001-12-11,"Singapore ",1995-01-01,1,1,"Singapore",1973-08-20,NA,NA,NA,1,-2,2,-7,0,0,0,NA,NA,NA,NA,NA,NA,NA,NA,NA,2008,0,NA,NA,0
"1943",NA,"CHN-AD-149",710,"2007",732,2007,732,710,"Q4_2012","China","CHN-AD-147","South Korea","KOR","Acetone/Dimethyl Ketone or 2-Propanone ","3/9/07","11/22/07","11/22/07","A","A","11/23/07","AVD","6/10/08","6/10/08","A","A","6/9/08","AVD","IF","IF","MI","5","51.6","G/ADP/N/173/CHN",-7,0,0,8,1,1,0.458951894,0.795338636,67.98414918,77.24301702,1,2651.260119,23101.4431,3.49e+12,1.12e+12,38.39804741,39.18467708,10.76971034,2.709264967,"3/9/07",2007-03-09,2007-03-09,NA,NA,2007-11-23,3.49e+12,1.12e+12,38.39804741,39.18467708,67.98414918,77.24301702,2651.260119,23101.4431,10.76971034,2.709264967,"China ",2001-12-11,"South Korea",1995-01-01,1,1,"South Korea",1967-04-14,NA,NA,NA,1,8,8,-7,0,0,1,NA,NA,NA,NA,NA,NA,NA,NA,NA,2008,0,NA,NA,0
"1946",NA,"CHN-AD-151",710,"2008",732,2008,732,710,"Q4_2012","China","CHN-AD-151","South Korea","KOR","Dimethyl Cyclosiloxane or Cyclic Dimethyl Siloxane","5/28/08","11/6/08","11/6/08","A","A","11/7/08","AVD","6/2/09","6/2/09","A","A","5/28/09","AVD","IF","IF","MI","25.1","25.1","G/ADP/N/188/CHN",-7,0,0,8,1,1,0.434411564,0.871876867,62.24882112,99.93354412,1,3413.588648,20474.82554,4.52e+12,1e+12,34.9816182,49.96140308,10.7315685,2.507685263,"5/28/08",2008-05-28,2008-05-28,NA,NA,2008-11-07,4.52e+12,1e+12,34.9816182,49.96140308,62.24882112,99.93354412,3413.588648,20474.82554,10.7315685,2.507685263,"China ",2001-12-11,"South Korea",1995-01-01,1,1,"South Korea",1967-04-14,NA,NA,NA,1,8,8,-7,0,0,1,NA,NA,NA,NA,NA,NA,NA,NA,NA,2009,0,NA,NA,0
"1947",NA,"CHN-AD-152",710,"2008",800,2008,800,710,"Q4_2012","China","CHN-AD-151","Thailand","THA","Dimethyl Cyclosiloxane or Cyclic Dimethyl Siloxane","5/28/08","11/6/08","11/6/08","A","A","11/7/08","AVD","6/2/09","6/2/09","A","A","5/29/09","AVD","IF","IF","MI","5.4","21.8","G/ADP/N/188/CHN",-7,0,0,4,0,1,0.434411564,4.798852666,62.24882112,150.3260626,1,3413.588648,4118.401435,4.52e+12,2.73e+11,34.9816182,76.44460097,10.7315685,11.56045295,"5/28/08",2008-05-28,2008-05-28,NA,NA,2008-11-07,4.52e+12,2.73e+11,34.9816182,76.44460097,62.24882112,150.3260626,3413.588648,4118.401435,10.7315685,11.56045295,"China ",2001-12-11,"Thailand ",1995-01-01,1,1,"Thailand",1982-11-20,NA,NA,NA,1,4,5,-7,0,0,0,NA,NA,NA,NA,NA,NA,NA,NA,NA,2009,0,NA,NA,0
"1949",NA,"CHN-AD-154",710,"2009",670,2008,670,710,"Q4_2012","China","CHN-AD-154","Saudi Arabia","SAU","1.4-Butanediol or BDO","9/25/08","5/7/09","5/7/09","A","A","5/6/09","AVD","12/24/09","12/24/09","A","A","12/25/09","AVD","IF","IF","MI","4.5","13.6","G/ADP/N/195/CHN",-7,0,0,-10,0,1,0.434411564,NA,62.24882112,96.10263087,0,3413.588648,19714.39514,4.52e+12,5.2e+11,34.9816182,62.11150203,10.7315685,2.316854073,"9/25/08",2008-09-25,2008-09-25,NA,NA,2009-05-06,4.99e+12,4.29e+11,26.71609478,47.08862065,49.0212234,84.85834156,3748.504063,16013.2804,10.3331503,2.854111914,"China ",2001-12-11,"Saudia Arabia",2005-12-11,1,1,NA,NA,NA,NA,NA,NA,-10,0,-7,0,0,0,NA,NA,NA,NA,NA,NA,NA,NA,NA,2009,0,NA,NA,0
"1951",NA,"CHN-AD-156",710,"2009",732,2008,732,710,"Q4_2012","China","CHN-AD-156","South Korea","KOR","Adipic Acid or AA","11/10/08","6/26/09","6/26/09","A","A","6/27/09","AVD","11/1/09","11/1/09","A","A","11/2/09","AVD","IF","IF","MI","5","16.7","G/ADP/N/195/CHN",-7,0,0,8,1,1,0.434411564,0.871876867,62.24882112,99.93354412,1,3413.588648,20474.82554,4.52e+12,1e+12,34.9816182,49.96140308,10.7315685,2.507685263,"11/10/08",2008-11-10,2008-11-10,NA,NA,2009-06-27,4.99e+12,9.02e+11,26.71609478,47.54976045,49.0212234,90.41263765,3748.504063,18338.70637,10.3331503,2.588004295,"China ",2001-12-11,"South Korea",1995-01-01,1,1,"South Korea",1967-04-14,NA,NA,NA,1,8,8,-7,0,0,1,NA,NA,NA,NA,NA,NA,NA,NA,NA,2009,0,NA,NA,0
"1952",NA,"CHN-AD-157",710,"2009",994,2008,994,710,"Q4_2012","China","CHN-AD-156","European Union","EUN","Adipic Acid or AA","11/10/08","6/26/09","6/26/09","A","A","6/27/09","AVD","11/1/09","11/1/09","A","A","11/2/09","AVD","IF","IF","MI","7.4","16.7","G/ADP/N/195/CHN",-7,0,0,NA,1,1,0.434411564,1.244473311,62.24882112,81.02271452,1,3413.588648,36612.36658,4.52e+12,1.84e+13,34.9816182,40.70362268,10.7315685,1.634080761,"11/10/08",2008-11-10,2008-11-10,NA,NA,2009-06-27,4.99e+12,1.64e+13,26.71609478,36.38564241,49.0212234,71.79250782,3748.504063,32598.4594,10.3331503,1.471584494,"China ",2001-12-11,"European Union",1995-01-01,1,1,NA,NA,NA,NA,NA,NA,6,NA,-7,0,0,1,NA,NA,NA,NA,NA,NA,NA,NA,NA,2009,0,NA,NA,0
"1953",NA,"CHN-AD-158",710,"2009",2,2008,2,710,"Q4_2012","China","CHN-AD-156","USA","USA","Adipic Acid or AA","11/10/08","6/26/09","6/26/09","A","A","6/27/09","AVD","11/1/09","11/1/09","A","A","11/2/09","AVD","IF","IF","MI","16.8","35.4","G/ADP/N/195/CHN",-7,0,0,10,1,1,0.434411564,2.287331158,62.24882112,29.88729849,1,3413.588648,48407.07691,4.52e+12,1.47e+13,34.9816182,12.5208046,10.7315685,1.220378431,"11/10/08",2008-11-10,2008-11-10,NA,NA,2009-06-27,4.99e+12,1.44e+13,26.71609478,10.9849562,49.0212234,24.69014212,3748.504063,46998.82042,10.3331503,1.11946068,"China ",2001-12-11,"United States of America",1995-01-01,1,1,"United States of America",1948-01-01,NA,NA,NA,1,10,10,-7,0,0,1,NA,NA,NA,NA,NA,NA,NA,NA,NA,2009,0,NA,NA,0
"1954",NA,"CHN-AD-159",710,"2009",2,2008,2,710,"Q4_2012","China","CHN-AD-159","USA","USA","Polyamide-6.6","11/17/08","6/25/09","6/25/09","A","A","6/26/09","AVD","10/12/09","10/12/09","A","A","10/13/09","AVD","IF","IF","MI","25.2","37.5","G/ADP/N/195/CHN",-7,0,0,10,1,1,0.434411564,2.287331158,62.24882112,29.88729849,1,3413.588648,48407.07691,4.52e+12,1.47e+13,34.9816182,12.5208046,10.7315685,1.220378431,"11/17/08",2008-11-17,2008-11-17,NA,NA,2009-06-26,4.99e+12,1.44e+13,26.71609478,10.9849562,49.0212234,24.69014212,3748.504063,46998.82042,10.3331503,1.11946068,"China ",2001-12-11,"United States of America",1995-01-01,1,1,"United States of America",1948-01-01,NA,NA,NA,1,10,10,-7,0,0,1,NA,NA,NA,NA,NA,NA,NA,NA,NA,2009,0,NA,NA,0
"1956",NA,"CHN-AD-160",710,"2009",325,2008,325,710,"Q4_2012","China","CHN-AD-159","Italy","ITA","Polyamide-6.6","11/17/08","6/25/09","6/25/09","A","A","6/26/09","AVD","10/12/09","10/12/09","A","A","10/13/09","AVD","IF","IF","MI","5.3","20.9","G/ADP/N/195/CHN",-7,0,0,10,1,1,0.434411564,0.592932588,62.24882112,57.74456006,1,3413.588648,39222.17723,4.52e+12,2.31e+12,34.9816182,28.45625136,10.7315685,2.035359894,"11/17/08",2008-11-17,2008-11-17,NA,NA,2009-06-26,4.99e+12,2.11e+12,26.71609478,23.74686845,49.0212234,48.02455389,3748.504063,35724.4084,10.3331503,1.92270754,"China ",2001-12-11,"Italy ",1995-01-01,1,1,"Italy",1950-05-30,NA,NA,NA,1,10,10,-7,0,0,1,NA,NA,NA,NA,NA,NA,NA,NA,NA,2009,0,NA,NA,0
"1957",NA,"CHN-AD-161",710,"2009",200,2008,200,710,"Q4_2012","China","CHN-AD-159","UK","GBR","Polyamide-6.6","11/17/08","6/25/09","6/25/09","A","A","6/26/09","AVD","10/12/09","10/12/09","A","A","10/13/09","AVD","IF","IF","MI","20.9","20.9","G/ADP/N/195/CHN",-7,0,0,10,1,1,0.434411564,0.659899092,62.24882112,61.01540966,1,3413.588648,43486.91323,4.52e+12,2.69e+12,34.9816182,29.39380467,10.7315685,0.693081078,"11/17/08",2008-11-17,2008-11-17,NA,NA,2009-06-26,4.99e+12,2.21e+12,26.71609478,28.37467431,49.0212234,58.39840153,3748.504063,35454.94893,10.3331503,0.577304159,"China ",2001-12-11,"United Kingdom",1995-01-01,1,1,"United Kingdom",1948-01-01,NA,NA,NA,1,10,10,-7,0,0,1,NA,NA,NA,NA,NA,NA,NA,NA,NA,2009,0,NA,NA,0
"1958",NA,"CHN-AD-162",710,"2009",220,2008,220,710,"Q4_2012","China","CHN-AD-159","France","FRA","Polyamide-6.6","11/17/08","6/25/09","6/25/09","A","A","6/26/09","AVD","10/12/09","10/12/09","A","A","10/13/09","AVD","IF","IF","MI","20.9","20.9","G/ADP/N/195/CHN",-7,0,0,9,1,1,0.434411564,0.823376135,62.24882112,56.00247259,1,3413.588648,43991.71814,4.52e+12,2.83e+12,34.9816182,26.94885927,10.7315685,1.77847336,"11/17/08",2008-11-17,2008-11-17,NA,NA,2009-06-26,4.99e+12,2.62e+12,26.71609478,23.36894933,49.0212234,48.56506358,3748.504063,40487.89707,10.3331503,1.538682376,"China ",2001-12-11,"France ",1995-01-01,1,1,"France",1948-01-01,NA,NA,NA,1,9,9,-7,0,0,1,NA,NA,NA,NA,NA,NA,NA,NA,NA,2009,0,NA,NA,0
"1960",NA,"IND-AD-122",750,"2000",732,1999,732,750,"Q4_2012","India","IND-AD-121","South Korea","KOR","Oxo Alcohols","7/29/99","12/3/99","12/3/99","A","A","1/27/00","SD","7/17/00","7/17/00","A","A","8/18/00","SD","2/26/04","2004","MI","140.19","140.19","G/ADP/N/72/IND",9,9,1,8,1,1,1.418164643,1.002573,24.38790891,65.43023242,1,455.4735407,10432.2108,4.67e+11,4.86e+11,11.25469183,35.77703363,24.50227807,4.75889537,"7/29/99",1999-07-29,1999-07-29,519,497,2000-01-27,4.77e+11,5.62e+11,12.77323297,35.0088675,26.43729384,67.94720274,457.2835418,11947.57725,23.02185278,4.392899263,"India ",1995-01-01,"South Korea",1995-01-01,1,1,"South Korea",1967-04-14,"India",1948-07-08,1,1,8,8,9,9,1,1,NA,NA,NA,NA,NA,NA,NA,NA,NA,2000,0,NA,NA,0
"1961",NA,"CHN-AD-165",710,"2010",732,2009,732,710,"Q4_2012","China","CHN-AD-165","South Korea","KOR","Terephthalic Acid","2/12/09","2/2/10","2/2/10","A","A","2/3/10","AVD","8/12/10","8/12/10","A","A","8/12/10","AVD","IF","IF","AVD","2","11.2","G/ADP/N/209/CHN",-7,0,0,8,1,1,0.448398182,0.839089353,49.0212234,90.41263765,1,3748.504063,18338.70637,4.99e+12,9.02e+11,26.71609478,47.54976045,10.3331503,2.588004295,"2/12/09",2009-02-12,2009-02-12,NA,NA,2010-02-03,5.93e+12,1.09e+12,29.396777,49.41949312,55.03337471,95.65409371,4433.340886,22151.20912,10.09522,2.471120816,"China ",2001-12-11,"South Korea",1995-01-01,1,1,"South Korea",1967-04-14,NA,NA,NA,1,8,8,-7,0,0,1,NA,NA,NA,NA,NA,NA,NA,NA,NA,2010,0,NA,NA,0
"1962",NA,"CHN-AD-166",710,"2010",800,2009,800,710,"Q4_2012","China","CHN-AD-165","Thailand","THA","Terephthalic Acid","2/12/09","2/2/10","2/2/10","A","A","2/3/10","AVD","8/12/10","8/12/10","A","A","8/12/10","AVD","IF","IF","AVD","6","20.1","G/ADP/N/209/CHN",-7,0,0,4,0,1,0.448398182,3.927129679,49.0212234,126.1573153,1,3748.504063,3978.905381,4.99e+12,2.64e+11,26.71609478,68.35167993,10.3331503,11.46469229,"2/12/09",2009-02-12,2009-02-12,NA,NA,2010-02-03,5.93e+12,3.19e+11,29.396777,71.28576548,55.03337471,135.1415428,4433.340886,4802.662758,10.09522,12.38821549,"China ",2001-12-11,"Thailand ",1995-01-01,1,1,"Thailand",1982-11-20,NA,NA,NA,1,4,5,-7,0,0,0,NA,NA,NA,NA,NA,NA,NA,NA,NA,2010,0,NA,NA,0
"1963",NA,"CHN-AD-167",710,"2010",850,2009,850,710,"Q4_2012","China","CHN-AD-167","Indonesia","IDN","Disodium 5'-Inosinate/Disodium 5'-Guanylate/Disodium 5'-Ribonucleotide","3/24/09","1/4/10","1/4/10","A","A","1/5/10","AVD","9/21/10","9/21/10","A","A","9/24/10","AVD","IF","IF","AVD","6.3","29.7","G/ADP/N/209/CHN",-7,0,0,8,1,1,0.448398182,4.526482788,49.0212234,45.51212137,1,3748.504063,2272.040982,4.99e+12,5.4e+11,26.71609478,24.15911967,10.3331503,15.29014815,"3/24/09",2009-03-24,2009-03-24,NA,NA,2010-01-05,5.93e+12,7.09e+11,29.396777,24.58058328,55.03337471,47.48510044,4433.340886,2946.656061,10.09522,15.28607319,"China ",2001-12-11,"Indonesia ",1995-01-01,1,1,"Indonesia",1950-02-24,NA,NA,NA,1,8,8,-7,0,0,1,NA,NA,NA,NA,NA,NA,NA,NA,NA,2010,0,NA,NA,0
"1964",NA,"CHN-AD-168",710,"2010",800,2009,800,710,"Q4_2012","China","CHN-AD-167","Thailand","THA","Disodium 5'-Inosinate/Disodium 5'-Guanylate/Disodium 5'-Ribonucleotide","3/24/09","1/4/10","1/4/10","A","A","1/5/10","AVD","9/21/10","9/21/10","A","A","9/24/10","AVD","IF","IF","AVD","4.8","29.7","G/ADP/N/209/CHN",-7,0,0,4,0,1,0.448398182,3.927129679,49.0212234,126.1573153,1,3748.504063,3978.905381,4.99e+12,2.64e+11,26.71609478,68.35167993,10.3331503,11.46469229,"3/24/09",2009-03-24,2009-03-24,NA,NA,2010-01-05,5.93e+12,3.19e+11,29.396777,71.28576548,55.03337471,135.1415428,4433.340886,4802.662758,10.09522,12.38821549,"China ",2001-12-11,"Thailand ",1995-01-01,1,1,"Thailand",1982-11-20,NA,NA,NA,1,4,5,-7,0,0,0,NA,NA,NA,NA,NA,NA,NA,NA,NA,2010,0,NA,NA,0
"1965",NA,"CHN-AD-169",710,"2009",2,2009,2,710,"Q4_2012","China","CHN-AD-169","USA","USA","Polycaprolactam/Polyamide-6 (PA6)/Nylon6 ","4/29/09","10/19/09","10/19/09","A","A","10/20/09","AVD","4/21/10","4/21/10","A","A","4/22/10","AVD","IF","IF","AVD","29.3","96.5","G/ADP/N/202/CHN",-7,0,0,10,1,1,0.448398182,2.312438916,49.0212234,24.69014212,1,3748.504063,46998.82042,4.99e+12,1.44e+13,26.71609478,10.9849562,10.3331503,1.11946068,"4/29/09",2009-04-29,2009-04-29,NA,NA,2009-10-20,4.99e+12,1.44e+13,26.71609478,10.9849562,49.0212234,24.69014212,3748.504063,46998.82042,10.3331503,1.11946068,"China ",2001-12-11,"United States of America",1995-01-01,1,1,"United States of America",1948-01-01,NA,NA,NA,1,10,10,-7,0,0,1,NA,NA,NA,NA,NA,NA,NA,NA,NA,2010,0,NA,NA,0
"1967",NA,"CHN-AD-170",710,"2009",994,2009,994,710,"Q4_2012","China","CHN-AD-169","European Union","EUN","Polycaprolactam/Polyamide-6 (PA6)/Nylon6 ","4/29/09","10/19/09","10/19/09","A","A","10/20/09","AVD","4/21/10","4/21/10","A","A","4/22/10","AVD","IF","IF","AVD","8","23.9","G/ADP/N/202/CHN",-7,0,0,NA,1,1,0.448398182,1.305923646,49.0212234,71.79250782,1,3748.504063,32598.4594,4.99e+12,1.64e+13,26.71609478,36.38564241,10.3331503,1.471584494,"4/29/09",2009-04-29,2009-04-29,NA,NA,2009-10-20,4.99e+12,1.64e+13,26.71609478,36.38564241,49.0212234,71.79250782,3748.504063,32598.4594,10.3331503,1.471584494,"China ",2001-12-11,"European Union",1995-01-01,1,1,NA,NA,NA,NA,NA,NA,6,NA,-7,0,0,1,NA,NA,NA,NA,NA,NA,NA,NA,NA,2010,0,NA,NA,0
"1973",NA,"CHN-AD-176",710,"2010",820,2009,820,710,"Q4_2012","China","CHN-AD-175","Malaysia","MYS","Methanol or Methyl Alcohol","6/24/09","10/25/10","10/25/10","A","A","10/28/10","AVD","12/23/10","12/23/10","A","A",".",".",".",".",".",".",".",".",-7,0,0,6,1,1,0.448398182,2.049225758,49.0212234,162.5591107,0,3748.504063,7277.762756,4.99e+12,2.02e+11,26.71609478,91.41679187,10.3331503,9.219100044,"6/24/09",2009-06-24,2009-06-24,NA,NA,2010-10-28,5.93e+12,2.48e+11,29.396777,93.31616765,55.03337471,169.662259,4433.340886,8754.24282,10.09522,10.36136993,"China ",2001-12-11,"Malaysia ",1995-01-01,1,1,"Malaysia",1957-10-24,NA,NA,NA,1,6,6,-7,0,0,1,NA,NA,NA,NA,NA,NA,NA,NA,NA,NA,0,NA,NA,0
"1974",NA,"CHN-AD-177",710,"2010",850,2009,850,710,"Q4_2012","China","CHN-AD-175","Indonesia","IDN","Methanol or Methyl Alcohol","6/24/09","10/25/10","10/25/10","A","A","10/28/10","AVD","12/23/10","12/23/10","A","A",".",".",".",".",".",".",".",".",-7,0,0,8,1,1,0.448398182,4.526482788,49.0212234,45.51212137,1,3748.504063,2272.040982,4.99e+12,5.4e+11,26.71609478,24.15911967,10.3331503,15.29014815,"6/24/09",2009-06-24,2009-06-24,NA,NA,2010-10-28,5.93e+12,7.09e+11,29.396777,24.58058328,55.03337471,47.48510044,4433.340886,2946.656061,10.09522,15.28607319,"China ",2001-12-11,"Indonesia ",1995-01-01,1,1,"Indonesia",1950-02-24,NA,NA,NA,1,8,8,-7,0,0,1,NA,NA,NA,NA,NA,NA,NA,NA,NA,NA,0,NA,NA,0
"1975",NA,"CHN-AD-178",710,"2010",920,2009,920,710,"Q4_2012","China","CHN-AD-175","New Zealand","NZL","Methanol or Methyl Alcohol","6/24/09","10/25/10","10/25/10","A","A","10/28/10","AVD","12/23/10","12/23/10","A","A",".",".",".",".",".",".",".",".",-7,0,0,10,1,1,0.448398182,9.904709153,49.0212234,56.24878564,0,3748.504063,27562.19055,4.99e+12,1.19e+11,26.71609478,29.32168945,10.3331503,6.279877064,"6/24/09",2009-06-24,2009-06-24,NA,NA,2010-10-28,5.93e+12,1.43e+11,29.396777,30.92040501,55.03337471,59.48480222,4433.340886,32846.45443,10.09522,7.181084289,"China ",2001-12-11,"New Zealand",1995-01-01,1,1,"New Zealand",1948-07-30,NA,NA,NA,1,10,10,-7,0,0,1,NA,NA,NA,NA,NA,NA,NA,NA,NA,NA,0,NA,NA,0
"1980",NA,"CHN-AD-182",710,"2011",2,2010,2,710,"Q4_2012","China","CHN-AD-182","USA","USA","Dispersion Unshifted Single-Mode Optical Fiber","4/22/10","2/9/11","2/9/11","A","A","2/18/11","AVD","4/21/11","4/21/11","A","A","4/22/11","AVD","IF","IF","AVD","4.7","18.6","G/ADP/N/216/CHN",-7,0,0,10,1,1,0.456645176,2.632230719,55.03337471,28.11482588,1,4433.340886,48357.67357,5.93e+12,1.5e+13,29.396777,12.32426145,10.09522,1.192126008,"4/22/10",2010-04-22,2010-04-22,NA,NA,2011-02-18,7.32e+12,1.55e+13,28.53028081,13.52598849,54.57721811,30.71366955,5447.309378,49854.52267,10.03716006,1.24542282,"China ",2001-12-11,"United States of America",1995-01-01,1,1,"United States of America",1948-01-01,NA,NA,NA,1,10,10,-7,0,0,1,NA,NA,NA,NA,NA,NA,NA,NA,NA,2011,0,NA,NA,0
"1981",NA,"CHN-AD-183",710,"2011",994,2010,994,710,"Q4_2012","China","CHN-AD-182","European Union","EUN","Dispersion Unshifted Single-Mode Optical Fiber","4/22/10","2/9/11","2/9/11","A","A","2/18/11","AVD","4/21/11","4/21/11","A","A","4/22/11","AVD","IF","IF","AVD","12.9","29.1","G/ADP/N/216/CHN",-7,0,0,NA,1,1,0.456645176,1.411250369,55.03337471,79.50970156,1,4433.340886,32380.82708,5.93e+12,1.63e+13,29.396777,40.19162968,10.09522,1.587467526,"4/22/10",2010-04-22,2010-04-22,NA,NA,2011-02-18,7.32e+12,1.77e+13,28.53028081,42.90363901,54.57721811,84.8037816,5447.309378,34920.11178,10.03716006,1.543159494,"China ",2001-12-11,"European Union",1995-01-01,1,1,NA,NA,NA,NA,NA,NA,6,NA,-7,0,0,1,NA,NA,NA,NA,NA,NA,NA,NA,NA,2011,0,NA,NA,0
"1982",NA,"CHN-AD-184",710,"2011",994,2010,994,710,"Q4_2012","China","CHN-AD-184","European Union","EUN","Caprolactam","4/22/10","1/24/11","1/24/11","A","A","1/25/11","AVD","10/18/11","10/18/11","A","A","10/22/11","AVD","IF","IF","AVD","2.3","25.5","G/ADP/N/223/CHN",-7,0,0,NA,1,1,0.456645176,1.411250369,55.03337471,79.50970156,1,4433.340886,32380.82708,5.93e+12,1.63e+13,29.396777,40.19162968,10.09522,1.587467526,"4/22/10",2010-04-22,2010-04-22,NA,NA,2011-01-25,7.32e+12,1.77e+13,28.53028081,42.90363901,54.57721811,84.8037816,5447.309378,34920.11178,10.03716006,1.543159494,"China ",2001-12-11,"European Union",1995-01-01,1,1,NA,NA,NA,NA,NA,NA,6,NA,-7,0,0,1,NA,NA,NA,NA,NA,NA,NA,NA,NA,2011,0,NA,NA,0
"1983",NA,"CHN-AD-185",710,"2011",2,2010,2,710,"Q4_2012","China","CHN-AD-184","USA","USA","Caprolactam","4/22/10","1/24/11","1/24/11","A","A","1/25/11","AVD","10/18/11","10/18/11","A","A","10/22/11","AVD","IF","IF","AVD","2.2","24.2","G/ADP/N/223/CHN",-7,0,0,10,1,1,0.456645176,2.632230719,55.03337471,28.11482588,1,4433.340886,48357.67357,5.93e+12,1.5e+13,29.396777,12.32426145,10.09522,1.192126008,"4/22/10",2010-04-22,2010-04-22,NA,NA,2011-01-25,7.32e+12,1.55e+13,28.53028081,13.52598849,54.57721811,30.71366955,5447.309378,49854.52267,10.03716006,1.24542282,"China ",2001-12-11,"United States of America",1995-01-01,1,1,"United States of America",1948-01-01,NA,NA,NA,1,10,10,-7,0,0,1,NA,NA,NA,NA,NA,NA,NA,NA,NA,2011,0,NA,NA,0
"1984",NA,"CHN-AD-186",710,"2011",994,2010,994,710,"Q4_2012","China","CHN-AD-186","European Union","EUN","Photographic Paper and Paper Board","12/23/10","8/10/11","8/10/11","A","A","8/10/11","AVD","3/22/12","3/22/12","A","A","3/23/12","AVD","IF","IF","AVD","17.5","19.4","G/ADP/N/230/CHN",-7,0,0,NA,1,1,0.456645176,1.411250369,55.03337471,79.50970156,1,4433.340886,32380.82708,5.93e+12,1.63e+13,29.396777,40.19162968,10.09522,1.587467526,"12/23/10",2010-12-23,2010-12-23,NA,NA,2011-08-10,7.32e+12,1.77e+13,28.53028081,42.90363901,54.57721811,84.8037816,5447.309378,34920.11178,10.03716006,1.543159494,"China ",2001-12-11,"European Union",1995-01-01,1,1,NA,NA,NA,NA,NA,NA,6,NA,-7,0,0,1,NA,NA,NA,NA,NA,NA,NA,NA,NA,2012,0,NA,NA,0
"1985",NA,"CHN-AD-187",710,"2011",2,2010,2,710,"Q4_2012","China","CHN-AD-186","USA","USA","Photographic Paper and Paper Board","12/23/10","8/10/11","8/10/11","A","A","8/10/11","AVD","3/22/12","3/22/12","A","A","3/23/12","AVD","IF","IF","AVD","16.2","28.8","G/ADP/N/230/CHN",-7,0,0,10,1,1,0.456645176,2.632230719,55.03337471,28.11482588,1,4433.340886,48357.67357,5.93e+12,1.5e+13,29.396777,12.32426145,10.09522,1.192126008,"12/23/10",2010-12-23,2010-12-23,NA,NA,2011-08-10,7.32e+12,1.55e+13,28.53028081,13.52598849,54.57721811,30.71366955,5447.309378,49854.52267,10.03716006,1.24542282,"China ",2001-12-11,"United States of America",1995-01-01,1,1,"United States of America",1948-01-01,NA,NA,NA,1,10,10,-7,0,0,1,NA,NA,NA,NA,NA,NA,NA,NA,NA,2012,0,NA,NA,0
"1986",NA,"CHN-AD-188",710,"2011",740,2010,740,710,"Q4_2012","China","CHN-AD-186","Japan","JPN","Photographic Paper and Paper Board","12/23/10","8/10/11","8/10/11","A","A","8/10/11","AVD","3/22/12","3/22/12","A","A","3/23/12","AVD","IF","IF","AVD","28.8","28.8","G/ADP/N/230/CHN",-7,0,0,10,1,1,0.456645176,0.708225469,55.03337471,29.14723196,1,4433.340886,43117.82967,5.93e+12,5.5e+12,29.396777,15.17099226,10.09522,1.177928769,"12/23/10",2010-12-23,2010-12-23,NA,NA,2011-08-10,7.32e+12,5.91e+12,28.53028081,15.1275549,54.57721811,31.1619424,5447.309378,46203.69804,10.03716006,1.158421513,"China ",2001-12-11,"Japan ",1995-01-01,1,1,"Japan",1955-09-10,NA,NA,NA,1,10,10,-7,0,0,1,NA,NA,NA,NA,NA,NA,NA,NA,NA,2012,0,NA,NA,0
"1991",NA,"CHN-AD-192",710,"2012",2,2011,2,710,"Q4_2012","China","CHN-AD-192","USA","USA","Ethylene Glycol Monobutyl Ether and Diethylene Glycol Monobutyl Ether","11/18/11","7/27/12","7/27/12","A","A","7/28/12","AVD","MI","MI","MI","MI","MI","MI","MI","MI","MI","MI","MI","MI",-7,0,0,10,1,1,0.533552859,2.801760143,54.57721811,30.71366955,1,5447.309378,49854.52267,7.32e+12,1.55e+13,28.53028081,13.52598849,10.03716006,1.24542282,"11/18/11",2011-11-18,2011-11-18,NA,NA,2012-07-28,8.23e+12,1.62e+13,27.32111234,13.51772281,51.82489065,30.40394962,6092.781886,51755.21484,10.08212511,NA,"China ",2001-12-11,"United States of America",1995-01-01,1,1,"United States of America",1948-01-01,NA,NA,NA,1,10,10,-7,0,0,1,NA,NA,NA,NA,NA,NA,NA,NA,NA,NA,0,NA,NA,0
"1994",NA,"CHN-AD-195",710,"2012",740,2012,740,710,"Q4_2012","China","CHN-AD-195","Japan","JPN","Resorcinol","3/23/12","11/23/12","11/23/12","A","A","11/23/12","AVD","MI","MI","MI","MI","MI","MI","MI","MI","MI","MI","MI","MI",-7,0,0,10,1,1,0.461590928,0.795654974,51.82489065,31.43488784,1,6092.781886,46548.26964,8.23e+12,5.94e+12,27.32111234,14.72734752,10.08212511,1.217299715,"3/23/12",2012-03-23,2012-03-23,NA,NA,2012-11-23,8.23e+12,5.94e+12,27.32111234,14.72734752,51.82489065,31.43488784,6092.781886,46548.26964,10.08212511,1.217299715,"China ",2001-12-11,"Japan ",1995-01-01,1,1,"Japan",1955-09-10,NA,NA,NA,1,10,10,-7,0,0,1,NA,NA,NA,NA,NA,NA,NA,NA,NA,NA,0,NA,NA,0
"1995",NA,"CHN-AD-196",710,"2012",2,2012,2,710,"Q4_2012","China","CHN-AD-195","USA","USA","Resorcinol","3/23/12","11/23/12","11/23/12","A","A","11/23/12","AVD","MI","MI","MI","MI","MI","MI","MI","MI","MI","MI","MI","MI",-7,0,0,10,1,1,0.461590928,2.451607541,51.82489065,30.40394962,1,6092.781886,51755.21484,8.23e+12,1.62e+13,27.32111234,13.51772281,10.08212511,NA,"3/23/12",2012-03-23,2012-03-23,NA,NA,2012-11-23,8.23e+12,1.62e+13,27.32111234,13.51772281,51.82489065,30.40394962,6092.781886,51755.21484,10.08212511,NA,"China ",2001-12-11,"United States of America",1995-01-01,1,1,"United States of America",1948-01-01,NA,NA,NA,1,10,10,-7,0,0,1,NA,NA,NA,NA,NA,NA,NA,NA,NA,NA,0,NA,NA,0
"1996",NA,"CHN-AD-197",710,"2012",994,2012,994,710,"Q4_2012","China","CHN-AD-197","European Union","EUN","Toluene Diisocyanate","3/23/12","11/13/12","11/13/12","A","A","11/13/12","AVD","MI","MI","MI","MI","MI","MI","MI","MI","MI","MI","MI","MI",-7,0,0,NA,1,1,0.461590928,1.431081124,51.82489065,84.5969663,1,6092.781886,32917.01851,8.23e+12,1.66e+13,27.32111234,43.18278344,10.08212511,1.549223779,"3/23/12",2012-03-23,2012-03-23,NA,NA,2012-11-13,8.23e+12,1.66e+13,27.32111234,43.18278344,51.82489065,84.5969663,6092.781886,32917.01851,10.08212511,1.549223779,"China ",2001-12-11,"European Union",1995-01-01,1,1,NA,NA,NA,NA,NA,NA,6,NA,-7,0,0,1,NA,NA,NA,NA,NA,NA,NA,NA,NA,NA,0,NA,NA,0
"2007",NA,"CHN-AD-23",710,"2002",732,2001,732,710,"Q4_2012","China","CHN-AD-23","South Korea","KOR","Poly(Ethylene Terephthalate) ","8/3/01","10/29/02","10/29/02","A","A","10/29/02","AVD","2/3/03","2/3/03","A","A","2/3/03","AVD","2/3/08","2008","AVD","5","52","G/ADP/N/105/CHN",-7,0,0,8,1,1,0.863739086,0.95340758,43.08019713,63.91107188,1,1041.6377,11255.94789,1.32e+12,5.33e+11,22.60010168,32.73245013,14.39172359,4.126427146,"8/3/01",2001-08-03,2001-08-03,1255,1626,2002-10-29,1.45e+12,6.09e+11,25.13437343,30.82686814,47.69731271,60.15373411,1135.447952,12788.58018,13.74274917,3.763589197,"China ",2001-12-11,"South Korea",1995-01-01,1,1,"South Korea",1967-04-14,NA,NA,NA,1,8,8,-7,0,0,1,NA,NA,NA,NA,NA,NA,NA,NA,NA,2003,0,NA,NA,0
"2008",NA,"CHN-AD-24",710,"2002",732,2001,732,710,"Q4_2012","China","CHN-AD-24","South Korea","KOR","Of Polyesters","8/3/01","10/22/02","10/22/02","A","A","10/22/02","AVD","1/3/03","1/3/03","A","A","1/3/03","AVD","2/3/08","2008","AVD","2","48","G/ADP/N/105/CHN",-7,0,0,8,1,1,0.863739086,0.95340758,43.08019713,63.91107188,1,1041.6377,11255.94789,1.32e+12,5.33e+11,22.60010168,32.73245013,14.39172359,4.126427146,"8/3/01",2001-08-03,2001-08-03,1255,1626,2002-10-22,1.45e+12,6.09e+11,25.13437343,30.82686814,47.69731271,60.15373411,1135.447952,12788.58018,13.74274917,3.763589197,"China ",2001-12-11,"South Korea",1995-01-01,1,1,"South Korea",1967-04-14,NA,NA,NA,1,8,8,-7,0,0,1,NA,NA,NA,NA,NA,NA,NA,NA,NA,2003,0,NA,NA,0
"2009",NA,"CHN-AD-25",710,"2002",732,2001,732,710,"Q4_2012","China","CHN-AD-25","South Korea","KOR","Esters of Acrylic Acid ","8/3/01","10/22/02","10/22/02","A","A","10/22/02","AVD","1/4/03","1/4/03","A","A","1/4/03","AVD","4/9/09","2009","AVD","2","20","G/ADP/N/105/CHN",-7,0,0,8,1,1,0.863739086,0.95340758,43.08019713,63.91107188,1,1041.6377,11255.94789,1.32e+12,5.33e+11,22.60010168,32.73245013,14.39172359,4.126427146,"8/3/01",2001-08-03,2001-08-03,1255,1626,2002-10-22,1.45e+12,6.09e+11,25.13437343,30.82686814,47.69731271,60.15373411,1135.447952,12788.58018,13.74274917,3.763589197,"China ",2001-12-11,"South Korea",1995-01-01,1,1,"South Korea",1967-04-14,NA,NA,NA,1,8,8,-7,0,0,1,NA,NA,NA,NA,NA,NA,NA,NA,NA,2003,0,NA,NA,0
"2010",NA,"CHN-AD-26",710,"2002",820,2001,820,710,"Q4_2012","China","CHN-AD-25","Malaysia","MYS","Esters of Acrylic Acid ","8/3/01","10/22/02","10/22/02","A","A","10/22/02","AVD","1/5/03","1/5/03","A","A","1/5/03","AVD","IF","IF","AVD","4","38","G/ADP/N/105/CHN",-7,0,0,3,0,1,0.863739086,2.106201381,43.08019713,203.364636,0,1041.6377,3877.996652,1.32e+12,92783947368,22.60010168,110.4024914,14.39172359,8.010970591,"8/3/01",2001-08-03,2001-08-03,7323,1626,2002-10-22,1.45e+12,1.01e+11,25.13437343,108.3053028,47.69731271,199.3562327,1135.447952,4130.678017,13.74274917,8.985081404,"China ",2001-12-11,"Malaysia ",1995-01-01,1,1,"Malaysia",1957-10-24,NA,NA,NA,1,3,4,-7,0,0,0,NA,NA,NA,NA,NA,NA,NA,NA,NA,2003,0,NA,NA,0
"2011",NA,"CHN-AD-27",710,"2002",830,2001,830,710,"Q4_2012","China","CHN-AD-25","Singapore","SGP","Esters of Acrylic Acid ","8/3/01","10/22/02","10/22/02","A","A","10/22/02","AVD","1/6/03","1/6/03","A","A","1/6/03","AVD","IF","IF","AVD","30","49","G/ADP/N/105/CHN",-7,0,0,-2,0,1,0.863739086,0.433972079,43.08019713,352.7492263,0,1041.6377,21576.86984,1.32e+12,89285087395,22.60010168,184.4794251,14.39172359,0.0878928,"8/3/01",2001-08-03,2001-08-03,3901,1626,2002-10-22,1.45e+12,91941791944,25.13437343,185.964275,47.69731271,354.2779896,1135.447952,22016.71263,13.74274917,0.075254915,"China ",2001-12-11,"Singapore ",1995-01-01,1,1,"Singapore",1973-08-20,NA,NA,NA,1,-2,2,-7,0,0,0,NA,NA,NA,NA,NA,NA,NA,NA,NA,2003,0,NA,NA,0
"2012",NA,"CHN-AD-28",710,"2002",850,2001,850,710,"Q4_2012","China","CHN-AD-25","Indonesia","IDN","Esters of Acrylic Acid ","10/10/01","12/5/02","12/5/02","A","A","12/5/02","AVD","4/10/03","4/10/03","A","A","4/10/03","AVD","IF","IF","AVD","11","24","G/ADP/N/105/CHN",-7,0,0,6,1,1,0.863739086,3.603402754,43.08019713,69.7932057,1,1041.6377,756.931013,1.32e+12,1.6e+11,22.60010168,39.03213345,14.39172359,15.29026521,"10/10/01",2001-10-10,2001-10-10,78,1694,2002-12-05,1.45e+12,1.96e+11,25.13437343,32.68762116,47.69731271,59.07946358,1135.447952,909.8873302,13.74274917,15.45645173,"China ",2001-12-11,"Indonesia ",1995-01-01,1,1,"Indonesia",1950-02-24,NA,NA,NA,1,6,7,-7,0,0,1,NA,NA,NA,NA,NA,NA,NA,NA,NA,2003,0,NA,NA,0
"2019",NA,"CHN-AD-34",710,"2002",732,2002,732,710,"Q4_2012","China","CHN-AD-34","South Korea","KOR","Paper and Paperboard of a kind used for Writing ","2/6/02","11/26/02","11/26/02","A","A","11/26/02","AVD","8/6/03","8/6/03","A","A","8/6/03","AVD","IF","IF","AVD","4","51","G/ADP/N/112/CHN",-7,0,0,8,1,1,0.780540991,0.868333788,47.69731271,60.15373411,1,1135.447952,12788.58018,1.45e+12,6.09e+11,25.13437343,30.82686814,13.74274917,3.763589197,"2/6/02",2002-02-06,2002-02-06,1442,1813,2002-11-26,1.45e+12,6.09e+11,25.13437343,30.82686814,47.69731271,60.15373411,1135.447952,12788.58018,13.74274917,3.763589197,"China ",2001-12-11,"South Korea",1995-01-01,1,1,"South Korea",1967-04-14,NA,NA,NA,1,8,8,-7,0,0,1,NA,NA,NA,NA,NA,NA,NA,NA,NA,2003,0,NA,NA,0
"2020",NA,"CHN-AD-35",710,"2002",740,2002,740,710,"Q4_2012","China","CHN-AD-34","Japan","JPN","Paper and Paperboard of a kind used for Writing ","2/6/02","11/26/02","11/26/02","A","A","11/26/02","AVD","8/6/03","8/6/03","A","A","8/6/03","AVD","IF","IF","AVD","9","71","G/ADP/N/112/CHN",-7,0,0,10,1,1,0.780540991,0.542656312,47.69731271,21.16392566,1,1135.447952,31235.58818,1.45e+12,3.98e+12,25.13437343,11.25283734,13.74274917,1.458508014,"2/6/02",2002-02-06,2002-02-06,286,1813,2002-11-26,1.45e+12,3.98e+12,25.13437343,11.25283734,47.69731271,21.16392566,1135.447952,31235.58818,13.74274917,1.458508014,"China ",2001-12-11,"Japan ",1995-01-01,1,1,"Japan",1955-09-10,NA,NA,NA,1,10,10,-7,0,0,1,NA,NA,NA,NA,NA,NA,NA,NA,NA,2003,0,NA,NA,0
"2022",NA,"CHN-AD-37",710,"2002",2,2002,2,710,"Q4_2012","China","CHN-AD-34","USA","USA","Paper and Paperboard of a kind used for Writing ","2/6/02","11/26/02","11/26/02","A","A","11/26/02","AVD","8/6/03","8/6/03","T","T",".",".",".",".",".",".",".",".",-7,0,0,10,1,1,0.780540991,2.401034651,47.69731271,22.17081656,1,1135.447952,38175.37638,1.45e+12,1.1e+13,25.13437343,9.150106555,13.74274917,1.009241245,"2/6/02",2002-02-06,2002-02-06,381,1813,2002-11-26,1.45e+12,1.1e+13,25.13437343,9.150106555,47.69731271,22.17081656,1135.447952,38175.37638,13.74274917,1.009241245,"China ",2001-12-11,"United States of America",1995-01-01,1,1,"United States of America",1948-01-01,NA,NA,NA,1,10,10,-7,0,0,1,NA,NA,NA,NA,NA,NA,NA,NA,NA,NA,0,NA,NA,0
"2023",NA,"CHN-AD-38",710,"2002",994,2002,994,710,"Q4_2012","China","CHN-AD-38","European Union","EUN","Catechol","3/1/02","11/4/02","11/4/02","A","A","11/4/02","AVD","8/27/03","8/27/03","A","A","8/27/03","AVD","IF","IF","AVD","20","79","G/ADP/N/112/CHN",-7,0,0,NA,1,1,0.780540991,1.513611807,47.69731271,69.17092307,1,1135.447952,19180.25766,1.45e+12,9.41e+12,25.13437343,35.25688032,13.74274917,2.09656721,"3/1/02",2002-03-01,2002-03-01,NA,1836,2002-11-04,1.45e+12,9.41e+12,25.13437343,35.25688032,47.69731271,69.17092307,1135.447952,19180.25766,13.74274917,2.09656721,"China ",2001-12-11,"European Union",1995-01-01,1,1,NA,NA,NA,NA,NA,NA,6,NA,-7,0,0,1,NA,NA,NA,NA,NA,NA,NA,NA,NA,2003,0,NA,NA,0
"2024",NA,"CHN-AD-39",710,"2003",740,2002,740,710,"Q4_2012","China","CHN-AD-39","Japan","JPN","Phthalic Anhydride ","3/6/02","1/8/03","1/8/03","A","A","1/8/03","AVD","9/3/03","9/3/03","A","A","9/3/03","AVD","IF","IF","AVD","66","66","G/ADP/N/112/CHN",-7,0,0,10,1,1,0.780540991,0.542656312,47.69731271,21.16392566,1,1135.447952,31235.58818,1.45e+12,3.98e+12,25.13437343,11.25283734,13.74274917,1.458508014,"3/6/02",2002-03-06,2002-03-06,314,1841,2003-01-08,1.64e+12,4.3e+12,29.5575468,11.87275335,56.93216421,22.09029561,1273.640744,33690.93773,12.7973531,1.384225524,"China ",2001-12-11,"Japan ",1995-01-01,1,1,"Japan",1955-09-10,NA,NA,NA,1,10,10,-7,0,0,1,NA,NA,NA,NA,NA,NA,NA,NA,NA,2003,0,NA,NA,0
"2026",NA,"CHN-AD-40",710,"2003",750,2002,750,710,"Q4_2012","China","CHN-AD-39","India","IND","Phthalic Anhydride ","3/6/02","1/8/03","1/8/03","A","A","1/8/03","AVD","9/3/03","9/3/03","A","A","9/3/03","AVD","IF","IF","AVD","13","13","G/ADP/N/112/CHN",-7,0,0,9,1,1,0.780540991,1.062797391,47.69731271,29.00009028,1,1135.447952,486.640454,1.45e+12,5.24e+11,25.13437343,14.01854169,13.74274917,20.69574147,"3/6/02",2002-03-06,2002-03-06,1448,1841,2003-01-08,1.64e+12,6.18e+11,29.5575468,14.6902912,56.93216421,30.06518498,1273.640744,565.335483,12.7973531,20.7427547,"China ",2001-12-11,"India ",1995-01-01,1,1,"India",1948-07-08,NA,NA,NA,1,9,9,-7,0,0,1,NA,NA,NA,NA,NA,NA,NA,NA,NA,2003,0,NA,NA,0
"2027",NA,"CHN-AD-41",710,"2003",732,2002,732,710,"Q4_2012","China","CHN-AD-39","South Korea","KOR","Phthalic Anhydride ","3/6/02","1/8/03","1/8/03","A","A","1/8/03","AVD","9/3/03","9/3/03","A","A","9/3/03","AVD","IF","IF","AVD","1.4","13","G/ADP/N/112/CHN",-7,0,0,8,1,1,0.780540991,0.868333788,47.69731271,60.15373411,1,1135.447952,12788.58018,1.45e+12,6.09e+11,25.13437343,30.82686814,13.74274917,3.763589197,"3/6/02",2002-03-06,2002-03-06,1470,1841,2003-01-08,1.64e+12,6.81e+11,29.5575468,32.7021783,56.93216421,63.39301239,1273.640744,14219.19359,12.7973531,3.514052875,"China ",2001-12-11,"South Korea",1995-01-01,1,1,"South Korea",1967-04-14,NA,NA,NA,1,8,8,-7,0,0,1,NA,NA,NA,NA,NA,NA,NA,NA,NA,2003,0,NA,NA,0
"2028",NA,"CHN-AD-42",710,"2003",732,2002,732,710,"Q4_2012","China","CHN-AD-42","South Korea","KOR","Styrene Butadine Rubber (SBR)","3/20/02","4/16/03","4/16/03","A","A","4/16/03","AVD","9/9/03","9/9/03","A","A","9/9/03","AVD","IF","IF","AVD","7","27","G/ADP/N/112/CHN",-7,0,0,8,1,1,0.780540991,0.868333788,47.69731271,60.15373411,1,1135.447952,12788.58018,1.45e+12,6.09e+11,25.13437343,30.82686814,13.74274917,3.763589197,"3/20/02",2002-03-20,2002-03-20,1484,1855,2003-04-16,1.64e+12,6.81e+11,29.5575468,32.7021783,56.93216421,63.39301239,1273.640744,14219.19359,12.7973531,3.514052875,"China ",2001-12-11,"South Korea",1995-01-01,1,1,"South Korea",1967-04-14,NA,NA,NA,1,8,8,-7,0,0,1,NA,NA,NA,NA,NA,NA,NA,NA,NA,2003,0,NA,NA,0
"2029",NA,"CHN-AD-43",710,"2003",740,2002,740,710,"Q4_2012","China","CHN-AD-42","Japan","JPN","Styrene Butadine Rubber (SBR)","3/20/02","4/16/03","4/16/03","A","A","4/16/03","AVD","9/9/03","9/9/03","A","A","9/9/03","AVD","IF","IF","AVD","0","33","G/ADP/N/112/CHN",-7,0,0,10,1,1,0.780540991,0.542656312,47.69731271,21.16392566,1,1135.447952,31235.58818,1.45e+12,3.98e+12,25.13437343,11.25283734,13.74274917,1.458508014,"3/20/02",2002-03-20,2002-03-20,328,1855,2003-04-16,1.64e+12,4.3e+12,29.5575468,11.87275335,56.93216421,22.09029561,1273.640744,33690.93773,12.7973531,1.384225524,"China ",2001-12-11,"Japan ",1995-01-01,1,1,"Japan",1955-09-10,NA,NA,NA,1,10,10,-7,0,0,1,NA,NA,NA,NA,NA,NA,NA,NA,NA,2003,0,NA,NA,0
"2032",NA,"CHN-AD-46",710,"2003",732,2002,732,710,"Q4_2012","China","CHN-AD-45","South Korea","KOR","Cold-Rolled Steel Products","3/20/02","5/20/03","5/20/03","A","A","5/20/03","AVD","9/24/03","9/24/03","A","A","9/24/03","AVD","9/23/08","2008","AVD","0","40","G/ADP/N/112/CHN",-7,0,0,8,1,1,0.780540991,0.868333788,47.69731271,60.15373411,1,1135.447952,12788.58018,1.45e+12,6.09e+11,25.13437343,30.82686814,13.74274917,3.763589197,"3/20/02",2002-03-20,2002-03-20,1484,1855,2003-05-20,1.64e+12,6.81e+11,29.5575468,32.7021783,56.93216421,63.39301239,1273.640744,14219.19359,12.7973531,3.514052875,"China ",2001-12-11,"South Korea",1995-01-01,1,1,"South Korea",1967-04-14,NA,NA,NA,1,8,8,-7,0,0,1,NA,NA,NA,NA,NA,NA,NA,NA,NA,2003,0,NA,NA,0
"2038",NA,"CHN-AD-51",710,"2003",732,2002,732,710,"Q4_2012","China","CHN-AD-50","South Korea","KOR","Polyvinyl Chloride ","3/29/02","5/12/03","5/12/03","A","A","5/12/03","AVD","9/29/03","9/29/03","A","A","9/29/03","AVD","IF","IF","AVD","6","76","G/ADP/N/112/CHN",-7,0,0,8,1,1,0.780540991,0.868333788,47.69731271,60.15373411,1,1135.447952,12788.58018,1.45e+12,6.09e+11,25.13437343,30.82686814,13.74274917,3.763589197,"3/29/02",2002-03-29,2002-03-29,1493,1864,2003-05-12,1.64e+12,6.81e+11,29.5575468,32.7021783,56.93216421,63.39301239,1273.640744,14219.19359,12.7973531,3.514052875,"China ",2001-12-11,"South Korea",1995-01-01,1,1,"South Korea",1967-04-14,NA,NA,NA,1,8,8,-7,0,0,1,NA,NA,NA,NA,NA,NA,NA,NA,NA,2003,0,NA,NA,0
"2039",NA,"CHN-AD-52",710,"2003",2,2002,2,710,"Q4_2012","China","CHN-AD-50","USA","USA","Polyvinyl Chloride ","3/29/02","5/12/03","5/12/03","A","A","5/12/03","AVD","9/29/03","9/29/03","A","A","9/29/03","AVD","IF","IF","AVD","11","83","G/ADP/N/112/CHN",-7,0,0,10,1,1,0.780540991,2.401034651,47.69731271,22.17081656,1,1135.447952,38175.37638,1.45e+12,1.1e+13,25.13437343,9.150106555,13.74274917,1.009241245,"3/29/02",2002-03-29,2002-03-29,432,1864,2003-05-12,1.64e+12,1.15e+13,29.5575468,9.063428363,56.93216421,22.47789302,1273.640744,39682.47225,12.7973531,1.197297611,"China ",2001-12-11,"United States of America",1995-01-01,1,1,"United States of America",1948-01-01,NA,NA,NA,1,10,10,-7,0,0,1,NA,NA,NA,NA,NA,NA,NA,NA,NA,2003,0,NA,NA,0
"2040",NA,"CHN-AD-53",710,"2003",740,2002,740,710,"Q4_2012","China","CHN-AD-50","Japan","JPN","Polyvinyl Chloride ","3/29/02","5/12/03","5/12/03","A","A","5/12/03","AVD","9/29/03","9/29/03","A","A","9/29/03","AVD","IF","IF","AVD","7","84","G/ADP/N/112/CHN",-7,0,0,10,1,1,0.780540991,0.542656312,47.69731271,21.16392566,1,1135.447952,31235.58818,1.45e+12,3.98e+12,25.13437343,11.25283734,13.74274917,1.458508014,"3/29/02",2002-03-29,2002-03-29,337,1864,2003-05-12,1.64e+12,4.3e+12,29.5575468,11.87275335,56.93216421,22.09029561,1273.640744,33690.93773,12.7973531,1.384225524,"China ",2001-12-11,"Japan ",1995-01-01,1,1,"Japan",1955-09-10,NA,NA,NA,1,10,10,-7,0,0,1,NA,NA,NA,NA,NA,NA,NA,NA,NA,2003,0,NA,NA,0
"2042",NA,"CHN-AD-55",710,"2003",732,2002,732,710,"Q4_2012","China","CHN-AD-55","South Korea","KOR","Toluene Diisocyanate ","5/22/02","6/10/03","6/10/03","A","A","6/10/03","AVD","11/22/03","11/22/03","A","A","11/22/03","AVD","IF","IF","AVD","3","5","G/ADP/N/112/CHN",-7,0,0,8,1,1,0.780540991,0.868333788,47.69731271,60.15373411,1,1135.447952,12788.58018,1.45e+12,6.09e+11,25.13437343,30.82686814,13.74274917,3.763589197,"5/22/02",2002-05-22,2002-05-22,1547,1918,2003-06-10,1.64e+12,6.81e+11,29.5575468,32.7021783,56.93216421,63.39301239,1273.640744,14219.19359,12.7973531,3.514052875,"China ",2001-12-11,"South Korea",1995-01-01,1,1,"South Korea",1967-04-14,NA,NA,NA,1,8,8,-7,0,0,1,NA,NA,NA,NA,NA,NA,NA,NA,NA,2003,0,NA,NA,0
"2043",NA,"CHN-AD-56",710,"2003",2,2002,2,710,"Q4_2012","China","CHN-AD-55","USA","USA","Toluene Diisocyanate ","5/22/02","6/10/03","6/10/03","A","A","6/10/03","AVD","11/22/03","11/22/03","A","A","11/22/03","AVD","IF","IF","AVD","7","28","G/ADP/N/112/CHN",-7,0,0,10,1,1,0.780540991,2.401034651,47.69731271,22.17081656,1,1135.447952,38175.37638,1.45e+12,1.1e+13,25.13437343,9.150106555,13.74274917,1.009241245,"5/22/02",2002-05-22,2002-05-22,486,1918,2003-06-10,1.64e+12,1.15e+13,29.5575468,9.063428363,56.93216421,22.47789302,1273.640744,39682.47225,12.7973531,1.197297611,"China ",2001-12-11,"United States of America",1995-01-01,1,1,"United States of America",1948-01-01,NA,NA,NA,1,10,10,-7,0,0,1,NA,NA,NA,NA,NA,NA,NA,NA,NA,2003,0,NA,NA,0
"2044",NA,"CHN-AD-57",710,"2003",740,2002,740,710,"Q4_2012","China","CHN-AD-55","Japan","JPN","Toluene Diisocyanate ","5/22/02","6/10/03","6/10/03","A","A","6/10/03","AVD","11/22/03","11/22/03","A","A","11/22/03","AVD","IF","IF","AVD","4","49","G/ADP/N/112/CHN",-7,0,0,10,1,1,0.780540991,0.542656312,47.69731271,21.16392566,1,1135.447952,31235.58818,1.45e+12,3.98e+12,25.13437343,11.25283734,13.74274917,1.458508014,"5/22/02",2002-05-22,2002-05-22,391,1918,2003-06-10,1.64e+12,4.3e+12,29.5575468,11.87275335,56.93216421,22.09029561,1273.640744,33690.93773,12.7973531,1.384225524,"China ",2001-12-11,"Japan ",1995-01-01,1,1,"Japan",1955-09-10,NA,NA,NA,1,10,10,-7,0,0,1,NA,NA,NA,NA,NA,NA,NA,NA,NA,2003,0,NA,NA,0
"2045",NA,"CHN-AD-58",710,"2003",732,2002,732,710,"Q4_2012","China","CHN-AD-58","South Korea","KOR","Phenol (Hydroxybenzene) and its Salts ","8/1/02","6/9/03","6/9/03","A","A","6/9/03","AVD","2/1/04","2/1/04","A","A","2/1/04","AVD","IF","IF","AVD","5","16","G/ADP/N/119/CHN",-7,0,0,8,1,1,0.780540991,0.868333788,47.69731271,60.15373411,1,1135.447952,12788.58018,1.45e+12,6.09e+11,25.13437343,30.82686814,13.74274917,3.763589197,"8/1/02",2002-08-01,2002-08-01,1618,1989,2003-06-09,1.64e+12,6.81e+11,29.5575468,32.7021783,56.93216421,63.39301239,1273.640744,14219.19359,12.7973531,3.514052875,"China ",2001-12-11,"South Korea",1995-01-01,1,1,"South Korea",1967-04-14,NA,NA,NA,1,8,8,-7,0,0,1,NA,NA,NA,NA,NA,NA,NA,NA,NA,2004,0,NA,NA,0
"2046",NA,"CHN-AD-59",710,"2003",2,2002,2,710,"Q4_2012","China","CHN-AD-58","USA","USA","Phenol (Hydroxybenzene) and its Salts ","8/1/02","6/9/03","6/9/03","A","A","6/9/03","AVD","2/1/04","2/1/04","A","A","2/1/04","AVD","IF","IF","AVD","36","36","G/ADP/N/119/CHN",-7,0,0,10,1,1,0.780540991,2.401034651,47.69731271,22.17081656,1,1135.447952,38175.37638,1.45e+12,1.1e+13,25.13437343,9.150106555,13.74274917,1.009241245,"8/1/02",2002-08-01,2002-08-01,557,1989,2003-06-09,1.64e+12,1.15e+13,29.5575468,9.063428363,56.93216421,22.47789302,1273.640744,39682.47225,12.7973531,1.197297611,"China ",2001-12-11,"United States of America",1995-01-01,1,1,"United States of America",1948-01-01,NA,NA,NA,1,10,10,-7,0,0,1,NA,NA,NA,NA,NA,NA,NA,NA,NA,2004,0,NA,NA,0
"2048",NA,"CHN-AD-60",710,"2003",740,2002,740,710,"Q4_2012","China","CHN-AD-58","Japan","JPN","Phenol (Hydroxybenzene) and its Salts ","8/1/02","6/9/03","6/9/03","A","A","6/9/03","AVD","2/1/04","2/1/04","A","A","2/1/04","AVD","IF","IF","AVD","6","144","G/ADP/N/119/CHN",-7,0,0,10,1,1,0.780540991,0.542656312,47.69731271,21.16392566,1,1135.447952,31235.58818,1.45e+12,3.98e+12,25.13437343,11.25283734,13.74274917,1.458508014,"8/1/02",2002-08-01,2002-08-01,462,1989,2003-06-09,1.64e+12,4.3e+12,29.5575468,11.87275335,56.93216421,22.09029561,1273.640744,33690.93773,12.7973531,1.384225524,"China ",2001-12-11,"Japan ",1995-01-01,1,1,"Japan",1955-09-10,NA,NA,NA,1,10,10,-7,0,0,1,NA,NA,NA,NA,NA,NA,NA,NA,NA,2004,0,NA,NA,0
"2052",NA,"CHN-AD-64",710,"2004",2,2003,2,710,"Q4_2012","China","CHN-AD-64","USA","USA","Monoethanolamine Diethanolamine and its Salts","5/14/03","3/25/04","3/25/04","A","A","3/25/04","AVD","11/14/04","11/14/04","A","A","11/14/04","AVD","IF","IF","AVD","20","74","G/ADP/N/126/CHN",-7,0,0,10,1,1,0.643643193,2.620249571,56.93216421,22.47789302,1,1273.640744,39682.47225,1.64e+12,1.15e+13,29.5575468,9.063428363,12.7973531,1.197297611,"5/14/03",2003-05-14,2003-05-14,843,60,2004-03-25,1.93e+12,1.23e+13,34.08005361,9.636719068,65.51084195,24.28117618,1490.380055,41928.88614,13.39314276,1.34507504,"China ",2001-12-11,"United States of America",1995-01-01,1,1,"United States of America",1948-01-01,NA,NA,NA,1,10,10,-7,0,0,1,NA,NA,NA,NA,NA,NA,NA,NA,NA,2004,0,NA,NA,0
"2053",NA,"CHN-AD-65",710,"2004",70,2003,70,710,"Q4_2012","China","CHN-AD-64","Mexico","MEX","Monoethanolamine Diethanolamine and its Salts","5/14/03","3/25/04","3/25/04","A","A","3/25/04","AVD","11/14/04","11/14/04","A","A","11/14/04","AVD","11/14/09","2009","AVD","74","74","G/ADP/N/126/CHN",-7,0,0,8,1,1,0.643643193,0.513348781,56.93216421,51.23527043,1,1273.640744,6601.042065,1.64e+12,7.13e+11,29.5575468,24.89614657,12.7973531,3.586141596,"5/14/03",2003-05-14,2003-05-14,894,60,2004-03-25,1.93e+12,7.7e+11,34.08005361,26.23368567,65.51084195,54.22641286,1490.380055,7042.024783,13.39314276,3.575193304,"China ",2001-12-11,"Mexico ",1995-01-01,1,1,"Mexico",1986-08-24,NA,NA,NA,1,8,8,-7,0,0,1,NA,NA,NA,NA,NA,NA,NA,NA,NA,2004,0,NA,NA,0
"2054",NA,"CHN-AD-66",710,"2004",740,2003,740,710,"Q4_2012","China","CHN-AD-64","Japan","JPN","Monoethanolamine Diethanolamine and its Salts","5/14/03","3/25/04","3/25/04","A","A","3/25/04","AVD","11/14/04","11/14/04","A","A","11/14/04","AVD","IF","IF","AVD","74","74","G/ADP/N/126/CHN",-7,0,0,10,1,1,0.643643193,0.518402302,56.93216421,22.09029561,1,1273.640744,33690.93773,1.64e+12,4.3e+12,29.5575468,11.87275335,12.7973531,1.384225524,"5/14/03",2003-05-14,2003-05-14,748,60,2004-03-25,1.93e+12,4.66e+12,34.08005361,13.21033508,65.51084195,24.46337319,1490.380055,36441.50449,13.39314276,1.316515033,"China ",2001-12-11,"Japan ",1995-01-01,1,1,"Japan",1955-09-10,NA,NA,NA,1,10,10,-7,0,0,1,NA,NA,NA,NA,NA,NA,NA,NA,NA,2004,0,NA,NA,0
"2057",NA,"CHN-AD-69",710,"2004",820,2003,820,710,"Q4_2012","China","CHN-AD-64","Malaysia","MYS","Monoethanolamine Diethanolamine and its Salts","5/14/03","3/25/04","3/25/04","A","A","3/25/04","AVD","11/14/04","11/14/04","A","A","11/14/04","AVD","IF","IF","AVD","9","74","G/ADP/N/126/CHN",-7,0,0,3,0,1,0.643643193,2.396832232,56.93216421,194.1951291,0,1273.640744,4427.459737,1.64e+12,1.1e+11,29.5575468,106.9434461,12.7973531,9.306085216,"5/14/03",2003-05-14,2003-05-14,7972,60,2004-03-25,1.93e+12,1.25e+11,34.08005361,115.3730943,65.51084195,210.3738221,1490.380055,4918.166731,13.39314276,9.270982536,"China ",2001-12-11,"Malaysia ",1995-01-01,1,1,"Malaysia",1957-10-24,NA,NA,NA,1,3,4,-7,0,0,0,NA,NA,NA,NA,NA,NA,NA,NA,NA,2004,0,NA,NA,0
"2060",NA,"CHN-AD-71",710,"2004",2,2003,2,710,"Q4_2012","China","CHN-AD-71","USA","USA","Chloroform (Trichloromethane) ","5/30/03","4/8/04","4/8/04","A","A","4/8/04","AVD","11/30/04","11/30/04","A","A","11/30/04","AVD","IF","IF","AVD/PU","96","96","G/ADP/N/126/CHN",-7,0,0,10,1,1,0.643643193,2.620249571,56.93216421,22.47789302,1,1273.640744,39682.47225,1.64e+12,1.15e+13,29.5575468,9.063428363,12.7973531,1.197297611,"5/30/03",2003-05-30,2003-05-30,859,76,2004-04-08,1.93e+12,1.23e+13,34.08005361,9.636719068,65.51084195,24.28117618,1490.380055,41928.88614,13.39314276,1.34507504,"China ",2001-12-11,"United States of America",1995-01-01,1,1,"United States of America",1948-01-01,NA,NA,NA,1,10,10,-7,0,0,1,NA,NA,NA,NA,NA,NA,NA,NA,NA,2004,0,NA,NA,0
"2061",NA,"CHN-AD-72",710,"2004",994,2003,994,710,"Q4_2012","China","CHN-AD-71","European Union","EUN","Chloroform (Trichloromethane) ","5/30/03","4/8/04","4/8/04","A","A","4/8/04","AVD","11/30/04","11/30/04","A","A","11/30/04","AVD","IF","IF","AVD/PU","32","96","G/ADP/N/126/CHN",-7,0,0,NA,1,1,0.643643193,1.50561652,56.93216421,67.81831502,1,1273.640744,23298.27289,1.64e+12,1.15e+13,29.5575468,34.45612425,12.7973531,2.016595406,"5/30/03",2003-05-30,2003-05-30,NA,76,2004-04-08,1.93e+12,1.32e+13,34.08005361,35.70172137,65.51084195,70.27789133,1490.380055,26795.93303,13.39314276,2.028298134,"China ",2001-12-11,"European Union",1995-01-01,1,1,NA,NA,NA,NA,NA,NA,6,NA,-7,0,0,1,NA,NA,NA,NA,NA,NA,NA,NA,NA,2004,0,NA,NA,0
"2062",NA,"CHN-AD-73",710,"2004",750,2003,750,710,"Q4_2012","China","CHN-AD-71","India","IND","Chloroform (Trichloromethane) ","5/30/03","4/8/04","4/8/04","A","A","4/8/04","AVD","11/30/04","11/30/04","A","A","11/30/04","AVD","11/30/09","2009","AVD","96","96","G/ADP/N/126/CHN",-7,0,0,9,1,1,0.643643193,1.079833355,56.93216421,30.06518498,1,1273.640744,565.335483,1.64e+12,6.18e+11,29.5575468,14.6902912,12.7973531,20.7427547,"5/30/03",2003-05-30,2003-05-30,1898,76,2004-04-08,1.93e+12,7.22e+11,34.08005361,17.55132848,65.51084195,36.85744745,1490.380055,649.7106479,13.39314276,19.02855235,"China ",2001-12-11,"India ",1995-01-01,1,1,"India",1948-07-08,NA,NA,NA,1,9,9,-7,0,0,1,NA,NA,NA,NA,NA,NA,NA,NA,NA,2004,0,NA,NA,0
"2063",NA,"CHN-AD-74",710,"2004",732,2003,732,710,"Q4_2012","China","CHN-AD-71","South Korea","KOR","Chloroform (Trichloromethane) ","5/30/03","4/8/04","4/8/04","A","A","4/8/04","AVD","11/30/04","11/30/04","A","A","11/30/04","AVD","IF","IF","AVD/PU","96","96","G/ADP/N/126/CHN",-7,0,0,8,1,1,0.643643193,0.85879417,56.93216421,63.39301239,1,1273.640744,14219.19359,1.64e+12,6.81e+11,29.5575468,32.7021783,12.7973531,3.514052875,"5/30/03",2003-05-30,2003-05-30,94,76,2004-04-08,1.93e+12,7.65e+11,34.08005361,38.29500278,65.51084195,72.76108631,1490.380055,15921.9392,13.39314276,3.530029285,"China ",2001-12-11,"South Korea",1995-01-01,1,1,"South Korea",1967-04-14,NA,NA,NA,1,8,8,-7,0,0,1,NA,NA,NA,NA,NA,NA,NA,NA,NA,2004,0,NA,NA,0
"2064",NA,"CHN-AD-75",710,"2004",2,2003,2,710,"Q4_2012","China","CHN-AD-75","USA","USA","Dispersion Unshifted Single-Mode Optical Fiber","7/1/03","6/16/04","6/16/04","A","A","6/16/04","AVD","4/28/05","4/28/05","A","A","4/28/05","AVD","12/31/09","2009","AVD","1.51","46","G/ADP/N/132/CHN",-7,0,0,10,1,1,0.643643193,2.620249571,56.93216421,22.47789302,1,1273.640744,39682.47225,1.64e+12,1.15e+13,29.5575468,9.063428363,12.7973531,1.197297611,"7/1/03",2003-07-01,2003-07-01,891,108,2004-06-16,1.93e+12,1.23e+13,34.08005361,9.636719068,65.51084195,24.28117618,1490.380055,41928.88614,13.39314276,1.34507504,"China ",2001-12-11,"United States of America",1995-01-01,1,1,"United States of America",1948-01-01,NA,NA,NA,1,10,10,-7,0,0,1,NA,NA,NA,NA,NA,NA,NA,NA,NA,2005,0,NA,NA,0
"2065",NA,"CHN-AD-76",710,"2004",740,2003,740,710,"Q4_2012","China","CHN-AD-75","Japan","JPN","Dispersion Unshifted Single-Mode Optical Fiber","7/1/03","6/16/04","6/16/04","A","A","6/16/04","AVD","4/28/05","4/28/05","A","A","4/28/05","AVD","IF","IF","AVD","46","46","G/ADP/N/132/CHN",-7,0,0,10,1,1,0.643643193,0.518402302,56.93216421,22.09029561,1,1273.640744,33690.93773,1.64e+12,4.3e+12,29.5575468,11.87275335,12.7973531,1.384225524,"7/1/03",2003-07-01,2003-07-01,796,108,2004-06-16,1.93e+12,4.66e+12,34.08005361,13.21033508,65.51084195,24.46337319,1490.380055,36441.50449,13.39314276,1.316515033,"China ",2001-12-11,"Japan ",1995-01-01,1,1,"Japan",1955-09-10,NA,NA,NA,1,10,10,-7,0,0,1,NA,NA,NA,NA,NA,NA,NA,NA,NA,2005,0,NA,NA,0
"2066",NA,"CHN-AD-77",710,"2004",732,2003,732,710,"Q4_2012","China","CHN-AD-75","South Korea","KOR","Dispersion Unshifted Single-Mode Optical Fiber","7/1/03","6/16/04","6/16/04","A","A","6/16/04","AVD","4/28/05","4/28/05","A","A","4/28/05","AVD","IF","IF","AVD","7","46","G/ADP/N/132/CHN",-7,0,0,8,1,1,0.643643193,0.85879417,56.93216421,63.39301239,1,1273.640744,14219.19359,1.64e+12,6.81e+11,29.5575468,32.7021783,12.7973531,3.514052875,"7/1/03",2003-07-01,2003-07-01,126,108,2004-06-16,1.93e+12,7.65e+11,34.08005361,38.29500278,65.51084195,72.76108631,1490.380055,15921.9392,13.39314276,3.530029285,"China ",2001-12-11,"South Korea",1995-01-01,1,1,"South Korea",1967-04-14,NA,NA,NA,1,8,8,-7,0,0,1,NA,NA,NA,NA,NA,NA,NA,NA,NA,2005,0,NA,NA,0
"2068",NA,"CHN-AD-79",710,"2004",994,2003,994,710,"Q4_2012","China","CHN-AD-79","European Union","EUN","Chloroprene Rubber (CR)","11/10/03","12/1/04","12/1/04","A","A","12/1/04","AVD","4/28/05","4/28/05","A","A","4/28/05","AVD","IF","IF","AVD","11","151","G/ADP/N/132/CHN",-7,0,0,NA,1,1,0.643643193,1.50561652,56.93216421,67.81831502,1,1273.640744,23298.27289,1.64e+12,1.15e+13,29.5575468,34.45612425,12.7973531,2.016595406,"11/10/03",2003-11-10,2003-11-10,NA,240,2004-12-01,1.93e+12,1.32e+13,34.08005361,35.70172137,65.51084195,70.27789133,1490.380055,26795.93303,13.39314276,2.028298134,"China ",2001-12-11,"European Union",1995-01-01,1,1,NA,NA,NA,NA,NA,NA,6,NA,-7,0,0,1,NA,NA,NA,NA,NA,NA,NA,NA,NA,2005,0,NA,NA,0
"2070",NA,"CHN-AD-80",710,"2004",740,2003,740,710,"Q4_2012","China","CHN-AD-79","Japan","JPN","Chloroprene Rubber (CR)","11/10/03","12/1/04","12/1/04","A","A","12/1/04","AVD","4/28/05","4/28/05","A","A","4/28/05","AVD","IF","IF","AVD","2","151","G/ADP/N/132/CHN",-7,0,0,10,1,1,0.643643193,0.518402302,56.93216421,22.09029561,1,1273.640744,33690.93773,1.64e+12,4.3e+12,29.5575468,11.87275335,12.7973531,1.384225524,"11/10/03",2003-11-10,2003-11-10,928,240,2004-12-01,1.93e+12,4.66e+12,34.08005361,13.21033508,65.51084195,24.46337319,1490.380055,36441.50449,13.39314276,1.316515033,"China ",2001-12-11,"Japan ",1995-01-01,1,1,"Japan",1955-09-10,NA,NA,NA,1,10,10,-7,0,0,1,NA,NA,NA,NA,NA,NA,NA,NA,NA,2005,0,NA,NA,0
"2071",NA,"CHN-AD-81",710,"2004",2,2003,2,710,"Q4_2012","China","CHN-AD-79","USA","USA","Chloroprene Rubber (CR)","11/10/03","12/1/04","12/1/04","A","A","12/1/04","AVD","4/28/05","4/28/05","A","A","4/28/05","AVD","IF","IF","AVD","151","151","G/ADP/N/132/CHN",-7,0,0,10,1,1,0.643643193,2.620249571,56.93216421,22.47789302,1,1273.640744,39682.47225,1.64e+12,1.15e+13,29.5575468,9.063428363,12.7973531,1.197297611,"11/10/03",2003-11-10,2003-11-10,1023,240,2004-12-01,1.93e+12,1.23e+13,34.08005361,9.636719068,65.51084195,24.28117618,1490.380055,41928.88614,13.39314276,1.34507504,"China ",2001-12-11,"United States of America",1995-01-01,1,1,"United States of America",1948-01-01,NA,NA,NA,1,10,10,-7,0,0,1,NA,NA,NA,NA,NA,NA,NA,NA,NA,2005,0,NA,NA,0
