"","s.ccodeIMP","IMP_DATE","t.ccodeIMP","i.date","t.ccodeINV","s.ccodeINV","V_NUMBER","AD_CTY_NAME","CASE_ID","CASE_REPCODE","INV_CTY_NAME","INV_CTY_CODE","PRODUCT","INIT_DATE","P_DUMP_DATE","P_INJ_DATE","P_DUMP_DEC","P_INJ_DEC","P_AD_DATE","P_AD_MEASURE","F_DUMP_DATE","F_INJ_DATE","F_DUMP_DEC","F_INJ_DEC","F_AD_DATE","F_AD_MEASURE","REVOKE_DATE","REVOKE_YEAR","WTO_F_AD_MEASURE","WTO_F_MARGIN_MIN","WTO_F_MARGIN_MAX","WTO_CITATION","s.polity2INV","s.democINV","s.democ.iINV","t.polity2INV","t.democ.iINV","chal","wtopd","s.TX.VAL.AGRI.ZS.UNINV","t.TX.VAL.AGRI.ZS.UNINV","s.NE.TRD.GNFS.ZSINV","t.NE.TRD.GNFS.ZSINV","prevint","s.NY.GDP.PCAP.CDINV","t.NY.GDP.PCAP.CDINV","s.NY.GDP.MKTP.CDINV","t.NY.GDP.MKTP.CDINV","s.NE.EXP.GNFS.ZSINV","t.NE.EXP.GNFS.ZSINV","s.NV.AGR.TOTL.ZSINV","t.NV.AGR.TOTL.ZSINV","sdateINV","cdate","einitdate","t.tenureINV","s.tenureINV","eP_AD_DATE","s.NY.GDP.MKTP.CD_IMP","t.NY.GDP.MKTP.CD_IMP","s.NE.EXP.GNFS.ZS_IMP","t.NE.EXP.GNFS.ZS_IMP","s.NE.TRD.GNFS.ZS_IMP","t.NE.TRD.GNFS.ZS_IMP","s.NY.GDP.PCAP.CD_IMP","t.NY.GDP.PCAP.CD_IMP","s.NV.AGR.TOTL.ZS_IMP","t.NV.AGR.TOTL.ZS_IMP","WTOname.x","s.WTOdate","WTOname.y","t.WTOdate","t.WTOmem","s.WTOmem","t.GATTname","t.GATTdate","s.GATTname","s.GATTdate","s.GATTmem","t.GATTmem","t.polity2_IMP","t.democ_IMP","s.polity2_IMP","s.democ_IMP","s.democ.i_IMP","t.democ.i_IMP"
"1",2,"1979",740,1979,740,2,"Q4_2012","USA","USA-AD-1","USA-AD-1","Japan","JPN","Spun Acrylic Yarn","1/4/79","7/13/79","MI","MI","MI","7/13/79","MI","10/25/79","3/26/80","MI","MI","4/9/80","AVD","7/21/94","1994","AVD",".",".",".",10,10,1,10,1,0,0,5.539277762,0.997926281,18.34276813,23.62584991,0,11695.36336,8953.59152,2.63e+12,1.04e+12,8.74206907,11.33935016,3.496339554,NA,"1/4/79",1979-01-04,1979-01-04,28,714,1979-07-13,2.63e+12,1.04e+12,8.74206907,11.33935016,18.34276813,23.62584991,11695.36336,8953.59152,3.496339554,NA,"United States of America",1995-01-01,"Japan ",1995-01-01,0,0,"Japan",1955-09-10,"United States of America",1948-01-01,1,1,10,10,10,10,1,1
"2",2,"1980",740,1979,740,2,"Q4_2012","USA","USA-AD-4","USA-AD-4","Japan","JPN","Microwave Ovens","8/29/79","7/15/80","2/21/80","MI","MI","7/15/80","MI","12/3/80","MI","MI","N",".",".",".",".",".",".",".",".",10,10,1,10,1,0,0,5.539277762,0.997926281,18.34276813,23.62584991,0,11695.36336,8953.59152,2.63e+12,1.04e+12,8.74206907,11.33935016,3.496339554,NA,"8/29/79",1979-08-29,1979-08-29,265,951,1980-07-15,2.86e+12,1.09e+12,9.809606987,13.42265571,20.07336245,27.79480687,12597.64551,9307.839295,2.897941681,NA,"United States of America",1995-01-01,"Japan ",1995-01-01,0,0,"Japan",1955-09-10,"United States of America",1948-01-01,1,1,10,10,10,10,1,1
"3",2,"1980",740,1979,740,2,"Q4_2012","USA","USA-AD-7","USA-AD-7","Japan","JPN","Large Electric Motors","10/3/79","6/20/80","2/22/80","MI","MI","6/20/80","MI","11/6/80","12/24/80","MI","MI","12/24/80","AVD","11/19/96","1996","AVD",".",".",".",10,10,1,10,1,0,0,5.539277762,0.997926281,18.34276813,23.62584991,0,11695.36336,8953.59152,2.63e+12,1.04e+12,8.74206907,11.33935016,3.496339554,NA,NA,1979-10-03,1979-10-03,300,986,1980-06-20,2.86e+12,1.09e+12,9.809606987,13.42265571,20.07336245,27.79480687,12597.64551,9307.839295,2.897941681,NA,"United States of America",1995-01-01,"Japan ",1995-01-01,0,0,"Japan",1955-09-10,"United States of America",1948-01-01,1,1,10,10,10,10,1,1
"4",2,"1980",220,1980,220,2,"Q4_2012","USA","USA-AD-25","USA-AD-25","France","FRA","Anhydrous Sodium Metasilicate","5/29/80","9/5/80","7/9/80","A","A","9/5/80","AVD","11/24/80","1/2/81","A","A","1/7/81","AVD","10/21/04","2004","AVD",".",".",".",10,10,1,8,1,0,0,5.127200691,2.416476357,20.07336245,44.37636452,0,12597.64551,12500.26549,2.86e+12,6.9e+11,9.809606987,21.40004376,2.897941681,4.282494934,"5/29/80",1980-05-29,1980-05-29,2194,1225,1980-09-05,2.86e+12,6.9e+11,9.809606987,21.40004376,20.07336245,44.37636452,12597.64551,12500.26549,2.897941681,4.282494934,"United States of America",1995-01-01,"France ",1995-01-01,0,0,"France",1948-01-01,"United States of America",1948-01-01,1,1,8,8,10,10,1,1
"5",2,"1981",713,1981,713,2,"Q4_2012","USA","USA-AD-42","USA-AD-42","Taiwan","TWN","Motorcycle Batteries","5/13/81","10/14/81","6/24/81","A","A","10/14/81","AVD","3/4/82","3/31/82","A","N",".",".",".",".",".",".",".",".",10,10,1,-7,0,0,0,4.292749079,NA,19.40265969,NA,0,13992.9227,NA,3.21e+12,NA,9.505123174,NA,3.153191192,NA,"5/13/81",1981-05-13,1981-05-13,1089,113,1981-10-14,3.21e+12,NA,9.505123174,NA,19.40265969,NA,13992.9227,NA,3.153191192,NA,"United States of America",1995-01-01,"Taiwan",2002-01-01,0,0,NA,NA,"United States of America",1948-01-01,1,NA,-7,0,10,10,1,0
"6",2,"1981",740,1981,740,2,"Q4_2012","USA","USA-AD-48a","USA-AD-48a","Japan","JPN","Twt Amplifier Assemblies and Parts","8/5/81","12/31/81","9/16/81","A","A","12/31/81","AVD","5/21/82","7/8/82","A","A","7/20/82","AVD","11/23/98","1998","AVD",".",".",".",10,10,1,10,1,0,0,4.292749079,0.82834419,19.40265969,28.10742731,0,13992.9227,10212.37814,3.21e+12,1.2e+12,9.505123174,14.39885882,3.153191192,NA,"8/5/81",1981-08-05,1981-08-05,384,197,1981-12-31,3.21e+12,1.2e+12,9.505123174,14.39885882,19.40265969,28.10742731,13992.9227,10212.37814,3.153191192,NA,"United States of America",1995-01-01,"Japan ",1995-01-01,0,0,"Japan",1955-09-10,"United States of America",1948-01-01,1,1,10,10,10,10,1,1
"7",2,"1981",710,1980,710,2,"Q4_2012","USA","USA-AD-28","USA-AD-27","China","CHN","Menthol","6/19/80","1/14/81","8/6/80","A","A","1/14/81","AVD","5/1/81","6/17/81","A","N",".",".",".",".",".",".",".",".",10,10,1,-7,0,0,0,5.127200691,NA,20.07336245,NA,0,12597.64551,193.0230693,2.86e+12,1.89e+11,9.809606987,NA,2.897941681,30.17392445,"6/19/80",1980-06-19,1980-06-19,1351,1246,1981-01-14,3.21e+12,1.94e+11,9.505123174,NA,19.40265969,NA,13992.9227,195.3038505,3.153191192,31.88068686,"United States of America",1995-01-01,"China ",2001-12-11,0,0,NA,NA,"United States of America",1948-01-01,1,NA,-7,0,10,10,1,0
"8",2,"1981",325,1980,325,2,"Q4_2012","USA","USA-AD-33","USA-AD-33","Italy","ITA","Strontium Nitrate","9/24/80","2/18/81","11/6/80","A","A","2/18/81","AVD","5/7/81","6/24/81","A","A","6/25/81","AVD","12/21/87","1987","AVD",".",".",".",10,10,1,10,1,0,0,5.127200691,0.996470158,20.07336245,44.75942901,0,12597.64551,8148.120532,2.86e+12,4.6e+11,9.809606987,21.03845093,2.897941681,NA,"9/24/80",1980-09-24,1980-09-24,416,1343,1981-02-18,3.21e+12,4.15e+11,9.505123174,22.58016281,19.40265969,47.1653132,13992.9227,7344.49093,3.153191192,NA,"United States of America",1995-01-01,"Italy ",1995-01-01,0,0,"Italy",1950-05-30,"United States of America",1948-01-01,1,1,10,10,10,10,1,1
"9",2,"1981",220,1981,220,2,"Q4_2012","USA","USA-AD-44a","USA-AD-44a","France","FRA","Liquid Sorbitol","6/24/81","11/30/81","8/5/81","A","A","11/30/81","AVD","2/12/82","4/7/82","A","A","4/9/82","AVD","7/21/10","2010","AVD",".",".",".",10,10,1,8,1,0,0,4.292749079,2.353601263,19.40265969,46.36198054,0,13992.9227,10903.83866,3.21e+12,6.05e+11,9.505123174,22.41994969,3.153191192,4.203395559,"6/24/81",1981-06-24,1981-06-24,34,155,1981-11-30,3.21e+12,6.05e+11,9.505123174,22.41994969,19.40265969,46.36198054,13992.9227,10903.83866,3.153191192,4.203395559,"United States of America",1995-01-01,"France ",1995-01-01,0,0,"France",1948-01-01,"United States of America",1948-01-01,1,1,8,8,10,10,1,1
"10",2,"1981",220,1981,220,2,"Q4_2012","USA","USA-AD-44b","USA-AD-44a","France","FRA","Crystaline Sorbitol","6/24/81","11/30/81","8/5/81","A","A","11/30/81","AVD","2/12/82","4/7/82","A","A","4/9/82","AVD","7/21/10","2010","AVD",".",".",".",10,10,1,8,1,0,0,4.292749079,2.353601263,19.40265969,46.36198054,0,13992.9227,10903.83866,3.21e+12,6.05e+11,9.505123174,22.41994969,3.153191192,4.203395559,"6/24/81",1981-06-24,1981-06-24,34,155,1981-11-30,3.21e+12,6.05e+11,9.505123174,22.41994969,19.40265969,46.36198054,13992.9227,10903.83866,3.153191192,4.203395559,"United States of America",1995-01-01,"France ",1995-01-01,0,0,"France",1948-01-01,"United States of America",1948-01-01,1,1,8,8,10,10,1,1
"11",2,"1981",265,1980,265,2,"Q4_2012","USA","USA-AD-30","USA-AD-30","East Germany","GDR","Montan Wax","8/24/80","3/12/81","11/6/80","A","A","3/12/81","AVD","7/28/81","9/10/81","A","A","9/10/81","AVD","5/7/86","1986","AVD",".",".",".",10,10,1,-9,0,0,0,5.127200691,NA,20.07336245,NA,0,12597.64551,NA,2.86e+12,NA,9.809606987,NA,2.897941681,NA,"8/24/80",1980-08-24,1980-08-24,3401,1312,1981-03-12,3.21e+12,NA,9.505123174,NA,19.40265969,NA,13992.9227,NA,3.153191192,NA,"United States of America",1995-01-01,NA,NA,NA,0,NA,NA,"United States of America",1948-01-01,1,NA,-9,0,10,10,1,0
"12",2,"1981",310,1981,310,2,"Q4_2012","USA","USA-AD-38","USA-AD-38","Hungary","HUN","Truck Trailer Axles and Brakes","2/25/81","9/17/81","4/8/81","A","A","9/17/81","AVD",".",".",".","OTH","1/20/82","SA","3/27/96",".","SA",".",".",".",10,10,1,-7,0,0,0,4.292749079,2.407523437,19.40265969,80.09519023,0,13992.9227,2121.764593,3.21e+12,22728019816,9.505123174,39.51997148,3.153191192,19.44738234,"2/25/81",1981-02-25,1981-02-25,8879,36,1981-09-17,3.21e+12,22728019816,9.505123174,39.51997148,19.40265969,80.09519023,13992.9227,2121.764593,3.153191192,19.44738234,"United States of America",1995-01-01,"Hungary ",1995-01-01,0,0,"Hungary",1973-09-09,"United States of America",1948-01-01,1,1,-7,0,10,10,1,0
"13",2,"1981",740,1981,740,2,"Q4_2012","USA","USA-AD-48b","USA-AD-48a","Japan","JPN","Klystrom Amplifier Assemblies and Parts","8/5/81","12/31/81","9/16/81","A","A","12/31/81","AVD","5/21/82","7/8/82","A","A","7/20/82","AVD","11/23/98","1998","AVD",".",".",".",10,10,1,10,1,0,0,4.292749079,0.82834419,19.40265969,28.10742731,0,13992.9227,10212.37814,3.21e+12,1.2e+12,9.505123174,14.39885882,3.153191192,NA,"8/5/81",1981-08-05,1981-08-05,384,197,1981-12-31,3.21e+12,1.2e+12,9.505123174,14.39885882,19.40265969,28.10742731,13992.9227,10212.37814,3.153191192,NA,"United States of America",1995-01-01,"Japan ",1995-01-01,0,0,"Japan",1955-09-10,"United States of America",1948-01-01,1,1,10,10,10,10,1,1
"14",2,"1981",255,1980,255,2,"Q4_2012","USA","USA-AD-31","USA-AD-31","West Germany","FRG","Barium Carbonate","9/24/80","2/18/81","11/6/80","A","A","2/18/81","AVD","5/7/81","6/24/81","A","A","6/25/81","AVD","MI","MI","AVD",".",".",".",10,10,1,10,1,0,0,5.127200691,1.246506385,20.07336245,45.30847605,0,12597.64551,11746.4041,2.86e+12,9.2e+11,9.809606987,20.22298424,2.897941681,NA,"9/24/80",1980-09-24,1980-09-24,2323,1343,1981-02-18,3.21e+12,7.75e+11,9.505123174,21.86679331,19.40265969,47.83275098,13992.9227,9879.457435,3.153191192,NA,"United States of America",1995-01-01,"Germany ",1995-01-01,0,0,"Germany",1951-10-01,"United States of America",1948-01-01,1,1,10,10,10,10,1,1
"15",2,"1982",220,1982,220,2,"Q4_2012","USA","USA-AD-62","USA-AD-61","France","FRA","Hot-Rolled Carbon Steel Sheet","1/20/82","8/16/82","3/3/82","A","A","8/16/82","AVD",".",".","W",".",".",".",".",".",".",".",".",".",10,10,1,8,1,0,0,4.251968605,2.311428541,17.53064275,46.25539856,0,14439.01513,10294.31773,3.35e+12,5.75e+11,8.466367713,21.85805772,2.884563848,4.825027741,"1/20/82",1982-01-20,1982-01-20,244,365,1982-08-16,3.35e+12,5.75e+11,8.466367713,21.85805772,17.53064275,46.25539856,14439.01513,10294.31773,2.884563848,4.825027741,"United States of America",1995-01-01,"France ",1995-01-01,0,0,"France",1948-01-01,"United States of America",1948-01-01,1,1,8,8,10,10,1,1
"16",2,"1982",220,1982,220,2,"Q4_2012","USA","USA-AD-95a","USA-AD-95a","France","FRA","Stainless Steel Sheet","5/19/82","12/9/82","6/30/82","A","A","12/9/82","AVD","4/29/83","6/15/83","A","A","6/22/83","AVD","8/11/86","1986","AVD",".",".",".",10,10,1,8,1,0,0,4.251968605,2.311428541,17.53064275,46.25539856,0,14439.01513,10294.31773,3.35e+12,5.75e+11,8.466367713,21.85805772,2.884563848,4.825027741,"5/19/82",1982-05-19,1982-05-19,363,484,1982-12-09,3.35e+12,5.75e+11,8.466367713,21.85805772,17.53064275,46.25539856,14439.01513,10294.31773,2.884563848,4.825027741,"United States of America",1995-01-01,"France ",1995-01-01,0,0,"France",1948-01-01,"United States of America",1948-01-01,1,1,8,8,10,10,1,1
"17",2,"1982",101,1982,101,2,"Q4_2012","USA","USA-AD-88","USA-AD-88","Venezuela","VEN","Carbon Steel Wire Rod","2/18/82","7/23/82","4/1/82","A","A","7/23/82","AVD","12/30/82","2/24/83","A","N",".",".",".",".",".",".",".",".",10,10,1,9,1,0,0,4.251968605,0.008574605,17.53064275,46.94297308,0,14439.01513,4796.237929,3.35e+12,76693647866,8.466367713,22.16343398,2.884563848,5.202821712,"2/18/82",1982-02-18,1982-02-18,1074,394,1982-07-23,3.35e+12,76693647866,8.466367713,22.16343398,17.53064275,46.94297308,14439.01513,4796.237929,2.884563848,5.202821712,"United States of America",1995-01-01,"Venezuela",1995-01-01,0,0,"Venezuela",1990-08-31,"United States of America",1948-01-01,1,0,9,9,10,10,1,1
"18",2,"1982",220,1982,220,2,"Q4_2012","USA","USA-AD-83","USA-AD-82","France","FRA","Carbon Steel Structural Shapes","1/20/82","8/16/82","3/3/82","A","A","8/16/82","AVD",".",".","W",".",".",".",".",".",".",".",".",".",10,10,1,8,1,0,0,4.251968605,2.311428541,17.53064275,46.25539856,0,14439.01513,10294.31773,3.35e+12,5.75e+11,8.466367713,21.85805772,2.884563848,4.825027741,"1/20/82",1982-01-20,1982-01-20,244,365,1982-08-16,3.35e+12,5.75e+11,8.466367713,21.85805772,17.53064275,46.25539856,14439.01513,10294.31773,2.884563848,4.825027741,"United States of America",1995-01-01,"France ",1995-01-01,0,0,"France",1948-01-01,"United States of America",1948-01-01,1,1,8,8,10,10,1,1
"19",2,"1982",220,1982,220,2,"Q4_2012","USA","USA-AD-95b","USA-AD-95a","France","FRA","Stainless Steel Strip","5/19/82","12/9/82","6/30/82","A","A","12/9/82","AVD","4/29/83","6/15/83","A","A","6/22/83","AVD","8/11/86","1986","AVD",".",".",".",10,10,1,8,1,0,0,4.251968605,2.311428541,17.53064275,46.25539856,0,14439.01513,10294.31773,3.35e+12,5.75e+11,8.466367713,21.85805772,2.884563848,4.825027741,"5/19/82",1982-05-19,1982-05-19,363,484,1982-12-09,3.35e+12,5.75e+11,8.466367713,21.85805772,17.53064275,46.25539856,14439.01513,10294.31773,2.884563848,4.825027741,"United States of America",1995-01-01,"France ",1995-01-01,0,0,"France",1948-01-01,"United States of America",1948-01-01,1,1,8,8,10,10,1,1
"20",2,"1982",220,1982,220,2,"Q4_2012","USA","USA-AD-69","USA-AD-68","France","FRA","Cold-Rolled Carbon Steel Sheet","1/20/82","8/16/82","3/3/82","A","A","8/16/82","AVD",".",".","W",".",".",".",".",".",".",".",".",".",10,10,1,8,1,0,0,4.251968605,2.311428541,17.53064275,46.25539856,0,14439.01513,10294.31773,3.35e+12,5.75e+11,8.466367713,21.85805772,2.884563848,4.825027741,"1/20/82",1982-01-20,1982-01-20,244,365,1982-08-16,3.35e+12,5.75e+11,8.466367713,21.85805772,17.53064275,46.25539856,14439.01513,10294.31773,2.884563848,4.825027741,"United States of America",1995-01-01,"France ",1995-01-01,0,0,"France",1948-01-01,"United States of America",1948-01-01,1,1,8,8,10,10,1,1
"21",2,"1982",255,1982,255,2,"Q4_2012","USA","USA-AD-86","USA-AD-82","West Germany","FRG","Carbon Steel Structural Shapes","1/20/82","8/16/82","3/3/82","A","A","8/16/82","AVD",".",".","W",".",".",".",".",".",".",".",".",".",10,10,1,10,1,0,0,4.251968605,1.145470016,17.53064275,48.05843229,0,14439.01513,9593.657326,3.35e+12,7.52e+11,8.466367713,22.66520479,2.884563848,NA,"1/20/82",1982-01-20,1982-01-20,2806,365,1982-08-16,3.35e+12,7.52e+11,8.466367713,22.66520479,17.53064275,48.05843229,14439.01513,9593.657326,2.884563848,NA,"United States of America",1995-01-01,"Germany ",1995-01-01,0,0,"Germany",1951-10-01,"United States of America",1948-01-01,1,1,10,10,10,10,1,1
"22",2,"1982",255,1982,255,2,"Q4_2012","USA","USA-AD-92a","USA-AD-92a","West Germany","FRG","Stainless Steel Sheet","5/5/82","12/17/82","6/23/82","A","A","12/17/82","AVD","5/6/83","6/15/83","A","A","6/23/83","AVD","8/11/86","1986","AVD",".",".",".",10,10,1,10,1,0,0,4.251968605,1.145470016,17.53064275,48.05843229,0,14439.01513,9593.657326,3.35e+12,7.52e+11,8.466367713,22.66520479,2.884563848,NA,"5/5/82",1982-05-05,1982-05-05,2911,470,1982-12-17,3.35e+12,7.52e+11,8.466367713,22.66520479,17.53064275,48.05843229,14439.01513,9593.657326,2.884563848,NA,"United States of America",1995-01-01,"Germany ",1995-01-01,0,0,"Germany",1951-10-01,"United States of America",1948-01-01,1,1,10,10,10,10,1,1
"23",2,"1982",211,1982,211,2,"Q4_2012","USA","USA-AD-82","USA-AD-82","Belgium","BEL","Carbon Steel Structural Shapes","1/20/82","8/16/82","3/3/82","A","A","8/16/82","AVD",".",".","W",".",".",".",".",".",".",".",".",".",10,10,1,10,1,0,0,4.251968605,1.682252213,17.53064275,128.4807001,0,14439.01513,9230.126481,3.35e+12,90974923323,8.466367713,63.17108825,2.884563848,NA,"1/20/82",1982-01-20,1982-01-20,34,365,1982-08-16,3.35e+12,90974923323,8.466367713,63.17108825,17.53064275,128.4807001,14439.01513,9230.126481,2.884563848,NA,"United States of America",1995-01-01,"Belgium ",1995-01-01,0,0,"Belgium",1948-01-01,"United States of America",1948-01-01,1,1,10,10,10,10,1,1
"24",2,"1982",211,1982,211,2,"Q4_2012","USA","USA-AD-61","USA-AD-61","Belgium","BEL","Hot-Rolled Carbon Steel Sheet","1/20/82","8/16/82","3/3/82","A","A","8/16/82","AVD",".",".","W",".",".",".",".",".",".",".",".",".",10,10,1,10,1,0,0,4.251968605,1.682252213,17.53064275,128.4807001,0,14439.01513,9230.126481,3.35e+12,90974923323,8.466367713,63.17108825,2.884563848,NA,"1/20/82",1982-01-20,1982-01-20,34,365,1982-08-16,3.35e+12,90974923323,8.466367713,63.17108825,17.53064275,128.4807001,14439.01513,9230.126481,2.884563848,NA,"United States of America",1995-01-01,"Belgium ",1995-01-01,0,0,"Belgium",1948-01-01,"United States of America",1948-01-01,1,1,10,10,10,10,1,1
"25",2,"1982",155,1982,155,2,"Q4_2012","USA","USA-AD-91b","USA-AD-91a","Chile","CHL","Industrial Grade Sodium Nitrate","4/21/82","11/15/82","6/3/82","A","A","11/15/82","SD","1/28/83","3/16/83","A","A","3/25/83","AVD","4/10/89","1989","AVD",".",".",".",10,10,1,-7,0,0,0,4.251968605,9.254245321,17.53064275,40.62205705,0,14439.01513,2108.53912,3.35e+12,24339421605,8.466367713,19.36858554,2.884563848,5.494167403,"4/21/82",1982-04-21,1982-04-21,3144,456,1982-11-15,3.35e+12,24339421605,8.466367713,19.36858554,17.53064275,40.62205705,14439.01513,2108.53912,2.884563848,5.494167403,"United States of America",1995-01-01,"Chile ",1995-01-01,0,0,"Chile",1949-03-16,"United States of America",1948-01-01,1,1,-7,0,10,10,1,0
"26",2,"1982",200,1982,200,2,"Q4_2012","USA","USA-AD-89","USA-AD-89","United Kingdom","GBR","Concrete Steel Wire Strand","3/16/82","10/6/82","4/28/82","A","A","10/6/82","AVD","12/20/82","2/9/83","A","N",".",".",".",".",".",".",".",".",10,10,1,10,1,0,0,4.251968605,1.346461211,17.53064275,50.43244325,0,14439.01513,8718.267257,3.35e+12,4.91e+11,8.466367713,26.30054012,2.884563848,NA,"3/16/82",1982-03-16,1982-03-16,1047,420,1982-10-06,3.35e+12,4.91e+11,8.466367713,26.30054012,17.53064275,50.43244325,14439.01513,8718.267257,2.884563848,NA,"United States of America",1995-01-01,"United Kingdom",1995-01-01,0,0,"United Kingdom",1948-01-01,"United States of America",1948-01-01,1,1,10,10,10,10,1,1
"27",2,"1982",20,1981,20,2,"Q4_2012","USA","USA-AD-52","USA-AD-52","Canada","CAN","Sheet Piling","11/24/81","6/28/82","1/20/82","A","A","6/28/82","AVD","4/23/91","6/5/91","A","N",".",".",".",".",".",".",".",".",10,10,1,10,1,0,0,4.292749079,9.506829508,19.40265969,52.19417179,0,13992.9227,12279.06036,3.21e+12,3.06e+11,9.505123174,26.48310518,3.153191192,4.217796395,"11/24/81",1981-11-24,1981-11-24,631,308,1982-06-28,3.35e+12,3.13e+11,8.466367713,25.24805602,17.53064275,46.61048287,14439.01513,12437.62509,2.884563848,3.877437918,"United States of America",1995-01-01,"Canada ",1995-01-01,0,0,"Canada",1948-01-01,"United States of America",1948-01-01,1,1,10,10,10,10,1,1
"28",2,"1982",713,1981,713,2,"Q4_2012","USA","USA-AD-49","USA-AD-49","Taiwan","TWN","Fireplace Mesh Panels","8/19/81","1/22/82","10/7/81","A","A","1/22/82","AVD","4/9/82","5/26/82","A","A","6/7/82","AVD","8/12/94","1994","AVD",".",".",".",10,10,1,-7,0,0,0,4.292749079,NA,19.40265969,NA,0,13992.9227,NA,3.21e+12,NA,9.505123174,NA,3.153191192,NA,"8/19/81",1981-08-19,1981-08-19,1187,211,1982-01-22,3.35e+12,NA,8.466367713,NA,17.53064275,NA,14439.01513,NA,2.884563848,NA,"United States of America",1995-01-01,"Taiwan",2002-01-01,0,0,NA,NA,"United States of America",1948-01-01,1,NA,-7,0,10,10,1,0
"29",2,"1982",200,1982,200,2,"Q4_2012","USA","USA-AD-59","USA-AD-53","United Kingdom","GBR","Carbon Steel Plate","1/20/82","8/16/82","3/3/82","A","A","8/16/82","AVD",".",".","W",".",".",".",".",".",".",".",".",".",10,10,1,10,1,0,0,4.251968605,1.346461211,17.53064275,50.43244325,0,14439.01513,8718.267257,3.35e+12,4.91e+11,8.466367713,26.30054012,2.884563848,NA,"1/20/82",1982-01-20,1982-01-20,992,365,1982-08-16,3.35e+12,4.91e+11,8.466367713,26.30054012,17.53064275,50.43244325,14439.01513,8718.267257,2.884563848,NA,"United States of America",1995-01-01,"United Kingdom",1995-01-01,0,0,"United Kingdom",1948-01-01,"United States of America",1948-01-01,1,1,10,10,10,10,1,1
"30",2,"1982",360,1982,360,2,"Q4_2012","USA","USA-AD-58","USA-AD-53","Romania","ROU","Carbon Steel Plate","1/20/82","8/16/82","3/3/82","A","A","8/16/82","AVD",".",".",".","W",".",".",".",".",".",".",".",".",10,10,1,-8,0,0,0,4.251968605,NA,17.53064275,NA,0,14439.01513,NA,3.35e+12,NA,8.466367713,NA,2.884563848,19.92753623,"1/20/82",1982-01-20,1982-01-20,6148,365,1982-08-16,3.35e+12,NA,8.466367713,NA,17.53064275,NA,14439.01513,NA,2.884563848,19.92753623,"United States of America",1995-01-01,"Romania ",1995-01-01,0,0,"Romania",1971-11-14,"United States of America",1948-01-01,1,1,-8,0,10,10,1,0
"31",2,"1982",732,1981,732,2,"Q4_2012","USA","USA-AD-46","USA-AD-45","South Korea","KOR","Steel Wire Nails","7/2/81","2/3/82","8/26/81","A","A","2/3/82","AVD","6/24/82","8/11/82","A","A","8/13/82","AVD","10/1/85","1985","AVD",".",".",".",10,10,1,-5,0,0,0,4.292749079,0.920578222,19.40265969,69.30919988,0,13992.9227,1968.868622,3.21e+12,76240987915,9.505123174,32.12370769,3.153191192,15.79167061,"7/2/81",1981-07-02,1981-07-02,309,163,1982-02-03,3.35e+12,81639218690,8.466367713,31.01995818,17.53064275,64.39931105,14439.01513,2075.941819,2.884563848,14.76295387,"United States of America",1995-01-01,"South Korea",1995-01-01,0,0,"South Korea",1967-04-14,"United States of America",1948-01-01,1,1,-5,0,10,10,1,0
"32",2,"1982",255,1982,255,2,"Q4_2012","USA","USA-AD-74","USA-AD-68","West Germany","FRG","Cold-Rolled Carbon Steel Sheet","1/20/82","5/28/82","3/3/82","A","A","5/28/82","AVD",".",".","W",".",".",".",".",".",".",".",".",".",10,10,1,10,1,0,0,4.251968605,1.145470016,17.53064275,48.05843229,0,14439.01513,9593.657326,3.35e+12,7.52e+11,8.466367713,22.66520479,2.884563848,NA,"1/20/82",1982-01-20,1982-01-20,2806,365,1982-05-28,3.35e+12,7.52e+11,8.466367713,22.66520479,17.53064275,48.05843229,14439.01513,9593.657326,2.884563848,NA,"United States of America",1995-01-01,"Germany ",1995-01-01,0,0,"Germany",1951-10-01,"United States of America",1948-01-01,1,1,10,10,10,10,1,1
"33",2,"1982",325,1982,325,2,"Q4_2012","USA","USA-AD-70","USA-AD-68","Italy","ITA","Cold-Rolled Carbon Steel Sheet","1/20/82","5/28/82","3/3/82","A","A","5/28/82","AVD",".",".","W",".",".",".",".",".",".",".",".",".",10,10,1,10,1,0,0,4.251968605,0.974620632,17.53064275,45.31816347,0,14439.01513,7280.602289,3.35e+12,4.12e+11,8.466367713,22.01175591,2.884563848,NA,"1/20/82",1982-01-20,1982-01-20,206,365,1982-05-28,3.35e+12,4.12e+11,8.466367713,22.01175591,17.53064275,45.31816347,14439.01513,7280.602289,2.884563848,NA,"United States of America",1995-01-01,"Italy ",1995-01-01,0,0,"Italy",1950-05-30,"United States of America",1948-01-01,1,1,10,10,10,10,1,1
"34",2,"1982",740,1982,740,2,"Q4_2012","USA","USA-AD-87a","USA-AD-87a","Japan","JPN","Stainless Steel Pipes","1/28/82","8/25/82","3/16/82","A","A","8/25/82","AVD","1/11/83","2/24/83","A","A","3/1/83","AVD","10/29/85","1985","AVD",".",".",".",10,10,1,10,1,0,0,4.251968605,0.755734911,17.53064275,27.77349585,0,14439.01513,9428.87465,3.35e+12,1.12e+12,8.466367713,14.20206781,2.884563848,NA,"1/28/82",1982-01-28,1982-01-28,560,373,1982-08-25,3.35e+12,1.12e+12,8.466367713,14.20206781,17.53064275,27.77349585,14439.01513,9428.87465,2.884563848,NA,"United States of America",1995-01-01,"Japan ",1995-01-01,0,0,"Japan",1955-09-10,"United States of America",1948-01-01,1,1,10,10,10,10,1,1
"35",2,"1982",200,1982,200,2,"Q4_2012","USA","USA-AD-85","USA-AD-82","United Kingdom","GBR","Carbon Steel Structural Shapes","1/20/82","8/16/82","3/3/82","A","A","8/16/82","AVD",".",".","W",".",".",".",".",".",".",".",".",".",10,10,1,10,1,0,0,4.251968605,1.346461211,17.53064275,50.43244325,0,14439.01513,8718.267257,3.35e+12,4.91e+11,8.466367713,26.30054012,2.884563848,NA,"1/20/82",1982-01-20,1982-01-20,992,365,1982-08-16,3.35e+12,4.91e+11,8.466367713,26.30054012,17.53064275,50.43244325,14439.01513,8718.267257,2.884563848,NA,"United States of America",1995-01-01,"United Kingdom",1995-01-01,0,0,"United Kingdom",1948-01-01,"United States of America",1948-01-01,1,1,10,10,10,10,1,1
"36",2,"1982",255,1982,255,2,"Q4_2012","USA","USA-AD-60","USA-AD-53","West Germany","FRG","Carbon Steel Plate","1/20/82","8/16/82","3/3/82","A","A","8/16/82","AVD",".",".","W",".",".",".",".",".",".",".",".",".",10,10,1,10,1,0,0,4.251968605,1.145470016,17.53064275,48.05843229,0,14439.01513,9593.657326,3.35e+12,7.52e+11,8.466367713,22.66520479,2.884563848,NA,"1/20/82",1982-01-20,1982-01-20,2806,365,1982-08-16,3.35e+12,7.52e+11,8.466367713,22.66520479,17.53064275,48.05843229,14439.01513,9593.657326,2.884563848,NA,"United States of America",1995-01-01,"Germany ",1995-01-01,0,0,"Germany",1951-10-01,"United States of America",1948-01-01,1,1,10,10,10,10,1,1
"37",2,"1982",255,1982,255,2,"Q4_2012","USA","USA-AD-92b","USA-AD-92a","West Germany","FRG","Stainless Steel Strip","5/5/82","12/17/82","6/23/82","A","A","12/17/82","AVD","5/6/83","6/15/83","A","A","6/23/83","AVD","8/11/86","1986","AVD",".",".",".",10,10,1,10,1,0,0,4.251968605,1.145470016,17.53064275,48.05843229,0,14439.01513,9593.657326,3.35e+12,7.52e+11,8.466367713,22.66520479,2.884563848,NA,"5/5/82",1982-05-05,1982-05-05,2911,470,1982-12-17,3.35e+12,7.52e+11,8.466367713,22.66520479,17.53064275,48.05843229,14439.01513,9593.657326,2.884563848,NA,"United States of America",1995-01-01,"Germany ",1995-01-01,0,0,"Germany",1951-10-01,"United States of America",1948-01-01,1,1,10,10,10,10,1,1
"38",2,"1982",713,1982,713,2,"Q4_2012","USA","USA-AD-94","USA-AD-94","Taiwan","TWN","Bicycle Tire and Tubes","5/12/82","12/7/82","6/23/82","A","A","12/7/82","AVD","4/29/83",".","N","T",".",".",".",".",".",".",".",".",10,10,1,-7,0,0,0,4.251968605,NA,17.53064275,NA,0,14439.01513,NA,3.35e+12,NA,8.466367713,NA,2.884563848,NA,"5/12/82",1982-05-12,1982-05-12,1453,477,1982-12-07,3.35e+12,NA,8.466367713,NA,17.53064275,NA,14439.01513,NA,2.884563848,NA,"United States of America",1995-01-01,"Taiwan",2002-01-01,0,0,NA,NA,"United States of America",1948-01-01,1,NA,-7,0,10,10,1,0
"39",2,"1982",155,1982,155,2,"Q4_2012","USA","USA-AD-91a","USA-AD-91a","Chile","CHL","Agricultural Grade Sodium Nitrate","4/21/82","11/15/82","6/3/82","A","A","11/15/82","SD","1/28/83","3/16/83","A","A","3/25/83","AVD","4/10/89","1989","AVD",".",".",".",10,10,1,-7,0,0,0,4.251968605,9.254245321,17.53064275,40.62205705,0,14439.01513,2108.53912,3.35e+12,24339421605,8.466367713,19.36858554,2.884563848,5.494167403,"4/21/82",1982-04-21,1982-04-21,3144,456,1982-11-15,3.35e+12,24339421605,8.466367713,19.36858554,17.53064275,40.62205705,14439.01513,2108.53912,2.884563848,5.494167403,"United States of America",1995-01-01,"Chile ",1995-01-01,0,0,"Chile",1949-03-16,"United States of America",1948-01-01,1,1,-7,0,10,10,1,0
"40",2,"1982",255,1982,255,2,"Q4_2012","USA","USA-AD-67","USA-AD-61","West Germany","FRG","Hot-Rolled Carbon Steel Sheet","1/20/82","8/16/82","3/3/82","A","A","8/16/82","AVD",".",".","W",".",".",".",".",".",".",".",".",".",10,10,1,10,1,0,0,4.251968605,1.145470016,17.53064275,48.05843229,0,14439.01513,9593.657326,3.35e+12,7.52e+11,8.466367713,22.66520479,2.884563848,NA,"1/20/82",1982-01-20,1982-01-20,2806,365,1982-08-16,3.35e+12,7.52e+11,8.466367713,22.66520479,17.53064275,48.05843229,14439.01513,9593.657326,2.884563848,NA,"United States of America",1995-01-01,"Germany ",1995-01-01,0,0,"Germany",1951-10-01,"United States of America",1948-01-01,1,1,10,10,10,10,1,1
"41",2,"1982",211,1982,211,2,"Q4_2012","USA","USA-AD-53","USA-AD-53","Belgium","BEL","Carbon Steel Plate","1/20/82","8/16/82","3/3/82","A","A","8/16/82","AVD",".",".",".","W",".",".",".",".",".",".",".",".",10,10,1,10,1,0,0,4.251968605,1.682252213,17.53064275,128.4807001,0,14439.01513,9230.126481,3.35e+12,90974923323,8.466367713,63.17108825,2.884563848,NA,"1/20/82",1982-01-20,1982-01-20,34,365,1982-08-16,3.35e+12,90974923323,8.466367713,63.17108825,17.53064275,128.4807001,14439.01513,9230.126481,2.884563848,NA,"United States of America",1995-01-01,"Belgium ",1995-01-01,0,0,"Belgium",1948-01-01,"United States of America",1948-01-01,1,1,10,10,10,10,1,1
"42",2,"1982",325,1982,325,2,"Q4_2012","USA","USA-AD-63","USA-AD-61","Italy","ITA","Hot-Rolled Carbon Steel Sheet","1/20/82","8/16/82","3/3/82","A","A","8/16/82","AVD",".",".","W",".",".",".",".",".",".",".",".",".",10,10,1,10,1,0,0,4.251968605,0.974620632,17.53064275,45.31816347,0,14439.01513,7280.602289,3.35e+12,4.12e+11,8.466367713,22.01175591,2.884563848,NA,"1/20/82",1982-01-20,1982-01-20,206,365,1982-08-16,3.35e+12,4.12e+11,8.466367713,22.01175591,17.53064275,45.31816347,14439.01513,7280.602289,2.884563848,NA,"United States of America",1995-01-01,"Italy ",1995-01-01,0,0,"Italy",1950-05-30,"United States of America",1948-01-01,1,1,10,10,10,10,1,1
"43",2,"1982",740,1981,740,2,"Q4_2012","USA","USA-AD-50","USA-AD-50","Japan","JPN","Stainless Clad Plate","10/15/81","3/22/82","12/2/81","A","A","3/22/82","AVD","6/4/82","7/29/82","A","A","8/6/82","AVD","9/20/85","1985","AVD",".",".",".",10,10,1,10,1,0,0,4.292749079,0.82834419,19.40265969,28.10742731,0,13992.9227,10212.37814,3.21e+12,1.2e+12,9.505123174,14.39885882,3.153191192,NA,"10/15/81",1981-10-15,1981-10-15,455,268,1982-03-22,3.35e+12,1.12e+12,8.466367713,14.20206781,17.53064275,27.77349585,14439.01513,9428.87465,2.884563848,NA,"United States of America",1995-01-01,"Japan ",1995-01-01,0,0,"Japan",1955-09-10,"United States of America",1948-01-01,1,1,10,10,10,10,1,1
"44",2,"1982",740,1982,740,2,"Q4_2012","USA","USA-AD-87b","USA-AD-87b","Japan","JPN","Heat Resistent Steel Pipes","1/28/82","8/25/82","3/16/82","A","A","8/25/82","AVD","1/11/83","2/24/83","A","A","3/1/83","AVD","10/29/85","1985","AVD",".",".",".",10,10,1,10,1,0,0,4.251968605,0.755734911,17.53064275,27.77349585,0,14439.01513,9428.87465,3.35e+12,1.12e+12,8.466367713,14.20206781,2.884563848,NA,"1/28/82",1982-01-28,1982-01-28,560,373,1982-08-25,3.35e+12,1.12e+12,8.466367713,14.20206781,17.53064275,27.77349585,14439.01513,9428.87465,2.884563848,NA,"United States of America",1995-01-01,"Japan ",1995-01-01,0,0,"Japan",1955-09-10,"United States of America",1948-01-01,1,1,10,10,10,10,1,1
"45",2,"1983",140,1983,140,2,"Q4_2012","USA","USA-AD-123a","USA-AD-123a","Brazil","BRA","Carbon Steel Plate","2/9/83","9/7/83","3/23/83","A","A","9/7/83","AVD","1/25/84","3/21/84","A","A","3/22/84","AVD","8/21/85","1985","AVD",".",".",".",10,10,1,-3,0,0,0,4.395704635,4.031608227,16.64605151,20.43016279,0,15561.26814,1558.418524,3.64e+12,2.03e+11,7.61386438,11.42182159,2.154627748,10.93790659,"2/9/83",1983-02-09,1983-02-09,1427,750,1983-09-07,3.64e+12,2.03e+11,7.61386438,11.42182159,16.64605151,20.43016279,15561.26814,1558.418524,2.154627748,10.93790659,"United States of America",1995-01-01,"Brazil ",1995-01-01,0,0,"Brazil",1948-07-30,"United States of America",1948-01-01,1,1,-3,2,10,10,1,0
"46",2,"1983",900,1982,900,2,"Q4_2012","USA","USA-AD-108","USA-AD-108","Australia","AUS","Portland Cement","10/6/82","4/29/83","11/17/82","A","A","4/29/83","AVD","9/13/83","11/2/83","A","N",".",".",".",".",".",".",".",".",10,10,1,10,1,0,0,4.251968605,10.84038809,17.53064275,30.36249396,0,14439.01513,12784.76907,3.35e+12,1.94e+11,8.466367713,13.51832371,2.884563848,6.100922656,"10/6/82",1982-10-06,1982-10-06,2521,624,1983-04-29,3.64e+12,1.77e+11,7.61386438,13.57406097,16.64605151,29.2162536,15561.26814,11533.34415,2.154627748,4.435801979,"United States of America",1995-01-01,"Australia ",1995-01-01,0,0,"Australia",1948-01-01,"United States of America",1948-01-01,1,1,10,10,10,10,1,1
"47",2,"1983",380,1982,380,2,"Q4_2012","USA","USA-AD-116","USA-AD-116","Sweden","SWE","Staples","12/29/82","6/2/83","2/9/83","A","A","6/2/83","AVD","10/25/83","12/14/83","A","A","12/20/83","AVD","6/7/94","1994","AVD",".",".",".",10,10,1,10,1,0,0,4.251968605,8.634794335,17.53064275,64.40442787,0,14439.01513,13034.7416,3.35e+12,1.09e+11,8.466367713,32.42252187,2.884563848,4.730189247,"12/29/82",1982-12-29,1982-12-29,83,708,1983-06-02,3.64e+12,99631542565,7.61386438,35.59253029,16.64605151,68.29745315,15561.26814,11961.95796,2.154627748,4.675005845,"United States of America",1995-01-01,"Sweden ",1995-01-01,0,0,"Sweden",1950-04-30,"United States of America",1948-01-01,1,1,10,10,10,10,1,1
"48",2,"1983",20,1983,20,2,"Q4_2012","USA","USA-AD-124","USA-AD-124","Canada","CAN","Fresh Round White Potatoes","2/24/83","8/2/83","4/6/83","A","A","8/2/83","AVD","11/10/83","12/29/83","A","N",".",".",".",".",".",".",".",".",10,10,1,10,1,0,0,4.395704635,9.2418675,16.64605151,46.72121962,0,15561.26814,13368.90674,3.64e+12,3.4e+11,7.61386438,24.98897258,2.154627748,3.472282924,"2/24/83",1983-02-24,1983-02-24,1088,765,1983-08-02,3.64e+12,3.4e+11,7.61386438,24.98897258,16.64605151,46.72121962,15561.26814,13368.90674,2.154627748,3.472282924,"United States of America",1995-01-01,"Canada ",1995-01-01,0,0,"Canada",1948-01-01,"United States of America",1948-01-01,1,1,10,10,10,10,1,1
"49",2,"1983",740,1983,740,2,"Q4_2012","USA","USA-AD-120","USA-AD-120","Japan","JPN","Certain Tapered Roller Bearings","2/2/83","8/30/83","3/23/83","A","A","8/30/83","AVD","1/19/84","3/7/84","A","N",".",".",".",".",".",".",".",".",10,10,1,10,1,0,0,4.395704635,0.741376455,16.64605151,25.60439267,0,15561.26814,10213.95828,3.64e+12,1.22e+12,7.61386438,13.63272182,2.154627748,NA,"2/2/83",1983-02-02,1983-02-02,68,743,1983-08-30,3.64e+12,1.22e+12,7.61386438,13.63272182,16.64605151,25.60439267,15561.26814,10213.95828,2.154627748,NA,"United States of America",1995-01-01,"Japan ",1995-01-01,0,0,"Japan",1955-09-10,"United States of America",1948-01-01,1,1,10,10,10,10,1,1
"50",2,"1983",325,1983,325,2,"Q4_2012","USA","USA-AD-122","USA-AD-120","Italy","ITA","Certain Tapered Roller Bearings","2/2/83","8/30/83","3/23/83","A","A","8/30/83","AVD","1/19/84","3/7/84","A","N",".",".",".",".",".",".",".",".",10,10,1,10,1,0,0,4.395704635,1.104048319,16.64605151,41.86252299,0,15561.26814,7546.574406,3.64e+12,4.27e+11,7.61386438,21.19146591,2.154627748,NA,"2/2/83",1983-02-02,1983-02-02,64,743,1983-08-30,3.64e+12,4.27e+11,7.61386438,21.19146591,16.64605151,41.86252299,15561.26814,7546.574406,2.154627748,NA,"United States of America",1995-01-01,"Italy ",1995-01-01,0,0,"Italy",1950-05-30,"United States of America",1948-01-01,1,1,10,10,10,10,1,1
"51",2,"1983",710,1983,710,2,"Q4_2012","USA","USA-AD-125","USA-AD-125","China","CHN","Potassium Permanganate","3/3/83","8/9/83","4/20/83","A","A","8/9/83","AVD","12/29/83","1/25/84","A","A","1/31/84","AVD","IF","IF","AVD",".",".",".",10,10,1,-7,0,0,0,4.395704635,NA,16.64605151,14.54508987,0,15561.26814,223.2501317,3.64e+12,2.28e+11,7.61386438,7.682585453,2.154627748,33.17965808,"3/3/83",1983-03-03,1983-03-03,904,772,1983-08-09,3.64e+12,2.28e+11,7.61386438,7.682585453,16.64605151,14.54508987,15561.26814,223.2501317,2.154627748,33.17965808,"United States of America",1995-01-01,"China ",2001-12-11,0,0,NA,NA,"United States of America",1948-01-01,1,NA,-7,0,10,10,1,0
"52",2,"1983",710,1982,710,2,"Q4_2012","USA","USA-AD-115","USA-AD-115","China","CHN","Canned Mushrooms","10/29/82","5/20/83","12/8/82","A","A","5/20/83","AVD","10/6/83",".","N","T",".",".",".",".",".",".",".",".",10,10,1,-7,0,0,0,4.251968605,NA,17.53064275,15.12309196,0,14439.01513,201.4428913,3.35e+12,2.03e+11,8.466367713,8.403613907,2.884563848,33.38875625,"10/29/82",1982-10-29,1982-10-29,779,647,1983-05-20,3.64e+12,2.28e+11,7.61386438,7.682585453,16.64605151,14.54508987,15561.26814,223.2501317,2.154627748,33.17965808,"United States of America",1995-01-01,"China ",2001-12-11,0,0,NA,NA,"United States of America",1948-01-01,1,NA,-7,0,10,10,1,0
"53",2,"1983",740,1983,740,2,"Q4_2012","USA","USA-AD-136b","USA-AD-136a","Japan","JPN","Dichloro Isocyanurates","6/15/83","11/18/83","7/27/83","A","A","11/18/83","AVD","2/29/84","4/25/84","A","A","4/27/84","AVD","6/1/95","1995","AVD",".",".",".",10,10,1,10,1,0,0,4.395704635,0.741376455,16.64605151,25.60439267,0,15561.26814,10213.95828,3.64e+12,1.22e+12,7.61386438,13.63272182,2.154627748,NA,"6/15/83",1983-06-15,1983-06-15,201,876,1983-11-18,3.64e+12,1.22e+12,7.61386438,13.63272182,16.64605151,25.60439267,15561.26814,10213.95828,2.154627748,NA,"United States of America",1995-01-01,"Japan ",1995-01-01,0,0,"Japan",1955-09-10,"United States of America",1948-01-01,1,1,10,10,10,10,1,1
"54",2,"1983",255,1982,255,2,"Q4_2012","USA","USA-AD-100","USA-AD-100","West Germany","FRG","Tool Steel","5/21/82","1/12/83","9/22/82","A","A","1/12/83","AVD","6/6/83","7/20/83","A","A","7/25/83","AVD","8/28/86","1986","AVD",".",".",".",10,10,1,10,1,0,0,4.251968605,1.145470016,17.53064275,48.05843229,0,14439.01513,9593.657326,3.35e+12,7.52e+11,8.466367713,22.66520479,2.884563848,NA,"5/21/82",1982-05-21,1982-05-21,2927,486,1983-01-12,3.64e+12,7.46e+11,7.61386438,22.03683238,16.64605151,47.17773597,15561.26814,9545.859342,2.154627748,NA,"United States of America",1995-01-01,"Germany ",1995-01-01,0,0,"Germany",1951-10-01,"United States of America",1948-01-01,1,1,10,10,10,10,1,1
"55",2,"1983",732,1983,732,2,"Q4_2012","USA","USA-AD-131","USA-AD-131","South Korea","KOR","Carbon Steel Pipes/Tubes","5/4/83","10/28/83","6/15/83","A","A","10/28/83","AVD","3/16/84","5/9/84","A","A","5/7/84","AVD","10/21/85","1985","AVD",".",".",".",10,10,1,-5,0,0,0,4.395704635,0.760743427,16.64605151,62.59298815,0,15561.26814,2268.18078,3.64e+12,90524009024,7.61386438,30.78221121,2.154627748,13.49627323,"5/4/83",1983-05-04,1983-05-04,980,834,1983-10-28,3.64e+12,90524009024,7.61386438,30.78221121,16.64605151,62.59298815,15561.26814,2268.18078,2.154627748,13.49627323,"United States of America",1995-01-01,"South Korea",1995-01-01,0,0,"South Korea",1967-04-14,"United States of America",1948-01-01,1,1,-5,0,10,10,1,0
"56",2,"1983",710,1982,710,2,"Q4_2012","USA","USA-AD-101","USA-AD-101","China","CHN","Greige Polyester Cotton Cloth","8/13/82","3/9/83","9/29/82","A","A","3/9/83","AVD","7/28/83","9/14/83","A","A","9/16/83","AVD","7/2/10","2010","AVD",".",".",".",10,10,1,-7,0,0,0,4.251968605,NA,17.53064275,15.12309196,0,14439.01513,201.4428913,3.35e+12,2.03e+11,8.466367713,8.403613907,2.884563848,33.38875625,"8/13/82",1982-08-13,1982-08-13,702,570,1983-03-09,3.64e+12,2.28e+11,7.61386438,7.682585453,16.64605151,14.54508987,15561.26814,223.2501317,2.154627748,33.17965808,"United States of America",1995-01-01,"China ",2001-12-11,0,0,NA,NA,"United States of America",1948-01-01,1,NA,-7,0,10,10,1,0
"57",2,"1983",140,1983,140,2,"Q4_2012","USA","USA-AD-123b","USA-AD-123b","Brazil","BRA","Carbon Steel Sheet","2/9/83","9/7/83","3/23/83","A","A","9/7/83","AVD","1/25/84","3/21/84","A","A","3/22/84","AVD","8/21/85","1985","AVD",".",".",".",10,10,1,-3,0,0,0,4.395704635,4.031608227,16.64605151,20.43016279,0,15561.26814,1558.418524,3.64e+12,2.03e+11,7.61386438,11.42182159,2.154627748,10.93790659,"2/9/83",1983-02-09,1983-02-09,1427,750,1983-09-07,3.64e+12,2.03e+11,7.61386438,11.42182159,16.64605151,20.43016279,15561.26814,1558.418524,2.154627748,10.93790659,"United States of America",1995-01-01,"Brazil ",1995-01-01,0,0,"Brazil",1948-07-30,"United States of America",1948-01-01,1,1,-3,2,10,10,1,0
"58",2,"1983",732,1983,732,2,"Q4_2012","USA","USA-AD-138","USA-AD-138","South Korea","KOR","Rectangular Welded Pipes","7/20/83","10/31/83","9/8/83","A","A","10/31/83","AVD","3/16/84","5/9/84","A","A","5/11/84","AVD","10/21/85","1985","AVD",".",".",".",10,10,1,-5,0,0,0,4.395704635,0.760743427,16.64605151,62.59298815,0,15561.26814,2268.18078,3.64e+12,90524009024,7.61386438,30.78221121,2.154627748,13.49627323,"7/20/83",1983-07-20,1983-07-20,1057,911,1983-10-31,3.64e+12,90524009024,7.61386438,30.78221121,16.64605151,62.59298815,15561.26814,2268.18078,2.154627748,13.49627323,"United States of America",1995-01-01,"South Korea",1995-01-01,0,0,"South Korea",1967-04-14,"United States of America",1948-01-01,1,1,-5,0,10,10,1,0
"59",2,"1983",740,1982,740,2,"Q4_2012","USA","USA-AD-109","USA-AD-108","Japan","JPN","Portland Cement","10/6/82","4/29/83","11/17/82","A","A","4/29/83","AVD","9/13/83","11/2/83","A","N",".",".",".",".",".",".",".",".",10,10,1,10,1,0,0,4.251968605,0.755734911,17.53064275,27.77349585,0,14439.01513,9428.87465,3.35e+12,1.12e+12,8.466367713,14.20206781,2.884563848,NA,"10/6/82",1982-10-06,1982-10-06,811,624,1983-04-29,3.64e+12,1.22e+12,7.61386438,13.63272182,16.64605151,25.60439267,15561.26814,10213.95828,2.154627748,NA,"United States of America",1995-01-01,"Japan ",1995-01-01,0,0,"Japan",1955-09-10,"United States of America",1948-01-01,1,1,10,10,10,10,1,1
"60",2,"1983",380,1982,380,2,"Q4_2012","USA","USA-AD-117","USA-AD-117","Sweden","SWE","Staplers","12/29/82","6/2/83","2/9/83","A","A","6/2/83","AVD","10/25/83","12/14/83","A","A","12/20/83","AVD","6/7/94","1994","AVD",".",".",".",10,10,1,10,1,0,0,4.251968605,8.634794335,17.53064275,64.40442787,0,14439.01513,13034.7416,3.35e+12,1.09e+11,8.466367713,32.42252187,2.884563848,4.730189247,"12/29/82",1982-12-29,1982-12-29,83,708,1983-06-02,3.64e+12,99631542565,7.61386438,35.59253029,16.64605151,68.29745315,15561.26814,11961.95796,2.154627748,4.675005845,"United States of America",1995-01-01,"Sweden ",1995-01-01,0,0,"Sweden",1950-04-30,"United States of America",1948-01-01,1,1,10,10,10,10,1,1
"61",2,"1983",713,1983,713,2,"Q4_2012","USA","USA-AD-135","USA-AD-134","Taiwan","TWN","Color Tv Receivers","5/11/83","10/19/83","6/22/83","A","A","10/19/83","AVD","3/1/84","4/25/84","A","A","4/30/84","AVD","11/23/98","1998","AVD",".",".",".",10,10,1,-7,0,0,0,4.395704635,NA,16.64605151,NA,0,15561.26814,NA,3.64e+12,NA,7.61386438,NA,2.154627748,NA,"5/11/83",1983-05-11,1983-05-11,1817,841,1983-10-19,3.64e+12,NA,7.61386438,NA,16.64605151,NA,15561.26814,NA,2.154627748,NA,"United States of America",1995-01-01,"Taiwan",2002-01-01,0,0,NA,NA,"United States of America",1948-01-01,1,NA,-7,0,10,10,1,0
"62",2,"1983",740,1983,740,2,"Q4_2012","USA","USA-AD-136a","USA-AD-136a","Japan","JPN","Cyanuric Acid","6/15/83","11/18/83","7/27/83","A","A","11/18/83","AVD","2/29/84","4/25/84","A","A","4/27/84","AVD","6/1/95","1995","AVD",".",".",".",10,10,1,10,1,0,0,4.395704635,0.741376455,16.64605151,25.60439267,0,15561.26814,10213.95828,3.64e+12,1.22e+12,7.61386438,13.63272182,2.154627748,NA,"6/15/83",1983-06-15,1983-06-15,201,876,1983-11-18,3.64e+12,1.22e+12,7.61386438,13.63272182,16.64605151,25.60439267,15561.26814,10213.95828,2.154627748,NA,"United States of America",1995-01-01,"Japan ",1995-01-01,0,0,"Japan",1955-09-10,"United States of America",1948-01-01,1,1,10,10,10,10,1,1
"63",2,"1983",713,1982,713,2,"Q4_2012","USA","USA-AD-111","USA-AD-110","Taiwan","TWN","Bicycles","10/6/82","4/29/83","11/17/82","A","A","4/29/83","AVD","7/1/83","9/8/83","A","N",".",".",".",".",".",".",".",".",10,10,1,-7,0,0,0,4.251968605,NA,17.53064275,NA,0,14439.01513,NA,3.35e+12,NA,8.466367713,NA,2.884563848,NA,"10/6/82",1982-10-06,1982-10-06,1600,624,1983-04-29,3.64e+12,NA,7.61386438,NA,16.64605151,NA,15561.26814,NA,2.154627748,NA,"United States of America",1995-01-01,"Taiwan",2002-01-01,0,0,NA,NA,"United States of America",1948-01-01,1,NA,-7,0,10,10,1,0
"64",2,"1983",740,1983,740,2,"Q4_2012","USA","USA-AD-136c","USA-AD-136a","Japan","JPN","Thrichloro Isocyanuric Acid","6/15/83","11/18/83","7/27/83","A","A","11/18/83","AVD","2/29/84","4/25/84","A","A","4/27/84","AVD","6/1/95","1995","AVD",".",".",".",10,10,1,10,1,0,0,4.395704635,0.741376455,16.64605151,25.60439267,0,15561.26814,10213.95828,3.64e+12,1.22e+12,7.61386438,13.63272182,2.154627748,NA,"6/15/83",1983-06-15,1983-06-15,201,876,1983-11-18,3.64e+12,1.22e+12,7.61386438,13.63272182,16.64605151,25.60439267,15561.26814,10213.95828,2.154627748,NA,"United States of America",1995-01-01,"Japan ",1995-01-01,0,0,"Japan",1955-09-10,"United States of America",1948-01-01,1,1,10,10,10,10,1,1
"65",2,"1983",710,1982,710,2,"Q4_2012","USA","USA-AD-103","USA-AD-103","China","CHN","Cotton Shop Towels","9/1/82","3/28/83","10/20/82","A","A","3/28/83","AVD","8/16/83","10/5/83","A","A","10/4/83","AVD","4/11/05","2005","AVD",".",".",".",10,10,1,-7,0,0,0,4.251968605,NA,17.53064275,15.12309196,0,14439.01513,201.4428913,3.35e+12,2.03e+11,8.466367713,8.403613907,2.884563848,33.38875625,"9/1/82",1982-09-01,1982-09-01,721,589,1983-03-28,3.64e+12,2.28e+11,7.61386438,7.682585453,16.64605151,14.54508987,15561.26814,223.2501317,2.154627748,33.17965808,"United States of America",1995-01-01,"China ",2001-12-11,0,0,NA,NA,"United States of America",1948-01-01,1,NA,-7,0,10,10,1,0
"66",2,"1983",52,1982,52,2,"Q4_2012","USA","USA-AD-114","USA-AD-113","Trinidad and Tobago","TTO","Carbon Steel Wire Rod","10/14/82","5/4/83","11/26/82","A","A","5/4/83","AVD","9/22/83","11/7/83","A","A","11/16/83","AVD","12/14/87","1987","AVD",".",".",".",10,10,1,8,1,0,0,4.251968605,0.009795358,17.53064275,76.99877454,0,14439.01513,7129.858966,3.35e+12,7989791256,8.466367713,34.91434457,2.884563848,NA,"10/14/82",1982-10-14,1982-10-14,563,632,1983-05-04,3.64e+12,7799749663,7.61386438,30.74778082,16.64605151,71.38049252,15561.26814,6849.859146,2.154627748,NA,"United States of America",1995-01-01,"Trinidad and Tobago",1995-03-01,0,0,"Trinidad and Tobago",1962-10-23,"United States of America",1948-01-01,1,1,8,8,10,10,1,1
"67",2,"1983",710,1983,710,2,"Q4_2012","USA","USA-AD-130","USA-AD-130","China","CHN","Chloropicrin","4/13/83","9/19/83","6/2/83","A","A","9/19/83","AVD","2/16/84","3/28/84","A","A","3/22/84","AVD","IF","IF","AVD",".",".",".",10,10,1,-7,0,0,0,4.395704635,NA,16.64605151,14.54508987,0,15561.26814,223.2501317,3.64e+12,2.28e+11,7.61386438,7.682585453,2.154627748,33.17965808,"4/13/83",1983-04-13,1983-04-13,945,813,1983-09-19,3.64e+12,2.28e+11,7.61386438,7.682585453,16.64605151,14.54508987,15561.26814,223.2501317,2.154627748,33.17965808,"United States of America",1995-01-01,"China ",2001-12-11,0,0,NA,NA,"United States of America",1948-01-01,1,NA,-7,0,10,10,1,0
"68",2,"1983",230,1983,230,2,"Q4_2012","USA","USA-AD-126","USA-AD-125","Spain","ESP","Potassium Permanganate","3/3/83","8/9/83","4/20/83","A","A","8/9/83","AVD","11/28/83","1/11/84","A","A","1/19/84","AVD","11/24/99","1999","AVD",".",".",".",10,10,1,10,1,0,0,4.395704635,1.957152427,16.64605151,39.78129322,0,15561.26814,4349.979785,3.64e+12,1.66e+11,7.61386438,19.58028085,2.154627748,NA,"3/3/83",1983-03-03,1983-03-03,91,772,1983-08-09,3.64e+12,1.66e+11,7.61386438,19.58028085,16.64605151,39.78129322,15561.26814,4349.979785,2.154627748,NA,"United States of America",1995-01-01,"Spain ",1995-01-01,0,0,"Spain",1963-08-29,"United States of America",1948-01-01,1,1,10,10,10,10,1,1
"69",2,"1983",732,1983,732,2,"Q4_2012","USA","USA-AD-119","USA-AD-118","South Korea","KOR","Polyester Filament Fabric","1/12/83","8/8/83","3/2/83","A","A","8/8/83","AVD","10/27/83","12/14/83","A","N",".",".",".",".",".",".",".",".",10,10,1,-5,0,0,0,4.395704635,0.760743427,16.64605151,62.59298815,0,15561.26814,2268.18078,3.64e+12,90524009024,7.61386438,30.78221121,2.154627748,13.49627323,"1/12/83",1983-01-12,1983-01-12,868,722,1983-08-08,3.64e+12,90524009024,7.61386438,30.78221121,16.64605151,62.59298815,15561.26814,2268.18078,2.154627748,13.49627323,"United States of America",1995-01-01,"South Korea",1995-01-01,0,0,"South Korea",1967-04-14,"United States of America",1948-01-01,1,1,-5,0,10,10,1,0
"70",2,"1983",740,1982,740,2,"Q4_2012","USA","USA-AD-102","USA-AD-102","Japan","JPN","Radio Pagers","8/25/82","2/1/83","10/14/82","A","A","2/1/83","AVD","6/23/83","8/10/83","A","A","8/16/83","AVD","11/14/95","1995","AVD",".",".",".",10,10,1,10,1,0,0,4.251968605,0.755734911,17.53064275,27.77349585,0,14439.01513,9428.87465,3.35e+12,1.12e+12,8.466367713,14.20206781,2.884563848,NA,"8/25/82",1982-08-25,1982-08-25,769,582,1983-02-01,3.64e+12,1.22e+12,7.61386438,13.63272182,16.64605151,25.60439267,15561.26814,10213.95828,2.154627748,NA,"United States of America",1995-01-01,"Japan ",1995-01-01,0,0,"Japan",1955-09-10,"United States of America",1948-01-01,1,1,10,10,10,10,1,1
"71",2,"1983",740,1983,740,2,"Q4_2012","USA","USA-AD-118","USA-AD-118","Japan","JPN","Polyester Filament Fabric","1/12/83","8/8/83","3/2/83","A","A","8/8/83","AVD","1/4/84",".","A","W",".",".",".",".",".",".",".",".",10,10,1,10,1,0,0,4.395704635,0.741376455,16.64605151,25.60439267,0,15561.26814,10213.95828,3.64e+12,1.22e+12,7.61386438,13.63272182,2.154627748,NA,"1/12/83",1983-01-12,1983-01-12,47,722,1983-08-08,3.64e+12,1.22e+12,7.61386438,13.63272182,16.64605151,25.60439267,15561.26814,10213.95828,2.154627748,NA,"United States of America",1995-01-01,"Japan ",1995-01-01,0,0,"Japan",1955-09-10,"United States of America",1948-01-01,1,1,10,10,10,10,1,1
"72",2,"1983",713,1983,713,2,"Q4_2012","USA","USA-AD-132","USA-AD-131","Taiwan","TWN","Carbon Steel Pipes/Tubes","5/4/83","10/28/83","6/15/83","A","A","10/28/83","AVD","3/16/84","5/9/84","A","A","5/7/84","AVD","IF","IF","AVD",".",".",".",10,10,1,-7,0,0,0,4.395704635,NA,16.64605151,NA,0,15561.26814,NA,3.64e+12,NA,7.61386438,NA,2.154627748,NA,"5/4/83",1983-05-04,1983-05-04,1810,834,1983-10-28,3.64e+12,NA,7.61386438,NA,16.64605151,NA,15561.26814,NA,2.154627748,NA,"United States of America",1995-01-01,"Taiwan",2002-01-01,0,0,NA,NA,"United States of America",1948-01-01,1,NA,-7,0,10,10,1,0
"73",2,"1983",140,1982,140,2,"Q4_2012","USA","USA-AD-113","USA-AD-113","Brazil","BRA","Carbon Steel Wire Rod","10/14/82","5/4/83","11/26/82","A","A","5/4/83","AVD","9/22/83","11/7/83","A","A","11/16/83","AVD","9/20/85","1985","AVD",".",".",".",10,10,1,-3,0,0,0,4.251968605,3.199274454,17.53064275,15.88416173,0,14439.01513,2208.832593,3.35e+12,2.82e+11,8.466367713,7.609682701,2.884563848,8.967900584,"10/14/82",1982-10-14,1982-10-14,1309,632,1983-05-04,3.64e+12,2.03e+11,7.61386438,11.42182159,16.64605151,20.43016279,15561.26814,1558.418524,2.154627748,10.93790659,"United States of America",1995-01-01,"Brazil ",1995-01-01,0,0,"Brazil",1948-07-30,"United States of America",1948-01-01,1,1,-3,2,10,10,1,0
"74",2,"1983",732,1983,732,2,"Q4_2012","USA","USA-AD-134","USA-AD-134","South Korea","KOR","Color Tv Receivers","5/11/83","10/19/83","6/22/83","A","A","10/19/83","AVD","3/1/84","4/25/84","A","A","4/30/84","AVD","11/23/98","1998","AVD",".",".",".",10,10,1,-5,0,1,0,4.395704635,0.760743427,16.64605151,62.59298815,0,15561.26814,2268.18078,3.64e+12,90524009024,7.61386438,30.78221121,2.154627748,13.49627323,"5/11/83",1983-05-11,1983-05-11,987,841,1983-10-19,3.64e+12,90524009024,7.61386438,30.78221121,16.64605151,62.59298815,15561.26814,2268.18078,2.154627748,13.49627323,"United States of America",1995-01-01,"South Korea",1995-01-01,0,0,"South Korea",1967-04-14,"United States of America",1948-01-01,1,1,-5,0,10,10,1,0
"75",2,"1984",900,1984,900,2,"Q4_2012","USA","USA-AD-178","USA-AD-178","Australia","AUS","Galvanized Carbon Steel Sheet ","2/23/84","7/25/84","4/4/84","A","A","7/25/84","AVD","12/18/84",".","A","W",".",".",".",".",".",".",".",".",10,10,1,10,1,0,0,4.722805917,9.942111643,17.50934244,28.56675056,0,17134.3157,12454.55172,4.04e+12,1.94e+11,7.483851808,13.55220194,2.570882817,6.133214017,"2/23/84",1984-02-23,1984-02-23,349,1129,1984-07-25,4.04e+12,1.94e+11,7.483851808,13.55220194,17.50934244,28.56675056,17134.3157,12454.55172,2.570882817,6.133214017,"United States of America",1995-01-01,"Australia ",1995-01-01,0,0,"Australia",1948-01-01,"United States of America",1948-01-01,1,1,10,10,10,10,1,1
"76",2,"1984",375,1984,375,2,"Q4_2012","USA","USA-AD-169","USA-AD-169","Finland","FIN","Carbon Steel Plate not in Coils","2/23/84","7/25/84","4/4/84","A","A","7/25/84","AVD","12/14/84",".","A","W",".",".",".",".",".",".",".",".",10,10,1,10,1,0,0,4.722805917,13.53436339,17.50934244,57.43626734,0,17134.3157,10675.99906,4.04e+12,52118124258,7.483851808,29.92160361,2.570882817,8.349472778,"2/23/84",1984-02-23,1984-02-23,895,1129,1984-07-25,4.04e+12,52118124258,7.483851808,29.92160361,17.50934244,57.43626734,17134.3157,10675.99906,2.570882817,8.349472778,"United States of America",1995-01-01,"Finland ",1995-01-01,0,0,"Finland",1950-05-25,"United States of America",1948-01-01,1,1,10,10,10,10,1,1
"77",2,"1984",230,1983,230,2,"Q4_2012","USA","USA-AD-160","USA-AD-157","Spain","ESP","Carbon Steel Wire Rod","11/30/83","5/8/84","1/18/84","A","A","5/8/84","AVD","9/27/84","11/15/84","A","A","11/23/84","AVD","9/16/85","1985","AVD",".",".",".",10,10,1,10,1,0,0,4.395704635,1.957152427,16.64605151,39.78129322,0,15561.26814,4349.979785,3.64e+12,1.66e+11,7.61386438,19.58028085,2.154627748,NA,"11/30/83",1983-11-30,1983-11-30,363,1044,1984-05-08,4.04e+12,1.67e+11,7.483851808,21.86699372,17.50934244,41.62398959,17134.3157,4361.422297,2.570882817,NA,"United States of America",1995-01-01,"Spain ",1995-01-01,0,0,"Spain",1963-08-29,"United States of America",1948-01-01,1,1,10,10,10,10,1,1
"78",2,"1984",230,1984,230,2,"Q4_2012","USA","USA-AD-186","USA-AD-184","Spain","ESP","Potassium Chloride","4/6/84","9/12/84","5/23/84","A","A","9/12/84","AVD","11/26/84",".","W","T",".",".",".",".",".",".",".",".",10,10,1,10,1,0,0,4.722805917,1.853946948,17.50934244,41.62398959,0,17134.3157,4361.422297,4.04e+12,1.67e+11,7.483851808,21.86699372,2.570882817,NA,"4/6/84",1984-04-06,1984-04-06,491,1172,1984-09-12,4.04e+12,1.67e+11,7.483851808,21.86699372,17.50934244,41.62398959,17134.3157,4361.422297,2.570882817,NA,"United States of America",1995-01-01,"Spain ",1995-01-01,0,0,"Spain",1963-08-29,"United States of America",1948-01-01,1,1,10,10,10,10,1,1
"79",2,"1984",230,1984,230,2,"Q4_2012","USA","USA-AD-173","USA-AD-172","Spain","ESP","Carbon Steel Plate in Coils","2/23/84","7/25/84","4/4/84","A","A","7/25/84","AVD","12/13/84",".","W","T",".",".",".",".",".",".",".",".",10,10,1,10,1,0,0,4.722805917,1.853946948,17.50934244,41.62398959,0,17134.3157,4361.422297,4.04e+12,1.67e+11,7.483851808,21.86699372,2.570882817,NA,"2/23/84",1984-02-23,1984-02-23,448,1129,1984-07-25,4.04e+12,1.67e+11,7.483851808,21.86699372,17.50934244,41.62398959,17134.3157,4361.422297,2.570882817,NA,"United States of America",1995-01-01,"Spain ",1995-01-01,0,0,"Spain",1963-08-29,"United States of America",1948-01-01,1,1,10,10,10,10,1,1
"80",2,"1984",230,1984,230,2,"Q4_2012","USA","USA-AD-198","USA-AD-197","Spain","ESP","Carbon Steel Welded Pipes","7/30/84","12/31/84","9/12/84","A","A","12/31/84","AVD",".","2/13/85","W","T",".",".",".",".",".",".",".",".",10,10,1,10,1,0,0,4.722805917,1.853946948,17.50934244,41.62398959,0,17134.3157,4361.422297,4.04e+12,1.67e+11,7.483851808,21.86699372,2.570882817,NA,"7/30/84",1984-07-30,1984-07-30,606,1287,1984-12-31,4.04e+12,1.67e+11,7.483851808,21.86699372,17.50934244,41.62398959,17134.3157,4361.422297,2.570882817,NA,"United States of America",1995-01-01,"Spain ",1995-01-01,0,0,"Spain",1963-08-29,"United States of America",1948-01-01,1,1,10,10,10,10,1,1
"81",2,"1984",160,1983,160,2,"Q4_2012","USA","USA-AD-157","USA-AD-157","Argentina","ARG","Carbon Steel Wire Rod","11/30/83","5/8/84","1/18/84","A","A","5/8/84","AVD","9/27/84","11/15/84","A","A","11/23/84","AVD","2/16/00","2000","AVD",".",".",".",10,10,1,8,1,0,0,4.395704635,3.092859901,16.64605151,14.98767011,0,15561.26814,3532.450473,3.64e+12,1.04e+11,7.61386438,9.151520687,2.154627748,8.658324961,"11/30/83",1983-11-30,1983-11-30,517,1044,1984-05-08,4.04e+12,79092001998,7.483851808,7.589895312,17.50934244,12.34638143,17134.3157,2646.406659,2.570882817,8.345976837,"United States of America",1995-01-01,"Argentina ",1995-01-01,0,0,"Argentina",1967-10-11,"United States of America",1948-01-01,1,1,8,8,10,10,1,1
"82",2,"1984",20,1984,20,2,"Q4_2012","USA","USA-AD-196","USA-AD-196","Canada","CAN","Red Raspberries","7/18/84","12/18/84","8/30/84","A","A","12/18/84","AVD","5/10/85","6/27/85","A","A","6/24/85","AVD","2/26/99","1999","AVD",".",".",".",10,10,1,10,1,0,0,4.722805917,8.797620617,17.50934244,52.69506022,0,17134.3157,13768.8791,4.04e+12,3.54e+11,7.483851808,28.10590854,2.570882817,3.486018072,"7/18/84",1984-07-18,1984-07-18,18,1275,1984-12-18,4.04e+12,3.54e+11,7.483851808,28.10590854,17.50934244,52.69506022,17134.3157,13768.8791,2.570882817,3.486018072,"United States of America",1995-01-01,"Canada ",1995-01-01,0,0,"Canada",1948-01-01,"United States of America",1948-01-01,1,1,10,10,10,10,1,1
"83",2,"1984",230,1984,230,2,"Q4_2012","USA","USA-AD-180","USA-AD-178","Spain","ESP","Galvanized Carbon Steel Sheet ","2/23/84","7/25/84","4/4/84","A","A","7/25/84","AVD","12/13/84",".","W","T",".",".",".",".",".",".",".",".",10,10,1,10,1,0,0,4.722805917,1.853946948,17.50934244,41.62398959,0,17134.3157,4361.422297,4.04e+12,1.67e+11,7.483851808,21.86699372,2.570882817,NA,"2/23/84",1984-02-23,1984-02-23,448,1129,1984-07-25,4.04e+12,1.67e+11,7.483851808,21.86699372,17.50934244,41.62398959,17134.3157,4361.422297,2.570882817,NA,"United States of America",1995-01-01,"Spain ",1995-01-01,0,0,"Spain",1963-08-29,"United States of America",1948-01-01,1,1,10,10,10,10,1,1
"84",2,"1984",710,1983,710,2,"Q4_2012","USA","USA-AD-149","USA-AD-149","China","CHN","Barium Chloride","11/2/83","4/6/84","12/21/83","A","A","4/6/84","AVD","8/27/84","10/17/84","A","A","10/17/84","AVD","IF","IF","AVD",".",".",".",10,10,1,-7,0,0,0,4.395704635,NA,16.64605151,14.54508987,0,15561.26814,223.2501317,3.64e+12,2.28e+11,7.61386438,7.682585453,2.154627748,33.17965808,"11/2/83",1983-11-02,1983-11-02,1148,1016,1984-04-06,4.04e+12,2.57e+11,7.483851808,8.624817694,17.50934244,17.25996606,17134.3157,248.2872451,2.570882817,32.13197666,"United States of America",1995-01-01,"China ",2001-12-11,0,0,NA,NA,"United States of America",1948-01-01,1,NA,-7,0,10,10,1,0
"85",2,"1984",230,1984,230,2,"Q4_2012","USA","USA-AD-171","USA-AD-169","Spain","ESP","Carbon Steel Plate not in Coils","2/23/84","7/25/84","4/4/84","A","A","7/25/84","AVD","12/13/84",".","W","T",".",".",".",".",".",".",".",".",10,10,1,10,1,0,0,4.722805917,1.853946948,17.50934244,41.62398959,0,17134.3157,4361.422297,4.04e+12,1.67e+11,7.483851808,21.86699372,2.570882817,NA,"2/23/84",1984-02-23,1984-02-23,448,1129,1984-07-25,4.04e+12,1.67e+11,7.483851808,21.86699372,17.50934244,41.62398959,17134.3157,4361.422297,2.570882817,NA,"United States of America",1995-01-01,"Spain ",1995-01-01,0,0,"Spain",1963-08-29,"United States of America",1948-01-01,1,1,10,10,10,10,1,1
"86",2,"1984",732,1983,732,2,"Q4_2012","USA","USA-AD-151","USA-AD-151","South Korea","KOR","Hot-Rolled Carbon Steel Plate","11/8/83","4/13/84","12/21/83","A","A","4/13/84","AVD","6/29/84","8/15/84","A","A","8/22/84",".","4/17/86","1986",".",".",".",".",10,10,1,-5,0,0,0,4.395704635,0.760743427,16.64605151,62.59298815,0,15561.26814,2268.18078,3.64e+12,90524009024,7.61386438,30.78221121,2.154627748,13.49627323,"11/8/83",1983-11-08,1983-11-08,1168,1022,1984-04-13,4.04e+12,99983374277,7.483851808,31.10830109,17.50934244,62.47322689,17134.3157,2474.471196,2.570882817,12.65069493,"United States of America",1995-01-01,"South Korea",1995-01-01,0,0,"South Korea",1967-04-14,"United States of America",1948-01-01,1,1,-5,0,10,10,1,0
"87",2,"1984",325,1984,325,2,"Q4_2012","USA","USA-AD-165","USA-AD-165","Italy","ITA","Brass Connectors","2/1/84","7/10/84","3/14/84","A","A","7/10/84","AVD","11/30/84","2/27/85","A","A","3/1/85","AVD","1/14/99","1999","AVD",".",".",".",10,10,1,10,1,0,0,4.722805917,1.267536551,17.50934244,44.20141576,0,17134.3157,7457.105018,4.04e+12,4.22e+11,7.483851808,21.89152927,2.570882817,NA,"2/1/84",1984-02-01,1984-02-01,181,1107,1984-07-10,4.04e+12,4.22e+11,7.483851808,21.89152927,17.50934244,44.20141576,17134.3157,7457.105018,2.570882817,NA,"United States of America",1995-01-01,"Italy ",1995-01-01,0,0,"Italy",1950-05-30,"United States of America",1948-01-01,1,1,10,10,10,10,1,1
"88",2,"1984",740,1983,740,2,"Q4_2012","USA","USA-AD-161","USA-AD-161","Japan","JPN","Titanium Sponge","12/7/83","5/11/84","1/18/84","A","A","5/11/84","AVD","10/1/84","11/15/84","A","A","11/30/84","AVD","8/31/98","1998","AVD",".",".",".",10,10,1,10,1,0,0,4.395704635,0.741376455,16.64605151,25.60439267,0,15561.26814,10213.95828,3.64e+12,1.22e+12,7.61386438,13.63272182,2.154627748,NA,"12/7/83",1983-12-07,1983-12-07,376,1051,1984-05-11,4.04e+12,1.29e+12,7.483851808,14.72016367,17.50934244,26.84113422,17134.3157,10786.78618,2.570882817,NA,"United States of America",1995-01-01,"Japan ",1995-01-01,0,0,"Japan",1955-09-10,"United States of America",1948-01-01,1,1,10,10,10,10,1,1
"89",2,"1984",740,1984,740,2,"Q4_2012","USA","USA-AD-189","USA-AD-189","Japan","JPN","Calcium Hypochlorite","5/9/84","10/9/84","6/20/84","A","A","10/9/84","AVD","2/27/85","4/17/85","A","A","4/18/85",".","2/26/99","1999",".",".",".",".",10,10,1,10,1,0,0,4.722805917,0.661495386,17.50934244,26.84113422,0,17134.3157,10786.78618,4.04e+12,1.29e+12,7.483851808,14.72016367,2.570882817,NA,"5/9/84",1984-05-09,1984-05-09,530,1205,1984-10-09,4.04e+12,1.29e+12,7.483851808,14.72016367,17.50934244,26.84113422,17134.3157,10786.78618,2.570882817,NA,"United States of America",1995-01-01,"Japan ",1995-01-01,0,0,"Japan",1955-09-10,"United States of America",1948-01-01,1,1,10,10,10,10,1,1
"90",2,"1984",100,1983,100,2,"Q4_2012","USA","USA-AD-148","USA-AD-148","Colombia","COL","Fresh Cut Roses","10/13/83","3/14/84","11/25/83","A","A","3/14/84","AVD","8/1/84","9/19/84","A","N",".",".",".",".",".",".",".",".",10,10,1,8,1,0,0,4.395704635,4.761538838,16.64605151,23.67280841,0,15561.26814,1344.632561,3.64e+12,38729822782,7.61386438,10.44484862,2.154627748,19.18011959,"10/13/83",1983-10-13,1983-10-13,432,996,1984-03-14,4.04e+12,38253120738,7.483851808,11.87579493,17.50934244,24.34797231,17134.3157,1299.445674,2.570882817,17.79984867,"United States of America",1995-01-01,"Colombia ",1995-04-30,0,0,"Colombia",1981-10-03,"United States of America",1948-01-01,1,1,8,8,10,10,1,1
"91",2,"1984",740,1983,740,2,"Q4_2012","USA","USA-AD-145","USA-AD-145","Japan","JPN","Certain Steel Valves","10/4/83","4/5/84","11/16/83","A","A","4/5/84","AVD","6/20/84","8/8/84","A","N",".",".",".",".",".",".",".",".",10,10,1,10,1,0,0,4.395704635,0.741376455,16.64605151,25.60439267,0,15561.26814,10213.95828,3.64e+12,1.22e+12,7.61386438,13.63272182,2.154627748,NA,"10/4/83",1983-10-04,1983-10-04,312,987,1984-04-05,4.04e+12,1.29e+12,7.483851808,14.72016367,17.50934244,26.84113422,17134.3157,10786.78618,2.570882817,NA,"United States of America",1995-01-01,"Japan ",1995-01-01,0,0,"Japan",1955-09-10,"United States of America",1948-01-01,1,1,10,10,10,10,1,1
"92",2,"1984",20,1983,20,2,"Q4_2012","USA","USA-AD-155","USA-AD-155","Canada","CAN","Choline Chloride","11/25/83","4/30/84","1/11/84","A","A","4/30/84","AVD","9/18/84","11/7/84","A","A","11/16/84","AVD","10/6/89","1989","AVD",".",".",".",10,10,1,10,1,0,0,4.395704635,9.2418675,16.64605151,46.72121962,0,15561.26814,13368.90674,3.64e+12,3.4e+11,7.61386438,24.98897258,2.154627748,3.472282924,"11/25/83",1983-11-25,1983-11-25,1362,1039,1984-04-30,4.04e+12,3.54e+11,7.483851808,28.10590854,17.50934244,52.69506022,17134.3157,13768.8791,2.570882817,3.486018072,"United States of America",1995-01-01,"Canada ",1995-01-01,0,0,"Canada",1948-01-01,"United States of America",1948-01-01,1,1,10,10,10,10,1,1
"93",2,"1984",255,1983,255,2,"Q4_2012","USA","USA-AD-147","USA-AD-146","West Germany","FRG","Certain Steel Plate","10/14/83","10/9/84","11/21/83","A","A","10/9/84","AVD",".",".","W",".",".",".",".",".",".",".",".",".",10,10,1,10,1,0,0,4.395704635,1.215330931,16.64605151,47.17773597,0,15561.26814,9545.859342,3.64e+12,7.46e+11,7.61386438,22.03683238,2.154627748,NA,"10/14/83",1983-10-14,1983-10-14,378,997,1984-10-09,4.04e+12,7.02e+11,7.483851808,23.59435838,17.50934244,50.06649926,17134.3157,9012.479369,2.570882817,NA,"United States of America",1995-01-01,"Germany ",1995-01-01,0,0,"Germany",1951-10-01,"United States of America",1948-01-01,1,1,10,10,10,10,1,1
"94",2,"1984",140,1983,140,2,"Q4_2012","USA","USA-AD-153","USA-AD-153","Brazil","BRA","Hot-Rolled Carbon Steel Sheet","11/22/83","4/26/84","1/5/84","A","A","4/26/84","AVD","7/11/84","8/29/84","A","A","9/10/84","AVD","8/21/85","1985","AVD",".",".",".",10,10,1,-3,0,0,0,4.395704635,4.031608227,16.64605151,20.43016279,0,15561.26814,1558.418524,3.64e+12,2.03e+11,7.61386438,11.42182159,2.154627748,10.93790659,"11/22/83",1983-11-22,1983-11-22,1713,1036,1984-04-26,4.04e+12,2.09e+11,7.483851808,13.54758492,17.50934244,21.47197221,17134.3157,1567.315607,2.570882817,11.46086133,"United States of America",1995-01-01,"Brazil ",1995-01-01,0,0,"Brazil",1948-07-30,"United States of America",1948-01-01,1,1,-3,2,10,10,1,0
"95",2,"1984",200,1983,200,2,"Q4_2012","USA","USA-AD-162","USA-AD-161","United Kingdom","GBR","Titanium Sponge","12/7/83","5/11/84","1/18/84","A","A","5/11/84","AVD","10/1/84","11/15/84","A","N",".",".",".",".",".",".",".",".",10,10,1,10,1,0,0,4.395704635,1.421589338,16.64605151,51.76847018,0,15561.26814,8266.523695,3.64e+12,4.66e+11,7.61386438,26.49230187,2.154627748,NA,"12/7/83",1983-12-07,1983-12-07,1678,1051,1984-05-11,4.04e+12,4.39e+11,7.483851808,28.32692206,17.50934244,56.46281937,17134.3157,7777.644289,2.570882817,NA,"United States of America",1995-01-01,"United Kingdom",1995-01-01,0,0,"United Kingdom",1948-01-01,"United States of America",1948-01-01,1,1,10,10,10,10,1,1
"96",2,"1984",290,1983,290,2,"Q4_2012","USA","USA-AD-159","USA-AD-157","Poland","POL","Carbon Steel Wire Rod","11/30/83","5/8/84","1/18/84","A","A","5/8/84","AVD","7/20/84","9/12/84","A","N",".",".",".",".",".",".",".",".",10,10,1,-7,0,0,0,4.395704635,NA,16.64605151,NA,0,15561.26814,NA,3.64e+12,NA,7.61386438,NA,2.154627748,NA,"11/30/83",1983-11-30,1983-11-30,773,1044,1984-05-08,4.04e+12,NA,7.483851808,NA,17.50934244,NA,17134.3157,NA,2.570882817,NA,"United States of America",1995-01-01,"Poland ",1995-07-01,0,0,"Poland",1967-10-18,"United States of America",1948-01-01,1,1,-7,0,10,10,1,0
"97",2,"1984",230,1984,230,2,"Q4_2012","USA","USA-AD-177","USA-AD-175","Spain","ESP","Cold-Rolled Carbon Steel Sheet","2/23/84","7/25/84","4/4/84","A","A","7/25/84","AVD","12/13/84",".","W","T",".",".",".",".",".",".",".",".",10,10,1,10,1,0,0,4.722805917,1.853946948,17.50934244,41.62398959,0,17134.3157,4361.422297,4.04e+12,1.67e+11,7.483851808,21.86699372,2.570882817,NA,"2/23/84",1984-02-23,1984-02-23,448,1129,1984-07-25,4.04e+12,1.67e+11,7.483851808,21.86699372,17.50934244,41.62398959,17134.3157,4361.422297,2.570882817,NA,"United States of America",1995-01-01,"Spain ",1995-01-01,0,0,"Spain",1963-08-29,"United States of America",1948-01-01,1,1,10,10,10,10,1,1
"98",2,"1984",740,1984,740,2,"Q4_2012","USA","USA-AD-163","USA-AD-163","Japan","JPN","Certain Cell Cite Transceivers","1/5/84","6/12/84","2/29/84","A","A","6/12/84","AVD","10/26/84","12/12/84","A","A","1/3/85","AVD","11/15/89","1989","AVD",".",".",".",10,10,1,10,1,0,0,4.722805917,0.661495386,17.50934244,26.84113422,0,17134.3157,10786.78618,4.04e+12,1.29e+12,7.483851808,14.72016367,2.570882817,NA,"1/5/84",1984-01-05,1984-01-05,405,1080,1984-06-12,4.04e+12,1.29e+12,7.483851808,14.72016367,17.50934244,26.84113422,17134.3157,10786.78618,2.570882817,NA,"United States of America",1995-01-01,"Japan ",1995-01-01,0,0,"Japan",1955-09-10,"United States of America",1948-01-01,1,1,10,10,10,10,1,1
"99",2,"1984",230,1984,230,2,"Q4_2012","USA","USA-AD-182","USA-AD-181","Spain","ESP","Carbon Steel Angles Shapes","2/23/84","7/25/84","4/4/84","A","A","7/25/84","AVD","12/13/84",".","W","T",".",".",".",".",".",".",".",".",10,10,1,10,1,0,0,4.722805917,1.853946948,17.50934244,41.62398959,0,17134.3157,4361.422297,4.04e+12,1.67e+11,7.483851808,21.86699372,2.570882817,NA,"2/23/84",1984-02-23,1984-02-23,448,1129,1984-07-25,4.04e+12,1.67e+11,7.483851808,21.86699372,17.50934244,41.62398959,17134.3157,4361.422297,2.570882817,NA,"United States of America",1995-01-01,"Spain ",1995-01-01,0,0,"Spain",1963-08-29,"United States of America",1948-01-01,1,1,10,10,10,10,1,1
"100",2,"1984",140,1984,140,2,"Q4_2012","USA","USA-AD-183","USA-AD-183","Brazil","BRA","Carbon Steel Welded Pipes","3/28/84","9/5/84","5/16/84","A","A","9/5/84","AVD","1/28/85",".","A","W",".",".",".",".",".",".",".",".",10,10,1,-3,0,0,0,4.722805917,3.08360431,17.50934244,21.47197221,0,17134.3157,1567.315607,4.04e+12,2.09e+11,7.483851808,13.54758492,2.570882817,11.46086133,"3/28/84",1984-03-28,1984-03-28,1840,1163,1984-09-05,4.04e+12,2.09e+11,7.483851808,13.54758492,17.50934244,21.47197221,17134.3157,1567.315607,2.570882817,11.46086133,"United States of America",1995-01-01,"Brazil ",1995-01-01,0,0,"Brazil",1948-07-30,"United States of America",1948-01-01,1,1,-3,2,10,10,1,0
"101",2,"1984",265,1984,265,2,"Q4_2012","USA","USA-AD-184","USA-AD-184","East Germany","GDR","Potassium Chloride","4/6/84","9/12/84","5/23/84","A","A","9/12/84","AVD","1/31/85",".","N","T",".",".",".",".",".",".",".",".",10,10,1,-9,0,0,0,4.722805917,NA,17.50934244,NA,0,17134.3157,NA,4.04e+12,NA,7.483851808,NA,2.570882817,NA,"4/6/84",1984-04-06,1984-04-06,4722,1172,1984-09-12,4.04e+12,NA,7.483851808,NA,17.50934244,NA,17134.3157,NA,2.570882817,NA,"United States of America",1995-01-01,NA,NA,NA,0,NA,NA,"United States of America",1948-01-01,1,NA,-9,0,10,10,1,0
"102",2,"1984",365,1984,365,2,"Q4_2012","USA","USA-AD-187","USA-AD-184","USSR","USR","Potassium Chloride","4/6/84","9/12/84","5/23/84","A","A","9/12/84","AVD","1/31/85","3/20/85","A","N",".",".",".",".",".",".",".",".",10,10,1,-7,0,0,0,4.722805917,NA,17.50934244,NA,0,17134.3157,NA,4.04e+12,NA,7.483851808,NA,2.570882817,NA,"4/6/84",1984-04-06,1984-04-06,53,1172,1984-09-12,4.04e+12,NA,7.483851808,NA,17.50934244,NA,17134.3157,NA,2.570882817,NA,"United States of America",1995-01-01,"Russia",2012-08-22,0,0,NA,NA,"United States of America",1948-01-01,1,NA,NA,NA,10,10,1,NA
"103",2,"1984",160,1984,160,2,"Q4_2012","USA","USA-AD-175","USA-AD-175","Argentina","ARG","Cold-Rolled Carbon Steel Sheet","2/23/84","7/25/84","4/4/84","A","A","7/25/84","AVD","12/13/84","2/6/85","A","N",".",".",".",".",".",".",".",".",10,10,1,8,1,0,0,4.722805917,3.65363715,17.50934244,12.34638143,0,17134.3157,2646.406659,4.04e+12,79092001998,7.483851808,7.589895312,2.570882817,8.345976837,"2/23/84",1984-02-23,1984-02-23,75,1129,1984-07-25,4.04e+12,79092001998,7.483851808,7.589895312,17.50934244,12.34638143,17134.3157,2646.406659,2.570882817,8.345976837,"United States of America",1995-01-01,"Argentina ",1995-01-01,0,0,"Argentina",1967-10-11,"United States of America",1948-01-01,1,1,8,8,10,10,1,1
"104",2,"1984",713,1983,713,2,"Q4_2012","USA","USA-AD-139","USA-AD-139","Taiwan","TWN","Acrylic Sheet","8/4/83","1/11/84","9/21/83","A","A","1/11/84","AVD","3/23/84","6/1/84","A","N",".",".",".",".",".",".",".",".",10,10,1,-7,0,0,0,4.395704635,NA,16.64605151,NA,0,15561.26814,NA,3.64e+12,NA,7.61386438,NA,2.154627748,NA,"8/4/83",1983-08-04,1983-08-04,1902,926,1984-01-11,4.04e+12,NA,7.483851808,NA,17.50934244,NA,17134.3157,NA,2.570882817,NA,"United States of America",1995-01-01,"Taiwan",2002-01-01,0,0,NA,NA,"United States of America",1948-01-01,1,NA,-7,0,10,10,1,0
"105",2,"1984",140,1984,140,2,"Q4_2012","USA","USA-AD-197","USA-AD-197","Brazil","BRA","Carbon Steel Welded Pipes","7/30/84","12/31/84","9/12/84","A","A","12/31/84","AVD","4/1/85",".","T","W",".",".",".",".",".",".",".",".",10,10,1,-3,0,0,0,4.722805917,3.08360431,17.50934244,21.47197221,0,17134.3157,1567.315607,4.04e+12,2.09e+11,7.483851808,13.54758492,2.570882817,11.46086133,"7/30/84",1984-07-30,1984-07-30,1964,1287,1984-12-31,4.04e+12,2.09e+11,7.483851808,13.54758492,17.50934244,21.47197221,17134.3157,1567.315607,2.570882817,11.46086133,"United States of America",1995-01-01,"Brazil ",1995-01-01,0,0,"Brazil",1948-07-30,"United States of America",1948-01-01,1,1,-3,2,10,10,1,0
"106",2,"1984",230,1984,230,2,"Q4_2012","USA","USA-AD-164","USA-AD-164","Spain","ESP","Stainless Steel Sheet","1/25/84","6/26/84","3/7/84","A","A","6/26/84","AVD","9/10/84","10/31/84","A","N",".",".",".",".",".",".",".",".",10,10,1,10,1,0,0,4.722805917,1.853946948,17.50934244,41.62398959,0,17134.3157,4361.422297,4.04e+12,1.67e+11,7.483851808,21.86699372,2.570882817,NA,"1/25/84",1984-01-25,1984-01-25,419,1100,1984-06-26,4.04e+12,1.67e+11,7.483851808,21.86699372,17.50934244,41.62398959,17134.3157,4361.422297,2.570882817,NA,"United States of America",1995-01-01,"Spain ",1995-01-01,0,0,"Spain",1963-08-29,"United States of America",1948-01-01,1,1,10,10,10,10,1,1
"107",2,"1984",325,1983,325,2,"Q4_2012","USA","USA-AD-152","USA-AD-152","Italy","ITA","Pads for Woodwind Instrument Keys","11/16/83","4/25/84","12/29/83","A","A","4/25/84","AVD","7/11/84","8/29/84","A","A","9/21/84","AVD","11/4/96","1996","AVD",".",".",".",10,10,1,10,1,0,0,4.395704635,1.104048319,16.64605151,41.86252299,0,15561.26814,7546.574406,3.64e+12,4.27e+11,7.61386438,21.19146591,2.154627748,NA,"11/16/83",1983-11-16,1983-11-16,104,1030,1984-04-25,4.04e+12,4.22e+11,7.483851808,21.89152927,17.50934244,44.20141576,17134.3157,7457.105018,2.570882817,NA,"United States of America",1995-01-01,"Italy ",1995-01-01,0,0,"Italy",1950-05-30,"United States of America",1948-01-01,1,1,10,10,10,10,1,1
"108",2,"1985",305,1985,305,2,"Q4_2012","USA","USA-AD-224","USA-AD-224","Austria","AUT","Cold-Rolled Carbon Steel Plate/Sheet ","1/2/85","6/3/85","2/13/85","A","A","6/3/85","AVD","8/19/85",".","N","T",".",".",".",".",".",".",".",".",10,10,1,10,1,0,0,4.237211042,4.546599079,16.57349253,72.51455013,0,18269.27927,9077.859908,4.35e+12,68673874036,6.97540663,36.27688855,2.415286591,3.655327588,"1/2/85",1985-01-02,1985-01-02,589,1443,1985-06-03,4.35e+12,68673874036,6.97540663,36.27688855,16.57349253,72.51455013,18269.27927,9077.859908,2.415286591,3.655327588,"United States of America",1995-01-01,"Austria ",1995-01-01,0,0,"Austria",1951-10-19,"United States of America",1948-01-01,1,1,10,10,10,10,1,1
"109",2,"1985",325,1984,325,2,"Q4_2012","USA","USA-AD-202","USA-AD-202","Italy","ITA","Metal-Framed Stacking Chairs","8/17/84","3/14/85","10/3/84","A","A","3/14/85","AVD","3/29/85","7/17/85","A","N",".",".",".",".",".",".",".",".",10,10,1,10,1,0,0,4.722805917,1.267536551,17.50934244,44.20141576,0,17134.3157,7457.105018,4.04e+12,4.22e+11,7.483851808,21.89152927,2.570882817,NA,"8/17/84",1984-08-17,1984-08-17,379,1305,1985-03-14,4.35e+12,4.36e+11,6.97540663,22.00406536,16.57349253,44.41129722,18269.27927,7698.91226,2.415286591,NA,"United States of America",1995-01-01,"Italy ",1995-01-01,0,0,"Italy",1950-05-30,"United States of America",1948-01-01,1,1,10,10,10,10,1,1
"110",2,"1985",305,1985,305,2,"Q4_2012","USA","USA-AD-249","USA-AD-249","Austria","AUT","Oil Country Tubular Goods","3/11/85","8/14/85","4/24/85","A","A","8/14/85","AVD","1/7/86",".","W","T",".",".",".",".",".",".",".",".",10,10,1,10,1,0,0,4.237211042,4.546599079,16.57349253,72.51455013,0,18269.27927,9077.859908,4.35e+12,68673874036,6.97540663,36.27688855,2.415286591,3.655327588,"3/11/85",1985-03-11,1985-03-11,657,1511,1985-08-14,4.35e+12,68673874036,6.97540663,36.27688855,16.57349253,72.51455013,18269.27927,9077.859908,2.415286591,3.655327588,"United States of America",1995-01-01,"Austria ",1995-01-01,0,0,"Austria",1951-10-19,"United States of America",1948-01-01,1,1,10,10,10,10,1,1
"111",2,"1985",991,1985,991,2,"Q4_2012","USA","USA-AD-240","USA-AD-240","Hong Kong","HKG","Photo Albums/Pages","2/7/85","7/16/85","3/27/85","A","A","7/16/85","AVD","10/29/85","12/12/85","A","A","12/16/85","AVD","7/21/94","1994","AVD",".",".",".",10,10,1,NA,0,0,0,4.237211042,0.322867993,16.57349253,204.3088075,0,18269.27927,6542.931537,4.35e+12,35699543051,6.97540663,107.174035,2.415286591,NA,"2/7/85",1985-02-07,1985-02-07,NA,1479,1985-07-16,4.35e+12,35699543051,6.97540663,107.174035,16.57349253,204.3088075,18269.27927,6542.931537,2.415286591,NA,"United States of America",1995-01-01,"Hong Kong",1995-01-01,0,0,"Hong Kong",1986-04-23,"United States of America",1948-01-01,1,0,NA,NA,10,10,1,NA
"112",2,"1985",140,1984,140,2,"Q4_2012","USA","USA-AD-192","USA-AD-191","Brazil","BRA","Oil Country Tubular Goods","6/25/84","1/16/85","8/6/84","A","A","1/16/85","AVD","6/11/85",".","W","T",".",".",".",".",".",".",".",".",10,10,1,-3,0,0,0,4.722805917,3.08360431,17.50934244,21.47197221,0,17134.3157,1567.315607,4.04e+12,2.09e+11,7.483851808,13.54758492,2.570882817,11.46086133,"6/25/84",1984-06-25,1984-06-25,1929,1252,1985-01-16,4.35e+12,2.23e+11,6.97540663,12.24795967,16.57349253,19.34327423,18269.27927,1636.601162,2.415286591,11.54090033,"United States of America",1995-01-01,"Brazil ",1995-01-01,0,0,"Brazil",1948-07-30,"United States of America",1948-01-01,1,1,7,7,10,10,1,1
"113",2,"1985",265,1985,265,2,"Q4_2012","USA","USA-AD-226","USA-AD-224","East Germany","GDR","Cold-Rolled Carbon Steel Plate/Sheet ","1/2/85","6/3/85","2/13/85","A","A","6/3/85","AVD",".",".",".","W",".",".",".",".",".",".",".",".",10,10,1,-9,0,0,0,4.237211042,NA,16.57349253,NA,0,18269.27927,NA,4.35e+12,NA,6.97540663,NA,2.415286591,NA,"1/2/85",1985-01-02,1985-01-02,4993,1443,1985-06-03,4.35e+12,NA,6.97540663,NA,16.57349253,NA,18269.27927,NA,2.415286591,NA,"United States of America",1995-01-01,NA,NA,NA,0,NA,NA,"United States of America",1948-01-01,1,NA,-9,0,10,10,1,0
"114",2,"1985",360,1985,360,2,"Q4_2012","USA","USA-AD-222","USA-AD-219","Romania","ROU","Hot-Rolled Carbon Steel Sheet","1/2/85","6/3/85","2/13/85","A","A","6/3/85","AVD","7/19/85",".","W","T",".",".",".",".",".",".",".",".",10,10,1,-8,0,0,0,4.237211042,NA,16.57349253,NA,0,18269.27927,NA,4.35e+12,NA,6.97540663,NA,2.415286591,NA,"1/2/85",1985-01-02,1985-01-02,7226,1443,1985-06-03,4.35e+12,NA,6.97540663,NA,16.57349253,NA,18269.27927,NA,2.415286591,NA,"United States of America",1995-01-01,"Romania ",1995-01-01,0,0,"Romania",1971-11-14,"United States of America",1948-01-01,1,1,-8,0,10,10,1,0
"115",2,"1985",740,1984,740,2,"Q4_2012","USA","USA-AD-206","USA-AD-206","Japan","JPN","Neoprene Laminate","10/11/84","3/15/85","11/21/84","A","A","3/15/85","AVD","6/4/85","7/24/85","A","A","7/19/85","AVD","9/2/94","1994","AVD",".",".",".",10,10,1,10,1,0,0,4.722805917,0.661495386,17.50934244,26.84113422,0,17134.3157,10786.78618,4.04e+12,1.29e+12,7.483851808,14.72016367,2.570882817,NA,"10/11/84",1984-10-11,1984-10-11,685,1360,1985-03-15,4.35e+12,1.38e+12,6.97540663,14.09481374,16.57349253,24.85131381,18269.27927,11465.72578,2.415286591,NA,"United States of America",1995-01-01,"Japan ",1995-01-01,0,0,"Japan",1955-09-10,"United States of America",1948-01-01,1,1,10,10,10,10,1,1
"116",2,"1985",140,1985,140,2,"Q4_2012","USA","USA-AD-237","USA-AD-237","Brazil","BRA","12-Hydroxystearic Acid","1/9/85","8/1/85","2/21/85","A","A","8/1/85","AVD","12/19/85",".","N","T",".",".",".",".",".",".",".",".",10,10,1,7,1,0,0,4.237211042,2.610276475,16.57349253,19.34327423,0,18269.27927,1636.601162,4.35e+12,2.23e+11,6.97540663,12.24795967,2.415286591,11.54090033,"1/9/85",1985-01-09,1985-01-09,2127,1450,1985-08-01,4.35e+12,2.23e+11,6.97540663,12.24795967,16.57349253,19.34327423,18269.27927,1636.601162,2.415286591,11.54090033,"United States of America",1995-01-01,"Brazil ",1995-01-01,0,0,"Brazil",1948-07-30,"United States of America",1948-01-01,1,1,7,7,10,10,1,1
"117",2,"1985",920,1985,920,2,"Q4_2012","USA","USA-AD-246","USA-AD-245","New Zealand","NZL","Low-Fuming Copper Wire","2/27/85","8/2/85","4/10/85","A","A","8/2/85","AVD","10/21/85","12/12/85","A","A","12/4/85","AVD","4/1/99","1999","AVD",".",".",".",10,10,1,10,1,0,0,4.237211042,20.76946919,16.57349253,61.41155288,0,18269.27927,7524.006666,4.35e+12,24431202046,6.97540663,29.60241191,2.415286591,7.484062439,"2/27/85",1985-02-27,1985-02-27,216,1499,1985-08-02,4.35e+12,24431202046,6.97540663,29.60241191,16.57349253,61.41155288,18269.27927,7524.006666,2.415286591,7.484062439,"United States of America",1995-01-01,"New Zealand",1995-01-01,0,0,"New Zealand",1948-07-30,"United States of America",1948-01-01,1,1,10,10,10,10,1,1
"118",2,"1985",305,1985,305,2,"Q4_2012","USA","USA-AD-219","USA-AD-219","Austria","AUT","Hot-Rolled Carbon Steel Sheet","1/2/85","6/3/85","2/13/85","A","A","6/3/85","AVD","8/19/85","10/3/85","A","N",".",".",".",".",".",".",".",".",10,10,1,10,1,0,0,4.237211042,4.546599079,16.57349253,72.51455013,0,18269.27927,9077.859908,4.35e+12,68673874036,6.97540663,36.27688855,2.415286591,3.655327588,"1/2/85",1985-01-02,1985-01-02,589,1443,1985-06-03,4.35e+12,68673874036,6.97540663,36.27688855,16.57349253,72.51455013,18269.27927,9077.859908,2.415286591,3.655327588,"United States of America",1995-01-01,"Austria ",1995-01-01,0,0,"Austria",1951-10-19,"United States of America",1948-01-01,1,1,10,10,10,10,1,1
"119",2,"1985",713,1985,713,2,"Q4_2012","USA","USA-AD-272","USA-AD-272","Taiwan","TWN","Welded Carbon Steel Pipe/Tube","7/24/85","12/30/85","9/11/85","A","A","12/30/85","AVD","3/14/86","5/7/86","A","N",".",".",".",".",".",".",".",".",10,10,1,-7,0,0,0,4.237211042,NA,16.57349253,NA,0,18269.27927,NA,4.35e+12,NA,6.97540663,NA,2.415286591,NA,"7/24/85",1985-07-24,1985-07-24,2622,1646,1985-12-30,4.35e+12,NA,6.97540663,NA,16.57349253,NA,18269.27927,NA,2.415286591,NA,"United States of America",1995-01-01,"Taiwan",2002-01-01,0,0,NA,NA,"United States of America",1948-01-01,1,NA,-7,0,10,10,1,0
"120",2,"1985",20,1985,20,2,"Q4_2012","USA","USA-AD-263","USA-AD-262","Canada","CAN","Iron Construction Castings","5/22/85","10/28/85","7/3/85","A","A","10/28/85","AVD","1/16/86","3/5/86","A","A","3/5/86","AVD","IF","IF","AVD",".",".",".",10,10,1,10,1,0,0,4.237211042,8.144492055,16.57349253,53.12375157,0,18269.27927,13991.21455,4.35e+12,3.63e+11,6.97540663,27.73040745,2.415286591,3.4669889,"5/22/85",1985-05-22,1985-05-22,247,1583,1985-10-28,4.35e+12,3.63e+11,6.97540663,27.73040745,16.57349253,53.12375157,18269.27927,13991.21455,2.415286591,3.4669889,"United States of America",1995-01-01,"Canada ",1995-01-01,0,0,"Canada",1948-01-01,"United States of America",1948-01-01,1,1,10,10,10,10,1,1
"121",2,"1985",160,1984,160,2,"Q4_2012","USA","USA-AD-208","USA-AD-208","Argentina","ARG","Barbed Wire","11/28/84","5/3/85","1/9/85","A","A","5/3/85","AVD","9/23/85","11/7/85","A","A","11/13/85","AVD","10/1/09","2009","AVD",".",".",".",10,10,1,8,1,0,0,4.722805917,3.65363715,17.50934244,12.34638143,0,17134.3157,2646.406659,4.04e+12,79092001998,7.483851808,7.589895312,2.570882817,8.345976837,"11/28/84",1984-11-28,1984-11-28,354,1408,1985-05-03,4.35e+12,88416668900,6.97540663,11.73609802,16.57349253,18.00942507,18269.27927,2914.154511,2.415286591,7.634307257,"United States of America",1995-01-01,"Argentina ",1995-01-01,0,0,"Argentina",1967-10-11,"United States of America",1948-01-01,1,1,8,8,10,10,1,1
"122",2,"1985",360,1985,360,2,"Q4_2012","USA","USA-AD-228","USA-AD-224","Romania","ROU","Cold-Rolled Carbon Steel Plate/Sheet ","1/2/85","6/3/85","2/13/85","A","A","6/3/85","AVD","7/19/85",".","W","T",".",".",".",".",".",".",".",".",10,10,1,-8,0,0,0,4.237211042,NA,16.57349253,NA,0,18269.27927,NA,4.35e+12,NA,6.97540663,NA,2.415286591,NA,"1/2/85",1985-01-02,1985-01-02,7226,1443,1985-06-03,4.35e+12,NA,6.97540663,NA,16.57349253,NA,18269.27927,NA,2.415286591,NA,"United States of America",1995-01-01,"Romania ",1995-01-01,0,0,"Romania",1971-11-14,"United States of America",1948-01-01,1,1,-8,0,10,10,1,0
"123",2,"1985",710,1985,710,2,"Q4_2012","USA","USA-AD-265","USA-AD-262","China","CHN","Iron Construction Castings","5/22/85","10/28/85","7/3/85","A","A","10/28/85","AVD","3/19/86","5/7/86","A","A","5/9/86","AVD","IF","IF","AVD",".",".",".",10,10,1,-7,0,0,0,4.237211042,5.121490977,16.57349253,22.4479447,0,18269.27927,291.7756745,4.35e+12,3.07e+11,6.97540663,9.17324163,2.415286591,28.44261852,"5/22/85",1985-05-22,1985-05-22,1715,1583,1985-10-28,4.35e+12,3.07e+11,6.97540663,9.17324163,16.57349253,22.4479447,18269.27927,291.7756745,2.415286591,28.44261852,"United States of America",1995-01-01,"China ",2001-12-11,0,0,NA,NA,"United States of America",1948-01-01,1,NA,-7,0,10,10,1,0
"124",2,"1985",101,1985,101,2,"Q4_2012","USA","USA-AD-223","USA-AD-219","Venezuela","VEN","Hot-Rolled Carbon Steel Sheet","1/2/85","6/3/85","2/13/85","A","A","6/3/85","AVD","7/19/85",".","W","T",".",".",".",".",".",".",".",".",10,10,1,9,1,0,0,4.237211042,0.074505941,16.57349253,42.18387758,0,18269.27927,3344.487963,4.35e+12,57935742247,6.97540663,24.1181488,2.415286591,6.305778873,"1/2/85",1985-01-02,1985-01-02,335,1443,1985-06-03,4.35e+12,57935742247,6.97540663,24.1181488,16.57349253,42.18387758,18269.27927,3344.487963,2.415286591,6.305778873,"United States of America",1995-01-01,"Venezuela",1995-01-01,0,0,"Venezuela",1990-08-31,"United States of America",1948-01-01,1,0,9,9,10,10,1,1
"125",2,"1985",290,1985,290,2,"Q4_2012","USA","USA-AD-216","USA-AD-213","Poland","POL","Carbon Steel Plate ","1/2/85","6/3/85","2/13/85","A","A","6/3/85","AVD","8/19/85",".","W","T",".",".",".",".",".",".",".",".",10,10,1,-7,0,0,0,4.237211042,NA,16.57349253,NA,0,18269.27927,1908.633357,4.35e+12,71004758668,6.97540663,NA,2.415286591,NA,"1/2/85",1985-01-02,1985-01-02,1172,1443,1985-06-03,4.35e+12,71004758668,6.97540663,NA,16.57349253,NA,18269.27927,1908.633357,2.415286591,NA,"United States of America",1995-01-01,"Poland ",1995-07-01,0,0,"Poland",1967-10-18,"United States of America",1948-01-01,1,1,-7,0,10,10,1,0
"126",2,"1985",732,1985,732,2,"Q4_2012","USA","USA-AD-259","USA-AD-259","South Korea","KOR","Offshore Platform Jackets","5/1/85","11/25/85","6/12/85","A","A","11/25/85","AVD","4/7/86","5/21/86","A","A","5/21/86","AVD","10/29/87","1987","AVD",".",".",".",10,10,1,-5,0,0,0,4.237211042,0.768806497,16.57349253,59.01031723,1,18269.27927,2542.04198,4.35e+12,1.04e+11,6.97540663,29.78056913,2.415286591,12.5106833,"5/1/85",1985-05-01,1985-05-01,1708,1562,1985-11-25,4.35e+12,1.04e+11,6.97540663,29.78056913,16.57349253,59.01031723,18269.27927,2542.04198,2.415286591,12.5106833,"United States of America",1995-01-01,"South Korea",1995-01-01,0,0,"South Korea",1967-04-14,"United States of America",1948-01-01,1,1,-5,0,10,10,1,0
"127",2,"1985",230,1984,230,2,"Q4_2012","USA","USA-AD-195","USA-AD-191","Spain","ESP","Oil Country Tubular Goods","6/25/84","1/16/85","8/6/84","A","A","1/16/85","AVD","3/29/85","5/22/85","A","A","5/24/85","AVD","6/30/85","1985","AVD",".",".",".",10,10,1,10,1,0,0,4.722805917,1.853946948,17.50934244,41.62398959,0,17134.3157,4361.422297,4.04e+12,1.67e+11,7.483851808,21.86699372,2.570882817,NA,"6/25/84",1984-06-25,1984-06-25,571,1252,1985-01-16,4.35e+12,1.75e+11,6.97540663,21.41707248,16.57349253,40.94320747,18269.27927,4564.933171,2.415286591,NA,"United States of America",1995-01-01,"Spain ",1995-01-01,0,0,"Spain",1963-08-29,"United States of America",1948-01-01,1,1,10,10,10,10,1,1
"128",2,"1985",20,1984,20,2,"Q4_2012","USA","USA-AD-199","USA-AD-199","Canada","CAN","Dried Salted Codfish","8/1/84","1/29/85","9/12/84","A","A","1/29/85","AVD","5/20/85","7/3/85","A","A","7/8/85","AVD","11/27/89","1989","AVD",".",".",".",10,10,1,10,1,0,0,4.722805917,8.797620617,17.50934244,52.69506022,0,17134.3157,13768.8791,4.04e+12,3.54e+11,7.483851808,28.10590854,2.570882817,3.486018072,"8/1/84",1984-08-01,1984-08-01,32,1289,1985-01-29,4.35e+12,3.63e+11,6.97540663,27.73040745,16.57349253,53.12375157,18269.27927,13991.21455,2.415286591,3.4669889,"United States of America",1995-01-01,"Canada ",1995-01-01,0,0,"Canada",1948-01-01,"United States of America",1948-01-01,1,1,10,10,10,10,1,1
"129",2,"1985",560,1985,560,2,"Q4_2012","USA","USA-AD-247","USA-AD-245","South Africa","ZAF","Low-Fuming Copper Wire","2/27/85","9/23/85","4/10/85","A","A","9/23/85","AVD","12/6/85","1/24/86","A","A","1/29/86","AVD","4/1/99","1999","AVD",".",".",".",10,10,1,4,0,0,0,4.237211042,NA,16.57349253,53.98360374,0,18269.27927,2142.151823,4.35e+12,67066232217,6.97540663,31.41506882,2.415286591,5.190721044,"2/27/85",1985-02-27,1985-02-27,2344,1499,1985-09-23,4.35e+12,67066232217,6.97540663,31.41506882,16.57349253,53.98360374,18269.27927,2142.151823,2.415286591,5.190721044,"United States of America",1995-01-01,"South Africa",1995-01-01,0,0,"South Africa",1948-06-13,"United States of America",1948-01-01,1,1,4,7,10,10,1,0
"130",2,"1985",140,1985,140,2,"Q4_2012","USA","USA-AD-236","USA-AD-236","Brazil","BRA","Hydrogenated Castor Oil","1/9/85","8/1/85","2/21/85","A","A","8/1/85","AVD","12/19/85","2/6/86","A","N",".",".",".",".",".",".",".",".",10,10,1,7,1,0,0,4.237211042,2.610276475,16.57349253,19.34327423,0,18269.27927,1636.601162,4.35e+12,2.23e+11,6.97540663,12.24795967,2.415286591,11.54090033,"1/9/85",1985-01-09,1985-01-09,2127,1450,1985-08-01,4.35e+12,2.23e+11,6.97540663,12.24795967,16.57349253,19.34327423,18269.27927,1636.601162,2.415286591,11.54090033,"United States of America",1995-01-01,"Brazil ",1995-01-01,0,0,"Brazil",1948-07-30,"United States of America",1948-01-01,1,1,7,7,10,10,1,1
"131",2,"1985",740,1984,740,2,"Q4_2012","USA","USA-AD-190","USA-AD-190","Japan","JPN","Stainless Steel Wire Cloth","6/13/84","1/3/85","7/25/84","A","A","1/3/85","AVD","3/15/85",".","A","W",".",".",".",".",".",".",".",".",10,10,1,10,1,0,0,4.722805917,0.661495386,17.50934244,26.84113422,0,17134.3157,10786.78618,4.04e+12,1.29e+12,7.483851808,14.72016367,2.570882817,NA,"6/13/84",1984-06-13,1984-06-13,565,1240,1985-01-03,4.35e+12,1.38e+12,6.97540663,14.09481374,16.57349253,24.85131381,18269.27927,11465.72578,2.415286591,NA,"United States of America",1995-01-01,"Japan ",1995-01-01,0,0,"Japan",1955-09-10,"United States of America",1948-01-01,1,1,10,10,10,10,1,1
"132",2,"1985",740,1985,740,2,"Q4_2012","USA","USA-AD-260","USA-AD-259","Japan","JPN","Offshore Platform Jackets","5/1/85","11/25/85","6/12/85","A","A","11/25/85","AVD","4/7/86","5/21/86","A","A","5/21/86","AVD","10/29/87","1987","AVD",".",".",".",10,10,1,10,1,0,0,4.237211042,0.636076681,16.57349253,24.85131381,0,18269.27927,11465.72578,4.35e+12,1.38e+12,6.97540663,14.09481374,2.415286591,NA,"5/1/85",1985-05-01,1985-05-01,887,1562,1985-11-25,4.35e+12,1.38e+12,6.97540663,14.09481374,16.57349253,24.85131381,18269.27927,11465.72578,2.415286591,NA,"United States of America",1995-01-01,"Japan ",1995-01-01,0,0,"Japan",1955-09-10,"United States of America",1948-01-01,1,1,10,10,10,10,1,1
"133",2,"1985",290,1984,290,2,"Q4_2012","USA","USA-AD-210","USA-AD-208","Poland","POL","Barbed Wire","11/28/84","5/3/85","1/9/85","A","A","5/3/85","AVD","7/22/85",".","A","W",".",".",".",".",".",".",".",".",10,10,1,-7,0,0,0,4.722805917,2.614271902,17.50934244,NA,0,17134.3157,NA,4.04e+12,NA,7.483851808,NA,2.570882817,NA,"11/28/84",1984-11-28,1984-11-28,1137,1408,1985-05-03,4.35e+12,71004758668,6.97540663,NA,16.57349253,NA,18269.27927,1908.633357,2.415286591,NA,"United States of America",1995-01-01,"Poland ",1995-07-01,0,0,"Poland",1967-10-18,"United States of America",1948-01-01,1,1,-7,0,10,10,1,0
"134",2,"1985",345,1985,345,2,"Q4_2012","USA","USA-AD-274","USA-AD-272","Yugoslavia","YUG","Welded Carbon Steel Pipe/Tube","7/24/85","12/31/85","9/11/85","A","A","12/31/85","AVD","3/14/86",".","A","W",".",".",".",".",".",".",".",".",10,10,1,-5,0,0,0,4.237211042,NA,16.57349253,NA,0,18269.27927,NA,4.35e+12,NA,6.97540663,NA,2.415286591,NA,"7/24/85",1985-07-24,1985-07-24,70,1646,1985-12-31,4.35e+12,NA,6.97540663,NA,16.57349253,NA,18269.27927,NA,2.415286591,NA,"United States of America",1995-01-01,NA,NA,NA,0,"Yugoslavia",1966-08-25,"United States of America",1948-01-01,1,1,-5,1,10,10,1,0
"135",2,"1985",345,1985,345,2,"Q4_2012","USA","USA-AD-268","USA-AD-266","Yugoslavia","YUG","Steel Wire Nails","6/13/85","11/20/85","7/31/85","A","A","11/20/85","AVD","2/3/86",".","W","T",".",".",".",".",".",".",".",".",10,10,1,-5,0,0,0,4.237211042,NA,16.57349253,NA,0,18269.27927,NA,4.35e+12,NA,6.97540663,NA,2.415286591,NA,"6/13/85",1985-06-13,1985-06-13,29,1605,1985-11-20,4.35e+12,NA,6.97540663,NA,16.57349253,NA,18269.27927,NA,2.415286591,NA,"United States of America",1995-01-01,NA,NA,NA,0,"Yugoslavia",1966-08-25,"United States of America",1948-01-01,1,1,-5,1,10,10,1,0
"136",2,"1985",235,1985,235,2,"Q4_2012","USA","USA-AD-257","USA-AD-256","Portugal","PRT","Carbon Steel Wire Rod","4/17/85","9/23/85","5/30/85","A","A","9/23/85","AVD",".",".",".","W",".",".",".",".",".",".",".",".",10,10,1,10,1,0,0,4.237211042,7.755641348,16.57349253,62.68704661,0,18269.27927,2669.105187,4.35e+12,26754077447,6.97540663,29.67772314,2.415286591,NA,"4/17/85",1985-04-17,1985-04-17,3190,1548,1985-09-23,4.35e+12,26754077447,6.97540663,29.67772314,16.57349253,62.68704661,18269.27927,2669.105187,2.415286591,NA,"United States of America",1995-01-01,"Portugal ",1995-01-01,0,0,"Portugal",1962-05-06,"United States of America",1948-01-01,1,1,10,10,10,10,1,1
"137",2,"1985",101,1985,101,2,"Q4_2012","USA","USA-AD-217","USA-AD-213","Venezuela","VEN","Carbon Steel Plate ","1/2/85","6/3/85","2/13/85","A","A","6/3/85","AVD","7/19/85",".","W","T",".",".",".",".",".",".",".",".",10,10,1,9,1,0,0,4.237211042,0.074505941,16.57349253,42.18387758,0,18269.27927,3344.487963,4.35e+12,57935742247,6.97540663,24.1181488,2.415286591,6.305778873,"1/2/85",1985-01-02,1985-01-02,335,1443,1985-06-03,4.35e+12,57935742247,6.97540663,24.1181488,16.57349253,42.18387758,18269.27927,3344.487963,2.415286591,6.305778873,"United States of America",1995-01-01,"Venezuela",1995-01-01,0,0,"Venezuela",1990-08-31,"United States of America",1948-01-01,1,0,9,9,10,10,1,1
"138",2,"1985",800,1985,800,2,"Q4_2012","USA","USA-AD-252","USA-AD-252","Thailand","THA","Welded Carbon Steel Pipe/Tube","3/18/85","10/3/85","4/24/85","A","A","10/3/85","AVD","1/27/86","3/3/86","A","A","3/11/86","AVD","IF","IF","AVD",".",".",".",10,10,1,2,0,0,0,4.237211042,9.228846221,16.57349253,49.15522764,0,18269.27927,747.6315992,4.35e+12,38900711298,6.97540663,23.21362918,2.415286591,15.8093702,"3/18/85",1985-03-18,1985-03-18,1841,1518,1985-10-03,4.35e+12,38900711298,6.97540663,23.21362918,16.57349253,49.15522764,18269.27927,747.6315992,2.415286591,15.8093702,"United States of America",1995-01-01,"Thailand ",1995-01-01,0,0,"Thailand",1982-11-20,"United States of America",1948-01-01,1,1,2,3,10,10,1,0
"139",2,"1985",750,1985,750,2,"Q4_2012","USA","USA-AD-271","USA-AD-271","India","IND","Welded Carbon Steel Pipe/Tube","7/24/85","12/31/85","9/11/85","A","A","12/31/85","AVD","3/17/86","5/7/86","A","A","5/12/86","AVD","IF","IF","AVD",".",".",".",10,10,1,8,1,0,0,4.237211042,2.838065918,16.57349253,12.67770807,0,18269.27927,302.645585,4.35e+12,2.37e+11,6.97540663,5.16399437,2.415286591,30.8926173,"7/24/85",1985-07-24,1985-07-24,266,1646,1985-12-31,4.35e+12,2.37e+11,6.97540663,5.16399437,16.57349253,12.67770807,18269.27927,302.645585,2.415286591,30.8926173,"United States of America",1995-01-01,"India ",1995-01-01,0,0,"India",1948-07-08,"United States of America",1948-01-01,1,1,8,8,10,10,1,1
"140",2,"1985",732,1985,732,2,"Q4_2012","USA","USA-AD-241","USA-AD-240","South Korea","KOR","Photo Albums/Pages","2/7/85","7/16/85","3/27/85","A","A","7/16/85","AVD","10/29/85","12/12/85","A","A","12/16/85","AVD","3/21/97","1997","AVD",".",".",".",10,10,1,-5,0,0,0,4.237211042,0.768806497,16.57349253,59.01031723,1,18269.27927,2542.04198,4.35e+12,1.04e+11,6.97540663,29.78056913,2.415286591,12.5106833,"2/7/85",1985-02-07,1985-02-07,1625,1479,1985-07-16,4.35e+12,1.04e+11,6.97540663,29.78056913,16.57349253,59.01031723,18269.27927,2542.04198,2.415286591,12.5106833,"United States of America",1995-01-01,"South Korea",1995-01-01,0,0,"South Korea",1967-04-14,"United States of America",1948-01-01,1,1,-5,0,10,10,1,0
"141",2,"1985",740,1984,740,2,"Q4_2012","USA","USA-AD-207","USA-AD-207","Japan","JPN","Cellular Telephones","11/15/84","6/11/85","12/27/84","A","A","6/11/85","AVD","10/31/85","12/17/85","A","A","12/19/85","AVD","4/1/99","1999","AVD",".",".",".",10,10,1,10,1,0,0,4.722805917,0.661495386,17.50934244,26.84113422,0,17134.3157,10786.78618,4.04e+12,1.29e+12,7.483851808,14.72016367,2.570882817,NA,"11/15/84",1984-11-15,1984-11-15,720,1395,1985-06-11,4.35e+12,1.38e+12,6.97540663,14.09481374,16.57349253,24.85131381,18269.27927,11465.72578,2.415286591,NA,"United States of America",1995-01-01,"Japan ",1995-01-01,0,0,"Japan",1955-09-10,"United States of America",1948-01-01,1,1,10,10,10,10,1,1
"142",2,"1985",385,1985,385,2,"Q4_2012","USA","USA-AD-234","USA-AD-234","Norway","NOR","Carbon Steel Angles Shapes","1/2/85","6/3/85","2/13/85","A","A","6/3/85","AVD","10/23/85","12/12/85","A","N",".",".",".",".",".",".",".",".",10,10,1,10,1,0,0,4.237211042,1.841658894,16.57349253,78.12617662,0,18269.27927,15474.28114,4.35e+12,64257200019,6.97540663,42.73811075,2.415286591,3.312864207,"1/2/85",1985-01-02,1985-01-02,1176,1443,1985-06-03,4.35e+12,64257200019,6.97540663,42.73811075,16.57349253,78.12617662,18269.27927,15474.28114,2.415286591,3.312864207,"United States of America",1995-01-01,"Norway ",1995-01-01,0,0,"Norway",1948-07-10,"United States of America",1948-01-01,1,1,10,10,10,10,1,1
"143",2,"1985",265,1985,265,2,"Q4_2012","USA","USA-AD-214","USA-AD-213","East Germany","GDR","Carbon Steel Plate ","1/2/85","6/3/85","2/13/85","A","A","6/3/85","AVD",".",".",".","W",".",".",".",".",".",".",".",".",10,10,1,-9,0,0,0,4.237211042,NA,16.57349253,NA,0,18269.27927,NA,4.35e+12,NA,6.97540663,NA,2.415286591,NA,"1/2/85",1985-01-02,1985-01-02,4993,1443,1985-06-03,4.35e+12,NA,6.97540663,NA,16.57349253,NA,18269.27927,NA,2.415286591,NA,"United States of America",1995-01-01,NA,NA,NA,0,NA,NA,"United States of America",1948-01-01,1,NA,-9,0,10,10,1,0
"144",2,"1985",20,1985,20,2,"Q4_2012","USA","USA-AD-239","USA-AD-239","Canada","CAN","Rock Salt","2/6/85","7/15/85","3/20/85","A","A","7/15/85","AVD","12/4/85","1/24/86","A","N",".",".",".",".",".",".",".",".",10,10,1,10,1,0,0,4.237211042,8.144492055,16.57349253,53.12375157,0,18269.27927,13991.21455,4.35e+12,3.63e+11,6.97540663,27.73040745,2.415286591,3.4669889,"2/6/85",1985-02-06,1985-02-06,142,1478,1985-07-15,4.35e+12,3.63e+11,6.97540663,27.73040745,16.57349253,53.12375157,18269.27927,13991.21455,2.415286591,3.4669889,"United States of America",1995-01-01,"Canada ",1995-01-01,0,0,"Canada",1948-01-01,"United States of America",1948-01-01,1,1,10,10,10,10,1,1
"145",2,"1985",140,1985,140,2,"Q4_2012","USA","USA-AD-262","USA-AD-262","Brazil","BRA","Iron Construction Castings","5/22/85","10/28/85","7/3/85","A","A","10/28/85","AVD","3/19/86","5/7/86","A","A","5/9/86","AVD","IF","IF","AVD",".",".",".",10,10,1,7,1,0,0,4.237211042,2.610276475,16.57349253,19.34327423,0,18269.27927,1636.601162,4.35e+12,2.23e+11,6.97540663,12.24795967,2.415286591,11.54090033,"5/22/85",1985-05-22,1985-05-22,62,1583,1985-10-28,4.35e+12,2.23e+11,6.97540663,12.24795967,16.57349253,19.34327423,18269.27927,1636.601162,2.415286591,11.54090033,"United States of America",1995-01-01,"Brazil ",1995-01-01,0,0,"Brazil",1948-07-30,"United States of America",1948-01-01,1,1,7,7,10,10,1,1
"146",2,"1985",101,1984,101,2,"Q4_2012","USA","USA-AD-212","USA-AD-212","Venezuela","VEN","Carbon Steel Standard/Line Pipe","12/27/84","6/3/85","2/7/85","A","N","6/3/85","AVD","10/23/85",".","W","T",".",".",".",".",".",".",".",".",10,10,1,9,1,0,0,4.722805917,0.018193471,17.50934244,45.58944582,0,17134.3157,3317.108288,4.04e+12,55952339080,7.483851808,26.81107272,2.570882817,5.556488729,"12/27/84",1984-12-27,1984-12-27,329,1437,1985-06-03,4.35e+12,57935742247,6.97540663,24.1181488,16.57349253,42.18387758,18269.27927,3344.487963,2.415286591,6.305778873,"United States of America",1995-01-01,"Venezuela",1995-01-01,0,0,"Venezuela",1990-08-31,"United States of America",1948-01-01,1,0,9,9,10,10,1,1
"147",2,"1985",20,1984,20,2,"Q4_2012","USA","USA-AD-201","USA-AD-201","Canada","CAN","Egg Filler Flats","8/15/84","1/16/85","9/26/84","A","A","1/16/85","AVD","6/7/85","7/24/85","A","N",".",".",".",".",".",".",".",".",10,10,1,10,1,0,0,4.722805917,8.797620617,17.50934244,52.69506022,0,17134.3157,13768.8791,4.04e+12,3.54e+11,7.483851808,28.10590854,2.570882817,3.486018072,"8/15/84",1984-08-15,1984-08-15,46,1303,1985-01-16,4.35e+12,3.63e+11,6.97540663,27.73040745,16.57349253,53.12375157,18269.27927,13991.21455,2.415286591,3.4669889,"United States of America",1995-01-01,"Canada ",1995-01-01,0,0,"Canada",1948-01-01,"United States of America",1948-01-01,1,1,10,10,10,10,1,1
"148",2,"1985",101,1985,101,2,"Q4_2012","USA","USA-AD-253","USA-AD-253","Venezuela","VEN","Carbon Steel Line Pipe","3/18/85","8/13/85","4/24/85","A","A","8/13/85","AVD","11/27/85",".","W","T",".",".",".",".",".",".",".",".",10,10,1,9,1,0,0,4.237211042,0.074505941,16.57349253,42.18387758,0,18269.27927,3344.487963,4.35e+12,57935742247,6.97540663,24.1181488,2.415286591,6.305778873,"3/18/85",1985-03-18,1985-03-18,410,1518,1985-08-13,4.35e+12,57935742247,6.97540663,24.1181488,16.57349253,42.18387758,18269.27927,3344.487963,2.415286591,6.305778873,"United States of America",1995-01-01,"Venezuela",1995-01-01,0,0,"Venezuela",1990-08-31,"United States of America",1948-01-01,1,0,9,9,10,10,1,1
"149",2,"1985",710,1985,710,2,"Q4_2012","USA","USA-AD-244","USA-AD-244","China","CHN","Paint Brushes","3/6/85","8/5/85","4/17/85","A","A","8/5/85","AVD","12/26/85","2/6/86","A","A","2/14/86","AVD","7/30/10","2010","AVD",".",".",".",10,10,1,-7,0,0,0,4.237211042,5.121490977,16.57349253,22.4479447,0,18269.27927,291.7756745,4.35e+12,3.07e+11,6.97540663,9.17324163,2.415286591,28.44261852,"3/6/85",1985-03-06,1985-03-06,1638,1506,1985-08-05,4.35e+12,3.07e+11,6.97540663,9.17324163,16.57349253,22.4479447,18269.27927,291.7756745,2.415286591,28.44261852,"United States of America",1995-01-01,"China ",2001-12-11,0,0,NA,NA,"United States of America",1948-01-01,1,NA,-7,0,10,10,1,0
"150",2,"1985",740,1985,740,2,"Q4_2012","USA","USA-AD-270","USA-AD-270","Japan","JPN","64K Drams","7/3/85","12/11/85","8/14/85","A","A","12/11/85","AVD","4/29/86","6/11/86","A","A","6/16/86","AVD","10/22/93","1993","AVD",".",".",".",10,10,1,10,1,0,0,4.237211042,0.636076681,16.57349253,24.85131381,0,18269.27927,11465.72578,4.35e+12,1.38e+12,6.97540663,14.09481374,2.415286591,NA,"7/3/85",1985-07-03,1985-07-03,950,1625,1985-12-11,4.35e+12,1.38e+12,6.97540663,14.09481374,16.57349253,24.85131381,18269.27927,11465.72578,2.415286591,NA,"United States of America",1995-01-01,"Japan ",1995-01-01,0,0,"Japan",1955-09-10,"United States of America",1948-01-01,1,1,10,10,10,10,1,1
"151",2,"1985",160,1984,160,2,"Q4_2012","USA","USA-AD-191","USA-AD-191","Argentina","ARG","Oil Country Tubular Goods","6/25/84","1/16/85","8/6/84","A","A","1/16/85","AVD","3/29/85","5/22/85","A","N",".",".",".",".",".",".",".",".",10,10,1,8,1,0,0,4.722805917,3.65363715,17.50934244,12.34638143,0,17134.3157,2646.406659,4.04e+12,79092001998,7.483851808,7.589895312,2.570882817,8.345976837,"6/25/84",1984-06-25,1984-06-25,198,1252,1985-01-16,4.35e+12,88416668900,6.97540663,11.73609802,16.57349253,18.00942507,18269.27927,2914.154511,2.415286591,7.634307257,"United States of America",1995-01-01,"Argentina ",1995-01-01,0,0,"Argentina",1967-10-11,"United States of America",1948-01-01,1,1,8,8,10,10,1,1
"152",2,"1985",265,1984,265,2,"Q4_2012","USA","USA-AD-205","USA-AD-205","East Germany","GDR","Carbon Steel Wire Rod","10/3/84","3/12/85","11/21/84","A","A","3/12/85","AVD",".","8/7/85","W","T",".",".",".",".",".",".",".",".",10,10,1,-9,0,0,0,4.722805917,NA,17.50934244,NA,0,17134.3157,NA,4.04e+12,NA,7.483851808,NA,2.570882817,NA,"10/3/84",1984-10-03,1984-10-03,4902,1352,1985-03-12,4.35e+12,NA,6.97540663,NA,16.57349253,NA,18269.27927,NA,2.415286591,NA,"United States of America",1995-01-01,NA,NA,NA,0,NA,NA,"United States of America",1948-01-01,1,NA,-9,0,10,10,1,0
"153",2,"1985",101,1985,101,2,"Q4_2012","USA","USA-AD-229","USA-AD-224","Venezuela","VEN","Cold-Rolled Carbon Steel Plate/Sheet ","1/2/85","6/3/85","2/13/85","A","A","6/3/85","AVD","7/19/85",".","W","T",".",".",".",".",".",".",".",".",10,10,1,9,1,0,0,4.237211042,0.074505941,16.57349253,42.18387758,0,18269.27927,3344.487963,4.35e+12,57935742247,6.97540663,24.1181488,2.415286591,6.305778873,"1/2/85",1985-01-02,1985-01-02,335,1443,1985-06-03,4.35e+12,57935742247,6.97540663,24.1181488,16.57349253,42.18387758,18269.27927,3344.487963,2.415286591,6.305778873,"United States of America",1995-01-01,"Venezuela",1995-01-01,0,0,"Venezuela",1990-08-31,"United States of America",1948-01-01,1,0,9,9,10,10,1,1
"154",2,"1985",750,1985,750,2,"Q4_2012","USA","USA-AD-264","USA-AD-262","India","IND","Iron Construction Castings","5/22/85","10/28/85","7/3/85","A","A","10/28/85","AVD","3/19/86","5/7/86","A","A","5/9/86","AVD","2/6/91","1991","AVD",".",".",".",10,10,1,8,1,0,0,4.237211042,2.838065918,16.57349253,12.67770807,0,18269.27927,302.645585,4.35e+12,2.37e+11,6.97540663,5.16399437,2.415286591,30.8926173,"5/22/85",1985-05-22,1985-05-22,203,1583,1985-10-28,4.35e+12,2.37e+11,6.97540663,5.16399437,16.57349253,12.67770807,18269.27927,302.645585,2.415286591,30.8926173,"United States of America",1995-01-01,"India ",1995-01-01,0,0,"India",1948-07-08,"United States of America",1948-01-01,1,1,8,8,10,10,1,1
"155",2,"1985",290,1985,290,2,"Q4_2012","USA","USA-AD-235","USA-AD-234","Poland","POL","Carbon Steel Angles Shapes","1/2/85","6/3/85","2/13/85","A","A","6/3/85","AVD","8/7/85",".","T","W",".",".",".",".",".",".",".",".",10,10,1,-7,0,0,0,4.237211042,NA,16.57349253,NA,0,18269.27927,1908.633357,4.35e+12,71004758668,6.97540663,NA,2.415286591,NA,"1/2/85",1985-01-02,1985-01-02,1172,1443,1985-06-03,4.35e+12,71004758668,6.97540663,NA,16.57349253,NA,18269.27927,1908.633357,2.415286591,NA,"United States of America",1995-01-01,"Poland ",1995-07-01,0,0,"Poland",1967-10-18,"United States of America",1948-01-01,1,1,-7,0,10,10,1,0
"156",2,"1985",713,1984,713,2,"Q4_2012","USA","USA-AD-211","USA-AD-296","Taiwan","TWN","Rectangular Pipe","12/27/84","7/22/85","2/7/85","A","A","7/22/85","AVD","12/12/85","1/24/86","A","N",".",".",".",".",".",".",".",".",10,10,1,-7,0,0,0,4.722805917,NA,17.50934244,NA,0,17134.3157,NA,4.04e+12,NA,7.483851808,NA,2.570882817,NA,"12/27/84",1984-12-27,1984-12-27,2413,1437,1985-07-22,4.35e+12,NA,6.97540663,NA,16.57349253,NA,18269.27927,NA,2.415286591,NA,"United States of America",1995-01-01,"Taiwan",2002-01-01,0,0,NA,NA,"United States of America",1948-01-01,1,NA,-7,0,10,10,1,0
"157",2,"1985",140,1985,140,2,"Q4_2012","USA","USA-AD-248","USA-AD-248","Brazil","BRA","Ethyl Alcohol","3/6/85","9/25/85","4/17/85","A","A","9/25/85","AVD","2/14/86","3/19/86","A","N",".",".",".",".",".",".",".",".",10,10,1,7,1,0,0,4.237211042,2.610276475,16.57349253,19.34327423,0,18269.27927,1636.601162,4.35e+12,2.23e+11,6.97540663,12.24795967,2.415286591,11.54090033,"3/6/85",1985-03-06,1985-03-06,2183,1506,1985-09-25,4.35e+12,2.23e+11,6.97540663,12.24795967,16.57349253,19.34327423,18269.27927,1636.601162,2.415286591,11.54090033,"United States of America",1995-01-01,"Brazil ",1995-01-01,0,0,"Brazil",1948-07-30,"United States of America",1948-01-01,1,1,7,7,10,10,1,1
"158",2,"1985",140,1984,140,2,"Q4_2012","USA","USA-AD-209","USA-AD-208","Brazil","BRA","Barbed Wire","11/28/84","5/3/85","1/9/85","A","A","5/3/85","AVD",".","8/14/85","T","W",".",".",".",".",".",".",".",".",10,10,1,-3,0,0,0,4.722805917,3.08360431,17.50934244,21.47197221,0,17134.3157,1567.315607,4.04e+12,2.09e+11,7.483851808,13.54758492,2.570882817,11.46086133,"11/28/84",1984-11-28,1984-11-28,2085,1408,1985-05-03,4.35e+12,2.23e+11,6.97540663,12.24795967,16.57349253,19.34327423,18269.27927,1636.601162,2.415286591,11.54090033,"United States of America",1995-01-01,"Brazil ",1995-01-01,0,0,"Brazil",1948-07-30,"United States of America",1948-01-01,1,1,7,7,10,10,1,1
"159",2,"1985",70,1984,70,2,"Q4_2012","USA","USA-AD-194","USA-AD-191","Mexico","MEX","Oil Country Tubular Goods","6/25/84","1/16/85","8/6/84","A","A","1/16/85","AVD","6/10/85",".","W","T",".",".",".",".",".",".",".",".",10,10,1,-3,0,0,0,4.722805917,1.322611459,17.50934244,26.93378077,0,17134.3157,2300.32245,4.04e+12,1.76e+11,7.483851808,17.38113668,2.570882817,9.392467013,"6/25/84",1984-06-25,1984-06-25,572,1252,1985-01-16,4.35e+12,1.84e+11,6.97540663,15.41489157,16.57349253,25.74873857,18269.27927,2369.312247,2.415286591,10.07199469,"United States of America",1995-01-01,"Mexico ",1995-01-01,0,0,"Mexico",1986-08-24,"United States of America",1948-01-01,1,0,-3,1,10,10,1,0
"160",2,"1986",130,1986,130,2,"Q4_2012","USA","USA-AD-331","USA-AD-327","Ecuador","ECU","Fresh Cut Flowers","6/6/86","11/3/86","7/16/86","A","A","11/3/86","AVD","1/20/87","3/19/87","A","P","3/18/87","AVD","10/19/99","1999","AVD",".",".",".",10,10,1,8,1,0,0,4.281799448,1.018945149,16.86019912,33.11060448,0,19114.82387,1666.937229,4.59e+12,15314143988,6.993311693,15.62940348,2.218254935,21.85230531,"6/6/86",1986-06-06,1986-06-06,665,1963,1986-11-03,4.59e+12,15314143988,6.993311693,15.62940348,16.86019912,33.11060448,19114.82387,1666.937229,2.218254935,21.85230531,"United States of America",1995-01-01,"Ecuador ",1996-01-21,0,0,NA,NA,"United States of America",1948-01-01,1,NA,8,8,10,10,1,1
"161",2,"1986",830,1985,830,2,"Q4_2012","USA","USA-AD-294","USA-AD-292","Singapore","SGP","Carbon Steel Standard Pipe","11/20/85","4/29/86","1/8/86","A","A","4/29/86","AVD","9/18/86","10/13/86","A","N",".",".",".",".",".",".",".",".",10,10,1,-2,0,0,0,4.237211042,4.425608489,16.57349253,304.4346571,0,18269.27927,6781.817642,4.35e+12,18555053067,6.97540663,152.3673632,2.415286591,0.958114317,"11/20/85",1985-11-20,1985-11-20,9665,1765,1986-04-29,4.59e+12,18762738721,6.993311693,148.8707431,16.86019912,295.1035754,19114.82387,6864.249184,2.218254935,0.744013256,"United States of America",1995-01-01,"Singapore ",1995-01-01,0,0,"Singapore",1973-08-20,"United States of America",1948-01-01,1,1,-2,2,10,10,1,0
"162",2,"1986",740,1985,740,2,"Q4_2012","USA","USA-AD-288","USA-AD-288","Japan","JPN","Eproms","10/9/85","3/17/86","11/20/85","A","A","3/17/86","AVD","10/30/86","12/29/86","A","A","8/6/86","SA","5/27/97","1997","SA",".",".",".",10,10,1,10,1,0,0,4.237211042,0.636076681,16.57349253,24.85131381,0,18269.27927,11465.72578,4.35e+12,1.38e+12,6.97540663,14.09481374,2.415286591,NA,"10/9/85",1985-10-09,1985-10-09,1048,1723,1986-03-17,4.59e+12,2.05e+12,6.993311693,11.09973774,16.86019912,18.34718223,19114.82387,16882.27395,2.218254935,NA,"United States of America",1995-01-01,"Japan ",1995-01-01,0,0,"Japan",1955-09-10,"United States of America",1948-01-01,1,1,10,10,10,10,1,1
"163",2,"1986",710,1985,710,2,"Q4_2012","USA","USA-AD-266","USA-AD-266","China","CHN","Steel Wire Nails","6/13/85","1/9/86","7/31/85","A","A","1/9/86","AVD","3/25/86","5/14/86","A","A","5/21/86","AVD","9/3/87","1987","AVD",".",".",".",10,10,1,-7,0,0,0,4.237211042,5.121490977,16.57349253,22.4479447,0,18269.27927,291.7756745,4.35e+12,3.07e+11,6.97540663,9.17324163,2.415286591,28.44261852,"6/13/85",1985-06-13,1985-06-13,1737,1605,1986-01-09,4.59e+12,2.98e+11,6.993311693,9.940866261,16.86019912,22.43188748,19114.82387,279.184542,2.218254935,27.1400698,"United States of America",1995-01-01,"China ",2001-12-11,0,0,NA,NA,"United States of America",1948-01-01,1,NA,-7,0,10,10,1,0
"164",2,"1986",830,1985,830,2,"Q4_2012","USA","USA-AD-296","USA-AD-296","Singapore","SGP","Welded Carbon Steel Pipe","11/20/85","4/29/86","1/8/86","A","A","4/29/86","AVD","9/18/86","10/13/86","A","A","11/13/86","AVD","8/22/00","2000","AVD",".",".",".",10,10,1,-2,0,0,0,4.237211042,4.425608489,16.57349253,304.4346571,0,18269.27927,6781.817642,4.35e+12,18555053067,6.97540663,152.3673632,2.415286591,0.958114317,"11/20/85",1985-11-20,1985-11-20,9665,1765,1986-04-29,4.59e+12,18762738721,6.993311693,148.8707431,16.86019912,295.1035754,19114.82387,6864.249184,2.218254935,0.744013256,"United States of America",1995-01-01,"Singapore ",1995-01-01,0,0,"Singapore",1973-08-20,"United States of America",1948-01-01,1,1,-2,2,10,10,1,0
"165",2,"1986",100,1986,100,2,"Q4_2012","USA","USA-AD-329","USA-AD-327","Colombia","COL","Fresh Cut Flowers","6/6/86","11/3/86","7/16/86","A","A","11/3/86","AVD","3/5/87","3/19/87","A","P","3/18/87","AVD","7/20/99","1999","AVD",".",".",".",10,10,1,8,1,0,0,4.281799448,3.904785044,16.86019912,30.83063591,0,19114.82387,1137.519996,4.59e+12,34942483688,6.993311693,18.83724644,2.218254935,18.02962947,"6/6/86",1986-06-06,1986-06-06,1399,1963,1986-11-03,4.59e+12,34942483688,6.993311693,18.83724644,16.86019912,30.83063591,19114.82387,1137.519996,2.218254935,18.02962947,"United States of America",1995-01-01,"Colombia ",1995-04-30,0,0,"Colombia",1981-10-03,"United States of America",1948-01-01,1,1,8,8,10,10,1,1
"166",2,"1986",200,1986,200,2,"Q4_2012","USA","USA-AD-325","USA-AD-320","United Kingdom","GBR","Unfinished Mirrors","4/9/86","9/12/86","5/29/86","A","A","9/12/86","AVD","12/2/86","1/22/87","A","N",".",".",".",".",".",".",".",".",10,10,1,10,1,0,0,4.281799448,1.409464381,16.86019912,51.62483551,0,19114.82387,10063.83866,4.59e+12,5.7e+11,6.993311693,25.61940983,2.218254935,NA,"4/9/86",1986-04-09,1986-04-09,2532,1905,1986-09-12,4.59e+12,5.7e+11,6.993311693,25.61940983,16.86019912,51.62483551,19114.82387,10063.83866,2.218254935,NA,"United States of America",1995-01-01,"United Kingdom",1995-01-01,0,0,"United Kingdom",1948-01-01,"United States of America",1948-01-01,1,1,10,10,10,10,1,1
"167",2,"1986",20,1985,20,2,"Q4_2012","USA","USA-AD-276","USA-AD-276","Canada","CAN","Oil Country Tubular Goods","7/31/85","1/7/86","9/11/85","A","A","1/7/86","AVD","4/22/86","6/11/86","A","A","6/16/86","AVD","8/22/00","2000","AVD",".",".",".",10,10,1,10,1,0,0,4.237211042,8.144492055,16.57349253,53.12375157,0,18269.27927,13991.21455,4.35e+12,3.63e+11,6.97540663,27.73040745,2.415286591,3.4669889,"7/31/85",1985-07-31,1985-07-31,317,1653,1986-01-07,4.59e+12,3.76e+11,6.993311693,27.15802219,16.86019912,53.33457223,19114.82387,14335.74387,2.218254935,3.527979013,"United States of America",1995-01-01,"Canada ",1995-01-01,0,0,"Canada",1948-01-01,"United States of America",1948-01-01,1,1,10,10,10,10,1,1
"168",2,"1986",94,1986,94,2,"Q4_2012","USA","USA-AD-330","USA-AD-327","Costa Rica","CRI","Fresh Cut Flowers","6/6/86","11/3/86","7/16/86","A","A","11/3/86","AVD","3/5/87","3/19/87","A","P","3/18/87","AVD","MI","MI","AVD",".",".",".",10,10,1,10,1,0,0,4.281799448,2.667043493,16.86019912,53.98014526,0,19114.82387,1975.566228,4.59e+12,5477895476,6.993311693,27.02579517,2.218254935,13.20240481,"6/6/86",1986-06-06,1986-06-06,29,1963,1986-11-03,4.59e+12,5477895476,6.993311693,27.02579517,16.86019912,53.98014526,19114.82387,1975.566228,2.218254935,13.20240481,"United States of America",1995-01-01,"Costa Rica",1995-01-01,0,0,"Costa Rica",1990-11-24,"United States of America",1948-01-01,1,0,10,10,10,10,1,1
"169",2,"1986",140,1986,140,2,"Q4_2012","USA","USA-AD-311","USA-AD-311","Brazil","BRA","Brass Sheet/Strip","3/19/86","8/22/86","5/1/86","A","A","8/22/86","AVD","11/10/86","12/31/86","A","A","1/12/87","AVD","5/1/05","2005","AVD",".",".",".",10,10,1,7,1,0,0,4.281799448,2.812194737,16.86019912,15.17116523,0,19114.82387,1928.720174,4.59e+12,2.68e+11,6.993311693,8.816588678,2.218254935,11.15718936,"3/19/86",1986-03-19,1986-03-19,363,1884,1986-08-22,4.59e+12,2.68e+11,6.993311693,8.816588678,16.86019912,15.17116523,19114.82387,1928.720174,2.218254935,11.15718936,"United States of America",1995-01-01,"Brazil ",1995-01-01,0,0,"Brazil",1948-07-30,"United States of America",1948-01-01,1,1,7,7,10,10,1,1
"170",2,"1986",140,1986,140,2,"Q4_2012","USA","USA-AD-308","USA-AD-308","Brazil","BRA","Butt-Weld Pipe Fittings","3/12/86","8/11/86","4/16/86","A","A","8/11/86","AVD","10/24/86","12/17/86","A","A","12/17/86","AVD","IF","IF","AVD",".",".",".",10,10,1,7,1,0,0,4.281799448,2.812194737,16.86019912,15.17116523,0,19114.82387,1928.720174,4.59e+12,2.68e+11,6.993311693,8.816588678,2.218254935,11.15718936,"3/12/86",1986-03-12,1986-03-12,356,1877,1986-08-11,4.59e+12,2.68e+11,6.993311693,8.816588678,16.86019912,15.17116523,19114.82387,1928.720174,2.218254935,11.15718936,"United States of America",1995-01-01,"Brazil ",1995-01-01,0,0,"Brazil",1948-07-30,"United States of America",1948-01-01,1,1,7,7,10,10,1,1
"171",2,"1986",325,1986,325,2,"Q4_2012","USA","USA-AD-322","USA-AD-320","Italy","ITA","Unfinished Mirrors","4/9/86","9/12/86","5/29/86","A","A","9/12/86","AVD","12/2/86","1/22/87","A","N",".",".",".",".",".",".",".",".",10,10,1,10,1,0,0,4.281799448,1.598338799,16.86019912,37.66908256,0,19114.82387,10901.85534,4.59e+12,6.17e+11,6.993311693,19.49368817,2.218254935,NA,"4/9/86",1986-04-09,1986-04-09,979,1905,1986-09-12,4.59e+12,6.17e+11,6.993311693,19.49368817,16.86019912,37.66908256,19114.82387,10901.85534,2.218254935,NA,"United States of America",1995-01-01,"Italy ",1995-01-01,0,0,"Italy",1950-05-30,"United States of America",1948-01-01,1,1,10,10,10,10,1,1
"172",2,"1986",325,1986,325,2,"Q4_2012","USA","USA-AD-314","USA-AD-311","Italy","ITA","Brass Sheet/Strip","3/19/86","8/22/86","5/1/86","A","A","8/22/86","AVD","1/9/87","2/6/87","A","A","3/6/87","AVD","IF","IF","AVD",".",".",".",10,10,1,10,1,0,0,4.281799448,1.598338799,16.86019912,37.66908256,0,19114.82387,10901.85534,4.59e+12,6.17e+11,6.993311693,19.49368817,2.218254935,NA,"3/19/86",1986-03-19,1986-03-19,958,1884,1986-08-22,4.59e+12,6.17e+11,6.993311693,19.49368817,16.86019912,37.66908256,19114.82387,10901.85534,2.218254935,NA,"United States of America",1995-01-01,"Italy ",1995-01-01,0,0,"Italy",1950-05-30,"United States of America",1948-01-01,1,1,10,10,10,10,1,1
"173",2,"1986",732,1986,732,2,"Q4_2012","USA","USA-AD-304","USA-AD-304","South Korea","KOR","Stainless Steel Cookware","2/6/86","7/7/86","3/19/86","A","A","7/7/86","AVD","11/26/86","1/14/87","A","A","1/20/87","AVD","12/29/10","2010","AVD",".",".",".",10,10,1,-5,0,0,0,4.281799448,0.734907455,16.86019912,61.5402175,1,19114.82387,2906.168843,4.59e+12,1.2e+11,6.993311693,33.12289782,2.218254935,11.05382003,"2/6/86",1986-02-06,1986-02-06,1989,1843,1986-07-07,4.59e+12,1.2e+11,6.993311693,33.12289782,16.86019912,61.5402175,19114.82387,2906.168843,2.218254935,11.05382003,"United States of America",1995-01-01,"South Korea",1995-01-01,0,0,"South Korea",1967-04-14,"United States of America",1948-01-01,1,1,-5,0,10,10,1,0
"174",2,"1986",200,1985,200,2,"Q4_2012","USA","USA-AD-286","USA-AD-286","United Kingdom","GBR","Anhydrous Metasilicate","10/2/85","3/3/86","11/7/85","A","A","3/3/86","AVD","7/2/86",".","W","W",".",".",".",".",".",".",".",".",10,10,1,10,1,0,0,4.237211042,1.384278354,16.57349253,56.11538308,0,18269.27927,8209.836963,4.35e+12,4.64e+11,6.97540663,28.75107592,2.415286591,NA,"10/2/85",1985-10-02,1985-10-02,2343,1716,1986-03-03,4.59e+12,5.7e+11,6.993311693,25.61940983,16.86019912,51.62483551,19114.82387,10063.83866,2.218254935,NA,"United States of America",1995-01-01,"United Kingdom",1995-01-01,0,0,"United Kingdom",1948-01-01,"United States of America",1948-01-01,1,1,10,10,10,10,1,1
"175",2,"1986",160,1985,160,2,"Q4_2012","USA","USA-AD-275","USA-AD-275","Argentina","ARG","Oil Country Tubular Goods","7/10/85","1/27/86","9/11/85","A","A","1/27/86","AVD","6/3/86",".","N","T",".",".",".",".",".",".",".",".",10,10,1,8,1,0,0,4.237211042,3.518863262,16.57349253,18.00942507,0,18269.27927,2914.154511,4.35e+12,88416668900,6.97540663,11.73609802,2.415286591,7.634307257,"7/10/85",1985-07-10,1985-07-10,578,1632,1986-01-27,4.59e+12,1.11e+11,6.993311693,8.161977544,16.86019912,14.48603279,19114.82387,3602.179183,2.218254935,7.80040264,"United States of America",1995-01-01,"Argentina ",1995-01-01,0,0,"Argentina",1967-10-11,"United States of America",1948-01-01,1,1,8,8,10,10,1,1
"176",2,"1986",740,1986,740,2,"Q4_2012","USA","USA-AD-323","USA-AD-320","Japan","JPN","Unfinished Mirrors","4/9/86","9/12/86","5/29/86","A","A","9/12/86","AVD","12/2/86","1/22/87","A","N",".",".",".",".",".",".",".",".",10,10,1,10,1,0,0,4.281799448,0.595085865,16.86019912,18.34718223,0,19114.82387,16882.27395,4.59e+12,2.05e+12,6.993311693,11.09973774,2.218254935,NA,"4/9/86",1986-04-09,1986-04-09,1230,1905,1986-09-12,4.59e+12,2.05e+12,6.993311693,11.09973774,16.86019912,18.34718223,19114.82387,16882.27395,2.218254935,NA,"United States of America",1995-01-01,"Japan ",1995-01-01,0,0,"Japan",1955-09-10,"United States of America",1948-01-01,1,1,10,10,10,10,1,1
"177",2,"1986",140,1985,140,2,"Q4_2012","USA","USA-AD-278","USA-AD-278","Brazil","BRA","Malleable Iron Pipe Fittings","8/7/85","1/14/86","9/25/85","A","A","1/14/86","AVD","3/31/86","5/21/86","A","A","5/21/86","AVD","2/28/00","2000","AVD",".",".",".",10,10,1,7,1,0,0,4.237211042,2.610276475,16.57349253,19.34327423,0,18269.27927,1636.601162,4.35e+12,2.23e+11,6.97540663,12.24795967,2.415286591,11.54090033,"8/7/85",1985-08-07,1985-08-07,139,1660,1986-01-14,4.59e+12,2.68e+11,6.993311693,8.816588678,16.86019912,15.17116523,19114.82387,1928.720174,2.218254935,11.15718936,"United States of America",1995-01-01,"Brazil ",1995-01-01,0,0,"Brazil",1948-07-30,"United States of America",1948-01-01,1,1,7,7,10,10,1,1
"178",2,"1986",640,1985,640,2,"Q4_2012","USA","USA-AD-273","USA-AD-271","Turkey","TUR","Welded Carbon Steel Pipe/Tube","7/24/85","1/3/86","9/11/85","A","A","1/3/86","AVD","4/17/86","5/7/86","A","A","5/15/86","AVD","IF","IF","AVD",".",".",".",10,10,1,7,1,0,0,4.237211042,4.609958131,16.57349253,34.82707798,0,18269.27927,1367.173131,4.35e+12,67234948265,6.97540663,15.86077453,2.415286591,20.25880139,"7/24/85",1985-07-24,1985-07-24,589,1646,1986-01-03,4.59e+12,75728009963,6.993311693,13.31252808,16.86019912,29.4145108,19114.82387,1508.919436,2.218254935,20.10440599,"United States of America",1995-01-01,"Turkey ",1995-03-26,0,0,"Turkey",1951-10-17,"United States of America",1948-01-01,1,1,7,7,10,10,1,1
"179",2,"1986",710,1985,710,2,"Q4_2012","USA","USA-AD-292","USA-AD-292","China","CHN","Carbon Steel Standard Pipe","11/20/85","4/29/86","1/8/86","A","A","4/29/86","AVD","7/10/86","9/4/86","A","N",".",".",".",".",".",".",".",".",10,10,1,-7,0,0,0,4.237211042,5.121490977,16.57349253,22.4479447,0,18269.27927,291.7756745,4.35e+12,3.07e+11,6.97540663,9.17324163,2.415286591,28.44261852,"11/20/85",1985-11-20,1985-11-20,1897,1765,1986-04-29,4.59e+12,2.98e+11,6.993311693,9.940866261,16.86019912,22.43188748,19114.82387,279.184542,2.218254935,27.1400698,"United States of America",1995-01-01,"China ",2001-12-11,0,0,NA,NA,"United States of America",1948-01-01,1,NA,-7,0,10,10,1,0
"180",2,"1986",20,1986,20,2,"Q4_2012","USA","USA-AD-312","USA-AD-311","Canada","CAN","Brass Sheet/Strip","3/19/86","8/22/86","5/1/86","A","A","8/22/86","AVD","12/9/86","12/31/86","A","A","1/12/87","AVD","5/1/05","2005","AVD",".",".",".",10,10,1,10,1,0,0,4.281799448,9.158628208,16.86019912,53.33457223,0,19114.82387,14335.74387,4.59e+12,3.76e+11,6.993311693,27.15802219,2.218254935,3.527979013,"3/19/86",1986-03-19,1986-03-19,548,1884,1986-08-22,4.59e+12,3.76e+11,6.993311693,27.15802219,16.86019912,53.33457223,19114.82387,14335.74387,2.218254935,3.527979013,"United States of America",1995-01-01,"Canada ",1995-01-01,0,0,"Canada",1948-01-01,"United States of America",1948-01-01,1,1,10,10,10,10,1,1
"181",2,"1986",710,1985,710,2,"Q4_2012","USA","USA-AD-282","USA-AD-282","China","CHN","Petroleum Wax Candles","9/11/85","2/19/86","10/30/85","A","A","2/19/86","AVD","7/10/86","8/27/86","A","A","8/28/86","AVD","IF","IF","AVD",".",".",".",10,10,1,-7,0,0,0,4.237211042,5.121490977,16.57349253,22.4479447,0,18269.27927,291.7756745,4.35e+12,3.07e+11,6.97540663,9.17324163,2.415286591,28.44261852,"9/11/85",1985-09-11,1985-09-11,1827,1695,1986-02-19,4.59e+12,2.98e+11,6.993311693,9.940866261,16.86019912,22.43188748,19114.82387,279.184542,2.218254935,27.1400698,"United States of America",1995-01-01,"China ",2001-12-11,0,0,NA,NA,"United States of America",1948-01-01,1,NA,-7,0,10,10,1,0
"182",2,"1986",20,1986,20,2,"Q4_2012","USA","USA-AD-327","USA-AD-327","Canada","CAN","Fresh Cut Flowers","6/6/86","11/3/86","7/16/86","A","A","11/3/86","AVD","1/20/87","3/19/87","A","P","3/18/87","AVD","6/18/93","1993","AVD",".",".",".",10,10,1,10,1,0,0,4.281799448,9.158628208,16.86019912,53.33457223,0,19114.82387,14335.74387,4.59e+12,3.76e+11,6.993311693,27.15802219,2.218254935,3.527979013,"6/6/86",1986-06-06,1986-06-06,627,1963,1986-11-03,4.59e+12,3.76e+11,6.993311693,27.15802219,16.86019912,53.33457223,19114.82387,14335.74387,2.218254935,3.527979013,"United States of America",1995-01-01,"Canada ",1995-01-01,0,0,"Canada",1948-01-01,"United States of America",1948-01-01,1,1,10,10,10,10,1,1
"183",2,"1986",70,1986,70,2,"Q4_2012","USA","USA-AD-333","USA-AD-327","Mexico","MEX","Fresh Cut Flowers","6/6/86","11/3/86","7/16/86","A","A","11/3/86","AVD","3/3/87","4/27/87","A","A","4/23/87","AVD","9/3/99","1999","AVD",".",".",".",10,10,1,-3,0,0,0,4.281799448,1.24386678,16.86019912,30.77498547,0,19114.82387,1630.019343,4.59e+12,1.29e+11,6.993311693,17.34074123,2.218254935,10.30092129,"6/6/86",1986-06-06,1986-06-06,1283,1963,1986-11-03,4.59e+12,1.29e+11,6.993311693,17.34074123,16.86019912,30.77498547,19114.82387,1630.019343,2.218254935,10.30092129,"United States of America",1995-01-01,"Mexico ",1995-01-01,0,0,"Mexico",1986-08-24,"United States of America",1948-01-01,1,1,-3,1,10,10,1,0
"184",2,"1986",713,1985,713,2,"Q4_2012","USA","USA-AD-299","USA-AD-297","Taiwan","TWN","Porcelain-On-Steel Cookware","12/12/85","5/20/86","1/30/86","A","A","5/20/86","AVD","10/10/86","11/26/86","A","A","12/2/86","AVD","12/29/10","2010","AVD",".",".",".",10,10,1,-7,0,0,0,4.237211042,NA,16.57349253,NA,0,18269.27927,NA,4.35e+12,NA,6.97540663,NA,2.415286591,NA,"12/12/85",1985-12-12,1985-12-12,2763,1787,1986-05-20,4.59e+12,NA,6.993311693,NA,16.86019912,NA,19114.82387,NA,2.218254935,NA,"United States of America",1995-01-01,"Taiwan",2002-01-01,0,0,NA,NA,"United States of America",1948-01-01,1,NA,-7,0,10,10,1,0
"185",2,"1986",211,1986,211,2,"Q4_2012","USA","USA-AD-320","USA-AD-320","Belgium","BEL","Unfinished Mirrors","4/9/86","9/12/86","5/29/86","A","A","9/12/86","AVD","2/2/87","3/19/87","A","N",".",".",".",".",".",".",".",".",10,10,1,10,1,0,0,4.281799448,1.758624347,16.86019912,122.3725329,0,19114.82387,12021.90541,4.59e+12,1.19e+11,6.993311693,62.27928311,2.218254935,NA,"4/9/86",1986-04-09,1986-04-09,1574,1905,1986-09-12,4.59e+12,1.19e+11,6.993311693,62.27928311,16.86019912,122.3725329,19114.82387,12021.90541,2.218254935,NA,"United States of America",1995-01-01,"Belgium ",1995-01-01,0,0,"Belgium",1948-01-01,"United States of America",1948-01-01,1,1,10,10,10,10,1,1
"186",2,"1986",140,1986,140,2,"Q4_2012","USA","USA-AD-335","USA-AD-335","Brazil","BRA","Tubeless Steel Disk Wheels","6/5/86","12/29/86","7/16/86","A","A","12/29/86","AVD","3/20/87","5/8/87","A","A","5/28/87","AVD","6/29/92","1992","AVD",".",".",".",10,10,1,7,1,0,0,4.281799448,2.812194737,16.86019912,15.17116523,0,19114.82387,1928.720174,4.59e+12,2.68e+11,6.993311693,8.816588678,2.218254935,11.15718936,"6/5/86",1986-06-05,1986-06-05,441,1962,1986-12-29,4.59e+12,2.68e+11,6.993311693,8.816588678,16.86019912,15.17116523,19114.82387,1928.720174,2.218254935,11.15718936,"United States of America",1995-01-01,"Brazil ",1995-01-01,0,0,"Brazil",1948-07-30,"United States of America",1948-01-01,1,1,7,7,10,10,1,1
"187",2,"1986",155,1986,155,2,"Q4_2012","USA","USA-AD-328","USA-AD-327","Chile","CHL","Standard Carnations","6/6/86","11/3/86","7/16/86","A","A","11/3/86","AVD","2/2/87","3/19/87","A","A","3/20/87","AVD","9/3/99","1999","AVD",".",".",".",10,10,1,-6,0,0,0,4.281799448,9.764872842,16.86019912,55.12008772,0,19114.82387,1437.152292,4.59e+12,17722536671,6.993311693,29.08959353,2.218254935,8.964973665,"6/6/86",1986-06-06,1986-06-06,4651,1963,1986-11-03,4.59e+12,17722536671,6.993311693,29.08959353,16.86019912,55.12008772,19114.82387,1437.152292,2.218254935,8.964973665,"United States of America",1995-01-01,"Chile ",1995-01-01,0,0,"Chile",1949-03-16,"United States of America",1948-01-01,1,1,-6,0,10,10,1,0
"188",2,"1986",740,1986,740,2,"Q4_2012","USA","USA-AD-309","USA-AD-308","Japan","JPN","Butt-Weld Pipe Fittings","3/12/86","8/11/86","4/16/86","A","A","8/11/86","AVD","12/29/86","2/4/87","A","A","2/10/87","AVD","IF","IF","AVD",".",".",".",10,10,1,10,1,0,0,4.281799448,0.595085865,16.86019912,18.34718223,0,19114.82387,16882.27395,4.59e+12,2.05e+12,6.993311693,11.09973774,2.218254935,NA,"3/12/86",1986-03-12,1986-03-12,1202,1877,1986-08-11,4.59e+12,2.05e+12,6.993311693,11.09973774,16.86019912,18.34718223,19114.82387,16882.27395,2.218254935,NA,"United States of America",1995-01-01,"Japan ",1995-01-01,0,0,"Japan",1955-09-10,"United States of America",1948-01-01,1,1,10,10,10,10,1,1
"189",2,"1986",840,1985,840,2,"Q4_2012","USA","USA-AD-293","USA-AD-292","Philippines","PHL","Carbon Steel Standard Pipe","11/20/85","4/29/86","1/8/86","A","A","4/29/86","AVD","9/18/86","10/13/86","A","N",".",".",".",".",".",".",".",".",10,10,1,-6,0,0,0,4.237211042,4.910552043,16.57349253,45.90904084,0,18269.27927,565.748617,4.35e+12,30734266462,6.97540663,24.01557661,2.415286591,24.57740482,"11/20/85",1985-11-20,1985-11-20,7265,1765,1986-04-29,4.59e+12,29868363901,6.993311693,26.32820211,16.86019912,48.70263284,19114.82387,535.1639326,2.218254935,23.9464794,"United States of America",1995-01-01,"Philippines ",1995-01-01,0,0,"Philippines",1979-12-27,"United States of America",1948-01-01,1,1,1,-88,10,10,1,0
"190",2,"1986",710,1985,710,2,"Q4_2012","USA","USA-AD-298","USA-AD-297","China","CHN","Porcelain-On-Steel Cookware","12/12/85","5/20/86","1/30/86","A","A","5/20/86","AVD","10/10/86","11/26/86","A","A","12/2/86","AVD","IF","IF","AVD",".",".",".",10,10,1,-7,0,0,0,4.237211042,5.121490977,16.57349253,22.4479447,0,18269.27927,291.7756745,4.35e+12,3.07e+11,6.97540663,9.17324163,2.415286591,28.44261852,"12/12/85",1985-12-12,1985-12-12,1919,1787,1986-05-20,4.59e+12,2.98e+11,6.993311693,9.940866261,16.86019912,22.43188748,19114.82387,279.184542,2.218254935,27.1400698,"United States of America",1995-01-01,"China ",2001-12-11,0,0,NA,NA,"United States of America",1948-01-01,1,NA,-7,0,10,10,1,0
"191",2,"1986",140,1986,140,2,"Q4_2012","USA","USA-AD-326","USA-AD-326","Brazil","BRA","Frozen Concentrated Orange Juice","5/21/86","10/23/86","7/2/86","A","A","10/23/86","AVD","3/17/87","4/29/87","A","A","5/5/87","AVD","4/13/05","2005","AVD",".",".",".",10,10,1,7,1,0,0,4.281799448,2.812194737,16.86019912,15.17116523,0,19114.82387,1928.720174,4.59e+12,2.68e+11,6.993311693,8.816588678,2.218254935,11.15718936,"5/21/86",1986-05-21,1986-05-21,426,1947,1986-10-23,4.59e+12,2.68e+11,6.993311693,8.816588678,16.86019912,15.17116523,19114.82387,1928.720174,2.218254935,11.15718936,"United States of America",1995-01-01,"Brazil ",1995-01-01,0,0,"Brazil",1948-07-30,"United States of America",1948-01-01,1,1,7,7,10,10,1,1
"192",2,"1986",713,1986,713,2,"Q4_2012","USA","USA-AD-310","USA-AD-308","Taiwan","TWN","Butt-Weld Pipe Fittings","3/12/86","8/11/86","4/16/86","A","A","8/11/86","AVD","10/24/86","12/17/86","A","A","12/17/86","AVD","IF","IF","AVD",".",".",".",10,10,1,-7,0,0,0,4.281799448,NA,16.86019912,NA,0,19114.82387,NA,4.59e+12,NA,6.993311693,NA,2.218254935,NA,"3/12/86",1986-03-12,1986-03-12,2853,1877,1986-08-11,4.59e+12,NA,6.993311693,NA,16.86019912,NA,19114.82387,NA,2.218254935,NA,"United States of America",1995-01-01,"Taiwan",2002-01-01,0,0,NA,NA,"United States of America",1948-01-01,1,NA,-7,0,10,10,1,0
"193",2,"1986",220,1986,220,2,"Q4_2012","USA","USA-AD-313","USA-AD-311","France","FRA","Brass Sheet/Strip","3/19/86","8/22/86","5/1/86","A","A","8/22/86","AVD","1/9/87","2/6/87","A","A","3/6/87","AVD","IF","IF","AVD",".",".",".",10,10,1,9,1,0,0,4.281799448,2.378224257,16.86019912,41.8023439,1,19114.82387,13271.22716,4.59e+12,7.59e+11,6.993311693,20.80244179,2.218254935,3.863266382,"3/19/86",1986-03-19,1986-03-19,1763,1884,1986-08-22,4.59e+12,7.59e+11,6.993311693,20.80244179,16.86019912,41.8023439,19114.82387,13271.22716,2.218254935,3.863266382,"United States of America",1995-01-01,"France ",1995-01-01,0,0,"France",1948-01-01,"United States of America",1948-01-01,1,1,9,9,10,10,1,1
"194",2,"1986",140,1986,140,2,"Q4_2012","USA","USA-AD-337","USA-AD-337","Brazil","BRA","Paint Filters","7/23/86","12/30/86","9/10/86","A","A","12/30/86","AVD","5/21/87",".","N","T",".",".",".",".",".",".",".",".",10,10,1,7,1,0,0,4.281799448,2.812194737,16.86019912,15.17116523,0,19114.82387,1928.720174,4.59e+12,2.68e+11,6.993311693,8.816588678,2.218254935,11.15718936,"7/23/86",1986-07-23,1986-07-23,489,2010,1986-12-30,4.59e+12,2.68e+11,6.993311693,8.816588678,16.86019912,15.17116523,19114.82387,1928.720174,2.218254935,11.15718936,"United States of America",1995-01-01,"Brazil ",1995-01-01,0,0,"Brazil",1948-07-30,"United States of America",1948-01-01,1,1,7,7,10,10,1,1
"195",2,"1986",230,1986,230,2,"Q4_2012","USA","USA-AD-336","USA-AD-297","Spain","ESP","Porcelain-On-Steel Cookware","7/9/86","12/12/86","8/20/86","A","A","12/12/86","AVD",".","2/11/87","T","W",".",".",".",".",".",".",".",".",10,10,1,10,1,0,0,4.281799448,2.238065512,16.86019912,35.42114378,0,19114.82387,6326.482009,4.59e+12,2.44e+11,6.993311693,18.67904498,2.218254935,NA,"7/9/86",1986-07-09,1986-07-09,1315,1996,1986-12-12,4.59e+12,2.44e+11,6.993311693,18.67904498,16.86019912,35.42114378,19114.82387,6326.482009,2.218254935,NA,"United States of America",1995-01-01,"Spain ",1995-01-01,0,0,"Spain",1963-08-29,"United States of America",1948-01-01,1,1,10,10,10,10,1,1
"196",2,"1986",235,1986,235,2,"Q4_2012","USA","USA-AD-324","USA-AD-320","Portugal","PRT","Unfinished Mirrors","4/9/86","9/12/86","5/29/86","A","A","9/12/86","AVD","12/2/86","1/22/87","A","N",".",".",".",".",".",".",".",".",10,10,1,10,1,0,0,4.281799448,7.496896684,16.86019912,55.04556352,0,19114.82387,3810.429405,4.59e+12,38229024650,6.993311693,26.38193909,2.218254935,NA,"4/9/86",1986-04-09,1986-04-09,31,1905,1986-09-12,4.59e+12,38229024650,6.993311693,26.38193909,16.86019912,55.04556352,19114.82387,3810.429405,2.218254935,NA,"United States of America",1995-01-01,"Portugal ",1995-01-01,0,0,"Portugal",1962-05-06,"United States of America",1948-01-01,1,1,10,10,10,10,1,1
"197",2,"1986",70,1985,70,2,"Q4_2012","USA","USA-AD-297","USA-AD-297","Mexico","MEX","Porcelain-On-Steel Cookware","12/12/85","5/20/86","1/30/86","A","A","5/20/86","AVD","10/10/86","11/26/86","A","A","12/2/86","AVD","4/22/02","2002","AVD",".",".",".",10,10,1,-3,0,0,0,4.237211042,0.851795268,16.57349253,25.74873857,0,18269.27927,2369.312247,4.35e+12,1.84e+11,6.97540663,15.41489157,2.415286591,10.07199469,"12/12/85",1985-12-12,1985-12-12,1107,1787,1986-05-20,4.59e+12,1.29e+11,6.993311693,17.34074123,16.86019912,30.77498547,19114.82387,1630.019343,2.218254935,10.30092129,"United States of America",1995-01-01,"Mexico ",1995-01-01,0,0,"Mexico",1986-08-24,"United States of America",1948-01-01,1,0,-3,1,10,10,1,0
"198",2,"1986",732,1985,732,2,"Q4_2012","USA","USA-AD-279","USA-AD-278","South Korea","KOR","Malleable Iron Pipe Fittings","8/7/85","1/14/86","9/25/85","A","A","1/14/86","AVD","3/31/86","5/21/86","A","A","5/23/86","AVD","2/28/00","2000","AVD",".",".",".",10,10,1,-5,0,0,0,4.237211042,0.768806497,16.57349253,59.01031723,1,18269.27927,2542.04198,4.35e+12,1.04e+11,6.97540663,29.78056913,2.415286591,12.5106833,"8/7/85",1985-08-07,1985-08-07,1806,1660,1986-01-14,4.59e+12,1.2e+11,6.993311693,33.12289782,16.86019912,61.5402175,19114.82387,2906.168843,2.218254935,11.05382003,"United States of America",1995-01-01,"South Korea",1995-01-01,0,0,"South Korea",1967-04-14,"United States of America",1948-01-01,1,1,-5,0,10,10,1,0
"199",2,"1986",713,1985,713,2,"Q4_2012","USA","USA-AD-280","USA-AD-278","Taiwan","TWN","Malleable Iron Pipe Fittings","8/7/85","1/14/86","9/25/85","A","A","1/14/86","AVD","3/31/86","5/21/86","A","A","5/23/86","AVD","2/28/00","2000","AVD",".",".",".",10,10,1,-7,0,0,0,4.237211042,NA,16.57349253,NA,0,18269.27927,NA,4.35e+12,NA,6.97540663,NA,2.415286591,NA,"8/7/85",1985-08-07,1985-08-07,2636,1660,1986-01-14,4.59e+12,NA,6.993311693,NA,16.86019912,NA,19114.82387,NA,2.218254935,NA,"United States of America",1995-01-01,"Taiwan",2002-01-01,0,0,NA,NA,"United States of America",1948-01-01,1,NA,-7,0,10,10,1,0
"200",2,"1986",630,1985,630,2,"Q4_2012","USA","USA-AD-287","USA-AD-287","Iran","IRN","In-Shell Pistachios","10/3/85","3/11/86","11/20/85","A","A","3/11/86","AVD","5/23/86","7/14/86","A","A","7/17/86","AVD","IF","IF","AVD",".",".",".",10,10,1,-6,0,0,0,4.237211042,NA,16.57349253,22.94387724,0,18269.27927,3590.716481,4.35e+12,1.71e+11,6.97540663,9.388896631,2.415286591,19.44386566,"10/3/85",1985-10-03,1985-10-03,2436,1717,1986-03-11,4.59e+12,1.99e+11,6.993311693,3.929636432,16.86019912,13.77243743,19114.82387,4020.485685,2.218254935,23.09539057,"United States of America",1995-01-01,NA,NA,NA,0,NA,NA,"United States of America",1948-01-01,1,NA,-6,0,10,10,1,0
"201",2,"1986",732,1986,732,2,"Q4_2012","USA","USA-AD-315","USA-AD-311","South Korea","KOR","Brass Sheet/Strip","3/19/86","8/22/86","5/1/86","A","A","8/22/86","AVD","11/10/86","12/31/86","A","A","1/12/87","AVD","5/1/00","2000","AVD",".",".",".",10,10,1,-5,0,0,0,4.281799448,0.734907455,16.86019912,61.5402175,1,19114.82387,2906.168843,4.59e+12,1.2e+11,6.993311693,33.12289782,2.218254935,11.05382003,"3/19/86",1986-03-19,1986-03-19,2030,1884,1986-08-22,4.59e+12,1.2e+11,6.993311693,33.12289782,16.86019912,61.5402175,19114.82387,2906.168843,2.218254935,11.05382003,"United States of America",1995-01-01,"South Korea",1995-01-01,0,0,"South Korea",1967-04-14,"United States of America",1948-01-01,1,1,-5,0,10,10,1,0
"202",2,"1986",380,1986,380,2,"Q4_2012","USA","USA-AD-316","USA-AD-311","Sweden","SWE","Brass Sheet/Strip","3/19/86","8/22/86","5/1/86","A","A","8/22/86","AVD","1/9/87","2/6/87","A","A","3/6/87","AVD","5/1/00","2000","AVD",".",".",".",10,10,1,10,1,0,0,4.281799448,7.479646908,16.86019912,61.87566056,0,19114.82387,17059.35035,4.59e+12,1.43e+11,6.993311693,32.81245852,2.218254935,4.51112039,"3/19/86",1986-03-19,1986-03-19,7,1884,1986-08-22,4.59e+12,1.43e+11,6.993311693,32.81245852,16.86019912,61.87566056,19114.82387,17059.35035,2.218254935,4.51112039,"United States of America",1995-01-01,"Sweden ",1995-01-01,0,0,"Sweden",1950-04-30,"United States of America",1948-01-01,1,1,10,10,10,10,1,1
"203",2,"1986",713,1985,713,2,"Q4_2012","USA","USA-AD-277","USA-AD-276","Taiwan","TWN","Oil Country Tubular Goods","7/31/85","1/7/86","9/11/85","A","A","1/7/86","AVD","3/7/86","6/11/86","A","A","6/18/86","AVD","8/22/00","2000","AVD",".",".",".",10,10,1,-7,0,0,0,4.237211042,NA,16.57349253,NA,0,18269.27927,NA,4.35e+12,NA,6.97540663,NA,2.415286591,NA,"7/31/85",1985-07-31,1985-07-31,2629,1653,1986-01-07,4.59e+12,NA,6.993311693,NA,16.86019912,NA,19114.82387,NA,2.218254935,NA,"United States of America",1995-01-01,"Taiwan",2002-01-01,0,0,NA,NA,"United States of America",1948-01-01,1,NA,-7,0,10,10,1,0
"204",2,"1986",740,1985,740,2,"Q4_2012","USA","USA-AD-300","USA-AD-300","Japan","JPN","256K and Above Drams","12/17/85","3/19/86","2/6/86","A","A","3/19/86","AVD",".",".","OTH",".","8/7/86","SA","8/7/91","1991","SA",".",".",".",10,10,1,10,1,0,0,4.237211042,0.636076681,16.57349253,24.85131381,0,18269.27927,11465.72578,4.35e+12,1.38e+12,6.97540663,14.09481374,2.415286591,NA,"12/17/85",1985-12-17,1985-12-17,1117,1792,1986-03-19,4.59e+12,2.05e+12,6.993311693,11.09973774,16.86019912,18.34718223,19114.82387,16882.27395,2.218254935,NA,"United States of America",1995-01-01,"Japan ",1995-01-01,0,0,"Japan",1955-09-10,"United States of America",1948-01-01,1,1,10,10,10,10,1,1
"205",2,"1986",501,1986,501,2,"Q4_2012","USA","USA-AD-332","USA-AD-327","Kenya","KEN","Standard Carnations","6/6/86","11/3/86","7/16/86","A","A","11/3/86","AVD","3/25/87","4/27/87","A","P","4/23/87","AVD","5/7/99","1999","AVD",".",".",".",10,10,1,-7,0,0,0,4.281799448,5.681824627,16.86019912,55.74138561,0,19114.82387,354.9929364,4.59e+12,7239126717,6.993311693,25.84835531,2.218254935,33.04248714,"6/6/86",1986-06-06,1986-06-06,2845,1963,1986-11-03,4.59e+12,7239126717,6.993311693,25.84835531,16.86019912,55.74138561,19114.82387,354.9929364,2.218254935,33.04248714,"United States of America",1995-01-01,"Kenya ",1995-01-01,0,0,"Kenya",1964-02-05,"United States of America",1948-01-01,1,1,-7,0,10,10,1,0
"206",2,"1986",255,1986,255,2,"Q4_2012","USA","USA-AD-317","USA-AD-311","West Germany","FRG","Brass Sheet/Strip","3/19/86","8/22/86","5/1/86","A","A","8/22/86","AVD","1/9/87","2/6/87","A","A","3/6/87","AVD","IF","IF","AVD",".",".",".",10,10,1,10,1,1,0,4.281799448,1.190724003,16.86019912,46.50273067,0,19114.82387,13027.19502,4.59e+12,1.01e+12,6.993311693,23.11821736,2.218254935,NA,"3/19/86",1986-03-19,1986-03-19,1265,1884,1986-08-22,4.59e+12,1.01e+12,6.993311693,23.11821736,16.86019912,46.50273067,19114.82387,13027.19502,2.218254935,NA,"United States of America",1995-01-01,"Germany ",1995-01-01,0,0,"Germany",1951-10-01,"United States of America",1948-01-01,1,1,10,10,10,10,1,1
"207",2,"1986",255,1986,255,2,"Q4_2012","USA","USA-AD-321","USA-AD-320","West Germany","FRG","Unfinished Mirrors","4/9/86","9/12/86","5/29/86","A","A","9/12/86","AVD","12/2/86","1/22/87","A","N",".",".",".",".",".",".",".",".",10,10,1,10,1,0,0,4.281799448,1.190724003,16.86019912,46.50273067,0,19114.82387,13027.19502,4.59e+12,1.01e+12,6.993311693,23.11821736,2.218254935,NA,"4/9/86",1986-04-09,1986-04-09,1286,1905,1986-09-12,4.59e+12,1.01e+12,6.993311693,23.11821736,16.86019912,46.50273067,19114.82387,13027.19502,2.218254935,NA,"United States of America",1995-01-01,"Germany ",1995-01-01,0,0,"Germany",1951-10-01,"United States of America",1948-01-01,1,1,10,10,10,10,1,1
"208",2,"1986",135,1986,135,2,"Q4_2012","USA","USA-AD-334","USA-AD-327","Peru","PER","Fresh Cut Flowers","6/6/86","11/3/86","7/16/86","A","A","11/3/86","AVD","3/7/87",".","N","T",".",".",".",".",".",".",".",".",10,10,1,7,1,0,0,4.281799448,5.366692063,16.86019912,29.26853011,0,19114.82387,900.0785177,4.59e+12,17977500454,6.993311693,13.94270616,2.218254935,11.21191945,"6/6/86",1986-06-06,1986-06-06,313,1963,1986-11-03,4.59e+12,17977500454,6.993311693,13.94270616,16.86019912,29.26853011,19114.82387,900.0785177,2.218254935,11.21191945,"United States of America",1995-01-01,"Peru ",1995-01-01,0,0,"Peru",1951-10-07,"United States of America",1948-01-01,1,1,7,7,10,10,1,1
"209",2,"1986",666,1986,666,2,"Q4_2012","USA","USA-AD-318","USA-AD-318","Israel","ISR","Oil Country Tubular Goods","3/19/86","8/25/86","5/7/86","A","A","8/25/86","AVD","1/14/87","3/4/87","A","A","3/6/87","AVD","7/27/99","1999","AVD",".",".",".",10,10,1,9,1,0,0,4.281799448,3.49532232,16.86019912,91.80602546,0,19114.82387,6908.919348,4.59e+12,29701444276,6.993311693,39.45147189,2.218254935,NA,"3/19/86",1986-03-19,1986-03-19,551,1884,1986-08-25,4.59e+12,29701444276,6.993311693,39.45147189,16.86019912,91.80602546,19114.82387,6908.919348,2.218254935,NA,"United States of America",1995-01-01,"Israel ",1995-04-21,0,0,"Israel",1962-07-05,"United States of America",1948-01-01,1,1,9,9,10,10,1,1
"210",2,"1986",92,1986,92,2,"Q4_2012","USA","USA-AD-319","USA-AD-319","El Salvador","SLV","Jalousie Window Cranks","3/27/86","9/3/86","5/14/86","A","A","9/3/86","AVD","11/17/86","1/14/87","A","N",".",".",".",".",".",".",".",".",10,10,1,6,1,0,0,4.281799448,1.413809252,16.86019912,53.71412479,0,19114.82387,744.0702736,4.59e+12,3771663198,6.993311693,24.66816339,2.218254935,NA,"3/27/86",1986-03-27,1986-03-27,664,1892,1986-09-03,4.59e+12,3771663198,6.993311693,24.66816339,16.86019912,53.71412479,19114.82387,744.0702736,2.218254935,NA,"United States of America",1995-01-01,"El Salvador",1995-05-07,0,0,"El Salvador",1991-05-22,"United States of America",1948-01-01,1,0,6,6,10,10,1,1
"211",2,"1986",713,1986,713,2,"Q4_2012","USA","USA-AD-305","USA-AD-304","Taiwan","TWN","Stainless Steel Cookware","2/6/86","7/7/86","3/19/86","A","A","7/7/86","AVD","11/26/86","1/14/87","A","A","1/20/87","AVD","11/17/05","2005","AVD",".",".",".",10,10,1,-7,0,0,0,4.281799448,NA,16.86019912,NA,0,19114.82387,NA,4.59e+12,NA,6.993311693,NA,2.218254935,NA,"2/6/86",1986-02-06,1986-02-06,2819,1843,1986-07-07,4.59e+12,NA,6.993311693,NA,16.86019912,NA,19114.82387,NA,2.218254935,NA,"United States of America",1995-01-01,"Taiwan",2002-01-01,0,0,NA,NA,"United States of America",1948-01-01,1,NA,-7,0,10,10,1,0
"212",2,"1987",325,1986,325,2,"Q4_2012","USA","USA-AD-342","USA-AD-341","Italy","ITA","Tapered Roller Bearings","9/4/86","2/6/87","10/16/86","A","A","2/6/87","AVD","6/29/87","8/12/87","A","A","8/14/87","AVD","10/9/96","1996","AVD",".",".",".",10,10,1,10,1,0,0,4.281799448,1.598338799,16.86019912,37.66908256,0,19114.82387,10901.85534,4.59e+12,6.17e+11,6.993311693,19.49368817,2.218254935,NA,"9/4/86",1986-09-04,1986-09-04,1127,2053,1987-02-06,4.87e+12,7.76e+11,7.471972404,18.7434215,17.91712866,37.0428331,20100.78873,13714.95754,2.238295154,NA,"United States of America",1995-01-01,"Italy ",1995-01-01,0,0,"Italy",1950-05-30,"United States of America",1948-01-01,1,1,10,10,10,10,1,1
"213",2,"1987",830,1986,830,2,"Q4_2012","USA","USA-AD-370","USA-AD-367","Singapore","SGP","Color Picture Tubes","12/8/86","6/30/87","1/22/87","A","A","6/30/87","AVD","11/18/87","7/29/87","A","A","1/7/88","AVD","4/18/00","2000","AVD",".",".",".",10,10,1,-2,0,0,0,4.281799448,4.345478061,16.86019912,295.1035754,0,19114.82387,6864.249184,4.59e+12,18762738721,6.993311693,148.8707431,2.218254935,0.744013256,"12/8/86",1986-12-08,1986-12-08,10048,2148,1987-06-30,4.87e+12,21606296346,7.471972404,164.1727378,17.91712866,325.3742102,20100.78873,7786.613935,2.238295154,0.574023382,"United States of America",1995-01-01,"Singapore ",1995-01-01,0,0,"Singapore",1973-08-20,"United States of America",1948-01-01,1,1,-2,2,10,10,1,0
"214",2,"1987",20,1986,20,2,"Q4_2012","USA","USA-AD-367","USA-AD-367","Canada","CAN","Color Picture Tubes","12/8/86","6/30/87","1/22/87","A","A","6/30/87","AVD","11/18/87","7/29/87","A","A","1/7/88","AVD","4/18/00","2000","AVD",".",".",".",10,10,1,10,1,0,0,4.281799448,9.158628208,16.86019912,53.33457223,0,19114.82387,14335.74387,4.59e+12,3.76e+11,6.993311693,27.15802219,2.218254935,3.527979013,"12/8/86",1986-12-08,1986-12-08,812,2148,1987-06-30,4.87e+12,4.29e+11,7.471972404,26.17555134,17.91712866,51.14206461,20100.78873,16158.98743,2.238295154,3.098099443,"United States of America",1995-01-01,"Canada ",1995-01-01,0,0,"Canada",1948-01-01,"United States of America",1948-01-01,1,1,10,10,10,10,1,1
"215",2,"1987",310,1986,310,2,"Q4_2012","USA","USA-AD-341","USA-AD-341","Hungary","HUN","Tapered Roller Bearings","9/4/86","2/6/87","10/16/86","A","A","2/6/87","AVD","5/8/87","6/11/87","A","A","6/19/87","AVD","7/11/00","2000","AVD",".",".",".",10,10,1,-7,0,0,0,4.281799448,2.735559084,16.86019912,80.69324026,0,19114.82387,2234.695007,4.59e+12,23756068292,6.993311693,39.63859295,2.218254935,18.30781403,"9/4/86",1986-09-04,1986-09-04,10896,2053,1987-02-06,4.87e+12,26108718022,7.471972404,37.86712004,17.91712866,76.21655781,20100.78873,2460.129576,2.238295154,17.04182236,"United States of America",1995-01-01,"Hungary ",1995-01-01,0,0,"Hungary",1973-09-09,"United States of America",1948-01-01,1,1,-7,0,10,10,1,0
"216",2,"1987",360,1986,360,2,"Q4_2012","USA","USA-AD-339","USA-AD-338","Romania","ROU","Urea","7/23/86","1/2/87","9/10/86","A","A","1/2/87","AVD","5/26/87","7/8/87","A","A","7/14/87","AVD","12/29/04","2004","AVD",".",".",".",10,10,1,-8,0,0,0,4.281799448,NA,16.86019912,NA,0,19114.82387,NA,4.59e+12,NA,6.993311693,NA,2.218254935,NA,"7/23/86",1986-07-23,1986-07-23,7793,2010,1987-01-02,4.87e+12,38067565161,7.471972404,NA,17.91712866,NA,20100.78873,1658.758634,2.238295154,NA,"United States of America",1995-01-01,"Romania ",1995-01-01,0,0,"Romania",1971-11-14,"United States of America",1948-01-01,1,1,-8,0,10,10,1,0
"217",2,"1987",740,1986,740,2,"Q4_2012","USA","USA-AD-355","USA-AD-355","Japan","JPN","Silica Filament Fabric","11/5/86","5/13/87","1/9/87","A","A","5/13/87","AVD","7/27/87","9/16/87","A","A","9/23/87","AVD","11/14/95","1995","AVD",".",".",".",10,10,1,10,1,0,0,4.281799448,0.595085865,16.86019912,18.34718223,0,19114.82387,16882.27395,4.59e+12,2.05e+12,6.993311693,11.09973774,2.218254935,NA,"11/5/86",1986-11-05,1986-11-05,1440,2115,1987-05-13,4.87e+12,2.49e+12,7.471972404,10.14650374,17.91712866,17.35219699,20100.78873,20355.60522,2.238295154,NA,"United States of America",1995-01-01,"Japan ",1995-01-01,0,0,"Japan",1955-09-10,"United States of America",1948-01-01,1,1,10,10,10,10,1,1
"218",2,"1987",360,1986,360,2,"Q4_2012","USA","USA-AD-345","USA-AD-341","Romania","ROU","Tapered Roller Bearings","9/4/86","2/6/87","10/16/86","A","A","2/6/87","AVD","5/8/87","6/11/87","A","A","6/19/87","AVD","7/11/00","2000","AVD",".",".",".",10,10,1,-8,0,0,0,4.281799448,NA,16.86019912,NA,0,19114.82387,NA,4.59e+12,NA,6.993311693,NA,2.218254935,NA,"9/4/86",1986-09-04,1986-09-04,7836,2053,1987-02-06,4.87e+12,38067565161,7.471972404,NA,17.91712866,NA,20100.78873,1658.758634,2.238295154,NA,"United States of America",1995-01-01,"Romania ",1995-01-01,0,0,"Romania",1971-11-14,"United States of America",1948-01-01,1,1,-8,0,10,10,1,0
"219",2,"1987",740,1986,740,2,"Q4_2012","USA","USA-AD-347","USA-AD-347","Japan","JPN","Malleable Iron Pipe Fittings","9/10/86","2/13/87","10/22/86","A","A","2/13/87","AVD","4/27/87","6/24/87","A","A","7/6/87","AVD","4/11/05","2005","AVD",".",".",".",10,10,1,10,1,0,0,4.281799448,0.595085865,16.86019912,18.34718223,0,19114.82387,16882.27395,4.59e+12,2.05e+12,6.993311693,11.09973774,2.218254935,NA,"9/10/86",1986-09-10,1986-09-10,1384,2059,1987-02-13,4.87e+12,2.49e+12,7.471972404,10.14650374,17.91712866,17.35219699,20100.78873,20355.60522,2.238295154,NA,"United States of America",1995-01-01,"Japan ",1995-01-01,0,0,"Japan",1955-09-10,"United States of America",1948-01-01,1,1,10,10,10,10,1,1
"220",2,"1987",365,1986,365,2,"Q4_2012","USA","USA-AD-340","USA-AD-338","USSR","USR","Urea","7/23/86","1/2/87","9/10/86","A","A","1/2/87","AVD","5/26/87","7/8/87","A","A","7/14/87","AVD","IF","IF","AVD",".",".",".",10,10,1,-7,0,0,0,4.281799448,NA,16.86019912,NA,0,19114.82387,NA,4.59e+12,NA,6.993311693,NA,2.218254935,NA,"7/23/86",1986-07-23,1986-07-23,499,2010,1987-01-02,4.87e+12,NA,7.471972404,NA,17.91712866,NA,20100.78873,NA,2.238295154,NA,"United States of America",1995-01-01,"Russia",2012-08-22,0,0,NA,NA,"United States of America",1948-01-01,1,NA,NA,NA,10,10,1,NA
"221",2,"1987",713,1986,713,2,"Q4_2012","USA","USA-AD-349","USA-AD-349","Taiwan","TWN","Rectangular Pipe","10/16/86","3/17/87","11/26/86","A","A","3/17/87","AVD","6/1/87","7/22/87","A","N",".",".",".",".",".",".",".",".",10,10,1,-7,0,0,0,4.281799448,NA,16.86019912,NA,0,19114.82387,NA,4.59e+12,NA,6.993311693,NA,2.218254935,NA,"10/16/86",1986-10-16,1986-10-16,3071,2095,1987-03-17,4.87e+12,NA,7.471972404,NA,17.91712866,NA,20100.78873,NA,2.238295154,NA,"United States of America",1995-01-01,"Taiwan",2002-01-01,0,0,NA,NA,"United States of America",1948-01-01,1,NA,-1,2,10,10,1,0
"222",2,"1987",640,1986,640,2,"Q4_2012","USA","USA-AD-364","USA-AD-364","Turkey","TUR","Acetylsalicylic Acid","11/7/86","4/15/87","4/15/87","A","A","4/15/87","AVD","7/1/87","8/19/87","A","A","8/25/87","AVD","10/1/04","2004","AVD",".",".",".",10,10,1,7,1,0,0,4.281799448,4.699960789,16.86019912,29.4145108,0,19114.82387,1508.919436,4.59e+12,75728009963,6.993311693,13.31252808,2.218254935,20.10440599,"11/7/86",1986-11-07,1986-11-07,1060,2117,1987-04-15,4.87e+12,87172789528,7.471972404,15.58084042,17.91712866,33.33828503,20100.78873,1703.649342,2.238295154,18.47404548,"United States of America",1995-01-01,"Turkey ",1995-03-26,0,0,"Turkey",1951-10-17,"United States of America",1948-01-01,1,1,7,7,10,10,1,1
"223",2,"1987",710,1986,710,2,"Q4_2012","USA","USA-AD-344","USA-AD-341","China","CHN","Tapered Roller Bearings","9/4/86","2/6/87","10/16/86","A","A","2/6/87","AVD","5/27/87","6/11/87","A","A","6/15/87","AVD","IF","IF","AVD",".",".",".",10,10,1,-7,0,0,0,4.281799448,4.731818538,16.86019912,22.43188748,0,19114.82387,279.184542,4.59e+12,2.98e+11,6.993311693,9.940866261,2.218254935,27.1400698,"9/4/86",1986-09-04,1986-09-04,2185,2053,1987-02-06,4.87e+12,2.7e+11,7.471972404,12.09080625,17.91712866,24.09179032,20100.78873,249.4131039,2.238295154,26.8110471,"United States of America",1995-01-01,"China ",2001-12-11,0,0,NA,NA,"United States of America",1948-01-01,1,NA,-7,0,10,10,1,0
"224",2,"1987",380,1986,380,2,"Q4_2012","USA","USA-AD-354","USA-AD-354","Sweden","SWE","Stainless Steel Pipe","10/29/86","5/22/87","12/10/86","A","A","5/22/87","AVD","10/9/87","11/25/87","A","A","12/3/87","AVD","9/1/99","1999","AVD",".",".",".",10,10,1,10,1,0,0,4.281799448,7.479646908,16.86019912,61.87566056,0,19114.82387,17059.35035,4.59e+12,1.43e+11,6.993311693,32.81245852,2.218254935,4.51112039,"10/29/86",1986-10-29,1986-10-29,231,2108,1987-05-22,4.87e+12,1.74e+11,7.471972404,32.39635309,17.91712866,62.33085077,20100.78873,20675.51837,2.238295154,4.30752893,"United States of America",1995-01-01,"Sweden ",1995-01-01,0,0,"Sweden",1950-04-30,"United States of America",1948-01-01,1,1,10,10,10,10,1,1
"225",2,"1987",20,1987,20,2,"Q4_2012","USA","USA-AD-374","USA-AD-374","Canada","CAN","Potassium Chloride","2/19/87","8/26/87","4/2/87","A","A","8/26/87","AVD",".",".","OTH",".","1/19/88","SA","2/28/99","1999","SA",".",".",".",10,10,1,10,1,0,0,4.771791722,10.97513594,17.91712866,51.14206461,0,20100.78873,16158.98743,4.87e+12,4.29e+11,7.471972404,26.17555134,2.238295154,3.098099443,"2/19/87",1987-02-19,1987-02-19,885,2221,1987-08-26,4.87e+12,4.29e+11,7.471972404,26.17555134,17.91712866,51.14206461,20100.78873,16158.98743,2.238295154,3.098099443,"United States of America",1995-01-01,"Canada ",1995-01-01,0,0,"Canada",1948-01-01,"United States of America",1948-01-01,1,1,10,10,10,10,1,1
"226",2,"1987",255,1986,255,2,"Q4_2012","USA","USA-AD-351","USA-AD-350","West Germany","FRG","Forged Steel Crankshafts","10/16/86","5/13/87","12/10/86","A","A","5/13/87","AVD","7/28/87","9/16/87","A","A","9/21/87","AVD","10/30/96","1996","AVD",".",".",".",10,10,1,10,1,0,0,4.281799448,1.190724003,16.86019912,46.50273067,0,19114.82387,13027.19502,4.59e+12,1.01e+12,6.993311693,23.11821736,2.218254935,NA,"10/16/86",1986-10-16,1986-10-16,1476,2095,1987-05-13,4.87e+12,1.26e+12,7.471972404,22.46214572,17.91712866,45.14368852,20100.78873,16139.05162,2.238295154,NA,"United States of America",1995-01-01,"Germany ",1995-01-01,0,0,"Germany",1951-10-01,"United States of America",1948-01-01,1,1,10,10,10,10,1,1
"227",2,"1987",200,1986,200,2,"Q4_2012","USA","USA-AD-353","USA-AD-350","United Kingdom","GBR","Forged Steel Crankshafts","10/16/86","5/13/87","12/10/86","A","A","5/13/87","AVD","9/1/87","9/16/87","A","A","9/23/87","AVD","4/8/97","1997","AVD",".",".",".",10,10,1,10,1,0,0,4.281799448,1.409464381,16.86019912,51.62483551,0,19114.82387,10063.83866,4.59e+12,5.7e+11,6.993311693,25.61940983,2.218254935,NA,"10/16/86",1986-10-16,1986-10-16,2722,2095,1987-05-13,4.87e+12,7.01e+11,7.471972404,25.34471681,17.91712866,51.4284945,20100.78873,12333.13719,2.238295154,NA,"United States of America",1995-01-01,"United Kingdom",1995-01-01,0,0,"United Kingdom",1948-01-01,"United States of America",1948-01-01,1,1,10,10,10,10,1,1
"228",2,"1987",732,1986,732,2,"Q4_2012","USA","USA-AD-369","USA-AD-367","South Korea","KOR","Color Picture Tubes","12/8/86","6/30/87","1/22/87","A","A","6/30/87","AVD","11/18/87","7/29/87","A","A","1/7/88","AVD","4/18/00","2000","AVD",".",".",".",10,10,1,-5,0,0,0,4.281799448,0.734907455,16.86019912,61.5402175,1,19114.82387,2906.168843,4.59e+12,1.2e+11,6.993311693,33.12289782,2.218254935,11.05382003,"12/8/86",1986-12-08,1986-12-08,2294,2148,1987-06-30,4.87e+12,1.51e+11,7.471972404,35.48788903,17.91712866,64.4187112,20100.78873,3627.601544,2.238295154,9.89616612,"United States of America",1995-01-01,"South Korea",1995-01-01,0,0,"South Korea",1967-04-14,"United States of America",1948-01-01,1,1,1,-88,10,10,1,0
"229",2,"1987",740,1987,740,2,"Q4_2012","USA","USA-AD-376","USA-AD-376","Japan","JPN","Stainless Buttweld Pipe Fittings","4/10/87","9/16/87","5/28/87","A","A","9/16/87","AVD","2/4/88","3/24/88","A","A","3/25/88","AVD","11/5/10","2010","AVD",".",".",".",10,10,1,10,1,0,0,4.771791722,0.573119255,17.91712866,17.35219699,1,20100.78873,20355.60522,4.87e+12,2.49e+12,7.471972404,10.14650374,2.238295154,NA,"4/10/87",1987-04-10,1987-04-10,1596,2271,1987-09-16,4.87e+12,2.49e+12,7.471972404,10.14650374,17.91712866,17.35219699,20100.78873,20355.60522,2.238295154,NA,"United States of America",1995-01-01,"Japan ",1995-01-01,0,0,"Japan",1955-09-10,"United States of America",1948-01-01,1,1,10,10,10,10,1,1
"230",2,"1987",800,1986,800,2,"Q4_2012","USA","USA-AD-348","USA-AD-347","Thailand","THA","Malleable Iron Pipe Fittings","9/10/86","2/13/87","10/22/86","A","A","2/13/87","AVD","7/6/87","8/19/87","A","A","8/20/87","AVD","2/28/00","2000","AVD",".",".",".",10,10,1,2,0,0,0,4.281799448,8.213435932,16.86019912,49.17085524,0,19114.82387,813.0970283,4.59e+12,43096774496,6.993311693,25.60179773,2.218254935,15.6641499,"9/10/86",1986-09-10,1986-09-10,2382,2059,1987-02-13,4.87e+12,50535445681,7.471972404,28.89401151,17.91712866,57.22798546,20100.78873,935.9620138,2.238295154,15.73343752,"United States of America",1995-01-01,"Thailand ",1995-01-01,0,0,"Thailand",1982-11-20,"United States of America",1948-01-01,1,1,2,3,10,10,1,0
"231",2,"1987",713,1987,713,2,"Q4_2012","USA","USA-AD-371","USA-AD-371","Taiwan","TWN","Neoprene Laminate","1/5/87","3/14/87","2/19/87","A","A","3/14/87","AVD","10/5/87","11/18/87","A","N",".",".",".",".",".",".",".",".",10,10,1,-1,0,0,0,4.771791722,NA,17.91712866,NA,0,20100.78873,NA,4.87e+12,NA,7.471972404,NA,2.238295154,NA,"1/5/87",1987-01-05,1987-01-05,3152,2176,1987-03-14,4.87e+12,NA,7.471972404,NA,17.91712866,NA,20100.78873,NA,2.238295154,NA,"United States of America",1995-01-01,"Taiwan",2002-01-01,0,0,NA,NA,"United States of America",1948-01-01,1,NA,-1,2,10,10,1,0
"232",2,"1987",740,1987,740,2,"Q4_2012","USA","USA-AD-377","USA-AD-377","Japan","JPN","Forklift Trucks","4/30/87","11/24/87","6/24/87","A","A","11/24/87","AVD","4/15/88","6/8/88","A","A","6/7/88","AVD","6/2/05","2005","AVD",".",".",".",10,10,1,10,1,0,0,4.771791722,0.573119255,17.91712866,17.35219699,1,20100.78873,20355.60522,4.87e+12,2.49e+12,7.471972404,10.14650374,2.238295154,NA,"4/30/87",1987-04-30,1987-04-30,1616,2291,1987-11-24,4.87e+12,2.49e+12,7.471972404,10.14650374,17.91712866,17.35219699,20100.78873,20355.60522,2.238295154,NA,"United States of America",1995-01-01,"Japan ",1995-01-01,0,0,"Japan",1955-09-10,"United States of America",1948-01-01,1,1,10,10,10,10,1,1
"233",2,"1987",666,1986,666,2,"Q4_2012","USA","USA-AD-366","USA-AD-265","Israel","ISR","Industrial Phosphoric Acid","11/18/86","4/20/87","1/7/87","A","A","4/20/87","AVD","7/7/87","8/19/87","A","A","8/19/87","AVD","5/5/99","1999","AVD",".",".",".",10,10,1,9,1,0,0,4.281799448,3.49532232,16.86019912,91.80602546,0,19114.82387,6908.919348,4.59e+12,29701444276,6.993311693,39.45147189,2.218254935,NA,"11/18/86",1986-11-18,1986-11-18,29,2128,1987-04-20,4.87e+12,35476344266,7.471972404,39.20490883,17.91712866,96.30382906,20100.78873,8120.01471,2.238295154,NA,"United States of America",1995-01-01,"Israel ",1995-04-21,0,0,"Israel",1962-07-05,"United States of America",1948-01-01,1,1,9,9,10,10,1,1
"234",2,"1987",265,1986,265,2,"Q4_2012","USA","USA-AD-338","USA-AD-338","East Germany","GDR","Urea","7/23/86","1/2/87","9/10/86","A","A","1/2/87","AVD","5/26/87","7/8/87","A","A","7/14/87","AVD","4/3/98","1998","AVD",".",".",".",10,10,1,-9,0,1,0,4.281799448,NA,16.86019912,NA,0,19114.82387,NA,4.59e+12,NA,6.993311693,NA,2.218254935,NA,"7/23/86",1986-07-23,1986-07-23,5560,2010,1987-01-02,4.87e+12,NA,7.471972404,NA,17.91712866,NA,20100.78873,NA,2.238295154,NA,"United States of America",1995-01-01,NA,NA,NA,0,NA,NA,"United States of America",1948-01-01,1,NA,-9,0,10,10,1,0
"235",2,"1987",740,1986,740,2,"Q4_2012","USA","USA-AD-368","USA-AD-367","Japan","JPN","Color Picture Tubes","12/8/86","6/30/87","1/22/87","A","A","6/30/87","AVD","11/18/87","7/29/87","A","A","1/7/88","AVD","4/18/00","2000","AVD",".",".",".",10,10,1,10,1,0,0,4.281799448,0.595085865,16.86019912,18.34718223,0,19114.82387,16882.27395,4.59e+12,2.05e+12,6.993311693,11.09973774,2.218254935,NA,"12/8/86",1986-12-08,1986-12-08,1473,2148,1987-06-30,4.87e+12,2.49e+12,7.471972404,10.14650374,17.91712866,17.35219699,20100.78873,20355.60522,2.238295154,NA,"United States of America",1995-01-01,"Japan ",1995-01-01,0,0,"Japan",1955-09-10,"United States of America",1948-01-01,1,1,10,10,10,10,1,1
"236",2,"1987",345,1986,345,2,"Q4_2012","USA","USA-AD-346","USA-AD-341","Yugoslavia","YUG","Tapered Roller Bearings","9/4/86","2/6/87","10/16/86","A","A","2/6/87","AVD","6/29/87","8/12/87","A","A","8/14/87","AVD","11/24/95","1995","AVD",".",".",".",10,10,1,-5,0,0,0,4.281799448,NA,16.86019912,NA,0,19114.82387,NA,4.59e+12,NA,6.993311693,NA,2.218254935,NA,"9/4/86",1986-09-04,1986-09-04,112,2053,1987-02-06,4.87e+12,NA,7.471972404,NA,17.91712866,NA,20100.78873,NA,2.238295154,NA,"United States of America",1995-01-01,NA,NA,NA,0,"Yugoslavia",1966-08-25,"United States of America",1948-01-01,1,1,-5,1,10,10,1,0
"237",2,"1987",740,1986,740,2,"Q4_2012","USA","USA-AD-343","USA-AD-341","Japan","JPN","Tapered Roller Bearings","9/4/86","3/27/87","10/16/86","A","A","3/27/87","AVD","8/17/87","10/1/87","A","A","10/6/87","AVD","7/11/00","2000","AVD",".",".",".",10,10,1,10,1,1,0,4.281799448,0.595085865,16.86019912,18.34718223,0,19114.82387,16882.27395,4.59e+12,2.05e+12,6.993311693,11.09973774,2.218254935,NA,"9/4/86",1986-09-04,1986-09-04,1378,2053,1987-03-27,4.87e+12,2.49e+12,7.471972404,10.14650374,17.91712866,17.35219699,20100.78873,20355.60522,2.238295154,NA,"United States of America",1995-01-01,"Japan ",1995-01-01,0,0,"Japan",1955-09-10,"United States of America",1948-01-01,1,1,10,10,10,10,1,1
"238",2,"1987",211,1986,211,2,"Q4_2012","USA","USA-AD-365","USA-AD-265","Belgium","BEL","Industrial Phosphoric Acid","11/18/86","4/22/87","1/7/87","A","A","4/22/87","AVD","7/7/87","8/19/87","A","A","8/20/87","AVD","6/13/00","2000","AVD",".",".",".",10,10,1,10,1,0,0,4.281799448,1.758624347,16.86019912,122.3725329,0,19114.82387,12021.90541,4.59e+12,1.19e+11,6.993311693,62.27928311,2.218254935,NA,"11/18/86",1986-11-18,1986-11-18,1797,2128,1987-04-22,4.87e+12,1.48e+11,7.471972404,60.74055505,17.91712866,119.7501111,20100.78873,14951.61675,2.238295154,NA,"United States of America",1995-01-01,"Belgium ",1995-01-01,0,0,"Belgium",1948-01-01,"United States of America",1948-01-01,1,1,10,10,10,10,1,1
"239",2,"1988",740,1988,740,2,"Q4_2012","USA","USA-AD-390","USA-AD-390","Japan","JPN","Digital Readout Systems","4/4/88","9/12/88","5/18/88","A","A","9/12/88","AVD","11/28/88","1/19/89","A","N",".",".",".",".",".",".",".",".",10,10,1,10,1,0,0,4.722676581,0.584074673,19.01153714,17.40198106,1,21483.11445,24592.77201,5.25e+12,3.02e+12,8.464379545,9.764554829,2.040427155,NA,"4/4/88",1988-04-04,1988-04-04,150,2631,1988-09-12,5.25e+12,3.02e+12,8.464379545,9.764554829,19.01153714,17.40198106,21483.11445,24592.77201,2.040427155,NA,"United States of America",1995-01-01,"Japan ",1995-01-01,0,0,"Japan",1955-09-10,"United States of America",1948-01-01,1,1,10,10,10,10,1,1
"240",2,"1988",360,1988,360,2,"Q4_2012","USA","USA-AD-395a","USA-AD-391a","Romania","ROU","Ball Bearings","4/11/88","11/9/88","5/25/88","A","A","11/9/88","AVD","5/3/89","5/18/89","A","A","5/15/89","AVD","7/11/00","2000","AVD",".",".",".",10,10,1,-8,0,0,0,4.722676581,NA,19.01153714,NA,0,21483.11445,1753.192792,5.25e+12,40424526826,8.464379545,NA,2.040427155,NA,"4/11/88",1988-04-11,1988-04-11,8421,2638,1988-11-09,5.25e+12,40424526826,8.464379545,NA,19.01153714,NA,21483.11445,1753.192792,2.040427155,NA,"United States of America",1995-01-01,"Romania ",1995-01-01,0,0,"Romania",1971-11-14,"United States of America",1948-01-01,1,1,-8,0,10,10,1,0
"241",2,"1988",740,1988,740,2,"Q4_2012","USA","USA-AD-394a","USA-AD-391a","Japan","JPN","Ball Bearings","4/11/88","11/9/88","5/25/88","A","A","11/9/88","AVD","5/3/89","5/18/89","A","A","5/15/89","AVD","7/15/11","2011","AVD",".",".",".",10,10,1,10,1,1,0,4.722676581,0.584074673,19.01153714,17.40198106,1,21483.11445,24592.77201,5.25e+12,3.02e+12,8.464379545,9.764554829,2.040427155,NA,"4/11/88",1988-04-11,1988-04-11,157,2638,1988-11-09,5.25e+12,3.02e+12,8.464379545,9.764554829,19.01153714,17.40198106,21483.11445,24592.77201,2.040427155,NA,"United States of America",1995-01-01,"Japan ",1995-01-01,0,0,"Japan",1955-09-10,"United States of America",1948-01-01,1,1,10,10,10,10,1,1
"242",2,"1988",740,1988,740,2,"Q4_2012","USA","USA-AD-408","USA-AD-406","Japan","JPN","Electrolytic Manganese Dioxide","6/8/88","11/14/88","7/27/88","A","A","11/14/88","AVD","3/2/89","4/20/89","A","A","4/17/89","AVD","5/31/00","2000","AVD",".",".",".",10,10,1,10,1,0,0,4.722676581,0.584074673,19.01153714,17.40198106,1,21483.11445,24592.77201,5.25e+12,3.02e+12,8.464379545,9.764554829,2.040427155,NA,"6/8/88",1988-06-08,1988-06-08,215,2696,1988-11-14,5.25e+12,3.02e+12,8.464379545,9.764554829,19.01153714,17.40198106,21483.11445,24592.77201,2.040427155,NA,"United States of America",1995-01-01,"Japan ",1995-01-01,0,0,"Japan",1955-09-10,"United States of America",1948-01-01,1,1,10,10,10,10,1,1
"243",2,"1988",200,1988,200,2,"Q4_2012","USA","USA-AD-399d","USA-AD-391d","United Kingdom","GBR","Needle Roller Bearings","4/11/88","11/9/88","5/25/88","A","A","11/9/88","AVD","5/3/89","5/18/89","A","N",".",".",".",".",".",".",".",".",10,10,1,10,1,0,0,4.722676581,1.293969981,19.01153714,49.07662405,0,21483.11445,14951.05213,5.25e+12,8.51e+11,8.464379545,22.94514937,2.040427155,NA,"4/11/88",1988-04-11,1988-04-11,3265,2638,1988-11-09,5.25e+12,8.51e+11,8.464379545,22.94514937,19.01153714,49.07662405,21483.11445,14951.05213,2.040427155,NA,"United States of America",1995-01-01,"United Kingdom",1995-01-01,0,0,"United Kingdom",1948-01-01,"United States of America",1948-01-01,1,1,10,10,10,10,1,1
"244",2,"1988",210,1987,210,2,"Q4_2012","USA","USA-AD-380","USA-AD-379","Netherlands","NLD","Brass Sheet/Strip","7/29/87","2/8/88","9/10/87","A","A","2/8/88","AVD","6/22/88","8/4/88","A","A","8/12/88","AVD","5/1/00","2000","AVD",".",".",".",10,10,1,10,1,0,0,4.771791722,4.55731744,17.91712866,100.3469976,0,20100.78873,15478.14696,4.87e+12,2.27e+11,7.471972404,51.30387688,2.238295154,4.097723314,"7/29/87",1987-07-29,1987-07-29,1728,2381,1988-02-08,5.25e+12,2.43e+11,8.464379545,53.6760786,19.01153714,104.8695748,21483.11445,16436.81853,2.040427155,4.054504812,"United States of America",1995-01-01,"Netherlands ",1995-01-01,0,0,"Netherlands",1948-01-01,"United States of America",1948-01-01,1,1,10,10,10,10,1,1
"245",2,"1988",255,1988,255,2,"Q4_2012","USA","USA-AD-391a","USA-AD-391a","West Germany","FRG","Ball Bearings","4/11/88","11/9/88","5/25/88","A","A","11/9/88","AVD","5/3/89","5/18/89","A","A","5/15/89","AVD","9/15/11","2011","AVD",".",".",".",10,10,1,10,1,1,0,4.722676581,1.17126611,19.01153714,46.05004562,1,21483.11445,17352.34321,5.25e+12,1.36e+12,8.464379545,22.90421573,2.040427155,NA,"4/11/88",1988-04-11,1988-04-11,2019,2638,1988-11-09,5.25e+12,1.36e+12,8.464379545,22.90421573,19.01153714,46.05004562,21483.11445,17352.34321,2.040427155,NA,"United States of America",1995-01-01,"Germany ",1995-01-01,0,0,"Germany",1951-10-01,"United States of America",1948-01-01,1,1,10,10,10,10,1,1
"246",2,"1988",710,1988,710,2,"Q4_2012","USA","USA-AD-405","USA-AD-405","China","CHN","Sewn Cloth Headware","6/3/88","11/8/88","7/20/88","A","A","11/8/88","AVD","3/23/89","5/11/89","A","N",".",".",".",".",".",".",".",".",10,10,1,-7,0,0,0,4.722676581,5.649474503,19.01153714,23.72492425,0,21483.11445,280.9682913,5.25e+12,3.1e+11,8.464379545,11.3601719,2.040427155,25.69572324,"6/3/88",1988-06-03,1988-06-03,2823,2691,1988-11-08,5.25e+12,3.1e+11,8.464379545,11.3601719,19.01153714,23.72492425,21483.11445,280.9682913,2.040427155,25.69572324,"United States of America",1995-01-01,"China ",2001-12-11,0,0,NA,NA,"United States of America",1948-01-01,1,NA,-7,0,10,10,1,0
"247",2,"1988",160,1988,160,2,"Q4_2012","USA","USA-AD-409","USA-AD-409","Argentina","ARG","Rectangular Pipe","6/14/88","11/21/88","7/27/88","A","A","11/21/88","AVD","4/6/89","5/25/89","A","A","5/26/89","AVD","8/22/05","2005","AVD",".",".",".",10,10,1,8,1,0,0,4.722676581,4.738119319,19.01153714,15.74345861,0,21483.11445,3979.637126,5.25e+12,1.26e+11,8.464379545,9.531612973,2.040427155,8.977868218,"6/14/88",1988-06-14,1988-06-14,1648,2702,1988-11-21,5.25e+12,1.26e+11,8.464379545,9.531612973,19.01153714,15.74345861,21483.11445,3979.637126,2.040427155,8.977868218,"United States of America",1995-01-01,"Argentina ",1995-01-01,0,0,"Argentina",1967-10-11,"United States of America",1948-01-01,1,1,8,8,10,10,1,1
"248",2,"1988",713,1988,713,2,"Q4_2012","USA","USA-AD-404","USA-AD-400","Taiwan","TWN","Thermostatic Plugs & Probes","4/26/88","9/28/88","6/8/88","A","A","9/28/88","AVD","12/13/88","2/1/89","A","N",".",".",".",".",".",".",".",".",10,10,1,-1,0,0,0,4.722676581,NA,19.01153714,NA,0,21483.11445,NA,5.25e+12,NA,8.464379545,NA,2.040427155,NA,"4/26/88",1988-04-26,1988-04-26,104,2653,1988-09-28,5.25e+12,NA,8.464379545,NA,19.01153714,NA,21483.11445,NA,2.040427155,NA,"United States of America",1995-01-01,"Taiwan",2002-01-01,0,0,NA,NA,"United States of America",1948-01-01,1,NA,-1,2,10,10,1,0
"249",2,"1988",740,1988,740,2,"Q4_2012","USA","USA-AD-394e","USA-AD-391e","Japan","JPN","Spherical Plain Ball Bearings","4/11/88","11/9/88","5/25/88","A","A","11/9/88","AVD","5/3/89","5/18/89","A","A","5/15/89","AVD","7/11/00","2000","AVD",".",".",".",10,10,1,10,1,1,0,4.722676581,0.584074673,19.01153714,17.40198106,1,21483.11445,24592.77201,5.25e+12,3.02e+12,8.464379545,9.764554829,2.040427155,NA,"4/11/88",1988-04-11,1988-04-11,157,2638,1988-11-09,5.25e+12,3.02e+12,8.464379545,9.764554829,19.01153714,17.40198106,21483.11445,24592.77201,2.040427155,NA,"United States of America",1995-01-01,"Japan ",1995-01-01,0,0,"Japan",1955-09-10,"United States of America",1948-01-01,1,1,10,10,10,10,1,1
"250",2,"1988",220,1988,220,2,"Q4_2012","USA","USA-AD-392d","USA-AD-391d","France","FRA","Needle Roller Bearings","4/11/88","11/9/88","5/25/88","A","A","11/9/88","AVD","5/3/89","5/18/89","A","N",".",".",".",".",".",".",".",".",10,10,1,9,1,0,0,4.722676581,2.315473749,19.01153714,42.38040038,1,21483.11445,17319.9367,5.25e+12,1e+12,8.464379545,20.80948831,2.040427155,3.407239047,"4/11/88",1988-04-11,1988-04-11,2517,2638,1988-11-09,5.25e+12,1e+12,8.464379545,20.80948831,19.01153714,42.38040038,21483.11445,17319.9367,2.040427155,3.407239047,"United States of America",1995-01-01,"France ",1995-01-01,0,0,"France",1948-01-01,"United States of America",1948-01-01,1,1,9,9,10,10,1,1
"251",2,"1988",101,1987,101,2,"Q4_2012","USA","USA-AD-378","USA-AD-378","Venezuela","VEN","Electrical Conductor Aluminum Rods","7/22/87","2/8/88","9/2/87","A","A","2/8/88","AVD","6/30/88","8/17/88","A","A","8/22/88","AVD","4/26/95","1995","AVD",".",".",".",10,10,1,9,1,0,0,4.771791722,0.045377497,17.91712866,44.81108679,0,20100.78873,2481.057185,4.87e+12,45343793676,7.471972404,21.43827481,2.238295154,6.582892273,"7/22/87",1987-07-22,1987-07-22,1266,2374,1988-02-08,5.25e+12,58428404474,8.464379545,20.5686801,19.01153714,47.79903164,21483.11445,3113.521877,2.040427155,6.757378351,"United States of America",1995-01-01,"Venezuela",1995-01-01,0,0,"Venezuela",1990-08-31,"United States of America",1948-01-01,1,0,9,9,10,10,1,1
"252",2,"1988",255,1988,255,2,"Q4_2012","USA","USA-AD-391c","USA-AD-391c","West Germany","FRG","Cylindrical Roller Bearings","4/11/88","11/9/88","5/25/88","A","A","11/9/88","AVD","5/3/89","5/18/89","A","A","5/15/89","AVD","7/11/00","2000","AVD",".",".",".",10,10,1,10,1,1,0,4.722676581,1.17126611,19.01153714,46.05004562,1,21483.11445,17352.34321,5.25e+12,1.36e+12,8.464379545,22.90421573,2.040427155,NA,"4/11/88",1988-04-11,1988-04-11,2019,2638,1988-11-09,5.25e+12,1.36e+12,8.464379545,22.90421573,19.01153714,46.05004562,21483.11445,17352.34321,2.040427155,NA,"United States of America",1995-01-01,"Germany ",1995-01-01,0,0,"Germany",1951-10-01,"United States of America",1948-01-01,1,1,10,10,10,10,1,1
"253",2,"1988",200,1988,200,2,"Q4_2012","USA","USA-AD-399a","USA-AD-391a","United Kingdom","GBR","Ball Bearings","4/11/88","11/9/88","5/25/88","A","A","11/9/88","AVD","5/3/89","5/18/89","A","A","5/15/89","AVD","7/15/11","2011","AVD",".",".",".",10,10,1,10,1,1,0,4.722676581,1.293969981,19.01153714,49.07662405,0,21483.11445,14951.05213,5.25e+12,8.51e+11,8.464379545,22.94514937,2.040427155,NA,"4/11/88",1988-04-11,1988-04-11,3265,2638,1988-11-09,5.25e+12,8.51e+11,8.464379545,22.94514937,19.01153714,49.07662405,21483.11445,14951.05213,2.040427155,NA,"United States of America",1995-01-01,"United Kingdom",1995-01-01,0,0,"United Kingdom",1948-01-01,"United States of America",1948-01-01,1,1,10,10,10,10,1,1
"254",2,"1988",740,1988,740,2,"Q4_2012","USA","USA-AD-389","USA-AD-389","Japan","JPN","Microdisks","3/9/88","9/29/88","4/20/88","A","A","9/29/88","AVD","2/10/89","3/29/89","A","A","4/3/89","AVD","7/1/99","1999","AVD",".",".",".",10,10,1,10,1,0,0,4.722676581,0.584074673,19.01153714,17.40198106,1,21483.11445,24592.77201,5.25e+12,3.02e+12,8.464379545,9.764554829,2.040427155,NA,"3/9/88",1988-03-09,1988-03-09,124,2605,1988-09-29,5.25e+12,3.02e+12,8.464379545,9.764554829,19.01153714,17.40198106,21483.11445,24592.77201,2.040427155,NA,"United States of America",1995-01-01,"Japan ",1995-01-01,0,0,"Japan",1955-09-10,"United States of America",1948-01-01,1,1,10,10,10,10,1,1
"255",2,"1988",740,1988,740,2,"Q4_2012","USA","USA-AD-394c","USA-AD-391c","Japan","JPN","Cylindrical Roller Bearings","4/11/88","11/9/88","5/25/88","A","A","11/9/88","AVD","5/3/89","5/18/89","A","A","5/15/89","AVD","7/11/00","2000","AVD",".",".",".",10,10,1,10,1,1,0,4.722676581,0.584074673,19.01153714,17.40198106,1,21483.11445,24592.77201,5.25e+12,3.02e+12,8.464379545,9.764554829,2.040427155,NA,"4/11/88",1988-04-11,1988-04-11,157,2638,1988-11-09,5.25e+12,3.02e+12,8.464379545,9.764554829,19.01153714,17.40198106,21483.11445,24592.77201,2.040427155,NA,"United States of America",1995-01-01,"Japan ",1995-01-01,0,0,"Japan",1955-09-10,"United States of America",1948-01-01,1,1,10,10,10,10,1,1
"256",2,"1988",740,1987,740,2,"Q4_2012","USA","USA-AD-386","USA-AD-385","Japan","JPN","Granular Polytetrafluoroethylene Resin","11/17/87","4/20/88","12/30/87","A","A","4/20/88","AVD","7/5/88","8/25/88","A","A","8/28/88","AVD","1/20/11","2011","AVD",".",".",".",10,10,1,10,1,0,0,4.771791722,0.573119255,17.91712866,17.35219699,1,20100.78873,20355.60522,4.87e+12,2.49e+12,7.471972404,10.14650374,2.238295154,NA,"11/17/87",1987-11-17,1987-11-17,11,2492,1988-04-20,5.25e+12,3.02e+12,8.464379545,9.764554829,19.01153714,17.40198106,21483.11445,24592.77201,2.040427155,NA,"United States of America",1995-01-01,"Japan ",1995-01-01,0,0,"Japan",1955-09-10,"United States of America",1948-01-01,1,1,10,10,10,10,1,1
"257",2,"1988",255,1988,255,2,"Q4_2012","USA","USA-AD-391b","USA-AD-391b","West Germany","FRG","Spherical Roller Bearings","4/11/88","11/9/88","5/25/88","A","A","11/9/88","AVD","5/3/89","5/18/89","A","N",".",".",".",".",".",".",".",".",10,10,1,10,1,0,0,4.722676581,1.17126611,19.01153714,46.05004562,1,21483.11445,17352.34321,5.25e+12,1.36e+12,8.464379545,22.90421573,2.040427155,NA,"4/11/88",1988-04-11,1988-04-11,2019,2638,1988-11-09,5.25e+12,1.36e+12,8.464379545,22.90421573,19.01153714,46.05004562,21483.11445,17352.34321,2.040427155,NA,"United States of America",1995-01-01,"Germany ",1995-01-01,0,0,"Germany",1951-10-01,"United States of America",1948-01-01,1,1,10,10,10,10,1,1
"258",2,"1988",740,1988,740,2,"Q4_2012","USA","USA-AD-402","USA-AD-400","Japan","JPN","Thermostatic Plugs & Probes","4/26/88","9/28/88","6/8/88","A","A","9/28/88","AVD","12/13/88","2/1/89","A","N",".",".",".",".",".",".",".",".",10,10,1,10,1,0,0,4.722676581,0.584074673,19.01153714,17.40198106,1,21483.11445,24592.77201,5.25e+12,3.02e+12,8.464379545,9.764554829,2.040427155,NA,"4/26/88",1988-04-26,1988-04-26,172,2653,1988-09-28,5.25e+12,3.02e+12,8.464379545,9.764554829,19.01153714,17.40198106,21483.11445,24592.77201,2.040427155,NA,"United States of America",1995-01-01,"Japan ",1995-01-01,0,0,"Japan",1955-09-10,"United States of America",1948-01-01,1,1,10,10,10,10,1,1
"259",2,"1988",740,1987,740,2,"Q4_2012","USA","USA-AD-384","USA-AD-384","Japan","JPN","Nitrile Rubber","9/10/87","2/12/88","10/28/87","A","A","2/12/88","AVD","4/29/88","6/27/88","A","A","6/16/88","AVD","10/5/99","1999","AVD",".",".",".",10,10,1,10,1,0,0,4.771791722,0.573119255,17.91712866,17.35219699,1,20100.78873,20355.60522,4.87e+12,2.49e+12,7.471972404,10.14650374,2.238295154,NA,"9/10/87",1987-09-10,1987-09-10,1749,2424,1988-02-12,5.25e+12,3.02e+12,8.464379545,9.764554829,19.01153714,17.40198106,21483.11445,24592.77201,2.040427155,NA,"United States of America",1995-01-01,"Japan ",1995-01-01,0,0,"Japan",1955-09-10,"United States of America",1948-01-01,1,1,10,10,10,10,1,1
"260",2,"1988",325,1987,325,2,"Q4_2012","USA","USA-AD-381","USA-AD-381","Italy","ITA","Granite","8/5/87","2/29/88","9/23/87","A","A","2/29/88","AVD","7/19/88","8/7/88","A","N",".",".",".",".",".",".",".",".",10,10,1,10,1,0,0,4.771791722,1.188131867,17.91712866,37.0428331,0,20100.78873,13714.95754,4.87e+12,7.76e+11,7.471972404,18.7434215,2.238295154,NA,"8/5/87",1987-08-05,1987-08-05,7,2388,1988-02-29,5.25e+12,8.59e+11,8.464379545,18.32021291,19.01153714,36.57231663,21483.11445,15169.75603,2.040427155,NA,"United States of America",1995-01-01,"Italy ",1995-01-01,0,0,"Italy",1950-05-30,"United States of America",1948-01-01,1,1,10,10,10,10,1,1
"261",2,"1988",220,1988,220,2,"Q4_2012","USA","USA-AD-392b","USA-AD-391b","France","FRA","Spherical Roller Bearings","4/11/88","11/9/88","5/25/88","A","A","11/9/88","AVD","5/3/89","5/18/89","A","N",".",".",".",".",".",".",".",".",10,10,1,9,1,0,0,4.722676581,2.315473749,19.01153714,42.38040038,1,21483.11445,17319.9367,5.25e+12,1e+12,8.464379545,20.80948831,2.040427155,3.407239047,"4/11/88",1988-04-11,1988-04-11,2517,2638,1988-11-09,5.25e+12,1e+12,8.464379545,20.80948831,19.01153714,42.38040038,21483.11445,17319.9367,2.040427155,3.407239047,"United States of America",1995-01-01,"France ",1995-01-01,0,0,"France",1948-01-01,"United States of America",1948-01-01,1,1,9,9,10,10,1,1
"262",2,"1988",350,1988,350,2,"Q4_2012","USA","USA-AD-406","USA-AD-406","Greece","GRC","Electrolytic Manganese Dioxide","6/8/88","11/14/88","7/27/88","A","A","11/14/88","AVD","3/2/89","4/20/89","A","A","4/17/89","AVD","5/31/00","2000","AVD",".",".",".",10,10,1,10,1,0,0,4.722676581,2.489897245,19.01153714,48.15911801,0,21483.11445,7245.206037,5.25e+12,72720009820,8.464379545,20.03051974,2.040427155,NA,"6/8/88",1988-06-08,1988-06-08,2422,2696,1988-11-14,5.25e+12,72720009820,8.464379545,20.03051974,19.01153714,48.15911801,21483.11445,7245.206037,2.040427155,NA,"United States of America",1995-01-01,"Greece ",1995-01-01,0,0,"Greece",1950-03-01,"United States of America",1948-01-01,1,1,10,10,10,10,1,1
"263",2,"1988",740,1988,740,2,"Q4_2012","USA","USA-AD-394b","USA-AD-391b","Japan","JPN","Spherical Roller Bearings","4/11/88","11/9/88","5/25/88","A","A","11/9/88","AVD","5/3/89","5/18/89","A","N",".",".",".",".",".",".",".",".",10,10,1,10,1,0,0,4.722676581,0.584074673,19.01153714,17.40198106,1,21483.11445,24592.77201,5.25e+12,3.02e+12,8.464379545,9.764554829,2.040427155,NA,"4/11/88",1988-04-11,1988-04-11,157,2638,1988-11-09,5.25e+12,3.02e+12,8.464379545,9.764554829,19.01153714,17.40198106,21483.11445,24592.77201,2.040427155,NA,"United States of America",1995-01-01,"Japan ",1995-01-01,0,0,"Japan",1955-09-10,"United States of America",1948-01-01,1,1,10,10,10,10,1,1
"264",2,"1988",220,1988,220,2,"Q4_2012","USA","USA-AD-392a","USA-AD-391a","France","FRA","Ball Bearings","4/11/88","11/9/88","5/25/88","A","A","11/9/88","AVD","5/3/89","5/18/89","A","A","5/15/89","AVD","9/15/11","2011","AVD",".",".",".",10,10,1,9,1,1,0,4.722676581,2.315473749,19.01153714,42.38040038,1,21483.11445,17319.9367,5.25e+12,1e+12,8.464379545,20.80948831,2.040427155,3.407239047,"4/11/88",1988-04-11,1988-04-11,2517,2638,1988-11-09,5.25e+12,1e+12,8.464379545,20.80948831,19.01153714,42.38040038,21483.11445,17319.9367,2.040427155,3.407239047,"United States of America",1995-01-01,"France ",1995-01-01,0,0,"France",1948-01-01,"United States of America",1948-01-01,1,1,9,9,10,10,1,1
"265",2,"1988",740,1987,740,2,"Q4_2012","USA","USA-AD-383","USA-AD-383","Japan","JPN","Bimetallic Cylinders","8/12/87","1/15/88","9/23/87","A","A","1/15/88","AVD","4/1/88","5/19/88","A","N",".",".",".",".",".",".",".",".",10,10,1,10,1,0,0,4.771791722,0.573119255,17.91712866,17.35219699,1,20100.78873,20355.60522,4.87e+12,2.49e+12,7.471972404,10.14650374,2.238295154,NA,"8/12/87",1987-08-12,1987-08-12,1720,2395,1988-01-15,5.25e+12,3.02e+12,8.464379545,9.764554829,19.01153714,17.40198106,21483.11445,24592.77201,2.040427155,NA,"United States of America",1995-01-01,"Japan ",1995-01-01,0,0,"Japan",1955-09-10,"United States of America",1948-01-01,1,1,10,10,10,10,1,1
"266",2,"1988",200,1988,200,2,"Q4_2012","USA","USA-AD-399b","USA-AD-391b","United Kingdom","GBR","Spherical Roller Bearings","4/11/88","11/9/88","5/25/88","A","A","11/9/88","AVD","5/3/89","5/18/89","A","N",".",".",".",".",".",".",".",".",10,10,1,10,1,0,0,4.722676581,1.293969981,19.01153714,49.07662405,0,21483.11445,14951.05213,5.25e+12,8.51e+11,8.464379545,22.94514937,2.040427155,NA,"4/11/88",1988-04-11,1988-04-11,3265,2638,1988-11-09,5.25e+12,8.51e+11,8.464379545,22.94514937,19.01153714,49.07662405,21483.11445,14951.05213,2.040427155,NA,"United States of America",1995-01-01,"United Kingdom",1995-01-01,0,0,"United Kingdom",1948-01-01,"United States of America",1948-01-01,1,1,10,10,10,10,1,1
"267",2,"1988",360,1988,360,2,"Q4_2012","USA","USA-AD-395b","USA-AD-391b","Romania","ROU","Spherical Roller Bearings","4/11/88","11/9/88","5/25/88","A","A","11/9/88","AVD","5/3/89","5/18/89","A","N",".",".",".",".",".",".",".",".",10,10,1,-8,0,0,0,4.722676581,NA,19.01153714,NA,0,21483.11445,1753.192792,5.25e+12,40424526826,8.464379545,NA,2.040427155,NA,"4/11/88",1988-04-11,1988-04-11,8421,2638,1988-11-09,5.25e+12,40424526826,8.464379545,NA,19.01153714,NA,21483.11445,1753.192792,2.040427155,NA,"United States of America",1995-01-01,"Romania ",1995-01-01,0,0,"Romania",1971-11-14,"United States of America",1948-01-01,1,1,-8,0,10,10,1,0
"268",2,"1988",325,1987,325,2,"Q4_2012","USA","USA-AD-385","USA-AD-385","Italy","ITA","Granular Polytetrafluoroethylene Resin","11/17/87","4/20/88","12/30/87","A","A","4/20/88","AVD","7/11/88","8/25/88","A","A","8/30/88","AVD","IF","IF","AVD",".",".",".",10,10,1,10,1,1,0,4.771791722,1.188131867,17.91712866,37.0428331,0,20100.78873,13714.95754,4.87e+12,7.76e+11,7.471972404,18.7434215,2.238295154,NA,"11/17/87",1987-11-17,1987-11-17,111,2492,1988-04-20,5.25e+12,8.59e+11,8.464379545,18.32021291,19.01153714,36.57231663,21483.11445,15169.75603,2.040427155,NA,"United States of America",1995-01-01,"Italy ",1995-01-01,0,0,"Italy",1950-05-30,"United States of America",1948-01-01,1,1,10,10,10,10,1,1
"269",2,"1988",713,1988,713,2,"Q4_2012","USA","USA-AD-410","USA-AD-409","Taiwan","TWN","Rectangular Pipe","6/14/88","11/21/88","7/27/88","A","A","11/21/88","AVD","2/3/89","3/29/89","A","A","3/27/89","AVD","IF","IF","AVD",".",".",".",10,10,1,-1,0,0,0,4.722676581,NA,19.01153714,NA,0,21483.11445,NA,5.25e+12,NA,8.464379545,NA,2.040427155,NA,"6/14/88",1988-06-14,1988-06-14,153,2702,1988-11-21,5.25e+12,NA,8.464379545,NA,19.01153714,NA,21483.11445,NA,2.040427155,NA,"United States of America",1995-01-01,"Taiwan",2002-01-01,0,0,NA,NA,"United States of America",1948-01-01,1,NA,-1,2,10,10,1,0
"270",2,"1988",740,1988,740,2,"Q4_2012","USA","USA-AD-388","USA-AD-388","Japan","JPN","All-Terrain Vehicles","2/18/88","9/12/88","4/6/88","A","A","9/12/88","AVD","1/31/89","3/22/89","A","N",".",".",".",".",".",".",".",".",10,10,1,10,1,0,0,4.722676581,0.584074673,19.01153714,17.40198106,1,21483.11445,24592.77201,5.25e+12,3.02e+12,8.464379545,9.764554829,2.040427155,NA,"2/18/88",1988-02-18,1988-02-18,104,2585,1988-09-12,5.25e+12,3.02e+12,8.464379545,9.764554829,19.01153714,17.40198106,21483.11445,24592.77201,2.040427155,NA,"United States of America",1995-01-01,"Japan ",1995-01-01,0,0,"Japan",1955-09-10,"United States of America",1948-01-01,1,1,10,10,10,10,1,1
"271",2,"1988",820,1988,820,2,"Q4_2012","USA","USA-AD-403","USA-AD-400","Malaysia","MYS","Thermostatic Plugs & Probes","4/26/88","9/28/88","6/8/88","A","A","9/28/88","AVD","12/13/88","2/1/89","A","N",".",".",".",".",".",".",".",".",10,10,1,4,0,0,0,4.722676581,21.54182543,19.01153714,122.6242247,0,21483.11445,2050.448575,5.25e+12,35271881996,8.464379545,66.41550121,2.040427155,20.07145052,"4/26/88",1988-04-26,1988-04-26,2476,2653,1988-09-28,5.25e+12,35271881996,8.464379545,66.41550121,19.01153714,122.6242247,21483.11445,2050.448575,2.040427155,20.07145052,"United States of America",1995-01-01,"Malaysia ",1995-01-01,0,0,"Malaysia",1957-10-24,"United States of America",1948-01-01,1,1,4,5,10,10,1,0
"272",2,"1988",740,1988,740,2,"Q4_2012","USA","USA-AD-394d","USA-AD-391d","Japan","JPN","Needle Roller Bearings","4/11/88","11/9/88","5/25/88","A","A","11/9/88","AVD","5/3/89","5/18/89","A","N",".",".",".",".",".",".",".",".",10,10,1,10,1,0,0,4.722676581,0.584074673,19.01153714,17.40198106,1,21483.11445,24592.77201,5.25e+12,3.02e+12,8.464379545,9.764554829,2.040427155,NA,"4/11/88",1988-04-11,1988-04-11,157,2638,1988-11-09,5.25e+12,3.02e+12,8.464379545,9.764554829,19.01153714,17.40198106,21483.11445,24592.77201,2.040427155,NA,"United States of America",1995-01-01,"Japan ",1995-01-01,0,0,"Japan",1955-09-10,"United States of America",1948-01-01,1,1,10,10,10,10,1,1
"273",2,"1988",325,1988,325,2,"Q4_2012","USA","USA-AD-393d","USA-AD-391d","Italy","ITA","Needle Roller Bearings","4/11/88","11/9/88","5/25/88","A","A","11/9/88","AVD","5/3/89","5/18/89","A","N",".",".",".",".",".",".",".",".",10,10,1,10,1,0,0,4.722676581,1.259594645,19.01153714,36.57231663,1,21483.11445,15169.75603,5.25e+12,8.59e+11,8.464379545,18.32021291,2.040427155,NA,"4/11/88",1988-04-11,1988-04-11,257,2638,1988-11-09,5.25e+12,8.59e+11,8.464379545,18.32021291,19.01153714,36.57231663,21483.11445,15169.75603,2.040427155,NA,"United States of America",1995-01-01,"Italy ",1995-01-01,0,0,"Italy",1950-05-30,"United States of America",1948-01-01,1,1,10,10,10,10,1,1
"274",2,"1988",325,1988,325,2,"Q4_2012","USA","USA-AD-393c","USA-AD-391c","Italy","ITA","Cylindrical Roller Bearings","4/11/88","11/9/88","5/25/88","A","A","11/9/88","AVD","5/3/89","5/18/89","A","A","5/15/89","AVD","7/11/00","2000","AVD",".",".",".",10,10,1,10,1,1,0,4.722676581,1.259594645,19.01153714,36.57231663,1,21483.11445,15169.75603,5.25e+12,8.59e+11,8.464379545,18.32021291,2.040427155,NA,"4/11/88",1988-04-11,1988-04-11,257,2638,1988-11-09,5.25e+12,8.59e+11,8.464379545,18.32021291,19.01153714,36.57231663,21483.11445,15169.75603,2.040427155,NA,"United States of America",1995-01-01,"Italy ",1995-01-01,0,0,"Italy",1950-05-30,"United States of America",1948-01-01,1,1,10,10,10,10,1,1
"275",2,"1988",220,1988,220,2,"Q4_2012","USA","USA-AD-392c","USA-AD-391c","France","FRA","Cylindrical Roller Bearings","4/11/88","11/9/88","5/25/88","A","A","11/9/88","AVD","5/3/89","5/18/89","A","A","5/15/89","AVD","7/11/00","2000","AVD",".",".",".",10,10,1,9,1,1,0,4.722676581,2.315473749,19.01153714,42.38040038,1,21483.11445,17319.9367,5.25e+12,1e+12,8.464379545,20.80948831,2.040427155,3.407239047,"4/11/88",1988-04-11,1988-04-11,2517,2638,1988-11-09,5.25e+12,1e+12,8.464379545,20.80948831,19.01153714,42.38040038,21483.11445,17319.9367,2.040427155,3.407239047,"United States of America",1995-01-01,"France ",1995-01-01,0,0,"France",1948-01-01,"United States of America",1948-01-01,1,1,9,9,10,10,1,1
"276",2,"1988",200,1988,200,2,"Q4_2012","USA","USA-AD-399c","USA-AD-391c","United Kingdom","GBR","Cylindrical Roller Bearings","4/11/88","11/9/88","5/25/88","A","A","11/9/88","AVD","5/3/89","5/18/89","A","A","5/15/89","AVD","7/11/00","2000","AVD",".",".",".",10,10,1,10,1,1,0,4.722676581,1.293969981,19.01153714,49.07662405,0,21483.11445,14951.05213,5.25e+12,8.51e+11,8.464379545,22.94514937,2.040427155,NA,"4/11/88",1988-04-11,1988-04-11,3265,2638,1988-11-09,5.25e+12,8.51e+11,8.464379545,22.94514937,19.01153714,49.07662405,21483.11445,14951.05213,2.040427155,NA,"United States of America",1995-01-01,"United Kingdom",1995-01-01,0,0,"United Kingdom",1948-01-01,"United States of America",1948-01-01,1,1,10,10,10,10,1,1
"277",2,"1988",380,1988,380,2,"Q4_2012","USA","USA-AD-397a","USA-AD-391a","Sweden","SWE","Ball Bearings","4/11/88","11/9/88","5/25/88","A","A","11/9/88","AVD","5/3/89","5/18/89","A","A","5/15/89","AVD","7/11/00","2000","AVD",".",".",".",10,10,1,10,1,0,0,4.722676581,7.806149147,19.01153714,61.97702705,0,21483.11445,23277.09724,5.25e+12,1.96e+11,8.464379545,32.09897269,2.040427155,4.122258225,"4/11/88",1988-04-11,1988-04-11,761,2638,1988-11-09,5.25e+12,1.96e+11,8.464379545,32.09897269,19.01153714,61.97702705,21483.11445,23277.09724,2.040427155,4.122258225,"United States of America",1995-01-01,"Sweden ",1995-01-01,0,0,"Sweden",1950-04-30,"United States of America",1948-01-01,1,1,10,10,10,10,1,1
"278",2,"1988",255,1988,255,2,"Q4_2012","USA","USA-AD-391e","USA-AD-391e","West Germany","FRG","Spherical Plain Ball Bearings","4/11/88","11/9/88","5/25/88","A","A","11/9/88","AVD","5/3/89","5/18/89","A","A","5/15/89","AVD","7/11/00","2000","AVD",".",".",".",10,10,1,10,1,0,0,4.722676581,1.17126611,19.01153714,46.05004562,1,21483.11445,17352.34321,5.25e+12,1.36e+12,8.464379545,22.90421573,2.040427155,NA,"4/11/88",1988-04-11,1988-04-11,2019,2638,1988-11-09,5.25e+12,1.36e+12,8.464379545,22.90421573,19.01153714,46.05004562,21483.11445,17352.34321,2.040427155,NA,"United States of America",1995-01-01,"Germany ",1995-01-01,0,0,"Germany",1951-10-01,"United States of America",1948-01-01,1,1,10,10,10,10,1,1
"279",2,"1988",740,1987,740,2,"Q4_2012","USA","USA-AD-379","USA-AD-379","Japan","JPN","Brass Sheet/Strip","7/29/87","2/1/88","9/10/87","A","A","2/1/88","AVD","6/21/88","8/4/88","A","A","8/12/88","AVD","IF","IF","AVD",".",".",".",10,10,1,10,1,0,0,4.771791722,0.573119255,17.91712866,17.35219699,1,20100.78873,20355.60522,4.87e+12,2.49e+12,7.471972404,10.14650374,2.238295154,NA,"7/29/87",1987-07-29,1987-07-29,1706,2381,1988-02-01,5.25e+12,3.02e+12,8.464379545,9.764554829,19.01153714,17.40198106,21483.11445,24592.77201,2.040427155,NA,"United States of America",1995-01-01,"Japan ",1995-01-01,0,0,"Japan",1955-09-10,"United States of America",1948-01-01,1,1,10,10,10,10,1,1
"280",2,"1988",255,1988,255,2,"Q4_2012","USA","USA-AD-391d","USA-AD-391d","West Germany","FRG","Needle Roller Bearings","4/11/88","11/9/88","5/25/88","A","A","11/9/88","AVD","5/3/89","5/18/89","A","N",".",".",".",".",".",".",".",".",10,10,1,10,1,0,0,4.722676581,1.17126611,19.01153714,46.05004562,1,21483.11445,17352.34321,5.25e+12,1.36e+12,8.464379545,22.90421573,2.040427155,NA,"4/11/88",1988-04-11,1988-04-11,2019,2638,1988-11-09,5.25e+12,1.36e+12,8.464379545,22.90421573,19.01153714,46.05004562,21483.11445,17352.34321,2.040427155,NA,"United States of America",1995-01-01,"Germany ",1995-01-01,0,0,"Germany",1951-10-01,"United States of America",1948-01-01,1,1,10,10,10,10,1,1
"281",2,"1988",230,1987,230,2,"Q4_2012","USA","USA-AD-382","USA-AD-381","Spain","ESP","Granite","8/5/87","2/29/88","9/23/87","A","A","2/29/88","AVD","6/28/88","8/7/88","A","N",".",".",".",".",".",".",".",".",10,10,1,10,1,0,0,4.771791722,2.620007682,17.91712866,36.34688184,0,20100.78873,8004.03797,4.87e+12,3.09e+11,7.471972404,18.19405455,2.238295154,NA,"8/5/87",1987-08-05,1987-08-05,1707,2388,1988-02-29,5.25e+12,3.65e+11,8.464379545,17.76082642,19.01153714,36.70983276,21483.11445,9424.970152,2.040427155,NA,"United States of America",1995-01-01,"Spain ",1995-01-01,0,0,"Spain",1963-08-29,"United States of America",1948-01-01,1,1,10,10,10,10,1,1
"282",2,"1988",800,1988,800,2,"Q4_2012","USA","USA-AD-398","USA-AD-391a","Thailand","THA","Ball Bearings","4/11/88","11/9/88","5/25/88","A","A","11/9/88","AVD","5/3/89","5/18/89","A","A","5/15/89","AVD","6/28/96","1996","AVD",".",".",".",10,10,1,3,0,0,0,4.722676581,NA,19.01153714,67.413469,0,21483.11445,1122.105476,5.25e+12,61667254411,8.464379545,33.01196771,2.040427155,16.1780589,"4/11/88",1988-04-11,1988-04-11,2961,2638,1988-11-09,5.25e+12,61667254411,8.464379545,33.01196771,19.01153714,67.413469,21483.11445,1122.105476,2.040427155,16.1780589,"United States of America",1995-01-01,"Thailand ",1995-01-01,0,0,"Thailand",1982-11-20,"United States of America",1948-01-01,1,1,3,4,10,10,1,0
"283",2,"1988",380,1988,380,2,"Q4_2012","USA","USA-AD-397b","USA-AD-391b","Sweden","SWE","Spherical Roller Bearings","4/11/88","11/9/88","5/25/88","A","A","11/9/88","AVD","5/3/89","5/18/89","A","N",".",".",".",".",".",".",".",".",10,10,1,10,1,0,0,4.722676581,7.806149147,19.01153714,61.97702705,0,21483.11445,23277.09724,5.25e+12,1.96e+11,8.464379545,32.09897269,2.040427155,4.122258225,"4/11/88",1988-04-11,1988-04-11,761,2638,1988-11-09,5.25e+12,1.96e+11,8.464379545,32.09897269,19.01153714,61.97702705,21483.11445,23277.09724,2.040427155,4.122258225,"United States of America",1995-01-01,"Sweden ",1995-01-01,0,0,"Sweden",1950-04-30,"United States of America",1948-01-01,1,1,10,10,10,10,1,1
"284",2,"1988",380,1988,380,2,"Q4_2012","USA","USA-AD-397c","USA-AD-391c","Sweden","SWE","Cylindrical Roller Bearings","4/11/88","11/9/88","5/25/88","A","A","11/9/88","AVD","5/3/89","5/18/89","A","A","5/15/89","AVD","7/11/00","2000","AVD",".",".",".",10,10,1,10,1,0,0,4.722676581,7.806149147,19.01153714,61.97702705,0,21483.11445,23277.09724,5.25e+12,1.96e+11,8.464379545,32.09897269,2.040427155,4.122258225,"4/11/88",1988-04-11,1988-04-11,761,2638,1988-11-09,5.25e+12,1.96e+11,8.464379545,32.09897269,19.01153714,61.97702705,21483.11445,23277.09724,2.040427155,4.122258225,"United States of America",1995-01-01,"Sweden ",1995-01-01,0,0,"Sweden",1950-04-30,"United States of America",1948-01-01,1,1,10,10,10,10,1,1
"285",2,"1988",20,1988,20,2,"Q4_2012","USA","USA-AD-400","USA-AD-400","Canada","CAN","Thermostatic Plugs & Probes","4/26/88","9/28/88","6/8/88","A","A","9/28/88","AVD","12/13/88","2/1/89","A","N",".",".",".",".",".",".",".",".",10,10,1,10,1,0,0,4.722676581,10.14023679,19.01153714,51.49882137,0,21483.11445,18814.56455,5.25e+12,5.06e+11,8.464379545,26.14491069,2.040427155,2.994107762,"4/26/88",1988-04-26,1988-04-26,1317,2653,1988-09-28,5.25e+12,5.06e+11,8.464379545,26.14491069,19.01153714,51.49882137,21483.11445,18814.56455,2.040427155,2.994107762,"United States of America",1995-01-01,"Canada ",1995-01-01,0,0,"Canada",1948-01-01,"United States of America",1948-01-01,1,1,10,10,10,10,1,1
"286",2,"1988",325,1988,325,2,"Q4_2012","USA","USA-AD-393a","USA-AD-391a","Italy","ITA","Ball Bearings","4/11/88","11/9/88","5/25/88","A","A","11/9/88","AVD","5/3/89","5/18/89","A","A","5/15/89","AVD","9/15/11","2011","AVD",".",".",".",10,10,1,10,1,1,0,4.722676581,1.259594645,19.01153714,36.57231663,1,21483.11445,15169.75603,5.25e+12,8.59e+11,8.464379545,18.32021291,2.040427155,NA,"4/11/88",1988-04-11,1988-04-11,257,2638,1988-11-09,5.25e+12,8.59e+11,8.464379545,18.32021291,19.01153714,36.57231663,21483.11445,15169.75603,2.040427155,NA,"United States of America",1995-01-01,"Italy ",1995-01-01,0,0,"Italy",1950-05-30,"United States of America",1948-01-01,1,1,10,10,10,10,1,1
"287",2,"1988",325,1988,325,2,"Q4_2012","USA","USA-AD-393b","USA-AD-391b","Italy","ITA","Spherical Roller Bearings","4/11/88","11/9/88","5/25/88","A","A","11/9/88","AVD","5/3/89","5/18/89","A","N",".",".",".",".",".",".",".",".",10,10,1,10,1,0,0,4.722676581,1.259594645,19.01153714,36.57231663,1,21483.11445,15169.75603,5.25e+12,8.59e+11,8.464379545,18.32021291,2.040427155,NA,"4/11/88",1988-04-11,1988-04-11,257,2638,1988-11-09,5.25e+12,8.59e+11,8.464379545,18.32021291,19.01153714,36.57231663,21483.11445,15169.75603,2.040427155,NA,"United States of America",1995-01-01,"Italy ",1995-01-01,0,0,"Italy",1950-05-30,"United States of America",1948-01-01,1,1,10,10,10,10,1,1
"288",2,"1988",830,1988,830,2,"Q4_2012","USA","USA-AD-396","USA-AD-391a","Singapore","SGP","Ball Bearings","4/11/88","11/9/88","5/25/88","A","A","11/9/88","AVD","5/3/89","5/18/89","A","A","5/15/89","AVD","7/11/05","2005","AVD",".",".",".",10,10,1,-2,0,0,0,4.722676581,4.465175103,19.01153714,360.3534095,0,21483.11445,9316.388477,5.25e+12,26515373244,8.464379545,184.9636995,2.040427155,0.437058993,"4/11/88",1988-04-11,1988-04-11,10538,2638,1988-11-09,5.25e+12,26515373244,8.464379545,184.9636995,19.01153714,360.3534095,21483.11445,9316.388477,2.040427155,0.437058993,"United States of America",1995-01-01,"Singapore ",1995-01-01,0,0,"Singapore",1973-08-20,"United States of America",1948-01-01,1,1,-2,2,10,10,1,0
"289",2,"1988",900,1988,900,2,"Q4_2012","USA","USA-AD-411","USA-AD-411","Australia","AUS","Calcined Bauxite Proppants","7/1/88","11/28/88","8/4/88","A","A","11/28/88","AVD","2/9/89","4/5/89","A","N",".",".",".",".",".",".",".",".",10,10,1,10,1,0,0,4.722676581,18.97166722,19.01153714,32.49587721,0,21483.11445,14331.09182,5.25e+12,2.37e+11,8.464379545,15.90153211,2.040427155,5.208420676,"7/1/88",1988-07-01,1988-07-01,1939,2719,1988-11-28,5.25e+12,2.37e+11,8.464379545,15.90153211,19.01153714,32.49587721,21483.11445,14331.09182,2.040427155,5.208420676,"United States of America",1995-01-01,"Australia ",1995-01-01,0,0,"Australia",1948-01-01,"United States of America",1948-01-01,1,1,10,10,10,10,1,1
"290",2,"1989",200,1988,200,2,"Q4_2012","USA","USA-AD-418","USA-AD-412","United Kingdom","GBR","Industrial Belts","7/26/88","2/1/89","8/25/88","A","A","2/1/89","AVD","4/18/89","6/7/89","A","N",".",".",".",".",".",".",".",".",10,10,1,10,1,0,0,4.722676581,1.293969981,19.01153714,49.07662405,0,21483.11445,14951.05213,5.25e+12,8.51e+11,8.464379545,22.94514937,2.040427155,NA,"7/26/88",1988-07-26,1988-07-26,3371,2744,1989-02-01,5.66e+12,8.59e+11,8.913516093,23.63388184,19.35945702,50.87570575,22922.46545,15057.17922,2.101254834,NA,"United States of America",1995-01-01,"United Kingdom",1995-01-01,0,0,"United Kingdom",1948-01-01,"United States of America",1948-01-01,1,1,10,10,10,10,1,1
"291",2,"1989",740,1989,740,2,"Q4_2012","USA","USA-AD-426","USA-AD-426","Japan","JPN","Small Business Telephones","1/6/89","8/3/89","2/23/89","A","A","8/3/89","AVD","10/17/89","12/6/89","A","A","12/11/89","AVD","9/1/99","1999","AVD",".",".",".",10,10,1,10,1,0,0,4.513177299,0.559084414,19.35945702,18.99054619,1,22922.46545,24505.7673,5.66e+12,3.02e+12,8.913516093,10.23779047,2.101254834,NA,"1/6/89",1989-01-06,1989-01-06,427,2908,1989-08-03,5.66e+12,3.02e+12,8.913516093,10.23779047,19.35945702,18.99054619,22922.46545,24505.7673,2.101254834,NA,"United States of America",1995-01-01,"Japan ",1995-01-01,0,0,"Japan",1955-09-10,"United States of America",1948-01-01,1,1,10,10,10,10,1,1
"292",2,"1989",740,1989,740,2,"Q4_2012","USA","USA-AD-432","USA-AD-432","Japan","JPN","Drafting Machines","4/13/89","8/25/89","5/31/89","A","P","8/25/89","AVD","11/8/89","1/4/90","A","A","12/29/89","AVD","12/27/04","2004","AVD",".",".",".",10,10,1,10,1,0,0,4.513177299,0.559084414,19.35945702,18.99054619,1,22922.46545,24505.7673,5.66e+12,3.02e+12,8.913516093,10.23779047,2.101254834,NA,"4/13/89",1989-04-13,1989-04-13,524,83,1989-08-25,5.66e+12,3.02e+12,8.913516093,10.23779047,19.35945702,18.99054619,22922.46545,24505.7673,2.101254834,NA,"United States of America",1995-01-01,"Japan ",1995-01-01,0,0,"Japan",1955-09-10,"United States of America",1948-01-01,1,1,10,10,10,10,1,1
"293",2,"1989",666,1988,666,2,"Q4_2012","USA","USA-AD-412","USA-AD-412","Israel","ISR","Industrial Belts","7/26/88","2/1/89","8/25/88","A","A","2/1/89","AVD","4/18/89","6/7/89","A","N",".",".",".",".",".",".",".",".",10,10,1,9,1,0,0,4.722676581,3.063841611,19.01153714,83.2618489,0,21483.11445,9881.242706,5.25e+12,43892480102,8.464379545,35.10209271,2.040427155,NA,"7/26/88",1988-07-26,1988-07-26,645,2744,1989-02-01,5.66e+12,44599772802,8.913516093,36.80897404,19.35945702,82.52974178,22922.46545,9871.574325,2.101254834,NA,"United States of America",1995-01-01,"Israel ",1995-04-21,0,0,"Israel",1962-07-05,"United States of America",1948-01-01,1,1,9,9,10,10,1,1
"294",2,"1989",70,1989,70,2,"Q4_2012","USA","USA-AD-435","USA-AD-435","Mexico","MEX","Steel Pails","6/9/89","11/15/89","7/26/89","A","A","11/15/89","AVD","4/2/90","5/16/90","A","N",".",".",".",".",".",".",".",".",10,10,1,0,0,0,0,4.513177299,1.977634311,19.35945702,38.05867344,0,22922.46545,2644.197603,5.66e+12,2.23e+11,8.913516093,18.99694164,2.101254834,7.753825485,"6/9/89",1989-06-09,1989-06-09,190,140,1989-11-15,5.66e+12,2.23e+11,8.913516093,18.99694164,19.35945702,38.05867344,22922.46545,2644.197603,2.101254834,7.753825485,"United States of America",1995-01-01,"Mexico ",1995-01-01,0,0,"Mexico",1986-08-24,"United States of America",1948-01-01,1,1,0,2,10,10,1,0
"295",2,"1989",713,1988,713,2,"Q4_2012","USA","USA-AD-424","USA-AD-424","Taiwan","TWN","Martial Arts Uniforms","11/23/88","5/1/89","1/11/89","A","A","5/1/89","AVD","7/17/89","9/7/89","A","N",".",".",".",".",".",".",".",".",10,10,1,-1,0,0,0,4.722676581,NA,19.01153714,NA,0,21483.11445,NA,5.25e+12,NA,8.464379545,NA,2.040427155,NA,"11/23/88",1988-11-23,1988-11-23,315,2864,1989-05-01,5.66e+12,NA,8.913516093,NA,19.35945702,NA,22922.46545,NA,2.101254834,NA,"United States of America",1995-01-01,"Taiwan",2002-01-01,0,0,NA,NA,"United States of America",1948-01-01,1,NA,-1,2,10,10,1,0
"296",2,"1989",713,1984,713,2,"Q4_2012","USA","USA-AD-238","USA-AD-238","Taiwan","TWN","12-Volt Cycle Batteries","2/7/84","4/18/89","9/21/88","A","A","4/18/89","AVD","6/28/89","8/23/89","A","N",".",".",".",".",".",".",".",".",10,10,1,-7,0,0,0,4.722805917,NA,17.50934244,NA,0,17134.3157,NA,4.04e+12,NA,7.483851808,NA,2.570882817,NA,"2/7/84",1984-02-07,1984-02-07,2089,1113,1989-04-18,5.66e+12,NA,8.913516093,NA,19.35945702,NA,22922.46545,NA,2.101254834,NA,"United States of America",1995-01-01,"Taiwan",2002-01-01,0,0,NA,NA,"United States of America",1948-01-01,1,NA,-1,2,10,10,1,0
"297",2,"1989",740,1989,740,2,"Q4_2012","USA","USA-AD-429","USA-AD-429","Japan","JPN","Mechanical Transfer Presses","1/25/89","8/18/89","5/8/89","A","A","8/18/89","AVD","1/4/90","2/22/90","A","A","2/16/90","AVD","6/21/05","2005","AVD",".",".",".",10,10,1,10,1,0,0,4.513177299,0.559084414,19.35945702,18.99054619,1,22922.46545,24505.7673,5.66e+12,3.02e+12,8.913516093,10.23779047,2.101254834,NA,"1/25/89",1989-01-25,1989-01-25,446,5,1989-08-18,5.66e+12,3.02e+12,8.913516093,10.23779047,19.35945702,18.99054619,22922.46545,24505.7673,2.101254834,NA,"United States of America",1995-01-01,"Japan ",1995-01-01,0,0,"Japan",1955-09-10,"United States of America",1948-01-01,1,1,10,10,10,10,1,1
"298",2,"1989",713,1988,713,2,"Q4_2012","USA","USA-AD-417","USA-AD-412","Taiwan","TWN","Industrial Belts","7/26/88","2/1/89","8/25/88","A","A","2/1/89","AVD","4/18/89","6/7/89","A","N",".",".",".",".",".",".",".",".",10,10,1,-1,0,0,0,4.722676581,NA,19.01153714,NA,0,21483.11445,NA,5.25e+12,NA,8.464379545,NA,2.040427155,NA,"7/26/88",1988-07-26,1988-07-26,195,2744,1989-02-01,5.66e+12,NA,8.913516093,NA,19.35945702,NA,22922.46545,NA,2.101254834,NA,"United States of America",1995-01-01,"Taiwan",2002-01-01,0,0,NA,NA,"United States of America",1948-01-01,1,NA,-1,2,10,10,1,0
"299",2,"1989",732,1989,732,2,"Q4_2012","USA","USA-AD-427","USA-AD-426","South Korea","KOR","Small Business Telephones","1/6/89","8/3/89","2/23/89","A","A","8/3/89","AVD","12/27/89","12/6/89","A","A","2/7/90","AVD","9/1/99","1999","AVD",".",".",".",10,10,1,6,1,0,0,4.513177299,1.198018149,19.35945702,55.15316566,1,22922.46545,5860.40382,5.66e+12,2.49e+11,8.913516093,28.53061667,2.101254834,9.134556595,"1/6/89",1989-01-06,1989-01-06,316,2908,1989-08-03,5.66e+12,2.49e+11,8.913516093,28.53061667,19.35945702,55.15316566,22922.46545,5860.40382,2.101254834,9.134556595,"United States of America",1995-01-01,"South Korea",1995-01-01,0,0,"South Korea",1967-04-14,"United States of America",1948-01-01,1,1,6,7,10,10,1,1
"300",2,"1989",830,1988,830,2,"Q4_2012","USA","USA-AD-415","USA-AD-412","Singapore","SGP","Industrial Belts","7/26/88","2/1/89","8/25/88","A","A","2/1/89","AVD","4/18/89","6/7/89","A","P","6/14/89","AVD","9/12/00","2000","AVD",".",".",".",10,10,1,-2,0,0,0,4.722676581,4.465175103,19.01153714,360.3534095,0,21483.11445,9316.388477,5.25e+12,26515373244,8.464379545,184.9636995,2.040427155,0.437058993,"7/26/88",1988-07-26,1988-07-26,10644,2744,1989-02-01,5.66e+12,31392969307,8.913516093,179.54198,19.35945702,348.0501238,22922.46545,10711.03392,2.101254834,0.375930782,"United States of America",1995-01-01,"Singapore ",1995-01-01,0,0,"Singapore",1973-08-20,"United States of America",1948-01-01,1,1,-2,2,10,10,1,0
"301",2,"1989",713,1989,713,2,"Q4_2012","USA","USA-AD-433","USA-AD-433","Taiwan","TWN","Residential Doorlocks","5/2/89","10/6/89","6/14/89","A","A","10/6/89","AVD","12/27/89","2/8/90","A","N",".",".",".",".",".",".",".",".",10,10,1,-1,0,0,0,4.513177299,NA,19.35945702,NA,0,22922.46545,NA,5.66e+12,NA,8.913516093,NA,2.101254834,NA,"5/2/89",1989-05-02,1989-05-02,475,102,1989-10-06,5.66e+12,NA,8.913516093,NA,19.35945702,NA,22922.46545,NA,2.101254834,NA,"United States of America",1995-01-01,"Taiwan",2002-01-01,0,0,NA,NA,"United States of America",1948-01-01,1,NA,-1,2,10,10,1,0
"302",2,"1989",713,1989,713,2,"Q4_2012","USA","USA-AD-428","USA-AD-426","Taiwan","TWN","Small Business Telephones","1/6/89","8/3/89","2/23/89","A","A","8/3/89","AVD","10/17/89","12/6/89","A","A","12/11/89","AVD","9/1/99","1999","AVD",".",".",".",10,10,1,-1,0,0,0,4.513177299,NA,19.35945702,NA,0,22922.46545,NA,5.66e+12,NA,8.913516093,NA,2.101254834,NA,"1/6/89",1989-01-06,1989-01-06,359,2908,1989-08-03,5.66e+12,NA,8.913516093,NA,19.35945702,NA,22922.46545,NA,2.101254834,NA,"United States of America",1995-01-01,"Taiwan",2002-01-01,0,0,NA,NA,"United States of America",1948-01-01,1,NA,-1,2,10,10,1,0
"303",2,"1989",20,1988,20,2,"Q4_2012","USA","USA-AD-423","USA-AD-423","Canada","CAN","Cephalexin Capsules","11/4/88","4/12/89","12/21/88","A","A","4/12/89","AVD","6/26/89","8/16/89","A","N",".",".",".",".",".",".",".",".",10,10,1,10,1,0,0,4.722676581,10.14023679,19.01153714,51.49882137,0,21483.11445,18814.56455,5.25e+12,5.06e+11,8.464379545,26.14491069,2.040427155,2.994107762,"11/4/88",1988-11-04,1988-11-04,1509,2845,1989-04-12,5.66e+12,5.64e+11,8.913516093,25.11759214,19.35945702,50.17509579,22922.46545,20586.55751,2.101254834,2.959650997,"United States of America",1995-01-01,"Canada ",1995-01-01,0,0,"Canada",1948-01-01,"United States of America",1948-01-01,1,1,10,10,10,10,1,1
"304",2,"1989",740,1988,740,2,"Q4_2012","USA","USA-AD-414","USA-AD-412","Japan","JPN","Industrial Belts","7/26/88","2/1/89","8/25/88","A","A","2/1/89","AVD","4/18/89","6/7/89","A","A","6/14/89","AVD","9/12/00","2000","AVD",".",".",".",10,10,1,10,1,0,0,4.722676581,0.584074673,19.01153714,17.40198106,1,21483.11445,24592.77201,5.25e+12,3.02e+12,8.464379545,9.764554829,2.040427155,NA,"7/26/88",1988-07-26,1988-07-26,263,2744,1989-02-01,5.66e+12,3.02e+12,8.913516093,10.23779047,19.35945702,18.99054619,22922.46545,24505.7673,2.101254834,NA,"United States of America",1995-01-01,"Japan ",1995-01-01,0,0,"Japan",1955-09-10,"United States of America",1948-01-01,1,1,10,10,10,10,1,1
"305",2,"1989",732,1988,732,2,"Q4_2012","USA","USA-AD-416","USA-AD-412","South Korea","KOR","Industrial Belts","7/26/88","2/1/89","8/25/88","A","A","2/1/89","AVD","4/18/89","6/7/89","A","N",".",".",".",".",".",".",".",".",10,10,1,6,1,0,0,4.722676581,0.95419994,19.01153714,60.87381954,1,21483.11445,4813.284872,5.25e+12,2.02e+11,8.464379545,33.74608484,2.040427155,9.85164558,"7/26/88",1988-07-26,1988-07-26,152,2744,1989-02-01,5.66e+12,2.49e+11,8.913516093,28.53061667,19.35945702,55.15316566,22922.46545,5860.40382,2.101254834,9.134556595,"United States of America",1995-01-01,"South Korea",1995-01-01,0,0,"South Korea",1967-04-14,"United States of America",1948-01-01,1,1,6,7,10,10,1,1
"306",2,"1989",325,1988,325,2,"Q4_2012","USA","USA-AD-413","USA-AD-412","Italy","ITA","Industrial Belts","7/26/88","2/1/89","8/25/88","A","A","2/1/89","AVD","4/18/89","6/7/89","A","P","6/14/89","AVD","9/12/00","2000","AVD",".",".",".",10,10,1,10,1,0,0,4.722676581,1.259594645,19.01153714,36.57231663,1,21483.11445,15169.75603,5.25e+12,8.59e+11,8.464379545,18.32021291,2.040427155,NA,"7/26/88",1988-07-26,1988-07-26,104,2744,1989-02-01,5.66e+12,8.95e+11,8.913516093,19.29851847,19.35945702,38.59474996,22922.46545,15788.31477,2.101254834,NA,"United States of America",1995-01-01,"Italy ",1995-01-01,0,0,"Italy",1950-05-30,"United States of America",1948-01-01,1,1,10,10,10,10,1,1
"307",2,"1989",101,1989,101,2,"Q4_2012","USA","USA-AD-431","USA-AD-431","Venezuela","VEN","Aluminum Sulfate","4/5/89","8/14/89","5/25/89","A","A","8/14/89","AVD","10/25/89","12/13/89","A","A","12/15/89","AVD","10/3/95","1995","AVD",".",".",".",10,10,1,9,1,0,0,4.513177299,0.266074242,19.35945702,55.21130379,0,22922.46545,2188.521626,5.66e+12,42142303739,8.913516093,34.12343142,2.101254834,6.29846473,"4/5/89",1989-04-05,1989-04-05,62,75,1989-08-14,5.66e+12,42142303739,8.913516093,34.12343142,19.35945702,55.21130379,22922.46545,2188.521626,2.101254834,6.29846473,"United States of America",1995-01-01,"Venezuela",1995-01-01,0,0,"Venezuela",1990-08-31,"United States of America",1948-01-01,1,0,9,9,10,10,1,1
"308",2,"1989",20,1988,20,2,"Q4_2012","USA","USA-AD-422","USA-AD-422","Canada","CAN","Steel Rails","10/3/88","3/13/89","11/23/88","A","A","3/13/89","AVD","8/3/89","9/20/89","A","A","9/15/89","AVD","4/11/05","2005","AVD",".",".",".",10,10,1,10,1,0,0,4.722676581,10.14023679,19.01153714,51.49882137,0,21483.11445,18814.56455,5.25e+12,5.06e+11,8.464379545,26.14491069,2.040427155,2.994107762,"10/3/88",1988-10-03,1988-10-03,1477,2813,1989-03-13,5.66e+12,5.64e+11,8.913516093,25.11759214,19.35945702,50.17509579,22922.46545,20586.55751,2.101254834,2.959650997,"United States of America",1995-01-01,"Canada ",1995-01-01,0,0,"Canada",1948-01-01,"United States of America",1948-01-01,1,1,10,10,10,10,1,1
"309",2,"1989",255,1988,255,2,"Q4_2012","USA","USA-AD-419","USA-AD-412","West Germany","FRG","Industrial Belts","7/26/88","2/1/89","8/25/88","A","A","2/1/89","AVD","4/18/89","6/7/89","A","A","6/14/89","AVD","9/12/00","2000","AVD",".",".",".",10,10,1,10,1,0,0,4.722676581,1.17126611,19.01153714,46.05004562,1,21483.11445,17352.34321,5.25e+12,1.36e+12,8.464379545,22.90421573,2.040427155,NA,"7/26/88",1988-07-26,1988-07-26,2125,2744,1989-02-01,5.66e+12,1.35e+12,8.913516093,24.21778849,19.35945702,48.96148928,22922.46545,17190.82613,2.101254834,NA,"United States of America",1995-01-01,"Germany ",1995-01-01,0,0,"Germany",1951-10-01,"United States of America",1948-01-01,1,1,10,10,10,10,1,1
"310",2,"1990",732,1989,732,2,"Q4_2012","USA","USA-AD-449","USA-AD-448","South Korea","KOR","Sweaters","10/2/89","4/27/90","11/15/89","A","A","4/27/90","AVD","8/10/90","9/19/90","A","A","9/24/90","AVD","7/14/94","1994","AVD",".",".",".",10,10,1,6,1,0,0,4.513177299,1.198018149,19.35945702,55.15316566,1,22922.46545,5860.40382,5.66e+12,2.49e+11,8.913516093,28.53061667,2.101254834,9.134556595,"10/2/89",1989-10-02,1989-10-02,585,255,1990-04-27,5.98e+12,2.85e+11,9.229714362,25.89430271,19.7605191,52.78468709,23954.52342,6642.451218,2.063723293,8.215501347,"United States of America",1995-01-01,"South Korea",1995-01-01,0,0,"South Korea",1967-04-14,"United States of America",1948-01-01,1,1,6,7,10,10,1,1
"311",2,"1990",385,1990,385,2,"Q4_2012","USA","USA-AD-454","USA-AD-454","Norway","NOR","Atlantic Salmon","3/9/90","10/3/90","4/25/90","A","A","10/3/90","AVD","2/25/91","4/10/91","A","A","4/12/91","AVD","3/2/12","2012","AVD",".",".",".",10,10,1,10,1,0,0,4.431478822,2.07980581,19.7605191,73.92749314,0,23954.52342,27731.80167,5.98e+12,1.18e+11,9.229714362,40.14605678,2.063723293,3.423303092,"3/9/90",1990-03-09,1990-03-09,144,413,1990-10-03,5.98e+12,1.18e+11,9.229714362,40.14605678,19.7605191,73.92749314,23954.52342,27731.80167,2.063723293,3.423303092,"United States of America",1995-01-01,"Norway ",1995-01-01,0,0,"Norway",1948-07-10,"United States of America",1948-01-01,1,1,10,10,10,10,1,1
"312",2,"1990",255,1990,255,2,"Q4_2012","USA","USA-AD-465","USA-AD-465","Germany","DEU","Sodium Thiosulfate","7/13/90","10/19/90","8/29/90","A","N","10/19/90","AVD","12/17/90","2/21/91","A","A","2/19/91","AVD","5/9/05","2005","AVD",".",".",".",10,10,1,10,1,0,0,4.431478822,1.102184572,19.7605191,49.66417056,1,23954.52342,21583.84352,5.98e+12,1.71e+12,9.229714362,24.80012937,2.063723293,NA,"7/13/90",1990-07-13,1990-07-13,2842,539,1990-10-19,5.98e+12,1.71e+12,9.229714362,24.80012937,19.7605191,49.66417056,23954.52342,21583.84352,2.063723293,NA,"United States of America",1995-01-01,"Germany ",1995-01-01,0,0,"Germany",1951-10-01,"United States of America",1948-01-01,1,1,10,10,10,10,1,1
"313",2,"1990",70,1989,70,2,"Q4_2012","USA","USA-AD-451","USA-AD-451","Mexico","MEX","Portland Hydraulic Cement","10/2/89","4/12/90","11/22/89","A","A","4/12/90","AVD","7/18/90","8/29/90","A","A","8/30/90","AVD","4/6/09","2009","AVD",".",".",".",10,10,1,0,0,1,0,4.513177299,1.977634311,19.35945702,38.05867344,0,22922.46545,2644.197603,5.66e+12,2.23e+11,8.913516093,18.99694164,2.101254834,7.753825485,"10/2/89",1989-10-02,1989-10-02,305,255,1990-04-12,5.98e+12,2.63e+11,9.229714362,18.60079267,19.7605191,38.30618278,23954.52342,3052.032173,2.063723293,7.847876909,"United States of America",1995-01-01,"Mexico ",1995-01-01,0,0,"Mexico",1986-08-24,"United States of America",1948-01-01,1,1,0,2,10,10,1,0
"314",2,"1990",740,1989,740,2,"Q4_2012","USA","USA-AD-440","USA-AD-439","Japan","JPN","Industrial Nitrocellulose","9/22/89","3/5/90","11/16/89","A","A","3/5/90","AVD","5/22/90","7/5/90","A","A","7/10/90","AVD","8/25/04","2004","AVD",".",".",".",10,10,1,10,1,0,0,4.513177299,0.559084414,19.35945702,18.99054619,1,22922.46545,24505.7673,5.66e+12,3.02e+12,8.913516093,10.23779047,2.101254834,NA,"9/22/89",1989-09-22,1989-09-22,44,245,1990-03-05,5.98e+12,3.1e+12,9.229714362,10.28802244,19.7605191,19.6672224,23954.52342,25123.63179,2.063723293,NA,"United States of America",1995-01-01,"Japan ",1995-01-01,0,0,"Japan",1955-09-10,"United States of America",1948-01-01,1,1,10,10,10,10,1,1
"315",2,"1990",200,1989,200,2,"Q4_2012","USA","USA-AD-443","USA-AD-439","United Kingdom","GBR","Industrial Nitrocellulose","9/22/89","3/5/90","11/16/89","A","A","3/5/90","AVD","5/22/90","7/5/90","A","A","7/10/90","AVD","8/25/04","2004","AVD",".",".",".",10,10,1,10,1,1,0,4.513177299,1.219727198,19.35945702,50.87570575,1,22922.46545,15057.17922,5.66e+12,8.59e+11,8.913516093,23.63388184,2.101254834,NA,"9/22/89",1989-09-22,1989-09-22,3794,245,1990-03-05,5.98e+12,1.02e+12,9.229714362,24.21621603,19.7605191,50.14440647,23954.52342,17805.24909,2.063723293,1.511350567,"United States of America",1995-01-01,"United Kingdom",1995-01-01,0,0,"United Kingdom",1948-01-01,"United States of America",1948-01-01,1,1,10,10,10,10,1,1
"316",2,"1990",991,1989,991,2,"Q4_2012","USA","USA-AD-448","USA-AD-448","Hong Kong","HKG","Sweaters","10/2/89","4/27/90","11/15/89","A","A","4/27/90","AVD","7/27/90","9/19/90","A","A","9/24/90","AVD","7/14/94","1994","AVD",".",".",".",10,10,1,NA,0,0,0,4.513177299,0.312338603,19.35945702,248.7911838,0,22922.46545,12097.77516,5.66e+12,68790369107,8.913516093,130.1270319,2.101254834,NA,"10/2/89",1989-10-02,1989-10-02,NA,255,1990-04-27,5.98e+12,76928290842,9.229714362,130.656681,19.7605191,252.7754415,23954.52342,13485.54489,2.063723293,NA,"United States of America",1995-01-01,"Hong Kong",1995-01-01,0,0,"Hong Kong",1986-04-23,"United States of America",1948-01-01,1,1,NA,NA,10,10,1,NA
"317",2,"1990",732,1989,732,2,"Q4_2012","USA","USA-AD-442","USA-AD-439","South Korea","KOR","Industrial Nitrocellulose","9/22/89","3/5/90","11/16/89","A","A","3/5/90","AVD","5/22/90","7/5/90","A","A","7/10/90","AVD","8/25/04","2004","AVD",".",".",".",10,10,1,6,1,0,0,4.513177299,1.198018149,19.35945702,55.15316566,1,22922.46545,5860.40382,5.66e+12,2.49e+11,8.913516093,28.53061667,2.101254834,9.134556595,"9/22/89",1989-09-22,1989-09-22,575,245,1990-03-05,5.98e+12,2.85e+11,9.229714362,25.89430271,19.7605191,52.78468709,23954.52342,6642.451218,2.063723293,8.215501347,"United States of America",1995-01-01,"South Korea",1995-01-01,0,0,"South Korea",1967-04-14,"United States of America",1948-01-01,1,1,6,7,10,10,1,1
"318",2,"1990",740,1990,740,2,"Q4_2012","USA","USA-AD-462","USA-AD-462","Japan","JPN","Benzyl Paraben","7/11/90","10/10/90","8/23/90","A","A","10/10/90","AVD","11/23/90","2/13/91","A","A","2/13/91","AVD","9/1/99","1999","AVD",".",".",".",10,10,1,10,1,0,0,4.431478822,0.554995999,19.7605191,19.6672224,1,23954.52342,25123.63179,5.98e+12,3.1e+12,9.229714362,10.28802244,2.063723293,NA,"7/11/90",1990-07-11,1990-07-11,336,537,1990-10-10,5.98e+12,3.1e+12,9.229714362,10.28802244,19.7605191,19.6672224,23954.52342,25123.63179,2.063723293,NA,"United States of America",1995-01-01,"Japan ",1995-01-01,0,0,"Japan",1955-09-10,"United States of America",1948-01-01,1,1,10,10,10,10,1,1
"319",2,"1990",255,1989,255,2,"Q4_2012","USA","USA-AD-444","USA-AD-439","West Germany","FRG","Industrial Nitrocellulose","9/22/89","3/5/90","11/16/89","A","A","3/5/90","AVD","5/22/90","7/5/90","A","A","7/10/90","AVD","8/25/04","2004","AVD",".",".",".",10,10,1,10,1,0,0,4.513177299,1.127825329,19.35945702,48.96148928,1,22922.46545,17190.82613,5.66e+12,1.35e+12,8.913516093,24.21778849,2.101254834,NA,"9/22/89",1989-09-22,1989-09-22,2548,245,1990-03-05,5.98e+12,1.71e+12,9.229714362,24.80012937,19.7605191,49.66417056,23954.52342,21583.84352,2.063723293,NA,"United States of America",1995-01-01,"Germany ",1995-01-01,0,0,"Germany",1951-10-01,"United States of America",1948-01-01,1,1,10,10,10,10,1,1
"320",2,"1990",200,1990,200,2,"Q4_2012","USA","USA-AD-468","USA-AD-465","United Kingdom","GBR","Sodium Thiosulfate","7/13/90","10/19/90","8/29/90","A","N","10/19/90","AVD","12/17/90","2/21/91","A","A","2/19/91","AVD","5/9/05","2005","AVD",".",".",".",10,10,1,10,1,0,0,4.431478822,1.05235374,19.7605191,50.14440647,1,23954.52342,17805.24909,5.98e+12,1.02e+12,9.229714362,24.21621603,2.063723293,1.511350567,"7/13/90",1990-07-13,1990-07-13,4088,539,1990-10-19,5.98e+12,1.02e+12,9.229714362,24.21621603,19.7605191,50.14440647,23954.52342,17805.24909,2.063723293,1.511350567,"United States of America",1995-01-01,"United Kingdom",1995-01-01,0,0,"United Kingdom",1948-01-01,"United States of America",1948-01-01,1,1,10,10,10,10,1,1
"321",2,"1990",710,1990,710,2,"Q4_2012","USA","USA-AD-464","USA-AD-464","China","CHN","Sparklers","7/11/90","12/17/90","8/23/90","A","A","12/17/90","AVD","5/6/91","6/19/91","A","A","6/18/91","AVD","1/28/11","2011","AVD",".",".",".",10,10,1,-7,0,0,0,4.431478822,3.492810655,19.7605191,26.67145069,0,23954.52342,314.4309774,5.98e+12,3.57e+11,9.229714362,14.70261157,2.063723293,27.1161783,"7/11/90",1990-07-11,1990-07-11,3591,537,1990-12-17,5.98e+12,3.57e+11,9.229714362,14.70261157,19.7605191,26.67145069,23954.52342,314.4309774,2.063723293,27.1161783,"United States of America",1995-01-01,"China ",2001-12-11,0,0,NA,NA,"United States of America",1948-01-01,1,NA,-7,0,10,10,1,0
"322",2,"1990",740,1990,740,2,"Q4_2012","USA","USA-AD-455","USA-AD-455","Japan","JPN","Light Scattering Instruments","3/23/90","7/10/90","5/16/90","A","A","7/10/90","AVD","8/27/90","11/15/90","A","A","11/19/90","AVD","9/1/00","2000","AVD",".",".",".",10,10,1,10,1,0,0,4.431478822,0.554995999,19.7605191,19.6672224,1,23954.52342,25123.63179,5.98e+12,3.1e+12,9.229714362,10.28802244,2.063723293,NA,"3/23/90",1990-03-23,1990-03-23,226,427,1990-07-10,5.98e+12,3.1e+12,9.229714362,10.28802244,19.7605191,19.6672224,23954.52342,25123.63179,2.063723293,NA,"United States of America",1995-01-01,"Japan ",1995-01-01,0,0,"Japan",1955-09-10,"United States of America",1948-01-01,1,1,10,10,10,10,1,1
"325",2,"1990",732,1990,732,2,"Q4_2012","USA","USA-AD-459","USA-AD-458","South Korea","KOR","Polyethylene Teraphthalate (Pet) Film","5/7/90","11/30/90","6/20/90","A","A","11/30/90","AVD","4/22/91","6/5/91","A","A","6/5/91","AVD","9/16/11","2011","AVD",".",".",".",10,10,1,6,1,0,0,4.431478822,1.269563499,19.7605191,52.78468709,1,23954.52342,6642.451218,5.98e+12,2.85e+11,9.229714362,25.89430271,2.063723293,8.215501347,"5/7/90",1990-05-07,1990-05-07,802,472,1990-11-30,5.98e+12,2.85e+11,9.229714362,25.89430271,19.7605191,52.78468709,23954.52342,6642.451218,2.063723293,8.215501347,"United States of America",1995-01-01,"South Korea",1995-01-01,0,0,"South Korea",1967-04-14,"United States of America",1948-01-01,1,1,6,7,10,10,1,1
"326",2,"1990",713,1989,713,2,"Q4_2012","USA","USA-AD-450","USA-AD-448","Taiwan","TWN","Sweaters","10/2/89","4/27/90","11/15/89","A","A","4/27/90","AVD","8/23/90","9/19/90","A","A","9/24/90","AVD","7/14/94","1994","AVD",".",".",".",10,10,1,-1,0,0,0,4.513177299,NA,19.35945702,NA,0,22922.46545,NA,5.66e+12,NA,8.913516093,NA,2.101254834,NA,"10/2/89",1989-10-02,1989-10-02,628,255,1990-04-27,5.98e+12,NA,9.229714362,NA,19.7605191,NA,23954.52342,NA,2.063723293,NA,"United States of America",1995-01-01,"Taiwan",2002-01-01,0,0,NA,NA,"United States of America",1948-01-01,1,NA,-1,2,10,10,1,0
"327",2,"1990",710,1989,710,2,"Q4_2012","USA","USA-AD-441","USA-AD-439","China","CHN","Industrial Nitrocellulose","9/22/89","3/5/90","11/16/89","A","A","3/5/90","AVD","5/22/90","7/5/90","A","A","7/10/90","AVD","8/25/04","2004","AVD",".",".",".",10,10,1,-7,0,0,0,4.513177299,4.99621222,19.35945702,22.28935664,0,22922.46545,307.4903384,5.66e+12,3.44e+11,8.913516093,10.59870843,2.101254834,25.10500794,"9/22/89",1989-09-22,1989-09-22,3299,245,1990-03-05,5.98e+12,3.57e+11,9.229714362,14.70261157,19.7605191,26.67145069,23954.52342,314.4309774,2.063723293,27.1161783,"United States of America",1995-01-01,"China ",2001-12-11,0,0,NA,NA,"United States of America",1948-01-01,1,NA,-7,0,10,10,1,0
"328",2,"1990",345,1989,345,2,"Q4_2012","USA","USA-AD-445","USA-AD-439","Yugoslavia","YUG","Industrial Nitrocellulose","9/22/89","4/24/90","11/16/89","A","A","4/24/90","AVD","8/27/90","10/17/90","A","A","10/16/90","AVD","9/12/00","2000","AVD",".",".",".",10,10,1,-5,0,0,0,4.513177299,NA,19.35945702,NA,0,22922.46545,NA,5.66e+12,NA,8.913516093,NA,2.101254834,NA,"9/22/89",1989-09-22,1989-09-22,130,245,1990-04-24,5.98e+12,NA,9.229714362,NA,19.7605191,NA,23954.52342,NA,2.063723293,NA,"United States of America",1995-01-01,NA,NA,NA,0,"Yugoslavia",1966-08-25,"United States of America",1948-01-01,1,1,-5,0,10,10,1,0
"329",2,"1990",20,1989,20,2,"Q4_2012","USA","USA-AD-438","USA-AD-438","Canada","CAN","Limousines","8/2/89","1/9/90","9/13/89","A","A","1/9/90","AVD","3/26/90","4/4/90","A","W",".",".",".",".",".",".",".",".",10,10,1,10,1,0,0,4.513177299,10.53561149,19.35945702,50.17509579,0,22922.46545,20586.55751,5.66e+12,5.64e+11,8.913516093,25.11759214,2.101254834,2.959650997,"8/2/89",1989-08-02,1989-08-02,1780,194,1990-01-09,5.98e+12,5.92e+11,9.229714362,25.15320016,19.7605191,50.12862588,23954.52342,21302.39691,2.063723293,2.862509582,"United States of America",1995-01-01,"Canada ",1995-01-01,0,0,"Canada",1948-01-01,"United States of America",1948-01-01,1,1,10,10,10,10,1,1
"330",2,"1990",740,1990,740,2,"Q4_2012","USA","USA-AD-461","USA-AD-451","Japan","JPN","Portland Hydraulic Cement","5/25/90","10/31/90","7/31/90","A","A","10/31/90","AVD","3/22/91","5/8/91","A","A","5/10/91","AVD","IF","IF","AVD",".",".",".",10,10,1,10,1,0,0,4.431478822,0.554995999,19.7605191,19.6672224,1,23954.52342,25123.63179,5.98e+12,3.1e+12,9.229714362,10.28802244,2.063723293,NA,"5/25/90",1990-05-25,1990-05-25,289,490,1990-10-31,5.98e+12,3.1e+12,9.229714362,10.28802244,19.7605191,19.6672224,23954.52342,25123.63179,2.063723293,NA,"United States of America",1995-01-01,"Japan ",1995-01-01,0,0,"Japan",1955-09-10,"United States of America",1948-01-01,1,1,10,10,10,10,1,1
"331",2,"1990",140,1989,140,2,"Q4_2012","USA","USA-AD-439","USA-AD-439","Brazil","BRA","Industrial Nitrocellulose","9/22/89","3/5/90","11/16/89","A","A","3/5/90","AVD","6/6/90","7/5/90","A","A","7/10/90","AVD","8/25/04","2004","AVD",".",".",".",10,10,1,8,1,0,0,4.513177299,3.514885313,19.35945702,14.39087766,0,22922.46545,2893.657808,5.66e+12,4.26e+11,8.913516093,8.92960968,2.101254834,8.518876828,"9/22/89",1989-09-22,1989-09-22,1646,245,1990-03-05,5.98e+12,4.62e+11,9.229714362,8.199990015,19.7605191,15.16175556,23954.52342,3086.915491,2.063723293,8.1,"United States of America",1995-01-01,"Brazil ",1995-01-01,0,0,"Brazil",1948-07-30,"United States of America",1948-01-01,1,1,8,8,10,10,1,1
"332",2,"1990",740,1990,740,2,"Q4_2012","USA","USA-AD-458","USA-AD-458","Japan","JPN","Polyethylene Teraphthalate (Pet) Film","5/7/90","11/30/90","6/20/90","A","A","11/30/90","AVD","5/1/91","6/5/91","A","A","6/5/91","AVD","10/6/95","1995","AVD",".",".",".",10,10,1,10,1,0,0,4.431478822,0.554995999,19.7605191,19.6672224,1,23954.52342,25123.63179,5.98e+12,3.1e+12,9.229714362,10.28802244,2.063723293,NA,"5/7/90",1990-05-07,1990-05-07,271,472,1990-11-30,5.98e+12,3.1e+12,9.229714362,10.28802244,19.7605191,19.6672224,23954.52342,25123.63179,2.063723293,NA,"United States of America",1995-01-01,"Japan ",1995-01-01,0,0,"Japan",1955-09-10,"United States of America",1948-01-01,1,1,10,10,10,10,1,1
"333",2,"1990",710,1990,710,2,"Q4_2012","USA","USA-AD-466","USA-AD-465","China","CHN","Sodium Thiosulfate","7/13/90","12/12/90","8/29/90","A","N","12/12/90","AVD","1/25/91","2/21/91","A","A","2/19/91","AVD","5/9/05","2005","AVD",".",".",".",10,10,1,-7,0,0,0,4.431478822,3.492810655,19.7605191,26.67145069,0,23954.52342,314.4309774,5.98e+12,3.57e+11,9.229714362,14.70261157,2.063723293,27.1161783,"7/13/90",1990-07-13,1990-07-13,3593,539,1990-12-12,5.98e+12,3.57e+11,9.229714362,14.70261157,19.7605191,26.67145069,23954.52342,314.4309774,2.063723293,27.1161783,"United States of America",1995-01-01,"China ",2001-12-11,0,0,NA,NA,"United States of America",1948-01-01,1,NA,-7,0,10,10,1,0
"334",2,"1990",710,1990,710,2,"Q4_2012","USA","USA-AD-457","USA-AD-457","China","CHN","Heavy Forged Handtools","4/11/90","10/19/90","5/31/90","A","A","10/19/90","AVD","1/3/91","2/21/91","A","A","2/19/91","AVD","IF","IF","AVD",".",".",".",10,10,1,-7,0,0,0,4.431478822,3.492810655,19.7605191,26.67145069,0,23954.52342,314.4309774,5.98e+12,3.57e+11,9.229714362,14.70261157,2.063723293,27.1161783,"4/11/90",1990-04-11,1990-04-11,3500,446,1990-10-19,5.98e+12,3.57e+11,9.229714362,14.70261157,19.7605191,26.67145069,23954.52342,314.4309774,2.063723293,27.1161783,"United States of America",1995-01-01,"China ",2001-12-11,0,0,NA,NA,"United States of America",1948-01-01,1,NA,-7,0,10,10,1,0
"335",2,"1991",750,1990,750,2,"Q4_2012","USA","USA-AD-478","USA-AD-476","India","IND","Steel Wire Rope","11/9/90","4/22/91","1/3/91","A","A","4/22/91","AVD","9/11/91","11/6/91","A","N",".",".",".",".",".",".",".",".",10,10,1,8,1,0,0,4.431478822,4.05073167,19.7605191,15.2390159,0,23954.52342,375.890793,5.98e+12,3.27e+11,9.229714362,6.93178793,2.063723293,29.02333395,"11/9/90",1990-11-09,1990-11-09,342,658,1991-04-22,6.17e+12,2.75e+11,9.635568513,8.347845164,19.73436994,16.69494835,24404.99484,310.0837677,1.894572404,29.38952435,"United States of America",1995-01-01,"India ",1995-01-01,0,0,"India",1948-07-08,"United States of America",1948-01-01,1,1,8,8,10,10,1,1
"336",2,"1991",710,1991,710,2,"Q4_2012","USA","USA-AD-497","USA-AD-497","China","CHN","Tungsten Ore","1/30/91","7/10/91","3/20/91","A","A","7/10/91","AVD","9/20/91","11/14/91","A","A","11/21/91","AVD","11/3/99","1999","AVD",".",".",".",10,10,1,-7,0,0,0,3.8528227,2.823436287,19.73436994,29.37180377,0,24404.99484,329.7490797,6.17e+12,3.79e+11,9.635568513,16.10335808,1.894572404,24.52631887,"1/30/91",1991-01-30,1991-01-30,3794,740,1991-07-10,6.17e+12,3.79e+11,9.635568513,16.10335808,19.73436994,29.37180377,24404.99484,329.7490797,1.894572404,24.52631887,"United States of America",1995-01-01,"China ",2001-12-11,0,0,NA,NA,"United States of America",1948-01-01,1,NA,-7,0,10,10,1,0
"337",2,"1991",800,1990,800,2,"Q4_2012","USA","USA-AD-482","USA-AD-476","Thailand","THA","Steel Wire Rope","11/9/90","4/22/91","1/3/91","A","A","4/22/91","AVD","9/11/91","11/6/91","A","N",".",".",".",".",".",".",".",".",10,10,1,3,0,0,0,4.431478822,5.077321707,19.7605191,75.78236397,0,23954.52342,1508.290522,5.98e+12,85343189320,9.229714362,34.13192865,2.063723293,12.49962783,"11/9/90",1990-11-09,1990-11-09,827,658,1991-04-22,6.17e+12,98234713407,9.635568513,35.96431007,19.73436994,78.47113444,24404.99484,1717.860885,1.894572404,12.6498266,"United States of America",1995-01-01,"Thailand ",1995-01-01,0,0,"Thailand",1982-11-20,"United States of America",1948-01-01,1,1,-1,1,10,10,1,0
"338",2,"1991",200,1990,200,2,"Q4_2012","USA","USA-AD-485","USA-AD-485","United Kingdom","GBR","Gene Amplifiers","11/20/90","4/29/91","1/16/91","A","A","4/29/91","AVD","7/15/91","9/6/91","A","N",".",".",".",".",".",".",".",".",10,10,1,10,1,0,0,4.431478822,1.05235374,19.7605191,50.14440647,1,23954.52342,17805.24909,5.98e+12,1.02e+12,9.229714362,24.21621603,2.063723293,1.511350567,"11/20/90",1990-11-20,1990-11-20,4218,669,1991-04-29,6.17e+12,1.07e+12,9.635568513,23.43496251,19.73436994,47.05465021,24404.99484,18571.36207,1.894572404,1.490754227,"United States of America",1995-01-01,"United Kingdom",1995-01-01,0,0,"United Kingdom",1948-01-01,"United States of America",1948-01-01,1,1,10,10,10,10,1,1
"339",2,"1991",710,1990,710,2,"Q4_2012","USA","USA-AD-473b","USA-AD-473","China","CHN","Electric Ceiling Fans","11/6/90","6/5/91","12/27/90","A","A","6/5/91","AVD","10/25/91","12/11/91","A","A","12/9/91","AVD","3/17/95","1995","AVD",".",".",".",10,10,1,-7,0,0,0,4.431478822,3.492810655,19.7605191,26.67145069,0,23954.52342,314.4309774,5.98e+12,3.57e+11,9.229714362,14.70261157,2.063723293,27.1161783,"11/6/90",1990-11-06,1990-11-06,3709,655,1991-06-05,6.17e+12,3.79e+11,9.635568513,16.10335808,19.73436994,29.37180377,24404.99484,329.7490797,1.894572404,24.52631887,"United States of America",1995-01-01,"China ",2001-12-11,0,0,NA,NA,"United States of America",1948-01-01,1,NA,-7,0,10,10,1,0
"340",2,"1991",740,1990,740,2,"Q4_2012","USA","USA-AD-483","USA-AD-483","Japan","JPN","Word Processors","11/14/90","4/22/91","1/3/91","A","A","4/22/91","AVD","7/9/91","8/28/91","A","A","8/28/91","AVD","5/2/94","1994","AVD",".",".",".",10,10,1,10,1,0,0,4.431478822,0.554995999,19.7605191,19.6672224,1,23954.52342,25123.63179,5.98e+12,3.1e+12,9.229714362,10.28802244,2.063723293,NA,"11/14/90",1990-11-14,1990-11-14,462,663,1991-04-22,6.17e+12,3.54e+12,9.635568513,9.874440046,19.73436994,18.17618719,24404.99484,28540.77148,1.894572404,NA,"United States of America",1995-01-01,"Japan ",1995-01-01,0,0,"Japan",1955-09-10,"United States of America",1948-01-01,1,1,10,10,10,10,1,1
"341",2,"1991",771,1991,771,2,"Q4_2012","USA","USA-AD-514","USA-AD-514","Bangladesh","BGD","Shop Towels","4/5/91","9/12/91","5/22/91","A","A","9/12/91","AVD","2/3/92","3/18/92","A","A","3/20/92","AVD","4/11/05","2005","AVD",".",".",".",10,10,1,6,1,0,0,3.8528227,5.421778234,19.73436994,18.88985039,0,24404.99484,281.5987649,6.17e+12,30957444767,9.635568513,6.662620259,1.894572404,30.36520119,"4/5/91",1991-04-05,1991-04-05,16,805,1991-09-12,6.17e+12,30957444767,9.635568513,6.662620259,19.73436994,18.88985039,24404.99484,281.5987649,1.894572404,30.36520119,"United States of America",1995-01-01,"Bangladesh ",1995-01-01,0,0,"Bangladesh",1972-12-16,"United States of America",1948-01-01,1,1,6,6,10,10,1,1
"342",2,"1991",702,1991,702,2,"Q4_2012","USA","USA-AD-539j","USA-AD-539a","Tajikistan","TJK","Uranium","11/19/91","11/19/91","1/2/92","A","A","11/19/91","AVD","7/8/93","8/25/93","A","N",".",".",".",".",".",".",".",".",10,10,1,-2,0,0,0,3.8528227,NA,19.73436994,65.42398628,0,24404.99484,468.0240177,6.17e+12,2535545389,9.635568513,33.2,1.894572404,36.61777291,"11/19/91",1991-11-19,1991-11-19,57,1033,1991-11-19,6.17e+12,2535545389,9.635568513,33.2,19.73436994,65.42398628,24404.99484,468.0240177,1.894572404,36.61777291,"United States of America",1995-01-01,"Tajikistan ",2013-03-02,0,0,NA,NA,"United States of America",1948-01-01,1,NA,-2,1,10,10,1,0
"343",2,"1991",140,1990,140,2,"Q4_2012","USA","USA-AD-471","USA-AD-470","Brazil","BRA","Silicon Metal","9/5/90","3/29/91","10/17/90","A","A","3/29/91","AVD","6/12/91","8/7/91","A","A","7/31/91","AVD","2/16/06","2006","AVD",".",".",".",10,10,1,8,1,1,0,4.431478822,3.444277125,19.7605191,15.16175556,0,23954.52342,3086.915491,5.98e+12,4.62e+11,9.229714362,8.199990015,2.063723293,8.1,"9/5/90",1990-09-05,1990-09-05,174,593,1991-03-29,6.17e+12,4.07e+11,9.635568513,8.6769732,19.73436994,16.59091683,24404.99484,2677.149908,1.894572404,7.79,"United States of America",1995-01-01,"Brazil ",1995-01-01,0,0,"Brazil",1948-07-30,"United States of America",1948-01-01,1,1,8,8,10,10,1,1
"344",2,"1991",740,1991,740,2,"Q4_2012","USA","USA-AD-518","USA-AD-518","Japan","JPN","Aspheric Opthalmoscopy Lenses","5/28/91","10/15/91","6/26/91","A","A","10/15/91","AVD","2/27/92","4/15/92","A","A","4/15/92","AVD","8/26/97","1997","AVD",".",".",".",10,10,1,10,1,0,0,3.8528227,0.52582088,19.73436994,18.17618719,1,24404.99484,28540.77148,6.17e+12,3.54e+12,9.635568513,9.874440046,1.894572404,NA,"5/28/91",1991-05-28,1991-05-28,657,858,1991-10-15,6.17e+12,3.54e+12,9.635568513,9.874440046,19.73436994,18.17618719,24404.99484,28540.77148,1.894572404,NA,"United States of America",1995-01-01,"Japan ",1995-01-01,0,0,"Japan",1955-09-10,"United States of America",1948-01-01,1,1,10,10,10,10,1,1
"345",2,"1991",705,1991,705,2,"Q4_2012","USA","USA-AD-539g","USA-AD-539a","Kazakhstan","KAZ","Uranium","11/19/91","11/19/91","1/2/92","A","A","11/19/91","AVD","6/10/99","7/28/99","A","N",".",".",".",".",".",".",".",".",10,10,1,-3,0,0,0,3.8528227,NA,19.73436994,NA,0,24404.99484,1512.485066,6.17e+12,24881135586,9.635568513,NA,1.894572404,NA,"11/19/91",1991-11-19,1991-11-19,574,1033,1991-11-19,6.17e+12,24881135586,9.635568513,NA,19.73436994,NA,24404.99484,1512.485066,1.894572404,NA,"United States of America",1995-01-01,NA,NA,NA,0,NA,NA,"United States of America",1948-01-01,1,NA,-3,1,10,10,1,0
"346",2,"1991",710,1991,710,2,"Q4_2012","USA","USA-AD-517","USA-AD-517","China","CHN","Antimony Trioxide","5/3/91","10/9/91","6/19/91","A","A","10/9/91","AVD","2/28/92","4/15/92","A","N",".",".",".",".",".",".",".",".",10,10,1,-7,0,0,0,3.8528227,2.823436287,19.73436994,29.37180377,0,24404.99484,329.7490797,6.17e+12,3.79e+11,9.635568513,16.10335808,1.894572404,24.52631887,"5/3/91",1991-05-03,1991-05-03,3887,833,1991-10-09,6.17e+12,3.79e+11,9.635568513,16.10335808,19.73436994,29.37180377,24404.99484,329.7490797,1.894572404,24.52631887,"United States of America",1995-01-01,"China ",2001-12-11,0,0,NA,NA,"United States of America",1948-01-01,1,NA,-7,0,10,10,1,0
"347",2,"1991",710,1990,710,2,"Q4_2012","USA","USA-AD-473a","USA-AD-473","China","CHN","Electric Oscillating Fans","11/6/90","6/5/91","12/27/90","A","A","6/5/91","AVD","10/25/91","12/11/91","A","A","12/9/91","AVD","1/29/93","1993","AVD",".",".",".",10,10,1,-7,0,0,0,4.431478822,3.492810655,19.7605191,26.67145069,0,23954.52342,314.4309774,5.98e+12,3.57e+11,9.229714362,14.70261157,2.063723293,27.1161783,"11/6/90",1990-11-06,1990-11-06,3709,655,1991-06-05,6.17e+12,3.79e+11,9.635568513,16.10335808,19.73436994,29.37180377,24404.99484,329.7490797,1.894572404,24.52631887,"United States of America",1995-01-01,"China ",2001-12-11,0,0,NA,NA,"United States of America",1948-01-01,1,NA,-7,0,10,10,1,0
"348",2,"1991",255,1991,255,2,"Q4_2012","USA","USA-AD-490","USA-AD-486","Germany","DEU","Coated Groundwood Paper","1/4/91","6/13/91","2/21/91","A","A","6/13/91","AVD","11/4/91","12/18/91","A","N",".",".",".",".",".",".",".",".",10,10,1,10,1,0,0,3.8528227,1.12337179,19.73436994,51.7789652,1,24404.99484,22603.61647,6.17e+12,1.81e+12,9.635568513,25.70050828,1.894572404,1.217166643,"1/4/91",1991-01-04,1991-01-04,3017,714,1991-06-13,6.17e+12,1.81e+12,9.635568513,25.70050828,19.73436994,51.7789652,24404.99484,22603.61647,1.894572404,1.217166643,"United States of America",1995-01-01,"Germany ",1995-01-01,0,0,"Germany",1951-10-01,"United States of America",1948-01-01,1,1,10,10,10,10,1,1
"349",2,"1991",710,1991,710,2,"Q4_2012","USA","USA-AD-520","USA-AD-520","China","CHN","Carbon Steel Butt-Weld Pipe Fittings","5/30/91","12/26/91","7/17/91","A","A","12/26/91","AVD","5/18/92","7/1/92","A","A","7/6/92","AVD","IF","IF","AVD",".",".",".",10,10,1,-7,0,0,0,3.8528227,2.823436287,19.73436994,29.37180377,0,24404.99484,329.7490797,6.17e+12,3.79e+11,9.635568513,16.10335808,1.894572404,24.52631887,"5/30/91",1991-05-30,1991-05-30,3914,860,1991-12-26,6.17e+12,3.79e+11,9.635568513,16.10335808,19.73436994,29.37180377,24404.99484,329.7490797,1.894572404,24.52631887,"United States of America",1995-01-01,"China ",2001-12-11,0,0,NA,NA,"United States of America",1948-01-01,1,NA,-7,0,10,10,1,0
"350",2,"1991",740,1990,740,2,"Q4_2012","USA","USA-AD-469b","USA-AD-469a","Japan","JPN","Electrolum. Flat Panel Displays","7/24/90","2/21/91","9/12/90","A","A","2/21/91","AVD","7/16/91","9/5/91","A","A","9/4/91","AVD","6/2/05","2005","AVD",".",".",".",10,10,1,10,1,0,0,4.431478822,0.554995999,19.7605191,19.6672224,1,23954.52342,25123.63179,5.98e+12,3.1e+12,9.229714362,10.28802244,2.063723293,NA,"7/24/90",1990-07-24,1990-07-24,349,550,1991-02-21,6.17e+12,3.54e+12,9.635568513,9.874440046,19.73436994,18.17618719,24404.99484,28540.77148,1.894572404,NA,"United States of America",1995-01-01,"Japan ",1995-01-01,0,0,"Japan",1955-09-10,"United States of America",1948-01-01,1,1,10,10,10,10,1,1
"351",2,"1991",160,1990,160,2,"Q4_2012","USA","USA-AD-476","USA-AD-476","Argentina","ARG","Steel Wire Rope","11/9/90","4/22/91","1/3/91","A","A","4/22/91","AVD","7/9/91","8/21/91","A","N",".",".",".",".",".",".",".",".",10,10,1,7,1,0,0,4.431478822,4.314083058,19.7605191,14.990859,0,23954.52342,4332.656387,5.98e+12,1.41e+11,9.229714362,10.35953659,2.063723293,8.123676208,"11/9/90",1990-11-09,1990-11-09,854,658,1991-04-22,6.17e+12,1.9e+11,9.635568513,7.675043324,19.73436994,13.75305415,24404.99484,5736.020465,1.894572404,6.716491769,"United States of America",1995-01-01,"Argentina ",1995-01-01,0,0,"Argentina",1967-10-11,"United States of America",1948-01-01,1,1,7,7,10,10,1,1
"352",2,"1991",713,1990,713,2,"Q4_2012","USA","USA-AD-481","USA-AD-476","Taiwan","TWN","Steel Wire Rope","11/9/90","4/22/91","1/3/91","A","A","4/22/91","AVD","9/11/91","11/6/91","A","N",".",".",".",".",".",".",".",".",10,10,1,-1,0,0,0,4.431478822,NA,19.7605191,NA,0,23954.52342,NA,5.98e+12,NA,9.229714362,NA,2.063723293,NA,"11/9/90",1990-11-09,1990-11-09,1031,658,1991-04-22,6.17e+12,NA,9.635568513,NA,19.73436994,NA,24404.99484,NA,1.894572404,NA,"United States of America",1995-01-01,"Taiwan",2002-01-01,0,0,NA,NA,"United States of America",1948-01-01,1,NA,-1,2,10,10,1,0
"353",2,"1991",220,1991,220,2,"Q4_2012","USA","USA-AD-489","USA-AD-486","France","FRA","Coated Groundwood Paper","1/4/91","6/13/91","2/21/91","A","A","6/13/91","AVD","11/4/91","12/18/91","A","N",".",".",".",".",".",".",".",".",10,10,1,9,1,0,0,3.8528227,1.625352398,19.73436994,44.02920499,1,24404.99484,21268.23045,6.17e+12,1.25e+12,9.635568513,21.81122734,1.894572404,3.11352614,"1/4/91",1991-01-04,1991-01-04,3515,714,1991-06-13,6.17e+12,1.25e+12,9.635568513,21.81122734,19.73436994,44.02920499,24404.99484,21268.23045,1.894572404,3.11352614,"United States of America",1995-01-01,"France ",1995-01-01,0,0,"France",1948-01-01,"United States of America",1948-01-01,1,1,9,9,10,10,1,1
"354",2,"1991",703,1991,703,2,"Q4_2012","USA","USA-AD-539h","USA-AD-539a","Kyrgyzstan","KGZ","Uranium","11/19/91","11/19/91","1/2/92","A","A","11/19/91","AVD",".",".",".","OTH","10/26/92","SA","11/3/99","1999","SA",".",".",".",10,10,1,-3,0,0,0,3.8528227,NA,19.73436994,71.96110211,0,24404.99484,575.9551334,6.17e+12,2570833333,9.635568513,35.33225284,1.894572404,36.97773245,"11/19/91",1991-11-19,1991-11-19,388,1033,1991-11-19,6.17e+12,2570833333,9.635568513,35.33225284,19.73436994,71.96110211,24404.99484,575.9551334,1.894572404,36.97773245,"United States of America",1995-01-01,"Kyrgyistan",1998-12-20,0,0,NA,NA,"United States of America",1948-01-01,1,NA,-3,1,10,10,1,0
"355",2,"1991",710,1990,710,2,"Q4_2012","USA","USA-AD-472","USA-AD-470","China","CHN","Silicon Metal","9/5/90","2/5/91","10/17/90","A","A","2/5/91","AVD","4/23/91","6/12/91","A","A","6/10/91","AVD","IF","IF","AVD",".",".",".",10,10,1,-7,0,0,0,4.431478822,3.492810655,19.7605191,26.67145069,0,23954.52342,314.4309774,5.98e+12,3.57e+11,9.229714362,14.70261157,2.063723293,27.1161783,"9/5/90",1990-09-05,1990-09-05,3647,593,1991-02-05,6.17e+12,3.79e+11,9.635568513,16.10335808,19.73436994,29.37180377,24404.99484,329.7490797,1.894572404,24.52631887,"United States of America",1995-01-01,"China ",2001-12-11,0,0,NA,NA,"United States of America",1948-01-01,1,NA,-7,0,10,10,1,0
"356",2,"1991",20,1991,20,2,"Q4_2012","USA","USA-AD-525","USA-AD-525","Canada","CAN","Nepheline Syenite","7/19/91","12/27/91","9/5/91","A","A","12/27/91","AVD","3/17/92","5/6/92","A","N",".",".",".",".",".",".",".",".",10,10,1,10,1,0,0,3.8528227,8.083021376,19.73436994,49.36947719,0,24404.99484,21591.13916,6.17e+12,6.08e+11,9.635568513,24.42005964,1.894572404,2.74284223,"7/19/91",1991-07-19,1991-07-19,2496,910,1991-12-27,6.17e+12,6.08e+11,9.635568513,24.42005964,19.73436994,49.36947719,24404.99484,21591.13916,1.894572404,2.74284223,"United States of America",1995-01-01,"Canada ",1995-01-01,0,0,"Canada",1948-01-01,"United States of America",1948-01-01,1,1,10,10,10,10,1,1
"357",2,"1991",365,1991,365,2,"Q4_2012","USA","USA-AD-539i","USA-AD-539a","Russia","RUS","Uranium","11/19/91","11/19/91","1/2/92","A","A","11/19/91","AVD",".",".",".","OTH","10/26/92","SA","IF","IF","SA",".",".",".",10,10,1,0,0,0,0,3.8528227,NA,19.73436994,26.25670317,0,24404.99484,3427.317519,6.17e+12,5.09e+11,9.635568513,13.27136217,1.894572404,14.29419612,"11/19/91",1991-11-19,1991-11-19,90,1033,1991-11-19,6.17e+12,5.09e+11,9.635568513,13.27136217,19.73436994,26.25670317,24404.99484,3427.317519,1.894572404,14.29419612,"United States of America",1995-01-01,"Russia",2012-08-22,0,0,NA,NA,"United States of America",1948-01-01,1,NA,NA,NA,10,10,1,NA
"358",2,"1991",920,1991,920,2,"Q4_2012","USA","USA-AD-516","USA-AD-516","New Zealand","NZL","Kiwi/Uit","5/1/91","11/27/91","6/19/91","A","A","11/27/91","AVD","4/17/92","6/3/92","A","A","6/2/92","AVD","9/17/99","1999","AVD",".",".",".",10,10,1,10,1,0,0,3.8528227,17.21159168,19.73436994,55.16567646,0,24404.99484,12112.54935,6.17e+12,42334571236,9.635568513,29.44428938,1.894572404,7.517210029,"5/1/91",1991-05-01,1991-05-01,186,831,1991-11-27,6.17e+12,42334571236,9.635568513,29.44428938,19.73436994,55.16567646,24404.99484,12112.54935,1.894572404,7.517210029,"United States of America",1995-01-01,"New Zealand",1995-01-01,0,0,"New Zealand",1948-07-30,"United States of America",1948-01-01,1,1,10,10,10,10,1,1
"359",2,"1991",740,1990,740,2,"Q4_2012","USA","USA-AD-469a","USA-AD-469a","Japan","JPN","Active Matrix Flat Panel Displays","7/24/90","2/21/91","9/12/90","A","A","2/21/91","AVD","7/16/91","9/5/91","A","A","9/4/91","AVD","6/2/05","2005","AVD",".",".",".",10,10,1,10,1,0,0,4.431478822,0.554995999,19.7605191,19.6672224,1,23954.52342,25123.63179,5.98e+12,3.1e+12,9.229714362,10.28802244,2.063723293,NA,"7/24/90",1990-07-24,1990-07-24,349,550,1991-02-21,6.17e+12,3.54e+12,9.635568513,9.874440046,19.73436994,18.17618719,24404.99484,28540.77148,1.894572404,NA,"United States of America",1995-01-01,"Japan ",1995-01-01,0,0,"Japan",1955-09-10,"United States of America",1948-01-01,1,1,10,10,10,10,1,1
"360",2,"1991",710,1990,710,2,"Q4_2012","USA","USA-AD-474","USA-AD-474","China","CHN","Lug Nuts","11/6/90","4/18/91","1/17/91","A","A","4/18/91","AVD","9/10/91","9/25/91","A","A","9/20/91","AVD","11/16/00","2000","AVD",".",".",".",10,10,1,-7,0,0,0,4.431478822,3.492810655,19.7605191,26.67145069,0,23954.52342,314.4309774,5.98e+12,3.57e+11,9.229714362,14.70261157,2.063723293,27.1161783,"11/6/90",1990-11-06,1990-11-06,3709,655,1991-04-18,6.17e+12,3.79e+11,9.635568513,16.10335808,19.73436994,29.37180377,24404.99484,329.7490797,1.894572404,24.52631887,"United States of America",1995-01-01,"China ",2001-12-11,0,0,NA,NA,"United States of America",1948-01-01,1,NA,-7,0,10,10,1,0
"361",2,"1991",800,1991,800,2,"Q4_2012","USA","USA-AD-521","USA-AD-520","Thailand","THA","Carbon Steel Butt-Weld Pipe Fittings","5/30/91","12/26/91","7/17/91","A","A","12/26/91","AVD","5/18/92","7/1/92","A","A","7/6/92","AVD","IF","IF","AVD",".",".",".",10,10,1,-1,0,0,0,3.8528227,4.519402919,19.73436994,78.47113444,0,24404.99484,1717.860885,6.17e+12,98234713407,9.635568513,35.96431007,1.894572404,12.6498266,"5/30/91",1991-05-30,1991-05-30,84,860,1991-12-26,6.17e+12,98234713407,9.635568513,35.96431007,19.73436994,78.47113444,24404.99484,1717.860885,1.894572404,12.6498266,"United States of America",1995-01-01,"Thailand ",1995-01-01,0,0,"Thailand",1982-11-20,"United States of America",1948-01-01,1,1,-1,1,10,10,1,0
"362",2,"1991",704,1991,704,2,"Q4_2012","USA","USA-AD-539l","USA-AD-539a","Uzbekistan","UZB","Uranium","11/19/91","11/19/91","1/2/92","A","A","11/19/91","AVD",".",".",".","OTH","10/26/92","SA","8/22/00","2000","SA",".",".",".",10,10,1,-9,0,0,0,3.8528227,NA,19.73436994,74.42310473,0,24404.99484,658.6558681,6.17e+12,13800157749,9.635568513,35.28017378,1.894572404,36.97700295,"11/19/91",1991-11-19,1991-11-19,605,1033,1991-11-19,6.17e+12,13800157749,9.635568513,35.28017378,19.73436994,74.42310473,24404.99484,658.6558681,1.894572404,36.97700295,"United States of America",1995-01-01,NA,NA,NA,0,NA,NA,"United States of America",1948-01-01,1,NA,-9,0,10,10,1,0
"363",2,"1991",375,1991,375,2,"Q4_2012","USA","USA-AD-488","USA-AD-486","Finland","FIN","Coated Groundwood Paper","1/4/91","6/13/91","2/21/91","A","A","6/13/91","AVD","11/4/91","12/18/91","A","N",".",".",".",".",".",".",".",".",10,10,1,10,1,0,0,3.8528227,8.679227862,19.73436994,44.27755025,0,24404.99484,24991.46168,6.17e+12,1.25e+11,9.635568513,21.65530352,1.894572404,5.668750169,"1/4/91",1991-01-04,1991-01-04,3402,714,1991-06-13,6.17e+12,1.25e+11,9.635568513,21.65530352,19.73436994,44.27755025,24404.99484,24991.46168,1.894572404,5.668750169,"United States of America",1995-01-01,"Finland ",1995-01-01,0,0,"Finland",1950-05-25,"United States of America",1948-01-01,1,1,10,10,10,10,1,1
"364",2,"1991",101,1991,101,2,"Q4_2012","USA","USA-AD-519","USA-AD-519","Venezuela","VEN","Portland Cement","5/29/91","11/4/91","7/17/91","A","A","11/4/91","AVD",".",".","OTH","OTH","2/27/92","SA","11/15/00","2000","SA",".",".",".",10,10,1,9,1,0,0,3.8528227,0.149829095,19.73436994,57.58016811,0,24404.99484,2558.724047,6.17e+12,51734363024,9.635568513,31.35326776,1.894572404,5.57920338,"5/29/91",1991-05-29,1991-05-29,846,859,1991-11-04,6.17e+12,51734363024,9.635568513,31.35326776,19.73436994,57.58016811,24404.99484,2558.724047,1.894572404,5.57920338,"United States of America",1995-01-01,"Venezuela",1995-01-01,0,0,"Venezuela",1990-08-31,"United States of America",1948-01-01,1,1,9,9,10,10,1,1
"365",2,"1991",160,1990,160,2,"Q4_2012","USA","USA-AD-470","USA-AD-470","Argentina","ARG","Silicon Metal","9/5/90","3/29/91","10/17/90","A","A","3/29/91","AVD","8/9/91","9/25/91","A","A","9/26/91","AVD","2/16/01","2001","AVD",".",".",".",10,10,1,7,1,0,0,4.431478822,4.314083058,19.7605191,14.990859,0,23954.52342,4332.656387,5.98e+12,1.41e+11,9.229714362,10.35953659,2.063723293,8.123676208,"9/5/90",1990-09-05,1990-09-05,789,593,1991-03-29,6.17e+12,1.9e+11,9.635568513,7.675043324,19.73436994,13.75305415,24404.99484,5736.020465,1.894572404,6.716491769,"United States of America",1995-01-01,"Argentina ",1995-01-01,0,0,"Argentina",1967-10-11,"United States of America",1948-01-01,1,1,7,7,10,10,1,1
"366",2,"1991",710,1990,710,2,"Q4_2012","USA","USA-AD-480","USA-AD-476","China","CHN","Steel Wire Rope","11/9/90","4/22/91","1/3/91","A","A","4/22/91","AVD","9/11/91","11/6/91","A","N",".",".",".",".",".",".",".",".",10,10,1,-7,0,0,0,4.431478822,3.492810655,19.7605191,26.67145069,0,23954.52342,314.4309774,5.98e+12,3.57e+11,9.229714362,14.70261157,2.063723293,27.1161783,"11/9/90",1990-11-09,1990-11-09,3712,658,1991-04-22,6.17e+12,3.79e+11,9.635568513,16.10335808,19.73436994,29.37180377,24404.99484,329.7490797,1.894572404,24.52631887,"United States of America",1995-01-01,"China ",2001-12-11,0,0,NA,NA,"United States of America",1948-01-01,1,NA,-7,0,10,10,1,0
"367",2,"1991",211,1991,211,2,"Q4_2012","USA","USA-AD-487","USA-AD-486","Belgium","BEL","Coated Groundwood Paper","1/4/91","6/13/91","2/21/91","A","A","6/13/91","AVD","11/4/91","12/18/91","A","N",".",".",".",".",".",".",".",".",10,10,1,10,1,0,0,3.8528227,1.454961199,19.73436994,129.1968785,0,24404.99484,20785.53888,6.17e+12,2.08e+11,9.635568513,65.48289171,1.894572404,NA,"1/4/91",1991-01-04,1991-01-04,3305,714,1991-06-13,6.17e+12,2.08e+11,9.635568513,65.48289171,19.73436994,129.1968785,24404.99484,20785.53888,1.894572404,NA,"United States of America",1995-01-01,"Belgium ",1995-01-01,0,0,"Belgium",1948-01-01,"United States of America",1948-01-01,1,1,10,10,10,10,1,1
"368",2,"1991",713,1990,713,2,"Q4_2012","USA","USA-AD-475","USA-AD-474","Taiwan","TWN","Lug Nuts","11/6/90","4/18/91","1/17/91","A","A","4/18/91","AVD","7/31/91","9/25/91","A","A","9/20/91","AVD","11/16/00","2000","AVD",".",".",".",10,10,1,-1,0,0,0,4.431478822,NA,19.7605191,NA,0,23954.52342,NA,5.98e+12,NA,9.229714362,NA,2.063723293,NA,"11/6/90",1990-11-06,1990-11-06,1028,655,1991-04-18,6.17e+12,NA,9.635568513,NA,19.73436994,NA,24404.99484,NA,1.894572404,NA,"United States of America",1995-01-01,"Taiwan",2002-01-01,0,0,NA,NA,"United States of America",1948-01-01,1,NA,-1,2,10,10,1,0
"369",2,"1991",369,1991,369,2,"Q4_2012","USA","USA-AD-539k","USA-AD-539a","Ukraine","UKR","Uranium","11/19/91","11/19/91","1/2/92","A","A","11/19/91","AVD","7/8/93","8/25/93","A","A","8/30/93","AVD","1/1/00","2000","AVD",".",".",".",10,10,1,6,1,0,0,3.8528227,NA,19.73436994,50.06044657,0,24404.99484,1489.679685,6.17e+12,77464043753,9.635568513,26.11558987,1.894572404,22.78138244,"11/19/91",1991-11-19,1991-11-19,489,1033,1991-11-19,6.17e+12,77464043753,9.635568513,26.11558987,19.73436994,50.06044657,24404.99484,1489.679685,1.894572404,22.78138244,"United States of America",1995-01-01,"Ukraine ",2008-05-16,0,0,NA,NA,"United States of America",1948-01-01,1,NA,6,6,10,10,1,1
"370",2,"1991",200,1991,200,2,"Q4_2012","USA","USA-AD-494","USA-AD-486","United Kingdom","GBR","Coated Groundwood Paper","1/4/91","6/13/91","2/21/91","A","A","6/13/91","AVD","11/4/91","12/18/91","A","N",".",".",".",".",".",".",".",".",10,10,1,10,1,0,0,3.8528227,0.573089526,19.73436994,47.05465021,1,24404.99484,18571.36207,6.17e+12,1.07e+12,9.635568513,23.43496251,1.894572404,1.490754227,"1/4/91",1991-01-04,1991-01-04,37,714,1991-06-13,6.17e+12,1.07e+12,9.635568513,23.43496251,19.73436994,47.05465021,24404.99484,18571.36207,1.894572404,1.490754227,"United States of America",1995-01-01,"United Kingdom",1995-01-01,0,0,"United Kingdom",1948-01-01,"United States of America",1948-01-01,1,1,10,10,10,10,1,1
"371",2,"1991",70,1990,70,2,"Q4_2012","USA","USA-AD-479","USA-AD-476","Mexico","MEX","Steel Wire Rope","11/9/90","4/22/91","1/3/91","A","A","4/22/91","AVD","7/9/91","8/21/91","A","N",".",".",".",".",".",".",".",".",10,10,1,0,0,0,0,4.431478822,1.559853112,19.7605191,38.30618278,1,23954.52342,3052.032173,5.98e+12,2.63e+11,9.229714362,18.60079267,2.063723293,7.847876909,"11/9/90",1990-11-09,1990-11-09,708,658,1991-04-22,6.17e+12,3.14e+11,9.635568513,16.36487066,19.73436994,35.63732242,24404.99484,3577.808161,1.894572404,7.524527922,"United States of America",1995-01-01,"Mexico ",1995-01-01,0,0,"Mexico",1986-08-24,"United States of America",1948-01-01,1,1,0,2,10,10,1,0
"372",2,"1992",750,1992,750,2,"Q4_2012","USA","USA-AD-550","USA-AD-548","India","IND","Sulfur Dyes","4/17/92","10/26/92","6/5/92","A","A","10/26/92","AVD","3/1/93","4/16/93","A","N",".",".",".",".",".",".",".",".",10,10,1,8,1,0,0,3.632971264,1.595791889,19.89203737,18.11541029,1,25492.95555,324.4951264,6.54e+12,2.93e+11,9.679935161,8.690521821,1.954274114,28.73564928,"4/17/92",1992-04-17,1992-04-17,301,1183,1992-10-26,6.54e+12,2.93e+11,9.679935161,8.690521821,19.89203737,18.11541029,25492.95555,324.4951264,1.954274114,28.73564928,"United States of America",1995-01-01,"India ",1995-01-01,0,0,"India",1948-07-08,"United States of America",1948-01-01,1,1,8,8,10,10,1,1
"373",2,"1992",710,1991,710,2,"Q4_2012","USA","USA-AD-538","USA-AD-538","China","CHN","Sulfanilic Acid","10/10/91","3/18/92","11/29/91","A","A","3/18/92","AVD","7/6/92","8/19/92","A","A","8/19/92","AVD","IF","IF","AVD",".",".",".",10,10,1,-7,0,0,0,3.8528227,2.823436287,19.73436994,29.37180377,0,24404.99484,329.7490797,6.17e+12,3.79e+11,9.635568513,16.10335808,1.894572404,24.52631887,"10/10/91",1991-10-10,1991-10-10,4047,993,1992-03-18,6.54e+12,4.23e+11,9.679935161,16.14456714,19.89203737,31.26536344,25492.95555,362.8080967,1.954274114,21.78990522,"United States of America",1995-01-01,"China ",2001-12-11,0,0,NA,NA,"United States of America",1948-01-01,1,NA,-7,0,10,10,1,0
"374",2,"1992",705,1992,705,2,"Q4_2012","USA","USA-AD-566","USA-AD-565","Kazakhstan","KAZ","Ferrosilicon","6/2/92","12/29/92","7/15/92","A","A","12/29/92","AVD","12/29/92","3/9/93","A","A","4/7/93","AVD","9/21/99","1999","AVD",".",".",".",10,10,1,-3,0,0,0,3.632971264,NA,19.89203737,149.3366448,0,25492.95555,1515.104059,6.54e+12,24906939560,9.679935161,74.00497247,1.954274114,26.70777989,"6/2/92",1992-06-02,1992-06-02,770,1229,1992-12-29,6.54e+12,24906939560,9.679935161,74.00497247,19.89203737,149.3366448,25492.95555,1515.104059,1.954274114,26.70777989,"United States of America",1995-01-01,NA,NA,NA,0,NA,NA,"United States of America",1948-01-01,1,NA,-3,1,10,10,1,0
"375",2,"1992",750,1992,750,2,"Q4_2012","USA","USA-AD-561","USA-AD-560","India","IND","Sufanilic Acid","5/14/92","10/22/92","7/1/92","A","A","10/22/92","AVD","1/8/93","2/24/93","A","A","3/2/93","AVD","IF","IF","AVD",".",".",".",10,10,1,8,1,0,0,3.632971264,1.595791889,19.89203737,18.11541029,1,25492.95555,324.4951264,6.54e+12,2.93e+11,9.679935161,8.690521821,1.954274114,28.73564928,"5/14/92",1992-05-14,1992-05-14,328,1210,1992-10-22,6.54e+12,2.93e+11,9.679935161,8.690521821,19.89203737,18.11541029,25492.95555,324.4951264,1.954274114,28.73564928,"United States of America",1995-01-01,"India ",1995-01-01,0,0,"India",1948-07-08,"United States of America",1948-01-01,1,1,8,8,10,10,1,1
"376",2,"1992",200,1992,200,2,"Q4_2012","USA","USA-AD-559","USA-AD-557","United Kingdom","GBR","Steel Rails","5/8/92","10/16/92","6/23/92","A","A","10/16/92","AVD","2/19/93","4/7/93","A","N",".",".",".",".",".",".",".",".",10,10,1,10,1,0,0,3.632971264,0.663137794,19.89203737,47.85000825,1,25492.95555,19211.86216,6.54e+12,1.11e+12,9.679935161,23.6597454,1.954274114,1.470180207,"5/8/92",1992-05-08,1992-05-08,527,1204,1992-10-16,6.54e+12,1.11e+12,9.679935161,23.6597454,19.89203737,47.85000825,25492.95555,19211.86216,1.954274114,1.470180207,"United States of America",1995-01-01,"United Kingdom",1995-01-01,0,0,"United Kingdom",1948-01-01,"United States of America",1948-01-01,1,1,10,10,10,10,1,1
"377",2,"1992",750,1991,750,2,"Q4_2012","USA","USA-AD-526","USA-AD-526","India","IND","Ibuprofin","8/7/91","3/3/92","9/25/91","A","A","3/3/92","AVD",".",".","W",".",".",".",".",".",".",".",".",".",10,10,1,8,1,0,0,3.8528227,2.007675519,19.73436994,16.69494835,0,24404.99484,310.0837677,6.17e+12,2.75e+11,9.635568513,8.347845164,1.894572404,29.38952435,"8/7/91",1991-08-07,1991-08-07,47,929,1992-03-03,6.54e+12,2.93e+11,9.679935161,8.690521821,19.89203737,18.11541029,25492.95555,324.4951264,1.954274114,28.73564928,"United States of America",1995-01-01,"India ",1995-01-01,0,0,"India",1948-07-08,"United States of America",1948-01-01,1,1,8,8,10,10,1,1
"378",2,"1992",740,1991,740,2,"Q4_2012","USA","USA-AD-522","USA-AD-522","Japan","JPN","Minivans","6/10/91","1/2/92","7/31/91","A","A","1/2/92","AVD","5/26/92","7/15/92","A","N",".",".",".",".",".",".",".",".",10,10,1,10,1,0,0,3.8528227,0.52582088,19.73436994,18.17618719,1,24404.99484,28540.77148,6.17e+12,3.54e+12,9.635568513,9.874440046,1.894572404,NA,"6/10/91",1991-06-10,1991-06-10,670,871,1992-01-02,6.54e+12,3.85e+12,9.679935161,9.769231822,19.89203737,17.41268373,25492.95555,31013.64715,1.954274114,NA,"United States of America",1995-01-01,"Japan ",1995-01-01,0,0,"Japan",1955-09-10,"United States of America",1948-01-01,1,1,10,10,10,10,1,1
"379",2,"1992",820,1991,820,2,"Q4_2012","USA","USA-AD-527","USA-AD-527","Malaysia","MYS","Extruded Rubber Thread","9/5/91","4/2/92","10/23/91","A","A","4/2/92","AVD","8/25/92","10/15/92","A","A","10/7/92","AVD","8/24/04","2004","AVD",".",".",".",10,10,1,4,0,0,0,3.8528227,11.28003728,19.73436994,159.3126263,0,24404.99484,2626.079566,6.17e+12,49133851512,9.635568513,77.82612879,1.894572404,14.35580915,"9/5/91",1991-09-05,1991-09-05,3703,958,1992-04-02,6.54e+12,59151684123,9.679935161,75.98335579,19.89203737,150.6102215,25492.95555,3079.996832,1.954274114,14.57231406,"United States of America",1995-01-01,"Malaysia ",1995-01-01,0,0,"Malaysia",1957-10-24,"United States of America",1948-01-01,1,1,4,5,10,10,1,0
"380",2,"1992",710,1992,710,2,"Q4_2012","USA","USA-AD-548","USA-AD-548","China","CHN","Sulfur Dyes","4/17/92","9/24/92","6/5/92","A","A","9/24/92","AVD","2/8/93","2/24/93","A","N",".",".",".",".",".",".",".",".",10,10,1,-7,0,0,0,3.632971264,2.258723573,19.89203737,31.26536344,0,25492.95555,362.8080967,6.54e+12,4.23e+11,9.679935161,16.14456714,1.954274114,21.78990522,"4/17/92",1992-04-17,1992-04-17,4237,1183,1992-09-24,6.54e+12,4.23e+11,9.679935161,16.14456714,19.89203737,31.26536344,25492.95555,362.8080967,1.954274114,21.78990522,"United States of America",1995-01-01,"China ",2001-12-11,0,0,NA,NA,"United States of America",1948-01-01,1,NA,-7,0,10,10,1,0
"381",2,"1992",310,1992,310,2,"Q4_2012","USA","USA-AD-560","USA-AD-560","Hungary","HUN","Sufanilic Acid","5/14/92","10/22/92","7/1/92","A","A","10/22/92","AVD","2/12/93","2/24/93","A","N",".",".",".",".",".",".",".",".",10,10,1,10,1,0,0,3.632971264,2.944194229,19.89203737,63.74440459,0,25492.95555,3665.570243,6.54e+12,38009547806,9.679935161,31.85982181,1.954274114,8.232743558,"5/14/92",1992-05-14,1992-05-14,742,1210,1992-10-22,6.54e+12,38009547806,9.679935161,31.85982181,19.89203737,63.74440459,25492.95555,3665.570243,1.954274114,8.232743558,"United States of America",1995-01-01,"Hungary ",1995-01-01,0,0,"Hungary",1973-09-09,"United States of America",1948-01-01,1,1,10,10,10,10,1,1
"382",2,"1992",360,1991,360,2,"Q4_2012","USA","USA-AD-535","USA-AD-532","Romania","ROU","Circular Welded Non-Alloy Steel Pipe","10/2/91","4/28/92","11/20/91","A","A","4/28/92","AVD","9/17/92","11/4/92","A","N",".",".",".",".",".",".",".",".",10,10,1,5,0,0,0,3.8528227,2.495798757,19.73436994,39.13516947,0,24404.99484,1254.148271,6.17e+12,28846858763,9.635568513,17.60061709,1.894572404,20.12873875,"10/2/91",1991-10-02,1991-10-02,1,985,1992-04-28,6.54e+12,25090303817,9.679935161,27.79141511,19.89203737,63.99024746,25492.95555,1100.727876,1.954274114,19.40593725,"United States of America",1995-01-01,"Romania ",1995-01-01,0,0,"Romania",1971-11-14,"United States of America",1948-01-01,1,1,5,5,10,10,1,0
"383",2,"1992",220,1992,220,2,"Q4_2012","USA","USA-AD-553","USA-AD-552","France","FRA","Hot-Rolled Lead & Bismuth Steel Products","4/20/92","9/28/92","6/3/92","A","A","9/28/92","AVD","1/27/93","3/17/93","A","A","3/22/93","AVD","9/15/99","1999","AVD",".",".",".",10,10,1,9,1,0,0,3.632971264,1.559256633,19.89203737,43.02263768,1,25492.95555,23330.25778,6.54e+12,1.37e+12,9.679935161,21.80807387,1.954274114,3.061330525,"4/20/92",1992-04-20,1992-04-20,3987,1186,1992-09-28,6.54e+12,1.37e+12,9.679935161,21.80807387,19.89203737,43.02263768,25492.95555,23330.25778,1.954274114,3.061330525,"United States of America",1995-01-01,"France ",1995-01-01,0,0,"France",1948-01-01,"United States of America",1948-01-01,1,1,9,9,10,10,1,1
"384",2,"1992",732,1991,732,2,"Q4_2012","USA","USA-AD-540","USA-AD-540","South Korea","KOR","Welded Stainless Steel Pipe","11/26/91","6/22/92","1/8/92","A","A","6/22/92","AVD","11/12/92","12/29/92","A","A","12/30/92","AVD","IF","IF","AVD",".",".",".",10,10,1,6,1,0,0,3.8528227,1.16983948,19.73436994,51.30372057,1,24404.99484,7675.693138,6.17e+12,3.32e+11,9.635568513,24.42027457,1.894572404,7.310108407,"11/26/91",1991-11-26,1991-11-26,1370,1040,1992-06-22,6.54e+12,3.56e+11,9.679935161,24.63163234,19.89203737,50.33609289,25492.95555,8140.218706,1.954274114,7.105611458,"United States of America",1995-01-01,"South Korea",1995-01-01,0,0,"South Korea",1967-04-14,"United States of America",1948-01-01,1,1,6,7,10,10,1,1
"385",2,"1992",101,1991,101,2,"Q4_2012","USA","USA-AD-537","USA-AD-532","Venezuela","VEN","Circular Welded Non-Alloy Steel Pipe","10/2/91","4/28/92","11/20/91","A","A","4/28/92","AVD","9/17/92","11/4/92","A","A","11/2/92","AVD","8/22/00","2000","AVD",".",".",".",10,10,1,9,1,0,0,3.8528227,0.149829095,19.73436994,57.58016811,0,24404.99484,2558.724047,6.17e+12,51734363024,9.635568513,31.35326776,1.894572404,5.57920338,"10/2/91",1991-10-02,1991-10-02,972,985,1992-04-28,6.54e+12,58470358476,9.679935161,26.3530069,19.89203737,55.26175468,25492.95555,2825.796102,1.954274114,5.42717462,"United States of America",1995-01-01,"Venezuela",1995-01-01,0,0,"Venezuela",1990-08-31,"United States of America",1948-01-01,1,1,8,8,10,10,1,1
"386",2,"1992",740,1992,740,2,"Q4_2012","USA","USA-AD-622","USA-AD-622","Japan","JPN","Dry Film Photoresist","7/23/92","12/30/92","9/8/92","A","A","12/30/92","AVD","3/15/93","5/5/93","A","N",".",".",".",".",".",".",".",".",10,10,1,10,1,0,0,3.632971264,0.514258482,19.89203737,17.41268373,1,25492.95555,31013.64715,6.54e+12,3.85e+12,9.679935161,9.769231822,1.954274114,NA,"7/23/92",1992-07-23,1992-07-23,260,1280,1992-12-30,6.54e+12,3.85e+12,9.679935161,9.769231822,19.89203737,17.41268373,25492.95555,31013.64715,1.954274114,NA,"United States of America",1995-01-01,"Japan ",1995-01-01,0,0,"Japan",1955-09-10,"United States of America",1948-01-01,1,1,10,10,10,10,1,1
"387",2,"1992",255,1992,255,2,"Q4_2012","USA","USA-AD-554","USA-AD-552","Germany","DEU","Hot-Rolled Lead & Bismuth Steel Products","4/20/92","9/28/92","6/3/92","A","A","9/28/92","AVD","1/27/93","3/17/93","A","A","3/22/93","AVD","9/15/99","1999","AVD",".",".",".",10,10,1,10,1,0,0,3.632971264,1.09321552,19.89203737,48.43423926,1,25492.95555,25604.72543,6.54e+12,2.06e+12,9.679935161,24.01480223,1.954274114,1.10689014,"4/20/92",1992-04-20,1992-04-20,3489,1186,1992-09-28,6.54e+12,2.06e+12,9.679935161,24.01480223,19.89203737,48.43423926,25492.95555,25604.72543,1.954274114,1.10689014,"United States of America",1995-01-01,"Germany ",1995-01-01,0,0,"Germany",1951-10-01,"United States of America",1948-01-01,1,1,10,10,10,10,1,1
"388",2,"1992",140,1991,140,2,"Q4_2012","USA","USA-AD-532","USA-AD-532","Brazil","BRA","Circular Welded Non-Alloy Steel Pipe","10/2/91","4/28/92","11/20/91","A","A","4/28/92","AVD","9/17/92","11/4/92","A","A","11/2/92","AVD","IF","IF","AVD",".",".",".",10,10,1,8,1,0,0,3.8528227,3.393774006,19.73436994,16.59091683,1,24404.99484,2677.149908,6.17e+12,4.07e+11,9.635568513,8.6769732,1.894572404,7.79,"10/2/91",1991-10-02,1991-10-02,566,985,1992-04-28,6.54e+12,3.91e+11,9.679935161,10.8682498,19.89203737,19.25334456,25492.95555,2526.336624,1.954274114,7.72,"United States of America",1995-01-01,"Brazil ",1995-01-01,0,0,"Brazil",1948-07-30,"United States of America",1948-01-01,1,1,8,8,10,10,1,1
"389",2,"1992",713,1991,713,2,"Q4_2012","USA","USA-AD-536","USA-AD-532","Taiwan","TWN","Circular Welded Non-Alloy Steel Pipe","10/2/91","4/28/92","11/20/91","A","A","4/28/92","AVD","9/17/92","11/4/92","A","A","11/2/92","AVD","IF","IF","AVD",".",".",".",10,10,1,-1,0,0,0,3.8528227,NA,19.73436994,NA,0,24404.99484,NA,6.17e+12,NA,9.635568513,NA,1.894572404,NA,"10/2/91",1991-10-02,1991-10-02,1358,985,1992-04-28,6.54e+12,NA,9.679935161,NA,19.89203737,NA,25492.95555,NA,1.954274114,NA,"United States of America",1995-01-01,"Taiwan",2002-01-01,0,0,NA,NA,"United States of America",1948-01-01,1,NA,7,7,10,10,1,1
"390",2,"1992",70,1992,70,2,"Q4_2012","USA","USA-AD-547","USA-AD-546","Mexico","MEX","Steel Wire Rope","4/16/92","9/22/92","6/3/92","A","A","9/22/92","AVD","2/8/93","3/25/93","A","A","3/25/93","AVD","1/20/00","2000","AVD",".",".",".",10,10,1,0,0,0,0,3.632971264,1.357616599,19.89203737,35.50933306,1,25492.95555,4050.999455,6.54e+12,3.64e+11,9.679935161,15.23779325,1.954274114,6.683986175,"4/16/92",1992-04-16,1992-04-16,1232,1182,1992-09-22,6.54e+12,3.64e+11,9.679935161,15.23779325,19.89203737,35.50933306,25492.95555,4050.999455,1.954274114,6.683986175,"United States of America",1995-01-01,"Mexico ",1995-01-01,0,0,"Mexico",1986-08-24,"United States of America",1948-01-01,1,1,0,2,10,10,1,0
"391",2,"1992",385,1991,385,2,"Q4_2012","USA","USA-AD-529","USA-AD-528","Norway","NOR","Magnesium","9/12/91","2/20/92","10/30/91","A","A","2/20/92","AVD","7/13/92",".","N","T",".",".",".",".",".",".",".",".",10,10,1,10,1,0,0,3.8528227,1.724092583,19.73436994,71.99723614,0,24404.99484,28077.17764,6.17e+12,1.2e+11,9.635568513,39.94162895,1.894572404,3.345698377,"9/12/91",1991-09-12,1991-09-12,313,965,1992-02-20,6.54e+12,1.28e+11,9.679935161,37.87152866,19.89203737,69.00681538,25492.95555,29931.6322,1.954274114,3.037031028,"United States of America",1995-01-01,"Norway ",1995-01-01,0,0,"Norway",1948-07-10,"United States of America",1948-01-01,1,1,10,10,10,10,1,1
"392",2,"1992",20,1991,20,2,"Q4_2012","USA","USA-AD-528","USA-AD-528","Canada","CAN","Magnesium","9/12/91","2/20/92","10/30/91","A","A","2/20/92","AVD","7/13/92","8/26/92","A","A","8/31/92","AVD","12/7/04","2004","AVD",".",".",".",10,10,1,10,1,0,0,3.8528227,8.083021376,19.73436994,49.36947719,0,24404.99484,21591.13916,6.17e+12,6.08e+11,9.635568513,24.42005964,1.894572404,2.74284223,"9/12/91",1991-09-12,1991-09-12,2551,965,1992-02-20,6.54e+12,5.9e+11,9.679935161,26.27924387,19.89203737,52.91751716,25492.95555,20692.72203,1.954274114,2.73038752,"United States of America",1995-01-01,"Canada ",1995-01-01,0,0,"Canada",1948-01-01,"United States of America",1948-01-01,1,1,10,10,10,10,1,1
"393",2,"1992",732,1992,732,2,"Q4_2012","USA","USA-AD-563","USA-AD-563","South Korea","KOR","Stainless Steel Butt-Weld Pipe Fittings","5/28/92","10/21/92","7/15/92","A","A","10/21/92","AVD","10/21/92","12/29/92","A","A","2/23/93","AVD","11/5/10","2010","AVD",".",".",".",10,10,1,6,1,0,0,3.632971264,1.203577942,19.89203737,50.33609289,1,25492.95555,8140.218706,6.54e+12,3.56e+11,9.679935161,24.63163234,1.954274114,7.105611458,"5/28/92",1992-05-28,1992-05-28,1554,1224,1992-10-21,6.54e+12,3.56e+11,9.679935161,24.63163234,19.89203737,50.33609289,25492.95555,8140.218706,1.954274114,7.105611458,"United States of America",1995-01-01,"South Korea",1995-01-01,0,0,"South Korea",1967-04-14,"United States of America",1948-01-01,1,1,6,7,10,10,1,1
"394",2,"1992",365,1992,365,2,"Q4_2012","USA","USA-AD-568","USA-AD-565","Russia","RUS","Ferrosilicon","6/2/92","12/29/92","7/15/92","A","A","12/29/92","AVD","12/29/92","5/19/93","A","A","6/24/93","AVD","9/21/99","1999","AVD",".",".",".",10,10,1,5,0,0,0,3.632971264,NA,19.89203737,110.5770647,0,25492.95555,3095.08716,6.54e+12,4.6e+11,9.679935161,62.32246186,1.954274114,7.39353834,"6/2/92",1992-06-02,1992-06-02,286,1229,1992-12-29,6.54e+12,4.6e+11,9.679935161,62.32246186,19.89203737,110.5770647,25492.95555,3095.08716,1.954274114,7.39353834,"United States of America",1995-01-01,"Russia",2012-08-22,0,0,NA,NA,"United States of America",1948-01-01,1,NA,5,5,10,10,1,0
"395",2,"1992",732,1991,732,2,"Q4_2012","USA","USA-AD-533","USA-AD-532","South Korea","KOR","Circular Welded Non-Alloy Steel Pipe","10/2/91","4/28/92","11/20/91","A","A","4/28/92","AVD","9/17/92","11/4/92","A","A","11/2/92","AVD","IF","IF","AVD",".",".",".",10,10,1,6,1,0,0,3.8528227,1.16983948,19.73436994,51.30372057,1,24404.99484,7675.693138,6.17e+12,3.32e+11,9.635568513,24.42027457,1.894572404,7.310108407,"10/2/91",1991-10-02,1991-10-02,1315,985,1992-04-28,6.54e+12,3.56e+11,9.679935161,24.63163234,19.89203737,50.33609289,25492.95555,8140.218706,1.954274114,7.105611458,"United States of America",1995-01-01,"South Korea",1995-01-01,0,0,"South Korea",1967-04-14,"United States of America",1948-01-01,1,1,6,7,10,10,1,1
"396",2,"1992",200,1992,200,2,"Q4_2012","USA","USA-AD-555","USA-AD-552","United Kingdom","GBR","Hot-Rolled Lead & Bismuth Steel Products","4/20/92","9/28/92","6/3/92","A","A","9/28/92","AVD","1/27/93","3/17/93","A","A","3/22/93","AVD","9/15/99","1999","AVD",".",".",".",10,10,1,10,1,0,0,3.632971264,0.663137794,19.89203737,47.85000825,1,25492.95555,19211.86216,6.54e+12,1.11e+12,9.679935161,23.6597454,1.954274114,1.470180207,"4/20/92",1992-04-20,1992-04-20,509,1186,1992-09-28,6.54e+12,1.11e+12,9.679935161,23.6597454,19.89203737,47.85000825,25492.95555,19211.86216,1.954274114,1.470180207,"United States of America",1995-01-01,"United Kingdom",1995-01-01,0,0,"United Kingdom",1948-01-01,"United States of America",1948-01-01,1,1,10,10,10,10,1,1
"397",2,"1992",732,1992,732,2,"Q4_2012","USA","USA-AD-556","USA-AD-556","South Korea","KOR","Drams","4/29/92","10/29/92","6/17/92","A","A","10/29/92","AVD","3/23/93","5/12/93","A","A","5/10/93","AVD","10/5/00","2000","AVD",".",".",".",10,10,1,6,1,1,0,3.632971264,1.203577942,19.89203737,50.33609289,1,25492.95555,8140.218706,6.54e+12,3.56e+11,9.679935161,24.63163234,1.954274114,7.105611458,"4/29/92",1992-04-29,1992-04-29,1525,1195,1992-10-29,6.54e+12,3.56e+11,9.679935161,24.63163234,19.89203737,50.33609289,25492.95555,8140.218706,1.954274114,7.105611458,"United States of America",1995-01-01,"South Korea",1995-01-01,0,0,"South Korea",1967-04-14,"United States of America",1948-01-01,1,1,6,7,10,10,1,1
"398",2,"1992",713,1991,713,2,"Q4_2012","USA","USA-AD-541","USA-AD-540","Taiwan","TWN","Welded Stainless Steel Pipe","11/26/91","6/22/92","1/8/92","A","A","6/22/92","AVD","11/12/92","12/29/92","A","A","12/30/92","AVD","IF","IF","AVD",".",".",".",10,10,1,-1,0,0,0,3.8528227,NA,19.73436994,NA,0,24404.99484,NA,6.17e+12,NA,9.635568513,NA,1.894572404,NA,"11/26/91",1991-11-26,1991-11-26,1413,1040,1992-06-22,6.54e+12,NA,9.679935161,NA,19.89203737,NA,25492.95555,NA,1.954274114,NA,"United States of America",1995-01-01,"Taiwan",2002-01-01,0,0,NA,NA,"United States of America",1948-01-01,1,NA,7,7,10,10,1,1
"399",2,"1992",713,1992,713,2,"Q4_2012","USA","USA-AD-564","USA-AD-563","Taiwan","TWN","Stainless Steel Butt-Weld Pipe Fittings","5/28/92","12/23/92","7/15/92","A","A","12/23/92","AVD","12/23/92","5/14/93","A","A","6/16/93","AVD","11/5/10","2010","AVD",".",".",".",10,10,1,7,1,0,0,3.632971264,NA,19.89203737,NA,0,25492.95555,NA,6.54e+12,NA,9.679935161,NA,1.954274114,NA,"5/28/92",1992-05-28,1992-05-28,1597,1224,1992-12-23,6.54e+12,NA,9.679935161,NA,19.89203737,NA,25492.95555,NA,1.954274114,NA,"United States of America",1995-01-01,"Taiwan",2002-01-01,0,0,NA,NA,"United States of America",1948-01-01,1,NA,7,7,10,10,1,1
"400",2,"1992",200,1992,200,2,"Q4_2012","USA","USA-AD-551","USA-AD-548","United Kingdom","GBR","Sulfur Dyes","4/17/92","9/24/92","6/5/92","A","A","9/24/92","AVD","1/8/93","2/24/93","A","N",".",".",".",".",".",".",".",".",10,10,1,10,1,0,0,3.632971264,0.663137794,19.89203737,47.85000825,1,25492.95555,19211.86216,6.54e+12,1.11e+12,9.679935161,23.6597454,1.954274114,1.470180207,"4/17/92",1992-04-17,1992-04-17,506,1183,1992-09-24,6.54e+12,1.11e+12,9.679935161,23.6597454,19.89203737,47.85000825,25492.95555,19211.86216,1.954274114,1.470180207,"United States of America",1995-01-01,"United Kingdom",1995-01-01,0,0,"United Kingdom",1948-01-01,"United States of America",1948-01-01,1,1,10,10,10,10,1,1
"401",2,"1992",140,1992,140,2,"Q4_2012","USA","USA-AD-552","USA-AD-552","Brazil","BRA","Hot-Rolled Lead & Bismuth Steel Products","4/20/92","11/17/92","6/3/92","A","A","11/17/92","AVD","1/27/93","3/17/93","A","A","3/22/93","AVD","9/15/99","1999","AVD",".",".",".",10,10,1,8,1,0,0,3.632971264,3.294303936,19.89203737,19.25334456,1,25492.95555,2526.336624,6.54e+12,3.91e+11,9.679935161,10.8682498,1.954274114,7.72,"4/20/92",1992-04-20,1992-04-20,767,1186,1992-11-17,6.54e+12,3.91e+11,9.679935161,10.8682498,19.89203737,19.25334456,25492.95555,2526.336624,1.954274114,7.72,"United States of America",1995-01-01,"Brazil ",1995-01-01,0,0,"Brazil",1948-07-30,"United States of America",1948-01-01,1,1,8,8,10,10,1,1
"402",2,"1992",732,1992,732,2,"Q4_2012","USA","USA-AD-546","USA-AD-546","South Korea","KOR","Steel Wire Rope","4/16/92","9/30/92","6/3/92","A","A","9/30/92","AVD","2/23/93","3/25/93","A","A","3/26/93","AVD","1/20/00","2000","AVD",".",".",".",10,10,1,6,1,0,0,3.632971264,1.203577942,19.89203737,50.33609289,1,25492.95555,8140.218706,6.54e+12,3.56e+11,9.679935161,24.63163234,1.954274114,7.105611458,"4/16/92",1992-04-16,1992-04-16,1512,1182,1992-09-30,6.54e+12,3.56e+11,9.679935161,24.63163234,19.89203737,50.33609289,25492.95555,8140.218706,1.954274114,7.105611458,"United States of America",1995-01-01,"South Korea",1995-01-01,0,0,"South Korea",1967-04-14,"United States of America",1948-01-01,1,1,6,7,10,10,1,1
"403",2,"1992",101,1992,101,2,"Q4_2012","USA","USA-AD-570","USA-AD-565","Venezuela","VEN","Ferrosilicon","6/2/92","12/29/92","7/15/92","A","A","12/29/92","AVD","12/29/92","5/10/93","A","A","6/24/93","AVD","9/21/99","1999","AVD",".",".",".",10,10,1,8,1,0,0,3.632971264,0.116629763,19.89203737,55.26175468,0,25492.95555,2825.796102,6.54e+12,58470358476,9.679935161,26.3530069,1.954274114,5.42717462,"6/2/92",1992-06-02,1992-06-02,1216,1229,1992-12-29,6.54e+12,58470358476,9.679935161,26.3530069,19.89203737,55.26175468,25492.95555,2825.796102,1.954274114,5.42717462,"United States of America",1995-01-01,"Venezuela",1995-01-01,0,0,"Venezuela",1990-08-31,"United States of America",1948-01-01,1,1,8,8,10,10,1,1
"404",2,"1992",255,1991,255,2,"Q4_2012","USA","USA-AD-530","USA-AD-530","Germany","DEU","High-Tenacity Rayon Filament Yarn","9/13/91","2/20/92","10/30/91","A","A","2/20/92","AVD","5/22/92","7/1/92","A","A","6/30/92","AVD","5/30/97","1997","AVD",".",".",".",10,10,1,10,1,0,0,3.8528227,1.12337179,19.73436994,51.7789652,1,24404.99484,22603.61647,6.17e+12,1.81e+12,9.635568513,25.70050828,1.894572404,1.217166643,"9/13/91",1991-09-13,1991-09-13,3269,966,1992-02-20,6.54e+12,2.06e+12,9.679935161,24.01480223,19.89203737,48.43423926,25492.95555,25604.72543,1.954274114,1.10689014,"United States of America",1995-01-01,"Germany ",1995-01-01,0,0,"Germany",1951-10-01,"United States of America",1948-01-01,1,1,10,10,10,10,1,1
"405",2,"1992",369,1992,369,2,"Q4_2012","USA","USA-AD-569","USA-AD-565","Ukraine","UKR","Ferrosilicon","6/2/92","12/29/92","7/15/92","A","A","12/29/92","AVD","12/29/92","3/9/93","A","A","4/7/93","AVD","9/21/99","1999","AVD",".",".",".",10,10,1,6,1,0,0,3.632971264,NA,19.89203737,45.97085413,0,25492.95555,1417.869932,6.54e+12,73942294099,9.679935161,23.98090588,1.954274114,20.35643892,"6/2/92",1992-06-02,1992-06-02,685,1229,1992-12-29,6.54e+12,73942294099,9.679935161,23.98090588,19.89203737,45.97085413,25492.95555,1417.869932,1.954274114,20.35643892,"United States of America",1995-01-01,"Ukraine ",2008-05-16,0,0,NA,NA,"United States of America",1948-01-01,1,NA,6,6,10,10,1,1
"406",2,"1992",710,1992,710,2,"Q4_2012","USA","USA-AD-567","USA-AD-565","China","CHN","Ferrosilicon","6/2/92","10/5/92","7/15/92","A","A","10/5/92","AVD","11/5/92","1/21/93","A","A","3/11/93","AVD","9/21/99","1999","AVD",".",".",".",10,10,1,-7,0,0,0,3.632971264,2.258723573,19.89203737,31.26536344,0,25492.95555,362.8080967,6.54e+12,4.23e+11,9.679935161,16.14456714,1.954274114,21.78990522,"6/2/92",1992-06-02,1992-06-02,4283,1229,1992-10-05,6.54e+12,4.23e+11,9.679935161,16.14456714,19.89203737,31.26536344,25492.95555,362.8080967,1.954274114,21.78990522,"United States of America",1995-01-01,"China ",2001-12-11,0,0,NA,NA,"United States of America",1948-01-01,1,NA,-7,0,10,10,1,0
"407",2,"1992",70,1991,70,2,"Q4_2012","USA","USA-AD-534","USA-AD-532","Mexico","MEX","Circular Welded Non-Alloy Steel Pipe","10/2/91","4/28/92","11/20/91","A","A","4/28/92","AVD","9/17/92","11/4/92","A","A","11/2/92","AVD","IF","IF","AVD",".",".",".",10,10,1,0,0,0,0,3.8528227,1.724690254,19.73436994,35.63732242,1,24404.99484,3577.808161,6.17e+12,3.14e+11,9.635568513,16.36487066,1.894572404,7.524527922,"10/2/91",1991-10-02,1991-10-02,1035,985,1992-04-28,6.54e+12,3.64e+11,9.679935161,15.23779325,19.89203737,35.50933306,25492.95555,4050.999455,1.954274114,6.683986175,"United States of America",1995-01-01,"Mexico ",1995-01-01,0,0,"Mexico",1986-08-24,"United States of America",1948-01-01,1,1,0,2,10,10,1,0
"408",2,"1993",732,1992,732,2,"Q4_2012","USA","USA-AD-607","USA-AD-597","South Korea","KOR","Cold-Rolled Carbon Steel Sheet ","7/8/92","2/4/93","8/21/92","A","A","2/4/93","AVD","7/9/93","8/18/93","A","A","8/19/93","AVD","12/10/00","2000","AVD",".",".",".",10,10,1,6,1,0,0,3.632971264,1.203577942,19.89203737,50.33609289,1,25492.95555,8140.218706,6.54e+12,3.56e+11,9.679935161,24.63163234,1.954274114,7.105611458,"7/8/92",1992-07-08,1992-07-08,1595,1265,1993-02-04,6.88e+12,3.92e+11,9.519240554,24.50976902,19.98633463,48.65827339,26464.78326,8869.020761,1.863028935,6.352665762,"United States of America",1995-01-01,"South Korea",1995-01-01,0,0,"South Korea",1967-04-14,"United States of America",1948-01-01,1,1,6,7,10,10,1,1
"409",2,"1993",740,1992,740,2,"Q4_2012","USA","USA-AD-571","USA-AD-571","Japan","JPN","Professional Cutting Sanding and Grinding Tools","6/5/92","1/4/93","7/22/92","A","A","1/4/93","AVD","5/26/93","7/14/93","A","A","7/12/93","AVD","6/2/00","2000","AVD",".",".",".",10,10,1,10,1,0,0,3.632971264,0.514258482,19.89203737,17.41268373,1,25492.95555,31013.64715,6.54e+12,3.85e+12,9.679935161,9.769231822,1.954274114,NA,"6/5/92",1992-06-05,1992-06-05,212,1232,1993-01-04,6.88e+12,4.41e+12,9.519240554,9.057284362,19.98633463,15.92398985,26464.78326,35451.29751,1.863028935,NA,"United States of America",1995-01-01,"Japan ",1995-01-01,0,0,"Japan",1955-09-10,"United States of America",1948-01-01,1,1,10,10,10,10,1,1
"410",2,"1993",820,1993,820,2,"Q4_2012","USA","USA-AD-644","USA-AD-644","Malaysia","MYS","Stainless Steel Pipe","2/24/93","9/7/93","4/14/93","A","A","9/7/93","AVD","1/28/94","3/16/94","A","N",".",".",".",".",".",".",".",".",10,10,1,4,0,0,0,3.334427515,8.748843224,19.98633463,157.9413797,0,26464.78326,3395.414241,6.88e+12,66894448089,9.519240554,78.92074591,1.863028935,13.78743619,"2/24/93",1993-02-24,1993-02-24,4241,35,1993-09-07,6.88e+12,66894448089,9.519240554,78.92074591,19.98633463,157.9413797,26464.78326,3395.414241,1.863028935,13.78743619,"United States of America",1995-01-01,"Malaysia ",1995-01-01,0,0,"Malaysia",1957-10-24,"United States of America",1948-01-01,1,1,4,5,10,10,1,0
"411",2,"1993",713,1992,713,2,"Q4_2012","USA","USA-AD-625","USA-AD-624","Taiwan","TWN","Helical Spring Lockwashers","9/16/92","2/23/93","10/29/92","A","A","2/23/93","AVD","5/11/93","6/28/93","A","A","6/28/93","AVD","IF","IF","AVD",".",".",".",10,10,1,7,1,0,0,3.632971264,NA,19.89203737,NA,0,25492.95555,NA,6.54e+12,NA,9.679935161,NA,1.954274114,NA,"9/16/92",1992-09-16,1992-09-16,1708,1335,1993-02-23,6.88e+12,NA,9.519240554,NA,19.98633463,NA,26464.78326,NA,1.863028935,NA,"United States of America",1995-01-01,"Taiwan",2002-01-01,0,0,NA,NA,"United States of America",1948-01-01,1,NA,7,7,10,10,1,1
"412",2,"1993",255,1992,255,2,"Q4_2012","USA","USA-AD-604","USA-AD-597","Germany","DEU","Cold-Rolled Carbon Steel Sheet ","7/8/92","2/4/93","8/21/92","A","A","2/4/93","AVD","7/9/93","8/18/93","A","A","8/19/93","AVD","12/10/00","2000","AVD",".",".",".",10,10,1,10,1,0,0,3.632971264,1.09321552,19.89203737,48.43423926,1,25492.95555,25604.72543,6.54e+12,2.06e+12,9.679935161,24.01480223,1.954274114,1.10689014,"7/8/92",1992-07-08,1992-07-08,3568,1265,1993-02-04,6.88e+12,2.01e+12,9.519240554,21.99186752,19.98633463,43.81047793,26464.78326,24735.62024,1.863028935,1.044928678,"United States of America",1995-01-01,"Germany ",1995-01-01,0,0,"Germany",1951-10-01,"United States of America",1948-01-01,1,1,10,10,10,10,1,1
"413",2,"1993",651,1993,651,2,"Q4_2012","USA","USA-AD-642","USA-AD-641","Egypt","EGY","Ferrosilicon","1/21/93","6/28/93","3/8/93","A","A","6/28/93","AVD","9/14/93","11/3/93","A","N",".",".",".",".",".",".",".",".",10,10,1,-6,0,0,0,3.334427515,2.304955364,19.98633463,55.92783505,0,26464.78326,785.371376,6.88e+12,46578631213,9.519240554,25.83762887,1.863028935,16.71250684,"1/21/93",1993-01-21,1993-01-21,4117,1,1993-06-28,6.88e+12,46578631213,9.519240554,25.83762887,19.98633463,55.92783505,26464.78326,785.371376,1.863028935,16.71250684,"United States of America",1995-01-01,"Egypt ",1995-06-30,0,0,"Egypt",1970-05-09,"United States of America",1948-01-01,1,1,-6,0,10,10,1,0
"414",2,"1993",210,1992,210,2,"Q4_2012","USA","USA-AD-596","USA-AD-588","Netherlands","NLD","Hot-Rolled Carbon Steel Sheet","7/8/92","2/4/93","8/21/92","A","A","2/4/93","AVD","7/9/93","8/18/93","A","N",".",".",".",".",".",".",".",".",10,10,1,10,1,0,0,3.632971264,4.437926,19.89203737,106.965736,0,25492.95555,22142.4269,6.54e+12,3.36e+11,9.679935161,55.37627796,1.954274114,3.874662389,"7/8/92",1992-07-08,1992-07-08,3534,1265,1993-02-04,6.88e+12,3.27e+11,9.519240554,54.58366091,19.98633463,103.738592,26464.78326,21418.40235,1.863028935,3.399511869,"United States of America",1995-01-01,"Netherlands ",1995-01-01,0,0,"Netherlands",1948-01-01,"United States of America",1948-01-01,1,1,10,10,10,10,1,1
"415",2,"1993",140,1992,140,2,"Q4_2012","USA","USA-AD-574","USA-AD-573","Brazil","BRA","Cut-To-Length Carbon Steel Plate","7/8/92","2/4/93","8/21/92","A","A","2/4/93","AVD","7/9/93","8/18/93","A","A","8/19/93","AVD","12/15/05","2005","AVD",".",".",".",10,10,1,8,1,0,0,3.632971264,3.294303936,19.89203737,19.25334456,1,25492.95555,2526.336624,6.54e+12,3.91e+11,9.679935161,10.8682498,1.954274114,7.72,"7/8/92",1992-07-08,1992-07-08,846,1265,1993-02-04,6.88e+12,4.38e+11,9.519240554,10.50327025,19.98633463,19.59931632,26464.78326,2791.518675,1.863028935,7.56,"United States of America",1995-01-01,"Brazil ",1995-01-01,0,0,"Brazil",1948-07-30,"United States of America",1948-01-01,1,1,8,8,10,10,1,1
"416",2,"1993",360,1992,360,2,"Q4_2012","USA","USA-AD-584","USA-AD-573","Romania","ROU","Cut-To-Length Carbon Steel Plate","7/8/92","2/4/93","8/21/92","A","A","2/4/93","AVD","7/9/93","8/18/93","A","A","8/19/93","AVD","12/15/05","2005","AVD",".",".",".",10,10,1,5,0,0,0,3.632971264,3.538069279,19.89203737,63.99024746,0,25492.95555,1100.727876,6.54e+12,25090303817,9.679935161,27.79141511,1.954274114,19.40593725,"7/8/92",1992-07-08,1992-07-08,281,1265,1993-02-04,6.88e+12,26361161948,9.519240554,23.01629966,19.98633463,51.00369936,26464.78326,1158.056394,1.863028935,22.63701941,"United States of America",1995-01-01,"Romania ",1995-01-01,0,0,"Romania",1971-11-14,"United States of America",1948-01-01,1,1,5,5,10,10,1,0
"417",2,"1993",740,1993,740,2,"Q4_2012","USA","USA-AD-643","USA-AD-643","Japan","JPN","Defrost Timers","1/27/93","8/24/93","3/17/93","A","A","8/24/93","AVD","1/13/94","3/2/94","A","A","3/2/94","AVD","2/16/00","2000","AVD",".",".",".",10,10,1,10,1,0,0,3.334427515,0.482171364,19.98633463,15.92398985,1,26464.78326,35451.29751,6.88e+12,4.41e+12,9.519240554,9.057284362,1.863028935,NA,"1/27/93",1993-01-27,1993-01-27,448,7,1993-08-24,6.88e+12,4.41e+12,9.519240554,9.057284362,19.98633463,15.92398985,26464.78326,35451.29751,1.863028935,NA,"United States of America",1995-01-01,"Japan ",1995-01-01,0,0,"Japan",1955-09-10,"United States of America",1948-01-01,1,1,10,10,10,10,1,1
"418",2,"1993",732,1992,732,2,"Q4_2012","USA","USA-AD-595","USA-AD-588","South Korea","KOR","Hot-Rolled Carbon Steel Sheet","7/8/92","2/4/93","8/21/92","A","A","2/4/93","AVD","7/9/93","8/18/93","A","N",".",".",".",".",".",".",".",".",10,10,1,6,1,0,0,3.632971264,1.203577942,19.89203737,50.33609289,1,25492.95555,8140.218706,6.54e+12,3.56e+11,9.679935161,24.63163234,1.954274114,7.105611458,"7/8/92",1992-07-08,1992-07-08,1595,1265,1993-02-04,6.88e+12,3.92e+11,9.519240554,24.50976902,19.98633463,48.65827339,26464.78326,8869.020761,1.863028935,6.352665762,"United States of America",1995-01-01,"South Korea",1995-01-01,0,0,"South Korea",1967-04-14,"United States of America",1948-01-01,1,1,6,7,10,10,1,1
"419",2,"1993",740,1992,740,2,"Q4_2012","USA","USA-AD-606","USA-AD-597","Japan","JPN","Cold-Rolled Carbon Steel Sheet ","7/8/92","2/4/93","8/21/92","A","A","2/4/93","AVD","7/9/93","8/18/93","A","N",".",".",".",".",".",".",".",".",10,10,1,10,1,0,0,3.632971264,0.514258482,19.89203737,17.41268373,1,25492.95555,31013.64715,6.54e+12,3.85e+12,9.679935161,9.769231822,1.954274114,NA,"7/8/92",1992-07-08,1992-07-08,245,1265,1993-02-04,6.88e+12,4.41e+12,9.519240554,9.057284362,19.98633463,15.92398985,26464.78326,35451.29751,1.863028935,NA,"United States of America",1995-01-01,"Japan ",1995-01-01,0,0,"Japan",1955-09-10,"United States of America",1948-01-01,1,1,10,10,10,10,1,1
"420",2,"1993",140,1992,140,2,"Q4_2012","USA","USA-AD-601","USA-AD-597","Brazil","BRA","Cold-Rolled Carbon Steel Sheet ","7/8/92","2/4/93","8/21/92","A","A","2/4/93","AVD","7/9/93","8/18/93","A","N",".",".",".",".",".",".",".",".",10,10,1,8,1,0,0,3.632971264,3.294303936,19.89203737,19.25334456,1,25492.95555,2526.336624,6.54e+12,3.91e+11,9.679935161,10.8682498,1.954274114,7.72,"7/8/92",1992-07-08,1992-07-08,846,1265,1993-02-04,6.88e+12,4.38e+11,9.519240554,10.50327025,19.98633463,19.59931632,26464.78326,2791.518675,1.863028935,7.56,"United States of America",1995-01-01,"Brazil ",1995-01-01,0,0,"Brazil",1948-07-30,"United States of America",1948-01-01,1,1,8,8,10,10,1,1
"421",2,"1993",230,1992,230,2,"Q4_2012","USA","USA-AD-609","USA-AD-597","Spain","ESP","Cold-Rolled Carbon Steel Sheet ","7/8/92","2/4/93","8/21/92","A","A","2/4/93","AVD","7/9/93","8/18/93","A","N",".",".",".",".",".",".",".",".",10,10,1,10,1,0,0,3.632971264,1.518752895,19.89203737,35.93564151,0,25492.95555,15665.66717,6.54e+12,6.12e+11,9.679935161,16.61606566,1.954274114,NA,"7/8/92",1992-07-08,1992-07-08,3506,1265,1993-02-04,6.88e+12,5.09e+11,9.519240554,18.17767717,19.98633463,36.96103125,26464.78326,12997.17416,1.863028935,NA,"United States of America",1995-01-01,"Spain ",1995-01-01,0,0,"Spain",1963-08-29,"United States of America",1948-01-01,1,1,10,10,10,10,1,1
"422",2,"1993",140,1992,140,2,"Q4_2012","USA","USA-AD-572","USA-AD-572","Brazil","BRA","Special Steel Products","6/17/92","1/11/93","7/30/92","A","A","1/11/93","AVD","6/3/93","7/15/93","A","N",".",".",".",".",".",".",".",".",10,10,1,8,1,0,0,3.632971264,3.294303936,19.89203737,19.25334456,1,25492.95555,2526.336624,6.54e+12,3.91e+11,9.679935161,10.8682498,1.954274114,7.72,"6/17/92",1992-06-17,1992-06-17,825,1244,1993-01-11,6.88e+12,4.38e+11,9.519240554,10.50327025,19.98633463,19.59931632,26464.78326,2791.518675,1.863028935,7.56,"United States of America",1995-01-01,"Brazil ",1995-01-01,0,0,"Brazil",1948-07-30,"United States of America",1948-01-01,1,1,8,8,10,10,1,1
"423",2,"1993",20,1992,20,2,"Q4_2012","USA","USA-AD-590","USA-AD-588","Canada","CAN","Hot-Rolled Carbon Steel Sheet","7/8/92","2/4/93","8/21/92","A","A","2/4/93","AVD","7/9/93","8/18/93","A","N",".",".",".",".",".",".",".",".",10,10,1,10,1,0,0,3.632971264,8.349049879,19.89203737,52.91751716,0,25492.95555,20692.72203,6.54e+12,5.9e+11,9.679935161,26.27924387,1.954274114,2.73038752,"7/8/92",1992-07-08,1992-07-08,2851,1265,1993-02-04,6.88e+12,5.75e+11,9.519240554,29.25054578,19.98633463,58.48167391,26464.78326,19936.37706,1.863028935,2.804406436,"United States of America",1995-01-01,"Canada ",1995-01-01,0,0,"Canada",1948-01-01,"United States of America",1948-01-01,1,1,10,10,10,10,1,1
"424",2,"1993",380,1992,380,2,"Q4_2012","USA","USA-AD-586","USA-AD-573","Sweden","SWE","Cut-To-Length Carbon Steel Plate","7/8/92","2/4/93","8/21/92","A","A","2/4/93","AVD","7/9/93","8/18/93","A","A","8/19/93","AVD","12/15/05","2005","AVD",".",".",".",10,10,1,10,1,0,0,3.632971264,6.56086203,19.89203737,53.93158938,0,25492.95555,31119.6736,6.54e+12,2.7e+11,9.679935161,27.9513417,1.954274114,3.010972903,"7/8/92",1992-07-08,1992-07-08,252,1265,1993-02-04,6.88e+12,2.02e+11,9.519240554,32.74598246,19.98633463,61.77314296,26464.78326,23173.29642,1.863028935,2.848391151,"United States of America",1995-01-01,"Sweden ",1995-01-01,0,0,"Sweden",1950-04-30,"United States of America",1948-01-01,1,1,10,10,10,10,1,1
"425",2,"1993",140,1992,140,2,"Q4_2012","USA","USA-AD-613","USA-AD-612","Brazil","BRA","Corrosion-Resistant Carbon Steel Sheet","7/8/92","2/4/93","8/21/92","A","A","2/4/93","AVD","7/9/93","8/18/93","A","N",".",".",".",".",".",".",".",".",10,10,1,8,1,0,0,3.632971264,3.294303936,19.89203737,19.25334456,1,25492.95555,2526.336624,6.54e+12,3.91e+11,9.679935161,10.8682498,1.954274114,7.72,"7/8/92",1992-07-08,1992-07-08,846,1265,1993-02-04,6.88e+12,4.38e+11,9.519240554,10.50327025,19.98633463,19.59931632,26464.78326,2791.518675,1.863028935,7.56,"United States of America",1995-01-01,"Brazil ",1995-01-01,0,0,"Brazil",1948-07-30,"United States of America",1948-01-01,1,1,8,8,10,10,1,1
"426",2,"1993",255,1992,255,2,"Q4_2012","USA","USA-AD-592","USA-AD-588","Germany","DEU","Hot-Rolled Carbon Steel Sheet","7/8/92","2/4/93","8/21/92","A","A","2/4/93","AVD","7/9/93","8/18/93","A","N",".",".",".",".",".",".",".",".",10,10,1,10,1,0,0,3.632971264,1.09321552,19.89203737,48.43423926,1,25492.95555,25604.72543,6.54e+12,2.06e+12,9.679935161,24.01480223,1.954274114,1.10689014,"7/8/92",1992-07-08,1992-07-08,3568,1265,1993-02-04,6.88e+12,2.01e+12,9.519240554,21.99186752,19.98633463,43.81047793,26464.78326,24735.62024,1.863028935,1.044928678,"United States of America",1995-01-01,"Germany ",1995-01-01,0,0,"Germany",1951-10-01,"United States of America",1948-01-01,1,1,10,10,10,10,1,1
"427",2,"1993",210,1993,210,2,"Q4_2012","USA","USA-AD-652","USA-AD-652","Netherlands","NLD","Aramid Fiber","7/12/93","12/16/93","8/25/93","A","A","12/16/93","AVD","5/6/94","6/22/94","A","A","6/24/94","AVD","3/13/01","2001","AVD",".",".",".",10,10,1,10,1,0,0,3.334427515,4.035124582,19.98633463,103.738592,0,26464.78326,21418.40235,6.88e+12,3.27e+11,9.519240554,54.58366091,1.863028935,3.399511869,"7/12/93",1993-07-12,1993-07-12,3903,173,1993-12-16,6.88e+12,3.27e+11,9.519240554,54.58366091,19.98633463,103.738592,26464.78326,21418.40235,1.863028935,3.399511869,"United States of America",1995-01-01,"Netherlands ",1995-01-01,0,0,"Netherlands",1948-01-01,"United States of America",1948-01-01,1,1,10,10,10,10,1,1
"428",2,"1993",740,1992,740,2,"Q4_2012","USA","USA-AD-617","USA-AD-612","Japan","JPN","Corrosion-Resistant Carbon Steel Sheet","7/8/92","2/4/93","8/21/92","A","A","2/4/93","AVD","7/9/93","8/18/93","A","A","8/19/93","AVD","12/15/05","2005","AVD",".",".",".",10,10,1,10,1,1,0,3.632971264,0.514258482,19.89203737,17.41268373,1,25492.95555,31013.64715,6.54e+12,3.85e+12,9.679935161,9.769231822,1.954274114,NA,"7/8/92",1992-07-08,1992-07-08,245,1265,1993-02-04,6.88e+12,4.41e+12,9.519240554,9.057284362,19.98633463,15.92398985,26464.78326,35451.29751,1.863028935,NA,"United States of America",1995-01-01,"Japan ",1995-01-01,0,0,"Japan",1955-09-10,"United States of America",1948-01-01,1,1,10,10,10,10,1,1
"429",2,"1993",20,1992,20,2,"Q4_2012","USA","USA-AD-614","USA-AD-612","Canada","CAN","Corrosion-Resistant Carbon Steel Sheet","7/8/92","2/4/93","8/21/92","A","A","2/4/93","AVD","7/9/93","8/18/93","A","A","8/19/93","AVD","12/15/05","2005","AVD",".",".",".",10,10,1,10,1,0,0,3.632971264,8.349049879,19.89203737,52.91751716,0,25492.95555,20692.72203,6.54e+12,5.9e+11,9.679935161,26.27924387,1.954274114,2.73038752,"7/8/92",1992-07-08,1992-07-08,2851,1265,1993-02-04,6.88e+12,5.75e+11,9.519240554,29.25054578,19.98633463,58.48167391,26464.78326,19936.37706,1.863028935,2.804406436,"United States of America",1995-01-01,"Canada ",1995-01-01,0,0,"Canada",1948-01-01,"United States of America",1948-01-01,1,1,10,10,10,10,1,1
"430",2,"1993",740,1992,740,2,"Q4_2012","USA","USA-AD-594","USA-AD-588","Japan","JPN","Hot-Rolled Carbon Steel Sheet","7/8/92","2/4/93","8/21/92","A","A","2/4/93","AVD","7/9/93","8/18/93","A","N",".",".",".",".",".",".",".",".",10,10,1,10,1,0,0,3.632971264,0.514258482,19.89203737,17.41268373,1,25492.95555,31013.64715,6.54e+12,3.85e+12,9.679935161,9.769231822,1.954274114,NA,"7/8/92",1992-07-08,1992-07-08,245,1265,1993-02-04,6.88e+12,4.41e+12,9.519240554,9.057284362,19.98633463,15.92398985,26464.78326,35451.29751,1.863028935,NA,"United States of America",1995-01-01,"Japan ",1995-01-01,0,0,"Japan",1955-09-10,"United States of America",1948-01-01,1,1,10,10,10,10,1,1
"431",2,"1993",200,1992,200,2,"Q4_2012","USA","USA-AD-587","USA-AD-573","United Kingdom","GBR","Cut-To-Length Carbon Steel Plate","7/8/92","2/4/93","8/21/92","A","A","2/4/93","AVD","7/9/93","8/18/93","A","A","8/19/93","AVD","12/15/05","2005","AVD",".",".",".",10,10,1,10,1,0,0,3.632971264,0.663137794,19.89203737,47.85000825,1,25492.95555,19211.86216,6.54e+12,1.11e+12,9.679935161,23.6597454,1.954274114,1.470180207,"7/8/92",1992-07-08,1992-07-08,588,1265,1993-02-04,6.88e+12,9.97e+11,9.519240554,25.59115713,19.98633463,51.32975562,26464.78326,17270.11564,1.863028935,1.478379721,"United States of America",1995-01-01,"United Kingdom",1995-01-01,0,0,"United Kingdom",1948-01-01,"United States of America",1948-01-01,1,1,10,10,10,10,1,1
"432",2,"1993",710,1993,710,2,"Q4_2012","USA","USA-AD-651","USA-AD-651","China","CHN","Silicon Carbide","6/30/93","12/8/93","8/11/93","A","A","12/8/93","AVD","5/2/94","6/15/94","A","N",".",".",".",".",".",".",".",".",10,10,1,-7,0,0,0,3.334427515,2.016200421,19.98633463,30.15260518,0,26464.78326,373.8002843,6.88e+12,4.41e+11,9.519240554,14.11484239,1.863028935,19.70843305,"6/30/93",1993-06-30,1993-06-30,4676,161,1993-12-08,6.88e+12,4.41e+11,9.519240554,14.11484239,19.98633463,30.15260518,26464.78326,373.8002843,1.863028935,19.70843305,"United States of America",1995-01-01,"China ",2001-12-11,0,0,NA,NA,"United States of America",1948-01-01,1,NA,-7,0,10,10,1,0
"433",2,"1993",20,1992,20,2,"Q4_2012","USA","USA-AD-575","USA-AD-573","Canada","CAN","Cut-To-Length Carbon Steel Plate","7/8/92","2/4/93","8/21/92","A","A","2/4/93","AVD","7/9/93","8/18/93","A","A","8/19/93","AVD","12/10/00","2000","AVD",".",".",".",10,10,1,10,1,0,0,3.632971264,8.349049879,19.89203737,52.91751716,0,25492.95555,20692.72203,6.54e+12,5.9e+11,9.679935161,26.27924387,1.954274114,2.73038752,"7/8/92",1992-07-08,1992-07-08,2851,1265,1993-02-04,6.88e+12,5.75e+11,9.519240554,29.25054578,19.98633463,58.48167391,26464.78326,19936.37706,1.863028935,2.804406436,"United States of America",1995-01-01,"Canada ",1995-01-01,0,0,"Canada",1948-01-01,"United States of America",1948-01-01,1,1,10,10,10,10,1,1
"434",2,"1993",732,1992,732,2,"Q4_2012","USA","USA-AD-618","USA-AD-612","South Korea","KOR","Corrosion-Resistant Carbon Steel Sheet","7/8/92","2/4/93","8/21/92","A","A","2/4/93","AVD","7/9/93","8/18/93","A","A","8/19/93","AVD","IF","IF","AVD",".",".",".",10,10,1,6,1,1,0,3.632971264,1.203577942,19.89203737,50.33609289,1,25492.95555,8140.218706,6.54e+12,3.56e+11,9.679935161,24.63163234,1.954274114,7.105611458,"7/8/92",1992-07-08,1992-07-08,1595,1265,1993-02-04,6.88e+12,3.92e+11,9.519240554,24.50976902,19.98633463,48.65827339,26464.78326,8869.020761,1.863028935,6.352665762,"United States of America",1995-01-01,"South Korea",1995-01-01,0,0,"South Korea",1967-04-14,"United States of America",1948-01-01,1,1,6,7,10,10,1,1
"435",2,"1993",140,1993,140,2,"Q4_2012","USA","USA-AD-636","USA-AD-636","Brazil","BRA","Stainless Steel Wire Rod","1/12/93","8/5/93","2/24/93","A","A","8/5/93","AVD","12/29/93","2/2/94","A","A","1/28/94","AVD","8/2/05","2005","AVD",".",".",".",10,10,1,8,1,0,0,3.334427515,3.059875207,19.98633463,19.59931632,1,26464.78326,2791.518675,6.88e+12,4.38e+11,9.519240554,10.50327025,1.863028935,7.56,"1/12/93",1993-01-12,1993-01-12,102,1453,1993-08-05,6.88e+12,4.38e+11,9.519240554,10.50327025,19.98633463,19.59931632,26464.78326,2791.518675,1.863028935,7.56,"United States of America",1995-01-01,"Brazil ",1995-01-01,0,0,"Brazil",1948-07-30,"United States of America",1948-01-01,1,1,8,8,10,10,1,1
"436",2,"1993",255,1992,255,2,"Q4_2012","USA","USA-AD-616","USA-AD-612","Germany","DEU","Corrosion-Resistant Carbon Steel Sheet","7/8/92","2/4/93","8/21/92","A","A","2/4/93","AVD","7/9/93","8/18/93","A","A","8/19/93","AVD","IF","IF","AVD",".",".",".",10,10,1,10,1,0,0,3.632971264,1.09321552,19.89203737,48.43423926,1,25492.95555,25604.72543,6.54e+12,2.06e+12,9.679935161,24.01480223,1.954274114,1.10689014,"7/8/92",1992-07-08,1992-07-08,3568,1265,1993-02-04,6.88e+12,2.01e+12,9.519240554,21.99186752,19.98633463,43.81047793,26464.78326,24735.62024,1.863028935,1.044928678,"United States of America",1995-01-01,"Germany ",1995-01-01,0,0,"Germany",1951-10-01,"United States of America",1948-01-01,1,1,10,10,10,10,1,1
"437",2,"1993",325,1992,325,2,"Q4_2012","USA","USA-AD-605","USA-AD-597","Italy","ITA","Cold-Rolled Carbon Steel Sheet ","7/8/92","2/4/93","8/21/92","A","A","2/4/93","AVD","7/9/93","8/18/93","A","N",".",".",".",".",".",".",".",".",10,10,1,10,1,0,0,3.632971264,0.640413715,19.89203737,36.36671202,1,25492.95555,22394.75541,6.54e+12,1.27e+12,9.679935161,18.21724309,1.954274114,3.464981864,"7/8/92",1992-07-08,1992-07-08,10,1265,1993-02-04,6.88e+12,1.03e+12,9.519240554,21.2604413,19.98633463,39.33247117,26464.78326,18054.53111,1.863028935,3.32017089,"United States of America",1995-01-01,"Italy ",1995-01-01,0,0,"Italy",1950-05-30,"United States of America",1948-01-01,1,1,10,10,10,10,1,1
"438",2,"1993",710,1993,710,2,"Q4_2012","USA","USA-AD-650","USA-AD-650","China","CHN","Nitromethane","6/18/93","11/8/93","7/21/93","A","A","11/8/93","AVD","3/30/94","5/11/94","A","N",".",".",".",".",".",".",".",".",10,10,1,-7,0,0,0,3.334427515,2.016200421,19.98633463,30.15260518,0,26464.78326,373.8002843,6.88e+12,4.41e+11,9.519240554,14.11484239,1.863028935,19.70843305,"6/18/93",1993-06-18,1993-06-18,4664,149,1993-11-08,6.88e+12,4.41e+11,9.519240554,14.11484239,19.98633463,30.15260518,26464.78326,373.8002843,1.863028935,19.70843305,"United States of America",1995-01-01,"China ",2001-12-11,0,0,NA,NA,"United States of America",1948-01-01,1,NA,-7,0,10,10,1,0
"439",2,"1993",220,1992,220,2,"Q4_2012","USA","USA-AD-615","USA-AD-612","France","FRA","Corrosion-Resistant Carbon Steel Sheet","7/8/92","2/4/93","8/21/92","A","A","2/4/93","AVD","7/9/93","8/18/93","A","A","8/19/93","AVD","12/15/05","2005","AVD",".",".",".",10,10,1,9,1,1,0,3.632971264,1.559256633,19.89203737,43.02263768,1,25492.95555,23330.25778,6.54e+12,1.37e+12,9.679935161,21.80807387,1.954274114,3.061330525,"7/8/92",1992-07-08,1992-07-08,4066,1265,1993-02-04,6.88e+12,1.3e+12,9.519240554,21.19816648,19.98633463,40.77708215,26464.78326,21944.02769,1.863028935,2.723320237,"United States of America",1995-01-01,"France ",1995-01-01,0,0,"France",1948-01-01,"United States of America",1948-01-01,1,1,9,9,10,10,1,1
"440",2,"1993",220,1992,220,2,"Q4_2012","USA","USA-AD-603","USA-AD-597","France","FRA","Cold-Rolled Carbon Steel Sheet ","7/8/92","2/4/93","8/21/92","A","A","2/4/93","AVD","7/9/93","8/18/93","A","N",".",".",".",".",".",".",".",".",10,10,1,9,1,0,0,3.632971264,1.559256633,19.89203737,43.02263768,1,25492.95555,23330.25778,6.54e+12,1.37e+12,9.679935161,21.80807387,1.954274114,3.061330525,"7/8/92",1992-07-08,1992-07-08,4066,1265,1993-02-04,6.88e+12,1.3e+12,9.519240554,21.19816648,19.98633463,40.77708215,26464.78326,21944.02769,1.863028935,2.723320237,"United States of America",1995-01-01,"France ",1995-01-01,0,0,"France",1948-01-01,"United States of America",1948-01-01,1,1,9,9,10,10,1,1
"441",2,"1993",220,1993,220,2,"Q4_2012","USA","USA-AD-645","USA-AD-645","France","FRA","Calcium Aluminate Cement Calcium Aluminate Flux","4/8/93","11/3/93","5/28/93","P","A","11/3/93","AVD","3/25/94","6/15/94","A","P","6/13/94","AVD","4/7/98","1998","AVD",".",".",".",10,10,1,9,1,0,0,3.334427515,1.44494026,19.98633463,40.77708215,1,26464.78326,21944.02769,6.88e+12,1.3e+12,9.519240554,21.19816648,1.863028935,2.723320237,"4/8/93",1993-04-08,1993-04-08,4340,78,1993-11-03,6.88e+12,1.3e+12,9.519240554,21.19816648,19.98633463,40.77708215,26464.78326,21944.02769,1.863028935,2.723320237,"United States of America",1995-01-01,"France ",1995-01-01,0,0,"France",1948-01-01,"United States of America",1948-01-01,1,1,9,9,10,10,1,1
"442",2,"1993",220,1992,220,2,"Q4_2012","USA","USA-AD-591","USA-AD-588","France","FRA","Hot-Rolled Carbon Steel Sheet","7/8/92","2/4/93","8/21/92","A","A","2/4/93","AVD","7/9/93","8/18/93","A","N",".",".",".",".",".",".",".",".",10,10,1,9,1,0,0,3.632971264,1.559256633,19.89203737,43.02263768,1,25492.95555,23330.25778,6.54e+12,1.37e+12,9.679935161,21.80807387,1.954274114,3.061330525,"7/8/92",1992-07-08,1992-07-08,4066,1265,1993-02-04,6.88e+12,1.3e+12,9.519240554,21.19816648,19.98633463,40.77708215,26464.78326,21944.02769,1.863028935,2.723320237,"United States of America",1995-01-01,"France ",1995-01-01,0,0,"France",1948-01-01,"United States of America",1948-01-01,1,1,9,9,10,10,1,1
"443",2,"1993",325,1992,325,2,"Q4_2012","USA","USA-AD-579","USA-AD-573","Italy","ITA","Cut-To-Length Carbon Steel Plate","7/8/92","2/4/93","8/21/92","A","A","2/4/93","AVD","7/9/93","8/18/93","A","N",".",".",".",".",".",".",".",".",10,10,1,10,1,0,0,3.632971264,0.640413715,19.89203737,36.36671202,1,25492.95555,22394.75541,6.54e+12,1.27e+12,9.679935161,18.21724309,1.954274114,3.464981864,"7/8/92",1992-07-08,1992-07-08,10,1265,1993-02-04,6.88e+12,1.03e+12,9.519240554,21.2604413,19.98633463,39.33247117,26464.78326,18054.53111,1.863028935,3.32017089,"United States of America",1995-01-01,"Italy ",1995-01-01,0,0,"Italy",1950-05-30,"United States of America",1948-01-01,1,1,10,10,10,10,1,1
"444",2,"1993",740,1993,740,2,"Q4_2012","USA","USA-AD-648","USA-AD-646","Japan","JPN","Carbon Steel Wire Rod","4/30/93","11/29/93","6/16/93","A","A","11/29/93","AVD","2/9/94","4/6/94","A","N",".",".",".",".",".",".",".",".",10,10,1,10,1,0,0,3.334427515,0.482171364,19.98633463,15.92398985,1,26464.78326,35451.29751,6.88e+12,4.41e+12,9.519240554,9.057284362,1.863028935,NA,"4/30/93",1993-04-30,1993-04-30,541,100,1993-11-29,6.88e+12,4.41e+12,9.519240554,9.057284362,19.98633463,15.92398985,26464.78326,35451.29751,1.863028935,NA,"United States of America",1995-01-01,"Japan ",1995-01-01,0,0,"Japan",1955-09-10,"United States of America",1948-01-01,1,1,10,10,10,10,1,1
"445",2,"1993",140,1993,140,2,"Q4_2012","USA","USA-AD-646","USA-AD-646","Brazil","BRA","Carbon Steel Wire Rod","4/30/93","11/29/93","6/16/93","A","A","11/29/93","AVD","2/9/94","4/6/94","A","N",".",".",".",".",".",".",".",".",10,10,1,8,1,0,0,3.334427515,3.059875207,19.98633463,19.59931632,1,26464.78326,2791.518675,6.88e+12,4.38e+11,9.519240554,10.50327025,1.863028935,7.56,"4/30/93",1993-04-30,1993-04-30,210,100,1993-11-29,6.88e+12,4.38e+11,9.519240554,10.50327025,19.98633463,19.59931632,26464.78326,2791.518675,1.863028935,7.56,"United States of America",1995-01-01,"Brazil ",1995-01-01,0,0,"Brazil",1948-07-30,"United States of America",1948-01-01,1,1,8,8,10,10,1,1
"446",2,"1993",290,1992,290,2,"Q4_2012","USA","USA-AD-583","USA-AD-573","Poland","POL","Cut-To-Length Carbon Steel Plate","7/8/92","2/4/93","8/21/92","A","A","2/4/93","AVD","7/9/93","8/18/93","A","A","8/19/93","AVD","12/15/05","2005","AVD",".",".",".",10,10,1,8,1,0,0,3.632971264,4.071436555,19.89203737,41.93441321,0,25492.95555,2405.792691,6.54e+12,92295029651,9.679935161,21.67083928,1.954274114,8.275546454,"7/8/92",1992-07-08,1992-07-08,564,1265,1993-02-04,6.88e+12,93964209359,9.519240554,20.97393469,19.98633463,41.05223192,26464.78326,2443.07773,1.863028935,8.41132849,"United States of America",1995-01-01,"Poland ",1995-07-01,0,0,"Poland",1967-10-18,"United States of America",1948-01-01,1,1,8,8,10,10,1,1
"447",2,"1993",732,1992,732,2,"Q4_2012","USA","USA-AD-581","USA-AD-573","South Korea","KOR","Cut-To-Length Carbon Steel Plate","7/8/92","2/4/93","8/21/92","A","A","2/4/93","AVD","7/9/93","8/18/93","A","N",".",".",".",".",".",".",".",".",10,10,1,6,1,0,0,3.632971264,1.203577942,19.89203737,50.33609289,1,25492.95555,8140.218706,6.54e+12,3.56e+11,9.679935161,24.63163234,1.954274114,7.105611458,"7/8/92",1992-07-08,1992-07-08,1595,1265,1993-02-04,6.88e+12,3.92e+11,9.519240554,24.50976902,19.98633463,48.65827339,26464.78326,8869.020761,1.863028935,6.352665762,"United States of America",1995-01-01,"South Korea",1995-01-01,0,0,"South Korea",1967-04-14,"United States of America",1948-01-01,1,1,6,7,10,10,1,1
"448",2,"1993",210,1992,210,2,"Q4_2012","USA","USA-AD-608","USA-AD-597","Netherlands","NLD","Cold-Rolled Carbon Steel Sheet ","7/8/92","2/4/93","8/21/92","A","A","2/4/93","AVD","7/9/93","8/18/93","A","A","8/19/93","AVD","12/10/00","2000","AVD",".",".",".",10,10,1,10,1,0,0,3.632971264,4.437926,19.89203737,106.965736,0,25492.95555,22142.4269,6.54e+12,3.36e+11,9.679935161,55.37627796,1.954274114,3.874662389,"7/8/92",1992-07-08,1992-07-08,3534,1265,1993-02-04,6.88e+12,3.27e+11,9.519240554,54.58366091,19.98633463,103.738592,26464.78326,21418.40235,1.863028935,3.399511869,"United States of America",1995-01-01,"Netherlands ",1995-01-01,0,0,"Netherlands",1948-01-01,"United States of America",1948-01-01,1,1,10,10,10,10,1,1
"449",2,"1993",750,1993,750,2,"Q4_2012","USA","USA-AD-639","USA-AD-639","India","IND","Stainless Steel Flanges","1/12/93","8/5/93","2/24/93","A","A","8/5/93","AVD","12/29/93","2/9/94","A","A","2/9/94","AVD","1/31/11","2011","AVD",".",".",".",10,10,1,8,1,0,0,3.334427515,1.971955088,19.98633463,19.31285159,1,26464.78326,308.5347869,6.88e+12,2.84e+11,9.519240554,9.664727766,1.863028935,28.67697144,"1/12/93",1993-01-12,1993-01-12,571,1453,1993-08-05,6.88e+12,2.84e+11,9.519240554,9.664727766,19.98633463,19.31285159,26464.78326,308.5347869,1.863028935,28.67697144,"United States of America",1995-01-01,"India ",1995-01-01,0,0,"India",1948-07-08,"United States of America",1948-01-01,1,1,8,8,10,10,1,1
"450",2,"1993",140,1993,140,2,"Q4_2012","USA","USA-AD-641","USA-AD-641","Brazil","BRA","Ferrosilicon","1/21/93","8/16/93","3/8/93","A","A","8/16/93","AVD","1/6/94","3/3/94","A","A","3/14/94","AVD","9/21/99","1999","AVD",".",".",".",10,10,1,8,1,0,0,3.334427515,3.059875207,19.98633463,19.59931632,1,26464.78326,2791.518675,6.88e+12,4.38e+11,9.519240554,10.50327025,1.863028935,7.56,"1/21/93",1993-01-21,1993-01-21,111,1,1993-08-16,6.88e+12,4.38e+11,9.519240554,10.50327025,19.98633463,19.59931632,26464.78326,2791.518675,1.863028935,7.56,"United States of America",1995-01-01,"Brazil ",1995-01-01,0,0,"Brazil",1948-07-30,"United States of America",1948-01-01,1,1,8,8,10,10,1,1
"451",2,"1993",710,1992,710,2,"Q4_2012","USA","USA-AD-621","USA-AD-621","China","CHN","Iron Waterworks Fittings","7/15/92","2/18/93","9/2/92","A","A","2/18/93","AVD","7/14/93","8/25/93","A","A","9/7/93","AVD","1/24/00","2000","AVD",".",".",".",10,10,1,-7,0,0,0,3.632971264,2.258723573,19.89203737,31.26536344,0,25492.95555,362.8080967,6.54e+12,4.23e+11,9.679935161,16.14456714,1.954274114,21.78990522,"7/15/92",1992-07-15,1992-07-15,4326,1272,1993-02-18,6.88e+12,4.41e+11,9.519240554,14.11484239,19.98633463,30.15260518,26464.78326,373.8002843,1.863028935,19.70843305,"United States of America",1995-01-01,"China ",2001-12-11,0,0,NA,NA,"United States of America",1948-01-01,1,NA,-7,0,10,10,1,0
"452",2,"1993",211,1992,211,2,"Q4_2012","USA","USA-AD-600","USA-AD-597","Belgium","BEL","Cold-Rolled Carbon Steel Sheet ","7/8/92","2/4/93","8/21/92","A","A","2/4/93","AVD","7/9/93","8/18/93","A","N",".",".",".",".",".",".",".",".",10,10,1,10,1,0,0,3.632971264,1.4459639,19.89203737,125.3594646,0,25492.95555,23088.12465,6.54e+12,2.32e+11,9.679935161,63.93825155,1.954274114,NA,"7/8/92",1992-07-08,1992-07-08,123,1265,1993-02-04,6.88e+12,2.22e+11,9.519240554,61.00146421,19.98633463,118.7595232,26464.78326,22012.69312,1.863028935,NA,"United States of America",1995-01-01,"Belgium ",1995-01-01,0,0,"Belgium",1948-01-01,"United States of America",1948-01-01,1,1,10,10,10,10,1,1
"453",2,"1993",211,1992,211,2,"Q4_2012","USA","USA-AD-588","USA-AD-588","Belgium","BEL","Hot-Rolled Carbon Steel Sheet","7/8/92","2/4/93","8/21/92","A","A","2/4/93","AVD","7/9/93","8/18/93","A","N",".",".",".",".",".",".",".",".",10,10,1,10,1,0,0,3.632971264,1.4459639,19.89203737,125.3594646,0,25492.95555,23088.12465,6.54e+12,2.32e+11,9.679935161,63.93825155,1.954274114,NA,"7/8/92",1992-07-08,1992-07-08,123,1265,1993-02-04,6.88e+12,2.22e+11,9.519240554,61.00146421,19.98633463,118.7595232,26464.78326,22012.69312,1.863028935,NA,"United States of America",1995-01-01,"Belgium ",1995-01-01,0,0,"Belgium",1948-01-01,"United States of America",1948-01-01,1,1,10,10,10,10,1,1
"454",2,"1993",160,1992,160,2,"Q4_2012","USA","USA-AD-597","USA-AD-597","Argentina","ARG","Cold-Rolled Carbon Steel Sheet ","7/8/92","2/4/93","8/21/92","A","A","2/4/93","AVD","7/9/93","8/18/93","A","N",".",".",".",".",".",".",".",".",10,10,1,7,1,0,0,3.632971264,2.774877345,19.89203737,14.73098058,0,25492.95555,6824.997085,6.54e+12,2.29e+11,9.679935161,6.598187464,1.954274114,5.9907871,"7/8/92",1992-07-08,1992-07-08,1461,1265,1993-02-04,6.88e+12,2.37e+11,9.519240554,6.909351642,19.98633463,16.2231515,26464.78326,6971.142245,1.863028935,5.492024807,"United States of America",1995-01-01,"Argentina ",1995-01-01,0,0,"Argentina",1967-10-11,"United States of America",1948-01-01,1,1,7,7,10,10,1,1
"455",2,"1993",211,1992,211,2,"Q4_2012","USA","USA-AD-573","USA-AD-573","Belgium","BEL","Cut-To-Length Carbon Steel Plate","7/8/92","2/4/93","8/21/92","A","A","2/4/93","AVD","7/9/93","8/18/93","A","A","8/19/93","AVD","12/15/05","2005","AVD",".",".",".",10,10,1,10,1,0,0,3.632971264,1.4459639,19.89203737,125.3594646,0,25492.95555,23088.12465,6.54e+12,2.32e+11,9.679935161,63.93825155,1.954274114,NA,"7/8/92",1992-07-08,1992-07-08,123,1265,1993-02-04,6.88e+12,2.22e+11,9.519240554,61.00146421,19.98633463,118.7595232,26464.78326,22012.69312,1.863028935,NA,"United States of America",1995-01-01,"Belgium ",1995-01-01,0,0,"Belgium",1948-01-01,"United States of America",1948-01-01,1,1,10,10,10,10,1,1
"456",2,"1993",325,1992,325,2,"Q4_2012","USA","USA-AD-627","USA-AD-627","Italy","ITA","Pads for  Woodwind Instruments","10/29/92","5/25/93","12/16/92","A","A","5/25/93","AVD","8/9/93","9/29/93","A","N",".",".",".",".",".",".",".",".",10,10,1,10,1,0,0,3.632971264,0.640413715,19.89203737,36.36671202,1,25492.95555,22394.75541,6.54e+12,1.27e+12,9.679935161,18.21724309,1.954274114,3.464981864,"10/29/92",1992-10-29,1992-10-29,123,1378,1993-05-25,6.88e+12,1.03e+12,9.519240554,21.2604413,19.98633463,39.33247117,26464.78326,18054.53111,1.863028935,3.32017089,"United States of America",1995-01-01,"Italy ",1995-01-01,0,0,"Italy",1950-05-30,"United States of America",1948-01-01,1,1,10,10,10,10,1,1
"457",2,"1993",900,1992,900,2,"Q4_2012","USA","USA-AD-612","USA-AD-612","Australia","AUS","Corrosion-Resistant Carbon Steel Sheet","7/8/92","2/4/93","8/21/92","A","A","2/4/93","AVD","7/9/93","8/18/93","A","A","8/19/93","AVD","12/15/05","2005","AVD",".",".",".",10,10,1,10,1,0,0,3.632971264,10.27801423,19.89203737,33.12755256,0,25492.95555,18599.00117,6.54e+12,3.25e+11,9.679935161,16.66516979,1.954274114,3.347441719,"7/8/92",1992-07-08,1992-07-08,202,1265,1993-02-04,6.88e+12,3.12e+11,9.519240554,17.54908342,19.98633463,35.47430229,26464.78326,17658.07944,1.863028935,3.546378237,"United States of America",1995-01-01,"Australia ",1995-01-01,0,0,"Australia",1948-01-01,"United States of America",1948-01-01,1,1,10,10,10,10,1,1
"458",2,"1993",20,1993,20,2,"Q4_2012","USA","USA-AD-647","USA-AD-646","Canada","CAN","Carbon Steel Wire Rod","4/30/93","11/29/93","6/16/93","A","A","11/29/93","AVD","5/4/94",".","W","T",".",".",".",".",".",".",".",".",10,10,1,10,1,0,0,3.334427515,8.640054965,19.98633463,58.48167391,0,26464.78326,19936.37706,6.88e+12,5.75e+11,9.519240554,29.25054578,1.863028935,2.804406436,"4/30/93",1993-04-30,1993-04-30,3147,100,1993-11-29,6.88e+12,5.75e+11,9.519240554,29.25054578,19.98633463,58.48167391,26464.78326,19936.37706,1.863028935,2.804406436,"United States of America",1995-01-01,"Canada ",1995-01-01,0,0,"Canada",1948-01-01,"United States of America",1948-01-01,1,1,10,10,10,10,1,1
"459",2,"1993",713,1993,713,2,"Q4_2012","USA","USA-AD-640","USA-AD-639","Taiwan","TWN","Stainless Steel Flanges","1/12/93","8/5/93","2/24/93","A","A","8/5/93","AVD","12/29/93","2/9/94","A","A","2/9/94","AVD","1/31/11","2011","AVD",".",".",".",10,10,1,7,1,0,0,3.334427515,NA,19.98633463,NA,0,26464.78326,NA,6.88e+12,NA,9.519240554,NA,1.863028935,NA,"1/12/93",1993-01-12,1993-01-12,1826,1453,1993-08-05,6.88e+12,NA,9.519240554,NA,19.98633463,NA,26464.78326,NA,1.863028935,NA,"United States of America",1995-01-01,"Taiwan",2002-01-01,0,0,NA,NA,"United States of America",1948-01-01,1,NA,7,7,10,10,1,1
"460",2,"1993",230,1992,230,2,"Q4_2012","USA","USA-AD-585","USA-AD-573","Spain","ESP","Cut-To-Length Carbon Steel Plate","7/8/92","2/4/93","8/21/92","A","A","2/4/93","AVD","7/9/93","8/18/93","A","A","8/19/93","AVD","12/15/05","2005","AVD",".",".",".",10,10,1,10,1,0,0,3.632971264,1.518752895,19.89203737,35.93564151,0,25492.95555,15665.66717,6.54e+12,6.12e+11,9.679935161,16.61606566,1.954274114,NA,"7/8/92",1992-07-08,1992-07-08,3506,1265,1993-02-04,6.88e+12,5.09e+11,9.519240554,18.17767717,19.98633463,36.96103125,26464.78326,12997.17416,1.863028935,NA,"United States of America",1995-01-01,"Spain ",1995-01-01,0,0,"Spain",1963-08-29,"United States of America",1948-01-01,1,1,10,10,10,10,1,1
"461",2,"1993",830,1991,830,2,"Q4_2012","USA","USA-AD-515","USA-AD-515","Singapore","SGP","Portable Typewriters","4/25/91","2/8/93","6/12/91","A","A","2/8/93","AVD","8/16/93","10/18/93","A","A","7/26/93","SA","5/2/94","1994","SA",".",".",".",10,10,1,-2,0,0,0,3.8528227,2.02399843,19.73436994,323.8290365,0,24404.99484,14504.52192,6.17e+12,45473126682,9.635568513,168.5155129,1.894572404,0.261281049,"4/25/91",1991-04-25,1991-04-25,148,825,1993-02-08,6.88e+12,60644916395,9.519240554,161.5409814,19.98633463,313.2037616,26464.78326,18302.37404,1.863028935,0.183065767,"United States of America",1995-01-01,"Singapore ",1995-01-01,0,0,"Singapore",1973-08-20,"United States of America",1948-01-01,1,1,-2,2,10,10,1,0
"462",2,"1993",70,1992,70,2,"Q4_2012","USA","USA-AD-582","USA-AD-573","Mexico","MEX","Cut-To-Length Carbon Steel Plate","7/8/92","2/4/93","8/21/92","A","A","2/4/93","AVD","7/9/93","8/18/93","A","A","8/19/93","AVD","12/15/05","2005","AVD",".",".",".",10,10,1,0,0,0,0,3.632971264,1.357616599,19.89203737,35.50933306,1,25492.95555,4050.999455,6.54e+12,3.64e+11,9.679935161,15.23779325,1.954274114,6.683986175,"7/8/92",1992-07-08,1992-07-08,1315,1265,1993-02-04,6.88e+12,5.04e+11,9.519240554,12.14127553,19.98633463,25.9656455,26464.78326,5498.546395,1.863028935,4.484756544,"United States of America",1995-01-01,"Mexico ",1995-01-01,0,0,"Mexico",1986-08-24,"United States of America",1948-01-01,1,1,0,2,10,10,1,0
"463",2,"1993",710,1992,710,2,"Q4_2012","USA","USA-AD-624","USA-AD-624","China","CHN","Helical Spring Lockwashers","9/16/92","4/30/93","10/29/92","A","A","4/30/93","AVD","9/20/93","10/18/93","A","A","10/19/93","AVD","IF","IF","AVD",".",".",".",10,10,1,-7,0,0,0,3.632971264,2.258723573,19.89203737,31.26536344,0,25492.95555,362.8080967,6.54e+12,4.23e+11,9.679935161,16.14456714,1.954274114,21.78990522,"9/16/92",1992-09-16,1992-09-16,4389,1335,1993-04-30,6.88e+12,4.41e+11,9.519240554,14.11484239,19.98633463,30.15260518,26464.78326,373.8002843,1.863028935,19.70843305,"United States of America",1995-01-01,"China ",2001-12-11,0,0,NA,NA,"United States of America",1948-01-01,1,NA,-7,0,10,10,1,0
"464",2,"1993",220,1993,220,2,"Q4_2012","USA","USA-AD-637","USA-AD-636","France","FRA","Stainless Steel Wire Rod","1/12/93","8/5/93","2/24/93","A","A","8/5/93","AVD","12/29/93","2/2/94","A","A","1/28/94","AVD","8/2/05","2005","AVD",".",".",".",10,10,1,9,1,0,0,3.334427515,1.44494026,19.98633463,40.77708215,1,26464.78326,21944.02769,6.88e+12,1.3e+12,9.519240554,21.19816648,1.863028935,2.723320237,"1/12/93",1993-01-12,1993-01-12,4254,1453,1993-08-05,6.88e+12,1.3e+12,9.519240554,21.19816648,19.98633463,40.77708215,26464.78326,21944.02769,1.863028935,2.723320237,"United States of America",1995-01-01,"France ",1995-01-01,0,0,"France",1948-01-01,"United States of America",1948-01-01,1,1,9,9,10,10,1,1
"465",2,"1993",255,1992,255,2,"Q4_2012","USA","USA-AD-578","USA-AD-573","Germany","DEU","Cut-To-Length Carbon Steel Plate","7/8/92","2/4/93","8/21/92","A","A","2/4/93","AVD","7/9/93","8/18/93","A","A","8/19/93","AVD","12/15/05","2005","AVD",".",".",".",10,10,1,10,1,1,0,3.632971264,1.09321552,19.89203737,48.43423926,1,25492.95555,25604.72543,6.54e+12,2.06e+12,9.679935161,24.01480223,1.954274114,1.10689014,"7/8/92",1992-07-08,1992-07-08,3568,1265,1993-02-04,6.88e+12,2.01e+12,9.519240554,21.99186752,19.98633463,43.81047793,26464.78326,24735.62024,1.863028935,1.044928678,"United States of America",1995-01-01,"Germany ",1995-01-01,0,0,"Germany",1951-10-01,"United States of America",1948-01-01,1,1,10,10,10,10,1,1
"466",2,"1993",70,1992,70,2,"Q4_2012","USA","USA-AD-619","USA-AD-612","Mexico","MEX","Corrosion-Resistant Carbon Steel Sheet","7/8/92","2/4/93","8/21/92","A","A","2/4/93","AVD","7/9/93","8/18/93","A","N",".",".",".",".",".",".",".",".",10,10,1,0,0,0,0,3.632971264,1.357616599,19.89203737,35.50933306,1,25492.95555,4050.999455,6.54e+12,3.64e+11,9.679935161,15.23779325,1.954274114,6.683986175,"7/8/92",1992-07-08,1992-07-08,1315,1265,1993-02-04,6.88e+12,5.04e+11,9.519240554,12.14127553,19.98633463,25.9656455,26464.78326,5498.546395,1.863028935,4.484756544,"United States of America",1995-01-01,"Mexico ",1995-01-01,0,0,"Mexico",1986-08-24,"United States of America",1948-01-01,1,1,0,2,10,10,1,0
"467",2,"1993",20,1992,20,2,"Q4_2012","USA","USA-AD-602","USA-AD-597","Canada","CAN","Cold-Rolled Carbon Steel Sheet ","7/8/92","2/4/93","8/21/92","A","A","2/4/93","AVD","7/9/93","8/18/93","A","N",".",".",".",".",".",".",".",".",10,10,1,10,1,0,0,3.632971264,8.349049879,19.89203737,52.91751716,0,25492.95555,20692.72203,6.54e+12,5.9e+11,9.679935161,26.27924387,1.954274114,2.73038752,"7/8/92",1992-07-08,1992-07-08,2851,1265,1993-02-04,6.88e+12,5.75e+11,9.519240554,29.25054578,19.98633463,58.48167391,26464.78326,19936.37706,1.863028935,2.804406436,"United States of America",1995-01-01,"Canada ",1995-01-01,0,0,"Canada",1948-01-01,"United States of America",1948-01-01,1,1,10,10,10,10,1,1
"468",2,"1993",220,1992,220,2,"Q4_2012","USA","USA-AD-577","USA-AD-573","France","FRA","Cut-To-Length Carbon Steel Plate","7/8/92","2/4/93","8/21/92","A","A","2/4/93","AVD","7/9/93","8/18/93","A","N",".",".",".",".",".",".",".",".",10,10,1,9,1,0,0,3.632971264,1.559256633,19.89203737,43.02263768,1,25492.95555,23330.25778,6.54e+12,1.37e+12,9.679935161,21.80807387,1.954274114,3.061330525,"7/8/92",1992-07-08,1992-07-08,4066,1265,1993-02-04,6.88e+12,1.3e+12,9.519240554,21.19816648,19.98633463,40.77708215,26464.78326,21944.02769,1.863028935,2.723320237,"United States of America",1995-01-01,"France ",1995-01-01,0,0,"France",1948-01-01,"United States of America",1948-01-01,1,1,9,9,10,10,1,1
"469",2,"1993",140,1992,140,2,"Q4_2012","USA","USA-AD-589","USA-AD-588","Brazil","BRA","Hot-Rolled Carbon Steel Sheet","7/8/92","2/4/93","8/21/92","A","A","2/4/93","AVD","7/9/93","8/18/93","A","N",".",".",".",".",".",".",".",".",10,10,1,8,1,0,0,3.632971264,3.294303936,19.89203737,19.25334456,1,25492.95555,2526.336624,6.54e+12,3.91e+11,9.679935161,10.8682498,1.954274114,7.72,"7/8/92",1992-07-08,1992-07-08,846,1265,1993-02-04,6.88e+12,4.38e+11,9.519240554,10.50327025,19.98633463,19.59931632,26464.78326,2791.518675,1.863028935,7.56,"United States of America",1995-01-01,"Brazil ",1995-01-01,0,0,"Brazil",1948-07-30,"United States of America",1948-01-01,1,1,8,8,10,10,1,1
"470",2,"1993",375,1992,375,2,"Q4_2012","USA","USA-AD-576","USA-AD-573","Finland","FIN","Cut-To-Length Carbon Steel Plate","7/8/92","2/4/93","8/21/92","A","A","2/4/93","AVD","7/9/93","8/18/93","A","A","8/19/93","AVD","12/15/05","2005","AVD",".",".",".",10,10,1,10,1,0,0,3.632971264,8.25723354,19.89203737,51.12465814,0,25492.95555,21850.73356,6.54e+12,1.1e+11,9.679935161,25.96894088,1.954274114,5.032850054,"7/8/92",1992-07-08,1992-07-08,3953,1265,1993-02-04,6.88e+12,87346726345,9.519240554,31.81709846,19.98633463,59.0819172,26464.78326,17240.23292,1.863028935,5.140896102,"United States of America",1995-01-01,"Finland ",1995-01-01,0,0,"Finland",1950-05-25,"United States of America",1948-01-01,1,1,10,10,10,10,1,1
"471",2,"1993",305,1992,305,2,"Q4_2012","USA","USA-AD-599","USA-AD-597","Austria","AUT","Cold-Rolled Carbon Steel Sheet ","7/8/92","2/4/93","8/21/92","A","A","2/4/93","AVD","7/9/93","8/18/93","A","N",".",".",".",".",".",".",".",".",10,10,1,10,1,0,0,3.632971264,3.304252763,19.89203737,69.97198402,0,25492.95555,24624.53784,6.54e+12,1.93e+11,9.679935161,34.44228054,1.954274114,2.839532682,"7/8/92",1992-07-08,1992-07-08,2214,1265,1993-02-04,6.88e+12,1.88e+11,9.519240554,32.68525577,19.98633463,65.4594052,26464.78326,23834.107,1.863028935,2.549002882,"United States of America",1995-01-01,"Austria ",1995-01-01,0,0,"Austria",1951-10-19,"United States of America",1948-01-01,1,1,10,10,10,10,1,1
"472",2,"1993",750,1993,750,2,"Q4_2012","USA","USA-AD-638","USA-AD-636","India","IND","Stainless Steel Wire Rod","1/12/93","8/5/93","2/24/93","A","A","8/5/93","AVD","10/20/93","12/1/93","A","A","12/1/93","AVD","IF","IF","AVD",".",".",".",10,10,1,8,1,0,0,3.334427515,1.971955088,19.98633463,19.31285159,1,26464.78326,308.5347869,6.88e+12,2.84e+11,9.519240554,9.664727766,1.863028935,28.67697144,"1/12/93",1993-01-12,1993-01-12,571,1453,1993-08-05,6.88e+12,2.84e+11,9.519240554,9.664727766,19.98633463,19.31285159,26464.78326,308.5347869,1.863028935,28.67697144,"United States of America",1995-01-01,"India ",1995-01-01,0,0,"India",1948-07-08,"United States of America",1948-01-01,1,1,8,8,10,10,1,1
"473",2,"1994",820,1994,820,2,"Q4_2012","USA","USA-AD-691","USA-AD-688","Malaysia","MYS","Certain Carbon Steel Butt-Weld Pipe Fittings","3/10/94","10/4/94","4/20/94","A","A","10/4/94","AVD","2/27/95","4/12/95","A","N",".",".",".",".",".",".",".",".",10,10,1,4,0,0,0,3.489054379,7.159948588,20.99278942,179.9049427,0,27776.4265,3685.993385,7.31e+12,74481194899,9.863587232,89.15077688,1.834777514,13.66103724,"3/10/94",1994-03-10,1994-03-10,4620,414,1994-10-04,7.31e+12,74481194899,9.863587232,89.15077688,20.99278942,179.9049427,27776.4265,3685.993385,1.834777514,13.66103724,"United States of America",1995-01-01,"Malaysia ",1995-01-01,0,0,"Malaysia",1957-10-24,"United States of America",1948-01-01,1,1,4,5,10,10,1,0
"474",2,"1994",211,1994,211,2,"Q4_2012","USA","USA-AD-686","USA-AD-686","Belgium","BEL","Carbon Steel Wire Rod","2/22/94","6/13/94","6/13/94","A","A","6/13/94","AVD",".","7/7/94","T","W",".",".",".",".",".",".",".",".",10,10,1,10,1,0,0,3.489054379,1.477101485,20.99278942,123.3556988,0,27776.4265,23913.88524,7.31e+12,2.42e+11,9.863587232,63.52078996,1.834777514,NA,"2/22/94",1994-02-22,1994-02-22,717,398,1994-06-13,7.31e+12,2.42e+11,9.863587232,63.52078996,20.99278942,123.3556988,27776.4265,23913.88524,1.834777514,NA,"United States of America",1995-01-01,"Belgium ",1995-01-01,0,0,"Belgium",1948-01-01,"United States of America",1948-01-01,1,1,10,10,10,10,1,1
"475",2,"1994",230,1994,230,2,"Q4_2012","USA","USA-AD-682","USA-AD-678","Spain","ESP","Stainless Steel Bar","1/7/94","8/4/94","2/23/94","A","A","8/4/94","AVD","12/28/94","2/17/95","A","A","3/2/95","AVD","IF","IF","AVD","7.74","62.85","G/ADP/N/2/USA",10,10,1,10,1,0,0,3.489054379,1.390785974,20.99278942,41.67473578,0,27776.4265,13097.71145,7.31e+12,5.15e+11,9.863587232,20.84881159,1.834777514,NA,"1/7/94",1994-01-07,1994-01-07,4054,352,1994-08-04,7.31e+12,5.15e+11,9.863587232,20.84881159,20.99278942,41.67473578,27776.4265,13097.71145,1.834777514,NA,"United States of America",1995-01-01,"Spain ",1995-01-01,0,0,"Spain",1963-08-29,"United States of America",1948-01-01,1,1,10,10,10,10,1,1
"476",2,"1994",130,1994,130,2,"Q4_2012","USA","USA-AD-685","USA-AD-684","Ecuador","ECU","Fresh-Cut Roses","2/24/94","9/20/94","4/6/94","A","A","9/20/94","AVD","2/6/95","3/17/95","A","N",".",".",".",".",".",".",".",".",10,10,1,9,1,0,0,3.489054379,2.547257618,20.99278942,43.7777475,0,27776.4265,2050.318154,7.31e+12,22708204405,9.863587232,20.27981807,1.834777514,22.96580361,"2/24/94",1994-02-24,1994-02-24,563,400,1994-09-20,7.31e+12,22708204405,9.863587232,20.27981807,20.99278942,43.7777475,27776.4265,2050.318154,1.834777514,22.96580361,"United States of America",1995-01-01,"Ecuador ",1996-01-21,0,0,NA,NA,"United States of America",1948-01-01,1,NA,9,9,10,10,1,1
"477",2,"1994",325,1994,325,2,"Q4_2012","USA","USA-AD-680","USA-AD-678","Italy","ITA","Stainless Steel Bar","1/7/94","8/4/94","2/23/94","A","A","8/4/94","AVD","12/28/94",".","N","T",".",".",".",".",".",".",".",".",10,10,1,10,1,0,0,3.489054379,0.661122452,20.99278942,42.14061047,1,27776.4265,18631.53091,7.31e+12,1.06e+12,9.863587232,22.79458809,1.834777514,3.314817953,"1/7/94",1994-01-07,1994-01-07,253,352,1994-08-04,7.31e+12,1.06e+12,9.863587232,22.79458809,20.99278942,42.14061047,27776.4265,18631.53091,1.834777514,3.314817953,"United States of America",1995-01-01,"Italy ",1995-01-01,0,0,"Italy",1950-05-30,"United States of America",1948-01-01,1,1,10,10,10,10,1,1
"478",2,"1994",369,1994,369,2,"Q4_2012","USA","USA-AD-698","USA-AD-696a USA-AD-696b","Ukraine","UKR","Pure and Alloy Magnesium","4/12/94","11/7/94","5/26/94","A","A","11/7/94","AVD","3/30/95","5/17/95","A","A","5/12/95","AVD","8/24/99","1999","AVD","79.87","104.27","G/ADP/N/4/USA",10,10,1,7,1,0,0,3.489054379,NA,20.99278942,73.94400155,0,27776.4265,1012.105189,7.31e+12,52549555010,9.863587232,35.38884844,1.834777514,16.24320453,"4/12/94",1994-04-12,1994-04-12,1364,447,1994-11-07,7.31e+12,52549555010,9.863587232,35.38884844,20.99278942,73.94400155,27776.4265,1012.105189,1.834777514,16.24320453,"United States of America",1995-01-01,"Ukraine ",2008-05-16,0,0,NA,NA,"United States of America",1948-01-01,1,NA,7,7,10,10,1,1
"479",2,"1994",710,1994,710,2,"Q4_2012","USA","USA-AD-703","USA-AD-703","China","CHN","Furfuryl Alcohol","6/8/94","12/16/94","7/27/94","A","A","12/16/94","AVD","5/8/95","6/21/95","A","A","6/21/95","AVD","IF","IF","AVD","43.54","50.43","G/ADP/N/4/USA",10,10,1,-7,0,0,0,3.489054379,2.103886805,20.99278942,41.21727895,0,27776.4265,469.2127702,7.31e+12,5.59e+11,9.863587232,21.26642574,1.834777514,19.86124582,"6/8/94",1994-06-08,1994-06-08,5019,504,1994-12-16,7.31e+12,5.59e+11,9.863587232,21.26642574,20.99278942,41.21727895,27776.4265,469.2127702,1.834777514,19.86124582,"United States of America",1995-01-01,"China ",2001-12-11,0,0,NA,NA,"United States of America",1948-01-01,1,NA,-7,0,10,10,1,0
"480",2,"1994",710,1994,710,2,"Q4_2012","USA","USA-AD-718","USA-AD-718","China","CHN","Glycine","7/8/94","11/16/94","8/24/94","A","A","11/16/94","AVD","1/30/95","3/21/95","A","A","3/29/95","AVD","IF","IF","AVD","155.89","155.89","G/ADP/N/4/USA",10,10,1,-7,0,0,0,3.489054379,2.103886805,20.99278942,41.21727895,0,27776.4265,469.2127702,7.31e+12,5.59e+11,9.863587232,21.26642574,1.834777514,19.86124582,"7/8/94",1994-07-08,1994-07-08,5049,534,1994-11-16,7.31e+12,5.59e+11,9.863587232,21.26642574,20.99278942,41.21727895,27776.4265,469.2127702,1.834777514,19.86124582,"United States of America",1995-01-01,"China ",2001-12-11,0,0,NA,NA,"United States of America",1948-01-01,1,NA,-7,0,10,10,1,0
"481",2,"1994",101,1993,101,2,"Q4_2012","USA","USA-AD-668","USA-AD-664","Venezuela","VEN","Phthalic Anhydride","11/1/93","5/27/94","12/16/93","A","A","5/27/94","AVD","8/10/94","9/29/94","A","N",".",".",".",".",".",".",".",".",10,10,1,8,1,0,0,3.334427515,0.194544527,19.98633463,54.13954007,0,26464.78326,2746.069746,6.88e+12,58107555298,9.519240554,26.95834524,1.863028935,5.486261165,"11/1/93",1993-11-01,1993-11-01,62,285,1994-05-27,7.31e+12,56529904239,9.863587232,30.86333043,20.99278942,53.16260012,27776.4265,2613.905373,1.834777514,5.264690033,"United States of America",1995-01-01,"Venezuela",1995-01-01,0,0,"Venezuela",1990-08-31,"United States of America",1948-01-01,1,1,8,8,10,10,1,1
"482",2,"1994",750,1994,750,2,"Q4_2012","USA","USA-AD-679","USA-AD-678","India","IND","Stainless Steel Bar","1/7/94","8/4/94","2/23/94","A","A","8/4/94","AVD","12/28/94","2/17/95","A","A","2/21/95","AVD","IF","IF","AVD","3.87","21.02","G/ADP/N/2/USA",10,10,1,8,1,0,0,3.489054379,1.192329034,20.99278942,19.73210378,1,27776.4265,354.8548761,7.31e+12,3.33e+11,9.863587232,9.717666838,1.834777514,28.27199437,"1/7/94",1994-01-07,1994-01-07,931,352,1994-08-04,7.31e+12,3.33e+11,9.863587232,9.717666838,20.99278942,19.73210378,27776.4265,354.8548761,1.834777514,28.27199437,"United States of America",1995-01-01,"India ",1995-01-01,0,0,"India",1948-07-08,"United States of America",1948-01-01,1,1,8,8,10,10,1,1
"483",2,"1994",210,1993,210,2,"Q4_2012","USA","USA-AD-662","USA-AD-661","Netherlands","NLD","Photo Paper and Chemicals","9/9/93","4/6/94","10/27/93","A","A","4/6/94","AVD",".","8/25/94","OTH","OTH","8/24/94","SA","2/16/00","2000","MI","MI","MI","G/ADP/N/2/USA",10,10,1,10,1,0,0,3.334427515,4.035124582,19.98633463,103.738592,0,26464.78326,21418.40235,6.88e+12,3.27e+11,9.519240554,54.58366091,1.863028935,3.399511869,"9/9/93",1993-09-09,1993-09-09,3962,232,1994-04-06,7.31e+12,3.51e+11,9.863587232,56.7868077,20.99278942,107.9428233,27776.4265,22830.00164,1.834777514,3.443347537,"United States of America",1995-01-01,"Netherlands ",1995-01-01,0,0,"Netherlands",1948-01-01,"United States of America",1948-01-01,1,1,10,10,10,10,1,1
"484",2,"1994",713,1993,713,2,"Q4_2012","USA","USA-AD-658","USA-AD-658","Taiwan","TWN","Stainless Steel Threaded Pipe Fittings","8/6/93","3/8/94","9/23/93","A","A","3/8/94","AVD","7/28/94",".","A","W",".",".",".",".",".",".",".",".",10,10,1,7,1,0,0,3.334427515,NA,19.98633463,NA,0,26464.78326,NA,6.88e+12,NA,9.519240554,NA,1.863028935,NA,"8/6/93",1993-08-06,1993-08-06,2032,198,1994-03-08,7.31e+12,NA,9.863587232,NA,20.99278942,NA,27776.4265,NA,1.834777514,NA,"United States of America",1995-01-01,"Taiwan",2002-01-01,0,0,NA,NA,"United States of America",1948-01-01,1,NA,7,7,10,10,1,1
"485",2,"1994",369,1993,369,2,"Q4_2012","USA","USA-AD-673","USA-AD-671","Ukraine","UKR","Silicomanganese","11/23/93","6/17/94","12/29/93","A","A","6/17/94","AVD","12/6/94","12/21/94","A","A","8/21/01","AVD","IF","IF","AVD","163","163","G/ADP/N/2/USA",10,10,1,5,0,0,0,3.334427515,NA,19.98633463,52.06881956,0,26464.78326,1258.136319,6.88e+12,65648559195,9.519240554,25.87794164,1.863028935,21.66971979,"11/23/93",1993-11-23,1993-11-23,1224,307,1994-06-17,7.31e+12,52549555010,9.863587232,35.38884844,20.99278942,73.94400155,27776.4265,1012.105189,1.834777514,16.24320453,"United States of America",1995-01-01,"Ukraine ",2008-05-16,0,0,NA,NA,"United States of America",1948-01-01,1,NA,7,7,10,10,1,1
"486",2,"1994",220,1994,220,2,"Q4_2012","USA","USA-AD-688","USA-AD-688","France","FRA","Certain Carbon Steel Butt-Weld Pipe Fittings","3/10/94","10/4/94","4/20/94","A","A","10/4/94","AVD","2/27/95","4/12/95","A","N",".",".",".",".",".",".",".",".",10,10,1,9,1,0,0,3.489054379,1.463617764,20.99278942,42.6708679,1,27776.4265,23059.23171,7.31e+12,1.37e+12,9.863587232,22.03317387,1.834777514,2.861302956,"3/10/94",1994-03-10,1994-03-10,4676,414,1994-10-04,7.31e+12,1.37e+12,9.863587232,22.03317387,20.99278942,42.6708679,27776.4265,23059.23171,1.834777514,2.861302956,"United States of America",1995-01-01,"France ",1995-01-01,0,0,"France",1948-01-01,"United States of America",1948-01-01,1,1,9,9,10,10,1,1
"487",2,"1994",740,1994,740,2,"Q4_2012","USA","USA-AD-699","USA-AD-699","Japan","JPN","Stainless Steel Angles","4/14/94","11/10/94","6/2/94","A","A","11/10/94","AVD","3/31/95","5/17/95","A","N",".",".",".",".",".",".",".",".",10,10,1,10,1,0,0,3.489054379,0.517938561,20.99278942,16.01493837,1,27776.4265,38814.89438,7.31e+12,4.85e+12,9.863587232,9.002096649,1.834777514,1.964755818,"4/14/94",1994-04-14,1994-04-14,248,449,1994-11-10,7.31e+12,4.85e+12,9.863587232,9.002096649,20.99278942,16.01493837,27776.4265,38814.89438,1.834777514,1.964755818,"United States of America",1995-01-01,"Japan ",1995-01-01,0,0,"Japan",1955-09-10,"United States of America",1948-01-01,1,1,10,10,10,10,1,1
"488",2,"1994",325,1993,325,2,"Q4_2012","USA","USA-AD-659","USA-AD-659","Italy","ITA","Grain-Oriented Electrical Steel","9/2/93","2/9/94","10/20/93","A","A","2/9/94","AVD","7/1/94","8/17/94","A","A","8/12/94","AVD","3/14/06","2006","AVD","60.79","60.79","G/ADP/N/2/USA",10,10,1,10,1,0,0,3.334427515,0.621896007,19.98633463,39.33247117,1,26464.78326,18054.53111,6.88e+12,1.03e+12,9.519240554,21.2604413,1.863028935,3.32017089,"9/2/93",1993-09-02,1993-09-02,126,225,1994-02-09,7.31e+12,1.06e+12,9.863587232,22.79458809,20.99278942,42.14061047,27776.4265,18631.53091,1.834777514,3.314817953,"United States of America",1995-01-01,"Italy ",1995-01-01,0,0,"Italy",1950-05-30,"United States of America",1948-01-01,1,1,10,10,10,10,1,1
"489",2,"1994",140,1993,140,2,"Q4_2012","USA","USA-AD-671","USA-AD-671","Brazil","BRA","Silicomanganese","11/23/93","6/17/94","12/29/93","A","A","6/17/94","AVD","11/7/94","12/21/94","A","A","12/22/94","AVD","11/7/12","2012","AVD","17.6","64.93","G/ADP/N/2/USA",10,10,1,8,1,0,0,3.334427515,3.059875207,19.98633463,19.59931632,1,26464.78326,2791.518675,6.88e+12,4.38e+11,9.519240554,10.50327025,1.863028935,7.56,"11/23/93",1993-11-23,1993-11-23,417,307,1994-06-17,7.31e+12,5.46e+11,9.863587232,9.513268634,20.99278942,18.67459702,27776.4265,3426.101824,1.834777514,9.850263575,"United States of America",1995-01-01,"Brazil ",1995-01-01,0,0,"Brazil",1948-07-30,"United States of America",1948-01-01,1,1,8,8,10,10,1,1
"490",2,"1994",100,1994,100,2,"Q4_2012","USA","USA-AD-684","USA-AD-684","Colombia","COL","Fresh-Cut Roses","2/24/94","9/20/94","4/6/94","A","A","9/20/94","AVD","2/6/95","3/17/95","A","N",".",".",".",".",".",".",".",".",10,10,1,9,1,0,0,3.489054379,5.828877739,20.99278942,35.91753745,0,27776.4265,2274.885405,7.31e+12,81703496604,9.863587232,14.99836183,1.834777514,16.0759062,"2/24/94",1994-02-24,1994-02-24,1297,400,1994-09-20,7.31e+12,81703496604,9.863587232,14.99836183,20.99278942,35.91753745,27776.4265,2274.885405,1.834777514,16.0759062,"United States of America",1995-01-01,"Colombia ",1995-04-30,0,0,"Colombia",1981-10-03,"United States of America",1948-01-01,1,1,9,9,10,10,1,1
"491",2,"1994",740,1994,740,2,"Q4_2012","USA","USA-AD-681","USA-AD-678","Japan","JPN","Stainless Steel Bar","1/7/94","8/4/94","2/23/94","A","A","8/4/94","AVD","12/28/94","2/17/95","A","A","2/21/95","AVD","IF","IF","AVD","61.47","61.47","G/ADP/N/2/USA",10,10,1,10,1,0,0,3.489054379,0.517938561,20.99278942,16.01493837,1,27776.4265,38814.89438,7.31e+12,4.85e+12,9.863587232,9.002096649,1.834777514,1.964755818,"1/7/94",1994-01-07,1994-01-07,151,352,1994-08-04,7.31e+12,4.85e+12,9.863587232,9.002096649,20.99278942,16.01493837,27776.4265,38814.89438,1.834777514,1.964755818,"United States of America",1995-01-01,"Japan ",1995-01-01,0,0,"Japan",1955-09-10,"United States of America",1948-01-01,1,1,10,10,10,10,1,1
"492",2,"1994",200,1994,200,2,"Q4_2012","USA","USA-AD-694","USA-AD-688","United Kingdom","GBR","Certain Carbon Steel Butt-Weld Pipe Fittings","3/10/94","10/4/94","4/20/94","A","A","10/4/94","AVD","2/27/95","4/12/95","A","N",".",".",".",".",".",".",".",".",10,10,1,10,1,0,0,3.489054379,0.70115628,20.99278942,53.09235912,1,27776.4265,18664.39426,7.31e+12,1.08e+12,9.863587232,26.65288349,1.834777514,1.519478837,"3/10/94",1994-03-10,1994-03-10,1198,414,1994-10-04,7.31e+12,1.08e+12,9.863587232,26.65288349,20.99278942,53.09235912,27776.4265,18664.39426,1.834777514,1.519478837,"United States of America",1995-01-01,"United Kingdom",1995-01-01,0,0,"United Kingdom",1948-01-01,"United States of America",1948-01-01,1,1,10,10,10,10,1,1
"493",2,"1994",710,1993,710,2,"Q4_2012","USA","USA-AD-669","USA-AD-669","China","CHN","Cased Pencils","11/17/93","6/16/94","1/5/94","A","A","6/16/94","AVD","11/8/94","12/21/94","A","A","12/28/94","AVD","IF","IF","AVD","0","44.66","G/ADP/N/2/USA",10,10,1,-7,0,0,0,3.334427515,2.016200421,19.98633463,30.15260518,0,26464.78326,373.8002843,6.88e+12,4.41e+11,9.519240554,14.11484239,1.863028935,19.70843305,"11/17/93",1993-11-17,1993-11-17,4816,301,1994-06-16,7.31e+12,5.59e+11,9.863587232,21.26642574,20.99278942,41.21727895,27776.4265,469.2127702,1.834777514,19.86124582,"United States of America",1995-01-01,"China ",2001-12-11,0,0,NA,NA,"United States of America",1948-01-01,1,NA,-7,0,10,10,1,0
"494",2,"1994",560,1994,560,2,"Q4_2012","USA","USA-AD-704","USA-AD-703","South Africa","ZAF","Furfuryl Alcohol","6/8/94","12/16/94","7/27/94","A","A","12/16/94","AVD","5/8/95","6/21/95","A","A","6/21/95","AVD","7/12/99","1999","AVD","11.55","11.55","G/ADP/N/4/USA",10,10,1,9,1,0,0,3.489054379,3.225830386,20.99278942,41.9623741,0,27776.4265,3546.668962,7.31e+12,1.36e+11,9.863587232,22.10279624,1.834777514,4.601190015,"6/8/94",1994-06-08,1994-06-08,29,504,1994-12-16,7.31e+12,1.36e+11,9.863587232,22.10279624,20.99278942,41.9623741,27776.4265,3546.668962,1.834777514,4.601190015,"United States of America",1995-01-01,"South Africa",1995-01-01,0,0,"South Africa",1948-06-13,"United States of America",1948-01-01,1,1,9,9,10,10,1,1
"495",2,"1994",666,1994,666,2,"Q4_2012","USA","USA-AD-690","USA-AD-688","Israel","ISR","Certain Carbon Steel Butt-Weld Pipe Fittings","3/10/94","10/4/94","4/20/94","A","A","10/4/94","AVD","2/27/95","4/12/95","A","N",".",".",".",".",".",".",".",".",10,10,1,9,1,0,0,3.489054379,1.838915938,20.99278942,80.5811322,0,27776.4265,13830.28675,7.31e+12,74669718187,9.863587232,32.61637269,1.834777514,NA,"3/10/94",1994-03-10,1994-03-10,606,414,1994-10-04,7.31e+12,74669718187,9.863587232,32.61637269,20.99278942,80.5811322,27776.4265,13830.28675,1.834777514,NA,"United States of America",1995-01-01,"Israel ",1995-04-21,0,0,"Israel",1962-07-05,"United States of America",1948-01-01,1,1,9,9,10,10,1,1
"496",2,"1994",750,1994,750,2,"Q4_2012","USA","USA-AD-689","USA-AD-688","India","IND","Certain Carbon Steel Butt-Weld Pipe Fittings","3/10/94","10/4/94","4/20/94","A","A","10/4/94","AVD","2/27/95","4/12/95","A","N",".",".",".",".",".",".",".",".",10,10,1,8,1,0,0,3.489054379,1.192329034,20.99278942,19.73210378,1,27776.4265,354.8548761,7.31e+12,3.33e+11,9.863587232,9.717666838,1.834777514,28.27199437,"3/10/94",1994-03-10,1994-03-10,993,414,1994-10-04,7.31e+12,3.33e+11,9.863587232,9.717666838,20.99278942,19.73210378,27776.4265,354.8548761,1.834777514,28.27199437,"United States of America",1995-01-01,"India ",1995-01-01,0,0,"India",1948-07-08,"United States of America",1948-01-01,1,1,8,8,10,10,1,1
"497",2,"1994",710,1993,710,2,"Q4_2012","USA","USA-AD-663","USA-AD-663","China","CHN","Paper Clips","10/20/93","5/18/94","12/6/93","A","A","5/18/94","AVD","10/7/94","11/25/94","A","A","11/25/94","AVD","IF","IF","AVD","46.01","126.94","G/ADP/N/2/USA",10,10,1,-7,0,0,0,3.334427515,2.016200421,19.98633463,30.15260518,0,26464.78326,373.8002843,6.88e+12,4.41e+11,9.519240554,14.11484239,1.863028935,19.70843305,"10/20/93",1993-10-20,1993-10-20,4788,273,1994-05-18,7.31e+12,5.59e+11,9.863587232,21.26642574,20.99278942,41.21727895,27776.4265,469.2127702,1.834777514,19.86124582,"United States of America",1995-01-01,"China ",2001-12-11,0,0,NA,NA,"United States of America",1948-01-01,1,NA,-7,0,10,10,1,0
"498",2,"1994",365,1994,365,2,"Q4_2012","USA","USA-AD-697b","USA-AD-696b","Russia","RUS","Alloy Magnesium","4/12/94","11/7/94","5/26/94","A","A","11/7/94","AVD","3/30/95","5/17/95","A","N",".","AVD","MI","MI","AVD","MI","MI","MI",10,10,1,3,0,0,0,3.489054379,NA,20.99278942,50.95371265,0,27776.4265,2663.456988,7.31e+12,3.95e+11,9.863587232,27.75837904,1.834777514,6.629480554,"4/12/94",1994-04-12,1994-04-12,965,447,1994-11-07,7.31e+12,3.95e+11,9.863587232,27.75837904,20.99278942,50.95371265,27776.4265,2663.456988,1.834777514,6.629480554,"United States of America",1995-01-01,"Russia",2012-08-22,0,0,NA,NA,"United States of America",1948-01-01,1,NA,3,4,10,10,1,0
"499",2,"1994",710,1994,710,2,"Q4_2012","USA","USA-AD-700","USA-AD-700","China","CHN","Disposable Lighters","5/16/94","12/13/94","6/29/94","A","A","12/13/94","AVD","5/5/95","6/21/95","A","N",".",".",".",".",".",".",".",".",10,10,1,-7,0,0,0,3.489054379,2.103886805,20.99278942,41.21727895,0,27776.4265,469.2127702,7.31e+12,5.59e+11,9.863587232,21.26642574,1.834777514,19.86124582,"5/16/94",1994-05-16,1994-05-16,4996,481,1994-12-13,7.31e+12,5.59e+11,9.863587232,21.26642574,20.99278942,41.21727895,27776.4265,469.2127702,1.834777514,19.86124582,"United States of America",1995-01-01,"China ",2001-12-11,0,0,NA,NA,"United States of America",1948-01-01,1,NA,-7,0,10,10,1,0
"500",2,"1994",710,1993,710,2,"Q4_2012","USA","USA-AD-675","USA-AD-675","China","CHN","Saccharin","11/29/93","6/23/94","1/12/94","A","A","6/23/94","AVD","11/15/94","1/3/95","A","N",".",".",".",".",".",".",".",".",10,10,1,-7,0,0,0,3.334427515,2.016200421,19.98633463,30.15260518,0,26464.78326,373.8002843,6.88e+12,4.41e+11,9.519240554,14.11484239,1.863028935,19.70843305,"11/29/93",1993-11-29,1993-11-29,4828,313,1994-06-23,7.31e+12,5.59e+11,9.863587232,21.26642574,20.99278942,41.21727895,27776.4265,469.2127702,1.834777514,19.86124582,"United States of America",1995-01-01,"China ",2001-12-11,0,0,NA,NA,"United States of America",1948-01-01,1,NA,-7,0,10,10,1,0
"501",2,"1994",140,1994,140,2,"Q4_2012","USA","USA-AD-678","USA-AD-678","Brazil","BRA","Stainless Steel Bar","1/7/94","8/4/94","2/23/94","A","A","8/4/94","AVD","12/28/94","2/17/95","A","A","2/21/95","AVD","IF","IF","AVD","19.43","19.43","G/ADP/N/2/USA",10,10,1,8,1,0,0,3.489054379,3.406037819,20.99278942,18.67459702,1,27776.4265,3426.101824,7.31e+12,5.46e+11,9.863587232,9.513268634,1.834777514,9.850263575,"1/7/94",1994-01-07,1994-01-07,462,352,1994-08-04,7.31e+12,5.46e+11,9.863587232,9.513268634,20.99278942,18.67459702,27776.4265,3426.101824,1.834777514,9.850263575,"United States of America",1995-01-01,"Brazil ",1995-01-01,0,0,"Brazil",1948-07-30,"United States of America",1948-01-01,1,1,8,8,10,10,1,1
"502",2,"1994",710,1994,710,2,"Q4_2012","USA","USA-AD-696a","USA-AD-696a","China","CHN","Pure Magnesium","4/12/94","11/7/94","5/26/94","A","A","11/7/94","AVD","3/30/95","5/17/95","A","A","5/12/95","AVD","IF","IF","AVD","79.38","108.26","G/ADP/N/4/USA",10,10,1,-7,0,0,0,3.489054379,2.103886805,20.99278942,41.21727895,0,27776.4265,469.2127702,7.31e+12,5.59e+11,9.863587232,21.26642574,1.834777514,19.86124582,"4/12/94",1994-04-12,1994-04-12,4962,447,1994-11-07,7.31e+12,5.59e+11,9.863587232,21.26642574,20.99278942,41.21727895,27776.4265,469.2127702,1.834777514,19.86124582,"United States of America",1995-01-01,"China ",2001-12-11,0,0,NA,NA,"United States of America",1948-01-01,1,NA,-7,0,10,10,1,0
"503",2,"1994",101,1993,101,2,"Q4_2012","USA","USA-AD-674","USA-AD-671","Venezuela","VEN","Silicomanganese","11/23/93","6/17/94","12/29/93","A","A","6/17/94","AVD","11/7/94","12/21/94","A","N",".",".",".",".",".",".",".",".",10,10,1,8,1,0,0,3.334427515,0.194544527,19.98633463,54.13954007,0,26464.78326,2746.069746,6.88e+12,58107555298,9.519240554,26.95834524,1.863028935,5.486261165,"11/23/93",1993-11-23,1993-11-23,84,307,1994-06-17,7.31e+12,56529904239,9.863587232,30.86333043,20.99278942,53.16260012,27776.4265,2613.905373,1.834777514,5.264690033,"United States of America",1995-01-01,"Venezuela",1995-01-01,0,0,"Venezuela",1990-08-31,"United States of America",1948-01-01,1,1,8,8,10,10,1,1
"504",2,"1994",710,1994,710,2,"Q4_2012","USA","USA-AD-683","USA-AD-683","China","CHN","Fresh Garlic","1/28/94","7/11/94","3/23/94","A","A","7/11/94","AVD","9/26/94","11/16/94","A","A","11/16/94","AVD","IF","IF","AVD","376.67","376.67","G/ADP/N/2/USA",10,10,1,-7,0,0,0,3.489054379,2.103886805,20.99278942,41.21727895,0,27776.4265,469.2127702,7.31e+12,5.59e+11,9.863587232,21.26642574,1.834777514,19.86124582,"1/28/94",1994-01-28,1994-01-28,4888,373,1994-07-11,7.31e+12,5.59e+11,9.863587232,21.26642574,20.99278942,41.21727895,27776.4265,469.2127702,1.834777514,19.86124582,"United States of America",1995-01-01,"China ",2001-12-11,0,0,NA,NA,"United States of America",1948-01-01,1,NA,-7,0,10,10,1,0
"505",2,"1994",710,1994,710,2,"Q4_2012","USA","USA-AD-677","USA-AD-677","China","CHN","Coumarin","1/7/94","8/4/94","2/23/94","A","A","8/4/94","AVD","12/28/94","2/8/95","A","A","2/9/95","AVD","5/3/04","2004","AVD","15.04","160.8","G/ADP/N/2/USA",10,10,1,-7,0,0,0,3.489054379,2.103886805,20.99278942,41.21727895,0,27776.4265,469.2127702,7.31e+12,5.59e+11,9.863587232,21.26642574,1.834777514,19.86124582,"1/7/94",1994-01-07,1994-01-07,4867,352,1994-08-04,7.31e+12,5.59e+11,9.863587232,21.26642574,20.99278942,41.21727895,27776.4265,469.2127702,1.834777514,19.86124582,"United States of America",1995-01-01,"China ",2001-12-11,0,0,NA,NA,"United States of America",1948-01-01,1,NA,-7,0,10,10,1,0
"506",2,"1994",740,1993,740,2,"Q4_2012","USA","USA-AD-660","USA-AD-659","Japan","JPN","Grain-Oriented Electrical Steel","9/2/93","2/9/94","10/20/93","A","A","2/9/94","AVD","4/25/94","6/2/94","A","A","6/10/94","AVD","3/14/06","2006","AVD","MI","MI","MI",10,10,1,10,1,0,0,3.334427515,0.482171364,19.98633463,15.92398985,1,26464.78326,35451.29751,6.88e+12,4.41e+12,9.519240554,9.057284362,1.863028935,NA,"9/2/93",1993-09-02,1993-09-02,24,225,1994-02-09,7.31e+12,4.85e+12,9.863587232,9.002096649,20.99278942,16.01493837,27776.4265,38814.89438,1.834777514,1.964755818,"United States of America",1995-01-01,"Japan ",1995-01-01,0,0,"Japan",1955-09-10,"United States of America",1948-01-01,1,1,10,10,10,10,1,1
"507",2,"1994",101,1994,101,2,"Q4_2012","USA","USA-AD-695","USA-AD-688","Venezuela","VEN","Carbon Steel Butt-Weld Pipe Fittings","3/10/94","10/4/94","4/20/94","A","A","10/4/94","AVD","2/27/95","4/12/95","A","N",".",".",".",".",".",".",".",".",10,10,1,8,1,0,0,3.489054379,0.227425657,20.99278942,53.16260012,0,27776.4265,2613.905373,7.31e+12,56529904239,9.863587232,30.86333043,1.834777514,5.264690033,"3/10/94",1994-03-10,1994-03-10,36,414,1994-10-04,7.31e+12,56529904239,9.863587232,30.86333043,20.99278942,53.16260012,27776.4265,2613.905373,1.834777514,5.264690033,"United States of America",1995-01-01,"Venezuela",1995-01-01,0,0,"Venezuela",1990-08-31,"United States of America",1948-01-01,1,1,8,8,10,10,1,1
"508",2,"1994",800,1994,800,2,"Q4_2012","USA","USA-AD-701","USA-AD-700","Thailand","THA","Disposable Lighters","5/16/94","10/24/94","6/29/94","A","A","10/24/94","AVD","3/16/95","4/28/95","A","N",".",".",".",".",".",".",".",".",10,10,1,9,1,0,0,3.489054379,4.568071728,20.99278942,82.58653749,0,27776.4265,2467.17802,7.31e+12,1.44e+11,9.863587232,38.87168552,1.834777514,9.088261566,"5/16/94",1994-05-16,1994-05-16,600,481,1994-10-24,7.31e+12,1.44e+11,9.863587232,38.87168552,20.99278942,82.58653749,27776.4265,2467.17802,1.834777514,9.088261566,"United States of America",1995-01-01,"Thailand ",1995-01-01,0,0,"Thailand",1982-11-20,"United States of America",1948-01-01,1,1,9,9,10,10,1,1
"509",2,"1994",732,1994,732,2,"Q4_2012","USA","USA-AD-692","USA-AD-688","South Korea","KOR","Certain Carbon Steel Butt-Weld Pipe Fittings","3/10/94","10/4/94","4/20/94","A","A","10/4/94","AVD","2/27/95","4/12/95","A","N",".",".",".",".",".",".",".",".",10,10,1,6,1,0,0,3.489054379,1.323078828,20.99278942,49.86423672,1,27776.4265,10275.27753,7.31e+12,4.59e+11,9.863587232,24.58952874,1.834777514,6.1667875,"3/10/94",1994-03-10,1994-03-10,378,414,1994-10-04,7.31e+12,4.59e+11,9.863587232,24.58952874,20.99278942,49.86423672,27776.4265,10275.27753,1.834777514,6.1667875,"United States of America",1995-01-01,"South Korea",1995-01-01,0,0,"South Korea",1967-04-14,"United States of America",1948-01-01,1,1,6,7,10,10,1,1
"510",2,"1994",800,1993,800,2,"Q4_2012","USA","USA-AD-670","USA-AD-669","Thailand","THA","Cased Pencils","11/17/93","6/16/94","1/5/94","A","A","6/16/94","AVD","8/31/94","10/19/94","A","N",".",".",".",".",".",".",".",".",10,10,1,9,1,0,0,3.334427515,3.969074063,19.98633463,80.15823028,0,26464.78326,2152.772968,6.88e+12,1.25e+11,9.519240554,37.95958114,1.863028935,8.658570961,"11/17/93",1993-11-17,1993-11-17,420,301,1994-06-16,7.31e+12,1.44e+11,9.863587232,38.87168552,20.99278942,82.58653749,27776.4265,2467.17802,1.834777514,9.088261566,"United States of America",1995-01-01,"Thailand ",1995-01-01,0,0,"Thailand",1982-11-20,"United States of America",1948-01-01,1,1,9,9,10,10,1,1
"511",2,"1994",710,1993,710,2,"Q4_2012","USA","USA-AD-672","USA-AD-671","China","CHN","Silicomanganese","11/23/93","6/17/94","12/29/93","A","A","6/17/94","AVD","11/7/94","12/21/94","A","A","12/22/94","AVD","IF","IF","AVD","150","150","G/ADP/N/2/USA",10,10,1,-7,0,0,0,3.334427515,2.016200421,19.98633463,30.15260518,0,26464.78326,373.8002843,6.88e+12,4.41e+11,9.519240554,14.11484239,1.863028935,19.70843305,"11/23/93",1993-11-23,1993-11-23,4822,307,1994-06-17,7.31e+12,5.59e+11,9.863587232,21.26642574,20.99278942,41.21727895,27776.4265,469.2127702,1.834777514,19.86124582,"United States of America",1995-01-01,"China ",2001-12-11,0,0,NA,NA,"United States of America",1948-01-01,1,NA,-7,0,10,10,1,0
"512",2,"1994",710,1994,710,2,"Q4_2012","USA","USA-AD-696b","USA-AD-696b","China","CHN","Alloy Magnesium","4/12/94","11/7/94","5/26/94","A","A","11/7/94","AVD","3/30/95","5/17/95","A","N",".",".",".",".",".",".",".",".",10,10,1,-7,0,0,0,3.489054379,2.103886805,20.99278942,41.21727895,0,27776.4265,469.2127702,7.31e+12,5.59e+11,9.863587232,21.26642574,1.834777514,19.86124582,"4/12/94",1994-04-12,1994-04-12,4962,447,1994-11-07,7.31e+12,5.59e+11,9.863587232,21.26642574,20.99278942,41.21727895,27776.4265,469.2127702,1.834777514,19.86124582,"United States of America",1995-01-01,"China ",2001-12-11,0,0,NA,NA,"United States of America",1948-01-01,1,NA,-7,0,10,10,1,0
"513",2,"1994",710,1993,710,2,"Q4_2012","USA","USA-AD-653","USA-AD-653","China","CHN","Sebacic Acid","7/26/93","1/5/94","9/9/93","A","A","1/5/94","AVD","5/31/94","7/13/94","A","A","7/14/94","AVD","6/2/05","2005","AVD",".",".",".",10,10,1,-7,0,0,0,3.334427515,2.016200421,19.98633463,30.15260518,0,26464.78326,373.8002843,6.88e+12,4.41e+11,9.519240554,14.11484239,1.863028935,19.70843305,"7/26/93",1993-07-26,1993-07-26,4702,187,1994-01-05,7.31e+12,5.59e+11,9.863587232,21.26642574,20.99278942,41.21727895,27776.4265,469.2127702,1.834777514,19.86124582,"United States of America",1995-01-01,"China ",2001-12-11,0,0,NA,NA,"United States of America",1948-01-01,1,NA,-7,0,10,10,1,0
"514",2,"1994",365,1994,365,2,"Q4_2012","USA","USA-AD-697a","USA-AD-696a","Russia","RUS","Pure Magnesium","4/12/94","11/7/94","5/26/94","A","A","11/7/94","AVD","3/30/95","5/17/95","A","A","5/12/95","AVD","7/7/00","2000","AVD","0","100.25","G/ADP/N/4/USA",10,10,1,3,0,0,0,3.489054379,NA,20.99278942,50.95371265,0,27776.4265,2663.456988,7.31e+12,3.95e+11,9.863587232,27.75837904,1.834777514,6.629480554,"4/12/94",1994-04-12,1994-04-12,965,447,1994-11-07,7.31e+12,3.95e+11,9.863587232,27.75837904,20.99278942,50.95371265,27776.4265,2663.456988,1.834777514,6.629480554,"United States of America",1995-01-01,"Russia",2012-08-22,0,0,NA,NA,"United States of America",1948-01-01,1,NA,3,4,10,10,1,0
"515",2,"1994",740,1993,740,2,"Q4_2012","USA","USA-AD-661","USA-AD-661","Japan","JPN","Photo Paper and Chemicals","9/9/93","4/6/94","10/27/93","A","A","4/6/94","AVD",".","8/25/94","OTH","OTH","8/24/94","SA","2/16/00","2000","MI","MI","MI","G/ADP/N/2/USA",10,10,1,10,1,0,0,3.334427515,0.482171364,19.98633463,15.92398985,1,26464.78326,35451.29751,6.88e+12,4.41e+12,9.519240554,9.057284362,1.863028935,NA,"9/9/93",1993-09-09,1993-09-09,31,232,1994-04-06,7.31e+12,4.85e+12,9.863587232,9.002096649,20.99278942,16.01493837,27776.4265,38814.89438,1.834777514,1.964755818,"United States of America",1995-01-01,"Japan ",1995-01-01,0,0,"Japan",1955-09-10,"United States of America",1948-01-01,1,1,10,10,10,10,1,1
"516",2,"1995",560,1995,560,2,"Q4_2012","USA","USA-AD-733","USA-AD-733","South Africa","ZAF","Circular-Welded Non-Alloy Steel Pipe","5/3/95","11/30/95","6/28/95","A","A","11/30/95","AVD","5/14/96","7/8/96","A","N",".",".",".",".",".",".",".",".",10,10,1,9,1,0,1,3.862870077,3.994782614,22.38256785,44.86571607,0,28781.94969,3862.808993,7.66e+12,1.51e+11,10.60542797,22.772486,1.607811468,3.860666569,"5/3/95",1995-05-03,1995-05-03,358,833,1995-11-30,7.66e+12,1.51e+11,10.60542797,22.772486,22.38256785,44.86571607,28781.94969,3862.808993,1.607811468,3.860666569,"United States of America",1995-01-01,"South Africa",1995-01-01,1,1,"South Africa",1948-06-13,"United States of America",1948-01-01,1,1,9,9,10,10,1,1
"517",2,"1995",365,1994,365,2,"Q4_2012","USA","USA-AD-702","USA-AD-702","Russia","RUS","Ferrovanadium and Nitrided Vanadium","6/8/94","1/4/95","7/27/94","A","A","1/4/95","AVD","5/26/95","7/12/95","A","A","7/10/95","AVD","9/6/12","2012","AVD","3.75","108","G/ADP/N/4/USA",10,10,1,3,0,0,0,3.489054379,NA,20.99278942,50.95371265,0,27776.4265,2663.456988,7.31e+12,3.95e+11,9.863587232,27.75837904,1.834777514,6.629480554,"6/8/94",1994-06-08,1994-06-08,1022,504,1995-01-04,7.66e+12,3.96e+11,10.60542797,29.28946447,22.38256785,55.18375919,28781.94969,2669.946123,1.607811468,7.160512321,"United States of America",1995-01-01,"Russia",2012-08-22,0,1,NA,NA,"United States of America",1948-01-01,1,NA,3,4,10,10,1,0
"518",2,"1995",710,1995,710,2,"Q4_2012","USA","USA-AD-726","USA-AD-726","China","CHN","Polyvinyl Alcohol ","3/17/95","10/10/95","5/3/95","A","A","10/10/95","AVD","3/29/96","5/15/96","A","A","5/14/96","AVD","5/3/01","2001","AVD","0","116.75","G/ADP/N/16/USA",10,10,1,-7,0,0,1,3.862870077,1.692047147,22.38256785,38.80756282,0,28781.94969,604.2283509,7.66e+12,7.28e+11,10.60542797,20.22506406,1.607811468,19.96227499,"3/17/95",1995-03-17,1995-03-17,5301,786,1995-10-10,7.66e+12,7.28e+11,10.60542797,20.22506406,22.38256785,38.80756282,28781.94969,604.2283509,1.607811468,19.96227499,"United States of America",1995-01-01,"China ",2001-12-11,0,1,NA,NA,"United States of America",1948-01-01,1,NA,-7,0,10,10,1,0
"519",2,"1995",732,1994,732,2,"Q4_2012","USA","USA-AD-715","USA-AD-711","South Korea","KOR","Oil Country Tubular Goods","7/7/94","2/2/95","8/24/94","A","A","2/2/95","AVD","6/28/95","8/10/95","A","P","8/11/95","AVD","7/25/06","2006","AVD","0","12.17","G/ADP/N/4/USA",10,10,1,6,1,0,0,3.489054379,1.323078828,20.99278942,49.86423672,1,27776.4265,10275.27753,7.31e+12,4.59e+11,9.863587232,24.58952874,1.834777514,6.1667875,"7/7/94",1994-07-07,1994-07-07,497,533,1995-02-02,7.66e+12,5.59e+11,10.60542797,26.65268255,22.38256785,54.3156478,28781.94969,12403.91322,1.607811468,5.821741134,"United States of America",1995-01-01,"South Korea",1995-01-01,1,1,"South Korea",1967-04-14,"United States of America",1948-01-01,1,1,6,7,10,10,1,1
"520",2,"1995",740,1995,740,2,"Q4_2012","USA","USA-AD-727","USA-AD-726","Japan","JPN","Polyvinyl Alcohol ","3/17/95","10/10/95","5/3/95","A","A","10/10/95","AVD","3/29/96","5/15/96","A","A","5/14/96","AVD","5/3/01","2001","AVD","77.49","77.49","G/ADP/N/16/USA",10,10,1,10,1,0,1,3.862870077,0.56039245,22.38256785,16.74969987,1,28781.94969,42522.06659,7.66e+12,5.33e+12,10.60542797,9.052576315,1.607811468,1.731472651,"3/17/95",1995-03-17,1995-03-17,261,786,1995-10-10,7.66e+12,5.33e+12,10.60542797,9.052576315,22.38256785,16.74969987,28781.94969,42522.06659,1.607811468,1.731472651,"United States of America",1995-01-01,"Japan ",1995-01-01,1,1,"Japan",1955-09-10,"United States of America",1948-01-01,1,1,10,10,10,10,1,1
"521",2,"1995",325,1994,325,2,"Q4_2012","USA","USA-AD-713","USA-AD-711","Italy","ITA","Oil Country Tubular Goods","7/7/94","2/2/95","8/24/94","A","A","2/2/95","AVD","6/28/95","8/10/95","A","P","8/11/95","AVD","7/25/06","2006","AVD","49.78","49.78","G/ADP/N/4/USA",10,10,1,10,1,0,0,3.489054379,0.661122452,20.99278942,42.14061047,1,27776.4265,18631.53091,7.31e+12,1.06e+12,9.863587232,22.79458809,1.834777514,3.314817953,"7/7/94",1994-07-07,1994-07-07,57,533,1995-02-02,7.66e+12,1.13e+12,10.60542797,25.71427747,22.38256785,47.58799564,28781.94969,19910.00067,1.607811468,3.317877129,"United States of America",1995-01-01,"Italy ",1995-01-01,1,1,"Italy",1950-05-30,"United States of America",1948-01-01,1,1,10,10,10,10,1,1
"522",2,"1995",800,1994,800,2,"Q4_2012","USA","USA-AD-706","USA-AD-706","Thailand","THA","Canned Pineapple","6/16/94","1/11/95","8/3/94","A","A","1/11/95","AVD","6/5/95","7/19/95","A","A","7/18/95","AVD","10/31/07","2007","AVD","2.36","55.77","G/ADP/N/4/USA",10,10,1,9,1,0,0,3.489054379,4.568071728,20.99278942,82.58653749,0,27776.4265,2467.17802,7.31e+12,1.44e+11,9.863587232,38.87168552,1.834777514,9.088261566,"6/16/94",1994-06-16,1994-06-16,631,512,1995-01-11,7.66e+12,1.68e+11,10.60542797,41.84389244,22.38256785,90.42944165,28781.94969,2848.546866,1.607811468,9.505705883,"United States of America",1995-01-01,"Thailand ",1995-01-01,1,1,"Thailand",1982-11-20,"United States of America",1948-01-01,1,1,9,9,10,10,1,1
"523",2,"1995",360,1995,360,2,"Q4_2012","USA","USA-AD-732","USA-AD-732","Romania","ROU","Circular-Welded Non-Alloy Steel Pipe","5/3/95","11/30/95","6/28/95","A","A","11/30/95","AVD","5/14/96","7/8/96","A","N",".",".",".",".",".",".",".",".",10,10,1,5,0,0,1,3.862870077,3.322267696,22.38256785,60.82927135,0,28781.94969,1563.949628,7.66e+12,35477055619,10.60542797,27.61649809,1.607811468,21.42585789,"5/3/95",1995-05-03,1995-05-03,910,833,1995-11-30,7.66e+12,35477055619,10.60542797,27.61649809,22.38256785,60.82927135,28781.94969,1563.949628,1.607811468,21.42585789,"United States of America",1995-01-01,"Romania ",1995-01-01,1,1,"Romania",1971-11-14,"United States of America",1948-01-01,1,1,5,5,10,10,1,0
"524",2,"1995",710,1994,710,2,"Q4_2012","USA","USA-AD-724","USA-AD-724","China","CHN","Manganese Metal","11/17/94","6/14/95","1/3/95","A","A","6/14/95","AVD","11/6/95","1/19/96","A","A","2/6/96","AVD","4/2/01","2001","AVD","0.97","143.2","G/ADP/N/16/USA",10,10,1,-7,0,0,0,3.489054379,2.103886805,20.99278942,41.21727895,0,27776.4265,469.2127702,7.31e+12,5.59e+11,9.863587232,21.26642574,1.834777514,19.86124582,"11/17/94",1994-11-17,1994-11-17,5181,666,1995-06-14,7.66e+12,7.28e+11,10.60542797,20.22506406,22.38256785,38.80756282,28781.94969,604.2283509,1.607811468,19.96227499,"United States of America",1995-01-01,"China ",2001-12-11,0,1,NA,NA,"United States of America",1948-01-01,1,NA,-7,0,10,10,1,0
"525",2,"1995",740,1994,740,2,"Q4_2012","USA","USA-AD-714","USA-AD-711","Japan","JPN","Oil Country Tubular Goods","7/7/94","2/2/95","8/24/94","A","A","2/2/95","AVD","6/28/95","8/10/95","A","A","8/11/95","AVD","7/25/06","2006","AVD","44.2","44.2","G/ADP/N/4/USA",10,10,1,10,1,0,0,3.489054379,0.517938561,20.99278942,16.01493837,1,27776.4265,38814.89438,7.31e+12,4.85e+12,9.863587232,9.002096649,1.834777514,1.964755818,"7/7/94",1994-07-07,1994-07-07,8,533,1995-02-02,7.66e+12,5.33e+12,10.60542797,9.052576315,22.38256785,16.74969987,28781.94969,42522.06659,1.607811468,1.731472651,"United States of America",1995-01-01,"Japan ",1995-01-01,1,1,"Japan",1955-09-10,"United States of America",1948-01-01,1,1,10,10,10,10,1,1
"526",2,"1995",305,1994,305,2,"Q4_2012","USA","USA-AD-712","USA-AD-711","Austria","AUT","Oil Country Tubular Goods","7/7/94","2/2/95","8/24/94","A","A","2/2/95","AVD","6/28/95","8/10/95","A","N",".",".",".",".",".",".",".",".",10,10,1,10,1,0,0,3.489054379,3.445773162,20.99278942,68.27044329,0,27776.4265,25383.19881,7.31e+12,2.01e+11,9.863587232,33.40685581,1.834777514,2.740495299,"7/7/94",1994-07-07,1994-07-07,2943,533,1995-02-02,7.66e+12,2.39e+11,10.60542797,34.8348214,22.38256785,70.62069084,28781.94969,30014.27275,1.607811468,2.467560259,"United States of America",1995-01-01,"Austria ",1995-01-01,1,1,"Austria",1951-10-19,"United States of America",1948-01-01,1,1,10,10,10,10,1,1
"527",2,"1995",710,1994,710,2,"Q4_2012","USA","USA-AD-722","USA-AD-722","China","CHN","Honey","10/13/94","3/20/95","11/25/94","A","A","3/20/95","AVD","8/16/95",".","OTH","OTH","8/11/95","SA","8/16/00","2000","SA","MI","MI","MI",10,10,1,-7,0,0,0,3.489054379,2.103886805,20.99278942,41.21727895,0,27776.4265,469.2127702,7.31e+12,5.59e+11,9.863587232,21.26642574,1.834777514,19.86124582,"10/13/94",1994-10-13,1994-10-13,5146,631,1995-03-20,7.66e+12,7.28e+11,10.60542797,20.22506406,22.38256785,38.80756282,28781.94969,604.2283509,1.607811468,19.96227499,"United States of America",1995-01-01,"China ",2001-12-11,0,1,NA,NA,"United States of America",1948-01-01,1,NA,-7,0,10,10,1,0
"528",2,"1995",255,1994,255,2,"Q4_2012","USA","USA-AD-709","USA-AD-707","Germany","DEU","Small Diameter Circular Seamless Carbon and Alloy Steel Standard Line and Pressure Pipe","6/30/94","1/27/95","8/17/94","A","A","1/27/95","AVD","6/19/95","9/13/95","A","A","8/3/95","AVD","IF","IF","AVD","57.72","57.72","G/ADP/N/9/USA",10,10,1,10,1,0,0,3.489054379,1.051335235,20.99278942,45.33497924,1,27776.4265,26375.84573,7.31e+12,2.15e+12,9.863587232,22.83469869,1.834777514,1.06979177,"6/30/94",1994-06-30,1994-06-30,4290,526,1995-01-27,7.66e+12,2.52e+12,10.60542797,23.74087098,22.38256785,46.88720584,28781.94969,30887.86549,1.607811468,1.094530339,"United States of America",1995-01-01,"Germany ",1995-01-01,1,1,"Germany",1951-10-01,"United States of America",1948-01-01,1,1,10,10,10,10,1,1
"529",2,"1995",140,1994,140,2,"Q4_2012","USA","USA-AD-708","USA-AD-707","Brazil","BRA","Small Diameter Circular Seamless Carbon and Alloy Steel Standard Line and Pressure Pipe","6/30/94","1/27/95","8/17/94","A","A","1/27/95","AVD","6/19/95","9/13/95","A","A","8/3/95","AVD","7/16/06","2006","AVD","124.94","124.94","G/ADP/N/9/USA",10,10,1,8,1,0,0,3.489054379,3.406037819,20.99278942,18.67459702,1,27776.4265,3426.101824,7.31e+12,5.46e+11,9.863587232,9.513268634,1.834777514,9.850263575,"6/30/94",1994-06-30,1994-06-30,636,526,1995-01-27,7.66e+12,7.69e+11,10.60542797,7.256806223,22.38256785,16.03180654,28781.94969,4749.814207,1.607811468,5.771250392,"United States of America",1995-01-01,"Brazil ",1995-01-01,1,1,"Brazil",1948-07-30,"United States of America",1948-01-01,1,1,8,8,10,10,1,1
"530",2,"1995",713,1995,713,2,"Q4_2012","USA","USA-AD-729","USA-AD-726","Taiwan","TWN","Polyvinyl Alcohol ","3/17/95","10/10/95","5/3/95","A","A","10/10/95","AVD","3/29/96","5/15/96","A","A","5/14/96","AVD","5/3/01","2001","AVD","19.21","19.21","G/ADP/N/16/USA",10,10,1,7,1,0,1,3.862870077,NA,22.38256785,NA,0,28781.94969,NA,7.66e+12,NA,10.60542797,NA,1.607811468,NA,"3/17/95",1995-03-17,1995-03-17,2620,786,1995-10-10,7.66e+12,NA,10.60542797,NA,22.38256785,NA,28781.94969,NA,1.607811468,NA,"United States of America",1995-01-01,"Taiwan",2002-01-01,0,1,NA,NA,"United States of America",1948-01-01,1,NA,7,7,10,10,1,1
"531",2,"1995",230,1994,230,2,"Q4_2012","USA","USA-AD-717","USA-AD-711","Spain","ESP","Oil Country Tubular Goods","7/7/94","2/2/95","8/24/94","A","A","2/2/95","AVD","6/28/95","8/10/95","A","N",".",".",".",".",".",".",".",".",10,10,1,10,1,0,0,3.489054379,1.390785974,20.99278942,41.67473578,0,27776.4265,13097.71145,7.31e+12,5.15e+11,9.863587232,20.84881159,1.834777514,NA,"7/7/94",1994-07-07,1994-07-07,4235,533,1995-02-02,7.66e+12,5.96e+11,10.60542797,22.40490605,22.38256785,44.80735013,28781.94969,15137.05975,1.607811468,4.318195613,"United States of America",1995-01-01,"Spain ",1995-01-01,1,1,"Spain",1963-08-29,"United States of America",1948-01-01,1,1,10,10,10,10,1,1
"532",2,"1995",710,1994,710,2,"Q4_2012","USA","USA-AD-725","USA-AD-725","China","CHN","Manganese Sulfate","12/8/94","5/16/95","1/25/95","A","A","5/16/95","AVD","10/5/95","11/14/95","A","N",".",".",".",".",".",".",".",".",10,10,1,-7,0,0,0,3.489054379,2.103886805,20.99278942,41.21727895,0,27776.4265,469.2127702,7.31e+12,5.59e+11,9.863587232,21.26642574,1.834777514,19.86124582,"12/8/94",1994-12-08,1994-12-08,5202,687,1995-05-16,7.66e+12,7.28e+11,10.60542797,20.22506406,22.38256785,38.80756282,28781.94969,604.2283509,1.607811468,19.96227499,"United States of America",1995-01-01,"China ",2001-12-11,0,1,NA,NA,"United States of America",1948-01-01,1,NA,-7,0,10,10,1,0
"533",2,"1995",710,1995,710,2,"Q4_2012","USA","USA-AD-731","USA-AD-731","China","CHN","Bicycles","4/12/95","11/9/95","5/30/95","A","A","11/9/95","AVD","4/30/96","6/26/96","A","N",".",".",".",".",".",".",".",".",10,10,1,-7,0,0,1,3.862870077,1.692047147,22.38256785,38.80756282,0,28781.94969,604.2283509,7.66e+12,7.28e+11,10.60542797,20.22506406,1.607811468,19.96227499,"4/12/95",1995-04-12,1995-04-12,5327,812,1995-11-09,7.66e+12,7.28e+11,10.60542797,20.22506406,22.38256785,38.80756282,28781.94969,604.2283509,1.607811468,19.96227499,"United States of America",1995-01-01,"China ",2001-12-11,0,1,NA,NA,"United States of America",1948-01-01,1,NA,-7,0,10,10,1,0
"534",2,"1995",160,1994,160,2,"Q4_2012","USA","USA-AD-707","USA-AD-707","Argentina","ARG","Small Diameter Circular Seamless Carbon and Alloy Steel Standard Line and Pressure Pipe","6/30/94","1/27/95","8/17/94","N","A","1/27/95","AVD","6/19/95","9/13/95","A","A","8/3/95","AVD","7/16/06","2006","AVD","108.13","108.13","G/ADP/N/4/USA",10,10,1,7,1,0,0,3.489054379,3.360702032,20.99278942,14.97014353,0,27776.4265,9065.649524,7.31e+12,3.12e+11,9.863587232,6.21608196,1.834777514,4.662412404,"6/30/94",1994-06-30,1994-06-30,2183,526,1995-01-27,7.66e+12,3.13e+11,10.60542797,7.991430122,22.38256785,16.32174519,28781.94969,8973.321347,1.607811468,4.909063075,"United States of America",1995-01-01,"Argentina ",1995-01-01,1,1,"Argentina",1967-10-11,"United States of America",1948-01-01,1,1,7,7,10,10,1,1
"535",2,"1995",160,1994,160,2,"Q4_2012","USA","USA-AD-711","USA-AD-711","Argentina","ARG","Oil Country Tubular Goods","7/7/94","2/2/95","8/24/94","A","A","2/2/95","AVD","6/28/95","8/10/95","A","A","8/11/95","AVD","7/25/06","2006","AVD","1.36","1.36","G/ADP/N/4/USA",10,10,1,7,1,1,0,3.489054379,3.360702032,20.99278942,14.97014353,0,27776.4265,9065.649524,7.31e+12,3.12e+11,9.863587232,6.21608196,1.834777514,4.662412404,"7/7/94",1994-07-07,1994-07-07,2190,533,1995-02-02,7.66e+12,3.13e+11,10.60542797,7.991430122,22.38256785,16.32174519,28781.94969,8973.321347,1.607811468,4.909063075,"United States of America",1995-01-01,"Argentina ",1995-01-01,1,1,"Argentina",1967-10-11,"United States of America",1948-01-01,1,1,7,7,10,10,1,1
"536",2,"1995",710,1994,710,2,"Q4_2012","USA","USA-AD-723","USA-AD-723","China","CHN","Drawer Slides","11/9/94","6/5/95","12/21/94","A","A","6/5/95","AVD","10/24/95",".","A","W",".",".",".",".",".",".",".",".",10,10,1,-7,0,0,0,3.489054379,2.103886805,20.99278942,41.21727895,0,27776.4265,469.2127702,7.31e+12,5.59e+11,9.863587232,21.26642574,1.834777514,19.86124582,"11/9/94",1994-11-09,1994-11-09,5173,658,1995-06-05,7.66e+12,7.28e+11,10.60542797,20.22506406,22.38256785,38.80756282,28781.94969,604.2283509,1.607811468,19.96227499,"United States of America",1995-01-01,"China ",2001-12-11,0,1,NA,NA,"United States of America",1948-01-01,1,NA,-7,0,10,10,1,0
"537",2,"1996",710,1996,710,2,"Q4_2012","USA","USA-AD-741","USA-AD-741","China","CHN","Melamine Institutional/Non-Institutional Dinnerware","2/14/96","8/22/96","4/4/96","A","A","8/22/96","AVD","1/13/97","2/26/97","A","P","2/25/97","AVD","2/19/02","2002","AVD","0.46","2.74","G/ADP/N/29/USA",10,10,1,-7,0,0,1,3.072677564,1.558517204,22.61178736,38.05745054,0,30068.22721,703.120717,8.1e+12,8.56e+11,10.71084665,20.05374071,1.805715555,19.6910103,"2/14/96",1996-02-14,1996-02-14,5635,1120,1996-08-22,8.1e+12,8.56e+11,10.71084665,20.05374071,22.61178736,38.05745054,30068.22721,703.120717,1.805715555,19.6910103,"United States of America",1995-01-01,"China ",2001-12-11,0,1,NA,NA,"United States of America",1948-01-01,1,NA,-7,0,10,10,1,0
"538",2,"1996",710,1996,710,2,"Q4_2012","USA","USA-AD-744","USA-AD-744","China","CHN","Certain Brake Drums and Rotors","3/15/96","10/10/96","5/9/96","A","A","10/10/96","AVD","2/28/97","4/16/97","A","P","4/17/97","AVD","6/25/08","2008","AVD","8.51","16.07","G/ADP/N/29/USA",10,10,1,-7,0,0,1,3.072677564,1.558517204,22.61178736,38.05745054,0,30068.22721,703.120717,8.1e+12,8.56e+11,10.71084665,20.05374071,1.805715555,19.6910103,"3/15/96",1996-03-15,1996-03-15,5665,1150,1996-10-10,8.1e+12,8.56e+11,10.71084665,20.05374071,22.61178736,38.05745054,30068.22721,703.120717,1.805715555,19.6910103,"United States of America",1995-01-01,"China ",2001-12-11,0,1,NA,NA,"United States of America",1948-01-01,1,NA,-7,0,10,10,1,0
"539",2,"1996",200,1995,200,2,"Q4_2012","USA","USA-AD-738","USA-AD-738","United Kingdom","GBR","Foam Extruded Pvc","9/18/95","5/13/96","11/8/95","A","A","5/13/96","AVD","10/2/96",".","A","W",".","AVD","10/9/96","1996","AVD","MI","MI","MI",10,10,1,10,1,0,1,3.862870077,0.738148648,22.38256785,56.27960438,1,28781.94969,20349.95874,7.66e+12,1.18e+12,10.60542797,28.41860465,1.607811468,1.569365601,"9/18/95",1995-09-18,1995-09-18,1755,971,1996-05-13,8.1e+12,1.24e+12,10.71084665,29.16154741,22.61178736,57.88001216,30068.22721,21349.43492,1.805715555,1.363270277,"United States of America",1995-01-01,"United Kingdom",1995-01-01,1,1,"United Kingdom",1948-01-01,"United States of America",1948-01-01,1,1,10,10,10,10,1,1
"540",2,"1996",70,1996,70,2,"Q4_2012","USA","USA-AD-747","USA-AD-747","Mexico","MEX","Fresh Tomatoes","4/5/96","11/1/96","6/6/96","OTH","A","11/1/96",".",".",".",".",".",".",".","IF","IF","MI","MI","MI","G/ADP/N/22/USA",10,10,1,4,0,1,1,3.072677564,1.164146926,22.61178736,50.72412577,1,30068.22721,4088.455459,8.1e+12,3.97e+11,10.71084665,26.72858685,1.805715555,4.719838656,"4/5/96",1996-04-05,1996-04-05,491,1171,1996-11-01,8.1e+12,3.97e+11,10.71084665,26.72858685,22.61178736,50.72412577,30068.22721,4088.455459,1.805715555,4.719838656,"United States of America",1995-01-01,"Mexico ",1995-01-01,1,1,"Mexico",1986-08-24,"United States of America",1948-01-01,1,1,4,4,10,10,1,0
"541",2,"1996",713,1996,713,2,"Q4_2012","USA","USA-AD-743","USA-AD-741","Taiwan","TWN","Melamine Institutional/Non-Institutional Dinnerware","2/14/96","8/22/96","4/4/96","A","A","8/22/96","AVD","1/13/97","2/26/97","A","P","2/25/97","AVD","2/19/02","2002","AVD","0","53.13","G/ADP/N/29/USA",10,10,1,8,1,0,1,3.072677564,NA,22.61178736,NA,0,30068.22721,NA,8.1e+12,NA,10.71084665,NA,1.805715555,NA,"2/14/96",1996-02-14,1996-02-14,2954,1120,1996-08-22,8.1e+12,NA,10.71084665,NA,22.61178736,NA,30068.22721,NA,1.805715555,NA,"United States of America",1995-01-01,"Taiwan",2002-01-01,0,1,NA,NA,"United States of America",1948-01-01,1,NA,8,8,10,10,1,1
"542",2,"1996",255,1995,255,2,"Q4_2012","USA","USA-AD-736","USA-AD-736","Germany","DEU","Large Newspaper Printing Presses and Components","7/10/95","3/1/96","8/23/95","A","A","3/1/96","AVD","7/23/96","9/5/96","A","A","9/4/96","AVD","2/25/02","2002","AVD","30.72","46.4","G/ADP/N/22/USA",10,10,1,10,1,0,1,3.862870077,1.111538494,22.38256785,46.88720584,1,28781.94969,30887.86549,7.66e+12,2.52e+12,10.60542797,23.74087098,1.607811468,1.094530339,"7/10/95",1995-07-10,1995-07-10,4665,901,1996-03-01,8.1e+12,2.44e+12,10.71084665,24.80373333,22.61178736,48.64693333,30068.22721,29749.97126,1.805715555,1.142644996,"United States of America",1995-01-01,"Germany ",1995-01-01,1,1,"Germany",1951-10-01,"United States of America",1948-01-01,1,1,10,10,10,10,1,1
"543",2,"1996",640,1995,640,2,"Q4_2012","USA","USA-AD-735","USA-AD-734","Turkey","TUR","Pasta","5/19/95","1/19/96","7/10/95","A","A","1/19/96","AVD","6/14/96","7/24/96","A","A","7/24/96","AVD","IF","IF","AVD","51.49","62.29","G/ADP/N/22/USA",10,10,1,8,1,0,1,3.862870077,1.453528982,22.38256785,44.24263475,0,28781.94969,2896.090604,7.66e+12,1.69e+11,10.60542797,19.8916075,1.607811468,16.28944767,"5/19/95",1995-05-19,1995-05-19,693,849,1996-01-19,8.1e+12,1.81e+11,10.71084665,21.54265814,22.61178736,49.36931489,30068.22721,3052.959569,1.805715555,17.39455624,"United States of America",1995-01-01,"Turkey ",1995-03-26,1,1,"Turkey",1951-10-17,"United States of America",1948-01-01,1,1,8,9,10,10,1,1
"544",2,"1996",740,1995,740,2,"Q4_2012","USA","USA-AD-739","USA-AD-739","Japan","JPN","Clad Steel Plate","10/10/95","2/28/96","12/6/95","A","A","2/28/96","AVD","5/9/96","7/3/96","A","A","7/2/96","AVD","IF","IF","AVD","118.53","118.53","G/ADP/N/16/USA",10,10,1,10,1,0,1,3.862870077,0.56039245,22.38256785,16.74969987,1,28781.94969,42522.06659,7.66e+12,5.33e+12,10.60542797,9.052576315,1.607811468,1.731472651,"10/10/95",1995-10-10,1995-10-10,468,993,1996-02-28,8.1e+12,4.71e+12,10.71084665,9.700512643,22.61178736,18.93944307,30068.22721,37421.67386,1.805715555,1.750899223,"United States of America",1995-01-01,"Japan ",1995-01-01,1,1,"Japan",1955-09-10,"United States of America",1948-01-01,1,1,10,10,10,10,1,1
"545",2,"1996",705,1996,705,2,"Q4_2012","USA","USA-AD-746","USA-AD-746","Kazakhstan","KAZ","Beryllium and High-Beryllium Alloys","3/26/96","8/28/96","5/15/96","A","A","8/28/96","AVD","1/17/97","3/5/97","A","N",".",".",".",".",".",".",".",".",10,10,1,-4,0,0,1,3.072677564,3.150189024,22.61178736,71.27357329,0,30068.22721,1350.333866,8.1e+12,21035357833,10.71084665,35.26880493,1.805715555,12.7881388,"3/26/96",1996-03-26,1996-03-26,2163,1161,1996-08-28,8.1e+12,21035357833,10.71084665,35.26880493,22.61178736,71.27357329,30068.22721,1350.333866,1.805715555,12.7881388,"United States of America",1995-01-01,NA,NA,NA,1,NA,NA,"United States of America",1948-01-01,1,NA,-4,1,10,10,1,0
"546",2,"1996",710,1996,710,2,"Q4_2012","USA","USA-AD-749","USA-AD-749","China","CHN","Persulfates","7/17/96","12/27/96","9/5/96","A","A","12/27/96","AVD","5/19/97","7/1/97","A","A","7/7/97","AVD","IF","IF","AVD","32.22","34.97","G/ADP/N/35/USA",10,10,1,-7,0,0,1,3.072677564,1.558517204,22.61178736,38.05745054,0,30068.22721,703.120717,8.1e+12,8.56e+11,10.71084665,20.05374071,1.805715555,19.6910103,"7/17/96",1996-07-17,1996-07-17,5789,1274,1996-12-27,8.1e+12,8.56e+11,10.71084665,20.05374071,22.61178736,38.05745054,30068.22721,703.120717,1.805715555,19.6910103,"United States of America",1995-01-01,"China ",2001-12-11,0,1,NA,NA,"United States of America",1948-01-01,1,NA,-7,0,10,10,1,0
"547",2,"1996",740,1996,740,2,"Q4_2012","USA","USA-AD-740","USA-AD-740","Japan","JPN","Sodium Azide","1/23/96","8/16/96","4/14/96","A","A","8/16/96","AVD",".","1/15/97","OTH","OTH","1/7/97","SA","1/11/02","2002","SA","MI","MI","MI",10,10,1,10,1,0,1,3.072677564,0.568945689,22.61178736,18.93944307,1,30068.22721,37421.67386,8.1e+12,4.71e+12,10.71084665,9.700512643,1.805715555,1.750899223,"1/23/96",1996-01-23,1996-01-23,12,1098,1996-08-16,8.1e+12,4.71e+12,10.71084665,9.700512643,22.61178736,18.93944307,30068.22721,37421.67386,1.805715555,1.750899223,"United States of America",1995-01-01,"Japan ",1995-01-01,1,1,"Japan",1955-09-10,"United States of America",1948-01-01,1,1,10,10,10,10,1,1
"548",2,"1996",850,1996,850,2,"Q4_2012","USA","USA-AD-742","USA-AD-741","Indonesia","IDN","Melamine Institutional/Non-Institutional Dinnerware","2/14/96","8/22/96","4/4/96","A","A","8/22/96","AVD","1/13/97","2/26/97","A","P","2/25/97","AVD","2/19/02","2002","AVD","8.95","12.9","G/ADP/N/29/USA",10,10,1,-7,0,0,1,3.072677564,5.83042185,22.61178736,52.26474368,0,30068.22721,1153.587564,8.1e+12,2.27e+11,10.71084665,25.82455238,1.805715555,16.67238699,"2/14/96",1996-02-14,1996-02-14,10931,1120,1996-08-22,8.1e+12,2.27e+11,10.71084665,25.82455238,22.61178736,52.26474368,30068.22721,1153.587564,1.805715555,16.67238699,"United States of America",1995-01-01,"Indonesia ",1995-01-01,1,1,"Indonesia",1950-02-24,"United States of America",1948-01-01,1,1,-7,0,10,10,1,0
"549",2,"1996",740,1995,740,2,"Q4_2012","USA","USA-AD-737","USA-AD-736","Japan","JPN","Large Newspaper Printing Presses and Components","7/10/95","3/1/96","8/23/95","A","A","3/1/96","AVD","7/23/96","9/5/96","A","A","9/4/96","AVD","2/25/02","2002","AVD","56.28","62.96","G/ADP/N/22/USA",10,10,1,10,1,0,1,3.862870077,0.56039245,22.38256785,16.74969987,1,28781.94969,42522.06659,7.66e+12,5.33e+12,10.60542797,9.052576315,1.607811468,1.731472651,"7/10/95",1995-07-10,1995-07-10,376,901,1996-03-01,8.1e+12,4.71e+12,10.71084665,9.700512643,22.61178736,18.93944307,30068.22721,37421.67386,1.805715555,1.750899223,"United States of America",1995-01-01,"Japan ",1995-01-01,1,1,"Japan",1955-09-10,"United States of America",1948-01-01,1,1,10,10,10,10,1,1
"550",2,"1996",740,1996,740,2,"Q4_2012","USA","USA-AD-748","USA-AD-748","Japan","JPN","Engineered Process Gas Turbo Compressor Systems","5/17/96","12/10/96","7/9/96","A","A","12/10/96","AVD","5/5/97","6/18/97","A","A","6/16/97","AVD","6/12/02","2002","AVD","38.32","38.32","G/ADP/N/29/USA",10,10,1,10,1,0,1,3.072677564,0.568945689,22.61178736,18.93944307,1,30068.22721,37421.67386,8.1e+12,4.71e+12,10.71084665,9.700512643,1.805715555,1.750899223,"5/17/96",1996-05-17,1996-05-17,127,1213,1996-12-10,8.1e+12,4.71e+12,10.71084665,9.700512643,22.61178736,18.93944307,30068.22721,37421.67386,1.805715555,1.750899223,"United States of America",1995-01-01,"Japan ",1995-01-01,1,1,"Japan",1955-09-10,"United States of America",1948-01-01,1,1,10,10,10,10,1,1
"551",2,"1996",325,1995,325,2,"Q4_2012","USA","USA-AD-734","USA-AD-734","Italy","ITA","Pasta","5/19/95","1/19/96","7/10/95","A","A","1/19/96","AVD","6/14/96","7/24/96","A","A","7/24/96","AVD","IF","IF","AVD","0","46.67","G/ADP/N/22/USA",10,10,1,10,1,1,1,3.862870077,0.667190616,22.38256785,47.58799564,1,28781.94969,19910.00067,7.66e+12,1.13e+12,10.60542797,25.71427747,1.607811468,3.317877129,"5/19/95",1995-05-19,1995-05-19,122,849,1996-01-19,8.1e+12,1.27e+12,10.71084665,24.68113975,22.61178736,44.64167892,30068.22721,22271.33092,1.805715555,3.29828126,"United States of America",1995-01-01,"Italy ",1995-01-01,1,1,"Italy",1950-05-30,"United States of America",1948-01-01,1,1,10,10,10,10,1,1
"552",2,"1996",640,1996,640,2,"Q4_2012","USA","USA-AD-745","USA-AD-745","Turkey","TUR","Steel Concrete Reinforcing Bars","3/18/96","10/10/96","5/3/96","A","A","10/10/96","AVD","3/4/97","4/16/97","A","A","4/17/97","AVD","1/5/09","2009","AVD","9.84","41.8","G/ADP/N/29/USA",10,10,1,8,1,0,1,3.072677564,1.70013938,22.61178736,49.36931489,0,30068.22721,3052.959569,8.1e+12,1.81e+11,10.71084665,21.54265814,1.805715555,17.39455624,"3/18/96",1996-03-18,1996-03-18,12,1153,1996-10-10,8.1e+12,1.81e+11,10.71084665,21.54265814,22.61178736,49.36931489,30068.22721,3052.959569,1.805715555,17.39455624,"United States of America",1995-01-01,"Turkey ",1995-03-26,1,1,"Turkey",1951-10-17,"United States of America",1948-01-01,1,1,8,9,10,10,1,1
"553",2,"1997",713,1996,713,2,"Q4_2012","USA","USA-AD-759","USA-AD-757","Taiwan","TWN","Collated Roofing Nails","12/4/96","5/12/97","1/23/97","A","A","5/12/97","AVD","10/1/97","11/20/97","A","A","11/19/97","AVD","11/25/02","2002","AVD","0","40.28","G/ADP/N/35/USA",10,10,1,8,1,0,1,3.072677564,NA,22.61178736,NA,0,30068.22721,NA,8.1e+12,NA,10.71084665,NA,1.805715555,NA,"12/4/96",1996-12-04,1996-12-04,3248,1414,1997-05-12,8.61e+12,NA,11.07974676,NA,23.34436894,NA,31572.63522,NA,1.685758917,NA,"United States of America",1995-01-01,"Taiwan",2002-01-01,0,1,NA,NA,"United States of America",1948-01-01,1,NA,9,9,10,10,1,1
"554",2,"1997",710,1996,710,2,"Q4_2012","USA","USA-AD-757","USA-AD-757","China","CHN","Collated Roofing Nails","12/4/96","5/12/97","1/23/97","A","A","5/12/97","AVD","10/1/97","11/20/97","A","A","11/19/97","AVD","11/25/02","2002","AVD","0","118.41","G/ADP/N/35/USA",10,10,1,-7,0,0,1,3.072677564,1.558517204,22.61178736,38.05745054,0,30068.22721,703.120717,8.1e+12,8.56e+11,10.71084665,20.05374071,1.805715555,19.6910103,"12/4/96",1996-12-04,1996-12-04,5929,1414,1997-05-12,8.61e+12,9.53e+11,11.07974676,21.75391487,23.34436894,39.01267607,31572.63522,774.4675042,1.685758917,18.28710986,"United States of America",1995-01-01,"China ",2001-12-11,0,1,NA,NA,"United States of America",1948-01-01,1,NA,-7,0,10,10,1,0
"555",2,"1997",560,1996,560,2,"Q4_2012","USA","USA-AD-755","USA-AD-753","South Africa","ZAF","Cut To Length Carbon Steel Plate ","11/13/96",".","12/27/96","OTH","A","11/19/97",".",".","12/17/97",".","A","11/19/97","SA","6/17/03","2003","SA","MI","MI","G/ADP/N/35/USA",10,10,1,9,1,0,1,3.072677564,3.648610553,22.61178736,47.92524681,0,30068.22721,3593.277596,8.1e+12,1.44e+11,10.71084665,24.72934694,1.805715555,4.194740453,"11/13/96",1996-11-13,1996-11-13,918,1393,1997-11-19,8.61e+12,1.49e+11,11.07974676,24.59554052,23.34436894,48.03304544,31572.63522,3636.171062,1.685758917,4.008502012,"United States of America",1995-01-01,"South Africa",1995-01-01,1,1,"South Africa",1948-06-13,"United States of America",1948-01-01,1,1,9,9,10,10,1,1
"556",2,"1997",732,1997,732,2,"Q4_2012","USA","USA-AD-761","USA-AD-761","South Korea","KOR","Static Random Access Memory Semiconductors","3/5/97","10/1/97","5/7/97","A","A","10/1/97","AVD","2/23/98","4/15/98","A","N",".",".",".",".",".",".",".",".",10,10,1,6,1,0,1,2.672195833,1.220949385,23.34436894,60.23187117,1,31572.63522,12196.76978,8.61e+12,5.6e+11,11.07974676,29.83791712,1.685758917,4.971705782,"3/5/97",1997-03-05,1997-03-05,1469,1505,1997-10-01,8.61e+12,5.6e+11,11.07974676,29.83791712,23.34436894,60.23187117,31572.63522,12196.76978,1.685758917,4.971705782,"United States of America",1995-01-01,"South Korea",1995-01-01,1,1,"South Korea",1967-04-14,"United States of America",1948-01-01,1,1,6,7,10,10,1,1
"557",2,"1997",732,1996,732,2,"Q4_2012","USA","USA-AD-758","USA-AD-757","South Korea","KOR","Collated Roofing Nails","12/4/96","5/12/97","1/23/97","A","A","5/12/97","AVD","10/1/97",".","N","T",".",".",".",".",".",".",".",".",10,10,1,6,1,0,1,3.072677564,1.161825166,22.61178736,54.70820165,1,30068.22721,13254.6374,8.1e+12,6.03e+11,10.71084665,25.74861093,1.805715555,5.457582593,"12/4/96",1996-12-04,1996-12-04,1378,1414,1997-05-12,8.61e+12,5.6e+11,11.07974676,29.83791712,23.34436894,60.23187117,31572.63522,12196.76978,1.685758917,4.971705782,"United States of America",1995-01-01,"South Korea",1995-01-01,1,1,"South Korea",1967-04-14,"United States of America",1948-01-01,1,1,6,7,10,10,1,1
"558",2,"1997",710,1996,710,2,"Q4_2012","USA","USA-AD-752","USA-AD-752","China","CHN","Crawfish Tail Meat","9/27/96","3/26/97","11/13/96","A","A","3/26/97","AVD","8/1/97","9/19/97","A","A","9/17/97","AVD","IF","IF","AVD","91.5","201.63","G/ADP/N/35/USA",10,10,1,-7,0,0,1,3.072677564,1.558517204,22.61178736,38.05745054,0,30068.22721,703.120717,8.1e+12,8.56e+11,10.71084665,20.05374071,1.805715555,19.6910103,"9/27/96",1996-09-27,1996-09-27,5861,1346,1997-03-26,8.61e+12,9.53e+11,11.07974676,21.75391487,23.34436894,39.01267607,31572.63522,774.4675042,1.685758917,18.28710986,"United States of America",1995-01-01,"China ",2001-12-11,0,1,NA,NA,"United States of America",1948-01-01,1,NA,-7,0,10,10,1,0
"559",2,"1997",710,1996,710,2,"Q4_2012","USA","USA-AD-753","USA-AD-753","China","CHN","Cut To Length Carbon Steel Plate ","11/13/96","6/11/97","12/27/96","A","A","6/11/97","AVD","11/20/97","12/17/97","A","A","10/21/03","AVD","IF","IF","SA","17.33","128.59","G/ADP/N/35/USA",10,10,1,-7,0,0,1,3.072677564,1.558517204,22.61178736,38.05745054,0,30068.22721,703.120717,8.1e+12,8.56e+11,10.71084665,20.05374071,1.805715555,19.6910103,"11/13/96",1996-11-13,1996-11-13,5908,1393,1997-06-11,8.61e+12,9.53e+11,11.07974676,21.75391487,23.34436894,39.01267607,31572.63522,774.4675042,1.685758917,18.28710986,"United States of America",1995-01-01,"China ",2001-12-11,0,1,NA,NA,"United States of America",1948-01-01,1,NA,-7,0,10,10,1,0
"560",2,"1997",52,1997,52,2,"Q4_2012","USA","USA-AD-765","USA-AD-763","Trinidad and Tobago","TTO","Carbon Steel Wire Rod","3/6/97","10/1/97","4/30/97","A","A","10/1/97","AVD","2/24/98","4/25/98","A","N",".",".",".",".",".",".",".",".",10,10,1,10,1,0,1,2.672195833,0.214261485,23.34436894,111.198579,0,31572.63522,4551.325458,8.61e+12,5737751324,11.07974676,53.85473243,1.685758917,2.269999667,"3/6/97",1997-03-06,1997-03-06,483,1506,1997-10-01,8.61e+12,5737751324,11.07974676,53.85473243,23.34436894,111.198579,31572.63522,4551.325458,1.685758917,2.269999667,"United States of America",1995-01-01,"Trinidad and Tobago",1995-03-01,1,1,"Trinidad and Tobago",1962-10-23,"United States of America",1948-01-01,1,1,10,10,10,10,1,1
"561",2,"1997",365,1996,365,2,"Q4_2012","USA","USA-AD-754","USA-AD-753","Russia","RUS","Cut To Length Carbon Steel Plate ","11/13/96","6/11/97","12/27/96","A","A","6/11/97","AVD","11/19/97","12/17/97","A","A",".",".","IF","IF","SA","MI","MI","G/ADP/N/35/USA",10,10,1,3,0,0,1,3.072677564,3.275019327,22.61178736,47.92309991,0,30068.22721,2643.905637,8.1e+12,3.92e+11,10.71084665,26.07331408,1.805715555,7.172466456,"11/13/96",1996-11-13,1996-11-13,1911,1393,1997-06-11,8.61e+12,4.05e+11,11.07974676,24.72998933,23.34436894,47.25720384,31572.63522,2737.555441,1.685758917,6.4393762,"United States of America",1995-01-01,"Russia",2012-08-22,0,1,NA,NA,"United States of America",1948-01-01,1,NA,3,4,10,10,1,0
"562",2,"1997",101,1997,101,2,"Q4_2012","USA","USA-AD-766","USA-AD-763","Venezuela","VEN","Steel Wire Rod","3/6/97","10/1/97","4/30/97","A","A","10/1/97","AVD","2/23/98","4/25/98","A","N",".",".",".",".",".",".",".",".",10,10,1,8,1,0,1,2.672195833,0.195988359,23.34436894,51.24503641,1,31572.63522,3728.787997,8.61e+12,85837385779,11.07974676,29.25901061,1.685758917,4.929622812,"3/6/97",1997-03-06,1997-03-06,1128,1506,1997-10-01,8.61e+12,85837385779,11.07974676,29.25901061,23.34436894,51.24503641,31572.63522,3728.787997,1.685758917,4.929622812,"United States of America",1995-01-01,"Venezuela",1995-01-01,1,1,"Venezuela",1990-08-31,"United States of America",1948-01-01,1,1,8,8,10,10,1,1
"563",2,"1997",369,1996,369,2,"Q4_2012","USA","USA-AD-756","USA-AD-753","Ukraine","UKR","Cut To Length Carbon Steel Plate ","11/13/96","6/11/97","12/27/96","A","A","6/11/97","AVD","11/19/97","12/17/97","A","A","11/19/97","SA","IF","IF","SA","MI","MI","G/ADP/N/35/USA",10,10,1,7,1,0,1,3.072677564,1.000229546,22.61178736,93.85664327,0,30068.22721,872.7091855,8.1e+12,44558077827,10.71084665,45.6519312,1.805715555,13.82873947,"11/13/96",1996-11-13,1996-11-13,848,1393,1997-06-11,8.61e+12,50150399813,11.07974676,40.59122522,23.34436894,84.24141415,31572.63522,991.2301011,1.685758917,14.41400323,"United States of America",1995-01-01,"Ukraine ",2008-05-16,0,1,NA,NA,"United States of America",1948-01-01,1,NA,7,7,10,10,1,1
"564",2,"1997",305,1996,305,2,"Q4_2012","USA","USA-AD-751","USA-AD-751","Austria","AUT","Open-End Spun Rayon Singles Yarn","8/28/96","3/26/97","10/15/96","A","A","3/26/97","AVD","8/15/97","9/26/97","A","N",".",".",".",".",".",".",".",".",10,10,1,10,1,0,1,3.072677564,2.831208312,22.61178736,72.53060043,0,30068.22721,29485.60821,8.1e+12,2.35e+11,10.71084665,35.48918674,1.805715555,2.287641313,"8/28/96",1996-08-28,1996-08-28,3726,1316,1997-03-26,8.61e+12,2.08e+11,11.07974676,39.24808728,23.34436894,79.00824055,31572.63522,26082.45851,1.685758917,2.217656345,"United States of America",1995-01-01,"Austria ",1995-01-01,1,1,"Austria",1951-10-19,"United States of America",1948-01-01,1,1,10,10,10,10,1,1
"565",2,"1997",740,1996,740,2,"Q4_2012","USA","USA-AD-750","USA-AD-750","Japan","JPN","Vector Supercomputers","8/7/96","4/7/97","9/25/96","A","A","4/7/97","AVD","8/28/97","10/16/97","A","A","10/24/97","AVD","5/3/01","2001","AVD","173.08","454","G/ADP/N/35/USA",10,10,1,10,1,0,1,3.072677564,0.568945689,22.61178736,18.93944307,1,30068.22721,37421.67386,8.1e+12,4.71e+12,10.71084665,9.700512643,1.805715555,1.750899223,"8/7/96",1996-08-07,1996-08-07,209,1295,1997-04-07,8.61e+12,4.32e+12,11.07974676,10.73145689,23.34436894,20.38760447,31572.63522,34294.89898,1.685758917,1.613068025,"United States of America",1995-01-01,"Japan ",1995-01-01,1,1,"Japan",1955-09-10,"United States of America",1948-01-01,1,1,10,10,10,10,1,1
"566",2,"1997",20,1997,20,2,"Q4_2012","USA","USA-AD-763","USA-AD-763","Canada","CAN","Carbon Steel Wire Rod","3/6/97","10/1/97","4/30/97","A","A","10/1/97","AVD","2/24/98","4/25/98","A","N",".",".",".",".",".",".",".",".",10,10,1,10,1,0,1,2.672195833,7.667701871,23.34436894,74.59351037,0,31572.63522,21709.29634,8.61e+12,6.51e+11,11.07974676,38.25007544,1.685758917,2.501016275,"3/6/97",1997-03-06,1997-03-06,1218,1506,1997-10-01,8.61e+12,6.51e+11,11.07974676,38.25007544,23.34436894,74.59351037,31572.63522,21709.29634,1.685758917,2.501016275,"United States of America",1995-01-01,"Canada ",1995-01-01,1,1,"Canada",1948-01-01,"United States of America",1948-01-01,1,1,10,10,10,10,1,1
"567",2,"1997",255,1997,255,2,"Q4_2012","USA","USA-AD-764","USA-AD-763","Germany","DEU","Carbon Steel Wire Rod","3/6/97","10/1/97","4/30/97","A","A","10/1/97","AVD","2/23/98","4/25/98","A","N",".",".",".",".",".",".",".",".",10,10,1,10,1,0,1,2.672195833,0.944504553,23.34436894,53.50674475,1,31572.63522,26296.53061,8.61e+12,2.16e+12,11.07974676,27.39830597,1.685758917,1.133319477,"3/6/97",1997-03-06,1997-03-06,5270,1506,1997-10-01,8.61e+12,2.16e+12,11.07974676,27.39830597,23.34436894,53.50674475,31572.63522,26296.53061,1.685758917,1.133319477,"United States of America",1995-01-01,"Germany ",1995-01-01,1,1,"Germany",1951-10-01,"United States of America",1948-01-01,1,1,10,10,10,10,1,1
"568",2,"1997",713,1997,713,2,"Q4_2012","USA","USA-AD-762","USA-AD-762","Taiwan","TWN","Static Random Access Memory Semiconductors","3/5/97","10/1/97","5/7/97","A","A","10/1/97","AVD","2/23/98","4/15/98","A","A","4/16/98","AVD","1/14/02","2002","AVD","7.56","113.85","G/ADP/N/41/USA",10,10,1,9,1,0,1,2.672195833,NA,23.34436894,NA,0,31572.63522,NA,8.61e+12,NA,11.07974676,NA,1.685758917,NA,"3/5/97",1997-03-05,1997-03-05,3339,1505,1997-10-01,8.61e+12,NA,11.07974676,NA,23.34436894,NA,31572.63522,NA,1.685758917,NA,"United States of America",1995-01-01,"Taiwan",2002-01-01,0,1,NA,NA,"United States of America",1948-01-01,1,NA,9,9,10,10,1,1
"569",2,"1998",560,1998,560,2,"Q4_2012","USA","USA-AD-792","USA-AD-788","South Africa","ZAF","Stainless Steel Plate in Coils","4/9/98","11/4/98","5/28/98","A","A","11/4/98","AVD","3/31/99","5/12/99","A","A","5/21/99","AVD","IF","IF","AVD","37.77","37.77","G/ADP/N/53/USA",10,10,1,9,1,0,1,2.349922309,3.775064242,22.75912907,50.16338451,0,32948.95126,3205.168742,9.09e+12,1.34e+11,10.48398631,25.65286277,1.300089704,3.768703469,"4/9/98",1998-04-09,1998-04-09,1430,1905,1998-11-04,9.09e+12,1.34e+11,10.48398631,25.65286277,22.75912907,50.16338451,32948.95126,3205.168742,1.300089704,3.768703469,"United States of America",1995-01-01,"South Africa",1995-01-01,1,1,"South Africa",1948-06-13,"United States of America",1948-01-01,1,1,9,9,10,10,1,1
"570",2,"1998",230,1997,230,2,"Q4_2012","USA","USA-AD-773","USA-AD-769","Spain","ESP","Stainless Steel Wire Rod","8/6/97","3/5/98","9/24/97","A","A","3/5/98","AVD","7/29/98","9/16/98","A","A","9/15/98","AVD","IF","IF","AVD","4.73","4.73","G/ADP/N/47/USA",10,10,1,10,1,0,1,2.672195833,1.352447831,23.34436894,51.75778652,0,31572.63522,14463.12096,8.61e+12,5.72e+11,11.07974676,26.31191357,1.685758917,4.800635225,"8/6/97",1997-08-06,1997-08-06,458,1659,1998-03-05,9.09e+12,6.01e+11,10.48398631,26.67408334,22.75912907,53.56955454,32948.95126,15121.72118,1.300089704,4.65607215,"United States of America",1995-01-01,"Spain ",1995-01-01,1,1,"Spain",1963-08-29,"United States of America",1948-01-01,1,1,10,10,10,10,1,1
"571",2,"1998",325,1997,325,2,"Q4_2012","USA","USA-AD-770","USA-AD-769","Italy","ITA","Stainless Steel Wire Rod","8/6/97","3/5/98","9/24/97","A","A","3/5/98","AVD","7/29/98","9/16/98","A","A","9/15/98","AVD","IF","IF","AVD","12.73","12.73","G/ADP/N/47/USA",10,10,1,10,1,0,1,2.672195833,0.636162923,23.34436894,46.49292109,1,31572.63522,21069.54779,8.61e+12,1.2e+12,11.07974676,25.20755186,1.685758917,3.198451766,"8/6/97",1997-08-06,1997-08-06,445,1659,1998-03-05,9.09e+12,1.22e+12,10.48398631,25.15430622,22.75912907,47.08565282,32948.95126,21519.06412,1.300089704,3.098162293,"United States of America",1995-01-01,"Italy ",1995-01-01,1,1,"Italy",1950-05-30,"United States of America",1948-01-01,1,1,10,10,10,10,1,1
"572",2,"1998",230,1998,230,2,"Q4_2012","USA","USA-AD-785","USA-AD-781","Spain","ESP","Stainless Steel Round Wire","4/6/98","11/18/98","6/18/98","A","A","11/18/98","AVD","4/9/99","5/26/99","A","N",".",".",".",".",".",".",".",".",10,10,1,10,1,0,1,2.349922309,1.260181682,22.75912907,53.56955454,0,32948.95126,15121.72118,9.09e+12,6.01e+11,10.48398631,26.67408334,1.300089704,4.65607215,"4/6/98",1998-04-06,1998-04-06,701,1902,1998-11-18,9.09e+12,6.01e+11,10.48398631,26.67408334,22.75912907,53.56955454,32948.95126,15121.72118,1.300089704,4.65607215,"United States of America",1995-01-01,"Spain ",1995-01-01,1,1,"Spain",1963-08-29,"United States of America",1948-01-01,1,1,10,10,10,10,1,1
"573",2,"1998",380,1997,380,2,"Q4_2012","USA","USA-AD-774","USA-AD-769","Sweden","SWE","Stainless Steel Wire Rod","8/6/97","3/5/98","9/24/97","A","A","3/5/98","AVD","7/29/98","9/16/98","A","A","9/15/98","AVD","4/23/07","2007","AVD","5.71","5.71","G/ADP/N/47/USA",10,10,1,10,1,0,1,2.672195833,5.344771338,23.34436894,76.65060518,0,31572.63522,28620.40835,8.61e+12,2.53e+11,11.07974676,42.07061813,1.685758917,2.536617332,"8/6/97",1997-08-06,1997-08-06,503,1659,1998-03-05,9.09e+12,2.55e+11,10.48398631,43.04956386,22.75912907,79.41214524,32948.95126,28779.11562,1.300089704,2.380585329,"United States of America",1995-01-01,"Sweden ",1995-01-01,1,1,"Sweden",1950-04-30,"United States of America",1948-01-01,1,1,10,10,10,10,1,1
"574",2,"1998",732,1998,732,2,"Q4_2012","USA","USA-AD-791","USA-AD-788","South Korea","KOR","Stainless Steel Plate in Coils","4/9/98","11/4/98","5/28/98","A","A","11/4/98","AVD","3/31/99","5/12/99","A","A","5/21/99","AVD","12/1/11","2011","AVD","16.26","16.26","G/ADP/N/53/USA",10,10,1,8,1,1,1,2.349922309,1.10598414,22.75912907,72.9054547,1,32948.95126,8133.731245,9.09e+12,3.76e+11,10.48398631,42.35677439,1.300089704,4.636583786,"4/9/98",1998-04-09,1998-04-09,43,1905,1998-11-04,9.09e+12,3.76e+11,10.48398631,42.35677439,22.75912907,72.9054547,32948.95126,8133.731245,1.300089704,4.636583786,"United States of America",1995-01-01,"South Korea",1995-01-01,1,1,"South Korea",1967-04-14,"United States of America",1948-01-01,1,1,8,8,10,10,1,1
"575",2,"1998",140,1998,140,2,"Q4_2012","USA","USA-AD-794","USA-AD-794","Brazil","BRA","Emulsion Styrene-Butadiene Rubber","4/9/98","11/4/98","5/28/98","A","A","11/4/98","AVD","3/29/99","5/19/99","A","N",".",".",".",".",".",".",".",".",10,10,1,8,1,0,1,2.349922309,3.716876352,22.75912907,15.86498597,1,32948.95126,4979.144846,9.09e+12,8.44e+11,10.48398631,6.932774825,1.300089704,5.524736835,"4/9/98",1998-04-09,1998-04-09,1194,1905,1998-11-04,9.09e+12,8.44e+11,10.48398631,6.932774825,22.75912907,15.86498597,32948.95126,4979.144846,1.300089704,5.524736835,"United States of America",1995-01-01,"Brazil ",1995-01-01,1,1,"Brazil",1948-07-30,"United States of America",1948-01-01,1,1,8,8,10,10,1,1
"576",2,"1998",740,1997,740,2,"Q4_2012","USA","USA-AD-771","USA-AD-769","Japan","JPN","Stainless Steel Wire Rod","8/6/97","3/5/98","9/24/97","A","A","3/5/98","AVD","7/29/98","9/16/98","A","A","9/15/98","AVD","IF","IF","AVD","0","34.21","G/ADP/N/47/USA",10,10,1,10,1,0,1,2.672195833,0.531375085,23.34436894,20.38760447,1,31572.63522,34294.89898,8.61e+12,4.32e+12,11.07974676,10.73145689,1.685758917,1.613068025,"8/6/97",1997-08-06,1997-08-06,573,1659,1998-03-05,9.09e+12,3.91e+12,10.48398631,10.7774668,22.75912907,19.6888759,32948.95126,30967.28809,1.300089704,1.704186546,"United States of America",1995-01-01,"Japan ",1995-01-01,1,1,"Japan",1955-09-10,"United States of America",1948-01-01,1,1,10,10,10,10,1,1
"577",2,"1998",713,1998,713,2,"Q4_2012","USA","USA-AD-793","USA-AD-788","Taiwan","TWN","Stainless Steel Plate in Coils","4/9/98","11/4/98","5/28/98","A","A","11/4/98","AVD","3/31/99","5/12/99","A","A","5/21/99","AVD","IF","IF","AVD","7.39","10.2","G/ADP/N/53/USA",10,10,1,9,1,0,1,2.349922309,NA,22.75912907,NA,0,32948.95126,NA,9.09e+12,NA,10.48398631,NA,1.300089704,NA,"4/9/98",1998-04-09,1998-04-09,3739,1905,1998-11-04,9.09e+12,NA,10.48398631,NA,22.75912907,NA,32948.95126,NA,1.300089704,NA,"United States of America",1995-01-01,"Taiwan",2002-01-01,0,1,NA,NA,"United States of America",1948-01-01,1,NA,9,9,10,10,1,1
"578",2,"1998",255,1997,255,2,"Q4_2012","USA","USA-AD-769","USA-AD-769","Germany","DEU","Stainless Steel Wire Rod","8/6/97","3/5/98","9/24/97","A","A","3/5/98","AVD","7/29/98","9/16/98","A","N",".",".",".",".",".",".",".",".",10,10,1,10,1,0,1,2.672195833,0.944504553,23.34436894,53.50674475,1,31572.63522,26296.53061,8.61e+12,2.16e+12,11.07974676,27.39830597,1.685758917,1.133319477,"8/6/97",1997-08-06,1997-08-06,5423,1659,1998-03-05,9.09e+12,2.18e+12,10.48398631,28.58294637,22.75912907,55.79170281,32948.95126,26547.77535,1.300089704,1.073012219,"United States of America",1995-01-01,"Germany ",1995-01-01,1,1,"Germany",1951-10-01,"United States of America",1948-01-01,1,1,10,10,10,10,1,1
"579",2,"1998",740,1998,740,2,"Q4_2012","USA","USA-AD-783","USA-AD-781","Japan","JPN","Stainless Steel Round Wire","4/6/98","11/18/98","6/18/98","A","A","11/18/98","AVD","4/9/99","5/26/99","A","N",".",".",".",".",".",".",".",".",10,10,1,10,1,0,1,2.349922309,0.52714681,22.75912907,19.6888759,1,32948.95126,30967.28809,9.09e+12,3.91e+12,10.48398631,10.7774668,1.300089704,1.704186546,"4/6/98",1998-04-06,1998-04-06,816,1902,1998-11-18,9.09e+12,3.91e+12,10.48398631,10.7774668,22.75912907,19.6888759,32948.95126,30967.28809,1.300089704,1.704186546,"United States of America",1995-01-01,"Japan ",1995-01-01,1,1,"Japan",1955-09-10,"United States of America",1948-01-01,1,1,10,10,10,10,1,1
"580",2,"1998",20,1998,20,2,"Q4_2012","USA","USA-AD-781","USA-AD-781","Canada","CAN","Stainless Steel Round Wire","4/6/98","11/18/98","6/18/98","A","A","11/18/98","AVD","4/9/99","5/26/99","A","N",".",".",".",".",".",".",".",".",10,10,1,10,1,0,1,2.349922309,6.745102129,22.75912907,78.20599319,0,32948.95126,20875.24831,9.09e+12,6.31e+11,10.48398631,40.06896331,1.300089704,2.576269825,"4/6/98",1998-04-06,1998-04-06,1614,1902,1998-11-18,9.09e+12,6.31e+11,10.48398631,40.06896331,22.75912907,78.20599319,32948.95126,20875.24831,1.300089704,2.576269825,"United States of America",1995-01-01,"Canada ",1995-01-01,1,1,"Canada",1948-01-01,"United States of America",1948-01-01,1,1,10,10,10,10,1,1
"581",2,"1998",211,1998,211,2,"Q4_2012","USA","USA-AD-788","USA-AD-788","Belgium","BEL","Stainless Steel Plate in Coils","4/9/98","11/4/98","5/28/98","A","A","11/4/98","AVD","3/31/99","5/12/99","A","A","5/21/99","AVD","IF","IF","AVD","9.86","9.86","G/ADP/N/53/USA",10,10,1,10,1,1,1,2.349922309,1.233065856,22.75912907,135.6035967,0,32948.95126,25051.33996,9.09e+12,2.56e+11,10.48398631,69.7023323,1.300089704,1.407012203,"4/9/98",1998-04-09,1998-04-09,2224,1905,1998-11-04,9.09e+12,2.56e+11,10.48398631,69.7023323,22.75912907,135.6035967,32948.95126,25051.33996,1.300089704,1.407012203,"United States of America",1995-01-01,"Belgium ",1995-01-01,1,1,"Belgium",1948-01-01,"United States of America",1948-01-01,1,1,10,10,10,10,1,1
"582",2,"1998",713,1998,713,2,"Q4_2012","USA","USA-AD-786","USA-AD-781","Taiwan","TWN","Stainless Steel Round Wire","4/6/98","11/18/98","6/18/98","A","A","11/18/98","AVD","4/9/99","5/26/99","A","N",".",".",".",".",".",".",".",".",10,10,1,9,1,0,1,2.349922309,NA,22.75912907,NA,0,32948.95126,NA,9.09e+12,NA,10.48398631,NA,1.300089704,NA,"4/6/98",1998-04-06,1998-04-06,3736,1902,1998-11-18,9.09e+12,NA,10.48398631,NA,22.75912907,NA,32948.95126,NA,1.300089704,NA,"United States of America",1995-01-01,"Taiwan",2002-01-01,0,1,NA,NA,"United States of America",1948-01-01,1,NA,9,9,10,10,1,1
"583",2,"1998",750,1998,750,2,"Q4_2012","USA","USA-AD-778","USA-AD-776","India","IND","Certain Preserved Mushrooms","1/16/98","8/5/98","3/3/98","A","A","8/5/98","AVD","12/31/98","2/24/99","A","A","2/19/99","AVD","IF","IF","AVD","6.28","243.87","G/ADP/N/53/USA",10,10,1,9,1,0,1,2.349922309,1.656051057,22.75912907,23.29101706,1,32948.95126,425.4452943,9.09e+12,4.29e+11,10.48398631,10.82856928,1.300089704,25.79098082,"1/16/98",1998-01-16,1998-01-16,270,1822,1998-08-05,9.09e+12,4.29e+11,10.48398631,10.82856928,22.75912907,23.29101706,32948.95126,425.4452943,1.300089704,25.79098082,"United States of America",1995-01-01,"India ",1995-01-01,1,1,"India",1948-07-08,"United States of America",1948-01-01,1,1,9,9,10,10,1,1
"584",2,"1998",70,1998,70,2,"Q4_2012","USA","USA-AD-796","USA-AD-794","Mexico","MEX","Emulsion Styrene-Butadiene Rubber","4/9/98","11/4/98","5/28/98","A","A","11/4/98","AVD","3/29/99","5/19/99","A","N",".",".",".",".",".",".",".",".",10,10,1,6,1,0,1,2.349922309,0.783309588,22.75912907,51.77609803,1,32948.95126,4986.252659,9.09e+12,5.02e+11,10.48398631,25.74892715,1.300089704,4.206365878,"4/9/98",1998-04-09,1998-04-09,1225,1905,1998-11-04,9.09e+12,5.02e+11,10.48398631,25.74892715,22.75912907,51.77609803,32948.95126,4986.252659,1.300089704,4.206365878,"United States of America",1995-01-01,"Mexico ",1995-01-01,1,1,"Mexico",1986-08-24,"United States of America",1948-01-01,1,1,6,6,10,10,1,1
"585",2,"1998",20,1998,20,2,"Q4_2012","USA","USA-AD-789","USA-AD-788","Canada","CAN","Stainless Steel Plate in Coils","4/9/98","11/4/98","5/28/98","A","A","11/4/98","AVD","3/31/99","5/12/99","A","A","5/21/99","AVD","5/21/04","2004","AVD","11.1","15.35","G/ADP/N/53/USA",10,10,1,10,1,0,1,2.349922309,6.745102129,22.75912907,78.20599319,0,32948.95126,20875.24831,9.09e+12,6.31e+11,10.48398631,40.06896331,1.300089704,2.576269825,"4/9/98",1998-04-09,1998-04-09,1617,1905,1998-11-04,9.09e+12,6.31e+11,10.48398631,40.06896331,22.75912907,78.20599319,32948.95126,20875.24831,1.300089704,2.576269825,"United States of America",1995-01-01,"Canada ",1995-01-01,1,1,"Canada",1948-01-01,"United States of America",1948-01-01,1,1,10,10,10,10,1,1
"586",2,"1998",710,1998,710,2,"Q4_2012","USA","USA-AD-777","USA-AD-776","China","CHN","Certain Preserved Mushrooms","1/16/98","8/5/98","3/3/98","A","A","8/5/98","AVD","12/31/98","2/24/99","A","A","2/19/99","AVD","IF","IF","AVD","121.47","198.63","G/ADP/N/53/USA",10,10,1,-7,0,0,1,2.349922309,1.094578768,22.75912907,36.39314281,0,32948.95126,820.8657978,9.09e+12,1.02e+12,10.48398631,20.34656271,1.300089704,17.55595413,"1/16/98",1998-01-16,1998-01-16,331,1822,1998-08-05,9.09e+12,1.02e+12,10.48398631,20.34656271,22.75912907,36.39314281,32948.95126,820.8657978,1.300089704,17.55595413,"United States of America",1995-01-01,"China ",2001-12-11,0,1,NA,NA,"United States of America",1948-01-01,1,NA,-7,0,10,10,1,0
"587",2,"1998",713,1997,713,2,"Q4_2012","USA","USA-AD-775","USA-AD-769","Taiwan","TWN","Stainless Steel Wire Rod","8/6/97","3/5/98","9/24/97","A","A","3/5/98","AVD","7/29/98","9/16/98","A","A","9/15/98","AVD","IF","IF","AVD","0.02","8.29","G/ADP/N/47/USA",10,10,1,9,1,0,1,2.672195833,NA,23.34436894,NA,0,31572.63522,NA,8.61e+12,NA,11.07974676,NA,1.685758917,NA,"8/6/97",1997-08-06,1997-08-06,3493,1659,1998-03-05,9.09e+12,NA,10.48398631,NA,22.75912907,NA,32948.95126,NA,1.300089704,NA,"United States of America",1995-01-01,"Taiwan",2002-01-01,0,1,NA,NA,"United States of America",1948-01-01,1,NA,9,9,10,10,1,1
"588",2,"1998",325,1998,325,2,"Q4_2012","USA","USA-AD-790","USA-AD-788","Italy","ITA","Stainless Steel Plate in Coils","4/9/98","11/4/98","5/28/98","A","A","11/4/98","AVD","3/31/99","5/12/99","A","A","5/21/99","AVD","8/31/11","2011","AVD","39.69","45.09","G/ADP/N/53/USA",10,10,1,10,1,0,1,2.349922309,0.634332938,22.75912907,47.08565282,1,32948.95126,21519.06412,9.09e+12,1.22e+12,10.48398631,25.15430622,1.300089704,3.098162293,"4/9/98",1998-04-09,1998-04-09,691,1905,1998-11-04,9.09e+12,1.22e+12,10.48398631,25.15430622,22.75912907,47.08565282,32948.95126,21519.06412,1.300089704,3.098162293,"United States of America",1995-01-01,"Italy ",1995-01-01,1,1,"Italy",1950-05-30,"United States of America",1948-01-01,1,1,10,10,10,10,1,1
"589",2,"1998",155,1997,155,2,"Q4_2012","USA","USA-AD-768","USA-AD-768","Chile","CHL","Fresh Atlantic Salmon","6/20/97","1/16/98","8/6/97","A","A","1/16/98","AVD","7/9/98","7/28/98","A","A","7/30/98","AVD","8/13/03","2003","AVD","0.16","10.69","G/ADP/N/47/USA",10,10,1,8,1,0,1,2.672195833,8.923344866,23.34436894,56.28683548,0,31572.63522,5567.942178,8.61e+12,82808986192,11.07974676,27.08376461,1.685758917,5.935907954,"6/20/97",1997-06-20,1997-06-20,1197,1612,1998-01-16,9.09e+12,79373597080,10.48398631,26.29991077,22.75912907,55.86589284,32948.95126,5266.152019,1.300089704,6.121745233,"United States of America",1995-01-01,"Chile ",1995-01-01,1,1,"Chile",1949-03-16,"United States of America",1948-01-01,1,1,8,8,10,10,1,1
"590",2,"1998",850,1998,850,2,"Q4_2012","USA","USA-AD-779","USA-AD-776","Indonesia","IDN","Certain Preserved Mushrooms","1/16/98","8/5/98","3/3/98","A","A","8/5/98","AVD","12/31/98","2/24/99","A","A","2/19/99","AVD","IF","IF","AVD","7.94","22.84","G/ADP/N/53/USA",10,10,1,-5,0,0,1,2.349922309,4.522680999,22.75912907,96.18619424,1,32948.95126,470.1961402,9.09e+12,95445548017,10.48398631,52.96813536,1.300089704,18.08286038,"1/16/98",1998-01-16,1998-01-16,11633,1822,1998-08-05,9.09e+12,95445548017,10.48398631,52.96813536,22.75912907,96.18619424,32948.95126,470.1961402,1.300089704,18.08286038,"United States of America",1995-01-01,"Indonesia ",1995-01-01,1,1,"Indonesia",1950-02-24,"United States of America",1948-01-01,1,1,-5,0,10,10,1,0
"591",2,"1998",750,1998,750,2,"Q4_2012","USA","USA-AD-782","USA-AD-781","India","IND","Stainless Steel Round Wire","4/6/98","11/18/98","6/18/98","A","A","11/18/98","AVD","4/9/99","5/26/99","A","N",".",".",".",".",".",".",".",".",10,10,1,9,1,0,1,2.349922309,1.656051057,22.75912907,23.29101706,1,32948.95126,425.4452943,9.09e+12,4.29e+11,10.48398631,10.82856928,1.300089704,25.79098082,"4/6/98",1998-04-06,1998-04-06,18,1902,1998-11-18,9.09e+12,4.29e+11,10.48398631,10.82856928,22.75912907,23.29101706,32948.95126,425.4452943,1.300089704,25.79098082,"United States of America",1995-01-01,"India ",1995-01-01,1,1,"India",1948-07-08,"United States of America",1948-01-01,1,1,9,9,10,10,1,1
"592",2,"1998",732,1997,732,2,"Q4_2012","USA","USA-AD-772","USA-AD-769","South Korea","KOR","Stainless Steel Wire Rod","8/6/97","3/5/98","9/24/97","A","A","3/5/98","AVD","7/29/98","9/16/98","A","A","9/15/98","AVD","IF","IF","AVD","5.19","28.44","G/ADP/N/47/USA",10,10,1,6,1,0,1,2.672195833,1.220949385,23.34436894,60.23187117,1,31572.63522,12196.76978,8.61e+12,5.6e+11,11.07974676,29.83791712,1.685758917,4.971705782,"8/6/97",1997-08-06,1997-08-06,1623,1659,1998-03-05,9.09e+12,3.76e+11,10.48398631,42.35677439,22.75912907,72.9054547,32948.95126,8133.731245,1.300089704,4.636583786,"United States of America",1995-01-01,"South Korea",1995-01-01,1,1,"South Korea",1967-04-14,"United States of America",1948-01-01,1,1,8,8,10,10,1,1
"593",2,"1998",732,1998,732,2,"Q4_2012","USA","USA-AD-795","USA-AD-794","South Korea","KOR","Emulsion Styrene-Butadiene Rubber","4/9/98","11/4/98","5/28/98","A","A","11/4/98","AVD","3/29/99","5/19/99","A","N",".",".",".",".",".",".",".",".",10,10,1,8,1,0,1,2.349922309,1.10598414,22.75912907,72.9054547,1,32948.95126,8133.731245,9.09e+12,3.76e+11,10.48398631,42.35677439,1.300089704,4.636583786,"4/9/98",1998-04-09,1998-04-09,43,1905,1998-11-04,9.09e+12,3.76e+11,10.48398631,42.35677439,22.75912907,72.9054547,32948.95126,8133.731245,1.300089704,4.636583786,"United States of America",1995-01-01,"South Korea",1995-01-01,1,1,"South Korea",1967-04-14,"United States of America",1948-01-01,1,1,8,8,10,10,1,1
"594",2,"1998",850,1998,850,2,"Q4_2012","USA","USA-AD-787","USA-AD-787","Indonesia","IDN","Extruded Rubber Thread","4/9/98","11/3/98","5/28/98","A","A","11/3/98","AVD","3/26/99","5/12/99","A","A","5/21/99","AVD","6/29/04","2004","AVD","5.13","28.29","G/ADP/N/53/USA",10,10,1,-5,0,0,1,2.349922309,4.522680999,22.75912907,96.18619424,1,32948.95126,470.1961402,9.09e+12,95445548017,10.48398631,52.96813536,1.300089704,18.08286038,"4/9/98",1998-04-09,1998-04-09,11716,1905,1998-11-03,9.09e+12,95445548017,10.48398631,52.96813536,22.75912907,96.18619424,32948.95126,470.1961402,1.300089704,18.08286038,"United States of America",1995-01-01,"Indonesia ",1995-01-01,1,1,"Indonesia",1950-02-24,"United States of America",1948-01-01,1,1,-5,0,10,10,1,0
"595",2,"1998",155,1998,155,2,"Q4_2012","USA","USA-AD-776","USA-AD-776","Chile","CHL","Certain Preserved Mushrooms","1/16/98","8/5/98","3/3/98","A","A","8/5/98","AVD","10/22/98","12/2/98","A","A","12/2/98","AVD","IF","IF","AVD","148.51","148.51","G/ADP/N/47/USA",10,10,1,8,1,0,1,2.349922309,8.966020476,22.75912907,55.86589284,0,32948.95126,5266.152019,9.09e+12,79373597080,10.48398631,26.29991077,1.300089704,6.121745233,"1/16/98",1998-01-16,1998-01-16,1407,1822,1998-08-05,9.09e+12,79373597080,10.48398631,26.29991077,22.75912907,55.86589284,32948.95126,5266.152019,1.300089704,6.121745233,"United States of America",1995-01-01,"Chile ",1995-01-01,1,1,"Chile",1949-03-16,"United States of America",1948-01-01,1,1,8,8,10,10,1,1
"596",2,"1999",140,1998,140,2,"Q4_2012","USA","USA-AD-806","USA-AD-806","Brazil","BRA","Hot Rolled Carbon Steel Flat Products","10/7/98","2/19/99","11/25/98","A","A","2/19/99","AVD","7/19/99","8/27/99","A","A","3/12/02","AVD","6/21/11","2011","AVD","7.81","9.7","G/ADP/N/59/USA",10,10,1,8,1,0,1,2.349922309,3.716876352,22.75912907,15.86498597,1,32948.95126,4979.144846,9.09e+12,8.44e+11,10.48398631,6.932774825,1.300089704,5.524736835,"10/7/98",1998-10-07,1998-10-07,1375,2086,1999-02-19,9.67e+12,5.87e+11,10.23412686,9.411088649,23.17266209,20.22715514,34639.11984,3411.865896,1.219934045,5.473261496,"United States of America",1995-01-01,"Brazil ",1995-01-01,1,1,"Brazil",1948-07-30,"United States of America",1948-01-01,1,1,8,8,10,10,1,1
"597",2,"1999",140,1999,140,2,"Q4_2012","USA","USA-AD-830","USA-AD-829","Brazil","BRA","Cold-Rolled Carbon Steel Products","6/9/99","11/10/99","7/30/99","A","A","11/10/99","AVD","2/4/00","3/20/00","A","N",".",".",".",".",".",".",".",".",10,10,1,8,1,0,1,2.077063761,4.506917669,23.17266209,20.22715514,1,34639.11984,3411.865896,9.67e+12,5.87e+11,10.23412686,9.411088649,1.219934045,5.473261496,"6/9/99",1999-06-09,1999-06-09,1620,2331,1999-11-10,9.67e+12,5.87e+11,10.23412686,9.411088649,23.17266209,20.22715514,34639.11984,3411.865896,1.219934045,5.473261496,"United States of America",1995-01-01,"Brazil ",1995-01-01,1,1,"Brazil",1948-07-30,"United States of America",1948-01-01,1,1,8,8,10,10,1,1
"598",2,"1999",200,1998,200,2,"Q4_2012","USA","USA-AD-804","USA-AD-797","United Kingdom","GBR","Stainless Steel Sheet and Strip","6/17/98","1/4/99","8/5/98","A","A","1/4/99","AVD","6/8/99","7/28/99","A","A","7/27/99","AVD","7/27/05","2005","AVD","14.84","14.84","G/ADP/N/59/USA",10,10,1,10,1,0,1,2.349922309,0.531443353,22.75912907,53.13777989,1,32948.95126,25266.39474,9.09e+12,1.48e+12,10.48398631,26.25155362,1.300089704,1.067465104,"6/17/98",1998-06-17,1998-06-17,411,1974,1999-01-04,9.67e+12,1.52e+12,10.23412686,25.82740736,23.17266209,53.11242851,34639.11984,25870.98904,1.219934045,0.995674794,"United States of America",1995-01-01,"United Kingdom",1995-01-01,1,1,"United Kingdom",1948-01-01,"United States of America",1948-01-01,1,1,10,10,10,10,1,1
"599",2,"1999",740,1998,740,2,"Q4_2012","USA","USA-AD-807","USA-AD-806","Japan","JPN","Hot Rolled Carbon Steel Flat Products","10/7/98","2/19/99","11/25/98","A","A","2/19/99","AVD","5/6/99","6/23/99","A","A","6/29/99","AVD","6/21/11","2011","AVD","17.86","67.14","G/ADP/N/53/USA",10,10,1,10,1,1,1,2.349922309,0.52714681,22.75912907,19.6888759,1,32948.95126,30967.28809,9.09e+12,3.91e+12,10.48398631,10.7774668,1.300089704,1.704186546,"10/7/98",1998-10-07,1998-10-07,69,2086,1999-02-19,9.67e+12,4.43e+12,10.23412686,10.17337581,23.17266209,18.75638736,34639.11984,34998.80997,1.219934045,1.679247869,"United States of America",1995-01-01,"Japan ",1995-01-01,1,1,"Japan",1955-09-10,"United States of America",1948-01-01,1,1,10,10,10,10,1,1
"600",2,"1999",750,1999,750,2,"Q4_2012","USA","USA-AD-817","USA-AD-815","India","IND","Cut-To-Length Carbon Steel Plate","2/24/99","7/29/99","4/8/99","A","A","7/29/99","AVD","12/29/99","2/10/00","A","A","2/10/00","AVD","IF","IF","AVD","72.49","72.49","G/ADP/N/59/USA",10,10,1,9,1,1,1,2.077063761,1.418164643,23.17266209,24.38790891,1,34639.11984,455.4735407,9.67e+12,4.67e+11,10.23412686,11.25469183,1.219934045,24.50227807,"2/24/99",1999-02-24,1999-02-24,342,2226,1999-07-29,9.67e+12,4.67e+11,10.23412686,11.25469183,23.17266209,24.38790891,34639.11984,455.4735407,1.219934045,24.50227807,"United States of America",1995-01-01,"India ",1995-01-01,1,1,"India",1948-07-08,"United States of America",1948-01-01,1,1,9,9,10,10,1,1
"601",2,"1999",160,1999,160,2,"Q4_2012","USA","USA-AD-829","USA-AD-829","Argentina","ARG","Cold-Rolled Carbon Steel Products","6/9/99","11/5/99","7/30/99","A","A","11/5/99","AVD","2/4/00","3/20/00","A","N",".",".",".",".",".",".",".",".",10,10,1,8,1,0,1,2.077063761,2.100327586,23.17266209,17.65178455,1,34639.11984,9405.790356,9.67e+12,3.43e+11,10.23412686,8.112502471,1.219934045,4.104074469,"6/9/99",1999-06-09,1999-06-09,3988,2331,1999-11-05,9.67e+12,3.43e+11,10.23412686,8.112502471,23.17266209,17.65178455,34639.11984,9405.790356,1.219934045,4.104074469,"United States of America",1995-01-01,"Argentina ",1995-01-01,1,1,"Argentina",1967-10-11,"United States of America",1948-01-01,1,1,8,8,10,10,1,1
"602",2,"1999",101,1999,101,2,"Q4_2012","USA","USA-AD-840","USA-AD-829","Venezuela","VEN","Cold-Rolled Carbon Steel Products","6/9/99","11/15/99","7/30/99","A","A","11/15/99","AVD","4/6/00","5/17/00","A","N",".",".",".",".",".",".",".",".",10,10,1,7,1,0,1,2.077063761,0.217589154,23.17266209,42.07023048,1,34639.11984,4091.632001,9.67e+12,97974136437,10.23412686,22.9117089,1.219934045,4.725817153,"6/9/99",1999-06-09,1999-06-09,127,2331,1999-11-15,9.67e+12,97974136437,10.23412686,22.9117089,23.17266209,42.07023048,34639.11984,4091.632001,1.219934045,4.725817153,"United States of America",1995-01-01,"Venezuela",1995-01-01,1,1,"Venezuela",1990-08-31,"United States of America",1948-01-01,1,1,7,7,10,10,1,1
"603",2,"1999",732,1999,732,2,"Q4_2012","USA","USA-AD-821","USA-AD-815","South Korea","KOR","Cut-To-Length Carbon Steel Plate","2/24/99","7/29/99","4/8/99","A","A","7/29/99","AVD","12/29/99","2/10/00","A","A","2/10/00","AVD","IF","IF","AVD","0.05","2.98","G/ADP/N/59/USA",10,10,1,8,1,0,1,2.077063761,1.002573,23.17266209,65.43023242,1,34639.11984,10432.2108,9.67e+12,4.86e+11,10.23412686,35.77703363,1.219934045,4.75889537,"2/24/99",1999-02-24,1999-02-24,364,2226,1999-07-29,9.67e+12,4.86e+11,10.23412686,35.77703363,23.17266209,65.43023242,34639.11984,10432.2108,1.219934045,4.75889537,"United States of America",1995-01-01,"South Korea",1995-01-01,1,1,"South Korea",1967-04-14,"United States of America",1948-01-01,1,1,8,8,10,10,1,1
"604",2,"1999",850,1999,850,2,"Q4_2012","USA","USA-AD-818","USA-AD-815","Indonesia","IDN","Cut-To-Length Carbon Steel Plate","2/24/99","7/29/99","4/8/99","A","A","7/29/99","AVD","12/29/99","2/10/00","A","A","2/10/00","AVD","IF","IF","AVD","50.8","52.42","G/ADP/N/65/USA",10,10,1,6,1,0,1,2.077063761,3.765437622,23.17266209,62.94391295,1,34639.11984,679.7936722,9.67e+12,1.4e+11,10.23412686,35.5141287,1.219934045,19.61266996,"2/24/99",1999-02-24,1999-02-24,279,2226,1999-07-29,9.67e+12,1.4e+11,10.23412686,35.5141287,23.17266209,62.94391295,34639.11984,679.7936722,1.219934045,19.61266996,"United States of America",1995-01-01,"Indonesia ",1995-01-01,1,1,"Indonesia",1950-02-24,"United States of America",1948-01-01,1,1,6,7,10,10,1,1
"605",2,"1999",740,1999,740,2,"Q4_2012","USA","USA-AD-833","USA-AD-829","Japan","JPN","Cold-Rolled Carbon Steel Products","6/9/99","11/5/99","7/30/99","A","A","11/5/99","AVD","2/4/00","3/20/00","A","N",".",".",".",".",".",".",".",".",10,10,1,10,1,0,1,2.077063761,0.490620156,23.17266209,18.75638736,1,34639.11984,34998.80997,9.67e+12,4.43e+12,10.23412686,10.17337581,1.219934045,1.679247869,"6/9/99",1999-06-09,1999-06-09,314,2331,1999-11-05,9.67e+12,4.43e+12,10.23412686,10.17337581,23.17266209,18.75638736,34639.11984,34998.80997,1.219934045,1.679247869,"United States of America",1995-01-01,"Japan ",1995-01-01,1,1,"Japan",1955-09-10,"United States of America",1948-01-01,1,1,10,10,10,10,1,1
"606",2,"1999",713,1998,713,2,"Q4_2012","USA","USA-AD-811","USA-AD-811","Taiwan","TWN","Drams of One Megabit and Above","10/29/98","5/28/99","12/16/98","A","A","5/28/99","AVD","10/19/99","12/8/99","A","N",".",".",".",".",".",".",".",".",10,10,1,9,1,0,1,2.349922309,NA,22.75912907,NA,0,32948.95126,NA,9.09e+12,NA,10.48398631,NA,1.300089704,NA,"10/29/98",1998-10-29,1998-10-29,3942,2108,1999-05-28,9.67e+12,NA,10.23412686,NA,23.17266209,NA,34639.11984,NA,1.219934045,NA,"United States of America",1995-01-01,"Taiwan",2002-01-01,0,1,NA,NA,"United States of America",1948-01-01,1,NA,9,9,10,10,1,1
"607",2,"1999",20,1998,20,2,"Q4_2012","USA","USA-AD-812","USA-AD-812","Canada","CAN","Live Cattle","11/19/98","7/8/99","1/25/99","A","A","7/8/99","AVD","10/21/99","11/24/99","A","N",".",".",".",".",".",".",".",".",10,10,1,10,1,0,1,2.349922309,6.745102129,22.75912907,78.20599319,0,32948.95126,20875.24831,9.09e+12,6.31e+11,10.48398631,40.06896331,1.300089704,2.576269825,"11/19/98",1998-11-19,1998-11-19,1841,2129,1999-07-08,9.67e+12,6.74e+11,10.23412686,41.98633521,23.17266209,80.40295655,34639.11984,22109.60399,1.219934045,2.483472464,"United States of America",1995-01-01,"Canada ",1995-01-01,1,1,"Canada",1948-01-01,"United States of America",1948-01-01,1,1,10,10,10,10,1,1
"608",2,"1999",710,1999,710,2,"Q4_2012","USA","USA-AD-841","USA-AD-841","China","CHN","Non-Frozen Apple Juice Concentrate","6/16/99","11/23/99","7/28/99","A","A","11/23/99","AVD","4/13/00","6/7/00","A","A","6/5/00","AVD","11/15/10","2010","AVD","8.98","51.74","G/ADP/N/65/USA",10,10,1,-7,0,0,1,2.077063761,1.212713583,23.17266209,37.96686524,0,34639.11984,864.7308423,9.67e+12,1.08e+12,10.23412686,20.39770198,1.219934045,16.4702426,"6/16/99",1999-06-16,1999-06-16,847,2338,1999-11-23,9.67e+12,1.08e+12,10.23412686,20.39770198,23.17266209,37.96686524,34639.11984,864.7308423,1.219934045,16.4702426,"United States of America",1995-01-01,"China ",2001-12-11,0,1,NA,NA,"United States of America",1948-01-01,1,NA,-7,0,10,10,1,0
"609",2,"1999",740,1999,740,2,"Q4_2012","USA","USA-AD-847a","USA-AD-847a","Japan","JPN","Large Diameter Pressure Pipe","7/8/99","12/14/99","8/27/99","A","A","12/14/99","AVD","5/4/00","6/26/00","A","A","6/26/00","AVD","IF","IF","AVD","68.88","107.8","G/ADP/N/65/USA",10,10,1,10,1,0,1,2.077063761,0.490620156,23.17266209,18.75638736,1,34639.11984,34998.80997,9.67e+12,4.43e+12,10.23412686,10.17337581,1.219934045,1.679247869,"7/8/99",1999-07-08,1999-07-08,343,2360,1999-12-14,9.67e+12,4.43e+12,10.23412686,10.17337581,23.17266209,18.75638736,34639.11984,34998.80997,1.219934045,1.679247869,"United States of America",1995-01-01,"Japan ",1995-01-01,1,1,"Japan",1955-09-10,"United States of America",1948-01-01,1,1,10,10,10,10,1,1
"610",2,"1999",750,1998,750,2,"Q4_2012","USA","USA-AD-805","USA-AD-805","India","IND","Elastic Steel Sheet and Strip","8/25/98","2/2/99","10/15/98","A","A","2/2/99","AVD","4/19/99","6/8/99","A","N",".",".",".",".",".",".",".",".",10,10,1,9,1,0,1,2.349922309,1.656051057,22.75912907,23.29101706,1,32948.95126,425.4452943,9.09e+12,4.29e+11,10.48398631,10.82856928,1.300089704,25.79098082,"8/25/98",1998-08-25,1998-08-25,159,2043,1999-02-02,9.67e+12,4.67e+11,10.23412686,11.25469183,23.17266209,24.38790891,34639.11984,455.4735407,1.219934045,24.50227807,"United States of America",1995-01-01,"India ",1995-01-01,1,1,"India",1948-07-08,"United States of America",1948-01-01,1,1,9,9,10,10,1,1
"611",2,"1999",220,1999,220,2,"Q4_2012","USA","USA-AD-816","USA-AD-815","France","FRA","Cut-To-Length Carbon Steel Plate","2/24/99","7/29/99","4/8/99","A","A","7/29/99","AVD","12/29/99","2/10/00","A","A","2/10/00","AVD","2/10/05","2005","AVD","10.41","10.41","G/ADP/N/65/USA",10,10,1,9,1,0,1,2.077063761,1.078988803,23.17266209,50.57611726,1,34639.11984,24075.01701,9.67e+12,1.46e+12,10.23412686,26.35445218,1.219934045,2.64938617,"2/24/99",1999-02-24,1999-02-24,1379,2226,1999-07-29,9.67e+12,1.46e+12,10.23412686,26.35445218,23.17266209,50.57611726,34639.11984,24075.01701,1.219934045,2.64938617,"United States of America",1995-01-01,"France ",1995-01-01,1,1,"France",1948-01-01,"United States of America",1948-01-01,1,1,9,9,10,10,1,1
"612",2,"1999",325,1999,325,2,"Q4_2012","USA","USA-AD-819","USA-AD-815","Italy","ITA","Cut-To-Length Carbon Steel Plate","2/24/99","7/29/99","4/8/99","A","A","7/29/99","AVD","12/29/99","2/10/00","A","A","2/10/00","AVD","1/4/12","2012","AVD","0","8.97","G/ADP/N/59/USA",10,10,1,10,1,0,1,2.077063761,0.697718764,23.17266209,46.64130468,1,34639.11984,21227.31087,9.67e+12,1.21e+12,10.23412686,24.27992645,1.219934045,3.027755412,"2/24/99",1999-02-24,1999-02-24,126,2226,1999-07-29,9.67e+12,1.21e+12,10.23412686,24.27992645,23.17266209,46.64130468,34639.11984,21227.31087,1.219934045,3.027755412,"United States of America",1995-01-01,"Italy ",1995-01-01,1,1,"Italy",1950-05-30,"United States of America",1948-01-01,1,1,10,10,10,10,1,1
"613",2,"1999",70,1998,70,2,"Q4_2012","USA","USA-AD-802","USA-AD-797","Mexico","MEX","Stainless Steel Sheet and Strip","6/17/98","1/4/99","8/5/98","A","A","1/4/99","AVD","6/8/99","7/28/99","A","A","7/27/99","AVD","8/10/11","2011","AVD","30.85","30.85","G/ADP/N/59/USA",10,10,1,6,1,1,1,2.349922309,0.783309588,22.75912907,51.77609803,1,32948.95126,4986.252659,9.09e+12,5.02e+11,10.48398631,25.74892715,1.300089704,4.206365878,"6/17/98",1998-06-17,1998-06-17,1294,1974,1999-01-04,9.67e+12,5.79e+11,10.23412686,25.48169145,23.17266209,51.2689011,34639.11984,5663.388512,1.219934045,3.953796773,"United States of America",1995-01-01,"Mexico ",1995-01-01,1,1,"Mexico",1986-08-24,"United States of America",1948-01-01,1,1,6,6,10,10,1,1
"614",2,"1999",220,1998,220,2,"Q4_2012","USA","USA-AD-797","USA-AD-797","France","FRA","Stainless Steel Sheet and Strip","6/17/98","1/4/99","8/5/98","A","A","1/4/99","AVD","6/8/99","7/28/99","A","A","7/27/99","AVD","7/27/04","2004","AVD","MI","MI","MI",10,10,1,9,1,1,1,2.349922309,1.128093344,22.75912907,50.4014939,1,32948.95126,24405.87657,9.09e+12,1.47e+12,10.48398631,26.4677143,1.300089704,2.797470926,"6/17/98",1998-06-17,1998-06-17,1127,1974,1999-01-04,9.67e+12,1.46e+12,10.23412686,26.35445218,23.17266209,50.57611726,34639.11984,24075.01701,1.219934045,2.64938617,"United States of America",1995-01-01,"France ",1995-01-01,1,1,"France",1948-01-01,"United States of America",1948-01-01,1,1,9,9,10,10,1,1
"615",2,"1999",740,1999,740,2,"Q4_2012","USA","USA-AD-820","USA-AD-815","Japan","JPN","Cut-To-Length Carbon Steel Plate","2/24/99","7/29/99","4/8/99","A","A","7/29/99","AVD","12/29/99","2/10/00","A","A","2/10/00","AVD","1/4/12","2012","AVD","10.78","59.12","G/ADP/N/59/USA",10,10,1,10,1,1,1,2.077063761,0.490620156,23.17266209,18.75638736,1,34639.11984,34998.80997,9.67e+12,4.43e+12,10.23412686,10.17337581,1.219934045,1.679247869,"2/24/99",1999-02-24,1999-02-24,209,2226,1999-07-29,9.67e+12,4.43e+12,10.23412686,10.17337581,23.17266209,18.75638736,34639.11984,34998.80997,1.219934045,1.679247869,"United States of America",1995-01-01,"Japan ",1995-01-01,1,1,"Japan",1955-09-10,"United States of America",1948-01-01,1,1,10,10,10,10,1,1
"616",2,"1999",740,1998,740,2,"Q4_2012","USA","USA-AD-800","USA-AD-797","Japan","JPN","Stainless Steel Sheet and Strip","6/17/98","1/4/99","8/5/98","A","A","1/4/99","AVD","6/8/99","7/28/99","A","A","7/27/99","AVD","IF","IF","AVD","MI","MI","MI",10,10,1,10,1,0,1,2.349922309,0.52714681,22.75912907,19.6888759,1,32948.95126,30967.28809,9.09e+12,3.91e+12,10.48398631,10.7774668,1.300089704,1.704186546,"6/17/98",1998-06-17,1998-06-17,888,1974,1999-01-04,9.67e+12,4.43e+12,10.23412686,10.17337581,23.17266209,18.75638736,34639.11984,34998.80997,1.219934045,1.679247869,"United States of America",1995-01-01,"Japan ",1995-01-01,1,1,"Japan",1955-09-10,"United States of America",1948-01-01,1,1,10,10,10,10,1,1
"617",2,"1999",365,1998,365,2,"Q4_2012","USA","USA-AD-808","USA-AD-806","Russia","RUS","Hot-Rolled Flat-Rolled Carbon-Quality Steel Products ","10/7/98","2/25/99","11/25/98","A","A","2/25/99","AVD","7/19/99","8/27/99","OTH","A","7/19/99","SA","IF","IF","AVD","73.59","184.56","G/ADP/N/59/USA",10,10,1,3,0,0,1,2.349922309,3.536867862,22.75912907,55.7727411,0,32948.95126,1834.845844,9.09e+12,2.71e+11,10.48398631,31.22147855,1.300089704,5.616002678,"10/7/98",1998-10-07,1998-10-07,2604,2086,1999-02-25,9.67e+12,1.96e+11,10.23412686,43.2202687,23.17266209,69.39376348,34639.11984,1330.747984,1.219934045,7.31454382,"United States of America",1995-01-01,"Russia",2012-08-22,0,1,NA,NA,"United States of America",1948-01-01,1,NA,3,4,10,10,1,0
"618",2,"1999",325,1998,325,2,"Q4_2012","USA","USA-AD-799","USA-AD-797","Italy","ITA","Stainless Steel Sheet and Strip","6/17/98","1/4/99","8/5/98","A","A","1/4/99","AVD","6/8/99","7/28/99","A","A","7/27/99","AVD","8/10/11","2011","AVD","MI","MI","MI",10,10,1,10,1,1,1,2.349922309,0.634332938,22.75912907,47.08565282,1,32948.95126,21519.06412,9.09e+12,1.22e+12,10.48398631,25.15430622,1.300089704,3.098162293,"6/17/98",1998-06-17,1998-06-17,760,1974,1999-01-04,9.67e+12,1.21e+12,10.23412686,24.27992645,23.17266209,46.64130468,34639.11984,21227.31087,1.219934045,3.027755412,"United States of America",1995-01-01,"Italy ",1995-01-01,1,1,"Italy",1950-05-30,"United States of America",1948-01-01,1,1,10,10,10,10,1,1
"619",2,"1999",710,1999,710,2,"Q4_2012","USA","USA-AD-851","USA-AD-851","China","CHN","Synthetic Indigo","7/8/99","12/14/99","8/25/99","A","A","12/14/99","AVD","5/3/00","6/9/00","A","A","6/19/00","AVD","6/19/05","2005","AVD","79.2","129.6","G/ADP/N/65/USA",10,10,1,-7,0,0,1,2.077063761,1.212713583,23.17266209,37.96686524,0,34639.11984,864.7308423,9.67e+12,1.08e+12,10.23412686,20.39770198,1.219934045,16.4702426,"7/8/99",1999-07-08,1999-07-08,869,2360,1999-12-14,9.67e+12,1.08e+12,10.23412686,20.39770198,23.17266209,37.96686524,34639.11984,864.7308423,1.219934045,16.4702426,"United States of America",1995-01-01,"China ",2001-12-11,0,1,NA,NA,"United States of America",1948-01-01,1,NA,-7,0,10,10,1,0
"620",2,"1999",800,1999,800,2,"Q4_2012","USA","USA-AD-838","USA-AD-829","Thailand","THA","Cold-Rolled Carbon Steel Products","6/9/99","11/5/99","7/30/99","A","A","11/5/99","AVD","2/4/00","3/20/00","A","N",".",".",".",".",".",".",".",".",10,10,1,9,1,0,1,2.077063761,3.023915411,23.17266209,104.0235932,0,34639.11984,1989.994923,9.67e+12,1.23e+11,10.23412686,58.29765213,1.219934045,9.391839512,"6/9/99",1999-06-09,1999-06-09,577,2331,1999-11-05,9.67e+12,1.23e+11,10.23412686,58.29765213,23.17266209,104.0235932,34639.11984,1989.994923,1.219934045,9.391839512,"United States of America",1995-01-01,"Thailand ",1995-01-01,1,1,"Thailand",1982-11-20,"United States of America",1948-01-01,1,1,9,9,10,10,1,1
"621",2,"1999",732,1998,732,2,"Q4_2012","USA","USA-AD-801","USA-AD-797","South Korea","KOR","Stainless Steel Sheet and Strip","6/17/98","1/4/99","8/5/98","A","A","1/4/99","AVD","6/8/99","7/28/99","A","A","7/27/99","AVD","IF","IF","AVD","MI","MI","MI",10,10,1,8,1,1,1,2.349922309,1.10598414,22.75912907,72.9054547,1,32948.95126,8133.731245,9.09e+12,3.76e+11,10.48398631,42.35677439,1.300089704,4.636583786,"6/17/98",1998-06-17,1998-06-17,112,1974,1999-01-04,9.67e+12,4.86e+11,10.23412686,35.77703363,23.17266209,65.43023242,34639.11984,10432.2108,1.219934045,4.75889537,"United States of America",1995-01-01,"South Korea",1995-01-01,1,1,"South Korea",1967-04-14,"United States of America",1948-01-01,1,1,8,8,10,10,1,1
"622",2,"1999",740,1999,740,2,"Q4_2012","USA","USA-AD-847b","USA-AD-846","Japan","JPN","Small Diameter Pressure Pipe","7/8/99","12/14/99","8/27/99","A","A","12/14/99","AVD","5/4/00","6/26/00","A","A","6/26/00","AVD","IF","IF","AVD","70.43","106.67","G/ADP/N/65/USA",10,10,1,10,1,0,1,2.077063761,0.490620156,23.17266209,18.75638736,1,34639.11984,34998.80997,9.67e+12,4.43e+12,10.23412686,10.17337581,1.219934045,1.679247869,"7/8/99",1999-07-08,1999-07-08,343,2360,1999-12-14,9.67e+12,4.43e+12,10.23412686,10.17337581,23.17266209,18.75638736,34639.11984,34998.80997,1.219934045,1.679247869,"United States of America",1995-01-01,"Japan ",1995-01-01,1,1,"Japan",1955-09-10,"United States of America",1948-01-01,1,1,10,10,10,10,1,1
"623",2,"1999",255,1998,255,2,"Q4_2012","USA","USA-AD-798","USA-AD-797","Germany","DEU","Stainless Steel Sheet and Strip","6/17/98","1/4/99","8/5/98","A","A","1/4/99","AVD","6/8/99","7/28/99","A","A","7/27/99","AVD","8/10/11","2011","AVD","25.37","25.37","G/ADP/N/59/USA",10,10,1,10,1,1,1,2.349922309,0.915361126,22.75912907,55.79170281,1,32948.95126,26547.77535,9.09e+12,2.18e+12,10.48398631,28.58294637,1.300089704,1.073012219,"6/17/98",1998-06-17,1998-06-17,5738,1974,1999-01-04,9.67e+12,2.13e+12,10.23412686,29.40355964,23.17266209,57.92820718,34639.11984,25956.63741,1.219934045,1.059086461,"United States of America",1995-01-01,"Germany ",1995-01-01,1,1,"Germany",1951-10-01,"United States of America",1948-01-01,1,1,10,10,10,10,1,1
"624",2,"1999",732,1999,732,2,"Q4_2012","USA","USA-AD-825","USA-AD-825","South Korea","KOR","Polyester Staple Fiber","4/9/99","11/8/99","5/26/99","A","A","11/8/99","AVD","3/30/00","5/24/00","A","A","5/25/00","AVD","IF","IF","AVD","0.14","14.1","G/ADP/N/65/USA",10,10,1,8,1,0,1,2.077063761,1.002573,23.17266209,65.43023242,1,34639.11984,10432.2108,9.67e+12,4.86e+11,10.23412686,35.77703363,1.219934045,4.75889537,"4/9/99",1999-04-09,1999-04-09,408,2270,1999-11-08,9.67e+12,4.86e+11,10.23412686,35.77703363,23.17266209,65.43023242,34639.11984,10432.2108,1.219934045,4.75889537,"United States of America",1995-01-01,"South Korea",1995-01-01,1,1,"South Korea",1967-04-14,"United States of America",1948-01-01,1,1,8,8,10,10,1,1
"625",2,"1999",365,1999,365,2,"Q4_2012","USA","USA-AD-834","USA-AD-829","Russia","RUS","Cold-Rolled Carbon Steel Products","6/9/99","11/10/99","7/30/99","A","A","11/10/99","AVD","2/4/00","3/20/00","A","N",".",".",".",".",".",".",".",".",10,10,1,3,0,0,1,2.077063761,3.577098483,23.17266209,69.39376348,0,34639.11984,1330.747984,9.67e+12,1.96e+11,10.23412686,43.2202687,1.219934045,7.31454382,"6/9/99",1999-06-09,1999-06-09,2849,2331,1999-11-10,9.67e+12,1.96e+11,10.23412686,43.2202687,23.17266209,69.39376348,34639.11984,1330.747984,1.219934045,7.31454382,"United States of America",1995-01-01,"Russia",2012-08-22,0,1,NA,NA,"United States of America",1948-01-01,1,NA,3,4,10,10,1,0
"626",2,"1999",710,1999,710,2,"Q4_2012","USA","USA-AD-814","USA-AD-814","China","CHN","Creatine Monohydrate","2/22/99","7/30/99","4/7/99","A","A","7/30/99","AVD","12/20/99","2/3/00","A","A","2/4/00","AVD","4/11/05","2005","AVD","0","153.7","G/ADP/N/59/USA",10,10,1,-7,0,0,1,2.077063761,1.212713583,23.17266209,37.96686524,0,34639.11984,864.7308423,9.67e+12,1.08e+12,10.23412686,20.39770198,1.219934045,16.4702426,"2/22/99",1999-02-22,1999-02-22,733,2224,1999-07-30,9.67e+12,1.08e+12,10.23412686,20.39770198,23.17266209,37.96686524,34639.11984,864.7308423,1.219934045,16.4702426,"United States of America",1995-01-01,"China ",2001-12-11,0,1,NA,NA,"United States of America",1948-01-01,1,NA,-7,0,10,10,1,0
"627",2,"1999",713,1998,713,2,"Q4_2012","USA","USA-AD-803","USA-AD-797","Taiwan","TWN","Stainless Steel Sheet and Strip","6/17/98","1/4/99","8/5/98","A","A","1/4/99","AVD","6/8/99","7/28/99","A","A","7/27/99","AVD","IF","IF","AVD","0","34.95","G/ADP/N/59/USA",10,10,1,9,1,0,1,2.349922309,NA,22.75912907,NA,0,32948.95126,NA,9.09e+12,NA,10.48398631,NA,1.300089704,NA,"6/17/98",1998-06-17,1998-06-17,3808,1974,1999-01-04,9.67e+12,NA,10.23412686,NA,23.17266209,NA,34639.11984,NA,1.219934045,NA,"United States of America",1995-01-01,"Taiwan",2002-01-01,0,1,NA,NA,"United States of America",1948-01-01,1,NA,9,9,10,10,1,1
"628",2,"1999",560,1999,560,2,"Q4_2012","USA","USA-AD-836","USA-AD-829","South Africa","ZAF","Cold-Rolled Carbon Steel Products","6/9/99","11/10/99","7/30/99","A","A","11/10/99","AVD","2/4/00","3/20/00","A","N",".",".",".",".",".",".",".",".",10,10,1,9,1,0,1,2.077063761,3.214746066,23.17266209,48.07535622,0,34639.11984,3102.813799,9.67e+12,1.33e+11,10.23412686,25.33468196,1.219934045,3.543098869,"6/9/99",1999-06-09,1999-06-09,1856,2331,1999-11-10,9.67e+12,1.33e+11,10.23412686,25.33468196,23.17266209,48.07535622,34639.11984,3102.813799,1.219934045,3.543098869,"United States of America",1995-01-01,"South Africa",1995-01-01,1,1,"South Africa",1948-06-13,"United States of America",1948-01-01,1,1,9,9,10,10,1,1
"629",2,"1999",560,1999,560,2,"Q4_2012","USA","USA-AD-850","USA-AD-846","South Africa","ZAF","Small Diameter Pressure Pipe","7/8/99","12/14/99","8/27/99","A","A","12/14/99","AVD","5/4/00","6/26/00","A","A","6/26/00","AVD","6/26/05","2005","AVD","40.17","43.51","G/ADP/N/65/USA",10,10,1,9,1,0,1,2.077063761,3.214746066,23.17266209,48.07535622,0,34639.11984,3102.813799,9.67e+12,1.33e+11,10.23412686,25.33468196,1.219934045,3.543098869,"7/8/99",1999-07-08,1999-07-08,22,2360,1999-12-14,9.67e+12,1.33e+11,10.23412686,25.33468196,23.17266209,48.07535622,34639.11984,3102.813799,1.219934045,3.543098869,"United States of America",1995-01-01,"South Africa",1995-01-01,1,1,"South Africa",1948-06-13,"United States of America",1948-01-01,1,1,9,9,10,10,1,1
"630",2,"2000",732,1999,732,2,"Q4_2012","USA","USA-AD-854","USA-AD-852","South Korea","KOR","Structural Steel Beams","7/16/99","2/11/00","9/1/99","A","A","2/11/00","AVD","7/5/00","8/14/00","A","A","8/18/00","AVD","8/18/05","2005","AVD","25.31","49.01","G/ADP/N/72/USA",10,10,1,8,1,0,1,2.077063761,1.002573,23.17266209,65.43023242,1,34639.11984,10432.2108,9.67e+12,4.86e+11,10.23412686,35.77703363,1.219934045,4.75889537,"7/16/99",1999-07-16,1999-07-16,506,2368,2000-02-11,1.03e+13,5.62e+11,10.63490675,35.0088675,24.96379875,67.94720274,36467.29543,11947.57725,1.190978876,4.392899263,"United States of America",1995-01-01,"South Korea",1995-01-01,1,1,"South Korea",1967-04-14,"United States of America",1948-01-01,1,1,8,8,10,10,1,1
"631",2,"2000",713,1999,713,2,"Q4_2012","USA","USA-AD-837","USA-AD-829","Taiwan","TWN","Cold-Rolled Carbon Steel Products","6/9/99","1/7/00","7/30/99","A","A","1/7/00","AVD","5/31/00","7/17/00","A","N",".",".",".",".",".",".",".",".",10,10,1,9,1,0,1,2.077063761,NA,23.17266209,NA,0,34639.11984,NA,9.67e+12,NA,10.23412686,NA,1.219934045,NA,"6/9/99",1999-06-09,1999-06-09,4165,2331,2000-01-07,1.03e+13,NA,10.63490675,NA,24.96379875,NA,36467.29543,NA,1.190978876,NA,"United States of America",1995-01-01,"Taiwan",2002-01-01,0,1,NA,NA,"United States of America",1948-01-01,1,NA,9,9,10,10,1,1
"632",2,"2000",70,1999,70,2,"Q4_2012","USA","USA-AD-848","USA-AD-847a","Mexico","MEX","Large Diameter Pressure Pipe","7/8/99","2/4/00","8/27/99","A","A","2/4/00","AVD","6/26/00","8/9/00","A","A","8/11/00","AVD","8/11/05","2005","AVD","15.05","15.05","G/ADP/N/72/USA",10,10,1,6,1,0,1,2.077063761,0.624501262,23.17266209,51.2689011,1,34639.11984,5663.388512,9.67e+12,5.79e+11,10.23412686,25.48169145,1.219934045,3.953796773,"7/8/99",1999-07-08,1999-07-08,1680,2360,2000-02-04,1.03e+13,6.84e+11,10.63490675,26.27670441,24.96379875,53.13105126,36467.29543,6581.536932,1.190978876,3.535313249,"United States of America",1995-01-01,"Mexico ",1995-01-01,1,1,"Mexico",1986-08-24,"United States of America",1948-01-01,1,1,8,8,10,10,1,1
"633",2,"2000",710,2000,710,2,"Q4_2012","USA","USA-AD-868","USA-AD-868","China","CHN","Steel Wire Rope","3/9/00","10/2/00","4/26/00","A","A","10/2/00","AVD","2/28/01","4/9/01","A","N",".",".",".",".",".",".",".",".",10,10,1,-7,0,0,1,2.295750911,1.085311721,24.96379875,44.24362337,0,36467.29543,949.178065,1.03e+13,1.2e+12,10.63490675,23.32640438,1.190978876,15.06303446,"3/9/00",2000-03-09,2000-03-09,1114,2605,2000-10-02,1.03e+13,1.2e+12,10.63490675,23.32640438,24.96379875,44.24362337,36467.29543,949.178065,1.190978876,15.06303446,"United States of America",1995-01-01,"China ",2001-12-11,0,1,NA,NA,"United States of America",1948-01-01,1,NA,-7,0,10,10,1,0
"634",2,"2000",840,2000,840,2,"Q4_2012","USA","USA-AD-867","USA-AD-864","Philippines","PHL","Butt-Weld Pipe Fittings","1/7/00","8/2/00","2/24/00","A","A","8/2/00","AVD","12/27/00","2/5/01","A","A","2/23/01","AVD","IF","IF","AVD","33.81","33.81","G/ADP/N/72/USA",10,10,1,8,1,0,1,2.295750911,0.557745269,24.96379875,104.7298598,0,36467.29543,1043.456103,1.03e+13,81026294681,10.63490675,51.36929375,1.190978876,13.96678221,"1/7/00",2000-01-07,2000-01-07,556,2543,2000-08-02,1.03e+13,81026294681,10.63490675,51.36929375,24.96379875,104.7298598,36467.29543,1043.456103,1.190978876,13.96678221,"United States of America",1995-01-01,"Philippines ",1995-01-01,1,1,"Philippines",1979-12-27,"United States of America",1948-01-01,1,1,8,8,10,10,1,1
"635",2,"2000",740,1999,740,2,"Q4_2012","USA","USA-AD-853","USA-AD-852","Japan","JPN","Structural Steel Beams","7/16/99","2/11/00","9/1/99","A","A","2/11/00","AVD","4/25/00","7/19/00","A","A","6/19/00","AVD","6/19/05","2005","AVD","31.98","65.21","G/ADP/N/65/USA",10,10,1,10,1,0,1,2.077063761,0.490620156,23.17266209,18.75638736,1,34639.11984,34998.80997,9.67e+12,4.43e+12,10.23412686,10.17337581,1.219934045,1.679247869,"7/16/99",1999-07-16,1999-07-16,351,2368,2000-02-11,1.03e+13,4.73e+12,10.63490675,10.8773781,24.96379875,20.3060448,36467.29543,37291.70616,1.190978876,1.586389312,"United States of America",1995-01-01,"Japan ",1995-01-01,1,1,"Japan",1955-09-10,"United States of America",1948-01-01,1,1,10,10,10,10,1,1
"636",2,"2000",315,1999,315,2,"Q4_2012","USA","USA-AD-846","USA-AD-846","Czech Republic","CZE","Small Diameter Pressure Pipe","7/8/99","2/4/00","8/27/99","A","A","2/4/00","AVD","6/26/00","8/9/00","A","A","8/14/00","AVD","8/14/05","2005","AVD","32.26","39.93","G/ADP/N/65/USA",10,10,1,10,1,0,1,2.077063761,2.560731776,23.17266209,107.2165817,0,34639.11984,6044.981144,9.67e+12,62165739783,10.23412686,53.33042038,1.219934045,3.579269551,"7/8/99",1999-07-08,1999-07-08,356,2360,2000-02-04,1.03e+13,NA,10.63490675,NA,24.96379875,NA,36467.29543,NA,1.190978876,NA,"United States of America",1995-01-01,NA,1995-01-01,1,1,NA,NA,"United States of America",1948-01-01,1,NA,10,10,10,10,1,1
"637",2,"2000",850,1999,850,2,"Q4_2012","USA","USA-AD-861","USA-AD-861","Indonesia","IDN","Expandable Polystyrene Resins","12/3/99","6/26/00","1/14/00","A","A","6/26/00","AVD","11/16/00","12/19/00","A","N",".",".",".",".",".",".",".",".",10,10,1,6,1,0,1,2.077063761,3.765437622,23.17266209,62.94391295,1,34639.11984,679.7936722,9.67e+12,1.4e+11,10.23412686,35.5141287,1.219934045,19.61266996,"12/3/99",1999-12-03,1999-12-03,44,2508,2000-06-26,1.03e+13,1.65e+11,10.63490675,40.97730855,24.96379875,71.43687599,36467.29543,789.8058801,1.190978876,15.60197123,"United States of America",1995-01-01,"Indonesia ",1995-01-01,1,1,"Indonesia",1950-02-24,"United States of America",1948-01-01,1,1,6,7,10,10,1,1
"638",2,"2000",740,1999,740,2,"Q4_2012","USA","USA-AD-860","USA-AD-860","Japan","JPN","Tin Mill Products","11/4/99","4/12/00","12/21/99","A","A","4/12/00","AVD","6/26/00","8/16/00","A","A","8/28/00","AVD","IF","IF","AVD","32.52","95.29","G/ADP/N/65/USA",10,10,1,10,1,0,1,2.077063761,0.490620156,23.17266209,18.75638736,1,34639.11984,34998.80997,9.67e+12,4.43e+12,10.23412686,10.17337581,1.219934045,1.679247869,"11/4/99",1999-11-04,1999-11-04,462,2479,2000-04-12,1.03e+13,4.73e+12,10.63490675,10.8773781,24.96379875,20.3060448,36467.29543,37291.70616,1.190978876,1.586389312,"United States of America",1995-01-01,"Japan ",1995-01-01,1,1,"Japan",1955-09-10,"United States of America",1948-01-01,1,1,10,10,10,10,1,1
"639",2,"2000",360,1999,360,2,"Q4_2012","USA","USA-AD-849","USA-AD-846","Romania","ROU","Small Diameter Pressure Pipe","7/8/99","2/4/00","8/27/99","A","A","2/4/00","AVD","6/23/00","8/9/00","A","A","8/10/00","AVD","IF","IF","AVD","11.08","15.15","G/ADP/N/72/USA",10,10,1,8,1,0,1,2.077063761,4.879246394,23.17266209,60.86839403,0,34639.11984,1583.849846,9.67e+12,35592337083,10.23412686,28.01800219,1.219934045,15.15275142,"7/8/99",1999-07-08,1999-07-08,449,2360,2000-02-04,1.03e+13,37305099928,10.63490675,32.83290897,24.96379875,70.96633187,36467.29543,1662.217535,1.190978876,12.0621862,"United States of America",1995-01-01,"Romania ",1995-01-01,1,1,"Romania",1971-11-14,"United States of America",1948-01-01,1,1,8,8,10,10,1,1
"640",2,"2000",732,1999,732,2,"Q4_2012","USA","USA-AD-862","USA-AD-861","South Korea","KOR","Expandable Polystyrene Resins","12/3/99","6/26/00","1/14/00","A","A","6/26/00","AVD","11/16/00",".","N","T",".",".",".",".",".",".",".",".",10,10,1,8,1,0,1,2.077063761,1.002573,23.17266209,65.43023242,1,34639.11984,10432.2108,9.67e+12,4.86e+11,10.23412686,35.77703363,1.219934045,4.75889537,"12/3/99",1999-12-03,1999-12-03,646,2508,2000-06-26,1.03e+13,5.62e+11,10.63490675,35.0088675,24.96379875,67.94720274,36467.29543,11947.57725,1.190978876,4.392899263,"United States of America",1995-01-01,"South Korea",1995-01-01,1,1,"South Korea",1967-04-14,"United States of America",1948-01-01,1,1,8,8,10,10,1,1
"641",2,"2000",710,1999,710,2,"Q4_2012","USA","USA-AD-828","USA-AD-828","China","CHN","Aspirin","6/7/99","1/3/00","7/19/99","A","A","1/3/00","AVD","5/25/00","7/6/00","A","A","7/11/00","AVD","12/28/04","2004","AVD","10.85","144.02","G/ADP/N/65/USA",10,10,1,-7,0,0,1,2.077063761,1.212713583,23.17266209,37.96686524,0,34639.11984,864.7308423,9.67e+12,1.08e+12,10.23412686,20.39770198,1.219934045,16.4702426,"6/7/99",1999-06-07,1999-06-07,838,2329,2000-01-03,1.03e+13,1.2e+12,10.63490675,23.32640438,24.96379875,44.24362337,36467.29543,949.178065,1.190978876,15.06303446,"United States of America",1995-01-01,"China ",2001-12-11,0,1,NA,NA,"United States of America",1948-01-01,1,NA,-7,0,10,10,1,0
"642",2,"2000",255,2000,255,2,"Q4_2012","USA","USA-AD-864","USA-AD-864","Germany","DEU","Stainless Steel Butt-Weld Pipe Fittings","1/7/00","8/2/00","2/24/00","A","A","8/2/00","AVD","10/16/00","12/5/00","A","N",".",".",".",".",".",".",".",".",10,10,1,10,1,0,1,2.295750911,0.892198767,24.96379875,66.46153846,1,36467.29543,22945.70885,1.03e+13,1.89e+12,10.63490675,33.38461538,1.190978876,1.110519799,"1/7/00",2000-01-07,2000-01-07,437,2543,2000-08-02,1.03e+13,1.89e+12,10.63490675,33.38461538,24.96379875,66.46153846,36467.29543,22945.70885,1.190978876,1.110519799,"United States of America",1995-01-01,"Germany ",1995-01-01,1,1,"Germany",1951-10-01,"United States of America",1948-01-01,1,1,10,10,10,10,1,1
"643",2,"2000",820,2000,820,2,"Q4_2012","USA","USA-AD-870","USA-AD-868","Malaysia","MYS","Steel Wire Rope","3/9/00","10/2/00","4/26/00","N","A","10/2/00","AVD","2/28/01",".","N",".",".",".",".",".",".",".",".",".",10,10,1,3,0,0,1,2.295750911,2.61031243,24.96379875,220.4074074,0,36467.29543,4004.545955,1.03e+13,93789473684,10.63490675,119.8100449,1.190978876,8.599046016,"3/9/00",2000-03-09,2000-03-09,6811,2605,2000-10-02,1.03e+13,93789473684,10.63490675,119.8100449,24.96379875,220.4074074,36467.29543,4004.545955,1.190978876,8.599046016,"United States of America",1995-01-01,"Malaysia ",1995-01-01,1,1,"Malaysia",1957-10-24,"United States of America",1948-01-01,1,1,3,4,10,10,1,0
"644",2,"2000",740,1999,740,2,"Q4_2012","USA","USA-AD-859","USA-AD-859","Japan","JPN","Seamless Stainless Steel Hollow Products","11/4/99","5/1/00","12/21/99","A","A","5/1/00","AVD","7/12/00","8/30/00","A","N",".",".",".",".",".",".",".",".",10,10,1,10,1,0,1,2.077063761,0.490620156,23.17266209,18.75638736,1,34639.11984,34998.80997,9.67e+12,4.43e+12,10.23412686,10.17337581,1.219934045,1.679247869,"11/4/99",1999-11-04,1999-11-04,462,2479,2000-05-01,1.03e+13,4.73e+12,10.63490675,10.8773781,24.96379875,20.3060448,36467.29543,37291.70616,1.190978876,1.586389312,"United States of America",1995-01-01,"Japan ",1995-01-01,1,1,"Japan",1955-09-10,"United States of America",1948-01-01,1,1,10,10,10,10,1,1
"645",2,"2000",640,1999,640,2,"Q4_2012","USA","USA-AD-839","USA-AD-829","Turkey","TUR","Cold-Rolled Carbon Steel Products","6/9/99","1/7/00","7/30/99","A","A","1/7/00","AVD","3/21/00","5/17/00","A","N",".",".",".",".",".",".",".",".",10,10,1,7,1,0,1,2.077063761,1.34201247,23.17266209,38.72587738,1,34639.11984,4012.472793,9.67e+12,2.5e+11,10.23412686,19.43988625,1.219934045,11.53718485,"6/9/99",1999-06-09,1999-06-09,149,2331,2000-01-07,1.03e+13,2.67e+11,10.63490675,20.0978721,24.96379875,43.19214543,36467.29543,4219.544349,1.190978876,11.31150937,"United States of America",1995-01-01,"Turkey ",1995-03-26,1,1,"Turkey",1951-10-17,"United States of America",1948-01-01,1,1,7,8,10,10,1,1
"646",2,"2000",317,1999,317,2,"Q4_2012","USA","USA-AD-835","USA-AD-829","Slovakia","SVK","Cold-Rolled Carbon Steel Products","6/9/99","1/7/00","7/30/99","A","A","1/7/00","SD","5/31/00","7/17/00","A","N",".",".",".",".",".",".",".",".",10,10,1,9,1,0,1,2.077063761,2.482733452,23.17266209,126.8180934,0,34639.11984,5550.004292,9.67e+12,29947934157,10.23412686,61.16324976,1.219934045,4.743961212,"6/9/99",1999-06-09,1999-06-09,222,2331,2000-01-07,1.03e+13,28724041828,10.63490675,70.44851064,24.96379875,143.4736581,36467.29543,5330.401622,1.190978876,4.474773304,"United States of America",1995-01-01,"Slovakia",1995-01-01,1,1,"Slovakia",1993-04-15,"United States of America",1948-01-01,1,1,9,9,10,10,1,1
"647",2,"2000",325,2000,325,2,"Q4_2012","USA","USA-AD-865","USA-AD-864","Italy","ITA","Butt-Weld Pipe Fittings","1/7/00","8/2/00","2/24/00","A","A","8/2/00","AVD","12/27/00","2/5/01","A","A","2/23/01","AVD","IF","IF","AVD","26.59","26.59","G/ADP/N/72/USA",10,10,1,10,1,0,1,2.295750911,0.698530087,24.96379875,52.58415044,1,36467.29543,19388.27875,1.03e+13,1.1e+12,10.63490675,26.76879547,1.190978876,2.804762303,"1/7/00",2000-01-07,2000-01-07,443,2543,2000-08-02,1.03e+13,1.1e+12,10.63490675,26.76879547,24.96379875,52.58415044,36467.29543,19388.27875,1.190978876,2.804762303,"United States of America",1995-01-01,"Italy ",1995-01-01,1,1,"Italy",1950-05-30,"United States of America",1948-01-01,1,1,10,10,10,10,1,1
"648",2,"2000",750,2000,750,2,"Q4_2012","USA","USA-AD-869","USA-AD-868","India","IND","Steel Wire Rope","3/9/00","10/2/00","4/26/00","A","A","10/2/00","AVD","2/28/01","4/9/01","A","N",".",".",".",".",".",".",".",".",10,10,1,9,1,0,1,2.295750911,1.258907331,24.96379875,26.43729384,1,36467.29543,457.2835418,1.03e+13,4.77e+11,10.63490675,12.77323297,1.190978876,23.02185278,"3/9/00",2000-03-09,2000-03-09,721,2605,2000-10-02,1.03e+13,4.77e+11,10.63490675,12.77323297,24.96379875,26.43729384,36467.29543,457.2835418,1.190978876,23.02185278,"United States of America",1995-01-01,"India ",1995-01-01,1,1,"India",1948-07-08,"United States of America",1948-01-01,1,1,9,9,10,10,1,1
"649",2,"2000",710,1999,710,2,"Q4_2012","USA","USA-AD-831","USA-AD-829","China","CHN","Cold-Rolled Carbon Steel Products","6/9/99","1/7/00","7/30/99","A","A","1/7/00","AVD","5/31/00","7/17/00","A","N",".",".",".",".",".",".",".",".",10,10,1,-7,0,0,1,2.077063761,1.212713583,23.17266209,37.96686524,0,34639.11984,864.7308423,9.67e+12,1.08e+12,10.23412686,20.39770198,1.219934045,16.4702426,"6/9/99",1999-06-09,1999-06-09,840,2331,2000-01-07,1.03e+13,1.2e+12,10.63490675,23.32640438,24.96379875,44.24362337,36467.29543,949.178065,1.190978876,15.06303446,"United States of America",1995-01-01,"China ",2001-12-11,0,1,NA,NA,"United States of America",1948-01-01,1,NA,-7,0,10,10,1,0
"650",2,"2000",365,1999,365,2,"Q4_2012","USA","USA-AD-856","USA-AD-856","Russia","RUS","Ammonium Nitrate","8/2/99","1/7/00","9/15/99","A","A","1/7/00","AVD","7/11/00","8/21/00","A","A","6/16/00","SA","4/27/11","2011","SA","253.98","253.98","G/ADP/N/72/USA",10,10,1,3,0,0,1,2.077063761,3.577098483,23.17266209,69.39376348,0,34639.11984,1330.747984,9.67e+12,1.96e+11,10.23412686,43.2202687,1.219934045,7.31454382,"8/2/99",1999-08-02,1999-08-02,2903,2385,2000-01-07,1.03e+13,2.6e+11,10.63490675,44.06072054,24.96379875,68.09433859,36467.29543,1771.582819,1.190978876,6.434521622,"United States of America",1995-01-01,"Russia",2012-08-22,0,1,NA,NA,"United States of America",1948-01-01,1,NA,6,6,10,10,1,1
"651",2,"2000",850,1999,850,2,"Q4_2012","USA","USA-AD-832","USA-AD-829","Indonesia","IDN","Cold-Rolled Carbon Steel Products","6/9/99","1/7/00","7/30/99","A","A","1/7/00","AVD","5/31/00","7/17/00","A","N",".",".",".",".",".",".",".",".",10,10,1,6,1,0,1,2.077063761,3.765437622,23.17266209,62.94391295,1,34639.11984,679.7936722,9.67e+12,1.4e+11,10.23412686,35.5141287,1.219934045,19.61266996,"6/9/99",1999-06-09,1999-06-09,384,2331,2000-01-07,1.03e+13,1.65e+11,10.63490675,40.97730855,24.96379875,71.43687599,36467.29543,789.8058801,1.190978876,15.60197123,"United States of America",1995-01-01,"Indonesia ",1995-01-01,1,1,"Indonesia",1950-02-24,"United States of America",1948-01-01,1,1,6,7,10,10,1,1
"652",2,"2001",710,2001,710,2,"Q4_2012","USA","USA-AD-935","USA-AD-935","China","CHN","Structural Steel Beams","6/4/01","12/28/01","7/16/01","A","A","12/28/01","AVD","5/20/02","6/27/02","A","N",".",".",".",".",".",".",".",".",10,10,1,-7,0,0,1,2.306059661,0.863739086,22.8379434,43.08019713,0,37285.81592,1041.6377,1.06e+13,1.32e+12,9.68255014,22.60010168,1.181402837,14.39172359,"6/4/01",2001-06-04,2001-06-04,1566,134,2001-12-28,1.06e+13,1.32e+12,9.68255014,22.60010168,22.8379434,43.08019713,37285.81592,1041.6377,1.181402837,14.39172359,"United States of America",1995-01-01,"China ",2001-12-11,1,1,NA,NA,"United States of America",1948-01-01,1,NA,-7,0,10,10,1,0
"653",2,"2001",750,2001,750,2,"Q4_2012","USA","USA-AD-933","USA-AD-933","India","IND","Polyethylene Terephthalate Film","5/29/01","12/21/01","7/11/01","A","A","12/21/01","AVD","5/16/02","6/27/02","A","A","7/1/02","AVD","IF","IF","AVD","24.14","24.14","G/ADP/N/98/USA",10,10,1,9,1,0,1,2.306059661,1.139473046,22.8379434,25.54526907,1,37285.81592,466.2141765,1.06e+13,4.94e+11,9.68255014,12.34193985,1.181402837,22.92230619,"5/29/01",2001-05-29,2001-05-29,1167,128,2001-12-21,1.06e+13,4.94e+11,9.68255014,12.34193985,22.8379434,25.54526907,37285.81592,466.2141765,1.181402837,22.92230619,"United States of America",1995-01-01,"India ",1995-01-01,1,1,"India",1948-07-08,"United States of America",1948-01-01,1,1,9,9,10,10,1,1
"654",2,"2001",800,2000,800,2,"Q4_2012","USA","USA-AD-907","USA-AD-898","Thailand","THA","Hot-Rolled Carbon Steel Products","11/22/00","5/3/01","1/4/01","A","A","5/3/01","AVD","9/28/01","11/15/01","A","A","11/29/01","AVD","IF","IF","AVD","3.86","19.72","G/ADP/N/85/USA",10,10,1,9,1,0,1,2.295750911,3.295531611,24.96379875,124.9223043,0,36467.29543,1968.536991,1.03e+13,1.23e+11,10.63490675,66.77764842,1.190978876,9.023141829,"11/22/00",2000-11-22,2000-11-22,1109,2863,2001-05-03,1.06e+13,1.16e+11,9.68255014,65.85660237,22.8379434,125.2229764,37285.81592,1831.902788,1.181402837,9.134212863,"United States of America",1995-01-01,"Thailand ",1995-01-01,1,1,"Thailand",1982-11-20,"United States of America",1948-01-01,1,1,9,9,10,10,1,1
"655",2,"2001",732,2000,732,2,"Q4_2012","USA","USA-AD-877","USA-AD-872","South Korea","KOR","Steel Concrete Rebar","7/7/00","1/30/01","8/23/00","A","A","1/30/01","AVD","6/22/01","7/30/01","A","A","9/7/01","AVD","9/7/06","2006","AVD","22.89","102.28","G/ADP/N/78/USA",10,10,1,8,1,0,1,2.295750911,0.956559987,24.96379875,67.94720274,1,36467.29543,11947.57725,1.03e+13,5.62e+11,10.63490675,35.0088675,1.190978876,4.392899263,"7/7/00",2000-07-07,2000-07-07,863,2725,2001-01-30,1.06e+13,5.33e+11,9.68255014,32.73245013,22.8379434,63.91107188,37285.81592,11255.94789,1.181402837,4.126427146,"United States of America",1995-01-01,"South Korea",1995-01-01,1,1,"South Korea",1967-04-14,"United States of America",1948-01-01,1,1,8,8,10,10,1,1
"656",2,"2001",212,2001,212,2,"Q4_2012","USA","USA-AD-938","USA-AD-935","Luxembourg","LUX","Structural Steel Beams","6/4/01","12/28/01","7/16/01","N","A","12/28/01","AVD","5/20/02","6/27/02","A","N",".",".",".",".",".",".",".",".",10,10,1,10,1,0,1,2.306059661,0.474867565,22.8379434,275.6473195,0,37285.81592,45743.43018,1.06e+13,20196868009,9.68255014,146.6371289,1.181402837,0.673385724,"6/4/01",2001-06-04,2001-06-04,2327,134,2001-12-28,1.06e+13,20196868009,9.68255014,146.6371289,22.8379434,275.6473195,37285.81592,45743.43018,1.181402837,0.673385724,"United States of America",1995-01-01,"Luxembourg ",1995-01-01,1,1,"Luxembourg",1948-01-01,"United States of America",1948-01-01,1,1,10,10,10,10,1,1
"657",2,"2001",713,2001,713,2,"Q4_2012","USA","USA-AD-942","USA-AD-935","Taiwan","TWN","Structural Steel Beams","6/4/01","12/28/01","7/16/01","A","A","12/28/01","AVD","5/20/02","6/27/02","A","N",".",".",".",".",".",".",".",".",10,10,1,9,1,0,1,2.306059661,NA,22.8379434,NA,1,37285.81592,NA,1.06e+13,NA,9.68255014,NA,1.181402837,NA,"6/4/01",2001-06-04,2001-06-04,379,134,2001-12-28,1.06e+13,NA,9.68255014,NA,22.8379434,NA,37285.81592,NA,1.181402837,NA,"United States of America",1995-01-01,"Taiwan",2002-01-01,0,1,NA,NA,"United States of America",1948-01-01,1,NA,9,9,10,10,1,1
"658",2,"2001",710,2000,710,2,"Q4_2012","USA","USA-AD-895","USA-AD-895","China","CHN","Pure Magnesium","10/25/00","4/30/01","12/13/00","A","A","4/30/01","AVD","9/27/01","11/20/01","A","A","11/19/01","AVD","IF","IF","AVD","24.67","305.56","G/ADP/N/85/USA",10,10,1,-7,0,0,1,2.295750911,1.085311721,24.96379875,44.24362337,0,36467.29543,949.178065,1.03e+13,1.2e+12,10.63490675,23.32640438,1.190978876,15.06303446,"10/25/00",2000-10-25,2000-10-25,1344,2835,2001-04-30,1.06e+13,1.32e+12,9.68255014,22.60010168,22.8379434,43.08019713,37285.81592,1041.6377,1.181402837,14.39172359,"United States of America",1995-01-01,"China ",2001-12-11,0,1,NA,NA,"United States of America",1948-01-01,1,NA,-7,0,10,10,1,0
"659",2,"2001",360,2000,360,2,"Q4_2012","USA","USA-AD-904","USA-AD-898","Romania","ROU","Hot-Rolled Carbon Steel Products","11/22/00","5/3/01","1/4/01","A","A","5/3/01","AVD","9/28/01","11/15/01","A","A","11/29/01","AVD","11/29/06","2006","AVD","16.29","88.62","G/ADP/N/85/USA",10,10,1,8,1,0,1,2.295750911,4.853903577,24.96379875,70.96633187,0,36467.29543,1662.217535,1.03e+13,37305099928,10.63490675,32.83290897,1.190978876,12.0621862,"11/22/00",2000-11-22,2000-11-22,336,2863,2001-05-03,1.06e+13,40585886769,9.68255014,33.06383101,22.8379434,73.73463065,37285.81592,1833.81266,1.181402837,14.54052017,"United States of America",1995-01-01,"Romania ",1995-01-01,1,1,"Romania",1971-11-14,"United States of America",1948-01-01,1,1,8,8,10,10,1,1
"660",2,"2001",210,2000,210,2,"Q4_2012","USA","USA-AD-903","USA-AD-898","Netherlands","NLD","Hot-Rolled Carbon Steel Products","11/22/00","5/3/01","1/4/01","A","A","5/3/01","AVD","10/3/01","11/15/01","A","A","11/29/01","AVD","11/29/06","2006","AVD","2.59","2.59","G/ADP/N/85/USA",10,10,1,10,1,1,1,2.295750911,2.732042732,24.96379875,134.6176668,0,36467.29543,24179.73141,1.03e+13,3.85e+11,10.63490675,70.08230453,1.190978876,2.506326741,"11/22/00",2000-11-22,2000-11-22,2284,2863,2001-05-03,1.06e+13,4.01e+11,9.68255014,67.27610999,22.8379434,128.7650397,37285.81592,24968.81742,1.181402837,2.418275664,"United States of America",1995-01-01,"Netherlands ",1995-01-01,1,1,"Netherlands",1948-01-01,"United States of America",1948-01-01,1,1,10,10,10,10,1,1
"661",2,"2001",365,2001,365,2,"Q4_2012","USA","USA-AD-939","USA-AD-935","Russia","RUS","Structural Steel Beams","6/4/01","12/28/01","7/16/01","A","A","12/28/01","AVD","5/20/02","6/27/02","A","N",".",".",".",".",".",".",".",".",10,10,1,6,1,0,1,2.306059661,3.122463378,22.8379434,61.11073841,0,37285.81592,2100.356774,1.06e+13,3.07e+11,9.68255014,36.89342099,1.181402837,6.588680759,"6/4/01",2001-06-04,2001-06-04,520,134,2001-12-28,1.06e+13,3.07e+11,9.68255014,36.89342099,22.8379434,61.11073841,37285.81592,2100.356774,1.181402837,6.588680759,"United States of America",1995-01-01,"Russia",2012-08-22,0,1,NA,NA,"United States of America",1948-01-01,1,NA,6,6,10,10,1,1
"662",2,"2001",20,2001,20,2,"Q4_2012","USA","USA-AD-924","USA-AD-924","Canada","CAN","Mussels","3/19/01","10/18/01","5/2/01","A","A","10/18/01","AVD",".","2/11/02","W",".",".",".",".",".",".",".",".",".",10,10,1,10,1,0,1,2.306059661,5.577059012,22.8379434,78.79827146,0,37285.81592,23573.75007,1.06e+13,7.33e+11,9.68255014,42.24634131,1.181402837,2.237988252,"3/19/01",2001-03-19,2001-03-19,2692,57,2001-10-18,1.06e+13,7.33e+11,9.68255014,42.24634131,22.8379434,78.79827146,37285.81592,23573.75007,1.181402837,2.237988252,"United States of America",1995-01-01,"Canada ",1995-01-01,1,1,"Canada",1948-01-01,"United States of America",1948-01-01,1,1,10,10,10,10,1,1
"663",2,"2001",750,2001,750,2,"Q4_2012","USA","USA-AD-929","USA-AD-929","India","IND","Silicomanganese","4/18/01","11/9/01","6/11/01","A","A","11/9/01","AVD","4/2/02","5/12/02","A","A","5/23/02","AVD","IF","IF","AVD","15.32","20.53","G/ADP/N/92/USA",10,10,1,9,1,0,1,2.306059661,1.139473046,22.8379434,25.54526907,1,37285.81592,466.2141765,1.06e+13,4.94e+11,9.68255014,12.34193985,1.181402837,22.92230619,"4/18/01",2001-04-18,2001-04-18,1126,87,2001-11-09,1.06e+13,4.94e+11,9.68255014,12.34193985,22.8379434,25.54526907,37285.81592,466.2141765,1.181402837,22.92230619,"United States of America",1995-01-01,"India ",1995-01-01,1,1,"India",1948-07-08,"United States of America",1948-01-01,1,1,9,9,10,10,1,1
"664",2,"2001",255,2001,255,2,"Q4_2012","USA","USA-AD-936","USA-AD-935","Germany","DEU","Structural Steel Beams","6/4/01","12/28/01","7/16/01","A","A","12/28/01","AVD","5/20/02","6/27/02","A","N",".",".",".",".",".",".",".",".",10,10,1,10,1,0,1,2.306059661,0.856664997,22.8379434,67.59503307,1,37285.81592,22840.27405,1.06e+13,1.88e+12,9.68255014,34.78900043,1.181402837,1.20527108,"6/4/01",2001-06-04,2001-06-04,951,134,2001-12-28,1.06e+13,1.88e+12,9.68255014,34.78900043,22.8379434,67.59503307,37285.81592,22840.27405,1.181402837,1.20527108,"United States of America",1995-01-01,"Germany ",1995-01-01,1,1,"Germany",1951-10-01,"United States of America",1948-01-01,1,1,10,10,10,10,1,1
"665",2,"2001",20,2001,20,2,"Q4_2012","USA","USA-AD-925","USA-AD-925","Canada","CAN","Greenhouse Tomatoes","4/4/01","10/5/01","5/17/01","A","A","10/5/01","AVD","2/26/02","4/16/02","A","N",".",".",".",".",".",".",".",".",10,10,1,10,1,0,1,2.306059661,5.577059012,22.8379434,78.79827146,0,37285.81592,23573.75007,1.06e+13,7.33e+11,9.68255014,42.24634131,1.181402837,2.237988252,"4/4/01",2001-04-04,2001-04-04,2708,73,2001-10-05,1.06e+13,7.33e+11,9.68255014,42.24634131,22.8379434,78.79827146,37285.81592,23573.75007,1.181402837,2.237988252,"United States of America",1995-01-01,"Canada ",1995-01-01,1,1,"Canada",1948-01-01,"United States of America",1948-01-01,1,1,10,10,10,10,1,1
"666",2,"2001",750,2000,750,2,"Q4_2012","USA","USA-AD-900","USA-AD-898","India","IND","Hot-Rolled Carbon Steel Products","11/22/00","5/3/01","1/4/01","A","A","5/3/01","AVD","10/3/01","11/15/01","A","A","12/3/01","AVD","IF","IF","AVD","36.53","44.4","G/ADP/N/85/USA",10,10,1,9,1,0,1,2.295750911,1.258907331,24.96379875,26.43729384,1,36467.29543,457.2835418,1.03e+13,4.77e+11,10.63490675,12.77323297,1.190978876,23.02185278,"11/22/00",2000-11-22,2000-11-22,979,2863,2001-05-03,1.06e+13,4.94e+11,9.68255014,12.34193985,22.8379434,25.54526907,37285.81592,466.2141765,1.181402837,22.92230619,"United States of America",1995-01-01,"India ",1995-01-01,1,1,"India",1948-07-08,"United States of America",1948-01-01,1,1,9,9,10,10,1,1
"667",2,"2001",713,2000,713,2,"Q4_2012","USA","USA-AD-906","USA-AD-898","Taiwan","TWN","Hot-Rolled Carbon Steel Products","11/22/00","5/3/01","1/4/01","A","A","5/3/01","AVD","9/28/01","11/15/01","A","A","11/29/01","AVD","IF","IF","AVD","20.28","29.14","G/ADP/N/85/USA",10,10,1,9,1,0,1,2.295750911,NA,24.96379875,NA,1,36467.29543,NA,1.03e+13,NA,10.63490675,NA,1.190978876,NA,"11/22/00",2000-11-22,2000-11-22,185,2863,2001-05-03,1.06e+13,NA,9.68255014,NA,22.8379434,NA,37285.81592,NA,1.181402837,NA,"United States of America",1995-01-01,"Taiwan",2002-01-01,0,1,NA,NA,"United States of America",1948-01-01,1,NA,9,9,10,10,1,1
"668",2,"2001",732,2000,732,2,"Q4_2012","USA","USA-AD-889","USA-AD-888","South Korea","KOR","Stainless Steel Angles","8/25/00","1/12/01","10/11/00","A","A","1/12/01","AVD","3/23/01","5/16/01","A","A","5/18/01","AVD","5/18/06","2006","AVD","40.21","99.56","G/ADP/N/78/USA",10,10,1,8,1,0,1,2.295750911,0.956559987,24.96379875,67.94720274,1,36467.29543,11947.57725,1.03e+13,5.62e+11,10.63490675,35.0088675,1.190978876,4.392899263,"8/25/00",2000-08-25,2000-08-25,912,2774,2001-01-12,1.06e+13,5.33e+11,9.68255014,32.73245013,22.8379434,63.91107188,37285.81592,11255.94789,1.181402837,4.126427146,"United States of America",1995-01-01,"South Korea",1995-01-01,1,1,"South Korea",1967-04-14,"United States of America",1948-01-01,1,1,8,8,10,10,1,1
"669",2,"2001",710,2000,710,2,"Q4_2012","USA","USA-AD-891","USA-AD-891","China","CHN","Foundry Coke","9/27/00","3/8/01","11/17/00","A","A","3/8/01","AVD","7/31/01","9/14/01","A","A","9/17/01","AVD","IF","IF","AVD","48.55","214.89","G/ADP/N/85/USA",10,10,1,-7,0,0,1,2.295750911,1.085311721,24.96379875,44.24362337,0,36467.29543,949.178065,1.03e+13,1.2e+12,10.63490675,23.32640438,1.190978876,15.06303446,"9/27/00",2000-09-27,2000-09-27,1316,2807,2001-03-08,1.06e+13,1.32e+12,9.68255014,22.60010168,22.8379434,43.08019713,37285.81592,1041.6377,1.181402837,14.39172359,"United States of America",1995-01-01,"China ",2001-12-11,0,1,NA,NA,"United States of America",1948-01-01,1,NA,-7,0,10,10,1,0
"670",2,"2001",740,2000,740,2,"Q4_2012","USA","USA-AD-888","USA-AD-888","Japan","JPN","Stainless Steel Angles","8/25/00","1/12/01","10/11/00","A","A","1/12/01","AVD","3/23/01","5/16/01","A","A","5/18/01","AVD","5/18/06","2006","AVD","70.48","114.51","G/ADP/N/78/USA",10,10,1,10,1,0,1,2.295750911,0.464845251,24.96379875,20.3060448,1,36467.29543,37291.70616,1.03e+13,4.73e+12,10.63490675,10.8773781,1.190978876,1.586389312,"8/25/00",2000-08-25,2000-08-25,142,2774,2001-01-12,1.06e+13,4.16e+12,9.68255014,10.4488202,22.8379434,20.2578929,37285.81592,32716.41867,1.181402837,1.44258103,"United States of America",1995-01-01,"Japan ",1995-01-01,1,1,"Japan",1955-09-10,"United States of America",1948-01-01,1,1,10,10,10,10,1,1
"671",2,"2001",20,2001,20,2,"Q4_2012","USA","USA-AD-928","USA-AD-928","Canada","CAN","Softwood Lumber","4/9/01","11/6/01","5/23/01","A","A","11/6/01","AVD","4/2/02","5/22/02","A","A","5/22/02","AVD","12/12/06","2006","AVD","2.18","12.44","G/ADP/N/92/USA",10,10,1,10,1,1,1,2.306059661,5.577059012,22.8379434,78.79827146,0,37285.81592,23573.75007,1.06e+13,7.33e+11,9.68255014,42.24634131,1.181402837,2.237988252,"4/9/01",2001-04-09,2001-04-09,2713,78,2001-11-06,1.06e+13,7.33e+11,9.68255014,42.24634131,22.8379434,78.79827146,37285.81592,23573.75007,1.181402837,2.237988252,"United States of America",1995-01-01,"Canada ",1995-01-01,1,1,"Canada",1948-01-01,"United States of America",1948-01-01,1,1,10,10,10,10,1,1
"672",2,"2001",710,2001,710,2,"Q4_2012","USA","USA-AD-922","USA-AD-922","China","CHN","Automotive Replacement Glass Windshields","3/8/01","9/19/01","4/24/01","A","A","9/19/01","AVD","2/12/02","4/2/02","A","A","4/4/02","AVD","4/4/07","2007","AVD","3.71","124.5","G/ADP/N/92/USA",10,10,1,-7,0,0,1,2.306059661,0.863739086,22.8379434,43.08019713,0,37285.81592,1041.6377,1.06e+13,1.32e+12,9.68255014,22.60010168,1.181402837,14.39172359,"3/8/01",2001-03-08,2001-03-08,1478,46,2001-09-19,1.06e+13,1.32e+12,9.68255014,22.60010168,22.8379434,43.08019713,37285.81592,1041.6377,1.181402837,14.39172359,"United States of America",1995-01-01,"China ",2001-12-11,0,1,NA,NA,"United States of America",1948-01-01,1,NA,-7,0,10,10,1,0
"673",2,"2001",369,2000,369,2,"Q4_2012","USA","USA-AD-908","USA-AD-898","Ukraine","UKR","Hot-Rolled Carbon Steel Products","11/22/00","5/3/01","1/4/01","A","A","5/3/01","AVD","10/3/01","11/15/01","A","A","11/29/01","AVD","IF","IF","AVD","90.33","90.33","G/ADP/N/85/USA",10,10,1,6,1,0,1,2.295750911,1.686860319,24.96379875,119.8582936,0,36467.29543,635.7089635,1.03e+13,31261527363,10.63490675,62.44487564,1.190978876,17.08280767,"11/22/00",2000-11-22,2000-11-22,2318,2863,2001-05-03,1.06e+13,38009344577,9.68255014,55.46060042,22.8379434,109.2947745,37285.81592,780.7380243,1.181402837,16.37209818,"United States of America",1995-01-01,"Ukraine ",2008-05-16,0,1,NA,NA,"United States of America",1948-01-01,1,NA,6,6,10,10,1,1
"674",2,"2001",369,2000,369,2,"Q4_2012","USA","USA-AD-894","USA-AD-894","Ukraine","UKR","Ammonium Nitrate","10/20/00","3/5/01","12/1/00","A","A","3/5/01","AVD","7/25/01","9/5/01","A","A","9/12/01","AVD","IF","IF","AVD","156.29","156.29","G/ADP/N/85/USA",10,10,1,6,1,0,1,2.295750911,1.686860319,24.96379875,119.8582936,0,36467.29543,635.7089635,1.03e+13,31261527363,10.63490675,62.44487564,1.190978876,17.08280767,"10/20/00",2000-10-20,2000-10-20,2285,2830,2001-03-05,1.06e+13,38009344577,9.68255014,55.46060042,22.8379434,109.2947745,37285.81592,780.7380243,1.181402837,16.37209818,"United States of America",1995-01-01,"Ukraine ",2008-05-16,0,1,NA,NA,"United States of America",1948-01-01,1,NA,6,6,10,10,1,1
"675",2,"2001",710,2001,710,2,"Q4_2012","USA","USA-AD-943","USA-AD-943","China","CHN","Circular-Welded Non-Alloy Steel Pipe","6/4/01","12/31/01","7/13/01","A","A","12/31/01","AVD","5/24/02","7/9/02","A","N",".",".",".",".",".",".",".",".",10,10,1,-7,0,0,1,2.306059661,0.863739086,22.8379434,43.08019713,0,37285.81592,1041.6377,1.06e+13,1.32e+12,9.68255014,22.60010168,1.181402837,14.39172359,"6/4/01",2001-06-04,2001-06-04,1566,134,2001-12-31,1.06e+13,1.32e+12,9.68255014,22.60010168,22.8379434,43.08019713,37285.81592,1041.6377,1.181402837,14.39172359,"United States of America",1995-01-01,"China ",2001-12-11,1,1,NA,NA,"United States of America",1948-01-01,1,NA,-7,0,10,10,1,0
"676",2,"2001",367,2000,367,2,"Q4_2012","USA","USA-AD-878","USA-AD-872","Latvia","LVA","Steel Concrete Rebar","7/7/00","1/30/01","8/23/00","A","A","1/30/01","AVD","6/22/01","7/30/01","A","A","9/7/01","AVD","IF","IF","AVD","17.21","17.21","G/ADP/N/78/USA",10,10,1,8,1,1,1,2.295750911,29.47080305,24.96379875,90.31615179,0,36467.29543,3308.512355,1.03e+13,7833068425,10.63490675,41.64179343,1.190978876,4.604133844,"7/7/00",2000-07-07,2000-07-07,63,2725,2001-01-30,1.06e+13,8313047744,9.68255014,41.57739299,22.8379434,92.68561261,37285.81592,3556.88621,1.181402837,4.504274595,"United States of America",1995-01-01,"Latvia ",1999-02-10,1,1,NA,NA,"United States of America",1948-01-01,1,NA,8,8,10,10,1,1
"677",2,"2001",713,2001,713,2,"Q4_2012","USA","USA-AD-934","USA-AD-933","Taiwan","TWN","Polyethylene Terephthalate Film","5/29/01","12/21/01","7/11/01","A","A","12/21/01","AVD","5/20/02","6/27/02","A","A","7/1/02","AVD","IF","IF","AVD","2.05","2.49","G/ADP/N/98/USA",10,10,1,9,1,0,1,2.306059661,NA,22.8379434,NA,1,37285.81592,NA,1.06e+13,NA,9.68255014,NA,1.181402837,NA,"5/29/01",2001-05-29,2001-05-29,373,128,2001-12-21,1.06e+13,NA,9.68255014,NA,22.8379434,NA,37285.81592,NA,1.181402837,NA,"United States of America",1995-01-01,"Taiwan",2002-01-01,0,1,NA,NA,"United States of America",1948-01-01,1,NA,9,9,10,10,1,1
"678",2,"2001",70,2001,70,2,"Q4_2012","USA","USA-AD-920","USA-AD-919","Mexico","MEX","Welded Large Diameter Line Pipe","1/18/01","8/15/01","3/6/01","A","A","8/15/01","AVD","1/4/02","2/25/02","A","A","2/27/02","AVD","2/27/07","2007","AVD","49.86","49.86","G/ADP/N/92/USA",10,10,1,8,1,0,1,2.306059661,0.542536007,22.8379434,48.52804694,1,37285.81592,6879.669807,1.06e+13,7.25e+11,9.68255014,23.64412569,1.181402837,3.665469947,"1/18/01",2001-01-18,2001-01-18,48,2920,2001-08-15,1.06e+13,7.25e+11,9.68255014,23.64412569,22.8379434,48.52804694,37285.81592,6879.669807,1.181402837,3.665469947,"United States of America",1995-01-01,"Mexico ",1995-01-01,1,1,"Mexico",1986-08-24,"United States of America",1948-01-01,1,1,8,8,10,10,1,1
"679",2,"2001",160,2000,160,2,"Q4_2012","USA","USA-AD-898","USA-AD-898","Argentina","ARG","Hot-Rolled Carbon Steel Products","11/22/00","5/3/01","1/4/01","A","A","5/3/01","AVD","7/16/01","8/31/01","A","A","9/19/01","AVD","9/19/06","2006","AVD","40.6","44.59","G/ADP/N/85/USA",10,10,1,8,1,0,1,2.295750911,1.732870451,24.96379875,18.67530036,1,36467.29543,9329.113756,1.03e+13,3.44e+11,10.63490675,9.069476306,1.190978876,4.310081555,"11/22/00",2000-11-22,2000-11-22,348,2863,2001-05-03,1.06e+13,3.25e+11,9.68255014,9.558790367,22.8379434,18.03958519,37285.81592,8732.466063,1.181402837,4.288049878,"United States of America",1995-01-01,"Argentina ",1995-01-01,1,1,"Argentina",1967-10-11,"United States of America",1948-01-01,1,1,8,8,10,10,1,1
"680",2,"2001",740,2001,740,2,"Q4_2012","USA","USA-AD-919","USA-AD-919","Japan","JPN","Welded Large Diameter Line Pipe","1/18/01","6/27/01","3/6/01","A","A","6/27/01","AVD","9/11/01","11/1/01","A","A","12/6/01","AVD","IF","IF","AVD","30.8","30.8","G/ADP/N/85/USA",10,10,1,10,1,0,1,2.306059661,0.520560234,22.8379434,20.2578929,1,37285.81592,32716.41867,1.06e+13,4.16e+12,9.68255014,10.4488202,1.181402837,1.44258103,"1/18/01",2001-01-18,2001-01-18,288,2920,2001-06-27,1.06e+13,4.16e+12,9.68255014,10.4488202,22.8379434,20.2578929,37285.81592,32716.41867,1.181402837,1.44258103,"United States of America",1995-01-01,"Japan ",1995-01-01,1,1,"Japan",1955-09-10,"United States of America",1948-01-01,1,1,10,10,10,10,1,1
"681",2,"2001",370,2000,370,2,"Q4_2012","USA","USA-AD-873","USA-AD-872","Belarus","BLR","Steel Concrete Rebar","7/7/00","1/30/01","8/23/00","A","A","1/30/01","AVD","6/22/01","7/30/01","A","A","9/7/01","AVD","IF","IF","AVD","114.53","114.53","G/ADP/N/78/USA",10,10,1,-7,0,0,1,2.295750911,3.623396663,24.96379875,141.609166,0,36467.29543,1273.049124,1.03e+13,12736856485,10.63490675,69.21082134,1.190978876,14.15322736,"7/7/00",2000-07-07,2000-07-07,2179,2725,2001-01-30,1.06e+13,12354820144,9.68255014,66.74760674,22.8379434,137.0449305,37285.81592,1244.441997,1.181402837,11.87493737,"United States of America",1995-01-01,NA,NA,NA,1,NA,NA,"United States of America",1948-01-01,1,NA,-7,0,10,10,1,0
"682",2,"2001",101,2001,101,2,"Q4_2012","USA","USA-AD-930","USA-AD-929","Venezuela","VEN","Silicomanganese","4/18/01","11/9/01","6/11/01","A","A","11/9/01","AVD","4/2/02","5/12/02","A","A","5/23/02","AVD","IF","IF","AVD","24.62","24.62","G/ADP/N/92/USA",10,10,1,6,1,0,1,2.306059661,0.240319121,22.8379434,42.14126802,1,37285.81592,4942.00061,1.06e+13,1.23e+11,9.68255014,22.73563157,1.181402837,4.544217324,"4/18/01",2001-04-18,2001-04-18,806,87,2001-11-09,1.06e+13,1.23e+11,9.68255014,22.73563157,22.8379434,42.14126802,37285.81592,4942.00061,1.181402837,4.544217324,"United States of America",1995-01-01,"Venezuela",1995-01-01,1,1,"Venezuela",1990-08-31,"United States of America",1948-01-01,1,1,6,6,10,10,1,1
"683",2,"2001",710,2000,710,2,"Q4_2012","USA","USA-AD-874","USA-AD-872","China","CHN","Steel Concrete Rebar","7/7/00","1/30/01","8/23/00","A","A","1/30/01","AVD","6/22/01","7/30/01","A","A","9/7/01","AVD","IF","IF","AVD","132.53","132.53","G/ADP/N/85/USA",10,10,1,-7,0,0,1,2.295750911,1.085311721,24.96379875,44.24362337,0,36467.29543,949.178065,1.03e+13,1.2e+12,10.63490675,23.32640438,1.190978876,15.06303446,"7/7/00",2000-07-07,2000-07-07,1234,2725,2001-01-30,1.06e+13,1.32e+12,9.68255014,22.60010168,22.8379434,43.08019713,37285.81592,1041.6377,1.181402837,14.39172359,"United States of America",1995-01-01,"China ",2001-12-11,0,1,NA,NA,"United States of America",1948-01-01,1,NA,-7,0,10,10,1,0
"684",2,"2001",325,2001,325,2,"Q4_2012","USA","USA-AD-915","USA-AD-913","Italy","ITA","Stainless Steel Bar","1/4/01","8/2/01","2/23/01","A","A","8/2/01","AVD","1/23/02","3/8/02","A","A","3/7/02","AVD","3/7/07","2007","AVD","1.7","33","G/ADP/N/92/USA",10,10,1,10,1,1,1,2.306059661,0.652361831,22.8379434,52.33283751,1,37285.81592,19723.04417,1.06e+13,1.12e+12,9.68255014,26.85797238,1.181402837,2.683528549,"1/4/01",2001-01-04,2001-01-04,253,2906,2001-08-02,1.06e+13,1.12e+12,9.68255014,26.85797238,22.8379434,52.33283751,37285.81592,19723.04417,1.181402837,2.683528549,"United States of America",1995-01-01,"Italy ",1995-01-01,1,1,"Italy",1950-05-30,"United States of America",1948-01-01,1,1,10,10,10,10,1,1
"685",2,"2001",850,2000,850,2,"Q4_2012","USA","USA-AD-901","USA-AD-898","Indonesia","IDN","Hot-Rolled Carbon Steel Products","11/22/00","5/3/01","1/4/01","A","A","5/3/01","AVD","9/28/01","11/15/01","A","A","12/3/01","AVD","IF","IF","AVD","47.86","47.86","G/ADP/N/85/USA",10,10,1,6,1,0,1,2.295750911,3.613756891,24.96379875,71.43687599,1,36467.29543,789.8058801,1.03e+13,1.65e+11,10.63490675,40.97730855,1.190978876,15.60197123,"11/22/00",2000-11-22,2000-11-22,399,2863,2001-05-03,1.06e+13,1.6e+11,9.68255014,39.03213345,22.8379434,69.7932057,37285.81592,756.931013,1.181402837,15.29026521,"United States of America",1995-01-01,"Indonesia ",1995-01-01,1,1,"Indonesia",1950-02-24,"United States of America",1948-01-01,1,1,6,7,10,10,1,1
"686",2,"2001",560,2000,560,2,"Q4_2012","USA","USA-AD-905","USA-AD-898","South Africa","ZAF","Hot-Rolled Carbon Steel Products","11/22/00","5/3/01","1/4/01","A","A","5/3/01","AVD","7/16/01","8/31/01","A","A","9/19/01","AVD","9/19/06","2006","AVD","9.28","9.28","G/ADP/N/85/USA",10,10,1,9,1,0,1,2.295750911,3.376975394,24.96379875,52.78632006,0,36467.29543,3019.946367,1.03e+13,1.33e+11,10.63490675,27.8709062,1.190978876,3.274923749,"11/22/00",2000-11-22,2000-11-22,525,2863,2001-05-03,1.06e+13,1.18e+11,9.68255014,30.12753668,22.8379434,56.20588719,37285.81592,2638.15805,1.181402837,3.510824368,"United States of America",1995-01-01,"South Africa",1995-01-01,1,1,"South Africa",1948-06-13,"United States of America",1948-01-01,1,1,9,9,10,10,1,1
"687",2,"2001",710,2000,710,2,"Q4_2012","USA","USA-AD-893","USA-AD-892","China","CHN","Honey","10/6/00","5/11/01","11/17/00","A","A","5/11/01","AVD","10/4/01","11/26/01","A","A","12/10/01","AVD","IF","IF","AVD","25.88","183.8","G/ADP/N/85/USA",10,10,1,-7,0,0,1,2.295750911,1.085311721,24.96379875,44.24362337,0,36467.29543,949.178065,1.03e+13,1.2e+12,10.63490675,23.32640438,1.190978876,15.06303446,"10/6/00",2000-10-06,2000-10-06,1325,2816,2001-05-11,1.06e+13,1.32e+12,9.68255014,22.60010168,22.8379434,43.08019713,37285.81592,1041.6377,1.181402837,14.39172359,"United States of America",1995-01-01,"China ",2001-12-11,0,1,NA,NA,"United States of America",1948-01-01,1,NA,-7,0,10,10,1,0
"688",2,"2001",710,2001,710,2,"Q4_2012","USA","USA-AD-932","USA-AD-932","China","CHN","Folding Metal Tables and Chairs","5/4/01","12/3/01","6/15/01","A","A","12/3/01","AVD","4/24/02","6/6/02","A","A","6/27/02","AVD","11/29/12","2012","AVD","0","70.71","G/ADP/N/92/USA",10,10,1,-7,0,0,1,2.306059661,0.863739086,22.8379434,43.08019713,0,37285.81592,1041.6377,1.06e+13,1.32e+12,9.68255014,22.60010168,1.181402837,14.39172359,"5/4/01",2001-05-04,2001-05-04,1535,103,2001-12-03,1.06e+13,1.32e+12,9.68255014,22.60010168,22.8379434,43.08019713,37285.81592,1041.6377,1.181402837,14.39172359,"United States of America",1995-01-01,"China ",2001-12-11,0,1,NA,NA,"United States of America",1948-01-01,1,NA,-7,0,10,10,1,0
"689",2,"2001",710,2001,710,2,"Q4_2012","USA","USA-AD-921","USA-AD-921","China","CHN","Folding Gift Boxes","3/1/01","8/6/01","4/18/01","A","A","8/6/01","AVD","11/20/01","12/31/01","A","A","1/8/02","AVD","IF","IF","AVD","1.64","164.75","G/ADP/N/85/USA",10,10,1,-7,0,0,1,2.306059661,0.863739086,22.8379434,43.08019713,0,37285.81592,1041.6377,1.06e+13,1.32e+12,9.68255014,22.60010168,1.181402837,14.39172359,"3/1/01",2001-03-01,2001-03-01,1471,39,2001-08-06,1.06e+13,1.32e+12,9.68255014,22.60010168,22.8379434,43.08019713,37285.81592,1041.6377,1.181402837,14.39172359,"United States of America",1995-01-01,"China ",2001-12-11,0,1,NA,NA,"United States of America",1948-01-01,1,NA,-7,0,10,10,1,0
"690",2,"2001",369,2000,369,2,"Q4_2012","USA","USA-AD-882","USA-AD-872","Ukraine","UKR","Steel Concrete Rebar","7/7/00","1/30/01","8/23/00","A","A","1/30/01","AVD","4/11/01","5/23/01","A","A","9/7/01","AVD","IF","IF","AVD","41.69","41.69","G/ADP/N/78/USA",10,10,1,6,1,0,1,2.295750911,1.686860319,24.96379875,119.8582936,0,36467.29543,635.7089635,1.03e+13,31261527363,10.63490675,62.44487564,1.190978876,17.08280767,"7/7/00",2000-07-07,2000-07-07,2180,2725,2001-01-30,1.06e+13,38009344577,9.68255014,55.46060042,22.8379434,109.2947745,37285.81592,780.7380243,1.181402837,16.37209818,"United States of America",1995-01-01,"Ukraine ",2008-05-16,0,1,NA,NA,"United States of America",1948-01-01,1,NA,6,6,10,10,1,1
"691",2,"2001",155,2001,155,2,"Q4_2012","USA","USA-AD-948","USA-AD-948","Chile","CHL","Individually Quick Frozen Red Raspberries","6/6/01","12/31/01","7/25/01","A","A","12/31/01","AVD","5/21/02","7/9/02","A","A","7/9/02","AVD","7/9/07","2007","AVD","0","6.33","G/ADP/N/92/USA",10,10,1,9,1,0,1,2.306059661,10.28334472,22.8379434,61.41428034,0,37285.81592,4625.336377,1.06e+13,72336972322,9.68255014,30.87198151,1.181402837,5.159719613,"6/6/01",2001-06-06,2001-06-06,451,136,2001-12-31,1.06e+13,72336972322,9.68255014,30.87198151,22.8379434,61.41428034,37285.81592,4625.336377,1.181402837,5.159719613,"United States of America",1995-01-01,"Chile ",1995-01-01,1,1,"Chile",1949-03-16,"United States of America",1948-01-01,1,1,9,9,10,10,1,1
"692",2,"2001",255,2001,255,2,"Q4_2012","USA","USA-AD-914","USA-AD-913","Germany","DEU","Stainless Steel Bar","1/4/01","8/2/01","2/23/01","A","A","8/2/01","AVD","1/23/02","3/8/02","A","A","3/7/02","AVD","3/7/07","2007","AVD","4.17","32.32","G/ADP/N/92/USA",10,10,1,10,1,1,1,2.306059661,0.856664997,22.8379434,67.59503307,1,37285.81592,22840.27405,1.06e+13,1.88e+12,9.68255014,34.78900043,1.181402837,1.20527108,"1/4/01",2001-01-04,2001-01-04,800,2906,2001-08-02,1.06e+13,1.88e+12,9.68255014,34.78900043,22.8379434,67.59503307,37285.81592,22840.27405,1.181402837,1.20527108,"United States of America",1995-01-01,"Germany ",1995-01-01,1,1,"Germany",1951-10-01,"United States of America",1948-01-01,1,1,10,10,10,10,1,1
"693",2,"2001",200,2000,200,2,"Q4_2012","USA","USA-AD-912","USA-AD-909","United Kingdom","GBR","Low Enriched Uranium","12/14/00","7/13/01","1/31/01","A","A","7/13/01","AVD","12/21/01",".","N","T",".",".",".",".",".",".",".",".",10,10,1,10,1,0,1,2.295750911,0.478483818,24.96379875,56.46621195,1,36467.29543,25361.93964,1.03e+13,1.49e+12,10.63490675,27.30800829,1.190978876,0.897981114,"12/14/00",2000-12-14,2000-12-14,1322,2885,2001-07-13,1.06e+13,1.49e+12,9.68255014,26.9190061,22.8379434,56.10090605,37285.81592,25121.03789,1.181402837,0.821107531,"United States of America",1995-01-01,"United Kingdom",1995-01-01,1,1,"United Kingdom",1948-01-01,"United States of America",1948-01-01,1,1,10,10,10,10,1,1
"694",2,"2001",666,2000,666,2,"Q4_2012","USA","USA-AD-896","USA-AD-895","Israel","ISR","Pure Magnesium","10/25/00","4/30/01","12/13/00","A","A","4/30/01","AVD","9/27/01","11/20/01","A","N",".",".",".",".",".",".",".",".",10,10,1,10,1,0,1,2.295750911,0.94645547,24.96379875,74.77569295,0,36467.29543,19859.30215,1.03e+13,1.25e+11,10.63490675,37.30419158,1.190978876,NA,"10/25/00",2000-10-25,2000-10-25,477,2835,2001-04-30,1.06e+13,1.23e+11,9.68255014,32.91145361,22.8379434,68.39383349,37285.81592,19093.10966,1.181402837,NA,"United States of America",1995-01-01,"Israel ",1995-04-21,1,1,"Israel",1962-07-05,"United States of America",1948-01-01,1,1,10,10,10,10,1,1
"695",2,"2001",230,2000,230,2,"Q4_2012","USA","USA-AD-890","USA-AD-888","Spain","ESP","Stainless Steel Angles","8/25/00","1/12/01","10/11/00","A","A","1/12/01","AVD","3/23/01","5/16/01","A","A","5/18/01","AVD","5/18/06","2006","AVD","24.32","61.45","G/ADP/N/78/USA",10,10,1,10,1,0,1,2.295750911,1.340853167,24.96379875,61.23094362,1,36467.29543,14413.78887,1.03e+13,5.8e+11,10.63490675,29.05063763,1.190978876,4.226665122,"8/25/00",2000-08-25,2000-08-25,1573,2774,2001-01-12,1.06e+13,6.09e+11,9.68255014,28.53363551,22.8379434,59.59388416,37285.81592,14939.06077,1.181402837,4.099585896,"United States of America",1995-01-01,"Spain ",1995-01-01,1,1,"Spain",1963-08-29,"United States of America",1948-01-01,1,1,10,10,10,10,1,1
"696",2,"2001",160,2000,160,2,"Q4_2012","USA","USA-AD-892","USA-AD-892","Argentina","ARG","Honey","10/6/00","5/11/01","11/17/00","A","A","5/11/01","AVD","10/4/01","11/26/01","A","A","12/10/01","AVD","9/21/12","2012","AVD","35.76","37.44","G/ADP/N/85/USA",10,10,1,8,1,0,1,2.295750911,1.732870451,24.96379875,18.67530036,1,36467.29543,9329.113756,1.03e+13,3.44e+11,10.63490675,9.069476306,1.190978876,4.310081555,"10/6/00",2000-10-06,2000-10-06,301,2816,2001-05-11,1.06e+13,3.25e+11,9.68255014,9.558790367,22.8379434,18.03958519,37285.81592,8732.466063,1.181402837,4.288049878,"United States of America",1995-01-01,"Argentina ",1995-01-01,1,1,"Argentina",1967-10-11,"United States of America",1948-01-01,1,1,8,8,10,10,1,1
"697",2,"2001",220,2000,220,2,"Q4_2012","USA","USA-AD-909","USA-AD-909","France","FRA","Low Enriched Uranium","12/14/00","7/13/01","1/31/01","A","A","7/13/01","AVD","12/21/01","2/8/02","A","A","2/13/02","AVD","IF","IF","AVD","19.95","19.95","G/ADP/N/92/USA",10,10,1,9,1,0,1,2.295750911,1.091021624,24.96379875,56.63227108,1,36467.29543,21774.93717,1.03e+13,1.33e+12,10.63490675,28.81383859,1.190978876,2.468438389,"12/14/00",2000-12-14,2000-12-14,2038,2885,2001-07-13,1.06e+13,1.34e+12,9.68255014,28.36027408,22.8379434,55.5839122,37285.81592,21812.19434,1.181402837,2.479958407,"United States of America",1995-01-01,"France ",1995-01-01,1,1,"France",1948-01-01,"United States of America",1948-01-01,1,1,9,9,10,10,1,1
"698",2,"2001",560,2001,560,2,"Q4_2012","USA","USA-AD-940","USA-AD-935","South Africa","ZAF","Structural Steel Beams","6/4/01","12/28/01","7/16/01","A","A","12/28/01","AVD","5/20/02","6/27/02","A","N",".",".",".",".",".",".",".",".",10,10,1,9,1,0,1,2.306059661,2.627801883,22.8379434,56.20588719,0,37285.81592,2638.15805,1.06e+13,1.18e+11,9.68255014,30.12753668,1.181402837,3.510824368,"6/4/01",2001-06-04,2001-06-04,719,134,2001-12-28,1.06e+13,1.18e+11,9.68255014,30.12753668,22.8379434,56.20588719,37285.81592,2638.15805,1.181402837,3.510824368,"United States of America",1995-01-01,"South Africa",1995-01-01,1,1,"South Africa",1948-06-13,"United States of America",1948-01-01,1,1,9,9,10,10,1,1
"699",2,"2001",850,2000,850,2,"Q4_2012","USA","USA-AD-875","USA-AD-872","Indonesia","IDN","Steel Concrete Rebar","7/7/00","1/30/01","8/23/00","A","A","1/30/01","AVD","4/11/01","5/23/01","A","A","9/7/01","AVD","IF","IF","AVD","60.46","71.01","G/ADP/N/78/USA",10,10,1,6,1,0,1,2.295750911,3.613756891,24.96379875,71.43687599,1,36467.29543,789.8058801,1.03e+13,1.65e+11,10.63490675,40.97730855,1.190978876,15.60197123,"7/7/00",2000-07-07,2000-07-07,261,2725,2001-01-30,1.06e+13,1.6e+11,9.68255014,39.03213345,22.8379434,69.7932057,37285.81592,756.931013,1.181402837,15.29026521,"United States of America",1995-01-01,"Indonesia ",1995-01-01,1,1,"Indonesia",1950-02-24,"United States of America",1948-01-01,1,1,6,7,10,10,1,1
"700",2,"2001",290,2000,290,2,"Q4_2012","USA","USA-AD-880","USA-AD-872","Poland","POL","Steel Concrete Rebar","7/7/00","1/30/01","8/23/00","A","A","1/30/01","AVD","4/11/01","5/23/01","A","A","9/7/01","AVD","IF","IF","AVD","47.13","52.07","G/ADP/N/78/USA",10,10,1,9,1,0,1,2.295750911,1.785732113,24.96379875,60.67078823,1,36467.29543,4476.797076,1.03e+13,1.71e+11,10.63490675,27.1243911,1.190978876,4.957839039,"7/7/00",2000-07-07,2000-07-07,1658,2725,2001-01-30,1.06e+13,1.9e+11,9.68255014,27.05602106,22.8379434,57.77678292,37285.81592,4978.573826,1.181402837,5.100143113,"United States of America",1995-01-01,"Poland ",1995-07-01,1,1,"Poland",1967-10-18,"United States of America",1948-01-01,1,1,9,9,10,10,1,1
"701",2,"2001",705,2000,705,2,"Q4_2012","USA","USA-AD-902","USA-AD-898","Kazakhstan","KAZ","Hot-Rolled Carbon Steel Products","11/22/00","5/3/01","1/4/01","A","A","5/3/01","AVD","10/3/01","11/15/01","A","A","11/21/01","AVD","11/21/06","2006","AVD","243.46","243.46","G/ADP/N/85/USA",10,10,1,-4,0,0,1,2.295750911,1.470012869,24.96379875,105.6996926,0,36467.29543,1229.000958,1.03e+13,18291990619,10.63490675,56.6024268,1.190978876,8.687818554,"11/22/00",2000-11-22,2000-11-22,3865,2863,2001-05-03,1.06e+13,22152689130,9.68255014,45.89501861,22.8379434,92.84906851,37285.81592,1490.926751,1.181402837,9.372502038,"United States of America",1995-01-01,NA,NA,NA,1,NA,NA,"United States of America",1948-01-01,1,NA,-4,1,10,10,1,0
"702",2,"2001",705,2001,705,2,"Q4_2012","USA","USA-AD-931","USA-AD-929","Kazakhstan","KAZ","Silicomanganese","4/18/01","11/9/01","6/11/01","A","A","11/9/01","AVD","4/2/02","5/12/02","A","A","5/23/02","AVD","IF","IF","AVD","247.88","247.88","G/ADP/N/92/USA",10,10,1,-4,0,0,1,2.306059661,1.393841182,22.8379434,92.84906851,0,37285.81592,1490.926751,1.06e+13,22152689130,9.68255014,45.89501861,1.181402837,9.372502038,"4/18/01",2001-04-18,2001-04-18,4012,87,2001-11-09,1.06e+13,22152689130,9.68255014,45.89501861,22.8379434,92.84906851,37285.81592,1490.926751,1.181402837,9.372502038,"United States of America",1995-01-01,NA,NA,NA,1,NA,NA,"United States of America",1948-01-01,1,NA,-4,1,10,10,1,0
"703",2,"2001",710,2000,710,2,"Q4_2012","USA","USA-AD-899","USA-AD-898","China","CHN","Hot-Rolled Carbon Steel Products","11/22/00","5/3/01","1/4/01","A","A","5/3/01","AVD","9/28/01","11/15/01","A","A","11/29/01","AVD","IF","IF","AVD","64.2","90.83","G/ADP/N/85/USA",10,10,1,-7,0,0,1,2.295750911,1.085311721,24.96379875,44.24362337,0,36467.29543,949.178065,1.03e+13,1.2e+12,10.63490675,23.32640438,1.190978876,15.06303446,"11/22/00",2000-11-22,2000-11-22,1372,2863,2001-05-03,1.06e+13,1.32e+12,9.68255014,22.60010168,22.8379434,43.08019713,37285.81592,1041.6377,1.181402837,14.39172359,"United States of America",1995-01-01,"China ",2001-12-11,0,1,NA,NA,"United States of America",1948-01-01,1,NA,-7,0,10,10,1,0
"704",2,"2001",220,2001,220,2,"Q4_2012","USA","USA-AD-913","USA-AD-913","France","FRA","Stainless Steel Bar","1/4/01","8/2/01","2/23/01","A","A","8/2/01","AVD","1/23/02","3/8/02","A","A","3/7/02","AVD","3/7/07","2007","AVD","3.9","71.83","G/ADP/N/92/USA",10,10,1,9,1,1,1,2.306059661,1.0180398,22.8379434,55.5839122,1,37285.81592,21812.19434,1.06e+13,1.34e+12,9.68255014,28.36027408,1.181402837,2.479958407,"1/4/01",2001-01-04,2001-01-04,2059,2906,2001-08-02,1.06e+13,1.34e+12,9.68255014,28.36027408,22.8379434,55.5839122,37285.81592,21812.19434,1.181402837,2.479958407,"United States of America",1995-01-01,"France ",1995-01-01,1,1,"France",1948-01-01,"United States of America",1948-01-01,1,1,9,9,10,10,1,1
"705",2,"2001",200,2001,200,2,"Q4_2012","USA","USA-AD-918","USA-AD-913","United Kingdom","GBR","Stainless Steel Bar","1/4/01","8/2/01","2/23/01","A","A","8/2/01","AVD","1/23/02","3/8/02","A","A","3/7/02","AVD","3/7/07","2007","AVD","4.48","125.77","G/ADP/N/92/USA",10,10,1,10,1,1,1,2.306059661,0.453504611,22.8379434,56.10090605,1,37285.81592,25121.03789,1.06e+13,1.49e+12,9.68255014,26.9190061,1.181402837,0.821107531,"1/4/01",2001-01-04,2001-01-04,1343,2906,2001-08-02,1.06e+13,1.49e+12,9.68255014,26.9190061,22.8379434,56.10090605,37285.81592,25121.03789,1.181402837,0.821107531,"United States of America",1995-01-01,"United Kingdom",1995-01-01,1,1,"United Kingdom",1948-01-01,"United States of America",1948-01-01,1,1,10,10,10,10,1,1
"706",2,"2001",359,2000,359,2,"Q4_2012","USA","USA-AD-879","USA-AD-872","Moldova","MDA","Steel Concrete Rebar","7/7/00","1/30/01","8/23/00","A","A","1/30/01","AVD","6/22/01","7/30/01","A","A","9/7/01","AVD","IF","IF","AVD","232.86","232.86","G/ADP/N/78/USA",10,10,1,7,1,0,1,2.295750911,3.140616834,24.96379875,125.2099254,0,36467.29543,354.001279,1.03e+13,1288420223,10.63490675,49.77801408,1.190978876,29.0293824,"7/7/00",2000-07-07,2000-07-07,1269,2725,2001-01-30,1.06e+13,1480656884,9.68255014,49.85354864,22.8379434,123.3884784,37285.81592,407.7302432,1.181402837,25.96192571,"United States of America",1995-01-01,"Moldova",2001-07-26,0,1,NA,NA,"United States of America",1948-01-01,1,NA,8,8,10,10,1,1
"707",2,"2001",732,2001,732,2,"Q4_2012","USA","USA-AD-916","USA-AD-913","South Korea","KOR","Stainless Steel Bar","1/4/01","8/2/01","2/23/01","A","A","8/2/01","AVD","1/23/02","3/8/02","A","A","3/7/02","AVD","3/7/07","2007","AVD","4.75","13.38","G/ADP/N/92/USA",10,10,1,8,1,0,1,2.306059661,0.95340758,22.8379434,63.91107188,1,37285.81592,11255.94789,1.06e+13,5.33e+11,9.68255014,32.73245013,1.181402837,4.126427146,"1/4/01",2001-01-04,2001-01-04,1044,2906,2001-08-02,1.06e+13,5.33e+11,9.68255014,32.73245013,22.8379434,63.91107188,37285.81592,11255.94789,1.181402837,4.126427146,"United States of America",1995-01-01,"South Korea",1995-01-01,1,1,"South Korea",1967-04-14,"United States of America",1948-01-01,1,1,8,8,10,10,1,1
"708",2,"2002",713,2001,713,2,"Q4_2012","USA","USA-AD-980","USA-AD-964","Taiwan","TWN","Cold-Rolled Steel Products","10/5/01","5/9/02","10/19/01","A","A","5/9/02","AVD","10/3/02","11/12/02","A","N",".",".",".",".",".",".",".",".",10,10,1,9,1,0,1,2.306059661,NA,22.8379434,NA,1,37285.81592,NA,1.06e+13,NA,9.68255014,NA,1.181402837,NA,"10/5/01",2001-10-05,2001-10-05,502,257,2002-05-09,1.1e+13,NA,9.150106555,NA,22.17081656,NA,38175.37638,NA,1.009241245,NA,"United States of America",1995-01-01,"Taiwan",2002-01-01,1,1,NA,NA,"United States of America",1948-01-01,1,NA,9,9,10,10,1,1
"709",2,"2002",640,2001,640,2,"Q4_2012","USA","USA-AD-982","USA-AD-964","Turkey","TUR","Cold-Rolled Steel Products","10/5/01","5/9/02","10/19/01","A","A","5/9/02","AVD","10/3/02","11/12/02","A","N",".",".",".",".",".",".",".",".",10,10,1,7,1,0,1,2.306059661,0.855704714,22.8379434,50.7562312,1,37285.81592,3057.790664,1.06e+13,1.96e+11,9.68255014,27.44088235,1.181402837,9.947713877,"10/5/01",2001-10-05,2001-10-05,998,257,2002-05-09,1.1e+13,2.33e+11,9.150106555,25.21730972,22.17081656,48.80008255,38175.37638,3576.227855,1.009241245,11.70692806,"United States of America",1995-01-01,"Turkey ",1995-03-26,1,1,"Turkey",1951-10-17,"United States of America",1948-01-01,1,1,7,8,10,10,1,1
"710",2,"2002",255,2001,255,2,"Q4_2012","USA","USA-AD-956","USA-AD-953","Germany","DEU","Carbon and Certain Alloy Steel Wire Rod","9/10/01","4/10/02","10/29/01","A","A","4/10/02","AVD","8/30/02","11/1/02","A","N",".",".",".",".",".",".",".",".",10,10,1,10,1,0,1,2.306059661,0.856664997,22.8379434,67.59503307,1,37285.81592,22840.27405,1.06e+13,1.88e+12,9.68255014,34.78900043,1.181402837,1.20527108,"9/10/01",2001-09-10,2001-09-10,1049,232,2002-04-10,1.1e+13,2.01e+12,9.150106555,35.67066879,22.17081656,66.84363568,38175.37638,24325.66645,1.009241245,0.994553881,"United States of America",1995-01-01,"Germany ",1995-01-01,1,1,"Germany",1951-10-01,"United States of America",1948-01-01,1,1,10,10,10,10,1,1
"711",2,"2002",900,2001,900,2,"Q4_2012","USA","USA-AD-965","USA-AD-964","Australia","AUS","Cold-Rolled Steel Products","10/5/01","5/9/02","10/19/01","A","A","5/9/02","AVD","7/19/02","9/13/02","A","N",".",".",".",".",".",".",".",".",10,10,1,10,1,0,1,2.306059661,5.894059235,22.8379434,44.09662085,0,37285.81592,19504.57255,1.06e+13,3.79e+11,9.68255014,22.13639623,1.181402837,3.835656398,"10/5/01",2001-10-05,2001-10-05,2034,257,2002-05-09,1.1e+13,3.94e+11,9.150106555,20.66211409,22.17081656,41.30101425,38175.37638,20071.96613,1.009241245,4.307360092,"United States of America",1995-01-01,"Australia ",1995-01-01,1,1,"Australia",1948-01-01,"United States of America",1948-01-01,1,1,10,10,10,10,1,1
"712",2,"2002",365,2002,365,2,"Q4_2012","USA","USA-AD-991","USA-AD-991","Russia","RUS","Silicon Metal","3/15/02","9/20/02","4/29/02","A","A","9/20/02","AVD","2/11/03","3/24/03","A","A","3/26/03","AVD","IF","IF","AVD","56.11","79.42","G/ADP/N/105/USA",10,10,1,6,1,0,1,2.401034651,3.378116065,22.17081656,59.70767417,0,38175.37638,2373.393213,1.1e+13,3.45e+11,9.150106555,35.24933157,1.009241245,6.298758953,"3/15/02",2002-03-15,2002-03-15,804,418,2002-09-20,1.1e+13,3.45e+11,9.150106555,35.24933157,22.17081656,59.70767417,38175.37638,2373.393213,1.009241245,6.298758953,"United States of America",1995-01-01,"Russia",2012-08-22,0,1,NA,NA,"United States of America",1948-01-01,1,NA,6,6,10,10,1,1
"713",2,"2002",380,2001,380,2,"Q4_2012","USA","USA-AD-979","USA-AD-964","Sweden","SWE","Cold-Rolled Steel Products","10/5/01","5/9/02","10/19/01","A","A","5/9/02","AVD","7/19/02","9/13/02","A","N",".",".",".",".",".",".",".",".",10,10,1,10,1,0,1,2.306059661,4.795049199,22.8379434,85.89800202,0,37285.81592,25557.61254,1.06e+13,2.27e+11,9.68255014,46.30327893,1.181402837,2.016157437,"10/5/01",2001-10-05,2001-10-05,2024,257,2002-05-09,1.1e+13,2.51e+11,9.150106555,44.37124278,22.17081656,81.99293674,38175.37638,28118.9848,1.009241245,1.943157025,"United States of America",1995-01-01,"Sweden ",1995-01-01,1,1,"Sweden",1950-04-30,"United States of America",1948-01-01,1,1,10,10,10,10,1,1
"714",2,"2002",369,2002,369,2,"Q4_2012","USA","USA-AD-1009","USA-AD-1006","Ukraine","UKR","Urea Ammonium Nitrate Solution","4/29/02","10/3/02","6/7/02","A","A","10/3/02","AVD","2/27/03","4/13/03","A","N",".",".",".",".",".",".",".",".",10,10,1,6,1,0,1,2.401034651,1.808523947,22.17081656,105.793809,0,38175.37638,879.4750486,1.1e+13,42392896031,9.150106555,55.08702006,1.009241245,14.6217084,"4/29/02",2002-04-29,2002-04-29,2841,463,2002-10-03,1.1e+13,42392896031,9.150106555,55.08702006,22.17081656,105.793809,38175.37638,879.4750486,1.009241245,14.6217084,"United States of America",1995-01-01,"Ukraine ",2008-05-16,0,1,NA,NA,"United States of America",1948-01-01,1,NA,6,6,10,10,1,1
"715",2,"2002",920,2001,920,2,"Q4_2012","USA","USA-AD-975","USA-AD-964","New Zealand","NZL","Cold-Rolled Steel Products","10/5/01","5/9/02","10/19/01","A","A","5/9/02","AVD","10/3/02","11/12/02","A","N",".",".",".",".",".",".",".",".",10,10,1,10,1,0,1,2.306059661,12.60528649,22.8379434,67.96328431,0,37285.81592,13736.70673,1.06e+13,53305290474,9.68255014,35.80878947,1.181402837,8.669790579,"10/5/01",2001-10-05,2001-10-05,665,257,2002-05-09,1.1e+13,66020503721,9.150106555,33.14843709,22.17081656,63.2397405,38175.37638,16720.40109,1.009241245,6.372463075,"United States of America",1995-01-01,"New Zealand",1995-01-01,1,1,"New Zealand",1948-07-30,"United States of America",1948-01-01,1,1,10,10,10,10,1,1
"716",2,"2002",750,2001,750,2,"Q4_2012","USA","USA-AD-971","USA-AD-964","India","IND","Cold-Rolled Steel Products","10/5/01","5/9/02","10/19/01","A","A","5/9/02","AVD","7/19/02","9/13/02","A","N",".",".",".",".",".",".",".",".",10,10,1,9,1,0,1,2.306059661,1.139473046,22.8379434,25.54526907,1,37285.81592,466.2141765,1.06e+13,4.94e+11,9.68255014,12.34193985,1.181402837,22.92230619,"10/5/01",2001-10-05,2001-10-05,1296,257,2002-05-09,1.1e+13,5.24e+11,9.150106555,14.01854169,22.17081656,29.00009028,38175.37638,486.640454,1.009241245,20.69574147,"United States of America",1995-01-01,"India ",1995-01-01,1,1,"India",1948-07-08,"United States of America",1948-01-01,1,1,9,9,10,10,1,1
"717",2,"2002",140,2001,140,2,"Q4_2012","USA","USA-AD-967","USA-AD-964","Brazil","BRA","Cold-Rolled Steel Products","10/5/01","5/9/02","10/19/01","A","A","5/9/02","AVD","10/3/02","11/12/02","A","N",".",".",".",".",".",".",".",".",10,10,1,8,1,0,1,2.306059661,4.103701107,22.8379434,25.67834696,1,37285.81592,3128.144846,1.06e+13,5.54e+11,9.68255014,12.18144648,1.181402837,5.973379533,"10/5/01",2001-10-05,2001-10-05,2469,257,2002-05-09,1.1e+13,5.04e+11,9.150106555,14.09662327,22.17081656,26.67960011,38175.37638,2810.695347,1.009241245,6.61763262,"United States of America",1995-01-01,"Brazil ",1995-01-01,1,1,"Brazil",1948-07-30,"United States of America",1948-01-01,1,1,8,8,10,10,1,1
"718",2,"2002",20,2001,20,2,"Q4_2012","USA","USA-AD-954","USA-AD-953","Canada","CAN","Carbon and Certain Alloy Steel Wire Rod","9/10/01","4/10/02","10/29/01","A","A","4/10/02","AVD","8/30/02","11/1/02","A","A","10/29/02","AVD","10/29/07","2007","AVD","1.18","9.9","G/ADP/N/98/USA",10,10,1,10,1,0,1,2.306059661,5.577059012,22.8379434,78.79827146,0,37285.81592,23573.75007,1.06e+13,7.33e+11,9.68255014,42.24634131,1.181402837,2.237988252,"9/10/01",2001-09-10,2001-09-10,2867,232,2002-04-10,1.1e+13,7.53e+11,9.150106555,40.32268991,22.17081656,76.27804103,38175.37638,23995.01633,1.009241245,2.179335795,"United States of America",1995-01-01,"Canada ",1995-01-01,1,1,"Canada",1948-01-01,"United States of America",1948-01-01,1,1,10,10,10,10,1,1
"719",2,"2002",710,2001,710,2,"Q4_2012","USA","USA-AD-986","USA-AD-986","China","CHN","Ferrovanadium","11/30/01","7/8/02","1/16/02","A","A","7/8/02","AVD","11/29/02","1/16/03","A","A","1/28/03","AVD","IF","IF","AVD","12.97","66.71","G/ADP/N/105/USA",10,10,1,-7,0,0,1,2.306059661,0.863739086,22.8379434,43.08019713,0,37285.81592,1041.6377,1.06e+13,1.32e+12,9.68255014,22.60010168,1.181402837,14.39172359,"11/30/01",2001-11-30,2001-11-30,1745,313,2002-07-08,1.1e+13,1.45e+12,9.150106555,25.13437343,22.17081656,47.69731271,38175.37638,1135.447952,1.009241245,13.74274917,"United States of America",1995-01-01,"China ",2001-12-11,1,1,NA,NA,"United States of America",1948-01-01,1,NA,-7,0,10,10,1,0
"720",2,"2002",160,2001,160,2,"Q4_2012","USA","USA-AD-964","USA-AD-964","Argentina","ARG","Cold-Rolled Steel Products","10/5/01","5/9/02","10/19/01","A","A","5/9/02","AVD","10/3/02","11/12/02","A","N",".",".",".",".",".",".",".",".",10,10,1,8,1,0,1,2.306059661,1.618177593,22.8379434,18.03958519,1,37285.81592,8732.466063,1.06e+13,3.25e+11,9.68255014,9.558790367,1.181402837,4.288049878,"10/5/01",2001-10-05,2001-10-05,665,257,2002-05-09,1.1e+13,1.24e+11,9.150106555,23.4304137,22.17081656,34.46767997,38175.37638,3285.026171,1.009241245,9.304636934,"United States of America",1995-01-01,"Argentina ",1995-01-01,1,1,"Argentina",1967-10-11,"United States of America",1948-01-01,1,1,8,8,10,10,1,1
"721",2,"2002",710,2001,710,2,"Q4_2012","USA","USA-AD-968","USA-AD-964","China","CHN","Cold-Rolled Steel Products","10/5/01","5/9/02","10/19/01","A","A","5/9/02","AVD","10/3/02","11/12/02","A","N",".",".",".",".",".",".",".",".",10,10,1,-7,0,0,1,2.306059661,0.863739086,22.8379434,43.08019713,0,37285.81592,1041.6377,1.06e+13,1.32e+12,9.68255014,22.60010168,1.181402837,14.39172359,"10/5/01",2001-10-05,2001-10-05,1689,257,2002-05-09,1.1e+13,1.45e+12,9.150106555,25.13437343,22.17081656,47.69731271,38175.37638,1135.447952,1.009241245,13.74274917,"United States of America",1995-01-01,"China ",2001-12-11,1,1,NA,NA,"United States of America",1948-01-01,1,NA,-7,0,10,10,1,0
"722",2,"2002",710,2002,710,2,"Q4_2012","USA","USA-AD-1013","USA-AD-1013","China","CHN","Saccharin","7/18/02","12/27/02","8/30/02","A","A","12/27/02","AVD","5/20/03","6/25/03","A","A","7/9/03","AVD","IF","IF","AVD","249.39","329.94","G/ADP/N/112/USA",10,10,1,-7,0,0,1,2.401034651,0.780540991,22.17081656,47.69731271,0,38175.37638,1135.447952,1.1e+13,1.45e+12,9.150106555,25.13437343,1.009241245,13.74274917,"7/18/02",2002-07-18,2002-07-18,1975,543,2002-12-27,1.1e+13,1.45e+12,9.150106555,25.13437343,22.17081656,47.69731271,38175.37638,1135.447952,1.009241245,13.74274917,"United States of America",1995-01-01,"China ",2001-12-11,1,1,NA,NA,"United States of America",1948-01-01,1,NA,-7,0,10,10,1,0
"723",2,"2002",230,2001,230,2,"Q4_2012","USA","USA-AD-978","USA-AD-964","Spain","ESP","Cold-Rolled Steel Products","10/5/01","5/9/02","10/19/01","A","A","5/9/02","AVD","10/3/02","11/12/02","A","N",".",".",".",".",".",".",".",".",10,10,1,10,1,0,1,2.306059661,1.267123637,22.8379434,59.59388416,1,37285.81592,14939.06077,1.06e+13,6.09e+11,9.68255014,28.53363551,1.181402837,4.099585896,"10/5/01",2001-10-05,2001-10-05,1979,257,2002-05-09,1.1e+13,6.86e+11,9.150106555,27.32640574,22.17081656,56.77442003,38175.37638,16564.56844,1.009241245,3.863690288,"United States of America",1995-01-01,"Spain ",1995-01-01,1,1,"Spain",1963-08-29,"United States of America",1948-01-01,1,1,10,10,10,10,1,1
"724",2,"2002",310,2001,310,2,"Q4_2012","USA","USA-AD-984","USA-AD-984","Hungary","HUN","Sulfanilic Acid","10/5/01","5/6/02","10/19/01","A","A","5/6/02","AVD","9/25/02","11/6/02","A","A","11/8/02","AVD","11/8/07","2007","AVD","20.98","20.98","G/ADP/N/98/USA",10,10,1,10,1,0,1,2.306059661,0.908916713,22.8379434,145.0008468,0,37285.81592,5175.025628,1.06e+13,52720966883,9.68255014,71.98411298,1.181402837,5.308697711,"10/5/01",2001-10-05,2001-10-05,1187,257,2002-05-06,1.1e+13,66389489264,9.150106555,63.25005849,22.17081656,128.3529198,38175.37638,6535.293936,1.009241245,4.638699107,"United States of America",1995-01-01,"Hungary ",1995-01-01,1,1,"Hungary",1973-09-09,"United States of America",1948-01-01,1,1,10,10,10,10,1,1
"725",2,"2002",101,2001,101,2,"Q4_2012","USA","USA-AD-983","USA-AD-964","Venezuela","VEN","Cold-Rolled Steel Products","10/5/01","5/9/02","10/19/01","A","A","5/9/02","AVD","10/3/02","11/12/02","A","N",".",".",".",".",".",".",".",".",10,10,1,6,1,0,1,2.306059661,0.240319121,22.8379434,42.14126802,1,37285.81592,4942.00061,1.06e+13,1.23e+11,9.68255014,22.73563157,1.181402837,4.544217324,"10/5/01",2001-10-05,2001-10-05,976,257,2002-05-09,1.1e+13,92889586976,9.150106555,30.43357055,22.17081656,48.57571065,38175.37638,3666.652442,1.009241245,4.103337017,"United States of America",1995-01-01,"Venezuela",1995-01-01,1,1,"Venezuela",1990-08-31,"United States of America",1948-01-01,1,1,6,6,10,10,1,1
"726",2,"2002",370,2002,370,2,"Q4_2012","USA","USA-AD-1006","USA-AD-1006","Belarus","BLR","Urea Ammonium Nitrate Solution","4/29/02","10/3/02","6/7/02","A","A","10/3/02","AVD","2/27/03","4/13/03","A","N",".",".",".",".",".",".",".",".",10,10,1,-7,0,0,1,2.401034651,3.710257637,22.17081656,131.0020583,0,38175.37638,1479.465321,1.1e+13,14594925393,9.150106555,63.62751594,1.009241245,11.7752761,"4/29/02",2002-04-29,2002-04-29,2840,463,2002-10-03,1.1e+13,14594925393,9.150106555,63.62751594,22.17081656,131.0020583,38175.37638,1479.465321,1.009241245,11.7752761,"United States of America",1995-01-01,NA,NA,NA,1,NA,NA,"United States of America",1948-01-01,1,NA,-7,0,10,10,1,0
"727",2,"2002",255,2001,255,2,"Q4_2012","USA","USA-AD-970","USA-AD-964","Germany","DEU","Cold-Rolled Steel Products","10/5/01","5/9/02","10/19/01","A","A","5/9/02","AVD","10/3/02","11/12/02","A","N",".",".",".",".",".",".",".",".",10,10,1,10,1,0,1,2.306059661,0.856664997,22.8379434,67.59503307,1,37285.81592,22840.27405,1.06e+13,1.88e+12,9.68255014,34.78900043,1.181402837,1.20527108,"10/5/01",2001-10-05,2001-10-05,1074,257,2002-05-09,1.1e+13,2.01e+12,9.150106555,35.67066879,22.17081656,66.84363568,38175.37638,24325.66645,1.009241245,0.994553881,"United States of America",1995-01-01,"Germany ",1995-01-01,1,1,"Germany",1951-10-01,"United States of America",1948-01-01,1,1,10,10,10,10,1,1
