,obsid,leadid,ccode,idacr,leader,startdate,enddate,bornin,died,eindate,eoutdate,entry,exit,exitcode,prevtimesinoffice,posttenurefate,gender,borndate,yrborn,deathdate,yrdied1,USA-1869,A2.9-1,2,USA,Grant,04/03/1869,04/03/1877,1822,23/07/1885,1869-03-04,1877-03-04,0,1,0,0,0,M,NA,1822,1885-07-23,18852,USA-1877,A2.9-4,2,USA,Hayes,04/03/1877,04/03/1881,1822,17/01/1893,1877-03-04,1881-03-04,0,1,0,0,0,M,NA,1822,1893-01-17,18933,USA-1881-1,A2.9-7,2,USA,Garfield,04/03/1881,19/09/1881,1831,19/09/1881,1881-03-04,1881-09-19,0,3,11,0,3,M,NA,1831,1881-09-19,18814,USA-1881-2,A2.9-10,2,USA,Arthur,19/09/1881,04/03/1885,1829,18/11/1886,1881-09-19,1885-03-04,0,1,0,0,0,M,NA,1829,1886-11-18,18865,USA-1885,A2.9-13,2,USA,Cleveland,04/03/1885,04/03/1889,1837,24/06/1908,1885-03-04,1889-03-04,0,1,0,0,0,M,NA,1837,6/24/08,19086,USA-1889,A2.9-16,2,USA,Harrison,04/03/1889,04/03/1893,1833,13/03/1901,1889-03-04,1893-03-04,0,1,0,0,0,M,NA,1833,3/13/01,19017,USA-1893,A2.9-19,2,USA,Cleveland,04/03/1893,04/03/1897,1837,24/06/1908,1893-03-04,1897-03-04,0,1,0,1,0,M,NA,1837,6/24/08,19088,USA-1897,A2.9-22,2,USA,McKinley,04/03/1897,14/09/1901,1843,14/09/1901,1897-03-04,9/14/01,0,3,11,0,3,M,NA,1843,9/14/01,19019,USA-1901,A2.9-25,2,USA,"Roosevelt, T.",14/09/1901,4/3/09,1858,1919,9/14/01,3/4/09,0,1,0,0,0,M,NA,1858,NA,191910,USA-1909,A2.9-28,2,USA,Taft,4/3/09,4/3/13,1857,1930,3/4/09,3/4/13,0,1,0,0,0,M,NA,1857,NA,193011,USA-1913,A2.9-31,2,USA,Wilson,4/3/13,4/3/21,1856,1924,3/4/13,3/4/21,0,1,0,0,0,M,NA,1856,NA,192412,USA-1921,A2.9-34,2,USA,Harding,4/3/21,3/8/23,1865,1923,3/4/21,8/3/23,0,2,0,0,-777,M,NA,1865,NA,192313,USA-1923,A2.9-37,2,USA,Coolidge,3/8/23,4/3/29,1872,1933,8/3/23,3/4/29,0,1,0,0,0,M,NA,1872,NA,193314,USA-1929,A2.9-40,2,USA,Hoover,4/3/29,4/3/33,1874,1964,3/4/29,3/4/33,0,1,0,0,0,M,NA,1874,NA,196415,USA-1933,A2.9-43,2,USA,"Roosevelt, F.",4/3/33,12/4/45,1882,1945,3/4/33,4/12/45,0,2,0,0,-777,M,NA,1882,NA,194516,USA-1945,A2.9-46,2,USA,Truman,12/4/45,20/01/1953,1884,1972,4/12/45,1/20/53,0,1,0,0,0,M,NA,1884,NA,197217,USA-1953,A2.9-49,2,USA,Eisenhower,20/01/1953,20/01/1961,1890,1969,1/20/53,1/20/61,0,1,0,0,0,M,NA,1890,NA,196918,USA-1961,A2.9-52,2,USA,Kennedy,20/01/1961,22/11/1963,1917,1963,1/20/61,11/22/63,0,3,11,0,3,M,NA,1917,NA,196319,USA-1963,A2.9-55,2,USA,Johnson,22/11/1963,20/01/1969,1908,1973,11/22/63,1/20/69,0,1,0,0,0,M,NA,1908,NA,197320,USA-1969,A2.9-58,2,USA,Nixon,20/01/1969,9/8/74,1913,1994,1/20/69,8/9/74,0,1,0,0,0,M,NA,1913,NA,199421,USA-1974,A2.9-61,2,USA,Ford,9/8/74,20/01/1977,1913,2006,8/9/74,1/20/77,0,1,0,0,0,M,NA,1913,NA,200622,USA-1977,A2.9-64,2,USA,Carter,20/01/1977,20/01/1981,1924,-777,1/20/77,1/20/81,0,1,0,0,0,M,NA,1924,NA,-77723,USA-1981,A2.9-67,2,USA,Reagan,20/01/1981,20/01/1989,1911,2004,1/20/81,1/20/89,0,1,0,0,0,M,NA,1911,NA,200424,USA-1989,A2.9-70,2,USA,Bush,20/01/1989,20/01/1993,1924,-777,1/20/89,1/20/93,0,1,0,0,0,M,NA,1924,NA,-77725,USA-1993,A2.9-73,2,USA,Clinton,20/01/1993,20/01/2001,1946,-777,1/20/93,1/20/01,0,1,0,0,0,M,NA,1946,NA,-77726,USA-2001,A2.9-76,2,USA,G.W. Bush,21/01/2001,31/12/2004,1946,-777,1/21/01,12/31/04,0,-888,0,0,-888,M,NA,1946,NA,-77727,CAN-1873,A2.9-79,20,CAN,Mackenzie,07/11/1873,17/10/1878,1822,17/04/1892,1873-11-07,1878-10-17,0,1,0,0,0,M,NA,1822,1892-04-17,189228,CAN-1878,A2.9-82,20,CAN,Macdonald,17/10/1878,06/06/1891,1815,06/06/1891,1878-10-17,1891-06-06,0,2,0,1,-777,M,NA,1815,1891-06-06,189129,CAN-1891,A2.9-85,20,CAN,Abbott,16/06/1891,05/12/1892,1821,30/10/1893,1891-06-16,1892-12-05,0,1,0,0,0,M,NA,1821,1893-10-30,189330,CAN-1892,A2.9-88,20,CAN,Thompson,05/12/1892,12/12/1894,1845,1894,1892-12-05,1894-12-12,0,2,0,0,-777,M,NA,1845,NA,189431,CAN-1894,A2.9-91,20,CAN,Bowell,21/12/1894,01/05/1896,1823,1917,1894-12-21,1896-05-01,0,1,0,0,0,M,NA,1823,NA,191732,CAN-1896-1,A2.9-94,20,CAN,Tupper,01/05/1896,11/07/1896,1821,1915,1896-05-01,1896-07-11,0,1,0,0,0,M,NA,1821,NA,191533,CAN-1896-2,A2.9-97,20,CAN,Laurier,11/07/1896,10/10/11,1841,1919,1896-07-11,10/10/11,0,1,0,0,0,M,NA,1841,NA,191934,CAN-1911,A2.9-100,20,CAN,Borden,10/10/11,10/6/20,1854,1937,10/10/11,6/10/20,0,2.1,0,0,0,M,NA,1854,NA,193735,CAN-1920,A2.9-103,20,CAN,Meighen,10/7/20,29/12/1921,1874,1960,7/10/20,12/29/21,0,1,0,0,0,M,NA,1874,NA,196036,CAN-1921,A2.9-106,20,CAN,King,29/12/1921,28/06/1926,1874,1951,12/29/21,6/28/26,0,1,0,0,0,M,NA,1874,NA,195137,CAN-1926-1,A2.9-109,20,CAN,Meighen,29/06/1926,25/09/1926,1874,1960,6/29/26,9/25/26,0,1,0,1,0,M,NA,1874,NA,196038,CAN-1926-2,A2.9-112,20,CAN,King,25/09/1926,7/8/30,1874,1951,9/25/26,8/7/30,0,1,0,1,0,M,NA,1874,NA,195139,CAN-1930,A2.9-115,20,CAN,Bennett,7/8/30,23/10/1935,1870,1947,8/7/30,10/23/35,0,1,0,0,0,M,NA,1870,NA,194740,CAN-1935,A2.9-118,20,CAN,King,23/10/1935,15/11/1948,1874,1951,10/23/35,11/15/48,0,2.1,0,2,0,M,NA,1874,NA,195141,CAN-1948,A2.9-121,20,CAN,St. Laurent,15/11/1948,21/06/1957,1/2/1882,1973,11/15/48,6/21/57,0,1,0,0,0,M,1882-02-01,1882,NA,197342,CAN-1957,A2.9-124,20,CAN,Diefenbaker,21/06/1957,22/04/1963,18/9/1895,1979,6/21/57,4/22/63,0,1,0,0,0,M,1895-09-18,1895,NA,197943,CAN-1963,A2.9-127,20,CAN,Pearson,22/04/1963,20/04/1968,23/4/1897,1972,4/22/63,4/20/68,0,1,0,0,0,M,1897-04-23,1897,NA,197244,CAN-1968,A2.9-130,20,CAN,Trudeau,20/04/1968,4/6/79,18/10/1919,2000,4/20/68,6/4/79,0,1,0,0,0,M,10/18/19,1919,NA,200045,CAN-1979,A2.9-133,20,CAN,Clark,4/6/79,3/3/80,5/6/39,-777,6/4/79,3/3/80,0,1,0,0,0,M,6/5/39,1939,NA,-77746,CAN-1980,A2.9-136,20,CAN,Trudeau,3/3/80,30/06/1984,18/10/1919,2000,3/3/80,6/30/84,0,1,0,1,0,M,10/18/19,1919,NA,200047,CAN-1984-1,A2.9-139,20,CAN,Turner,30/06/1984,17/09/1984,7/6/29,-777,6/30/84,9/17/84,0,1,0,0,0,M,6/7/29,1929,NA,-77748,CAN-1984-2,A2.9-142,20,CAN,Mulroney,17/09/1984,25/06/1993,20/3/1939,-777,9/17/84,6/25/93,0,1,0,0,0,M,3/20/39,1939,NA,-77749,CAN-1993-1,A2.9-145,20,CAN,Kim Campbell,25/06/1993,4/11/93,1947,-777,6/25/93,11/4/93,0,1,0,0,0,F,NA,1947,NA,-77750,CAN-1993-2,A2.9-148,20,CAN,Chretien,4/11/93,12/12/03,1939,-777,11/4/93,12/12/03,0,1,0,0,0,M,NA,1939,NA,-77751,CAN-2003,A2.9-151,20,CAN,Paul Martin,12/12/03,31/12/2004,1938,-777,12/12/03,12/31/04,0,-888,0,0,-888,M,NA,1938,NA,-77752,BHM-1967,A2.9-154,31,BHM,Pindling,16/01/1967,21/08/1992,1930,2000,1/16/67,8/21/92,0,1,0,0,0,M,NA,1930,NA,200053,BHM-1992,A2.9-157,31,BHM,Ingraham,21/08/1992,3/5/02,1947,-777,8/21/92,5/3/02,0,1,0,0,0,M,NA,1947,NA,-77754,BHM-2002,A2.9-160,31,BHM,Christie,3/5/02,31/12/2004,1943,-777,5/3/02,12/31/04,0,-888,0,0,-888,M,NA,1943,NA,-77755,CUB-1902,A2.9-163,40,CUB,Palma,20/05/1902,28/09/1906,9/7/1835,1908,5/20/02,9/28/06,0,3,-999,0,0,M,1835-07-09,1835,NA,190856,CUB-1909,A2.9-166,40,CUB,Gomez,28/01/1909,20/05/1913,6/7/1858,1921,1/28/09,5/20/13,0,1,0,0,0,M,1858-07-06,1858,NA,192157,CUB-1913,A2.9-169,40,CUB,Menocal,20/05/1913,20/05/1921,17/12/1868,1941,5/20/13,5/20/21,0,1,0,0,1,M,1868-12-17,1868,NA,194158,CUB-1921,A2.9-172,40,CUB,Zyas y Alfonso,20/05/1921,20/05/1925,21/9/1861,1934,5/20/21,5/20/25,0,1,0,0,0,M,1861-09-21,1861,NA,193459,CUB-1925,A2.9-175,40,CUB,Machado Morales,20/05/1925,12/8/33,28/9/1871,1939,5/20/25,8/12/33,0,3,6,0,1,M,1871-09-28,1871,NA,193960,CUB-1933-1,A2.9-178,40,CUB,de Cespedes,12/8/33,5/9/33,12/8/1871,1939,8/12/33,9/5/33,1,3,6,0,0,M,1871-08-12,1871,NA,193961,CUB-1933-2,A2.9-181,40,CUB,Grau San Martin,10/9/33,15/01/1934,13/9/1882,1969,9/10/33,1/15/34,1,3,16,0,1,M,1882-09-13,1882,NA,196962,CUB-1934-1,A2.9-184,40,CUB,Hevia,15/01/1934,18/01/1934,1900,1964,1/15/34,1/18/34,1,3,16,0,0,M,NA,1900,NA,196463,CUB-1934-2,A2.9-187,40,CUB,Mendieta,18/01/1934,12/12/35,4/11/1873,1960,1/18/34,12/12/35,1,1,0,0,0,M,1873-11-04,1873,NA,196064,CUB-1935,A2.9-190,40,CUB,Barnet,12/12/35,20/05/1936,1864,1945,12/12/35,5/20/36,0,1,0,0,0,M,NA,1864,NA,194565,CUB-1936-1,A2.9-193,40,CUB,Gomez y Arias,20/05/1936,28/12/1936,6/10/1889,1950,5/20/36,12/28/36,0,1,0,0,0,M,1889-10-06,1889,NA,195066,CUB-1936-2,A2.9-196,40,CUB,Laredo Bru,28/12/1936,10/10/40,23/4/1875,1946,12/28/36,10/10/40,0,1,0,0,0,M,1875-04-23,1875,NA,194667,CUB-1940,A2.9-199,40,CUB,Batista,10/10/40,10/10/44,16/1/1901,1973,10/10/40,10/10/44,0,1,0,0,1,M,1/16/01,1901,NA,197368,CUB-1944,A2.9-202,40,CUB,Grau San Martin,10/10/44,10/10/48,13/9/1882,1969,10/10/44,10/10/48,0,1,0,1,1,M,1882-09-13,1882,NA,196969,CUB-1948,A2.9-205,40,CUB,Prio Socarres,10/10/48,10/3/52,14/7/1903,1977,10/10/48,3/10/52,0,3,6,0,1,M,7/14/03,1903,NA,197770,CUB-1952,A2.9-208,40,CUB,Batista,10/3/52,1/1/59,16/1/1901,1973,3/10/52,1/1/59,1,3,4,1,1,M,1/16/01,1901,NA,197371,CUB-1959,A2.9-211,40,CUB,Castro,2/1/59,31/12/2004,13/8/1927,-777,1/2/59,12/31/04,1,-888,0,0,-888,M,8/13/27,1927,NA,-77772,HAI-1874,A2.9-214,41,HAI,Rameau,11/06/1874,15/04/1876,1828,15/04/1876,1874-06-11,1876-04-15,1,3,6,0,3,M,NA,1828,1876-04-15,187673,HAI-1876,A2.9-217,41,HAI,Canal,23/04/1876,17/07/1879,1832,1905,1876-04-23,1879-07-17,1,3,-999,0,1,M,NA,1832,NA,190574,HAI-1879-1,A2.9-220,41,HAI,Herrise,17/07/1879,26/07/1879,-999,-999,1879-07-17,1879-07-26,1,1,0,0,2,M,NA,NA,NA,NA75,HAI-1879-2,A2.9-223,41,HAI,Lamothe,26/07/1879,02/10/1879,-999,-999,1879-07-26,1879-10-02,1,3,-999,0,2,M,NA,NA,NA,NA76,HAI-1879-3,A2.9-226,41,HAI,Salomon,23/10/1879,10/08/1888,1815,1888,1879-10-23,1888-08-10,1,3,-999,0,1,M,NA,1815,NA,188877,HAI-1888-1,A2.9-229,41,HAI,Canal,10/08/1888,16/10/1888,1832,1905,1888-08-10,1888-10-16,1,1,0,1,1,M,NA,1832,NA,190578,HAI-1888-2,A2.9-232,41,HAI,Legitime,16/10/1888,22/08/1889,1841,1935,1888-10-16,1889-08-22,1,3,-999,0,1,M,NA,1841,NA,193579,HAI-1889,A2.9-235,41,HAI,Hippolyte,25/08/1889,24/03/1896,1827,1896,1889-08-25,1896-03-24,1,2,0,0,-777,M,NA,1827,NA,189680,HAI-1896,A2.9-238,41,HAI,P. A. T. Simon,31/03/1896,12/5/02,1835,1916,1896-03-31,5/12/02,0,1,0,0,1,M,NA,1835,NA,191681,HAI-1902-1,A2.9-241,41,HAI,Canal,26/05/1902,17/12/1902,1832,1905,5/26/02,12/17/02,1,3,-999,2,0,M,NA,1832,NA,190582,HAI-1902-2,A2.9-244,41,HAI,Nord,17/12/1902,20/12/1908,1820,1/5/10,12/17/02,12/20/08,1,3,-999,0,1,M,NA,1820,5/1/10,191083,HAI-1908,A2.9-247,41,HAI,A. Simon,20/12/1908,3/8/11,1844,1923,12/20/08,8/3/11,1,3,-999,0,1,M,NA,1844,NA,192384,HAI-1911,A2.9-250,41,HAI,Leconte,7/8/11,8/8/12,1854,1912,8/7/11,8/8/12,1,3,-999,0,3,M,NA,1854,NA,191285,HAI-1912,A2.9-253,41,HAI,Tancred Auguste,8/8/12,12/5/13,1856,1913,8/8/12,5/12/13,1,2,0,0,-777,M,NA,1856,NA,191386,HAI-1913,A2.9-256,41,HAI,Michel Oreste,12/5/13,27/01/1914,1859,28/10/1918,5/12/13,1/27/14,0,3,-999,0,1,M,NA,1859,10/28/18,191887,HAI-1914-1,A2.9-259,41,HAI,Oreste Zamor,8/2/14,19/10/1914,1861,1915,2/8/14,10/19/14,1,3,-999,0,3,M,NA,1861,NA,191588,HAI-1914-2,A2.9-262,41,HAI,Theodore,19/10/1914,22/02/1915,1847,13/01/1917,10/19/14,2/22/15,1,3,-999,0,1,M,NA,1847,1/13/17,191789,HAI-1915,A2.9-265,41,HAI,Velbrun-Guillaume,4/3/15,26/07/1915,-999,1915,3/4/15,7/26/15,1,3,-999,0,3,M,NA,NA,NA,191590,HAI-1934,A2.9-268,41,HAI,Vincent,15/08/1934,15/05/1941,1874,3/9/59,8/15/34,5/15/41,0,1,0,0,1,M,NA,1874,9/3/59,195991,HAI-1941,A2.9-271,41,HAI,Lescot,15/05/1941,11/1/46,9/12/1883,21/10/1974,5/15/41,1/11/46,0,3,6,0,1,M,1883-12-09,1883,10/21/74,197492,HAI-1946-1,A2.9-274,41,HAI,Lavaud,11/1/46,16/08/1946,1903,-999,1/11/46,8/16/46,1,1,0,0,0,M,NA,1903,NA,NA93,HAI-1946-2,A2.9-277,41,HAI,Estime,16/08/1946,10/5/50,21/4/1900,20/07/1953,8/16/46,5/10/50,0,3,6,0,2,M,4/21/00,1900,7/20/53,195394,HAI-1950,A2.9-280,41,HAI,Magloire,10/5/50,12/12/56,19/7/1907,2001,5/10/50,12/12/56,0,3,6,0,1,M,7/19/07,1907,NA,200195,HAI-1956,A2.9-283,41,HAI,Pierre-Louis,12/12/56,3/2/57,1900,-999,12/12/56,2/3/57,0,3,6,0,0,M,NA,1900,NA,NA96,HAI-1957-1,A2.9-286,41,HAI,Sylvain,7/2/57,2/4/57,1909,1987,2/7/57,4/2/57,0,3,6,0,2,M,NA,1909,NA,198797,HAI-1957-2,A2.9-289,41,HAI,Cantave,2/4/57,6/4/57,1910,1967,4/2/57,4/6/57,1,1,0,0,0,M,NA,1910,NA,196798,HAI-1957-3,A2.9-292,41,HAI,Executive council,6/4/57,20/05/1957,-999,-999,4/6/57,5/20/57,0,1,0,0,0,M,NA,NA,NA,NA99,HAI-1957-4,A2.9-295,41,HAI,Cantave,20/05/1957,26/05/1957,4/7/10,1967,5/20/57,5/26/57,1,3,6,1,1,M,7/4/10,1910,NA,1967100,HAI-1957-5,A2.9-298,41,HAI,Fignole,26/05/1957,14/06/1957,12/11/14,1986,5/26/57,6/14/57,1,3,6,0,1,M,11/12/14,1914,NA,1986101,HAI-1957-6,A2.9-301,41,HAI,Kebreau,14/06/1957,15/10/1957,11/11/09,1962,6/14/57,10/15/57,1,1,0,0,1,M,11/11/09,1909,NA,1962102,HAI-1957-7,A2.9-304,41,HAI,"Duvalier, Francois",15/10/1957,22/04/1971,14/4/1907,1971,10/15/57,4/22/71,0,2,0,0,-777,M,4/14/07,1907,NA,1971103,HAI-1971,A2.9-307,41,HAI,"Duvalier, Jean-",22/04/1971,7/2/86,3/7/51,-777,4/22/71,2/7/86,0,3,6,0,1,M,7/3/51,1951,NA,-777104,HAI-1986,A2.9-310,41,HAI,Namphy,7/2/86,7/2/88,2/11/32,-777,2/7/86,2/7/88,1,1,0,0,2,M,11/2/32,1932,NA,-777105,HAI-1988-1,A2.9-313,41,HAI,Manigat,7/2/88,20/06/1988,16/8/1930,-777,2/7/88,6/20/88,0,3,6,0,1,M,8/16/30,1930,NA,-777106,HAI-1988-2,A2.9-316,41,HAI,Namphy,20/06/1988,17/09/1988,2/11/32,-777,6/20/88,9/17/88,1,3,6,1,1,M,11/2/32,1932,NA,-777107,HAI-1988-3,A2.9-319,41,HAI,Avril,17/09/1988,10/3/90,1938,-777,9/17/88,3/10/90,1,3,2,0,1,M,NA,1938,NA,-777108,HAI-1990-1,A2.9-322,41,HAI,Abraham,10/3/90,13/03/1990,1940,-777,3/10/90,3/13/90,0,1,0,0,0,M,NA,1940,NA,-777109,HAI-1990-2,A2.9-325,41,HAI,Pascal-Troillet,13/03/1990,7/2/91,13/8/1943,-777,3/13/90,2/7/91,0,1,0,0,2,F,8/13/43,1943,NA,-777110,HAI-1991-1,A2.9-328,41,HAI,Aristide,7/2/91,30/09/1991,15/7/1953,-777,2/7/91,9/30/91,0,3,6,0,2,M,7/15/53,1953,NA,-777111,HAI-1991-2,A2.9-331,41,HAI,Cedras,30/09/1991,14/10/1994,1949,-777,9/30/91,10/14/94,1,4,9,0,1,M,NA,1949,NA,-777112,HAI-1994,A2.9-334,41,HAI,Aristide,15/10/1994,7/2/96,15/7/1953,-777,10/15/94,2/7/96,2,1,0,1,0,M,7/15/53,1953,NA,-777113,HAI-1996,A2.9-337,41,HAI,Preval,7/2/96,7/2/01,1943,-777,2/7/96,2/7/01,0,1,0,0,0,M,NA,1943,NA,-777114,HAI-2001,A2.9-340,41,HAI,Aristide,8/2/01,29/02/2004,15/7/1953,-777,2/8/01,2/29/04,0,3,3,2,1,M,7/15/53,1953,NA,-777115,HAI-2004,A2.9-343,41,HAI,Boniface Alexandre,29/02/2004,31/12/2004,1936,-777,2/29/04,12/31/04,0,-888,0,0,-888,M,NA,1936,NA,-777116,DOM-1874,A2.9-346,42,DOM,Gonzalez,02/01/1874,23/02/1876,1840,1915,1874-01-02,1876-02-23,1,3,-999,0,0,M,NA,1840,NA,1915117,DOM-1876-1,A2.9-349,42,DOM,Villanueva,24/02/1876,03/03/1876,-999,1920,1876-02-24,1876-03-03,1,3,6,0,1,M,NA,NA,NA,1920118,DOM-1876-2,A2.9-352,42,DOM,Espaillat,29/04/1876,05/10/1876,1823,1878,1876-04-29,1876-10-05,1,3,-999,0,1,M,NA,1823,NA,1878119,DOM-1876-3,A2.9-355,42,DOM,Gonzalez,05/10/1876,09/12/1876,1840,1915,1876-10-05,1876-12-09,1,3,-999,1,1,M,NA,1840,NA,1915120,DOM-1876-4,A2.9-358,42,DOM,Buenaventura Baez,26/12/1876,02/03/1878,14/7/1812,14/03/1884,1876-12-26,1878-03-02,1,3,-999,4,1,M,1812-07-14,1812,1884-03-14,1884121,DOM-1878-1,A2.9-361,42,DOM,Guillermo,05/03/1878,06/07/1878,1847,1885,1878-03-05,1878-07-06,1,1,0,0,1,M,NA,1847,NA,1885122,DOM-1878-2,A2.9-364,42,DOM,Gonzalez,06/07/1878,02/09/1878,1840,1915,1878-07-06,1878-09-02,0,3,-999,2,1,M,NA,1840,NA,1915123,DOM-1878-3,A2.9-367,42,DOM,del Rosario de Castro,07/09/1878,29/09/1878,1811,1896,1878-09-07,1878-09-29,0,3,-999,1,0,M,NA,1811,NA,1896124,DOM-1878-4,A2.9-370,42,DOM,Guillermo,30/09/1878,06/12/1879,1847,1885,1878-09-30,1879-12-06,1,3,-999,1,1,M,NA,1847,NA,1885125,DOM-1879,A2.9-373,42,DOM,Luperon,06/12/1879,01/09/1880,1839,1897,1879-12-06,1880-09-01,1,1,0,0,0,M,NA,1839,NA,1897126,DOM-1880,A2.9-376,42,DOM,de Merino,01/09/1880,01/09/1882,1833,1906,1880-09-01,1882-09-01,0,1,0,0,0,M,NA,1833,NA,1906127,DOM-1882,A2.9-379,42,DOM,Heureaux,01/09/1882,01/09/1884,21/10/1845,26/07/1899,1882-09-01,1884-09-01,0,1,0,0,0,M,1845-10-21,1845,1899-07-26,1899128,DOM-1884,A2.9-382,42,DOM,Billini,01/09/1884,16/05/1885,1844,1898,1884-09-01,1885-05-16,0,3,-999,0,0,M,NA,1844,NA,1898129,DOM-1885,A2.9-385,42,DOM,Woss y Gil,16/05/1885,06/01/1887,1856,1932,1885-05-16,1887-01-06,0,1,0,0,0,M,NA,1856,NA,1932130,DOM-1887,A2.9-388,42,DOM,Heureaux,06/01/1887,26/07/1899,21/10/1845,26/07/1899,1887-01-06,1899-07-26,0,3,-999,1,3,M,1845-10-21,1845,1899-07-26,1899131,DOM-1899-1,A2.9-391,42,DOM,Figuereo,27/07/1899,31/08/1899,1834,1910,1899-07-27,1899-08-31,0,3,-999,0,0,M,NA,1834,NA,1910132,DOM-1899-2,A2.9-394,42,DOM,Vasquez,01/09/1899,14/11/1899,22/10/1860,1936,1899-09-01,1899-11-14,1,1,0,0,0,M,1860-10-22,1860,NA,1936133,DOM-1899-3,A2.9-397,42,DOM,Jimenez,15/11/1899,2/5/02,1846,1919,1899-11-15,5/2/02,0,3,-999,0,1,M,NA,1846,NA,1919134,DOM-1902,A2.9-400,42,DOM,Vasquez,2/5/02,18/04/1903,22/10/1860,1936,5/2/02,4/18/03,1,3,-999,1,0,M,1860-10-22,1860,NA,1936135,DOM-1903-1,A2.9-403,42,DOM,Woss y Gil,18/04/1903,4/11/03,1856,1932,4/18/03,11/4/03,1,1,0,1,1,M,NA,1856,NA,1932136,DOM-1903-2,A2.9-406,42,DOM,Morales,4/11/03,25/12/1905,1867,1906,11/4/03,12/25/05,1,3,-999,0,1,M,NA,1867,NA,1906137,DOM-1905,A2.9-409,42,DOM,Caceres,25/12/1905,19/11/1911,15/12/1866,1911,12/25/05,11/19/11,0,3,-999,0,3,M,1866-12-15,1866,NA,1911138,DOM-1911,A2.9-412,42,DOM,Victoria,2/12/11,28/11/1912,1864,1939,12/2/11,11/28/12,1,3,-999,0,0,M,NA,1864,NA,1939139,DOM-1912,A2.9-415,42,DOM,Nouel y Bobadilla,1/12/12,31/03/1913,1862,1937,12/1/12,3/31/13,0,1,0,0,1,M,NA,1862,NA,1937140,DOM-1913,A2.9-418,42,DOM,Bordas y Valdes,13/04/1913,27/08/1914,1874,1968,4/13/13,8/27/14,0,4,-999,0,1,M,NA,1874,NA,1968141,DOM-1914-1,A2.9-421,42,DOM,Ramon Baez,27/08/1914,5/12/14,1858,1929,8/27/14,12/5/14,0,1,0,0,0,M,NA,1858,NA,1929142,DOM-1914-2,A2.9-424,42,DOM,Jimenez,5/12/14,8/5/16,1846,1919,12/5/14,5/8/16,0,4,-999,1,1,M,NA,1846,NA,1919143,DOM-1925,A2.9-427,42,DOM,Vasquez,1/1/25,27/02/1930,22/10/1860,1936,1/1/25,2/27/30,1,3,6,2,0,M,1860-10-22,1860,NA,1936144,DOM-1930-1,A2.9-430,42,DOM,Estrella Urena,2/3/30,16/08/1930,1889,1945,3/2/30,8/16/30,1,1,0,0,0,M,NA,1889,NA,1945145,DOM-1930-2,A2.9-433,42,DOM,Rafel Trujillo,16/08/1930,30/05/1961,24/10/1891,30/05/1961,8/16/30,5/30/61,0,3,6,0,3,M,1891-10-24,1891,5/30/61,1961146,DOM-1961,A2.9-436,42,DOM,Balaguer,30/05/1961,17/01/1962,1/9/07,2002,5/30/61,1/17/62,1,3,6,0,1,M,9/1/07,1907,NA,2002147,DOM-1962-1,A2.9-439,42,DOM,Echavarria,17/01/1962,19/01/1962,1925,-999,1/17/62,1/19/62,1,3,6,0,2,M,NA,1925,NA,NA148,DOM-1962-2,A2.9-442,42,DOM,Filiberto Bonnelly,19/01/1962,27/02/1963,22/8/1904,1979,1/19/62,2/27/63,0,1,0,0,0,M,8/22/04,1904,NA,1979149,DOM-1963-1,A2.9-445,42,DOM,Bosch,27/02/1963,25/09/1963,30/6/1909,1/11/01,2/27/63,9/25/63,0,3,6,0,1,M,6/30/09,1909,11/1/01,2001150,DOM-1963-2,A2.9-448,42,DOM,de los Santos,26/09/1963,22/12/1963,1903,-999,9/26/63,12/22/63,1,1,0,0,0,M,NA,1903,NA,NA151,DOM-1963-3,A2.9-451,42,DOM,Cabral,22/12/1963,25/04/1965,9/6/23,2006,12/22/63,4/25/65,1,3,6,0,0,M,6/9/23,1923,NA,2006152,DOM-1965-1,A2.9-454,42,DOM,Molina Urena,25/04/1965,27/04/1965,1921,2000,4/25/65,4/27/65,1,3,6,0,1,M,NA,1921,NA,2000153,DOM-1965-2,A2.9-457,42,DOM,Bartolome Benoit,27/04/1965,7/5/65,1921,-777,4/27/65,5/7/65,1,1,0,0,0,M,NA,1921,NA,-777154,DOM-1965-3,A2.9-460,42,DOM,Berreras,7/5/65,30/08/1965,3/12/20,-999,5/7/65,8/30/65,1,1,0,0,0,M,12/3/20,1920,NA,NA155,DOM-1965-4,A2.9-463,42,DOM,Godoy,3/9/65,1/7/66,11/7/21,1970,9/3/65,7/1/66,0,1,0,0,0,M,7/11/21,1921,NA,1970156,DOM-1966,A2.9-466,42,DOM,Balaguer,1/7/66,1/7/78,1/9/07,2002,7/1/66,7/1/78,0,1,0,1,0,M,9/1/07,1907,NA,2002157,DOM-1978,A2.9-469,42,DOM,Guzman Fernandez,1/7/78,4/7/82,12/2/11,1982,7/1/78,7/4/82,0,2.2,0,0,-777,M,2/12/11,1911,NA,1982158,DOM-1982-1,A2.9-472,42,DOM,Majluta Azar,4/7/82,16/08/1982,1934,1996,7/4/82,8/16/82,0,1,0,0,0,M,NA,1934,NA,1996159,DOM-1982-2,A2.9-475,42,DOM,Blanco,16/08/1982,16/08/1986,5/7/26,-777,8/16/82,8/16/86,0,1,0,0,0,M,7/5/26,1926,NA,-777160,DOM-1986,A2.9-478,42,DOM,Balaguer,16/08/1986,16/08/1996,1/9/07,-777,8/16/86,8/16/96,0,1,0,2,0,M,9/1/07,1907,NA,-777161,DOM-1996,A2.9-481,42,DOM,Fernandez Reyna,16/08/1996,16/08/2000,26/12/1953,-777,8/16/96,8/16/00,0,1,0,0,0,M,12/26/53,1953,NA,-777162,DOM-2000,A2.9-484,42,DOM,Hipolito Mejia,17/08/2000,16/08/2004,22/02/1941,-777,8/17/00,8/16/04,0,1,0,0,-999,M,2/22/41,1941,NA,-777163,DOM-2004,A2.9-487,42,DOM,Fernandez Reyna,16/08/2004,31/12/2004,26/12/1953,-777,8/16/04,12/31/04,0,-888,0,1,-888,M,12/26/53,1953,NA,-777164,JAM-1962,A2.9-490,51,JAM,Bustamante,6/8/62,22/02/1967,24/2/1884,6/8/77,8/6/62,2/22/67,0,1,0,0,0,M,1884-02-24,1884,8/6/77,1977165,JAM-1967-1,A2.9-493,51,JAM,Sangster,22/02/1967,11/4/67,26/10/1911,1967,2/22/67,4/11/67,0,2,0,0,-777,M,10/26/11,1911,NA,1967166,JAM-1967-2,A2.9-496,51,JAM,Shearer,11/4/67,2/3/72,18/5/1923,2004,4/11/67,3/2/72,0,1,0,0,0,M,5/18/23,1923,NA,2004167,JAM-1972,A2.9-499,51,JAM,Manley,2/3/72,1/11/80,10/12/24,6/3/97,3/2/72,11/1/80,0,1,0,0,0,M,12/10/24,1924,3/6/97,1997168,JAM-1980,A2.9-502,51,JAM,Seaga,1/11/80,10/2/89,28/5/1930,-777,11/1/80,2/10/89,0,1,0,0,0,M,5/28/30,1930,NA,-777169,JAM-1989,A2.9-505,51,JAM,Manley,10/2/89,30/03/1992,28/5/1924,6/3/97,2/10/89,3/30/92,0,2.1,0,1,0,M,5/28/24,1924,3/6/97,1997170,JAM-1992,A2.9-508,51,JAM,Patterson,30/03/1992,31/12/2004,1935,-777,3/30/92,12/31/04,0,-888,0,0,-888,M,NA,1935,NA,-777171,TRI-1962,A2.9-511,52,TRI,Williams,31/08/1962,29/03/1981,25/9/1911,1981,8/31/62,3/29/81,0,2,0,0,-777,M,9/25/11,1911,NA,1981172,TRI-1981,A2.9-514,52,TRI,Chambers,30/03/1981,18/12/1986,4/10/28,4/11/97,3/30/81,12/18/86,0,1,0,0,0,M,10/4/28,1928,11/4/97,1997173,TRI-1986,A2.9-517,52,TRI,Robinson,18/12/1986,7/12/91,16/12/1926,-777,12/18/86,12/7/91,0,1,0,0,0,M,12/16/26,1926,NA,-777174,TRI-1991,A2.9-520,52,TRI,Manning,16/12/1991,9/11/95,17/8/1946,-777,12/16/91,11/9/95,0,1,0,0,0,M,8/17/46,1946,NA,-777175,TRI-1995,A2.9-523,52,TRI,Panday,9/11/95,24/12/2001,1933,-777,11/9/95,12/24/01,0,1,0,0,0,M,NA,1933,NA,-777176,TRI-2001,A2.9-526,52,TRI,Manning,25/12/2001,31/12/2004,17/8/1947,-777,12/25/01,12/31/04,0,-888,0,1,-888,M,8/17/47,1947,NA,-777177,BAR-1966,A2.9-529,53,BAR,Barrow,18/11/1966,8/9/76,21/1/1920,1/6/87,11/18/66,9/8/76,0,1,0,0,0,M,1/21/20,1920,6/1/87,1987178,BAR-1976,A2.9-532,53,BAR,Adams,8/10/76,11/3/85,24/9/1931,11/3/85,10/8/76,3/11/85,0,2,0,0,-777,M,9/24/31,1931,3/11/85,1985179,BAR-1985,A2.9-535,53,BAR,St. John,11/3/85,29/05/1986,16/8/1931,2004,3/11/85,5/29/86,0,1,0,0,0,M,8/16/31,1931,NA,2004180,BAR-1986,A2.9-538,53,BAR,Barrow,29/05/1986,1/6/87,21/1/1920,1/6/87,5/29/86,6/1/87,0,2,0,1,-777,M,1/21/20,1920,6/1/87,1987181,BAR-1987,A2.9-541,53,BAR,Sandiford,1/6/87,7/9/94,24/3/1937,-777,6/1/87,9/7/94,0,1,0,0,0,M,3/24/37,1937,NA,-777182,BAR-1994,A2.9-544,53,BAR,Arthur,7/9/94,31/12/2004,1949,-777,9/7/94,12/31/04,0,-888,0,0,-888,M,NA,1949,NA,-777183,MEX-1872,A2.9-547,70,MEX,de Tejada,19/07/1872,21/11/1876,25/04/1825,21/04/1889,1872-07-19,1876-11-21,0,3,-999,0,1,M,1825-04-25,1825,1889-04-21,1889184,MEX-1876,A2.9-550,70,MEX,Diaz,23/11/1876,25/05/1911,15/9/1830,2/7/15,1876-11-23,5/25/11,1,3,-999,0,1,M,1830-09-15,1830,7/2/15,1915185,MEX-1911-1,A2.9-553,70,MEX,de la Barra,26/05/1911,6/11/11,16/6/1863,1939,5/26/11,11/6/11,0,1,0,0,1,M,1863-06-16,1863,NA,1939186,MEX-1911-2,A2.9-556,70,MEX,Madero,6/11/11,19/02/1913,30/10/1873,22/02/1913,11/6/11,2/19/13,0,3,-999,0,3,M,1873-10-30,1873,2/22/13,1913187,MEX-1913,A2.9-559,70,MEX,Huerta,19/02/1913,15/07/1914,23/3/1845,13/01/1916,2/19/13,7/15/14,1,3,-999,0,1,M,1845-03-23,1845,1/13/16,1916188,MEX-1915,A2.9-562,70,MEX,Carranza,19/10/1915,6/5/20,29/12/1859,21/05/1920,10/19/15,5/6/20,1,3,4,0,3,M,1859-12-29,1859,5/21/20,1920189,MEX-1920-1,A2.9-565,70,MEX,"de la Huerta, A",24/05/1920,1/12/20,26/5/1881,9/7/55,5/24/20,12/1/20,0,1,0,0,0,M,1881-05-26,1881,7/9/55,1955190,MEX-1920-2,A2.9-568,70,MEX,Obregon,1/12/20,1/12/24,19/2/1890,17/07/1928,12/1/20,12/1/24,1,1,0,0,0,M,1890-02-19,1890,7/17/28,1928191,MEX-1924,A2.9-571,70,MEX,Calles,1/12/24,1/12/28,25/9/1877,19/10/1945,12/1/24,12/1/28,0,1,0,0,1,M,1877-09-25,1877,10/19/45,1945192,MEX-1928,A2.9-574,70,MEX,Portes Gil,1/12/28,5/2/30,3/10/1890,10/12/78,12/1/28,2/5/30,0,1,0,0,0,M,1890-10-03,1890,12/10/78,1978193,MEX-1930,A2.9-577,70,MEX,Ortiz Rubio,5/2/30,4/9/32,10/3/1877,1963,2/5/30,9/4/32,0,1,0,0,1,M,1877-03-10,1877,NA,1963194,MEX-1932,A2.9-580,70,MEX,Rodriguez,4/9/32,1/12/34,12/5/1889,1967,9/4/32,12/1/34,0,1,0,0,0,M,1889-05-12,1889,NA,1967195,MEX-1934,A2.9-583,70,MEX,Cardenas,1/12/34,1/12/40,21/5/1895,19/10/1970,12/1/34,12/1/40,0,1,0,0,0,M,1895-05-21,1895,10/19/70,1970196,MEX-1940,A2.9-586,70,MEX,Avila Camacho,1/12/40,1/12/46,24/4/1897,13/10/1955,12/1/40,12/1/46,0,1,0,0,0,M,1897-04-24,1897,10/13/55,1955197,MEX-1946,A2.9-589,70,MEX,Aleman Valdes,1/12/46,1/12/52,29/9/1903,14/05/1983,12/1/46,12/1/52,0,1,0,0,1,M,9/29/03,1903,5/14/83,1983198,MEX-1952,A2.9-592,70,MEX,Ruiz Cortines,1/12/52,1/12/58,30/12/1890,1973,12/1/52,12/1/58,0,1,0,0,0,M,1890-12-30,1890,NA,1973199,MEX-1958,A2.9-595,70,MEX,Lopez Mateos,1/12/58,1/12/64,26/5/1910,22/09/1969,12/1/58,12/1/64,0,1,0,0,0,M,5/26/10,1910,9/22/69,1969200,MEX-1964,A2.9-598,70,MEX,Diaz Ordaz,1/12/64,1/12/70,12/3/11,15/07/1979,12/1/64,12/1/70,0,1,0,0,0,M,3/12/11,1911,7/15/79,1979201,MEX-1970,A2.9-601,70,MEX,Echeverria Alvarez,1/12/70,1/12/76,17/1/1922,-777,12/1/70,12/1/76,0,1,0,0,0,M,1/17/22,1922,NA,-777202,MEX-1976,A2.9-604,70,MEX,Lopez Portillo,1/12/76,1/12/82,16/6/1920,17/02/2004,12/1/76,12/1/82,0,1,0,0,0,M,6/16/20,1920,2/17/04,2004203,MEX-1982,A2.9-607,70,MEX,de La Madrid,1/12/82,1/12/88,12/12/34,-777,12/1/82,12/1/88,0,1,0,0,0,M,12/12/34,1934,NA,-777204,MEX-1988,A2.9-610,70,MEX,Salinas,1/12/88,30/11/1994,3/4/48,-777,12/1/88,11/30/94,0,1,0,0,1,M,4/3/48,1948,NA,-777205,MEX-1994,A2.9-613,70,MEX,Zedillo,1/12/94,30/11/2000,27/12/1951,-777,12/1/94,11/30/00,0,1,0,0,0,M,12/27/51,1951,NA,-777206,MEX-2000,A2.9-616,70,MEX,Vicente Fox Quesada,1/12/00,31/12/2004,2/7/42,-777,12/1/00,12/31/04,0,-888,0,0,-888,M,7/2/42,1942,NA,-777207,BLZ-1961,A2.9-619,80,BLZ,Price,7/4/61,17/12/1984,15/1/1919,-777,4/7/61,12/17/84,0,1,0,0,0,M,1/15/19,1919,NA,-777208,BLZ-1984,A2.9-622,80,BLZ,Esquivel,17/12/1984,7/11/89,2/5/40,-777,12/17/84,11/7/89,0,1,0,0,0,M,5/2/40,1940,NA,-777209,BLZ-1989,A2.9-625,80,BLZ,Price,7/11/89,3/7/93,15/1/1919,-777,11/7/89,7/3/93,0,1,0,1,0,M,1/15/19,1919,NA,-777210,BLZ-1993,A2.9-628,80,BLZ,Esquivel,3/7/93,28/08/1998,2/5/40,-777,7/3/93,8/28/98,0,1,0,1,0,M,5/2/40,1940,NA,-777211,BLZ-1998,A2.9-631,80,BLZ,Musa,28/08/1998,31/12/2004,19/03/1944,-777,8/28/98,12/31/04,0,-888,0,0,-888,M,3/19/44,1944,NA,-777212,GUA-1873,A2.9-634,90,GUA,Justo Rufino Barrios,04/06/1873,06/04/1885,17/07/1835,1885,1873-06-04,1885-04-06,0,3,-999,0,3,M,1835-07-17,1835,NA,1885213,GUA-1885,A2.9-637,90,GUA,Barillas,06/04/1885,15/03/1892,1845,1907,1885-04-06,1892-03-15,0,1,0,0,0,M,NA,1845,NA,1907214,GUA-1892,A2.9-640,90,GUA,Reina Barrios,15/03/1892,08/02/1898,1835,1898,1892-03-15,1898-02-08,0,3,-999,0,3,M,NA,1835,NA,1898215,GUA-1898,A2.9-643,90,GUA,Estrada-Cabrera,08/02/1898,15/4/1920,21/11/1857,1924,1898-02-08,4/15/20,0,3,4,0,2,M,1857-11-21,1857,NA,1924216,GUA-1920,A2.9-646,90,GUA,Herrera y Luna,15/04/1920,7/12/21,1856,1930,4/15/20,12/7/21,1,3,6,0,2,M,NA,1856,NA,1930217,GUA-1921,A2.9-649,90,GUA,"Orellana, J.",7/12/21,26/09/1926,11/7/1872,1926,12/7/21,9/26/26,1,2,0,0,-777,M,1872-07-11,1872,NA,1926218,GUA-1926,A2.9-652,90,GUA,Chacon,27/09/1926,13/12/1930,27/6/1874,1931,9/27/26,12/13/30,0,2.1,0,0,-777,M,1874-06-27,1874,NA,1931219,GUA-1930-1,A2.9-655,90,GUA,Palma,13/12/1930,17/12/1930,1884,-999,12/13/30,12/17/30,0,3,6,0,0,M,NA,1884,NA,NA220,GUA-1930-2,A2.9-658,90,GUA,"Orellana, M.",17/12/1930,31/12/1930,-999,-999,12/17/30,12/31/30,1,1,0,0,0,M,NA,NA,NA,NA221,GUA-1931-1,A2.9-661,90,GUA,Reyna Andrade,1/1/31,14/02/1931,1860,1947,1/1/31,2/14/31,0,1,0,0,0,M,NA,1860,NA,1947222,GUA-1931-2,A2.9-664,90,GUA,Ubico Castaneda,15/02/1931,1/7/44,10/11/1878,1946,2/15/31,7/1/44,0,3,2,0,1,M,1878-11-10,1878,NA,1946223,GUA-1944-1,A2.9-667,90,GUA,Ponce Valdez,1/7/44,21/10/1944,1889,1956,7/1/44,10/21/44,1,3,6,0,1,M,NA,1889,NA,1956224,GUA-1944-2,A2.9-670,90,GUA,Arbenz Guzman,21/10/1944,15/03/1945,14/9/1913,27/01/1971,10/21/44,3/15/45,1,1,0,0,0,M,9/14/13,1913,1/27/71,1971225,GUA-1945,A2.9-673,90,GUA,Arevalo,15/03/1945,1/3/51,10/9/04,6/10/90,3/15/45,3/1/51,0,1,0,0,1,M,9/10/04,1904,10/6/90,1990226,GUA-1951,A2.9-676,90,GUA,Arbenz Guzman,1/3/51,27/06/1954,14/9/1913,27/01/1971,3/1/51,6/27/54,0,3,5,1,1,M,9/14/13,1913,1/27/71,1971227,GUA-1954-1,A2.9-679,90,GUA,Diaz,27/06/1954,29/06/1954,-999,-999,6/27/54,6/29/54,1,3,6,0,2,M,NA,NA,NA,NA228,GUA-1954-2,A2.9-682,90,GUA,Monzon,29/06/1954,8/7/54,1912,1981,6/29/54,7/8/54,1,3,16,0,0,M,NA,1912,NA,1981229,GUA-1954-3,A2.9-685,90,GUA,Castillo Armas,8/7/54,20/07/1957,4/11/14,1957,7/8/54,7/20/57,1,3,11,0,3,M,11/4/14,1914,NA,1957230,GUA-1957-1,A2.9-688,90,GUA,Gonzalez Lopez,20/07/1957,24/10/1957,12/12/00,1965,7/20/57,10/24/57,1,3,6,0,0,M,12/12/00,1900,NA,1965231,GUA-1957-2,A2.9-691,90,GUA,Mendoza Azurdia,24/10/1957,27/10/1957,1917,-999,10/24/57,10/27/57,1,3,5,0,0,M,NA,1917,NA,NA232,GUA-1957-3,A2.9-694,90,GUA,Flores Avendano,28/10/1957,2/3/58,1898,1982,10/28/57,3/2/58,1,1,0,0,0,M,NA,1898,NA,1982233,GUA-1958,A2.9-697,90,GUA,Ydigoras Fuente,2/3/58,31/03/1963,17/10/1895,1982,3/2/58,3/31/63,0,3,6,0,1,M,1895-10-17,1895,NA,1982234,GUA-1963,A2.9-700,90,GUA,Peralta Azurdia,31/03/1963,1/7/66,17/6/1908,1997,3/31/63,7/1/66,1,1,0,0,0,M,6/17/08,1908,NA,1997235,GUA-1966,A2.9-703,90,GUA,Mendez Montenegro,1/7/66,1/7/70,23/11/1915,1996,7/1/66,7/1/70,0,1,0,0,0,M,11/23/15,1915,NA,1996236,GUA-1970,A2.9-706,90,GUA,Arana Osorio,1/7/70,1/7/74,17/7/1918,6/12/03,7/1/70,7/1/74,0,1,0,0,0,M,7/17/18,1918,12/6/03,2003237,GUA-1974,A2.9-709,90,GUA,Laugerud Garcia,1/7/74,1/7/78,24/1/1930,-777,7/1/74,7/1/78,0,1,0,0,0,M,1/24/30,1930,NA,-777238,GUA-1978,A2.9-712,90,GUA,Lucas Garcia,1/7/78,23/03/1982,4/7/24,27/05/2006,7/1/78,3/23/82,0,3,6,0,2,M,7/4/24,1924,5/27/06,2006239,GUA-1982,A2.9-715,90,GUA,Rios Montt,23/03/1982,8/8/83,16/6/1926,-777,3/23/82,8/8/83,1,3,6,0,2,M,6/16/26,1926,NA,-777240,GUA-1983,A2.9-718,90,GUA,Mejia Victores,8/8/83,14/01/1986,1930,-777,8/8/83,1/14/86,1,1,0,0,0,M,NA,1930,NA,-777241,GUA-1986,A2.9-721,90,GUA,Cerezo,14/01/1986,14/01/1991,26/12/1942,-777,1/14/86,1/14/91,0,1,0,0,0,M,12/26/42,1942,NA,-777242,GUA-1991,A2.9-724,90,GUA,Serrano Elias,14/01/1991,31/05/1993,26/4/1945,-777,1/14/91,5/31/93,0,3,6,0,1,M,4/26/45,1945,NA,-777243,GUA-1993-1,A2.9-727,90,GUA,Espina Salguero,31/05/1993,1/6/93,1946,-777,5/31/93,6/1/93,0,1,0,0,1,M,NA,1946,NA,-777244,GUA-1993-2,A2.9-730,90,GUA,Leon Carpio,1/6/93,14/01/1996,1942,2002,6/1/93,1/14/96,1,1,0,0,0,M,NA,1942,NA,2002245,GUA-1996,A2.9-733,90,GUA,Arzu Yrigoyen,14/01/1996,14/01/2000,1946,-777,1/14/96,1/14/00,0,1,0,0,0,M,NA,1946,NA,-777246,GUA-2000,A2.9-736,90,GUA,Alfonso Portillo Cabrera,15/01/2000,14/01/2004,1951,-777,1/15/00,1/14/04,0,1,0,0,1,M,NA,1951,NA,-777247,GUA-2004,A2.9-739,90,GUA,Berger Perdomo,14/01/2004,31/12/2004,1946,-777,1/14/04,12/31/04,0,-888,0,0,-888,M,NA,1946,NA,-777248,HON-1874,A2.9-742,91,HON,Leiva,13/01/1874,08/06/1876,1821,1896,1874-01-13,1876-06-08,1,3,-999,0,0,M,NA,1821,NA,1896249,HON-1876,A2.9-745,91,HON,Soto,27/08/1876,19/10/1883,1846,1908,1876-08-27,1883-10-19,1,3,-999,0,1,M,NA,1846,NA,1908250,HON-1883-1,A2.9-748,91,HON,Council of Ministers,19/10/1883,30/11/1883,-999,-999,1883-10-19,1883-11-30,1,1,0,0,0,M,NA,NA,NA,NA251,HON-1883-2,A2.9-751,91,HON,Bogran,30/11/1883,30/11/1891,1849,1895,1883-11-30,1891-11-30,0,1,0,0,1,M,NA,1849,NA,1895252,HON-1891,A2.9-754,91,HON,Leiva,30/11/1891,07/08/1893,1821,1896,1891-11-30,1893-08-07,0,3,-999,1,1,M,NA,1821,NA,1896253,HON-1893,A2.9-757,91,HON,Vasquez,07/08/1893,22/02/1894,1846,1909,1893-08-07,1894-02-22,1,3,-999,0,1,M,NA,1846,NA,1909254,HON-1894,A2.9-760,91,HON,P. Bonilla,22/02/1894,01/02/1899,1858,1926,1894-02-22,1899-02-01,1,1,0,0,0,M,NA,1858,NA,1926255,HON-1899,A2.9-763,91,HON,Sierra,01/02/1899,30/01/1903,1839,1907,1899-02-01,1/30/03,0,3,-999,0,1,M,NA,1839,NA,1907256,HON-1903,A2.9-766,91,HON,M. Bonilla,1/2/03,11/4/07,1849,1913,2/1/03,4/11/07,1,3,-999,0,1,M,NA,1849,NA,1913257,HON-1907,A2.9-769,91,HON,Davila,18/04/1907,28/03/1911,1856,1927,4/18/07,3/28/11,1,3,-999,0,1,M,NA,1856,NA,1927258,HON-1911,A2.9-772,91,HON,Bertrand,28/03/1911,2/2/12,1866,1926,3/28/11,2/2/12,1,1,0,0,0,M,NA,1866,NA,1926259,HON-1912,A2.9-775,91,HON,M. Bonilla,2/2/12,20/03/1913,1849,20/03/1913,2/2/12,3/20/13,0,2,0,1,-777,M,NA,1849,3/20/13,1913260,HON-1913,A2.9-778,91,HON,Bertrand,20/03/1913,28/07/1915,1866,1926,3/20/13,7/28/15,0,1,0,1,0,M,NA,1866,NA,1926261,HON-1915,A2.9-781,91,HON,Alberto Membreno,28/07/1915,1/2/16,1858,-999,7/28/15,2/1/16,0,1,0,0,0,M,NA,1858,NA,NA262,HON-1916,A2.9-784,91,HON,Bertrand,1/2/16,9/9/19,1866,1926,2/1/16,9/9/19,0,3,6,2,1,M,NA,1866,NA,1926263,HON-1919,A2.9-787,91,HON,Bogran,13/09/1919,1/2/20,1849,1926,9/13/19,2/1/20,0,1,0,1,0,M,NA,1849,NA,1926264,HON-1920,A2.9-790,91,HON,Lopez-Gutierrez,1/2/20,1/2/24,1855,1924,2/1/20,2/1/24,0,3,6,0,-777,M,NA,1855,NA,1924265,HON-1924,A2.9-793,91,HON,Vicente Tosta,1/2/24,1/2/25,1876,1930,2/1/24,2/1/25,1,1,0,0,0,M,NA,1876,NA,1930266,HON-1925,A2.9-796,91,HON,Paz Baraona,1/2/25,1/2/29,1863,1937,2/1/25,2/1/29,1,1,0,0,0,M,NA,1863,NA,1937267,HON-1929,A2.9-799,91,HON,Mejia Colindres,1/2/29,1/2/33,1878,1966,2/1/29,2/1/33,0,1,0,0,1,M,NA,1878,NA,1966268,HON-1933,A2.9-802,91,HON,Carias Andino,1/2/33,1/1/49,15/3/1876,1969,2/1/33,1/1/49,0,1,0,0,0,M,1876-03-15,1876,NA,1969269,HON-1949,A2.9-805,91,HON,Galvez,1/1/49,15/01/1954,1887,1972,1/1/49,1/15/54,0,2.1,0,0,0,M,NA,1887,NA,1972270,HON-1954,A2.9-808,91,HON,Lozano Diaz,15/01/1954,21/10/1956,1885,1957,1/15/54,10/21/56,0,3,6,0,1,M,NA,1885,NA,1957271,HON-1956,A2.9-811,91,HON,Hector Caraccioli,21/10/1956,21/12/1957,1922,1975,10/21/56,12/21/57,1,1,0,0,0,M,NA,1922,NA,1975272,HON-1957,A2.9-814,91,HON,Villeda Morales,21/12/1957,3/10/63,26/11/1909,1971,12/21/57,10/3/63,0,3,6,0,1,M,11/26/09,1909,NA,1971273,HON-1963,A2.9-817,91,HON,Lopez Arellano,3/10/63,6/6/71,30/6/1921,-777,10/3/63,6/6/71,1,1,0,0,0,M,6/30/21,1921,NA,-777274,HON-1971,A2.9-820,91,HON,Cruz,6/6/71,4/12/72,4/1/03,6/8/85,6/6/71,12/4/72,0,3,6,0,2,M,1/4/03,1903,8/6/85,1985275,HON-1972,A2.9-823,91,HON,Lopez Arellano,4/12/72,22/04/1975,30/6/1921,-777,12/4/72,4/22/75,1,3,16,1,0,M,6/30/21,1921,NA,-777276,HON-1975,A2.9-826,91,HON,Castro,22/04/1975,7/8/78,1938,1987,4/22/75,8/7/78,1,3,16,0,0,M,NA,1938,NA,1987277,HON-1978,A2.9-829,91,HON,Paz Garcia,7/8/78,27/01/1982,1931,2000,8/7/78,1/27/82,1,1,0,0,0,M,NA,1931,NA,2000278,HON-1982,A2.9-832,91,HON,Suazo Cordova,27/01/1982,27/01/1986,1928,-777,1/27/82,1/27/86,0,1,0,0,0,M,NA,1928,NA,-777279,HON-1986,A2.9-835,91,HON,Azcona Hoyo,27/01/1986,27/01/1990,26/1/1927,24/10/2005,1/27/86,1/27/90,0,1,0,0,0,M,1/26/27,1927,10/24/05,2005280,HON-1990,A2.9-838,91,HON,Callejas,27/01/1990,27/01/1994,1943,-777,1/27/90,1/27/94,0,1,0,0,0,M,NA,1943,NA,-777281,HON-1994,A2.9-841,91,HON,Reina,27/01/1994,27/01/1998,13/03/1926,19/08/2003,1/27/94,1/27/98,0,1,0,0,0,M,3/13/26,1926,8/19/03,2003282,HON-1998,A2.9-844,91,HON,Flores Facusse,27/01/1998,27/01/2002,1950,-777,1/27/98,1/27/02,0,1,0,0,0,M,NA,1950,NA,-777283,HON-2002,A2.9-847,91,HON,Ricardo Maduro,27/01/2002,31/12/2004,1946,-777,1/27/02,12/31/04,0,-888,0,0,-888,M,NA,1946,NA,-777284,SAL-1871,A2.9-850,92,SAL,Gonzalez,15/04/1871,11/02/1876,1818,1887,1871-04-15,1876-02-11,1,1,0,0,-666,M,NA,1818,NA,1887285,SAL-1876-1,A2.9-853,92,SAL,Andres del Valle,12/02/1876,01/05/1876,1833,1888,1876-02-12,1876-05-01,0,3,-999,0,1,M,NA,1833,NA,1888286,SAL-1876-2,A2.9-856,92,SAL,Zaldivar,01/05/1876,14/05/1885,1834,1903,1876-05-01,1885-05-14,1,3,-999,0,1,M,NA,1834,NA,1903287,SAL-1885,A2.9-859,92,SAL,Menendez,22/05/1885,22/06/1890,1830,1890,1885-05-22,1890-06-22,1,3,-999,0,0,M,NA,1830,NA,1890288,SAL-1890,A2.9-862,92,SAL,Ezeta,22/06/1890,10/06/1894,1852,1903,1890-06-22,1894-06-10,1,3,-999,0,1,M,NA,1852,NA,1903289,SAL-1894,A2.9-865,92,SAL,Guttierez,10/06/1894,14/11/1898,1861,1921,1894-06-10,1898-11-14,1,3,-999,0,1,M,NA,1861,NA,1921290,SAL-1898,A2.9-868,92,SAL,Regalado,14/11/1898,1/3/03,1864,1906,1898-11-14,3/1/03,1,1,0,0,0,M,NA,1864,NA,1906291,SAL-1903,A2.9-871,92,SAL,Escalon,1/3/03,28/02/1907,1847,1923,3/1/03,2/28/07,0,1,0,0,-666,M,NA,1847,NA,1923292,SAL-1907,A2.9-874,92,SAL,Figueroa,1/3/07,28/02/1911,1849,1919,3/1/07,2/28/11,0,1,0,0,-666,M,NA,1849,NA,1919293,SAL-1911,A2.9-877,92,SAL,Araujo,1/3/11,9/2/13,1865,1913,3/1/11,2/9/13,0,3,-999,0,3,M,NA,1865,NA,1913294,SAL-1913,A2.9-880,92,SAL,C. Melendez,11/2/13,15/08/1914,1/2/1861,9/10/19,2/11/13,8/15/14,0,1,0,0,0,M,1861-02-01,1861,10/9/19,1919295,SAL-1914,A2.9-883,92,SAL,Quinonez Molina,29/08/1914,28/02/1915,1873,1950,8/29/14,2/28/15,0,1,0,0,0,M,NA,1873,NA,1950296,SAL-1915,A2.9-886,92,SAL,C. Melendez,1/3/15,21/12/1918,1/2/1861,9/10/19,3/1/15,12/21/18,0,2.1,0,1,0,M,1861-02-01,1861,10/9/19,1919297,SAL-1918,A2.9-889,92,SAL,Quinonez Molina,21/12/1918,28/02/1919,1873,1950,12/21/18,2/28/19,0,1,0,1,0,M,NA,1873,NA,1950298,SAL-1919,A2.9-892,92,SAL,J. Melendez,1/3/19,28/02/1923,15/4/1871,1953,3/1/19,2/28/23,0,1,0,0,0,M,1871-04-15,1871,NA,1953299,SAL-1923,A2.9-895,92,SAL,Quinonez Molina,1/3/23,28/02/1927,1873,1950,3/1/23,2/28/27,0,1,0,2,1,M,NA,1873,NA,1950300,SAL-1927,A2.9-898,92,SAL,Romeo Bosque,1/3/27,28/02/1931,1860,1935,3/1/27,2/28/31,0,1,0,0,1,M,NA,1860,NA,1935301,SAL-1931-1,A2.9-901,92,SAL,"Arajuo, A.",1/3/31,2/12/31,1878,1967,3/1/31,12/2/31,0,3,6,0,1,M,NA,1878,NA,1967302,SAL-1931-2,A2.9-904,92,SAL,Hernandez Martinez,4/12/31,29/08/1934,29/10/1882,11/4/66,12/4/31,8/29/34,0,1,0,0,0,M,1882-10-29,1882,4/11/66,1966303,SAL-1934,A2.9-907,92,SAL,"Menendez, A.I.",29/08/1934,28/02/1935,1879,1962,8/29/34,2/28/35,0,1,0,0,0,M,NA,1879,NA,1962304,SAL-1935,A2.9-910,92,SAL,Hernandez Martinez,28/02/1935,9/5/44,29/10/1882,11/4/66,2/28/35,5/9/44,0,3,2,1,1,M,1882-10-29,1882,4/11/66,1966305,SAL-1944-1,A2.9-913,92,SAL,"Menendez, A.I.",9/5/44,21/10/1944,1879,1962,5/9/44,10/21/44,1,3,6,1,1,M,NA,1879,NA,1962306,SAL-1944-2,A2.9-916,92,SAL,Aguirre Salinas,21/10/1944,28/02/1945,1889,1977,10/21/44,2/28/45,1,1,0,0,1,M,NA,1889,NA,1977307,SAL-1945,A2.9-919,92,SAL,Castaneda Castro,28/02/1945,14/12/1948,6/8/1888,1965,2/28/45,12/14/48,0,3,6,0,2,M,1888-08-06,1888,NA,1965308,SAL-1948,A2.9-922,92,SAL,Cordova,15/12/1948,4/1/49,1894,-999,12/15/48,1/4/49,1,1,0,0,1,M,NA,1894,NA,NA309,SAL-1949-1,A2.9-925,92,SAL,Osorio,4/1/49,22/10/1949,1910,1969,1/4/49,10/22/49,0,1,0,0,0,M,NA,1910,NA,1969310,SAL-1949-2,A2.9-928,92,SAL,Oscar Bolanos,22/10/1949,14/09/1950,-999,-999,10/22/49,9/14/50,0,1,0,0,1,M,NA,NA,NA,NA311,SAL-1950,A2.9-931,92,SAL,Osorio,14/09/1950,14/09/1956,1910,1969,9/14/50,9/14/56,0,1,0,1,0,M,NA,1910,NA,1969312,SAL-1956,A2.9-934,92,SAL,Lemus,14/09/1956,26/10/1960,1911,1993,9/14/56,10/26/60,0,3,6,0,1,M,NA,1911,NA,1993313,SAL-1960,A2.9-937,92,SAL,Castillo,26/10/1960,25/01/1961,1915,-999,10/26/60,1/25/61,1,3,6,0,1,M,NA,1915,NA,NA314,SAL-1961,A2.9-940,92,SAL,Portillo,25/01/1961,25/01/1962,1914,-999,1/25/61,1/25/62,1,1,0,0,0,M,NA,1914,NA,NA315,SAL-1962-1,A2.9-943,92,SAL,Rodolfo Cordon,25/01/1962,1/7/62,1899,1966,1/25/62,7/1/62,0,1,0,0,0,M,NA,1899,NA,1966316,SAL-1962-2,A2.9-946,92,SAL,Rivera,1/7/62,1/7/67,1922,1973,7/1/62,7/1/67,0,1,0,0,0,M,NA,1922,NA,1973317,SAL-1967,A2.9-949,92,SAL,Sanchez Hernandez,1/7/67,1/7/72,7/7/17,2003,7/1/67,7/1/72,0,1,0,0,0,M,7/7/17,1917,NA,2003318,SAL-1972,A2.9-952,92,SAL,Molina,1/7/72,1/7/77,18/6/1927,-777,7/1/72,7/1/77,0,1,0,0,0,M,6/18/27,1927,NA,-777319,SAL-1977,A2.9-955,92,SAL,Romero Mena,1/7/77,15/10/1979,1924,-777,7/1/77,10/15/79,0,3,6,0,1,M,NA,1924,NA,-777320,SAL-1979,A2.9-958,92,SAL,Majano Ramos,15/10/1979,7/12/80,1938,-777,10/15/79,12/7/80,1,3,16,0,1,M,NA,1938,NA,-777321,SAL-1980,A2.9-961,92,SAL,Duarte,13/12/1980,2/5/82,23/11/1925,23/2/1990,12/13/80,5/2/82,1,1,0,0,0,M,11/23/25,1925,2/23/90,1990322,SAL-1982,A2.9-964,92,SAL,Magana Borjo,2/5/82,1/6/84,8/10/25,10/7/01,5/2/82,6/1/84,0,1,0,0,0,M,10/8/25,1925,7/10/01,2001323,SAL-1984,A2.9-967,92,SAL,Duarte,1/6/84,1/6/89,23/11/1925,23/2/1990,6/1/84,6/1/89,0,1,0,1,-777,M,11/23/25,1925,2/23/90,1990324,SAL-1989,A2.9-970,92,SAL,Cristiani,1/6/89,1/6/94,22/11/1947,-777,6/1/89,6/1/94,0,1,0,0,0,M,11/22/47,1947,NA,-777325,SAL-1994,A2.9-973,92,SAL,Calderon Sol,1/6/94,1/6/99,1948,-777,6/1/94,6/1/99,0,1,0,0,0,M,NA,1948,NA,-777326,SAL-1999,A2.9-976,92,SAL,Flores,1/6/99,1/6/04,17/10/1959,-777,6/1/99,6/1/04,0,1,0,0,0,M,10/17/59,1959,NA,-777327,SAL-2004,A2.9-979,92,SAL,Saca Gonz‡lez,1/6/04,31/12/2004,1965,-777,6/1/04,12/31/04,0,-888,0,0,-888,M,NA,1965,NA,-777328,NIC-1871,A2.9-982,93,NIC,Quadra,01/03/1871,01/03/1875,1812,1894,1871-03-01,1875-03-01,0,1,0,0,0,M,NA,1812,NA,1894329,NIC-1875,A2.9-985,93,NIC,Chamorro,01/03/1875,01/03/1879,1818,1894,1875-03-01,1879-03-01,0,1,0,0,0,M,NA,1818,NA,1894330,NIC-1879,A2.9-988,93,NIC,Zavala,01/03/1879,01/03/1883,1835,1906,1879-03-01,1883-03-01,0,1,0,0,0,M,NA,1835,NA,1906331,NIC-1883,A2.9-991,93,NIC,Cardenas,01/03/1883,01/03/1887,1836,1916,1883-03-01,1887-03-01,0,1,0,0,0,M,NA,1836,NA,1916332,NIC-1887,A2.9-994,93,NIC,Carazo,01/03/1887,01/08/1889,24/10/1821,1889,1887-03-01,1889-08-01,0,2,0,0,-777,M,1821-10-24,1821,NA,1889333,NIC-1889,A2.9-997,93,NIC,Sacasa,01/08/1889,01/06/1893,1840,1896,1889-08-01,1893-06-01,0,3,-999,0,1,M,NA,1840,NA,1896334,NIC-1893,A2.9-1000,93,NIC,Zelaya,31/07/1893,16/12/1909,31/10/1853,1919,1893-07-31,12/16/09,1,3,-999,0,1,M,1853-10-31,1853,NA,1919335,NIC-1909,A2.9-1003,93,NIC,Madriz,16/12/1909,20/08/1910,1867,1911,12/16/09,8/20/10,1,3,-999,0,1,M,NA,1867,NA,1911336,NIC-1910-1,A2.9-1006,93,NIC,J. D. Estrada,20/08/1910,29/08/1910,-999,1911,8/20/10,8/29/10,1,3,-999,0,0,M,NA,NA,NA,1911337,NIC-1910-2,A2.9-1009,93,NIC,J. J. Estrada,29/08/1910,9/5/11,1871,1967,8/29/10,5/9/11,1,3,-999,0,1,M,NA,1871,NA,1967338,NIC-1911,A2.9-1012,93,NIC,Adolfo Diaz,9/5/11,31/12/1916,1875,1964,5/9/11,12/31/16,1,1,0,0,0,M,NA,1875,NA,1964339,NIC-1917,A2.9-1015,93,NIC,Chamorro Vargas,1/1/17,31/12/1920,11/5/1871,26/02/1966,1/1/17,12/31/20,0,1,0,0,0,M,1871-05-11,1871,2/26/66,1966340,NIC-1921,A2.9-1018,93,NIC,Diego Chamorro,1/1/21,12/10/23,1861,1923,1/1/21,10/12/23,0,2,0,0,-777,M,NA,1861,NA,1923341,NIC-1923,A2.9-1021,93,NIC,Martinez Bartol,12/10/23,7/12/24,1860,1936,10/12/23,12/7/24,0,1,0,0,1,M,NA,1860,NA,1936342,NIC-1925,A2.9-1024,93,NIC,Solorzano,1/1/25,14/01/1926,1860,1936,1/1/25,1/14/26,0,3,6,0,1,M,NA,1860,NA,1936343,NIC-1926-1,A2.9-1027,93,NIC,Chamorro Vargas,17/01/1926,30/10/1926,11/5/1871,26/02/1966,1/17/26,10/30/26,1,1,0,1,1,M,1871-05-11,1871,2/26/66,1966344,NIC-1926-2,A2.9-1030,93,NIC,Adolfo Diaz,30/10/1926,1/1/29,1875,1964,10/30/26,1/1/29,0,1,0,1,1,M,NA,1875,NA,1964345,NIC-1929,A2.9-1033,93,NIC,Moncada,1/1/29,31/12/1932,1871,1945,1/1/29,12/31/32,0,1,0,0,0,M,NA,1871,NA,1945346,NIC-1933,A2.9-1036,93,NIC,"Sacasa, Juan",1/1/33,6/6/36,21/12/1874,1946,1/1/33,6/6/36,0,1,0,0,1,M,1874-12-21,1874,NA,1946347,NIC-1936,A2.9-1039,93,NIC,Jarquin,6/6/36,18/12/1936,1886,1942,6/6/36,12/18/36,0,1,0,0,1,M,NA,1886,NA,1942348,NIC-1937,A2.9-1042,93,NIC,Anastasio Somoza Garcia,1/1/37,1/5/47,1/2/1896,29/09/1956,1/1/37,5/1/47,0,1,0,0,0,M,1896-02-01,1896,9/29/56,1956349,NIC-1947-1,A2.9-1045,93,NIC,Arguello,1/5/47,26/05/1947,29/08/1875,15/12/1947,5/1/47,5/26/47,0,3,6,0,1,M,1875-08-29,1875,12/15/47,1947350,NIC-1947-2,A2.9-1048,93,NIC,Anastasio Somoza Garcia,26/05/1947,29/09/1956,1/2/1896,29/09/1956,5/26/47,9/29/56,1,3,11,1,3,M,1896-02-01,1896,9/29/56,1956351,NIC-1956,A2.9-1051,93,NIC,Luis Somoza Debayle,29/09/1956,1/5/63,18/11/1922,1967,9/29/56,5/1/63,0,1,0,0,0,M,11/18/22,1922,NA,1967352,NIC-1963,A2.9-1054,93,NIC,Shick Gutierrez,1/5/63,3/8/66,1909,1966,5/1/63,8/3/66,1,2,0,0,-777,M,NA,1909,NA,1966353,NIC-1966,A2.9-1057,93,NIC,Guerrero Gutierrez,4/8/66,1/5/67,13/11/1900,1981,8/4/66,5/1/67,0,1,0,0,0,M,11/13/00,1900,NA,1981354,NIC-1967,A2.9-1060,93,NIC,Anastasio Somoza Debayle,1/5/67,17/07/1979,5/12/25,17/09/1980,5/1/67,7/17/79,0,3,3,0,3,M,12/5/25,1925,9/17/80,1980355,NIC-1979,A2.9-1063,93,NIC,Daniel Ortega,18/07/1979,25/04/1990,11/11/45,-777,7/18/79,4/25/90,1,1,0,0,0,M,11/11/45,1945,NA,-777356,NIC-1990,A2.9-1066,93,NIC,Violeta Chamorro,25/04/1990,10/1/97,18/10/1929,-777,4/25/90,1/10/97,0,1,0,0,0,F,10/18/29,1929,NA,-777357,NIC-1997,A2.9-1069,93,NIC,Aleman,10/1/97,10/1/02,1946,-777,1/10/97,1/10/02,0,1,0,0,0,M,NA,1946,NA,-777358,NIC-2002,A2.9-1072,93,NIC,Enrique Bolanos,11/1/02,31/12/2004,1928,-777,1/11/02,12/31/04,0,-888,0,0,-888,M,NA,1928,NA,-777359,COS-1870,A2.9-1075,94,COS,Guardia,10/08/1870,06/07/1882,1831,1882,1870-08-10,1882-07-06,1,2,0,0,-777,M,NA,1831,NA,1882360,COS-1882-1,A2.9-1078,94,COS,Lizano,06/07/1882,20/07/1882,1826,1905,1882-07-06,1882-07-20,0,1,0,0,0,M,NA,1826,NA,1905361,COS-1882-2,A2.9-1081,94,COS,Prospero Fernandez Oreamuno,20/07/1882,12/03/1885,1834,1885,1882-07-20,1885-03-12,0,2,0,0,-777,M,NA,1834,NA,1885362,COS-1885,A2.9-1084,94,COS,Bernardo Soto Alfaro,12/03/1885,07/11/1889,1854,1931,1885-03-12,1889-11-07,0,3,-999,0,1,M,NA,1854,NA,1931363,COS-1889,A2.9-1087,94,COS,Carlos Duran Cartin,07/11/1889,08/05/1890,1852,-999,1889-11-07,1890-05-08,0,1,0,0,-666,M,NA,1852,NA,NA364,COS-1890,A2.9-1090,94,COS,Jose Joaquin Rodriguez,08/05/1890,08/05/1894,1838,1917,1890-05-08,1894-05-08,0,1,0,0,1,M,NA,1838,NA,1917365,COS-1894,A2.9-1093,94,COS,Rafael Yglesias Castro,08/05/1894,8/5/02,18/4/1861,1924,1894-05-08,5/8/02,0,1,0,0,0,M,1861-04-18,1861,NA,1924366,COS-1902,A2.9-1096,94,COS,Ascension Esquivel Ibarra,8/5/02,8/5/06,1848,1927,5/8/02,5/8/06,0,1,0,0,0,M,NA,1848,NA,1927367,COS-1906,A2.9-1099,94,COS,Gonzalez Viquez,8/5/06,8/5/10,13/10/1858,1937,5/8/06,5/8/10,0,1,0,0,0,M,1858-10-13,1858,NA,1937368,COS-1910,A2.9-1102,94,COS,Jimenez Oreamuno,8/5/10,8/5/14,6/2/1859,1945,5/8/10,5/8/14,0,1,0,0,0,M,1859-02-06,1859,NA,1945369,COS-1914,A2.9-1105,94,COS,Alfredo Gonzalez Flores,8/5/14,27/01/1917,15/6/1877,1962,5/8/14,1/27/17,0,3,-999,0,1,M,1877-06-15,1877,NA,1962370,COS-1917,A2.9-1108,94,COS,Federico Tinoco Granados,27/01/1917,13/08/1919,1870,1931,1/27/17,8/13/19,1,3,4,0,1,M,NA,1870,NA,1931371,COS-1919-1,A2.9-1111,94,COS,Juan Bautista Quiros Segura,13/08/1919,6/9/19,1853,1934,8/13/19,9/6/19,1,3,1,0,0,M,NA,1853,NA,1934372,COS-1919-2,A2.9-1114,94,COS,Barquero,6/9/19,6/9/19,1857,1924,9/6/19,9/6/19,1,1,0,0,-666,M,NA,1857,NA,1924373,COS-1920,A2.9-1117,94,COS,Acosta Garcia,8/5/20,8/5/24,23/5/1872,1954,5/8/20,5/8/24,0,1,0,0,0,M,1872-05-23,1872,NA,1954374,COS-1924,A2.9-1120,94,COS,Jimenez Oreamuno,8/5/24,8/5/28,6/2/1859,1945,5/8/24,5/8/28,0,1,0,1,0,M,1859-02-06,1859,NA,1945375,COS-1928,A2.9-1123,94,COS,Gonzalez Viquez,8/5/28,8/5/32,13/10/1858,1937,5/8/28,5/8/32,0,1,0,1,0,M,1858-10-13,1858,NA,1937376,COS-1932,A2.9-1126,94,COS,Jimenez Oreamuno,8/5/32,8/5/36,6/2/1859,1945,5/8/32,5/8/36,0,1,0,2,0,M,1859-02-06,1859,NA,1945377,COS-1936,A2.9-1129,94,COS,Cortes Castro,8/5/36,8/5/40,8/12/1882,1946,5/8/36,5/8/40,0,1,0,0,0,M,1882-12-08,1882,NA,1946378,COS-1940,A2.9-1132,94,COS,Calderon Guardi,8/5/40,8/5/44,10/3/00,1970,5/8/40,5/8/44,0,1,0,0,0,M,3/10/00,1900,NA,1970379,COS-1944,A2.9-1135,94,COS,Picado Michalski,8/5/44,20/04/1948,10/1/00,1960,5/8/44,4/20/48,0,3,4,0,1,M,1/10/00,1900,NA,1960380,COS-1948,A2.9-1138,94,COS,Leon Herrera,20/04/1948,8/5/49,1872,-999,4/20/48,5/8/49,1,1,0,0,0,M,NA,1872,NA,NA381,COS-1949-1,A2.9-1141,94,COS,Figueres Ferrer,8/5/49,8/11/49,25/9/1906,8/6/90,5/8/49,11/8/49,1,1,0,0,0,M,9/25/06,1906,6/8/90,1990382,COS-1949-2,A2.9-1144,94,COS,Otilia Ulate,8/11/49,8/11/53,1892,1973,11/8/49,11/8/53,0,1,0,0,0,M,NA,1892,NA,1973383,COS-1953,A2.9-1147,94,COS,Figueres Ferrer,8/11/53,8/5/58,25/9/1906,8/6/90,11/8/53,5/8/58,0,1,0,1,0,M,9/25/06,1906,6/8/90,1990384,COS-1958,A2.9-1150,94,COS,Echandi Jimenez,8/5/58,8/5/62,1915,-777,5/8/58,5/8/62,0,1,0,0,0,M,NA,1915,NA,-777385,COS-1962,A2.9-1153,94,COS,Orlich,8/5/62,8/5/66,10/3/07,1969,5/8/62,5/8/66,0,1,0,0,0,M,3/10/07,1907,NA,1969386,COS-1966,A2.9-1156,94,COS,Trejos,8/5/66,8/5/70,18/4/1916,-777,5/8/66,5/8/70,0,1,0,0,0,M,4/18/16,1916,NA,-777387,COS-1970,A2.9-1159,94,COS,Figueres Ferrer,8/5/70,8/5/74,25/9/1906,8/6/90,5/8/70,5/8/74,0,1,0,2,0,M,9/25/06,1906,6/8/90,1990388,COS-1974,A2.9-1162,94,COS,"Quiros, Daniel",8/5/74,8/5/78,25/8/1921,13/10/1991,5/8/74,5/8/78,0,1,0,0,0,M,8/25/21,1921,10/13/91,1991389,COS-1978,A2.9-1165,94,COS,Carazo Odio,8/5/78,8/5/82,27/12/1926,-777,5/8/78,5/8/82,0,1,0,0,0,M,12/27/26,1926,NA,-777390,COS-1982,A2.9-1168,94,COS,Monge Alverez,8/5/82,8/5/86,28/12/1925,-777,5/8/82,5/8/86,0,1,0,0,0,M,12/28/25,1925,NA,-777391,COS-1986,A2.9-1171,94,COS,Arias,8/5/86,8/5/90,13/9/1941,-777,5/8/86,5/8/90,0,1,0,0,0,M,9/13/41,1941,NA,-777392,COS-1990,A2.9-1174,94,COS,Calderon Fournier,8/5/90,8/5/94,1949,-777,5/8/90,5/8/94,0,1,0,0,0,M,NA,1949,NA,-777393,COS-1994,A2.9-1177,94,COS,Figueres Olsen,8/5/94,8/5/98,1954,-777,5/8/94,5/8/98,0,1,0,0,0,M,NA,1954,NA,-777394,COS-1998,A2.9-1180,94,COS,Rodriguez Echeverria,8/5/98,8/5/02,1940,-777,5/8/98,5/8/02,0,1,0,0,0,M,NA,1940,NA,-777395,COS-2002,A2.9-1183,94,COS,de la Espriella,9/5/02,31/12/2004,1933,-777,5/9/02,12/31/04,0,-888,0,0,-888,M,NA,1933,NA,-777396,PAN-1903,A2.9-1186,95,PAN,Jose Agustin Arango,3/11/03,20/02/1904,1841,1909,11/3/03,2/20/04,1,1,0,0,0,M,NA,1841,NA,1909397,PAN-1904,A2.9-1189,95,PAN,Manuel Amador Guerrero,20/02/1904,1/10/08,30/6/1833,1909,2/20/04,10/1/08,0,1,0,0,0,M,1833-06-30,1833,NA,1909398,PAN-1908,A2.9-1192,95,PAN,Jose Domingo de Obaldia,1/10/08,1/3/10,1845,1910,10/1/08,3/1/10,0,2,0,0,-777,M,NA,1845,NA,1910399,PAN-1910-1,A2.9-1195,95,PAN,Carlos Antonio Mendoza,1/3/10,1/10/10,1856,1916,3/1/10,10/1/10,0,1,0,0,0,M,NA,1856,NA,1916400,PAN-1910-2,A2.9-1198,95,PAN,Pablo Arosemena Alba,1/10/10,2/2/12,24/9/1836,1920,10/1/10,2/2/12,0,1,0,0,0,M,1836-09-24,1836,NA,1920401,PAN-1912-1,A2.9-1201,95,PAN,Rudolfo Chiari,2/2/12,8/3/12,15/11/1870,1937,2/2/12,3/8/12,0,1,0,0,0,F,1870-11-15,1870,NA,1937402,PAN-1912-2,A2.9-1204,95,PAN,Pablo Arosemena Alba,8/3/12,1/10/12,24/9/1836,1920,3/8/12,10/1/12,0,1,0,1,0,F,1836-09-24,1836,NA,1920403,PAN-1912-3,A2.9-1207,95,PAN,Belisario Porras Barahona,1/10/12,1/10/16,28/11/1856,1942,10/1/12,10/1/16,0,1,0,0,0,M,1856-11-28,1856,NA,1942404,PAN-1916,A2.9-1210,95,PAN,Ramon Maximiliano Valdes,1/10/16,3/6/18,1867,1918,10/1/16,6/3/18,0,2,0,0,-777,M,NA,1867,NA,1918405,PAN-1918-1,A2.9-1213,95,PAN,Ciro Luis Urriola,3/6/18,1/10/18,1863,1922,6/3/18,10/1/18,0,1,0,0,0,M,NA,1863,NA,1922406,PAN-1918-2,A2.9-1216,95,PAN,Belisario Porras Barahona,1/10/18,30/01/1920,28/11/1856,1942,10/1/18,1/30/20,0,1,0,1,0,M,1856-11-28,1856,NA,1942407,PAN-1920-1,A2.9-1219,95,PAN,Ernesto Lefevre,30/01/1920,1/10/20,1876,1922,1/30/20,10/1/20,0,1,0,0,0,M,NA,1876,NA,1922408,PAN-1920-2,A2.9-1222,95,PAN,Belisario Porras Barahona,1/10/20,1/10/24,28/11/1856,1942,10/1/20,10/1/24,0,1,0,2,0,M,1856-11-28,1856,NA,1942409,PAN-1924,A2.9-1225,95,PAN,Rudolfo Chiari,1/10/24,8/9/28,15/11/1870,1937,10/1/24,9/8/28,0,1,0,1,0,M,1870-11-15,1870,NA,1937410,PAN-1928-1,A2.9-1228,95,PAN,Tomas Duque,8/9/28,1/10/28,1890,-999,9/8/28,10/1/28,0,1,0,0,0,M,NA,1890,NA,NA411,PAN-1928-2,A2.9-1231,95,PAN,Florencio Harmodio Arosemena,1/10/28,3/1/31,17/09/1872,30/08/1945,10/1/28,1/3/31,0,3,4,0,1,M,1872-09-17,1872,8/30/45,1945412,PAN-1931-1,A2.9-1234,95,PAN,"Arias, H.",3/1/31,16/01/1931,3/7/1886,23/12/1962,1/3/31,1/16/31,1,1,0,0,0,M,1886-07-03,1886,12/23/62,1962413,PAN-1931-2,A2.9-1237,95,PAN,Alfaro,16/01/1931,1/10/32,20/8/1882,1971,1/16/31,10/1/32,0,1,0,0,0,M,1882-08-20,1882,NA,1971414,PAN-1932,A2.9-1240,95,PAN,"Arias, H.",1/10/32,1/10/36,3/7/1886,23/12/1962,10/1/32,10/1/36,0,1,0,1,0,M,1886-07-03,1886,12/23/62,1962415,PAN-1936,A2.9-1243,95,PAN,"Arosomena, Juan",1/10/36,16/12/1939,24/6/1879,16/12/1939,10/1/36,12/16/39,0,2,0,0,-777,M,1879-06-24,1879,12/16/39,1939416,PAN-1939,A2.9-1246,95,PAN,Boyd,18/12/1939,1/10/40,1879,1957,12/18/39,10/1/40,0,1,0,0,0,M,NA,1879,NA,1957417,PAN-1940,A2.9-1249,95,PAN,"Arias, A.",1/10/40,9/10/41,15/8/1901,10/8/88,10/1/40,10/9/41,0,3,8,0,1,M,8/15/01,1901,8/10/88,1988418,PAN-1941-1,A2.9-1252,95,PAN,Ernesto Jaen Guardia,9/10/41,9/10/41,1895,1961,10/9/41,10/9/41,0,1,0,0,0,M,NA,1895,NA,1961419,PAN-1941-2,A2.9-1255,95,PAN,"Guardia, R.",9/10/41,15/06/1945,14/6/1899,1969,10/9/41,6/15/45,1,1,0,0,0,M,1899-06-14,1899,NA,1969420,PAN-1945,A2.9-1258,95,PAN,Jimenez,15/06/1945,1/10/48,1888,1970,6/15/45,10/1/48,0,3,8,0,1,M,NA,1888,NA,1970421,PAN-1948,A2.9-1261,95,PAN,Diaz Arosomena,1/10/48,28/07/1949,17/9/1873,23/08/1949,10/1/48,7/28/49,1,2.1,0,0,-777,M,1873-09-17,1873,8/23/49,1949422,PAN-1949-1,A2.9-1264,95,PAN,Chaniz Pinzon,28/07/1949,20/11/1949,1892,1961,7/28/49,11/20/49,0,3,6,0,1,M,NA,1892,NA,1961423,PAN-1949-2,A2.9-1267,95,PAN,"Chiari, Roberto",20/11/1949,25/11/1949,2/3/05,1981,11/20/49,11/25/49,0,1,0,0,0,M,3/2/05,1905,NA,1981424,PAN-1949-3,A2.9-1270,95,PAN,"Arias, A.",25/11/1949,10/5/51,15/8/1901,10/8/88,11/25/49,5/10/51,1,1,0,1,2,M,8/15/01,1901,8/10/88,1988425,PAN-1951,A2.9-1273,95,PAN,"Arosomena, A.",10/5/51,1/10/52,20/11/1883,8/4/58,5/10/51,10/1/52,0,1,0,0,0,M,1883-11-20,1883,4/8/58,1958426,PAN-1952,A2.9-1276,95,PAN,Remon Cantero,1/10/52,2/1/55,1/7/08,1955,10/1/52,1/2/55,0,3,11,0,3,M,7/1/08,1908,NA,1955427,PAN-1955-1,A2.9-1279,95,PAN,Guizado,3/1/55,15/01/1955,1899,1964,1/3/55,1/15/55,0,1,0,0,2,M,NA,1899,NA,1964428,PAN-1955-2,A2.9-1282,95,PAN,Arias Espinosa,15/01/1955,1/10/56,1912,1993,1/15/55,10/1/56,0,1,0,0,0,M,NA,1912,NA,1993429,PAN-1956,A2.9-1285,95,PAN,"Guardia Jr., E.",1/10/56,1/10/60,30/5/1904,2/5/83,10/1/56,10/1/60,0,1,0,0,0,M,5/30/04,1904,5/2/83,1983430,PAN-1960,A2.9-1288,95,PAN,"Chiari, Roberto",1/10/60,1/10/64,2/3/05,1981,10/1/60,10/1/64,0,1,0,1,0,M,3/2/05,1905,NA,1981431,PAN-1964,A2.9-1291,95,PAN,Robles,1/10/64,1/10/68,8/11/05,1990,10/1/64,10/1/68,0,1,0,0,1,M,11/8/05,1905,NA,1990432,PAN-1968-1,A2.9-1294,95,PAN,"Arias, A.",1/10/68,12/10/68,15/8/1901,10/8/88,10/1/68,10/12/68,0,3,6,2,1,M,8/15/01,1901,8/10/88,1988433,PAN-1968-2,A2.9-1297,95,PAN,Torrijos Herrera,12/10/68,31/07/1981,13/2/1929,31/07/1981,10/12/68,7/31/81,1,2,0,0,-777,M,2/13/29,1929,7/31/81,1981434,PAN-1981,A2.9-1300,95,PAN,Florez Aguilar,31/07/1981,3/3/82,1931,-777,7/31/81,3/3/82,1,3,16,0,2,M,NA,1931,NA,-777435,PAN-1982,A2.9-1303,95,PAN,Dario Paredes,3/3/82,15/08/1983,1931,-777,3/3/82,8/15/83,1,1,0,0,0,M,NA,1931,NA,-777436,PAN-1983,A2.9-1306,95,PAN,Noriega,15/08/1983,3/1/90,11/2/40,-777,8/15/83,1/3/90,1,4,9,0,2,M,2/11/40,1940,NA,-777437,PAN-1990,A2.9-1309,95,PAN,Endara,4/1/90,1/9/94,1936,-777,1/4/90,9/1/94,2,1,0,0,0,M,NA,1936,NA,-777438,PAN-1994,A2.9-1312,95,PAN,Balladares,1/9/94,1/9/99,1946,-777,9/1/94,9/1/99,0,1,0,0,0,M,NA,1946,NA,-777439,PAN-1999,A2.9-1315,95,PAN,Mireya Moscoso,1/9/99,1/9/04,1/7/46,-999,9/1/99,9/1/04,0,1,0,0,-999,F,7/1/46,1946,NA,NA440,PAN-2004,A2.9-1318,95,PAN,Martin Torrijos,1/9/04,31/12/2004,1963,-777,9/1/04,12/31/04,0,-888,0,0,-888,M,NA,1963,NA,-777441,COL-1874,A2.9-1321,100,COL,Perez,01/04/1874,01/04/1876,1830,1900,1874-04-01,1876-04-01,0,1,0,0,0,M,NA,1830,NA,1900442,COL-1876,A2.9-1324,100,COL,Parra,01/04/1876,14/05/1877,1825,1900,1876-04-01,1877-05-14,0,2.1,0,0,0,M,NA,1825,NA,1900443,COL-1877-1,A2.9-1327,100,COL,Camargo,14/05/1877,15/08/1877,-999,-999,1877-05-14,1877-08-15,0,1,0,0,0,M,NA,NA,NA,NA444,COL-1877-2,A2.9-1330,100,COL,Parra,15/08/1877,01/04/1878,1825,1900,1877-08-15,1878-04-01,0,1,0,1,1,M,NA,1825,NA,1900445,COL-1878,A2.9-1333,100,COL,Trujillo,01/04/1878,08/04/1880,1828,1883,1878-04-01,1880-04-08,0,1,0,0,0,M,NA,1828,NA,1883446,COL-1880,A2.9-1336,100,COL,Nunez,08/04/1880,01/04/1882,28/09/1825,18/09/1894,1880-04-08,1882-04-01,0,1,0,0,0,M,1825-09-28,1825,1894-09-18,1894447,COL-1882-1,A2.9-1339,100,COL,Zaldua,01/04/1882,21/12/1882,1811,1882,1882-04-01,1882-12-21,0,2,0,0,-777,M,NA,1811,NA,1882448,COL-1882-2,A2.9-1342,100,COL,Otalora,22/12/1882,01/04/1884,1828,1884,1882-12-22,1884-04-01,0,2,0,0,-777,M,NA,1828,NA,1884449,COL-1884,A2.9-1345,100,COL,Nunez,01/04/1884,12/09/1894,1825,18/09/1894,1884-04-01,1894-09-12,0,1,0,1,0,M,NA,1825,1894-09-18,1894450,COL-1894,A2.9-1348,100,COL,Caro,18/09/1894,07/08/1898,1843,1909,1894-09-18,1898-08-07,0,1,0,0,0,M,NA,1843,NA,1909451,COL-1898,A2.9-1351,100,COL,Sanclemente,07/08/1898,31/07/1900,1814,1902,1898-08-07,7/31/00,0,3,-999,0,2,M,NA,1814,NA,1902452,COL-1900,A2.9-1354,100,COL,Marroquin,31/07/1900,7/8/04,6/8/1827,1908,7/31/00,8/7/04,1,1,0,0,0,M,1827-08-06,1827,NA,1908453,COL-1904,A2.9-1357,100,COL,Reyes Prieto,7/8/04,8/7/09,5/12/1849,19/02/1921,8/7/04,7/8/09,0,1,0,0,1,M,1849-12-05,1849,2/19/21,1921454,COL-1909-1,A2.9-1360,100,COL,J. Holguin,8/7/09,3/8/09,30/10/1848,1928,7/8/09,8/3/09,0,1,0,0,0,M,1848-10-30,1848,NA,1928455,COL-1909-2,A2.9-1363,100,COL,Gonzales Valencia,3/8/09,15/07/1910,1854,1928,8/3/09,7/15/10,0,1,0,0,0,M,NA,1854,NA,1928456,COL-1910,A2.9-1366,100,COL,Restropo,15/07/1910,7/8/14,12/9/1867,1937,7/15/10,8/7/14,0,1,0,0,0,M,1867-09-12,1867,NA,1937457,COL-1914,A2.9-1369,100,COL,Concha,7/8/14,7/8/18,21/4/1867,1929,8/7/14,8/7/18,0,1,0,0,0,M,1867-04-21,1867,NA,1929458,COL-1918,A2.9-1372,100,COL,Suarez,7/8/18,11/11/21,23/4/1855,1927,8/7/18,11/11/21,0,1,0,0,0,M,1855-04-23,1855,NA,1927459,COL-1921,A2.9-1375,100,COL,J. Holguin,11/11/21,7/8/22,30/10/1848,1928,11/11/21,8/7/22,0,1,0,1,0,M,1848-10-30,1848,NA,1928460,COL-1922,A2.9-1378,100,COL,Nel Ospina,7/8/22,7/8/26,18/9/1858,1927,8/7/22,8/7/26,0,1,0,0,0,M,1858-09-18,1858,NA,1927461,COL-1926,A2.9-1381,100,COL,Abadia Mendez,7/8/26,7/8/30,5/6/1867,1947,8/7/26,8/7/30,0,1,0,0,0,M,1867-06-05,1867,NA,1947462,COL-1930,A2.9-1384,100,COL,Olaya Herrera,7/8/30,7/8/34,1881,1937,8/7/30,8/7/34,0,1,0,0,0,M,NA,1881,NA,1937463,COL-1934,A2.9-1387,100,COL,Lopez Pumarejo,7/8/34,7/8/38,31/1/1886,20/11/1959,8/7/34,8/7/38,0,1,0,0,0,M,1886-01-31,1886,11/20/59,1959464,COL-1938,A2.9-1390,100,COL,Santos,7/8/38,7/8/42,1888,1974,8/7/38,8/7/42,0,1,0,0,0,M,NA,1888,NA,1974465,COL-1942,A2.9-1393,100,COL,Lopez Pumarejo,7/8/42,7/8/45,31/1/1886,20/11/1959,8/7/42,8/7/45,0,1,0,1,0,M,1886-01-31,1886,11/20/59,1959466,COL-1945,A2.9-1396,100,COL,Lleras Camargo,7/8/45,7/8/46,3/7/06,4/1/90,8/7/45,8/7/46,0,1,0,0,0,M,7/3/06,1906,1/4/90,1990467,COL-1946,A2.9-1399,100,COL,Ospina Perez,7/8/46,7/8/50,24/11/1891,14/04/1976,8/7/46,8/7/50,0,1,0,0,0,M,1891-11-24,1891,4/14/76,1976468,COL-1950,A2.9-1402,100,COL,Laureanco Gomez,7/8/50,5/11/51,20/2/1889,13/07/1965,8/7/50,11/5/51,0,1,0,0,0,M,1889-02-20,1889,7/13/65,1965469,COL-1951,A2.9-1405,100,COL,Roberto Urdaneta Arbelaez,5/11/51,13/06/1953,1890,1972,11/5/51,6/13/53,0,1,0,0,0,M,NA,1890,NA,1972470,COL-1953-1,A2.9-1408,100,COL,Laureanco Gomez,13/06/1953,13/06/1953,20/2/1889,13/07/1965,6/13/53,6/13/53,0,3,6,1,1,M,1889-02-20,1889,7/13/65,1965471,COL-1953-2,A2.9-1411,100,COL,Rojas Pinillia,13/06/1953,10/5/57,12/3/00,1975,6/13/53,5/10/57,1,3,16,0,1,M,3/12/00,1900,NA,1975472,COL-1957,A2.9-1414,100,COL,Paris,10/5/57,7/8/58,1910,-999,5/10/57,8/7/58,1,1,0,0,0,M,NA,1910,NA,NA473,COL-1958,A2.9-1417,100,COL,Lleras Camargo,7/8/58,7/8/62,3/7/06,4/1/90,8/7/58,8/7/62,0,1,0,1,0,M,7/3/06,1906,1/4/90,1990474,COL-1962,A2.9-1420,100,COL,Guillermo-Leon,7/8/62,7/8/66,1909,1971,8/7/62,8/7/66,0,1,0,0,0,M,NA,1909,NA,1971475,COL-1966,A2.9-1423,100,COL,Lleras Restropo,7/8/66,7/8/70,12/4/08,27/09/1994,8/7/66,8/7/70,0,1,0,0,0,M,4/12/08,1908,9/27/94,1994476,COL-1970,A2.9-1426,100,COL,Pastrana Borrero,7/8/70,7/8/74,12/11/23,21/08/1997,8/7/70,8/7/74,0,1,0,0,0,M,11/12/23,1923,8/21/97,1997477,COL-1974,A2.9-1429,100,COL,Lopez Michelsen,7/8/74,7/8/78,30/6/1913,-777,8/7/74,8/7/78,0,1,0,0,0,M,6/30/13,1913,NA,-777478,COL-1978,A2.9-1432,100,COL,Turbay,7/8/78,7/8/82,18/6/1916,2005,8/7/78,8/7/82,0,1,0,0,0,M,6/18/16,1916,NA,2005479,COL-1982,A2.9-1435,100,COL,Betancur,7/8/82,7/8/86,1923,-777,8/7/82,8/7/86,0,1,0,0,0,M,NA,1923,NA,-777480,COL-1986,A2.9-1438,100,COL,Vargas,7/8/86,7/8/90,17/9/1921,1997,8/7/86,8/7/90,0,1,0,0,0,M,9/17/21,1921,NA,1997481,COL-1990,A2.9-1441,100,COL,Trujillo,7/8/90,7/8/94,31/3/1947,-777,8/7/90,8/7/94,0,1,0,0,0,M,3/31/47,1947,NA,-777482,COL-1994,A2.9-1444,100,COL,Pizano,7/8/94,7/8/98,1950,-777,8/7/94,8/7/98,0,1,0,0,0,M,NA,1950,NA,-777483,COL-1998,A2.9-1447,100,COL,Arango,7/8/98,7/8/02,1954,-777,8/7/98,8/7/02,0,1,0,0,0,M,NA,1954,NA,-777484,COL-2002,A2.9-1450,100,COL,Alvaro Uribe Velez,8/8/02,31/12/2004,1952,-777,8/8/02,12/31/04,0,-888,0,0,-888,M,NA,1952,NA,-777485,VEN-1870,A2.9-1453,101,VEN,Guzman Blanco,27/04/1870,20/02/1877,20/2/1829,1899,1870-04-27,1877-02-20,1,1,0,0,0,M,1829-02-20,1829,NA,1899486,VEN-1877-1,A2.9-1456,101,VEN,Jacinto Guitierrez Martinez de Aleman,21/02/1877,02/03/1877,1808,1884,1877-02-21,1877-03-02,0,1,0,0,-666,M,NA,1808,NA,1884487,VEN-1877-2,A2.9-1459,101,VEN,Linares Alcantara,02/03/1877,20/11/1878,1825,30/11/1878,1877-03-02,1878-11-20,0,2,0,0,-777,M,NA,1825,1878-11-30,1878488,VEN-1878,A2.9-1462,101,VEN,Jacinto Guitierrez Martinez de Aleman,20/11/1878,01/01/1879,1808,1884,1878-11-20,1879-01-01,0,3,-999,1,1,M,NA,1808,NA,1884489,VEN-1879,A2.9-1465,101,VEN,Guzman Blanco,26/02/1879,27/04/1884,20/2/1829,1899,1879-02-26,1884-04-27,0,1,0,1,0,M,1829-02-20,1829,NA,1899490,VEN-1884,A2.9-1468,101,VEN,Joaquin Crespo,27/04/1884,27/04/1886,22/8/1841,15/04/1898,1884-04-27,1886-04-27,0,1,0,0,0,M,1841-08-22,1841,1898-04-15,1898491,VEN-1886-1,A2.9-1471,101,VEN,Antonio Diez,27/04/1886,15/09/1886,1838,1916,1886-04-27,1886-09-15,0,1,0,0,-666,M,NA,1838,NA,1916492,VEN-1886-2,A2.9-1474,101,VEN,Guzman Blanco,15/09/1886,08/08/1887,20/2/1829,1899,1886-09-15,1887-08-08,0,1,0,2,0,M,1829-02-20,1829,NA,1899493,VEN-1887,A2.9-1477,101,VEN,Lopez,08/08/1887,05/07/1888,-999,-999,1887-08-08,1888-07-05,0,1,0,0,0,M,NA,NA,NA,NA494,VEN-1888,A2.9-1480,101,VEN,Rojas Paul,05/07/1888,19/03/1890,26/11/1826,1905,1888-07-05,1890-03-19,0,1,0,0,0,M,1826-11-26,1826,NA,1905495,VEN-1890,A2.9-1483,101,VEN,Palacio,19/03/1890,17/06/1892,6/2/1843,1900,1890-03-19,1892-06-17,0,3,-999,0,1,M,1843-02-06,1843,NA,1900496,VEN-1892-1,A2.9-1486,101,VEN,Tell Villegas,17/06/1892,02/09/1892,1823,1907,1892-06-17,1892-09-02,1,3,-999,0,1,M,NA,1823,NA,1907497,VEN-1892-2,A2.9-1489,101,VEN,Tell Villegas Pulido,02/09/1892,06/10/1892,1854,1949,1892-09-02,1892-10-06,0,3,-999,0,1,M,NA,1854,NA,1949498,VEN-1892-3,A2.9-1492,101,VEN,Joaquin Crespo,07/10/1892,28/02/1894,22/8/1841,15/04/1898,1892-10-07,1894-02-28,1,1,0,1,0,M,1841-08-22,1841,1898-04-15,1898499,VEN-1894-1,A2.9-1495,101,VEN,Guzman Alvarez,28/02/1894,14/03/1894,1830,1912,1894-02-28,1894-03-14,0,1,0,0,0,M,NA,1830,NA,1912500,VEN-1894-2,A2.9-1498,101,VEN,Joaquin Crespo,14/04/1894,20/02/1898,22/8/1841,15/04/1898,1894-04-14,1898-02-20,0,1,0,2,3,M,1841-08-22,1841,1898-04-15,1898501,VEN-1898-1,A2.9-1501,101,VEN,Guzman Alvarez,20/02/1898,28/02/1898,1830,1912,1898-02-20,1898-02-28,0,1,0,1,0,M,NA,1830,NA,1912502,VEN-1898-2,A2.9-1504,101,VEN,Andrade,28/02/1898,20/10/1899,1839,1925,1898-02-28,1899-10-20,1,3,-999,0,1,M,NA,1839,NA,1925503,VEN-1899,A2.9-1507,101,VEN,Cipriano Castro,21/10/1899,10/12/08,12/10/1858,1924,1899-10-21,12/10/08,1,3,-999,0,1,M,1858-10-12,1858,NA,1924504,VEN-1908,A2.9-1510,101,VEN,Gomez,19/12/1908,18/12/1935,24/7/1857,1935,12/19/08,12/18/35,1,2,0,0,-777,M,1857-07-24,1857,NA,1935505,VEN-1935,A2.9-1513,101,VEN,Lopez Contreras,18/12/1935,15/04/1941,5/5/1883,1973,12/18/35,4/15/41,0,1,0,0,0,M,1883-05-05,1883,NA,1973506,VEN-1941,A2.9-1516,101,VEN,Medina Angarita,5/5/41,18/10/1945,6/7/1897,1953,5/5/41,10/18/45,0,3,6,0,1,M,1897-07-06,1897,NA,1953507,VEN-1945,A2.9-1519,101,VEN,Betancourt,18/10/1945,15/02/1948,22/2/1908,28/09/1981,10/18/45,2/15/48,1,1,0,0,1,M,2/22/08,1908,9/28/81,1981508,VEN-1948-1,A2.9-1522,101,VEN,Gallegos,15/02/1948,24/11/1948,2/8/1884,1969,2/15/48,11/24/48,0,3,6,0,1,M,1884-08-02,1884,NA,1969509,VEN-1948-2,A2.9-1525,101,VEN,Delgado Chalbaud,24/11/1948,13/11/1950,1909,1950,11/24/48,11/13/50,1,3,4,0,3,M,NA,1909,NA,1950510,VEN-1950,A2.9-1528,101,VEN,Perez Jimenez,13/11/1950,23/01/1958,25/4/1914,20/09/2001,11/13/50,1/23/58,0,3,2,0,1,M,4/25/14,1914,9/20/01,2001511,VEN-1958-1,A2.9-1531,101,VEN,Larrazabal,23/01/1958,14/11/1958,5/3/11,2003,1/23/58,11/14/58,1,1,0,0,0,M,3/5/11,1911,NA,2003512,VEN-1958-2,A2.9-1534,101,VEN,Sanabria,14/11/1958,13/02/1959,1911,1989,11/14/58,2/13/59,0,1,0,0,0,M,NA,1911,NA,1989513,VEN-1959,A2.9-1537,101,VEN,Betancourt,13/02/1959,1/12/63,22/2/1908,28/09/1981,2/13/59,12/1/63,0,1,0,1,1,M,2/22/08,1908,9/28/81,1981514,VEN-1963,A2.9-1540,101,VEN,Leoni,1/12/63,11/3/69,26/4/1905,-777,12/1/63,3/11/69,0,1,0,0,0,M,4/26/05,1905,NA,-777515,VEN-1969,A2.9-1543,101,VEN,Caldera Rodriguez,11/3/69,12/3/74,24/1/1916,-777,3/11/69,3/12/74,0,1,0,0,0,M,1/24/16,1916,NA,-777516,VEN-1974,A2.9-1546,101,VEN,Andres Perez,12/3/74,12/3/79,27/10/1922,-777,3/12/74,3/12/79,0,1,0,0,0,M,10/27/22,1922,NA,-777517,VEN-1979,A2.9-1549,101,VEN,Campins,12/3/79,2/2/84,4/5/25,-777,3/12/79,2/2/84,0,1,0,0,0,M,5/4/25,1925,NA,-777518,VEN-1984,A2.9-1552,101,VEN,Lusinchi,2/2/84,2/2/89,27/4/1924,-777,2/2/84,2/2/89,0,1,0,0,0,M,4/27/24,1924,NA,-777519,VEN-1989,A2.9-1555,101,VEN,Andres Perez,2/2/89,31/08/1993,27/10/1922,-777,2/2/89,8/31/93,0,1,0,1,2,M,10/27/22,1922,NA,-777520,VEN-1993,A2.9-1558,101,VEN,Velasquez,31/08/1993,2/2/94,1916,-777,8/31/93,2/2/94,0,1,0,0,0,M,NA,1916,NA,-777521,VEN-1994,A2.9-1561,101,VEN,Caldera Rodriguez,2/2/94,2/2/99,24/1/1916,-777,2/2/94,2/2/99,0,1,0,1,0,M,1/24/16,1916,NA,-777522,VEN-1999,A2.9-1564,101,VEN,Hugo Chavez,2/2/99,31/12/2004,28/7/1954,-777,2/2/99,12/31/04,0,-888,0,0,-888,M,7/28/54,1954,NA,-777523,GUY-1966,A2.9-1567,110,GUY,Burnham,26/05/1966,6/8/85,20/2/1923,6/8/85,5/26/66,8/6/85,0,2,0,0,-777,M,2/20/23,1923,8/6/85,1985524,GUY-1985,A2.9-1570,110,GUY,Hoyte,6/8/85,9/10/92,9/3/29,22/12/2002,8/6/85,10/9/92,0,1,0,0,0,M,3/9/29,1929,12/22/02,2002525,GUY-1992,A2.9-1573,110,GUY,Jagan Cheddi,9/10/92,6/3/97,22/3/1918,6/3/97,10/9/92,3/6/97,0,2,0,0,-777,M,3/22/18,1918,3/6/97,1997526,GUY-1997-1,A2.9-1576,110,GUY,Samuel Hinds,6/3/97,19/12/1997,27/12/1943,-777,3/6/97,12/19/97,0,1,0,0,0,M,12/27/43,1943,NA,-777527,GUY-1997-2,A2.9-1579,110,GUY,Janet Jagan,19/12/1997,11/8/99,20/10/1920,-777,12/19/97,8/11/99,0,2.1,0,0,0,F,10/20/20,1920,NA,-777528,GUY-1999,A2.9-1582,110,GUY,Bharrat Jagdeo,11/8/99,31/12/2004,23/1/1964,-777,8/11/99,12/31/04,0,-888,0,0,-888,M,1/23/64,1964,NA,-777529,SUR-1975,A2.9-1585,115,SUR,Ferrier,25/11/1975,13/08/1980,12/5/10,-777,11/25/75,8/13/80,0,3,6,0,1,M,5/12/10,1910,NA,-777530,SUR-1980,A2.9-1588,115,SUR,Bouterse,13/08/1980,25/01/1988,1946,-777,8/13/80,1/25/88,1,1,0,0,0,M,NA,1946,NA,-777531,SUR-1988,A2.9-1591,115,SUR,Shankar,25/01/1988,24/12/1990,1937,-777,1/25/88,12/24/90,0,3,6,0,0,M,NA,1937,NA,-777532,SUR-1990-1,A2.9-1594,115,SUR,Graanoogst,24/12/1990,29/12/1990,-999,-999,12/24/90,12/29/90,1,1,0,0,0,M,NA,NA,NA,NA533,SUR-1990-2,A2.9-1597,115,SUR,Kraag,29/12/1990,16/09/1991,1913,1996,12/29/90,9/16/91,0,1,0,0,0,M,NA,1913,NA,1996534,SUR-1991,A2.9-1600,115,SUR,Venetiaan,16/09/1991,15/09/1996,1936,-777,9/16/91,9/15/96,0,1,0,0,0,M,NA,1936,NA,-777535,SUR-1996,A2.9-1603,115,SUR,Wijdenbosch,15/09/1996,12/8/00,1941,-777,9/15/96,8/12/00,0,1,0,0,0,M,NA,1941,NA,-777536,SUR-2000,A2.9-1606,115,SUR,Venetiaan,12/8/00,31/12/2004,1936,-777,8/12/00,12/31/04,0,-888,0,1,-888,M,NA,1936,NA,-777537,ECU-1869,A2.9-1609,130,ECU,Moreno,19/01/1869,06/08/1875,24/12/1821,06/08/1875,1869-01-19,1875-08-06,1,3,-999,0,3,M,1821-12-24,1821,1875-08-06,1875538,ECU-1875,A2.9-1612,130,ECU,Borrero y Cortazar,09/10/1875,08/09/1876,28/10/1827,1911,1875-10-09,1876-09-08,0,3,-999,0,1,M,1827-10-28,1827,NA,1911539,ECU-1876,A2.9-1615,130,ECU,Veintemilla,08/09/1876,09/07/1883,1823,1908,1876-09-08,1883-07-09,1,3,-999,0,1,M,NA,1823,NA,1908540,ECU-1883-1,A2.9-1618,130,ECU,Aloy Alfaro Delgado,09/07/1883,11/10/1883,25/6/1842,1912,1883-07-09,1883-10-11,1,1,0,0,1,M,1842-06-25,1842,NA,1912541,ECU-1883-2,A2.9-1621,130,ECU,Borrero y Cortazar,11/10/1883,15/10/1883,1827,1911,1883-10-11,1883-10-15,0,1,0,1,0,M,NA,1827,NA,1911542,ECU-1883-3,A2.9-1624,130,ECU,Perez Pareja,15/10/1883,23/11/1883,-999,1897,1883-10-15,1883-11-23,0,1,0,0,-666,M,NA,NA,NA,1897543,ECU-1883-4,A2.9-1627,130,ECU,Caamano,23/11/1883,30/06/1888,1837,1907,1883-11-23,1888-06-30,0,1,0,0,0,M,NA,1837,NA,1907544,ECU-1888,A2.9-1630,130,ECU,Flores,03/08/1888,01/07/1892,1833,1915,1888-08-03,1892-07-01,0,1,0,0,1,M,NA,1833,NA,1915545,ECU-1892,A2.9-1633,130,ECU,Cordero,01/07/1892,16/04/1895,6/4/1833,1912,1892-07-01,1895-04-16,0,3,-999,0,1,M,1833-04-06,1833,NA,1912546,ECU-1895,A2.9-1636,130,ECU,Aloy Alfaro Delgado,16/04/1895,31/08/1901,25/6/1842,1912,1895-04-16,8/31/01,1,1,0,1,0,M,1842-06-25,1842,NA,1912547,ECU-1901,A2.9-1639,130,ECU,Plaza Gutierrez,1/9/01,31/08/1905,18/4/1865,1932,9/1/01,8/31/05,0,1,0,0,1,M,1865-04-18,1865,NA,1932548,ECU-1905,A2.9-1642,130,ECU,Garcia,1/9/05,15/01/1906,1842,1927,9/1/05,1/15/06,0,3,-999,0,1,M,NA,1842,NA,1927549,ECU-1906,A2.9-1645,130,ECU,Aloy Alfaro Delgado,17/01/1906,11/8/11,25/6/1842,1932,1/17/06,8/11/11,1,3,-999,2,3,M,1842-06-25,1842,NA,1932550,ECU-1911-1,A2.9-1648,130,ECU,Freile,11/8/11,31/08/1911,1851,1926,8/11/11,8/31/11,0,1,0,0,1,M,NA,1851,NA,1926551,ECU-1911-2,A2.9-1651,130,ECU,E. Estrada,1/9/11,22/12/1911,28/5/1855,22/12/1911,9/1/11,12/22/11,0,2,0,0,-777,M,1855-05-28,1855,12/22/11,1911552,ECU-1911-3,A2.9-1654,130,ECU,Freile,22/12/1911,6/3/12,1851,1926,12/22/11,3/6/12,0,1,0,1,1,M,NA,1851,NA,1926553,ECU-1912-1,A2.9-1657,130,ECU,Andrade Marin,6/3/12,10/8/12,1841,1935,3/6/12,8/10/12,0,1,0,0,-666,M,NA,1841,NA,1935554,ECU-1912-2,A2.9-1660,130,ECU,Alfredo Baquerizo Moreno,10/8/12,1/9/12,28/9/1859,1951,8/10/12,9/1/12,0,1,0,0,0,M,1859-09-28,1859,NA,1951555,ECU-1912-3,A2.9-1663,130,ECU,Plaza Gutierrez,1/9/12,1/9/16,18/4/1865,1932,9/1/12,9/1/16,0,1,0,1,0,M,1865-04-18,1865,NA,1932556,ECU-1916,A2.9-1666,130,ECU,Alfredo Baquerizo Moreno,1/9/16,1/9/20,28/9/1859,1951,9/1/16,9/1/20,0,1,0,1,0,M,1859-09-28,1859,NA,1951557,ECU-1920,A2.9-1669,130,ECU,Tamayo,1/9/20,1/9/24,29/7/1858,1947,9/1/20,9/1/24,0,1,0,0,0,M,1858-07-29,1858,NA,1947558,ECU-1924,A2.9-1672,130,ECU,Cordova,1/9/24,9/7/25,15/7/1863,1928,9/1/24,7/9/25,0,3,6,0,1,M,1863-07-15,1863,NA,1928559,ECU-1925,A2.9-1675,130,ECU,Ayora,9/7/25,24/08/1931,31/8/1879,1978,7/9/25,8/24/31,1,3,6,0,1,M,1879-08-31,1879,NA,1978560,ECU-1931-1,A2.9-1678,130,ECU,Larrea Alba,24/08/1931,15/10/1931,25/10/1895,1980,8/24/31,10/15/31,1,3,6,0,1,M,1895-10-25,1895,NA,1980561,ECU-1931-2,A2.9-1681,130,ECU,Alfredo Baquerizo Moreno,15/10/1931,27/08/1932,28/9/1859,1951,10/15/31,8/27/32,1,3,6,2,2,M,1859-09-28,1859,NA,1951562,ECU-1932-1,A2.9-1684,130,ECU,Freile Larrea,27/08/1932,2/9/32,1892,1942,8/27/32,9/2/32,0,1,0,0,0,M,NA,1892,NA,1942563,ECU-1932-2,A2.9-1687,130,ECU,Guerrero Martin,2/9/32,6/12/32,1878,1941,9/2/32,12/6/32,0,1,0,0,-666,M,NA,1878,NA,1941564,ECU-1932-3,A2.9-1690,130,ECU,Martinez Mera,6/12/32,18/10/1933,9/3/1875,1955,12/6/32,10/18/33,0,1,0,0,-666,M,1875-03-09,1875,NA,1955565,ECU-1933,A2.9-1693,130,ECU,Montalvo,20/10/1933,31/08/1934,1/6/1876,1950,10/20/33,8/31/34,1,1,0,0,0,M,1876-06-01,1876,NA,1950566,ECU-1934,A2.9-1696,130,ECU,Velasco Ibarra,1/9/34,21/08/1935,19/3/1893,30/03/1979,9/1/34,8/21/35,0,3,6,0,2,M,1893-03-19,1893,3/30/79,1979567,ECU-1935-1,A2.9-1699,130,ECU,Pons,21/08/1935,26/09/1935,10/11/1897,1980,8/21/35,9/26/35,1,3,16,0,-666,M,1897-11-10,1897,NA,1980568,ECU-1935-2,A2.9-1702,130,ECU,Paez,26/09/1935,23/10/1937,6/6/1876,1974,9/26/35,10/23/37,1,3,16,0,1,M,1876-06-06,1876,NA,1974569,ECU-1937,A2.9-1705,130,ECU,Enriquez Gallo,23/10/1937,10/8/38,24/7/1895,1962,10/23/37,8/10/38,1,1,0,0,0,M,1895-07-24,1895,NA,1962570,ECU-1938-1,A2.9-1708,130,ECU,Manuel Maria Borrero,10/8/38,2/12/38,1883,1975,8/10/38,12/2/38,0,1,0,0,0,M,NA,1883,NA,1975571,ECU-1938-2,A2.9-1711,130,ECU,Mosquera Narvaez,3/12/38,19/11/1939,2/8/1883,19/11/1939,12/3/38,11/19/39,0,2,0,0,-777,M,1883-08-02,1883,11/19/39,1939572,ECU-1939-1,A2.9-1714,130,ECU,Arroyo del Rio,19/11/1939,10/12/39,27/11/1893,1969,11/19/39,12/10/39,0,1,0,0,0,M,1893-11-27,1893,NA,1969573,ECU-1939-2,A2.9-1717,130,ECU,Cordova Nieto,11/12/39,10/8/40,8/5/1892,1983,12/11/39,8/10/40,0,1,0,0,0,M,1892-05-08,1892,NA,1983574,ECU-1940-1,A2.9-1720,130,ECU,Moreno,10/8/40,31/08/1940,20/10/1880,1952,8/10/40,8/31/40,0,1,0,0,0,M,1880-10-20,1880,NA,1952575,ECU-1940-2,A2.9-1723,130,ECU,Arroyo del Rio,1/9/40,29/05/1944,27/11/1893,1952,9/1/40,5/29/44,0,3,6,1,1,M,1893-11-27,1893,NA,1952576,ECU-1944-1,A2.9-1726,130,ECU,Navarro Allende,29/05/1944,30/05/1944,-999,-999,5/29/44,5/30/44,0,3,6,1,2,M,NA,NA,NA,NA577,ECU-1944-2,A2.9-1729,130,ECU,Larrea Alba,30/05/1944,31/05/1944,25/10/1895,1980,5/30/44,5/31/44,1,1,6,1,1,M,1895-10-25,1895,NA,1980578,ECU-1944-3,A2.9-1732,130,ECU,Velasco Ibarra,31/05/1944,23/08/1947,19/3/1893,30/03/1979,5/31/44,8/23/47,1,3,6,1,1,M,1893-03-19,1893,3/30/79,1979579,ECU-1947-1,A2.9-1735,130,ECU,Mancheno,24/08/1947,3/9/47,1902,1996,8/24/47,9/3/47,1,3,6,0,1,M,NA,1902,NA,1996580,ECU-1947-2,A2.9-1738,130,ECU,Suarez,3/9/47,17/09/1947,1897,1980,9/3/47,9/17/47,1,1,0,0,0,M,NA,1897,NA,1980581,ECU-1947-3,A2.9-1741,130,ECU,Arosemana Tola,17/09/1947,21/08/1948,1894,1952,9/17/47,8/21/48,0,1,0,0,0,M,NA,1894,NA,1952582,ECU-1948,A2.9-1744,130,ECU,Plaza Lasso,1/9/48,1/9/52,17/2/1906,28/01/1987,9/1/48,9/1/52,0,1,0,0,0,M,2/17/06,1906,1/28/87,1987583,ECU-1952,A2.9-1747,130,ECU,Velasco Ibarra,1/9/52,1/9/56,19/3/1893,30/03/1979,9/1/52,9/1/56,0,1,0,2,1,M,1893-03-19,1893,3/30/79,1979584,ECU-1956,A2.9-1750,130,ECU,Ponce Enriquez,1/9/56,1/9/60,31/1/1912,1976,9/1/56,9/1/60,0,1,0,0,1,M,1/31/12,1912,NA,1976585,ECU-1960,A2.9-1753,130,ECU,Velasco Ibarra,1/9/60,7/11/61,19/3/1893,30/03/1979,9/1/60,11/7/61,0,3,6,3,1,M,1893-03-19,1893,3/30/79,1979586,ECU-1961,A2.9-1756,130,ECU,Arosemena Monroy,7/11/61,11/7/63,1919,2004,11/7/61,7/11/63,1,3,6,0,1,M,NA,1919,NA,2004587,ECU-1963,A2.9-1759,130,ECU,Castro,11/7/63,29/03/1966,1915,1984,7/11/63,3/29/66,1,3,2,0,1,M,NA,1915,NA,1984588,ECU-1966-1,A2.9-1762,130,ECU,Yerovi Indaburu,29/03/1966,16/11/1966,1904,1981,3/29/66,11/16/66,1,1,0,0,0,M,NA,1904,NA,1981589,ECU-1966-2,A2.9-1765,130,ECU,Arosemena Gomez,16/11/1966,1/9/68,19/7/1925,20/04/1984,11/16/66,9/1/68,0,1,0,0,0,M,7/19/25,1925,4/20/84,1984590,ECU-1968,A2.9-1768,130,ECU,Velasco Ibarra,1/9/68,15/02/1972,19/3/1893,30/03/1979,9/1/68,2/15/72,0,3,6,4,1,M,1893-03-19,1893,3/30/79,1979591,ECU-1972,A2.9-1771,130,ECU,Rodriguez Lara,15/02/1972,11/1/76,4/11/23,-777,2/15/72,1/11/76,1,3,6,0,0,M,11/4/23,1923,NA,-777592,ECU-1976,A2.9-1774,130,ECU,Poveda Burbano,11/1/76,10/8/79,1926,7/6/90,1/11/76,8/10/79,1,1,0,0,0,M,NA,1926,6/7/90,1990593,ECU-1979,A2.9-1777,130,ECU,Roldos Aquilers,10/8/79,24/05/1981,5/11/40,1981,8/10/79,5/24/81,0,2,0,0,-777,M,11/5/40,1940,NA,1981594,ECU-1981,A2.9-1780,130,ECU,Hurtado Larrea,24/05/1981,10/8/84,1940,-777,5/24/81,8/10/84,0,1,0,0,0,M,NA,1940,NA,-777595,ECU-1984,A2.9-1783,130,ECU,Febres Cordaro,10/8/84,10/8/88,9/3/31,-777,8/10/84,8/10/88,0,1,0,0,0,M,3/9/31,1931,NA,-777596,ECU-1988,A2.9-1786,130,ECU,Borja Cevallos,10/8/88,10/8/92,19/6/1935,-777,8/10/88,8/10/92,0,1,0,0,0,M,6/19/35,1935,NA,-777597,ECU-1992,A2.9-1789,130,ECU,Duran Ballen,10/8/92,10/8/96,14/7/1921,-777,8/10/92,8/10/96,0,1,0,0,0,M,7/14/21,1921,NA,-777598,ECU-1996,A2.9-1792,130,ECU,Bucaram Ortiz,10/8/96,6/2/97,20/2/1952,-777,8/10/96,2/6/97,0,1,0,0,1,M,2/20/52,1952,NA,-777599,ECU-1997-1,A2.9-1795,130,ECU,Alarcon Fabian,6/2/97,9/2/97,14/4/1947,-777,2/6/97,2/9/97,0,1,0,0,0,M,4/14/47,1947,NA,-777600,ECU-1997-2,A2.9-1798,130,ECU,Arteaga Serrano,9/2/97,11/2/97,1956,-777,2/9/97,2/11/97,0,1,0,0,0,F,NA,1956,NA,-777601,ECU-1997-3,A2.9-1801,130,ECU,Alarcon Fabian,11/2/97,10/8/98,14/4/1947,-777,2/11/97,8/10/98,0,1,0,1,0,M,4/14/47,1947,NA,-777602,ECU-1998,A2.9-1804,130,ECU,Mahuad,10/8/98,21/01/2000,29/7/1949,-777,8/10/98,1/21/00,0,3,2,0,1,M,7/29/49,1949,NA,-777603,ECU-2000,A2.9-1807,130,ECU,Gustavo Noboa,22/01/2000,15/01/2003,1937,-777,1/22/00,1/15/03,1,1,0,0,1,M,NA,1937,NA,-777604,ECU-2003,A2.9-1810,130,ECU,Lucio Gutierrez,15/01/2003,31/12/2004,1957,-777,1/15/03,12/31/04,0,-888,0,0,-888,M,NA,1957,NA,-777605,PER-1872,A2.9-1813,135,PER,Pardo,02/08/1872,02/08/1876,1834,1878,1872-08-02,1876-08-02,0,1,0,0,1,M,NA,1834,NA,1878606,PER-1876,A2.9-1816,135,PER,Prado,02/08/1876,17/12/1879,1826,1901,1876-08-02,1879-12-17,0,1,0,0,1,M,NA,1826,NA,1901607,PER-1879-1,A2.9-1819,135,PER,Luis de la Puerta,17/12/1879,22/12/1879,1795,-999,1879-12-17,1879-12-22,0,3,-999,0,-666,F,NA,1795,NA,NA608,PER-1879-2,A2.9-1822,135,PER,Pierola,22/12/1879,16/01/1881,1839,1913,1879-12-22,1881-01-16,1,4,-999,0,1,M,NA,1839,NA,1913609,PER-1881-1,A2.9-1825,135,PER,Francisco Garcia Calderon,22/02/1881,28/09/1881,1834,1905,1881-02-22,1881-09-28,2,4,-999,0,2,F,NA,1834,NA,1905610,PER-1881-2,A2.9-1828,135,PER,Montero,28/09/1881,30/12/1882,1832,1905,1881-09-28,1882-12-30,1,4,-999,0,1,F,NA,1832,NA,1905611,PER-1882,A2.9-1831,135,PER,Iglesias,30/12/1882,30/11/1885,1830,1909,1882-12-30,1885-11-30,2,3,-999,0,0,M,NA,1830,NA,1909612,PER-1885,A2.9-1834,135,PER,Caceres,30/11/1885,10/08/1890,1833,1923,1885-11-30,1890-08-10,1,1,0,0,0,M,NA,1833,NA,1923613,PER-1890,A2.9-1837,135,PER,Bermudez,10/08/1890,01/04/1894,1836,1894,1890-08-10,1894-04-01,0,2,0,0,-777,M,NA,1836,NA,1894614,PER-1894-1,A2.9-1840,135,PER,Borgono,01/04/1894,10/08/1894,1836,1921,1894-04-01,1894-08-10,1,1,0,0,0,M,NA,1836,NA,1921615,PER-1894-2,A2.9-1843,135,PER,Caceres,10/08/1894,19/03/1895,1833,1923,1894-08-10,1895-03-19,0,3,-999,1,1,M,NA,1833,NA,1923616,PER-1895-1,A2.9-1846,135,PER,de Candamo,21/03/1895,08/09/1895,1841,1904,1895-03-21,1895-09-08,0,3,-999,0,0,M,NA,1841,NA,1904617,PER-1895-2,A2.9-1849,135,PER,Pierola,08/09/1895,08/09/1899,1839,1913,1895-09-08,1899-09-08,1,1,0,1,0,M,NA,1839,NA,1913618,PER-1899,A2.9-1852,135,PER,de Romana,08/09/1899,8/9/03,19/3/1847,1912,1899-09-08,9/8/03,0,1,0,0,0,M,1847-03-19,1847,NA,1912619,PER-1903,A2.9-1855,135,PER,de Candamo,30/09/1903,7/5/04,1841,7/5/04,9/30/03,5/7/04,0,2,0,1,-777,M,NA,1841,5/7/04,1904620,PER-1904-1,A2.9-1858,135,PER,Serapio Calderon,7/5/04,24/09/1904,1843,1922,5/7/04,9/24/04,0,1,0,0,0,M,NA,1843,NA,1922621,PER-1904-2,A2.9-1861,135,PER,Pardo y Barreda,24/09/1904,24/09/1908,24/2/1864,1947,9/24/04,9/24/08,0,1,0,0,1,M,1864-02-24,1864,NA,1947622,PER-1908,A2.9-1864,135,PER,Leguia,24/09/1908,24/09/1912,19/2/1863,6/2/32,9/24/08,9/24/12,0,1,0,0,2,M,1863-02-19,1863,2/6/32,1932623,PER-1912,A2.9-1867,135,PER,Billinghurst,24/09/1912,4/2/14,1851,1915,9/24/12,2/4/14,0,3,-999,0,1,M,NA,1851,NA,1915624,PER-1914,A2.9-1870,135,PER,Benavides,4/2/14,18/08/1915,18/5/1876,1945,2/4/14,8/18/15,1,1,0,0,0,M,1876-05-18,1876,NA,1945625,PER-1915,A2.9-1873,135,PER,Pardo y Barreda,18/08/1915,4/7/19,24/2/1864,1947,8/18/15,7/4/19,0,3,6,1,2,M,1864-02-24,1864,NA,1947626,PER-1919,A2.9-1876,135,PER,Leguia,20/07/1919,25/08/1930,19/2/1863,6/2/32,7/20/19,8/25/30,1,3,6,1,2,M,1863-02-19,1863,2/6/32,1932627,PER-1930-1,A2.9-1879,135,PER,Ponce Brousset,25/08/1930,27/08/1930,1874,1966,8/25/30,8/27/30,1,3,6,0,-666,M,NA,1874,NA,1966628,PER-1930-2,A2.9-1882,135,PER,Sanchez Cerro,27/08/1930,1/3/31,1889,1933,8/27/30,3/1/31,1,3,6,0,1,M,NA,1889,NA,1933629,PER-1931-1,A2.9-1885,135,PER,Ricardo Leonicio Elias,1/3/31,5/3/31,1874,1951,3/1/31,3/5/31,1,3,6,0,0,M,NA,1874,NA,1951630,PER-1931-2,A2.9-1888,135,PER,Gustavo Jimenez,5/3/31,10/3/31,1886,1933,3/5/31,3/10/31,1,3,6,0,0,M,NA,1886,NA,1933631,PER-1931-3,A2.9-1891,135,PER,Samanez Ocampo,10/3/31,8/12/31,1866,1947,3/10/31,12/8/31,1,1,0,0,0,M,NA,1866,NA,1947632,PER-1931-4,A2.9-1894,135,PER,Sanchez Cerro,8/12/31,30/04/1933,1889,1933,12/8/31,4/30/33,0,3,11,1,3,M,NA,1889,NA,1933633,PER-1933,A2.9-1897,135,PER,Benavidez,30/04/1933,8/12/39,18/5/1876,1945,4/30/33,12/8/39,0,1,0,1,0,M,1876-05-18,1876,NA,1945634,PER-1939,A2.9-1900,135,PER,Ugarteche,8/12/39,28/07/1945,21/4/1889,1967,12/8/39,7/28/45,0,1,0,0,0,M,1889-04-21,1889,NA,1967635,PER-1945,A2.9-1903,135,PER,Bustamante,28/07/1945,28/10/1948,15/1/1894,11/1/89,7/28/45,10/28/48,0,3,6,0,1,M,1894-01-15,1894,1/11/89,1989636,PER-1948,A2.9-1906,135,PER,Odria,29/10/1948,1/6/50,26/11/1897,18/02/1974,10/29/48,6/1/50,1,1,0,0,0,M,1897-11-26,1897,2/18/74,1974637,PER-1950-1,A2.9-1909,135,PER,Noriega,1/6/50,28/07/1950,1900,1957,6/1/50,7/28/50,0,1,0,0,0,M,NA,1900,NA,1957638,PER-1950-2,A2.9-1912,135,PER,Odria,28/07/1950,28/07/1956,26/11/1897,18/02/1974,7/28/50,7/28/56,0,1,0,1,1,M,1897-11-26,1897,2/18/74,1974639,PER-1956,A2.9-1915,135,PER,Ugarteche,28/07/1956,19/07/1962,21/4/1889,1967,7/28/56,7/19/62,0,3,6,1,2,M,1889-04-21,1889,NA,1967640,PER-1962,A2.9-1918,135,PER,Perez Godoy,19/07/1962,3/3/63,9/6/05,1982,7/19/62,3/3/63,1,3,16,0,2,M,6/9/05,1905,NA,1982641,PER-1963-1,A2.9-1921,135,PER,Lindley Lopez,3/3/63,28/07/1963,1908,1995,3/3/63,7/28/63,1,1,0,0,0,M,NA,1908,NA,1995642,PER-1963-2,A2.9-1924,135,PER,Belaunde,28/07/1963,3/10/68,7/10/13,4/6/02,7/28/63,10/3/68,0,3,6,0,1,M,10/7/13,1913,6/4/02,2002643,PER-1968,A2.9-1927,135,PER,Velasco Alvarado,3/10/68,29/08/1975,16/6/1910,1977,10/3/68,8/29/75,1,3,6,0,0,M,6/16/10,1910,NA,1977644,PER-1975,A2.9-1930,135,PER,Morales Bermudez,30/08/1975,28/07/1980,4/10/21,-777,8/30/75,7/28/80,1,1,0,0,0,M,10/4/21,1921,NA,-777645,PER-1980,A2.9-1933,135,PER,Belaunde,28/07/1980,28/07/1985,7/10/13,4/6/02,7/28/80,7/28/85,0,1,0,1,0,M,10/7/13,1913,6/4/02,2002646,PER-1985,A2.9-1936,135,PER,Garcia Perez,28/07/1985,28/07/1990,23/5/1949,-777,7/28/85,7/28/90,0,1,0,0,0,M,5/23/49,1949,NA,-777647,PER-1990,A2.9-1939,135,PER,Fujimori,28/07/1990,22/11/2000,28/7/1938,-777,7/28/90,11/22/00,0,1,0,0,1,M,7/28/38,1938,NA,-777648,PER-2000,A2.9-1942,135,PER,Valentin Paniagua,23/11/2000,28/07/2001,1936,2006,11/23/00,7/28/01,0,1,0,0,0,M,NA,1936,NA,2006649,PER-2001,A2.9-1945,135,PER,Alejandro Toledo,28/07/2001,31/12/2004,1946,-777,7/28/01,12/31/04,0,-888,0,0,-888,M,NA,1946,NA,-777650,BRA-1840,A2.9-1948,140,BRA,Pedro II,23/07/1840,15/11/1889,2/12/1825,05/12/1891,1840-07-23,1889-11-15,0,3,-999,0,1,M,1825-12-02,1825,1891-12-05,1891651,BRA-1889,A2.9-1951,140,BRA,M. D. da Fonseca,15/11/1889,23/11/1891,1823,1892,1889-11-15,1891-11-23,1,3,-999,0,0,M,NA,1823,NA,1892652,BRA-1891,A2.9-1954,140,BRA,Peixoto,23/11/1891,15/11/1894,30/4/1839,1895,1891-11-23,1894-11-15,0,1,0,0,0,M,1839-04-30,1839,NA,1895653,BRA-1894,A2.9-1957,140,BRA,de Moraes Barros,15/11/1894,15/11/1898,4/10/1841,1902,1894-11-15,1898-11-15,0,1,0,0,0,M,1841-10-04,1841,NA,1902654,BRA-1898,A2.9-1960,140,BRA,de Campos Salles,15/11/1898,15/11/1902,1841,1913,1898-11-15,11/15/02,0,1,0,0,0,M,NA,1841,NA,1913655,BRA-1902,A2.9-1963,140,BRA,Rodriguez Alves,15/11/1902,15/11/1906,7/7/1848,1919,11/15/02,11/15/06,0,1,0,0,0,M,1848-07-07,1848,NA,1919656,BRA-1906,A2.9-1966,140,BRA,Moreira Penna,15/11/1906,14/06/1909,30/11/1847,1909,11/15/06,6/14/09,0,2,0,0,-777,M,1847-11-30,1847,NA,1909657,BRA-1909,A2.9-1969,140,BRA,Pecanha,14/06/1909,15/11/1910,2/10/1867,1924,6/14/09,11/15/10,0,1,0,0,0,M,1867-10-02,1867,NA,1924658,BRA-1910,A2.9-1972,140,BRA,H. R. da Fonseca,15/11/1910,15/11/1914,12/5/1885,1923,11/15/10,11/15/14,0,1,0,0,0,M,1885-05-12,1885,NA,1923659,BRA-1914,A2.9-1975,140,BRA,Braz Pereira Gomez,15/11/1914,15/11/1918,26/2/1868,1966,11/15/14,11/15/18,0,1,0,0,0,M,1868-02-26,1868,NA,1966660,BRA-1918,A2.9-1978,140,BRA,da Costa Ribeiro,15/11/1918,28/07/1919,7/11/1868,1/7/20,11/15/18,7/28/19,0,1,0,0,0,M,1868-11-07,1868,7/1/20,1920661,BRA-1919,A2.9-1981,140,BRA,de Silva Pessoa,28/07/1919,15/11/1922,23/5/1865,1942,7/28/19,11/15/22,0,1,0,0,0,M,1865-05-23,1865,NA,1942662,BRA-1922,A2.9-1984,140,BRA,de Silva Bernar,15/11/1922,15/11/1926,8/8/1875,1955,11/15/22,11/15/26,0,1,0,0,1,M,1875-08-08,1875,NA,1955663,BRA-1926,A2.9-1987,140,BRA,de Souza,15/11/1926,24/10/1930,26/10/1870,4/8/57,11/15/26,10/24/30,0,3,6,0,2,M,1870-10-26,1870,8/4/57,1957664,BRA-1930,A2.9-1990,140,BRA,Vargas,25/10/1930,30/10/1945,19/4/1883,24/08/1954,10/25/30,10/30/45,1,3,6,0,0,M,1883-04-19,1883,8/24/54,1954665,BRA-1945,A2.9-1993,140,BRA,Linhares,30/10/1945,31/01/1946,28/1/1886,1957,10/30/45,1/31/46,0,1,0,0,0,M,1886-01-28,1886,NA,1957666,BRA-1946,A2.9-1996,140,BRA,Dutra,31/01/1946,31/01/1951,18/5/1885,11/6/74,1/31/46,1/31/51,0,1,0,0,0,M,1885-05-18,1885,6/11/74,1974667,BRA-1951,A2.9-1999,140,BRA,Vargas,10/2/51,24/08/1954,19/4/1883,24/08/1954,2/10/51,8/24/54,0,3,6,1,3.1,M,1883-04-19,1883,8/24/54,1954668,BRA-1954,A2.9-2002,140,BRA,Cafe Filho,24/08/1954,8/11/55,3/2/1899,1970,8/24/54,11/8/55,0,2.1,0,0,2,M,1899-02-03,1899,NA,1970669,BRA-1955-1,A2.9-2005,140,BRA,Coimbra da Luz,8/11/55,11/11/55,1894,1961,11/8/55,11/11/55,0,3,6,0,2,M,NA,1894,NA,1961670,BRA-1955-2,A2.9-2008,140,BRA,Oliveria Ramos,11/11/55,31/01/1956,1889,1958,11/11/55,1/31/56,0,1,0,0,0,M,NA,1889,NA,1958671,BRA-1956,A2.9-2011,140,BRA,Kubitschek,31/01/1956,31/01/1961,12/9/02,22/08/1976,1/31/56,1/31/61,0,1,0,0,0,M,9/12/02,1902,8/22/76,1976672,BRA-1961-1,A2.9-2014,140,BRA,Quadros,31/01/1961,25/08/1961,25/1/1917,16/02/1992,1/31/61,8/25/61,0,1,0,0,1,M,1/25/17,1917,2/16/92,1992673,BRA-1961-2,A2.9-2017,140,BRA,Ranieri Mazzilli,25/08/1961,7/9/61,1910,1975,8/25/61,9/7/61,0,1,0,0,0,M,NA,1910,NA,1975674,BRA-1961-3,A2.9-2020,140,BRA,Goulart,7/9/61,2/4/64,1/3/18,6/12/76,9/7/61,4/2/64,0,3,6,0,1,M,3/1/18,1918,12/6/76,1976675,BRA-1964-1,A2.9-2023,140,BRA,Ranieri Mazzilli,2/4/64,15/04/1964,1910,1975,4/2/64,4/15/64,0,1,0,1,0,M,NA,1910,NA,1975676,BRA-1964-2,A2.9-2026,140,BRA,Castello Branco,15/04/1964,15/03/1967,20/9/1900,1967,4/15/64,3/15/67,1,1,0,0,-777,M,9/20/00,1900,NA,1967677,BRA-1967,A2.9-2029,140,BRA,Costa de Silva,15/03/1967,1/9/69,3/10/02,1969,3/15/67,9/1/69,0,2.1,0,0,-777,M,10/3/02,1902,NA,1969678,BRA-1969-1,A2.9-2032,140,BRA,Military Junta,1/9/69,25/10/1969,-999,-999,9/1/69,10/25/69,1,1,0,0,0,M,NA,NA,NA,NA679,BRA-1969-2,A2.9-2035,140,BRA,Medici,25/10/1969,15/03/1974,4/12/05,9/10/85,10/25/69,3/15/74,1,1,0,0,0,M,12/4/05,1905,10/9/85,1985680,BRA-1974,A2.9-2038,140,BRA,Geisel,15/03/1974,15/03/1979,3/8/07,12/9/96,3/15/74,3/15/79,0,1,0,0,0,M,8/3/07,1907,9/12/96,1996681,BRA-1979,A2.9-2041,140,BRA,Figueiredo,15/03/1979,21/03/1985,15/1/1918,24/12/1999,3/15/79,3/21/85,0,1,0,0,0,M,1/15/18,1918,12/24/99,1999682,BRA-1985,A2.9-2044,140,BRA,Sarnay,21/03/1985,15/03/1990,30/4/1930,-777,3/21/85,3/15/90,0,1,0,0,0,M,4/30/30,1930,NA,-777683,BRA-1990,A2.9-2047,140,BRA,Mello,15/03/1990,2/10/92,12/8/49,-777,3/15/90,10/2/92,0,1,0,0,0,M,8/12/49,1949,NA,-777684,BRA-1992,A2.9-2050,140,BRA,"Franco, Itamar",2/10/92,31/12/1994,28/6/1930,-777,10/2/92,12/31/94,0,1,0,0,0,M,6/28/30,1930,NA,-777685,BRA-1995,A2.9-2053,140,BRA,Cardoso,1/1/95,1/1/03,18/6/1931,-777,1/1/95,1/1/03,0,1,0,0,0,M,6/18/31,1931,NA,-777686,BRA-2003,A2.9-2056,140,BRA,Lula da Silva,1/1/03,31/12/2004,1945,-777,1/1/03,12/31/04,0,-888,0,0,-888,M,NA,1945,NA,-777687,BOL-1874,A2.9-2059,145,BOL,Frias,14/02/1874,04/05/1876,21/12/1804,1884,1874-02-14,1876-05-04,0,3,-999,1,2,M,1804-12-21,1804,NA,1884688,BOL-1876,A2.9-2062,145,BOL,Daza,04/05/1876,27/12/1879,14/1/1840,1893,1876-05-04,1879-12-27,1,3,-999,0,1,M,1840-01-14,1840,NA,1893689,BOL-1880,A2.9-2065,145,BOL,Campero,19/01/1880,15/08/1884,28/10/1813,1896,1880-01-19,1884-08-15,1,1,0,0,0,M,1813-10-28,1813,NA,1896690,BOL-1884,A2.9-2068,145,BOL,Pacheco,15/08/1884,15/08/1888,4/7/1823,1899,1884-08-15,1888-08-15,0,1,0,0,0,M,1823-07-04,1823,NA,1899691,BOL-1888,A2.9-2071,145,BOL,Arce,15/08/1888,01/08/1892,17/4/1824,1906,1888-08-15,1892-08-01,0,1,0,0,0,M,1824-04-17,1824,NA,1906692,BOL-1892,A2.9-2074,145,BOL,Baptista,06/08/1892,15/08/1896,16/7/1832,1907,1892-08-06,1896-08-15,0,1,0,0,0,M,1832-07-16,1832,NA,1907693,BOL-1896,A2.9-2077,145,BOL,Fernandez Alonso,15/08/1896,06/10/1899,15/8/1849,1925,1896-08-15,1899-10-06,0,3,-999,0,1,M,1849-08-15,1849,NA,1925694,BOL-1899,A2.9-2080,145,BOL,Jose Manuel Pando,06/10/1899,4/8/04,25/12/1848,1917,1899-10-06,8/4/04,1,1,0,0,0,M,1848-12-25,1848,NA,1917695,BOL-1904,A2.9-2083,145,BOL,Montes,14/08/1904,24/10/1909,5/10/1861,1933,8/14/04,10/24/09,0,1,0,0,0,M,1861-10-05,1861,NA,1933696,BOL-1909,A2.9-2086,145,BOL,Villazon,24/10/1909,15/08/1913,22/1/1848,1939,10/24/09,8/15/13,0,1,0,0,0,M,1848-01-22,1848,NA,1939697,BOL-1913,A2.9-2089,145,BOL,Montes,15/08/1913,15/08/1917,5/10/1861,1933,8/15/13,8/15/17,0,1,0,1,0,M,1861-10-05,1861,NA,1933698,BOL-1917,A2.9-2092,145,BOL,Gutierrez Guerra,15/08/1917,11/7/20,5/9/1869,1929,8/15/17,7/11/20,0,3,8,0,1,M,1869-09-05,1869,NA,1929699,BOL-1920,A2.9-2095,145,BOL,Saavedra,11/7/20,3/9/25,30/8/1870,1939,7/11/20,9/3/25,1,1,0,0,0,M,1870-08-30,1870,NA,1939700,BOL-1925,A2.9-2098,145,BOL,Felipe Guzman,3/9/25,10/1/26,1879,1932,9/3/25,1/10/26,0,1,0,0,-666,M,NA,1879,NA,1932701,BOL-1926,A2.9-2101,145,BOL,Siles,10/1/26,25/06/1930,1905,1942,1/10/26,6/25/30,0,3,6,0,1,M,NA,1905,NA,1942702,BOL-1930,A2.9-2104,145,BOL,Blanco Galindo,25/06/1930,5/3/31,12/3/1882,1943,6/25/30,3/5/31,1,1,0,0,0,M,1882-03-12,1882,NA,1943703,BOL-1931,A2.9-2107,145,BOL,Salamanca,5/3/31,28/11/1934,8/7/1868,17/7/1935,3/5/31,11/28/34,0,3,6,0,2,M,1868-07-08,1868,7/17/35,1935704,BOL-1934,A2.9-2110,145,BOL,Tejada Sorzano,28/11/1934,18/05/1936,12/1/1882,4/10/38,11/28/34,5/18/36,0,3,6,0,1,M,1882-01-12,1882,10/4/38,1938705,BOL-1936,A2.9-2113,145,BOL,Toro,18/05/1936,13/07/1937,24/6/1898,1977,5/18/36,7/13/37,1,3,16,0,1,M,1898-06-24,1898,NA,1977706,BOL-1937,A2.9-2116,145,BOL,"Busch, G.",13/07/1937,23/08/1939,23/3/1903,23/08/1939,7/13/37,8/23/39,1,2.2,0,0,-777,M,3/23/03,1903,8/23/39,1939707,BOL-1939,A2.9-2119,145,BOL,Quintanila,23/08/1939,15/04/1940,1888,1964,8/23/39,4/15/40,1,1,0,0,0,M,NA,1888,NA,1964708,BOL-1940,A2.9-2122,145,BOL,Penaranda,15/04/1940,20/12/1943,17/11/1891,1969,4/15/40,12/20/43,0,3,6,0,2,M,1891-11-17,1891,NA,1969709,BOL-1943,A2.9-2125,145,BOL,Villarroel,20/12/1943,21/07/1946,1908,1946,12/20/43,7/21/46,1,3,2,0,3,M,NA,1908,NA,1946710,BOL-1946-1,A2.9-2128,145,BOL,Guillen,21/07/1946,16/08/1946,1890,1966,7/21/46,8/16/46,1,1,0,0,0,M,NA,1890,NA,1966711,BOL-1946-2,A2.9-2131,145,BOL,Gutierrez,16/08/1946,10/3/47,1884,1954,8/16/46,3/10/47,0,1,0,0,0,M,NA,1884,NA,1954712,BOL-1947,A2.9-2134,145,BOL,Herzog,11/3/47,7/5/49,1896,1980,3/11/47,5/7/49,0,2.1,0,0,0,M,NA,1896,NA,1980713,BOL-1949,A2.9-2137,145,BOL,Urriolagoitia,7/5/49,16/05/1951,1894,4/6/74,5/7/49,5/16/51,0,3,6,0,1,M,NA,1894,6/4/74,1974714,BOL-1951,A2.9-2140,145,BOL,Ballivian Rojas,16/05/1951,11/4/52,1902,1993,5/16/51,4/11/52,1,3,4,0,1,M,NA,1902,NA,1993715,BOL-1952-1,A2.9-2143,145,BOL,Siles Zuazo,11/4/52,16/04/1952,1914,6/8/96,4/11/52,4/16/52,1,1,0,0,0,M,NA,1914,8/6/96,1996716,BOL-1952-2,A2.9-2146,145,BOL,Paz Estenssoro,17/04/1952,17/06/1956,2/10/07,7/6/01,4/17/52,6/17/56,0,1,0,0,0,M,10/2/07,1907,6/7/01,2001717,BOL-1956,A2.9-2149,145,BOL,Siles Zuazo,17/06/1956,6/8/60,19/3/1914,6/8/96,6/17/56,8/6/60,0,1,0,1,0,M,3/19/14,1914,8/6/96,1996718,BOL-1960,A2.9-2152,145,BOL,Paz Estenssoro,6/8/60,4/11/64,2/10/07,7/6/01,8/6/60,11/4/64,0,3,6,1,1,M,10/2/07,1907,6/7/01,2001719,BOL-1964,A2.9-2155,145,BOL,Barrientos Ortuna,6/11/64,5/1/66,30/5/1919,1969,11/6/64,1/5/66,1,1,0,0,0,M,5/30/19,1919,NA,1969720,BOL-1966-1,A2.9-2158,145,BOL,Ovando Candia,5/1/66,6/8/66,6/4/18,24/01/1982,1/5/66,8/6/66,0,1,0,0,0,M,4/6/18,1918,1/24/82,1982721,BOL-1966-2,A2.9-2161,145,BOL,Barrientos Ortuna,6/8/66,27/04/1969,30/5/1919,1969,8/6/66,4/27/69,0,2,0,1,-777,M,5/30/19,1919,NA,1969722,BOL-1969-1,A2.9-2164,145,BOL,Siles Salinas,27/04/1969,26/09/1969,1925,2005,4/27/69,9/26/69,0,3,6,0,1,M,NA,1925,NA,2005723,BOL-1969-2,A2.9-2167,145,BOL,Ovando Candia,26/09/1969,6/10/70,6/4/18,24/01/1982,9/26/69,10/6/70,1,3,6,1,1,M,4/6/18,1918,1/24/82,1982724,BOL-1970,A2.9-2170,145,BOL,Torres,7/10/70,22/08/1971,5/3/21,1976,10/7/70,8/22/71,1,3,6,0,1,M,3/5/21,1921,NA,1976725,BOL-1971,A2.9-2173,145,BOL,Banzer Suarez,22/08/1971,21/07/1978,10/7/26,5/5/02,8/22/71,7/21/78,1,3,6,0,1,M,7/10/26,1926,5/5/02,2002726,BOL-1978-1,A2.9-2176,145,BOL,Pereda Asbun,21/07/1978,24/11/1978,1932,-777,7/21/78,11/24/78,1,3,6,0,1,M,NA,1932,NA,-777727,BOL-1978-2,A2.9-2179,145,BOL,Padilla Aranciba,24/11/1978,8/8/79,1927,-777,11/24/78,8/8/79,1,1,0,0,0,M,NA,1927,NA,-777728,BOL-1979-1,A2.9-2182,145,BOL,Guevara Arze,8/8/79,1/11/79,11/3/11,1996,8/8/79,11/1/79,0,3,6,0,0,M,3/11/11,1911,NA,1996729,BOL-1979-2,A2.9-2185,145,BOL,Natusch Busch,1/11/79,16/11/1979,1927,1994,11/1/79,11/16/79,1,1,0,0,1,M,NA,1927,NA,1994730,BOL-1979-3,A2.9-2188,145,BOL,Gueiler Tejada,16/11/1979,17/07/1980,1925,-777,11/16/79,7/17/80,0,3,7,0,1,F,NA,1925,NA,-777731,BOL-1980,A2.9-2191,145,BOL,Garcia Meza Tejada,18/07/1980,4/8/81,8/8/32,-777,7/18/80,8/4/81,1,3,6,0,1,M,8/8/32,1932,NA,-777732,BOL-1981,A2.9-2194,145,BOL,Torrelio Villa,5/8/81,19/07/1982,3/6/33,1999,8/5/81,7/19/82,1,3,16,0,1,M,6/3/33,1933,NA,1999733,BOL-1982-1,A2.9-2197,145,BOL,Vildoso Calderon,21/07/1982,10/10/82,1937,-777,7/21/82,10/10/82,1,1,0,0,0,M,NA,1937,NA,-777734,BOL-1982-2,A2.9-2200,145,BOL,Siles Zuazo,10/10/82,6/8/85,19/3/1914,6/8/96,10/10/82,8/6/85,1,1,0,2,0,M,3/19/14,1914,8/6/96,1996735,BOL-1985,A2.9-2203,145,BOL,Paz Estenssoro,6/8/85,6/8/89,2/10/07,7/6/01,8/6/85,8/6/89,0,1,0,2,0,M,10/2/07,1907,6/7/01,2001736,BOL-1989,A2.9-2206,145,BOL,Paz Zamora,6/8/89,6/8/93,15/4/1939,-777,8/6/89,8/6/93,0,1,0,0,0,M,4/15/39,1939,NA,-777737,BOL-1993,A2.9-2209,145,BOL,Gonzalo Sanchez de Lozada,6/8/93,6/8/97,1930,-777,8/6/93,8/6/97,0,1,0,0,0,M,NA,1930,NA,-777738,BOL-1997,A2.9-2212,145,BOL,Banzer Suarez,6/8/97,7/8/01,10/7/26,5/5/02,8/6/97,8/7/01,0,2.1,0,1,-777,M,7/10/26,1926,5/5/02,2002739,BOL-2001,A2.9-2215,145,BOL,Jorge Quiroga Ramirez,7/8/01,6/8/02,1960,-777,8/7/01,8/6/02,0,1,0,0,0,M,NA,1960,NA,-777740,BOL-2002,A2.9-2218,145,BOL,Gonzalo Sanchez de Lozada,8/8/02,17/10/2003,1930,-777,8/8/02,10/17/03,0,1,0,1,1,M,NA,1930,NA,-777741,BOL-2003,A2.9-2221,145,BOL,Carlos Mesa,17/10/2003,31/12/2004,12/8/53,-777,10/17/03,12/31/04,0,-888,0,0,-888,M,8/12/53,1953,NA,-777742,PAR-1874,A2.9-2224,150,PAR,Gill,25/11/1874,12/04/1877,1840,1877,1874-11-25,1877-04-12,1,3,-999,0,3,M,NA,1840,NA,1877743,PAR-1877,A2.9-2227,150,PAR,Uriarte,12/04/1877,25/11/1878,1843,1909,1877-04-12,1878-11-25,0,1,0,0,-666,M,NA,1843,NA,1909744,PAR-1878,A2.9-2230,150,PAR,Barreiro,27/11/1878,04/09/1880,1833,1880,1878-11-27,1880-09-04,0,2,0,0,-777,M,NA,1833,NA,1880745,PAR-1880,A2.9-2233,150,PAR,Caballero,04/09/1880,25/11/1886,1839,1912,1880-09-04,1886-11-25,1,1,0,0,0,M,NA,1839,NA,1912746,PAR-1886,A2.9-2236,150,PAR,Escobar,25/11/1886,25/11/1890,1843,1912,1886-11-25,1890-11-25,0,1,0,0,0,M,NA,1843,NA,1912747,PAR-1890,A2.9-2239,150,PAR,Gonzalez,25/11/1890,09/06/1894,1851,1912,1890-11-25,1894-06-09,0,3,-999,0,1,M,NA,1851,NA,1912748,PAR-1894-1,A2.9-2242,150,PAR,Morinigo,09/06/1894,25/11/1894,1848,1901,1894-06-09,1894-11-25,1,1,0,0,-666,M,NA,1848,NA,1901749,PAR-1894-2,A2.9-2245,150,PAR,Egusquiza,25/11/1894,25/11/1898,1845,1902,1894-11-25,1898-11-25,0,1,0,0,-666,M,NA,1845,NA,1902750,PAR-1898,A2.9-2248,150,PAR,Aceval,25/11/1898,9/1/02,1854,1931,1898-11-25,1/9/02,0,3,-999,0,2,M,NA,1854,NA,1931751,PAR-1902-1,A2.9-2251,150,PAR,Carvallo,9/1/02,25/08/1902,1862,1934,1/9/02,8/25/02,0,1,0,0,-666,M,NA,1862,NA,1934752,PAR-1902-2,A2.9-2254,150,PAR,Escurra,25/08/1902,19/12/1904,1859,1929,8/25/02,12/19/04,0,3,-999,0,1,M,NA,1859,NA,1929753,PAR-1904,A2.9-2257,150,PAR,Gaona,19/12/1904,8/12/05,1846,1932,12/19/04,12/8/05,1,3,-999,0,-666,M,NA,1846,NA,1932754,PAR-1905,A2.9-2260,150,PAR,Baez,8/12/05,25/11/1906,1/2/1862,1941,12/8/05,11/25/06,1,1,0,0,0,M,1862-02-01,1862,NA,1941755,PAR-1906,A2.9-2263,150,PAR,Ferreira,25/11/1906,4/7/08,18/2/1840,1920,11/25/06,7/4/08,1,3,-999,0,1,M,1840-02-18,1840,NA,1920756,PAR-1908,A2.9-2266,150,PAR,Gonzales Navero,5/7/08,25/11/1910,1861,1934,7/5/08,11/25/10,1,1,0,0,0,M,NA,1861,NA,1934757,PAR-1910,A2.9-2269,150,PAR,Gondra,25/11/1910,17/01/1911,1/1/1871,1927,11/25/10,1/17/11,0,3,-999,0,0,M,1871-01-01,1871,NA,1927758,PAR-1911-1,A2.9-2272,150,PAR,Jara,19/01/1911,5/7/11,1877,1912,1/19/11,7/5/11,1,3,-999,0,3,M,NA,1877,NA,1912759,PAR-1911-2,A2.9-2275,150,PAR,Rojas,5/7/11,1/3/12,1870,1922,7/5/11,3/1/12,0,3,-999,0,1,M,NA,1870,NA,1922760,PAR-1912-1,A2.9-2278,150,PAR,Pena,1/3/12,25/03/1912,1864,1943,3/1/12,3/25/12,1,3,-999,0,1,M,NA,1864,NA,1943761,PAR-1912-2,A2.9-2281,150,PAR,Gonzalez Navero,25/03/1912,31/07/1912,1861,1934,3/25/12,7/31/12,1,1,0,1,0,M,NA,1861,NA,1934762,PAR-1912-3,A2.9-2284,150,PAR,Schaerer,15/08/1912,15/08/1916,2/12/1873,1941,8/15/12,8/15/16,0,1,0,0,0,M,1873-12-02,1873,NA,1941763,PAR-1916,A2.9-2287,150,PAR,Manuel Franco,15/08/1916,5/6/19,1871,5/6/19,8/15/16,6/5/19,0,2,0,0,-777,M,NA,1871,6/5/19,1919764,PAR-1919,A2.9-2290,150,PAR,Montero,5/6/19,15/08/1920,12/02/1879,1927,6/5/19,8/15/20,0,1,0,0,-666,M,1879-02-12,1879,NA,1927765,PAR-1920,A2.9-2293,150,PAR,Gondra,15/08/1920,30/10/1921,1/1/1871,1927,8/15/20,10/30/21,0,3,8,1,0,M,1871-01-01,1871,NA,1927766,PAR-1921-1,A2.9-2296,150,PAR,Paiva,31/10/1921,3/11/21,1877,1965,10/31/21,11/3/21,0,1,0,0,0,M,NA,1877,NA,1965767,PAR-1921-2,A2.9-2299,150,PAR,Ayala Eusebio,3/11/21,10/4/23,15/8/1874,1942,11/3/21,4/10/23,1,1,0,0,0,M,1874-08-15,1874,NA,1942768,PAR-1923,A2.9-2302,150,PAR,Ayala Eligio,10/4/23,12/4/24,1880,1930,4/10/23,4/12/24,0,1,0,0,0,M,NA,1880,NA,1930769,PAR-1924-1,A2.9-2305,150,PAR,Riart,12/4/24,15/08/1924,1891,1953,4/12/24,8/15/24,0,1,0,0,0,M,NA,1891,NA,1953770,PAR-1924-2,A2.9-2308,150,PAR,Ayala Eligio,15/08/1924,15/08/1928,1880,1930,8/15/24,8/15/28,0,1,0,1,0,M,NA,1880,NA,1930771,PAR-1928,A2.9-2311,150,PAR,Guggiari,15/08/1928,26/10/1931,17/3/1884,1957,8/15/28,10/26/31,0,1,0,0,0,M,1884-03-17,1884,NA,1957772,PAR-1931,A2.9-2314,150,PAR,Gonzalez Navero,26/10/1931,28/01/1932,1861,1934,10/26/31,1/28/32,0,1,0,2,0,M,NA,1861,NA,1934773,PAR-1932-1,A2.9-2317,150,PAR,Guggiari,28/01/1932,15/08/1932,17/3/1884,1957,1/28/32,8/15/32,0,1,0,1,0,M,1884-03-17,1884,NA,1957774,PAR-1932-2,A2.9-2320,150,PAR,Ayala Eusebio,15/08/1932,19/02/1936,15/8/1874,1942,8/15/32,2/19/36,0,3,6,1,2,M,1874-08-15,1874,NA,1942775,PAR-1936,A2.9-2323,150,PAR,Rafael Franco,19/02/1936,16/08/1937,1897,1973,2/19/36,8/16/37,1,3,6,0,1,M,NA,1897,NA,1973776,PAR-1937,A2.9-2326,150,PAR,Paiva,16/08/1937,15/08/1939,1877,1965,8/16/37,8/15/39,1,1,0,1,0,M,NA,1877,NA,1965777,PAR-1939,A2.9-2329,150,PAR,Estigarribia,15/08/1939,5/9/40,21/2/1888,5/9/40,8/15/39,9/5/40,0,2,0,0,-777,M,1888-02-21,1888,9/5/40,1940778,PAR-1940,A2.9-2332,150,PAR,Morinigo,8/9/40,3/6/48,11/1/1897,1983,9/8/40,6/3/48,0,3,8,0,2,M,1897-01-11,1897,NA,1983779,PAR-1948-1,A2.9-2335,150,PAR,Frutos,3/6/48,15/08/1948,1879,1960,6/3/48,8/15/48,1,1,0,0,0,M,NA,1879,NA,1960780,PAR-1948-2,A2.9-2338,150,PAR,Natalicio,15/08/1948,30/01/1949,8/9/1897,1966,8/15/48,1/30/49,0,3,6,0,1,M,1897-09-08,1897,NA,1966781,PAR-1949-1,A2.9-2341,150,PAR,Rolon,30/01/1949,26/02/1949,1903,1954,1/30/49,2/26/49,1,3,8,0,0,M,NA,1903,NA,1954782,PAR-1949-2,A2.9-2344,150,PAR,Molas Lopez,26/02/1949,10/9/49,1901,2/3/54,2/26/49,9/10/49,1,3,8,0,0,M,NA,1901,3/2/54,1954783,PAR-1949-3,A2.9-2347,150,PAR,Chavez,10/9/49,6/5/54,15/02/1882,24/04/1978,9/10/49,5/6/54,1,3,6,0,0,M,1882-02-15,1882,4/24/78,1978784,PAR-1954-1,A2.9-2350,150,PAR,Pareira,6/5/54,11/7/54,1886,1982,5/6/54,7/11/54,0,1,0,0,0,M,NA,1886,NA,1982785,PAR-1954-2,A2.9-2353,150,PAR,Stroessner,11/7/54,3/2/89,3/11/12,2006,7/11/54,2/3/89,1,3,6,0,1,M,11/3/12,1912,NA,2006786,PAR-1989,A2.9-2356,150,PAR,Rodriguez Pedotti,3/2/89,15/08/1993,19/6/1924,1997,2/3/89,8/15/93,1,1,0,0,0,M,6/19/24,1924,NA,1997787,PAR-1993,A2.9-2359,150,PAR,Wasmosy Monti,15/08/1993,15/08/1998,1938,-777,8/15/93,8/15/98,0,1,0,0,0,M,NA,1938,NA,-777788,PAR-1998,A2.9-2362,150,PAR,Cubas Grau,15/08/1998,28/03/1999,1943,-777,8/15/98,3/28/99,0,1,0,0,1,M,NA,1943,NA,-777789,PAR-1999,A2.9-2365,150,PAR,Gonzalez Macchi,28/03/1999,15/08/2003,1947,-777,3/28/99,8/15/03,0,1,0,0,-888,M,NA,1947,NA,-777790,PAR-2003,A2.9-2368,150,PAR,Nicanor Duarte Frutos,15/08/2003,31/12/2004,11/10/56,-777,8/15/03,12/31/04,0,-888,0,0,-888,M,10/11/56,1956,NA,-777791,CHL-1871,A2.9-2371,155,CHL,F.  Errazuriz Zanartu,18/09/1871,18/09/1876,25/4/1825,1877,1871-09-18,1876-09-18,0,1,0,0,0,M,1825-04-25,1825,NA,1877792,CHL-1876,A2.9-2374,155,CHL,Pinto,18/09/1876,18/09/1881,15/3/1825,1884,1876-09-18,1881-09-18,0,1,0,0,0,M,1825-03-15,1825,NA,1884793,CHL-1881,A2.9-2377,155,CHL,Santa Maria,18/09/1881,18/09/1886,4/8/1825,1889,1881-09-18,1886-09-18,0,1,0,0,0,M,1825-08-04,1825,NA,1889794,CHL-1886,A2.9-2380,155,CHL,Balmaceda,18/09/1886,28/08/1891,19/7/1840,1891,1886-09-18,1891-08-28,0,3,-999,0,1,M,1840-07-19,1840,NA,1891795,CHL-1891,A2.9-2383,155,CHL,J. Montt-Alvarez,31/08/1891,18/09/1896,1845,1922,1891-08-31,1896-09-18,1,1,0,0,0,M,NA,1845,NA,1922796,CHL-1896,A2.9-2386,155,CHL,F. Errazuriz Echaurren,18/09/1896,1/5/01,16/9/1850,1901,1896-09-18,5/1/01,0,2.1,0,0,-777,M,1850-09-16,1850,NA,1901797,CHL-1901-1,A2.9-2389,155,CHL,A. Zanartu Zanartu,1/5/01,18/08/1901,1847,1902,5/1/01,8/18/01,0,1,0,0,-777,M,NA,1847,NA,1902798,CHL-1901-2,A2.9-2392,155,CHL,Riesco Errazuriz,18/08/1901,18/09/1906,18/5/1854,1916,8/18/01,9/18/06,0,1,0,0,0,M,1854-05-18,1854,NA,1916799,CHL-1906,A2.9-2395,155,CHL,P. Montt,18/09/1906,16/08/1910,29/6/1848,1910,9/18/06,8/16/10,0,2,0,0,-777,M,1848-06-29,1848,NA,1910800,CHL-1910-1,A2.9-2398,155,CHL,Albano,16/08/1910,6/9/10,1845,1910,8/16/10,9/6/10,0,2,0,0,-777,M,NA,1845,NA,1910801,CHL-1910-2,A2.9-2401,155,CHL,Figueroa Larrain,6/9/10,18/09/1911,1866,1931,9/6/10,9/18/11,0,1,0,0,0,M,NA,1866,NA,1931802,CHL-1911,A2.9-2404,155,CHL,Lucco,18/09/1911,23/12/1915,1835,1919,9/18/11,12/23/15,0,1,0,0,0,M,NA,1835,NA,1919803,CHL-1915,A2.9-2407,155,CHL,Sanfuentes,23/12/1915,23/12/1920,27/12/1858,1930,12/23/15,12/23/20,0,1,0,0,0,M,1858-12-27,1858,NA,1930804,CHL-1920,A2.9-2410,155,CHL,Alessandri y Palma,23/12/1920,8/9/24,20/12/1868,24/08/1950,12/23/20,9/8/24,0,3,6,0,1,M,1868-12-20,1868,8/24/50,1950805,CHL-1924,A2.9-2413,155,CHL,Altamirano,8/9/24,23/01/1925,1867,1938,9/8/24,1/23/25,1,3,6,0,2,M,NA,1867,NA,1938806,CHL-1925-1,A2.9-2416,155,CHL,Ibanez del Campo,23/01/1925,21/03/1925,03/11/1877,28/04/1960,1/23/25,3/21/25,1,1,0,0,0,M,1877-11-03,1877,4/28/60,1960807,CHL-1925-2,A2.9-2419,155,CHL,Alessandri y Palma,21/03/1925,1/10/25,20/12/1868,24/08/1950,3/21/25,10/1/25,0,1,0,1,1,M,1868-12-20,1868,8/24/50,1950808,CHL-1925-3,A2.9-2422,155,CHL,Barros Borgono,1/10/25,23/12/1925,1858,1943,10/1/25,12/23/25,0,1,0,0,0,M,NA,1858,NA,1943809,CHL-1925-4,A2.9-2425,155,CHL,Figueroa Larrain,23/12/1925,9/4/27,1866,1931,12/23/25,4/9/27,1,3,6,1,1,M,NA,1866,NA,1931810,CHL-1927,A2.9-2428,155,CHL,Ibanez del Campo,9/4/27,26/07/1931,3/11/1877,28/04/1960,4/9/27,7/26/31,1,1,0,1,1,M,1877-11-03,1877,4/28/60,1960811,CHL-1931-1,A2.9-2431,155,CHL,Opazo Letelier,26/07/1931,27/07/1931,1878,-999,7/26/31,7/27/31,0,1,0,0,0,M,NA,1878,NA,NA812,CHL-1931-2,A2.9-2434,155,CHL,Montero Rodriquez,28/07/1931,17/08/1931,1878,1948,7/28/31,8/17/31,0,1,0,0,0,M,NA,1878,NA,1948813,CHL-1931-3,A2.9-2437,155,CHL,Trucco Franzani,17/08/1931,15/11/1931,1874,-999,8/17/31,11/15/31,0,1,0,0,0,M,NA,1874,NA,NA814,CHL-1931-4,A2.9-2440,155,CHL,Montero Rodriquez,15/11/1931,4/6/32,1878,1948,11/15/31,6/4/32,0,3,6,1,1,M,NA,1878,NA,1948815,CHL-1932-1,A2.9-2443,155,CHL,Davila,5/6/32,12/6/32,5/9/1887,1955,6/5/32,6/12/32,1,3,16,0,1,M,1887-09-05,1887,NA,1955816,CHL-1932-2,A2.9-2446,155,CHL,Grove Vallejo,12/6/32,17/06/1932,6/7/1878,-999,6/12/32,6/17/32,1,3,6,0,2,M,1878-07-06,1878,NA,NA817,CHL-1932-3,A2.9-2449,155,CHL,Davila,17/06/1932,13/09/1932,5/9/1887,1955,6/17/32,9/13/32,1,3,6,1,1,M,1887-09-05,1887,NA,1955818,CHL-1932-4,A2.9-2452,155,CHL,Blanche,13/09/1932,2/10/32,1879,1970,9/13/32,10/2/32,1,1,0,0,0,M,NA,1879,NA,1970819,CHL-1932-5,A2.9-2455,155,CHL,Ovandel Urrutia,2/10/32,25/12/1932,1874,1954,10/2/32,12/25/32,0,1,0,0,0,M,NA,1874,NA,1954820,CHL-1932-6,A2.9-2458,155,CHL,Alessandri y Palma,25/12/1932,24/12/1938,20/12/1868,24/08/1950,12/25/32,12/24/38,0,1,0,2,1,M,1868-12-20,1868,8/24/50,1950821,CHL-1938,A2.9-2461,155,CHL,Aguirre Cerda,24/12/1938,25/11/1941,6/2/1879,25/11/1941,12/24/38,11/25/41,0,2,0,0,-777,M,1879-02-06,1879,11/25/41,1941822,CHL-1941,A2.9-2464,155,CHL,Mendez Arancibia,25/11/1941,1/4/42,1884,1959,11/25/41,4/1/42,0,1,0,0,0,M,NA,1884,NA,1959823,CHL-1942,A2.9-2467,155,CHL,Rios Morales,1/4/42,17/01/1946,10/11/1888,27/6/1946,4/1/42,1/17/46,0,2.1,0,0,-777,M,1888-11-10,1888,6/27/46,1946824,CHL-1946-1,A2.9-2470,155,CHL,Duhalde Vasquez,17/01/1946,3/8/46,1888,1985,1/17/46,8/3/46,0,1,0,0,0,M,NA,1888,NA,1985825,CHL-1946-2,A2.9-2473,155,CHL,Bielech,3/8/46,6/9/46,1895,1977,8/3/46,9/6/46,0,1,0,0,0,M,NA,1895,NA,1977826,CHL-1946-3,A2.9-2476,155,CHL,Duhalde Vasquez,6/9/46,17/10/1946,1888,1985,9/6/46,10/17/46,0,1,0,1,0,M,NA,1888,NA,1985827,CHL-1946-4,A2.9-2479,155,CHL,Iribarren,17/10/1946,3/11/46,1885,-999,10/17/46,11/3/46,0,1,0,0,0,M,NA,1885,NA,NA828,CHL-1946-5,A2.9-2482,155,CHL,Gonzalez Videla,3/11/46,3/11/52,22/11/1898,22/08/1980,11/3/46,11/3/52,0,1,0,0,0,M,1898-11-22,1898,8/22/80,1980829,CHL-1952,A2.9-2485,155,CHL,Ibanez Campo,3/11/52,3/11/58,3/11/1877,28/04/1960,11/3/52,11/3/58,0,1,0,1,0,M,1877-11-03,1877,4/28/60,1960830,CHL-1958,A2.9-2488,155,CHL,Alessandri Rodriguez,3/11/58,3/11/64,19/5/1896,31/08/1986,11/3/58,11/3/64,0,1,0,0,0,M,1896-05-19,1896,8/31/86,1986831,CHL-1964,A2.9-2491,155,CHL,Frei Montalva,3/11/64,3/11/70,16/1/1911,22/01/1982,11/3/64,11/3/70,0,1,0,0,0,M,1/16/11,1911,1/22/82,1982832,CHL-1970,A2.9-2494,155,CHL,Allende,4/11/70,11/9/73,26/7/1908,11/9/73,11/4/70,9/11/73,0,3,6,0,3.1,M,7/26/08,1908,9/11/73,1973833,CHL-1973,A2.9-2497,155,CHL,Pinochet,11/9/73,11/3/90,25/11/1915,10/12/06,9/11/73,3/11/90,1,1,0,0,0,M,11/25/15,1915,12/10/06,2006834,CHL-1990,A2.9-2500,155,CHL,Aylwin,11/3/90,11/3/94,26/11/1918,-777,3/11/90,3/11/94,0,1,0,0,0,M,11/26/18,1918,NA,-777835,CHL-1994,A2.9-2503,155,CHL,Frei Ruiz-Tagle,11/3/94,11/3/00,1942,-777,3/11/94,3/11/00,0,1,0,0,0,M,NA,1942,NA,-777836,CHL-2000,A2.9-2506,155,CHL,Ricardo Lagos Escobar,12/3/00,31/12/2004,1928,-777,3/12/00,12/31/04,0,-888,0,0,-888,M,NA,1928,NA,-777837,ARG-1874,A2.9-2509,160,ARG,Avellanda,12/10/1874,21/09/1880,1/10/1836,1885,1874-10-12,1880-09-21,0,1,0,0,-666,M,1836-10-01,1836,NA,1885838,ARG-1880,A2.9-2512,160,ARG,Roca,21/09/1880,12/10/1886,17/07/1843,1914,1880-09-21,1886-10-12,0,1,0,0,0,M,1843-07-17,1843,NA,1914839,ARG-1886,A2.9-2515,160,ARG,Celman,12/10/1886,05/08/1890,1844,1909,1886-10-12,1890-08-05,0,1,0,0,0,M,NA,1844,NA,1909840,ARG-1890,A2.9-2518,160,ARG,Pellegrini,05/08/1890,12/10/1892,1846,1906,1890-08-05,1892-10-12,0,1,0,0,0,M,NA,1846,NA,1906841,ARG-1892,A2.9-2521,160,ARG,L.S. Pena,12/10/1892,23/01/1895,1822,1907,1892-10-12,1895-01-23,0,1,0,0,-666,M,NA,1822,NA,1907842,ARG-1895,A2.9-2524,160,ARG,J. Evaristo Uriburu,23/01/1895,12/10/1898,19/11/1831,1914,1895-01-23,1898-10-12,0,1,0,0,0,M,1831-11-19,1831,NA,1914843,ARG-1898,A2.9-2527,160,ARG,Roca,12/10/1898,12/10/04,1843,1914,1898-10-12,10/12/04,0,1,0,1,0,M,NA,1843,NA,1914844,ARG-1904,A2.9-2530,160,ARG,Quintana,12/10/04,12/3/06,19/10/1835,1906,10/12/04,3/12/06,0,2,0,0,-777,M,1835-10-19,1835,NA,1906845,ARG-1906,A2.9-2533,160,ARG,Alcorta,12/3/06,12/10/10,20/11/1860,1931,3/12/06,10/12/10,0,1,0,0,0,M,1860-11-20,1860,NA,1931846,ARG-1910,A2.9-2536,160,ARG,R.S. Pena,12/10/10,6/10/13,19/3/1851,1914,10/12/10,10/6/13,0,2.1,0,0,0,M,1851-03-19,1851,NA,1914847,ARG-1913,A2.9-2539,160,ARG,de la Plaza,6/10/13,12/10/16,2/11/1840,1919,10/6/13,10/12/16,0,1,0,0,0,M,1840-11-02,1840,NA,1919848,ARG-1916,A2.9-2542,160,ARG,Irigoyen,12/10/16,12/10/22,12/7/1852,1933,10/12/16,10/12/22,0,1,0,0,0,M,1852-07-12,1852,NA,1933849,ARG-1922,A2.9-2545,160,ARG,de Alvear,12/10/22,12/10/28,4/10/1868,1942,10/12/22,10/12/28,0,1,0,0,0,M,1868-10-04,1868,NA,1942850,ARG-1928,A2.9-2548,160,ARG,Irigoyen,12/10/28,6/9/30,12/7/1852,1933,10/12/28,9/6/30,0,3,6,1,2,M,1852-07-12,1852,NA,1933851,ARG-1930,A2.9-2551,160,ARG,J. Felix Uriburu,6/9/30,20/02/1932,20/7/1868,1932,9/6/30,2/20/32,1,1,0,0,1,M,1868-07-20,1868,NA,1932852,ARG-1932,A2.9-2554,160,ARG,Justo,20/02/1932,20/02/1938,26/2/1876,10/1/43,2/20/32,2/20/38,0,1,0,0,0,M,1876-02-26,1876,1/10/43,1943853,ARG-1938,A2.9-2557,160,ARG,Ortiz,20/02/1938,22/06/1942,24/9/1886,1942,2/20/38,6/22/42,0,2.1,0,0,-777,M,1886-09-24,1886,NA,1942854,ARG-1942,A2.9-2560,160,ARG,Castillo,27/06/1942,5/6/43,20/11/1873,12/10/44,6/27/42,6/5/43,0,3,6,0,0,M,1873-11-20,1873,10/12/44,1944855,ARG-1943-1,A2.9-2563,160,ARG,Rawson,5/6/43,7/6/43,4/6/1885,1952,6/5/43,6/7/43,1,3,16,0,1,M,1885-06-04,1885,NA,1952856,ARG-1943-2,A2.9-2566,160,ARG,Ramirez,7/6/43,24/02/1944,30/1/1884,1962,6/7/43,2/24/44,1,1,0,0,0,M,1884-01-30,1884,NA,1962857,ARG-1944,A2.9-2569,160,ARG,Farrell,10/3/44,4/6/46,12/8/1887,1980,3/10/44,6/4/46,0,1,0,0,0,M,1887-08-12,1887,NA,1980858,ARG-1946,A2.9-2572,160,ARG,Peron,4/6/46,20/09/1955,8/10/1895,1/7/74,6/4/46,9/20/55,0,3,6,0,1,M,1895-10-08,1895,7/1/74,1974859,ARG-1955-1,A2.9-2575,160,ARG,Lonardi,20/09/1955,13/11/1955,15/9/1896,22/3/1956,9/20/55,11/13/55,1,3,6,0,1,M,1896-09-15,1896,3/22/56,1956860,ARG-1955-2,A2.9-2578,160,ARG,Aramburu,13/11/1955,1/5/58,21/5/1903,31/05/1970,11/13/55,5/1/58,1,1,0,0,0,M,5/21/03,1903,5/31/70,1970861,ARG-1958,A2.9-2581,160,ARG,Frondizi,1/5/58,29/03/1962,28/10/1908,18/04/1995,5/1/58,3/29/62,0,3,6,0,2,M,10/28/08,1908,4/18/95,1995862,ARG-1962,A2.9-2584,160,ARG,Guido,29/03/1962,12/10/63,20/8/1910,1975,3/29/62,10/12/63,0,1,0,0,0,M,8/20/10,1910,NA,1975863,ARG-1963,A2.9-2587,160,ARG,Arturo Illia,12/10/63,28/06/1966,4/8/00,18/01/1983,10/12/63,6/28/66,0,3,6,0,0,M,8/4/00,1900,1/18/83,1983864,ARG-1966,A2.9-2590,160,ARG,Ongania,28/06/1966,8/6/70,17/3/1914,8/6/95,6/28/66,6/8/70,1,3,6,0,0,M,3/17/14,1914,6/8/95,1995865,ARG-1970-1,A2.9-2593,160,ARG,Lanusse,8/6/70,18/06/1970,28/8/1918,26/08/1996,6/8/70,6/18/70,1,1,0,0,0,M,8/28/18,1918,8/26/96,1996866,ARG-1970-2,A2.9-2596,160,ARG,Levingston,18/06/1970,22/03/1971,10/1/20,-777,6/18/70,3/22/71,0,3,16,0,2,M,1/10/20,1920,NA,-777867,ARG-1971,A2.9-2599,160,ARG,Lanusse,25/03/1971,25/05/1973,28/8/1918,26/08/1996,3/25/71,5/25/73,1,1,0,1,0,M,8/28/18,1918,8/26/96,1996868,ARG-1973-1,A2.9-2602,160,ARG,Campora,25/05/1973,13/07/1973,26/3/1909,1980,5/25/73,7/13/73,0,1,0,0,0,M,3/26/09,1909,NA,1980869,ARG-1973-2,A2.9-2605,160,ARG,Lastiri,13/07/1973,12/10/73,1915,1978,7/13/73,10/12/73,0,1,0,0,0,M,NA,1915,NA,1978870,ARG-1973-3,A2.9-2608,160,ARG,Peron,12/10/73,1/7/74,8/10/1895,1/7/74,10/12/73,7/1/74,0,2,0,1,-777,M,1895-10-08,1895,7/1/74,1974871,ARG-1974,A2.9-2611,160,ARG,"Peron, Isabel",1/7/74,29/03/1976,4/2/31,-777,7/1/74,3/29/76,0,3,6,0,2,F,2/4/31,1931,NA,-777872,ARG-1976,A2.9-2614,160,ARG,Videla,29/03/1976,29/03/1981,2/8/25,-777,3/29/76,3/29/81,1,1,0,0,0,M,8/2/25,1925,NA,-777873,ARG-1981-1,A2.9-2617,160,ARG,Viola,29/03/1981,20/11/1981,13/10/1924,1994,3/29/81,11/20/81,0,2.1,0,0,0,M,10/13/24,1924,NA,1994874,ARG-1981-2,A2.9-2620,160,ARG,Liendo,20/11/1981,11/12/81,17/12/1924,-999,11/20/81,12/11/81,0,3,16,0,0,M,12/17/24,1924,NA,NA875,ARG-1981-3,A2.9-2623,160,ARG,Galtieri,12/12/81,17/06/1982,15/7/1926,12/1/03,12/12/81,6/17/82,1,3,16,0,2,M,7/15/26,1926,1/12/03,2003876,ARG-1982-1,A2.9-2626,160,ARG,Saint-Jean,18/06/1982,1/7/82,1926,-777,6/18/82,7/1/82,1,1,0,0,0,M,NA,1926,NA,-777877,ARG-1982-2,A2.9-2629,160,ARG,Bignone,1/7/82,10/12/83,21/1/1928,-777,7/1/82,12/10/83,0,1,0,0,2,M,1/21/28,1928,NA,-777878,ARG-1983,A2.9-2632,160,ARG,Alfonsin,10/12/83,8/7/88,13/3/1926,-777,12/10/83,7/8/88,0,1,0,0,0,M,3/13/26,1926,NA,-777879,ARG-1988,A2.9-2635,160,ARG,Menem,8/7/88,10/12/99,2/7/30,-777,7/8/88,12/10/99,0,1,0,0,0,M,7/2/30,1930,NA,-777880,ARG-1999,A2.9-2638,160,ARG,de la Rua,10/12/99,21/12/2001,15/9/1937,-777,12/10/99,12/21/01,0,1,0,0,0,M,9/15/37,1937,NA,-777881,ARG-2001-1,A2.9-2641,160,ARG,Ramon Puerta,21/12/2001,23/12/2001,1951,-777,12/21/01,12/23/01,0,1,0,0,0,M,NA,1951,NA,-777882,ARG-2001-2,A2.9-2644,160,ARG,Adolfo Rodriguez Saa,23/12/2001,1/1/02,1947,-777,12/23/01,1/1/02,0,1,0,0,0,M,NA,1947,NA,-777883,ARG-2002,A2.9-2647,160,ARG,Eduardo Duhalde,2/1/02,25/05/2003,5/10/41,-777,1/2/02,5/25/03,0,1,0,0,0,M,10/5/41,1941,NA,-777884,ARG-2003,A2.9-2650,160,ARG,Nestor Kirchner,25/05/2003,31/12/2004,1950,-777,5/25/03,12/31/04,0,-888,0,0,-888,M,NA,1950,NA,-777885,URU-1873,A2.9-2653,165,URU,Jose Eugenio Ellauri,15/02/1873,15/01/1875,1834,1894,1873-02-15,1875-01-15,0,3,-999,0,1,M,NA,1834,NA,1894886,URU-1875,A2.9-2656,165,URU,Pedro Varela Olivera,15/01/1875,10/03/1876,1837,1903,1875-01-15,1876-03-10,1,3,-999,1,1,M,NA,1837,NA,1903887,URU-1876,A2.9-2659,165,URU,Lorenzo Latorre,10/03/1876,14/02/1879,1844,1916,1876-03-10,1879-02-14,1,1,0,0,0,M,NA,1844,NA,1916888,URU-1879-1,A2.9-2662,165,URU,Francisco Antonino Vidal,14/02/1879,01/03/1879,1827,1891,1879-02-14,1879-03-01,0,1,0,0,0,M,NA,1827,NA,1891889,URU-1879-2,A2.9-2665,165,URU,Lorenzo Latorre,01/03/1879,15/03/1880,1844,1916,1879-03-01,1880-03-15,0,1,0,1,1,M,NA,1844,NA,1916890,URU-1880,A2.9-2668,165,URU,Francisco Antonino Vidal,15/03/1880,28/02/1882,1827,1891,1880-03-15,1882-02-28,0,3,-999,1,0,M,NA,1827,NA,1891891,URU-1882,A2.9-2671,165,URU,Maximo Santos,01/03/1882,01/03/1886,1847,1889,1882-03-01,1886-03-01,1,1,0,0,0,M,NA,1847,NA,1889892,URU-1886-1,A2.9-2674,165,URU,Francisco Antonino Vidal,01/03/1886,24/05/1886,1827,1891,1886-03-01,1886-05-24,0,3,-999,2,-666,M,NA,1827,NA,1891893,URU-1886-2,A2.9-2677,165,URU,Maximo Santos,24/05/1886,18/11/1886,1847,1889,1886-05-24,1886-11-18,0,1,0,1,1,M,NA,1847,NA,1889894,URU-1886-3,A2.9-2680,165,URU,Maximo Tajes,18/11/1886,01/03/1890,1852,1912,1886-11-18,1890-03-01,0,1,0,0,0,M,NA,1852,NA,1912895,URU-1890,A2.9-2683,165,URU,Julio Herrera y Obes,01/03/1890,01/03/1894,1841,1912,1890-03-01,1894-03-01,0,1,0,0,0,M,NA,1841,NA,1912896,URU-1894,A2.9-2686,165,URU,Juan Idiarte Borda,21/03/1894,25/08/1897,1844,1897,1894-03-21,1897-08-25,0,3,-999,0,3,M,NA,1844,NA,1897897,URU-1897,A2.9-2689,165,URU,Juan Lindolfo Cuestas,25/08/1897,1/3/03,6/1/1837,1905,1897-08-25,3/1/03,1,1,0,0,1,M,1837-01-06,1837,NA,1905898,URU-1903,A2.9-2692,165,URU,Jose Batlle y Ordonez,1/3/03,1/3/07,21/5/1856,20/10/1929,3/1/03,3/1/07,0,1,0,0,1,M,1856-05-21,1856,10/20/29,1929899,URU-1907,A2.9-2695,165,URU,Claudio Williman,1/3/07,1/3/11,2/9/1863,1934,3/1/07,3/1/11,0,1,0,0,0,M,1863-09-02,1863,NA,1934900,URU-1911,A2.9-2698,165,URU,Jose Batlle y Ordonez,1/3/11,1/3/15,21/5/1856,20/10/1929,3/1/11,3/1/15,0,1,0,1,0,M,1856-05-21,1856,10/20/29,1929901,URU-1915,A2.9-2701,165,URU,Feliciano Viera,1/3/15,1/3/19,8/11/1872,1927,3/1/15,3/1/19,0,1,0,0,0,M,1872-11-08,1872,NA,1927902,URU-1919,A2.9-2704,165,URU,Baltasar Brum,5/3/19,1/3/23,18/6/1883,31/03/1933,3/5/19,3/1/23,0,1,0,0,0,M,1883-06-18,1883,3/31/33,1933903,URU-1923,A2.9-2707,165,URU,Serrato,1/3/23,1/3/27,30/9/1868,1960,3/1/23,3/1/27,0,1,0,0,0,M,1868-09-30,1868,NA,1960904,URU-1927,A2.9-2710,165,URU,Campisteguy,1/3/27,1/3/31,7/9/1859,1937,3/1/27,3/1/31,0,1,0,0,0,M,1859-09-07,1859,NA,1937905,URU-1931,A2.9-2713,165,URU,Terra,1/3/31,18/06/1938,1873,1942,3/1/31,6/18/38,0,1,0,0,0,M,NA,1873,NA,1942906,URU-1938,A2.9-2716,165,URU,Baldomir,19/06/1938,1/3/43,27/8/1884,25/02/1948,6/19/38,3/1/43,0,1,0,0,0,M,1884-08-27,1884,2/25/48,1948907,URU-1943,A2.9-2719,165,URU,Amezaga,1/3/43,1/3/47,28/1/1881,1974,3/1/43,3/1/47,0,1,0,0,0,M,1881-01-28,1881,NA,1974908,URU-1947-1,A2.9-2722,165,URU,Berreta,1/3/47,1/8/47,22/11/1875,1947,3/1/47,8/1/47,0,2.1,0,0,-777,M,1875-11-22,1875,NA,1947909,URU-1947-2,A2.9-2725,165,URU,Batlle Berres,1/8/47,1/3/51,26/11/1897,15/07/1964,8/1/47,3/1/51,0,1,0,0,0,M,1897-11-26,1897,7/15/64,1964910,URU-1951,A2.9-2728,165,URU,Martinez Trueba,1/3/51,1/3/54,1884,1959,3/1/51,3/1/54,0,1,0,0,0,M,NA,1884,NA,1959911,URU-1954,A2.9-2731,165,URU,Batlle Berres,1/3/54,1/3/56,26/11/1897,15/07/1964,3/1/54,3/1/56,0,1,0,1,0,M,1897-11-26,1897,7/15/64,1964912,URU-1956,A2.9-2734,165,URU,Zubiria,1/3/56,1/3/57,9/10/01,1971,3/1/56,3/1/57,0,1,0,0,0,M,10/9/01,1901,NA,1971913,URU-1957,A2.9-2737,165,URU,Lezama,1/3/57,1/3/58,1899,1964,3/1/57,3/1/58,0,1,0,0,0,M,NA,1899,NA,1964914,URU-1958,A2.9-2740,165,URU,Fisher,1/3/58,1/3/59,1903,1969,3/1/58,3/1/59,0,1,0,0,0,M,NA,1903,NA,1969915,URU-1959,A2.9-2743,165,URU,Echegoyen,2/3/59,1/3/60,1892,1974,3/2/59,3/1/60,0,1,0,0,0,M,NA,1892,NA,1974916,URU-1960,A2.9-2746,165,URU,Nardone,1/3/60,1/3/61,1907,1964,3/1/60,3/1/61,0,1,0,0,0,M,NA,1907,NA,1964917,URU-1961,A2.9-2749,165,URU,Haedo,1/3/61,1/3/62,1898,1970,3/1/61,3/1/62,0,1,0,0,0,M,NA,1898,NA,1970918,URU-1962,A2.9-2752,165,URU,Harrison,1/3/62,1/3/63,1900,1963,3/1/62,3/1/63,0,1,0,0,-777,M,NA,1900,NA,1963919,URU-1963,A2.9-2755,165,URU,Crespo,1/3/63,2/3/64,1901,1964,3/1/63,3/2/64,0,1,0,0,0,M,NA,1901,NA,1964920,URU-1964,A2.9-2758,165,URU,Giannattasio,2/3/64,7/2/65,1895,1965,3/2/64,2/7/65,0,2,0,0,-777,M,NA,1895,NA,1965921,URU-1965,A2.9-2761,165,URU,Beltran,7/2/65,1/3/66,6/4/14,2003,2/7/65,3/1/66,0,1,0,0,0,M,4/6/14,1914,NA,2003922,URU-1966,A2.9-2764,165,URU,Heber Usher,1/3/66,1/3/67,1916,1981,3/1/66,3/1/67,0,1,0,0,0,M,NA,1916,NA,1981923,URU-1967-1,A2.9-2767,165,URU,Gestido,1/3/67,6/12/67,28/11/1901,1967,3/1/67,12/6/67,0,2,0,0,-777,M,11/28/01,1901,NA,1967924,URU-1967-2,A2.9-2770,165,URU,Pacheco Areco,6/12/67,1/3/72,9/4/20,1998,12/6/67,3/1/72,0,1,0,0,0,M,4/9/20,1920,NA,1998925,URU-1972,A2.9-2773,165,URU,Bordaberry,1/3/72,12/6/76,17/6/1928,-777,3/1/72,6/12/76,0,3,6,0,0,M,6/17/28,1928,NA,-777926,URU-1976-1,A2.9-2776,165,URU,Demichelli,12/6/76,1/9/76,1894,1980,6/12/76,9/1/76,1,3,6,0,0,M,NA,1894,NA,1980927,URU-1976-2,A2.9-2779,165,URU,Mendez Manfredini,1/9/76,1/9/81,24/04/1904,26/06/1988,9/1/76,9/1/81,1,1,0,0,0,M,4/24/04,1904,6/26/88,1988928,URU-1981,A2.9-2782,165,URU,Alvarez Armalino,1/9/81,1/3/85,26/11/1925,-777,9/1/81,3/1/85,1,1,0,0,0,M,11/26/25,1925,NA,-777929,URU-1985,A2.9-2785,165,URU,Sanguinetti,1/3/85,1/3/90,6/1/36,-777,3/1/85,3/1/90,0,1,0,0,0,M,1/6/36,1936,NA,-777930,URU-1990,A2.9-2788,165,URU,Lacalle de Herrera,1/3/90,1/3/95,1941,-777,3/1/90,3/1/95,0,1,0,0,0,M,NA,1941,NA,-777931,URU-1995,A2.9-2791,165,URU,Sanguinetti,1/3/95,1/3/00,6/1/36,-777,3/1/95,3/1/00,0,1,0,1,0,M,1/6/36,1936,NA,-777932,URU-2000,A2.9-2794,165,URU,Jorge Batlle,2/3/00,31/12/2004,1927,-777,3/2/00,12/31/04,0,-888,0,0,-888,M,NA,1927,NA,-777933,UKG-1874,A2.9-2797,200,UKG,Disraeli,20/02/1874,18/04/1880,21/11/1804,19/04/1881,1874-02-20,1880-04-18,0,1,0,1,0,M,1804-11-21,1804,1881-04-19,1881934,UKG-1880,A2.9-2800,200,UKG,Gladstone,28/04/1880,09/06/1885,29/12/1809,19/05/1898,1880-04-28,1885-06-09,0,1,0,1,0,M,1809-12-29,1809,1898-05-19,1898935,UKG-1885,A2.9-2803,200,UKG,Salisbury,24/06/1885,26/01/1886,03/02/1830,1903,1885-06-24,1886-01-26,0,2.1,0,0,0,M,1830-02-03,1830,NA,1903936,UKG-1886-1,A2.9-2806,200,UKG,Gladstone,03/02/1886,20/07/1886,29/12/1809,19/05/1898,1886-02-03,1886-07-20,0,1,0,2,0,M,1809-12-29,1809,1898-05-19,1898937,UKG-1886-2,A2.9-2809,200,UKG,Salisbury,03/08/1886,11/08/1892,03/02/1830,1903,1886-08-03,1892-08-11,0,1,0,1,0,M,1830-02-03,1830,NA,1903938,UKG-1892,A2.9-2812,200,UKG,Gladstone,16/08/1892,03/03/1894,29/12/1809,19/05/1898,1892-08-16,1894-03-03,0,1,0,3,0,M,1809-12-29,1809,1898-05-19,1898939,UKG-1894,A2.9-2815,200,UKG,Rosebery,06/03/1894,24/06/1895,07/05/1847,1929,1894-03-06,1895-06-24,0,1,0,0,0,M,1847-05-07,1847,NA,1929940,UKG-1895,A2.9-2818,200,UKG,Salisbury,28/06/1895,11/7/02,03/02/1830,1903,1895-06-28,7/11/02,0,1,0,2,0,M,1830-02-03,1830,NA,1903941,UKG-1902,A2.9-2821,200,UKG,Balfour,12/7/02,4/12/05,25/07/1848,19/03/1930,7/12/02,12/4/05,0,1,0,0,0,M,1848-07-25,1848,3/19/30,1930942,UKG-1905,A2.9-2824,200,UKG,Campbell-Bannerman,10/12/05,6/4/08,07/09/1836,22/04/1908,12/10/05,4/6/08,0,2.1,0,0,-777,M,1836-09-07,1836,4/22/08,1908943,UKG-1908,A2.9-2827,200,UKG,Asquith,6/4/08,5/12/16,12/09/1852,15/02/1928,4/6/08,12/5/16,0,1,0,0,0,M,1852-09-12,1852,2/15/28,1928944,UKG-1916,A2.9-2830,200,UKG,Lloyd-George,10/12/16,19/10/1922,17/11/1863,26/03/1945,12/10/16,10/19/22,0,1,0,0,0,M,1863-11-17,1863,3/26/45,1945945,UKG-1922,A2.9-2833,200,UKG,Bonar Law,24/10/1922,20/05/1923,16/09/1858,30/10/1923,10/24/22,5/20/23,0,2.1,0,0,0,M,1858-09-16,1858,10/30/23,1923946,UKG-1923,A2.9-2836,200,UKG,Baldwin,27/05/1923,22/01/1924,03/08/1867,14/14/1947,5/27/23,1/22/24,0,1,0,0,0,M,1867-08-03,1867,NA,NA947,UKG-1924-1,A2.9-2839,200,UKG,MacDonald,23/01/1924,4/11/24,12/10/1866,9/11/37,1/23/24,11/4/24,0,1,0,0,0,M,1866-10-12,1866,11/9/37,1937948,UKG-1924-2,A2.9-2842,200,UKG,Baldwin,6/11/24,4/6/29,03/08/1867,14/14/1947,11/6/24,6/4/29,0,1,0,1,0,M,1867-08-03,1867,NA,NA949,UKG-1929,A2.9-2845,200,UKG,MacDonald,8/6/29,7/6/35,12/10/1867,9/11/37,6/8/29,6/7/35,0,1,0,1,0,M,1867-10-12,1867,11/9/37,1937950,UKG-1935,A2.9-2848,200,UKG,Baldwin,7/6/35,28/05/1937,03/08/1867,14/14/1947,6/7/35,5/28/37,0,1,0,2,0,M,1867-08-03,1867,NA,NA951,UKG-1937,A2.9-2851,200,UKG,Chamberlin,28/05/1937,10/5/40,18/04/1869,9/11/40,5/28/37,5/10/40,0,1,0,0,0,M,1869-04-18,1869,11/9/40,1940952,UKG-1940,A2.9-2854,200,UKG,Churchill,10/5/40,27/07/1945,30/11/1874,24/01/1965,5/10/40,7/27/45,0,1,0,0,0,M,1874-11-30,1874,1/24/65,1965953,UKG-1945,A2.9-2857,200,UKG,Atlee,27/07/1945,26/10/1951,03/01/1883,8/10/67,7/27/45,10/26/51,0,1,0,0,0,M,1883-01-03,1883,10/8/67,1967954,UKG-1951,A2.9-2860,200,UKG,Churchill,26/10/1951,5/4/55,30/11/1874,24/01/1965,10/26/51,4/5/55,0,1,0,1,0,M,1874-11-30,1874,1/24/65,1965955,UKG-1955,A2.9-2863,200,UKG,Eden,6/4/55,9/1/57,12/06/1897,14/01/1977,4/6/55,1/9/57,0,2.1,0,0,0,M,1897-06-12,1897,1/14/77,1977956,UKG-1957,A2.9-2866,200,UKG,MacMillan,10/1/57,18/10/1963,10/02/1894,29/12/1986,1/10/57,10/18/63,0,1,0,0,0,M,1894-02-10,1894,12/29/86,1986957,UKG-1963,A2.9-2869,200,UKG,Douglas-Home,18/10/1963,16/10/1964,8/3/03,9/10/95,10/18/63,10/16/64,0,1,0,0,0,M,3/8/03,1903,10/9/95,1995958,UKG-1964,A2.9-2872,200,UKG,Wilson,16/10/1964,19/06/1970,11/3/16,1995,10/16/64,6/19/70,0,1,0,0,0,M,3/11/16,1916,NA,1995959,UKG-1970,A2.9-2875,200,UKG,Heath,19/06/1970,4/3/74,9/7/16,17/05/2005,6/19/70,3/4/74,0,1,0,0,0,M,7/9/16,1916,5/17/05,2005960,UKG-1974,A2.9-2878,200,UKG,Wilson,4/3/74,5/4/76,11/3/16,1995,3/4/74,4/5/76,0,1,0,1,0,M,3/11/16,1916,NA,1995961,UKG-1976,A2.9-2881,200,UKG,Callaghan,5/4/76,4/5/79,27/03/1912,26/03/2005,4/5/76,5/4/79,0,1,0,0,0,M,3/27/12,1912,3/26/05,2005962,UKG-1979,A2.9-2884,200,UKG,Thatcher,4/5/79,28/11/1990,13/10/1925,-777,5/4/79,11/28/90,0,1,0,0,0,F,10/13/25,1925,NA,-777963,UKG-1990,A2.9-2887,200,UKG,Major,28/11/1990,2/5/97,29/03/1943,-777,11/28/90,5/2/97,0,1,0,0,0,M,3/29/43,1943,NA,-777964,UKG-1997,A2.9-2890,200,UKG,Blair,2/5/97,31/12/2004,6/5/53,-777,5/2/97,12/31/04,0,-888,0,0,-888,M,5/6/53,1953,NA,-777965,IRE-1919,A2.9-2893,205,IRE,de Valera,1/4/19,5/12/21,14/10/1882,29/08/1975,4/1/19,12/5/21,1,1,0,0,0,M,1882-10-14,1882,8/29/75,1975966,IRE-1922-1,A2.9-2896,205,IRE,Griffith,10/1/22,12/8/22,31/03/1872,12/8/22,1/10/22,8/12/22,0,2,0,0,-777,M,1872-03-31,1872,8/12/22,1922967,IRE-1922-2,A2.9-2899,205,IRE,Collins,12/8/22,22/08/1922,16/10/1890,22/08/1922,8/12/22,8/22/22,0,3,4,0,3,M,1890-10-16,1890,8/22/22,1922968,IRE-1922-3,A2.9-2902,205,IRE,"Cosgrave, W.",9/9/22,9/3/32,06/06/1880,16/11/1965,9/9/22,3/9/32,0,1,0,0,0,M,1880-06-06,1880,11/16/65,1965969,IRE-1932,A2.9-2905,205,IRE,de Valera,9/3/32,18/02/1948,14/10/1882,29/08/1975,3/9/32,2/18/48,0,1,0,1,0,M,1882-10-14,1882,8/29/75,1975970,IRE-1948,A2.9-2908,205,IRE,Costello,18/02/1948,13/06/1951,20/06/1891,5/1/76,2/18/48,6/13/51,0,1,0,0,0,M,1891-06-20,1891,1/5/76,1976971,IRE-1951,A2.9-2911,205,IRE,de Valera,13/06/1951,2/6/54,14/10/1882,29/08/1975,6/13/51,6/2/54,0,1,0,2,0,M,1882-10-14,1882,8/29/75,1975972,IRE-1954,A2.9-2914,205,IRE,Costello,2/6/54,20/03/1957,20/06/1891,5/1/76,6/2/54,3/20/57,0,1,0,1,0,M,1891-06-20,1891,1/5/76,1976973,IRE-1957,A2.9-2917,205,IRE,de Valera,20/03/1957,23/06/1959,14/10/1882,29/08/1975,3/20/57,6/23/59,0,1,0,3,0,M,1882-10-14,1882,8/29/75,1975974,IRE-1959,A2.9-2920,205,IRE,LeMass,23/06/1959,10/11/66,15/07/1899,11/5/71,6/23/59,11/10/66,0,1,0,0,0,M,1899-07-15,1899,5/11/71,1971975,IRE-1966,A2.9-2923,205,IRE,Lynch,10/11/66,14/03/1973,15/08/1917,20/10/1999,11/10/66,3/14/73,0,1,0,0,0,M,8/15/17,1917,10/20/99,1999976,IRE-1973,A2.9-2926,205,IRE,"Cosgrave, L.",14/03/1973,5/7/77,30/04/1920,-777,3/14/73,7/5/77,0,1,0,0,0,M,4/30/20,1920,NA,-777977,IRE-1977,A2.9-2929,205,IRE,Lynch,5/7/77,11/12/79,15/08/1917,20/10/1999,7/5/77,12/11/79,0,1,0,1,0,M,8/15/17,1917,10/20/99,1999978,IRE-1979,A2.9-2932,205,IRE,Haughey,11/12/79,30/06/1981,16/09/1925,13/06/2006,12/11/79,6/30/81,0,1,0,0,0,M,9/16/25,1925,6/13/06,2006979,IRE-1981,A2.9-2935,205,IRE,Fitzgerald,30/06/1981,9/3/82,9/2/26,-777,6/30/81,3/9/82,0,1,0,0,0,M,2/9/26,1926,NA,-777980,IRE-1982-1,A2.9-2938,205,IRE,Haughey,9/3/82,14/12/1982,16/09/1925,13/06/2006,3/9/82,12/14/82,0,1,0,1,0,M,9/16/25,1925,6/13/06,2006981,IRE-1982-2,A2.9-2941,205,IRE,Fitzgerald,14/12/1982,10/3/87,9/2/26,-777,12/14/82,3/10/87,0,1,0,1,0,M,2/9/26,1926,NA,-777982,IRE-1987,A2.9-2944,205,IRE,Haughey,10/3/87,11/2/92,16/09/1925,13/06/2006,3/10/87,2/11/92,0,1,0,2,0,M,9/16/25,1925,6/13/06,2006983,IRE-1992,A2.9-2947,205,IRE,Reynolds,11/2/92,15/12/1994,3/11/35,-777,2/11/92,12/15/94,0,1,0,0,0,M,11/3/35,1935,NA,-777984,IRE-1994,A2.9-2950,205,IRE,Bruton,15/12/1994,26/06/1997,1947,-777,12/15/94,6/26/97,0,1,0,0,0,M,NA,1947,NA,-777985,IRE-1997,A2.9-2953,205,IRE,Ahern,26/06/1997,31/12/2004,1951,-777,6/26/97,12/31/04,0,-888,0,0,-888,M,NA,1951,NA,-777986,NTH-1874,A2.9-2956,210,NTH,"Heemskerk, JA",27/08/1874,03/11/1877,30/07/1818,1897,1874-08-27,1877-11-03,0,1,0,1,0,M,1818-07-30,1818,NA,1897987,NTH-1877,A2.9-2959,210,NTH,Kappeye van de Coppello,03/11/1877,11/08/1879,08/11/1822,1895,1877-11-03,1879-08-11,0,1,0,0,0,M,1822-11-08,1822,NA,1895988,NTH-1879,A2.9-2962,210,NTH,van Lynden,20/08/1879,23/04/1883,04/02/1826,1885,1879-08-20,1883-04-23,0,1,0,0,0,M,1826-02-04,1826,NA,1885989,NTH-1883,A2.9-2965,210,NTH,"Heemskerk, JA",23/04/1883,21/04/1888,30/07/1818,1897,1883-04-23,1888-04-21,0,1,0,2,0,M,1818-07-30,1818,NA,1897990,NTH-1888,A2.9-2968,210,NTH,Mackay,21/04/1888,21/08/1891,1838,1909,1888-04-21,1891-08-21,0,1,0,0,0,M,NA,1838,NA,1909991,NTH-1891,A2.9-2971,210,NTH,van Tienhoven,21/08/1891,07/05/1894,12/02/1841,1914,1891-08-21,1894-05-07,0,1,0,0,0,M,1841-02-12,1841,NA,1914992,NTH-1894,A2.9-2974,210,NTH,Roell,09/05/1894,27/07/1897,21/07/1844,1914,1894-05-09,1897-07-27,0,1,0,0,0,M,1844-07-21,1844,NA,1914993,NTH-1897,A2.9-2977,210,NTH,Pierson,27/07/1897,1/8/01,1839,1909,1897-07-27,8/1/01,0,1,0,0,0,M,NA,1839,NA,1909994,NTH-1901,A2.9-2980,210,NTH,Kuyper,1/8/01,16/08/1905,29/10/1837,1920,8/1/01,8/16/05,0,1,0,0,0,M,1837-10-29,1837,NA,1920995,NTH-1905,A2.9-2983,210,NTH,de Meester,16/08/1905,11/2/08,16/12/1851,1919,8/16/05,2/11/08,0,1,0,0,0,M,1851-12-16,1851,NA,1919996,NTH-1908,A2.9-2986,210,NTH,"Heemskerk, T",12/2/08,25/08/1913,02/07/1852,1932,2/12/08,8/25/13,0,1,0,0,0,M,1852-07-02,1852,NA,1932997,NTH-1913,A2.9-2989,210,NTH,van der Linden,29/08/1913,3/7/18,14/05/1846,1935,8/29/13,7/3/18,0,1,0,0,0,M,1846-05-14,1846,NA,1935998,NTH-1918,A2.9-2992,210,NTH,de Beerenbrouck,9/9/18,30/06/1925,01/12/1873,1936,9/9/18,6/30/25,0,1,0,0,0,M,1873-12-01,1873,NA,1936999,NTH-1925,A2.9-2995,210,NTH,Colijn,4/8/25,8/3/26,22/06/1869,18/09/1944,8/4/25,3/8/26,0,1,0,0,0,M,1869-06-22,1869,9/18/44,19441000,NTH-1926,A2.9-2998,210,NTH,de Geer,8/3/26,2/7/29,14/12/1870,1960,3/8/26,7/2/29,0,1,0,0,0,M,1870-12-14,1870,NA,19601001,NTH-1929,A2.9-3001,210,NTH,de Beerenbrouck,10/8/29,25/04/1933,01/12/1873,1936,8/10/29,4/25/33,0,1,0,1,0,M,1873-12-01,1873,NA,19361002,NTH-1933,A2.9-3004,210,NTH,Colijn,26/05/1933,27/07/1939,22/06/1869,18/09/1944,5/26/33,7/27/39,0,1,0,1,2,M,1869-06-22,1869,9/18/44,19441003,NTH-1939,A2.9-3007,210,NTH,de Geer,10/8/39,14/05/1940,14/12/1870,1960,8/10/39,5/14/40,0,4,9,1,1,M,1870-12-14,1870,NA,19601004,NTH-1945,A2.9-3010,210,NTH,Schermerhorn,24/06/1945,17/05/1946,17/12/1894,1977,6/24/45,5/17/46,0,1,0,0,0,M,1894-12-17,1894,NA,19771005,NTH-1946,A2.9-3013,210,NTH,Beel,3/7/46,7/7/48,12/4/02,1977,7/3/46,7/7/48,0,1,0,0,0,M,4/12/02,1902,NA,19771006,NTH-1948,A2.9-3016,210,NTH,Drees,7/8/48,22/12/1958,05/07/1886,14/05/1988,8/7/48,12/22/58,0,1,0,0,0,M,1886-07-05,1886,5/14/88,19881007,NTH-1958,A2.9-3019,210,NTH,Beel,22/12/1958,19/05/1959,12/4/02,1977,12/22/58,5/19/59,0,1,0,1,0,M,4/12/02,1902,NA,19771008,NTH-1959,A2.9-3022,210,NTH,de Quay,19/05/1959,15/05/1963,26/08/1901,4/7/85,5/19/59,5/15/63,0,1,0,0,0,M,8/26/01,1901,7/4/85,19851009,NTH-1963,A2.9-3025,210,NTH,Marijnen,24/07/1963,26/02/1965,21/02/1917,1975,7/24/63,2/26/65,0,1,0,0,0,M,2/21/17,1917,NA,19751010,NTH-1965,A2.9-3028,210,NTH,Cals,27/04/1965,14/10/1966,18/07/1914,1971,4/27/65,10/14/66,0,1,0,0,0,M,7/18/14,1914,NA,19711011,NTH-1966,A2.9-3031,210,NTH,Zijlstra,22/11/1966,15/02/1967,27/08/1918,2001,11/22/66,2/15/67,0,1,0,0,0,M,8/27/18,1918,NA,20011012,NTH-1967,A2.9-3034,210,NTH,De Jong,3/4/67,29/04/1971,3/4/15,-777,4/3/67,4/29/71,0,1,0,0,0,M,4/3/15,1915,NA,-7771013,NTH-1971,A2.9-3037,210,NTH,Biesheuvel,6/7/71,11/5/73,5/4/20,2001,7/6/71,5/11/73,0,1,0,0,0,M,4/5/20,1920,NA,20011014,NTH-1973,A2.9-3040,210,NTH,den Uyl,11/5/73,19/12/1977,9/8/19,24/12/1987,5/11/73,12/19/77,0,1,0,0,0,M,8/9/19,1919,12/24/87,19871015,NTH-1977,A2.9-3043,210,NTH,van Agt,19/12/1977,4/11/82,2/2/31,-777,12/19/77,11/4/82,0,1,0,0,0,M,2/2/31,1931,NA,-7771016,NTH-1982,A2.9-3046,210,NTH,Lubbers,4/11/82,22/08/1994,7/5/39,-777,11/4/82,8/22/94,0,1,0,0,0,M,5/7/39,1939,NA,-7771017,NTH-1994,A2.9-3049,210,NTH,Kok,22/08/1994,22/07/2002,29/09/1938,-777,8/22/94,7/22/02,0,1,0,0,0,M,9/29/38,1938,NA,-7771018,NTH-2002,A2.9-3052,210,NTH,Jan Peter Balkenende,22/07/2002,31/12/2004,7/5/56,-777,7/22/02,12/31/04,0,-888,0,0,-888,M,5/7/56,1956,NA,-7771019,BEL-1871,A2.9-3055,211,BEL,Jules Malou,07/12/1871,19/06/1878,1810,1886,1871-12-07,1878-06-19,0,1,0,0,0,M,NA,1810,NA,18861020,BEL-1878,A2.9-3058,211,BEL,Walthere Frere-Orban,19/06/1878,16/06/1884,22/04/1812,02/02/1896,1878-06-19,1884-06-16,0,1,0,1,0,M,1812-04-22,1812,1896-02-02,18961021,BEL-1884-1,A2.9-3061,211,BEL,Jules Malou,16/06/1884,26/10/1884,1810,1886,1884-06-16,1884-10-26,0,1,0,1,0,M,NA,1810,NA,18861022,BEL-1884-2,A2.9-3064,211,BEL,Auguste Marie Franaois Beernaert,26/10/1884,26/03/1894,26/07/1829,6/10/12,1884-10-26,1894-03-26,0,1,0,0,0,M,1829-07-26,1829,10/6/12,19121023,BEL-1894,A2.9-3067,211,BEL,Jules Philippe Marie de Burlet,26/03/1894,25/02/1896,10/04/1844,01/03/1897,1894-03-26,1896-02-25,0,1,0,0,-777,M,1844-04-10,1844,1897-03-01,18971024,BEL-1896,A2.9-3070,211,BEL,Paul de Smet de Nayer,25/02/1896,24/01/1899,1843,1913,1896-02-25,1899-01-24,0,1,0,0,0,M,NA,1843,NA,19131025,BEL-1899-1,A2.9-3073,211,BEL,Julius Vandenpeereboom,24/01/1899,05/08/1899,1843,1917,1899-01-24,1899-08-05,0,1,0,0,0,M,NA,1843,NA,19171026,BEL-1899-2,A2.9-3076,211,BEL,Paul de Smet de Nayer,05/08/1899,2/5/07,1843,1913,1899-08-05,5/2/07,0,1,0,1,0,M,NA,1843,NA,19131027,BEL-1907,A2.9-3079,211,BEL,Jules de Trooz,2/5/07,31/12/1907,12/01/1857,1907,5/2/07,12/31/07,0,2,0,0,-777,M,1857-01-12,1857,NA,19071028,BEL-1908,A2.9-3082,211,BEL,Frans Schollaert,9/1/08,17/06/1911,19/08/1851,1917,1/9/08,6/17/11,0,1,0,0,0,M,1851-08-19,1851,NA,19171029,BEL-1911,A2.9-3085,211,BEL,"Charles, baron de Broqueville",17/06/1911,1/8/14,04/12/1860,5/9/40,6/17/11,8/1/14,0,4,-999,0,1,M,1860-12-04,1860,9/5/40,19401030,BEL-1914-1,A2.9-3088,211,BEL,Von der Golt,26/08/1914,27/11/1914,-999,-999,8/26/14,11/27/14,2,1,0,0,0,M,NA,NA,NA,NA1031,BEL-1914-2,A2.9-3091,211,BEL,Von Bissing,27/11/1914,18/04/1917,1844,18/04/1917,11/27/14,4/18/17,0,2,0,0,-777,M,NA,1844,4/18/17,19171032,BEL-1917,A2.9-3094,211,BEL,Von Falkenhausen,18/04/1917,11/11/18,-999,-999,4/18/17,11/11/18,0,4,-999,0,0,M,NA,NA,NA,NA1033,BEL-1918-1,A2.9-3097,211,BEL,Geraard Cooreman,11/11/18,13/11/1918,25/03/1852,1926,11/11/18,11/13/18,0,1,0,0,0,M,1852-03-25,1852,NA,19261034,BEL-1918-2,A2.9-3100,211,BEL,Delacroix,22/11/1918,3/11/20,27/12/1876,15/10/1929,11/22/18,11/3/20,0,1,0,0,0,M,1876-12-27,1876,10/15/29,19291035,BEL-1920,A2.9-3103,211,BEL,de Wiart,18/11/1920,19/11/1921,31/01/1869,6/5/51,11/18/20,11/19/21,0,1,0,0,0,M,1869-01-31,1869,5/6/51,19511036,BEL-1921,A2.9-3106,211,BEL,Theunis,15/12/1921,5/4/25,1873,1944,12/15/21,4/5/25,0,1,0,0,0,M,NA,1873,NA,19441037,BEL-1925-1,A2.9-3109,211,BEL,van der Vyvere,13/05/1925,22/05/1925,1871,1961,5/13/25,5/22/25,0,1,0,0,0,M,NA,1871,NA,19611038,BEL-1925-2,A2.9-3112,211,BEL,Poullet,17/06/1925,6/5/26,1868,1937,6/17/25,5/6/26,0,2.1,0,0,0,M,NA,1868,NA,19371039,BEL-1926,A2.9-3115,211,BEL,Jasper,20/05/1926,21/05/1931,28/07/1870,15/02/1939,5/20/26,5/21/31,0,1,0,0,0,M,1870-07-28,1870,2/15/39,19391040,BEL-1931,A2.9-3118,211,BEL,Renkin,5/6/31,18/10/1932,1862,1934,6/5/31,10/18/32,0,1,0,0,0,M,NA,1862,NA,19341041,BEL-1932,A2.9-3121,211,BEL,"Charles, baron de Broqueville",22/10/1932,13/11/1934,04/12/1860,5/9/40,10/22/32,11/13/34,0,1,0,1,0,M,1860-12-04,1860,9/5/40,19401042,BEL-1934,A2.9-3124,211,BEL,Theunis,19/11/1934,19/03/1935,1873,1944,11/19/34,3/19/35,0,1,0,1,0,M,NA,1873,NA,19441043,BEL-1935,A2.9-3127,211,BEL,van ZeeLand,26/03/1935,25/10/1937,1893,1973,3/26/35,10/25/37,0,1,0,0,0,M,NA,1893,NA,19731044,BEL-1937,A2.9-3130,211,BEL,Janson,24/11/1937,13/05/1938,30/05/1872,3/3/44,11/24/37,5/13/38,0,1,0,0,0,M,1872-05-30,1872,3/3/44,19441045,BEL-1938,A2.9-3133,211,BEL,Spaak,15/05/1938,9/2/39,1899,31/07/1972,5/15/38,2/9/39,0,1,0,0,0,M,NA,1899,7/31/72,19721046,BEL-1939,A2.9-3136,211,BEL,Pierlot,9/2/39,28/05/1940,1883,1963,2/9/39,5/28/40,0,4,9,0,1,M,NA,1883,NA,19631047,BEL-1944,A2.9-3139,211,BEL,Pierlot,3/9/44,7/2/45,1883,1963,9/3/44,2/7/45,0,1,0,1,0,M,NA,1883,NA,19631048,BEL-1945,A2.9-3142,211,BEL,van Acker,11/2/45,18/02/1946,1898,1975,2/11/45,2/18/46,0,1,0,0,0,M,NA,1898,NA,19751049,BEL-1946-1,A2.9-3145,211,BEL,Spaak,12/3/46,21/03/1946,1899,31/07/1972,3/12/46,3/21/46,0,1,0,1,0,M,NA,1899,7/31/72,19721050,BEL-1946-2,A2.9-3148,211,BEL,van Acker,31/03/1946,9/7/46,1898,1975,3/31/46,7/9/46,0,1,0,1,0,M,NA,1898,NA,19751051,BEL-1946-3,A2.9-3151,211,BEL,Huysman,2/8/46,12/3/47,26/05/1871,25/02/1968,8/2/46,3/12/47,0,1,0,0,0,M,1871-05-26,1871,2/25/68,19681052,BEL-1947,A2.9-3154,211,BEL,Spaak,19/03/1947,28/06/1949,1899,31/07/1972,3/19/47,6/28/49,0,1,0,2,0,M,NA,1899,7/31/72,19721053,BEL-1949,A2.9-3157,211,BEL,"Eyskens, G.",10/8/49,18/03/1950,1/4/05,3/1/88,8/10/49,3/18/50,0,1,0,0,0,M,4/1/05,1905,1/3/88,19881054,BEL-1950-1,A2.9-3160,211,BEL,Duvieusart,8/6/50,11/8/50,10/4/00,10/10/77,6/8/50,8/11/50,0,1,0,0,0,M,4/10/00,1900,10/10/77,19771055,BEL-1950-2,A2.9-3163,211,BEL,Pholien,15/08/1950,9/1/52,28/12/1884,4/1/68,8/15/50,1/9/52,0,1,0,0,0,M,1884-12-28,1884,1/4/68,19681056,BEL-1952,A2.9-3166,211,BEL,van Houtte,15/01/1952,12/4/54,1907,1991,1/15/52,4/12/54,0,1,0,0,0,M,NA,1907,NA,19911057,BEL-1954,A2.9-3169,211,BEL,van Acker,22/04/1954,2/6/58,1898,1975,4/22/54,6/2/58,0,1,0,2,0,M,NA,1898,NA,19751058,BEL-1958,A2.9-3172,211,BEL,"Eyskens, G.",25/06/1958,27/03/1961,1/4/05,3/1/88,6/25/58,3/27/61,0,1,0,1,0,M,4/1/05,1905,1/3/88,19881059,BEL-1961,A2.9-3175,211,BEL,Lefevre,25/04/1961,27/07/1965,1914,1973,4/25/61,7/27/65,0,1,0,0,0,M,NA,1914,NA,19731060,BEL-1965,A2.9-3178,211,BEL,Harmel,27/07/1965,11/2/66,1911,-777,7/27/65,2/11/66,0,1,0,0,0,M,NA,1911,NA,-7771061,BEL-1966,A2.9-3181,211,BEL,Vanden Boeynants,19/03/1966,16/06/1968,22/05/1919,2001,3/19/66,6/16/68,0,1,0,0,0,M,5/22/19,1919,NA,20011062,BEL-1968,A2.9-3184,211,BEL,"Eyskens, G.",17/06/1968,26/01/1973,1/4/05,3/1/88,6/17/68,1/26/73,0,1,0,2,0,M,4/1/05,1905,1/3/88,19881063,BEL-1973,A2.9-3187,211,BEL,Leburton,26/01/1973,24/04/1974,1915,1997,1/26/73,4/24/74,0,1,0,0,0,M,NA,1915,NA,19971064,BEL-1974,A2.9-3190,211,BEL,Tindemans,25/04/1974,20/10/1978,1922,-777,4/25/74,10/20/78,0,1,0,0,0,M,NA,1922,NA,-7771065,BEL-1978,A2.9-3193,211,BEL,Vanden Boeynants,20/10/1978,3/4/79,22/05/1919,2001,10/20/78,4/3/79,0,1,0,1,0,M,5/22/19,1919,NA,20011066,BEL-1979,A2.9-3196,211,BEL,Martens,3/4/79,6/4/81,19/04/1936,-777,4/3/79,4/6/81,0,1,0,0,0,M,4/19/36,1936,NA,-7771067,BEL-1981-1,A2.9-3199,211,BEL,"Eyskens, M.",6/4/81,17/12/1981,1933,-777,4/6/81,12/17/81,0,1,0,0,0,M,NA,1933,NA,-7771068,BEL-1981-2,A2.9-3202,211,BEL,Martens,17/12/1981,7/3/92,19/04/1936,-777,12/17/81,3/7/92,0,1,0,1,0,M,4/19/36,1936,NA,-7771069,BEL-1992,A2.9-3205,211,BEL,Dehaene,7/3/92,12/7/99,7/8/40,-777,3/7/92,7/12/99,0,1,0,0,0,M,8/7/40,1940,NA,-7771070,BEL-1999,A2.9-3208,211,BEL,Verhofstadt,12/7/99,31/12/2004,1953,-777,7/12/99,12/31/04,0,-888,0,0,-888,M,NA,1953,NA,-7771071,LUX-1874,A2.9-3211,212,LUX,Felix de Blochausen,26/12/1874,20/02/1885,1834,1915,1874-12-26,1885-02-20,0,1,0,0,0,M,NA,1834,NA,19151072,LUX-1885,A2.9-3214,212,LUX,Edouard Thilges,20/02/1885,22/09/1888,1817,1904,1885-02-20,1888-09-22,0,1,0,0,0,M,NA,1817,NA,19041073,LUX-1888,A2.9-3217,212,LUX,Paul Eyschen,22/09/1888,12/10/15,09/09/1841,1915,1888-09-22,10/12/15,0,2,0,0,-777,M,1841-09-09,1841,NA,19151074,LUX-1915-1,A2.9-3220,212,LUX,Mathias Mongenast,12/10/15,6/11/15,1843,1926,10/12/15,11/6/15,0,1,0,0,0,M,NA,1843,NA,19261075,LUX-1915-2,A2.9-3223,212,LUX,Hubert Loutsch,6/11/15,24/02/1916,1878,1946,11/6/15,2/24/16,0,1,0,0,0,M,NA,1878,NA,19461076,LUX-1916,A2.9-3226,212,LUX,Victor Thorn,24/02/1916,19/06/1917,31/01/1844,1930,2/24/16,6/19/17,0,1,0,0,0,M,1844-01-31,1844,NA,19301077,LUX-1917,A2.9-3229,212,LUX,Leon Kauffman,19/06/1917,28/09/1918,1869,1952,6/19/17,9/28/18,0,1,0,0,0,M,NA,1869,NA,19521078,LUX-1918,A2.9-3232,212,LUX,Reuter,28/09/1918,1/3/25,1874,1973,9/28/18,3/1/25,0,1,0,0,0,M,NA,1874,NA,19731079,LUX-1925,A2.9-3235,212,LUX,Prum,1/3/25,1/7/26,1886,1950,3/1/25,7/1/26,0,1,0,0,0,M,NA,1886,NA,19501080,LUX-1926,A2.9-3238,212,LUX,Bech,16/07/1926,19/10/1937,17/02/1887,1975,7/16/26,10/19/37,0,1,0,0,0,M,1887-02-17,1887,NA,19751081,LUX-1937,A2.9-3241,212,LUX,Dupong,5/11/37,10/5/40,01/11/1885,1953,11/5/37,5/10/40,0,4,9,0,1,M,1885-11-01,1885,NA,19531082,LUX-1945,A2.9-3244,212,LUX,Dupong,9/5/45,22/12/1953,01/11/1885,1953,5/9/45,12/22/53,0,2,0,1,-777,M,1885-11-01,1885,NA,19531083,LUX-1953,A2.9-3247,212,LUX,Bech,28/12/1953,26/03/1958,17/02/1887,1975,12/28/53,3/26/58,0,1,0,1,0,M,1887-02-17,1887,NA,19751084,LUX-1958,A2.9-3250,212,LUX,Frieden,31/03/1958,23/02/1959,28/10/1892,1959,3/31/58,2/23/59,0,2,0,0,-777,M,1892-10-28,1892,NA,19591085,LUX-1959,A2.9-3253,212,LUX,Werner,7/3/59,27/05/1974,29/12/1913,2002,3/7/59,5/27/74,0,1,0,0,0,M,12/29/13,1913,NA,20021086,LUX-1974,A2.9-3256,212,LUX,Thorn G.,15/06/1974,19/07/1979,3/9/28,-777,6/15/74,7/19/79,0,1,0,0,0,M,9/3/28,1928,NA,-7771087,LUX-1979,A2.9-3259,212,LUX,Werner,19/07/1979,20/07/1984,29/12/1913,2002,7/19/79,7/20/84,0,1,0,1,0,M,12/29/13,1913,NA,20021088,LUX-1984,A2.9-3262,212,LUX,Santer,20/07/1984,20/01/1995,18/05/1937,-777,7/20/84,1/20/95,0,1,0,0,0,M,5/18/37,1937,NA,-7771089,LUX-1995,A2.9-3265,212,LUX,Juncker,20/01/1995,31/12/2004,1954,-777,1/20/95,12/31/04,0,-888,0,0,-888,M,NA,1954,NA,-7771090,FRN-1874,A2.9-3268,220,FRN,Cissey,22/05/1874,25/02/1875,1810,1882,1874-05-22,1875-02-25,0,1,0,0,0,M,NA,1810,NA,18821091,FRN-1875,A2.9-3271,220,FRN,Buffet,10/03/1875,21/02/1876,1818,1898,1875-03-10,1876-02-21,0,1,0,0,0,M,NA,1818,NA,18981092,FRN-1876-1,A2.9-3274,220,FRN,DuFaure,22/02/1876,12/12/1876,1798,1881,1876-02-22,1876-12-12,0,1,0,1,0,M,NA,1798,NA,18811093,FRN-1876-2,A2.9-3277,220,FRN,Simon,12/12/1876,16/05/1877,1814,1896,1876-12-12,1877-05-16,0,1,0,0,0,M,NA,1814,NA,18961094,FRN-1877-1,A2.9-3280,220,FRN,Broglie,18/05/1877,23/11/1877,1821,1901,1877-05-18,1877-11-23,0,1,0,1,0,M,NA,1821,NA,19011095,FRN-1877-2,A2.9-3283,220,FRN,Rochebouet,23/11/1877,12/12/1877,1813,1899,1877-11-23,1877-12-12,0,1,0,0,0,M,NA,1813,NA,18991096,FRN-1877-3,A2.9-3286,220,FRN,DuFaure,14/12/1877,30/01/1879,1798,1881,1877-12-14,1879-01-30,0,1,0,2,0,M,NA,1798,NA,18811097,FRN-1879-1,A2.9-3289,220,FRN,Waddington,04/02/1879,21/12/1879,1826,1894,1879-02-04,1879-12-21,0,1,0,0,0,M,NA,1826,NA,18941098,FRN-1879-2,A2.9-3292,220,FRN,Freycinet,29/12/1879,19/09/1880,1828,1923,1879-12-29,1880-09-19,0,1,0,0,0,M,NA,1828,NA,19231099,FRN-1880,A2.9-3295,220,FRN,Ferry,22/09/1880,10/11/1881,1832,1893,1880-09-22,1881-11-10,0,1,0,0,0,M,NA,1832,NA,18931100,FRN-1881,A2.9-3298,220,FRN,Gambetta,14/11/1881,26/01/1882,02/04/1838,31/12/1882,1881-11-14,1882-01-26,0,1,0,0,0,M,1838-04-02,1838,1882-12-31,18821101,FRN-1882-1,A2.9-3301,220,FRN,Freycinet,31/01/1882,29/07/1882,1828,1923,1882-01-31,1882-07-29,0,1,0,1,0,M,NA,1828,NA,19231102,FRN-1882-2,A2.9-3304,220,FRN,Duclerc,08/08/1882,28/01/1883,1812,1888,1882-08-08,1883-01-28,0,1,0,0,0,M,NA,1812,NA,18881103,FRN-1883-1,A2.9-3307,220,FRN,Fallieres,29/01/1883,18/02/1883,06/11/1841,22/06/1931,1883-01-29,1883-02-18,0,1,0,0,0,M,1841-11-06,1841,6/22/31,19311104,FRN-1883-2,A2.9-3310,220,FRN,Ferry,19/02/1883,30/03/1885,1832,1893,1883-02-19,1885-03-30,0,1,0,1,0,M,NA,1832,NA,18931105,FRN-1885,A2.9-3313,220,FRN,Brisson,06/04/1885,29/12/1885,1835,1912,1885-04-06,1885-12-29,0,1,0,0,0,M,NA,1835,NA,19121106,FRN-1886-1,A2.9-3316,220,FRN,Freycinet,07/01/1886,03/12/1886,1828,1923,1886-01-07,1886-12-03,0,1,0,2,0,M,NA,1828,NA,19231107,FRN-1886-2,A2.9-3319,220,FRN,Goblet,16/12/1886,17/05/1887,1828,1905,1886-12-16,1887-05-17,0,1,0,0,0,M,NA,1828,NA,19051108,FRN-1887-1,A2.9-3322,220,FRN,Rouvier,29/05/1887,19/11/1887,1842,1911,1887-05-29,1887-11-19,0,1,0,0,0,M,NA,1842,NA,19111109,FRN-1887-2,A2.9-3325,220,FRN,Tirard,11/12/1887,03/04/1888,1837,1893,1887-12-11,1888-04-03,0,1,0,0,0,M,NA,1837,NA,18931110,FRN-1888,A2.9-3328,220,FRN,Floquet,03/04/1888,21/02/1889,1828,1896,1888-04-03,1889-02-21,0,1,0,0,0,M,NA,1828,NA,18961111,FRN-1889,A2.9-3331,220,FRN,Tirard,21/02/1889,13/03/1890,1837,1893,1889-02-21,1890-03-13,0,1,0,1,0,M,NA,1837,NA,18931112,FRN-1890,A2.9-3334,220,FRN,Freycinet,17/03/1890,20/02/1892,1828,1923,1890-03-17,1892-02-20,0,1,0,3,0,M,NA,1828,NA,19231113,FRN-1892-1,A2.9-3337,220,FRN,Loubet,27/02/1892,29/11/1892,30/12/1838,20/12/1929,1892-02-27,1892-11-29,0,1,0,0,0,M,1838-12-30,1838,12/20/29,19291114,FRN-1892-2,A2.9-3340,220,FRN,Ribot,06/12/1892,04/04/1893,1842,1923,1892-12-06,1893-04-04,0,1,0,0,0,M,NA,1842,NA,19231115,FRN-1893-1,A2.9-3343,220,FRN,Dupuy,04/04/1893,25/11/1893,05/11/1851,23/07/1923,1893-04-04,1893-11-25,0,1,0,0,0,M,1851-11-05,1851,7/23/23,19231116,FRN-1893-2,A2.9-3346,220,FRN,Casimir-Perier,03/12/1893,22/05/1894,08/11/1847,11/3/07,1893-12-03,1894-05-22,0,1,0,0,0,M,1847-11-08,1847,3/11/07,19071117,FRN-1894,A2.9-3349,220,FRN,Dupuy,30/05/1894,14/01/1895,05/11/1851,23/07/1923,1894-05-30,1895-01-14,0,1,0,1,0,M,1851-11-05,1851,7/23/23,19231118,FRN-1895-1,A2.9-3352,220,FRN,Ribot,27/01/1895,28/10/1895,1842,1923,1895-01-27,1895-10-28,0,1,0,1,0,M,NA,1842,NA,19231119,FRN-1895-2,A2.9-3355,220,FRN,Bourgeois,01/11/1895,22/04/1896,1851,1925,1895-11-01,1896-04-22,0,1,0,0,0,M,NA,1851,NA,19251120,FRN-1896,A2.9-3358,220,FRN,Meline,29/04/1896,14/06/1898,1838,1925,1896-04-29,1898-06-14,0,1,0,0,0,M,NA,1838,NA,19251121,FRN-1898-1,A2.9-3361,220,FRN,Brisson,27/06/1898,25/10/1898,1835,1912,1898-06-27,1898-10-25,0,1,0,1,0,M,NA,1835,NA,19121122,FRN-1898-2,A2.9-3364,220,FRN,Dupuy,31/10/1898,12/06/1899,05/11/1851,23/07/1923,1898-10-31,1899-06-12,0,1,0,2,0,M,1851-11-05,1851,7/23/23,19231123,FRN-1899,A2.9-3367,220,FRN,Waldeck-Rousseau,22/06/1899,28/05/1902,1846,10/8/04,1899-06-22,5/28/02,0,2.1,0,0,0,M,NA,1846,8/10/04,19041124,FRN-1902,A2.9-3370,220,FRN,Combes,7/6/02,19/01/1905,1835,1921,6/7/02,1/19/05,0,1,0,0,0,M,NA,1835,NA,19211125,FRN-1905,A2.9-3373,220,FRN,Rouvier,24/01/1905,7/3/06,1842,1911,1/24/05,3/7/06,0,1,0,1,0,M,NA,1842,NA,19111126,FRN-1906-1,A2.9-3376,220,FRN,Sarrien,12/3/06,18/10/1906,1840,1915,3/12/06,10/18/06,0,1,0,0,0,M,NA,1840,NA,19151127,FRN-1906-2,A2.9-3379,220,FRN,Clemenceau,28/10/1906,20/07/1909,28/09/1841,24/11/1929,10/28/06,7/20/09,0,1,0,0,0,M,1841-09-28,1841,11/24/29,19291128,FRN-1909,A2.9-3382,220,FRN,Briand,24/07/1909,24/02/1911,28/03/1862,7/3/32,7/24/09,2/24/11,0,1,0,0,0,M,1862-03-28,1862,3/7/32,19321129,FRN-1911-1,A2.9-3385,220,FRN,Monis,4/3/11,22/06/1911,1846,1929,3/4/11,6/22/11,0,1,0,0,0,M,NA,1846,NA,19291130,FRN-1911-2,A2.9-3388,220,FRN,Caillaux,27/06/1911,10/1/12,1863,1934,6/27/11,1/10/12,0,1,0,0,0,M,NA,1863,NA,19341131,FRN-1912,A2.9-3391,220,FRN,Poincare,14/01/1912,18/01/1913,20/08/1860,15/10/1934,1/14/12,1/18/13,0,1,0,0,0,M,1860-08-20,1860,10/15/34,19341132,FRN-1913-1,A2.9-3394,220,FRN,Briand,18/01/1913,18/03/1913,28/03/1862,7/3/32,1/18/13,3/18/13,0,1,0,1,0,M,1862-03-28,1862,3/7/32,19321133,FRN-1913-2,A2.9-3397,220,FRN,Barthou,24/03/1913,2/12/13,25/08/1862,9/10/34,3/24/13,12/2/13,0,1,0,0,0,M,1862-08-25,1862,10/9/34,19341134,FRN-1913-3,A2.9-3400,220,FRN,Doumergue,8/12/13,4/6/14,01/08/1863,18/06/1937,12/8/13,6/4/14,0,1,0,0,0,M,1863-08-01,1863,6/18/37,19371135,FRN-1914,A2.9-3403,220,FRN,Viviani,9/6/14,29/10/1915,1863,1925,6/9/14,10/29/15,0,1,0,0,0,M,NA,1863,NA,19251136,FRN-1915,A2.9-3406,220,FRN,Briand,29/10/1915,17/03/1917,28/03/1862,7/3/32,10/29/15,3/17/17,0,1,0,2,0,M,1862-03-28,1862,3/7/32,19321137,FRN-1917-1,A2.9-3409,220,FRN,Ribot,20/03/1917,7/9/17,1842,1923,3/20/17,9/7/17,0,1,0,2,0,M,NA,1842,NA,19231138,FRN-1917-2,A2.9-3412,220,FRN,Painleve,12/9/17,13/11/1917,1863,1933,9/12/17,11/13/17,0,1,0,0,0,M,NA,1863,NA,19331139,FRN-1917-3,A2.9-3415,220,FRN,Clemenceau,16/11/1917,19/01/1920,28/09/1841,24/11/1929,11/16/17,1/19/20,0,1,0,1,0,M,1841-09-28,1841,11/24/29,19291140,FRN-1920-1,A2.9-3418,220,FRN,Millerand,19/01/1920,3/9/20,10/02/1859,7/4/43,1/19/20,9/3/20,0,1,0,0,0,M,1859-02-10,1859,4/7/43,19431141,FRN-1920-2,A2.9-3421,220,FRN,Leygues,3/9/20,16/01/1921,1857,1933,9/3/20,1/16/21,0,1,0,0,0,M,NA,1857,NA,19331142,FRN-1921,A2.9-3424,220,FRN,Briand,16/01/1921,16/01/1922,28/03/1862,7/3/32,1/16/21,1/16/22,0,1,0,3,0,M,1862-03-28,1862,3/7/32,19321143,FRN-1922,A2.9-3427,220,FRN,Poincare,16/01/1922,8/6/24,20/08/1860,15/10/1934,1/16/22,6/8/24,0,1,0,1,0,M,1860-08-20,1860,10/15/34,19341144,FRN-1924-1,A2.9-3430,220,FRN,Francois-Marsat,8/6/24,14/06/1924,1874,1958,6/8/24,6/14/24,0,1,0,0,0,M,NA,1874,NA,19581145,FRN-1924-2,A2.9-3433,220,FRN,Herriot,14/06/1924,17/04/1925,1872,1957,6/14/24,4/17/25,0,1,0,0,0,M,NA,1872,NA,19571146,FRN-1925-1,A2.9-3436,220,FRN,Painleve,17/04/1925,2/11/25,1863,1933,4/17/25,11/2/25,0,1,0,1,0,M,NA,1863,NA,19331147,FRN-1925-2,A2.9-3439,220,FRN,Briand,29/11/1925,20/07/1926,28/03/1862,7/3/32,11/29/25,7/20/26,0,1,0,4,0,M,1862-03-28,1862,3/7/32,19321148,FRN-1926-1,A2.9-3442,220,FRN,Herriot,20/07/1926,24/07/1926,1872,1957,7/20/26,7/24/26,0,1,0,1,0,M,NA,1872,NA,19571149,FRN-1926-2,A2.9-3445,220,FRN,Poincare,24/07/1926,28/07/1929,20/08/1860,15/10/1934,7/24/26,7/28/29,0,1,0,2,0,M,1860-08-20,1860,10/15/34,19341150,FRN-1929-1,A2.9-3448,220,FRN,Briand,28/07/1929,11/10/29,28/03/1862,7/3/32,7/28/29,10/11/29,0,1,0,5,0,M,1862-03-28,1862,3/7/32,19321151,FRN-1929-2,A2.9-3451,220,FRN,Poincare,11/10/29,2/11/29,20/08/1860,15/10/1934,10/11/29,11/2/29,0,1,0,3,0,M,1860-08-20,1860,10/15/34,19341152,FRN-1929-3,A2.9-3454,220,FRN,Tardieu,2/11/29,21/02/1930,1876,1945,11/2/29,2/21/30,0,1,0,0,0,M,NA,1876,NA,19451153,FRN-1930-1,A2.9-3457,220,FRN,Chautemps,21/02/1930,2/3/30,1885,1963,2/21/30,3/2/30,0,1,0,0,0,M,NA,1885,NA,19631154,FRN-1930-2,A2.9-3460,220,FRN,Tardieu,2/3/30,13/12/1930,1876,1945,3/2/30,12/13/30,0,1,0,1,0,M,NA,1876,NA,19451155,FRN-1930-3,A2.9-3463,220,FRN,Steeg,13/12/1930,27/01/1931,1868,1950,12/13/30,1/27/31,0,1,0,0,0,M,NA,1868,NA,19501156,FRN-1931,A2.9-3466,220,FRN,Laval,27/01/1931,23/02/1932,28/06/1883,15/10/1945,1/27/31,2/23/32,0,1,0,0,0,M,1883-06-28,1883,10/15/45,19451157,FRN-1932-1,A2.9-3469,220,FRN,Tardieu,23/02/1932,4/6/32,1876,1945,2/23/32,6/4/32,0,1,0,2,0,M,NA,1876,NA,19451158,FRN-1932-2,A2.9-3472,220,FRN,Herriot,4/6/32,20/12/1932,1872,1957,6/4/32,12/20/32,0,1,0,2,0,M,NA,1872,NA,19571159,FRN-1932-3,A2.9-3475,220,FRN,Paul-Boncour,20/12/1932,31/01/1933,04/08/1873,1972,12/20/32,1/31/33,0,1,0,0,0,M,1873-08-04,1873,NA,19721160,FRN-1933-1,A2.9-3478,220,FRN,Daladier,31/01/1933,24/10/1933,18/06/1884,10/10/70,1/31/33,10/24/33,0,1,0,0,0,M,1884-06-18,1884,10/10/70,19701161,FRN-1933-2,A2.9-3481,220,FRN,Sarraut,24/10/1933,22/11/1933,1872,1962,10/24/33,11/22/33,0,1,0,0,0,M,NA,1872,NA,19621162,FRN-1933-3,A2.9-3484,220,FRN,Chautemps,22/11/1933,30/01/1934,1885,1963,11/22/33,1/30/34,0,1,0,1,0,M,NA,1885,NA,19631163,FRN-1934-1,A2.9-3487,220,FRN,Daladier,30/01/1934,9/2/34,18/06/1884,10/10/70,1/30/34,2/9/34,0,1,0,1,0,M,1884-06-18,1884,10/10/70,19701164,FRN-1934-2,A2.9-3490,220,FRN,Doumergue,9/2/34,10/11/34,01/08/1863,18/06/1937,2/9/34,11/10/34,0,1,0,1,0,M,1863-08-01,1863,6/18/37,19371165,FRN-1934-3,A2.9-3493,220,FRN,Flandin,10/11/34,30/05/1935,12/04/1889,13/06/1958,11/10/34,5/30/35,0,1,0,0,0,M,1889-04-12,1889,6/13/58,19581166,FRN-1935-1,A2.9-3496,220,FRN,Bouissin,1/6/35,4/6/35,1874,1959,6/1/35,6/4/35,0,1,0,0,0,M,NA,1874,NA,19591167,FRN-1935-2,A2.9-3499,220,FRN,Laval,7/6/35,25/01/1936,28/06/1883,15/10/1945,6/7/35,1/25/36,0,1,0,1,0,M,1883-06-28,1883,10/15/45,19451168,FRN-1936-1,A2.9-3502,220,FRN,Sarraut,25/01/1936,3/6/36,1872,1962,1/25/36,6/3/36,0,1,0,1,0,M,NA,1872,NA,19621169,FRN-1936-2,A2.9-3505,220,FRN,Blum,3/6/36,23/06/1937,09/04/1872,30/03/1950,6/3/36,6/23/37,0,1,0,0,0,M,1872-04-09,1872,3/30/50,19501170,FRN-1937,A2.9-3508,220,FRN,Chautemps,23/06/1937,12/3/38,1885,1963,6/23/37,3/12/38,0,1,0,2,0,M,NA,1885,NA,19631171,FRN-1938-1,A2.9-3511,220,FRN,Blum,12/3/38,10/4/38,09/04/1872,30/03/1950,3/12/38,4/10/38,0,1,0,1,0,M,1872-04-09,1872,3/30/50,19501172,FRN-1938-2,A2.9-3514,220,FRN,Daladier,10/4/38,21/03/1940,18/06/1884,10/10/70,4/10/38,3/21/40,0,1,0,2,0,M,1884-06-18,1884,10/10/70,19701173,FRN-1940-1,A2.9-3517,220,FRN,Reynaud,21/03/1940,11/6/40,1878,1966,3/21/40,6/11/40,0,1,0,0,2,M,NA,1878,NA,19661174,FRN-1940-2,A2.9-3520,220,FRN,Petain,17/06/1940,18/04/1942,24/04/1856,23/07/1951,6/17/40,4/18/42,0,1,0,0,0,M,1856-04-24,1856,7/23/51,19511175,FRN-1942,A2.9-3523,220,FRN,Laval,18/04/1942,17/08/1944,28/06/1883,15/10/1945,4/18/42,8/17/44,0,4,9,3,2,M,1883-06-28,1883,10/15/45,19451176,FRN-1944,A2.9-3526,220,FRN,De Gaulle,10/9/44,20/01/1946,22/11/1890,9/11/70,9/10/44,1/20/46,0,1,0,0,0,M,1890-11-22,1890,11/9/70,19701177,FRN-1946-1,A2.9-3529,220,FRN,Gouin,26/01/1946,12/6/46,04/10/1884,25/11/1977,1/26/46,6/12/46,0,1,0,0,0,M,1884-10-04,1884,11/25/77,19771178,FRN-1946-2,A2.9-3532,220,FRN,Bidault,24/06/1946,28/11/1946,05/10/1899,27/01/1983,6/24/46,11/28/46,0,1,0,0,0,M,1899-10-05,1899,1/27/83,19831179,FRN-1946-3,A2.9-3535,220,FRN,Blum,16/12/1946,16/01/1947,09/04/1872,30/03/1950,12/16/46,1/16/47,0,1,0,2,0,M,1872-04-09,1872,3/30/50,19501180,FRN-1947-1,A2.9-3538,220,FRN,Ramadier,22/01/1947,19/11/1947,17/03/1888,14/10/1961,1/22/47,11/19/47,0,1,0,0,0,M,1888-03-17,1888,10/14/61,19611181,FRN-1947-2,A2.9-3541,220,FRN,Schuman,24/11/1947,19/07/1948,1886,1963,11/24/47,7/19/48,0,1,0,0,0,M,NA,1886,NA,19631182,FRN-1948-1,A2.9-3544,220,FRN,Marie,27/07/1948,27/08/1948,1897,1974,7/27/48,8/27/48,0,1,0,0,0,M,NA,1897,NA,19741183,FRN-1948-2,A2.9-3547,220,FRN,Schuman,31/08/1948,8/9/48,1886,1963,8/31/48,9/8/48,0,1,0,1,0,M,NA,1886,NA,19631184,FRN-1948-3,A2.9-3550,220,FRN,Queuille,13/09/1948,6/10/49,1884,1970,9/13/48,10/6/49,0,1,0,0,0,M,NA,1884,NA,19701185,FRN-1949,A2.9-3553,220,FRN,Bidault,28/10/1949,24/06/1950,05/10/1899,27/01/1983,10/28/49,6/24/50,0,1,0,0,0,M,1899-10-05,1899,1/27/83,19831186,FRN-1950-1,A2.9-3556,220,FRN,Queuille,30/06/1950,4/7/50,1884,1970,6/30/50,7/4/50,0,1,0,1,0,M,NA,1884,NA,19701187,FRN-1950-2,A2.9-3559,220,FRN,Pleven,11/7/50,28/02/1951,15/04/1901,13/01/1993,7/11/50,2/28/51,0,1,0,0,0,M,4/15/01,1901,1/13/93,19931188,FRN-1951-1,A2.9-3562,220,FRN,Queuille,9/3/51,10/7/51,1884,1970,3/9/51,7/10/51,0,1,0,2,0,M,NA,1884,NA,19701189,FRN-1951-2,A2.9-3565,220,FRN,Pleven,8/8/51,8/1/52,15/04/1901,13/01/1993,8/8/51,1/8/52,0,1,0,1,0,M,4/15/01,1901,1/13/93,19931190,FRN-1952-1,A2.9-3568,220,FRN,Faure,18/01/1952,29/02/1952,18/08/1908,30/03/1988,1/18/52,2/29/52,0,1,0,0,0,M,8/18/08,1908,3/30/88,19881191,FRN-1952-2,A2.9-3571,220,FRN,Pinay,7/3/52,23/12/1952,30/12/1891,13/12/1994,3/7/52,12/23/52,0,1,0,0,0,M,1891-12-30,1891,12/13/94,19941192,FRN-1953-1,A2.9-3574,220,FRN,Mayer,7/1/53,21/05/1953,1895,1972,1/7/53,5/21/53,0,1,0,0,0,M,NA,1895,NA,19721193,FRN-1953-2,A2.9-3577,220,FRN,Laniel,26/06/1953,12/6/54,1889,1975,6/26/53,6/12/54,0,1,0,0,0,M,NA,1889,NA,19751194,FRN-1954,A2.9-3580,220,FRN,Mendes-France,18/06/1954,5/2/55,11/1/07,18/10/1982,6/18/54,2/5/55,0,1,0,0,0,M,1/11/07,1907,10/18/82,19821195,FRN-1955,A2.9-3583,220,FRN,Faure,23/02/1955,19/01/1956,18/08/1908,30/03/1988,2/23/55,1/19/56,0,1,0,1,0,M,8/18/08,1908,3/30/88,19881196,FRN-1956,A2.9-3586,220,FRN,Mollet,31/01/1956,13/06/1957,31/12/1905,3/10/75,1/31/56,6/13/57,0,1,0,0,0,M,12/31/05,1905,10/3/75,19751197,FRN-1957-1,A2.9-3589,220,FRN,Bourges-Maunory,13/06/1957,5/11/57,1914,1993,6/13/57,11/5/57,0,1,0,0,0,M,NA,1914,NA,19931198,FRN-1957-2,A2.9-3592,220,FRN,Gaillard,6/11/57,13/05/1958,1919,1970,11/6/57,5/13/58,0,1,0,0,0,M,NA,1919,NA,19701199,FRN-1958-1,A2.9-3595,220,FRN,Pflimin,14/05/1958,31/05/1958,5/2/07,27/06/2000,5/14/58,5/31/58,0,1,0,0,0,M,2/5/07,1907,6/27/00,20001200,FRN-1958-2,A2.9-3598,220,FRN,De Gaulle,1/6/58,27/04/1969,22/11/1890,9/11/70,6/1/58,4/27/69,0,1,0,1,0,M,1890-11-22,1890,11/9/70,19701201,FRN-1969-1,A2.9-3601,220,FRN,Poher,27/04/1969,20/06/1969,17/04/1909,9/12/96,4/27/69,6/20/69,0,1,0,0,0,M,4/17/09,1909,12/9/96,19961202,FRN-1969-2,A2.9-3604,220,FRN,Pompidou,20/06/1969,2/4/74,5/7/11,2/4/74,6/20/69,4/2/74,0,2,0,0,-777,M,7/5/11,1911,4/2/74,19741203,FRN-1974-1,A2.9-3607,220,FRN,Poher,2/4/74,27/05/1974,17/04/1909,9/12/96,4/2/74,5/27/74,0,1,0,1,0,M,4/17/09,1909,12/9/96,19961204,FRN-1974-2,A2.9-3610,220,FRN,Giscard D'Estaing,27/05/1974,21/05/1981,2/2/26,-777,5/27/74,5/21/81,0,1,0,0,0,M,2/2/26,1926,NA,-7771205,FRN-1981,A2.9-3613,220,FRN,Mitterand,21/05/1981,17/05/1995,26/10/1916,8/1/96,5/21/81,5/17/95,0,1,0,0,0,M,10/26/16,1916,1/8/96,19961206,FRN-1995,A2.9-3616,220,FRN,Chirac,17/05/1995,31/12/2004,29/11/1932,-777,5/17/95,12/31/04,0,-888,0,0,-888,M,11/29/32,1932,NA,-7771207,SWZ-1875,A2.9-3619,225,SWZ,Scherer,01/01/1875,31/12/1875,1825,1878,1875-01-01,1875-12-31,0,1,0,0,0,M,NA,1825,NA,18781208,SWZ-1876,A2.9-3622,225,SWZ,Welti,01/01/1876,31/12/1876,23/04/1825,1899,1876-01-01,1876-12-31,0,1,0,2,0,M,1825-04-23,1825,NA,18991209,SWZ-1877,A2.9-3625,225,SWZ,Heer,01/01/1877,31/12/1877,25/09/1825,1879,1877-01-01,1877-12-31,0,1,0,0,0,M,1825-09-25,1825,NA,18791210,SWZ-1878,A2.9-3628,225,SWZ,Schenck,01/01/1878,31/12/1878,01/12/1823,1895,1878-01-01,1878-12-31,0,1,0,3,0,M,1823-12-01,1823,NA,18951211,SWZ-1879,A2.9-3631,225,SWZ,Hammer,01/01/1879,31/12/1879,03/03/1822,1907,1879-01-01,1879-12-31,0,1,0,0,0,M,1822-03-03,1822,NA,19071212,SWZ-1880,A2.9-3634,225,SWZ,Welti,01/01/1880,31/12/1880,23/04/1825,1899,1880-01-01,1880-12-31,0,1,0,3,0,M,1825-04-23,1825,NA,18991213,SWZ-1881,A2.9-3637,225,SWZ,Droz,01/01/1881,31/12/1881,27/01/1844,1899,1881-01-01,1881-12-31,0,1,0,0,0,M,1844-01-27,1844,NA,18991214,SWZ-1882,A2.9-3640,225,SWZ,Bavier,01/01/1882,31/12/1882,16/09/1825,1896,1882-01-01,1882-12-31,0,1,0,0,0,M,1825-09-16,1825,NA,18961215,SWZ-1883,A2.9-3643,225,SWZ,Ruchonnet,01/01/1883,31/12/1883,28/04/1834,1893,1883-01-01,1883-12-31,0,1,0,0,0,M,1834-04-28,1834,NA,18931216,SWZ-1884,A2.9-3646,225,SWZ,Welti,01/01/1884,31/12/1884,23/04/1825,1899,1884-01-01,1884-12-31,0,1,0,4,0,M,1825-04-23,1825,NA,18991217,SWZ-1885,A2.9-3649,225,SWZ,Schenck,01/01/1885,31/12/1885,01/12/1823,1895,1885-01-01,1885-12-31,0,1,0,4,0,M,1823-12-01,1823,NA,18951218,SWZ-1886,A2.9-3652,225,SWZ,Deucher,01/01/1886,31/12/1886,15/02/1831,1912,1886-01-01,1886-12-31,0,1,0,0,0,M,1831-02-15,1831,NA,19121219,SWZ-1887,A2.9-3655,225,SWZ,Droz,01/01/1887,31/12/1887,27/01/1844,1899,1887-01-01,1887-12-31,0,1,0,1,0,M,1844-01-27,1844,NA,18991220,SWZ-1888-1,A2.9-3658,225,SWZ,Hertenstein,01/01/1888,27/11/1888,05/03/1825,27/11/1888,1888-01-01,1888-11-27,0,2,0,0,-777,M,1825-03-05,1825,1888-11-27,18881221,SWZ-1888-2,A2.9-3661,225,SWZ,Hammer,27/11/1888,31/12/1889,03/03/1822,1907,1888-11-27,1889-12-31,0,1,0,1,0,M,1822-03-03,1822,NA,19071222,SWZ-1890,A2.9-3664,225,SWZ,Ruchonnet,01/01/1890,31/12/1890,28/04/1834,1893,1890-01-01,1890-12-31,0,1,0,1,0,M,1834-04-28,1834,NA,18931223,SWZ-1891,A2.9-3667,225,SWZ,Welti,01/01/1891,31/12/1891,23/04/1825,1899,1891-01-01,1891-12-31,0,1,0,5,0,M,1825-04-23,1825,NA,18991224,SWZ-1892,A2.9-3670,225,SWZ,Hauser,01/01/1892,31/12/1892,01/05/1837,1902,1892-01-01,1892-12-31,0,1,0,0,0,M,1837-05-01,1837,NA,19021225,SWZ-1893,A2.9-3673,225,SWZ,Schenck,01/01/1893,31/12/1893,01/12/1823,1895,1893-01-01,1893-12-31,0,1,0,5,0,M,1823-12-01,1823,NA,18951226,SWZ-1894,A2.9-3676,225,SWZ,Frey,01/01/1894,31/12/1894,24/10/1838,1922,1894-01-01,1894-12-31,0,1,0,0,0,M,1838-10-24,1838,NA,19221227,SWZ-1895,A2.9-3679,225,SWZ,Zemp,01/01/1895,31/12/1895,02/09/1834,1908,1895-01-01,1895-12-31,0,1,0,0,0,M,1834-09-02,1834,NA,19081228,SWZ-1896,A2.9-3682,225,SWZ,Lachenal,01/01/1896,31/12/1896,19/05/1849,1918,1896-01-01,1896-12-31,0,1,0,0,0,M,1849-05-19,1849,NA,19181229,SWZ-1897,A2.9-3685,225,SWZ,Deucher,01/01/1897,31/12/1897,15/02/1831,1912,1897-01-01,1897-12-31,0,1,0,1,0,M,1831-02-15,1831,NA,19121230,SWZ-1898,A2.9-3688,225,SWZ,Ruffy,01/01/1898,31/12/1898,02/08/1854,1919,1898-01-01,1898-12-31,0,1,0,0,0,M,1854-08-02,1854,NA,19191231,SWZ-1899,A2.9-3691,225,SWZ,Muller,01/01/1899,31/12/1899,12/11/1848,1919,1899-01-01,1899-12-31,0,1,0,0,0,M,1848-11-12,1848,NA,19191232,SWZ-1900,A2.9-3694,225,SWZ,Hauser,1/1/00,31/12/1900,01/05/1837,1902,1/1/00,12/31/00,0,1,0,1,0,M,1837-05-01,1837,NA,19021233,SWZ-1901,A2.9-3697,225,SWZ,Brenner,1/1/01,31/12/1901,1856,1911,1/1/01,12/31/01,0,1,0,0,0,M,NA,1856,NA,19111234,SWZ-1902,A2.9-3700,225,SWZ,Zemp,1/1/02,31/12/1902,02/09/1834,1908,1/1/02,12/31/02,0,1,0,1,0,M,1834-09-02,1834,NA,19081235,SWZ-1903,A2.9-3703,225,SWZ,Deucher,1/1/03,31/12/1903,15/02/1831,1912,1/1/03,12/31/03,0,1,0,2,0,M,1831-02-15,1831,NA,19121236,SWZ-1904,A2.9-3706,225,SWZ,Comtesse,1/1/04,31/12/1904,14/08/1847,1922,1/1/04,12/31/04,0,1,0,0,0,M,1847-08-14,1847,NA,19221237,SWZ-1905,A2.9-3709,225,SWZ,Ruchet,1/1/05,31/12/1905,14/09/1853,1912,1/1/05,12/31/05,0,1,0,0,0,M,1853-09-14,1853,NA,19121238,SWZ-1906,A2.9-3712,225,SWZ,Forrer,1/1/06,31/12/1906,09/02/1845,1921,1/1/06,12/31/06,0,1,0,0,0,M,1845-02-09,1845,NA,19211239,SWZ-1907,A2.9-3715,225,SWZ,Muller,1/1/07,31/12/1907,12/11/1848,1919,1/1/07,12/31/07,0,1,0,1,0,M,1848-11-12,1848,NA,19191240,SWZ-1908,A2.9-3718,225,SWZ,Brenner,1/1/08,31/12/1908,1856,1911,1/1/08,12/31/08,0,1,0,1,0,M,NA,1856,NA,19111241,SWZ-1909,A2.9-3721,225,SWZ,Deucher,1/1/09,31/12/1909,15/02/1831,1912,1/1/09,12/31/09,0,1,0,3,0,M,1831-02-15,1831,NA,19121242,SWZ-1910,A2.9-3724,225,SWZ,Comtesse,1/1/10,31/12/1910,14/08/1847,1922,1/1/10,12/31/10,0,1,0,1,0,M,1847-08-14,1847,NA,19221243,SWZ-1911,A2.9-3727,225,SWZ,Ruchet,1/1/11,31/12/1911,14/09/1853,1912,1/1/11,12/31/11,0,1,0,1,0,M,1853-09-14,1853,NA,19121244,SWZ-1912,A2.9-3730,225,SWZ,Forrer,1/1/12,31/12/1912,09/02/1845,1921,1/1/12,12/31/12,0,1,0,1,0,M,1845-02-09,1845,NA,19211245,SWZ-1913,A2.9-3733,225,SWZ,Muller,1/1/13,31/12/1913,12/11/1848,1919,1/1/13,12/31/13,0,1,0,2,0,M,1848-11-12,1848,NA,19191246,SWZ-1914,A2.9-3736,225,SWZ,Hoffman,1/1/14,31/12/1914,08/06/1857,1927,1/1/14,12/31/14,0,1,0,0,0,M,1857-06-08,1857,NA,19271247,SWZ-1915,A2.9-3739,225,SWZ,Motta,1/1/15,31/12/1915,17/12/1871,1940,1/1/15,12/31/15,0,1,0,0,0,M,1871-12-17,1871,NA,19401248,SWZ-1916,A2.9-3742,225,SWZ,Decoppet,1/1/16,31/12/1916,04/06/1862,1925,1/1/16,12/31/16,0,1,0,0,0,M,1862-06-04,1862,NA,19251249,SWZ-1917,A2.9-3745,225,SWZ,Schulthess,1/1/17,31/12/1917,02/03/1868,1944,1/1/17,12/31/17,0,1,0,0,0,M,1868-03-02,1868,NA,19441250,SWZ-1918,A2.9-3748,225,SWZ,Calonder,1/1/18,31/12/1918,07/10/1863,1952,1/1/18,12/31/18,0,1,0,0,0,M,1863-10-07,1863,NA,19521251,SWZ-1919,A2.9-3751,225,SWZ,Ador,1/1/19,31/12/1919,23/12/1845,31/03/1928,1/1/19,12/31/19,0,1,0,0,0,M,1845-12-23,1845,3/31/28,19281252,SWZ-1920,A2.9-3754,225,SWZ,Motta,1/1/20,31/12/1920,17/12/1871,1940,1/1/20,12/31/20,0,1,0,1,0,M,1871-12-17,1871,NA,19401253,SWZ-1921,A2.9-3757,225,SWZ,Schulthess,1/1/21,31/12/1921,02/03/1868,1944,1/1/21,12/31/21,0,1,0,1,0,M,1868-03-02,1868,NA,19441254,SWZ-1922,A2.9-3760,225,SWZ,Haab,1/1/22,31/12/1922,1865,1939,1/1/22,12/31/22,0,1,0,0,0,M,NA,1865,NA,19391255,SWZ-1923,A2.9-3763,225,SWZ,Scheurer,1/1/23,31/12/1923,1872,1929,1/1/23,12/31/23,0,1,0,0,0,M,NA,1872,NA,19291256,SWZ-1924,A2.9-3766,225,SWZ,Chuard,1/1/24,31/12/1924,1857,1942,1/1/24,12/31/24,0,1,0,0,0,M,NA,1857,NA,19421257,SWZ-1925,A2.9-3769,225,SWZ,Musy,1/1/25,31/12/1925,10/04/1876,1952,1/1/25,12/31/25,0,1,0,0,0,M,1876-04-10,1876,NA,19521258,SWZ-1926,A2.9-3772,225,SWZ,Haberlin,1/1/26,31/12/1926,06/09/1868,1947,1/1/26,12/31/26,0,1,0,0,0,M,1868-09-06,1868,NA,19471259,SWZ-1927,A2.9-3775,225,SWZ,Motta,1/1/27,31/12/1927,17/12/1871,1940,1/1/27,12/31/27,0,1,0,2,0,M,1871-12-17,1871,NA,19401260,SWZ-1928,A2.9-3778,225,SWZ,Schulthess,1/1/28,31/12/1928,02/03/1868,1944,1/1/28,12/31/28,0,1,0,2,0,M,1868-03-02,1868,NA,19441261,SWZ-1929,A2.9-3781,225,SWZ,Haab,1/1/29,31/12/1929,1865,1939,1/1/29,12/31/29,0,1,0,1,0,M,NA,1865,NA,19391262,SWZ-1930,A2.9-3784,225,SWZ,Musy,1/1/30,31/12/1930,10/04/1876,1952,1/1/30,12/31/30,0,1,0,1,0,M,1876-04-10,1876,NA,19521263,SWZ-1931,A2.9-3787,225,SWZ,Haberlin,1/1/31,31/12/1931,06/09/1868,1947,1/1/31,12/31/31,0,1,0,1,0,M,1868-09-06,1868,NA,19471264,SWZ-1932,A2.9-3790,225,SWZ,Motta,1/1/32,31/12/1932,17/12/1871,1940,1/1/32,12/31/32,0,1,0,3,0,M,1871-12-17,1871,NA,19401265,SWZ-1933,A2.9-3793,225,SWZ,Schulthess,1/1/33,31/12/1933,02/03/1868,1944,1/1/33,12/31/33,0,1,0,3,0,M,1868-03-02,1868,NA,19441266,SWZ-1934,A2.9-3796,225,SWZ,Golaz,1/1/34,31/12/1934,31/12/1889,1958,1/1/34,12/31/34,0,1,0,0,0,M,1889-12-31,1889,NA,19581267,SWZ-1935,A2.9-3799,225,SWZ,Minger,1/1/35,31/12/1935,12/11/1881,1955,1/1/35,12/31/35,0,1,0,0,0,M,1881-11-12,1881,NA,19551268,SWZ-1936,A2.9-3802,225,SWZ,Meyer,1/1/36,31/12/1936,12/03/1870,1953,1/1/36,12/31/36,0,1,0,0,0,M,1870-03-12,1870,NA,19531269,SWZ-1937,A2.9-3805,225,SWZ,Motta,1/1/37,31/12/1937,17/12/1871,1940,1/1/37,12/31/37,0,1,0,4,0,M,1871-12-17,1871,NA,19401270,SWZ-1938,A2.9-3808,225,SWZ,Baumann,1/1/38,31/12/1938,27/11/1874,1953,1/1/38,12/31/38,0,1,0,0,0,M,1874-11-27,1874,NA,19531271,SWZ-1939,A2.9-3811,225,SWZ,Etter,1/1/39,31/12/1939,21/12/1891,1977,1/1/39,12/31/39,0,1,0,0,0,M,1891-12-21,1891,NA,19771272,SWZ-1940,A2.9-3814,225,SWZ,Golaz,1/1/40,31/12/1940,31/12/1889,1958,1/1/40,12/31/40,0,1,0,1,0,M,1889-12-31,1889,NA,19581273,SWZ-1941,A2.9-3817,225,SWZ,Wetter,1/1/41,31/12/1941,27/08/1877,1965,1/1/41,12/31/41,0,1,0,0,0,M,1877-08-27,1877,NA,19651274,SWZ-1942,A2.9-3820,225,SWZ,Etter,1/1/42,31/12/1942,21/12/1891,1977,1/1/42,12/31/42,0,1,0,1,0,M,1891-12-21,1891,NA,19771275,SWZ-1943,A2.9-3823,225,SWZ,Celio,1/1/43,31/12/1943,19/06/1889,1980,1/1/43,12/31/43,0,1,0,0,0,M,1889-06-19,1889,NA,19801276,SWZ-1944,A2.9-3826,225,SWZ,Stampfli,1/1/44,31/12/1944,03/12/1884,1965,1/1/44,12/31/44,0,1,0,0,0,M,1884-12-03,1884,NA,19651277,SWZ-1945,A2.9-3829,225,SWZ,von Steiger,1/1/45,31/12/1945,02/07/1881,1962,1/1/45,12/31/45,0,1,0,0,0,M,1881-07-02,1881,NA,19621278,SWZ-1946,A2.9-3832,225,SWZ,Kobelt,1/1/46,31/12/1946,01/08/1891,1968,1/1/46,12/31/46,0,1,0,0,0,M,1891-08-01,1891,NA,19681279,SWZ-1947,A2.9-3835,225,SWZ,Etter,1/1/47,31/12/1947,21/12/1891,1977,1/1/47,12/31/47,0,1,0,2,0,M,1891-12-21,1891,NA,19771280,SWZ-1948,A2.9-3838,225,SWZ,Celio,1/1/48,31/12/1948,19/06/1889,1980,1/1/48,12/31/48,0,1,0,1,0,M,1889-06-19,1889,NA,19801281,SWZ-1949,A2.9-3841,225,SWZ,Nobs,1/1/49,31/12/1949,14/07/1886,1957,1/1/49,12/31/49,0,1,0,0,0,M,1886-07-14,1886,NA,19571282,SWZ-1950,A2.9-3844,225,SWZ,Petipierre,1/1/50,31/12/1950,26/02/1899,1994,1/1/50,12/31/50,0,1,0,0,0,M,1899-02-26,1899,NA,19941283,SWZ-1951,A2.9-3847,225,SWZ,von Steiger,1/1/51,31/12/1951,02/07/1881,1962,1/1/51,12/31/51,0,1,0,1,0,M,1881-07-02,1881,NA,19621284,SWZ-1952,A2.9-3850,225,SWZ,Kobelt,1/1/52,31/12/1952,01/08/1891,1968,1/1/52,12/31/52,0,1,0,1,0,M,1891-08-01,1891,NA,19681285,SWZ-1953,A2.9-3853,225,SWZ,Etter,1/1/53,31/12/1953,21/12/1891,1977,1/1/53,12/31/53,0,1,0,3,0,M,1891-12-21,1891,NA,19771286,SWZ-1954,A2.9-3856,225,SWZ,Rubattel,1/1/54,31/12/1954,04/09/1896,1961,1/1/54,12/31/54,0,1,0,0,0,M,1896-09-04,1896,NA,19611287,SWZ-1955,A2.9-3859,225,SWZ,Petipierre,1/1/55,31/12/1955,26/02/1899,1994,1/1/55,12/31/55,0,1,0,1,0,M,1899-02-26,1899,NA,19941288,SWZ-1956,A2.9-3862,225,SWZ,Feldmann,1/1/56,31/12/1956,21/05/1897,1958,1/1/56,12/31/56,0,1,0,0,0,M,1897-05-21,1897,NA,19581289,SWZ-1957,A2.9-3865,225,SWZ,Streuli,1/1/57,31/12/1957,13/07/1892,1970,1/1/57,12/31/57,0,1,0,0,0,M,1892-07-13,1892,NA,19701290,SWZ-1958,A2.9-3868,225,SWZ,Holenstein,1/1/58,31/12/1958,07/12/1896,1962,1/1/58,12/31/58,0,1,0,0,0,M,1896-12-07,1896,NA,19621291,SWZ-1959,A2.9-3871,225,SWZ,Chaudet,1/1/59,31/12/1959,17/11/1901,1977,1/1/59,12/31/59,0,1,0,0,0,M,11/17/01,1901,NA,19771292,SWZ-1960,A2.9-3874,225,SWZ,Petipierre,1/1/60,31/12/1960,26/02/1899,1994,1/1/60,12/31/60,0,1,0,2,0,M,1899-02-26,1899,NA,19941293,SWZ-1961,A2.9-3877,225,SWZ,Friedrich,1/1/61,31/12/1961,10/04/1899,1985,1/1/61,12/31/61,0,1,0,0,0,M,1899-04-10,1899,NA,19851294,SWZ-1962,A2.9-3880,225,SWZ,Chaudet,1/1/62,31/12/1962,17/11/1901,1977,1/1/62,12/31/62,0,1,0,1,0,M,11/17/01,1901,NA,19771295,SWZ-1963,A2.9-3883,225,SWZ,Spuhler,1/1/63,31/12/1963,31/01/1902,1990,1/1/63,12/31/63,0,1,0,0,0,M,1/31/02,1902,NA,19901296,SWZ-1964,A2.9-3886,225,SWZ,von Moos,1/1/64,31/12/1964,31/01/1910,1990,1/1/64,12/31/64,0,1,0,0,0,M,1/31/10,1910,NA,19901297,SWZ-1965,A2.9-3889,225,SWZ,Tschudi,1/1/65,31/12/1965,22/10/1923,2002,1/1/65,12/31/65,0,1,0,0,0,M,10/22/23,1923,NA,20021298,SWZ-1966,A2.9-3892,225,SWZ,Schaffner,1/1/66,31/12/1966,16/12/1908,2004,1/1/66,12/31/66,0,1,0,0,0,M,12/16/08,1908,NA,20041299,SWZ-1967,A2.9-3895,225,SWZ,Bonvin,1/1/67,31/12/1967,12/9/07,1982,1/1/67,12/31/67,0,1,0,0,0,M,9/12/07,1907,NA,19821300,SWZ-1968,A2.9-3898,225,SWZ,Spuhler,1/1/68,31/12/1968,31/01/1902,1990,1/1/68,12/31/68,0,1,0,1,0,M,1/31/02,1902,NA,19901301,SWZ-1969,A2.9-3901,225,SWZ,von Moos,1/1/69,31/12/1969,31/01/1910,1990,1/1/69,12/31/69,0,1,0,1,0,M,1/31/10,1910,NA,19901302,SWZ-1970,A2.9-3904,225,SWZ,Tschudi,1/1/70,31/12/1970,22/10/1923,2002,1/1/70,12/31/70,0,1,0,1,0,M,10/22/23,1923,NA,20021303,SWZ-1971,A2.9-3907,225,SWZ,Gnagi,1/1/71,31/12/1971,3/8/17,1985,1/1/71,12/31/71,0,1,0,0,0,M,8/3/17,1917,NA,19851304,SWZ-1972,A2.9-3910,225,SWZ,Celio,1/1/72,31/12/1972,12/2/14,1980,1/1/72,12/31/72,0,1,0,0,0,M,2/12/14,1914,NA,19801305,SWZ-1973,A2.9-3913,225,SWZ,Bonvin,1/1/73,31/12/1973,12/9/07,1982,1/1/73,12/31/73,0,1,0,1,0,M,9/12/07,1907,NA,19821306,SWZ-1974,A2.9-3916,225,SWZ,Brugger,1/1/74,31/12/1974,10/3/14,21/06/1998,1/1/74,12/31/74,0,1,0,0,0,M,3/10/14,1914,6/21/98,19981307,SWZ-1975,A2.9-3919,225,SWZ,Graber,1/1/75,31/12/1975,6/12/08,2003,1/1/75,12/31/75,0,1,0,0,0,M,12/6/08,1908,NA,20031308,SWZ-1976,A2.9-3922,225,SWZ,Gnagi,1/1/76,31/12/1976,3/8/17,1985,1/1/76,12/31/76,0,1,0,1,0,M,8/3/17,1917,NA,19851309,SWZ-1977,A2.9-3925,225,SWZ,Furgler,1/1/77,31/12/1977,1924,-777,1/1/77,12/31/77,0,1,0,0,0,M,NA,1924,NA,-7771310,SWZ-1978,A2.9-3928,225,SWZ,Ritschard,1/1/78,31/12/1978,1918,1983,1/1/78,12/31/78,0,1,0,0,0,M,NA,1918,NA,19831311,SWZ-1979,A2.9-3931,225,SWZ,Hurlimann,1/1/79,31/12/1979,1918,1994,1/1/79,12/31/79,0,1,0,0,0,M,NA,1918,NA,19941312,SWZ-1980,A2.9-3934,225,SWZ,Chevallaz,1/1/80,31/12/1980,7/2/15,8/9/02,1/1/80,12/31/80,0,1,0,0,0,M,2/7/15,1915,9/8/02,20021313,SWZ-1981,A2.9-3937,225,SWZ,Furgler,1/1/81,31/12/1981,1924,-777,1/1/81,12/31/81,0,1,0,1,0,M,NA,1924,NA,-7771314,SWZ-1982,A2.9-3940,225,SWZ,Honegger,1/1/82,31/12/1982,1917,1999,1/1/82,12/31/82,0,1,0,0,0,M,NA,1917,NA,19991315,SWZ-1983,A2.9-3943,225,SWZ,Aubert,1/1/83,31/12/1983,1927,-777,1/1/83,12/31/83,0,1,0,0,0,M,NA,1927,NA,-7771316,SWZ-1984,A2.9-3946,225,SWZ,Schlumpf,1/1/84,31/12/1984,1925,-777,1/1/84,12/31/84,0,1,0,0,0,M,NA,1925,NA,-7771317,SWZ-1985,A2.9-3949,225,SWZ,Furgler,1/1/85,31/12/1985,1924,-777,1/1/85,12/31/85,0,1,0,2,0,M,NA,1924,NA,-7771318,SWZ-1986,A2.9-3952,225,SWZ,Egli,1/1/86,31/12/1986,1924,-777,1/1/86,12/31/86,0,1,0,0,0,M,NA,1924,NA,-7771319,SWZ-1987,A2.9-3955,225,SWZ,Aubert,1/1/87,31/12/1987,1927,-777,1/1/87,12/31/87,0,1,0,1,0,M,NA,1927,NA,-7771320,SWZ-1988,A2.9-3958,225,SWZ,Stich,1/1/88,31/12/1988,1927,-777,1/1/88,12/31/88,0,1,0,0,0,M,NA,1927,NA,-7771321,SWZ-1989,A2.9-3961,225,SWZ,Delamuraz,1/1/89,31/12/1989,1/4/36,4/10/98,1/1/89,12/31/89,0,1,0,0,0,M,4/1/36,1936,10/4/98,19981322,SWZ-1990,A2.9-3964,225,SWZ,Koller,1/1/90,31/12/1990,1933,-777,1/1/90,12/31/90,0,1,0,0,0,M,NA,1933,NA,-7771323,SWZ-1991,A2.9-3967,225,SWZ,Cotti,1/1/91,31/12/1991,1939,-777,1/1/91,12/31/91,0,1,0,0,0,M,NA,1939,NA,-7771324,SWZ-1992,A2.9-3970,225,SWZ,Felber,1/1/92,31/12/1992,1933,-777,1/1/92,12/31/92,0,1,0,0,0,M,NA,1933,NA,-7771325,SWZ-1993,A2.9-3973,225,SWZ,Ogi,1/1/93,31/12/1993,18/07/1942,-777,1/1/93,12/31/93,0,1,0,0,0,M,7/18/42,1942,NA,-7771326,SWZ-1994,A2.9-3976,225,SWZ,Stich,1/1/94,31/12/1994,1927,-777,1/1/94,12/31/94,0,1,0,1,0,M,NA,1927,NA,-7771327,SWZ-1995,A2.9-3979,225,SWZ,Villiger,1/1/95,31/12/1995,1941,-777,1/1/95,12/31/95,0,1,0,0,0,M,NA,1941,NA,-7771328,SWZ-1996,A2.9-3982,225,SWZ,Delamuraz,1/1/96,31/12/1996,1/4/36,4/10/98,1/1/96,12/31/96,0,1,0,1,0,M,4/1/36,1936,10/4/98,19981329,SWZ-1997,A2.9-3985,225,SWZ,Koller,1/1/97,31/12/1997,1933,-777,1/1/97,12/31/97,0,1,0,1,0,M,NA,1933,NA,-7771330,SWZ-1998,A2.9-3988,225,SWZ,Cotti,1/1/98,31/12/1998,1939,-777,1/1/98,12/31/98,0,1,0,1,0,M,NA,1939,NA,-7771331,SWZ-1999,A2.9-3991,225,SWZ,Dreifuss,1/1/99,31/12/1999,9/1/40,-777,1/1/99,12/31/99,0,1,0,0,0,F,1/9/40,1940,NA,-7771332,SWZ-2000,A2.9-3994,225,SWZ,Ogi,1/1/00,31/12/2000,1942,-777,1/1/00,12/31/00,0,1,0,1,0,M,NA,1942,NA,-7771333,SWZ-2001,A2.9-3997,225,SWZ,Leuenberger,1/1/01,31/12/2001,21/09/1946,-777,1/1/01,12/31/01,0,1,0,0,0,M,9/21/46,1946,NA,-7771334,SWZ-2002,A2.9-4000,225,SWZ,Villiger,1/1/02,31/12/2002,1941,-777,1/1/02,12/31/02,0,1,0,1,0,M,NA,1941,NA,-7771335,SWZ-2003,A2.9-4003,225,SWZ,Pascal Couchepin,1/1/03,31/12/2003,1942,-777,1/1/03,12/31/03,0,1,0,0,0,M,NA,1942,NA,-7771336,SWZ-2004,A2.9-4006,225,SWZ,Joseph Deiss,1/1/04,31/12/2004,1946,-777,1/1/04,12/31/04,0,1,0,0,-888,M,NA,1946,NA,-7771337,SPN-1874,A2.9-4009,230,SPN,del Castillo,30/12/1874,10/09/1875,08/02/1828,1897,1874-12-30,1875-09-10,0,1,0,0,0,M,1828-02-08,1828,NA,18971338,SPN-1875-1,A2.9-4012,230,SPN,Jovellar,11/09/1875,02/12/1875,1819,1892,1875-09-11,1875-12-02,0,1,0,0,0,M,NA,1819,NA,18921339,SPN-1875-2,A2.9-4015,230,SPN,del Castillo,02/12/1875,07/03/1879,08/02/1828,1897,1875-12-02,1879-03-07,0,1,0,1,0,M,1828-02-08,1828,NA,18971340,SPN-1879-1,A2.9-4018,230,SPN,Martinez-Campos,07/03/1879,09/12/1879,12/12/1831,1900,1879-03-07,1879-12-09,0,1,0,1,0,M,1831-12-12,1831,NA,19001341,SPN-1879-2,A2.9-4021,230,SPN,del Castillo,09/12/1879,08/02/1881,08/02/1828,1897,1879-12-09,1881-02-08,0,1,0,2,0,M,1828-02-08,1828,NA,18971342,SPN-1881,A2.9-4024,230,SPN,Sagasta,08/02/1881,13/10/1883,21/07/1827,1903,1881-02-08,1883-10-13,0,1,0,2,0,M,1827-07-21,1827,NA,19031343,SPN-1883,A2.9-4027,230,SPN,Herrera,13/10/1883,18/01/1884,1815,1885,1883-10-13,1884-01-18,0,1,0,0,0,M,NA,1815,NA,18851344,SPN-1884,A2.9-4030,230,SPN,del Castillo,18/01/1884,27/11/1885,08/02/1828,1897,1884-01-18,1885-11-27,0,1,0,3,0,M,1828-02-08,1828,NA,18971345,SPN-1885,A2.9-4033,230,SPN,Sagasta,27/11/1885,05/07/1890,21/07/1827,1903,1885-11-27,1890-07-05,0,1,0,3,0,M,1827-07-21,1827,NA,19031346,SPN-1890,A2.9-4036,230,SPN,del Castillo,05/07/1890,11/12/1892,08/02/1828,1897,1890-07-05,1892-12-11,0,1,0,4,0,M,1828-02-08,1828,NA,18971347,SPN-1892,A2.9-4039,230,SPN,Sagasta,11/12/1892,23/03/1895,21/07/1827,1903,1892-12-11,1895-03-23,0,1,0,4,0,M,1827-07-21,1827,NA,19031348,SPN-1895,A2.9-4042,230,SPN,del Castillo,23/03/1895,08/08/1897,08/02/1828,1897,1895-03-23,1897-08-08,0,3,-999,5,3,M,1828-02-08,1828,NA,18971349,SPN-1897-1,A2.9-4045,230,SPN,Azcarraga y Palmero,08/08/1897,04/10/1897,04/09/1832,1915,1897-08-08,1897-10-04,0,1,0,0,0,M,1832-09-04,1832,NA,19151350,SPN-1897-2,A2.9-4048,230,SPN,Sagasta,04/10/1897,05/03/1899,21/07/1827,1903,1897-10-04,1899-03-05,0,1,0,5,0,M,1827-07-21,1827,NA,19031351,SPN-1899,A2.9-4051,230,SPN,Le-Vielleuze,05/03/1899,22/10/1900,15/12/1843,1905,1899-03-05,10/22/00,0,1,0,0,0,M,1843-12-15,1843,NA,19051352,SPN-1900,A2.9-4054,230,SPN,Azcarraga y Palmero,22/10/1900,26/02/1901,04/09/1832,1915,10/22/00,2/26/01,0,1,0,1,0,M,1832-09-04,1832,NA,19151353,SPN-1901,A2.9-4057,230,SPN,Sagasta,26/02/1901,6/12/02,21/07/1827,1903,2/26/01,12/6/02,0,1,0,6,0,M,1827-07-21,1827,NA,19031354,SPN-1902,A2.9-4060,230,SPN,Le-Vielleuze,6/12/02,20/07/1903,15/12/1843,1905,12/6/02,7/20/03,0,1,0,1,0,M,1843-12-15,1843,NA,19051355,SPN-1903-1,A2.9-4063,230,SPN,Villaverde,20/07/1903,6/12/03,20/01/1848,1905,7/20/03,12/6/03,0,1,0,0,0,M,1848-01-20,1848,NA,19051356,SPN-1903-2,A2.9-4066,230,SPN,Maura y Montaner,6/12/03,16/12/1904,02/05/1853,1925,12/6/03,12/16/04,0,1,0,0,0,M,1853-05-02,1853,NA,19251357,SPN-1904,A2.9-4069,230,SPN,Azcarraga y Palmero,16/12/1904,27/01/1905,04/09/1832,1915,12/16/04,1/27/05,0,1,0,2,0,M,1832-09-04,1832,NA,19151358,SPN-1905-1,A2.9-4072,230,SPN,Villaverde,27/01/1905,23/06/1905,20/01/1848,1905,1/27/05,6/23/05,0,1,0,1,0,M,1848-01-20,1848,NA,19051359,SPN-1905-2,A2.9-4075,230,SPN,Rios,23/06/1905,1/12/05,12/11/1832,1914,6/23/05,12/1/05,0,1,0,0,0,M,1832-11-12,1832,NA,19141360,SPN-1905-3,A2.9-4078,230,SPN,Moret y Prendergast,1/12/05,5/7/06,02/07/1838,1913,12/1/05,7/5/06,0,1,0,0,0,M,1838-07-02,1838,NA,19131361,SPN-1906-1,A2.9-4081,230,SPN,Dominguez,5/7/06,30/11/1906,29/11/1829,1911,7/5/06,11/30/06,0,1,0,0,0,M,1829-11-29,1829,NA,19111362,SPN-1906-2,A2.9-4084,230,SPN,Moret y Prendergast,30/11/1906,4/12/06,02/07/1838,1913,11/30/06,12/4/06,0,1,0,1,0,M,1838-07-02,1838,NA,19131363,SPN-1906-3,A2.9-4087,230,SPN,Aguilar y Correa,4/12/06,24/01/1907,30/06/1824,1908,12/4/06,1/24/07,0,1,0,0,0,M,1824-06-30,1824,NA,19081364,SPN-1907,A2.9-4090,230,SPN,Maura y Montaner,24/01/1907,21/10/1909,02/05/1853,1925,1/24/07,10/21/09,0,1,0,1,0,M,1853-05-02,1853,NA,19251365,SPN-1909,A2.9-4093,230,SPN,Moret y Prendergast,21/10/1909,9/2/10,02/07/1838,1913,10/21/09,2/9/10,0,1,0,2,0,M,1838-07-02,1838,NA,19131366,SPN-1910,A2.9-4096,230,SPN,Canalejas y Mendez,9/2/10,12/11/12,03/07/1854,1912,2/9/10,11/12/12,0,3,-999,0,3,M,1854-07-03,1854,NA,19121367,SPN-1912-1,A2.9-4099,230,SPN,Figueroa y Torres,12/11/12,15/11/1912,01/08/1863,1950,11/12/12,11/15/12,0,1,0,0,0,M,1863-08-01,1863,NA,19501368,SPN-1912-2,A2.9-4102,230,SPN,Garcia Prieto,15/11/1912,27/10/1913,05/11/1859,1938,11/15/12,10/27/13,0,1,0,0,0,M,1859-11-05,1859,NA,19381369,SPN-1913,A2.9-4105,230,SPN,Dato y Iradier,27/10/1913,9/12/15,12/08/1856,1921,10/27/13,12/9/15,0,1,0,0,0,M,1856-08-12,1856,NA,19211370,SPN-1915,A2.9-4108,230,SPN,Figueroa y Torres,9/12/15,19/04/1917,01/08/1863,1950,12/9/15,4/19/17,0,1,0,1,0,M,1863-08-01,1863,NA,19501371,SPN-1917-1,A2.9-4111,230,SPN,Garcia Prieto,19/04/1917,11/6/17,05/11/1859,1938,4/19/17,6/11/17,0,1,0,1,0,M,1859-11-05,1859,NA,19381372,SPN-1917-2,A2.9-4114,230,SPN,Dato y Iradier,11/6/17,3/11/17,12/08/1856,1921,6/11/17,11/3/17,0,1,0,1,0,M,1856-08-12,1856,NA,19211373,SPN-1917-3,A2.9-4117,230,SPN,Garcia Prieto,3/11/17,22/03/1918,05/11/1859,1938,11/3/17,3/22/18,0,1,0,2,0,M,1859-11-05,1859,NA,19381374,SPN-1918-1,A2.9-4120,230,SPN,Maura y Montaner,22/03/1918,9/11/18,02/05/1853,1925,3/22/18,11/9/18,0,1,0,2,0,M,1853-05-02,1853,NA,19251375,SPN-1918-2,A2.9-4123,230,SPN,Garcia Prieto,9/11/18,5/12/18,05/11/1859,1938,11/9/18,12/5/18,0,1,0,3,0,M,1859-11-05,1859,NA,19381376,SPN-1918-3,A2.9-4126,230,SPN,Figueroa y Torres,5/12/18,14/04/1919,01/08/1863,1950,12/5/18,4/14/19,0,3,2,2,0,M,1863-08-01,1863,NA,19501377,SPN-1919-1,A2.9-4129,230,SPN,Maura y Montaner,14/04/1919,20/07/1919,02/05/1853,1925,4/14/19,7/20/19,0,1,0,3,0,M,1853-05-02,1853,NA,19251378,SPN-1919-2,A2.9-4132,230,SPN,de Toca,20/07/1919,12/12/19,1852,1942,7/20/19,12/12/19,0,1,0,0,0,M,NA,1852,NA,19421379,SPN-1919-3,A2.9-4135,230,SPN,Allende Salazar,12/12/19,5/5/20,1856,1923,12/12/19,5/5/20,0,1,0,0,0,M,NA,1856,NA,19231380,SPN-1920,A2.9-4138,230,SPN,Dato y Iradier,5/5/20,8/3/21,12/08/1856,1921,5/5/20,3/8/21,0,3,11,2,3,M,1856-08-12,1856,NA,19211381,SPN-1921-1,A2.9-4141,230,SPN,Araugo,8/3/21,12/3/21,1861,1932,3/8/21,3/12/21,0,1,0,0,0,M,NA,1861,NA,19321382,SPN-1921-2,A2.9-4144,230,SPN,Allende Salazar,13/03/1921,14/08/1921,1856,1923,3/13/21,8/14/21,0,1,0,1,0,M,NA,1856,NA,19231383,SPN-1921-3,A2.9-4147,230,SPN,Maura y Montaner,14/08/1921,8/3/22,02/05/1853,1925,8/14/21,3/8/22,0,1,0,3,0,M,1853-05-02,1853,NA,19251384,SPN-1922-1,A2.9-4150,230,SPN,Sanchez Guerra,8/3/22,5/12/22,1859,1925,3/8/22,12/5/22,0,3,8,0,1,M,NA,1859,NA,19251385,SPN-1922-2,A2.9-4153,230,SPN,Garcia Prieto,5/12/22,14/9/1923,05/11/1859,1938,12/5/22,9/14/23,0,3,6,4,0,M,1859-11-05,1859,NA,19381386,SPN-1923,A2.9-4156,230,SPN,de Rivera,14/9/1923,28/01/1930,09/01/1870,6/3/30,9/14/23,1/28/30,1,1,0,0,1,M,1870-01-09,1870,3/6/30,19301387,SPN-1930,A2.9-4159,230,SPN,Berenguer,30/01/1930,14/02/1931,04/08/1873,19/05/1953,1/30/30,2/14/31,1,1,0,0,2,M,1873-08-04,1873,5/19/53,19531388,SPN-1931-1,A2.9-4162,230,SPN,Azmar-Cabanas,18/02/1931,14/04/1931,1860,1933,2/18/31,4/14/31,0,3,2,0,0,M,NA,1860,NA,19331389,SPN-1931-2,A2.9-4165,230,SPN,Alcala Zamora,14/04/1931,14/10/1931,06/07/1877,1949,4/14/31,10/14/31,1,1,0,0,0,M,1877-07-06,1877,NA,19491390,SPN-1931-3,A2.9-4168,230,SPN,Azana y Diez,14/10/1931,8/9/33,10/11/1880,1940,10/14/31,9/8/33,0,1,0,0,0,M,1880-11-10,1880,NA,19401391,SPN-1933-1,A2.9-4171,230,SPN,Lerroux y Garcia,12/9/33,3/10/33,26/02/1866,1949,9/12/33,10/3/33,0,1,0,0,0,M,1866-02-26,1866,NA,19491392,SPN-1933-2,A2.9-4174,230,SPN,Martinez Barro,9/10/33,16/12/1933,25/11/1883,1962,10/9/33,12/16/33,0,1,0,0,0,M,1883-11-25,1883,NA,19621393,SPN-1933-3,A2.9-4177,230,SPN,Lerroux y Garcia,16/12/1933,15/04/1934,26/02/1866,1949,12/16/33,4/15/34,0,1,0,1,0,M,1866-02-26,1866,NA,19491394,SPN-1934-1,A2.9-4180,230,SPN,Ibanez,28/04/1934,1/10/34,25/08/1881,1938,4/28/34,10/1/34,0,1,0,0,0,M,1881-08-25,1881,NA,19381395,SPN-1934-2,A2.9-4183,230,SPN,Lerroux y Garcia,10/10/34,20/10/1935,26/02/1866,1949,10/10/34,10/20/35,0,1,0,2,0,M,1866-02-26,1866,NA,19491396,SPN-1935-1,A2.9-4186,230,SPN,Chapaprieta,25/10/1935,9/12/35,26/10/1871,1951,10/25/35,12/9/35,0,1,0,0,0,M,1871-10-26,1871,NA,19511397,SPN-1935-2,A2.9-4189,230,SPN,Portela,31/12/1935,19/02/1936,1868,1952,12/31/35,2/19/36,0,1,0,0,0,M,NA,1868,NA,19521398,SPN-1936-1,A2.9-4192,230,SPN,Azana y Diez,19/02/1936,11/5/36,10/11/1880,1940,2/19/36,5/11/36,0,1,0,1,1,M,1880-11-10,1880,NA,19401399,SPN-1936-2,A2.9-4195,230,SPN,Casares Quiroga,13/05/1936,19/07/1936,1884,1950,5/13/36,7/19/36,0,1,0,0,0,M,NA,1884,NA,19501400,SPN-1936-3,A2.9-4198,230,SPN,Martinez Barro,19/07/1936,19/07/1936,25/11/1883,1962,7/19/36,7/19/36,0,1,0,1,0,M,1883-11-25,1883,NA,19621401,SPN-1936-4,A2.9-4201,230,SPN,Giral y Pereyra,19/07/1936,4/9/36,22/10/1879,1962,7/19/36,9/4/36,0,1,0,0,0,M,1879-10-22,1879,NA,19621402,SPN-1936-5,A2.9-4204,230,SPN,Largo Caballero,4/9/36,15/05/1937,15/10/1869,1946,9/4/36,5/15/37,0,1,0,0,0,M,1869-10-15,1869,NA,19461403,SPN-1937,A2.9-4207,230,SPN,Negrin,18/05/1937,5/3/39,1889,1956,5/18/37,3/5/39,0,3,6,0,1,M,NA,1889,NA,19561404,SPN-1939-1,A2.9-4210,230,SPN,Miaja,5/3/39,31/03/1939,1878,14/01/1958,3/5/39,3/31/39,1,3,3,0,1,M,NA,1878,1/14/58,19581405,SPN-1939-2,A2.9-4213,230,SPN,Franco,1/4/39,30/10/1975,04/12/1892,20/11/1975,4/1/39,10/30/75,1,2,0,0,-777,M,1892-12-04,1892,11/20/75,19751406,SPN-1975-1,A2.9-4216,230,SPN,Juan Carlos,1/11/75,8/11/75,5/1/28,-777,11/1/75,11/8/75,0,1,0,0,0,M,1/5/28,1928,NA,-7771407,SPN-1975-2,A2.9-4219,230,SPN,Arias Navarro,9/11/75,1/7/76,11/12/08,27/11/1989,11/9/75,7/1/76,0,1,0,0,0,M,12/11/08,1908,11/27/89,19891408,SPN-1976,A2.9-4222,230,SPN,Suarez Gonzalez,1/7/76,25/02/1981,25/09/1932,-777,7/1/76,2/25/81,0,1,0,0,0,M,9/25/32,1932,NA,-7771409,SPN-1981,A2.9-4225,230,SPN,Calvo-Sotelo,25/02/1981,2/12/82,14/04/1926,-777,2/25/81,12/2/82,0,1,0,0,0,M,4/14/26,1926,NA,-7771410,SPN-1982,A2.9-4228,230,SPN,Gonzalez Marquez,2/12/82,5/5/96,5/3/42,-777,12/2/82,5/5/96,0,1,0,0,0,M,3/5/42,1942,NA,-7771411,SPN-1996,A2.9-4231,230,SPN,Aznar,5/5/96,17/04/2004,25/02/1953,-777,5/5/96,4/17/04,0,1,0,0,0,M,2/25/53,1953,NA,-7771412,SPN-2004,A2.9-4234,230,SPN,Rodriguez Zapatero,17/04/2004,31/12/2004,1960,-777,4/17/04,12/31/04,0,-888,0,0,-888,M,NA,1960,NA,-7771413,POR-1861,A2.9-4237,235,POR,Luis I,11/11/1861,19/10/1889,1838,1889,1861-11-11,1889-10-19,0,2,0,0,-777,M,NA,1838,NA,18891414,POR-1889,A2.9-4240,235,POR,Carlos I,19/10/1889,1/2/08,28/09/1863,1/2/08,1889-10-19,2/1/08,0,3,-999,0,3,M,1863-09-28,1863,2/1/08,19081415,POR-1908,A2.9-4243,235,POR,Manuel II,1/2/08,5/10/10,15/11/1889,2/7/32,2/1/08,10/5/10,0,3,-999,0,1,M,1889-11-15,1889,7/2/32,19321416,POR-1910,A2.9-4246,235,POR,Braga,5/10/10,24/08/1911,1843,1924,10/5/10,8/24/11,1,1,0,0,0,M,NA,1843,NA,19241417,POR-1911,A2.9-4249,235,POR,Arriaga,24/08/1911,29/05/1915,1840,1917,8/24/11,5/29/15,0,1,0,0,0,M,NA,1840,NA,19171418,POR-1915-1,A2.9-4252,235,POR,Braga,29/05/1915,5/10/15,1843,1924,5/29/15,10/5/15,0,1,0,1,0,M,NA,1843,NA,19241419,POR-1915-2,A2.9-4255,235,POR,Machado Guimaraes,5/10/15,8/12/17,28/03/1851,29/04/1944,10/5/15,12/8/17,0,3,-999,0,2,M,1851-03-28,1851,4/29/44,19441420,POR-1917,A2.9-4258,235,POR,Paes,8/12/17,14/12/1918,1872,1918,12/8/17,12/14/18,1,3,-999,0,3,M,NA,1872,NA,19181421,POR-1918,A2.9-4261,235,POR,Joao Canto e Castro,16/12/1918,5/10/19,1862,1934,12/16/18,10/5/19,0,1,0,0,0,M,NA,1862,NA,19341422,POR-1919,A2.9-4264,235,POR,Almeida,5/10/19,6/8/23,1866,1929,10/5/19,8/6/23,0,1,0,0,0,M,NA,1866,NA,19291423,POR-1923,A2.9-4267,235,POR,Gomes,6/8/23,11/12/25,1860,1941,8/6/23,12/11/25,0,2.1,0,0,0,M,NA,1860,NA,19411424,POR-1925,A2.9-4270,235,POR,Machado Guimaraes,16/12/1925,28/05/1926,28/03/1851,29/04/1944,12/16/25,5/28/26,0,3,6,1,1,M,1851-03-28,1851,4/29/44,19441425,POR-1926,A2.9-4273,235,POR,Carmona,28/05/1926,5/7/32,29/11/1869,1951,5/28/26,7/5/32,1,1,0,0,0,M,1869-11-29,1869,NA,19511426,POR-1932,A2.9-4276,235,POR,Salazar,5/7/32,16/09/1968,1889,1970,7/5/32,9/16/68,0,2,0,0,-777,M,NA,1889,NA,19701427,POR-1968,A2.9-4279,235,POR,Caetano,27/09/1968,25/04/1974,17/08/1906,26/10/1980,9/27/68,4/25/74,0,3,6,0,1,M,8/17/06,1906,10/26/80,19801428,POR-1974-1,A2.9-4282,235,POR,Spinola,25/04/1974,30/09/1974,11/4/10,13/08/1996,4/25/74,9/30/74,1,1,0,0,2,M,4/11/10,1910,8/13/96,19961429,POR-1974-2,A2.9-4285,235,POR,Costa Gomes,30/09/1974,23/07/1976,30/06/1914,2001,9/30/74,7/23/76,0,1,0,0,0,M,6/30/14,1914,NA,20011430,POR-1976,A2.9-4288,235,POR,Eanes,23/07/1976,9/3/86,25/01/1914,-777,7/23/76,3/9/86,0,1,0,0,0,M,1/25/14,1914,NA,-7771431,POR-1986,A2.9-4291,235,POR,Soares,9/3/86,9/3/96,7/12/24,-777,3/9/86,3/9/96,0,1,0,0,0,M,12/7/24,1924,NA,-7771432,POR-1996,A2.9-4294,235,POR,Sampaio,9/3/96,31/12/2004,1939,-777,3/9/96,12/31/04,0,-888,0,0,-888,M,NA,1939,NA,-7771433,BAV-1864,A2.9-4297,245,BAV,Ludwig II,10/03/1864,06/04/1871,1831,1886,1864-03-10,1871-04-06,0,4,9,0,0,M,NA,1831,NA,18861434,GMY-1858,A2.9-4300,255,GMY,Wilhelm I,07/10/1858,09/03/1888,22/03/1797,09/03/1888,1858-10-07,1888-03-09,0,2,0,0,-777,M,1797-03-22,1797,1888-03-09,18881435,GMY-1888-1,A2.9-4303,255,GMY,Friedrich III,09/03/1888,15/06/1888,1831,15/06/1888,1888-03-09,1888-06-15,0,1,0,0,0,M,NA,1831,1888-06-15,18881436,GMY-1888-2,A2.9-4306,255,GMY,Wilhelm II,15/06/1888,9/11/18,27/01/1859,4/6/41,1888-06-15,11/9/18,0,3,1,0,1,M,1859-01-27,1859,6/4/41,19411437,GMY-1918,A2.9-4309,255,GMY,Ebert,9/11/18,11/2/19,04/02/1871,28/02/1925,11/9/18,2/11/19,1,1,0,0,0,M,1871-02-04,1871,2/28/25,19251438,GMY-1919-1,A2.9-4312,255,GMY,Scheidemann,12/2/19,20/06/1919,26/07/1865,29/11/1939,2/12/19,6/20/19,0,1,0,0,0,M,1865-07-26,1865,11/29/39,19391439,GMY-1919-2,A2.9-4315,255,GMY,Bauer,21/06/1919,26/03/1920,06/01/1870,16/09/1944,6/21/19,3/26/20,0,1,0,0,0,M,1870-01-06,1870,9/16/44,19441440,GMY-1920-1,A2.9-4318,255,GMY,Muller,27/03/1920,8/6/20,18/05/1876,20/03/1931,3/27/20,6/8/20,0,1,0,0,0,M,1876-05-18,1876,3/20/31,19311441,GMY-1920-2,A2.9-4321,255,GMY,Fehrenback,25/06/1920,4/5/21,11/01/1852,26/03/1926,6/25/20,5/4/21,0,1,0,0,0,M,1852-01-11,1852,3/26/26,19261442,GMY-1921,A2.9-4324,255,GMY,Wirth,10/5/21,14/11/1922,06/09/1879,3/1/56,5/10/21,11/14/22,0,1,0,0,0,M,1879-09-06,1879,1/3/56,19561443,GMY-1922,A2.9-4327,255,GMY,Cuno,22/11/1922,12/8/23,02/07/1876,3/1/33,11/22/22,8/12/23,0,1,0,0,0,M,1876-07-02,1876,1/3/33,19331444,GMY-1923-1,A2.9-4330,255,GMY,Stresemann,13/08/1923,23/11/1923,10/05/1878,3/10/29,8/13/23,11/23/23,0,1,0,0,0,M,1878-05-10,1878,10/3/29,19291445,GMY-1923-2,A2.9-4333,255,GMY,Marx,30/11/1923,15/12/1924,15/01/1863,5/8/46,11/30/23,12/15/24,0,1,0,0,0,M,1863-01-15,1863,8/5/46,19461446,GMY-1925,A2.9-4336,255,GMY,Luther,15/01/1925,12/5/26,10/03/1879,11/5/62,1/15/25,5/12/26,0,1,0,0,0,M,1879-03-10,1879,5/11/62,19621447,GMY-1926,A2.9-4339,255,GMY,Marx,16/05/1926,12/6/28,15/01/1863,5/8/46,5/16/26,6/12/28,0,1,0,1,0,M,1863-01-15,1863,8/5/46,19461448,GMY-1928,A2.9-4342,255,GMY,Muller,28/06/1928,27/03/1930,18/05/1876,20/03/1931,6/28/28,3/27/30,0,1,0,1,0,M,1876-05-18,1876,3/20/31,19311449,GMY-1930,A2.9-4345,255,GMY,Bruning,30/03/1930,30/05/1932,26/11/1885,30/03/1970,3/30/30,5/30/32,0,1,0,0,0,M,1885-11-26,1885,3/30/70,19701450,GMY-1932-1,A2.9-4348,255,GMY,Papen,1/6/32,17/11/1932,29/10/1879,2/5/69,6/1/32,11/17/32,0,1,0,0,0,M,1879-10-29,1879,5/2/69,19691451,GMY-1932-2,A2.9-4351,255,GMY,Schleicher,3/12/32,28/01/1933,07/04/1882,30/06/1934,12/3/32,1/28/33,0,1,0,0,0,M,1882-04-07,1882,6/30/34,19341452,GMY-1933,A2.9-4354,255,GMY,Hitler,30/01/1933,30/04/1945,20/05/1889,30/04/1945,1/30/33,4/30/45,0,2.2,0,0,-777,M,1889-05-20,1889,4/30/45,19451453,GMY-1945,A2.9-4357,255,GMY,Doenitz,30/04/1945,23/05/1945,16/09/1891,24/12/1980,4/30/45,5/23/45,0,4,9,0,2,M,1891-09-16,1891,12/24/80,19801454,GFR-1949,A2.9-4360,260,GFR,Adenauer,16/09/1949,15/10/1963,05/01/1876,19/04/1967,9/16/49,10/15/63,0,1,0,0,0,M,1876-01-05,1876,4/19/67,19671455,GFR-1963,A2.9-4363,260,GFR,Erhard,16/10/1963,1/12/66,04/02/1897,5/5/77,10/16/63,12/1/66,0,1,0,0,0,M,1897-02-04,1897,5/5/77,19771456,GFR-1966,A2.9-4366,260,GFR,Kiesinger,1/12/66,21/10/1969,6/4/04,9/3/88,12/1/66,10/21/69,0,1,0,0,0,M,4/6/04,1904,3/9/88,19881457,GFR-1969,A2.9-4369,260,GFR,Brandt,22/10/1969,6/5/74,18/12/1913,8/10/92,10/22/69,5/6/74,0,1,0,0,0,M,12/18/13,1913,10/8/92,19921458,GFR-1974,A2.9-4372,260,GFR,Schmidt,16/05/1974,1/10/82,23/12/1918,-777,5/16/74,10/1/82,0,1,0,0,0,M,12/23/18,1918,NA,-7771459,GFR-1982,A2.9-4375,260,GFR,Kohl,1/10/82,27/10/1998,3/4/30,-777,10/1/82,10/27/98,0,1,0,0,0,M,4/3/30,1930,NA,-7771460,GFR-1998,A2.9-4378,260,GFR,Schroder,27/10/1998,31/12/2004,7/4/44,-777,10/27/98,12/31/04,0,-888,0,0,-888,M,4/7/44,1944,NA,-7771461,GDR-1946,A2.9-4381,265,GDR,Wilhelm Pieck,22/04/1946,25/07/1950,1876,1960,4/22/46,7/25/50,1,1,0,0,0,M,NA,1876,NA,19601462,GDR-1950,A2.9-4384,265,GDR,Ulbricht,25/07/1950,3/5/71,30/06/1893,1/8/73,7/25/50,5/3/71,0,1,0,0,0,M,1893-06-30,1893,8/1/73,19731463,GDR-1971,A2.9-4387,265,GDR,Honecker,3/5/71,18/10/1989,25/08/1912,29/05/1994,5/3/71,10/18/89,0,1,0,0,2,M,8/25/12,1912,5/29/94,19941464,GDR-1989-1,A2.9-4390,265,GDR,Krenz,18/10/1989,3/12/89,19/03/1937,-777,10/18/89,12/3/89,0,1,0,0,0,M,3/19/37,1937,NA,-7771465,GDR-1989-2,A2.9-4393,265,GDR,Gysi,9/12/89,3/10/90,16/01/1948,-777,12/9/89,10/3/90,0,4,111,0,0,M,1/16/48,1948,NA,-7771466,POL-1918-1,A2.9-4396,290,POL,Daszynski,11/11/18,13/11/1918,26/10/1866,31/10/1936,11/11/18,11/13/18,1,1,0,0,0,M,1866-10-26,1866,10/31/36,19361467,POL-1918-2,A2.9-4399,290,POL,Pildsudski,14/11/1918,9/12/22,05/12/1867,12/5/35,11/14/18,12/9/22,1,1,0,0,0,M,1867-12-05,1867,5/12/35,19351468,POL-1922-1,A2.9-4402,290,POL,Narutowicz,9/12/22,18/12/1922,17/03/1865,16/12/1922,12/9/22,12/18/22,0,3,11,0,3,M,1865-03-17,1865,12/16/22,19221469,POL-1922-2,A2.9-4405,290,POL,Wojciechowski,20/12/1922,12/5/26,15/03/1869,9/4/53,12/20/22,5/12/26,0,3,6,0,0,M,1869-03-15,1869,4/9/53,19531470,POL-1926,A2.9-4408,290,POL,Pildsudski,12/5/26,12/5/35,05/12/1867,12/5/35,5/12/26,5/12/35,0,2,0,1,-777,M,1867-12-05,1867,5/12/35,19351471,POL-1935,A2.9-4411,290,POL,Smigly-Rydz,12/5/35,18/09/1939,11/03/1866,2/12/41,5/12/35,9/18/39,0,4,9,0,1,M,1866-03-11,1866,12/2/41,19411472,POL-1944,A2.9-4414,290,POL,Bierut,31/12/1944,12/3/56,18/04/1892,12/3/56,12/31/44,3/12/56,1,2,0,0,-777,M,1892-04-18,1892,3/12/56,19561473,POL-1956-1,A2.9-4417,290,POL,Ochab,20/03/1956,21/10/1956,1906,1989,3/20/56,10/21/56,0,1,0,0,0,M,NA,1906,NA,19891474,POL-1956-2,A2.9-4420,290,POL,Gomulka,21/10/1956,20/12/1970,6/2/05,1/9/82,10/21/56,12/20/70,0,3,2,0,0,M,2/6/05,1905,9/1/82,19821475,POL-1970,A2.9-4423,290,POL,Gierek,20/12/1970,6/9/80,6/1/13,29/07/2001,12/20/70,9/6/80,0,2,0,0,-777,M,1/6/13,1913,7/29/01,20011476,POL-1980,A2.9-4426,290,POL,Kania,6/9/80,18/10/1981,8/3/27,-777,9/6/80,10/18/81,0,1,0,0,0,M,3/8/27,1927,NA,-7771477,POL-1981,A2.9-4429,290,POL,Jaruzelski,18/10/1981,22/12/1990,6/7/23,-777,10/18/81,12/22/90,0,1,0,0,0,M,7/6/23,1923,NA,-7771478,POL-1990,A2.9-4432,290,POL,Walesa,22/12/1990,23/12/1995,29/09/1943,-777,12/22/90,12/23/95,0,1,0,0,0,M,9/29/43,1943,NA,-7771479,POL-1995,A2.9-4435,290,POL,Kwasniewski,23/12/1995,31/12/2004,15/11/1954,-777,12/23/95,12/31/04,0,-888,0,0,-888,M,11/15/54,1954,NA,-7771480,AUH-1848,A2.9-4438,300,AUH,Francis Joseph I,02/12/1848,21/11/1916,18/08/1830,21/11/1916,1848-12-02,11/21/16,0,2,0,0,-777,M,1830-08-18,1830,11/21/16,19161481,AUH-1916,A2.9-4441,300,AUH,Karl,21/11/1916,11/11/18,17/08/1887,1/4/22,11/21/16,11/11/18,0,3,1,0,1,M,1887-08-17,1887,4/1/22,19221482,AUS-1918,A2.9-4444,305,AUS,Renner,12/11/18,11/6/20,14/12/1870,31/12/1950,11/12/18,6/11/20,1,1,0,0,0,M,1870-12-14,1870,12/31/50,19501483,AUS-1920,A2.9-4447,305,AUS,Mayr,7/7/20,1/6/21,1864,1922,7/7/20,6/1/21,0,1,0,0,0,M,NA,1864,NA,19221484,AUS-1921,A2.9-4450,305,AUS,Schober,21/06/1921,24/05/1922,14/11/1870,1932,6/21/21,5/24/22,0,1,0,0,0,M,1870-11-14,1870,NA,19321485,AUS-1922,A2.9-4453,305,AUS,Seipel,31/05/1922,1/6/24,19/07/1876,1932,5/31/22,6/1/24,0,1,0,0,0,M,1876-07-19,1876,NA,19321486,AUS-1924,A2.9-4456,305,AUS,Ramek,1/6/24,15/10/1926,12/04/1881,1941,6/1/24,10/15/26,0,1,0,0,0,M,1881-04-12,1881,NA,19411487,AUS-1926,A2.9-4459,305,AUS,Seipel,20/10/1926,3/4/29,19/07/1876,1932,10/20/26,4/3/29,0,1,0,1,0,M,1876-07-19,1876,NA,19321488,AUS-1929-1,A2.9-4462,305,AUS,Streeruwitz,4/5/29,25/09/1929,1874,1952,5/4/29,9/25/29,0,1,0,0,0,M,NA,1874,NA,19521489,AUS-1929-2,A2.9-4465,305,AUS,Schober,26/09/1929,25/09/1930,14/11/1870,1932,9/26/29,9/25/30,0,1,0,1,0,M,1870-11-14,1870,NA,19321490,AUS-1930-1,A2.9-4468,305,AUS,Vaugoin,30/09/1930,29/11/1930,1873,1949,9/30/30,11/29/30,0,1,0,0,0,M,NA,1873,NA,19491491,AUS-1930-2,A2.9-4471,305,AUS,Ender,4/12/30,16/06/1931,24/12/1875,25/06/1960,12/4/30,6/16/31,0,1,0,0,0,M,1875-12-24,1875,6/25/60,19601492,AUS-1931,A2.9-4474,305,AUS,Buresch,20/06/1931,6/5/32,1878,1936,6/20/31,5/6/32,0,1,0,0,0,M,NA,1878,NA,19361493,AUS-1932,A2.9-4477,305,AUS,Dollfuss,20/05/1932,25/07/1934,04/10/1882,25/07/1934,5/20/32,7/25/34,0,3,4,0,3,M,1882-10-04,1882,7/25/34,19341494,AUS-1934,A2.9-4480,305,AUS,Schuschnigg,30/07/1934,11/3/38,14/12/1897,18/11/1977,7/30/34,3/11/38,0,4,9,0,2,M,1897-12-14,1897,11/18/77,19771495,AUS-1938,A2.9-4483,305,AUS,Seyss-Inquart,12/3/38,30/04/1939,22/07/1892,16/10/1946,3/12/38,4/30/39,0,4,111,0,0,M,1892-07-22,1892,10/16/46,19461496,AUS-1945-1,A2.9-4486,305,AUS,Renner,29/04/1945,28/11/1945,14/12/1870,31/12/1950,4/29/45,11/28/45,1,1,0,1,0,M,1870-12-14,1870,12/31/50,19501497,AUS-1945-2,A2.9-4489,305,AUS,Figl,28/11/1945,2/4/53,2/10/02,1965,11/28/45,4/2/53,0,1,0,0,0,M,10/2/02,1902,NA,19651498,AUS-1953,A2.9-4492,305,AUS,Raab,2/4/53,11/4/61,29/11/1891,1964,4/2/53,4/11/61,0,1,0,0,0,M,1891-11-29,1891,NA,19641499,AUS-1961,A2.9-4495,305,AUS,Gorbach,11/4/61,25/02/1964,02/10/1898,1972,4/11/61,2/25/64,0,1,0,0,0,M,1898-10-02,1898,NA,19721500,AUS-1964,A2.9-4498,305,AUS,Klaus,2/4/64,3/3/70,15/08/1910,25/07/2001,4/2/64,3/3/70,0,1,0,0,0,M,8/15/10,1910,7/25/01,20011501,AUS-1970,A2.9-4501,305,AUS,Kreisky,20/04/1970,24/05/1983,22/01/1911,29/07/1990,4/20/70,5/24/83,0,1,0,0,0,M,1/22/11,1911,7/29/90,19901502,AUS-1983,A2.9-4504,305,AUS,Sinowatz,24/05/1983,16/06/1986,5/2/29,-777,5/24/83,6/16/86,0,1,0,0,0,M,2/5/29,1929,NA,-7771503,AUS-1986,A2.9-4507,305,AUS,Vranitzky,16/06/1986,28/01/1997,4/10/37,-777,6/16/86,1/28/97,0,1,0,0,0,M,10/4/37,1937,NA,-7771504,AUS-1997,A2.9-4510,305,AUS,Klima,28/01/1997,4/2/00,4/6/47,-777,1/28/97,2/4/00,0,1,0,0,0,M,6/4/47,1947,NA,-7771505,AUS-2000,A2.9-4513,305,AUS,Schussel,5/2/00,31/12/2004,7/6/45,-777,2/5/00,12/31/04,0,-888,0,0,-888,M,6/7/45,1945,NA,-7771506,HUN-1918,A2.9-4516,310,HUN,Karolyi,16/11/1918,21/03/1919,04/03/1875,1955,11/16/18,3/21/19,0,3,3,0,1,M,1875-03-04,1875,NA,19551507,HUN-1919-1,A2.9-4519,310,HUN,Kun,21/03/1919,1/8/19,20/02/1886,30/11/1939,3/21/19,8/1/19,1,4,9,0,1,M,1886-02-20,1886,11/30/39,19391508,HUN-1919-2,A2.9-4522,310,HUN,Peidl,1/8/19,7/8/19,03/04/1873,1943,8/1/19,8/7/19,1,3,6,0,1,M,1873-04-03,1873,NA,19431509,HUN-1919-3,A2.9-4525,310,HUN,Friedrich,7/8/19,16/11/1919,01/07/1883,1951,8/7/19,11/16/19,1,1,0,0,0,M,1883-07-01,1883,NA,19511510,HUN-1919-4,A2.9-4528,310,HUN,Huszar,23/11/1919,1/3/20,10/09/1882,1941,11/23/19,3/1/20,0,1,0,0,0,M,1882-09-10,1882,NA,19411511,HUN-1920,A2.9-4531,310,HUN,Horthy,1/3/20,15/10/1944,18/06/1868,9/2/57,3/1/20,10/15/44,0,4,9,0,2,M,1868-06-18,1868,2/9/57,19571512,HUN-1945,A2.9-4534,310,HUN,Rakoski,15/01/1945,15/07/1956,14/03/1892,5/2/71,1/15/45,7/15/56,1,3,8,0,1,M,1892-03-14,1892,2/5/71,19711513,HUN-1956-1,A2.9-4537,310,HUN,Gero,18/07/1956,25/10/1956,08/07/1898,12/3/80,7/18/56,10/25/56,1,3,2,0,1,M,1898-07-08,1898,3/12/80,19801514,HUN-1956-2,A2.9-4540,310,HUN,Nagy,25/10/1956,4/11/56,07/06/1896,16/06/1958,10/25/56,11/4/56,1,4,9,0,2,M,1896-06-07,1896,6/16/58,19581515,HUN-1956-3,A2.9-4543,310,HUN,Kadar,4/11/56,22/05/1988,26/05/1912,6/7/89,11/4/56,5/22/88,2,1,0,0,0,M,5/26/12,1912,7/6/89,19891516,HUN-1988,A2.9-4546,310,HUN,Grosz,22/05/1988,7/10/89,1/8/30,7/1/96,5/22/88,10/7/89,0,1,0,0,0,M,8/1/30,1930,1/7/96,19961517,HUN-1989,A2.9-4549,310,HUN,Szuros,18/10/1989,2/5/90,11/9/33,-999,10/18/89,5/2/90,0,1,0,0,0,M,9/11/33,1933,NA,NA1518,HUN-1990,A2.9-4552,310,HUN,Antall,3/5/90,12/12/93,8/4/32,12/12/93,5/3/90,12/12/93,0,2,0,0,-777,M,4/8/32,1932,12/12/93,19931519,HUN-1993,A2.9-4555,310,HUN,Boross,12/12/93,15/07/1994,1928,-777,12/12/93,7/15/94,0,1,0,0,0,M,NA,1928,NA,-7771520,HUN-1994,A2.9-4558,310,HUN,Horn,15/07/1994,6/7/98,1932,-777,7/15/94,7/6/98,0,1,0,0,0,M,NA,1932,NA,-7771521,HUN-1998,A2.9-4561,310,HUN,Orban,6/7/98,27/05/2002,1963,-777,7/6/98,5/27/02,0,1,0,0,0,M,NA,1963,NA,-7771522,HUN-2002,A2.9-4564,310,HUN,Peter Medgyessy,27/05/2002,29/09/2004,19/10/1942,-777,5/27/02,9/29/04,0,1,0,0,-999,M,10/19/42,1942,NA,-7771523,HUN-2004,A2.9-4567,310,HUN,Ferenc Gyurcsany,29/09/2004,31/12/2004,4/6/61,-777,9/29/04,12/31/04,0,-888,0,0,-888,M,6/4/61,1961,NA,-7771524,CZE-1918,A2.9-4570,315,CZE,Masaryk,28/10/1918,14/12/1935,07/03/1850,14/09/1937,10/28/18,12/14/35,0,2.1,0,0,0,M,1850-03-07,1850,9/14/37,19371525,CZE-1935,A2.9-4573,315,CZE,Benes,18/12/1935,5/10/38,28/05/1884,3/9/48,12/18/35,10/5/38,0,1,0,0,1,M,1884-05-28,1884,9/3/48,19481526,CZE-1938-1,A2.9-4576,315,CZE,Syrovy,5/10/38,1/12/38,1888,1971,10/5/38,12/1/38,0,1,0,0,0,M,NA,1888,NA,19711527,CZE-1938-2,A2.9-4579,315,CZE,Hacha,1/12/38,13/05/1945,12/07/1872,1945,12/1/38,5/13/45,2,4,9,0,2,M,1872-07-12,1872,NA,19451528,CZE-1945,A2.9-4582,315,CZE,Benes,13/05/1945,7/6/48,28/05/1884,3/9/48,5/13/45,6/7/48,2,1,0,1,-777,M,1884-05-28,1884,9/3/48,19481529,CZE-1948,A2.9-4585,315,CZE,Gottwald,7/6/48,14/03/1953,23/11/1896,14/03/1953,6/7/48,3/14/53,0,2,0,0,-777,M,1896-11-23,1896,3/14/53,19531530,CZE-1953,A2.9-4588,315,CZE,Zapotocky,21/03/1953,13/11/1957,19/12/1884,1957,3/21/53,11/13/57,0,2,0,0,-777,M,1884-12-19,1884,NA,19571531,CZE-1957,A2.9-4591,315,CZE,Novotny,19/11/1957,5/1/68,10/12/04,28/01/1975,11/19/57,1/5/68,0,1,0,0,0,M,12/10/04,1904,1/28/75,19751532,CZE-1968-1,A2.9-4594,315,CZE,Dubcek,5/1/68,20/08/1968,27/11/1921,7/11/92,1/5/68,8/20/68,0,4,9,0,2,M,11/27/21,1921,11/7/92,19921533,CZE-1968-2,A2.9-4597,315,CZE,Svoboda,20/08/1968,28/08/1968,25/11/1895,20/09/1979,8/20/68,8/28/68,0,4,9,0,0,M,1895-11-25,1895,9/20/79,19791534,CZE-1968-3,A2.9-4600,315,CZE,Husak,28/08/1968,17/12/1989,10/1/13,18/11/1991,8/28/68,12/17/89,2,1,0,0,0,M,1/10/13,1913,11/18/91,19911535,CZE-1989,A2.9-4603,315,CZE,Calfa,17/12/1989,1/7/92,1946,-777,12/17/89,7/1/92,0,1,0,0,0,M,NA,1946,NA,-7771536,CZE-1992,A2.9-4606,315,CZE,Strasky,1/7/92,31/12/1992,1940,-777,7/1/92,12/31/92,0,1,0,0,0,M,NA,1940,NA,-7771537,CZR-1993,A2.9-4609,316,CZR,Klaus,1/1/93,17/12/1997,15/08/1910,-777,1/1/93,12/17/97,0,1,0,0,0,M,8/15/10,1910,NA,-7771538,CZR-1997,A2.9-4612,316,CZR,Tosovsky,17/12/1997,17/07/1998,1950,-777,12/17/97,7/17/98,0,1,0,0,0,M,NA,1950,NA,-7771539,CZR-1998,A2.9-4615,316,CZR,Zeman,17/07/1998,12/7/02,1944,-777,7/17/98,7/12/02,0,1,0,0,0,M,NA,1944,NA,-7771540,CZR-2002,A2.9-4618,316,CZR,Spidla,12/7/02,26/07/2004,22/04/1951,-777,7/12/02,7/26/04,0,1,0,0,-999,M,4/22/51,1951,NA,-7771541,CZR-2004,A2.9-4621,316,CZR,Stanislav Gross,26/07/2004,31/12/2004,30/10/1969,-777,7/26/04,12/31/04,0,-888,0,0,-888,M,10/30/69,1969,NA,-7771542,SLO-1993,A2.9-4624,317,SLO,Meciar,1/1/93,16/03/1994,26/07/1942,-777,1/1/93,3/16/94,0,1,0,0,0,M,7/26/42,1942,NA,-7771543,SLO-1994-1,A2.9-4627,317,SLO,Moravcik,16/03/1994,13/12/1994,1945,-777,3/16/94,12/13/94,0,1,0,0,0,M,NA,1945,NA,-7771544,SLO-1994-2,A2.9-4630,317,SLO,Meciar,13/12/1994,30/10/1998,26/07/1942,-777,12/13/94,10/30/98,0,1,0,1,0,M,7/26/42,1942,NA,-7771545,SLO-1998,A2.9-4633,317,SLO,Dzurinda,30/10/1998,31/12/2004,4/2/55,-777,10/30/98,12/31/04,0,-888,0,0,-888,M,2/4/55,1955,NA,-7771546,ITA-1873,A2.9-4636,325,ITA,Minghetti,10/08/1873,18/03/1876,1818,1886,1873-08-10,1876-03-18,0,1,0,1,0,M,NA,1818,NA,18861547,ITA-1876,A2.9-4639,325,ITA,Depretis,25/03/1876,11/03/1878,1813,1887,1876-03-25,1878-03-11,0,1,0,0,0,M,NA,1813,NA,18871548,ITA-1878-1,A2.9-4642,325,ITA,Cairoli,23/03/1878,09/12/1878,1825,1889,1878-03-23,1878-12-09,0,1,0,0,0,M,NA,1825,NA,18891549,ITA-1878-2,A2.9-4645,325,ITA,Depretis,18/12/1878,03/07/1879,1813,1887,1878-12-18,1879-07-03,0,1,0,1,0,M,NA,1813,NA,18871550,ITA-1879,A2.9-4648,325,ITA,Cairoli,12/07/1879,14/05/1881,1825,1889,1879-07-12,1881-05-14,0,1,0,1,0,M,NA,1825,NA,18891551,ITA-1881,A2.9-4651,325,ITA,Depretis,28/05/1881,29/07/1887,1813,1887,1881-05-28,1887-07-29,0,2,0,2,-777,M,NA,1813,NA,18871552,ITA-1887,A2.9-4654,325,ITA,Crispi,08/08/1887,31/01/1891,04/10/1819,12/8/01,1887-08-08,1891-01-31,0,1,0,0,0,M,1819-10-04,1819,8/12/01,19011553,ITA-1891,A2.9-4657,325,ITA,Rudini,09/02/1891,05/05/1892,1839,1908,1891-02-09,1892-05-05,0,1,0,0,0,M,NA,1839,NA,19081554,ITA-1892,A2.9-4660,325,ITA,Giolitti,15/05/1892,24/11/1893,27/10/1842,17/07/1928,1892-05-15,1893-11-24,0,1,0,0,0,M,1842-10-27,1842,7/17/28,19281555,ITA-1893,A2.9-4663,325,ITA,Crispi,10/12/1893,05/03/1896,04/10/1819,12/8/01,1893-12-10,1896-03-05,0,1,0,1,0,M,1819-10-04,1819,8/12/01,19011556,ITA-1896,A2.9-4666,325,ITA,Rudini,10/03/1896,18/06/1898,1839,1908,1896-03-10,1898-06-18,0,1,0,1,0,M,NA,1839,NA,19081557,ITA-1898,A2.9-4669,325,ITA,Pelloux,29/06/1898,18/06/1900,01/03/1839,26/10/1924,1898-06-29,6/18/00,0,1,0,0,0,M,1839-03-01,1839,10/26/24,19241558,ITA-1900,A2.9-4672,325,ITA,Saracco,20/06/1900,6/2/01,09/10/1821,1907,6/20/00,2/6/01,0,1,0,0,0,M,1821-10-09,1821,NA,19071559,ITA-1901,A2.9-4675,325,ITA,Zanardelli,15/02/1901,21/10/1903,29/10/1826,1903,2/15/01,10/21/03,0,2.1,0,0,-777,M,1826-10-29,1826,NA,19031560,ITA-1903,A2.9-4678,325,ITA,Giolitti,3/11/03,4/3/05,27/10/1842,17/07/1928,11/3/03,3/4/05,0,1,0,1,0,M,1842-10-27,1842,7/17/28,19281561,ITA-1905,A2.9-4681,325,ITA,Fortis,27/03/1905,1/2/06,16/09/1842,4/12/09,3/27/05,2/1/06,0,1,0,0,0,M,1842-09-16,1842,12/4/09,19091562,ITA-1906-1,A2.9-4684,325,ITA,Sonnino,8/2/06,17/05/1906,11/03/1847,24/11/1922,2/8/06,5/17/06,0,1,0,0,0,M,1847-03-11,1847,11/24/22,19221563,ITA-1906-2,A2.9-4687,325,ITA,Giolitti,29/05/1906,2/12/09,27/10/1842,17/07/1928,5/29/06,12/2/09,0,1,0,2,0,M,1842-10-27,1842,7/17/28,19281564,ITA-1909,A2.9-4690,325,ITA,Sonnino,10/12/09,21/03/1910,11/03/1847,24/11/1922,12/10/09,3/21/10,0,1,0,1,0,M,1847-03-11,1847,11/24/22,19221565,ITA-1910,A2.9-4693,325,ITA,Luzzati,30/03/1910,20/03/1911,01/03/1841,1927,3/30/10,3/20/11,0,1,0,0,0,M,1841-03-01,1841,NA,19271566,ITA-1911,A2.9-4696,325,ITA,Giolitti,27/03/1911,10/3/14,27/10/1842,17/07/1928,3/27/11,3/10/14,0,1,0,3,0,M,1842-10-27,1842,7/17/28,19281567,ITA-1914,A2.9-4699,325,ITA,Salandra,21/03/1914,12/6/16,13/08/1853,1931,3/21/14,6/12/16,0,1,0,0,0,M,1853-08-13,1853,NA,19311568,ITA-1916,A2.9-4702,325,ITA,Boselli,17/06/1916,30/10/1917,08/06/1838,10/3/32,6/17/16,10/30/17,0,1,0,0,0,M,1838-06-08,1838,3/10/32,19321569,ITA-1917,A2.9-4705,325,ITA,Orlando,30/10/1917,19/06/1919,19/05/1860,1952,10/30/17,6/19/19,0,1,0,0,0,M,1860-05-19,1860,NA,19521570,ITA-1919,A2.9-4708,325,ITA,Nitti,23/06/1919,9/6/20,19/07/1868,1953,6/23/19,6/9/20,0,1,0,0,0,M,1868-07-19,1868,NA,19531571,ITA-1920,A2.9-4711,325,ITA,Giolitti,16/06/1920,26/06/1921,27/10/1842,17/07/1928,6/16/20,6/26/21,0,1,0,4,0,M,1842-10-27,1842,7/17/28,19281572,ITA-1921,A2.9-4714,325,ITA,Bonomi,26/06/1921,25/02/1922,18/10/1873,20/04/1951,6/26/21,2/25/22,0,1,0,0,0,M,1873-10-18,1873,4/20/51,19511573,ITA-1922-1,A2.9-4717,325,ITA,Facta,25/02/1922,27/10/1922,16/11/1861,5/11/30,2/25/22,10/27/22,0,1,0,0,0,M,1861-11-16,1861,11/5/30,19301574,ITA-1922-2,A2.9-4720,325,ITA,Mussolini,30/10/1922,25/07/1943,29/07/1883,28/04/1945,10/30/22,7/25/43,0,3,8,0,3,M,1883-07-29,1883,4/28/45,19451575,ITA-1943,A2.9-4723,325,ITA,Badoglio,28/07/1943,4/6/44,28/09/1871,31/10/1956,7/28/43,6/4/44,1,1,0,0,0,M,1871-09-28,1871,10/31/56,19561576,ITA-1944,A2.9-4726,325,ITA,Bonomi,9/6/44,20/06/1945,18/10/1873,20/04/1951,6/9/44,6/20/45,0,1,0,1,0,M,1873-10-18,1873,4/20/51,19511577,ITA-1945-1,A2.9-4729,325,ITA,Parri,20/06/1945,26/11/1945,19/06/1890,1981,6/20/45,11/26/45,0,1,0,0,0,M,1890-06-19,1890,NA,19811578,ITA-1945-2,A2.9-4732,325,ITA,de Gasperi,10/12/45,28/07/1953,03/04/1881,19/08/1954,12/10/45,7/28/53,0,1,0,0,0,M,1881-04-03,1881,8/19/54,19541579,ITA-1953,A2.9-4735,325,ITA,Pella,15/08/1953,6/1/54,18/04/1902,31/05/1981,8/15/53,1/6/54,0,1,0,0,0,M,4/18/02,1902,5/31/81,19811580,ITA-1954-1,A2.9-4738,325,ITA,Fanfani,18/01/1954,31/01/1954,6/2/08,20/11/1999,1/18/54,1/31/54,0,1,0,0,0,M,2/6/08,1908,11/20/99,19991581,ITA-1954-2,A2.9-4741,325,ITA,Scelba,9/2/54,22/06/1955,5/9/01,1991,2/9/54,6/22/55,0,1,0,0,0,M,9/5/01,1901,NA,19911582,ITA-1955,A2.9-4744,325,ITA,Segni,6/7/55,6/5/57,02/02/1891,1972,7/6/55,5/6/57,0,1,0,0,0,M,1891-02-02,1891,NA,19721583,ITA-1957,A2.9-4747,325,ITA,Zoli,19/05/1957,19/06/1958,16/12/1887,1960,5/19/57,6/19/58,0,1,0,0,0,M,1887-12-16,1887,NA,19601584,ITA-1958,A2.9-4750,325,ITA,Fanfani,2/7/58,26/01/1959,6/2/08,20/11/1999,7/2/58,1/26/59,0,1,0,1,0,M,2/6/08,1908,11/20/99,19991585,ITA-1959,A2.9-4753,325,ITA,Segni,15/02/1959,24/02/1960,02/02/1891,1972,2/15/59,2/24/60,0,1,0,1,0,M,1891-02-02,1891,NA,19721586,ITA-1960-1,A2.9-4756,325,ITA,Tambroni,25/03/1960,19/07/1960,1901,1963,3/25/60,7/19/60,0,1,0,0,0,M,NA,1901,NA,19631587,ITA-1960-2,A2.9-4759,325,ITA,Fanfani,26/07/1960,16/05/1963,6/2/08,20/11/1999,7/26/60,5/16/63,0,1,0,2,0,M,2/6/08,1908,11/20/99,19991588,ITA-1963-1,A2.9-4762,325,ITA,Leone,21/06/1963,5/11/63,3/11/08,9/11/01,6/21/63,11/5/63,0,1,0,0,0,M,11/3/08,1908,11/9/01,20011589,ITA-1963-2,A2.9-4765,325,ITA,Moro,5/12/63,5/6/68,23/09/1916,9/5/78,12/5/63,6/5/68,0,1,0,0,0,M,9/23/16,1916,5/9/78,19781590,ITA-1968-1,A2.9-4768,325,ITA,Leone,25/06/1968,19/11/1968,3/11/08,9/11/01,6/25/68,11/19/68,0,1,0,1,0,M,11/3/08,1908,11/9/01,20011591,ITA-1968-2,A2.9-4771,325,ITA,Rumor,13/12/1968,6/7/70,16/06/1915,1990,12/13/68,7/6/70,0,1,0,0,0,M,6/16/15,1915,NA,19901592,ITA-1970,A2.9-4774,325,ITA,Colombo,6/8/70,15/01/1972,11/4/20,-777,8/6/70,1/15/72,0,1,0,0,0,M,4/11/20,1920,NA,-7771593,ITA-1972,A2.9-4777,325,ITA,Andreotti,18/02/1972,12/6/73,15/01/1919,-777,2/18/72,6/12/73,0,1,0,0,0,M,1/15/19,1919,NA,-7771594,ITA-1973,A2.9-4780,325,ITA,Rumor,8/7/73,23/11/1974,16/06/1915,1990,7/8/73,11/23/74,0,1,0,1,0,M,6/16/15,1915,NA,19901595,ITA-1974,A2.9-4783,325,ITA,Moro,23/11/1974,30/07/1976,23/09/1916,9/5/78,11/23/74,7/30/76,0,1,0,1,0,M,9/23/16,1916,5/9/78,19781596,ITA-1976,A2.9-4786,325,ITA,Andreotti,30/07/1976,5/8/79,15/01/1919,-777,7/30/76,8/5/79,0,1,0,1,0,M,1/15/19,1919,NA,-7771597,ITA-1979,A2.9-4789,325,ITA,Cossiga,5/8/79,18/10/1980,26/07/1928,-777,8/5/79,10/18/80,0,1,0,0,0,M,7/26/28,1928,NA,-7771598,ITA-1980,A2.9-4792,325,ITA,Forlani,18/10/1980,26/05/1981,8/12/25,-777,10/18/80,5/26/81,0,1,0,0,0,M,12/8/25,1925,NA,-7771599,ITA-1981,A2.9-4795,325,ITA,Spadolini,28/06/1981,30/11/1982,21/06/1925,1994,6/28/81,11/30/82,0,1,0,0,0,M,6/21/25,1925,NA,19941600,ITA-1982,A2.9-4798,325,ITA,Fanfani,30/11/1982,4/8/83,6/2/08,20/11/1999,11/30/82,8/4/83,0,1,0,3,0,M,2/6/08,1908,11/20/99,19991601,ITA-1983,A2.9-4801,325,ITA,Craxi,4/8/83,18/04/1987,24/02/1934,19/01/2000,8/4/83,4/18/87,0,1,0,0,0,M,2/24/34,1934,1/19/00,20001602,ITA-1987-1,A2.9-4804,325,ITA,Fanfani,18/04/1987,29/07/1987,6/2/08,20/11/1999,4/18/87,7/29/87,0,1,0,4,0,M,2/6/08,1908,11/20/99,19991603,ITA-1987-2,A2.9-4807,325,ITA,Goria,29/07/1987,13/04/1988,30/07/1943,21/05/1994,7/29/87,4/13/88,0,1,0,0,0,M,7/30/43,1943,5/21/94,19941604,ITA-1988,A2.9-4810,325,ITA,Mita,13/04/1988,12/7/89,2/2/28,-777,4/13/88,7/12/89,0,1,0,0,0,M,2/2/28,1928,NA,-7771605,ITA-1989,A2.9-4813,325,ITA,Andreotti,23/07/1989,28/06/1992,15/01/1919,-777,7/23/89,6/28/92,0,1,0,2,0,M,1/15/19,1919,NA,-7771606,ITA-1992,A2.9-4816,325,ITA,Amato,28/06/1992,29/04/1993,13/05/1938,-777,6/28/92,4/29/93,0,1,0,0,0,M,5/13/38,1938,NA,-7771607,ITA-1993,A2.9-4819,325,ITA,Ciampi,29/04/1993,11/5/94,9/12/20,-777,4/29/93,5/11/94,0,1,0,0,0,M,12/9/20,1920,NA,-7771608,ITA-1994,A2.9-4822,325,ITA,Berlusconi,11/5/94,17/01/1995,29/09/1936,-777,5/11/94,1/17/95,0,1,0,0,0,M,9/29/36,1936,NA,-7771609,ITA-1995,A2.9-4825,325,ITA,Dini,17/01/1995,18/05/1996,1/3/31,-777,1/17/95,5/18/96,0,1,0,0,0,M,3/1/31,1931,NA,-7771610,ITA-1996,A2.9-4828,325,ITA,Prodi,18/05/1996,21/10/1998,9/8/39,-777,5/18/96,10/21/98,0,1,0,0,0,M,8/9/39,1939,NA,-7771611,ITA-1998,A2.9-4831,325,ITA,D'Alema,21/10/1998,26/04/2000,20/04/1949,-777,10/21/98,4/26/00,0,1,0,0,0,M,4/20/49,1949,NA,-7771612,ITA-2000,A2.9-4834,325,ITA,Amato,26/04/2000,11/6/01,13/05/1938,-777,4/26/00,6/11/01,0,1,0,1,0,M,5/13/38,1938,NA,-7771613,ITA-2001,A2.9-4837,325,ITA,Berlusconi,11/6/01,31/12/2004,29/09/1936,-777,6/11/01,12/31/04,0,-888,0,1,-888,M,9/29/36,1936,NA,-7771614,MLT-1962,A2.9-4840,338,MLT,Olivier,5/3/62,21/06/1971,5/7/11,29/10/1980,3/5/62,6/21/71,0,1,0,0,0,M,7/5/11,1911,10/29/80,19801615,MLT-1971,A2.9-4843,338,MLT,Mintoff,21/06/1971,22/12/1984,6/8/16,-777,6/21/71,12/22/84,0,1,0,0,0,M,8/6/16,1916,NA,-7771616,MLT-1984,A2.9-4846,338,MLT,Bonnici,22/12/1984,12/5/87,17/07/1933,-777,12/22/84,5/12/87,0,1,0,0,0,M,7/17/33,1933,NA,-7771617,MLT-1987,A2.9-4849,338,MLT,Adami,12/5/87,28/10/1996,7/2/34,-777,5/12/87,10/28/96,0,1,0,0,0,M,2/7/34,1934,NA,-7771618,MLT-1996,A2.9-4852,338,MLT,Sant,28/10/1996,6/9/98,1948,-777,10/28/96,9/6/98,0,1,0,0,0,M,NA,1948,NA,-7771619,MLT-1998,A2.9-4855,338,MLT,Adami,6/9/98,31/12/2004,7/2/34,-777,9/6/98,12/31/04,0,-888,0,1,-888,M,2/7/34,1934,NA,-7771620,ALB-1912,A2.9-4858,339,ALB,Ismail Qemali Bej,29/11/1912,22/01/1914,1844,1919,11/29/12,1/22/14,1,3,-999,0,1,M,NA,1844,NA,19191621,ALB-1914-1,A2.9-4861,339,ALB,Fevzi Bej,22/01/1914,21/02/1914,1876,1945,1/22/14,2/21/14,-666,-666,0,0,-666,M,NA,1876,NA,19451622,ALB-1914-2,A2.9-4864,339,ALB,Wilhelm zu Wied,21/02/1914,3/9/14,1871,1945,2/21/14,9/3/14,1,1,0,0,1,M,NA,1871,NA,19451623,ALB-1914-3,A2.9-4867,339,ALB,Esat Pashe Toptani,5/10/14,24/02/1916,1863,1920,10/5/14,2/24/16,1,4,-999,0,1,M,NA,1863,NA,19201624,ALB-1918,A2.9-4870,339,ALB,Turkhan Pasha,28/12/1918,27/03/1920,1839,1927,12/28/18,3/27/20,2,1,0,0,1,M,NA,1839,NA,19271625,ALB-1920-1,A2.9-4873,339,ALB,Delvina,27/03/1920,20/11/1920,1882,1932,3/27/20,11/20/20,0,1,0,0,0,M,NA,1882,NA,19321626,ALB-1920-2,A2.9-4876,339,ALB,Vrioni,11/12/20,17/10/1921,1883,1932,12/11/20,10/17/21,0,1,0,0,0,M,NA,1883,NA,19321627,ALB-1921-1,A2.9-4879,339,ALB,Evangeli,17/10/1921,7/12/21,1859,1939,10/17/21,12/7/21,0,1,0,0,0,M,NA,1859,NA,19391628,ALB-1921-2,A2.9-4882,339,ALB,Prishtina,7/12/21,11/12/21,1873,1933,12/7/21,12/11/21,0,1,0,0,0,M,NA,1873,NA,19331629,ALB-1921-3,A2.9-4885,339,ALB,Idomeni Kosturis,11/12/21,24/12/1921,1873,1943,12/11/21,12/24/21,0,1,0,0,-666,M,NA,1873,NA,19431630,ALB-1921-4,A2.9-4888,339,ALB,Djafer Ypi,24/12/1921,2/12/22,1880,1940,12/24/21,12/2/22,0,1,0,0,0,M,NA,1880,NA,19401631,ALB-1922,A2.9-4891,339,ALB,Zogu,3/12/22,3/3/24,1895,1961,12/3/22,3/3/24,0,1,0,0,1,M,NA,1895,NA,19611632,ALB-1924-1,A2.9-4894,339,ALB,Verlaci,5/3/24,1/6/24,1877,1946,3/5/24,6/1/24,0,1,0,0,1,M,NA,1877,NA,19461633,ALB-1924-2,A2.9-4897,339,ALB,Vrioni,1/6/24,10/6/24,1883,1932,6/1/24,6/10/24,0,3,4,1,0,M,NA,1883,NA,19321634,ALB-1924-3,A2.9-4900,339,ALB,Fan S. Noli,12/6/24,24/12/1924,1882,1965,6/12/24,12/24/24,1,3,4,0,1,M,NA,1882,NA,19651635,ALB-1924-4,A2.9-4903,339,ALB,Vrioni,24/12/1924,10/1/25,1883,1932,12/24/24,1/10/25,1,3,8,2,0,M,NA,1883,NA,19321636,ALB-1925,A2.9-4906,339,ALB,Zogu,10/1/25,12/4/39,1895,1961,1/10/25,4/12/39,1,4,9,1,1,M,NA,1895,NA,19611637,ALB-1944,A2.9-4909,339,ALB,Hoxha,29/11/1944,11/4/85,16/10/1908,11/4/85,11/29/44,4/11/85,1,2,0,0,-777,M,10/16/08,1908,4/11/85,19851638,ALB-1985,A2.9-4912,339,ALB,Alia,13/04/1985,3/4/92,18/10/1925,-777,4/13/85,4/3/92,0,1,0,0,2,M,10/18/25,1925,NA,-7771639,ALB-1992,A2.9-4915,339,ALB,Berisha,9/4/92,24/07/1997,15/10/1944,-777,4/9/92,7/24/97,0,1,0,0,0,M,10/15/44,1944,NA,-7771640,ALB-1997,A2.9-4918,339,ALB,Fatos Nano,24/07/1997,2/10/98,16/09/1952,-777,7/24/97,10/2/98,0,1,0,0,0,M,9/16/52,1952,NA,-7771641,ALB-1998,A2.9-4921,339,ALB,Majko,2/10/98,29/10/1999,15/11/1967,-777,10/2/98,10/29/99,0,1,0,0,0,M,11/15/67,1967,NA,-7771642,ALB-1999,A2.9-4924,339,ALB,Meta,29/10/1999,22/02/2002,1969,-777,10/29/99,2/22/02,0,1,0,0,0,M,NA,1969,NA,-7771643,ALB-2002-1,A2.9-4927,339,ALB,Majko,22/02/2002,31/07/2002,15/11/1967,-777,2/22/02,7/31/02,0,1,0,1,0,M,11/15/67,1967,NA,-7771644,ALB-2002-2,A2.9-4930,339,ALB,Fatos Nano,31/07/2002,31/12/2004,16/09/1952,-777,7/31/02,12/31/04,0,-888,0,2,-888,M,9/16/52,1952,NA,-7771645,SER-1882,A2.9-4933,340,SER,Milan I,06/03/1882,06/03/1889,1854,1901,1882-03-06,1889-03-06,1,1,0,0,1,M,NA,1854,NA,19011646,SER-1889,A2.9-4936,340,SER,Ristic (Regency),06/03/1889,13/04/1893,1831,1899,1889-03-06,1893-04-13,0,3,-999,0,2,M,NA,1831,NA,18991647,SER-1893,A2.9-4939,340,SER,Alexander I,13/04/1893,11/6/03,1876,1903,1893-04-13,6/11/03,1,3,-999,0,3,M,NA,1876,NA,19031648,SER-1903,A2.9-4942,340,SER,Peter I,15/06/1903,24/06/1914,1844,1921,6/15/03,6/24/14,1,2.1,0,0,0,M,NA,1844,NA,19211649,SER-1914,A2.9-4945,340,SER,Alexander,24/06/1914,1/10/15,16/12/1888,9/10/34,6/24/14,10/1/15,0,4,-999,0,1,M,1888-12-16,1888,10/9/34,19341650,MNG-1860,A2.9-4948,341,MNG,Nikola I Petrovic-Njegos,13/08/1860,17/01/1917,1841,1921,1860-08-13,1/17/17,0,4,-999,0,1,M,NA,1841,NA,19211651,MAC-1991,A2.9-4951,343,MAC,Nikola Kljusev,27/01/1991,17/08/1992,1927,-777,1/27/91,8/17/92,1,1,0,0,0,M,NA,1927,NA,-7771652,MAC-1992,A2.9-4954,343,MAC,Crvenkovski,17/08/1992,30/11/1998,1962,-777,8/17/92,11/30/98,0,1,0,0,0,M,NA,1962,NA,-7771653,MAC-1998,A2.9-4957,343,MAC,Georgievski,30/11/1998,1/11/02,1966,-777,11/30/98,11/1/02,0,1,0,0,0,M,NA,1966,NA,-7771654,MAC-2002,A2.9-4960,343,MAC,Crvenkovski,1/11/02,12/5/04,1962,-777,11/1/02,5/12/04,0,1,0,1,0,M,NA,1962,NA,-7771655,MAC-2004-1,A2.9-4963,343,MAC,Radmila Sekerinska,12/5/04,2/6/04,10/7/72,-777,5/12/04,6/2/04,0,1,0,0,0,M,7/10/72,1972,NA,-7771656,MAC-2004-2,A2.9-4966,343,MAC,Hari Kostov,2/6/04,18/11/2004,1959,-777,6/2/04,11/18/04,0,1,0,0,-999,M,NA,1959,NA,-7771657,MAC-2004-3,A2.9-4969,343,MAC,Radmila Sekerinska,18/11/2004,17/12/2004,10/7/72,-777,11/18/04,12/17/04,0,1,0,1,-999,M,7/10/72,1972,NA,-7771658,MAC-2004-4,A2.9-4972,343,MAC,Vlado Buckovski,17/12/2004,31/12/2004,2/12/62,-777,12/17/04,12/31/04,0,-888,0,0,-888,M,12/2/62,1962,NA,-7771659,CRO-1990,A2.9-4975,344,CRO,Tudjman,30/05/1990,26/11/1999,1922,1999,5/30/90,11/26/99,0,2,0,0,-777,M,NA,1922,NA,19991660,CRO-1999,A2.9-4978,344,CRO,Pavletic,26/11/1999,2/2/00,1930,-777,11/26/99,2/2/00,0,1,0,0,0,M,NA,1930,NA,-7771661,CRO-2000-1,A2.9-4981,344,CRO,Tomcic,2/2/00,18/02/2000,1945,-777,2/2/00,2/18/00,0,1,0,0,0,M,NA,1945,NA,-7771662,CRO-2000-2,A2.9-4984,344,CRO,Mesic,18/02/2000,31/12/2004,24/12/1934,-777,2/18/00,12/31/04,0,-888,0,0,-888,M,12/24/34,1934,NA,-7771663,YUG-1918,A2.9-4987,345,YUG,Alexander,1/12/18,9/10/34,1888,1934,12/1/18,10/9/34,0,3,11,1,3,M,NA,1888,NA,19341664,YUG-1934,A2.9-4990,345,YUG,Prince Paul,9/10/34,27/03/1941,1893,1976,10/9/34,3/27/41,0,3,6,0,1,M,NA,1893,NA,19761665,YUG-1941,A2.9-4993,345,YUG,Peter II,27/03/1941,20/04/1941,6/9/23,3/11/70,3/27/41,4/20/41,1,4,9,0,1,M,9/6/23,1923,11/3/70,19701666,YUG-1945,A2.9-4996,345,YUG,Tito,6/3/45,4/5/80,07/05/1892,4/5/80,3/6/45,5/4/80,1,2,0,0,-777,M,1892-05-07,1892,5/4/80,19801667,YUG-1980-1,A2.9-4999,345,YUG,Kolisevski,4/5/80,15/05/1980,1914,2000,5/4/80,5/15/80,0,1,0,0,0,M,NA,1914,NA,20001668,YUG-1980-2,A2.9-5002,345,YUG,Mijatovic,15/05/1980,15/05/1981,1912,1993,5/15/80,5/15/81,0,1,0,0,0,M,NA,1912,NA,19931669,YUG-1981,A2.9-5005,345,YUG,Kraigher,15/05/1981,16/05/1982,1914,2001,5/15/81,5/16/82,0,1,0,0,0,M,NA,1914,NA,20011670,YUG-1982,A2.9-5008,345,YUG,Stambolic,16/05/1982,13/05/1983,1912,-777,5/16/82,5/13/83,0,1,0,0,0,M,NA,1912,NA,-7771671,YUG-1983,A2.9-5011,345,YUG,Spiljac,13/05/1983,15/05/1984,1916,2007,5/13/83,5/15/84,0,1,0,0,0,M,NA,1916,NA,20071672,YUG-1984,A2.9-5014,345,YUG,Djuranovic,15/05/1984,15/05/1985,1926,1997,5/15/84,5/15/85,0,1,0,0,0,M,NA,1926,NA,19971673,YUG-1985,A2.9-5017,345,YUG,Vlajkovic,15/05/1985,15/05/1986,1922,2001,5/15/85,5/15/86,0,1,0,0,0,M,NA,1922,NA,20011674,YUG-1986,A2.9-5020,345,YUG,Hasani,15/05/1986,15/05/1987,1922,-777,5/15/86,5/15/87,0,1,0,0,0,M,NA,1922,NA,-7771675,YUG-1987,A2.9-5023,345,YUG,Mojsov,15/05/1987,15/05/1988,1920,-777,5/15/87,5/15/88,0,1,0,0,0,M,NA,1920,NA,-7771676,YUG-1988,A2.9-5026,345,YUG,Dizarevic,15/05/1988,15/05/1989,1926,-777,5/15/88,5/15/89,0,1,0,0,0,M,NA,1926,NA,-7771677,YUG-1989,A2.9-5029,345,YUG,Milosevic,15/05/1989,7/10/00,20/08/1941,11/3/06,5/15/89,10/7/00,0,1,0,0,2,M,8/20/41,1941,3/11/06,20061678,YUG-2000,A2.9-5032,345,YUG,Kostunica,8/10/00,31/12/2004,24/03/1944,-777,10/8/00,12/31/04,0,-888,0,0,-888,M,3/24/44,1944,NA,-7771679,BOS-1990,A2.9-5035,346,BOS,Izetbegovic,20/12/1990,13/10/1998,8/8/25,19/10/2003,12/20/90,10/13/98,0,2.1,0,0,0,M,8/8/25,1925,10/19/03,20031680,BOS-1998,A2.9-5038,346,BOS,Radisic,13/10/1998,15/06/1999,15/08/1937,-777,10/13/98,6/15/99,0,1,0,0,0,M,8/15/37,1937,NA,-7771681,BOS-1999,A2.9-5041,346,BOS,Jelavic,15/06/1999,14/02/2000,21/08/1963,-777,6/15/99,2/14/00,0,1,0,0,0,M,8/21/63,1963,NA,-7771682,BOS-2000-1,A2.9-5044,346,BOS,Izetbegovic,14/02/2000,14/10/2000,8/8/25,19/10/2003,2/14/00,10/14/00,0,2.1,0,1,0,M,8/8/25,1925,10/19/03,20031683,BOS-2000-2,A2.9-5047,346,BOS,Radisic,14/10/2000,14/06/2001,15/08/1937,-777,10/14/00,6/14/01,0,1,0,1,0,M,8/15/37,1937,NA,-7771684,BOS-2001,A2.9-5050,346,BOS,Krizanovic,14/06/2001,14/02/2002,1944,-777,6/14/01,2/14/02,0,1,0,0,0,M,NA,1944,NA,-7771685,BOS-2002-1,A2.9-5053,346,BOS,Belkic,14/02/2002,28/10/2002,1946,-777,2/14/02,10/28/02,0,1,0,0,0,M,NA,1946,NA,-7771686,BOS-2002-2,A2.9-5056,346,BOS,Sarovic,28/10/2002,2/4/03,16/09/1956,-777,10/28/02,4/2/03,0,1,0,0,0,M,9/16/56,1956,NA,-7771687,BOS-2003-1,A2.9-5059,346,BOS,Borislav Paravac,10/4/03,27/06/2003,1943,-777,4/10/03,6/27/03,0,1,0,0,0,M,NA,1943,NA,-7771688,BOS-2003-2,A2.9-5062,346,BOS,Dragan Covic,27/06/2003,28/02/2004,1956,-777,6/27/03,2/28/04,0,1,0,0,0,M,NA,1956,NA,-7771689,BOS-2004-1,A2.9-5065,346,BOS,Sulejman Tihic,28/02/2004,28/10/2004,1951,-777,2/28/04,10/28/04,0,1,0,0,-999,M,NA,1951,NA,-7771690,BOS-2004-2,A2.9-5068,346,BOS,Borislav Paravac,28/10/2004,31/12/2004,1943,-777,10/28/04,12/31/04,0,-888,0,1,-888,M,NA,1943,NA,-7771691,SLV-1990,A2.9-5071,349,SLV,Kucan,22/04/1990,23/12/1991,1941,-777,4/22/90,12/23/91,0,1,0,0,0,M,NA,1941,NA,-7771692,SLV-1991,A2.9-5074,349,SLV,Peterle,23/12/1991,14/05/1992,1948,-777,12/23/91,5/14/92,0,1,0,0,0,M,NA,1948,NA,-7771693,SLV-1992,A2.9-5077,349,SLV,Drnovsek,14/05/1992,3/5/00,17/05/1950,23/02/2008,5/14/92,5/3/00,0,1,0,0,0,M,5/17/50,1950,2/23/08,20081694,SLV-2000-1,A2.9-5080,349,SLV,Bajuk,3/5/00,17/11/2000,18/10/1943,-777,5/3/00,11/17/00,0,1,0,0,0,M,10/18/43,1943,NA,-7771695,SLV-2000-2,A2.9-5083,349,SLV,Drnovsek,17/11/2000,11/12/02,17/05/1950,23/02/2008,11/17/00,12/11/02,0,1,0,1,0,M,5/17/50,1950,2/23/08,20081696,SLV-2002,A2.9-5086,349,SLV,Anton Rop,11/12/02,9/11/04,27/12/1960,-777,12/11/02,11/9/04,0,1,0,0,-999,M,12/27/60,1960,NA,-7771697,SLV-2004,A2.9-5089,349,SLV,Janez Jansa,9/11/04,31/12/2004,17/09/1958,-777,11/9/04,12/31/04,0,-888,0,0,-888,M,9/17/58,1958,NA,-7771698,GRC-1863,A2.9-5092,350,GRC,George I,30/03/1863,18/03/1913,24/12/1845,18/03/1913,1863-03-30,3/18/13,0,3,-999,0,3,M,1845-12-24,1845,3/18/13,19131699,GRC-1913,A2.9-5095,350,GRC,Konstantinos I,18/03/1913,12/6/17,1868,1923,3/18/13,6/12/17,1,4,-999,0,1,M,NA,1868,NA,19231700,GRC-1917,A2.9-5098,350,GRC,Venizelos,27/06/1917,18/11/1920,23/08/1864,1936,6/27/17,11/18/20,2,1,0,0,1,M,1864-08-23,1864,NA,19361701,GRC-1920-1,A2.9-5101,350,GRC,Rallis,18/11/1920,11/12/20,1844,1921,11/18/20,12/11/20,0,2.1,0,0,0,M,NA,1844,NA,19211702,GRC-1920-2,A2.9-5104,350,GRC,Konstantinos I,11/12/20,27/09/1922,1868,1923,12/11/20,9/27/22,0,3,6,1,1,M,NA,1868,NA,19231703,GRC-1922-1,A2.9-5107,350,GRC,Plastiras,27/09/1922,27/11/1922,1883,1953,9/27/22,11/27/22,1,1,0,0,0,M,NA,1883,NA,19531704,GRC-1922-2,A2.9-5110,350,GRC,Gonatas,27/11/1922,24/01/1924,1876,1966,11/27/22,1/24/24,1,1,0,0,0,M,NA,1876,NA,19661705,GRC-1924-1,A2.9-5113,350,GRC,Venizelos,24/01/1924,19/02/1924,23/08/1864,1936,1/24/24,2/19/24,0,2.1,0,1,0,M,1864-08-23,1864,NA,19361706,GRC-1924-2,A2.9-5116,350,GRC,Kaphantaris,19/02/1924,12/3/24,1873,1946,2/19/24,3/12/24,0,1,0,0,0,M,NA,1873,NA,19461707,GRC-1924-3,A2.9-5119,350,GRC,Papanastasiou,12/3/24,24/07/1924,1876,1936,3/12/24,7/24/24,0,1,0,0,0,M,NA,1876,NA,19361708,GRC-1924-4,A2.9-5122,350,GRC,Sophoulis,24/07/1924,7/10/24,1861,1949,7/24/24,10/7/24,0,1,0,0,0,M,NA,1861,NA,19491709,GRC-1924-5,A2.9-5125,350,GRC,Michalakopoulos,7/10/24,26/06/1925,1876,1938,10/7/24,6/26/25,0,3,6,0,0,M,NA,1876,NA,19381710,GRC-1925,A2.9-5128,350,GRC,Pangalos,26/06/1925,22/08/1926,11/01/1878,26/02/1952,6/26/25,8/22/26,1,3,6,0,2,M,1878-01-11,1878,2/26/52,19521711,GRC-1926-1,A2.9-5131,350,GRC,Kondilis,23/08/1926,4/12/26,1879,31/01/1936,8/23/26,12/4/26,1,1,0,0,0,M,NA,1879,1/31/36,19361712,GRC-1926-2,A2.9-5134,350,GRC,Zaimis,4/12/26,4/7/28,1855,1936,12/4/26,7/4/28,0,1,0,0,0,M,NA,1855,NA,19361713,GRC-1928,A2.9-5137,350,GRC,Venizelos,4/7/28,26/05/1932,23/08/1864,1936,7/4/28,5/26/32,0,1,0,2,0,M,1864-08-23,1864,NA,19361714,GRC-1932-1,A2.9-5140,350,GRC,Papanastasiou,26/05/1932,5/6/32,1876,1936,5/26/32,6/5/32,0,1,0,1,0,M,NA,1876,NA,19361715,GRC-1932-2,A2.9-5143,350,GRC,Venizelos,5/6/32,3/11/32,23/08/1864,1936,6/5/32,11/3/32,0,1,0,3,0,M,1864-08-23,1864,NA,19361716,GRC-1932-3,A2.9-5146,350,GRC,Tsaldaris,4/11/32,11/1/33,1868,1936,11/4/32,1/11/33,0,1,0,0,0,M,NA,1868,NA,19361717,GRC-1933-1,A2.9-5149,350,GRC,Venizelos,16/01/1933,6/3/33,23/08/1864,1936,1/16/33,3/6/33,0,1,0,4,0,M,1864-08-23,1864,NA,19361718,GRC-1933-2,A2.9-5152,350,GRC,Plastiras,6/3/33,10/3/33,1883,1953,3/6/33,3/10/33,1,3,6,1,1,M,NA,1883,NA,19531719,GRC-1933-3,A2.9-5155,350,GRC,Tsaldaris,10/3/33,10/10/35,1868,1936,3/10/33,10/10/35,0,3,6,1,0,M,NA,1868,NA,19361720,GRC-1935-1,A2.9-5158,350,GRC,Kondilis,10/10/35,30/11/1935,1879,31/01/1936,10/10/35,11/30/35,1,1,0,1,1,M,NA,1879,1/31/36,19361721,GRC-1935-2,A2.9-5161,350,GRC,Demertzis,30/11/1935,12/4/36,1876,12/4/36,11/30/35,4/12/36,0,2,0,0,-777,M,NA,1876,4/12/36,19361722,GRC-1936,A2.9-5164,350,GRC,Metaxas,22/04/1936,29/01/1941,12/04/1871,29/01/1941,4/22/36,1/29/41,1,2,0,0,-777,M,1871-04-12,1871,1/29/41,19411723,GRC-1941-1,A2.9-5167,350,GRC,Korizis,29/01/1941,18/04/1941,1885,1941,1/29/41,4/18/41,0,2,0,0,-777,M,NA,1885,NA,19411724,GRC-1941-2,A2.9-5170,350,GRC,Tsouderos,21/04/1941,29/04/1941,1882,1956,4/21/41,4/29/41,0,4,9,0,1,M,NA,1882,NA,19561725,GRC-1944,A2.9-5173,350,GRC,G. Papandreou,18/10/1944,3/1/45,13/02/1888,1/11/68,10/18/44,1/3/45,1,1,0,0,0,M,1888-02-13,1888,11/1/68,19681726,GRC-1945-1,A2.9-5176,350,GRC,Plastiras,3/1/45,9/4/45,1883,1953,1/3/45,4/9/45,0,1,0,2,0,M,NA,1883,NA,19531727,GRC-1945-2,A2.9-5179,350,GRC,Voulgaris,9/4/45,9/10/45,1884,1957,4/9/45,10/9/45,0,1,0,0,0,M,NA,1884,NA,19571728,GRC-1945-3,A2.9-5182,350,GRC,Damaskinos,17/10/1945,1/11/45,03/03/1891,20/05/1949,10/17/45,11/1/45,1,1,0,0,0,M,1891-03-03,1891,5/20/49,19491729,GRC-1945-4,A2.9-5185,350,GRC,Kanellopoulos,1/11/45,22/11/1945,13/12/1902,11/9/86,11/1/45,11/22/45,0,1,0,0,0,M,12/13/02,1902,9/11/86,19861730,GRC-1945-5,A2.9-5188,350,GRC,Sophoulis,22/11/1945,4/4/46,1861,1949,11/22/45,4/4/46,0,1,0,1,0,M,NA,1861,NA,19491731,GRC-1946-1,A2.9-5191,350,GRC,Poulitsas,4/4/46,18/04/1946,1881,1968,4/4/46,4/18/46,0,1,0,0,0,M,NA,1881,NA,19681732,GRC-1946-2,A2.9-5194,350,GRC,K. Tsaldaris,18/04/1946,22/01/1947,1884,1970,4/18/46,1/22/47,0,1,0,0,0,M,NA,1884,NA,19701733,GRC-1947-1,A2.9-5197,350,GRC,Maximos,25/01/1947,25/08/1947,1873,1955,1/25/47,8/25/47,0,1,0,0,0,M,NA,1873,NA,19551734,GRC-1947-2,A2.9-5200,350,GRC,K. Tsaldaris,29/08/1947,5/9/47,1884,1970,8/29/47,9/5/47,0,1,0,1,0,M,NA,1884,NA,19701735,GRC-1947-3,A2.9-5203,350,GRC,Sophoulis,8/9/47,24/06/1949,1861,1949,9/8/47,6/24/49,0,2,0,2,-777,M,NA,1861,NA,19491736,GRC-1949,A2.9-5206,350,GRC,Diomidis,30/06/1949,6/1/50,1875,1950,6/30/49,1/6/50,0,1,0,0,0,M,NA,1875,NA,19501737,GRC-1950-1,A2.9-5209,350,GRC,Theotokis,6/1/50,5/3/50,1880,1961,1/6/50,3/5/50,0,1,0,0,0,M,NA,1880,NA,19611738,GRC-1950-2,A2.9-5212,350,GRC,S. Venizelos,23/03/1950,15/04/1950,1894,1964,3/23/50,4/15/50,0,1,0,0,0,M,NA,1894,NA,19641739,GRC-1950-3,A2.9-5215,350,GRC,Plastiras,15/04/1950,21/08/1950,1883,1953,4/15/50,8/21/50,0,1,0,3,0,M,NA,1883,NA,19531740,GRC-1950-4,A2.9-5218,350,GRC,S. Venizelos,21/08/1950,1/11/51,1894,1964,8/21/50,11/1/51,0,1,0,1,0,M,NA,1894,NA,19641741,GRC-1951,A2.9-5221,350,GRC,Plastiras,1/11/51,11/10/52,1883,1953,11/1/51,10/11/52,0,2.1,0,4,0,M,NA,1883,NA,19531742,GRC-1952-1,A2.9-5224,350,GRC,Kiousopoulos,11/10/52,19/11/1952,1892,1977,10/11/52,11/19/52,0,1,0,0,-666,M,NA,1892,NA,19771743,GRC-1952-2,A2.9-5227,350,GRC,Papagos,19/11/1952,4/10/55,1883,1955,11/19/52,10/4/55,0,2,0,0,-777,M,NA,1883,NA,19551744,GRC-1955-1,A2.9-5230,350,GRC,Stephanopoulos,4/10/55,6/10/55,1898,1982,10/4/55,10/6/55,0,1,0,0,0,M,NA,1898,NA,19821745,GRC-1955-2,A2.9-5233,350,GRC,Karamanlis,6/10/55,5/3/58,8/3/07,22/04/1998,10/6/55,3/5/58,0,1,0,0,0,M,3/8/07,1907,4/22/98,19981746,GRC-1958-1,A2.9-5236,350,GRC,Georgakopoulos,5/3/58,17/05/1958,1890,1978,3/5/58,5/17/58,0,1,0,0,0,M,NA,1890,NA,19781747,GRC-1958-2,A2.9-5239,350,GRC,Karamanlis,17/05/1958,20/09/1961,8/3/07,22/04/1998,5/17/58,9/20/61,0,1,0,1,0,M,3/8/07,1907,4/22/98,19981748,GRC-1961-1,A2.9-5242,350,GRC,Dovas,20/09/1961,4/11/61,1898,1973,9/20/61,11/4/61,0,1,0,0,0,M,NA,1898,NA,19731749,GRC-1961-2,A2.9-5245,350,GRC,Karamanlis,4/11/61,11/6/63,8/3/07,22/04/1998,11/4/61,6/11/63,0,1,0,2,1,M,3/8/07,1907,4/22/98,19981750,GRC-1963-1,A2.9-5248,350,GRC,Pipinelis,17/06/1963,29/09/1963,1899,1970,6/17/63,9/29/63,0,1,0,0,0,M,NA,1899,NA,19701751,GRC-1963-2,A2.9-5251,350,GRC,Mavromichalis,29/09/1963,8/11/63,1900,1981,9/29/63,11/8/63,0,1,0,0,0,M,NA,1900,NA,19811752,GRC-1963-3,A2.9-5254,350,GRC,G. Papandreou,8/11/63,24/12/1963,13/02/1888,1/11/68,11/8/63,12/24/63,0,1,0,1,0,M,1888-02-13,1888,11/1/68,19681753,GRC-1963-4,A2.9-5257,350,GRC,Paraskevopoulos,31/12/1963,18/02/1964,1900,1984,12/31/63,2/18/64,0,1,0,0,0,M,NA,1900,NA,19841754,GRC-1964,A2.9-5260,350,GRC,G. Papandreou,18/02/1964,15/07/1965,13/02/1888,1/11/68,2/18/64,7/15/65,0,3,8,2,0,M,1888-02-13,1888,11/1/68,19681755,GRC-1965-1,A2.9-5263,350,GRC,Athaniadis-Novas,15/07/1965,5/8/65,1893,1987,7/15/65,8/5/65,1,1,0,0,0,M,NA,1893,NA,19871756,GRC-1965-2,A2.9-5266,350,GRC,Tsirimokos,20/08/1965,29/08/1965,1907,1968,8/20/65,8/29/65,0,1,0,0,0,M,NA,1907,NA,19681757,GRC-1965-3,A2.9-5269,350,GRC,Stephanopoulos,17/09/1965,22/12/1966,1898,1982,9/17/65,12/22/66,0,1,0,1,2,M,NA,1898,NA,19821758,GRC-1966,A2.9-5272,350,GRC,Paraskevopoulos,22/12/1966,30/03/1967,1900,1984,12/22/66,3/30/67,0,1,0,1,0,M,NA,1900,NA,19841759,GRC-1967-1,A2.9-5275,350,GRC,Kanellopoulos,3/4/67,21/04/1967,13/12/1902,11/9/86,4/3/67,4/21/67,0,3,6,1,2,M,12/13/02,1902,9/11/86,19861760,GRC-1967-2,A2.9-5278,350,GRC,Kollias,21/04/1967,13/12/1967,1901,1998,4/21/67,12/13/67,1,3,6,0,1,M,NA,1901,NA,19981761,GRC-1967-3,A2.9-5281,350,GRC,Papadopoulos,13/12/1967,25/11/1973,5/5/19,27/06/1999,12/13/67,11/25/73,1,3,6,0,2,M,5/5/19,1919,6/27/99,19991762,GRC-1973,A2.9-5284,350,GRC,Ionannides,25/11/1973,24/07/1974,13/03/1923,27/07/1999,11/25/73,7/24/74,1,1,0,0,2,M,3/13/23,1923,7/27/99,19991763,GRC-1974,A2.9-5287,350,GRC,Karamanlis,24/07/1974,9/5/80,8/3/07,22/04/1998,7/24/74,5/9/80,0,1,0,3,0,M,3/8/07,1907,4/22/98,19981764,GRC-1980,A2.9-5290,350,GRC,Rallis,9/5/80,21/10/1981,26/12/1918,15/03/2006,5/9/80,10/21/81,0,1,0,0,0,M,12/26/18,1918,3/15/06,20061765,GRC-1981,A2.9-5293,350,GRC,A. Papandreou,21/10/1981,2/7/89,5/2/19,23/06/1996,10/21/81,7/2/89,0,1,0,0,0,M,2/5/19,1919,6/23/96,19961766,GRC-1989-1,A2.9-5296,350,GRC,Tzannetakis,2/7/89,11/10/89,1927,-777,7/2/89,10/11/89,0,1,0,0,0,M,NA,1927,NA,-7771767,GRC-1989-2,A2.9-5299,350,GRC,Grivas,11/10/89,23/11/1989,1923,-777,10/11/89,11/23/89,0,1,0,0,0,M,NA,1923,NA,-7771768,GRC-1989-3,A2.9-5302,350,GRC,Zolotas,28/11/1989,10/4/90,1904,2004,11/28/89,4/10/90,0,1,0,0,0,M,NA,1904,NA,20041769,GRC-1990,A2.9-5305,350,GRC,Mitsotakis,11/4/90,13/10/1993,1918,-777,4/11/90,10/13/93,0,1,0,0,0,M,NA,1918,NA,-7771770,GRC-1993,A2.9-5308,350,GRC,A. Papandreou,13/10/1993,20/11/1995,5/2/19,23/06/1996,10/13/93,11/20/95,0,2.1,0,1,-777,M,2/5/19,1919,6/23/96,19961771,GRC-1995,A2.9-5311,350,GRC,Tsokhatzopulos,20/11/1995,22/01/1996,1939,-777,11/20/95,1/22/96,0,1,0,0,0,M,NA,1939,NA,-7771772,GRC-1996,A2.9-5314,350,GRC,Simitis,22/01/1996,10/3/04,1936,-777,1/22/96,3/10/04,0,1,0,0,0,M,NA,1936,NA,-7771773,GRC-2004,A2.9-5317,350,GRC,Konstantinos Karamanlis,10/3/04,31/12/2004,1956,-777,3/10/04,12/31/04,0,-888,0,0,-888,M,NA,1956,NA,-7771774,CYP-1960,A2.9-5320,352,CYP,Makarios,16/08/1960,15/07/1974,13/08/1913,3/8/77,8/16/60,7/15/74,0,3,5,0,1,M,8/13/13,1913,8/3/77,19771775,CYP-1974-1,A2.9-5323,352,CYP,Sampson,16/07/1974,23/07/1974,1935,2001,7/16/74,7/23/74,1,3,111,0,2,M,NA,1935,NA,20011776,CYP-1974-2,A2.9-5326,352,CYP,Clerides,23/07/1974,7/12/74,24/04/1919,-777,7/23/74,12/7/74,0,1,0,0,0,M,4/24/19,1919,NA,-7771777,CYP-1974-3,A2.9-5329,352,CYP,Makarios,7/12/74,3/8/77,13/08/1913,3/8/77,12/7/74,8/3/77,0,2,0,1,-777,M,8/13/13,1913,8/3/77,19771778,CYP-1977,A2.9-5332,352,CYP,Kyprianou,3/8/77,28/02/1988,28/10/1932,12/3/02,8/3/77,2/28/88,0,1,0,0,0,M,10/28/32,1932,3/12/02,20021779,CYP-1988,A2.9-5335,352,CYP,Vassiliou,28/02/1988,28/02/1993,1931,-777,2/28/88,2/28/93,0,1,0,0,0,M,NA,1931,NA,-7771780,CYP-1993,A2.9-5338,352,CYP,Clerides,28/02/1993,28/02/2003,24/04/1919,-777,2/28/93,2/28/03,0,1,0,1,0,M,4/24/19,1919,NA,-7771781,CYP-2003,A2.9-5341,352,CYP,Tassos Nikolaou Papadopoulos,28/02/2003,31/12/2004,1934,-777,2/28/03,12/31/04,0,-888,0,0,-888,M,NA,1934,NA,-7771782,BUL-1887,A2.9-5344,355,BUL,Ferdinand I,07/08/1887,3/10/18,26/02/1861,10/9/48,1887-08-07,10/3/18,0,1,0,0,1,M,1861-02-26,1861,9/10/48,19481783,BUL-1918,A2.9-5347,355,BUL,Boris III,3/10/18,29/08/1943,30/01/1894,29/08/1943,10/3/18,8/29/43,0,2,0,0,-777,M,1894-01-30,1894,8/29/43,19431784,BUL-1943,A2.9-5350,355,BUL,Cyril,29/08/1943,9/9/44,1895,1945,8/29/43,9/9/44,0,3,3,0,3,M,NA,1895,NA,19451785,BUL-1944,A2.9-5353,355,BUL,Georgiev,9/9/44,23/11/1946,1882,1968,9/9/44,11/23/46,1,1,0,0,0,M,NA,1882,NA,19681786,BUL-1946,A2.9-5356,355,BUL,Dimitrov,23/11/1946,2/7/49,30/06/1882,2/7/49,11/23/46,7/2/49,0,2,0,0,-777,M,1882-06-30,1882,7/2/49,19491787,BUL-1949,A2.9-5359,355,BUL,Kolarov,20/07/1949,23/01/1950,28/07/1877,23/01/1950,7/20/49,1/23/50,0,2,0,0,-777,M,1877-07-28,1877,1/23/50,19501788,BUL-1950,A2.9-5362,355,BUL,Chervenkov,1/2/50,16/04/1956,6/9/00,21/10/1980,2/1/50,4/16/56,0,1,0,0,0,M,9/6/00,1900,10/21/80,19801789,BUL-1956,A2.9-5365,355,BUL,Zhivkov,16/04/1956,10/11/89,1911,1998,4/16/56,11/10/89,0,1,0,0,2,M,NA,1911,NA,19981790,BUL-1989,A2.9-5368,355,BUL,Mladenov,10/11/89,6/7/90,22/08/1936,31/05/2000,11/10/89,7/6/90,0,1,0,0,0,M,8/22/36,1936,5/31/00,20001791,BUL-1990-1,A2.9-5371,355,BUL,Lukanov,6/7/90,7/12/90,26/09/1938,2/10/96,7/6/90,12/7/90,0,1,0,0,0,M,9/26/38,1938,10/2/96,19961792,BUL-1990-2,A2.9-5374,355,BUL,Popov,7/12/90,8/11/91,1927,-777,12/7/90,11/8/91,0,1,0,0,-666,M,NA,1927,NA,-7771793,BUL-1991,A2.9-5377,355,BUL,Dimitrov,8/11/91,30/12/1992,31/03/1955,-777,11/8/91,12/30/92,0,1,0,0,0,M,3/31/55,1955,NA,-7771794,BUL-1992,A2.9-5380,355,BUL,Berov,30/12/1992,17/10/1994,1925,2006,12/30/92,10/17/94,0,1,0,0,0,M,NA,1925,NA,20061795,BUL-1994,A2.9-5383,355,BUL,Indzhova,17/10/1994,25/01/1995,1953,-777,10/17/94,1/25/95,0,1,0,0,0,F,NA,1953,NA,-7771796,BUL-1995,A2.9-5386,355,BUL,Videnov,25/01/1995,13/02/1997,1959,-777,1/25/95,2/13/97,0,1,0,0,0,M,NA,1959,NA,-7771797,BUL-1997-1,A2.9-5389,355,BUL,Sofiyanski,13/02/1997,21/05/1997,1951,-777,2/13/97,5/21/97,0,1,0,0,0,M,NA,1951,NA,-7771798,BUL-1997-2,A2.9-5392,355,BUL,Kostov,21/05/1997,21/07/2001,1949,-777,5/21/97,7/21/01,0,1,0,0,0,M,NA,1949,NA,-7771799,BUL-2001,A2.9-5395,355,BUL,Saksgoburggotski,24/07/2001,31/12/2004,1937,-777,7/24/01,12/31/04,0,-888,0,0,-888,M,NA,1937,NA,-7771800,MLD-1990,A2.9-5398,359,MLD,Snegur,3/9/90,15/01/1997,1940,-777,9/3/90,1/15/97,0,1,0,0,0,M,NA,1940,NA,-7771801,MLD-1997,A2.9-5401,359,MLD,Lucinschi,15/01/1997,7/4/01,27/01/1940,-777,1/15/97,4/7/01,0,1,0,0,0,M,1/27/40,1940,NA,-7771802,MLD-2001,A2.9-5404,359,MLD,Tarlev,7/4/01,31/12/2004,1963,-777,4/7/01,12/31/04,0,-888,0,0,-888,M,NA,1963,NA,-7771803,RUM-1866,A2.9-5407,360,RUM,Carol I,22/05/1866,10/10/14,1839,1914,1866-05-22,10/10/14,0,2,0,0,-777,M,NA,1839,NA,19141804,RUM-1914,A2.9-5410,360,RUM,Ferdinand I,11/10/14,21/07/1927,1865,1927,10/11/14,7/21/27,0,2,0,0,-777,M,NA,1865,NA,19271805,RUM-1927,A2.9-5413,360,RUM,Nicholas,21/07/1927,8/6/30,1903,1978,7/21/27,6/8/30,0,1,0,0,1,M,NA,1903,NA,19781806,RUM-1930,A2.9-5416,360,RUM,Carol II,8/6/30,6/9/40,1893,1953,6/8/30,9/6/40,1,3,6,0,1,M,NA,1893,NA,19531807,RUM-1940,A2.9-5419,360,RUM,Antonescu,6/9/40,23/08/1944,15/06/1882,1/6/46,9/6/40,8/23/44,1,3,8,0,2,M,1882-06-15,1882,6/1/46,19461808,RUM-1944,A2.9-5422,360,RUM,Michael,23/08/1944,30/12/1947,1921,-777,8/23/44,12/30/47,1,3,7,0,1,M,NA,1921,NA,-7771809,RUM-1947,A2.9-5425,360,RUM,Georghiu-Dej,30/12/1947,19/03/1965,8/11/01,19/03/1965,12/30/47,3/19/65,1,2,0,0,-777,M,11/8/01,1901,3/19/65,19651810,RUM-1965,A2.9-5428,360,RUM,Ceausescu,22/03/1965,25/12/1989,26/01/1918,25/12/1989,3/22/65,12/25/89,0,3,2,0,3,M,1/26/18,1918,12/25/89,19891811,RUM-1989,A2.9-5431,360,RUM,Roman,26/12/1989,1/10/91,1946,-777,12/26/89,10/1/91,0,1,0,0,0,M,NA,1946,NA,-7771812,RUM-1991,A2.9-5434,360,RUM,Stolojan,1/10/91,4/11/92,1943,-777,10/1/91,11/4/92,0,1,0,0,0,M,NA,1943,NA,-7771813,RUM-1992,A2.9-5437,360,RUM,Vacariou,4/11/92,12/12/96,1943,-777,11/4/92,12/12/96,0,1,0,0,0,M,NA,1943,NA,-7771814,RUM-1996,A2.9-5440,360,RUM,Ciorbea,12/12/96,30/03/1998,1954,-777,12/12/96,3/30/98,0,1,0,0,0,M,NA,1954,NA,-7771815,RUM-1998-1,A2.9-5443,360,RUM,Dejeu,30/03/1998,15/04/1998,1932,-777,3/30/98,4/15/98,0,1,0,0,0,M,NA,1932,NA,-7771816,RUM-1998-2,A2.9-5446,360,RUM,Vasile,15/04/1998,14/12/1999,1942,-777,4/15/98,12/14/99,0,1,0,0,0,M,NA,1942,NA,-7771817,RUM-1999-1,A2.9-5449,360,RUM,Athanasiu,14/12/1999,22/12/1999,1955,-777,12/14/99,12/22/99,0,1,0,0,0,M,NA,1955,NA,-7771818,RUM-1999-2,A2.9-5452,360,RUM,Isarescu,22/12/1999,28/12/2000,1949,-777,12/22/99,12/28/00,0,1,0,0,0,M,NA,1949,NA,-7771819,RUM-2000,A2.9-5455,360,RUM,A. Nastase,28/12/2000,21/12/2004,1950,-777,12/28/00,12/21/04,0,1,0,0,-999,M,NA,1950,NA,-7771820,RUM-2004-1,A2.9-5458,360,RUM,Eugen Bejinariu,21/12/2004,29/12/2004,1959,-777,12/21/04,12/29/04,0,1,0,0,-999,M,NA,1959,NA,-7771821,RUM-2004-2,A2.9-5461,360,RUM,Traian Basescu,29/12/2004,31/12/2004,4/11/51,-777,12/29/04,12/31/04,0,-888,0,0,-888,M,11/4/51,1951,NA,-7771822,RUS-1855,A2.9-5464,364,RUS,Alexander II,02/03/1855,13/03/1881,20/04/1818,13/03/1881,1855-03-02,1881-03-13,0,3,-999,0,3,M,1818-04-20,1818,1881-03-13,18811823,RUS-1881,A2.9-5467,364,RUS,Alexander III,13/03/1881,01/11/1894,1845,01/11/1894,1881-03-13,1894-11-01,0,2,0,0,-777,M,NA,1845,1894-11-01,18941824,RUS-1894,A2.9-5470,364,RUS,Nicholas II,01/11/1894,6/11/17,18/05/1868,16/07/1918,1894-11-01,11/6/17,0,3,-999,0,2,M,1868-05-18,1868,7/16/18,19181825,RUS-1917,A2.9-5473,364,RUS,Lenin,7/11/17,10/3/23,22/04/1870,21/01/1924,11/7/17,3/10/23,1,2,0,0,-777,M,1870-04-22,1870,1/21/24,19241826,RUS-1923,A2.9-5476,364,RUS,Stalin,10/3/23,5/3/53,21/12/1879,5/3/53,3/10/23,3/5/53,0,2,0,0,-777,M,1879-12-21,1879,3/5/53,19531827,RUS-1953-1,A2.9-5479,364,RUS,Malenkov,6/3/53,20/03/1953,21/01/1902,14/01/1988,3/6/53,3/20/53,0,1,0,0,0,M,1/21/02,1902,1/14/88,19881828,RUS-1953-2,A2.9-5482,364,RUS,Khrushchev,20/03/1953,15/10/1964,15/04/1894,11/9/71,3/20/53,10/15/64,0,1,0,0,0,M,1894-04-15,1894,9/11/71,19711829,RUS-1964,A2.9-5485,364,RUS,Brezhnev,15/10/1964,10/11/82,19/12/1906,10/11/82,10/15/64,11/10/82,0,2,0,0,-777,M,12/19/06,1906,11/10/82,19821830,RUS-1982,A2.9-5488,364,RUS,Andropov,10/11/82,9/2/84,15/06/1914,9/2/84,11/10/82,2/9/84,0,2,0,0,-777,M,6/15/14,1914,2/9/84,19841831,RUS-1984,A2.9-5491,364,RUS,Chernenko,13/02/1984,10/3/85,24/09/1911,10/3/85,2/13/84,3/10/85,0,2,0,0,-777,M,9/24/11,1911,3/10/85,19851832,RUS-1985,A2.9-5494,364,RUS,Gorbachev,11/3/85,21/08/1991,2/3/31,-777,3/11/85,8/21/91,0,3,6,0,0,M,3/2/31,1931,NA,-7771833,RUS-1991,A2.9-5497,364,RUS,Yeltsin,21/08/1991,31/12/1999,1/2/31,23/04/2007,8/21/91,12/31/99,0,1,0,0,0,M,2/1/31,1931,4/23/07,20071834,RUS-2000,A2.9-5500,365,RUS,Putin,1/1/00,31/12/2004,7/10/52,-777,1/1/00,12/31/04,0,-888,0,0,-888,M,10/7/52,1952,NA,-7771835,EST-1918,A2.9-5503,366,EST,Pats,24/02/1918,8/5/19,23/02/1874,18/01/1956,2/24/18,5/8/19,0,1,0,0,0,M,1874-02-23,1874,1/18/56,19561836,EST-1919-1,A2.9-5506,366,EST,Strandman,19/05/1919,13/11/1919,30/11/1875,1941,5/19/19,11/13/19,0,1,0,0,0,M,1875-11-30,1875,NA,19411837,EST-1919-2,A2.9-5509,366,EST,Tonisson,13/11/1919,27/10/1920,22/12/1868,1941,11/13/19,10/27/20,0,1,0,0,0,M,1868-12-22,1868,NA,19411838,EST-1920,A2.9-5512,366,EST,Piip,27/10/1920,4/1/21,1884,1942,10/27/20,1/4/21,0,1,0,0,0,M,NA,1884,NA,19421839,EST-1921,A2.9-5515,366,EST,Pats,25/01/1921,23/10/1922,23/02/1874,18/01/1956,1/25/21,10/23/22,0,1,0,1,0,M,1874-02-23,1874,1/18/56,19561840,EST-1922,A2.9-5518,366,EST,Kukk,23/10/1922,2/8/23,1885,1945,10/23/22,8/2/23,0,1,0,0,0,M,NA,1885,NA,19451841,EST-1923,A2.9-5521,366,EST,Pats,2/8/23,28/03/1924,23/02/1874,18/01/1956,8/2/23,3/28/24,0,1,0,2,0,M,1874-02-23,1874,1/18/56,19561842,EST-1924-1,A2.9-5524,366,EST,Akel,28/03/1924,10/12/24,1871,1941,3/28/24,12/10/24,0,1,0,0,0,M,NA,1871,NA,19411843,EST-1924-2,A2.9-5527,366,EST,Jaakson,17/12/1924,16/12/1925,1870,1942,12/17/24,12/16/25,0,1,0,0,0,M,NA,1870,NA,19421844,EST-1925,A2.9-5530,366,EST,Teemant,16/12/1925,22/02/1927,24/09/1872,1941,12/16/25,2/22/27,0,1,0,0,0,M,1872-09-24,1872,NA,19411845,EST-1927-1,A2.9-5533,366,EST,Uluots,22/02/1927,22/11/1927,1890,1945,2/22/27,11/22/27,0,1,0,0,0,M,NA,1890,NA,19451846,EST-1927-2,A2.9-5536,366,EST,Tonisson,10/12/27,19/11/1928,22/12/1868,1941,12/10/27,11/19/28,0,1,0,1,0,M,1868-12-22,1868,NA,19411847,EST-1928,A2.9-5539,366,EST,Rei,19/11/1928,3/7/29,22/03/1886,1963,11/19/28,7/3/29,0,1,0,0,0,M,1886-03-22,1886,NA,19631848,EST-1929,A2.9-5542,366,EST,Strandman,10/7/29,3/2/31,30/11/1875,1941,7/10/29,2/3/31,0,1,0,1,0,M,1875-11-30,1875,NA,19411849,EST-1931,A2.9-5545,366,EST,Pats,12/2/31,29/01/1932,23/02/1874,18/01/1956,2/12/31,1/29/32,0,1,0,3,0,M,1874-02-23,1874,1/18/56,19561850,EST-1932-1,A2.9-5548,366,EST,Teemant,18/02/1932,20/06/1932,24/09/1872,1941,2/18/32,6/20/32,0,1,0,1,0,M,1872-09-24,1872,NA,19411851,EST-1932-2,A2.9-5551,366,EST,Einbund,19/07/1932,30/10/1932,1888,1942,7/19/32,10/30/32,0,1,0,0,0,M,NA,1888,NA,19421852,EST-1932-3,A2.9-5554,366,EST,Pats,1/11/32,26/04/1933,23/02/1874,18/01/1956,11/1/32,4/26/33,0,1,0,4,0,M,1874-02-23,1874,1/18/56,19561853,EST-1933-1,A2.9-5557,366,EST,Tonisson,17/05/1933,17/10/1933,22/12/1868,1941,5/17/33,10/17/33,0,1,0,2,0,M,1868-12-22,1868,NA,19411854,EST-1933-2,A2.9-5560,366,EST,Pats,21/10/1933,23/07/1940,23/02/1874,18/01/1956,10/21/33,7/23/40,0,4,9,5,2,M,1874-02-23,1874,1/18/56,19561855,EST-1940,A2.9-5563,366,EST,Vares,23/07/1940,25/08/1940,12/01/1890,1946,7/23/40,8/25/40,2,4,9,0,0,M,1890-01-12,1890,NA,19461856,EST-1991,A2.9-5566,366,EST,Savisaar,6/9/91,23/01/1992,1950,-777,9/6/91,1/23/92,0,1,0,0,0,M,NA,1950,NA,-7771857,EST-1992-1,A2.9-5569,366,EST,Vahi,30/01/1992,8/10/92,10/1/47,-777,1/30/92,10/8/92,0,1,0,0,0,M,1/10/47,1947,NA,-7771858,EST-1992-2,A2.9-5572,366,EST,Laar,28/10/1992,8/11/94,22/04/1960,-777,10/28/92,11/8/94,0,1,0,0,0,M,4/22/60,1960,NA,-7771859,EST-1994,A2.9-5575,366,EST,Tarand,8/11/94,17/04/1995,1940,-777,11/8/94,4/17/95,0,1,0,0,0,M,NA,1940,NA,-7771860,EST-1995,A2.9-5578,366,EST,Vahi,17/04/1995,17/03/1997,10/1/47,-777,4/17/95,3/17/97,0,1,0,1,0,M,1/10/47,1947,NA,-7771861,EST-1997,A2.9-5581,366,EST,Siimann,17/03/1997,25/03/1999,1946,-777,3/17/97,3/25/99,0,1,0,0,0,M,NA,1946,NA,-7771862,EST-1999,A2.9-5584,366,EST,Laar,25/03/1999,28/01/2002,22/04/1960,-777,3/25/99,1/28/02,0,1,0,1,0,M,4/22/60,1960,NA,-7771863,EST-2002,A2.9-5587,366,EST,Kallas,28/01/2002,10/4/03,1948,-777,1/28/02,4/10/03,0,1,0,0,0,M,NA,1948,NA,-7771864,EST-2003,A2.9-5590,366,EST,Parts,10/4/03,31/12/2004,1966,-777,4/10/03,12/31/04,0,-888,0,0,-888,M,NA,1966,NA,-7771865,LAT-1918,A2.9-5593,367,LAT,Ulmanis,17/11/1918,21/04/1919,04/09/1877,1942,11/17/18,4/21/19,1,1,0,0,0,M,1877-09-04,1877,NA,19421866,LAT-1919-1,A2.9-5596,367,LAT,Oskars Borkovskis,21/04/1919,26/04/1919,1872,1945,4/21/19,4/26/19,2,-666,0,0,-666,M,NA,1872,NA,19451867,LAT-1919-2,A2.9-5599,367,LAT,Andrievs Niedra,26/04/1919,28/06/1919,08/02/1871,25/09/1942,4/26/19,6/28/19,2,3,4,0,1,M,1871-02-08,1871,9/25/42,19421868,LAT-1919-3,A2.9-5602,367,LAT,Ulmanis,14/07/1919,17/06/1921,04/09/1877,1942,7/14/19,6/17/21,0,1,0,1,0,M,1877-09-04,1877,NA,19421869,LAT-1921,A2.9-5605,367,LAT,Meierovics,17/06/1921,31/01/1923,1887,1925,6/17/21,1/31/23,0,1,0,0,0,M,NA,1887,NA,19251870,LAT-1923-1,A2.9-5608,367,LAT,Pauluks,31/01/1923,27/06/1923,1865,1937,1/31/23,6/27/23,0,1,0,0,-666,M,NA,1865,NA,19371871,LAT-1923-2,A2.9-5611,367,LAT,Meierovics,28/06/1923,26/01/1924,1887,1925,6/28/23,1/26/24,0,1,0,1,0,M,NA,1887,NA,19251872,LAT-1924-1,A2.9-5614,367,LAT,Zamuelis,27/01/1924,18/12/1924,22/05/1872,1948,1/27/24,12/18/24,0,1,0,0,-666,M,1872-05-22,1872,NA,19481873,LAT-1924-2,A2.9-5617,367,LAT,Celmins,19/12/1924,25/12/1925,1877,1941,12/19/24,12/25/25,0,1,0,0,0,M,NA,1877,NA,19411874,LAT-1925,A2.9-5620,367,LAT,Ulmanis,25/12/1925,6/5/26,04/09/1877,1942,12/25/25,5/6/26,0,1,0,2,0,M,1877-09-04,1877,NA,19421875,LAT-1926-1,A2.9-5623,367,LAT,Alberings,7/5/26,17/12/1926,26/12/1876,1934,5/7/26,12/17/26,0,1,0,0,0,M,1876-12-26,1876,NA,19341876,LAT-1926-2,A2.9-5626,367,LAT,Skujenieks,17/12/1926,21/01/1928,23/06/1886,1941,12/17/26,1/21/28,0,1,0,0,0,M,1886-06-23,1886,NA,19411877,LAT-1928-1,A2.9-5629,367,LAT,Juresevskis,21/01/1928,13/11/1928,1872,1945,1/21/28,11/13/28,0,1,0,0,-666,M,NA,1872,NA,19451878,LAT-1928-2,A2.9-5632,367,LAT,Celmins,1/12/28,3/3/31,1877,1941,12/1/28,3/3/31,0,1,0,1,0,M,NA,1877,NA,19411879,LAT-1931-1,A2.9-5635,367,LAT,Ulmanis,24/03/1931,4/11/31,04/09/1877,1942,3/24/31,11/4/31,0,1,0,3,0,M,1877-09-04,1877,NA,19421880,LAT-1931-2,A2.9-5638,367,LAT,Skujenieks,4/12/31,3/2/33,23/06/1886,1941,12/4/31,2/3/33,0,1,0,1,0,M,1886-06-23,1886,NA,19411881,LAT-1933,A2.9-5641,367,LAT,Blodnieks,25/03/1933,2/3/34,1889,1962,3/25/33,3/2/34,0,1,0,0,-666,M,NA,1889,NA,19621882,LAT-1934,A2.9-5644,367,LAT,Ulmanis,16/03/1934,22/06/1940,04/09/1877,1942,3/16/34,6/22/40,0,4,9,4,2,M,1877-09-04,1877,NA,19421883,LAT-1990,A2.9-5647,367,LAT,Godmanis,3/5/90,3/8/93,27/11/1951,-777,5/3/90,8/3/93,0,1,0,0,0,M,11/27/51,1951,NA,-7771884,LAT-1993,A2.9-5650,367,LAT,Birkavs,3/8/93,19/09/1994,28/07/1942,-777,8/3/93,9/19/94,0,1,0,0,0,M,7/28/42,1942,NA,-7771885,LAT-1994,A2.9-5653,367,LAT,Gailis,19/09/1994,21/12/1995,1951,-777,9/19/94,12/21/95,0,1,0,0,0,M,NA,1951,NA,-7771886,LAT-1995,A2.9-5656,367,LAT,Skele,21/12/1995,7/8/97,1958,-777,12/21/95,8/7/97,0,1,0,0,0,M,NA,1958,NA,-7771887,LAT-1997,A2.9-5659,367,LAT,Krasts,7/8/97,26/11/1998,1957,-777,8/7/97,11/26/98,0,1,0,0,0,M,NA,1957,NA,-7771888,LAT-1998,A2.9-5662,367,LAT,Kristopans,26/11/1998,16/07/1999,1954,-777,11/26/98,7/16/99,0,1,0,0,0,M,NA,1954,NA,-7771889,LAT-1999,A2.9-5665,367,LAT,Skele,16/07/1999,5/5/00,1958,-777,7/16/99,5/5/00,0,1,0,1,0,M,NA,1958,NA,-7771890,LAT-2000,A2.9-5668,367,LAT,Berzins,5/5/00,7/11/02,4/8/51,-777,5/5/00,11/7/02,0,1,0,0,0,M,8/4/51,1951,NA,-7771891,LAT-2002,A2.9-5671,367,LAT,Repse,7/11/02,9/3/04,1961,-777,11/7/02,3/9/04,0,1,0,0,0,M,NA,1961,NA,-7771892,LAT-2004-1,A2.9-5674,367,LAT,Indulis Emsis,9/3/04,2/12/04,1952,-777,3/9/04,12/2/04,0,1,0,0,-999,M,NA,1952,NA,-7771893,LAT-2004-2,A2.9-5677,367,LAT,Aigars Kalvitis,2/12/04,31/12/2004,1966,-777,12/2/04,12/31/04,0,-888,0,0,-888,M,NA,1966,NA,-7771894,LIT-1917,A2.9-5680,368,LIT,Smetona,18/09/1917,9/7/18,10/08/1874,9/1/44,9/18/17,7/9/18,-666,-666,0,0,-666,M,1874-08-10,1874,1/9/44,19441895,LIT-1918-1,A2.9-5683,368,LIT,Mindaugas II,9/7/18,2/11/18,30/05/1864,24/03/1928,7/9/18,11/2/18,0,3,-999,0,-666,M,1864-05-30,1864,3/24/28,19281896,LIT-1918-2,A2.9-5686,368,LIT,Smetona,2/11/18,15/05/1920,10/08/1874,9/1/44,11/2/18,5/15/20,0,1,0,1,0,M,1874-08-10,1874,1/9/44,19441897,LIT-1920,A2.9-5689,368,LIT,Stulginskis,15/05/1920,6/6/26,26/02/1885,1969,5/15/20,6/6/26,0,1,0,0,0,M,1885-02-26,1885,NA,19691898,LIT-1926-1,A2.9-5692,368,LIT,Grinius,6/6/26,19/12/1926,17/12/1866,4/6/50,6/6/26,12/19/26,0,3,6,0,0,M,1866-12-17,1866,6/4/50,19501899,LIT-1926-2,A2.9-5695,368,LIT,Smetona,19/12/1926,16/06/1940,10/08/1874,9/1/44,12/19/26,6/16/40,1,4,9,2,1,M,1874-08-10,1874,1/9/44,19441900,LIT-1990,A2.9-5698,368,LIT,Landsbergis,11/3/90,25/11/1992,12/10/31,-777,3/11/90,11/25/92,0,1,0,0,0,M,10/12/31,1931,NA,-7771901,LIT-1992,A2.9-5701,368,LIT,Brazauskas,25/11/1992,25/02/1998,1932,-777,11/25/92,2/25/98,0,1,0,0,0,M,NA,1932,NA,-7771902,LIT-1998,A2.9-5704,368,LIT,Adamkus,26/02/1998,25/02/2003,3/11/26,-777,2/26/98,2/25/03,0,1,0,0,0,M,11/3/26,1926,NA,-7771903,LIT-2003,A2.9-5707,368,LIT,Paksas,26/02/2003,6/4/04,10/6/56,-777,2/26/03,4/6/04,0,1,0,0,0,M,6/10/56,1956,NA,-7771904,LIT-2004-1,A2.9-5710,368,LIT,Paulauskas,6/4/04,12/7/04,1953,-777,4/6/04,7/12/04,0,1,0,0,-999,M,NA,1953,NA,-7771905,LIT-2004-2,A2.9-5713,368,LIT,Adamkus,12/7/04,31/12/2004,1953,-777,7/12/04,12/31/04,0,-888,0,1,-888,M,NA,1953,NA,-7771906,UKR-1990,A2.9-5716,369,UKR,Kravchuk,18/07/1990,19/07/1994,10/1/34,-777,7/18/90,7/19/94,0,1,0,0,0,M,1/10/34,1934,NA,-7771907,UKR-1994,A2.9-5719,369,UKR,Kuchma,19/07/1994,31/12/2004,9/8/38,-777,7/19/94,12/31/04,0,-888,0,0,-888,M,8/9/38,1938,NA,-7771908,BLR-1991,A2.9-5722,370,BLR,Shushkevich,18/09/1991,26/01/1994,15/12/1934,-777,9/18/91,1/26/94,0,1,0,0,0,M,12/15/34,1934,NA,-7771909,BLR-1994-1,A2.9-5725,370,BLR,Kuznyatsu,26/01/1994,28/01/1994,1947,-777,1/26/94,1/28/94,0,1,0,0,0,M,NA,1947,NA,-7771910,BLR-1994-2,A2.9-5728,370,BLR,Hryb,28/01/1994,20/07/1994,1938,-777,1/28/94,7/20/94,0,1,0,0,0,M,NA,1938,NA,-7771911,BLR-1994-3,A2.9-5731,370,BLR,Lukashenko,20/07/1994,31/12/2004,30/08/1954,-777,7/20/94,12/31/04,0,-888,0,0,-888,M,8/30/54,1954,NA,-7771912,ARM-1991,A2.9-5734,371,ARM,Ter-Petrosyan,16/10/1991,3/2/98,1945,-777,10/16/91,2/3/98,0,1,0,0,0,M,NA,1945,NA,-7771913,ARM-1998,A2.9-5737,371,ARM,Kocharian,4/2/98,31/12/2004,31/08/1954,-777,2/4/98,12/31/04,0,-888,0,0,-888,M,8/31/54,1954,NA,-7771914,GRG-1991,A2.9-5740,372,GRG,Gamsakhurdia,12/4/91,6/1/92,31/03/1939,31/12/1993,4/12/91,1/6/92,0,3,4,0,1,M,3/31/39,1939,12/31/93,19931915,GRG-1992-1,A2.9-5743,372,GRG,Ioseliani,6/1/92,10/3/92,10/7/26,4/3/03,1/6/92,3/10/92,1,1,0,0,0,M,7/10/26,1926,3/4/03,20031916,GRG-1992-2,A2.9-5746,372,GRG,Shevardnadze,10/3/92,23/11/2003,25/01/1928,-777,3/10/92,11/23/03,0,3,2,0,0,M,1/25/28,1928,NA,-7771917,GRG-2003,A2.9-5749,372,GRG,Burdjanadze,23/11/2003,25/01/2004,16/07/1964,-777,11/23/03,1/25/04,0,1,0,0,0,F,7/16/64,1964,NA,-7771918,GRG-2004,A2.9-5752,372,GRG,Saakashvili,25/01/2004,31/12/2004,21/12/1967,-777,1/25/04,12/31/04,0,-888,0,0,-888,M,12/21/67,1967,NA,-7771919,AZE-1991,A2.9-5755,373,AZE,Mutalibov,8/9/91,6/3/92,12/5/38,-777,9/8/91,3/6/92,0,1,0,0,0,M,5/12/38,1938,NA,-7771920,AZE-1992-1,A2.9-5758,373,AZE,Mamedov,6/3/92,14/05/1992,1941,-777,3/6/92,5/14/92,0,1,0,0,-666,M,NA,1941,NA,-7771921,AZE-1992-2,A2.9-5761,373,AZE,Mutalibov,14/05/1992,18/05/1992,12/5/38,-777,5/14/92,5/18/92,0,3,2,1,1,M,5/12/38,1938,NA,-7771922,AZE-1992-3,A2.9-5764,373,AZE,Gambarov,19/05/1992,16/06/1992,1957,-777,5/19/92,6/16/92,1,1,0,0,0,M,NA,1957,NA,-7771923,AZE-1992-4,A2.9-5767,373,AZE,Abulfaz Elchibey,16/06/1992,18/06/1993,7/6/38,22/08/2000,6/16/92,6/18/93,1,3,4,0,0,M,6/7/38,1938,8/22/00,20001924,AZE-1993,A2.9-5770,373,AZE,H. Aliyev,24/06/1993,4/8/03,10/5/23,12/12/03,6/24/93,8/4/03,0,2.1,0,0,0,M,5/10/23,1923,12/12/03,20031925,AZE-2003,A2.9-5773,373,AZE,Ilhma Aliyev,4/8/03,31/12/2004,24/12/1961,-777,8/4/03,12/31/04,0,-888,0,0,-888,M,12/24/61,1961,NA,-7771926,FIN-1917,A2.9-5776,375,FIN,Svinhufud,27/11/1917,12/12/18,15/12/1861,1944,11/27/17,12/12/18,0,2.1,0,0,0,M,1861-12-15,1861,NA,19441927,FIN-1918,A2.9-5779,375,FIN,Mannerheim,12/12/18,30/06/1919,04/06/1867,27/01/1951,12/12/18,6/30/19,0,1,0,0,0,M,1867-06-04,1867,1/27/51,19511928,FIN-1919,A2.9-5782,375,FIN,Stahlberg,25/07/1919,28/02/1925,28/01/1865,1952,7/25/19,2/28/25,0,1,0,0,0,M,1865-01-28,1865,NA,19521929,FIN-1925,A2.9-5785,375,FIN,Relander,1/3/25,28/02/1931,31/05/1883,1942,3/1/25,2/28/31,0,1,0,0,0,M,1883-05-31,1883,NA,19421930,FIN-1931,A2.9-5788,375,FIN,Svinhufud,1/3/31,28/02/1937,15/12/1861,1944,3/1/31,2/28/37,0,1,0,1,0,M,1861-12-15,1861,NA,19441931,FIN-1937,A2.9-5791,375,FIN,Kallio,1/3/37,28/11/1940,10/04/1873,1940,3/1/37,11/28/40,0,2.1,0,0,-777,M,1873-04-10,1873,NA,19401932,FIN-1940,A2.9-5794,375,FIN,Ryti,19/12/1940,1/8/44,03/02/1889,1956,12/19/40,8/1/44,0,1,0,0,2,M,1889-02-03,1889,NA,19561933,FIN-1944,A2.9-5797,375,FIN,Mannerheim,4/8/44,4/3/46,04/06/1867,27/01/1951,8/4/44,3/4/46,0,2.1,0,1,1,M,1867-06-04,1867,1/27/51,19511934,FIN-1946,A2.9-5800,375,FIN,Paasikivi,9/3/46,29/02/1956,27/11/1879,14/12/1956,3/9/46,2/29/56,0,1,0,0,0,M,1879-11-27,1879,12/14/56,19561935,FIN-1956,A2.9-5803,375,FIN,Kekkonen,1/3/56,11/9/81,3/9/00,31/08/1986,3/1/56,9/11/81,0,2.1,0,0,0,M,9/3/00,1900,8/31/86,19861936,FIN-1981,A2.9-5806,375,FIN,Koivisto,11/9/81,1/3/94,25/11/1923,-777,9/11/81,3/1/94,0,1,0,0,0,M,11/25/23,1923,NA,-7771937,FIN-1994,A2.9-5809,375,FIN,Marthi Ahtisaari,1/3/94,1/3/00,23/06/1937,-777,3/1/94,3/1/00,0,1,0,0,0,M,6/23/37,1937,NA,-7771938,FIN-2000,A2.9-5812,375,FIN,Halonen,1/3/00,31/12/2004,24/12/1943,-777,3/1/00,12/31/04,0,-888,0,0,-888,F,12/24/43,1943,NA,-7771939,SWD-1872,A2.9-5815,380,SWD,Oscar II,18/09/1872,20/03/1876,21/01/1829,8/12/07,1872-09-18,1876-03-20,0,1,0,0,0,M,1829-01-21,1829,12/8/07,19071940,SWD-1876,A2.9-5818,380,SWD,de Geer af FinspŒng,20/03/1876,19/04/1880,1818,1896,1876-03-20,1880-04-19,0,1,0,0,0,M,NA,1818,NA,18961941,SWD-1880,A2.9-5821,380,SWD,Posse,19/04/1880,13/06/1883,1820,1901,1880-04-19,1883-06-13,0,1,0,0,0,M,NA,1820,NA,19011942,SWD-1883,A2.9-5824,380,SWD,Thyselius,13/06/1883,16/05/1884,08/06/1811,11/01/1891,1883-06-13,1884-05-16,0,1,0,0,0,M,1811-06-08,1811,1891-01-11,18911943,SWD-1884,A2.9-5827,380,SWD,Themptander,16/05/1884,06/02/1888,14/02/1844,30/01/1897,1884-05-16,1888-02-06,0,1,0,0,0,M,1844-02-14,1844,1897-01-30,18971944,SWD-1888,A2.9-5830,380,SWD,Bildt,06/02/1888,12/10/1889,1820,1894,1888-02-06,1889-10-12,0,1,0,0,0,M,NA,1820,NA,18941945,SWD-1889,A2.9-5833,380,SWD,Akerhjelm,12/10/1889,15/07/1891,1833,1900,1889-10-12,1891-07-15,0,1,0,0,0,M,NA,1833,NA,19001946,SWD-1891,A2.9-5836,380,SWD,Bostrom,15/07/1891,12/9/00,11/02/1842,1907,1891-07-15,9/12/00,0,1,0,0,0,M,1842-02-11,1842,NA,19071947,SWD-1900,A2.9-5839,380,SWD,Otter,12/9/00,5/7/02,11/04/1833,1910,9/12/00,7/5/02,0,1,0,0,0,M,1833-04-11,1833,NA,19101948,SWD-1902,A2.9-5842,380,SWD,Bostrom,5/7/02,13/04/1905,11/02/1842,1907,7/5/02,4/13/05,0,1,0,1,0,M,1842-02-11,1842,NA,19071949,SWD-1905-1,A2.9-5845,380,SWD,Ramstedt,13/04/1905,2/8/05,1852,1935,4/13/05,8/2/05,0,1,0,0,0,M,NA,1852,NA,19351950,SWD-1905-2,A2.9-5848,380,SWD,Lundeberg,2/8/05,7/11/05,14/07/1842,1911,8/2/05,11/7/05,0,1,0,0,0,M,1842-07-14,1842,NA,19111951,SWD-1905-3,A2.9-5851,380,SWD,Staaf,7/11/05,29/05/1906,21/01/1860,1915,11/7/05,5/29/06,0,1,0,0,0,M,1860-01-21,1860,NA,19151952,SWD-1906,A2.9-5854,380,SWD,Lindman,29/05/1906,30/09/1911,19/09/1862,1936,5/29/06,9/30/11,0,1,0,0,0,M,1862-09-19,1862,NA,19361953,SWD-1911,A2.9-5857,380,SWD,Staaf,7/10/11,17/02/1914,21/01/1860,1915,10/7/11,2/17/14,0,1,0,1,0,M,1860-01-21,1860,NA,19151954,SWD-1914,A2.9-5860,380,SWD,Hammarskjold,17/02/1914,29/03/1917,04/02/1862,12/10/53,2/17/14,3/29/17,0,1,0,0,0,M,1862-02-04,1862,10/12/53,19531955,SWD-1917-1,A2.9-5863,380,SWD,Swartz,29/03/1917,19/10/1917,09/06/1858,1926,3/29/17,10/19/17,0,1,0,0,0,M,1858-06-09,1858,NA,19261956,SWD-1917-2,A2.9-5866,380,SWD,Eden,19/10/1917,6/3/20,25/08/1871,16/06/1945,10/19/17,3/6/20,0,1,0,0,0,M,1871-08-25,1871,6/16/45,19451957,SWD-1920-1,A2.9-5869,380,SWD,Branting,6/3/20,22/10/1920,23/11/1860,24/02/1925,3/6/20,10/22/20,0,1,0,0,0,M,1860-11-23,1860,2/24/25,19251958,SWD-1920-2,A2.9-5872,380,SWD,de Geer,27/10/1920,23/02/1921,27/11/1854,1935,10/27/20,2/23/21,0,1,0,0,0,M,1854-11-27,1854,NA,19351959,SWD-1921-1,A2.9-5875,380,SWD,von Sydow,23/02/1921,13/10/1921,12/07/1873,1936,2/23/21,10/13/21,0,1,0,0,0,M,1873-07-12,1873,NA,19361960,SWD-1921-2,A2.9-5878,380,SWD,Branting,13/10/1921,6/4/23,23/11/1860,24/02/1925,10/13/21,4/6/23,0,1,0,1,0,M,1860-11-23,1860,2/24/25,19251961,SWD-1923,A2.9-5881,380,SWD,Trygger,6/4/23,18/10/1924,20/10/1857,24/09/1943,4/6/23,10/18/24,0,1,0,0,0,M,1857-10-20,1857,9/24/43,19431962,SWD-1924,A2.9-5884,380,SWD,Branting,18/10/1924,24/01/1925,23/11/1860,24/02/1925,10/18/24,1/24/25,0,2.1,0,2,-777,M,1860-11-23,1860,2/24/25,19251963,SWD-1925,A2.9-5887,380,SWD,Sandler,24/01/1925,2/6/26,29/01/1884,1964,1/24/25,6/2/26,0,1,0,0,0,M,1884-01-29,1884,NA,19641964,SWD-1926,A2.9-5890,380,SWD,Ekman,6/6/26,26/09/1928,05/10/1872,1945,6/6/26,9/26/28,0,1,0,0,0,M,1872-10-05,1872,NA,19451965,SWD-1928,A2.9-5893,380,SWD,Lindman,1/10/28,2/6/30,19/09/1862,1936,10/1/28,6/2/30,0,1,0,1,0,M,1862-09-19,1862,NA,19361966,SWD-1930,A2.9-5896,380,SWD,Ekman,6/6/30,6/8/32,05/10/1872,1945,6/6/30,8/6/32,0,1,0,1,0,M,1872-10-05,1872,NA,19451967,SWD-1932-1,A2.9-5899,380,SWD,Hamrin,6/8/32,19/09/1932,14/01/1875,27/11/1937,8/6/32,9/19/32,0,1,0,0,0,M,1875-01-14,1875,11/27/37,19371968,SWD-1932-2,A2.9-5902,380,SWD,Hansson,24/09/1932,15/06/1936,28/10/1885,6/10/46,9/24/32,6/15/36,0,1,0,0,0,M,1885-10-28,1885,10/6/46,19461969,SWD-1936-1,A2.9-5905,380,SWD,Pehrsson-Bramst,19/06/1936,23/09/1936,19/08/1883,19/02/1954,6/19/36,9/23/36,0,1,0,0,0,M,1883-08-19,1883,2/19/54,19541970,SWD-1936-2,A2.9-5908,380,SWD,Hansson,28/09/1936,6/10/46,28/10/1885,6/10/46,9/28/36,10/6/46,0,2,0,1,-777,M,1885-10-28,1885,10/6/46,19461971,SWD-1946,A2.9-5911,380,SWD,Erlander,10/10/46,9/10/69,16/06/1901,21/06/1985,10/10/46,10/9/69,0,1,0,0,0,M,6/16/01,1901,6/21/85,19851972,SWD-1969,A2.9-5914,380,SWD,Palme,14/10/1969,20/09/1976,30/01/1927,28/02/1986,10/14/69,9/20/76,0,1,0,0,0,M,1/30/27,1927,2/28/86,19861973,SWD-1976,A2.9-5917,380,SWD,Falldin,4/10/76,18/10/1978,24/04/1926,-777,10/4/76,10/18/78,0,1,0,0,0,M,4/24/26,1926,NA,-7771974,SWD-1978,A2.9-5920,380,SWD,Ullsten,18/10/1978,9/10/79,23/06/1931,-777,10/18/78,10/9/79,0,1,0,0,0,M,6/23/31,1931,NA,-7771975,SWD-1979,A2.9-5923,380,SWD,Falldin,9/10/79,7/10/82,24/04/1926,-777,10/9/79,10/7/82,0,1,0,1,0,M,4/24/26,1926,NA,-7771976,SWD-1982,A2.9-5926,380,SWD,Palme,7/10/82,28/02/1986,30/01/1927,28/02/1986,10/7/82,2/28/86,0,3,11,1,3,M,1/30/27,1927,2/28/86,19861977,SWD-1986,A2.9-5929,380,SWD,Carlsson,12/3/86,30/10/1991,9/11/34,-777,3/12/86,10/30/91,0,1,0,0,0,M,11/9/34,1934,NA,-7771978,SWD-1991,A2.9-5932,380,SWD,Bildt,30/10/1991,7/10/94,15/07/1949,-777,10/30/91,10/7/94,0,1,0,0,0,M,7/15/49,1949,NA,-7771979,SWD-1994,A2.9-5935,380,SWD,Carlsson,7/10/94,21/03/1996,9/11/34,-777,10/7/94,3/21/96,0,1,0,1,0,M,11/9/34,1934,NA,-7771980,SWD-1996,A2.9-5938,380,SWD,Persson,21/03/1996,31/12/2004,20/01/1949,-777,3/21/96,12/31/04,0,-888,0,0,-888,M,1/20/49,1949,NA,-7771981,NOR-1905,A2.9-5941,385,NOR,Michelsen,2/3/05,28/10/1907,15/03/1857,28/06/1925,3/2/05,10/28/07,0,1,0,0,0,M,1857-03-15,1857,6/28/25,19251982,NOR-1907,A2.9-5944,385,NOR,Lovland,28/10/1907,13/03/1908,03/02/1857,1922,10/28/07,3/13/08,0,1,0,0,0,M,1857-02-03,1857,NA,19221983,NOR-1908,A2.9-5947,385,NOR,Knudsen,19/03/1908,1/2/10,19/09/1848,1928,3/19/08,2/1/10,0,1,0,0,0,M,1848-09-19,1848,NA,19281984,NOR-1910,A2.9-5950,385,NOR,Konow,1/2/10,19/02/1912,1845,1932,2/1/10,2/19/12,0,1,0,0,0,M,NA,1845,NA,19321985,NOR-1912,A2.9-5953,385,NOR,Bratlie,19/02/1912,29/01/1913,17/01/1856,1939,2/19/12,1/29/13,0,1,0,0,0,M,1856-01-17,1856,NA,19391986,NOR-1913,A2.9-5956,385,NOR,Knudsen,29/01/1913,20/06/1920,19/09/1848,1928,1/29/13,6/20/20,0,1,0,1,0,M,1848-09-19,1848,NA,19281987,NOR-1920,A2.9-5959,385,NOR,Halvorsen,20/06/1920,22/06/1921,28/05/1872,1923,6/20/20,6/22/21,0,1,0,0,0,M,1872-05-28,1872,NA,19231988,NOR-1921,A2.9-5962,385,NOR,Blehr,22/06/1921,5/3/23,17/02/1847,1927,6/22/21,3/5/23,0,1,0,1,0,M,1847-02-17,1847,NA,19271989,NOR-1923-1,A2.9-5965,385,NOR,Halvorsen,5/3/23,23/05/1923,28/05/1872,1923,3/5/23,5/23/23,0,2,0,1,-777,M,1872-05-28,1872,NA,19231990,NOR-1923-2,A2.9-5968,385,NOR,Berge,23/05/1923,25/06/1924,20/08/1851,1936,5/23/23,6/25/24,0,1,0,0,0,M,1851-08-20,1851,NA,19361991,NOR-1924,A2.9-5971,385,NOR,Mowinckel,25/06/1924,3/3/26,22/10/1870,30/09/1943,6/25/24,3/3/26,0,1,0,0,0,M,1870-10-22,1870,9/30/43,19431992,NOR-1926,A2.9-5974,385,NOR,Lykke,3/3/26,20/01/1928,09/01/1872,1949,3/3/26,1/20/28,0,1,0,0,0,M,1872-01-09,1872,NA,19491993,NOR-1928-1,A2.9-5977,385,NOR,Hornsrud,20/01/1928,15/02/1928,15/11/1859,1960,1/20/28,2/15/28,0,1,0,0,0,M,1859-11-15,1859,NA,19601994,NOR-1928-2,A2.9-5980,385,NOR,Mowinckel,15/02/1928,9/5/31,22/10/1870,30/09/1943,2/15/28,5/9/31,0,1,0,1,0,M,1870-10-22,1870,9/30/43,19431995,NOR-1931,A2.9-5983,385,NOR,Kolstad,11/5/31,1/2/32,1878,1932,5/11/31,2/1/32,0,2.1,0,0,-777,M,NA,1878,NA,19321996,NOR-1932-1,A2.9-5986,385,NOR,Braadland,1/2/32,14/03/1932,1879,1966,2/1/32,3/14/32,0,1,0,0,0,M,NA,1879,NA,19661997,NOR-1932-2,A2.9-5989,385,NOR,Hundseid,14/03/1932,25/02/1933,1883,1965,3/14/32,2/25/33,0,1,0,0,0,M,NA,1883,NA,19651998,NOR-1933,A2.9-5992,385,NOR,Mowinckel,2/3/33,16/03/1935,22/10/1870,30/09/1943,3/2/33,3/16/35,0,1,0,2,0,M,1870-10-22,1870,9/30/43,19431999,NOR-1935,A2.9-5995,385,NOR,Nygaardsvold,19/03/1935,9/4/40,06/09/1879,13/03/1952,3/19/35,4/9/40,0,4,9,0,1,M,1879-09-06,1879,3/13/52,19522000,NOR-1940,A2.9-5998,385,NOR,Quisling,9/4/40,7/5/45,18/07/1887,24/10/1945,4/9/40,5/7/45,2,4,9,0,0,M,1887-07-18,1887,10/24/45,19452001,NOR-1945-1,A2.9-6001,385,NOR,Nygaardsvold,7/5/45,25/06/1945,06/09/1879,13/03/1952,5/7/45,6/25/45,0,1,0,1,0,M,1879-09-06,1879,3/13/52,19522002,NOR-1945-2,A2.9-6004,385,NOR,Gerhardsen,26/06/1945,13/11/1951,10/05/1897,19/09/1987,6/26/45,11/13/51,0,1,0,0,0,M,1897-05-10,1897,9/19/87,19872003,NOR-1951,A2.9-6007,385,NOR,Torp,13/11/1951,14/01/1955,08/06/1893,1958,11/13/51,1/14/55,0,1,0,0,0,M,1893-06-08,1893,NA,19582004,NOR-1955,A2.9-6010,385,NOR,Gerhardsen,22/01/1955,23/08/1963,10/05/1897,19/09/1987,1/22/55,8/23/63,0,1,0,1,0,M,1897-05-10,1897,9/19/87,19872005,NOR-1963-1,A2.9-6013,385,NOR,Lyng,27/08/1963,25/09/1963,22/08/1905,1978,8/27/63,9/25/63,0,1,0,0,0,M,8/22/05,1905,NA,19782006,NOR-1963-2,A2.9-6016,385,NOR,Gerhardsen,25/09/1963,12/10/65,10/05/1897,19/09/1987,9/25/63,10/12/65,0,1,0,2,0,M,1897-05-10,1897,9/19/87,19872007,NOR-1965,A2.9-6019,385,NOR,Borten,12/10/65,16/03/1971,3/4/13,20/01/2005,10/12/65,3/16/71,0,1,0,0,0,M,4/3/13,1913,1/20/05,20052008,NOR-1971,A2.9-6022,385,NOR,Bratteli,16/03/1971,17/10/1972,11/1/10,20/11/1984,3/16/71,10/17/72,0,1,0,0,0,M,1/11/10,1910,11/20/84,19842009,NOR-1972,A2.9-6025,385,NOR,Korvald,17/10/1972,15/10/1973,29/04/1916,2006,10/17/72,10/15/73,0,1,0,0,0,M,4/29/16,1916,NA,20062010,NOR-1973,A2.9-6028,385,NOR,Bratteli,15/10/1973,9/1/76,11/1/10,20/11/1984,10/15/73,1/9/76,0,1,0,1,0,M,1/11/10,1910,11/20/84,19842011,NOR-1976,A2.9-6031,385,NOR,Nordli,9/1/76,4/2/81,3/11/27,-777,1/9/76,2/4/81,0,2.1,0,0,0,M,11/3/27,1927,NA,-7772012,NOR-1981-1,A2.9-6034,385,NOR,Brundtland,4/2/81,14/10/1981,20/04/1939,-777,2/4/81,10/14/81,0,1,0,0,0,F,4/20/39,1939,NA,-7772013,NOR-1981-2,A2.9-6037,385,NOR,Willoch,14/10/1981,9/5/86,3/10/28,-777,10/14/81,5/9/86,0,1,0,0,0,M,10/3/28,1928,NA,-7772014,NOR-1986,A2.9-6040,385,NOR,Brundtland,9/5/86,16/10/1989,20/04/1939,-777,5/9/86,10/16/89,0,1,0,1,0,F,4/20/39,1939,NA,-7772015,NOR-1989,A2.9-6043,385,NOR,Syse,16/10/1989,3/11/90,25/11/1930,1997,10/16/89,11/3/90,0,1,0,0,0,M,11/25/30,1930,NA,19972016,NOR-1990,A2.9-6046,385,NOR,Brundtland,3/11/90,25/10/1996,20/04/1939,-777,11/3/90,10/25/96,0,1,0,2,0,F,4/20/39,1939,NA,-7772017,NOR-1996,A2.9-6049,385,NOR,Jagland,25/10/1996,17/10/1997,5/11/50,-777,10/25/96,10/17/97,0,1,0,0,0,M,11/5/50,1950,NA,-7772018,NOR-1997,A2.9-6052,385,NOR,Bondevik,17/10/1997,30/08/1998,3/9/47,-777,10/17/97,8/30/98,0,1,0,0,0,M,9/3/47,1947,NA,-7772019,NOR-1998-1,A2.9-6055,385,NOR,Lahnstein,30/08/1998,23/09/1998,1949,-777,8/30/98,9/23/98,0,1,0,0,0,M,NA,1949,NA,-7772020,NOR-1998-2,A2.9-6058,385,NOR,Bondevik,24/09/1998,17/03/2000,3/9/47,-777,9/24/98,3/17/00,0,1,0,1,0,M,9/3/47,1947,NA,-7772021,NOR-2000,A2.9-6061,385,NOR,Stoltenberg,17/03/2000,19/10/2001,1959,-777,3/17/00,10/19/01,0,1,0,0,0,M,NA,1959,NA,-7772022,NOR-2001,A2.9-6064,385,NOR,Bondevik,19/10/2001,31/12/2004,3/9/47,-777,10/19/01,12/31/04,0,-888,0,2,-888,M,9/3/47,1947,NA,-7772023,DEN-1874,A2.9-6067,390,DEN,Fonnesbech,14/07/1874,11/06/1875,07/07/1817,1880,1874-07-14,1875-06-11,0,1,0,0,0,M,1817-07-07,1817,NA,18802024,DEN-1875,A2.9-6070,390,DEN,Estrup,11/06/1875,07/08/1894,06/04/1825,24/12/1913,1875-06-11,1894-08-07,0,1,0,0,0,M,1825-04-06,1825,12/24/13,19132025,DEN-1894,A2.9-6073,390,DEN,Reedtz-Thott,07/08/1894,23/05/1897,1839,1923,1894-08-07,1897-05-23,0,1,0,0,0,M,NA,1839,NA,19232026,DEN-1897,A2.9-6076,390,DEN,Horring,23/05/1897,24/04/1900,17/08/1842,1909,1897-05-23,4/24/00,0,1,0,0,0,M,1842-08-17,1842,NA,19092027,DEN-1900,A2.9-6079,390,DEN,Sehested,24/04/1900,24/07/1901,16/11/1842,1924,4/24/00,7/24/01,0,1,0,0,0,M,1842-11-16,1842,NA,19242028,DEN-1901,A2.9-6082,390,DEN,Deuntzer,24/07/1901,14/01/1905,21/05/1845,1918,7/24/01,1/14/05,0,1,0,0,0,M,1845-05-21,1845,NA,19182029,DEN-1905,A2.9-6085,390,DEN,Christensen,14/01/1905,12/10/08,21/11/1856,1930,1/14/05,10/12/08,0,1,0,0,0,M,1856-11-21,1856,NA,19302030,DEN-1908,A2.9-6088,390,DEN,Neergaard,12/10/08,16/08/1909,27/04/1854,1936,10/12/08,8/16/09,0,1,0,0,0,M,1854-04-27,1854,NA,19362031,DEN-1909-1,A2.9-6091,390,DEN,J. Holstein,16/08/1909,28/10/1909,10/06/1839,1912,8/16/09,10/28/09,0,1,0,0,0,M,1839-06-10,1839,NA,19122032,DEN-1909-2,A2.9-6094,390,DEN,Zahle,28/10/1909,5/7/10,19/01/1866,1946,10/28/09,7/5/10,0,1,0,0,0,M,1866-01-19,1866,NA,19462033,DEN-1910,A2.9-6097,390,DEN,Bernsten,5/7/10,21/06/1913,12/06/1844,1927,7/5/10,6/21/13,0,1,0,0,0,M,1844-06-12,1844,NA,19272034,DEN-1913,A2.9-6100,390,DEN,Zahle,21/06/1913,30/03/1920,19/01/1866,1946,6/21/13,3/30/20,0,1,0,1,0,M,1866-01-19,1866,NA,19462035,DEN-1920-1,A2.9-6103,390,DEN,Liebe,30/03/1920,5/4/20,24/05/1860,1929,3/30/20,4/5/20,0,1,0,0,0,M,1860-05-24,1860,NA,19292036,DEN-1920-2,A2.9-6106,390,DEN,Friis,5/4/20,5/5/20,16/08/1870,1944,4/5/20,5/5/20,0,1,0,0,0,M,1870-08-16,1870,NA,19442037,DEN-1920-3,A2.9-6109,390,DEN,Neergaard,5/5/20,23/04/1924,27/04/1854,1936,5/5/20,4/23/24,0,1,0,1,0,M,1854-04-27,1854,NA,19362038,DEN-1924,A2.9-6112,390,DEN,Stauning,23/04/1924,14/12/1926,26/10/1873,1942,4/23/24,12/14/26,0,1,0,0,0,M,1873-10-26,1873,NA,19422039,DEN-1926,A2.9-6115,390,DEN,Madsen-Mygdat,14/12/1926,25/04/1929,24/12/1876,1943,12/14/26,4/25/29,0,1,0,0,0,M,1876-12-24,1876,NA,19432040,DEN-1929,A2.9-6118,390,DEN,Stauning,30/04/1929,3/5/42,26/10/1873,1942,4/30/29,5/3/42,0,2,0,1,-777,M,1873-10-26,1873,NA,19422041,DEN-1942-1,A2.9-6121,390,DEN,Buhl,3/5/42,9/11/42,16/10/1881,18/12/1954,5/3/42,11/9/42,0,1,0,0,0,M,1881-10-16,1881,12/18/54,19542042,DEN-1942-2,A2.9-6124,390,DEN,Scavenius,9/11/42,30/08/1943,13/06/1877,1962,11/9/42,8/30/43,0,4,9,0,0,M,1877-06-13,1877,NA,19622043,DEN-1945-1,A2.9-6127,390,DEN,Buhl,5/5/45,7/11/45,16/10/1881,18/12/1954,5/5/45,11/7/45,0,1,0,0,0,M,1881-10-16,1881,12/18/54,19542044,DEN-1945-2,A2.9-6130,390,DEN,Kristensen,8/11/45,4/10/47,26/10/1880,29/09/1962,11/8/45,10/4/47,0,1,0,1,0,M,1880-10-26,1880,9/29/62,19622045,DEN-1947,A2.9-6133,390,DEN,Hedtoft,12/11/47,25/10/1950,21/04/1903,29/01/1955,11/12/47,10/25/50,0,1,0,0,0,M,4/21/03,1903,1/29/55,19552046,DEN-1950,A2.9-6136,390,DEN,Eriksen,28/10/1950,30/09/1953,20/11/1902,7/10/72,10/28/50,9/30/53,0,1,0,0,0,M,11/20/02,1902,10/7/72,19722047,DEN-1953,A2.9-6139,390,DEN,Hedtoft,30/09/1953,29/01/1955,21/04/1903,29/01/1955,9/30/53,1/29/55,0,2,0,1,-777,M,4/21/03,1903,1/29/55,19552048,DEN-1955,A2.9-6142,390,DEN,Hansen,1/2/55,19/02/1960,8/11/06,19/02/1960,2/1/55,2/19/60,0,2,0,0,-777,M,11/8/06,1906,2/19/60,19602049,DEN-1960,A2.9-6145,390,DEN,Kampmann,19/02/1960,3/9/62,21/07/1910,3/6/76,2/19/60,9/3/62,0,2.1,0,0,0,M,7/21/10,1910,6/3/76,19762050,DEN-1962,A2.9-6148,390,DEN,Krag,3/9/62,18/02/1968,15/09/1914,22/06/1978,9/3/62,2/18/68,0,1,0,0,0,M,9/15/14,1914,6/22/78,19782051,DEN-1968,A2.9-6151,390,DEN,Baunsgaard,18/02/1968,6/10/71,26/02/1920,30/06/1989,2/18/68,10/6/71,0,1,0,0,0,M,2/26/20,1920,6/30/89,19892052,DEN-1971,A2.9-6154,390,DEN,Krag,11/10/71,3/10/72,15/09/1914,22/06/1978,10/11/71,10/3/72,0,1,0,1,0,M,9/15/14,1914,6/22/78,19782053,DEN-1972,A2.9-6157,390,DEN,Jorgensen,5/10/72,19/12/1973,12/7/23,-777,10/5/72,12/19/73,0,1,0,0,0,M,7/12/23,1923,NA,-7772054,DEN-1973,A2.9-6160,390,DEN,Hartling,19/12/1973,29/01/1975,14/08/1914,30/04/2000,12/19/73,1/29/75,0,1,0,0,0,M,8/14/14,1914,4/30/00,20002055,DEN-1975,A2.9-6163,390,DEN,Jorgensen,13/02/1975,10/9/82,12/7/23,-777,2/13/75,9/10/82,0,1,0,1,0,M,7/12/23,1923,NA,-7772056,DEN-1982,A2.9-6166,390,DEN,Schluter,10/9/82,25/01/1993,3/4/29,-777,9/10/82,1/25/93,0,1,0,0,0,M,4/3/29,1929,NA,-7772057,DEN-1993,A2.9-6169,390,DEN,Nyrup Rasmussen,25/01/1993,27/11/2001,15/06/1943,-777,1/25/93,11/27/01,0,1,0,0,0,M,6/15/43,1943,NA,-7772058,DEN-2001,A2.9-6172,390,DEN,Fogh Rasmussen,27/11/2001,31/12/2004,26/01/1953,-777,11/27/01,12/31/04,0,-888,0,0,-888,M,1/26/53,1953,NA,-7772059,ICE-1944-1,A2.9-6175,395,ICE,Thordarson,17/05/1944,21/10/1944,1879,1963,5/17/44,10/21/44,0,1,0,0,0,M,NA,1879,NA,19632060,ICE-1944-2,A2.9-6178,395,ICE,Thors,21/10/1944,3/2/47,19/01/1892,1964,10/21/44,2/3/47,0,1,0,0,0,M,1892-01-19,1892,NA,19642061,ICE-1947,A2.9-6181,395,ICE,Stefansson,3/2/47,6/12/49,20/07/1894,1980,2/3/47,12/6/49,0,1,0,0,0,M,1894-07-20,1894,NA,19802062,ICE-1949,A2.9-6184,395,ICE,Thors,6/12/49,14/03/1950,19/01/1892,1964,12/6/49,3/14/50,0,1,0,1,0,M,1892-01-19,1892,NA,19642063,ICE-1950,A2.9-6187,395,ICE,Steinthorsson,14/03/1950,13/09/1953,12/02/1893,1966,3/14/50,9/13/53,0,1,0,0,0,M,1893-02-12,1893,NA,19662064,ICE-1953,A2.9-6190,395,ICE,Thors,13/09/1953,21/07/1956,19/01/1892,1964,9/13/53,7/21/56,0,1,0,2,0,M,1892-01-19,1892,NA,19642065,ICE-1956,A2.9-6193,395,ICE,Jonasson,21/07/1956,4/12/58,25/12/1896,1976,7/21/56,12/4/58,0,1,0,0,0,M,1896-12-25,1896,NA,19762066,ICE-1958,A2.9-6196,395,ICE,Jonsson,23/12/1958,20/11/1959,27/10/1902,1986,12/23/58,11/20/59,0,1,0,0,0,M,10/27/02,1902,NA,19862067,ICE-1959,A2.9-6199,395,ICE,Thors,20/11/1959,12/11/63,19/01/1892,1964,11/20/59,11/12/63,0,2.1,0,3,0,M,1892-01-19,1892,NA,19642068,ICE-1963,A2.9-6202,395,ICE,Benediktsson,14/11/1963,10/7/70,30/04/1908,1970,11/14/63,7/10/70,0,2,0,0,-777,M,4/30/08,1908,NA,19702069,ICE-1970,A2.9-6205,395,ICE,Hafstein,10/7/70,14/07/1971,19/09/1915,1980,7/10/70,7/14/71,0,1,0,0,0,M,9/19/15,1915,NA,19802070,ICE-1971,A2.9-6208,395,ICE,Johannesson,14/07/1971,28/08/1974,1/3/13,1984,7/14/71,8/28/74,0,1,0,0,0,M,3/1/13,1913,NA,19842071,ICE-1974,A2.9-6211,395,ICE,Hallgrimsson,29/08/1974,31/08/1978,16/12/1925,1990,8/29/74,8/31/78,0,1,0,0,0,M,12/16/25,1925,NA,19902072,ICE-1978,A2.9-6214,395,ICE,Johannesson,31/08/1978,15/10/1979,1/3/13,1984,8/31/78,10/15/79,0,1,0,1,0,M,3/1/13,1913,NA,19842073,ICE-1979,A2.9-6217,395,ICE,Groendal,15/10/1979,8/2/80,7/7/24,-777,10/15/79,2/8/80,0,1,0,0,0,M,7/7/24,1924,NA,-7772074,ICE-1980,A2.9-6220,395,ICE,Thoroddsen,8/2/80,26/05/1983,29/12/1910,1983,2/8/80,5/26/83,0,1,0,0,-777,M,12/29/10,1910,NA,19832075,ICE-1983,A2.9-6223,395,ICE,Hermannsson,26/05/1983,8/7/87,22/06/1928,-777,5/26/83,7/8/87,0,1,0,0,0,M,6/22/28,1928,NA,-7772076,ICE-1987,A2.9-6226,395,ICE,Palsson,8/7/87,28/09/1988,29/10/1947,-777,7/8/87,9/28/88,0,1,0,0,0,M,10/29/47,1947,NA,-7772077,ICE-1988,A2.9-6229,395,ICE,Hermannsson,28/09/1988,30/04/1991,22/06/1928,-777,9/28/88,4/30/91,0,1,0,1,0,M,6/22/28,1928,NA,-7772078,ICE-1991,A2.9-6232,395,ICE,Oddsson,30/04/1991,15/09/2004,17/01/1948,-777,4/30/91,9/15/04,0,1,0,0,-999,M,1/17/48,1948,NA,-7772079,ICE-2004,A2.9-6235,395,ICE,Halldor Asgrimsson,15/09/2004,31/12/2004,1947,-777,9/15/04,12/31/04,0,-888,0,0,-888,M,NA,1947,NA,-7772080,CAP-1975,A2.9-6238,402,CAP,Pires,8/7/75,4/4/91,1934,-777,7/8/75,4/4/91,0,1,0,0,0,M,NA,1934,NA,-7772081,CAP-1991,A2.9-6241,402,CAP,Veiga,4/4/91,29/07/2000,1949,-777,4/4/91,7/29/00,0,1,0,0,0,M,NA,1949,NA,-7772082,CAP-2000,A2.9-6244,402,CAP,do Rosario,29/07/2000,1/2/01,1950,-777,7/29/00,2/1/01,0,1,0,0,0,M,NA,1950,NA,-7772083,CAP-2001,A2.9-6247,402,CAP,Neves,1/2/01,31/12/2004,1960,-777,2/1/01,12/31/04,0,-888,0,0,-888,M,NA,1960,NA,-7772084,GNB-1974,A2.9-6250,404,GNB,Cabral,10/9/74,14/11/1980,1931,-777,9/10/74,11/14/80,1,3,6,0,2,M,NA,1931,NA,-7772085,GNB-1980,A2.9-6253,404,GNB,Vieira,14/11/1980,7/5/99,1939,-777,11/14/80,5/7/99,1,3,6,0,1,M,NA,1939,NA,-7772086,GNB-1999-1,A2.9-6256,404,GNB,Mane,7/5/99,14/05/1999,1940,2000,5/7/99,5/14/99,1,1,0,0,0,M,NA,1940,NA,20002087,GNB-1999-2,A2.9-6259,404,GNB,Sanha,14/05/1999,17/02/2000,5/5/47,-777,5/14/99,2/17/00,1,1,0,0,0,M,5/5/47,1947,NA,-7772088,GNB-2000,A2.9-6262,404,GNB,Kumba Iala,18/02/2000,14/09/2003,1953,-777,2/18/00,9/14/03,0,3,6,0,0,M,NA,1953,NA,-7772089,GNB-2003-1,A2.9-6265,404,GNB,Correia Seabra,14/09/2003,28/09/2003,1947,2004,9/14/03,9/28/03,1,1,0,0,0,M,NA,1947,NA,20042090,GNB-2003-2,A2.9-6268,404,GNB,Henrique Pereira Rosa,28/09/2003,31/12/2004,1946,-777,9/28/03,12/31/04,0,-888,0,0,-888,M,NA,1946,NA,-7772091,EQG-1963,A2.9-6271,411,EQG,Bonifacio Ondo Edu,15/12/1963,12/10/68,-999,1969,12/15/63,10/12/68,0,1,0,0,3,M,NA,NA,NA,19692092,EQG-1968,A2.9-6274,411,EQG,Macias Nguema,12/10/68,3/8/79,1/1/24,29/09/1979,10/12/68,8/3/79,0,3,6,0,3,M,1/1/24,1924,9/29/79,19792093,EQG-1979,A2.9-6277,411,EQG,Nguema Mbasogo,3/8/79,31/12/2004,4/6/42,-777,8/3/79,12/31/04,1,-888,0,0,-888,M,6/4/42,1942,NA,-7772094,GAM-1965,A2.9-6280,420,GAM,Jawara,18/02/1965,22/07/1994,11/5/24,-777,2/18/65,7/22/94,0,3,6,0,1,M,5/11/24,1924,NA,-7772095,GAM-1994,A2.9-6283,420,GAM,Jammeh,22/07/1994,31/12/2004,25/5/1965,-777,7/22/94,12/31/04,1,-888,0,0,-888,M,5/25/65,1965,NA,-7772096,MLI-1960,A2.9-6286,432,MLI,Keita,22/09/1960,19/11/1968,4/6/15,16/05/1977,9/22/60,11/19/68,0,3,6,0,2,M,6/4/15,1915,5/16/77,19772097,MLI-1968,A2.9-6289,432,MLI,Traore,19/11/1968,26/03/1991,15/9/1936,-777,11/19/68,3/26/91,1,3,6,0,2,M,9/15/36,1936,NA,-7772098,MLI-1991,A2.9-6292,432,MLI,Amadou Toure,26/03/1991,6/6/92,1948,-777,3/26/91,6/6/92,1,1,0,0,0,M,NA,1948,NA,-7772099,MLI-1992,A2.9-6295,432,MLI,Konare,6/6/92,8/6/02,1946,-777,6/6/92,6/8/02,0,1,0,0,0,M,NA,1946,NA,-7772100,MLI-2002,A2.9-6298,432,MLI,Amadou Toure,9/6/02,31/12/2004,1948,-777,6/9/02,12/31/04,0,-888,0,1,-888,M,NA,1948,NA,-7772101,SEN-1960,A2.9-6301,433,SEN,Senghor,20/08/1960,31/12/1980,9/10/06,2001,8/20/60,12/31/80,0,1,0,0,0,M,10/9/06,1906,NA,20012102,SEN-1981,A2.9-6304,433,SEN,Diouf,1/1/81,1/4/00,7/9/35,-777,1/1/81,4/1/00,0,1,0,0,0,M,9/7/35,1935,NA,-7772103,SEN-2000,A2.9-6307,433,SEN,Abdoulaye Wade,2/4/00,31/12/2004,1926,-777,4/2/00,12/31/04,0,-888,0,0,-888,M,NA,1926,NA,-7772104,BEN-1960,A2.9-6310,434,BEN,Maga,1/1/60,27/10/1963,10/8/16,8/5/00,1/1/60,10/27/63,0,3,6,0,2,M,8/10/16,1916,5/8/00,20002105,BEN-1963,A2.9-6313,434,BEN,Soglo,28/10/1963,19/01/1964,28/6/1912,1983,10/28/63,1/19/64,1,1,0,0,0,M,6/28/12,1912,NA,19832106,BEN-1964,A2.9-6316,434,BEN,Apithy,19/01/1964,29/11/1965,8/4/13,1989,1/19/64,11/29/65,1,3,6,0,2,M,4/8/13,1913,NA,19892107,BEN-1965-1,A2.9-6319,434,BEN,Congacou,29/11/1965,22/12/1965,1913,1994,11/29/65,12/22/65,1,3,6,0,2,M,NA,1913,NA,19942108,BEN-1965-2,A2.9-6322,434,BEN,Soglo,22/12/1965,17/12/1967,28/6/1912,1983,12/22/65,12/17/67,1,3,6,1,2,M,6/28/12,1912,NA,19832109,BEN-1967,A2.9-6325,434,BEN,Alley,17/12/1967,1/8/68,9/4/30,1987,12/17/67,8/1/68,1,1,0,0,2,M,4/9/30,1930,NA,19872110,BEN-1968,A2.9-6328,434,BEN,Zinsou,1/8/68,10/12/69,23/3/1918,-777,8/1/68,12/10/69,1,3,6,0,2,M,3/23/18,1918,NA,-7772111,BEN-1969-1,A2.9-6331,434,BEN,Kouandete,10/12/69,13/12/1969,1939,2003,12/10/69,12/13/69,1,1,0,0,0,M,NA,1939,NA,20032112,BEN-1969-2,A2.9-6334,434,BEN,Paul-Emile de Souza,13/12/1969,7/5/70,1930,1999,12/13/69,5/7/70,1,1,0,0,0,M,NA,1930,NA,19992113,BEN-1970,A2.9-6337,434,BEN,Maga,7/5/70,7/4/72,1916,2000,5/7/70,4/7/72,0,1,0,1,2,M,NA,1916,NA,20002114,BEN-1972-1,A2.9-6340,434,BEN,Ahomadegbe,7/4/72,26/10/1972,1917,2002,4/7/72,10/26/72,1,3,6,0,2,M,NA,1917,NA,20022115,BEN-1972-2,A2.9-6343,434,BEN,Kerekou,27/10/1972,4/4/91,2/9/33,-777,10/27/72,4/4/91,1,1,0,0,0,M,9/2/33,1933,NA,-7772116,BEN-1991,A2.9-6346,434,BEN,"Soglo, C",4/4/91,4/4/96,29/11/1934,-777,4/4/91,4/4/96,0,1,0,0,0,M,11/29/34,1934,NA,-7772117,BEN-1996,A2.9-6349,434,BEN,Kerekou,4/4/96,31/12/2004,2/9/33,-777,4/4/96,12/31/04,0,-888,0,1,-888,M,9/2/33,1933,NA,-7772118,MAA-1960,A2.9-6352,435,MAA,Ould Daddah,28/11/1960,10/7/78,25/12/1924,15/10/2003,11/28/60,7/10/78,0,3,6,0,2,M,12/25/24,1924,10/15/03,20032119,MAA-1978,A2.9-6355,435,MAA,Ould Mohamed Salek,10/7/78,6/4/79,1936,-777,7/10/78,4/6/79,1,3,16,0,0,M,NA,1936,NA,-7772120,MAA-1979-1,A2.9-6358,435,MAA,Ould Bouceif,6/4/79,27/05/1979,1933,1979,4/6/79,5/27/79,1,2,0,0,-777,M,NA,1933,NA,19792121,MAA-1979-2,A2.9-6361,435,MAA,Ould Sidi,27/05/1979,31/05/1979,1934,1981,5/27/79,5/31/79,0,1,0,0,1,M,NA,1934,NA,19812122,MAA-1979-3,A2.9-6364,435,MAA,Ould Ahmed Louly,3/6/79,4/1/80,1943,-777,6/3/79,1/4/80,0,3,16,0,0,M,NA,1943,NA,-7772123,MAA-1980,A2.9-6367,435,MAA,Ould Haidalla,4/1/80,12/12/84,1940,-777,1/4/80,12/12/84,1,3,6,0,1,M,NA,1940,NA,-7772124,MAA-1984,A2.9-6370,435,MAA,Sidi Ahmed Taya,12/12/84,31/12/2004,1941,-777,12/12/84,12/31/04,1,-888,0,0,-888,M,NA,1941,NA,-7772125,NIR-1960,A2.9-6373,436,NIR,Diori,3/10/60,15/04/1974,6/6/16,23/04/1989,10/3/60,4/15/74,0,3,6,0,2,M,6/6/16,1916,4/23/89,19892126,NIR-1974,A2.9-6376,436,NIR,Kountche,17/04/1974,10/11/87,1/7/31,10/11/87,4/17/74,11/10/87,1,2,0,0,-777,M,7/1/31,1931,11/10/87,19872127,NIR-1987,A2.9-6379,436,NIR,Seibou,10/11/87,16/04/1993,1940,-777,11/10/87,4/16/93,0,1,0,0,0,M,NA,1940,NA,-7772128,NIR-1993,A2.9-6382,436,NIR,Ousmane,16/04/1993,27/01/1996,1950,-777,4/16/93,1/27/96,0,3,6,0,2,M,NA,1950,NA,-7772129,NIR-1996,A2.9-6385,436,NIR,Mainassara,27/01/1996,11/4/99,9/5/49,9/4/99,1/27/96,4/11/99,1,3,6,0,3,M,5/9/49,1949,4/9/99,19992130,NIR-1999-1,A2.9-6388,436,NIR,Wanke,11/4/99,22/12/1999,1954,2004,4/11/99,12/22/99,1,1,0,0,0,M,NA,1954,NA,20042131,NIR-1999-2,A2.9-6391,436,NIR,Mamadou,22/12/1999,31/12/2004,1938,-777,12/22/99,12/31/04,0,-888,0,0,-888,M,NA,1938,NA,-7772132,CDI-1960,A2.9-6394,437,CDI,Houphouet-Boigny,7/8/60,7/12/93,18/10/1905,7/12/93,8/7/60,12/7/93,0,2,0,0,-777,M,10/18/05,1905,12/7/93,19932133,CDI-1993,A2.9-6397,437,CDI,Konan Bedie,7/12/93,25/12/1999,1934,-777,12/7/93,12/25/99,0,3,6,0,1,M,NA,1934,NA,-7772134,CDI-1999,A2.9-6400,437,CDI,Guei,25/12/1999,25/10/2000,16/3/1941,19/09/2002,12/25/99,10/25/00,1,3,2,0,1,M,3/16/41,1941,9/19/02,20022135,CDI-2000,A2.9-6403,437,CDI,Laurent Gbagbo,26/10/2000,31/12/2004,31/5/1945,-777,10/26/00,12/31/04,1,-888,0,0,-888,M,5/31/45,1945,NA,-7772136,GUI-1958,A2.9-6406,438,GUI,Toure,2/10/58,26/03/1984,9/1/22,1984,10/2/58,3/26/84,0,2,0,0,-777,M,1/9/22,1922,NA,19842137,GUI-1984-1,A2.9-6409,438,GUI,Beavogui,27/03/1984,3/4/84,1923,1984,3/27/84,4/3/84,1,3,6,0,2,M,NA,1923,NA,19842138,GUI-1984-2,A2.9-6412,438,GUI,Conte,3/4/84,31/12/2004,1934,-777,4/3/84,12/31/04,1,-888,0,0,-888,M,NA,1934,NA,-7772139,BFO-1960,A2.9-6415,439,BFO,Yameogo,5/8/60,3/1/66,31/12/1921,1993,8/5/60,1/3/66,0,3,6,0,2,M,12/31/21,1921,NA,19932140,BFO-1966,A2.9-6418,439,BFO,Lamizana,3/1/66,13/01/1971,1916,2005,1/3/66,1/13/71,1,1,0,0,0,M,NA,1916,NA,20052141,BFO-1971,A2.9-6421,439,BFO,Gerard Kango Ouedraogo,13/01/1971,8/2/74,1925,-777,1/13/71,2/8/74,0,3,6,0,-666,M,NA,1925,NA,-7772142,BFO-1974,A2.9-6424,439,BFO,Lamizana,8/2/74,25/11/1980,1916,2005,2/8/74,11/25/80,1,3,6,1,2,M,NA,1916,NA,20052143,BFO-1980,A2.9-6427,439,BFO,Zerbo,25/11/1980,7/11/82,1932,-777,11/25/80,11/7/82,1,3,6,0,2,M,NA,1932,NA,-7772144,BFO-1982,A2.9-6430,439,BFO,J. P. Ouedraogo,7/11/82,4/8/83,1942,-777,11/7/82,8/4/83,1,3,6,0,2,M,NA,1942,NA,-7772145,BFO-1983,A2.9-6433,439,BFO,Sankara,4/8/83,15/10/1987,21/12/1949,1987,8/4/83,10/15/87,1,3,6,0,3,M,12/21/49,1949,NA,19872146,BFO-1987,A2.9-6436,439,BFO,Campaore,15/10/1987,31/12/2004,3/2/51,-777,10/15/87,12/31/04,1,-888,0,0,-888,M,2/3/51,1951,NA,-7772147,LBR-1872,A2.9-6439,450,LBR,Joseph Jenkins Roberts,01/01/1872,27/06/1875,1809,1876,1872-01-01,1875-06-27,1,2.1,0,1,0,M,NA,1809,NA,18762148,LBR-1875,A2.9-6442,450,LBR,Anthony William Gardiner,27/06/1875,03/01/1876,1820,1885,1875-06-27,1876-01-03,0,1,0,0,0,M,NA,1820,NA,18852149,LBR-1876,A2.9-6445,450,LBR,James Spriggs Payne,03/01/1876,07/01/1878,1819,1882,1876-01-03,1878-01-07,0,1,0,1,0,M,NA,1819,NA,18822150,LBR-1878,A2.9-6448,450,LBR,Anthony William Gardiner,07/01/1878,20/01/1883,1820,1882,1878-01-07,1883-01-20,0,1,0,1,0,M,NA,1820,NA,18822151,LBR-1883,A2.9-6451,450,LBR,Alfred Francis Russell,20/01/1883,07/01/1884,1817,1884,1883-01-20,1884-01-07,0,1,0,0,-777,M,NA,1817,NA,18842152,LBR-1884,A2.9-6454,450,LBR,Hilary Richard Wright Johnson,07/01/1884,04/01/1892,1837,1901,1884-01-07,1892-01-04,0,1,0,0,0,M,NA,1837,NA,19012153,LBR-1892,A2.9-6457,450,LBR,Joseph James Cheeseman,04/01/1892,12/11/1896,1843,1896,1892-01-04,1896-11-12,0,2,0,0,-777,M,NA,1843,NA,18962154,LBR-1896,A2.9-6460,450,LBR,William David Coleman,12/11/1896,11/12/00,18/7/1842,1908,1896-11-12,12/11/00,0,1,0,0,0,M,1842-07-18,1842,NA,19082155,LBR-1900,A2.9-6463,450,LBR,Garretson Wilmot Gibson,11/12/00,4/1/04,20/5/1832,1910,12/11/00,1/4/04,0,1,0,0,0,M,1832-05-20,1832,NA,19102156,LBR-1904,A2.9-6466,450,LBR,Arthur Barclay,4/1/04,1/1/12,31/7/1854,1938,1/4/04,1/1/12,0,1,0,0,0,M,1854-07-31,1854,NA,19382157,LBR-1912,A2.9-6469,450,LBR,Daniel E. Howard,1/1/12,5/1/20,4/8/1861,1935,1/1/12,1/5/20,0,1,0,0,0,M,1861-08-04,1861,NA,19352158,LBR-1920,A2.9-6472,450,LBR,Burgess King,5/1/20,3/12/30,1875,1961,1/5/20,12/3/30,0,1,0,0,0,M,NA,1875,NA,19612159,LBR-1930,A2.9-6475,450,LBR,Edwin Barclay,3/12/30,31/12/1943,5/1/1882,1955,12/3/30,12/31/43,0,1,0,0,0,M,1882-01-05,1882,NA,19552160,LBR-1944,A2.9-6478,450,LBR,Tubman,1/1/44,23/07/1971,29/11/1895,1971,1/1/44,7/23/71,0,2,0,0,-777,M,1895-11-29,1895,NA,19712161,LBR-1971,A2.9-6481,450,LBR,Tolbert,23/07/1971,12/4/80,13/5/1913,1980,7/23/71,4/12/80,0,3,6,0,3,M,5/13/13,1913,NA,19802162,LBR-1980,A2.9-6484,450,LBR,Doe,12/4/80,9/9/90,6/5/51,9/9/90,4/12/80,9/9/90,1,3,4,0,3,M,5/6/51,1951,9/9/90,19902163,LBR-1990,A2.9-6487,450,LBR,Sawyer,22/11/1990,7/3/94,15/6/1945,-777,11/22/90,3/7/94,2,1,0,0,0,M,6/15/45,1945,NA,-7772164,LBR-1994,A2.9-6490,450,LBR,Kpormapkor,7/3/94,1/9/95,1944,-777,3/7/94,9/1/95,0,1,0,0,0,M,NA,1944,NA,-7772165,LBR-1995,A2.9-6493,450,LBR,Sankawulo,1/9/95,3/9/96,1943,-777,9/1/95,9/3/96,0,1,0,0,0,M,NA,1943,NA,-7772166,LBR-1996,A2.9-6496,450,LBR,Perry,3/9/96,2/8/97,1939,-777,9/3/96,8/2/97,0,1,0,0,0,F,NA,1939,NA,-7772167,LBR-1997,A2.9-6499,450,LBR,Taylor,2/8/97,11/8/03,1948,-777,8/2/97,8/11/03,0,1,0,0,1,M,NA,1948,NA,-7772168,LBR-2003-1,A2.9-6502,450,LBR,Moses Zeh Blah,11/8/03,14/10/2003,1947,-777,8/11/03,10/14/03,0,1,0,0,0,M,NA,1947,NA,-7772169,LBR-2003-2,A2.9-6505,450,LBR,Bryant,14/10/2003,31/12/2004,1949,-777,10/14/03,12/31/04,0,-888,0,0,-888,M,NA,1949,NA,-7772170,SIE-1961,A2.9-6508,451,SIE,"Margai,M",27/04/1961,28/04/1964,7/12/1895,28/04/1964,4/27/61,4/28/64,0,2,0,0,-777,M,1895-12-07,1895,4/28/64,19642171,SIE-1964,A2.9-6511,451,SIE,"Margai, A",29/04/1964,17/03/1967,10/10/10,18/12/1980,4/29/64,3/17/67,0,1,0,0,2,M,10/10/10,1910,12/18/80,19802172,SIE-1967-1,A2.9-6514,451,SIE,Lansana,21/03/1967,23/03/1967,27/3/1922,1975,3/21/67,3/23/67,1,3,16,0,2,M,3/27/22,1922,NA,19752173,SIE-1967-2,A2.9-6517,451,SIE,Juxon-Smith,27/03/1967,19/04/1968,1933,1996,3/27/67,4/19/68,1,3,6,0,2,M,NA,1933,NA,19962174,SIE-1968,A2.9-6520,451,SIE,Stevens,19/04/1968,28/11/1985,24/8/1905,1988,4/19/68,11/28/85,1,1,0,0,0,M,8/24/05,1905,NA,19882175,SIE-1985,A2.9-6523,451,SIE,Momoh,28/11/1985,29/04/1992,26/1/1937,2/8/03,11/28/85,4/29/92,0,3,6,0,1,M,1/26/37,1937,8/2/03,20032176,SIE-1992,A2.9-6526,451,SIE,Strasser,1/5/92,17/01/1996,1965,-777,5/1/92,1/17/96,1,3,6,0,1,M,NA,1965,NA,-7772177,SIE-1996-1,A2.9-6529,451,SIE,Bio,17/01/1996,29/03/1996,1964,-777,1/17/96,3/29/96,1,1,0,0,0,M,NA,1964,NA,-7772178,SIE-1996-2,A2.9-6532,451,SIE,Kabbah,29/03/1996,25/05/1997,16/2/1932,-777,3/29/96,5/25/97,0,3,6,0,1,M,2/16/32,1932,NA,-7772179,SIE-1997,A2.9-6535,451,SIE,Koroma,25/05/1997,12/2/98,9/5/60,1/6/03,5/25/97,2/12/98,1,4,9,0,0,M,5/9/60,1960,6/1/03,20032180,SIE-1998,A2.9-6538,451,SIE,Kabbah,10/3/98,31/12/2004,16/2/1932,-777,3/10/98,12/31/04,2,-888,0,1,-888,M,2/16/32,1932,NA,-7772181,GHA-1952,A2.9-6541,452,GHA,Nkrumah,21/03/1952,24/02/1966,21/9/1909,27/04/1972,3/21/52,2/24/66,0,3,6,0,1,M,9/21/09,1909,4/27/72,19722182,GHA-1966,A2.9-6544,452,GHA,Ankrah,24/02/1966,3/4/69,18/8/1915,1992,2/24/66,4/3/69,1,1,0,0,0,M,8/18/15,1915,NA,19922183,GHA-1969-1,A2.9-6547,452,GHA,Afrifa,3/4/69,3/9/69,24/4/1936,26/06/1979,4/3/69,9/3/69,0,1,0,0,0,M,4/24/36,1936,6/26/79,19792184,GHA-1969-2,A2.9-6550,452,GHA,Busia,3/9/69,13/01/1972,11/7/13,28/08/1978,9/3/69,1/13/72,0,3,6,0,1,M,7/11/13,1913,8/28/78,19782185,GHA-1972,A2.9-6553,452,GHA,Acheampong,13/01/1972,5/7/78,23/9/1931,16/06/1979,1/13/72,7/5/78,1,3,16,0,2,M,9/23/31,1931,6/16/79,19792186,GHA-1978,A2.9-6556,452,GHA,Akuffo,5/7/78,4/6/79,21/3/1937,26/06/1979,7/5/78,6/4/79,0,3,6,0,3,M,3/21/37,1937,6/26/79,19792187,GHA-1979-1,A2.9-6559,452,GHA,Rawlings,5/6/79,24/09/1979,22/6/1947,-777,6/5/79,9/24/79,1,1,0,0,0,M,6/22/47,1947,NA,-7772188,GHA-1979-2,A2.9-6562,452,GHA,Limann,24/09/1979,31/12/1981,12/12/34,23/01/1998,9/24/79,12/31/81,0,3,6,0,2,M,12/12/34,1934,1/23/98,19982189,GHA-1981,A2.9-6565,452,GHA,Rawlings,31/12/1981,7/1/01,22/6/1947,-777,12/31/81,1/7/01,1,1,0,1,0,M,6/22/47,1947,NA,-7772190,GHA-2001,A2.9-6568,452,GHA,John Agyekum Kufuor,8/1/01,31/12/2004,8/12/38,-777,1/8/01,12/31/04,0,-888,0,0,-888,M,12/8/38,1938,NA,-7772191,TOG-1960,A2.9-6571,461,TOG,Olympio,27/04/1960,13/01/1963,6/9/02,13/1/1963,4/27/60,1/13/63,0,3,6,0,3,M,9/6/02,1902,1/13/63,19632192,TOG-1963,A2.9-6574,461,TOG,Grunitzky,16/01/1963,13/01/1967,5/4/13,1969,1/16/63,1/13/67,1,3,6,0,1,M,4/5/13,1913,NA,19692193,TOG-1967-1,A2.9-6577,461,TOG,Dadjo,13/01/1967,14/04/1967,12/8/14,1979,1/13/67,4/14/67,1,3,16,0,0,M,8/12/14,1914,NA,19792194,TOG-1967-2,A2.9-6580,461,TOG,Eyadema,14/04/1967,31/12/2004,26/12/1937,5/2/05,4/14/67,12/31/04,1,-888,0,0,-888,M,12/26/37,1937,2/5/05,20052195,CAO-1960,A2.9-6583,471,CAO,Ahidjo,1/1/60,6/11/82,24/8/1924,30/11/1989,1/1/60,11/6/82,0,2.1,0,0,1,M,8/24/24,1924,11/30/89,19892196,CAO-1982,A2.9-6586,471,CAO,Biya,6/11/82,31/12/2004,13/2/1933,-777,11/6/82,12/31/04,0,-888,0,0,-888,M,2/13/33,1933,NA,-7772197,NIG-1960,A2.9-6589,475,NIG,Balewa,1/10/60,15/01/1966,1912,15/01/1966,10/1/60,1/15/66,0,3,6,0,3,M,NA,1912,1/15/66,19662198,NIG-1966-1,A2.9-6592,475,NIG,Ironsi,15/01/1966,29/07/1966,3/3/24,1966,1/15/66,7/29/66,1,3,6,0,3,M,3/3/24,1924,NA,19662199,NIG-1966-2,A2.9-6595,475,NIG,Gowon,29/07/1966,29/07/1975,19/10/1934,-777,7/29/66,7/29/75,1,3,6,0,1,M,10/19/34,1934,NA,-7772200,NIG-1975,A2.9-6598,475,NIG,Ramat Mohammed,29/07/1975,13/02/1976,8/11/38,1976,7/29/75,2/13/76,1,3,6,0,3,M,11/8/38,1938,NA,19762201,NIG-1976,A2.9-6601,475,NIG,Obasanjo,13/02/1976,1/10/79,5/3/37,-777,2/13/76,10/1/79,1,1,0,0,0,M,3/5/37,1937,NA,-7772202,NIG-1979,A2.9-6604,475,NIG,Shagari,1/10/79,31/12/1983,1925,-777,10/1/79,12/31/83,0,3,6,0,2,M,NA,1925,NA,-7772203,NIG-1983,A2.9-6607,475,NIG,Buhari,31/12/1983,27/08/1985,17/12/1942,-777,12/31/83,8/27/85,1,3,6,0,2,M,12/17/42,1942,NA,-7772204,NIG-1985,A2.9-6610,475,NIG,Babangida,27/08/1985,26/08/1993,17/8/1941,-777,8/27/85,8/26/93,1,1,0,0,0,M,8/17/41,1941,NA,-7772205,NIG-1993-1,A2.9-6613,475,NIG,Shonekan,26/08/1993,17/11/1993,1936,-777,8/26/93,11/17/93,1,3,6,0,0,M,NA,1936,NA,-7772206,NIG-1993-2,A2.9-6616,475,NIG,Abacha,17/11/1993,8/6/98,20/9/1943,8/6/98,11/17/93,6/8/98,1,2,0,0,-777,M,9/20/43,1943,6/8/98,19982207,NIG-1998,A2.9-6619,475,NIG,Abubakar,9/6/98,29/05/1999,13/6/1942,-777,6/9/98,5/29/99,0,1,0,0,0,M,6/13/42,1942,NA,-7772208,NIG-1999,A2.9-6622,475,NIG,Obasanjo,29/05/1999,31/12/2004,5/3/37,-777,5/29/99,12/31/04,0,-888,0,1,-888,M,3/5/37,1937,NA,-7772209,GAB-1960,A2.9-6625,481,GAB,Mba,17/08/1960,17/02/1964,1902,28/11/1967,8/17/60,2/17/64,0,3,6,0,2,M,NA,1902,11/28/67,19672210,GAB-1964-1,A2.9-6628,481,GAB,Aubaume,17/02/1964,19/02/1964,10/11/12,1989,2/17/64,2/19/64,1,4,9,0,2,M,11/10/12,1912,NA,19892211,GAB-1964-2,A2.9-6631,481,GAB,Mba,20/02/1964,28/11/1967,1902,28/11/1967,2/20/64,11/28/67,2,2,0,1,-777,M,NA,1902,11/28/67,19672212,GAB-1967,A2.9-6634,481,GAB,Bongo,28/11/1967,31/12/2004,30/12/1935,-777,11/28/67,12/31/04,0,-888,0,0,-888,M,12/30/35,1935,NA,-7772213,CEN-1960,A2.9-6637,482,CEN,Dacko,13/08/1960,1/1/66,24/3/1930,20/11/2003,8/13/60,1/1/66,0,3,6,0,2,M,3/24/30,1930,11/20/03,20032214,CEN-1966,A2.9-6640,482,CEN,Bokassa,1/1/66,21/09/1979,22/2/1921,3/11/96,1/1/66,9/21/79,1,4,9,0,1,M,2/22/21,1921,11/3/96,19962215,CEN-1979,A2.9-6643,482,CEN,Dacko,21/09/1979,1/9/81,24/3/1930,20/11/2003,9/21/79,9/1/81,2,3,6,1,0,M,3/24/30,1930,11/20/03,20032216,CEN-1981,A2.9-6646,482,CEN,Kolingba,1/9/81,22/10/1993,12/8/35,-777,9/1/81,10/22/93,1,1,0,0,0,M,8/12/35,1935,NA,-7772217,CEN-1993,A2.9-6649,482,CEN,Patasse,22/10/1993,15/03/2003,25/01/1937,-777,10/22/93,3/15/03,0,3,4,0,1,M,1/25/37,1937,NA,-7772218,CEN-2003,A2.9-6652,482,CEN,Francois Bozize,15/03/2003,31/12/2004,1953,-777,3/15/03,12/31/04,0,-888,0,0,-888,M,NA,1953,NA,-7772219,CHA-1960,A2.9-6655,483,CHA,Tombalbaye,11/8/60,13/04/1975,15/6/1918,1975,8/11/60,4/13/75,0,3,6,0,3,M,6/15/18,1918,NA,19752220,CHA-1975,A2.9-6658,483,CHA,Malloum,15/04/1975,23/03/1979,10/9/32,-777,4/15/75,3/23/79,1,3,3,0,1,M,9/10/32,1932,NA,-7772221,CHA-1979,A2.9-6661,483,CHA,Oueddei,23/03/1979,7/6/82,1944,-777,3/23/79,6/7/82,0,3,4,0,1,M,NA,1944,NA,-7772222,CHA-1982,A2.9-6664,483,CHA,Habre,19/06/1982,2/12/90,1942,-777,6/19/82,12/2/90,1,3,4,0,1,M,NA,1942,NA,-7772223,CHA-1990,A2.9-6667,483,CHA,Deby,4/12/90,31/12/2004,1952,-777,12/4/90,12/31/04,1,-888,0,0,-888,M,NA,1952,NA,-7772224,CON-1960,A2.9-6670,484,CON,Youlou,15/08/1960,15/08/1963,9/6/17,1972,8/15/60,8/15/63,0,3,2,0,2,M,6/9/17,1917,NA,19722225,CON-1963,A2.9-6673,484,CON,Debat,16/08/1963,4/9/68,1921,1977,8/16/63,9/4/68,1,3,6,0,0,M,NA,1921,NA,19772226,CON-1968,A2.9-6676,484,CON,Raoul,4/9/68,1/1/69,13/12/1938,1999,9/4/68,1/1/69,1,1,0,0,0,M,12/13/38,1938,NA,19992227,CON-1969,A2.9-6679,484,CON,Ngouabi,1/1/69,18/03/1977,1938,1977,1/1/69,3/18/77,0,3,6,0,3,M,NA,1938,NA,19772228,CON-1977,A2.9-6682,484,CON,Opango,18/03/1977,5/2/79,1939,-777,3/18/77,2/5/79,0,3,16,0,2,M,NA,1939,NA,-7772229,CON-1979,A2.9-6685,484,CON,Nguesso,8/2/79,20/08/1992,1943,-777,2/8/79,8/20/92,1,1,0,0,0,M,NA,1943,NA,-7772230,CON-1992,A2.9-6688,484,CON,Lissouba,31/08/1992,15/10/1997,29/11/1931,-777,8/31/92,10/15/97,0,3,3,0,1,M,11/29/31,1931,NA,-7772231,CON-1997,A2.9-6691,484,CON,Nguesso,15/10/1997,31/12/2004,1943,-777,10/15/97,12/31/04,1,-888,0,1,-888,M,NA,1943,NA,-7772232,DRC-1960-1,A2.9-6694,490,DRC,Lumumba,30/06/1960,14/09/1960,2/7/25,17/01/1961,6/30/60,9/14/60,0,3,6,0,3,M,7/2/25,1925,1/17/61,19612233,DRC-1960-2,A2.9-6697,490,DRC,Mobutu,14/09/1960,20/09/1960,14/10/1930,-777,9/14/60,9/20/60,1,1,0,0,0,M,10/14/30,1930,NA,-7772234,DRC-1960-3,A2.9-6700,490,DRC,Kasavubu,20/09/1960,25/11/1965,1913,1969,9/20/60,11/25/65,0,3,6,0,0,M,NA,1913,NA,19692235,DRC-1965,A2.9-6703,490,DRC,Mobutu,25/11/1965,16/05/1997,14/10/1930,-777,11/25/65,5/16/97,1,3,4,1,1,M,10/14/30,1930,NA,-7772236,DRC-1997,A2.9-6706,490,DRC,Laurent Kabila,16/05/1997,16/01/2001,27/11/1939,16/01/2001,5/16/97,1/16/01,1,3,6,0,3,M,11/27/39,1939,1/16/01,20012237,DRC-2001,A2.9-6709,490,DRC,Joseph Kabila,17/01/2001,31/12/2004,1971,-777,1/17/01,12/31/04,0,-888,0,0,-888,M,NA,1971,NA,-7772238,UGA-1962,A2.9-6712,500,UGA,Obote,9/10/62,25/01/1971,28/12/1924,10/10/05,10/9/62,1/25/71,0,3,6,0,1,M,12/28/24,1924,10/10/05,20052239,UGA-1971,A2.9-6715,500,UGA,Amin,25/01/1971,11/4/79,1925,16/08/2003,1/25/71,4/11/79,1,4,9,0,1,M,NA,1925,8/16/03,20032240,UGA-1979-1,A2.9-6718,500,UGA,Yusuf Lule,13/04/1979,20/06/1979,10/4/12,21/01/1985,4/13/79,6/20/79,0,1,0,0,1,M,4/10/12,1912,1/21/85,19852241,UGA-1979-2,A2.9-6721,500,UGA,Banaisa,20/06/1979,12/5/80,30/5/1919,-777,6/20/79,5/12/80,0,3,6,0,1,M,5/30/19,1919,NA,-7772242,UGA-1980-1,A2.9-6724,500,UGA,Paulo Muwanga,18/05/1980,17/12/1980,1924,1/4/91,5/18/80,12/17/80,1,1,0,0,0,M,NA,1924,4/1/91,19912243,UGA-1980-2,A2.9-6727,500,UGA,Obote,17/12/1980,27/07/1985,28/12/1924,10/10/05,12/17/80,7/27/85,0,3,6,1,1,M,12/28/24,1924,10/10/05,20052244,UGA-1985,A2.9-6730,500,UGA,Okello,29/07/1985,29/01/1986,1914,1990,7/29/85,1/29/86,1,3,4,0,2,M,NA,1914,NA,19902245,UGA-1986,A2.9-6733,500,UGA,Museveni,29/01/1986,31/12/2004,1944,-777,1/29/86,12/31/04,1,-888,0,0,-888,M,NA,1944,NA,-7772246,KEN-1963,A2.9-6736,501,KEN,Kenyatta,12/12/63,22/08/1978,20/10/1891,22/08/1978,12/12/63,8/22/78,0,2,0,0,-777,M,1891-10-20,1891,8/22/78,19782247,KEN-1978,A2.9-6739,501,KEN,Moi,22/08/1978,30/12/2002,2/9/24,-777,8/22/78,12/30/02,0,1,0,0,0,M,9/2/24,1924,NA,-7772248,KEN-2002,A2.9-6742,501,KEN,Mwai Kibaki,31/12/2002,31/12/2004,1931,-777,12/31/02,12/31/04,0,-888,0,0,-888,M,NA,1931,NA,-7772249,TAZ-1961,A2.9-6745,510,TAZ,Nyerere,9/11/61,5/11/85,13/04/1922,14/10/1999,11/9/61,11/5/85,0,1,0,0,0,M,4/13/22,1922,10/14/99,19992250,TAZ-1985,A2.9-6748,510,TAZ,Mwinyi,5/11/85,5/11/95,8/5/25,-777,11/5/85,11/5/95,0,1,0,0,0,M,5/8/25,1925,NA,-7772251,TAZ-1995,A2.9-6751,510,TAZ,Mkapa,5/11/95,31/12/2004,1938,-777,11/5/95,12/31/04,0,-888,0,0,-888,M,NA,1938,NA,-7772252,ZAN-1961,A2.9-6754,511,ZAN,Shamte Hamadi,5/6/61,12/1/64,-999,-999,6/5/61,1/12/64,0,3,4,0,2,M,NA,NA,NA,NA2253,ZAN-1964,A2.9-6757,511,ZAN,Kassim Hanga,12/1/64,27/04/1964,1932,1969,1/12/64,4/27/64,1,1,0,0,0,M,NA,1932,NA,19692254,BUI-1962,A2.9-6760,516,BUI,Mwambutsa,1/7/62,8/7/66,1912,1977,7/1/62,7/8/66,0,3,8,0,1,M,NA,1912,NA,19772255,BUI-1966-1,A2.9-6763,516,BUI,Ntare,8/7/66,28/11/1966,2/12/47,1972,7/8/66,11/28/66,1,3,6,0,1,M,12/2/47,1947,NA,19722256,BUI-1966-2,A2.9-6766,516,BUI,Micombero,28/11/1966,1/11/76,1940,1983,11/28/66,11/1/76,1,3,6,0,1,M,NA,1940,NA,19832257,BUI-1976,A2.9-6769,516,BUI,Bagaza,9/11/76,3/9/87,29/8/1946,-777,11/9/76,9/3/87,1,3,6,0,1,M,8/29/46,1946,NA,-7772258,BUI-1987,A2.9-6772,516,BUI,Buyoya,3/9/87,10/7/93,24/11/1949,-777,9/3/87,7/10/93,1,1,0,0,0,M,11/24/49,1949,NA,-7772259,BUI-1993-1,A2.9-6775,516,BUI,Ndadaye,10/7/93,21/10/1993,1953,1993,7/10/93,10/21/93,0,3,6,0,3,M,NA,1953,NA,19932260,BUI-1993-2,A2.9-6778,516,BUI,Ngueze,21/10/1993,27/10/1993,-999,-999,10/21/93,10/27/93,1,1,0,0,2,M,NA,NA,NA,NA2261,BUI-1993-3,A2.9-6781,516,BUI,Kinigi,27/10/1993,5/2/94,1953,-777,10/27/93,2/5/94,0,1,0,0,0,F,NA,1953,NA,-7772262,BUI-1994-1,A2.9-6784,516,BUI,Ntarymira,5/2/94,6/4/94,1955,6/4/94,2/5/94,4/6/94,0,3,111,0,3,M,NA,1955,4/6/94,19942263,BUI-1994-2,A2.9-6787,516,BUI,Ntibantunganya,6/4/94,25/07/1996,8/5/56,-777,4/6/94,7/25/96,0,3,8,0,0,M,5/8/56,1956,NA,-7772264,BUI-1996,A2.9-6790,516,BUI,Buyoya,25/07/1996,30/04/2003,24/11/1949,-777,7/25/96,4/30/03,1,1,0,1,0,M,11/24/49,1949,NA,-7772265,BUI-2003,A2.9-6793,516,BUI,Ndayizeye,30/04/2003,31/12/2004,1953,-777,4/30/03,12/31/04,0,-888,0,0,-888,M,NA,1953,NA,-7772266,RWA-1961,A2.9-6796,517,RWA,Kayibanda,26/10/1961,5/7/73,1/5/24,1976,10/26/61,7/5/73,0,3,6,0,2,M,5/1/24,1924,NA,19762267,RWA-1973,A2.9-6799,517,RWA,Habyarimana,5/7/73,6/4/94,3/8/37,6/4/94,7/5/73,4/6/94,1,3,111,0,3,M,8/3/37,1937,4/6/94,19942268,RWA-1994-1,A2.9-6802,517,RWA,Sindikubwabo,6/4/94,19/07/1994,1928,1998,4/6/94,7/19/94,1,1,0,0,1,M,NA,1928,NA,19982269,RWA-1994-2,A2.9-6805,517,RWA,Paul Kagame,19/07/1994,31/12/2004,23/10/1957,-777,7/19/94,12/31/04,0,-888,0,0,-888,M,10/23/57,1957,NA,-7772270,SOM-1960,A2.9-6808,520,SOM,Osman Daar,1/7/60,10/7/67,1908,8/6/07,7/1/60,7/10/67,0,1,0,0,0,M,NA,1908,6/8/07,20072271,SOM-1967,A2.9-6811,520,SOM,Shermarke,10/7/67,15/10/1969,16/10/1919,1969,7/10/67,10/15/69,0,3,11,0,3,M,10/16/19,1919,NA,19692272,SOM-1969,A2.9-6814,520,SOM,Siad Barre,21/10/1969,26/01/1991,1912,2/1/95,10/21/69,1/26/91,1,3,4,0,1,M,NA,1912,1/2/95,19952273,DJI-1977,A2.9-6817,522,DJI,Gouled Aptidon,27/06/1977,8/5/99,1916,2006,6/27/77,5/8/99,0,1,0,0,0,M,NA,1916,NA,20062274,DJI-1999,A2.9-6820,522,DJI,Guelleh,8/5/99,31/12/2004,1947,-777,5/8/99,12/31/04,0,-888,0,0,-888,M,NA,1947,NA,-7772275,ETH-1871,A2.9-6823,530,ETH,Yohannes IV,11/07/1871,09/03/1889,1837,1889,1871-07-11,1889-03-09,1,3,-999,0,3,M,NA,1837,NA,18892276,ETH-1889,A2.9-6826,530,ETH,Menelek II,09/03/1889,15/05/1911,17/08/1844,12/12/13,1889-03-09,5/15/11,1,2,0,0,-777,M,1844-08-17,1844,12/12/13,19132277,ETH-1911,A2.9-6829,530,ETH,Joshua (Lij Yasu),15/05/1911,27/09/1916,1894,1935,5/15/11,9/27/16,0,3,-999,0,2,M,NA,1894,NA,19352278,ETH-1916,A2.9-6832,530,ETH,Judith (Zanditu),27/09/1916,3/4/30,1876,1930,9/27/16,4/3/30,1,2,0,0,-777,M,NA,1876,NA,19302279,ETH-1930,A2.9-6835,530,ETH,Selassie,3/4/30,15/05/1936,23/7/1892,27/08/1975,4/3/30,5/15/36,0,4,9,0,1,M,1892-07-23,1892,8/27/75,19752280,ETH-1936,A2.9-6838,530,ETH,King of Italy/Emperor of Ethiopia,15/05/1936,7/4/41,-999,-999,5/15/36,4/7/41,2,4,9,0,0,M,NA,NA,NA,NA2281,ETH-1941,A2.9-6841,530,ETH,Selassie,5/5/41,12/9/74,23/7/1892,27/08/1975,5/5/41,9/12/74,2,3,6,1,2,M,1892-07-23,1892,8/27/75,19752282,ETH-1974-1,A2.9-6844,530,ETH,Andom,12/9/74,23/11/1974,1924,1974,9/12/74,11/23/74,1,3,16,0,3,M,NA,1924,NA,19742283,ETH-1974-2,A2.9-6847,530,ETH,Banti,28/11/1974,3/2/77,1921,1977,11/28/74,2/3/77,0,3,6,0,3,M,NA,1921,NA,19772284,ETH-1977,A2.9-6850,530,ETH,Mengistu Marriam,11/2/77,21/05/1991,1937,-777,2/11/77,5/21/91,0,3,4,0,1,M,NA,1937,NA,-7772285,ETH-1991-1,A2.9-6853,530,ETH,Gebre Kidan,21/05/1991,27/05/1991,1935,2004,5/21/91,5/27/91,0,3,4,0,1,M,NA,1935,NA,20042286,ETH-1991-2,A2.9-6856,530,ETH,Meles Zenawi,27/05/1991,31/12/2004,23/8/1955,-777,5/27/91,12/31/04,1,-888,0,0,-888,M,8/23/55,1955,NA,-7772287,ERI-1993,A2.9-6859,531,ERI,Afeworki,24/05/1993,31/12/2004,1946,-777,5/24/93,12/31/04,0,-888,0,0,-888,M,NA,1946,NA,-7772288,ANG-1975,A2.9-6862,540,ANG,Neto,11/11/75,10/9/79,17/9/1922,10/9/79,11/11/75,9/10/79,1,2,0,0,-777,M,9/17/22,1922,9/10/79,19792289,ANG-1979,A2.9-6865,540,ANG,Dos Santos,10/9/79,31/12/2004,28/8/1942,-777,9/10/79,12/31/04,0,-888,0,0,-888,M,8/28/42,1942,NA,-7772290,MZM-1975,A2.9-6868,541,MZM,Machel,25/06/1975,19/10/1986,29/9/1933,19/10/1986,6/25/75,10/19/86,1,2,0,0,-777,M,9/29/33,1933,10/19/86,19862291,MZM-1986,A2.9-6871,541,MZM,Chissano,6/11/86,31/12/2004,2/10/39,-777,11/6/86,12/31/04,0,-888,0,0,-888,M,10/2/39,1939,NA,-7772292,ZAM-1964,A2.9-6874,551,ZAM,Kaunda,24/10/1964,2/11/91,28/4/1924,-777,10/24/64,11/2/91,0,1,0,0,0,M,4/28/24,1924,NA,-7772293,ZAM-1991,A2.9-6877,551,ZAM,Chiluba,2/11/91,2/1/02,30/4/1943,-777,11/2/91,1/2/02,0,1,0,0,0,M,4/30/43,1943,NA,-7772294,ZAM-2002,A2.9-6880,551,ZAM,Levy Mwanawasa,3/1/02,31/12/2004,3/9/48,-777,1/3/02,12/31/04,0,-888,0,0,-888,M,9/3/48,1948,NA,-7772295,ZIM-1965,A2.9-6883,552,ZIM,Smith,11/11/65,23/05/1979,8/4/19,-777,11/11/65,5/23/79,0,1,0,0,0,M,4/8/19,1919,NA,-7772296,ZIM-1979,A2.9-6886,552,ZIM,Muzorewa,29/05/1979,11/12/79,14/4/1925,-777,5/29/79,12/11/79,0,1,0,0,0,M,4/14/25,1925,NA,-7772297,ZIM-1980,A2.9-6889,552,ZIM,Mugabe,4/3/80,31/12/2004,21/2/1924,-777,3/4/80,12/31/04,0,-888,0,0,-888,M,2/21/24,1924,NA,-7772298,MAW-1964,A2.9-6892,553,MAW,Banda,6/7/64,21/05/1994,18/5/1906,25/11/1997,7/6/64,5/21/94,0,1,0,0,2,M,5/18/06,1906,11/25/97,19972299,MAW-1994,A2.9-6895,553,MAW,Muluzi,21/05/1994,24/05/2004,1943,-777,5/21/94,5/24/04,0,1,0,0,0,M,NA,1943,NA,-7772300,MAW-2004,A2.9-6898,553,MAW,Bingu wa Mutharika,24/05/2004,31/12/2004,1934,-777,5/24/04,12/31/04,0,-888,0,0,-888,M,NA,1934,NA,-7772301,SAF-1910,A2.9-6901,560,SAF,Louis Botha,31/05/1910,27/08/1919,27/9/1862,27/08/1919,5/31/10,8/27/19,0,2,0,1,-777,M,1862-09-27,1862,8/27/19,19192302,SAF-1919,A2.9-6904,560,SAF,Smuts,3/9/19,29/06/1924,24/5/1870,1950,9/3/19,6/29/24,0,1,0,0,0,M,1870-05-24,1870,NA,19502303,SAF-1924,A2.9-6907,560,SAF,Hertzog,30/06/1924,5/9/39,3/4/1866,1942,6/30/24,9/5/39,0,1,0,0,0,M,1866-04-03,1866,NA,19422304,SAF-1939,A2.9-6910,560,SAF,Smuts,6/9/39,3/6/48,24/5/1870,1950,9/6/39,6/3/48,0,1,0,1,0,M,1870-05-24,1870,NA,19502305,SAF-1948,A2.9-6913,560,SAF,Malan,3/6/48,30/11/1954,22/5/1874,7/2/59,6/3/48,11/30/54,0,1,0,0,0,M,1874-05-22,1874,2/7/59,19592306,SAF-1954,A2.9-6916,560,SAF,Strijdom,2/12/54,23/08/1958,14/7/1873,1958,12/2/54,8/23/58,0,2,0,0,-777,M,1873-07-14,1873,NA,19582307,SAF-1958-1,A2.9-6919,560,SAF,Swart,23/08/1958,3/9/58,5/12/1894,1982,8/23/58,9/3/58,0,1,0,0,0,M,1894-12-05,1894,NA,19822308,SAF-1958-2,A2.9-6922,560,SAF,Verwoerd,3/9/58,6/9/66,8/9/01,6/9/66,9/3/58,9/6/66,0,3,11,0,3,M,9/8/01,1901,9/6/66,19662309,SAF-1966-1,A2.9-6925,560,SAF,Donges,6/9/66,13/09/1966,8/3/1898,1968,9/6/66,9/13/66,0,1,0,0,0,M,1898-03-08,1898,NA,19682310,SAF-1966-2,A2.9-6928,560,SAF,Vorster,13/09/1966,28/09/1978,13/12/1915,1983,9/13/66,9/28/78,0,1,0,0,0,M,12/13/15,1915,NA,19832311,SAF-1978,A2.9-6931,560,SAF,Botha,28/09/1978,18/01/1989,12/1/16,2006,9/28/78,1/18/89,0,1,0,0,0,M,1/12/16,1916,NA,20062312,SAF-1989-1,A2.9-6934,560,SAF,Heunis,19/01/1989,15/03/1989,29/4/1927,2006,1/19/89,3/15/89,0,1,0,0,0,M,4/29/27,1927,NA,20062313,SAF-1989-2,A2.9-6937,560,SAF,Botha,15/03/1989,14/08/1989,12/1/16,2006,3/15/89,8/14/89,0,1,0,1,0,M,1/12/16,1916,NA,20062314,SAF-1989-3,A2.9-6940,560,SAF,deKlerk,15/08/1989,10/5/94,18/3/1936,-777,8/15/89,5/10/94,0,1,0,0,0,M,3/18/36,1936,NA,-7772315,SAF-1994,A2.9-6943,560,SAF,Mandela,10/5/94,16/06/1999,18/7/1918,-777,5/10/94,6/16/99,0,1,0,0,0,M,7/18/18,1918,NA,-7772316,SAF-1999,A2.9-6946,560,SAF,Mbeki,16/06/1999,31/12/2004,18/6/1942,-777,6/16/99,12/31/04,0,-888,0,0,-888,M,6/18/42,1942,NA,-7772317,TRA-1872,A2.9-6949,563,TRA,Burgers,01/07/1872,12/04/1877,1834,1881,1872-07-01,1877-04-12,0,4,-999,0,1,M,NA,1834,NA,18812318,TRA-1877,A2.9-6952,563,TRA,Shepstone,12/04/1877,04/03/1879,1817,1893,1877-04-12,1879-03-04,2,1,0,0,0,M,NA,1817,NA,18932319,TRA-1879,A2.9-6955,563,TRA,Lanyon,04/03/1879,08/08/1881,1842,1887,1879-03-04,1881-08-08,0,3,-999,0,0,M,NA,1842,NA,18872320,TRA-1881,A2.9-6958,563,TRA,Triumvirate,08/08/1881,09/05/1883,-999,-999,1881-08-08,1883-05-09,1,1,0,0,0,M,NA,NA,NA,NA2321,TRA-1883,A2.9-6961,563,TRA,Kruger,09/05/1883,10/9/00,1825,1904,1883-05-09,9/10/00,0,1,0,0,1,M,NA,1825,NA,19042322,TRA-1900,A2.9-6964,563,TRA,Schalk Burger,10/9/00,31/05/1902,1852,1918,9/10/00,5/31/02,0,4,-999,0,0,M,NA,1852,NA,19182323,TRA-1902,A2.9-6967,563,TRA,Milner,21/06/1902,1/4/05,1854,1925,6/21/02,4/1/05,2,1,0,0,0,M,NA,1854,NA,19252324,TRA-1905,A2.9-6970,563,TRA,Palmer,2/4/05,4/2/07,1859,1942,4/2/05,2/4/07,0,1,0,0,0,M,NA,1859,NA,19422325,TRA-1907,A2.9-6973,563,TRA,Louis Botha,4/2/07,31/05/1910,27/9/1862,27/08/1919,2/4/07,5/31/10,0,1,0,0,0,M,1862-09-27,1862,8/27/19,19192326,OFS-1873,A2.9-6976,564,OFS,Johannes Henricus Brand,16/06/1873,14/07/1888,1823,14/07/1888,1873-06-16,1888-07-14,0,2,0,0,-777,M,NA,1823,1888-07-14,18882327,OFS-1888,A2.9-6979,564,OFS,Blignaut,14/07/1888,10/01/1889,1841,1909,1888-07-14,1889-01-10,0,1,0,0,0,M,NA,1841,NA,19092328,OFS-1889,A2.9-6982,564,OFS,Reitz,10/01/1889,11/12/1895,1844,1934,1889-01-10,1895-12-11,0,2.1,0,0,0,M,NA,1844,NA,19342329,OFS-1895,A2.9-6985,564,OFS,Blignaut,11/12/1895,04/03/1896,1841,1909,1895-12-11,1896-03-04,0,1,0,1,0,M,NA,1841,NA,19092330,OFS-1896,A2.9-6988,564,OFS,Steyn,04/03/1896,31/05/1902,1857,1916,1896-03-04,5/31/02,0,4,-999,0,1,M,NA,1857,NA,19162331,OFS-1902,A2.9-6991,564,OFS,Milner,23/06/1902,1/4/05,1854,1925,6/23/02,4/1/05,2,1,0,0,0,M,NA,1854,NA,19252332,OFS-1905,A2.9-6994,564,OFS,Palmer,2/4/05,7/6/07,1859,1942,4/2/05,6/7/07,0,1,0,0,0,M,NA,1859,NA,19422333,OFS-1907-1,A2.9-6997,564,OFS,Hamilton John Goold-Adams,7/6/07,27/11/1907,1858,1920,6/7/07,11/27/07,0,1,0,0,0,M,NA,1858,NA,19202334,OFS-1907-2,A2.9-7000,564,OFS,Fischer,27/11/1907,31/05/1910,1850,1913,11/27/07,5/31/10,0,1,0,0,0,M,NA,1850,NA,19132335,NAM-1990,A2.9-7003,565,NAM,Nujoma,21/03/1990,31/12/2004,12/5/29,-777,3/21/90,12/31/04,0,-888,0,0,-888,M,5/12/29,1929,NA,-7772336,LES-1966,A2.9-7006,570,LES,Jonathan,4/10/66,20/01/1986,30/10/1914,5/4/87,10/4/66,1/20/86,0,3,6,0,1,M,10/30/14,1914,4/5/87,19872337,LES-1986,A2.9-7009,570,LES,Lekhanya,24/01/1986,2/5/91,7/4/38,-777,1/24/86,5/2/91,1,3,6,0,2,M,4/7/38,1938,NA,-7772338,LES-1991,A2.9-7012,570,LES,Ramaema,2/5/91,2/4/93,10/11/33,-777,5/2/91,4/2/93,1,1,0,0,0,M,11/10/33,1933,NA,-7772339,LES-1993,A2.9-7015,570,LES,Mokhehle,2/4/93,17/08/1994,26/12/1918,6/1/99,4/2/93,8/17/94,0,3,8,0,0,M,12/26/18,1918,1/6/99,19992340,LES-1994-1,A2.9-7018,570,LES,Letsie III,17/08/1994,14/09/1994,1963,-777,8/17/94,9/14/94,1,1,0,0,0,M,NA,1963,NA,-7772341,LES-1994-2,A2.9-7021,570,LES,Mokhehle,14/09/1994,29/05/1998,26/12/1918,6/1/99,9/14/94,5/29/98,1,1,0,1,0,M,12/26/18,1918,1/6/99,19992342,LES-1998,A2.9-7024,570,LES,Mosisili,29/05/1998,31/12/2004,14/03/1945,-777,5/29/98,12/31/04,0,-888,0,0,-888,M,3/14/45,1945,NA,-7772343,BOT-1966,A2.9-7027,571,BOT,Khama,30/09/1966,13/07/1980,1/7/21,13/07/1980,9/30/66,7/13/80,0,2,0,0,-777,M,7/1/21,1921,7/13/80,19802344,BOT-1980,A2.9-7030,571,BOT,Masire,13/07/1980,31/03/1998,23/7/1925,-777,7/13/80,3/31/98,0,1,0,0,0,M,7/23/25,1925,NA,-7772345,BOT-1998,A2.9-7033,571,BOT,Mogae,31/03/1998,31/12/2004,1939,-777,3/31/98,12/31/04,0,-888,0,0,-888,M,NA,1939,NA,-7772346,SWA-1968,A2.9-7036,572,SWA,Subhuza II,6/9/68,21/08/1982,22/7/1899,1982,9/6/68,8/21/82,0,2,0,0,-777,M,1899-07-22,1899,NA,19822347,SWA-1982,A2.9-7039,572,SWA,Dzeliwe Shongwe,21/08/1982,10/8/83,1927,-777,8/21/82,8/10/83,0,3,8,0,0,M,NA,1927,NA,-7772348,SWA-1983,A2.9-7042,572,SWA,Ntombe Thwala,10/8/83,25/04/1986,1950,-777,8/10/83,4/25/86,0,1,0,0,0,M,NA,1950,NA,-7772349,SWA-1986,A2.9-7045,572,SWA,Mswati,25/04/1986,31/12/2004,1968,-777,4/25/86,12/31/04,0,-888,0,0,-888,M,NA,1968,NA,-7772350,MAG-1864,A2.9-7048,580,MAG,Rainilaiarivony,15/07/1864,30/09/1895,1828,1896,1864-07-15,1895-09-30,0,4,-999,0,1,M,NA,1828,NA,18962351,MAG-1960,A2.9-7051,580,MAG,Tsiranana,26/06/1960,8/10/72,8/10/10,1978,6/26/60,10/8/72,0,3,2,0,0,M,10/8/10,1910,NA,19782352,MAG-1972,A2.9-7054,580,MAG,Ramanantsoa,12/10/72,5/2/75,13/4/1906,1979,10/12/72,2/5/75,1,3,16,0,0,M,4/13/06,1906,NA,19792353,MAG-1975-1,A2.9-7057,580,MAG,Ratsimandrava,5/2/75,11/2/75,21/3/1931,1975,2/5/75,2/11/75,1,3,6,0,3,M,3/21/31,1931,NA,19752354,MAG-1975-2,A2.9-7060,580,MAG,Gilles Andriamahazo,11/2/75,15/06/1975,5/5/19,1989,2/11/75,6/15/75,1,1,0,0,0,M,5/5/19,1919,NA,19892355,MAG-1975-3,A2.9-7063,580,MAG,Ratsiraka,15/06/1975,27/03/1993,4/11/36,-777,6/15/75,3/27/93,0,1,0,0,0,M,11/4/36,1936,NA,-7772356,MAG-1993,A2.9-7066,580,MAG,Zafy,27/03/1993,5/9/96,1927,-777,3/27/93,9/5/96,0,1,0,0,0,M,NA,1927,NA,-7772357,MAG-1996,A2.9-7069,580,MAG,Ratsirahonana,5/9/96,9/2/97,1938,-777,9/5/96,2/9/97,0,1,0,0,0,M,NA,1938,NA,-7772358,MAG-1997,A2.9-7072,580,MAG,Ratsiraka,9/2/97,6/7/02,4/11/36,-777,2/9/97,7/6/02,0,3,8,1,1,M,11/4/36,1936,NA,-7772359,MAG-2002,A2.9-7075,580,MAG,Marc Ravalomanana,6/7/02,31/12/2004,12/12/49,-777,7/6/02,12/31/04,1,-888,0,0,-888,M,12/12/49,1949,NA,-7772360,COM-1975-1,A2.9-7078,581,COM,Abdallah,6/7/75,3/8/75,1919,26/11/1989,7/6/75,8/3/75,1,3,4,0,1,M,NA,1919,11/26/89,19892361,COM-1975-2,A2.9-7081,581,COM,Soilih,3/8/75,13/05/1978,1937,1978,8/3/75,5/13/78,1,3,6,0,3,M,NA,1937,NA,19782362,COM-1978,A2.9-7084,581,COM,Bob Denard,13/05/1978,18/12/1989,7/4/29,13/10/2007,5/13/78,12/18/89,1,3,7,0,1,M,4/7/29,1929,10/13/07,20072363,COM-1989,A2.9-7087,581,COM,Djohar,18/12/1989,29/09/1995,1918,2006,12/18/89,9/29/95,0,3,5,0,2,M,NA,1918,NA,20062364,COM-1995-1,A2.9-7090,581,COM,Bob Denard,29/09/1995,5/10/95,7/4/29,13/10/2007,9/29/95,10/5/95,1,4,9,1,1,M,4/7/29,1929,10/13/07,20072365,COM-1995-2,A2.9-7093,581,COM,el-Yachroutu,5/10/95,26/01/1996,1948,-777,10/5/95,1/26/96,0,1,0,0,0,M,NA,1948,NA,-7772366,COM-1996-1,A2.9-7096,581,COM,Djohar,26/01/1996,25/03/1996,1918,2006,1/26/96,3/25/96,0,1,0,1,2,M,NA,1918,NA,20062367,COM-1996-2,A2.9-7099,581,COM,Abdoulkarim,25/03/1996,6/11/98,1936,1998,3/25/96,11/6/98,0,2,0,1,-777,M,NA,1936,NA,19982368,COM-1998,A2.9-7102,581,COM,Massounde,6/11/98,30/04/1999,1933,2004,11/6/98,4/30/99,0,3,6,0,2,M,NA,1933,NA,20042369,COM-1999,A2.9-7105,581,COM,Azali Assoumani,30/04/1999,21/01/2002,1959,-777,4/30/99,1/21/02,1,1,0,0,0,M,NA,1959,NA,-7772370,COM-2002-1,A2.9-7108,581,COM,Hamada Madi,22/01/2002,26/05/2002,1965,-777,1/22/02,5/26/02,0,1,0,0,0,M,NA,1965,NA,-7772371,COM-2002-2,A2.9-7111,581,COM,Azali Assoumani,27/05/2002,31/12/2004,1959,-777,5/27/02,12/31/04,0,-888,0,1,-888,M,NA,1959,NA,-7772372,MAS-1968,A2.9-7114,590,MAS,Ramgoolam,12/3/68,16/06/1982,18/9/1900,15/12/1985,3/12/68,6/16/82,0,1,0,0,0,M,9/18/00,1900,12/15/85,19852373,MAS-1982,A2.9-7117,590,MAS,Anerood Jugnauth,16/06/1982,22/12/1995,29/3/1930,-777,6/16/82,12/22/95,0,1,0,0,0,M,3/29/30,1930,NA,-7772374,MAS-1995,A2.9-7120,590,MAS,Ramgoolam N.,22/12/1995,17/09/2000,1947,-777,12/22/95,9/17/00,0,1,0,0,0,M,NA,1947,NA,-7772375,MAS-2000,A2.9-7123,590,MAS,Anerood Jugnauth,18/09/2000,30/09/2003,29/3/1930,-777,9/18/00,9/30/03,0,1,0,1,0,M,3/29/30,1930,NA,-7772376,MAS-2003,A2.9-7126,590,MAS,Paul Berenger,30/09/2003,31/12/2004,26/03/1945,-777,9/30/03,12/31/04,0,-888,0,0,-888,M,3/26/45,1945,NA,-7772377,MOR-1873,A2.9-7129,600,MOR,Abu Ali al-Hasan,25/09/1873,07/06/1894,1827,1894,1873-09-25,1894-06-07,0,2,0,0,-777,M,NA,1827,NA,18942378,MOR-1894,A2.9-7132,600,MOR,Abd al-Aziz,07/06/1894,5/1/08,18/2/1881,1943,1894-06-07,1/5/08,0,3,-999,0,0,M,1881-02-18,1881,NA,19432379,MOR-1956,A2.9-7135,600,MOR,Mohammed V,2/3/56,26/02/1961,10/8/09,26/02/1961,3/2/56,2/26/61,1,2,0,0,-777,M,8/10/09,1909,2/26/61,19612380,MOR-1961,A2.9-7138,600,MOR,Hassan II,26/02/1961,23/07/1999,9/7/29,23/07/1999,2/26/61,7/23/99,0,2,0,0,-777,M,7/9/29,1929,7/23/99,19992381,MOR-1999,A2.9-7141,600,MOR,Muhammad VI,23/07/1999,31/12/2004,1963,-777,7/23/99,12/31/04,0,-888,0,0,-888,M,NA,1963,NA,-7772382,ALG-1962-1,A2.9-7144,615,ALG,Ben Khedda,3/7/62,25/09/1962,1920,2003,7/3/62,9/25/62,0,1,0,0,0,M,NA,1920,NA,20032383,ALG-1962-2,A2.9-7147,615,ALG,Bella,26/09/1962,19/06/1965,25/12/1916,-777,9/26/62,6/19/65,0,3,6,0,2,M,12/25/16,1916,NA,-7772384,ALG-1965,A2.9-7150,615,ALG,Boumedienne,19/06/1965,27/12/1978,22/8/1927,27/12/1978,6/19/65,12/27/78,1,2,0,0,-777,M,8/22/27,1927,12/27/78,19782385,ALG-1978,A2.9-7153,615,ALG,Bitat,27/12/1978,7/2/79,19/12/1925,2000,12/27/78,2/7/79,0,1,0,0,0,M,12/19/25,1925,NA,20002386,ALG-1979,A2.9-7156,615,ALG,Benjedid,7/2/79,11/1/92,14/04/1929,-777,2/7/79,1/11/92,0,3,6,0,0,M,4/14/29,1929,NA,-7772387,ALG-1992-1,A2.9-7159,615,ALG,Boudiaf,14/01/1992,29/06/1992,23/6/1919,29/06/1992,1/14/92,6/29/92,1,3,4,0,3,M,6/23/19,1919,6/29/92,19922388,ALG-1992-2,A2.9-7162,615,ALG,Kafi,2/7/92,31/01/1994,1928,-777,7/2/92,1/31/94,0,1,0,0,0,M,NA,1928,NA,-7772389,ALG-1994,A2.9-7165,615,ALG,Zeroual,31/01/1994,27/04/1999,1941,-777,1/31/94,4/27/99,0,1,0,0,0,M,NA,1941,NA,-7772390,ALG-1999,A2.9-7168,615,ALG,Bouteflika,27/04/1999,31/12/2004,2/3/37,-777,4/27/99,12/31/04,0,-888,0,0,-888,M,3/2/37,1937,NA,-7772391,TUN-1859,A2.9-7171,616,TUN,Muhammad III,23/09/1859,28/10/1882,1813,28/10/1882,1859-09-23,1882-10-28,0,2,0,0,-777,M,NA,1813,1882-10-28,18822392,TUN-1943,A2.9-7174,616,TUN,Muhammad al-Amin,15/05/1943,25/07/1957,4/9/1881,1962,5/15/43,7/25/57,0,3,8,0,2,M,1881-09-04,1881,NA,19622393,TUN-1957,A2.9-7177,616,TUN,Ben Ali Bourguiba,25/07/1957,7/11/87,3/8/03,6/4/00,7/25/57,11/7/87,1,3,8,0,2,M,8/3/03,1903,4/6/00,20002394,TUN-1987,A2.9-7180,616,TUN,Zine Al-Abidine Ben Ali,7/11/87,31/12/2004,3/9/36,-777,11/7/87,12/31/04,1,-888,0,0,-888,M,9/3/36,1936,NA,-7772395,LIB-1951,A2.9-7183,620,LIB,Idris,24/12/1951,1/9/69,12/3/1890,25/05/1983,12/24/51,9/1/69,0,3,6,0,1,M,1890-03-12,1890,5/25/83,19832396,LIB-1969,A2.9-7186,620,LIB,Qaddafi,1/9/69,31/12/2004,1942,-777,9/1/69,12/31/04,1,-888,0,0,-888,M,NA,1942,NA,-7772397,SUD-1956-1,A2.9-7189,625,SUD,Al-Azhari,1/1/56,4/7/56,1900,1969,1/1/56,7/4/56,0,1,0,0,0,M,NA,1900,NA,19692398,SUD-1956-2,A2.9-7192,625,SUD,Khalil,5/7/56,17/11/1958,1892,1970,7/5/56,11/17/58,0,3,6,0,0,M,NA,1892,NA,19702399,SUD-1958,A2.9-7195,625,SUD,Abboud,18/11/1958,1/11/64,26/10/1900,1983,11/18/58,11/1/64,1,3,2,0,0,M,10/26/00,1900,NA,19832400,SUD-1964,A2.9-7198,625,SUD,al-Khalifa,1/11/64,14/06/1965,1917,2006,11/1/64,6/14/65,1,1,0,0,0,M,NA,1917,NA,20062401,SUD-1965,A2.9-7201,625,SUD,Maghoub,14/06/1965,25/07/1966,1908,1976,6/14/65,7/25/66,0,1,0,0,0,M,NA,1908,NA,19762402,SUD-1966,A2.9-7204,625,SUD,Mahdi,26/07/1966,15/05/1967,25/12/1935,-777,7/26/66,5/15/67,0,1,0,0,0,M,12/25/35,1935,NA,-7772403,SUD-1967,A2.9-7207,625,SUD,Maghoub,18/05/1967,23/05/1969,1908,1976,5/18/67,5/23/69,0,3,6,1,1,M,NA,1908,NA,19762404,SUD-1969,A2.9-7210,625,SUD,Nimeiri,25/05/1969,19/07/1971,1/1/30,-777,5/25/69,7/19/71,1,3,6,0,2,M,1/1/30,1930,NA,-7772405,SUD-1971-1,A2.9-7213,625,SUD,Osman,19/07/1971,22/07/1971,-999,23/071971,7/19/71,7/22/71,1,3,6,0,3,M,NA,NA,NA,NA2406,SUD-1971-2,A2.9-7216,625,SUD,Nimeiri,22/07/1971,6/4/85,1/1/30,-777,7/22/71,4/6/85,1,3,6,1,1,M,1/1/30,1930,NA,-7772407,SUD-1985,A2.9-7219,625,SUD,Abdul Rahman Swaredahab,6/4/85,6/5/86,1934,-777,4/6/85,5/6/86,1,1,0,0,0,M,NA,1934,NA,-7772408,SUD-1986,A2.9-7222,625,SUD,Al-Mirghani,6/5/86,30/06/1989,1941,-777,5/6/86,6/30/89,0,3,6,0,2,M,NA,1941,NA,-7772409,SUD-1989,A2.9-7225,625,SUD,Al-Bashir,30/06/1989,31/12/2004,1/1/44,-777,6/30/89,12/31/04,1,-888,0,0,-888,M,1/1/44,1944,NA,-7772410,IRN-1848,A2.9-7228,630,IRN,Nasir Ad-Din,13/09/1848,01/05/1896,17/07/1831,01/05/1896,1848-09-13,1896-05-01,0,3,-999,0,3,M,1831-07-17,1831,1896-05-01,18962411,IRN-1896,A2.9-7231,630,IRN,Muzaffar ad-Din,02/05/1896,8/1/07,25/3/1853,8/1/07,1896-05-02,1/8/07,0,2,0,0,-777,M,1853-03-25,1853,1/8/07,19072412,IRN-1907,A2.9-7234,630,IRN,Mohammed Ali Shah,8/1/07,16/07/1909,21/6/1872,1924,1/8/07,7/16/09,0,1,0,0,1,M,1872-06-21,1872,NA,19242413,IRN-1909,A2.9-7237,630,IRN,Sultan Ahmad,16/07/1909,21/02/1922,21/1/1898,1930,7/16/09,2/21/22,0,3,6,0,0,M,1898-01-21,1898,NA,19302414,IRN-1922,A2.9-7240,630,IRN,Reza Khan,21/02/1922,16/09/1941,16/3/1878,26/07/1944,2/21/22,9/16/41,1,1,0,0,1,M,1878-03-16,1878,7/26/44,19442415,IRN-1941,A2.9-7243,630,IRN,Mohammad Reza,16/09/1941,30/04/1951,26/10/1919,27/07/1980,9/16/41,4/30/51,0,3,8,0,1,M,10/26/19,1919,7/27/80,19802416,IRN-1951,A2.9-7246,630,IRN,Mohammad Mossadeg,30/04/1951,19/08/1953,19/05/1882,5/3/67,4/30/51,8/19/53,1,3,8,0,2,M,1882-05-19,1882,3/5/67,19672417,IRN-1953,A2.9-7249,630,IRN,Mohammad Reza,19/08/1953,16/01/1979,26/10/1919,27/07/1980,8/19/53,1/16/79,1,3,2,1,1,M,10/26/19,1919,7/27/80,19802418,IRN-1979,A2.9-7252,630,IRN,Ayatollah Khomeini,1/2/79,3/6/89,24/09/1902,3/6/89,2/1/79,6/3/89,1,2,0,0,-777,M,9/24/02,1902,6/3/89,19892419,IRN-1989-1,A2.9-7255,630,IRN,Khamenei,4/6/89,3/8/89,15/07/1939,-777,6/4/89,8/3/89,0,1,0,0,0,M,7/15/39,1939,NA,-7772420,IRN-1989-2,A2.9-7258,630,IRN,Rafsanjani,17/08/1989,3/8/97,29/9/1943,-777,8/17/89,8/3/97,0,1,0,0,0,M,9/29/43,1943,NA,-7772421,IRN-1997,A2.9-7261,630,IRN,Khatami,3/8/97,31/12/2004,2/2/46,-777,8/3/97,12/31/04,0,-888,0,0,-888,M,2/2/46,1946,NA,-7772422,TUR-1861,A2.9-7264,640,TUR,Abdul Aziz,25/06/1861,30/05/1876,1830,04/06/1876,1861-06-25,1876-05-30,0,3,-999,0,3,M,NA,1830,1876-06-04,18762423,TUR-1876-1,A2.9-7267,640,TUR,Murad V,30/05/1876,30/08/1876,1840,1904,1876-05-30,1876-08-30,1,1,0,0,2,M,NA,1840,NA,19042424,TUR-1876-2,A2.9-7270,640,TUR,Hamid II,30/08/1876,27/04/1909,21/9/1842,1918,1876-08-30,4/27/09,0,3,-999,0,2,M,1842-09-21,1842,NA,19182425,TUR-1909,A2.9-7273,640,TUR,Mahmud Sefket Pasha,27/04/1909,23/01/1913,3/11/1844,11/6/13,4/27/09,1/23/13,1,3,-999,0,3,M,1844-11-03,1844,6/11/13,19132426,TUR-1913,A2.9-7276,640,TUR,Enver Pasha,23/01/1913,8/10/18,22/11/1881,4/8/22,1/23/13,10/8/18,1,3,-999,0,1,M,1881-11-22,1881,8/4/22,19222427,TUR-1918,A2.9-7279,640,TUR,Mehmet VI Vahidettin,8/10/18,1/11/22,14/1/1861,1926,10/8/18,11/1/22,1,3,8,0,1,M,1861-01-14,1861,NA,19262428,TUR-1922,A2.9-7282,640,TUR,Ataturk,1/11/22,10/11/38,1881,10/11/38,11/1/22,11/10/38,1,2,0,0,-777,M,NA,1881,11/10/38,19382429,TUR-1938,A2.9-7285,640,TUR,Inonu,11/11/38,22/05/1950,25/9/1884,25/12/1973,11/11/38,5/22/50,0,1,0,0,0,M,1884-09-25,1884,12/25/73,19732430,TUR-1950,A2.9-7288,640,TUR,Menderes,22/05/1950,27/05/1960,1899,17/09/1961,5/22/50,5/27/60,0,3,6,0,3,M,NA,1899,9/17/61,19612431,TUR-1960,A2.9-7291,640,TUR,Gursel,27/05/1960,10/11/61,1895,1966,5/27/60,11/10/61,1,1,0,0,0,M,NA,1895,NA,19662432,TUR-1961,A2.9-7294,640,TUR,Inonu,10/11/61,13/02/1965,25/9/1884,25/12/1973,11/10/61,2/13/65,0,1,0,1,0,M,1884-09-25,1884,12/25/73,19732433,TUR-1965-1,A2.9-7297,640,TUR,Urguplu,13/02/1965,27/10/1965,1902,1981,2/13/65,10/27/65,0,1,0,0,0,M,NA,1902,NA,19812434,TUR-1965-2,A2.9-7300,640,TUR,Demirel,27/10/1965,12/3/71,6/10/24,-777,10/27/65,3/12/71,0,3,6,0,0,M,10/6/24,1924,NA,-7772435,TUR-1971,A2.9-7303,640,TUR,Erim,19/03/1971,17/04/1972,1912,19/07/1980,3/19/71,4/17/72,1,1,0,0,0,M,NA,1912,7/19/80,19802436,TUR-1972,A2.9-7306,640,TUR,Melen,22/05/1972,15/04/1973,1906,3/9/88,5/22/72,4/15/73,0,1,0,0,0,M,NA,1906,9/3/88,19882437,TUR-1973,A2.9-7309,640,TUR,Talu,15/04/1973,25/01/1974,22/7/1919,1998,4/15/73,1/25/74,0,1,0,0,0,M,7/22/19,1919,NA,19982438,TUR-1974-1,A2.9-7312,640,TUR,Ecevit,25/01/1974,7/11/74,28/5/1925,5/11/06,1/25/74,11/7/74,0,1,0,0,2,M,5/28/25,1925,11/5/06,20062439,TUR-1974-2,A2.9-7315,640,TUR,Irmak,17/11/1974,31/03/1975,15/5/1901,1990,11/17/74,3/31/75,0,1,0,0,0,M,5/15/01,1901,NA,19902440,TUR-1975,A2.9-7318,640,TUR,Demirel,31/03/1975,21/06/1977,6/10/24,-777,3/31/75,6/21/77,0,1,0,1,0,M,10/6/24,1924,NA,-7772441,TUR-1977-1,A2.9-7321,640,TUR,Ecevit,21/06/1977,21/07/1977,28/5/1925,5/11/06,6/21/77,7/21/77,0,1,0,1,2,M,5/28/25,1925,11/5/06,20062442,TUR-1977-2,A2.9-7324,640,TUR,Demirel,21/07/1977,21/12/1977,6/10/24,-777,7/21/77,12/21/77,0,1,0,2,0,M,10/6/24,1924,NA,-7772443,TUR-1978,A2.9-7327,640,TUR,Ecevit,1/1/78,12/11/79,28/5/1925,5/11/06,1/1/78,11/12/79,0,1,0,2,2,M,5/28/25,1925,11/5/06,20062444,TUR-1979,A2.9-7330,640,TUR,Demirel,12/11/79,20/09/1980,6/10/24,-777,11/12/79,9/20/80,0,3,6,3,2,M,10/6/24,1924,NA,-7772445,TUR-1980,A2.9-7333,640,TUR,Evren,20/09/1980,23/11/1983,1917,-777,9/20/80,11/23/83,1,1,0,0,0,M,NA,1917,NA,-7772446,TUR-1983,A2.9-7336,640,TUR,Ozal,13/12/1983,9/11/89,13/10/1927,17/04/1993,12/13/83,11/9/89,0,1,0,0,0,M,10/13/27,1927,4/17/93,19932447,TUR-1989,A2.9-7339,640,TUR,Akbulut,9/11/89,24/06/1991,1935,-777,11/9/89,6/24/91,0,1,0,0,0,M,NA,1935,NA,-7772448,TUR-1991-1,A2.9-7342,640,TUR,Yilmaz,24/06/1991,20/11/1991,6/11/47,-777,6/24/91,11/20/91,0,1,0,0,0,M,11/6/47,1947,NA,-7772449,TUR-1991-2,A2.9-7345,640,TUR,Demirel,20/11/1991,16/05/1993,6/10/24,-777,11/20/91,5/16/93,0,1,0,4,0,M,10/6/24,1924,NA,-7772450,TUR-1993-1,A2.9-7348,640,TUR,Erdal Inonu,16/05/1993,25/06/1993,1926,-777,5/16/93,6/25/93,0,1,0,0,0,M,NA,1926,NA,-7772451,TUR-1993-2,A2.9-7351,640,TUR,Ciller,25/06/1993,6/3/96,24/5/1946,-777,6/25/93,3/6/96,0,1,0,0,0,F,5/24/46,1946,NA,-7772452,TUR-1996-1,A2.9-7354,640,TUR,Yilmaz,6/3/96,28/06/1996,6/11/47,-777,3/6/96,6/28/96,0,1,0,1,0,M,11/6/47,1947,NA,-7772453,TUR-1996-2,A2.9-7357,640,TUR,Erbakan,28/06/1996,30/06/1997,29/10/1926,-777,6/28/96,6/30/97,0,3,6,0,0,M,10/29/26,1926,NA,-7772454,TUR-1997,A2.9-7360,640,TUR,Yilmaz,30/06/1997,11/1/99,6/11/47,-777,6/30/97,1/11/99,1,1,0,2,0,M,11/6/47,1947,NA,-7772455,TUR-1999,A2.9-7363,640,TUR,Ecevit,11/1/99,18/11/2002,28/5/1925,5/11/06,1/11/99,11/18/02,0,1,0,3,2,M,5/28/25,1925,11/5/06,20062456,TUR-2002,A2.9-7366,640,TUR,Abdullah Gul,19/11/2002,14/03/2003,1950,-777,11/19/02,3/14/03,0,1,0,0,0,M,NA,1950,NA,-7772457,TUR-2003,A2.9-7369,640,TUR,Erdogan,14/03/2003,31/12/2004,26/02/1954,-777,3/14/03,12/31/04,0,-888,0,0,-888,M,2/26/54,1954,NA,-7772458,IRQ-1932,A2.9-7372,645,IRQ,Faisal I,3/10/32,8/9/33,20/5/1885,8/9/33,10/3/32,9/8/33,0,2,0,0,-777,M,1885-05-20,1885,9/8/33,19332459,IRQ-1933,A2.9-7375,645,IRQ,Ghazi,8/9/33,4/4/39,21/03/1912,4/4/39,9/8/33,4/4/39,0,2,0,0,-777,M,3/21/12,1912,4/4/39,19392460,IRQ-1939,A2.9-7378,645,IRQ,Abdul-Ilah,4/4/39,2/5/53,14/11/1913,14/07/1958,4/4/39,5/2/53,0,1,0,0,0,M,11/14/13,1913,7/14/58,19582461,IRQ-1953,A2.9-7381,645,IRQ,Faisal II,2/5/53,14/07/1958,2/5/35,14/07/1958,5/2/53,7/14/58,0,3,6,0,3,M,5/2/35,1935,7/14/58,19582462,IRQ-1958,A2.9-7384,645,IRQ,Karrim Kassem,14/07/1958,8/2/63,4/5/14,9/2/63,7/14/58,2/8/63,1,3,6,0,3,M,5/4/14,1914,2/9/63,19632463,IRQ-1963,A2.9-7387,645,IRQ,Salem Aref,8/2/63,13/04/1966,21/3/1921,13/04/1966,2/8/63,4/13/66,1,2,0,0,-777,M,3/21/21,1921,4/13/66,19662464,IRQ-1966,A2.9-7390,645,IRQ,Rahmen Aref,17/04/1966,17/07/1968,1916,-777,4/17/66,7/17/68,0,3,6,0,1,M,NA,1916,NA,-7772465,IRQ-1968,A2.9-7393,645,IRQ,Hassan Al-Bakr,17/07/1968,16/07/1979,1/7/14,4/10/82,7/17/68,7/16/79,1,1,0,0,-666,M,7/1/14,1914,10/4/82,19822466,IRQ-1979,A2.9-7396,645,IRQ,Saddam Hussein,16/07/1979,9/4/03,28/4/1937,30/12/2006,7/16/79,4/9/03,0,4,9,0,2,M,4/28/37,1937,12/30/06,20062467,IRQ-2003-1,A2.9-7399,645,IRQ,Tommy Ray Franks,9/4/03,21/04/2003,1945,-777,4/9/03,4/21/03,2,1,0,0,0,M,NA,1945,NA,-7772468,IRQ-2003-2,A2.9-7402,645,IRQ,Jay Garner,21/04/2003,12/5/03,1938,-777,4/21/03,5/12/03,2,1,0,0,0,M,NA,1938,NA,-7772469,IRQ-2003-3,A2.9-7405,645,IRQ,Paul Bremer,12/5/03,28/06/2004,1941,-777,5/12/03,6/28/04,2,1,0,0,0,M,NA,1941,NA,-7772470,IRQ-2004,A2.9-7408,645,IRQ,Iyad Allawi,28/06/2004,31/12/2004,1945,-777,6/28/04,12/31/04,0,-888,0,0,-888,M,NA,1945,NA,-7772471,EGY-1922,A2.9-7411,651,EGY,Fuad I,28/02/1922,28/04/1936,26/3/1868,28/04/1936,2/28/22,4/28/36,0,2,0,0,-777,M,1868-03-26,1868,4/28/36,19362472,EGY-1936,A2.9-7414,651,EGY,Farouk,28/04/1936,22/07/1952,11/2/20,18/03/1965,4/28/36,7/22/52,0,3,6,0,1,M,2/11/20,1920,3/18/65,19652473,EGY-1952,A2.9-7417,651,EGY,Naguib,23/07/1952,14/11/1954,20/2/1901,28/08/1984,7/23/52,11/14/54,1,1,0,0,1,M,2/20/01,1901,8/28/84,19842474,EGY-1954,A2.9-7420,651,EGY,Nasser,17/11/1954,28/09/1970,15/1/1918,28/09/1970,11/17/54,9/28/70,1,2,0,0,-777,M,1/15/18,1918,9/28/70,19702475,EGY-1970,A2.9-7423,651,EGY,Sadat,28/09/1970,6/10/81,25/12/1918,6/10/81,9/28/70,10/6/81,0,3,111,0,3,M,12/25/18,1918,10/6/81,19812476,EGY-1981,A2.9-7426,651,EGY,Mubarak,14/10/1981,31/12/2004,4/5/29,-777,10/14/81,12/31/04,0,-888,0,0,-888,M,5/4/29,1929,NA,-7772477,SYR-1943,A2.9-7429,652,SYR,Kuwatli,17/08/1943,30/03/1949,1891,30/06/1967,8/17/43,3/30/49,0,3,6,0,1,M,NA,1891,6/30/67,19672478,SYR-1949-1,A2.9-7432,652,SYR,Al-Zaim,30/03/1949,13/08/1949,1897,1949,3/30/49,8/13/49,1,3,6,0,3,M,NA,1897,NA,19492479,SYR-1949-2,A2.9-7435,652,SYR,Hinnawi,13/08/1949,19/12/1949,1898,1950,8/13/49,12/19/49,1,3,6,0,3,M,NA,1898,NA,19502480,SYR-1949-3,A2.9-7438,652,SYR,Shishakli,19/12/1949,28/02/1954,1909,1964,12/19/49,2/28/54,1,3,6,0,1,M,NA,1909,NA,19642481,SYR-1954,A2.9-7441,652,SYR,"Atassi, H.",28/02/1954,6/9/55,1875,5/12/60,2/28/54,9/6/55,1,1,0,2,0,M,NA,1875,12/5/60,19602482,SYR-1955,A2.9-7444,652,SYR,Kuwatli,6/9/55,1/2/58,1891,30/06/1967,9/6/55,2/1/58,0,1,0,1,0,M,NA,1891,6/30/67,19672483,SYR-1958,A2.9-7447,652,SYR,Nasser (president of UAR),1/2/58,28/09/1961,15/1/1918,28/09/1970,2/1/58,9/28/61,0,3,6,0,0,M,1/15/18,1918,9/28/70,19702484,SYR-1961-1,A2.9-7450,652,SYR,Al-kuzbari,28/09/1961,1/12/61,1914,2/3/98,9/28/61,12/1/61,1,1,0,0,0,M,NA,1914,3/2/98,19982485,SYR-1961-2,A2.9-7453,652,SYR,El-Kudsi,1/12/61,28/03/1962,14/02/1906,6/2/98,12/1/61,3/28/62,0,3,6,0,2,M,2/14/06,1906,2/6/98,19982486,SYR-1962-1,A2.9-7456,652,SYR,Zahreddin,28/03/1962,13/04/1962,-999,-999,3/28/62,4/13/62,1,1,0,0,2,M,NA,NA,NA,NA2487,SYR-1962-2,A2.9-7459,652,SYR,El-Kudsi,13/04/1962,8/3/63,14/02/1906,6/2/98,4/13/62,3/8/63,0,3,6,1,2,M,2/14/06,1906,2/6/98,19982488,SYR-1963-1,A2.9-7462,652,SYR,"Atassi, L.",9/3/63,27/07/1963,1926,2003,3/9/63,7/27/63,1,3,16,0,-666,M,NA,1926,NA,20032489,SYR-1963-2,A2.9-7465,652,SYR,Al-Hafiz,27/07/1963,25/02/1966,1911,-777,7/27/63,2/25/66,1,3,6,0,2,M,NA,1911,NA,-7772490,SYR-1966,A2.9-7468,652,SYR,"El-Atassi, N.",25/02/1966,13/11/1970,1929,3/12/92,2/25/66,11/13/70,1,3,6,0,2,M,NA,1929,12/3/92,19922491,SYR-1970,A2.9-7471,652,SYR,Al-Khatib,18/11/1970,22/02/1971,1933,-777,11/18/70,2/22/71,1,1,0,0,0,M,NA,1933,NA,-7772492,SYR-1971,A2.9-7474,652,SYR,Al-Assad H.,22/02/1971,10/6/00,6/10/30,10/6/00,2/22/71,6/10/00,0,2,0,0,-777,M,10/6/30,1930,6/10/00,20002493,SYR-2000,A2.9-7477,652,SYR,Bashar al-Assad,11/6/00,31/12/2004,1965,-777,6/11/00,12/31/04,0,-888,0,0,-888,M,NA,1965,NA,-7772494,LEB-1943,A2.9-7480,660,LEB,EL Khoury,22/11/1943,18/09/1952,10/8/1890,11/1/64,11/22/43,9/18/52,0,1,0,1,0,M,1890-08-10,1890,1/11/64,19642495,LEB-1952-1,A2.9-7483,660,LEB,Chebab,19/09/1952,23/09/1952,9/3/02,25/04/1973,9/19/52,9/23/52,0,1,0,0,0,M,3/9/02,1902,4/25/73,19732496,LEB-1952-2,A2.9-7486,660,LEB,Chamoun,23/09/1952,23/09/1958,3/4/00,7/8/87,9/23/52,9/23/58,0,1,0,0,0,M,4/3/00,1900,8/7/87,19872497,LEB-1958,A2.9-7489,660,LEB,Chehab,23/09/1958,23/09/1964,9/3/02,25/04/1973,9/23/58,9/23/64,0,1,0,1,0,M,3/9/02,1902,4/25/73,19732498,LEB-1964,A2.9-7492,660,LEB,Helou,23/09/1964,23/09/1970,25/12/1912,7/1/01,9/23/64,9/23/70,0,1,0,0,0,M,12/25/12,1912,1/7/01,20012499,LEB-1970,A2.9-7495,660,LEB,Franjieh,23/09/1970,23/09/1976,14/6/1910,23/07/1992,9/23/70,9/23/76,0,1,0,0,0,M,6/14/10,1910,7/23/92,19922500,LEB-1976,A2.9-7498,660,LEB,Sarkis,23/09/1976,23/09/1982,20/7/1924,1985,9/23/76,9/23/82,0,1,0,0,0,M,7/20/24,1924,NA,19852501,LEB-1982,A2.9-7501,660,LEB,"Gemayel, Amin",23/09/1982,23/09/1988,1942,-777,9/23/82,9/23/88,0,1,0,0,0,M,NA,1942,NA,-7772502,LEB-1988,A2.9-7504,660,LEB,Aoun,23/09/1988,5/11/89,15/2/1935,-777,9/23/88,11/5/89,0,1,0,0,1,M,2/15/35,1935,NA,-7772503,LEB-1989-1,A2.9-7507,660,LEB,Moawad,5/11/89,22/11/1989,17/04/1925,22/11/1989,11/5/89,11/22/89,0,3,4,0,3,M,4/17/25,1925,11/22/89,19892504,LEB-1989-2,A2.9-7510,660,LEB,Elias Hrawi,23/11/1989,24/11/1998,1930,2006,11/23/89,11/24/98,0,1,0,0,0,M,NA,1930,NA,20062505,LEB-1998,A2.9-7513,660,LEB,Emile Lahoud,24/11/1998,31/12/2004,1936,-777,11/24/98,12/31/04,0,-888,0,0,-888,M,NA,1936,NA,-7772506,JOR-1921,A2.9-7516,663,JOR,Abdullah Al-Hussein,11/4/21,20/07/1951,1882,20/07/1951,4/11/21,7/20/51,2,3,11,0,3,M,NA,1882,7/20/51,19512507,JOR-1951-1,A2.9-7519,663,JOR,Abdullah El-Hashim,20/07/1951,6/9/51,1914,1983,7/20/51,9/6/51,0,1,0,0,1,M,NA,1914,NA,19832508,JOR-1951-2,A2.9-7522,663,JOR,Ibn Abdullah-Hashim,6/9/51,11/8/52,1909,1972,9/6/51,8/11/52,0,1,0,0,1,M,NA,1909,NA,19722509,JOR-1952,A2.9-7525,663,JOR,Hussein Ibn Talal El-Hashim,11/8/52,7/2/99,14/11/1935,7/2/99,8/11/52,2/7/99,0,2,0,0,-777,M,11/14/35,1935,2/7/99,19992510,JOR-1999,A2.9-7528,663,JOR,Abdullah Ibn Hussein El-Hashimi,7/2/99,31/12/2004,30/1/1962,-777,2/7/99,12/31/04,0,-888,0,0,-888,M,1/30/62,1962,NA,-7772511,ISR-1948,A2.9-7531,666,ISR,Ben Gurion,14/05/1948,8/12/53,16/10/1886,1973,5/14/48,12/8/53,0,1,0,0,0,M,1886-10-16,1886,NA,19732512,ISR-1953,A2.9-7534,666,ISR,Sharett,8/12/53,3/11/55,15/10/1894,1965,12/8/53,11/3/55,0,1,0,0,0,M,1894-10-15,1894,NA,19652513,ISR-1955,A2.9-7537,666,ISR,Ben Gurion,3/11/55,16/06/1963,16/10/1886,1973,11/3/55,6/16/63,0,1,0,1,0,M,1886-10-16,1886,NA,19732514,ISR-1963,A2.9-7540,666,ISR,Eshkol,19/06/1963,26/02/1969,25/10/1895,26/02/1969,6/19/63,2/26/69,0,2,0,0,-777,M,1895-10-25,1895,2/26/69,19692515,ISR-1969-1,A2.9-7543,666,ISR,Allon,26/02/1969,17/03/1969,10/10/18,1980,2/26/69,3/17/69,0,1,0,0,0,M,10/10/18,1918,NA,19802516,ISR-1969-2,A2.9-7546,666,ISR,Meir,17/03/1969,3/6/74,3/5/1898,1978,3/17/69,6/3/74,0,1,0,0,0,F,1898-05-03,1898,NA,19782517,ISR-1974,A2.9-7549,666,ISR,Rabin,3/6/74,8/4/77,1/3/22,1995,6/3/74,4/8/77,0,1,0,0,0,M,3/1/22,1922,NA,19952518,ISR-1977-1,A2.9-7552,666,ISR,Peres,8/4/77,21/06/1977,1/8/23,-777,4/8/77,6/21/77,0,1,0,0,0,M,8/1/23,1923,NA,-7772519,ISR-1977-2,A2.9-7555,666,ISR,Begin,21/06/1977,10/10/83,16/8/1913,1992,6/21/77,10/10/83,0,1,0,0,0,M,8/16/13,1913,NA,19922520,ISR-1983,A2.9-7558,666,ISR,Shamir,10/10/83,14/09/1984,3/11/14,-777,10/10/83,9/14/84,0,1,0,0,0,M,11/3/14,1914,NA,-7772521,ISR-1984,A2.9-7561,666,ISR,Peres,14/09/1984,20/10/1986,1/8/23,-777,9/14/84,10/20/86,0,1,0,1,0,M,8/1/23,1923,NA,-7772522,ISR-1986,A2.9-7564,666,ISR,Shamir,20/10/1986,12/7/92,3/11/14,-777,10/20/86,7/12/92,0,1,0,1,0,M,11/3/14,1914,NA,-7772523,ISR-1992,A2.9-7567,666,ISR,Rabin,12/7/92,4/11/95,1/3/22,4/11/95,7/12/92,11/4/95,0,3,11,1,3,M,3/1/22,1922,11/4/95,19952524,ISR-1995,A2.9-7570,666,ISR,Peres,4/11/95,18/06/1996,1/8/23,-777,11/4/95,6/18/96,0,1,0,2,0,M,8/1/23,1923,NA,-7772525,ISR-1996,A2.9-7573,666,ISR,Netanyahu,18/06/1996,6/7/99,1949,-777,6/18/96,7/6/99,0,1,0,0,0,M,NA,1949,NA,-7772526,ISR-1999,A2.9-7576,666,ISR,Barak,6/7/99,7/3/01,12/2/42,-777,7/6/99,3/7/01,0,1,0,0,0,M,2/12/42,1942,NA,-7772527,ISR-2001,A2.9-7579,666,ISR,Ariel Sharon,8/3/01,31/12/2004,1928,-777,3/8/01,12/31/04,0,-888,0,0,-888,M,NA,1928,NA,-7772528,SAU-1927,A2.9-7582,670,SAU,Aziz,20/05/1927,9/11/53,21/10/1882,9/11/53,5/20/27,11/9/53,0,2,0,0,-777,M,1882-10-21,1882,11/9/53,19532529,SAU-1953,A2.9-7585,670,SAU,Saud,9/11/53,2/11/64,15/1/1902,1969,11/9/53,11/2/64,0,1,0,0,1,M,1/15/02,1902,NA,19692530,SAU-1964,A2.9-7588,670,SAU,Faisal,2/11/64,25/03/1975,1905,25/03/1975,11/2/64,3/25/75,0,3,11,0,3,M,NA,1905,3/25/75,19752531,SAU-1975,A2.9-7591,670,SAU,Khalid,25/03/1975,13/06/1982,1913,13/06/1982,3/25/75,6/13/82,0,2,0,0,-777,M,NA,1913,6/13/82,19822532,SAU-1982,A2.9-7594,670,SAU,Fahd,13/06/1982,1/1/96,1922,1/8/05,6/13/82,1/1/96,0,2.1,0,0,0,M,NA,1922,8/1/05,20052533,SAU-1996,A2.9-7597,670,SAU,Abdullah,1/1/96,31/12/2004,1924,-777,1/1/96,12/31/04,0,-888,0,0,-888,M,NA,1924,NA,-7772534,YEM-1904,A2.9-7600,678,YEM,Yahya,4/6/04,17/02/1948,1876,1948,6/4/04,2/17/48,0,3,4,0,3,M,NA,1876,NA,19482535,YEM-1948-1,A2.9-7603,678,YEM,Ibn Ahmed Alwazir,17/02/1948,13/03/1948,1888,1948,2/17/48,3/13/48,1,3,4,0,3,M,NA,1888,NA,19482536,YEM-1948-2,A2.9-7606,678,YEM,Ibn Yahya Hamid,13/03/1948,18/09/1962,1891,18/09/1962,3/13/48,9/18/62,1,2,0,0,-777,M,NA,1891,9/18/62,19622537,YEM-1962-1,A2.9-7609,678,YEM,Al-Badr,18/09/1962,27/09/1962,1928,1996,9/18/62,9/27/62,1,3,6,0,0,M,NA,1928,NA,19962538,YEM-1962-2,A2.9-7612,678,YEM,AL-Sallal,27/09/1962,5/11/67,1917,1994,9/27/62,11/5/67,1,3,6,0,1,M,NA,1917,NA,19942539,YEM-1967,A2.9-7615,678,YEM,Al-Iryani,5/11/67,13/06/1974,18/7/1917,1998,11/5/67,6/13/74,1,3,6,0,1,M,7/18/17,1917,NA,19982540,YEM-1974,A2.9-7618,678,YEM,Al-Hamadi,13/06/1974,11/10/77,1943,1977,6/13/74,10/11/77,1,3,111,0,3,M,NA,1943,NA,19772541,YEM-1977,A2.9-7621,678,YEM,Al-Ghashmi,11/10/77,24/06/1978,1939,1978,10/11/77,6/24/78,0,3,11,0,3,M,NA,1939,NA,19782542,YEM-1978,A2.9-7624,678,YEM,Saleh al-Hashidi,17/07/1978,31/12/2004,1942,-777,7/17/78,12/31/04,0,-888,0,0,-888,M,NA,1942,NA,-7772543,YPR-1967,A2.9-7627,680,YPR,Al-Shaabi,30/11/1967,22/06/1969,1925,1976,11/30/67,6/22/69,1,3,8,0,2,M,NA,1925,NA,19762544,YPR-1969,A2.9-7630,680,YPR,Ali Rubayyi,24/06/1969,26/06/1978,1934,1978,6/24/69,6/26/78,0,3,3,0,3,M,NA,1934,NA,19782545,YPR-1978-1,A2.9-7633,680,YPR,Ali Nassir Hassani,27/06/1978,27/12/1978,1939,-777,6/27/78,12/27/78,1,1,0,0,0,M,NA,1939,NA,-7772546,YPR-1978-2,A2.9-7636,680,YPR,Ismail,27/12/1978,2/4/80,1939,1986,12/27/78,4/2/80,0,1,0,0,0,M,NA,1939,NA,19862547,YPR-1980,A2.9-7639,680,YPR,Ali Nassir Hassani,2/4/80,24/01/1986,1939,-777,4/2/80,1/24/86,0,3,8,1,1,M,NA,1939,NA,-7772548,YPR-1986,A2.9-7642,680,YPR,Attas,24/01/1986,22/05/1990,1939,-777,1/24/86,5/22/90,1,1,0,0,0,M,NA,1939,NA,-7772549,KUW-1950,A2.9-7645,690,KUW,Abdullah As-Sabah,29/01/1950,24/11/1965,1895,24/11/1965,1/29/50,11/24/65,0,2,0,0,-777,M,NA,1895,11/24/65,19652550,KUW-1965,A2.9-7648,690,KUW,Sabah As-Sabah,24/11/1965,31/12/1977,1913,31/12/1977,11/24/65,12/31/77,0,2,0,0,-777,M,NA,1913,12/31/77,19772551,KUW-1978,A2.9-7651,690,KUW,Jabir As-Sabah,1/1/78,2/8/90,29/6/1926,-777,1/1/78,8/2/90,0,4,9,0,1,M,6/29/26,1926,NA,-7772552,KUW-1990,A2.9-7654,690,KUW,Saddam Hussein,2/8/90,20/04/1991,28/4/1937,30/12/2006,8/2/90,4/20/91,2,4,9,0,0,M,4/28/37,1937,12/30/06,20062553,KUW-1991,A2.9-7657,690,KUW,Jabir As-Sabah,20/04/1991,31/12/2004,29/6/1926,-777,4/20/91,12/31/04,2,-888,0,1,-888,M,6/29/26,1926,NA,-7772554,BAH-1971,A2.9-7660,692,BAH,Isa Ibn Al-Khalifah,15/08/1971,6/3/99,3/7/33,6/3/99,8/15/71,3/6/99,0,2,0,0,-777,M,7/3/33,1933,3/6/99,19992555,BAH-1999,A2.9-7663,692,BAH,Hamad Isa Ibn Al-Khalifah,6/3/99,31/12/2004,28/1/1950,-777,3/6/99,12/31/04,0,-888,0,0,-888,M,1/28/50,1950,NA,-7772556,QAT-1971,A2.9-7666,694,QAT,Ahmed Ath-Thani,3/9/71,22/02/1972,1917,1977,9/3/71,2/22/72,0,3,8,0,1,M,NA,1917,NA,19772557,QAT-1972,A2.9-7669,694,QAT,Khalifah Ath-Thani,22/02/1972,27/06/1995,1932,-777,2/22/72,6/27/95,1,3,8,0,1,M,NA,1932,NA,-7772558,QAT-1995,A2.9-7672,694,QAT,Amad Al Thani,27/06/1995,31/12/2004,1952,-777,6/27/95,12/31/04,1,-888,0,0,-888,M,NA,1952,NA,-7772559,UAE-1971,A2.9-7675,696,UAE,An-Nahayan,2/12/71,31/12/2004,1918,-777,12/2/71,12/31/04,0,-888,0,0,-888,M,NA,1918,NA,-7772560,OMA-1871,A2.9-7678,698,OMA,Turki ibn Sa`id,30/01/1871,04/06/1888,1832,04/06/1888,1871-01-30,1888-06-04,1,2,0,0,-777,M,NA,1832,1888-06-04,18882561,OMA-1888,A2.9-7681,698,OMA,Faysal ibn Turki,04/06/1888,5/10/13,1864,5/10/13,1888-06-04,10/5/13,0,2,0,0,-777,M,NA,1864,10/5/13,19132562,OMA-1913,A2.9-7684,698,OMA,Taimur ibn Faysal,9/10/13,10/2/32,4/6/1888,1965,10/9/13,2/10/32,0,1,0,0,-666,M,1888-06-04,1888,NA,19652563,OMA-1932,A2.9-7687,698,OMA,Sa`id ibn Taimur,10/2/32,23/07/1970,13/4/1910,1972,2/10/32,7/23/70,0,3,8,0,1,M,4/13/10,1910,NA,19722564,OMA-1970,A2.9-7690,698,OMA,Qabus Bin Said,23/07/1970,31/12/2004,18/11/1940,-777,7/23/70,12/31/04,1,-888,0,0,-888,M,11/18/40,1940,NA,-7772565,AFG-1868,A2.9-7693,700,AFG,Shir `Ali Khan,08/09/1868,21/02/1879,1825,21/02/1879,1868-09-08,1879-02-21,1,1,0,1,1,M,NA,1825,1879-02-21,18792566,AFG-1879-1,A2.9-7696,700,AFG,Mohammad Ya`qub Khan,21/02/1879,12/10/1879,1849,1923,1879-02-21,1879-10-12,0,4,-999,0,1,M,NA,1849,NA,19232567,AFG-1879-2,A2.9-7699,700,AFG,Mohammad Jan,12/10/1879,31/03/1880,-999,31/03/1880,1879-10-12,1880-03-31,2,2,0,0,-777,M,NA,NA,1880-03-31,18802568,AFG-1880,A2.9-7702,700,AFG,Abdor Rahman Khan,22/07/1880,3/10/01,1844,3/10/01,1880-07-22,10/3/01,2,2,0,0,-777,M,NA,1844,10/3/01,19012569,AFG-1901,A2.9-7705,700,AFG,Habibullah Khan,3/10/01,20/02/1919,3/7/1872,20/02/1919,10/3/01,2/20/19,0,3,11,0,3,M,1872-07-03,1872,2/20/19,19192570,AFG-1920,A2.9-7708,700,AFG,Amanullah Khan,1/1/20,14/01/1929,1/6/1892,25/04/1960,1/1/20,1/14/29,1,1,0,0,1,M,1892-06-01,1892,4/25/60,19602571,AFG-1929-1,A2.9-7711,700,AFG,Inayatullah Khan,14/01/1929,17/01/1929,20/10/1888,1946,1/14/29,1/17/29,0,3,4,0,1,M,1888-10-20,1888,NA,19462572,AFG-1929-2,A2.9-7714,700,AFG,Habibullah Ghazi,17/01/1929,17/10/1929,1890,1929,1/17/29,10/17/29,1,3,4,0,3,M,NA,1890,NA,19292573,AFG-1929-3,A2.9-7717,700,AFG,Nadir Shah,17/10/1929,8/11/33,10/4/1880,1933,10/17/29,11/8/33,1,3,11,0,3,M,1880-04-10,1880,NA,19332574,AFG-1933,A2.9-7720,700,AFG,Hashim Khan,8/11/33,14/05/1946,1884,1953,11/8/33,5/14/46,0,2.1,0,0,0,M,NA,1884,NA,19532575,AFG-1946,A2.9-7723,700,AFG,Mahmud Khan Ghazi,14/05/1946,7/9/53,1888,1959,5/14/46,9/7/53,0,3,8,0,0,M,NA,1888,NA,19592576,AFG-1953,A2.9-7726,700,AFG,Sardar Mohammad Daud Khan,7/9/53,10/3/63,18/07/1909,27/04/1978,9/7/53,3/10/63,1,1,0,0,0,M,7/18/09,1909,4/27/78,19782577,AFG-1963,A2.9-7729,700,AFG,Mohammad Yusuf,10/3/63,2/11/65,1917,1998,3/10/63,11/2/65,0,1,0,0,0,M,NA,1917,NA,19982578,AFG-1965,A2.9-7732,700,AFG,Mohammad Hashim Maiwandwal,2/11/65,11/10/67,1919,1973,11/2/65,10/11/67,0,2.1,0,0,0,M,NA,1919,NA,19732579,AFG-1967-1,A2.9-7735,700,AFG,Abdallah Yakta,11/10/67,1/11/67,-999,-999,10/11/67,11/1/67,0,1,0,0,0,M,NA,NA,NA,NA2580,AFG-1967-2,A2.9-7738,700,AFG,Nur Ahmad Etemadi,1/11/67,9/6/71,1921,1979,11/1/67,6/9/71,0,1,0,0,0,M,NA,1921,NA,19792581,AFG-1971,A2.9-7741,700,AFG,Abdul Zahir,9/6/71,6/12/72,1910,1982,6/9/71,12/6/72,0,1,0,0,0,M,NA,1910,NA,19822582,AFG-1972,A2.9-7744,700,AFG,Mohammad Musa Shafiq,12/12/72,17/07/1973,1932,1979,12/12/72,7/17/73,0,3,6,0,2,M,NA,1932,NA,19792583,AFG-1973,A2.9-7747,700,AFG,Sardar Mohammad Daud Khan,17/07/1973,27/04/1978,18/07/1909,27/04/1978,7/17/73,4/27/78,1,3,6,1,3,M,7/18/09,1909,4/27/78,19782584,AFG-1978,A2.9-7750,700,AFG,Taraki,30/04/1978,27/03/1979,1917,1979,4/30/78,3/27/79,1,3,8,0,3,M,NA,1917,NA,19792585,AFG-1979-1,A2.9-7753,700,AFG,Amin,27/03/1979,27/12/1979,1/8/29,1979,3/27/79,12/27/79,1,3,7,0,3,M,8/1/29,1929,NA,19792586,AFG-1979-2,A2.9-7756,700,AFG,Karmal,27/12/1979,4/5/86,6/1/29,1/12/96,12/27/79,5/4/86,1,4,9,0,1,M,1/6/29,1929,12/1/96,19962587,AFG-1986,A2.9-7759,700,AFG,Najibullah,4/5/86,16/04/1992,6/8/47,27/09/1996,5/4/86,4/16/92,1,3,4,0,1,M,8/6/47,1947,9/27/96,19962588,AFG-1992-1,A2.9-7762,700,AFG,Mojadidi,28/04/1992,28/06/1992,1926,-777,4/28/92,6/28/92,1,1,0,0,-666,M,NA,1926,NA,-7772589,AFG-1992-2,A2.9-7765,700,AFG,Burhanuddin Rabbani,28/06/1992,27/09/1996,1939,-777,6/28/92,9/27/96,0,3,4,0,0,M,NA,1939,NA,-7772590,AFG-1996,A2.9-7768,700,AFG,Mullah Omar,27/09/1996,13/11/2001,1959,-777,9/27/96,11/13/01,1,3,3,0,0,M,NA,1959,NA,-7772591,AFG-2001,A2.9-7771,700,AFG,Hamid Karzai,22/12/2001,31/12/2004,24/12/1957,-777,12/22/01,12/31/04,2,-888,0,0,-888,M,12/24/57,1957,NA,-7772592,TKM-1990,A2.9-7774,701,TKM,Niyazov,27/10/1990,31/12/2004,19/02/1940,21/12/2006,10/27/90,12/31/04,0,-888,0,0,-888,M,2/19/40,1940,12/21/06,20062593,TAJ-1991-1,A2.9-7777,702,TAJ,Kadreddin Aslonov,31/08/1991,23/09/1991,1947,-777,8/31/91,9/23/91,0,1,0,0,0,M,NA,1947,NA,-7772594,TAJ-1991-2,A2.9-7780,702,TAJ,Nabiyev,23/09/1991,7/9/92,5/10/30,1993,9/23/91,9/7/92,1,3,4,0,0,M,10/5/30,1930,NA,19932595,TAJ-1992-1,A2.9-7783,702,TAJ,Iskandrov,7/9/92,20/11/1992,1951,-777,9/7/92,11/20/92,0,1,0,0,0,M,NA,1951,NA,-7772596,TAJ-1992-2,A2.9-7786,702,TAJ,Rakhmonov,20/11/1992,31/12/2004,1952,-777,11/20/92,12/31/04,1,-888,0,0,-888,M,NA,1952,NA,-7772597,KYR-1990,A2.9-7789,703,KYR,Akayev,27/10/1990,31/12/2004,10/11/44,-777,10/27/90,12/31/04,0,-888,0,0,-888,M,11/10/44,1944,NA,-7772598,UZB-1990,A2.9-7792,704,UZB,Karimov,24/03/1990,31/12/2004,30/01/1938,-777,3/24/90,12/31/04,0,-888,0,0,-888,M,1/30/38,1938,NA,-7772599,KZK-1990,A2.9-7795,705,KZK,Nazarbaev,24/04/1990,31/12/2004,6/7/40,-777,4/24/90,12/31/04,0,-888,0,0,-888,M,7/6/40,1940,NA,-7772600,CHN-1861,A2.9-7798,710,CHN,Tz'u Hsi,22/08/1861,15/11/1908,1835,15/11/1908,1861-08-22,11/15/08,0,2,0,0,-777,M,NA,1835,11/15/08,19082601,CHN-1908,A2.9-7801,710,CHN,Zaifeng,2/12/08,6/12/11,1882,1951,12/2/08,12/6/11,0,3,-999,0,0,M,NA,1882,NA,19512602,CHN-1911,A2.9-7804,710,CHN,Empress Dowager Jonyu,6/12/11,12/1/12,1868,1913,12/6/11,1/12/12,0,3,-999,0,0,F,NA,1868,NA,19132603,CHN-1912-1,A2.9-7807,710,CHN,Sun Yat-sen,12/1/12,15/02/1912,12/11/1866,1925,1/12/12,2/15/12,1,1,0,0,0,M,1866-11-12,1866,NA,19252604,CHN-1912-2,A2.9-7810,710,CHN,Yuan Shih-kai,15/02/1912,6/6/16,16/9/1859,1916,2/15/12,6/6/16,0,2,0,0,-777,M,1859-09-16,1859,NA,19162605,CHN-1916,A2.9-7813,710,CHN,Li Yuan-Hung,6/6/16,14/08/1917,1864,3/6/28,6/6/16,8/14/17,0,3,-999,0,0,M,NA,1864,6/3/28,19282606,CHN-1917,A2.9-7816,710,CHN,Feng Kuo-chang,14/08/1917,4/9/18,7/1/1859,1919,8/14/17,9/4/18,1,1,0,0,0,M,1859-01-07,1859,NA,19192607,CHN-1918,A2.9-7819,710,CHN,Hsu Shih-ch'ang,4/9/18,2/6/22,23/10/1855,1939,9/4/18,6/2/22,0,1,0,0,0,M,1855-10-23,1855,NA,19392608,CHN-1922,A2.9-7822,710,CHN,Li Yuan-Hung,11/6/22,14/06/1923,1864,3/6/28,6/11/22,6/14/23,0,3,6,1,1,M,NA,1864,6/3/28,19282609,CHN-1923,A2.9-7825,710,CHN,Tsao Kun,5/10/23,2/11/24,12/12/1862,1938,10/5/23,11/2/24,1,3,6,0,2,M,1862-12-12,1862,NA,19382610,CHN-1924,A2.9-7828,710,CHN,Tuan Chi-jui,24/11/1924,20/04/1926,6/3/1865,1936,11/24/24,4/20/26,1,3,6,0,0,M,1865-03-06,1865,NA,19362611,CHN-1926,A2.9-7831,710,CHN,Chang Tso-lin,21/04/1926,10/10/28,1873,1928,4/21/26,10/10/28,1,4,9,0,3,M,NA,1873,NA,19282612,CHN-1928,A2.9-7834,710,CHN,Chiang Kai-shek,10/10/28,14/12/1937,31/10/1886,5/4/75,10/10/28,12/14/37,1,4,9,0,0,M,1886-10-31,1886,4/5/75,19752613,CHN-1937,A2.9-7837,710,CHN,Wang Kemin,14/12/1937,30/03/1940,1873,1945,12/14/37,3/30/40,2,1,0,0,0,M,NA,1873,NA,19452614,CHN-1940,A2.9-7840,710,CHN,Wang Jingwei,30/03/1940,10/11/44,1883,10/11/44,3/30/40,11/10/44,0,2,0,0,-777,M,NA,1883,11/10/44,19442615,CHN-1944,A2.9-7843,710,CHN,Chen Gongbo,20/11/1944,1/8/45,1892,1946,11/20/44,8/1/45,0,3,3,0,1,M,NA,1892,NA,19462616,CHN-1946,A2.9-7846,710,CHN,Chiang Kai-shek,26/12/1946,21/01/1949,31/10/1886,5/4/75,12/26/46,1/21/49,1,3,4,1,1,M,1886-10-31,1886,4/5/75,19752617,CHN-1949,A2.9-7849,710,CHN,Mao Tse-Tung,1/10/49,9/9/76,26/12/1893,9/9/76,10/1/49,9/9/76,1,2,0,0,-777,M,1893-12-26,1893,9/9/76,19762618,CHN-1976,A2.9-7852,710,CHN,Hua Guofeng,7/10/76,10/9/80,16/2/1921,-777,10/7/76,9/10/80,0,1,0,0,0,M,2/16/21,1921,NA,-7772619,CHN-1980,A2.9-7855,710,CHN,Deng Xiaoping,10/9/80,19/02/1997,22/8/1904,19/02/1997,9/10/80,2/19/97,0,2,0,0,-777,M,8/22/04,1904,2/19/97,19972620,CHN-1997,A2.9-7858,710,CHN,Jiang Zemin,19/02/1997,15/03/2003,17/8/1926,-777,2/19/97,3/15/03,0,1,0,0,0,M,8/17/26,1926,NA,-7772621,CHN-2003,A2.9-7861,710,CHN,Hu Jintao,15/03/2003,31/12/2004,1942,-777,3/15/03,12/31/04,0,-888,0,0,-888,M,NA,1942,NA,-7772622,TBT-1875,A2.9-7864,711,TBT,Tatsak Rinpoche,25/04/1875,15/06/1886,-999,15/06/1886,1875-04-25,1886-06-15,0,2,0,0,-777,M,NA,NA,1886-06-15,18862623,TBT-1886,A2.9-7867,711,TBT,Demo Tulku Trinley Rabgyey,15/06/1886,08/01/1895,-999,08/01/1895,1886-06-15,1895-01-08,0,2,0,0,-777,M,NA,NA,1895-01-08,18952624,TBT-1895,A2.9-7870,711,TBT,13th Dalai Lama,08/01/1895,17/12/1933,26/6/1876,17/12/1933,1895-01-08,12/17/33,0,2,0,0,-777,M,1876-06-26,1876,12/17/33,19332625,TBT-1933,A2.9-7873,711,TBT,Radreng Hutukto,17/12/1933,30/06/1941,1911,1947,12/17/33,6/30/41,0,1,0,0,-666,M,NA,1911,NA,19472626,TBT-1941,A2.9-7876,711,TBT,Taktra Rimpoche,30/06/1941,17/11/1950,-999,-999,6/30/41,11/17/50,0,1,0,0,-666,M,NA,NA,NA,NA2627,TBT-1950,A2.9-7879,711,TBT,14th Dalai Lama,17/11/1950,23/05/1951,7/6/35,-777,11/17/50,5/23/51,0,4,9,0,1,M,6/7/35,1935,NA,-7772628,MON-1921-1,A2.9-7882,712,MON,Chagdarjav,13/03/1921,16/04/1921,1880,31/08/1922,3/13/21,4/16/21,2,1,0,0,0,M,NA,1880,8/31/22,19222629,MON-1921-2,A2.9-7885,712,MON,Dogsomyn Bodo,16/04/1921,7/1/22,1895,31/08/1922,4/16/21,1/7/22,0,1,0,0,3,M,NA,1895,8/31/22,19222630,MON-1922,A2.9-7888,712,MON,Sukhebaatur,7/1/22,23/02/1923,02/02/1893,23/02/1923,1/7/22,2/23/23,0,2,0,0,-777,M,1893-02-02,1893,2/23/23,19232631,MON-1923,A2.9-7891,712,MON,Danzin,23/02/1923,26/08/1924,1885,30/08/1924,2/23/23,8/26/24,0,3,8,0,3,M,NA,1885,8/30/24,19242632,MON-1924,A2.9-7894,712,MON,Elbek-Dorzhi Rinchino,26/08/1924,15/07/1925,16/05/1898,23/06/1938,8/26/24,7/15/25,0,4,111,0,1,M,1898-05-16,1898,6/23/38,19382633,MON-1925,A2.9-7897,712,MON,Dambadorji,15/07/1925,15/10/1928,1899,25/06/1934,7/15/25,10/15/28,0,1,0,0,1,M,NA,1899,6/25/34,19342634,MON-1928,A2.9-7900,712,MON,Gendun,15/10/1928,20/03/1936,1895,1937,10/15/28,3/20/36,0,1,0,0,1,M,NA,1895,NA,19372635,MON-1936,A2.9-7903,712,MON,Choibalsan,22/03/1936,26/01/1952,8/2/1895,26/01/1952,3/22/36,1/26/52,0,2,0,0,-777,M,1895-02-08,1895,1/26/52,19522636,MON-1952,A2.9-7906,712,MON,Tsedenbal,26/01/1952,23/08/1984,17/9/1916,1991,1/26/52,8/23/84,0,4,111,0,1,M,9/17/16,1916,NA,19912637,MON-1984,A2.9-7909,712,MON,Batmonh,23/08/1984,12/3/90,10/3/26,1997,8/23/84,3/12/90,0,1,0,0,0,M,3/10/26,1926,NA,19972638,MON-1990,A2.9-7912,712,MON,Ochirbat,12/3/90,20/06/1997,1942,-777,3/12/90,6/20/97,0,1,0,0,0,M,NA,1942,NA,-7772639,MON-1997,A2.9-7915,712,MON,Bagabandi,20/06/1997,31/12/2004,22/4/1950,-777,6/20/97,12/31/04,0,-888,0,0,-888,M,4/22/50,1950,NA,-7772640,TAW-1949,A2.9-7918,713,TAW,Li Tsung-jen,21/01/1949,28/02/1950,1890,13/01/1969,1/21/49,2/28/50,0,3,8,0,1,M,NA,1890,1/13/69,19692641,TAW-1950,A2.9-7921,713,TAW,Chiang Kai-shek,1/3/50,5/4/75,31/10/1886,5/4/75,3/1/50,4/5/75,0,2,0,0,-777,M,1886-10-31,1886,4/5/75,19752642,TAW-1975,A2.9-7924,713,TAW,Yen Chia-Kan,5/4/75,20/05/1978,23/11/1905,1993,4/5/75,5/20/78,0,2,0,0,-777,M,11/23/05,1905,NA,19932643,TAW-1978,A2.9-7927,713,TAW,Chiang Ching-Kuo,20/05/1978,13/01/1988,18/3/1910,1988,5/20/78,1/13/88,0,2,0,0,-777,M,3/18/10,1910,NA,19882644,TAW-1988,A2.9-7930,713,TAW,Lee Teng-Hui,13/01/1988,20/05/2000,15/1/1923,-777,1/13/88,5/20/00,0,1,0,0,0,M,1/15/23,1923,NA,-7772645,TAW-2000,A2.9-7933,713,TAW,Chen Shui-bian,21/05/2000,31/12/2004,1950,-777,5/21/00,12/31/04,0,-888,0,0,-888,M,NA,1950,NA,-7772646,KOR-1873,A2.9-7936,730,KOR,Yi Hyong,22/12/1873,20/07/1907,1852,1919,1873-12-22,7/20/07,0,4,-999,0,1,M,NA,1852,NA,19192647,KOR-1907,A2.9-7939,730,KOR,Yi Ch'ok,20/07/1907,29/08/1910,1874,1926,7/20/07,8/29/10,2,4,-999,0,0,M,NA,1874,NA,19262648,PRK-1948,A2.9-7942,731,PRK,Kim Il-Sung,9/9/48,8/7/94,15/4/1912,1994,9/9/48,7/8/94,0,2,0,0,-777,M,4/15/12,1912,NA,19942649,PRK-1994,A2.9-7945,731,PRK,Kim Jong-Il,8/7/94,31/12/2004,16/2/1942,-777,7/8/94,12/31/04,0,-888,0,0,-888,M,2/16/42,1942,NA,-7772650,ROK-1948,A2.9-7948,732,ROK,Rhee,15/08/1948,27/04/1960,26/4/1875,1965,8/15/48,4/27/60,0,3,2,0,1,M,1875-04-26,1875,NA,19652651,ROK-1960-1,A2.9-7951,732,ROK,Ho Chong,27/04/1960,12/8/60,1896,1988,4/27/60,8/12/60,0,1,0,0,0,M,NA,1896,NA,19882652,ROK-1960-2,A2.9-7954,732,ROK,Myun Chang,12/8/60,16/05/1961,28/08/1899,1966,8/12/60,5/16/61,0,3,6,0,2,M,1899-08-28,1899,NA,19662653,ROK-1961-1,A2.9-7957,732,ROK,Chang Do Yong,18/05/1961,3/7/61,1923,-777,5/18/61,7/3/61,1,3,16,0,2,M,NA,1923,NA,-7772654,ROK-1961-2,A2.9-7960,732,ROK,Hee Park,3/7/61,26/10/1979,30/9/1917,26/10/1979,7/3/61,10/26/79,1,3,8,0,3,M,9/30/17,1917,10/26/79,19792655,ROK-1979,A2.9-7963,732,ROK,Choi Kuy Hay,26/10/1979,16/08/1980,16/7/1919,2006,10/26/79,8/16/80,0,1,0,0,0,M,7/16/19,1919,NA,20062656,ROK-1980-1,A2.9-7966,732,ROK,Park Choong Hoon,16/08/1980,27/08/1980,19/01/1919,2001,8/16/80,8/27/80,0,1,0,0,0,M,1/19/19,1919,NA,20012657,ROK-1980-2,A2.9-7969,732,ROK,Chun Doo Hwan,27/08/1980,25/02/1988,18/1/1931,-777,8/27/80,2/25/88,0,1,0,0,0,M,1/18/31,1931,NA,-7772658,ROK-1988,A2.9-7972,732,ROK,Roh Tae Woo,25/02/1988,25/02/1993,4/12/32,-777,2/25/88,2/25/93,0,1,0,0,0,M,12/4/32,1932,NA,-7772659,ROK-1993,A2.9-7975,732,ROK,Kim Young Sam,25/02/1993,25/02/1998,20/12/1927,-777,2/25/93,2/25/98,0,1,0,0,0,M,12/20/27,1927,NA,-7772660,ROK-1998,A2.9-7978,732,ROK,Kim Dae Jung,25/02/1998,25/02/2003,3/12/25,-777,2/25/98,2/25/03,0,1,0,0,0,M,12/3/25,1925,NA,-7772661,ROK-2003,A2.9-7981,732,ROK,Roh Moo Hyun,25/02/2003,31/12/2004,1946,-777,2/25/03,12/31/04,0,-888,0,0,-888,M,NA,1946,NA,-7772662,JPN-1868,A2.9-7984,740,JPN,Mutsuhito (Emperor),03/01/1868,22/12/1885,3/11/1852,30/07/1912,1868-01-03,1885-12-22,0,1,0,0,0,M,1852-11-03,1852,7/30/12,19122663,JPN-1885,A2.9-7987,740,JPN,Ito,22/12/1885,30/04/1888,2/9/1842,1909,1885-12-22,1888-04-30,0,1,0,0,0,M,1842-09-02,1842,NA,19092664,JPN-1888,A2.9-7990,740,JPN,Kuroda,30/04/1888,24/12/1889,1840,1900,1888-04-30,1889-12-24,0,1,0,0,0,M,NA,1840,NA,19002665,JPN-1889,A2.9-7993,740,JPN,Yamagata,24/12/1889,06/05/1891,22/04/1838,1922,1889-12-24,1891-05-06,0,1,0,0,0,M,1838-04-22,1838,NA,19222666,JPN-1891,A2.9-7996,740,JPN,Matsukata,06/05/1891,08/08/1892,1835,1924,1891-05-06,1892-08-08,0,1,0,0,0,M,NA,1835,NA,19242667,JPN-1892,A2.9-7999,740,JPN,Ito,08/08/1892,18/09/1896,2/9/1842,1909,1892-08-08,1896-09-18,0,1,0,1,0,M,1842-09-02,1842,NA,19092668,JPN-1896,A2.9-8002,740,JPN,Matsukata,18/09/1896,14/04/1897,1835,1924,1896-09-18,1897-04-14,0,1,0,1,0,M,NA,1835,NA,19242669,JPN-1897-1,A2.9-8005,740,JPN,Kuroda,14/04/1897,08/06/1897,1840,1900,1897-04-14,1897-06-08,0,1,0,1,0,M,NA,1840,NA,19002670,JPN-1897-2,A2.9-8008,740,JPN,Matsukata,08/06/1897,12/01/1898,1835,1924,1897-06-08,1898-01-12,0,1,0,2,0,M,NA,1835,NA,19242671,JPN-1898-1,A2.9-8011,740,JPN,Ito,12/01/1898,30/06/1898,2/9/1842,1909,1898-01-12,1898-06-30,0,1,0,2,0,M,1842-09-02,1842,NA,19092672,JPN-1898-2,A2.9-8014,740,JPN,Okuma,30/06/1898,31/10/1898,1838,1922,1898-06-30,1898-10-31,0,1,0,0,0,M,NA,1838,NA,19222673,JPN-1898-3,A2.9-8017,740,JPN,Yamagata,07/11/1898,19/10/1900,22/04/1838,1922,1898-11-07,10/19/00,0,1,0,1,0,M,1838-04-22,1838,NA,19222674,JPN-1900,A2.9-8020,740,JPN,Ito,19/10/1900,10/5/01,2/9/1842,1909,10/19/00,5/10/01,0,1,0,3,0,M,1842-09-02,1842,NA,19092675,JPN-1901-1,A2.9-8023,740,JPN,Saionji,10/5/01,2/6/01,1849,1940,5/10/01,6/2/01,0,1,0,0,0,M,NA,1849,NA,19402676,JPN-1901-2,A2.9-8026,740,JPN,Katsura,2/6/01,7/1/06,28/11/1847,1913,6/2/01,1/7/06,0,1,0,0,0,M,1847-11-28,1847,NA,19132677,JPN-1906,A2.9-8029,740,JPN,Saionji,7/1/06,14/07/1908,1849,1940,1/7/06,7/14/08,0,1,0,1,0,M,NA,1849,NA,19402678,JPN-1908,A2.9-8032,740,JPN,Katsura,14/07/1908,30/08/1911,28/11/1847,1913,7/14/08,8/30/11,0,1,0,1,0,M,1847-11-28,1847,NA,19132679,JPN-1911,A2.9-8035,740,JPN,Saionji,30/08/1911,21/12/1912,1849,1940,8/30/11,12/21/12,0,1,0,2,0,M,NA,1849,NA,19402680,JPN-1912,A2.9-8038,740,JPN,Katsura,21/12/1912,20/02/1913,28/11/1847,10/10/13,12/21/12,2/20/13,0,1,0,2,0,M,1847-11-28,1847,10/10/13,19132681,JPN-1913,A2.9-8041,740,JPN,"Yamamoto, G.",20/02/1913,16/04/1914,1852,1933,2/20/13,4/16/14,0,1,0,0,0,M,NA,1852,NA,19332682,JPN-1914,A2.9-8044,740,JPN,Okuma,16/04/1914,9/10/16,1838,1922,4/16/14,10/9/16,0,1,0,1,0,M,NA,1838,NA,19222683,JPN-1916,A2.9-8047,740,JPN,Terauchi,9/10/16,29/09/1918,1852,1919,10/9/16,9/29/18,0,1,0,0,0,M,NA,1852,NA,19192684,JPN-1918,A2.9-8050,740,JPN,"Hara, T.",29/09/1918,4/11/21,9/2/1856,1921,9/29/18,11/4/21,0,3,11,0,3,M,1856-02-09,1856,NA,19212685,JPN-1921-1,A2.9-8053,740,JPN,Uchida,4/11/21,13/11/1921,1865,1936,11/4/21,11/13/21,0,1,0,0,0,M,NA,1865,NA,19362686,JPN-1921-2,A2.9-8056,740,JPN,"Takahashi, K.",13/11/1921,11/6/22,1854,1936,11/13/21,6/11/22,0,1,0,0,0,M,NA,1854,NA,19362687,JPN-1922,A2.9-8059,740,JPN,"Kato, Tomosaburo",11/6/22,24/08/1923,1859,1923,6/11/22,8/24/23,0,2,0,0,-777,M,NA,1859,NA,19232688,JPN-1923-1,A2.9-8062,740,JPN,Uchida,24/08/1923,12/9/23,1865,1936,8/24/23,9/12/23,0,1,0,1,0,M,NA,1865,NA,19362689,JPN-1923-2,A2.9-8065,740,JPN,"Yamamoto, G.",12/9/23,29/12/1923,1852,1933,9/12/23,12/29/23,0,1,0,1,0,M,NA,1852,NA,19332690,JPN-1923-3,A2.9-8068,740,JPN,Kiyoura,29/12/1923,11/6/24,1850,1942,12/29/23,6/11/24,0,1,0,0,0,M,NA,1850,NA,19422691,JPN-1924,A2.9-8071,740,JPN,"Kato, Takaaki",11/6/24,28/01/1926,3/1/1860,1926,6/11/24,1/28/26,0,2,0,0,-777,M,1860-01-03,1860,NA,19262692,JPN-1926,A2.9-8074,740,JPN,Wakatsuki,29/01/1926,17/04/1927,5/2/1866,1949,1/29/26,4/17/27,0,1,0,0,0,M,1866-02-05,1866,NA,19492693,JPN-1927,A2.9-8077,740,JPN,"Tanaka, G.",17/04/1927,2/7/29,1864,1929,4/17/27,7/2/29,0,1,0,0,0,M,NA,1864,NA,19292694,JPN-1929,A2.9-8080,740,JPN,Hamaguchi,2/7/29,14/11/1930,1870,25/08/1931,7/2/29,11/14/30,0,3,11,0,3,M,NA,1870,8/25/31,19312695,JPN-1930,A2.9-8083,740,JPN,Shidehara,14/11/1930,13/04/1931,11/8/1872,10/3/51,11/14/30,4/13/31,0,1,0,0,0,M,1872-08-11,1872,3/10/51,19512696,JPN-1931-1,A2.9-8086,740,JPN,Wakatsuki,13/04/1931,11/12/31,5/2/1866,1949,4/13/31,12/11/31,0,1,0,1,0,M,1866-02-05,1866,NA,19492697,JPN-1931-2,A2.9-8089,740,JPN,Inukai,13/12/1931,15/05/1932,1855,1932,12/13/31,5/15/32,0,3,4,0,3,M,NA,1855,NA,19322698,JPN-1932-1,A2.9-8092,740,JPN,"Takahashi, K.",16/05/1932,26/05/1932,1854,1936,5/16/32,5/26/32,0,1,0,1,0,M,NA,1854,NA,19362699,JPN-1932-2,A2.9-8095,740,JPN,"Saito, M.",26/05/1932,7/7/34,1858,1936,5/26/32,7/7/34,0,1,0,0,0,M,NA,1858,NA,19362700,JPN-1934,A2.9-8098,740,JPN,Okada,7/7/34,6/3/36,1868,1952,7/7/34,3/6/36,0,1,0,0,0,M,NA,1868,NA,19522701,JPN-1936,A2.9-8101,740,JPN,Hirota,9/3/36,23/01/1937,1878,1948,3/9/36,1/23/37,0,1,0,0,0,M,NA,1878,NA,19482702,JPN-1937-1,A2.9-8104,740,JPN,Hayashi,2/2/37,31/05/1937,1876,1943,2/2/37,5/31/37,0,1,0,0,0,M,NA,1876,NA,19432703,JPN-1937-2,A2.9-8107,740,JPN,"Konoe, F.",31/05/1937,5/1/39,1891,1945,5/31/37,1/5/39,0,1,0,0,0,M,NA,1891,NA,19452704,JPN-1939-1,A2.9-8110,740,JPN,Hiranuma,5/1/39,29/08/1939,1867,1952,1/5/39,8/29/39,0,1,0,0,0,M,NA,1867,NA,19522705,JPN-1939-2,A2.9-8113,740,JPN,"Abe, M.",30/08/1939,14/01/1940,1875,1953,8/30/39,1/14/40,0,1,0,0,0,M,NA,1875,NA,19532706,JPN-1940-1,A2.9-8116,740,JPN,Yonai,14/01/1940,16/07/1940,30/12/1873,1948,1/14/40,7/16/40,0,1,0,0,0,M,1873-12-30,1873,NA,19482707,JPN-1940-2,A2.9-8119,740,JPN,"Konoe, F.",16/07/1940,17/10/1941,1891,1945,7/16/40,10/17/41,0,1,0,1,0,M,NA,1891,NA,19452708,JPN-1941,A2.9-8122,740,JPN,Tojo,17/10/1941,18/07/1944,20/12/1883,1948,10/17/41,7/18/44,0,1,0,0,0,M,1883-12-20,1883,NA,19482709,JPN-1944,A2.9-8125,740,JPN,Koiso,18/07/1944,5/4/45,1880,1950,7/18/44,4/5/45,0,1,0,0,2,M,NA,1880,NA,19502710,JPN-1945-1,A2.9-8128,740,JPN,"Suzuki, Kantaro",7/4/45,17/08/1945,24/12/1867,1948,4/7/45,8/17/45,0,4,9,0,2,M,1867-12-24,1867,NA,19482711,JPN-1945-2,A2.9-8131,740,JPN,Douglas MacArthur,2/9/45,11/4/51,1880,-999,9/2/45,4/11/51,2,1,0,0,0,M,NA,1880,NA,NA2712,JPN-1951,A2.9-8134,740,JPN,Matthew Bunker Ridgway,11/4/51,28/04/1952,1895,-999,4/11/51,4/28/52,0,1,0,0,0,M,NA,1895,NA,NA2713,JPN-1952,A2.9-8137,740,JPN,"Yoshida, Shigeru",29/04/1952,7/12/54,22/9/1878,1967,4/29/52,12/7/54,0,1,0,0,0,M,1878-09-22,1878,NA,19672714,JPN-1954,A2.9-8140,740,JPN,Hatoyama,9/12/54,20/12/1956,1/1/1883,1959,12/9/54,12/20/56,0,1,0,0,0,M,1883-01-01,1883,NA,19592715,JPN-1956,A2.9-8143,740,JPN,Ishibashi,23/12/1956,23/02/1957,25/9/1884,1973,12/23/56,2/23/57,0,2.1,0,0,0,M,1884-09-25,1884,NA,19732716,JPN-1957,A2.9-8146,740,JPN,Kishi,25/02/1957,18/07/1960,13/11/1896,1987,2/25/57,7/18/60,0,1,0,0,0,M,1896-11-13,1896,NA,19872717,JPN-1960,A2.9-8149,740,JPN,Ikeda,18/07/1960,25/10/1964,3/12/1899,1965,7/18/60,10/25/64,0,2.1,0,0,-777,M,1899-12-03,1899,NA,19652718,JPN-1964,A2.9-8152,740,JPN,Sato,9/11/64,5/7/72,27/3/1901,1975,11/9/64,7/5/72,0,1,0,0,0,M,3/27/01,1901,NA,19752719,JPN-1972,A2.9-8155,740,JPN,Tanaka,6/7/72,9/12/74,4/5/18,1993,7/6/72,12/9/74,0,1,0,0,2,M,5/4/18,1918,NA,19932720,JPN-1974,A2.9-8158,740,JPN,Miki,9/12/74,24/12/1976,17/3/1907,1988,12/9/74,12/24/76,0,1,0,0,0,M,3/17/07,1907,NA,19882721,JPN-1976,A2.9-8161,740,JPN,Fukuda,24/12/1976,7/12/78,14/1/1905,1995,12/24/76,12/7/78,0,1,0,0,0,M,1/14/05,1905,NA,19952722,JPN-1978,A2.9-8164,740,JPN,Ohira,7/12/78,12/6/80,12/3/10,1980,12/7/78,6/12/80,0,2,0,0,-777,M,3/12/10,1910,NA,19802723,JPN-1980-1,A2.9-8167,740,JPN,Ito,12/6/80,17/07/1980,15/12/1913,1994,6/12/80,7/17/80,0,1,0,0,0,M,12/15/13,1913,NA,19942724,JPN-1980-2,A2.9-8170,740,JPN,Suzuki,17/07/1980,26/11/1982,11/1/11,2004,7/17/80,11/26/82,0,1,0,0,0,M,1/11/11,1911,NA,20042725,JPN-1982,A2.9-8173,740,JPN,Nakasone,26/11/1982,6/11/87,27/5/1918,-777,11/26/82,11/6/87,0,1,0,0,0,M,5/27/18,1918,NA,-7772726,JPN-1987,A2.9-8176,740,JPN,Takeshita,6/11/87,2/6/89,26/2/1924,2000,11/6/87,6/2/89,0,1,0,0,0,M,2/26/24,1924,NA,20002727,JPN-1989-1,A2.9-8179,740,JPN,Uno,2/6/89,9/8/89,27/8/1922,1998,6/2/89,8/9/89,0,1,0,0,0,M,8/27/22,1922,NA,19982728,JPN-1989-2,A2.9-8182,740,JPN,Kaifu,9/8/89,6/11/91,2/1/31,-777,8/9/89,11/6/91,0,1,0,0,0,M,1/2/31,1931,NA,-7772729,JPN-1991,A2.9-8185,740,JPN,Miyazawa,6/11/91,9/8/93,8/10/19,2007,11/6/91,8/9/93,0,1,0,0,0,M,10/8/19,1919,NA,20072730,JPN-1993,A2.9-8188,740,JPN,Hosokawa,9/8/93,25/04/1994,14/1/1938,-777,8/9/93,4/25/94,0,1,0,0,0,M,1/14/38,1938,NA,-7772731,JPN-1994-1,A2.9-8191,740,JPN,Hata,25/04/1994,29/06/1994,24/8/1935,-777,4/25/94,6/29/94,0,1,0,0,0,M,8/24/35,1935,NA,-7772732,JPN-1994-2,A2.9-8194,740,JPN,Murayama,29/06/1994,11/1/96,1924,-777,6/29/94,1/11/96,0,1,0,0,0,M,NA,1924,NA,-7772733,JPN-1996,A2.9-8197,740,JPN,Hashimoto,11/1/96,30/07/1998,29/7/1937,2006,1/11/96,7/30/98,0,1,0,0,0,M,7/29/37,1937,NA,20062734,JPN-1998,A2.9-8200,740,JPN,Obuchi,30/07/1998,2/4/00,23/06/1937,2000,7/30/98,4/2/00,0,2.1,0,0,-777,M,6/23/37,1937,NA,20002735,JPN-2000-1,A2.9-8203,740,JPN,Mikio Aoki,2/4/00,5/4/00,1934,-777,4/2/00,4/5/00,0,1,0,0,0,M,NA,1934,NA,-7772736,JPN-2000-2,A2.9-8206,740,JPN,Yoshiro Mori,5/4/00,26/04/2001,1937,-777,4/5/00,4/26/01,0,1,0,0,0,M,NA,1937,NA,-7772737,JPN-2001,A2.9-8209,740,JPN,Junichiro Koizumi,26/04/2001,31/12/2004,8/1/42,-777,4/26/01,12/31/04,0,-888,0,0,-888,M,1/8/42,1942,NA,-7772738,IND-1947,A2.9-8212,750,IND,Nehru,15/08/1947,27/05/1964,14/11/1889,27/05/1964,8/15/47,5/27/64,0,2,0,0,-777,M,1889-11-14,1889,5/27/64,19642739,IND-1964-1,A2.9-8215,750,IND,Nanda,27/05/1964,9/6/64,4/7/1898,1998,5/27/64,6/9/64,0,1,0,0,0,M,1898-07-04,1898,NA,19982740,IND-1964-2,A2.9-8218,750,IND,Shastri,9/6/64,11/1/66,2/10/04,1966,6/9/64,1/11/66,0,2,0,0,-777,M,10/2/04,1904,NA,19662741,IND-1966-1,A2.9-8221,750,IND,Nanda,11/1/66,24/01/1966,4/7/1898,1998,1/11/66,1/24/66,0,1,0,1,0,M,1898-07-04,1898,NA,19982742,IND-1966-2,A2.9-8224,750,IND,"Gandhi, I.",24/01/1966,22/03/1977,19/11/1917,31/10/1984,1/24/66,3/22/77,0,1,0,0,2,F,11/19/17,1917,10/31/84,19842743,IND-1977,A2.9-8227,750,IND,Desai,24/03/1977,15/06/1979,29/2/1896,10/3/95,3/24/77,6/15/79,0,1,0,0,0,M,1896-02-29,1896,3/10/95,19952744,IND-1979,A2.9-8230,750,IND,Charan Singh,28/07/1979,14/01/1980,23/12/1902,1987,7/28/79,1/14/80,0,1,0,0,0,M,12/23/02,1902,NA,19872745,IND-1980,A2.9-8233,750,IND,"Gandhi, I.",14/01/1980,31/10/1984,19/11/1917,31/10/1984,1/14/80,10/31/84,0,3,111,1,3,F,11/19/17,1917,10/31/84,19842746,IND-1984,A2.9-8236,750,IND,"Gandhi, R.",31/10/1984,2/12/89,20/8/1944,21/05/1991,10/31/84,12/2/89,0,1,0,0,0,M,8/20/44,1944,5/21/91,19912747,IND-1989,A2.9-8239,750,IND,Pratap Singh,2/12/89,10/11/90,25/6/1931,-777,12/2/89,11/10/90,0,1,0,0,0,M,6/25/31,1931,NA,-7772748,IND-1990,A2.9-8242,750,IND,Shekhar,10/11/90,21/06/1991,17/4/1927,2007,11/10/90,6/21/91,0,1,0,0,0,M,4/17/27,1927,NA,20072749,IND-1991,A2.9-8245,750,IND,Rao,21/06/1991,16/05/1996,28/6/1921,23/12/2004,6/21/91,5/16/96,0,1,0,0,0,M,6/28/21,1921,12/23/04,20042750,IND-1996-1,A2.9-8248,750,IND,Vajpayee,16/05/1996,1/6/96,1924,-777,5/16/96,6/1/96,0,1,0,0,0,M,NA,1924,NA,-7772751,IND-1996-2,A2.9-8251,750,IND,Gowda,1/6/96,21/04/1997,18/5/1933,-777,6/1/96,4/21/97,0,1,0,0,0,M,5/18/33,1933,NA,-7772752,IND-1997,A2.9-8254,750,IND,Gujral,21/04/1997,19/03/1998,4/12/19,-777,4/21/97,3/19/98,0,1,0,0,0,M,12/4/19,1919,NA,-7772753,IND-1998,A2.9-8257,750,IND,Vajpayee,19/03/1998,22/05/2004,1924,-777,3/19/98,5/22/04,0,1,0,1,0,M,NA,1924,NA,-7772754,IND-2004,A2.9-8260,750,IND,Manmohan Singh,22/05/2004,31/12/2004,1932,-777,5/22/04,12/31/04,0,-888,0,0,-888,M,NA,1932,NA,-7772755,BHU-1926,A2.9-8263,760,BHU,"Wangchuk, Jigme",21/08/1926,24/03/1952,1902,24/03/1952,8/21/26,3/24/52,0,2,0,0,-777,M,NA,1902,3/24/52,19522756,BHU-1952,A2.9-8266,760,BHU,"Wangchuk, Jigme Dorji",24/03/1952,21/07/1972,1929,21/07/1972,3/24/52,7/21/72,0,2,0,0,-777,M,NA,1929,7/21/72,19722757,BHU-1972,A2.9-8269,760,BHU,"Wangchuck, Jigme Singye",21/07/1972,20/07/1998,11/11/55,-777,7/21/72,7/20/98,0,1,0,0,0,M,11/11/55,1955,NA,-7772758,BHU-1998,A2.9-8272,760,BHU,Lyonpo Jigme Thinley,20/07/1998,9/7/99,1952,-777,7/20/98,7/9/99,0,1,0,0,0,M,NA,1952,NA,-7772759,BHU-1999,A2.9-8275,760,BHU,Lyonpo Sangay Ngedup,9/7/99,20/07/2000,1953,-777,7/9/99,7/20/00,0,1,0,0,0,M,NA,1953,NA,-7772760,BHU-2000,A2.9-8278,760,BHU,Lyonpo Yeshey Zimba,20/07/2000,8/8/01,1952,-777,7/20/00,8/8/01,0,1,0,0,0,M,NA,1952,NA,-7772761,BHU-2001,A2.9-8281,760,BHU,Lyonpo Khandu Wangchuk,8/8/01,14/08/2002,1950,-777,8/8/01,8/14/02,0,1,0,0,0,M,NA,1950,NA,-7772762,BHU-2002,A2.9-8284,760,BHU,Lyonpo Kinzang Dorji,14/08/2002,30/08/2003,1951,-777,8/14/02,8/30/03,0,1,0,0,0,M,NA,1951,NA,-7772763,BHU-2003,A2.9-8287,760,BHU,Lyonpo Jigme Thinley,30/08/2003,18/08/2004,1952,-777,8/30/03,8/18/04,0,1,0,1,-999,M,NA,1952,NA,-7772764,BHU-2004,A2.9-8290,760,BHU,Lyonpo Yeshey Zimba,18/08/2004,31/12/2004,1952,-777,8/18/04,12/31/04,0,-888,0,1,-888,M,NA,1952,NA,-7772765,PAK-1947,A2.9-8293,770,PAK,Jinnah,15/08/1947,11/9/48,25/12/1876,11/9/48,8/15/47,9/11/48,0,2,0,0,-777,M,1876-12-25,1876,9/11/48,19482766,PAK-1948,A2.9-8296,770,PAK,L. Khan,11/9/48,16/10/1951,1/10/1895,16/10/1951,9/11/48,10/16/51,0,3,11,0,3,M,1895-10-01,1895,10/16/51,19512767,PAK-1951,A2.9-8299,770,PAK,Nazimuddin,17/10/1951,17/04/1953,19/7/1894,1964,10/17/51,4/17/53,0,1,0,0,0,M,1894-07-19,1894,NA,19642768,PAK-1953,A2.9-8302,770,PAK,Mohammed Ali,17/04/1953,8/8/55,19/10/1909,1963,4/17/53,8/8/55,0,1,0,0,0,M,10/19/09,1909,NA,19632769,PAK-1955,A2.9-8305,770,PAK,Chaudhri M. Ali,11/8/55,12/9/56,15/7/1905,1/12/80,8/11/55,9/12/56,0,1,0,0,0,M,7/15/05,1905,12/1/80,19802770,PAK-1956,A2.9-8308,770,PAK,Shahid Suhrawardy,12/9/56,17/10/1957,8/9/1893,1963,9/12/56,10/17/57,0,1,0,0,0,M,1893-09-08,1893,NA,19632771,PAK-1957-1,A2.9-8311,770,PAK,Chundrigar,17/10/1957,16/12/1957,1897,1960,10/17/57,12/16/57,0,1,0,0,0,M,NA,1897,NA,19602772,PAK-1957-2,A2.9-8314,770,PAK,Khan Noon,16/12/1957,7/10/58,7/5/1893,1970,12/16/57,10/7/58,0,3,8,0,0,M,1893-05-07,1893,NA,19702773,PAK-1958,A2.9-8317,770,PAK,Ayub Khan,7/10/58,25/03/1969,14/5/1907,19/04/1974,10/7/58,3/25/69,1,3,2,0,0,M,5/14/07,1907,4/19/74,19742774,PAK-1969,A2.9-8320,770,PAK,Yahya Khan,31/03/1969,20/12/1971,4/2/17,1980,3/31/69,12/20/71,1,3,6,0,2,M,2/4/17,1917,NA,19802775,PAK-1971,A2.9-8323,770,PAK,Bhutto,20/12/1971,5/7/77,5/1/28,4/4/79,12/20/71,7/5/77,0,3,6,0,3,M,1/5/28,1928,4/4/79,19792776,PAK-1977,A2.9-8326,770,PAK,Zia,5/7/77,17/08/1988,12/8/24,17/08/1988,7/5/77,8/17/88,1,3,111,0,3,M,8/12/24,1924,8/17/88,19882777,PAK-1988-1,A2.9-8329,770,PAK,Ishaq Khan,17/08/1988,2/12/88,1915,28/10/2006,8/17/88,12/2/88,0,1,0,0,0,M,NA,1915,10/28/06,20062778,PAK-1988-2,A2.9-8332,770,PAK,Bhutto Benazir,2/12/88,6/8/90,21/6/1953,-777,12/2/88,8/6/90,0,1,0,0,0,F,6/21/53,1953,NA,-7772779,PAK-1990-1,A2.9-8335,770,PAK,Jatoi,6/8/90,6/11/90,1931,-777,8/6/90,11/6/90,0,1,0,0,0,M,NA,1931,NA,-7772780,PAK-1990-2,A2.9-8338,770,PAK,Sharif,6/11/90,18/04/1993,25/12/1949,-777,11/6/90,4/18/93,0,3,8,0,0,M,12/25/49,1949,NA,-7772781,PAK-1993-1,A2.9-8341,770,PAK,Mazari,18/04/1993,26/05/1993,1922,-777,4/18/93,5/26/93,1,1,0,0,0,M,NA,1922,NA,-7772782,PAK-1993-2,A2.9-8344,770,PAK,Sharif,26/05/1993,18/07/1993,25/12/1949,-777,5/26/93,7/18/93,0,1,0,1,0,M,12/25/49,1949,NA,-7772783,PAK-1993-3,A2.9-8347,770,PAK,Qureshi,19/07/1993,19/10/1993,1930,-777,7/19/93,10/19/93,0,1,0,0,0,M,NA,1930,NA,-7772784,PAK-1993-4,A2.9-8350,770,PAK,Bhutto Benazir,19/10/1993,5/11/96,21/6/1953,-777,10/19/93,11/5/96,0,3,8,1,0,F,6/21/53,1953,NA,-7772785,PAK-1996,A2.9-8353,770,PAK,Khalid,5/11/96,17/02/1997,1916,2003,11/5/96,2/17/97,1,1,0,0,0,M,NA,1916,NA,20032786,PAK-1997,A2.9-8356,770,PAK,Sharif,17/02/1997,12/10/99,25/12/1949,-777,2/17/97,10/12/99,0,3,6,2,2,M,12/25/49,1949,NA,-7772787,PAK-1999,A2.9-8359,770,PAK,Musharraf,14/10/1999,31/12/2004,1943,-777,10/14/99,12/31/04,1,-888,0,0,-888,M,NA,1943,NA,-7772788,BNG-1971,A2.9-8362,771,BNG,Syed Nazrul Islam,11/4/71,10/1/72,1925,1975,4/11/71,1/10/72,0,1,0,0,0,M,NA,1925,NA,19752789,BNG-1972,A2.9-8365,771,BNG,Sheikh Mujib Rahman,13/01/1972,15/08/1975,17/3/1920,15/08/1975,1/13/72,8/15/75,0,3,6,0,3,M,3/17/20,1920,8/15/75,19752790,BNG-1975-1,A2.9-8368,771,BNG,Moshtaque Ahmed,15/08/1975,6/11/75,1918,1996,8/15/75,11/6/75,1,3,6,0,2,M,NA,1918,NA,19962791,BNG-1975-2,A2.9-8371,771,BNG,Ziaur Rahman,6/11/75,30/05/1981,19/1/1936,30/05/1981,11/6/75,5/30/81,1,3,6,0,3,M,1/19/36,1936,5/30/81,19812792,BNG-1981,A2.9-8374,771,BNG,Sattar,30/05/1981,20/03/1982,1906,1985,5/30/81,3/20/82,0,3,6,0,0,M,NA,1906,NA,19852793,BNG-1982,A2.9-8377,771,BNG,Ershad,27/03/1982,6/12/90,1/2/30,-777,3/27/82,12/6/90,1,3,2,0,2,M,2/1/30,1930,NA,-7772794,BNG-1990,A2.9-8380,771,BNG,Ahmed,6/12/90,20/03/1991,1/2/30,-777,12/6/90,3/20/91,1,1,0,0,0,M,2/1/30,1930,NA,-7772795,BNG-1991,A2.9-8383,771,BNG,Khaleda Zia,20/03/1991,30/03/1996,1945,-777,3/20/91,3/30/96,0,1,0,0,0,F,NA,1945,NA,-7772796,BNG-1996-1,A2.9-8386,771,BNG,Mohammad Habibur Rahman,30/03/1996,23/06/1996,1930,-777,3/30/96,6/23/96,0,1,0,0,0,M,NA,1930,NA,-7772797,BNG-1996-2,A2.9-8389,771,BNG,Hasina Wazed,23/06/1996,15/07/2001,1947,-777,6/23/96,7/15/01,0,1,0,0,0,F,NA,1947,NA,-7772798,BNG-2001-1,A2.9-8392,771,BNG,Latifur Rahman,15/07/2001,10/10/01,1936,-777,7/15/01,10/10/01,0,1,0,0,0,M,NA,1936,NA,-7772799,BNG-2001-2,A2.9-8395,771,BNG,Khaleda Zia,10/10/01,31/12/2004,1945,-777,10/10/01,12/31/04,0,-888,0,0,-888,F,NA,1945,NA,-7772800,MYA-1853,A2.9-8398,775,MYA,Mindon Min,18/02/1853,01/10/1878,08/07/1808,01/10/1878,1853-02-18,1878-10-01,1,2,0,0,-777,M,1808-07-08,1808,1878-10-01,18782801,MYA-1878,A2.9-8401,775,MYA,Thibaw Min,01/10/1878,29/11/1885,1859,1916,1878-10-01,1885-11-29,0,4,-999,0,1,M,NA,1859,NA,19162802,MYA-1885,A2.9-8404,775,MYA,Taingda Mingyi,29/11/1885,01/01/1886,-999,-999,1885-11-29,1886-01-01,0,4,-999,0,1,M,NA,NA,NA,NA2803,MYA-1948,A2.9-8407,775,MYA,U Nu,4/1/48,12/6/56,25/5/1907,14/02/1995,1/4/48,6/12/56,0,1,0,0,0,M,5/25/07,1907,2/14/95,19952804,MYA-1956,A2.9-8410,775,MYA,U Ba Swe,12/6/56,1/3/57,19/4/1915,1987,6/12/56,3/1/57,0,1,0,0,0,M,4/19/15,1915,NA,19872805,MYA-1957,A2.9-8413,775,MYA,U Nu,1/3/57,29/10/1958,25/5/1907,14/02/1995,3/1/57,10/29/58,0,1,0,1,0,M,5/25/07,1907,2/14/95,19952806,MYA-1958,A2.9-8416,775,MYA,Ne Win,29/10/1958,15/03/1960,24/5/1911,5/12/02,10/29/58,3/15/60,0,1,0,0,0,M,5/24/11,1911,12/5/02,20022807,MYA-1960,A2.9-8419,775,MYA,U Nu,4/4/60,2/3/62,25/5/1907,14/02/1995,4/4/60,3/2/62,0,3,6,2,2,M,5/25/07,1907,2/14/95,19952808,MYA-1962,A2.9-8422,775,MYA,Ne Win,2/3/62,25/07/1988,24/5/1911,5/12/02,3/2/62,7/25/88,1,1,0,1,0,M,5/24/11,1911,12/5/02,20022809,MYA-1988-1,A2.9-8425,775,MYA,Sein Lwin,25/07/1988,12/8/88,1924,-777,7/25/88,8/12/88,1,1,0,0,0,M,NA,1924,NA,-7772810,MYA-1988-2,A2.9-8428,775,MYA,Maung Maung,19/08/1988,18/09/1988,11/1/25,2/7/94,8/19/88,9/18/88,0,3,6,0,0,M,1/11/25,1925,7/2/94,19942811,MYA-1988-3,A2.9-8431,775,MYA,Saw Maung,18/09/1988,23/04/1992,5/12/28,1997,9/18/88,4/23/92,1,2.1,0,0,0,M,12/5/28,1928,NA,19972812,MYA-1992,A2.9-8434,775,MYA,Than Shwe,23/04/1992,31/12/2004,1933,-777,4/23/92,12/31/04,0,-888,0,0,-888,M,NA,1933,NA,-7772813,SRI-1948,A2.9-8437,780,SRI,"Senanayake, Don",4/2/48,22/03/1952,20/10/1884,1952,2/4/48,3/22/52,0,2,0,0,-777,M,1884-10-20,1884,NA,19522814,SRI-1952,A2.9-8440,780,SRI,"Senanayake, Dudley",26/03/1952,12/10/53,19/6/1911,1973,3/26/52,10/12/53,0,2.1,0,0,0,M,6/19/11,1911,NA,19732815,SRI-1953,A2.9-8443,780,SRI,Kotelawala,12/10/53,11/4/56,1897,1980,10/12/53,4/11/56,0,1,0,0,1,M,NA,1897,NA,19802816,SRI-1956,A2.9-8446,780,SRI,"Bandaranaike, S.W.R.D.",12/4/56,26/09/1959,8/1/1899,26/09/1959,4/12/56,9/26/59,0,3,11,0,3,M,1899-01-08,1899,9/26/59,19592817,SRI-1959,A2.9-8449,780,SRI,Dahanayake,26/09/1959,21/03/1960,22/10/1902,1997,9/26/59,3/21/60,0,1,0,0,0,M,10/22/02,1902,NA,19972818,SRI-1960-1,A2.9-8452,780,SRI,"Senanayake, Dudley",21/03/1960,22/07/1960,19/6/1911,1973,3/21/60,7/22/60,0,1,0,1,0,M,6/19/11,1911,NA,19732819,SRI-1960-2,A2.9-8455,780,SRI,"Bandaranaike, S",22/07/1960,25/03/1965,17/4/1916,10/10/00,7/22/60,3/25/65,0,1,0,0,0,F,4/17/16,1916,10/10/00,20002820,SRI-1965,A2.9-8458,780,SRI,"Senanayake, Dudley",25/03/1965,28/05/1970,19/6/1911,1973,3/25/65,5/28/70,0,1,0,2,0,M,6/19/11,1911,NA,19732821,SRI-1970,A2.9-8461,780,SRI,"Bandaranaike, S",31/05/1970,23/01/1977,17/4/1916,10/10/00,5/31/70,1/23/77,0,1,0,1,0,F,4/17/16,1916,10/10/00,20002822,SRI-1977,A2.9-8464,780,SRI,Jayewardene,23/01/1977,2/1/89,17/9/1906,1/11/96,1/23/77,1/2/89,0,1,0,0,0,M,9/17/06,1906,11/1/96,19962823,SRI-1989,A2.9-8467,780,SRI,Premadasa,2/1/89,1/5/93,23/6/1924,1/5/93,1/2/89,5/1/93,0,3,111,0,3,M,6/23/24,1924,5/1/93,19932824,SRI-1993,A2.9-8470,780,SRI,Wijetunge,1/5/93,12/11/94,15/2/1922,-777,5/1/93,11/12/94,0,1,0,0,0,M,2/15/22,1922,NA,-7772825,SRI-1994,A2.9-8473,780,SRI,Kumaratunga,12/11/94,31/12/2004,29/6/1945,-777,11/12/94,12/31/04,0,-888,0,0,-888,F,6/29/45,1945,NA,-7772826,MAD-1953,A2.9-8476,781,MAD,Ali Didi,2/9/53,12/12/57,1889,1975,9/2/53,12/12/57,0,3,2,0,0,M,NA,1889,NA,19752827,MAD-1957,A2.9-8479,781,MAD,Nasir,12/12/57,11/11/78,2/9/26,-777,12/12/57,11/11/78,0,2.1,0,0,1,M,9/2/26,1926,NA,-7772828,MAD-1978,A2.9-8482,781,MAD,Gayoom,11/11/78,31/12/2004,29/12/1937,-777,11/11/78,12/31/04,0,-888,0,0,-888,M,12/29/37,1937,NA,-7772829,NEP-1846,A2.9-8485,790,NEP,Jang Bahadur Kunwar,17/09/1846,25/02/1877,18/6/1817,25/02/1877,1846-09-17,1877-02-25,0,2,0,0,-777,M,1817-06-18,1817,1877-02-25,18772830,NEP-1877,A2.9-8488,790,NEP,Rana Udip Singh,27/02/1877,21/11/1885,1825,1885,1877-02-27,1885-11-21,0,3,-999,0,3,M,NA,1825,NA,18852831,NEP-1885,A2.9-8491,790,NEP,Bira Shamsher Jang Bahadur Rana,23/11/1885,5/3/01,1852,5/3/01,1885-11-23,3/5/01,0,2,0,0,-777,M,NA,1852,3/5/01,19012832,NEP-1901-1,A2.9-8494,790,NEP,Dev Shumshere Jung Bahadur Rana,15/03/1901,26/06/1901,1862,1914,3/15/01,6/26/01,0,3,-999,0,1,M,NA,1862,NA,19142833,NEP-1901-2,A2.9-8497,790,NEP,Chandra Rana,26/06/1901,22/06/1929,1863,22/06/1929,6/26/01,6/22/29,1,2,0,0,-777,M,NA,1863,6/22/29,19292834,NEP-1929,A2.9-8500,790,NEP,Bhim Rana,22/06/1929,1/9/32,1869,1/9/32,6/22/29,9/1/32,0,2,0,0,-777,M,NA,1869,9/1/32,19322835,NEP-1932,A2.9-8503,790,NEP,Juddha Rana,1/9/32,28/11/1945,1875,1952,9/1/32,11/28/45,0,1,0,0,0,M,NA,1875,NA,19522836,NEP-1945,A2.9-8506,790,NEP,Padma Rana,28/11/1945,9/2/48,1882,9/2/48,11/28/45,2/9/48,0,2,0,0,-777,M,NA,1882,2/9/48,19482837,NEP-1948,A2.9-8509,790,NEP,Mohan Rana,9/2/48,18/02/1951,23/12/1885,1967,2/9/48,2/18/51,0,3,8,0,1,M,1885-12-23,1885,NA,19672838,NEP-1951,A2.9-8512,790,NEP,Tribhuvan,18/02/1951,13/03/1955,1906,13/03/1955,2/18/51,3/13/55,1,2,0,0,-777,M,NA,1906,3/13/55,19552839,NEP-1955,A2.9-8515,790,NEP,Mahendra,14/03/1955,31/01/1972,11/6/20,31/01/1972,3/14/55,1/31/72,0,2,0,0,-777,M,6/11/20,1920,1/31/72,19722840,NEP-1972,A2.9-8518,790,NEP,Birendra,31/01/1972,9/11/90,28/12/1946,1/6/01,1/31/72,11/9/90,0,1,0,0,0,M,12/28/46,1946,6/1/01,20012841,NEP-1990,A2.9-8521,790,NEP,Krishna Prasad Bhatterai,9/11/90,26/05/1991,1924,-777,11/9/90,5/26/91,0,1,0,0,0,M,NA,1924,NA,-7772842,NEP-1991,A2.9-8524,790,NEP,Girija Prasad Koirala,26/05/1991,30/11/1994,1925,-777,5/26/91,11/30/94,0,1,0,0,0,M,NA,1925,NA,-7772843,NEP-1994,A2.9-8527,790,NEP,Man Mohan Adhilari,30/11/1994,12/9/95,1920,1999,11/30/94,9/12/95,0,1,0,0,0,M,NA,1920,NA,19992844,NEP-1995,A2.9-8530,790,NEP,Sher Bahadur Deuba,12/9/95,12/3/97,1946,-777,9/12/95,3/12/97,0,1,0,0,0,M,NA,1946,NA,-7772845,NEP-1997-1,A2.9-8533,790,NEP,Lokendra Bahadur Chand,12/3/97,7/10/97,1940,-777,3/12/97,10/7/97,0,1,0,0,0,M,NA,1940,NA,-7772846,NEP-1997-2,A2.9-8536,790,NEP,Surya  Bahadur Thapa,7/10/97,15/04/1998,1928,-777,10/7/97,4/15/98,0,1,0,0,0,M,NA,1928,NA,-7772847,NEP-1998,A2.9-8539,790,NEP,Girija Prasad Koirala,15/04/1998,31/05/1999,1925,-777,4/15/98,5/31/99,0,1,0,1,0,M,NA,1925,NA,-7772848,NEP-1999,A2.9-8542,790,NEP,Krishna Prasad Bhatterai,31/05/1999,22/03/2000,1924,-777,5/31/99,3/22/00,0,1,0,1,0,M,NA,1924,NA,-7772849,NEP-2000,A2.9-8545,790,NEP,Girija Prasad Koirala,22/03/2000,26/07/2001,1925,-777,3/22/00,7/26/01,0,1,0,2,0,M,NA,1925,NA,-7772850,NEP-2001,A2.9-8548,790,NEP,Sher Bahdur Deuba,26/07/2001,4/10/02,1946,-777,7/26/01,10/4/02,0,1,0,1,0,M,NA,1946,NA,-7772851,NEP-2002,A2.9-8551,790,NEP,Lokendra Bahadur Chand,11/10/02,5/6/03,1940,-777,10/11/02,6/5/03,0,1,0,1,0,M,NA,1940,NA,-7772852,NEP-2003,A2.9-8554,790,NEP,Surya Bahadur Thapa,5/6/03,3/6/04,1928,-777,6/5/03,6/3/04,0,1,0,1,0,M,NA,1928,NA,-7772853,NEP-2004,A2.9-8557,790,NEP,Sher Bahdur Deuba,3/6/04,31/12/2004,13/06/1946,-777,6/3/04,12/31/04,0,-888,0,2,-888,M,6/13/46,1946,NA,-7772854,THI-1868,A2.9-8560,800,THI,Rama V,01/10/1868,23/10/1910,22/9/1853,23/10/1910,1868-10-01,10/23/10,0,2,0,0,-777,M,1853-09-22,1853,10/23/10,19102855,THI-1910,A2.9-8563,800,THI,Rama VI,23/10/1910,26/11/1925,1/1/1881,26/11/1925,10/23/10,11/26/25,0,2,0,0,-777,M,1881-01-01,1881,11/26/25,19252856,THI-1925,A2.9-8566,800,THI,Rama VII,26/11/1925,10/12/32,8/11/1893,30/05/1941,11/26/25,12/10/32,0,3,6,0,0,M,1893-11-08,1893,5/30/41,19412857,THI-1932,A2.9-8569,800,THI,Phraya Mano,10/12/32,20/06/1933,1884,1948,12/10/32,6/20/33,1,3,6,0,1,M,NA,1884,NA,19482858,THI-1933,A2.9-8572,800,THI,Phahon,20/06/1933,21/12/1938,1889,1958,6/20/33,12/21/38,1,1,0,0,-666,M,NA,1889,NA,19582859,THI-1938,A2.9-8575,800,THI,Plaek Pibulsongkram,26/12/1938,2/8/44,14/7/1897,11/6/64,12/26/38,8/2/44,0,1,0,0,0,M,1897-07-14,1897,6/11/64,19642860,THI-1944,A2.9-8578,800,THI,Pridi Banomyong,2/8/44,21/08/1946,11/5/00,1983,8/2/44,8/21/46,0,1,0,0,1,M,5/11/00,1900,NA,19832861,THI-1946,A2.9-8581,800,THI,Plaek Pibulsongkram,21/08/1946,16/09/1957,14/7/1897,11/6/64,8/21/46,9/16/57,0,3,6,1,1,M,1897-07-14,1897,6/11/64,19642862,THI-1957-1,A2.9-8584,800,THI,Pote Sarasin,21/09/1957,27/12/1957,26/03/1906,28/09/2000,9/21/57,12/27/57,1,1,0,0,1,M,3/26/06,1906,9/28/00,20002863,THI-1957-2,A2.9-8587,800,THI,Thanon Kittakachorn,27/12/1957,20/10/1958,11/8/11,2004,12/27/57,10/20/58,0,1,0,0,0,M,8/11/11,1911,NA,20042864,THI-1958,A2.9-8590,800,THI,Sarit,20/10/1958,8/12/63,16/6/1908,1963,10/20/58,12/8/63,1,2,0,0,-777,M,6/16/08,1908,NA,19632865,THI-1963,A2.9-8593,800,THI,Thanon Kittakachorn,8/12/63,13/10/1973,11/8/11,2004,12/8/63,10/13/73,0,3,2,0,1,M,8/11/11,1911,NA,20042866,THI-1973,A2.9-8596,800,THI,Sanya,14/10/1973,21/02/1975,5/4/07,2002,10/14/73,2/21/75,1,1,0,0,0,M,4/5/07,1907,NA,20022867,THI-1975-1,A2.9-8599,800,THI,Seni Pramoj,21/02/1975,6/3/75,26/5/1905,28/07/1997,2/21/75,3/6/75,0,1,0,0,0,M,5/26/05,1905,7/28/97,19972868,THI-1975-2,A2.9-8602,800,THI,Kukrot Pramoj,17/03/1975,16/04/1976,20/4/1911,9/10/95,3/17/75,4/16/76,0,1,0,0,0,M,4/20/11,1911,10/9/95,19952869,THI-1976-1,A2.9-8605,800,THI,Seni Pramoj,20/04/1976,6/10/76,26/5/1905,28/07/1997,4/20/76,10/6/76,0,3,6,1,0,M,5/26/05,1905,7/28/97,19972870,THI-1976-2,A2.9-8608,800,THI,Sangad,6/10/76,22/10/1976,3/3/15,1980,10/6/76,10/22/76,1,1,0,0,0,M,3/3/15,1915,NA,19802871,THI-1976-3,A2.9-8611,800,THI,Thanin Kraivichien,22/10/1976,20/10/1977,1927,-777,10/22/76,10/20/77,1,3,6,0,0,M,NA,1927,NA,-7772872,THI-1977-1,A2.9-8614,800,THI,Sangad,20/10/1977,12/11/77,3/3/15,1980,10/20/77,11/12/77,1,1,0,0,0,M,3/3/15,1915,NA,19802873,THI-1977-2,A2.9-8617,800,THI,Kriangsak,12/11/77,29/02/1980,17/12/1917,23/12/2003,11/12/77,2/29/80,1,1,0,0,0,M,12/17/17,1917,12/23/03,20032874,THI-1980,A2.9-8620,800,THI,Prem,3/3/80,4/8/88,26/8/1920,-777,3/3/80,8/4/88,0,1,0,0,0,M,8/26/20,1920,NA,-7772875,THI-1988,A2.9-8623,800,THI,Choonhavan,4/8/88,23/02/1991,25/4/1922,6/5/98,8/4/88,2/23/91,0,3,6,0,1,M,4/25/22,1922,5/6/98,19982876,THI-1991,A2.9-8626,800,THI,Panyarachun,7/3/91,4/4/92,9/8/32,-777,3/7/91,4/4/92,0,1,0,0,0,M,8/9/32,1932,NA,-7772877,THI-1992-1,A2.9-8629,800,THI,Kraprayoon,5/4/92,24/05/1992,1932,-777,4/5/92,5/24/92,0,1,0,0,0,M,NA,1932,NA,-7772878,THI-1992-2,A2.9-8632,800,THI,Panyarachun,10/6/92,23/09/1992,9/8/32,-777,6/10/92,9/23/92,0,1,0,1,0,M,8/9/32,1932,NA,-7772879,THI-1992-3,A2.9-8635,800,THI,Leekpai,23/09/1992,13/07/1995,1938,-777,9/23/92,7/13/95,0,1,0,0,0,M,NA,1938,NA,-7772880,THI-1995,A2.9-8638,800,THI,Silpa-Archa,13/07/1995,1/12/96,1932,-777,7/13/95,12/1/96,0,1,0,0,0,M,NA,1932,NA,-7772881,THI-1996,A2.9-8641,800,THI,Chavalit Yongchaiyudh,1/12/96,9/11/97,15/5/1932,-777,12/1/96,11/9/97,0,1,0,0,0,M,5/15/32,1932,NA,-7772882,THI-1997,A2.9-8644,800,THI,Leekpai,9/11/97,9/2/01,1938,-777,11/9/97,2/9/01,0,1,0,1,0,M,NA,1938,NA,-7772883,THI-2001,A2.9-8647,800,THI,Thaksin Shinawatra,10/2/01,31/12/2004,1949,-777,2/10/01,12/31/04,0,-888,0,0,-888,M,NA,1949,NA,-7772884,CAM-1953,A2.9-8650,811,CAM,Sihanouk,9/11/53,18/03/1970,31/10/1922,-777,11/9/53,3/18/70,0,3,6,0,1,M,10/31/22,1922,NA,-7772885,CAM-1970,A2.9-8653,811,CAM,Lon Nol,18/03/1970,10/4/75,13/11/1913,17/11/1985,3/18/70,4/10/75,1,3,4,0,1,M,11/13/13,1913,11/17/85,19852886,CAM-1975,A2.9-8656,811,CAM,Pol Pot,11/4/75,7/1/79,19/5/1925,15/04/1998,4/11/75,1/7/79,1,4,9,0,0,M,5/19/25,1925,4/15/98,19982887,CAM-1979,A2.9-8659,811,CAM,Heng Samrin,7/1/79,14/01/1985,25/05/1934,-777,1/7/79,1/14/85,0,1,0,0,0,M,5/25/34,1934,NA,-7772888,CAM-1985,A2.9-8662,811,CAM,Hun Sen,14/01/1985,21/09/1993,5/8/52,-777,1/14/85,9/21/93,0,1,0,0,0,M,8/5/52,1952,NA,-7772889,CAM-1993,A2.9-8665,811,CAM,Ranariddh,21/09/1993,6/7/97,1944,-777,9/21/93,7/6/97,0,3,8,1,1,M,NA,1944,NA,-7772890,CAM-1997,A2.9-8668,811,CAM,Hun Sen,6/7/97,31/12/2004,5/8/52,-777,7/6/97,12/31/04,1,-888,0,2,-888,M,8/5/52,1952,NA,-7772891,LAO-1951,A2.9-8671,812,LAO,Souvanna Phouma,21/11/1951,25/11/1954,7/10/01,1984,11/21/51,11/25/54,0,1,0,0,0,M,10/7/01,1901,NA,19842892,LAO-1954,A2.9-8674,812,LAO,Katay Don Sasorith,25/11/1954,21/03/1956,1904,1959,11/25/54,3/21/56,0,1,0,0,0,M,NA,1904,NA,19592893,LAO-1956,A2.9-8677,812,LAO,Souvanna Phouma,21/03/1956,22/07/1958,7/10/01,1984,3/21/56,7/22/58,0,1,0,1,0,M,10/7/01,1901,NA,19842894,LAO-1958,A2.9-8680,812,LAO,Sananikone,15/08/1958,31/12/1959,6/9/03,1983,8/15/58,12/31/59,0,3,6,0,0,M,9/6/03,1903,NA,19832895,LAO-1959,A2.9-8683,812,LAO,Nosavan,31/12/1959,7/1/60,7/1/20,-999,12/31/59,1/7/60,1,1,0,0,0,M,1/7/20,1920,NA,NA2896,LAO-1960-1,A2.9-8686,812,LAO,Kou Abhay Og Long,7/1/60,31/05/1960,1892,1964,1/7/60,5/31/60,1,1,0,0,-666,M,NA,1892,NA,19642897,LAO-1960-2,A2.9-8689,812,LAO,Somsanith,31/05/1960,9/8/60,1913,1975,5/31/60,8/9/60,1,3,6,0,0,M,NA,1913,NA,19752898,LAO-1960-3,A2.9-8692,812,LAO,Kong Le,9/8/60,15/08/1960,1934,-999,8/9/60,8/15/60,1,1,0,0,1,M,NA,1934,NA,NA2899,LAO-1960-4,A2.9-8695,812,LAO,Souvanna Phouma,15/08/1960,10/12/60,7/10/01,1984,8/15/60,12/10/60,1,3,6,2,1,M,10/7/01,1901,NA,19842900,LAO-1960-5,A2.9-8698,812,LAO,Boun Oum,13/12/1960,22/06/1962,12/12/12,17/03/1980,12/13/60,6/22/62,1,1,0,0,0,M,12/12/12,1912,3/17/80,19802901,LAO-1962,A2.9-8701,812,LAO,Souvanna Phouma,24/06/1962,19/04/1964,7/10/01,1984,6/24/62,4/19/64,0,3,6,3,2,M,10/7/01,1901,NA,19842902,LAO-1964-1,A2.9-8704,812,LAO,Kouprasith,19/04/1964,20/04/1964,1926,-999,4/19/64,4/20/64,1,1,0,0,0,M,NA,1926,NA,NA2903,LAO-1964-2,A2.9-8707,812,LAO,Souvanna Phouma,20/04/1964,2/12/75,7/10/01,1984,4/20/64,12/2/75,0,3,3,4,0,M,10/7/01,1901,NA,19842904,LAO-1975,A2.9-8710,812,LAO,Phomivan,2/12/75,25/11/1992,13/12/1920,25/11/1992,12/2/75,11/25/92,1,2,0,0,-777,M,12/13/20,1920,11/25/92,19922905,LAO-1992,A2.9-8713,812,LAO,Phounsavanh,25/11/1992,24/02/1998,1914,-777,11/25/92,2/24/98,0,1,0,0,0,M,NA,1914,NA,-7772906,LAO-1998,A2.9-8716,812,LAO,Siphandon,24/02/1998,31/12/2004,1924,-777,2/24/98,12/31/04,0,-888,0,0,-888,M,NA,1924,NA,-7772907,VNM-1847,A2.9-8719,815,VNM,Tu Duc,10/11/1847,17/07/1883,1829,17/07/1883,1847-11-10,1883-07-17,1,2,0,0,-777,M,NA,1829,1883-07-17,18832908,VNM-1883-1,A2.9-8722,815,VNM,Duc Duc,20/07/1883,23/07/1883,1852,23/07/1883,1883-07-20,1883-07-23,0,3,-999,0,3,M,NA,1852,1883-07-23,18832909,VNM-1883-2,A2.9-8725,815,VNM,Hiep Hoa,30/07/1883,29/11/1883,1847,29/11/1883,1883-07-30,1883-11-29,1,3,-999,0,3,M,NA,1847,1883-11-29,18832910,VIE-1883,A2.9-8728,815,VIE,Regency,02/12/1883,14/10/1885,-999,-999,1883-12-02,1885-10-14,1,4,-999,0,1,M,NA,NA,NA,NA2911,VNM-1885,A2.9-8731,815,VNM,Dong Khanh,14/10/1885,28/01/1889,1864,1889,1885-10-14,1889-01-28,2,2,0,0,-777,M,NA,1864,NA,18892912,VNM-1889,A2.9-8734,815,VNM,Thanh Thai,01/02/1889,3/9/07,1878,1954,1889-02-01,9/3/07,0,4,-999,0,1,M,NA,1878,NA,19542913,DRV-1945,A2.9-8737,816,DRV,Ho Chi Minh,2/9/45,3/9/69,19/5/1890,2/9/69,9/2/45,9/3/69,1,2,0,0,-777,M,1890-05-19,1890,9/2/69,19692914,DRV-1969,A2.9-8740,816,DRV,Le Duan,3/9/69,10/7/86,7/4/08,10/7/86,9/3/69,7/10/86,0,2,0,0,-777,M,4/7/08,1908,7/10/86,19862915,DRV-1986-1,A2.9-8743,816,DRV,Truong Chinh,10/7/86,18/12/1986,1907,1988,7/10/86,12/18/86,0,1,0,0,0,M,NA,1907,NA,19882916,DRV-1986-2,A2.9-8746,816,DRV,Nguyen Van Linh,18/12/1986,27/06/1991,1/7/15,27/04/1998,12/18/86,6/27/91,0,1,0,0,0,M,7/1/15,1915,4/27/98,19982917,DRV-1991,A2.9-8749,816,DRV,Do Muoi,27/06/1991,29/12/1997,2/2/17,-777,6/27/91,12/29/97,0,1,0,0,0,M,2/2/17,1917,NA,-7772918,DRV-1997,A2.9-8752,816,DRV,Phieu,29/12/1997,22/04/2001,27/12/1931,-777,12/29/97,4/22/01,0,1,0,0,0,M,12/27/31,1931,NA,-7772919,DRV-2001,A2.9-8755,816,DRV,Nong Duc Manh,23/04/2001,31/12/2004,11/9/40,-777,4/23/01,12/31/04,0,-888,0,0,-888,M,9/11/40,1940,NA,-7772920,RVN-1954-1,A2.9-8758,817,RVN,Pham Buu Loc,12/1/54,16/06/1954,1915,1990,1/12/54,6/16/54,0,1,0,0,-666,M,NA,1915,NA,19902921,RVN-1954-2,A2.9-8761,817,RVN,Quat,16/06/1954,26/06/1954,1909,1979,6/16/54,6/26/54,0,1,0,0,0,M,NA,1909,NA,19792922,RVN-1954-3,A2.9-8764,817,RVN,Ngo Dinh Diem,26/06/1954,1/11/63,3/1/01,1/11/63,6/26/54,11/1/63,1,3,6,0,3,M,1/3/01,1901,11/1/63,19632923,RVN-1963,A2.9-8767,817,RVN,Minh,1/11/63,30/01/1964,19/2/1916,6/8/01,11/1/63,1/30/64,1,3,6,0,1,M,2/19/16,1916,8/6/01,20012924,RVN-1964-1,A2.9-8770,817,RVN,Khanh,30/01/1964,4/11/64,8/11/27,-777,1/30/64,11/4/64,1,3,2,0,1,M,11/8/27,1927,NA,-7772925,RVN-1964-2,A2.9-8773,817,RVN,Van Huong,4/11/64,26/01/1965,1/12/03,1982,11/4/64,1/26/65,1,3,6,0,0,M,12/1/03,1903,NA,19822926,RVN-1965-1,A2.9-8776,817,RVN,Khahn,26/01/1965,20/02/1965,8/11/27,-777,1/26/65,2/20/65,1,3,16,1,1,M,11/8/27,1927,NA,-7772927,RVN-1965-2,A2.9-8779,817,RVN,Quat,20/02/1965,12/6/65,1909,1979,2/20/65,6/12/65,1,3,6,1,0,M,NA,1909,NA,19792928,RVN-1965-3,A2.9-8782,817,RVN,Van Thieu,14/06/1965,21/04/1975,5/5/23,29/09/2001,6/14/65,4/21/75,1,4,9,0,1,M,5/5/23,1923,9/29/01,20012929,RVN-1975,A2.9-8785,817,RVN,Minh,28/04/1975,30/04/1975,19/2/1916,6/8/01,4/28/75,4/30/75,0,4,9,1,2,M,2/19/16,1916,8/6/01,20012930,MAL-1957,A2.9-8788,820,MAL,Rahman,31/08/1957,15/04/1959,24/8/1895,6/12/90,8/31/57,4/15/59,0,1,0,0,0,M,1895-08-24,1895,12/6/90,19902931,MAL-1959-1,A2.9-8791,820,MAL,Razak,15/04/1959,21/08/1959,11/3/22,14/01/1976,4/15/59,8/21/59,0,1,0,0,0,M,3/11/22,1922,1/14/76,19762932,MAL-1959-2,A2.9-8794,820,MAL,Rahman,21/08/1959,22/09/1970,24/8/1895,6/12/90,8/21/59,9/22/70,0,1,0,1,0,M,1895-08-24,1895,12/6/90,19902933,MAL-1970,A2.9-8797,820,MAL,Razak,22/09/1970,14/01/1976,11/3/22,14/01/1976,9/22/70,1/14/76,0,2,0,1,-777,M,3/11/22,1922,1/14/76,19762934,MAL-1976,A2.9-8800,820,MAL,Hussein Bin Onn,14/01/1976,16/07/1981,22/2/1922,28/05/1990,1/14/76,7/16/81,0,2.1,0,0,0,M,2/22/22,1922,5/28/90,19902935,MAL-1981,A2.9-8803,820,MAL,Mahatir Bin Mohammad,16/07/1981,31/10/2003,20/12/1925,-777,7/16/81,10/31/03,0,1,0,0,0,M,12/20/25,1925,NA,-7772936,MAL-2003,A2.9-8806,820,MAL,Ahmad Badawi,31/10/2003,31/12/2004,26/11/1939,-777,10/31/03,12/31/04,0,-888,0,0,-888,M,11/26/39,1939,NA,-7772937,SIN-1959,A2.9-8809,830,SIN,Lee Kuan Yew,5/6/59,28/11/1990,16/9/1923,-777,6/5/59,11/28/90,0,1,0,0,0,M,9/16/23,1923,NA,-7772938,SIN-1990,A2.9-8812,830,SIN,Goh Chok Tong,28/11/1990,12/8/04,20/5/1941,-777,11/28/90,8/12/04,0,1,0,0,-999,M,5/20/41,1941,NA,-7772939,SIN-2004,A2.9-8815,830,SIN,Lee Hsien Loong,12/8/04,31/12/2004,1939,-777,8/12/04,12/31/04,0,-888,0,0,-888,M,NA,1939,NA,-7772940,BRU-1967,A2.9-8818,835,BRU,Hassanal Bolkiah,4/10/67,31/12/2004,15/7/1946,-777,10/4/67,12/31/04,0,-888,0,0,-888,M,7/15/46,1946,NA,-7772941,PHI-1946,A2.9-8821,840,PHI,Roxas,4/7/46,16/04/1948,1/1/1892,15/04/1948,7/4/46,4/16/48,0,2,0,0,-777,M,1892-01-01,1892,4/15/48,19482942,PHI-1948,A2.9-8824,840,PHI,Quirrino,16/04/1948,30/12/1953,16/11/1890,28/02/1956,4/16/48,12/30/53,0,1,0,0,0,M,1890-11-16,1890,2/28/56,19562943,PHI-1953,A2.9-8827,840,PHI,Magsaysay,30/12/1953,17/03/1957,31/8/1907,17/03/1957,12/30/53,3/17/57,0,2,0,0,-777,M,8/31/07,1907,3/17/57,19572944,PHI-1957,A2.9-8830,840,PHI,Garcia,17/03/1957,14/11/1961,4/11/1896,14/06/1971,3/17/57,11/14/61,0,1,0,0,0,M,1896-11-04,1896,6/14/71,19712945,PHI-1961,A2.9-8833,840,PHI,Macapagal,14/11/1961,30/12/1965,28/9/1910,21/04/1997,11/14/61,12/30/65,0,1,0,0,0,M,9/28/10,1910,4/21/97,19972946,PHI-1965,A2.9-8836,840,PHI,Marcos,30/12/1965,25/02/1986,11/9/17,28/09/1989,12/30/65,2/25/86,0,3,2,0,1,M,9/11/17,1917,9/28/89,19892947,PHI-1986,A2.9-8839,840,PHI,Aquino,25/02/1986,30/06/1992,25/1/1933,-777,2/25/86,6/30/92,1,1,0,0,0,F,1/25/33,1933,NA,-7772948,PHI-1992,A2.9-8842,840,PHI,Ramos,30/06/1992,30/06/1998,18/3/1928,-777,6/30/92,6/30/98,0,1,0,0,0,M,3/18/28,1928,NA,-7772949,PHI-1998,A2.9-8845,840,PHI,Estrada,30/06/1998,20/01/2001,19/04/1937,-777,6/30/98,1/20/01,0,1,0,0,2,M,4/19/37,1937,NA,-7772950,PHI-2001,A2.9-8848,840,PHI,Gloria Macapagal-Arroyo,21/01/2001,31/12/2004,5/4/47,-777,1/21/01,12/31/04,0,-888,0,0,-888,F,4/5/47,1947,NA,-7772951,INS-1945,A2.9-8851,850,INS,Sukarno,17/08/1945,18/12/1948,6/6/01,1970,8/17/45,12/18/48,0,4,9,0,2,M,6/6/01,1901,NA,19702952,INS-1948,A2.9-8854,850,INS,Louis Beel,18/12/1948,19/05/1949,12/4/02,1977,12/18/48,5/19/49,2,4,111,0,1,M,4/12/02,1902,NA,19772953,INS-1949-1,A2.9-8857,850,INS,A. H. J. Lovink,19/05/1949,27/12/1949,12/7/02,1995,5/19/49,12/27/49,2,1,0,0,1,M,7/12/02,1902,NA,19952954,INS-1949-2,A2.9-8860,850,INS,Sukarno,27/12/1949,12/3/66,6/6/01,1970,12/27/49,3/12/66,0,3,6,1,2,M,6/6/01,1901,NA,19702955,INS-1966,A2.9-8863,850,INS,Suharto,12/3/66,21/05/1998,20/2/1921,-777,3/12/66,5/21/98,1,1,0,0,2,M,2/20/21,1921,NA,-7772956,INS-1998,A2.9-8866,850,INS,Habibie,21/05/1998,20/10/1999,25/6/1936,-777,5/21/98,10/20/99,0,1,0,0,0,M,6/25/36,1936,NA,-7772957,INS-1999,A2.9-8869,850,INS,Wahid,20/10/1999,23/07/2001,1940,-777,10/20/99,7/23/01,0,1,0,0,0,M,NA,1940,NA,-7772958,INS-2001,A2.9-8872,850,INS,Megawati Sukarnoputri,24/07/2001,20/10/2004,1947,-777,7/24/01,10/20/04,0,1,0,0,-999,F,NA,1947,NA,-7772959,INS-2004,A2.9-8875,850,INS,Bambang Yudhoyono,20/10/2004,31/12/2004,1949,-777,10/20/04,12/31/04,0,-888,0,0,-888,M,NA,1949,NA,-7772960,ETM-2002,A2.9-8878,860,ETM,Gusmao,20/05/2002,31/12/2004,20/6/1946,-777,5/20/02,12/31/04,0,-888,0,0,-888,M,6/20/46,1946,NA,-7772961,AUL-1901,A2.9-8881,900,AUL,Edmund Barton,1/1/01,24/09/1903,18/1/1849,7/1/20,1/1/01,9/24/03,0,1,0,0,0,M,1849-01-18,1849,1/7/20,19202962,AUL-1903,A2.9-8884,900,AUL,Alfred Deakin,24/09/1903,26/04/1904,3/8/1856,7/10/19,9/24/03,4/26/04,0,1,0,0,0,M,1856-08-03,1856,10/7/19,19192963,AUL-1904-1,A2.9-8887,900,AUL,John Christian Watson,26/04/1904,18/08/1904,9/4/1867,1941,4/26/04,8/18/04,0,1,0,0,0,M,1867-04-09,1867,NA,19412964,AUL-1904-2,A2.9-8890,900,AUL,George Reid,18/08/1904,5/7/05,22/2/1848,12/9/18,8/18/04,7/5/05,0,1,0,0,0,M,1848-02-22,1848,9/12/18,19182965,AUL-1905,A2.9-8893,900,AUL,Alfred Deakin,5/7/05,13/11/1908,3/8/1856,7/10/19,7/5/05,11/13/08,0,1,0,1,0,M,1856-08-03,1856,10/7/19,19192966,AUL-1908,A2.9-8896,900,AUL,Andrew Fisher,13/11/1908,2/6/09,29/8/1862,22/10/1928,11/13/08,6/2/09,0,1,0,0,0,M,1862-08-29,1862,10/22/28,19282967,AUL-1909,A2.9-8899,900,AUL,Alfred Deakin,2/6/09,29/04/1910,3/8/1856,7/10/19,6/2/09,4/29/10,0,1,0,2,0,M,1856-08-03,1856,10/7/19,19192968,AUL-1910,A2.9-8902,900,AUL,Andrew Fisher,29/04/1910,24/04/1913,29/8/1862,22/10/1928,4/29/10,4/24/13,0,1,0,1,0,M,1862-08-29,1862,10/22/28,19282969,AUL-1913,A2.9-8905,900,AUL,Joseph Cook,24/04/1913,17/09/1914,7/12/1860,30/07/1947,4/24/13,9/17/14,0,1,0,0,0,M,1860-12-07,1860,7/30/47,19472970,AUL-1914,A2.9-8908,900,AUL,Andrew Fisher,17/09/1914,27/10/1915,29/8/1862,22/10/1928,9/17/14,10/27/15,0,1,0,2,0,M,1862-08-29,1862,10/22/28,19282971,AUL-1915,A2.9-8911,900,AUL,Hughes,27/10/1915,3/2/23,25/9/1864,28/10/1952,10/27/15,2/3/23,0,1,0,0,0,M,1864-09-25,1864,10/28/52,19522972,AUL-1923,A2.9-8914,900,AUL,Bruce,3/2/23,22/10/1929,15/4/1883,25/08/1967,2/3/23,10/22/29,0,1,0,0,0,M,1883-04-15,1883,8/25/67,19672973,AUL-1929,A2.9-8917,900,AUL,Scullin,22/10/1929,6/1/32,18/9/1876,1953,10/22/29,1/6/32,0,1,0,0,0,M,1876-09-18,1876,NA,19532974,AUL-1932,A2.9-8920,900,AUL,Lyons,6/1/32,7/4/39,15/9/1879,7/4/39,1/6/32,4/7/39,0,2,0,0,-777,M,1879-09-15,1879,4/7/39,19392975,AUL-1939-1,A2.9-8923,900,AUL,Page,7/4/39,26/04/1939,8/8/1888,20/12/1961,4/7/39,4/26/39,0,1,0,0,0,M,1888-08-08,1888,12/20/61,19612976,AUL-1939-2,A2.9-8926,900,AUL,Menzies,26/04/1939,29/08/1941,20/12/1894,16/05/1978,4/26/39,8/29/41,0,1,0,0,0,M,1894-12-20,1894,5/16/78,19782977,AUL-1941-1,A2.9-8929,900,AUL,Fadden,29/08/1941,7/10/41,13/04/1895,21/04/1973,8/29/41,10/7/41,0,1,0,0,0,M,1895-04-13,1895,4/21/73,19732978,AUL-1941-2,A2.9-8932,900,AUL,Curtin,7/10/41,30/04/1945,8/1/1885,5/7/45,10/7/41,4/30/45,0,2.1,0,0,-777,M,1885-01-08,1885,7/5/45,19452979,AUL-1945-1,A2.9-8935,900,AUL,Forde,30/04/1945,13/07/1945,18/7/1890,28/01/1983,4/30/45,7/13/45,0,1,0,0,0,M,1890-07-18,1890,1/28/83,19832980,AUL-1945-2,A2.9-8938,900,AUL,Chifley,13/07/1945,19/12/1949,22/9/1885,13/06/1951,7/13/45,12/19/49,0,1,0,0,0,M,1885-09-22,1885,6/13/51,19512981,AUL-1949,A2.9-8941,900,AUL,Menzies,19/12/1949,26/01/1966,20/12/1894,16/05/1978,12/19/49,1/26/66,0,1,0,1,0,M,1894-12-20,1894,5/16/78,19782982,AUL-1966,A2.9-8944,900,AUL,Holt,27/01/1966,19/12/1967,5/8/08,19/12/1967,1/27/66,12/19/67,0,2,0,0,-777,M,8/5/08,1908,12/19/67,19672983,AUL-1967,A2.9-8947,900,AUL,McEwen,19/12/1967,10/1/68,29/3/1900,21/11/1980,12/19/67,1/10/68,0,1,0,0,0,M,3/29/00,1900,11/21/80,19802984,AUL-1968,A2.9-8950,900,AUL,Gorton,10/1/68,10/3/71,9/9/11,19/05/2002,1/10/68,3/10/71,0,1,0,0,0,M,9/9/11,1911,5/19/02,20022985,AUL-1971,A2.9-8953,900,AUL,McMahon,10/3/71,5/12/72,23/2/1908,31/03/1988,3/10/71,12/5/72,0,1,0,0,0,M,2/23/08,1908,3/31/88,19882986,AUL-1972,A2.9-8956,900,AUL,Whitlam,5/12/72,11/11/75,11/7/16,-777,12/5/72,11/11/75,0,1,0,0,0,M,7/11/16,1916,NA,-7772987,AUL-1975,A2.9-8959,900,AUL,Fraser,11/11/75,11/3/83,21/5/1930,-777,11/11/75,3/11/83,0,1,0,0,0,M,5/21/30,1930,NA,-7772988,AUL-1983,A2.9-8962,900,AUL,Hawke,11/3/83,19/12/1991,9/12/29,-777,3/11/83,12/19/91,0,1,0,0,0,M,12/9/29,1929,NA,-7772989,AUL-1991,A2.9-8965,900,AUL,Keating,19/12/1991,11/3/96,18/1/1945,-777,12/19/91,3/11/96,0,1,0,0,0,M,1/18/45,1945,NA,-7772990,AUL-1996,A2.9-8968,900,AUL,Howard,11/3/96,31/12/2004,26/7/1939,-777,3/11/96,12/31/04,0,-888,0,0,-888,M,7/26/39,1939,NA,-7772991,PNG-1975,A2.9-8971,910,PNG,Somare,16/09/1975,11/3/80,9/4/36,-777,9/16/75,3/11/80,0,1,0,0,0,M,4/9/36,1936,NA,-7772992,PNG-1980,A2.9-8974,910,PNG,Chan,11/3/80,2/8/82,29/8/1939,-777,3/11/80,8/2/82,0,1,0,0,0,M,8/29/39,1939,NA,-7772993,PNG-1982,A2.9-8977,910,PNG,Somare,2/8/82,21/11/1985,9/4/36,-777,8/2/82,11/21/85,0,1,0,1,0,M,4/9/36,1936,NA,-7772994,PNG-1985,A2.9-8980,910,PNG,Wingti,21/11/1985,4/7/88,1951,-777,11/21/85,7/4/88,0,1,0,0,0,M,NA,1951,NA,-7772995,PNG-1988,A2.9-8983,910,PNG,Namaliu,4/7/88,17/07/1992,3/4/47,-777,7/4/88,7/17/92,0,1,0,0,0,M,4/3/47,1947,NA,-7772996,PNG-1992,A2.9-8986,910,PNG,Wingti,17/07/1992,30/08/1994,1951,-777,7/17/92,8/30/94,0,1,0,1,0,M,NA,1951,NA,-7772997,PNG-1994,A2.9-8989,910,PNG,Chan,30/08/1994,22/07/1997,29/8/1939,-777,8/30/94,7/22/97,0,1,0,1,0,M,8/29/39,1939,NA,-7772998,PNG-1997,A2.9-8992,910,PNG,Skate,22/07/1997,14/07/1999,1953,-777,7/22/97,7/14/99,0,1,0,0,0,M,NA,1953,NA,-7772999,PNG-1999,A2.9-8995,910,PNG,Morauta,14/07/1999,5/8/02,1946,-777,7/14/99,8/5/02,0,1,0,0,0,M,NA,1946,NA,-7773000,PNG-2002,A2.9-8998,910,PNG,Somare,6/8/02,31/12/2004,9/4/36,-777,8/6/02,12/31/04,0,-888,0,2,-888,M,4/9/36,1936,NA,-7773001,NEW-1906,A2.9-9001,920,NEW,Ward,6/8/06,28/03/1912,1856,1930,8/6/06,3/28/12,0,1,0,0,0,M,NA,1856,NA,19303002,NEW-1912-1,A2.9-9004,920,NEW,Thomas Mackenzie,28/03/1912,10/7/12,1854,1930,3/28/12,7/10/12,0,1,0,0,0,M,NA,1854,NA,19303003,NEW-1912-2,A2.9-9007,920,NEW,Massey,10/7/12,10/5/25,26/3/1856,1925,7/10/12,5/10/25,0,2,0,0,-777,M,1856-03-26,1856,NA,19253004,NEW-1925-1,A2.9-9010,920,NEW,Bell,14/05/1925,30/05/1925,31/03/1851,1936,5/14/25,5/30/25,0,1,0,0,0,M,1851-03-31,1851,NA,19363005,NEW-1925-2,A2.9-9013,920,NEW,Coates,30/05/1925,7/12/28,3/2/1878,1943,5/30/25,12/7/28,0,1,0,0,0,M,1878-02-03,1878,NA,19433006,NEW-1928,A2.9-9016,920,NEW,Ward,10/12/28,15/05/1930,1856,1930,12/10/28,5/15/30,0,2.1,0,1,-777,M,NA,1856,NA,19303007,NEW-1930,A2.9-9019,920,NEW,Forbes,28/05/1930,27/11/1935,12/3/1869,17/05/1947,5/28/30,11/27/35,0,1,0,0,0,M,1869-03-12,1869,5/17/47,19473008,NEW-1935,A2.9-9022,920,NEW,Savage,27/11/1935,26/03/1940,7/3/1872,1940,11/27/35,3/26/40,0,2,0,0,-777,M,1872-03-07,1872,NA,19403009,NEW-1940,A2.9-9025,920,NEW,Fraser,1/4/40,12/12/49,28/8/1884,12/12/50,4/1/40,12/12/49,0,1,0,0,0,M,1884-08-28,1884,12/12/50,19503010,NEW-1949,A2.9-9028,920,NEW,Holland,13/12/1949,20/09/1957,18/10/1893,5/8/61,12/13/49,9/20/57,0,2.1,0,0,0,M,1893-10-18,1893,8/5/61,19613011,NEW-1957-1,A2.9-9031,920,NEW,Holyoake,20/09/1957,12/12/57,11/2/04,8/12/83,9/20/57,12/12/57,0,1,0,0,0,M,2/11/04,1904,12/8/83,19833012,NEW-1957-2,A2.9-9034,920,NEW,Nash,12/12/57,12/12/60,12/2/1882,4/6/68,12/12/57,12/12/60,0,1,0,0,0,M,1882-02-12,1882,6/4/68,19683013,NEW-1960,A2.9-9037,920,NEW,Holyoake,12/12/60,7/2/72,11/2/04,8/12/83,12/12/60,2/7/72,0,1,0,1,0,M,2/11/04,1904,12/8/83,19833014,NEW-1972-1,A2.9-9040,920,NEW,Marshall,7/2/72,8/12/72,5/3/12,30/08/1988,2/7/72,12/8/72,0,1,0,0,0,M,3/5/12,1912,8/30/88,19883015,NEW-1972-2,A2.9-9043,920,NEW,Kirk,8/12/72,31/08/1974,2/1/23,31/08/1974,12/8/72,8/31/74,0,2,0,0,-777,M,1/2/23,1923,8/31/74,19743016,NEW-1974,A2.9-9046,920,NEW,Rowling,6/9/74,12/12/75,15/11/1927,31/10/1995,9/6/74,12/12/75,0,1,0,0,0,M,11/15/27,1927,10/31/95,19953017,NEW-1975,A2.9-9049,920,NEW,Muldoon,12/12/75,26/07/1984,25/9/1921,5/8/92,12/12/75,7/26/84,0,1,0,0,0,M,9/25/21,1921,8/5/92,19923018,NEW-1984,A2.9-9052,920,NEW,Lange,26/07/1984,8/8/89,1942,13/08/2005,7/26/84,8/8/89,0,1,0,0,0,M,NA,1942,8/13/05,20053019,NEW-1989,A2.9-9055,920,NEW,Palmer,8/8/89,4/9/90,21/4/1942,-777,8/8/89,9/4/90,0,1,0,0,0,M,4/21/42,1942,NA,-7773020,NEW-1990-1,A2.9-9058,920,NEW,Moore,4/9/90,27/10/1990,1949,-777,9/4/90,10/27/90,0,1,0,0,0,M,NA,1949,NA,-7773021,NEW-1990-2,A2.9-9061,920,NEW,Bolger,27/10/1990,8/12/97,31/5/1935,-777,10/27/90,12/8/97,0,1,0,0,0,M,5/31/35,1935,NA,-7773022,NEW-1997,A2.9-9064,920,NEW,Shipley,8/12/97,10/12/99,1952,-777,12/8/97,12/10/99,0,1,0,0,0,F,NA,1952,NA,-7773023,NEW-1999,A2.9-9067,920,NEW,Clark,10/12/99,31/12/2004,26/2/1950,-777,12/10/99,12/31/04,0,-888,0,0,-888,F,2/26/50,1950,NA,-7773024,SOL-1978,A2.9-9070,940,SOL,Kenilorea,7/7/78,31/08/1981,23/5/1943,-777,7/7/78,8/31/81,0,1,0,0,0,M,5/23/43,1943,NA,-7773025,SOL-1981,A2.9-9073,940,SOL,Mamaloni,31/08/1981,19/11/1984,1943,2000,8/31/81,11/19/84,0,1,0,0,0,M,NA,1943,NA,20003026,SOL-1984,A2.9-9076,940,SOL,Kenilorea,19/11/1984,1/12/86,23/5/1943,-777,11/19/84,12/1/86,0,1,0,1,0,M,5/23/43,1943,NA,-7773027,SOL-1986,A2.9-9079,940,SOL,Alebua,1/12/86,28/03/1989,1947,-777,12/1/86,3/28/89,0,1,0,0,0,M,NA,1947,NA,-7773028,SOL-1989,A2.9-9082,940,SOL,Mamaloni,28/03/1989,18/06/1993,1943,2000,3/28/89,6/18/93,0,1,0,1,0,M,NA,1943,NA,20003029,SOL-1993,A2.9-9085,940,SOL,Hilly,18/06/1993,31/10/1994,1947,-777,6/18/93,10/31/94,0,3,8,0,0,M,NA,1947,NA,-7773030,SOL-1994,A2.9-9088,940,SOL,Mamaloni,31/10/1994,27/08/1997,1943,2000,10/31/94,8/27/97,1,1,0,2,0,M,NA,1943,NA,20003031,SOL-1997,A2.9-9091,940,SOL,Ulufa'alu,27/08/1997,5/6/00,1950,2007,8/27/97,6/5/00,0,3,4,0,2,M,NA,1950,NA,20073032,SOL-2000,A2.9-9094,940,SOL,Sogavare,30/06/2000,17/12/2001,1954,-777,6/30/00,12/17/01,0,1,0,0,0,M,NA,1954,NA,-7773033,SOL-2001,A2.9-9097,940,SOL,Kemakeza,17/12/2001,31/12/2004,1951,-777,12/17/01,12/31/04,0,-888,0,0,-888,M,NA,1951,NA,-7773034,FJI-1970,A2.9-9100,950,FJI,Mara,10/10/70,13/04/1987,13/5/1920,18/04/2004,10/10/70,4/13/87,0,1,0,0,0,M,5/13/20,1920,4/18/04,20043035,FJI-1987-1,A2.9-9103,950,FJI,Bavadra,13/04/1987,14/05/1987,1934,3/11/89,4/13/87,5/14/87,0,3,6,0,2,M,NA,1934,11/3/89,19893036,FJI-1987-2,A2.9-9106,950,FJI,Rabuka,14/05/1987,5/12/87,13/9/1948,-777,5/14/87,12/5/87,1,1,0,0,0,M,9/13/48,1948,NA,-7773037,FJI-1987-3,A2.9-9109,950,FJI,Mara,5/12/87,2/6/92,13/5/1920,18/04/2004,12/5/87,6/2/92,0,1,0,1,0,M,5/13/20,1920,4/18/04,20043038,FJI-1992,A2.9-9112,950,FJI,Rabuka,2/6/92,19/05/1999,13/9/1948,-777,6/2/92,5/19/99,0,1,0,1,0,M,9/13/48,1948,NA,-7773039,FJI-1999,A2.9-9115,950,FJI,Chaudhry,19/05/1999,19/05/2000,2/9/42,-777,5/19/99,5/19/00,0,3,4,0,2,M,9/2/42,1942,NA,-7773040,FJI-2000-1,A2.9-9118,950,FJI,Ratu Josefa Iloilo,27/05/2000,29/05/2000,1920,-777,5/27/00,5/29/00,1,1,0,0,0,M,NA,1920,NA,-7773041,FJI-2000-2,A2.9-9121,950,FJI,Bainimarama,29/05/2000,14/07/2000,27/04/1954,-777,5/29/00,7/14/00,1,3,8,0,0,M,4/27/54,1954,NA,-7773042,FJI-2000-3,A2.9-9124,950,FJI,Laisenia Qarase,14/07/2000,31/12/2004,1941,-777,7/14/00,12/31/04,0,-888,0,0,-888,M,NA,1941,NA,-777,,,,,,,,,,,,,,,,,,,,,